feed,title,long_url,short_url
Investing,Tariff Fears Grow as Trump Targets Medicines and Chips With Potential 250% Duties,https://www.investing.com/analysis/tariff-fears-grow-as-trump-targets-medicines-and-chips-with-potential-250-duties-200664881,
Investing,US Dollar Stabilizes as Markets Eye Trump’s Remarks and Fed Signals,https://www.investing.com/analysis/us-dollar-stabilizes-as-markets-,
Investing,Brazil's central bank signals more hawkish stance amid inflation concerns,https://www.investing.com/news/economy-news/brazils-central-bank-signals-more-hawkish-stance-amid-inflation-concerns-93CH-4172231,
Investing,Toronto home sales post biggest increase in nine months in July,https://www.investing.com/news/economy-news/toronto-home-sales-post-biggest-increase-in-nine-months-in-july-4172223,
Investing,Indonesian economic researchers question upside surprise in Q2 GDP growth,https://www.investing.com/news/economy-news/indonesian-economic-researchers-question-upside-surprise-in-q2-gdp-growth-4172209,
Investing,"UBS revised BoJ forecast, now expects 25 basis point rate hikes in December 2025 and June 2026",https://www.investing.com/news/economy-news/ubs-revised-boj-forecast-now-expects-25-basis-point-rate-hikes-in-december-2025-and-june-2026-93CH-4172206,
Investing,Euro zone retail sales grow quicker than thought after revisions,https://www.investing.com/news/economy-news/euro-zone-retail-sales-grow-quicker-than-thought-after-revisions-4172205,
