feed,title,long_url,short_url
Investing,S&P 500: Utilities and Industrials Carrying the Market?,https://www.investing.com/analysis/sp-500-utilities-and-industrials-carrying-the-market-200664889,
Investing,US Dollar Struggles on Stagflation Fears While Stocks Rebound,https://www.investing.com/analysis/us-dollar-struggles-on-stagflation-fears-while-stocks-rebound-200664890,
Investing,AI Euphoria Vs. Tariff Shock: Can Tech Optimism Keep Markets Rising in 2025?,https://www.investing.com/analysis/ai-euphoria-vs-tariff-shock-can-tech-optimism-keep-markets-rising-in-2025-200664884,
Investing,"Siemens Energy plans cost cuts, offshore ramp-up to break even wind unit",https://www.investing.com/news/stock-market-news/siemens-energy-plans-cost-cuts-offshore-rampup-to-break-even-wind-unit-4172326,
Investing,India braces for hit to $64 billion US exports amid rising tensions with Washington,https://www.investing.com/news/economic-indicators/india-braces-for-hit-to-64-billion-us-exports-amid-rising-tensions-with-washington-4172333,
