feed,title,long_url,short_url
Investing,U.K. stocks higher at close of trade; Investing.com United Kingdom 100 up 1.10%,https://www.investing.com/news/stock-market-news/uk-stocks-higher-at-close-of-trade-investingcom-united-kingdom-100-up-110-4701877,
Investing,Spain stocks higher at close of trade; IBEX 35 up 2.04%,https://www.investing.com/news/stock-market-news/spain-stocks-higher-at-close-of-trade-ibex-35-up-204-4701876,
Investing,Portugal stocks higher at close of trade; PSI up 0.96%,https://www.investing.com/news/stock-market-news/portugal-stocks-higher-at-close-of-trade-psi-up-096-4701875,
Investing,Netherlands stocks higher at close of trade; AEX up 1.46%,https://www.investing.com/news/stock-market-news/netherlands-stocks-higher-at-close-of-trade-aex-up-146-4701874,
Investing,Italy stocks higher at close of trade; Investing.com Italy 40 up 1.79%,https://www.investing.com/news/stock-market-news/italy-stocks-higher-at-close-of-trade-investingcom-italy-40-up-179-4701873,
Investing,Germany stocks higher at close of trade; DAX up 1.36%,https://www.investing.com/news/stock-market-news/germany-stocks-higher-at-close-of-trade-dax-up-136-4701872,
Investing,France stocks higher at close of trade; CAC 40 up 1.70%,https://www.investing.com/news/stock-market-news/france-stocks-higher-at-close-of-trade-cac-40-up-170-4701871,
Investing,Bernstein lifts price targets on LRCX and KLAX after lifting WFE forecasts,https://www.investing.com/news/stock-market-news/bernstein-lifts-price-targets-on-lrcx-and-klax-after-lifting-wfe-forecasts-4701870,
Investing,Belgium stocks higher at close of trade; BEL 20 up 1.37%,https://www.investing.com/news/stock-market-news/belgium-stocks-higher-at-close-of-trade-bel-20-up-137-4701869,
