feed,title,long_url,short_url
ETFTrends,This Active SMID-Cap ETF Doubled Its AUM in Just 6 Months,https://www.etftrends.com/active-etf-channel/active-mid-cap-etf-doubled-aum-6-months/,https://da.gd/XTb3r
ETFTrends,Prepare for Fed Rate Cuts With Active Bond ETFs,https://www.etftrends.com/prepare-fed-rate-cuts-active-bond-etfs/,https://da.gd/PnGp
ETFTrends,Treasury Yields: A Long-Term Perspective – July 2024,https://www.etftrends.com/fixed-income-channel/treasury-yields-long-term-perspective-july-2024/,https://da.gd/aal7
ETFTrends,This Could Be a Buying Opportunity for Active ETF ‘LSGR’,https://www.etftrends.com/portfolio-construction-channel/could-be-buying-opportunity-active-etf-lsgr/,https://da.gd/5MgL3d
ETFTrends,Expect a Soft Landing,https://www.etftrends.com/etf-strategist-channel/expect-soft-landing/,https://da.gd/3cHIU
ETFTrends,Enterprise Underscores Continued Growth in NGL Production in Permian,https://www.etftrends.com/energy-infrastructure-channel/enterprise-underscores-continued-growth-in-ngl-production-in-permian/,https://da.gd/65BJgv
ETFTrends,"Five Years in, What’s Setting Emerging Markets ETF KEMX Apart?",https://www.etftrends.com/china-insights-channel/five-years-whats-setting-emerging-markets-etf-kemx-apart/,https://da.gd/gYPMC
