feed,title,long_url,short_url
Yahoo,Nvidia Stock Rises Toward Fresh Record High,https://www.wsj.com/livecoverage/stock-market-today-dow-jones-01-08-2024/card/nvidia-stock-rises-toward-fresh-record-high-iF6bnYfdxi6YILOVKjY9?siteid=yhoof2&yptr=yahoo,https://da.gd/aNti9f
Yahoo,Apple’s Vision Pro to Become Available In U.S. Feb. 2,https://finance.yahoo.com/m/4b5f9a91-7f93-342f-a2ac-3186998b1450/apple%E2%80%99s-vision-pro-to-become.html?.tsrc=rss,https://da.gd/hUVGXM
Yahoo,"Zacks Industry Outlook Highlights CVS Health, Herbalife, Rite Aid and Amazon",https://finance.yahoo.com/news/zacks-industry-outlook-highlights-cvs-140300471.html?.tsrc=rss,https://da.gd/V6aX
Yahoo,Apple Inc. (AAPL) is Attracting Investor Attention: Here is What You Should Know,https://finance.yahoo.com/news/apple-inc-aapl-attracting-investor-140012082.html?.tsrc=rss,https://da.gd/GULNmP
Yahoo,Raise a Toast to These 5 Consumer Discretionary Stocks in 2024,https://finance.yahoo.com/news/raise-toast-5-consumer-discretionary-132100331.html?.tsrc=rss,https://da.gd/XHZSZb
Yahoo,5 Must-Buy Growth Stocks for Solid Returns in 2024,https://finance.yahoo.com/news/5-must-buy-growth-stocks-132000867.html?.tsrc=rss,https://da.gd/h9arQv
