feed,title,long_url,short_url
SeekingAlpha,Microsoft invests 3.2B euro in Germany for AI push - report,https://seekingalpha.com/news/4067626,
SeekingAlpha,Water Technologies to acquire residential community with 87 single family homes,https://seekingalpha.com/news/4067633,
SeekingAlpha,"5 stocks to watch on Thursday: SunPower, DraftKings, Super Micro Computer and more",https://seekingalpha.com/news/4067632,
SeekingAlpha,Notable earnings before Friday's open,https://seekingalpha.com/news/4067628,
SeekingAlpha,Manulife Financial raised to Outperform after Q4 earnings beat,https://seekingalpha.com/news/4067627,
SeekingAlpha,"Worried About Big Tech, Stock Market Bubble? Own BIL Instead",https://seekingalpha.com/article/4670493,
