feed,title,long_url,short_url
SeekingAlpha,"Evercore EPS beats by $0.38, beats on revenue",https://seekingalpha.com/news/3720254,
SeekingAlpha,"Owens Corning EPS beats by $0.46, beats on revenue; issues full year guidance",https://seekingalpha.com/news/3720253,
SeekingAlpha,"Six Flags EPS beats by $1.09, beats on revenue",https://seekingalpha.com/news/3720252,
SeekingAlpha,"Thermo Fisher Scientific EPS beats by $0.12, beats on revenue, raises guidance",https://seekingalpha.com/news/3720251,
SeekingAlpha,"Generac EPS beats by $0.07, beats on revenue",https://seekingalpha.com/news/3720250,
