feed,title,long_url,short_url
SeekingAlpha,"Automatic Data Processing EPS beats by $0.06, beats on revenue",https://seekingalpha.com/news/3720317,
SeekingAlpha,"Moody's EPS beats by $0.45, beats on revenue",https://seekingalpha.com/news/3720316,
SeekingAlpha,Credit Suisse's Archegos inquiry describes due diligence failure - Bloomberg,https://seekingalpha.com/news/3720315,
SeekingAlpha,"General Dynamics EPS beats by $0.07, misses on revenue",https://seekingalpha.com/news/3720314,
SeekingAlpha,MGM Resorts rallies after Goldman Sachs turns away from bear call,https://seekingalpha.com/news/3720313,
SeekingAlpha,"Garmin EPS beats by $0.43, beats on revenue; raises full year guidance",https://seekingalpha.com/news/3720312,
SeekingAlpha,Fluidigm gains on report that it's exploring a sale,https://seekingalpha.com/news/3720311,
