feed,title,long_url,short_url
SeekingAlpha,"Mid America Apartment Communities FFO beats by $0.05, beats on rental and other property revenues",https://seekingalpha.com/news/3720941,
SeekingAlpha,Manning & Napier reports Q2 results,https://seekingalpha.com/news/3720939,
SeekingAlpha,"Forrester Research EPS beats by $0.10, beats on revenue",https://seekingalpha.com/news/3720938,
SeekingAlpha,"TTM Technologies EPS beats by $0.06, beats on revenue",https://seekingalpha.com/news/3720937,
SeekingAlpha,"Zovio  EPS beats by $0.04, beats on revenue",https://seekingalpha.com/news/3720932,
SeekingAlpha,"Qualcomm stock gains as 5G strength drives FQ3 beats, upside profit forecast",https://seekingalpha.com/news/3720930,
