feed,title,long_url,short_url
Nasdaq,"Today's Mortgage Rates -- May 10, 2021: Rates Mixed",https://www.nasdaq.com/articles/todays-mortgage-rates-may-10-2021%3A-rates-mixed-2021-05-10,https://j.mp/3tAFYhe
Nasdaq,"Inovio says COVID-19 vaccine candidate safe, effective in clinical trial",https://www.nasdaq.com/articles/inovio-says-covid-19-vaccine-candidate-safe-effective-in-clinical-trial-2021-05-10,https://j.mp/3vVyl6E
Nasdaq,Ransom group linked to Colonial Pipeline hack is new but experienced,https://www.nasdaq.com/articles/ransom-group-linked-to-colonial-pipeline-hack-is-new-but-experienced-2021-05-10,https://j.mp/3hf5pSZ
Nasdaq,"PREIT Earnings: Modest Progress, Lots of Work Left",https://www.nasdaq.com/articles/preit-earnings%3A-modest-progress-lots-of-work-left-2021-05-10,https://j.mp/3xYFoxi
Nasdaq,U.S. opens safety probe into 1.1 million Honda Accord vehicles,https://www.nasdaq.com/articles/u.s.-opens-safety-probe-into-1.1-million-honda-accord-vehicles-2021-05-10-0,https://j.mp/33Ci7TL
Nasdaq,"After virtual Berlin Film Festival, movies to be shown outdoors",https://www.nasdaq.com/articles/after-virtual-berlin-film-festival-movies-to-be-shown-outdoors-2021-05-10,https://j.mp/3vWi5CA
Nasdaq,PlayAGS (AGS) Moves 5.6% Higher: Will This Strength Last?,https://www.nasdaq.com/articles/playags-ags-moves-5.6-higher%3A-will-this-strength-last-2021-05-10,https://j.mp/3xVfb2R
Nasdaq,Expedia (EXPE) Surges 5.2%: Is This an Indication of Further Gains?,https://www.nasdaq.com/articles/expedia-expe-surges-5.2%3A-is-this-an-indication-of-further-gains-2021-05-10,https://j.mp/3o51ERF
