feed,title,long_url,short_url
Nasdaq,Brooks Automation To Split Into Two Companies; Q2 Profit Rises,https://www.nasdaq.com/articles/brooks-automation-to-split-into-two-companies-q2-profit-rises-2021-05-10,https://j.mp/3vTkZI8
Nasdaq,US State Dept approves potential sale of AEGIS Combat System to Canada -Pentagon,https://www.nasdaq.com/articles/us-state-dept-approves-potential-sale-of-aegis-combat-system-to-canada-pentagon-2021-05-10,https://j.mp/3tA9VhD
Nasdaq,"In New York, artist Maya Lin's 'Ghost Forest' warns on rising sea water",https://www.nasdaq.com/articles/in-new-york-artist-maya-lins-ghost-forest-warns-on-rising-sea-water-2021-05-10,https://j.mp/3uBocM9
Nasdaq,Wynn Resorts Interactive To Become Independent Public Company,https://www.nasdaq.com/articles/wynn-resorts-interactive-to-become-independent-public-company-2021-05-10,https://j.mp/3eAt3HZ
Nasdaq,"TSX Fails To Hold Early Gains, Ends On Weak Note",https://www.nasdaq.com/articles/tsx-fails-to-hold-early-gains-ends-on-weak-note-2021-05-10,https://j.mp/3tCO6hc
Nasdaq,Ameren Corp Q1 Earnings Advance,https://www.nasdaq.com/articles/ameren-corp-q1-earnings-advance-2021-05-10,https://j.mp/3uDVslU
