feed,title,long_url,short_url
SeekingAlpha,J&J says bankruptcy is best way to resolve talc claims in trial,https://seekingalpha.com/news/3800089,
SeekingAlpha,"Delta Galil Industries  GAAP EPS of $1.60, revenue of $578M",https://seekingalpha.com/news/3800093,
SeekingAlpha,EMCORE to acquire L3Harris Space and Navigation Business in $5M all-cash deal,https://seekingalpha.com/news/3800092,
SeekingAlpha,"AgriFORCE jumps 23% on acquisition of Delphy, AgTech consulting firm",https://seekingalpha.com/news/3800091,
SeekingAlpha,Voyager Digital Q2 beat highlights transaction revenue soaring Y/Y,https://seekingalpha.com/news/3800090,
SeekingAlpha,XPEL expands architectural window film solutions,https://seekingalpha.com/news/3800088,
SeekingAlpha,Seanergy Maritime regains compliance with minimum price requirement,https://seekingalpha.com/news/3800087,
