feed,title,long_url,short_url
FXEmpire,Ottawa police chief resigns amid blockade chaos – CBC reporter,https://www.fxempire.com/news/article/ottawa-police-chief-resigns-amid-blockade-chaos-cbc-reporter-899797,https://bit.ly/3oPQgKU
FXEmpire,Russia’s Lavrov calls for pragmatic dialogue in phone call with Blinken,https://www.fxempire.com/news/article/russias-lavrov-calls-for-pragmatic-dialogue-in-phone-call-with-blinken-899798,https://bit.ly/3uO5fch
FXEmpire,Push for peace: Scholz wants more diplomacy after Putin talks,https://www.fxempire.com/news/article/push-for-peace-scholz-wants-more-diplomacy-after-putin-talks-899800,https://bit.ly/3sLhJPd
FXEmpire,Israeli soldiers kill Palestinian in West Bank confrontation,https://www.fxempire.com/news/article/israeli-soldiers-kill-palestinian-in-west-bank-confrontation-899802,https://bit.ly/3GTcDFo
FXEmpire,"Forcing foreign banks to become EU branches ‘a last resort’, says official",https://www.fxempire.com/news/article/forcing-foreign-banks-to-become-eu-branches-a-last-resort-says-official-899794,https://bit.ly/3sGDYWo
FXEmpire,"Ukraine reports cyber attack on defence ministry website, banks – TASS",https://www.fxempire.com/news/article/ukraine-reports-cyber-attack-on-defence-ministry-website-banks-tass-899796,https://bit.ly/3LBoPys
FXEmpire,"“Ban Crypto Trading and Mining”, Says Hungary Central Bank’s Governer",https://www.fxempire.com/news/article/ban-crypto-trading-and-mining-says-hungary-central-banks-governer-899787,https://bit.ly/3gOXlHq
