feed,title,long_url,short_url
Benzinga,Did Umbilical Cord Blood Transplant Help Cure A Woman's HIV infection?,https://benzinga.com/general/biotech/22/02/25642729/did-umbilical-cord-blood-transplant-help-cure-a-womans-hiv-infection,https://bit.ly/3JzKHs9
Benzinga,DraftKings Whale Trades For February 15,https://benzinga.com/markets/options/22/02/25646721/draftkings-whale-trades-for-february-15,https://bit.ly/3HUTT9U
Benzinga,Check Out What Whales Are Doing With ABBV,https://benzinga.com/markets/options/22/02/25646718/check-out-what-whales-are-doing-with-abbv,https://bit.ly/36gXUYu
Benzinga,What Are Whales Doing With Twilio,https://benzinga.com/markets/options/22/02/25646716/what-are-whales-doing-with-twilio,https://bit.ly/3sLHuyD
Benzinga,Looking At Comcast's Recent Whale Trades,https://benzinga.com/markets/options/22/02/25645744/looking-at-comcasts-recent-whale-trades,https://bit.ly/3LNPEzB
Benzinga,What Are Whales Doing With Joby Aviation,https://benzinga.com/markets/options/22/02/25645735/what-are-whales-doing-with-joby-aviation,https://bit.ly/3gKuDrb
