feed,title,long_url,short_url
SeekingAlpha,"EngageSmart GAAP EPS of -$0.01 in-line, revenue of $61.6M beats by $3.53M",https://seekingalpha.com/news/3800386,
SeekingAlpha,"Mercury General GAAP EPS of $0.55 beats by $0.16, revenue of $1.05B beats by $141.04M",https://seekingalpha.com/news/3800382,
SeekingAlpha,"Cincinnati Financial Non-GAAP EPS of $1.97 beats by $0.61, earned premiums of $1.68B misses by $90M",https://seekingalpha.com/news/3800381,
SeekingAlpha,"ViacomCBS dips as profits dip despite revenue beat, streaming gains",https://seekingalpha.com/news/3800380,
SeekingAlpha,"Akamai Non-GAAP EPS of $1.49 beats by $0.07, revenue of $905M beats by $8.66M",https://seekingalpha.com/news/3800379,
SeekingAlpha,"Wynn Resorts trades lower after earnings, Encore Boston sale",https://seekingalpha.com/news/3800378,
SeekingAlpha,"Gladstone Commercial FFO of $0.40 in-line, revenue of $35.3M misses by $0.22M",https://seekingalpha.com/news/3800377,
