feed,title,long_url,short_url
SeekingAlpha,"Akamai Technologies acquires Linode for $900M, accretive to FY22 earnings",https://seekingalpha.com/news/3800436,
SeekingAlpha,"Vishay Precision Non-GAAP EPS of $0.56 beats by $0.02, revenue of $90M beats by $2.48M",https://seekingalpha.com/news/3800435,
SeekingAlpha,"GXO Logistics Non-GAAP EPS of $0.73 beats by $0.20, revenue of $2.26B beats by $210M",https://seekingalpha.com/news/3800434,
SeekingAlpha,"Franklin Street Properties Non-GAAP EPS of $0.16 misses by $0.62, revenue of $43.38M misses by $0.65M",https://seekingalpha.com/news/3800433,
SeekingAlpha,"Alcon Non-GAAP EPS of $0.56 beats by $0.06, revenue of $2.13B beats by $30M",https://seekingalpha.com/news/3800432,
SeekingAlpha,"Wyndham Hotels & Resorts Non-GAAP EPS of $0.69 beats by $0.15, revenue of $392M beats by $7.25M",https://seekingalpha.com/news/3800431,
