feed,title,long_url,short_url
SeekingAlpha,ATIF Holdings inks consulting agreements with McSen Realty and Promise Logistics,https://seekingalpha.com/news/3625766,
SeekingAlpha,"Alliance Resource reports surprise Q3 profit, sees 10% sales volume growth",https://seekingalpha.com/news/3625765,
SeekingAlpha,Mack-Cali Realty disposes its suburban property,https://seekingalpha.com/news/3625764,
SeekingAlpha,Neonode inks value-added reseller agreement with Japan Aerospace,https://seekingalpha.com/news/3625762,
SeekingAlpha,Mid-Southern Savings Bank reports Q3 results,https://seekingalpha.com/news/3625763,
