feed,title,long_url,short_url
ETFdb:DailyRecap,Harbor Capital Launches New Large-Cap Core ETF,https://etfdb.com/news/2024/10/10/harbor-capital-launches-new-etf-info/,https://da.gd/46g3B
ETFdb:DailyRecap,China's Stimulus Will Continue to Weigh Heavy on Copper,https://etfdb.com/gold-silver-investing-channel/china-stimulus-weighs-heavily-copper/,https://da.gd/K7vpC
ETFdb:DailyRecap,White Wolf Brings Private Capital Expertise to the Public Via LBO,https://etfdb.com/news/2024/10/10/white-wolf-brings-private-capital-expertise-lbo/,https://da.gd/7kNG9i
ETFdb:DailyRecap,2 Bonds ETFs Right for the Times,https://etfdb.com/model-portfolio-channel/2-tiely-bonds-etfs/,https://da.gd/jKUkxq
ETFdb:DailyRecap,3 Roadblocks to Crypto Adoption,https://etfdb.com/crypto-channel/3-crypto-adoption-roadblocks/,https://da.gd/N11ZXx
ETFdb:DailyRecap,The Fixed Income Symposium Can Help You Navigate Rate Cuts,https://etfdb.com/fixed-income-channel/fixed-income-symposium-aids-rate-cut-navigation/,https://da.gd/cXHHjD
