feed,title,long_url,short_url
Benzinga,$100 Invested In Krystal Biotech 5 Years Ago Would Be Worth This Much Today,https://benzinga.com/insights/news/24/10/41297565/100-invested-in-krystal-biotech-5-years-ago-would-be-worth-this-much-today,https://da.gd/AhBqG
Benzinga,Here's How Much $100 Invested In BlackRock 20 Years Ago Would Be Worth Today,https://benzinga.com/insights/news/24/10/41297564/heres-how-much-100-invested-in-blackrock-20-years-ago-would-be-worth-today,https://da.gd/HDEl
Benzinga,Amazon's AI-Driven AWS Growth To Power Outperformance: Analysts,https://benzinga.com/analyst-ratings/analyst-color/24/10/41297538/amazons-ai-driven-aws-growth-to-power-outperformance-analysts,https://da.gd/jFzVD
Benzinga,S&P 500 Moves Higher; BlackRock Reports Upbeat Results,https://benzinga.com/news/earnings/24/10/41297524/s-p-500-moves-higher-blackrock-reports-upbeat-results,https://da.gd/8Emwy
Benzinga,Ethereum Up More Than 3% In 24 hours,https://benzinga.com/insights/cryptocurrency/24/10/41297597/ethereum-up-more-than-3-in-24-hours,https://da.gd/YJF8Uv
Benzinga,Bitcoin Rises More Than 5% In 24 hours,https://benzinga.com/insights/cryptocurrency/24/10/41297551/bitcoin-rises-more-than-5-in-24-hours,https://da.gd/KS5arH
