feed,title,long_url,short_url
InsiderMonkey,35 Trending AI Stocks on Latest News and Analyst Ratings,https://insidermonkey.com/blog/--1370936,
InsiderMonkey,Jim Cramer Says Accenture plc (ACN) Is A ‘Great Buy’,https://insidermonkey.com/blog/--1371442,
InsiderMonkey,"Jim Cramer On Cadence Design Systems, Inc. (CDNS): ‘Buy Some More’",https://insidermonkey.com/blog/--1371438,
InsiderMonkey,Jim Cramer on GE HealthCare Technologies Inc. (GEHC): ‘I’d Wait For Another Downgrade And Buy More’,https://insidermonkey.com/blog/--1371434,
InsiderMonkey,"Jim Cramer Says ‘Super Micro Computer, Inc. (SMCI) Was Down Terrible’",https://insidermonkey.com/blog/--1371431,
InsiderMonkey,"Jim Cramer on Reddit, Inc. (RDDT) CEO Steve Huffman: ‘I Think He’s Doing A Rather Remarkable Job’",https://insidermonkey.com/blog/--1371427,
InsiderMonkey,Jim Cramer Says Nextracker Inc. (NXT) Is A ‘Loser’,https://insidermonkey.com/blog/--1371423,
InsiderMonkey,Jim Cramer Says GSK plc (GSK) ‘Goes Higher’,https://insidermonkey.com/blog/--1371417,
InsiderMonkey,"Jim Cramer Says ‘I Like CAVA Group, Inc. (CAVA) Very Much’",https://insidermonkey.com/blog/--1371414,
InsiderMonkey,"Jim Cramer on McCormick & Company, Incorporated (MKC): ‘I Think Buying It Right Here Is A Very Good Idea’",https://insidermonkey.com/blog/--1371409,
InsiderMonkey,Jim Cramer on Equinor ASA (EQNR): ‘I’m Not Encouraging Buying In That Sector’,https://insidermonkey.com/blog/--1371331,
