feed,title,long_url,short_url
Investing,"5 High-Yield REITs Paying Up to 13.2%: 3 Duds, 2 Studs",https://www.investing.com/analysis/5-highyield-reits-paying-up-to-132-3-duds-2-studs-200658828,https://da.gd/hz0R0
Investing,Top 3 Beverage Stocks Pouring Out Profits,https://www.investing.com/analysis/top-3-beverage-stocks-pouring-out-profits-200658817,https://da.gd/XQygM
Investing,"Exclusive-India weighs scrapping import tax on US LNG, boost purchases, sources say",https://www.investing.com/news/commodities-news/exclusiveindia-weighs-scrapping-import-tax-on-us-lng-boost-purchases-sources-say-3953971,https://da.gd/vULg
Investing,Buy Alibaba stock as AI deep dive analysis shows 'clear product roadmap': Mizuho,https://www.investing.com/news/stock-market-news/buy-alibaba-stock-as-ai-deep-dive-analysis-shows-clear-product-roadmap-mizuho-3953977,https://da.gd/0Juk
Investing,Elliott takes big short position in Shell amid BP campaign,https://www.investing.com/news/stock-market-news/elliott-takes-big-short-position-in-shell-amid-bp-campaign-3953973,https://da.gd/2xX9g
Investing,Wall St futures edge lower on tariff woes; inflation data on tap,https://www.investing.com/news/stock-market-news/wall-st-futures-edge-lower-on-tariff-woes-inflation-data-on-tap-3953972,https://da.gd/vD9D5m
Investing,Westminster Group reports narrower pretax loss on higher sales,https://www.investing.com/news/stock-market-news/westminster-group-reports-narrower-pretax-loss-on-higher-sales-93CH-3953970,https://da.gd/BrHXKT
Investing,"U.S. recession could spark global downturn, equity bear market - BCA Research",https://www.investing.com/news/stock-market-news/us-recession-could-spark-global-downturn-equity-bear-market--bca-research-3953966,https://da.gd/JJDO
Investing,"Plexus Holdings reports pretax loss, shifts focus to wellhead rental market",https://www.investing.com/news/stock-market-news/plexus-holdings-reports-pretax-loss-shifts-focus-to-wellhead-rental-market-93CH-3953964,https://da.gd/lHCRj
Investing,Topcon set to go private with KKR & JIC Capital investment,https://www.investing.com/news/stock-market-news/topcon-set-to-go-private-with-kkr--jic-capital-investment-93CH-3953962,https://da.gd/0kVf0R
Investing,Jenoptik shares dip after analyst downgrades stock on 'missed opportunity',https://www.investing.com/news/stock-market-news/jenoptik-shares-dip-after-analyst-downgrades-stock-on-missed-opportunity-3953958,https://da.gd/rNilef
Investing,Factbox-Major brokerages see slower pace of Fed rate cuts amid Trump tariff uncertainty,https://www.investing.com/news/economy-news/factboxmajor-brokerages-see-slower-pace-of-fed-rate-cuts-amid-trump-tariff-uncertainty-3953981,https://da.gd/2Yvnt
Investing,"Analysis-Deal slump hits US high-grade bond supply, pressures spreads",https://www.investing.com/news/economy-news/analysisdeal-slump-hits-us-highgrade-bond-supply-pressures-spreads-3953934,https://da.gd/wqjP1
