feed,title,long_url,short_url
Benzinga,Insider Buys Dun & Bradstreet's Shares,https://www.benzinga.com/news/20/11/18277102/insider-buys-dun-bradstreets-shares,https://j.mp/3ls2XYV
Benzinga,Arko/GPM and Haymaker Acquisition Corp. II to Participate in SPACInsider-ICR Webinar on November 12th at 2pm ET,https://www.benzinga.com/pressreleases/20/11/g18279410/arkogpm-and-haymaker-acquisition-corp-ii-to-participate-in-spacinsider-icr-webinar-on-november-12t,https://j.mp/3kbUc3p
Benzinga,74 Stocks Moving In Monday's Mid-Day Session,https://www.benzinga.com/news/20/11/18279397/74-stocks-moving-in-mondays-mid-day-session,https://j.mp/3kirZIm
Benzinga,New Rapid COVID-19 Point of Care Test,https://www.benzinga.com/pressreleases/20/11/r18279401/new-rapid-covid-19-point-of-care-test,https://j.mp/3pb5FnN
Benzinga,Insider Buys Agree Realty's Shares,https://www.benzinga.com/news/20/11/18277100/insider-buys-agree-realtys-shares,https://j.mp/32uSPXF
