feed,title,long_url,short_url
CryptoNewsFlash,IOTA Community Pushes Staking Ratio to 50% in Major Network Achievement,https://crypto-news-flash.com/iota-community-pushes-staking-ratio-up/,
CryptoNewsFlash,Hedera Expands Real-World Asset Utility as cSigma Channels Invoice Financing Returns to Stablecoin Holders,https://crypto-news-flash.com/hedera-expands-rwa-utility-with-csigma/,
CryptoNewsFlash,Ethereum Poised for 5x Gas Limit Increase as Buterin Proposes New Cost Model for Heavy Ops,https://crypto-news-flash.com/ethereum-poised-for-5x-gas-limit-increase-as-buterin-proposes-new-cost-model-for-heavy-ops/,
CryptoNewsFlash,Tether CEO Rebukes S&P Global After USDT Risk Warning,https://crypto-news-flash.com/tether-ceo-rebukes-sp-global-after-usdt-risk-warning/,
CryptoNewsFlash,"OKX Re-Lists Dash, Restoring Access for Millions Worldwide",https://crypto-news-flash.com/okx-re-lists-dash-restoring-access-for-millions-worldwide/,
