feed,title,long_url,short_url
SeekingAlpha,Selecta Biosciences EPS misses by $0.27,https://seekingalpha.com/news/3601833,
SeekingAlpha,"Insmed EPS misses by $0.05, beats on revenue",https://seekingalpha.com/news/3601832,
SeekingAlpha,"Cheniere Energy EPS beats by $0.43, beats on revenue",https://seekingalpha.com/news/3601831,
SeekingAlpha,"Ironwood Pharmaceuticals EPS beats by $0.06, beats on revenue",https://seekingalpha.com/news/3601830,
SeekingAlpha,"FLIR Systems EPS beats by $0.13, beats on revenue",https://seekingalpha.com/news/3601829,
SeekingAlpha,"Cheniere Energy Partners EPS beats by $0.01, misses on revenue",https://seekingalpha.com/news/3601828,
SeekingAlpha,"Intellia Therapeutics EPS beats by $0.09, beats on revenue",https://seekingalpha.com/news/3601827,
