feed,title,long_url,short_url
SeekingAlpha,"Flowers Foods EPS beats by $0.02, beats on revenue",https://seekingalpha.com/news/3602427,
SeekingAlpha,"FibroGen EPS misses by $0.39, misses on revenue",https://seekingalpha.com/news/3602426,
SeekingAlpha,"TrueCar EPS beats by $0.11, beats on revenue",https://seekingalpha.com/news/3602424,
SeekingAlpha,"Switch EPS beats by $0.01, misses on revenue",https://seekingalpha.com/news/3602423,
SeekingAlpha,"Montage Resources EPS beats by $0.30, misses on revenue",https://seekingalpha.com/news/3602421,
