feed,title,long_url,short_url
Benzinga,US Job Hiring Bounces Back From April Lows,https://www.benzinga.com/government/20/07/16539341/us-job-hiring-bounces-back-from-april-lows,https://j.mp/3f75ioI
Benzinga,"Levi Strauss Reports Q2 Earnings Miss, Accelerating E-Commerce Growth",https://www.benzinga.com/news/earnings/20/07/16542219/levi-strauss-reports-q2-earnings-miss-accelerating-e-commerce-growth,https://j.mp/3f75q7G
Benzinga,Alexiacare Corporation Builds and Gives Away New Virtual Visit EMR/EHR Tool to Doctors Offices Facing COVID-19 Crisis,https://www.benzinga.com/pressreleases/20/07/r16542299/alexiacare-corporation-builds-and-gives-away-new-virtual-visit-emrehr-tool-to-doctors-offices-faci,https://j.mp/3f75iVK
Benzinga,Rupert Resources Ltd. Announces Equity Financings Totalling C$22.3 Million,https://www.benzinga.com/pressreleases/20/07/g16542261/rupert-resources-ltd-announces-equity-financings-totalling-c-22-3-million,https://j.mp/3iGMnDy
Benzinga,Atlas Awarded $4 Million Richards Boulevard Office Complex Project in California,https://www.benzinga.com/pressreleases/20/07/g16542256/atlas-awarded-4-million-richards-boulevard-office-complex-project-in-california,https://j.mp/2AHqRxk
Benzinga,"Bridge Bancorp, Inc. to Host Second Quarter 2020 Earnings Conference Call",https://www.benzinga.com/pressreleases/20/07/g16542255/bridge-bancorp-inc-to-host-second-quarter-2020-earnings-conference-call,https://j.mp/2VY2ItA
Benzinga,Uniti Group Inc. To Report Second Quarter 2020 Financial Results and Host Conference Call,https://www.benzinga.com/pressreleases/20/07/g16542253/uniti-group-inc-to-report-second-quarter-2020-financial-results-and-host-conference-call,https://j.mp/2O3prA7
Benzinga,Black Hills Corp. Schedules 2020 Second Quarter Earnings Release and Conference Call,https://www.benzinga.com/pressreleases/20/07/g16542252/black-hills-corp-schedules-2020-second-quarter-earnings-release-and-conference-call,https://j.mp/2O17YZj
