feed,title,long_url,short_url
FXEmpire,"Ukraine may have to pull back to stronger positions in Sievierodonetsk, governor says",https://www.fxempire.com/news/article/ukraine-may-have-to-pull-back-to-stronger-positions-in-sievierodonetsk-governor-says-1026666,https://bit.ly/3H5MCV9
FXEmpire,"After lockdown, Shanghai tries to mend fences with foreign firms",https://www.fxempire.com/news/article/after-lockdown-shanghai-tries-to-mend-fences-with-foreign-firms-1026658,https://bit.ly/3xw7nWM
FXEmpire,Thai central bank holds key rate at record low despite inflation,https://www.fxempire.com/news/article/thai-central-bank-holds-key-rate-at-record-low-despite-inflation-1026659,https://bit.ly/3xqjWTD
FXEmpire,"In Nigeria’s disappearing forests, loggers outnumber trees",https://www.fxempire.com/news/article/in-nigerias-disappearing-forests-loggers-outnumber-trees-1026663,https://bit.ly/3aGv4Tn
FXEmpire,Biden’s plan to pitch Latin America reboot at summit dogged by dispute and dissent,https://www.fxempire.com/news/article/bidens-plan-to-pitch-latin-america-reboot-at-summit-dogged-by-dispute-and-dissent-1026660,https://bit.ly/391M85T
FXEmpire,Western Digital reviewing alternatives after Elliott’s push to split,https://www.fxempire.com/news/article/western-digital-reviewing-alternatives-after-elliotts-push-to-split-1026665,https://bit.ly/3O4CO0a
