feed,title,long_url,short_url
FXEmpire,Half of Britons to spend less this Christmas – Kantar,https://www.fxempire.com/news/article/half-of-britons-to-spend-less-this-christmas-kantar-1171782,https://bit.ly/3F7o2V5
FXEmpire,Blowing up dam would only slow Ukrainian advance by two weeks in south – spy chief,https://www.fxempire.com/news/article/blowing-up-dam-would-only-slow-ukrainian-advance-by-two-weeks-in-south-spy-chief-1171789,https://bit.ly/3SvvtbN
FXEmpire,Foreign business groups in China wary as new Xi term begins,https://www.fxempire.com/news/article/foreign-business-groups-in-china-wary-as-new-xi-term-begins-1171788,https://bit.ly/3SvvufR
FXEmpire,"Strong equipment, parts demand expected to lift Caterpillar sales",https://www.fxempire.com/news/article/strong-equipment-parts-demand-expected-to-lift-caterpillar-sales-1171784,https://bit.ly/3FioJe2
FXEmpire,UPS could keep outpacing FedEx as e-commerce delivery market dims,https://www.fxempire.com/news/article/ups-could-keep-outpacing-fedex-as-e-commerce-delivery-market-dims-1171787,https://bit.ly/3Frhr8f
FXEmpire,Analysis-Biden’s EV minerals cash fruitless without permitting reform,https://www.fxempire.com/news/article/analysis-bidens-ev-minerals-cash-fruitless-without-permitting-reform-1171791,https://bit.ly/3F6nuyN
FXEmpire,Archer Aviation plans to build 250 air taxis in 2025,https://www.fxempire.com/news/article/archer-aviation-plans-to-build-250-air-taxis-in-2025-1171790,https://bit.ly/3N0pURd
FXEmpire,Explainer-What happens if a candidate cries foul in U.S. midterm elections?,https://www.fxempire.com/news/article/explainer-what-happens-if-a-candidate-cries-foul-in-u-s-midterm-elections-1171785,https://bit.ly/3F9TXnB
FXEmpire,Teen charged in Michigan school shooting to plead guilty Monday -prosecutor,https://www.fxempire.com/news/article/teen-charged-in-michigan-school-shooting-to-plead-guilty-monday-prosecutor-1171786,https://bit.ly/3gBBIx8
