feed,title,long_url,short_url
SeekingAlpha,"Boxlight GAAP EPS of -$0.18 beats by $0.17, revenue of $38.5M misses by $5.42M",https://seekingalpha.com/news/4136599,
SeekingAlpha,"Duolingo GAAP EPS of $0.51 beats by $0.19, revenue of $178.33M beats by $1.19M",https://seekingalpha.com/news/4136598,
SeekingAlpha,"Amtech Non-GAAP EPS of $0.08, revenue of $26.7M",https://seekingalpha.com/news/4136596,
SeekingAlpha,"Blade Air Mobility GAAP EPS of -$0.15 misses by $0.09, revenue of $67.95M beats by $4.83M",https://seekingalpha.com/news/4136595,
SeekingAlpha,DiaMedica Therapeutics GAAP EPS of -$0.13 beats by $0.03,https://seekingalpha.com/news/4136594,
SeekingAlpha,"Amphastar Pharmaceuticals Non-GAAP EPS of $0.94 beats by $0.19, revenue of $182.39M beats by $11.48M",https://seekingalpha.com/news/4136593,
SeekingAlpha,"SiTime Non-GAAP EPS of $0.12 beats by $0.08, revenue of $43.9M beats by $2.89M",https://seekingalpha.com/news/4136592,
