feed,title,long_url,short_url
Investing,Oil prices extend gains as Hormuz disruptions persist; US-Iran talks eyed,https://www.investing.com/news/commodities-news/oil-prices-extend-gains-as-hormuz-disruptions-persist-usiran-talks-eyed-4607015,
Investing,"US stock futures steady with Iran ceasefire talks, CPI data in focus",https://www.investing.com/news/stock-market-news/us-stock-futures-steady-with-iran-ceasefire-talks-cpi-data-in-focus-4607013,
Investing,Apple to shutter its first unionized US store in Maryland,https://www.investing.com/news/stock-market-news/apple-to-shutter-its-first-unionized-us-store-in-maryland-4607010,
Investing,"South Korean central bank stands pat as Middle East war fuels inflation, growth risks",https://www.investing.com/news/economy-news/south-korean-central-bank-stands-pat-as-middle-east-war-fuels-inflation-growth-risks-4607018,
Investing,"Putin announces two-day Easter ceasefire, expects Ukraine to follow",https://www.investing.com/news/economy-news/putin-announces-twoday-easter-ceasefire-expects-u,
