feed,title,long_url,short_url
SeekingAlpha,Inozyme Pharma GAAP EPS of -$0.38,https://seekingalpha.com/news/3872813,
SeekingAlpha,MediPharm Labs reports Q2 results,https://seekingalpha.com/news/3872812,
SeekingAlpha,"Mexco Energy GAAP EPS of $0.59, revenue of $2.45M",https://seekingalpha.com/news/3872811,
SeekingAlpha,"Celsion GAAP EPS of -$0.87, revenue of $0.13M",https://seekingalpha.com/news/3872810,
SeekingAlpha,Akouos GAAP EPS of -$0.58 beats by $0.21,https://seekingalpha.com/news/3872809,
SeekingAlpha,GreenPower Motor reports Q1 results,https://seekingalpha.com/news/3872808,
SeekingAlpha,Viridian stock soars 39% as thyroid eye disease drug shows promise in trial,https://seekingalpha.com/news/3872802,
