feed,title,long_url,short_url
SeekingAlpha,Endra Life Sciences GAAP EPS of $0.06 beats by $0.12,https://seekingalpha.com/news/3873162,
SeekingAlpha,"F45 Training Holdings GAAP EPS of -$0.36 misses by $0.48, revenue of $30.03M beats by $4.33M",https://seekingalpha.com/news/3873161,
SeekingAlpha,Acumen Pharmaceuticals GAAP EPS of -$0.25 in-line,https://seekingalpha.com/news/3873160,
SeekingAlpha,Viridian Therapeutics stock gains on securities offering,https://seekingalpha.com/news/3873159,
SeekingAlpha,"WidePoint GAAP EPS of -$1.58 misses by $1.54, revenue of $23.1M beats by $1.71M",https://seekingalpha.com/news/3873158,
SeekingAlpha,"Greenidge Generation Holdings GAAP EPS of -$2.61, revenue of $31.3M",https://seekingalpha.com/news/3873157,
SeekingAlpha,"Qiagen launches test to differentiate between monkeypox, other pathogens",https://seekingalpha.com/news/3873156,
SeekingAlpha,II-VI: Technology For The Future,https://seekingalpha.com/article/4534549,
