feed,title,long_url,short_url
FXEmpire,"Fresenius CEO signals realignment, confirms call with Elliott – FAZ newspaper",https://www.fxempire.com/news/article/fresenius-ceo-signals-realignment-confirms-call-with-elliott-faz-newspaper-1173764,https://bit.ly/3SAvL0Q
FXEmpire,Exclusive-‘Where did the Tweeters go?’ Twitter is losing its most active users -internal documents,https://www.fxempire.com/news/article/exclusive-where-did-the-tweeters-go-twitter-is-losing-its-most-active-users-internal-documents-1173762,https://bit.ly/3gKr9s1
FXEmpire,"U.S. in ‘constant contact’ with Russia about Griner, Biden says",https://www.fxempire.com/news/article/u-s-in-constant-contact-with-russia-about-griner-biden-says-1173763,https://bit.ly/3f5woSt
FXEmpire,Exclusive-FAA sees aviation safety risks without U.S. telecom agency mandate — letter,https://www.fxempire.com/news/article/exclusive-faa-sees-aviation-safety-risks-without-u-s-telecom-agency-mandate-letter-1173765,https://bit.ly/3N3BafP
FXEmpire,Arizona county backs hand count of ballots in U.S. midterm elections,https://www.fxempire.com/news/article/arizona-county-backs-hand-count-of-ballots-in-u-s-midterm-elections-1173761,https://bit.ly/3N3Bawl
