feed,title,long_url,short_url
Benzinga,A Congress Member Bought Up To $100K In KLA Stock: Here's What You Need To Know,https://benzinga.com/government/23/10/35242930/a-congress-member-bought-up-to-100k-in-kla-stock-heres-what-you-need-to-know,https://da.gd/kl0ca
Benzinga,Florida Rep. Scott Franklin Sold Over $50K Worth of Cisco Systems Stock: Here's What You Should Know,https://benzinga.com/government/23/10/35242925/florida-rep-scott-franklin-sold-over-50k-worth-of-cisco-systems-stock-heres-what-you-should-know,https://da.gd/yjMM
Benzinga,Chief Executive Officer of Cosmos Health Purchased $158K In Stock,https://benzinga.com/news/23/10/35242794/chief-executive-officer-of-cosmos-health-purchased-158k-in-stock,https://da.gd/2xkOr
Benzinga,Director of Lexicon Pharmaceuticals Makes $1.10M Buy,https://benzinga.com/news/23/10/35242791/director-of-lexicon-pharmaceuticals-makes-1-10m-buy,https://da.gd/JBe0I
Benzinga,Executive Chairman At This Information Technology Company Sells $8.09M of Stock,https://benzinga.com/news/23/10/35242790/executive-chairman-at-this-information-technology-company-sells-8-09m-of-stock,https://da.gd/odI6z
Benzinga,Jabil SVP Trades $1.00M In Company Stock,https://benzinga.com/news/23/10/35242788/jabil-svp-trades-1-00m-in-company-stock,https://da.gd/Vyxf
Benzinga,Massive Insider Trade At AAR,https://benzinga.com/news/23/10/35242784/massive-insider-trade-at-aar,https://da.gd/e8GUWD
Benzinga,10% Owner of Sprinklr Sold $1.29M In Stock,https://benzinga.com/news/23/10/35242782/10-owner-of-sprinklr-sold-1-29m-in-stock,https://da.gd/QRKF6
Benzinga,Victory Capital Holdings Director Makes $52K Stock Purchase,https://benzinga.com/news/23/10/35242781/victory-capital-holdings-director-makes-52k-stock-purchase,https://da.gd/ax8Nw
Benzinga,Funko 10% Owner Trades Company's Stock,https://benzinga.com/news/23/10/35242779/funko-10-owner-trades-companys-stock,https://da.gd/orq9Zl
Benzinga,Director at Copart Exercises Options Worth $2.29M,https://benzinga.com/news/23/10/35242776/director-at-copart-exercises-options-worth-2-29m,https://da.gd/Eo0oq
Benzinga,"AAR Chairman Acquires 10,000 Shares After Exercising Company Stock Options",https://benzinga.com/news/23/10/35242774/aar-chairman-acquires-10-000-shares-after-exercising-company-stock-options,https://da.gd/8kGMB
Benzinga,President at Donaldson Exercises Options Worth $152K,https://benzinga.com/news/23/10/35242772/president-at-donaldson-exercises-options-worth-152k,https://da.gd/Y9OU
