feed,title,long_url,short_url
Yahoo,Nvidia Will Release the Best AI Chips Faster. Buy the Stock.,https://finance.yahoo.com/m/eaa2618a-5270-33c1-8b39-248f81ebbd2e/nvidia-will-release-the-best.html?.tsrc=rss,https://da.gd/0JB6N
Yahoo,Musk’s Lead Atop World’s Rich List Widens as Economic Woes Impact LVMH’s Arnault,https://finance.yahoo.com/m/70d05e5d-5f2f-346f-a978-f4573e5cb7db/musk%E2%80%99s-lead-atop-world%E2%80%99s-rich.html?.tsrc=rss,https://da.gd/9pJFd
Yahoo,"Earnings Season Begins With Big Tech, Not the Banks",https://finance.yahoo.com/m/20209b29-6dc2-394c-841b-ecae461e0793/earnings-season-begins-with.html?.tsrc=rss,https://da.gd/sbxjh
Yahoo,Atlassian (TEAM) Buys Loom to Boost Collaboration Tool Abilities,https://finance.yahoo.com/news/atlassian-team-buys-loom-boost-135000476.html?.tsrc=rss,https://da.gd/KDDx6e
Yahoo,Man faces four years behind bars after tricking Tesla into handing him five cars he never paid for,https://finance.yahoo.com/news/man-faces-four-years-behind-132602096.html?.tsrc=rss,https://da.gd/mmMIq
