feed,title,long_url,short_url
Investing,CNHC stablecoin issuer detained by Chinese police: Report,https://www.investing.com/news/cryptocurrency-news/cnhc-stablecoin-issuer-detained-by-chinese-police-report-3094893,https://da.gd/MI589C
Investing,Bitcoin Outperforms Major Commodities Over Last 90 Days: Glassnode,https://www.investing.com/news/cryptocurrency-news/bitcoin-outperforms-major-commodities-over-last-90-days-glassnode-3094872,https://da.gd/XeJEEB
Investing,American Airlines raises Q2 profit outlook on lower fuel costs,https://www.investing.com/news/stock-market-news/american-airlines-raises-q2-profit-outlook-on-lower-fuel-costs-3094910,https://da.gd/Xssk1O
Investing,Faraday Future launches limited edition FF 91 2.0 for $309K,https://www.investing.com/news/stock-market-news/faraday-future-launches-limited-edition-ff-91-20-for-309k-432SI-3094891,https://da.gd/jx0U
Investing,EU tech chief calls for voluntary AI code of conduct within months,https://www.investing.com/news/economy/eu-tech-chief-calls-for-voluntary-ai-code-of-conduct-within-months-3094866,https://da.gd/yaPrXd
