feed,title,long_url,short_url
Investing,"XRP Is Surprisingly Stable, Here's Why",https://www.investing.com/news/cryptocurrency-news/xrp-is-surprisingly-stable-heres-why-3290783,https://da.gd/pNHXMC
Investing,"Shiba Inu (SHIB) Becoming Bullish, Ethereum (ETH) Price Screams Rally Continuation, Bitcoin (BTC) Not Giving up Market Dominance",https://www.investing.com/news/cryptocurrency-news/shiba-inu-shib-becoming-bullish-ethereum-eth-price-screams-rally-continuation-bitcoin-btc-not-giving-up-market-dominance-3290782,https://da.gd/I8WTR
Investing,"Ethereum (ETH) In Dangerous Position, Bitcoin (BTC) About to Lose $40,000, Shiba Inu (SHIB) At Local Support",https://www.investing.com/news/cryptocurrency-news/ethereum-eth-in-dangerous-position-bitcoin-btc-about-to-lose-40000-shiba-inu-shib-at-local-support-3290781,https://da.gd/3YyPOP
Investing,"Ethereum (ETH) Loses All of Its Gains, Bitcoin (BTC) Not Ready to Give up $40,000, Solana (SOL) Comeback Starts",https://www.investing.com/news/cryptocurrency-news/ethereum-eth-loses-all-of-its-gains-bitcoin-btc-not-ready-to-give-up-40000-solana-sol-comeback-starts-3290780,https://da.gd/6Mrp
Investing,"XRP Starts Moving Earlier, Solana (SOL) Already Stronger Than Everyone Else; Does Ethereum (ETH) Need More Fuel?",https://www.investing.com/news/cryptocurrency-news/xrp-starts-moving-earlier-solana-sol-already-stronger-than-everyone-else-does-ethereum-eth-need-more-fuel-3290779,https://da.gd/NqUx
