feed,title,long_url,short_url
SeekingAlpha,iShares iBonds Dec 2026 Term Corporate ETF declares monthly distribution of $0.0758,https://seekingalpha.com/news/4062147,
SeekingAlpha,Innovator S&P Investment Grade Preferred ETF declares monthly distribution of $0.0900,https://seekingalpha.com/news/4062146,
SeekingAlpha,iShares iBonds Dec 2025 Term Corporate ETF declares monthly distribution of $0.0745,https://seekingalpha.com/news/4062145,
SeekingAlpha,Capital Group U.S. Multi-Sector Income ETF declares monthly distribution of $0.1359,https://seekingalpha.com/news/4062144,
SeekingAlpha,Capital Group Short Duration Income ETF declares monthly distribution of $0.0708,https://seekingalpha.com/news/4062143,
