feed,title,long_url,short_url
SeekingAlpha,JPMorgan Ultra-Short Municipal Income ETF declares monthly distribution of $0.1451,https://seekingalpha.com/news/4146397,
SeekingAlpha,JPMorgan Nasdaq Equity Premium Income ETF declares monthly distribution of $0.5569,https://seekingalpha.com/news/4146396,
SeekingAlpha,JPMorgan Inflation Managed Bond ETF declares monthly distribution of $0.1387,https://seekingalpha.com/news/4146395,
SeekingAlpha,JPMorgan Sustainable Municipal Income ETF declares monthly distribution of $0.1572,https://seekingalpha.com/news/4146394,
SeekingAlpha,JPMorgan Limited Duration Bond ETF declares monthly distribution of $0.1936,https://seekingalpha.com/news/4146393,
