feed,title,long_url,short_url
SeekingAlpha,JPMorgan Ultra-Short Income ETF declares monthly distribution of $0.2242,https://seekingalpha.com/news/4146402,
SeekingAlpha,JPMorgan USD Emerging Markets Sovereign Bond ETF declares monthly distribution of $0.2076,https://seekingalpha.com/news/4146401,
SeekingAlpha,JPMorgan Income ETF declares monthly distribution of $0.2311,https://seekingalpha.com/news/4146400,
SeekingAlpha,JPMorgan International Bond Opportunities ETF declares monthly distribution of $0.1816,https://seekingalpha.com/news/4146399,
SeekingAlpha,JPMorgan Municipal ETF declares monthly distribution of $0.1506,https://seekingalpha.com/news/4146398,
