feed,title,long_url,short_url
Investing,California sues 23andMe over large 2023 data breach,https://www.investing.com/news/stock-market-news/california-sues-23andme-over-large-2023-data-breach-4715298,
Investing,USPS secures $10 billion deal with DHL eCommerce for deliveries,https://www.investing.com/news/stock-market-news/usps-secures-10-billion-deal-with-dhl-ecommerce-for-deliveries-93CH-4715285,
Investing,Petrobras completes talks with SBM Offshore for two production vessels,https://www.investing.com/news/stock-market-news/petrobras-completes-talks-with-sbm-offshore-for-two-production-vessels-93CH-4715278,
Investing,Morgan Stanley: GDS Holdings stock faces growth pressure from contract renewals,https://www.investing.com/news/stock-market-news/morgan-stanley-gds-holdings-stock-faces-growth-pressure-from-contract-renewals-93CH-4715276,
Investing,"Southwest Airlines sees no demand drop despite fare increases, CEO says",https://www.investing.com/news/stock-market-news/southwest-airlines-sees-no-demand-drop-despite-fare-increases-ceo-says-93CH-4715275,
