feed,title,long_url,short_url
Investors,"SentinelOne Plunges As Cybersecurity Firm's Q1 Revenue, Guidance Disappoint",https://www.investors.com/news/technology/sentinelone-stock-sentinelone-earnings-news-q12026/,
Investors,"Dell Technologies Smashes Q1 Estimates, Hikes Outlook On AI Boom",https://www.investors.com/news/technology/dell-stock-fiscal-q1-2027-earnings/,
Investors,"MongoDB Jumps After Earnings, Sales Forecast Beat Estimates",https://www.investors.com/news/technology/mongodb-stock-mdb-mongodb-earnings-q1-2026/,
Investors,"Bitcoin Slumps, But Strategy Isn't Buying. Here's Why.",https://www.investors.com/news/bitcoin-price-slumps-strategy-buying-power-strc-mstr-stock/,
Investors,"Cybersecurity Firm Okta Earnings, Revenue, Key Metric Top Estimates",https://www.investors.com/news/technology/okta-stock-okta-earnings-news-q12026/,
Investors,"Data Center Grid Company's Profit Soars 150%, But Outlook Light",https://www.investors.com/news/american-superconductor-amsc-stock-data-center-grid/,
Investors,Dollar Tree Is The Latest Retail Stock To Jump Post-Earnings. Here's Why.,https://www.investors.com/news/dollar-tree-tjx-ross-stores-retail-stocks-inflation-consumer-spending-gas-prices/,
Investors,Analysts Name Best Picks In Industrials. One Is Topping A Buy Point Today.,https://www.investors.com/news/boeing-ge-vernova-united-airlines-industrial-stocks-best-picks/,
Investors,"Costco Sales Accelerate, Analysts Lift Targets With Earnings Due",https://www.investors.com/news/costco-stock-earnings-q3-2026-retail-sales-consumer-spending-cost-stock/,
Investors,Solar Stocks To Watch As AI Drives Energy Demand,https://www.investors.com/news/first-solar-nextpower-enphase-solar-power-energy-demand-renewables/,
