feed,title,long_url,short_url
Investing,OPEC says world economy may do better in second half of year,https://www.investing.com/news/commodities-news/opec-says-world-economy-may-do-better-in-second-half-of-year-4135513,
Investing,Uber partners with China's Baidu to deploy self-driving taxis in international markets,https://www.investing.com/news/stock-market-news/uber-partners-with-chinas-baidu-to-deploy-selfdriving-taxis-in-international-markets-4135583,
Investing,Uber stock rises after Baidu partnership for self-driving taxis,https://www.investing.com/news/stock-market-news/uber-stock-rises-after-baidu-partnership-for-selfdriving-taxis-93CH-4135569,
Investing,Longevity Health stock soars after merger with THPlasma in all-stock deal,https://www.investing.com/news/stock-market-news/longevity-health-stock-soars-after-merger-with-thplasma-in-allstock-deal-93CH-4135554,
Investing,Apple invests $500 million in rare earths mine operator MP Materials,https://www.investing.com/news/stock-market-news/apple-invests-500-million-in-rare-earths-mine-operator-mp-materials-4135537,
