feed,title,long_url,short_url
FXEmpire,Sweden to send up to 10 Leopard tanks to Ukraine,https://www.fxempire.com/news/article/sweden-to-send-up-to-10-leopard-tanks-to-ukraine-1293972,https://da.gd/vFFCqi
FXEmpire,Two Fed measures see notable recession risk despite strong data,https://www.fxempire.com/news/article/two-fed-measures-see-notable-recession-risk-despite-strong-data-1293970,https://da.gd/FLfI5
FXEmpire,Mexico’s FEMSA posts 28% profit fall hurt by peso strength,https://www.fxempire.com/news/article/mexicos-femsa-posts-28-profit-fall-hurt-by-peso-strength-1293971,https://da.gd/txQDB
FXEmpire,Warner Bros Discovery shares fall as ad woes weigh,https://www.fxempire.com/news/article/warner-bros-discovery-shares-fall-as-ad-woes-weigh-1293976,https://da.gd/hM0sk9
FXEmpire,"U.S. inflation accelerates in January, consumer spending surges",https://www.fxempire.com/news/article/u-s-inflation-accelerates-in-january-consumer-spending-surges-1293973,https://da.gd/PnkIn0
