feed,title,long_url,short_url
FXEmpire,"Germany’s Thyssenkrupp, Japan’s NSK mull automotive JV",https://www.fxempire.com/news/article/germanys-thyssenkrupp-japans-nsk-mull-automotive-jv-998596,https://bit.ly/3FCWapQ
FXEmpire,"Euronav’s Q1 profit gets boost from freight rates, Ukraine war",https://www.fxempire.com/news/article/euronavs-q1-profit-gets-boost-from-freight-rates-ukraine-war-998602,https://bit.ly/38kUvZS
FXEmpire,South Africa court bars some ArcelorMittal workers from strike – union,https://www.fxempire.com/news/article/south-africa-court-bars-some-arcelormittal-workers-from-strike-union-998600,https://bit.ly/3srAfwM
FXEmpire,Norway cuts 2022 oil fund spending to $36 billion,https://www.fxempire.com/news/article/norway-cuts-2022-oil-fund-spending-to-36-billion-998599,https://bit.ly/39dRBpS
FXEmpire,Britain’s JD Sports records higher sales at start of new financial year,https://www.fxempire.com/news/article/britains-jd-sports-records-higher-sales-at-start-of-new-financial-year-998601,https://bit.ly/3M7pTtv
