feed,title,long_url,short_url
FXEmpire,RWE faces payment deadline for Russian gas at end-May – CFO,https://www.fxempire.com/news/article/rwe-faces-payment-deadline-for-russian-gas-at-end-may-cfo-998813,https://bit.ly/3PhKg9m
FXEmpire,The inflation quirk that is costing Spain billions,https://www.fxempire.com/news/article/the-inflation-quirk-that-is-costing-spain-billions-998812,https://bit.ly/3M9dhSR
FXEmpire,Deliveroo’s UK riders win collective bargaining rights under union deal,https://www.fxempire.com/news/article/deliveroos-uk-riders-win-collective-bargaining-rights-under-union-deal-998822,https://bit.ly/3N8cH7P
FXEmpire,Palestinian president says Israel responsible for killing al Jazeera reporter,https://www.fxempire.com/news/article/palestinian-president-says-israel-responsible-for-killing-al-jazeera-reporter-998823,https://bit.ly/3l3RMH2
FXEmpire,"Sweden to take Finland NATO stance into account, foreign minister says",https://www.fxempire.com/news/article/sweden-to-take-finland-nato-stance-into-account-foreign-minister-says-998824,https://bit.ly/3MaiTMG
