feed,title,long_url,short_url
SeekingAlpha,Fisker aims to start production of second model at Foxconn factory in 2024,https://seekingalpha.com/news/3837553,
SeekingAlpha,XP announces new cryptocurrency trading platform XTAGE,https://seekingalpha.com/news/3837552,
SeekingAlpha,"Tapestry Non-GAAP EPS of $0.51 beats by $0.10, revenue of $1.44B beats by $10M",https://seekingalpha.com/news/3837551,
SeekingAlpha,"US Foods Non-GAAP EPS of $0.36 beats by $0.02, revenue of $7.8B in-line",https://seekingalpha.com/news/3837550,
SeekingAlpha,"Primo Water Non-GAAP EPS of $0.09, revenue of $526M; reaffirms FY22 guidance",https://seekingalpha.com/news/3837549,
