feed,title,long_url,short_url
SeekingAlpha,PDS Biotechnology GAAP EPS of -$0.30 beats by $0.06,https://seekingalpha.com/news/4106418,
SeekingAlpha,Origin Agritech reports 1H results,https://seekingalpha.com/news/4106417,
SeekingAlpha,"Fonar GAAP EPS of $0.27, revenue of $25.72M",https://seekingalpha.com/news/4106415,
SeekingAlpha,Bread Financial posts 11.4% rise in April net principal losses,https://seekingalpha.com/news/4106414,
SeekingAlpha,Moving iMage Technologies reports Q3 Non-GAAP EPS of -$0.06,https://seekingalpha.com/news/4106413,
