feed,title,long_url,short_url
SeekingAlpha,Will USD Be Bought After Being Sold On Expectations Of A Softer CPI?,https://seekingalpha.com/article/4693422,
SeekingAlpha,Gold Is Poised For A Major Move Higher As The Inflationary Cycle Persists,https://seekingalpha.com/article/4693401,
SeekingAlpha,Sunnova: Strong Growth But Needs More Scaling To Become Profitable,https://seekingalpha.com/article/4693400,
SeekingAlpha,Zscaler: Market Pessimism Won't Last Forever (Rating Upgrade),https://seekingalpha.com/article/4693384,
SeekingAlpha,Alibaba: 'Dead Money' Continues To Disappoint (Technical Analysis),https://seekingalpha.com/article/4693399,
SeekingAlpha,Aristotle Capital Small/Mid Cap Equity Q1 2024 Commentary,https://seekingalpha.com/article/4693415,
SeekingAlpha,Q1 2024 U.S. Retail Preview: Sales Picked Up,https://seekingalpha.com/article/4693421,
