feed,title,long_url,short_url
SeekingAlpha,"Cisco Earnings Summary: Earnings, revenue beat; issues strong guidance",https://seekingalpha.com/news/4106948,
SeekingAlpha,The INX Digital Company reports Q1 results,https://seekingalpha.com/news/4106954,
SeekingAlpha,"David Tepper's Appaloosa adds Adobe, Boeing, exits GM among Q1 buys, sells",https://seekingalpha.com/news/4106952,
SeekingAlpha,Rekor Systems reports Q1 results,https://seekingalpha.com/news/4106953,
SeekingAlpha,Seritage: Only Berkshire Hathaway Made Money On This,https://seekingalpha.com/article/4693610,
