feed,title,long_url,short_url
SeekingAlpha,"cbdMD GAAP EPS of -$1.35, revenue of $4.4M",https://seekingalpha.com/news/4107038,
SeekingAlpha,"Hawkins GAAP EPS of $0.66, revenue of $223M",https://seekingalpha.com/news/4107037,
SeekingAlpha,"Robinhood Markets options trading volume rises in April; equities, crypto decline",https://seekingalpha.com/news/4107036,
SeekingAlpha,"Shelf Drilling EPS of $0.02, revenue of $254.7M",https://seekingalpha.com/news/4107035,
SeekingAlpha,NeuroMetrix GAAP EPS of -$1.67,https://seekingalpha.com/news/4107034,
SeekingAlpha,"The Glimpse Group GAAP EPS of -$0.09, revenue of $1.9M",https://seekingalpha.com/news/4107033,
