feed,title,long_url,short_url
Investors,"Tesla Stock Slumps After Monthly Sales Record In China, Reports Of Production Cut",https://www.investors.com/news/tesla-stock-drops-after-sales-record-in-china-prompt-production-cut/,https://bit.ly/3iG216J
Investors,"Saia Stock May Be In Play; Profit, Sales Growth Ranged Up To 113% Over Past Year",https://www.investors.com/news/stocks-showing-improved-relative-strength-saia/,https://bit.ly/3gVPvQ1
Investors,Imax Stock Sees Relative Strength Rating Jump To 83,https://www.investors.com/news/imax-stock-sees-relative-strength-rating-jump-to-83/,https://bit.ly/3F2OHAE
Investors,"FTX Wreck Still On Fire: ""It's Stolen Customer Money ... Plain And Simple""",https://www.investors.com/news/bankman-fried-used-stolen-customer-money-experts-say/,https://bit.ly/3Fv9ApM
Investors,Dave & Buster's Stock Sees Rising Relative Strength Upgrade,https://www.investors.com/news/dave-busters-stock-shows-rising-relative-strength-upgrade/,https://bit.ly/3Vz4tdE
Investors,Corsair Gaming Stock Sees IBD RS Rating Rise To 77,https://www.investors.com/news/technology/corsair-gaming-stock-sees-ibd-rs-rating-rise-to-77/,https://bit.ly/3FtDCdl
