feed,title,long_url,short_url
Yahoo,Billionaire George Soros Ends His Exposure to Elon Musk,https://finance.yahoo.com/m/ea0f0cb3-bea2-37c5-8335-72ec62d0f376/billionaire-george-soros-ends.html?.tsrc=rss,https://da.gd/SQiV9
Yahoo,Rivian Stock May Now Be a Buy -- This Important Number Shows Why,https://finance.yahoo.com/m/241c5c41-4165-3ce2-bec6-6e20c20cfda9/rivian-stock-may-now-be-a-buy.html?.tsrc=rss,https://da.gd/GJtxfM
Yahoo,Elon Musk Responds to Speculation He May Step Down as Tesla CEO,https://finance.yahoo.com/m/db6a46ab-b6ef-309f-b3b0-7e63190b21df/elon-musk-responds-to.html?.tsrc=rss,https://da.gd/feRI
Yahoo,Tesla owners sue claiming software update killed EV battery life,https://finance.yahoo.com/news/tesla-owners-sue-claiming-software-114653620.html?.tsrc=rss,https://da.gd/Wp4p
Yahoo,"Google, Meta and other tech companies are cutting back on a prized Silicon Valley tradition: summer internships",https://finance.yahoo.com/news/google-meta-other-tech-companies-113500784.html?.tsrc=rss,https://da.gd/mac8lb
