feed,title,long_url,short_url
SeekingAlpha,"Amdocs EPS beats by $0.02, beats on revenue",https://seekingalpha.com/news/3657436,
SeekingAlpha,"Amgen EPS beats by $0.47, beats on revenue",https://seekingalpha.com/news/3657435,
SeekingAlpha,"FireEye EPS beats by $0.02, beats on revenue",https://seekingalpha.com/news/3657434,
SeekingAlpha,"Stocks rally, boosted by renewed stimulus enthusiasm",https://seekingalpha.com/news/3657427,
SeekingAlpha,"Dow ends 495 points higher as Biden, Republicans 'hopeful' for stimulus deal",https://seekingalpha.com/news/3657432,
SeekingAlpha,GameStop And SKEW,https://seekingalpha.com/article/4402831,
