feed,title,long_url,short_url
SeekingAlpha,Isuzu Motors FY GAAP EPS of ¥229.92,https://seekingalpha.com/news/4105658,
SeekingAlpha,Home Depot slips after warning of the delayed start to the critical spring selling season,https://seekingalpha.com/news/4105661,
SeekingAlpha,Cellectar Biosciences GAAP EPS of -$0.74 misses by $0.18,https://seekingalpha.com/news/4105660,
SeekingAlpha,"CEZ, a. s. reports Q1 results",https://seekingalpha.com/news/4105659,
SeekingAlpha,Keyera GAAP EPS of C$0.31; updates FY24 outlook,https://seekingalpha.com/news/4105657,
SeekingAlpha,INCO: Compelling Growth Still Evident Despite Lofty Valuations,https://seekingalpha.com/article/4693002,
SeekingAlpha,"Medtronic: Looking Ahead To FY 2025 EPS Growth, Shareholder Friendly Actions",https://seekingalpha.com/article/4693001,
SeekingAlpha,HireQuest: Declining Revenue Keeps Me Waiting On The Sidelines,https://seekingalpha.com/article/4693000,
