feed,title,long_url,short_url
SeekingAlpha,"Cemtrex GAAP EPS of -$1.46, revenue of $17.16M",https://seekingalpha.com/news/4106211,
SeekingAlpha,Superior Plus reports Q1 results,https://seekingalpha.com/news/4106210,
SeekingAlpha,Dream Unlimited reports Q1 results,https://seekingalpha.com/news/4106209,
SeekingAlpha,"Prestige Consumer Healthcare Non-GAAP EPS of $1.02 misses by $0.12, revenue of $276.99M misses by $10.37M",https://seekingalpha.com/news/4106208,
SeekingAlpha,"AgeX Therapeutics GAAP EPS of -$3.38, revenue of $0.05M",https://seekingalpha.com/news/4106207,
SeekingAlpha,"SilverCrest Metals GAAP EPS of $0.23 beats by $0.13, revenue of $63.6M misses by $0.34M",https://seekingalpha.com/news/4106206,
SeekingAlpha,"TFF Pharmaceuticals GAAP EPS of -$2.40, revenue of $203.27M",https://seekingalpha.com/news/4106205,
