feed,title,long_url,short_url
SeekingAlpha,48North Cannabis reports FY results,https://seekingalpha.com/news/3629655,
SeekingAlpha,Erste Group Bank AG reports Q3 results,https://seekingalpha.com/news/3629654,
SeekingAlpha,Advance Auto Parts tipped by UBS for earning beat next week,https://seekingalpha.com/news/3629653,
SeekingAlpha,"AT&T closes sale of Puerto Rico, USVI operations for $2B in cash",https://seekingalpha.com/news/3629652,
SeekingAlpha,"Alico purchases 3,280 gross citrus acres for $16.45M",https://seekingalpha.com/news/3629650,
