feed,title,long_url,short_url
Benzinga,Global Automotive Head-Up Display (HUD) Market Report 2021: Increasing Adoption Rate of Advanced Technologies by OEMs,https://benzinga.com/pressreleases/21/02/g19790361/global-automotive-head-up-display-hud-market-report-2021-increasing-adoption-rate-of-advanced-tech,
Benzinga,"Global Defibrillator (ICD, External Defibrillator) Market Report, 2021-2028: Legislative Reforms, Presence of Integrated Technology, Increasing Incidences of SCA in Younger Population - ResearchAndMarkets.com",https://benzinga.com/pressreleases/21/02/b19790356/global-defibrillator-icd-external-defibrillator-market-report-2021-2028-legislative-reforms-presen,
Benzinga,"Non-Invasive Cardiac Output Monitoring Device Market Forecast to 2027 - COVID-19 Impact and Global Analysis By Device, Indication and End User and Geography",https://benzinga.com/pressreleases/21/02/g19790343/non-invasive-cardiac-output-monitoring-device-market-forecast-to-2027-covid-19-impact-and-global-a,
Benzinga,Global Screw Compressors Market Report 2021: Historical Data 2016-2019 & Forecasts 2021-2026 with 2020 as the Base Year,https://benzinga.com/pressreleases/21/02/g19790342/global-screw-compressors-market-report-2021-historical-data-2016-2019-forecasts-2021-2026-with-202,
Benzinga,500.com Limited Receives 356.04342 Bitcoins and Announces Closing of Private Placement,https://benzinga.com/pressreleases/21/02/n19790341/500-com-limited-receives-356-04342-bitcoins-and-announces-closing-of-private-placement,
