feed,title,long_url,short_url
SeekingAlpha,"Holly Energy Partners EPS beats by $0.06, beats on revenue",https://seekingalpha.com/news/3664738,
SeekingAlpha,"Westlake Chemical Partners EPS misses by $0.08, misses on revenue",https://seekingalpha.com/news/3664737,
SeekingAlpha,"Westlake Chemical EPS beats by $0.22, beats on revenue",https://seekingalpha.com/news/3664736,
SeekingAlpha,"EnPro EPS beats by $0.73, beats on revenue",https://seekingalpha.com/news/3664735,
SeekingAlpha,"Astronics EPS misses by $0.53, beats on revenue",https://seekingalpha.com/news/3664734,
SeekingAlpha,"Equitrans Midstream EPS misses by $0.06, misses on revenue",https://seekingalpha.com/news/3664733,
SeekingAlpha,"Thomson Reuters EPS beats by $0.08, revenue in-line",https://seekingalpha.com/news/3664732,
