feed,title,long_url,short_url
SeekingAlpha,We Are Buying Gold Miners Hand Over Fist - Part 2,https://seekingalpha.com/article/4408179,
SeekingAlpha,"Gas Keeps The Economy Moving, You Get 11% Yield: Global Partners",https://seekingalpha.com/article/4407991,
SeekingAlpha,Ant Group IPO - Strong Business Should Send Alibaba Stock Higher,https://seekingalpha.com/article/4408144,
SeekingAlpha,"TripAdvisor: Significant Growth Prospects, But Market Too Optimistic Right Now",https://seekingalpha.com/article/4408166,
SeekingAlpha,Biogen And The Politics Of Alzheimer's Disease,https://seekingalpha.com/article/4408165,
