feed,title,long_url,short_url
Benzinga,"Aehr Test Systems to Announce Fiscal 2020 Fourth Quarter and Full Year Financial Results on July 16, 2020",https://www.benzinga.com/pressreleases/20/07/g16559399/aehr-test-systems-to-announce-fiscal-2020-fourth-quarter-and-full-year-financial-results-on-july-1,https://j.mp/3gImQIn
Benzinga,"Safe Bulkers, Inc. Declares Quarterly Dividend on its 8.00% Series C Cumulative Redeemable Perpetual Preferred Shares; 8.00% Series D Cumulative Redeemable Perpetual Preferred Shares",https://www.benzinga.com/pressreleases/20/07/g16559395/safe-bulkers-inc-declares-quarterly-dividend-on-its-8-00-series-c-cumulative-redeemable-perpetual-,https://j.mp/38Bf2oW
Benzinga,"TTM Technologies, Inc. To Conduct Second Quarter 2020 Conference Call July 29, 2020",https://www.benzinga.com/pressreleases/20/07/g16559394/ttm-technologies-inc-to-conduct-second-quarter-2020-conference-call-july-29-2020,https://j.mp/31XZQRx
Benzinga,CubeSmart Announces the Date of Its Second Quarter 2020 Earnings Release and Conference Call,https://www.benzinga.com/pressreleases/20/07/g16559393/cubesmart-announces-the-date-of-its-second-quarter-2020-earnings-release-and-conference-call,https://j.mp/2BHwR9V
Benzinga,Lam Research Corporation Announces June 2020 Quarter Financial Conference Call,https://www.benzinga.com/pressreleases/20/07/g16559392/lam-research-corporation-announces-june-2020-quarter-financial-conference-call,https://j.mp/2DofhIp
