feed,title,long_url,short_url
Investing,"Buterin: Terra should protect the smallholders, not the whales",https://investing.com/news/-2826131,
Investing,Cryptoverse: Stablecoins wend wobbly way into the unknown,https://investing.com/news/-2826105,
Investing,UK competition watchdog to probe LSEG takeover of Quantile,https://investing.com/news/-2826137,
Investing,Imperial Brands reports flat first-half sales,https://investing.com/news/-2826133,
Investing,European Stock Futures Higher; Eurozone Growth Data Due,https://investing.com/news/-2826124,
