feed,title,long_url,short_url
SeekingAlpha,"Trimble Non-GAAP EPS of $0.64 beats by $0.02, revenue of $953.4M beats by $40.86M",https://seekingalpha.com/news/4099458,
SeekingAlpha,Scandinavian Tobacco Group A/S reports Non-GAAP EPS DKK 1.8,https://seekingalpha.com/news/4099457,
SeekingAlpha,Adient Non-GAAP EPS of $0.54 beats by $0.10; updates FY24 outlook,https://seekingalpha.com/news/4099456,
SeekingAlpha,"Magellan Aerospace Adjusted EBITDA of C$0.38, revenue of C$235.24M",https://seekingalpha.com/news/4099455,
SeekingAlpha,ALK-Abelló A/S reports Q1 results,https://seekingalpha.com/news/4099454,
SeekingAlpha,"Martinrea Non-GAAP EPS of C$0.62, revenue of C$1.32B",https://seekingalpha.com/news/4099453,
SeekingAlpha,Forrester Research: Margin Execution Would Drive Outperformance,https://seekingalpha.com/article/4688987,
