feed,title,long_url,short_url
SeekingAlpha,Alpine Banks of Colorado reports Q1 results,https://seekingalpha.com/news/4099763,
SeekingAlpha,U.S. government gives EV makers two year reprieve on FEOC graphite for batteries,https://seekingalpha.com/news/4099762,
SeekingAlpha,Lucid Q1 results preview: What to expect,https://seekingalpha.com/news/4099761,
SeekingAlpha,Barrick Gold Q1 Earnings: Don't Miss The Forest For The Trees,https://seekingalpha.com/article/4689055,
SeekingAlpha,Implementation Shortfalls Hamstring Factor Strategies,https://seekingalpha.com/article/4689090,
