feed,title,long_url,short_url
FXEmpire,"Palestinians clash with Israeli police at Jerusalem holy site, 31 injured",https://www.fxempire.com/news/article/palestinians-clash-with-israeli-police-at-jerusalem-holy-site-31-injured-976052,https://bit.ly/38dgXE7
FXEmpire,"Crime checks at some upstart banks too weak, says UK watchdog",https://www.fxempire.com/news/article/crime-checks-at-some-upstart-banks-too-weak-says-uk-watchdog-976056,https://bit.ly/3v6WDxb
FXEmpire,"Cooling demand, supply disruptions slow German manufacturing in April -PMI",https://www.fxempire.com/news/article/cooling-demand-supply-disruptions-slow-german-manufacturing-in-april-pmi-976058,https://bit.ly/3K6CRpu
FXEmpire,"Transport plane crashes in south Ukraine on technical flight, casualties reported – local authorities",https://www.fxempire.com/news/article/transport-plane-crashes-in-south-ukraine-on-technical-flight-casualties-reported-local-authorities-976054,https://bit.ly/38clu9E
FXEmpire,"Sweden’s SKF to exit Russia, take 500 million SEK write-down",https://www.fxempire.com/news/article/swedens-skf-to-exit-russia-take-500-million-sek-write-down-976057,https://bit.ly/36GTFWM
