feed,title,long_url,short_url
SeekingAlpha,Charge Enterprises announces private offering,https://seekingalpha.com/news/3825697,
SeekingAlpha,American Express Q1 earnings reflect rebound in travel & entertainment spending,https://seekingalpha.com/news/3825696,
SeekingAlpha,Inside Volatility Newsletter: The Certainty Of Volatility,https://seekingalpha.com/article/4502915,
SeekingAlpha,Prologis: A Cash Cow That's Built-To-Last,https://seekingalpha.com/article/4502821,
SeekingAlpha,American Airlines Earnings Review: I'm No Longer A Bear,https://seekingalpha.com/article/4502871,
SeekingAlpha,MLP Monthly Report: April 2022,https://seekingalpha.com/article/4502914,
