feed,title,long_url,short_url
Investing,Surging Bond Yields Threaten to Derail the Stock Market Rally,https://www.investing.com/analysis/surging-bond-yields-threaten-to-derail-the-stock-rally-200680458,
Investing,Iran Ceasefire Trade: 3 Energy Stocks to Own if Oil Falls to $80,https://www.investing.com/analysis/iran-ceasefire-trade-3-energy-stocks-to-own-if-oil-falls-to-80-200680501,
Investing,Why is Seagate Technology stock sliding today?,https://www.investing.com/news/stock-market-news/why-is-seagate-technology-stock-sliding-today-93CH-4696423,
Investing,Poland stocks higher at close of trade; WIG30 up 1.66%,https://www.investing.com/news/stock-market-news/poland-stocks-higher-at-close-of-trade-wig30-up-166-4696418,
Investing,Uber raises stake in Germany’s Delivery Hero,https://www.investing.com/news/stock-market-news/uber-raises-stake-in-germanys-delivery-hero-4696401,
Investing,Turkey stocks lower at close of trade; BIST 100 down 2.35%,https://www.investing.com/news/stock-market-news/turkey-stocks-lower-at-close-of-trade-bist-100-down-235-4696409,
Investing,Denmark stocks lower at close of trade; OMX Copenhagen 20 down 1.54%,https://www.investing.com/news/stock-market-news/denmark-stocks-lower-at-close-of-trade-omx-copenhagen-20-down-154-4696407,
Investing,"Battery storage firms eye AI demand but face grid, supply hurdles",https://www.investing.com/news/stock-market-news/battery-storage-firms-eye-ai-demand-but-face-grid-supply-hurdles-4696402,
