feed,title,long_url,short_url
SeekingAlpha,Jack Henry & Associates reiterates FY EPS outlook,https://seekingalpha.com/news/3879358,
SeekingAlpha,Ollie's Bargain Outlet falls after saying it will hold the line on pricing,https://seekingalpha.com/news/3879357,
SeekingAlpha,Tribe Property Technologies appoints Drew Keddy as COO,https://seekingalpha.com/news/3879353,
SeekingAlpha,Alibaba: SEC Makes A Move,https://seekingalpha.com/article/4538377,
SeekingAlpha,Warner Bros. Discovery Needs Long-Term Investors,https://seekingalpha.com/article/4538379,
