feed,title,long_url,short_url
Benzinga,Suncor Energy Whale Trades For September 01,https://benzinga.com/markets/options/22/09/28721406/suncor-energy-whale-trades-for-september-01,https://bit.ly/3Rbilsf
Benzinga,Twilio Whale Trades For September 01,https://benzinga.com/markets/options/22/09/28721401/twilio-whale-trades-for-september-01,https://bit.ly/3AFSSjJ
Benzinga,ASML Holding Whale Trades Spotted,https://benzinga.com/markets/options/22/09/28721387/asml-holding-whale-trades-spotted,https://bit.ly/3eb0CTg
Benzinga,Anonymous Bitcoin Whale Just Moved $40M Worth Of BTC Off Gemini,https://benzinga.com/markets/cryptocurrency/22/09/28721376/anonymous-bitcoin-whale-just-moved-40m-worth-of-btc-off-gemini,https://bit.ly/3RrVk43
Benzinga,Anonymous Bitcoin Whale Just Moved $61M Worth Of BTC Off Coinbase,https://benzinga.com/markets/cryptocurrency/22/09/28721370/anonymous-bitcoin-whale-just-moved-61m-worth-of-btc-off-coinbase,https://bit.ly/3RaS7Ge
Benzinga,Anonymous Bitcoin Whale Just Moved $62M Worth Of BTC Off Coinbase,https://benzinga.com/markets/cryptocurrency/22/09/28721369/anonymous-bitcoin-whale-just-moved-62m-worth-of-btc-off-coinbase,https://bit.ly/3RocEa6
Benzinga,Anonymous Crypto Wallet Moves $79M Worth Of Bitcoin Onto Gemini,https://benzinga.com/markets/cryptocurrency/22/09/28721365/anonymous-crypto-wallet-moves-79m-worth-of-bitcoin-onto-gemini,https://bit.ly/3wPFGrj
Benzinga,$89M In Ethereum Was Just Transferred Onto Binance,https://benzinga.com/markets/cryptocurrency/22/09/28721362/89m-in-ethereum-was-just-transferred-onto-binance,https://bit.ly/3Rg4Mbi
Benzinga,"Ethereum Whale Moves 86,000 ETH Off Gemini",https://benzinga.com/markets/cryptocurrency/22/09/28721359/ethereum-whale-moves-86-000-eth-off-gemini,https://bit.ly/3TxPZds
