feed,title,long_url,short_url
SeekingAlpha,New Residential Investment Q4 Earnings Preview,https://seekingalpha.com/news/3659593,
SeekingAlpha,"China-based Baosheng Media Group Holdings opened at $8.25, above the IPO price",https://seekingalpha.com/news/3659591,
SeekingAlpha,WESCO Q4 2020 Earnings Preview,https://seekingalpha.com/news/3659590,
SeekingAlpha,Aramark  Q1 2021 Earnings Preview,https://seekingalpha.com/news/3659589,
SeekingAlpha,MacroGenics: A Look At The DART Platform,https://seekingalpha.com/article/4404329,
