feed,title,long_url,short_url
SeekingAlpha,"Hilton Worldwide continues recovery, guides for unit growth in 2022",https://seekingalpha.com/news/3800615,
SeekingAlpha,Metropole Television GAAP EPS of $280.80,https://seekingalpha.com/news/3800614,
SeekingAlpha,MJ Harvest to purchase cannabis and extraction licenses and Colorado operations assets,https://seekingalpha.com/news/3800613,
SeekingAlpha,Similarweb reports Q4 results,https://seekingalpha.com/news/3800612,
SeekingAlpha,"PCN: After Some Thought, I'm Still Not A Buyer",https://seekingalpha.com/article/4487361,
