feed,title,long_url,short_url
InsiderMonkey,Jim Cramer on The Home Depot Inc. (HD): ‘We Like Home Depot’s Exposure To Professional Customers’,https://insidermonkey.com/blog/--1362427,
InsiderMonkey,7 Cheap Reliable Stocks to Invest In,https://insidermonkey.com/blog/--1360879,
InsiderMonkey,Jim Cramer Says Constellation Energy Corporation (CEG) ‘Plans to Restart Three Mile Island And Send Power To Microsoft’,https://insidermonkey.com/blog/--1362422,
InsiderMonkey,Jim Cramer on Costco Wholesale Corporation (COST): ‘We Can’t Argue Against The Stock Being Expensive But It Always Is’,https://insidermonkey.com/blog/--1362416,
InsiderMonkey,Jim Cramer on Starbucks Corporation (SBUX): ‘The Analysts Don’t Seem To Be Believers In New CEO Brian Niccol’,https://insidermonkey.com/blog/--1362410,
InsiderMonkey,Jim Cramer on NIKE Inc. (NKE): ‘The Analysts See Fiscal 2025 First-Quarter Earnings Per Share Below Street Estimates’,https://insidermonkey.com/blog/--1362396,
InsiderMonkey,Jim Cramer on Lowe’s Companies Inc. (LOW): ‘Oppenheimer Sees Clearer Skies Ahead For Home Improvement’,https://insidermonkey.com/blog/--1362392,
InsiderMonkey,Jim Cramer on Pinterest Inc. (PINS): ‘The Analysts See Potential From Ads’,https://insidermonkey.com/blog/--1362384,
InsiderMonkey,Archer Aviation Inc. (ACHR): Worst 52-Week Low Stock to Buy Now,https://insidermonkey.com/blog/--1359559,
InsiderMonkey,Cerence Inc. (CRNC): Worst 52-Week Low Stock to Buy Now,https://insidermonkey.com/blog/--1359565,
InsiderMonkey,"Coherus BioSciences, Inc. (CHRS): Worst 52-Week Low Stock to Buy Now",https://insidermonkey.com/blog/--1359570,
InsiderMonkey,Dana Incorporated (DAN): A Top Pick in Carl Icahn’s Stock Portfolio,https://insidermonkey.com/blog/--1362302,
InsiderMonkey,Bausch Health Companies Inc. (BHC): A Top Pick in Carl Icahn’s Stock Portfolio,https://insidermonkey.com/blog/--1362306,
InsiderMonkey,8 Best Long Term Tech Stocks To Invest In Now,https://insidermonkey.com/blog/--1362307,
InsiderMonkey,8 Best Value Stocks to Invest In According To Warren Buffett,https://insidermonkey.com/blog/--1360082,
InsiderMonkey,"CVR Partners, LP (UAN): A Top Pick in Carl Icahn’s Stock Portfolio",https://insidermonkey.com/blog/--1362311,
InsiderMonkey,International Flavors & Fragrances Inc. (IFF): A Top Pick in Carl Icahn’s Stock Portfolio,https://insidermonkey.com/blog/--1362315,
InsiderMonkey,"Southwest Gas Holdings, Inc. (SWX): A Top Pick in Carl Icahn’s Stock Portfolio",https://insidermonkey.com/blog/--1362320,
InsiderMonkey,CVR Energy Inc. (CVI): A Top Pick in Carl Icahn’s Stock Portfolio,https://insidermonkey.com/blog/--1362323,
