feed,title,long_url,short_url
Investing,Blast Royale to Launch $NOOB Low FDV Community Offering (LCO) for First Gaming x Meme Token,https://www.investing.com/news/cryptocurrency-news/blast-royale-to-launch-noob-low-fdv-community-offering-lco-for-first-gaming-x-meme-token-3691407,https://da.gd/Z3Fotz
Investing,Epic Bitcoin Prediction Issued by OG Bitcoiner Erik Voorhees,https://www.investing.com/news/cryptocurrency-news/epic-bitcoin-prediction-issued-by-og-bitcoiner-erik-voorhees-3691406,https://da.gd/FShSr
Investing,"Leonardo DRS earnings beat by $0.02, revenue topped estimates",https://www.investing.com/news/stock-market-news/leonardo-drs-earnings-beat-by-002-revenue-topped-estimates-3691429,https://da.gd/eq4Z
Investing,"Alphabet could remain choppy in near term, analysts warn, despite strong earnings",https://www.investing.com/news/stock-market-news/alphabet-could-remain-choppy-in-near-term-analysts-warn-despite-strong-earnings-3691417,https://da.gd/SsrIl
Investing,"Pending home sales surge, beating expectations and bolstering USD",https://www.investing.com/news/economic-indicators/pending-home-sales-surge-beating-expectations-and-bolstering-usd-93CH-3691413,https://da.gd/OCvOEL
