feed,title,long_url,short_url
Investing,"Bybit WSOT 2024 Final Showdown Livestream: Winners Took Home Grand Prizes, Insights from Top Traders, and 10,000 USDT in Airdrop",https://www.investing.com/news/cryptocurrency-news/bybit-wsot-2024-final-showdown-livestream-winners-took-home-grand-prizes-insights-from-top-traders-and-10000-usdt-in-airdrop-3692050,https://da.gd/TuCmN
Investing,Earnings call: DaVita maintains guidance despite headwinds and hurricanes,https://www.investing.com/news/stock-market-news/earnings-call-davita-maintains-guidance-despite-headwinds-and-hurricanes-93CH-3692073,https://da.gd/5WDIa
Investing,Earnings call: Safehold reports steady growth amid market fluctuations,https://www.investing.com/news/stock-market-news/earnings-call-safehold-reports-steady-growth-amid-market-fluctuations-93CH-3692066,https://da.gd/Ce2B
Investing,Earnings call: Royal Caribbean saw a net yield growth of 7.9% year-over-year,https://www.investing.com/news/stock-market-news/earnings-call-royal-caribbean-saw-a-net-yield-growth-of-79-yearoveryear-93CH-3692065,https://da.gd/vtJHE
Investing,"Amazon workers 'appalled' by AWS CEO’s return to office remarks, urge policy reversal",https://www.investing.com/news/stock-market-news/amazon-workers-appalled-by-aws-ceos-return-to-office-remarks-urge-policy-reversal-3692064,https://da.gd/Xubu8U
Investing,"SkyBridge's Scaramucci says US will solve debt crisis, bitcoin to triple by 2026",https://www.investing.com/news/stock-market-news/skybridges-scaramucci-says-us-will-solve-debt-crisis-bitcoin-to-triple-by-2026-3692063,https://da.gd/8roA7
Investing,Earnings call: Douglas Dynamics Q3 results show mixed performance,https://www.investing.com/news/stock-market-news/earnings-call-douglas-dynamics-q3-results-show-mixed-performance-93CH-3692062,https://da.gd/gvrsY4
Investing,Earnings call: PROS Holdings Q3 2024 results surpass expectations,https://www.investing.com/news/stock-market-news/earnings-call-pros-holdings-q3-2024-results-surpass-expectations-93CH-3692061,https://da.gd/DL18KG
Investing,Earnings call: Allison Transmission Holdings Inc. reported a significant YoY increase in net sales,https://www.investing.com/news/stock-market-news/earnings-call-allison-transmission-holdings-inc-reported-a-significant-yoy-increase-in-net-sales-93CH-3692057,https://da.gd/HYvX
Investing,Earnings call: Eagle Materials reports solid Q2 with record revenue,https://www.investing.com/news/stock-market-news/earnings-call-eagle-materials-reports-solid-q2-with-record-revenue-93CH-3692056,https://da.gd/jAZxF
Investing,"Earnings call: PJT Partners reports strong Q3 growth, optimistic about 2025",https://www.investing.com/news/stock-market-news/earnings-call-pjt-partners-reports-strong-q3-growth-optimistic-about-2025-93CH-3692054,https://da.gd/1YsXo
