feed,title,long_url,short_url
Benzinga,Why RR Donnelley's Stock Is Trading Higher Today,https://www.benzinga.com/m-a/20/09/17511747/why-rr-donnelleys-stock-is-trading-higher-today,https://j.mp/2FzGpph
Benzinga,Summit to Participate in Piper Sandler Virtual D.C. Community Bank Field Trip,https://www.benzinga.com/pressreleases/20/09/g17512974/summit-to-participate-in-piper-sandler-virtual-d-c-community-bank-field-trip,https://j.mp/3ixv3QZ
Benzinga,Lordstown Enters A Growing EV Pickup Market,https://www.benzinga.com/news/20/09/17511838/lordstown-enters-a-growing-ev-pickup-market,https://j.mp/3mpo92s
Benzinga,Why Nano X Imaging Is Trading Lower Today,https://www.benzinga.com/news/20/09/17511352/why-nano-x-imaging-is-trading-lower-today,https://j.mp/2E6PsgK
Benzinga,"Accumen Launches MyBloodHealth®, a Virtual Anemia Management Software Solution for the Perioperative Patient",https://www.benzinga.com/pressreleases/20/09/g17512815/accumen-launches-mybloodhealth-a-virtual-anemia-management-software-solution-for-the-perioperative,https://j.mp/3c1AGV9
Benzinga,Waste Management wins technology award for innovative environmental platform,https://www.benzinga.com/pressreleases/20/09/g17512812/waste-management-wins-technology-award-for-innovative-environmental-platform,https://j.mp/3hzJhze
Benzinga,Waste Management wins technology award for innovative environmental platform,https://www.benzinga.com/pressreleases/20/09/g17512807/waste-management-wins-technology-award-for-innovative-environmental-platform,https://j.mp/2ZH4ZLF
Benzinga,AlgaEnergy and Concentric Ag Enter into Distribution and Product Development Agreements,https://www.benzinga.com/pressreleases/20/09/n17512823/algaenergy-and-concentric-ag-enter-into-distribution-and-product-development-agreements,https://j.mp/3mor4sd
Benzinga,Nextdoor and We Are All Human Come Together to Support Hispanic-Owned Local Businesses During Hispanic Heritage Month,https://www.benzinga.com/pressreleases/20/09/n17512802/nextdoor-and-we-are-all-human-come-together-to-support-hispanic-owned-local-businesses-during-hisp,https://j.mp/3koHwa9
