feed,title,long_url,short_url
SeekingAlpha,"Becton, Dickinson EPS beats by $0.30, beats on revenue; 2021 outlook raised",https://seekingalpha.com/news/3725773,
SeekingAlpha,"Iron Mountain FFO beats by $0.05, beats on revenue; raises midpoint of 2021 guidance",https://seekingalpha.com/news/3725771,
SeekingAlpha,"Lexington Realty Trust FFO misses by $0.01, beats on revenue",https://seekingalpha.com/news/3725772,
SeekingAlpha,Targa Resources beats on revenue; issues guidance,https://seekingalpha.com/news/3725770,
SeekingAlpha,"Global Net Lease FFO beats by $0.03, beats on revenue",https://seekingalpha.com/news/3725769,
SeekingAlpha,"Amarin EPS beats by $0.06, beats on revenue",https://seekingalpha.com/news/3725768,
SeekingAlpha,"CIGNA EPS beats by $0.27, beats on revenue",https://seekingalpha.com/news/3725767,
SeekingAlpha,"Air-France KLM: Betting On Greater Fools, Also Known As French And Dutch Governments",https://seekingalpha.com/article/4445278,
