feed,title,long_url,short_url
Benzinga,Cryptocurrency Celestia's Price Increased More Than 4% Within 24 hours,https://benzinga.com/insights/cryptocurrency/24/01/36831212/cryptocurrency-celestias-price-increased-more-than-4-within-24-hours,https://da.gd/aXof
Benzinga,'We Stay The Course On Meta And Amazon': Analysts Preview Tech Earnings,https://benzinga.com/analyst-ratings/analyst-color/24/01/36831197/we-stay-the-course-on-meta-and-amazon-analysts-preview-tech-earnings,https://da.gd/MhukD8
Benzinga,Cryptocurrency Aptos's Price Increased More Than 5% Within 24 hours,https://benzinga.com/insights/cryptocurrency/24/01/36831195/cryptocurrency-aptoss-price-increased-more-than-5-within-24-hours,https://da.gd/deVWS
Benzinga,Cryptocurrency Injective's Price Increased More Than 5% Within 24 hours,https://benzinga.com/insights/cryptocurrency/24/01/36831194/cryptocurrency-injectives-price-increased-more-than-5-within-24-hours,https://da.gd/YTQfE
Benzinga,Dogecoin Rises More Than 4% In 24 hours,https://benzinga.com/insights/cryptocurrency/24/01/36831187/dogecoin-rises-more-than-4-in-24-hours,https://da.gd/3u13mB
Benzinga,Goldman Sachs Gr's Options: A Look at What the Big Money is Thinking,https://benzinga.com/insights/options/24/01/36831184/goldman-sachs-grs-options-a-look-at-what-the-big-money-is-thinking,https://da.gd/2gl1
Benzinga,Behind the Scenes of AppLovin's Latest Options Trends,https://benzinga.com/insights/options/24/01/36831179/behind-the-scenes-of-applovins-latest-options-trends,https://da.gd/aIRDzW
Benzinga,Polkadot's Price Increased More Than 7% Within 24 hours,https://benzinga.com/insights/cryptocurrency/24/01/36831164/polkadots-price-increased-more-than-7-within-24-hours,https://da.gd/M5rUQ
