feed,title,long_url,short_url
Investing,Major 'Secret' of MicroStrategy Revealed by Bitcoiner Samson Mow,https://www.investing.com/news/cryptocurrency-news/major-secret-of-microstrategy-revealed-by-bitcoiner-samson-mow-3286333,https://da.gd/Emjz5
Investing,Bitcoin (BTC) ETF Major New Impact Predicted by Top Crypto Analyst,https://www.investing.com/news/cryptocurrency-news/bitcoin-btc-etf-major-new-impact-predicted-by-top-crypto-analyst-3286332,https://da.gd/zC98n
Investing,Peter Schiff Reacts to Bitcoin Price as Hourly Liquidation Tops $100 Million in Crypto Bloodbath,https://www.investing.com/news/cryptocurrency-news/peter-schiff-reacts-to-bitcoin-price-as-hourly-liquidation-tops-100-million-in-crypto-bloodbath-3286331,https://da.gd/n2Or2
Investing,Solana (SOL) Going to Zero Against Bitcoin: Max Keiser,https://www.investing.com/news/cryptocurrency-news/solana-sol-going-to-zero-against-bitcoin-max-keiser-3286330,https://da.gd/DaiaA
Investing,"BlackRock's Bitcoin ETF 'Huge Success' by All Metrics, High-Ranking Rep Says",https://www.investing.com/news/cryptocurrency-news/blackrocks-bitcoin-etf-huge-success-by-all-metrics-highranking-rep-says-3286329,https://da.gd/TVjz
Investing,"Bitcoin Whales Boost Holdings by $3 Billion, Pro-XRP Lawyer Highlights Key Factor in Ripple's Win, SHIB Price History Hints at Double-Digit Gains Next Month: Crypto News Digest by U.Today",https://www.investing.com/news/cryptocurrency-news/bitcoin-whales-boost-holdings-by-3-billion-proxrp-lawyer-highlights-key-factor-in-ripples-win-shib-price-history-hints-at-doubledigit-gains-next-month-crypto-news-digest-by-utoday-3286328,https://da.gd/IKHw
