feed,title,long_url,short_url
SeekingAlpha,Biophytis reports FY results,https://seekingalpha.com/news/4088279,
SeekingAlpha,"Broadcom, Google Cloud expand collaboration efforts: Cloud Next '24",https://seekingalpha.com/news/4088277,
SeekingAlpha,Inspire Veterinary Partners reports FY results,https://seekingalpha.com/news/4088278,
SeekingAlpha,Hecla Mining sees 43% jump in Q1 silver output as Lucky Friday hits stride,https://seekingalpha.com/news/4088276,
SeekingAlpha,Google: Why It Could Be Losing The AI Race,https://seekingalpha.com/article/4682897,
