feed,title,long_url,short_url
Investing,Investors Await NFP to Validate Their Fed Rate Cut Bets – Preview,https://www.investing.com/analysis/investors-await-nfp-to-validate-their-fed-rate-cut-bets--preview-200649707,https://da.gd/cRYi4k
Investing,"Japan firms have offered 5.10% pay rise, biggest in 33 years",https://www.investing.com/news/stock-market-news/japan-firms-have-offered-510-pay-rise-biggest-in-33-years-3506698,https://da.gd/Yl8Vb
Investing,London stocks rebound on gains in metal miners ahead of elections,https://www.investing.com/news/economy-news/london-stocks-rebound-on-gains-in-metal-miners-ahead-of-elections-3506697,https://da.gd/dhVW33
Investing,"Futures muted, Fed minutes ahead - what's moving markets",https://www.investing.com/news/economy-news/futures-muted-fed-minutes-ahead--whats-moving-markets-3506696,https://da.gd/iMunL
Investing,"Italy plans 20 billion euro tank order from Germany's Rheinmetall, reports Handelsblatt",https://www.investing.com/news/economy-news/italy-plans-20-billion-euro-tank-order-from-germanys-rheinmetall-reports-handelsblatt-3506695,https://da.gd/fSDGX
