feed,title,long_url,short_url
ETFTrends,Meta’s AI Investments Could See It Prosper Among Magnificent Seven Peers,https://www.etftrends.com/leveraged-inverse-channel/metas-ai-investments-could-see-prosper-among-magnificent-seven-peers/,https://da.gd/8x0I
ETFTrends,2 Bond ETFs to Consider for Short-Term Fixed Income Investors,https://www.etftrends.com/fixed-income-channel/2-bond-etfs-consider-short-term-fixed-income-investors/,https://da.gd/wW223
ETFTrends,Software Stocks Could Be Super for These ETFs,https://www.etftrends.com/etf-education-channel/software-stocks-could-super-etfs/,https://da.gd/tMnTbb
ETFTrends,BlackRock’s Top Thematic Trends to Watch in 2H,https://www.etftrends.com/blackrocks-top-thematic-trends-watch-2h/,https://da.gd/pYscjp
ETFTrends,Note from the Desk: Does Election Season Influence the Fed’s Decisions?,https://www.etftrends.com/etf-strategist-channel/note-does-election-season-influence-feds-decisions/,https://da.gd/u5qoo
ETFTrends,Active Value ETF VNSE Outperforms Category Averages Over 3 Years,https://www.etftrends.com/portfolio-construction-channel/active-value-etf-vnse-outperforms-category-averages-over-3-years/,https://da.gd/dQfUQC
ETFTrends,"For Corporate Bonds, Good News Is Finally Positive",https://www.etftrends.com/model-portfolio-channel/corporate-bonds-good-news-finally-positive/,https://da.gd/7YO4p
