feed,title,long_url,short_url
InsiderMonkey,Veeva Systems (VEEV) Stock Impacted by Reduced Revenue Outlook For 2024 And 2025,https://insidermonkey.com/blog/--1262777,
InsiderMonkey,Conestoga Mid Cap Composite Exited Cognex Corp. (CGNX),https://insidermonkey.com/blog/--1262773,
InsiderMonkey,ANSYS (ANSS) Increased Sharply on Acquisition Talks,https://insidermonkey.com/blog/--1262765,
InsiderMonkey,Fortinet (FTNT) Fell as Billings Growth Missed Expectations,https://insidermonkey.com/blog/--1262767,
InsiderMonkey,Conestoga Capital Advisors Mid Cap Strategy’s Q4 2023 Investor Letter,https://insidermonkey.com/blog/--1262763,
