feed,title,long_url,short_url
Investing,Kwenta Receives Proposals to Integrate GMX and Gains Network into Perpetuals Marketplace,https://www.investing.com/news/cryptocurrency-news/kwenta-receives-proposals-to-integrate-gmx-and-gains-network-into-perpetuals-marketplace-3511292,https://da.gd/aJt4w
Investing,"Morning Bid: Eyes switch to inflation vs elections, Powell up",https://www.investing.com/news/commodities-news/eyes-switch-to-inflation-vs-elections-powell-up-3511309,https://da.gd/xH5Qcs
Investing,Oil companies in Texas restoring operations following hurricane Beryl,https://www.investing.com/news/commodities-news/oil-companies-in-texas-restoring-operations-following-hurricane-beryl-3511303,https://da.gd/yQo9D
Investing,How to trade AI? Citi says take profits as sentiment is most elevated since 2019,https://www.investing.com/news/stock-market-news/how-to-trade-ai-citi-says-take-profits-as-sentiment-is-most-elevated-since-2019-3511343,https://da.gd/XeXL
Investing,Apple: Piper Sandler warns AI optimism is already priced into the stock,https://www.investing.com/news/stock-market-news/apple-piper-sandler-warns-ai-optimism-is-already-priced-into-the-stock-3511341,https://da.gd/FPMO3I
Investing,Exclusive-Fed considers rule tweak that could save biggest US banks billions in capital,https://www.investing.com/news/stock-market-news/exclusivefed-considers-rule-tweak-that-could-save-biggest-us-banks-billions-in-capital-3511305,https://da.gd/1yGEuW
