feed,title,long_url,short_url
Investing,Bitcoin halving performance: Does price always rise? Citi analyzes past trends,https://www.investing.com/news/cryptocurrency-news/bitcoin-halving-performance-does-price-always-rise-citi-analyzes-past-trends-3378283,https://da.gd/lM3iBd
Investing,Snap One soars 30% as Resideo acquires smart home product maker for $821m,https://www.investing.com/news/stock-market-news/snap-one-soars-30-as-resideo-acquires-smart-home-product-maker-for-821m-432SI-3378345,https://da.gd/xTQd6Z
Investing,"Macquarie resumes coverage of China EV stocks, prefers Li Auto Inc",https://www.investing.com/news/stock-market-news/macquarie-resumes-coverage-of-china-ev-stocks-prefers-li-auto-inc-432SI-3378325,https://da.gd/IFVPbb
Investing,U.S. earnings seasons begins: What to expect,https://www.investing.com/news/stock-market-news/us-earnings-seasons-begins-what-to-expect-3378223,https://da.gd/2Dy5V2
Investing,US retail sales beat expectations in March,https://www.investing.com/news/economy/us-retail-sales-beat-expectations-in-march-3378346,https://da.gd/txsw
