feed,title,long_url,short_url
Yahoo,Oil futures end higher as OPEC+ keeps its plan to slowly raise output,https://www.marketwatch.com/story/oil-futures-end-higher-as-opec-keeps-its-plan-to-slowly-raise-output-2021-04-27?siteid=yhoof2&yptr=yahoo,https://on.mktw.net/3sUE7nm
Yahoo,Biden’s First 100 Days Have Been Great for the Stock Market. What History Says Happens Next.,https://www.barrons.com/articles/stocks-soared-during-bidens-first-100-days-what-history-says-happens-next-51619479357?siteid=yhoof2&yptr=yahoo,https://j.mp/3nogAtO
Yahoo,Will the IRS Come After Your Bitcoin Soon?,https://www.investopedia.com/tech/bitcoin-irs-taxes/?utm_campaign=quote-yahoo&utm_source=yahoo&utm_medium=referral&yptr=yahoo,https://j.mp/3aHxT3G
Yahoo,Amazon stock is exciting for these two reasons: analyst,https://finance.yahoo.com/news/amazon-stock-is-exciting-for-these-two-reasons-analyst-185337414.html?.tsrc=rss,https://yhoo.it/2S8okEJ
Yahoo,"Facebook used the pandemic to develop non-advertising business, while ad money kept pouring in",https://finance.yahoo.com/m/d971ba9f-8620-3ae9-bad3-1cc092a82e21/facebook-used-the-pandemic-to.html?.tsrc=rss,https://yhoo.it/2R83zIU
Yahoo,Warren Buffett’s investing success depends on these two traits: Portfolio manager [Video],https://finance.yahoo.com/video/warren-buffett-investing-success-depends-185244517.html?.tsrc=rss,https://yhoo.it/3dUvK6Y
