feed,title,long_url,short_url
SeekingAlpha,"Ceres Global Ag GAAP EPS of -C$0.02, revenue of $C209.57M",https://seekingalpha.com/news/4149601,
SeekingAlpha,"The Becker Milk Company Limited GAAP EPS of C$0.14, revenue of C$727.5M",https://seekingalpha.com/news/4149598,
SeekingAlpha,Ares Management in advanced talks on acquisition of GCP's non-China operations - report,https://seekingalpha.com/news/4149597,
SeekingAlpha,"Sibanye-Stillwater GAAP EPS of -$14.00, revenue of $2.95B",https://seekingalpha.com/news/4149596,
SeekingAlpha,"Roots GAAP EPS of -C$0.13, revenue of C$47.7M",https://seekingalpha.com/news/4149594,
