feed,title,long_url,short_url
Investing,Arthur Hayes endorses Bitcoin as central banks boost liquidity,https://www.investing.com/news/cryptocurrency-news/arthur-hayes-endorses-bitcoin-as-central-banks-boost-liquidity-93CH-3232102,https://da.gd/HWrj
Investing,Bitcoin hovers near key support level with potential for either drop or rally,https://www.investing.com/news/cryptocurrency-news/bitcoin-hovers-near-key-support-level-with-potential-for-either-drop-or-rally-93CH-3232089,https://da.gd/2SQFF
Investing,"Turkish lira bonds may rebound to top 2024 market, Deutsche Bank says",https://www.investing.com/news/stock-market-news/turkish-lira-bonds-may-rebound-to-top-2024-market-deutsche-bank-says-93CH-3232118,https://da.gd/dIWBYk
Investing,MTN plans exit from three West African markets amid financial challenges,https://www.investing.com/news/stock-market-news/mtn-plans-exit-from-three-west-african-markets-amid-financial-challenges-93CH-3232112,https://da.gd/3Tem2L
Investing,Israeli arms firms absent at Dubai Airshow amid conflict,https://www.investing.com/news/stock-market-news/israeli-arms-firms-absent-at-dubai-airshow-amid-conflict-93CH-3232111,https://da.gd/cI1pM
Investing,Hindustan Unilever stock sees fluctuations in Monday trading,https://www.investing.com/news/stock-market-news/hindustan-unilever-stock-sees-fluctuations-in-monday-trading-93CH-3232108,https://da.gd/PE6p
Investing,HP Inc. upgraded at Citi as PC momentum should drive FCF,https://www.investing.com/news/stock-market-news/hp-inc-upgraded-at-citi-as-pc-momentum-should-drive-fcf-432SI-3232105,https://da.gd/5SnOGN
Investing,Nucor's stock influenced by institutional ownership with 80% share,https://www.investing.com/news/stock-market-news/nucors-stock-influenced-by-institutional-ownership-with-80-share-93CH-3232110,https://da.gd/oEEqG8
Investing,Freshworks stands out with high P/S ratio amid strong growth forecasts,https://www.investing.com/news/stock-market-news/freshworks-stands-out-with-high-ps-ratio-amid-strong-growth-forecasts-93CH-3232103,https://da.gd/6RjOp
Investing,Sea (SE) Reports Q3: Everything You Need To Know Ahead Of Earnings,https://www.investing.com/news/stock-market-news/sea-se-reports-q3-everything-you-need-to-know-ahead-of-earnings-3232101,https://da.gd/Q4WF5
Investing,So-Young's Wuhan Miracle Submits Application Documents for IPO on China's Beijing Stock Exchange,https://www.investing.com/news/stock-market-news/soyoungs-wuhan-miracle-submits-application-documents-for-ipo-on-chinas-beijing-stock-exchange-432SI-3232100,https://da.gd/sLgLoH
Investing,Futures dip as focus shifts to economic data,https://www.investing.com/news/economy/futures-dip-as-focus-shifts-to-economic-data-3232113,https://da.gd/JNhNq
Investing,Sub-Saharan Africa faces funding squeeze amid rising debt,https://www.investing.com/news/economy/subsaharan-africa-faces-funding-squeeze-amid-rising-debt-93CH-3232093,https://da.gd/RvfK
