feed,title,long_url,short_url
SeekingAlpha,DISH Network appoints Hamid Akhavan as CEO,https://seekingalpha.com/news/4035467,
SeekingAlpha,Selecta merges with Cartesian Therapeutics in all-stock deal,https://seekingalpha.com/news/4035466,
SeekingAlpha,"Twin Vee PowerCats GAAP EPS of -$0.20, revenue of $8.08M",https://seekingalpha.com/news/4035465,
SeekingAlpha,Wonder Group officially swallows up Blue Apron,https://seekingalpha.com/news/4035464,
SeekingAlpha,Sio Silica to go public via business combination with Pyrophyte Acquisition,https://seekingalpha.com/news/4035463,
