feed,title,long_url,short_url
SeekingAlpha,SPDR Portfolio Developed World ex-US ETF declares semi-annual distribution of $0.3504,https://seekingalpha.com/news/4047502,
SeekingAlpha,SPDR S&P China ETF declares semi-annual distribution of $1.6869,https://seekingalpha.com/news/4047501,
SeekingAlpha,SPDR S&P International Small Cap ETF declares semi-annual distribution of $0.3619,https://seekingalpha.com/news/4047500,
SeekingAlpha,SPDR S&P Emerging Asia Pacific ETF declares semi-annual distribution of $1.9206,https://seekingalpha.com/news/4047499,
SeekingAlpha,SPDR S&P Emerging Markets Small Cap ETF declares semi-annual distribution of $0.8270,https://seekingalpha.com/news/4047498,
