feed,title,long_url,short_url
Investing,SVB Tire Fire Is Serving These 6.6%+ Payouts on a Platter,https://www.investing.com/analysis/svb-tire-fire-is-serving-these-66-payouts-on-a-platter-200636453,https://da.gd/46wbTe
Investing,Indicators Point to Bear Rally in OMG Market; Support May be Tested,https://www.investing.com/news/cryptocurrency-news/indicators-point-to-bear-rally-in-omg-market-support-may-be-tested-3035612,https://da.gd/cwER
Investing,Systemic credit event now seen as the biggest tail risk - BofA's survey,https://www.investing.com/news/stock-market-news/systemic-credit-event-now-seen-as-the-biggest-tail-risk--bofas-survey-432SI-3035608,https://da.gd/3K8JU
Investing,Morgan Stanley rides Harley-Davidson to Overweight on strategic confidence,https://www.investing.com/news/stock-market-news/morgan-stanley-rides-harleydavidson-to-overweight-on-strategic-confidence-432SI-3035607,https://da.gd/yHARj
Investing,"Stifel resumes Alphabet coverage at Buy, sees nearly 30% upside potential",https://www.investing.com/news/stock-market-news/stifel-resumes-alphabet-coverage-at-buy-sees-nearly-30-upside-potential-432SI-3035606,https://da.gd/uZPbul
Investing,"Banking stocks steady after Credit Suisse rescue as focus turns to Fed, US banks",https://i-invdn-com.investing.com/trkd-images/LYNXMPEJ2K036_L.jpg,https://da.gd/qEXoiZ
