feed,title,long_url,short_url
SeekingAlpha,Least shorted S&P 500 stocks in June,https://seekingalpha.com/news/4125485,
SeekingAlpha,"IHD: 12% Yield Is Fully Covered, Valuation Is Attractive, But Chinese Exposure Is A Risk",https://seekingalpha.com/article/4704794,
SeekingAlpha,Overcoming Inertia: How Home Bias Hurts U.S. Investors,https://seekingalpha.com/article/4704819,
SeekingAlpha,L1 Capital Long Short Fund June 2024 Quarterly Report,https://seekingalpha.com/article/4704820,
SeekingAlpha,B. Riley Financial: Securities Lending Business Raises Eyebrows Due To Liquidity Risk,https://seekingalpha.com/article/4704793,
