feed,title,long_url,short_url
SeekingAlpha,Salarius Pharmaceuticals readies stock offering,https://seekingalpha.com/news/3669051,
SeekingAlpha,"Global Medical REIT FFO beats by $0.01, misses on revenue",https://seekingalpha.com/news/3669050,
SeekingAlpha,"Marvell Technology Group EPS in-line, beats on revenue",https://seekingalpha.com/news/3669049,
SeekingAlpha,"Points International EPS misses by $0.58, beats on revenue",https://seekingalpha.com/news/3669048,
SeekingAlpha,"Splunk EPS beats by $0.35, beats on revenue",https://seekingalpha.com/news/3669047,
SeekingAlpha,"Descartes Systems EPS beats by $0.04, beats on revenue",https://seekingalpha.com/news/3669045,
