feed,title,long_url,short_url
SeekingAlpha,"Distribution Solutions Group Non-GAAP EPS of $0.22 beats by $0.08, revenue of $405.24M misses by $13.76M",https://seekingalpha.com/news/4077075,
SeekingAlpha,"The Real Brokerage GAAP EPS of -$0.07 misses by $0.03, revenue of $181.34M beats by $19.97M",https://seekingalpha.com/news/4077074,
SeekingAlpha,United Rentals announces private offering of $1.1 billion of senior notes due 2034,https://seekingalpha.com/news/4077073,
SeekingAlpha,"FuelCell Energy GAAP EPS of -$0.05 beats by $0.03, revenue of $16.69M misses by $8.91M",https://seekingalpha.com/news/4077072,
SeekingAlpha,Stratasys reports mixed Q4 results; initiates FY24 outlook,https://seekingalpha.com/news/4077071,
SeekingAlpha,MoneyLion reports Q4 results,https://seekingalpha.com/news/4077070,
SeekingAlpha,"GE Aerospace targets bigger shareholder payout, sets $15B stock buyback program",https://seekingalpha.com/news/4077069,
