feed,title,long_url,short_url
SeekingAlpha,SU Group wins 2-year security guarding bid in Hong Kong,https://seekingalpha.com/news/4077168,
SeekingAlpha,Cannabis supplier Allied signs 180kgs purchase order with international partner,https://seekingalpha.com/news/4077167,
SeekingAlpha,VOXX International announces JV between EyeLock and GalvanEyes Partners,https://seekingalpha.com/news/4077166,
SeekingAlpha,BILL to repurchase 0.0% convertible senior notes due 2025,https://seekingalpha.com/news/4077164,
SeekingAlpha,"Rentokil Initial, Avangrid, American Eagle Outfitters among premarket gainers' pack",https://seekingalpha.com/news/4077163,
SeekingAlpha,Mobileye Global: Steering Clear Of This Overpriced Stock,https://seekingalpha.com/article/4676589,
