feed,title,long_url,short_url
SeekingAlpha,E-L Financial announces renewal of normal course issuer bid,https://seekingalpha.com/news/4077506,
SeekingAlpha,United Rentals prices private offering of $1.1B of 6.125% senior notes due 2034,https://seekingalpha.com/news/4077505,
SeekingAlpha,Economic Investment says TSX accepts renewal of its normal course issuer bid,https://seekingalpha.com/news/4077504,
SeekingAlpha,Shaving company Harry's files confidentially for IPO: report,https://seekingalpha.com/news/4077503,
SeekingAlpha,Crew Energy GAAP EPS of C$0.24,https://seekingalpha.com/news/4077502,
SeekingAlpha,SMIN: Caution Warranted Towards One Of The Dazzling Equity Counters Of The World,https://seekingalpha.com/article/4676794,
