feed,title,long_url,short_url
Yahoo,"Nvidia cuts stake in Arm Holdings, invests in China's WeRide",https://finance.yahoo.com/news/nvidia-cuts-stake-arm-holdings-124814194.html,https://da.gd/PMwm
Yahoo,Analyst Report: Prudential Financial Inc,https://finance.yahoo.com/research/reports/ARGUS_3333_AnalystReport_1739534445000?yptr=yahoo&ncid=yahooproperties_plusresear_nm5q6ze1cei,https://da.gd/H7qv
Yahoo,Brace for Donald Trump’s Truth Social (DJT) Stock Rollercoaster,https://finance.yahoo.com/news/brace-donald-trump-truth-social-120738037.html,https://da.gd/4DVV0F
Yahoo,China's Tencent wins video copyright infringement case in US district court,https://finance.yahoo.com/news/chinas-tencent-wins-video-copyright-055622613.html,https://da.gd/3ef6oX
Yahoo,Retail sales decline more than expected in January,https://finance.yahoo.com/news/retail-sales-decline-more-than-expected-in-january-133721449.html?.tsrc=rss,https://da.gd/rDsDC
