feed,title,long_url,short_url
Yahoo,Health Care Roundup: Market Talk,https://www.wsj.com/finance/stocks/health-care-roundup-market-talk-3365def5?siteid=yhoof2&yptr=yahoo,https://da.gd/1cXbQ
Yahoo,Basic Materials Roundup: Market Talk,https://www.wsj.com/business/basic-materials-roundup-market-talk-344fc1b5?siteid=yhoof2&yptr=yahoo,https://da.gd/CiYvoK
Yahoo,Auto & Transport Roundup: Market Talk,https://www.wsj.com/business/auto-transport-roundup-market-talk-4afebd08?siteid=yhoof2&yptr=yahoo,https://da.gd/tosry1
Yahoo,Energy & Utilities Roundup: Market Talk,https://www.wsj.com/business/energy-utilities-roundup-market-talk-ee7d888e?siteid=yhoof2&yptr=yahoo,https://da.gd/6axsSF
Yahoo,Financial Services Roundup: Market Talk,https://www.wsj.com/finance/banking/financial-services-roundup-market-talk-ab4cda9a?siteid=yhoof2&yptr=yahoo,https://da.gd/NikDEV
Yahoo,"Tech, Media & Telecom Roundup: Market Talk",https://www.wsj.com/business/tech-media-telecom-roundup-market-talk-55efc6dc?siteid=yhoof2&yptr=yahoo,https://da.gd/HMiI
Yahoo,Base Metal Prices Mixed; Copper Returns Gains Seen Earlier in Session,https://www.wsj.com/finance/commodities-futures/gold-edges-higher-supported-by-prospects-of-more-u-s-tariffs-0c204e55?siteid=yhoof2&yptr=yahoo,https://da.gd/zZItHD
Yahoo,Diamondback in Talks to Buy Permian Producer Double Eagle,https://www.wsj.com/business/energy-oil/diamondback-in-talks-to-buy-permian-producer-double-eagle-c119a84e?siteid=yhoof2&yptr=yahoo,https://da.gd/qbgK9
