feed,title,long_url,short_url
SeekingAlpha,"Warner Bros. Discovery GAAP EPS of -$0.17 misses by $0.08, revenue of $9.97B beats by $10M",https://seekingalpha.com/news/4032759,
SeekingAlpha,Amicus Therapeutics beats Q3 top and bottom line estimates; raises FY23 Galafold revenue outlook,https://seekingalpha.com/news/4032758,
SeekingAlpha,"Kandi Technologies GAAP EPS of $0.02, revenue of $36.43M",https://seekingalpha.com/news/4032757,
SeekingAlpha,"Steven Madden Non-GAAP EPS of $0.88 beats by $0.03, revenue of $552.7M beats by $4.98M",https://seekingalpha.com/news/4032756,
SeekingAlpha,Nexstar Media reports Q3 results,https://seekingalpha.com/news/4032755,
SeekingAlpha,"Starwood Property Trust Non-GAAP EPS of $0.49 beats by $0.02, revenue of $521.55M misses by $2.97M",https://seekingalpha.com/news/4032754,
