feed,title,long_url,short_url
Investing,"How to manage crypto losses on tax returns in the US, UK and Canada",https://www.investing.com/news/cryptocurrency-news/how-to-manage-crypto-losses-on-tax-returns-in-the-us-uk-and-canada-3227399,https://da.gd/qhvp
Investing,"XRP Whales Responsible for This 23% Price Increase, BTC Target Remains $36,500-$37,000, SHIB Member Teases New Updates Coming: Crypto News Digest by U.Today",https://www.investing.com/news/cryptocurrency-news/xrp-whales-responsible-for-this-23-price-increase-btc-target-remains-3650037000-shib-member-teases-new-updates-coming-crypto-news-digest-by-utoday-3227390,https://da.gd/A6TYu
Investing,TMX Group reports decrease in total financings despite new listings in October 2023,https://www.investing.com/news/stock-market-news/tmx-group-reports-decrease-in-total-financings-despite-new-listings-in-october-2023-93CH-3227400,https://da.gd/hSUi
Investing,NCR Voyix executives to participate in November investor conferences,https://www.investing.com/news/stock-market-news/ncr-voyix-executives-to-participate-in-november-investor-conferences-93CH-3227402,https://da.gd/ZhwL
Investing,Flywire Corporation shares drop 27% as Q3 profit impacted by FX headwinds,https://www.investing.com/news/stock-market-news/flywire-corporation-shares-drop-27-as-q3-profit-impacted-by-fx-headwinds-432SI-3227398,https://da.gd/0fUGMt
Investing,"M&S echoes UK peers on early Christmas demand, Ahold looks to loyalty",https://www.investing.com/news/stock-market-news/ms-christmas-trading-off-to-a-good-start-ceo-3226386,https://da.gd/LFrOkc
Investing,"Telefonica reports 9.3% rise in Q3 net profit, surpassing analysts' expectations",https://www.investing.com/news/stock-market-news/telefonica-reports-93-rise-in-q3-net-profit-surpassing-analysts-expectations-93CH-3227396,https://da.gd/ZQANR
Investing,Nuvei raises annual financial targets after Q3 transaction surge,https://www.investing.com/news/stock-market-news/nuvei-raises-annual-financial-targets-after-q3-transaction-surge-93CH-3227394,https://da.gd/xqsHy
Investing,UiPath introduces AI-driven features to enhance enterprise productivity,https://www.investing.com/news/stock-market-news/uipath-introduces-aidriven-features-to-enhance-enterprise-productivity-93CH-3227393,https://da.gd/gm6qcV
Investing,"Lumentum Holdings reports fiscal Q1 loss, beats earnings forecast",https://www.investing.com/news/stock-market-news/lumentum-holdings-reports-fiscal-q1-loss-beats-earnings-forecast-93CH-3227392,https://da.gd/m09C
Investing,"IMF sees Thai GDP growth at 2.7% this year, 3.6% next year",https://www.investing.com/news/economy/imf-sees-thai-gdp-growth-at-27-this-year-36-next-year-3227397,https://da.gd/aoHk8g
Investing,Investors spurn options hedges as U.S. stock rally crushes fear,https://www.investing.com/news/economy/investors-spurn-options-hedges-as-us-stock-rally-crushes-fear-3227386,https://da.gd/2BnT
