feed,title,long_url,short_url
SeekingAlpha,"Kura Sushi USA Non-GAAP EPS of $0.25 beats by $0.01, revenue of $54.9M misses by $0.7M",https://seekingalpha.com/news/4033426,
SeekingAlpha,"Akoya Biosciences GAAP EPS of -$0.26 beats by $0.10, revenue of $25.2M beats by $0.66M",https://seekingalpha.com/news/4033425,
SeekingAlpha,"Duolingo GAAP EPS of $0.06 beats by $0.18, revenue of $137.6M beats by $5.47M",https://seekingalpha.com/news/4033424,
SeekingAlpha,"Lantronix Non-GAAP EPS of $0.07 beats by $0.04, revenue of $33M beats by $1.38M",https://seekingalpha.com/news/4033423,
SeekingAlpha,The 'Macro Question' Some Have Been Asking (What Keeps Me Up At Night?),https://seekingalpha.com/article/4649334,
