feed,title,long_url,short_url
Yahoo,"Analyst Report: Xcel Energy, Inc",https://finance.yahoo.com/research/reports/ARGUS_3546_AnalystReport_1699468398000?yptr=yahoo&ncid=yahooproperties_plusresear_nm5q6ze1cei,https://da.gd/aJPvt
Yahoo,Analyst Report: Fortive Corp,https://finance.yahoo.com/research/reports/ARGUS_3681_AnalystReport_1699468398000?yptr=yahoo&ncid=yahooproperties_plusresear_nm5q6ze1cei,https://da.gd/LLsr4Y
Yahoo,Analyst Report: CVS Health Corp,https://finance.yahoo.com/research/reports/ARGUS_2877_AnalystReport_1699468398000?yptr=yahoo&ncid=yahooproperties_plusresear_nm5q6ze1cei,https://da.gd/M9N8W8
Yahoo,"Analyst Report: Quest Diagnostics, Inc",https://finance.yahoo.com/research/reports/ARGUS_3699_AnalystReport_1699468398000?yptr=yahoo&ncid=yahooproperties_plusresear_nm5q6ze1cei,https://da.gd/ZMICkT
Yahoo,"Market Update: CHKP, CVS, DGX, SBUX, SWKS, XEL, KKR, FTV",https://finance.yahoo.com/research/reports/ARGUS_38219_MarketUpdate_1699467498000?yptr=yahoo&ncid=yahooproperties_plusresear_nm5q6ze1cei,https://da.gd/61uM
Yahoo,"Disney theme parks strength fuels profit beat, offsets ad weakness",https://finance.yahoo.com/news/disney-theme-parks-strength-fuels-211148810.html,https://da.gd/ZpTaQy
