feed,title,long_url,short_url
SeekingAlpha,Manulife Financial Q3 core earnings beat helped by Asia growth,https://seekingalpha.com/news/4033582,
SeekingAlpha,"Seritage GAAP EPS of -$0.04, revenue of $5.05M",https://seekingalpha.com/news/4033581,
SeekingAlpha,"Amphastar Pharmaceuticals Non-GAAP EPS of $1.15 beats by $0.46, revenue of $180.6M beats by $6.8M",https://seekingalpha.com/news/4033580,
SeekingAlpha,National Australia Bank Limited GAAP EPS of 228.70 cents,https://seekingalpha.com/news/4033579,
SeekingAlpha,Verastem Non-GAAP EPS of -$0.71 beats by $0.08,https://seekingalpha.com/news/4033578,
SeekingAlpha,Agrify receives extended stay of suspension from Nasdaq,https://seekingalpha.com/news/4033577,
SeekingAlpha,"Ferrari: Some Companies Deserve A 40x Multiple, But Beware Of Q4",https://seekingalpha.com/article/4649361,
