feed,title,long_url,short_url
Investing,Prime Medicine stock soars amid gene editing sector momentum,https://www.investing.com/news/stock-market-news/prime-medicine-stock-soars-amid-gene-editing-sector-momentum-4125209,
Investing,U.K. stocks lower at close of trade; Investing.com United Kingdom 100 down 0.17%,https://www.investing.com/news/stock-market-news/uk-stocks-lower-at-close-of-trade-investingcom-united-kingdom-100-down-017-4125203,
Investing,Spain stocks higher at close of trade; IBEX 35 up 0.62%,https://www.investing.com/news/stock-market-news/spain-stocks-higher-at-close-of-trade-ibex-35-up-062-4125201,
Investing,Portugal stocks lower at close of trade; PSI down 0.57%,https://www.investing.com/news/stock-market-news/portugal-stocks-lower-at-close-of-trade-psi-down-057-4125200,
Investing,Netherlands stocks higher at close of trade; AEX up 0.61%,https://www.investing.com/news/stock-market-news/netherlands-stocks-higher-at-close-of-trade-aex-up-061-4125198,
Investing,TMC shares dip as Iceberg Research rebuts Ives upgrade,https://www.investing.com/news/stock-market-news/tmc-shares-dip-as-iceberg-research-rebuts-ives-upgrade-4125197,
Investing,Italy stocks lower at close of trade; Investing.com Italy 40 unchanged,https://www.investing.com/news/stock-market-news/italy-stocks-lower-at-close-of-trade-investingcom-italy-40-unchanged-4125196,
