feed,title,long_url,short_url
Investing,Rare earth stocks gain amid China's export restrictions,https://www.investing.com/news/stock-market-news/rare-earth-stocks-gain-amid-chinas-export-restrictions-3849463,https://da.gd/JznV
Investing,Clean energy companies press US lawmakers to protect subsidies,https://www.investing.com/news/stock-market-news/clean-energy-companies-press-us-lawmakers-to-protect-subsidies-3849459,https://da.gd/UojmP
Investing,"Toyota to set up wholly owned EV, battery unit in China",https://www.investing.com/news/stock-market-news/toyota-to-set-up-wholly-owned-ev-battery-unit-in-china-3849457,https://da.gd/xB90j
Investing,"Thailand to roll out next phase of handout scheme in Q2, plans more stimulus",https://www.investing.com/news/economy-news/thailand-to-roll-out-next-phase-of-handout-scheme-in-q2-plans-more-stimulus-3849462,https://da.gd/8yfnxr
Investing,"Growth in India services sector slows to more than 2-year low in Jan, PMI shows",https://www.investing.com/news/economy-news/growth-in-india-services-sector-slows-to-more-than-2year-low-in-jan-pmi-shows-3849458,https://da.gd/kXhv
