feed,title,long_url,short_url
FXEmpire,Explainer-How the U.S. drug pricing law affects Medicare and its members,https://www.fxempire.com/news/article/explainer-how-the-u-s-drug-pricing-law-affects-medicare-and-its-members-1125860,https://bit.ly/3Bcmzt4
FXEmpire,"Starbucks exploring tech to ease high U.S. demand, worker stress",https://www.fxempire.com/news/article/starbucks-exploring-tech-to-ease-high-u-s-demand-worker-stress-1125865,https://bit.ly/3QB6aDX
FXEmpire,Morgan Stanley says rise in interest rates hurts mortgage demand,https://www.fxempire.com/news/article/morgan-stanley-says-rise-in-interest-rates-hurts-mortgage-demand-1125863,https://bit.ly/3LdBLKM
FXEmpire,King Charles thanks Sinn Fein’s O’Neill for ‘incredibly kind’ words,https://www.fxempire.com/news/article/king-charles-thanks-sinn-feins-oneill-for-incredibly-kind-words-1125862,https://bit.ly/3dbVUo8
FXEmpire,U.S. Senate Republican Lindsey Graham unveils abortion bill ahead of midterms,https://www.fxempire.com/news/article/u-s-senate-republican-lindsey-graham-unveils-abortion-bill-ahead-of-midterms-1125861,https://bit.ly/3xlMj4T
