feed,title,long_url,short_url
Benzinga,Orange signs a renewable power purchase agreement with Boralex in France,https://www.benzinga.com/pressreleases/20/07/n16537653/orange-signs-a-renewable-power-purchase-agreement-with-boralex-in-france,https://j.mp/31RHnpt
Benzinga,NOAA Selects Woolpert for $40M Shoreline Mapping Support Services Contract,https://www.benzinga.com/pressreleases/20/07/n16537641/noaa-selects-woolpert-for-40m-shoreline-mapping-support-services-contract,https://j.mp/31QTnYs
Benzinga,MiX Telematics Partners with The Global Alliance for Vehicle Data Access,https://www.benzinga.com/pressreleases/20/07/n16537639/mix-telematics-partners-with-the-global-alliance-for-vehicle-data-access,https://j.mp/2O5K3rs
Benzinga,SolTrans Turns to AMPLY Power to Simplify Electric Bus Fleet Charging,https://www.benzinga.com/pressreleases/20/07/n16537635/soltrans-turns-to-amply-power-to-simplify-electric-bus-fleet-charging,https://j.mp/2ADrJmD
Benzinga,AlgaEnergy and Integrated Agribusiness Professionals (IAP) Seal a Distribution and Partnership Agreement,https://www.benzinga.com/pressreleases/20/07/n16537590/algaenergy-and-integrated-agribusiness-professionals-iap-seal-a-distribution-and-partnership-agree,https://j.mp/2O2d8nL
Benzinga,US Companies In 'Much Better Shape' Than Wall Street Thinks: Here's Why,https://www.benzinga.com/analyst-ratings/analyst-color/20/07/16536995/us-companies-in-much-better-shape-than-wall-street-thinks-heres-why,https://j.mp/2VUISiR
