feed,title,long_url,short_url
InsiderMonkey,Microsoft Corporation (MSFT): Billionaire Tom Steyer Is Buying This Stock,https://insidermonkey.com/blog/--1751836,
InsiderMonkey,Boston Scientific Corporation (BSX): Billionaire Tom Steyer Is Loading Up on This Stock,https://insidermonkey.com/blog/--1751848,
InsiderMonkey,"Amazon.com, Inc. (AMZN): Billionaire Tom Steyer Is Bullish on This Stock",https://insidermonkey.com/blog/--1751859,
InsiderMonkey,TransUnion (TRU): Billionaire Tom Steyer Trims Position,https://insidermonkey.com/blog/--1751862,
InsiderMonkey,Revolution Medicines Inc. (RVMD): Billionaire Tom Steyer Remains Bullish on This Stock,https://insidermonkey.com/blog/--1751867,
InsiderMonkey,Crinetics Pharmaceuticals (CRNX): Billionaire Tom Steyer Likes This Pharma Stock,https://insidermonkey.com/blog/--1751864,
InsiderMonkey,Protagonist Therapeutics Inc. (PTGX): Billionaire Tom Steyer Likes Upside Potential of This Stock,https://insidermonkey.com/blog/--1751869,
InsiderMonkey,Liquidia Corporation (LQDA): Billionaire Tom Steyer Admires This Pharma Stock,https://insidermonkey.com/blog/--1751916,
InsiderMonkey,BridgeBio Pharma Inc. (BBIO): Billionaire Tom Steyer Admires Upside Potential of This Stock,https://insidermonkey.com/blog/--1751874,
InsiderMonkey,Teva (TEVA) Enters a New $700 Million Acquisition Deal,https://insidermonkey.com/blog/--1752618,
InsiderMonkey,Scotiabank Elevates Restaurant Brands (QSR) PT by $10 – Here’s Why,https://insidermonkey.com/blog/--1752616,
InsiderMonkey,William Blair Initiates Natera (NTRA) With Outperform,https://insidermonkey.com/blog/--1752624,
InsiderMonkey,"Raymond James Starts Insmed (INSM) at Outperform, Citing Limited Competition",https://insidermonkey.com/blog/--1752626,
InsiderMonkey,Jefferies Cuts United Airlines (UAL) PT by $6 – Here’s Why,https://insidermonkey.com/blog/--1752628,
InsiderMonkey,Here’s Why Bloom Energy (BE) is Among the Stocks that Billionaire Druckenmiller and Jim Cramer Like,https://insidermonkey.com/blog/--1752630,
InsiderMonkey,Barclays Raises Coupang (CPNG) Target Price Ahead of Earnings,https://insidermonkey.com/blog/--1752635,
InsiderMonkey,Barclays Adjusts MercadoLibre (MELI) PT Preceding the Release of First Quarter Results,https://insidermonkey.com/blog/--1752640,
InsiderMonkey,Taiwan Semiconductor (TSM): Top 10 Stock that Billionaire Druckenmiller and Jim Cramer Like,https://insidermonkey.com/blog/--1752656,
