feed,title,long_url,short_url
Benzinga,"Eli Lilly's Diabetes Drug Shows Statistical Reduction In Blood Sugar Levels In Children, Adolescents",https://benzinga.com/general/biotech/22/12/29994593/eli-lillys-diabetes-drug-shows-statistical-reduction-in-blood-sugar-levels-in-children-adolescent,https://da.gd/ZC7W4l
Benzinga,The SolarEdge Technologies Story 'Looks Better Than We Thought' Says Analyst,https://benzinga.com/analyst-ratings/analyst-color/22/12/29991466/the-solaredge-technologies-story-looks-better-than-we-thought-says-analyst,https://da.gd/ZPsTo
Benzinga,Are People Fleeing Cities For Camping Life? Airbnb Faces Occupancy Headwinds And This RV Manufacturer Just Smashed Earnings Estimates,https://benzinga.com/news/earnings/earnings-beats/22/12/29994323/are-people-fleeing-cities-for-camping-life-airbnb-faces-occupancy-headwinds-and-this,https://da.gd/a506
Benzinga,United Natural Foods Plunges Post Mixed Q1 Performance,https://benzinga.com/news/earnings/22/12/29994004/united-natural-foods-plunges-post-mixed-q1-performance,https://da.gd/rhJ9
Benzinga,AstraZeneca's Enhertu Cuts Risk Of Death By 36% VsTrastuzumab In Metastatic Breast Cancer,https://benzinga.com/general/biotech/22/12/29994308/astrazenecas-enhertu-cuts-risk-of-death-by-36-vstrastuzumab-in-metastatic-breast-cancer,https://da.gd/j53B
Benzinga,Here's How Much $1000 Invested In Home Depot 20 Years Ago Would Be Worth Today,https://benzinga.com/news/earnings/22/12/29994910/heres-how-much-1000-invested-in-home-depot-20-years-ago-would-be-worth-today,https://da.gd/RwaLni
