feed,title,long_url,short_url
Benzinga,Pembina Pipeline Announces Binding Open Season on Cochin Pipeline,https://www.benzinga.com/pressreleases/21/01/n19211355/pembina-pipeline-announces-binding-open-season-on-cochin-pipeline,https://j.mp/3qAiqrW
Benzinga,AirBoss Announces Participation in Upcoming Investor Conferences and Provides Outlook on Upcoming Results,https://www.benzinga.com/pressreleases/21/01/g19211339/airboss-announces-participation-in-upcoming-investor-conferences-and-provides-outlook-on-upcoming-,https://j.mp/2KtzJvn
Benzinga,"FirstService to Announce Fourth Quarter and Annual Results for 2020 on February 9, 2021",https://www.benzinga.com/pressreleases/21/01/g19211337/firstservice-to-announce-fourth-quarter-and-annual-results-for-2020-on-february-9-2021,https://j.mp/39J1BnK
Benzinga,"Kforce Expects Fourth Quarter Revenues and Earnings Per Share to Exceed Prior Guidance; Q4 Tech Flex Revenues Grew Nearly 6% Sequentially Per Billing Day; Kforce to Release Its Q4 Results on February 8, 2021",https://www.benzinga.com/pressreleases/21/01/g19211334/kforce-expects-fourth-quarter-revenues-and-earnings-per-share-to-exceed-prior-guidance-q4-tech-fle,https://j.mp/3qDliV1
Benzinga,Matrix Service Company Sets Date to Discuss Results for the Second Quarter of Fiscal 2021,https://www.benzinga.com/pressreleases/21/01/g19211331/matrix-service-company-sets-date-to-discuss-results-for-the-second-quarter-of-fiscal-2021,https://j.mp/3sE8tLS
Benzinga,Danforth Advisors Appoints Bettina Davids as Chief Financial Officer,https://www.benzinga.com/pressreleases/21/01/g19211330/danforth-advisors-appoints-bettina-davids-as-chief-financial-officer,https://j.mp/3it9kKt
Benzinga,REPEAT -- BC Craft Supply Co Announces Letter of Intent with Psilocybin Research and Development Company Ava Pathways,https://www.benzinga.com/pressreleases/21/01/g19211329/repeat-bc-craft-supply-co-announces-letter-of-intent-with-psilocybin-research-and-development-comp,https://j.mp/35Tp0BW
