feed,title,long_url,short_url
SeekingAlpha,Total inks 80 MW power purchase deal with Orange,https://seekingalpha.com/news/3671126,
SeekingAlpha,Monro to acquire Mountain View Tire & Service,https://seekingalpha.com/news/3671125,
SeekingAlpha,"XOMA EPS misses by $0.68, beats on revenue",https://seekingalpha.com/news/3671124,
SeekingAlpha,Oncorus EPS misses by $0.08,https://seekingalpha.com/news/3671123,
SeekingAlpha,Campbell Soup down on missing sales expectations and softer FY2021 guidance,https://seekingalpha.com/news/3671122,
