feed,title,long_url,short_url
SeekingAlpha,Safely to make retail debut exclusively at Bed Bath & Beyond stores,https://seekingalpha.com/news/3722882,
SeekingAlpha,"Immunovant, Marin Software, ECMOHO among premarket losers' pack",https://seekingalpha.com/news/3722881,
SeekingAlpha,"Sterling Bancorp EPS misses by $0.01, misses on revenue",https://seekingalpha.com/news/3722880,
SeekingAlpha,Sirius XM Radio to raise $1.95B in senior notes offering,https://seekingalpha.com/news/3722879,
SeekingAlpha,Prometheus Biosciences initiates mid-stage PRA023 Crohn’s disease trial,https://seekingalpha.com/news/3722878,
