feed,title,long_url,short_url
Benzinga,Aeromexico reaches agreement with Unions,https://www.benzinga.com/pressreleases/21/01/n19366479/aeromexico-reaches-agreement-with-unions,https://j.mp/3sZAM7P
Benzinga,energyhill Develops Mobile App to Simplify Tuition Payments,https://www.benzinga.com/pressreleases/21/01/n19366480/energyhill-develops-mobile-app-to-simplify-tuition-payments,https://j.mp/2YjzvKu
Benzinga,The Global Building Information Modeling Software Market is expected to grow by $ 8.38 bn during 2021-2025 progressing at a CAGR of 24% during the forecast period,https://www.benzinga.com/pressreleases/21/01/g19366478/the-global-building-information-modeling-software-market-is-expected-to-grow-by-8-38-bn-during-202,https://j.mp/3cfveQx
Benzinga,"Fusion PPE Lowers Pricing of N95, KN95 and other High-filtration Masks to Support President Biden's 100-day Challenge and Doctors' Recommendations to Upgrade Masks to Stop Pandemic",https://www.benzinga.com/pressreleases/21/01/n19366477/fusion-ppe-lowers-pricing-of-n95-kn95-and-other-high-filtration-masks-to-support-president-bidens-,https://j.mp/2My72OA
Benzinga,Scitara Raises $5 Million to Accelerate Digital Transformation of Scientific Laboratories,https://www.benzinga.com/pressreleases/21/01/b19366476/scitara-raises-5-million-to-accelerate-digital-transformation-of-scientific-laboratories,https://j.mp/36kDc78
Benzinga,"Welding Vendors Focusing on New Technologies and Energy Efficiency for Business Growth, Finds Frost & Sullivan",https://www.benzinga.com/pressreleases/21/01/n19366465/welding-vendors-focusing-on-new-technologies-and-energy-efficiency-for-business-growth-finds-frost,https://j.mp/2Yp7mla
Benzinga,"Welding Vendors Focusing on New Technologies and Energy Efficiency for Business Growth, Finds Frost & Sullivan",https://www.benzinga.com/pressreleases/21/01/n19366463/welding-vendors-focusing-on-new-technologies-and-energy-efficiency-for-business-growth-finds-frost,https://j.mp/3a9EvH3
Benzinga,"Worldwide RNA Vaccine Patent Industry Report 2021 - Players Include CureVac, Moderna and BioNTech Among Others",https://www.benzinga.com/pressreleases/21/01/g19366454/worldwide-rna-vaccine-patent-industry-report-2021-players-include-curevac-moderna-and-biontech-amo,https://j.mp/2MuEa9Y
Benzinga,Thrive Completes Recapitalization with Court Square Capital to Accelerate Growth,https://www.benzinga.com/pressreleases/21/01/n19366459/thrive-completes-recapitalization-with-court-square-capital-to-accelerate-growth,https://j.mp/3qWG1mI
Benzinga,Insights on the Cement and Concrete Products Global Market to 2030 - Identify Growth Segments for Investment - ResearchAndMarkets.com,https://www.benzinga.com/pressreleases/21/01/b19366449/insights-on-the-cement-and-concrete-products-global-market-to-2030-identify-growth-segments-for-in,https://j.mp/3iSP2un
