feed,title,long_url,short_url
Benzinga,"Global Synthetic Dye and Pigment Market Trajectory & Analytics Report 2020: Market to Reach US$238.8 Billion by the Year 2027, from $77 Billion in 2020 - ResearchAndMarkets.com",https://www.benzinga.com/pressreleases/21/01/b19371842/global-synthetic-dye-and-pigment-market-trajectory-analytics-report-2020-market-to-reach-us-238-8-,https://j.mp/3pqShvy
Benzinga,Radio Broadcasting Global Market Report 2021: COVID 19 Impact and Recovery to 2030,https://www.benzinga.com/pressreleases/21/01/g19371789/radio-broadcasting-global-market-report-2021-covid-19-impact-and-recovery-to-2030,https://j.mp/36kGKqa
Benzinga,Qatar National Tourism Council Announces Jason Statham Has Been Spotted Filming in Qatar,https://www.benzinga.com/pressreleases/21/01/n19371797/qatar-national-tourism-council-announces-jason-statham-has-been-spotted-filming-in-qatar,https://j.mp/3qZIJb3
Benzinga,Qatar National Tourism Council Announces Jason Statham Has Been Spotted Filming in Qatar,https://www.benzinga.com/pressreleases/21/01/n19371795/qatar-national-tourism-council-announces-jason-statham-has-been-spotted-filming-in-qatar,https://j.mp/2KXblm5
Benzinga,Global Sepsis Diagnostics Market is estimated to be US$ 1070 million by 2029 with a CAGR of 8.1% during the forecast period - by PMI,https://www.benzinga.com/pressreleases/21/01/g19371727/global-sepsis-diagnostics-market-is-estimated-to-be-us-1070-million-by-2029-with-a-cagr-of-8-1-dur,https://j.mp/3orJubd
Benzinga,"MJ Holdings, Inc. Announces the Execution of a Letter of Intent to Acquire Cultivation and Production Licenses",https://www.benzinga.com/pressreleases/21/01/g19371726/mj-holdings-inc-announces-the-execution-of-a-letter-of-intent-to-acquire-cultivation-and-productio,https://j.mp/2Yna6zE
Benzinga,Standex Declares 226th Consecutive Quarterly Dividend,https://www.benzinga.com/pressreleases/21/01/n19371683/standex-declares-226th-consecutive-quarterly-dividend,https://j.mp/39oFIuW
Benzinga,Standard Chartered Earns Top Marks in Human Rights Campaign's 2021 Corporate Equality Index,https://www.benzinga.com/pressreleases/21/01/b19371665/standard-chartered-earns-top-marks-in-human-rights-campaigns-2021-corporate-equality-index,https://j.mp/2YkRSyP
