feed,title,long_url,short_url
SeekingAlpha,"Strattec Security EPS beats by $0.63, beats on revenue",https://seekingalpha.com/news/3655899,
SeekingAlpha,"First Financial Bankshares EPS beats by $0.04, misses on revenue",https://seekingalpha.com/news/3655898,
SeekingAlpha,Avinger secures $14.4M via equity raise,https://seekingalpha.com/news/3655894,
SeekingAlpha,"Byline Bancorp EPS beats by $0.11, beats on revenue",https://seekingalpha.com/news/3655896,
SeekingAlpha,"Dolby Labs stock gains after FQ1 beats, raised revenue outlook",https://seekingalpha.com/news/3655895,
