feed,title,long_url,short_url
ETFTrends:DailyRecap,What to Make of the Recent Volatility & the Potential for Fed Rate Cuts,https://www.etftrends.com/etf-strategist-channel/recent-volatility-potential-fed-rate-cuts/,https://da.gd/rdlmES
ETFTrends:DailyRecap,Opportunity Knocks for Emerging Markets ETFs,https://www.etftrends.com/opportunity-knocks-emerging-markets-etfs/,https://da.gd/FzjQUt
ETFTrends:DailyRecap,Opportunity Knocks for Growth ETFs,https://www.etftrends.com/portfolio-construction-channel/opportunity-knocks-growth-etfs/,https://da.gd/OS1jn
ETFTrends:DailyRecap,VIDEO: ETF of the Week: ALPS O’Shares US Small-Cap Quality Dividend ETF (OUSM),https://www.etftrends.com/etf-building-blocks-channel/video-alps-oshares-us-small-cap-quality-dividend-etf-ousm-etf-of-the-week/,https://da.gd/YsuJAL
ETFTrends:DailyRecap,Bonds Could Be Poised to Outperform Stocks in Next Decade,https://www.etftrends.com/fixed-income-channel/bonds-could-poised-outperform-stocks-next-decade/,https://da.gd/QrexX
ETFTrends:DailyRecap,2 Leveraged ETFs to Play Small-Caps Strategically,https://www.etftrends.com/leveraged-inverse-channel/2-leveraged-etfs-play-small-caps-strategically/,https://da.gd/ia1LQ
ETFTrends:DailyRecap,"With Muni Bonds, Active Management Holds Appeal",https://www.etftrends.com/etf-yield-channel/muni-bonds-active-management-holds-appeal/,https://da.gd/YcvDL
ETFTrends:DailyRecap,"Exploring Economic Indicators: Household Debt, Services PMI & Trade",https://www.etftrends.com/innovative-etfs-channel/exploring-economic-indicators-household-debt-services-pmi-trade/,https://da.gd/XKdGJ
ETFTrends:DailyRecap,Rate Cut Uncertainty Speaks to Case for This Active Fixed Income ETF,https://www.etftrends.com/active-etf-channel/rate-cut-uncertainty-speaks-case-active-fixed-income-etf/,https://da.gd/dojHG
ETFTrends:DailyRecap,Encouraging Trends in IG Corporate Bond Space,https://www.etftrends.com/model-portfolio-channel/encouraging-trends-ig-corporate-bond-space/,https://da.gd/mWAh
ETFTrends:DailyRecap,Don’t Panic!,https://www.etftrends.com/etf-strategist-channel/avoid-panicking/,https://da.gd/doZ9
ETFTrends:DailyRecap,Beat Cash Yields With This Dividend ETF,https://www.etftrends.com/etf-building-blocks-channel/beat-cash-yields-dividend-etf/,https://da.gd/xO2G
ETFTrends:DailyRecap,Diversify Your Core Equity Sector Exposure With VFLO,https://www.etftrends.com/free-cash-flow-channel/diversify-core-equity-sector-exposure-vflo/,https://da.gd/RagcP
ETFTrends:DailyRecap,Growing Supply of Active Municipal Bond ETFs,https://www.etftrends.com/growing-supply-active-municipal-bond-etfs/,https://da.gd/l6uT
ETFTrends:DailyRecap,Money in Motion: Playing Along Directly With Fed Rate Cuts,https://www.etftrends.com/model-portfolio-channel/money-motion-playing-along-directly-fed-rate-cuts/,https://da.gd/5tzpL
ETFTrends:DailyRecap,How to Use Non-GAAP Reporting and Make Better Investment Choices,https://www.etftrends.com/how-use-non-gaap-reporting-make-better-investment-choices/,https://da.gd/YlGI
ETFTrends:DailyRecap,Economic Indicators Are Flashing Mixed Signals Amid Recession Speculation,https://www.etftrends.com/economic-indicators-flashing-mixed-signals-amid-recession-speculation/,https://da.gd/cqKDyg
