feed,title,long_url,short_url
Investing,Earnings call: Vislink announced a 73% year-over-year increase in revenue,https://www.investing.com/news/stock-market-news/earnings-call-vislink-announced-a-73-yearoveryear-increase-in-revenue-93CH-3572606,https://da.gd/rvTjp
Investing,"Earnings call: Extendicare reports robust Q2 growth, high occupancy",https://www.investing.com/news/stock-market-news/earnings-call-extendicare-reports-robust-q2-growth-high-occupancy-93CH-3572603,https://da.gd/drQ1
Investing,Earnings call: Ondas Holdings Q2 2024 results reflect challenging start,https://www.investing.com/news/stock-market-news/earnings-call-ondas-holdings-q2-2024-results-reflect-challenging-start-93CH-3572604,https://da.gd/rPcjNu
Investing,Earnings call: CorMedix reported a net loss of $14.2 million,https://www.investing.com/news/stock-market-news/earnings-call-cormedix-reported-a-net-loss-of-142-million-93CH-3572599,https://da.gd/Z2xpGZ
Investing,Earnings call: Reed's Q2 2024 results show strong sales and margin growth,https://www.investing.com/news/stock-market-news/earnings-call-reeds-q2-2024-results-show-strong-sales-and-margin-growth-93CH-3572594,https://da.gd/1Ig6
Investing,Earnings call: Lowell Farms reports a net revenue of $3.5 million,https://www.investing.com/news/stock-market-news/earnings-call-lowell-farms-reports-a-net-revenue-of-35-million-93CH-3572589,https://da.gd/GHlcY
