feed,title,long_url,short_url
SeekingAlpha,"Biggest stock movers today: Meta Platforms, Chipotle Mexican Grill and more",https://seekingalpha.com/news/3991831,
SeekingAlpha,Saipem SpA reports 1H results,https://seekingalpha.com/news/3991896,
SeekingAlpha,"Gladstone Capital GAAP NII of $0.31 beats by $0.04, total investment income of $22.82M beats by $1.15M",https://seekingalpha.com/news/3991895,
SeekingAlpha,"Linde Non-GAAP EPS of $3.57 beats by $0.09, revenue of $8.2B misses by $500M",https://seekingalpha.com/news/3991894,
SeekingAlpha,Hoisington Investment Management Q2 2023 Review And Outlook,https://seekingalpha.com/article/4620364,
