feed,title,long_url,short_url
Yahoo,Daily Spotlight: Fed Gets Back to Work,https://finance.yahoo.com/research/reports/ARGUS_37178_MarketOutlook_1690457457000?yptr=yahoo&ncid=yahooproperties_plusresear_nm5q6ze1cei,https://da.gd/wc2X
Yahoo,Technical Assessment: Neutral in the Intermediate-Term,https://finance.yahoo.com/research/reports/ARGUS_37177_TechnicalAnalysis_1690457431000?yptr=yahoo&ncid=yahooproperties_plusresear_nm5q6ze1cei,https://da.gd/XmtU0
Yahoo,Analyst Report: Toll Brothers Inc,https://finance.yahoo.com/research/reports/ARGUS_3452_AnalystReport_1690457400000?yptr=yahoo&ncid=yahooproperties_plusresear_nm5q6ze1cei,https://da.gd/vzyhb6
Yahoo,"Analyst Report: Fiserv, Inc",https://finance.yahoo.com/research/reports/ARGUS_2972_AnalystReport_1690457400000?yptr=yahoo&ncid=yahooproperties_plusresear_nm5q6ze1cei,https://da.gd/O1tX
Yahoo,Analyst Report: Cleveland-Cliffs Inc,https://finance.yahoo.com/research/reports/ARGUS_5171_AnalystReport_1690457400000?yptr=yahoo&ncid=yahooproperties_plusresear_nm5q6ze1cei,https://da.gd/iKZoiG
Yahoo,Analyst Report: Visa Inc,https://finance.yahoo.com/research/reports/ARGUS_3489_AnalystReport_1690457400000?yptr=yahoo&ncid=yahooproperties_plusresear_nm5q6ze1cei,https://da.gd/Og3h
Yahoo,Analyst Report: Fortive Corp,https://finance.yahoo.com/research/reports/ARGUS_3681_AnalystReport_1690457400000?yptr=yahoo&ncid=yahooproperties_plusresear_nm5q6ze1cei,https://da.gd/iRyk
Yahoo,"Elon, where’s my Cybertruck? Millions are still waiting for Tesla’s elusive product years after reserving it",https://finance.yahoo.com/news/elon-where-cybertruck-millions-still-100000618.html?.tsrc=rss,https://da.gd/rZBHHU
