feed,title,long_url,short_url
InvestorPlace,The Cost to Borrow Tupperware (TUP) Stock Is Up 500% This Week,https://investorplace.com/2023/07/the-cost-to-borrow-tupperware-tup-stock-is-up-500-this-week/,https://da.gd/sE1k
InvestorPlace,The Cost to Borrow AMC Entertainment (AMC) Stock Is Swinging Wildly,https://investorplace.com/2023/07/the-cost-to-borrow-amc-entertainment-amc-stock-is-swinging-wildly/,https://da.gd/OKqnot
InvestorPlace,Gas Price Alert: Why Are Gas Prices Going Up Again?,https://investorplace.com/2023/07/gas-price-alert-why-are-gas-prices-going-up-again/,https://da.gd/ZB95
InvestorPlace,AMC Stock: Adam Aron Asks for APE Court Decision in Early August,https://investorplace.com/2023/07/amc-stock-adam-aron-asks-for-ape-court-decision-in-early-august/,https://da.gd/OZ7V
InvestorPlace,MXL Stock Alert: Why Is MaxLinear Down 23% Today?,https://investorplace.com/2023/07/mxl-stock-alert-why-is-maxlinear-down-23-today/,https://da.gd/17ofRT
InvestorPlace,3 Cryptocurrencies to Consider for Long-Term Investment,https://investorplace.com/2023/07/3-cryptocurrencies-to-consider-for-long-term-investment/,https://da.gd/9C0HI
