feed,title,long_url,short_url
Benzinga,"Martin Marietta Materials Q2: Revenue Miss, Lower Aggregates Shipments & More",https://benzinga.com/news/earnings/23/07/33424335/martin-marietta-materials-q2-revenue-miss-lower-aggregates-shipments-more,https://da.gd/8owx
Benzinga,Here's How Much You Would Have Made Owning NextEra Energy Stock In The Last 20 Years,https://benzinga.com/news/earnings/23/07/33426754/heres-how-much-you-would-have-made-owning-nextera-energy-stock-in-the-last-20-years,https://da.gd/iJiEA
Benzinga,$1000 Invested In Stryker 10 Years Ago Would Be Worth This Much Today,https://benzinga.com/news/earnings/23/07/33426752/1000-invested-in-stryker-10-years-ago-would-be-worth-this-much-today,https://da.gd/LjBY
Benzinga,Check Out What Whales Are Doing With COP,https://benzinga.com/markets/options/23/07/33426769/check-out-what-whales-are-doing-with-cop,https://da.gd/JQfWYX
Benzinga,Check Out What Whales Are Doing With MPC,https://benzinga.com/markets/options/23/07/33426765/check-out-what-whales-are-doing-with-mpc,https://da.gd/ULW0
