feed,title,long_url,short_url
SeekingAlpha,"Diversified Healthcare Trust FFO of $0.05 misses by $0.04, revenue of $346.2M misses by $6.95M",https://seekingalpha.com/news/3994693,
SeekingAlpha,"Terex GAAP EPS of $2.35 beats by $0.73, revenue of $1.4B beats by $130M",https://seekingalpha.com/news/3994692,
SeekingAlpha,"Nevro GAAP EPS of -$0.69 in-line, revenue of $108.8M beats by $0.74M",https://seekingalpha.com/news/3994691,
SeekingAlpha,"Quaker Houghton  Non-GAAP EPS of $1.93 beats by $0.06, revenue of $495.4M misses by $11.62M",https://seekingalpha.com/news/3994689,
SeekingAlpha,Schneider acquires New England based dedicated carrier,https://seekingalpha.com/news/3994690,
SeekingAlpha,"Cytosorbents GAAP EPS of -$0.14 in-line, revenue of $9.4M misses by $0.8M",https://seekingalpha.com/news/3994688,
SeekingAlpha,Flora Growth signs global partnership to sell Hulk Hogan cannabis products,https://seekingalpha.com/news/3994687,
SeekingAlpha,"TG Therapeutics: Fairly Valued After Earnings Miss, EU Deal (Rating Upgrade)",https://seekingalpha.com/article/4622347,
