feed,title,long_url,short_url
ETFTrends,Using Fixed Income to Navigate Changing Markets,https://www.etftrends.com/active-etf-channel/using-fixed-income-to-navigate-changing-markets/,https://da.gd/vg2p8
ETFTrends,This Little-Known NEOS ETF Is Outperforming Among Cash Alternatives,https://www.etftrends.com/monthly-income-channel/this-little-known-neos-etf-is-outperforming-among-cash-alternatives/,https://da.gd/u53N
ETFTrends,RENW Fits as Core Component in Energy Transition Portfolios,https://www.etftrends.com/market-insights-channel/renw-fits-as-core-component-in-energy-transition-portfolios/,https://da.gd/ioIr
ETFTrends,VettaFi’s TMX Partnership: The Innovation Angle,https://www.etftrends.com/vettafis-tmx-partnership-the-innovation-angle/,https://da.gd/cnNq
ETFTrends,3 Investment Themes for 2023,https://www.etftrends.com/etf-strategist-channel/3-investment-themes-for-2023/,https://da.gd/0kRGUp
