feed,title,long_url,short_url
Investing,AI Derangement Syndrome Sparks Flight to Quality as Yields Fall,https://www.investing.com/analysis/ai-derangement-syndrome-sparks-flight-to-quality-as-yields-fall-200675823,
Investing,"Netflix, Dell among market cap stock movers on Friday",https://www.investing.com/news/stock-market-news/netflix-dell-among-market-cap-stock-movers-on-friday-93CH-4532490,
Investing,Manufacturing PMI and ISM data highlight Monday’s economic calendar,https://www.investing.com/news/stock-market-news/manufacturing-pmi-and-ism-data-highlight-mondays-economic-calendar-93CH-4532489,
Investing,"Exclusive-Paramount expected to easily secure EU nod for Warner Bros deal, sources say",https://www.investing.com/news/stock-market-news/exclusiveparamount-expected-to-easily-secure-eu-nod-for-warner-bros-deal-sources-say-4532478,
Investing,Dorsey’s blunt AI warning sharpens debate over jobs and profits,https://www.investing.com/news/stock-market-news/dorseys-blunt-ai-warning-sharpens-debate-over-jobs-and-profits-4532487,
