feed,title,long_url,short_url
DailyHodl,Visa Exploring Ways of Paying Transaction Fees on the Ethereum Blockchain With Just a Card,https://dailyhodl.com/2023/08/11/visa-exploring-ways-of-paying-transaction-fees-on-the-ethereum-blockchain-with-just-a-card/,https://da.gd/TukYi
DailyHodl,Argentina’s Data Privacy Agency Investigating Controversial Crypto Project Worldcoin (WLD),https://dailyhodl.com/2023/08/11/argentinas-data-privacy-agency-investigating-controversial-crypto-project-worldcoin-wld/,https://da.gd/TcL776
DailyHodl,"Crypto Analyst Breaks Down Bitcoin (BTC) and XRP, Doubles Down on Bull Run Prediction",https://dailyhodl.com/2023/08/11/crypto-analyst-breaks-down-bitcoin-btc-and-xrp-doubles-down-on-bull-run-prediction/,https://da.gd/a0TcL
DailyHodl,Barry Silbert and Digital Currency Group File To Dismiss Gemini Fraud Lawsuit Involving Alleged Debt Delinquency,https://dailyhodl.com/2023/08/11/barry-silbert-and-digital-currency-group-file-to-dismiss-gemini-fraud-lawsuit-involving-alleged-debt-delinquency/,https://da.gd/7FFin
DailyHodl,U.S. Securities and Exchanges Commission (SEC) Opens Potential Bitcoin Spot ETFs to Public Opinion,https://dailyhodl.com/2023/08/11/u-s-securities-and-exchanges-commission-sec-opens-potential-bitcoin-spot-etfs-to-public-opinion/,https://da.gd/X9By
DailyHodl,Binance Labs Commits $10 Million to Helio Protocol To Advance the LSDfi Revolution,https://dailyhodl.com/2023/08/11/binance-labs-commits-10-million-to-helio-protocol-to-advance-the-lsdfi-revolution/,https://da.gd/NZQ4pg
DailyHodl,"Analyst Says Bitcoin’s Going To Be an ‘Easy Long-Term Trade’ Due to One Catalyst, Updates Outlook on Shiba Inu",https://dailyhodl.com/2023/08/11/analyst-says-bitcoins-going-to-be-an-easy-long-term-trade-due-to-one-catalyst-updates-outlook-on-shiba-inu/,https://da.gd/cduB06
DailyHodl,"Top Crypto Exchange Binance Sinks $5,000,000 Into Curve (CRV) Following Massive Hack on the DeFi Platform",https://dailyhodl.com/2023/08/11/top-crypto-exchange-binance-sinks-5000000-into-curve-crv-following-massive-hack-on-the-defi-platform/,https://da.gd/V3Nihw
DailyHodl,"Blockchain Event OnXDC Live Debuts in Austin, Texas, on August 25–26, 2023",https://dailyhodl.com/2023/08/11/blockchain-event-onxdc-live-debuts-in-austin-texas-on-august-25-26-2023/,https://da.gd/eLC0Y
DailyHodl,"Litecoin Flashing Bullish Signal As Whales and Sharks Accumulate LTC, Says Santiment – But There’s a Catch",https://dailyhodl.com/2023/08/11/litecoin-flashing-bullish-signal-as-whales-and-sharks-accumulate-ltc-says-santiment-but-theres-a-catch/,https://da.gd/4k47v
