feed,title,long_url,short_url
SeekingAlpha,"Pacific Premier Bancorp EPS beats by $0.31, beats on revenue",https://seekingalpha.com/news/3719460,
SeekingAlpha,"Stanley Black & Decker EPS beats by $0.19, beats on revenue; raises full year guidance",https://seekingalpha.com/news/3719459,
SeekingAlpha,"Sensata Technologies EPS beats by $0.08, beats on revenue",https://seekingalpha.com/news/3719458,
SeekingAlpha,"Entegris EPS beats by $0.06, beats on revenue, guides Q3 above estimates",https://seekingalpha.com/news/3719457,
SeekingAlpha,"Centene EPS misses by $0.12, beats on revenue, boost FY21 revenue outllok",https://seekingalpha.com/news/3719456,
SeekingAlpha,"UPS EPS beats by $0.25, beats on revenue",https://seekingalpha.com/news/3719455,
