feed,title,long_url,short_url
Nasdaq,United Parcel Service Q2 adjusted earnings of $3.06 per share,https://www.nasdaq.com/articles/united-parcel-service-q2-adjusted-earnings-of-%243.06-per-share-2021-07-27,https://j.mp/3fjYqXt
Nasdaq,2 Beaten-Down Biotech Stocks That Could Bounce Back,https://www.nasdaq.com/articles/2-beaten-down-biotech-stocks-that-could-bounce-back-2021-07-27,https://j.mp/3BJSjoI
Nasdaq,UPS beats revenue estimates on steady online shipments,https://www.nasdaq.com/articles/ups-beats-revenue-estimates-on-steady-online-shipments-2021-07-27,https://j.mp/3BDNJbw
Nasdaq,These 3 Cheap Growth Stocks Should Easily Beat AMC,https://www.nasdaq.com/articles/these-3-cheap-growth-stocks-should-easily-beat-amc-2021-07-27,https://j.mp/3i3UuLY
Nasdaq,Centene reports second-quarter loss,https://www.nasdaq.com/articles/centene-reports-second-quarter-loss-2021-07-27,https://j.mp/3x6V681
Nasdaq,These High-Flying Stocks Can Run Circles Around Ethereum,https://www.nasdaq.com/articles/these-high-flying-stocks-can-run-circles-around-ethereum-2021-07-27,https://j.mp/3i6rGTf
Nasdaq,These Smart Decisions in Your 30s Could Lead to Early Retirement,https://www.nasdaq.com/articles/these-smart-decisions-in-your-30s-could-lead-to-early-retirement-2021-07-27,https://j.mp/2TE4Xob
Nasdaq,Indonesia's BRI Life probes reported data leak of 2 million users,https://www.nasdaq.com/articles/indonesias-bri-life-probes-reported-data-leak-of-2-million-users-2021-07-27,https://j.mp/3BJSikE
Nasdaq,2 Overlooked Bank Stocks That Just Crushed Earnings,https://www.nasdaq.com/articles/2-overlooked-bank-stocks-that-just-crushed-earnings-2021-07-27,https://j.mp/3BLlrvT
