feed,title,long_url,short_url
SeekingAlpha,"Five9 EPS beats by $0.09, beats on revenue",https://seekingalpha.com/news/3720081,
SeekingAlpha,"TESSCO Technologies EPS misses by $0.05, revenue in-line",https://seekingalpha.com/news/3720079,
SeekingAlpha,"Visa EPS beats by $0.14, beats on revenue",https://seekingalpha.com/news/3720078,
SeekingAlpha,First Quantum Minerals beats on revenue,https://seekingalpha.com/news/3720076,
SeekingAlpha,"Horizon Technology Finance NII beats by $0.01, beats on total investment income",https://seekingalpha.com/news/3720075,
SeekingAlpha,"Trustmark EPS beats by $0.09, beats on revenue",https://seekingalpha.com/news/3720074,
