feed,title,long_url,short_url
Benzinga,MayStreet Names Manisha Kimmel Chief Policy Officer,https://www.benzinga.com/pressreleases/21/02/g19584593/maystreet-names-manisha-kimmel-chief-policy-officer,https://j.mp/3cYYZWf
Benzinga,QuickLogic Launches Qomu - an Open Source SoC Dev Kit That Fits in Your USB Port,https://www.benzinga.com/pressreleases/21/02/n19584586/quicklogic-launches-qomu-an-open-source-soc-dev-kit-that-fits-in-your-usb-port,https://j.mp/3rDFNkF
Benzinga,Garnier Whole Blends Announces Drew Barrymore as Brand Ambassador,https://www.benzinga.com/pressreleases/21/02/n19584584/garnier-whole-blends-announces-drew-barrymore-as-brand-ambassador,https://j.mp/3tKuPf9
Benzinga,Recent Otezla Growth: A Result of the Amgen Acquisition or Benefiting from the Pandemic?,https://www.benzinga.com/pressreleases/21/02/n19584583/recent-otezla-growth-a-result-of-the-amgen-acquisition-or-benefiting-from-the-pandemic,https://j.mp/3jAX2QO
Benzinga,"U.S. Anesthesia Partners Signs Three-Year Agreement with Cigna HealthCare of Florida, Inc.",https://www.benzinga.com/pressreleases/21/02/b19584579/u-s-anesthesia-partners-signs-three-year-agreement-with-cigna-healthcare-of-florida-inc,https://j.mp/2LFHEX2
Benzinga,"Global Biodefense Market By Product, By Region, Industry Analysis and Forecast, 2020 - 2026",https://www.benzinga.com/pressreleases/21/02/g19584575/global-biodefense-market-by-product-by-region-industry-analysis-and-forecast-2020-2026,https://j.mp/2Ol3QXj
Benzinga,IIROC Trade Resumption - AD.UN,https://www.benzinga.com/pressreleases/21/02/n19584577/iiroc-trade-resumption-ad-un,https://j.mp/3rDFNRH
Benzinga,Insights on the Ball Valve Global Market to 2026 - Food Processing Industry Expected to Have Significant Applications,https://www.benzinga.com/pressreleases/21/02/g19584567/insights-on-the-ball-valve-global-market-to-2026-food-processing-industry-expected-to-have-signifi,https://j.mp/3qepFGk
Benzinga,myViewBoard Software Platform Leads EdTech's Transformation in Hybrid Learning,https://www.benzinga.com/pressreleases/21/02/b19584553/myviewboard-software-platform-leads-edtechs-transformation-in-hybrid-learning,https://j.mp/2N9oLMu
Benzinga,"BioVaxys and Procare Health Announce Broad Co-Development, Joint Commercialization and Marketing Collaboration for Cancer and Viral Vaccines",https://www.benzinga.com/pressreleases/21/02/n19584548/biovaxys-and-procare-health-announce-broad-co-development-joint-commercialization-and-marketing-co,https://j.mp/3tNbDNK
Benzinga,"BioVaxys and Procare Health Announce Broad Co-Development, Joint Commercialization and Marketing Collaboration for Cancer and Viral Vaccines",https://www.benzinga.com/pressreleases/21/02/n19584497/biovaxys-and-procare-health-announce-broad-co-development-joint-commercialization-and-marketing-co,https://j.mp/372rdLN
Benzinga,Dutch Bros teams up with customers to help fight hunger this Valentine's Day,https://www.benzinga.com/pressreleases/21/02/n19584490/dutch-bros-teams-up-with-customers-to-help-fight-hunger-this-valentines-day,https://j.mp/3705LH8
Benzinga,Regulus Therapeutics Announces Completion of Enrollment in First Cohort of Phase 1b Clinical Trial of RGLS4326 for the Treatment of Patients with Autosomal Dominant Polycystic Kidney Disease (ADPKD),https://www.benzinga.com/pressreleases/21/02/n19584488/regulus-therapeutics-announces-completion-of-enrollment-in-first-cohort-of-phase-1b-clinical-trial,https://j.mp/3p7H7uC
Benzinga,Kith Republic Disrupts Human Resources with Direct-to-Consumer Employee Advocacy and Female Empowerment Application,https://www.benzinga.com/pressreleases/21/02/g19584485/kith-republic-disrupts-human-resources-with-direct-to-consumer-employee-advocacy-and-female-empowe,https://j.mp/2MVETkR
Benzinga,Global Inflammatory Pain Pipeline Market Report 2021 - ResearchAndMarkets.com,https://www.benzinga.com/pressreleases/21/02/b19584484/global-inflammatory-pain-pipeline-market-report-2021-researchandmarkets-com,https://j.mp/3a32Qj4
