feed,title,long_url,short_url
SeekingAlpha,Huntington Ingalls reports Q2 earnings beat; reaffirms and updates FY22 guidance,https://seekingalpha.com/news/3867034,
SeekingAlpha,"Lifetime Brands Non-GAAP EPS of -$0.14 misses by $0.19, revenue of $151.3M misses by $31.25M",https://seekingalpha.com/news/3867033,
SeekingAlpha,"Superior GAAP EPS of $0.07, revenue of $431.5M",https://seekingalpha.com/news/3867032,
SeekingAlpha,"Vital Farms GAAP EPS of $0.00 beats by $0.03, revenue of $82.9M beats by $3.29M",https://seekingalpha.com/news/3867031,
SeekingAlpha,"Deciphera Pharmaceuticals GAAP EPS of -$0.60 beats by $0.06, revenue of $32.5M beats by $2.39M",https://seekingalpha.com/news/3867030,
SeekingAlpha,"Lantheus Non-GAAP EPS of $0.89 beats by $0.19, revenue of $223.72M beats by $19.21M",https://seekingalpha.com/news/3867029,
SeekingAlpha,"Travere Therapeutics GAAP EPS of -$1.05 misses by $0.14, revenue of $54.2M beats by $4.7M",https://seekingalpha.com/news/3867028,
