feed,title,long_url,short_url
SeekingAlpha,Cuentas to raise $3M in stock and warrants offering,https://seekingalpha.com/news/3867171,
SeekingAlpha,"Quebecor Non-GAAP EPS of $0.68, revenue of $1.12B beats by $236.25M",https://seekingalpha.com/news/3867170,
SeekingAlpha,Tritax Big Box REIT plc Non-GAAP EPS of $3.73,https://seekingalpha.com/news/3867169,
SeekingAlpha,Elevation Oncology GAAP EPS of -$0.86 misses by $0.07,https://seekingalpha.com/news/3867168,
SeekingAlpha,"Serco Non-GAAP EPS of $7.41, revenue of $2.18B, FY22 revenue guidance unchanged",https://seekingalpha.com/news/3867167,
SeekingAlpha,"Williams Industrial Services slashes FY guidance on one-time costs, project delays",https://seekingalpha.com/news/3867166,
