feed,title,long_url,short_url
SeekingAlpha,"Axos FinancialFQ4 Non-GAAP EPS, revenue beats,",https://seekingalpha.com/news/3867560,
SeekingAlpha,"Main Street Capital Non-GAAP EPS of $0.78 beats by $0.06, total investment income of $85.2M beats by $3.8M",https://seekingalpha.com/news/3867559,
SeekingAlpha,"Universal Electronics Non-GAAP EPS of $0.66, revenue of $139.1M",https://seekingalpha.com/news/3867558,
SeekingAlpha,"Fox Factory Non-GAAP EPS of $1.38 beats by $0.16, revenue of $406.7M beats by $7.57M",https://seekingalpha.com/news/3867557,
SeekingAlpha,"Jones Soda GAAP EPS of -$0.02, revenue of $6.02M",https://seekingalpha.com/news/3867553,
SeekingAlpha,Doma proposes reverse stock split to regain compliance with NYSE listing rules,https://seekingalpha.com/news/3867552,
