feed,title,long_url,short_url
Yahoo,"The Best High-Yield Midstream Stock to Invest $10,000 in Right Now",https://finance.yahoo.com/news/best-high-yield-midstream-stock-090000213.html,https://da.gd/Bqqq8
Yahoo,Down payments are the biggest homeownership hurdle. Why is Washington making them scarcer?,https://finance.yahoo.com/news/down-payments-biggest-homeownership-hurdle-090241732.html,https://da.gd/Ef7o8f
Yahoo,Is NVIDIA Corporation (NVDA) the Best Augmented Reality Stock to Buy According to Hedge Funds?,https://finance.yahoo.com/news/nvidia-corporation-nvda-best-augmented-093716287.html,https://da.gd/CyGLg
Yahoo,"Tesla, Inc. (TSLA): Thousands of Robots by Year-End? Musk’s Ambitious AI Timeline Sparks Debate",https://finance.yahoo.com/news/tesla-inc-tsla-thousands-robots-093755166.html,https://da.gd/fzfJ5
Yahoo,"Palo Alto Networks, Inc. (PANW): Protect AI Acquisition Pushes Cybersecurity Giant Further Ahead in AI Race",https://finance.yahoo.com/news/palo-alto-networks-inc-panw-093904726.html,https://da.gd/kcW9aS
Yahoo,"Is A10 Networks, Inc. (ATEN) the Best Cybersecurity Stock to Invest in Under $20?",https://finance.yahoo.com/news/a10-networks-inc-aten-best-093953725.html,https://da.gd/QLsqBc
Yahoo,Is Piedmont Lithium Inc. (PLL) Among the Most Promising EV Battery Stocks According to Wall Street Analysts?,https://finance.yahoo.com/news/piedmont-lithium-inc-pll-among-094407218.html,https://da.gd/bxLpBS
Yahoo,"Stocks close sharply higher, lifted by Microsoft, Meta earnings",https://finance.yahoo.com/news/us-stock-index-futures-bounce-094318538.html,https://da.gd/ZY0hHb
Yahoo,"April jobs report preview: As Trump tariffs start, see sectors that are and aren't hiring",https://finance.yahoo.com/news/jobs-report-preview-tariffs-effect-090915522.html,https://da.gd/b9zq03
