feed,title,long_url,short_url
Yahoo,How to find and cancel forgotten online subscriptions that are costing you a fortune,https://finance.yahoo.com/news/cancel-forgotten-online-subscriptions-costing-091300758.html,https://da.gd/IvlccG
Yahoo,Posco to build graphite plant in South Korea,https://finance.yahoo.com/news/posco-build-graphite-plant-south-091034355.html,https://da.gd/byDpW
Yahoo,Instacart buys e-commerce solutions provider Wynshop,https://finance.yahoo.com/news/instacart-buys-e-commerce-solutions-091300496.html,https://da.gd/HbkdXl
Yahoo,Flashfood names its first woman CEO,https://finance.yahoo.com/news/flashfood-names-first-woman-ceo-091059895.html,https://da.gd/kxFnS
Yahoo,"Cal-Maine Foods, Inc. (CALM): A Cheap Dividend Stock Being Targeted by Short Sellers",https://finance.yahoo.com/news/cal-maine-foods-inc-calm-094454083.html,https://da.gd/1bU1m
Yahoo,"Hyundai reports strong revenues, earnings in Q1",https://finance.yahoo.com/news/hyundai-reports-strong-revenues-earnings-091015118.html,https://da.gd/2tMo8
Yahoo,PSE&G open to utility-owned generation to tackle supply needs: CEO LaRossa,https://finance.yahoo.com/news/pse-g-open-utility-owned-092116776.html,https://da.gd/2Pp8c
