feed,title,long_url,short_url
Investing,What Elon Musk’s investment could mean for Twitter’s crypto plans,https://investing.com/news/-2799055,
Investing,Cano Health Stock Falls 8% After Piper Sandler Downgrade to Underweight on Challenged Outlook,https://investing.com/news/-2799038,
Investing,Tilray Stock Jumps 11% After Posting a Q3 Profit on Higher Revenue and Announcing Exclusive Whole Foods Deal,https://investing.com/news/-2799035,
Investing,Hungary PM Orban says price caps need to stay in place as much as possible,https://investing.com/news/-2799064,
Investing,Invesco to cut stake in India's Zee by more than a third to 11%,https://investing.com/news/-2799063,
Investing,"Wall Street Opens Lower, Hurt by Rising Bond Yields; Dow Down 280 Pts",https://investing.com/news/-2799057,
