feed,title,long_url,short_url
InsiderMonkey,Why Wall Street Maintains Buy Stance on AbCellera Biologics Inc. (ABCL) Amid Business Model Evolution?,https://insidermonkey.com/blog/--1647296,
InsiderMonkey,"indie Semiconductor, Inc. (INDI) Closing in on Profitability amid Backlog Growth",https://insidermonkey.com/blog/--1647303,
InsiderMonkey,Stagwell Inc. (STGW) is a Buy at Needham Amid Deals with Tech Giants,https://insidermonkey.com/blog/--1647309,
InsiderMonkey,Sana Biotechnology (SANA) Wins Analyst Support With Strategic Focus and Cash Strength,https://insidermonkey.com/blog/--1647313,
InsiderMonkey,This is Why Eve Holding Inc. (EVEX) is a Buy Despite Wider Than Expected Q3 Net Loss,https://insidermonkey.com/blog/--1647316,
InsiderMonkey,Nuvation Bio Inc. (NUVB) is a Buy at H.C. Wainwright on Cancer Drug Development Progress,https://insidermonkey.com/blog/--1647324,
InsiderMonkey,Wall Street Bullish on Alight Inc. (ALIT) amid Disappointing Q3 Results,https://insidermonkey.com/blog/--1647327,
InsiderMonkey,Compass Therapeutics Inc. (CMPX) is A Buy on Wall Street on Robust Pipeline Development,https://insidermonkey.com/blog/--1647342,
InsiderMonkey,Atai Beckley N.V. (ATAI) Receives Buy Rating on BPL-003 Edge against Spravato,https://insidermonkey.com/blog/--1647354,
InsiderMonkey,Rezolve AI PLC (RZLV) Secures $200M to Enhance AI Commerce in Europe and the US,https://insidermonkey.com/blog/--1647339,
InsiderMonkey,Citizens Lifts Benitec Biopharma Inc. (BNTC) Price Target on Topline Results for Oculopharyngeal Muscular Dystrophy Treatment,https://insidermonkey.com/blog/--1647360,
InsiderMonkey,Arcos Dorados Holdings Inc. (ARCO) Q3 Results Impress on Robust Growth in Argentina and Mexico,https://insidermonkey.com/blog/--1647364,
InsiderMonkey,CAE Inc. (CAE) Capitalizing on Generational Investments in the Defense Sector,https://insidermonkey.com/blog/--1647367,
InsiderMonkey,"Citizens Touts KalVista Pharmaceuticals, Inc. (KALV) Growth Trajectory on EKTERLY Prospects",https://insidermonkey.com/blog/--1647372,
InsiderMonkey,Buy Rating Reaffirmed: CorMedix Inc. (CRMD) Posts Profitability and Expands Outlook for 2025,https://insidermonkey.com/blog/--1647374,
InsiderMonkey,Barclays Lifts Tencent Music Entertainment Group (TME) Price Target on Solid Q3 Results and Strong Growth Trajectory,https://insidermonkey.com/blog/--1647378,
InsiderMonkey,Gates Industrial Corporation plc (GTES) Pursues Growth in Data Centers with New Liquid-Cooling Solution,https://insidermonkey.com/blog/--1647382,
