feed,title,long_url,short_url
ETFTrends,REIT Balance Sheets Are Looking Good,https://www.etftrends.com/etf-building-blocks-content/reit-balance-sheets-looking-good/,
ETFTrends,Quietly Big OutPerformance With This Small-Caps ETF,https://www.etftrends.com/model-portfolio-content-hub/quietly-big-outperformance-smalls-cap-etf/,
ETFTrends,Why It’s Time to Look at This Microsoft ETF,https://www.etftrends.com/leveraged-inverse-content-hub/time-look-microsoft-etf/,
ETFTrends,Baron Capital’s Active Approach Coming Soon to ETFs,https://www.etftrends.com/baron-capitals-active-approach-coming-etfs/,
ETFTrends,3Q25 Midstream/MLP Dividends: Payouts Stay Strong,https://www.etftrends.com/energy-infrastructure-content-hub/3q25-midstream-mlp-dividends-payouts-stay-strong/,
