feed,title,long_url,short_url
Investing,Nvidia Faces Earnings Test as AI Expectations Collide With Valuation Fears,https://www.investing.com/analysis/nvidia-faces-earnings-test-as-ai-expectations-collide-with-valuation-fears-200670384,
Investing,Is It Time to Give Up on the AI Trade? Why Hedge Funds Might Be Wrong,https://www.investing.com/analysis/is-it-time-to-give-up-on-the-ai-trade-why-hedge-funds-might-be-wrong-200670383,
Investing,"U.S. States can scrutinize Hewlett-Packard Enterprise’s $14 billion Juniper deal, says judge",https://www.investing.com/news/stock-market-news/us-states-can-scrutinize-hewlettpackard-enterprises-14-billion-juniper-deal-says-judge-93CH-4365998,
Investing,"US states can intervene in case over HPE’s $14 billion Juniper acquisition, judge rules",https://www.investing.com/news/stock-market-news/us-states-can-intervene-in-case-over-hpes-14-billion-juniper-acquisition-judge-rules-4365997,
Investing,"Fitch affirms Axia Energia at ’BB-’, revises outlook to positive",https://www.investing.com/news/stock-market-news/fitch-affirms-axia-energia-at-bb-revises-outlook-to-positive-93CH-4365996,
Investing,Bank of England’s Dhingra calls for interest rate cuts to neutral level soon,https://www.investing.com/news/economy-news/bank-of-englands-dhingra-calls-for-interest-rate-cuts-to-neutral-level-soon-93CH-4366003,
