feed,title,long_url,short_url
Investing,Nexo Unveils Strategic Rebrand as a Premier Digital Assets Wealth Platform,https://www.investing.com/news/cryptocurrency-news/nexo-unveils-strategic-rebrand-as-a-premier-digital-assets-wealth-platform-3694960,https://da.gd/1YWVQM
Investing,Mawari Announces Node Sale to Bring Immersive Content to the World,https://www.investing.com/news/cryptocurrency-news/mawari-announces-node-sale-to-bring-immersive-content-to-the-world-3694959,https://da.gd/xqA1rt
Investing,Earnings call: Herbalife meets Q3 guidance with $1.2B net sales,https://www.investing.com/news/stock-market-news/earnings-call-herbalife-meets-q3-guidance-with-12b-net-sales-93CH-3694977,https://da.gd/iSabd
Investing,"Earnings call: Federal Realty hits record FFO, raises guidance",https://www.investing.com/news/stock-market-news/earnings-call-federal-realty-hits-record-ffo-raises-guidance-93CH-3694974,https://da.gd/XLMu5f
Investing,"Earnings call: Informatica posts solid Q3 growth, focuses on cloud strategy",https://www.investing.com/news/stock-market-news/earnings-call-informatica-posts-solid-q3-growth-focuses-on-cloud-strategy-93CH-3694970,https://da.gd/JPtu4
Investing,Turkey stocks lower at close of trade; BIST 100 down 1.58%,https://www.investing.com/news/stock-market-news/turkey-stocks-lower-at-close-of-trade-bist-100-down-158-3694958,https://da.gd/PVgrm
Investing,"Earnings call: Weave highlights strong Q3 growth, raises 2024 guidance",https://www.investing.com/news/stock-market-news/earnings-call-weave-highlights-strong-q3-growth-raises-2024-guidance-93CH-3694956,https://da.gd/PSLQVB
Investing,"Earnings call: Benchmark exceeds Q3 revenue expectations, eyes future growth",https://www.investing.com/news/stock-market-news/earnings-call-benchmark-exceeds-q3-revenue-expectations-eyes-future-growth-93CH-3694948,https://da.gd/IoTiT
Investing,Los Angeles County sues PepsiCo and Coca-Cola over plastic pollution,https://www.investing.com/news/stock-market-news/los-angeles-county-sues-pepsico-and-cocacola-over-plastic-pollution-3694947,https://da.gd/CLDvNe
Investing,Ukraine holds key rate at 13% as inflationary pressure grows,https://www.investing.com/news/economy-news/ukraine-holds-key-rate-at-13-as-inflationary-pressure-grows-3694961,https://da.gd/WDupP9
