feed,title,long_url,short_url
Benzinga,"Tesla, Amazon, Nvidia May Be 'Extravagantly Priced' But Not Necessarily Overvalued: Investment Firm",https://www.benzinga.com/analyst-ratings/analyst-color/20/10/17915535/tesla-amazon-nvidia-may-be-extravagantly-priced-but-not-necessarily-overvalued-inve,https://j.mp/3554pZY
Benzinga,Analyzing Macerich's Unusual Options Activity,https://www.benzinga.com/markets/options/20/10/17922598/analyzing-macerichs-unusual-options-activity,https://j.mp/319Gwzf
Benzinga,Analyzing Alibaba Group Holding's Unusual Options Activity,https://www.benzinga.com/markets/options/20/10/17922590/analyzing-alibaba-group-holdings-unusual-options-activity,https://j.mp/2Itrj5D
Benzinga,Analyzing Tiffany's Unusual Options Activity,https://www.benzinga.com/markets/options/20/10/17922574/analyzing-tiffanys-unusual-options-activity,https://j.mp/378Ruc5
Benzinga,Understanding United Airlines Holdings's Unusual Options Activity,https://www.benzinga.com/markets/options/20/10/17922456/understanding-united-airlines-holdingss-unusual-options-activity,https://j.mp/3k5a09c
Benzinga,Understanding Centene's Unusual Options Activity,https://www.benzinga.com/markets/options/20/10/17922452/understanding-centenes-unusual-options-activity,https://j.mp/37mpWQX
Benzinga,Analyzing Sunrun's Unusual Options Activity,https://www.benzinga.com/markets/options/20/10/17922410/analyzing-sunruns-unusual-options-activity,https://j.mp/2SVNC6f
