feed,title,long_url,short_url
Investing,"China deals final blow on cryptos, says all related services are illegal",https://investing.com/news/-2626380,
Investing,Huobi and OKEx's tokens the biggest losers in China's latest crackdown,https://investing.com/news/-2626379,
Investing,Explainer-What is the role of outside advisers to the U.S. FDA and CDC in vaccine decisions?,https://investing.com/news/-2626384,
Investing,"Caterpillar Stock: Beaten-Down, Still Has Its Legs",https://investing.com/news/-2626383,
Investing,1 Value Stock You Should Buy This Week,https://investing.com/news/-2626382,
Investing,3 Cheap Semiconductor Stocks to Buy on Market Dips,https://investing.com/news/-2626381,
