feed,title,long_url,short_url
Investing,Deckers’ Surprise Blowout Has Wall Street Repricing the Story,https://www.investing.com/analysis/deckers-surprise-blowout-has-wall-street-repricing-the-story-200674288,
Investing,"Amazon stock is ’too cheap’, Jefferies says",https://www.investing.com/news/stock-market-news/amazon-stock-is-too-cheap-jefferies-says-4479248,
Investing,French tech company Capgemini to sell US unit linked to ICE,https://www.investing.com/news/stock-market-news/french-tech-company-capgemini-to-sell-us-unit-linked-to-ice-4479228,
Investing,Wall St opens lower as commodity rout rattles markets,https://www.investing.com/news/stock-market-news/wall-st-opens-lower-as-commodity-rout-rattles-markets-4479166,
Investing,Best Home Improvement Stocks for 2026: 3 Names That Piper Sandler Favors,https://www.investing.com/news/stock-market-news/best-home-improvement-stocks-for-2026-3-names-that-piper-sandler-favors-93CH-4479138,
Investing,What are Truist’s Top Four Stocks in Packaging and Paper sector,https://www.investing.com/news/stock-market-news/what-are-truists-top-four-stocks-in-packaging-and-paper-sector-93CH-4479130,
Investing,"U.S. manufacturing sector shows resilience, PMI beats forecasts",https://www.investing.com/news/economic-indicators/us-manufacturing-sector-shows-resilience-pmi-beats-forecasts-93CH-4479221,
Investing,Canada manufacturing PMI expands for the first time in a year,https://www.investing.com/news/economic-indicators/canada-manufacturing-pmi-expands-for-the-first-time-in-a-year-4479206,
