feed,title,long_url,short_url
Benzinga,Here's How Much $100 Invested In Arista Networks 5 Years Ago Would Be Worth Today,https://benzinga.com/insights/news/24/02/36987359/heres-how-much-100-invested-in-arista-networks-5-years-ago-would-be-worth-today,https://da.gd/Y30U
Benzinga,"If You Invested $100 In This Stock 10 Years Ago, You Would Have $500 Today",https://benzinga.com/insights/news/24/02/36987337/if-you-invested-100-in-this-stock-10-years-ago-you-would-have-500-today,https://da.gd/On768
Benzinga,Unpacking the Latest Options Trading Trends in JD.com,https://benzinga.com/insights/options/24/02/36987444/unpacking-the-latest-options-trading-trends-in-jd-com,https://da.gd/T3ve
Benzinga,These Analysts Boost Their Forecasts On Edwards Lifesciences Following Q4 Results,https://benzinga.com/news/earnings/24/02/36987439/these-analysts-boost-their-forecasts-on-edwards-lifesciences-following-q4-results,https://da.gd/83US
Benzinga,AbbVie Options Trading: A Deep Dive into Market Sentiment,https://benzinga.com/insights/options/24/02/36987440/abbvie-options-trading-a-deep-dive-into-market-sentiment,https://da.gd/FiAuLt
Benzinga,How Tucker Carlson's Yet-To-Air Vladimir Putin Interview Is Landing In Bitcoin Community: 'Russian Propaganda',https://benzinga.com/markets/cryptocurrency/24/02/36982101/how-tucker-carlsons-yet-to-air-vladimir-putin-interview-is-landing-in-bitcoin-community-ru,https://da.gd/3026p3
