feed,title,long_url,short_url
Investing,UiPath shares target raised to $24 on growth momentum,https://www.investing.com/news/stock-market-news/uipath-shares-target-raised-to-24-on-growth-momentum-93CH-3337361,https://da.gd/7605E
Investing,"SentinelOne shares target raised to $24 from $22, retains neutral rating",https://www.investing.com/news/stock-market-news/sentinelone-shares-target-raised-to-24-from-22-retains-neutral-rating-93CH-3337359,https://da.gd/TGugV
Investing,Morgan Stanley raises Williams-Sonoma stock target to $270 from $155,https://www.investing.com/news/stock-market-news/morgan-stanley-raises-williamssonoma-stock-target-to-270-from-155-93CH-3337358,https://da.gd/Bor6Y
Investing,ProQR shares get a boost with raised price target to $2.50,https://www.investing.com/news/stock-market-news/proqr-shares-get-a-boost-with-raised-price-target-to-250-93CH-3337354,https://da.gd/dTneg
Investing,Williams-Sonoma stock target raised to $320 on upbeat outlook,https://www.investing.com/news/stock-market-news/williamssonoma-stock-target-raised-to-320-on-upbeat-outlook-93CH-3337353,https://da.gd/XHTqX
Investing,"RBC cuts Pagegroup shares citing macro challenges, positive on long-term returns",https://www.investing.com/news/stock-market-news/rbc-cuts-pagegroup-shares-citing-macro-challenges-positive-on-longterm-returns-93CH-3337352,https://da.gd/Z7pDf
Investing,Inditex shares target raised to EUR47 by RBC Capital,https://www.investing.com/news/stock-market-news/inditex-shares-target-raised-to-eur47-by-rbc-capital-93CH-3337351,https://da.gd/M75cZ
Investing,Light & Wonder stock target raised to $103 on growth outlook,https://www.investing.com/news/stock-market-news/light--wonder-stock-target-raised-to-103-on-growth-outlook-93CH-3337348,https://da.gd/hyO6YZ
Investing,AstraZeneca to acquire Amolyt Pharma for $1.05 billion,https://www.investing.com/news/stock-market-news/astrazeneca-to-acquire-amolyt-pharma-for-105-billion-93CH-3337347,https://da.gd/kS0BGo
Investing,Citi shares upgraded with higher price target on growth potential,https://www.investing.com/news/stock-market-news/citi-shares-upgraded-with-higher-price-target-on-growth-potential-93CH-3337345,https://da.gd/v0kXwm
