feed,title,long_url,short_url
Investing,"Bitcoin Bullish Spillover: Ethereum Eyes $5k, Ripple Targets High-Volume Breakout",https://www.investing.com/analysis/bitcoin-bullish-spillover-ethereum-eyes-5k-ripple-targets-highvolume-breakout-200646824,https://da.gd/3zuW
Investing,Analysis-Putin grows war economy but incomes suffer 'lost decade',https://www.investing.com/news/economy/analysisputin-grows-war-economy-but-incomes-suffer-lost-decade-3337674,https://da.gd/pwL8V9
Investing,ECB's Lane backs possible rate cut by June -CNBC,https://www.investing.com/news/economy/ecbs-lane-backs-possible-rate-cut-by-june-cnbc-3337691,https://da.gd/YUTa
Investing,"Futures rise in run-up to inflation figures, retail sales data",https://www.investing.com/news/economy/futures-rise-in-runup-to-inflation-figures-retail-sales-data-3337686,https://da.gd/sV9Rq
Investing,"China probes exposure of HK units of banks, insurers to local government debt, sources say",https://www.investing.com/news/economy/china-probes-exposure-of-hk-units-of-banks-insurers-to-local-government-debt-sources-say-3337630,https://da.gd/MLpfy6
Investing,Cuba's private sector provides elderly care - for those who can afford it,https://www.investing.com/news/economy/cubas-private-sector-provides-elderly-care--for-those-who-can-afford-it-3337617,https://da.gd/8smoL
Investing,Britain and Turkey launch talks on a new free trade deal,https://www.investing.com/news/economy/britain-and-turkey-launch-talks-on-a-new-free-trade-deal-3337546,https://da.gd/vTOZ
Investing,Chinese automakers open factories abroad as export clout causes friction,https://www.investing.com/news/economy/chinese-automakers-open-factories-abroad-as-export-clout-causes-friction-3337545,https://da.gd/oGsUR
