feed,title,long_url,short_url
InsiderMonkey,12 Best EV Battery Stocks to Buy in 2025,https://insidermonkey.com/blog/--1440309,
InsiderMonkey,Why Talen Energy (TLN) Is Advancing Today,https://insidermonkey.com/blog/--1441811,
InsiderMonkey,Why Texas Pacific Land (TPL) is Skyrocketing So Far In 2025?,https://insidermonkey.com/blog/--1441733,
InsiderMonkey,Why Cheniere Energy Partners (CQP) is Skyrocketing So Far In 2025?,https://insidermonkey.com/blog/--1441749,
InsiderMonkey,Why Park Hotels & Resorts (PK) Is Sinking Today,https://insidermonkey.com/blog/--1441724,
InsiderMonkey,Why USA Compression Partners (USAC) is Skyrocketing So Far In 2025?,https://insidermonkey.com/blog/--1441734,
InsiderMonkey,WhyTetra Technologies (TTI) is Skyrocketing So Far In 2025?,https://insidermonkey.com/blog/--1441736,
InsiderMonkey,Why Forum Energy Technologies (FET) is Skyrocketing So Far In 2025?,https://insidermonkey.com/blog/--1441746,
InsiderMonkey,Why National Fuel Gas Company (NFG) is Skyrocketing So Far In 2025?,https://insidermonkey.com/blog/--1441750,
InsiderMonkey,Why Plains GP Holdings (PAGP) is Skyrocketing So Far In 2025?,https://insidermonkey.com/blog/--1441754,
InsiderMonkey,Why Global Partners (GLP) is Skyrocketing So Far In 2025?,https://insidermonkey.com/blog/--1441755,
InsiderMonkey,Why MRC Global (MRC) is Skyrocketing So Far In 2025?,https://insidermonkey.com/blog/--1441756,
InsiderMonkey,"Amazon.com, Inc. (AMZN) AWS Adds DeepSeek-R1 AI Models for Cost-Effective, High-Performance Reasoning and Inference",https://insidermonkey.com/blog/--1441872,
InsiderMonkey,Why DHT Holdings (DHT) is Skyrocketing So Far In 2025?,https://insidermonkey.com/blog/--1441758,
InsiderMonkey,Why Frontline plc (FRO) is Skyrocketing So Far In 2025?,https://insidermonkey.com/blog/--1441757,
InsiderMonkey,"Microsoft Corporation (MSFT) Joins NJ AI Hub as Founding Partner to Boost Research, Innovation, and Workforce Development",https://insidermonkey.com/blog/--1441864,
InsiderMonkey,Why Clean Energy (CLNE) is Skyrocketing So Far In 2025?,https://insidermonkey.com/blog/--1441760,
InsiderMonkey,"Why Stabilis Solutions, Inc. (SLNG) is Skyrocketing So Far In 2025?",https://insidermonkey.com/blog/--1441759,
InsiderMonkey,"Stifel Lowers Intel Corporation (INTC) Price Target to $21, Maintains ‘Hold’ Amid Restructuring Delays and Uncertainty",https://insidermonkey.com/blog/--1441857,
InsiderMonkey,Why Prairie Operating Co. (PROP) is Skyrocketing So Far In 2025?,https://insidermonkey.com/blog/--1441764,
