feed,title,long_url,short_url
SeekingAlpha,SELLAS Life Sciences EPS beats by $0.02,https://seekingalpha.com/news/3696316,
SeekingAlpha,Align Technology announces $1 billion worth of share buyback program,https://seekingalpha.com/news/3696315,
SeekingAlpha,Exchange Income reports Q1 results,https://seekingalpha.com/news/3696314,
SeekingAlpha,Office Properties Income Trust prices $300M in senior notes,https://seekingalpha.com/news/3696313,
SeekingAlpha,Histogen reports Q1 results,https://seekingalpha.com/news/3696312,
SeekingAlpha,"Molecular Templates EPS beats by $0.26, misses on revenue",https://seekingalpha.com/news/3696311,
SeekingAlpha,Oscar Health Insurance reports Q1 results,https://seekingalpha.com/news/3696310,
