feed,title,long_url,short_url
Investing,JPMorgan lifts AT&T phone adds on lower churn,https://www.investing.com/news/stock-market-news/jpmorgan-lifts-att-phone-adds-on-lower-churn-432SI-3483714,https://da.gd/mzJR
Investing,"Earnings call: Hepsiburada reports robust Q1 2024 growth, beats guidance",https://www.investing.com/news/stock-market-news/earnings-call-hepsiburada-reports-robust-q1-2024-growth-beats-guidance-93CH-3483713,https://da.gd/fMvh4z
Investing,"Earnings call: Signet Jewelers sees first-quarter growth, raises guidance",https://www.investing.com/news/stock-market-news/earnings-call-signet-jewelers-sees-firstquarter-growth-raises-guidance-93CH-3483712,https://da.gd/EsLvnJ
Investing,"Earnings call: Lovesac reports mixed Q1 results, focuses on innovation",https://www.investing.com/news/stock-market-news/earnings-call-lovesac-reports-mixed-q1-results-focuses-on-innovation-93CH-3483711,https://da.gd/whcnk
Investing,Earnings call: CXI reports mixed Q2 2024 results amid growth efforts,https://www.investing.com/news/stock-market-news/earnings-call-cxi-reports-mixed-q2-2024-results-amid-growth-efforts-93CH-3483710,https://da.gd/s0pl
Investing,Automakers lead European shares lower; Italian stocks slide,https://www.investing.com/news/stock-market-news/automakers-lead-european-shares-lower-italian-stocks-slide-3483703,https://da.gd/66J8H
