feed,title,long_url,short_url
Benzinga,Why Worry With Dividends? Their Five-Year Reinvested Value for Meta Financial Group,https://benzinga.com/news/earnings/21/07/21900664/why-worry-with-dividends-their-five-year-reinvested-value-for-meta-financial-group,https://j.mp/3jVgOcb
Benzinga,Why Worry With Dividends? Their Five-Year Reinvested Value for Best Buy Co,https://benzinga.com/news/earnings/21/07/21900653/why-worry-with-dividends-their-five-year-reinvested-value-for-best-buy-co,https://j.mp/3xtSDFw
Benzinga,Why Worry With Dividends? Their Five-Year Reinvested Value for Raymond James Financial,https://benzinga.com/news/earnings/21/07/21900652/why-worry-with-dividends-their-five-year-reinvested-value-for-raymond-james-financial,https://j.mp/2VdDj1w
Benzinga,Five-Year Compounded Value of NetApp Holdings,https://benzinga.com/news/earnings/21/07/21900651/five-year-compounded-value-of-netapp-holdings,https://j.mp/3AJPZOb
Benzinga,Five-Year Compounded Value of Deere Holdings,https://benzinga.com/news/earnings/21/07/21900645/five-year-compounded-value-of-deere-holdings,https://j.mp/2TOIsNk
Benzinga,Five-Year Compounded Value of KBR Holdings,https://benzinga.com/news/earnings/21/07/21900642/five-year-compounded-value-of-kbr-holdings,https://j.mp/3AGVAo9
Benzinga,Five-Year Compounded Value of Best Buy Co Holdings,https://benzinga.com/news/earnings/21/07/21900640/five-year-compounded-value-of-best-buy-co-holdings,https://j.mp/3hOeL6X
Benzinga,"Domestic Airline Travel Begins To Stabilize, International Travel Remains Volatile: What You Need To Know",https://benzinga.com/general/travel/21/07/21897639/domestic-airline-travel-begins-to-stabilize-international-travel-remains-volatile-what-you-need-to,https://j.mp/3jWONRj
