feed,title,long_url,short_url
Investing,"Exclusive-Beijing nudged Syngenta to withdraw $9 billion Shanghai IPO on market weakness, sources say",https://www.investing.com/news/stock-market-news/exclusivebeijing-nudged-syngenta-to-withdraw-9-billion-shanghai-ipo-on-market-weakness-sources-say-3363733,https://da.gd/CDiM
Investing,Earnings call: Vicinity Motor Corp reports growth and expansion plans,https://www.investing.com/news/stock-market-news/earnings-call-vicinity-motor-corp-reports-growth-and-expansion-plans-93CH-3363728,https://da.gd/PnQ6D
Investing,Earnings call: Dave & Buster's Q4 results show strategic growth amid challenges,https://www.investing.com/news/stock-market-news/earnings-call-dave--busters-q4-results-show-strategic-growth-amid-challenges-93CH-3363727,https://da.gd/GnvaR
Investing,Saudi Arabia stocks higher at close of trade; Tadawul All Share up 1.17%,https://www.investing.com/news/stock-market-news/saudi-arabia-stocks-higher-at-close-of-trade-tadawul-all-share-up-117-3363724,https://da.gd/fvxXZ7
Investing,Tesla to explore potential locations for a new EV plant in India - report,https://www.investing.com/news/stock-market-news/tesla-to-explore-potential-locations-for-a-new-ev-plant-in-india--report-432SI-3363714,https://da.gd/g0pmr
Investing,"Taiwan quake to hit some chip output, cause Asia supply chain disruptions, analysts say",https://www.investing.com/news/stock-market-news/taiwan-quake-to-hit-some-chip-output-cause-asia-supply-chain-disruptions-analysts-say-3363677,https://da.gd/BUsX
Investing,This hedge fund is beating S&P 500 without relying on Magnificent 7; This is how,https://www.investing.com/news/stock-market-news/this-hedge-fund-is-beating-sp-500-without-relying-on-magnificent-7-this-is-how-3363668,https://da.gd/k1xrdQ
Investing,"U.S. private employers add 184,000 jobs in March - ADP",https://www.investing.com/news/economic-indicators/us-private-employers-add-184000-jobs-in-march--adp-3363681,https://da.gd/agqwN
