feed,title,long_url,short_url
Investing,Peter Schiff Bashes BTC ETF Yet Again: 'I Doubt They Will HODL',https://www.investing.com/news/cryptocurrency-news/peter-schiff-bashes-btc-etf-yet-again-i-doubt-they-will-hodl-3278824,https://da.gd/q8O1pk
Investing,Michael Saylor Issues Critical Warning to BTC Holders,https://www.investing.com/news/cryptocurrency-news/michael-saylor-issues-critical-warning-to-btc-holders-3278823,https://da.gd/otxMf
Investing,"'Bitcoin to Hit $1 Million in Days,' Says Samson Mow, but There's Catch",https://www.investing.com/news/cryptocurrency-news/bitcoin-to-hit-1-million-in-days-says-samson-mow-but-theres-catch-3278822,https://da.gd/yGOaz
Investing,Bitcoin (BTC) to 6x From Here? Analyst Shares Reasoning,https://www.investing.com/news/cryptocurrency-news/bitcoin-btc-to-6x-from-here-analyst-shares-reasoning-3278821,https://da.gd/wEiMAd
Investing,Ark's Cathie Wood Touts Bitcoin (BTC) as World's Most Secure Asset: Details,https://www.investing.com/news/cryptocurrency-news/arks-cathie-wood-touts-bitcoin-btc-as-worlds-most-secure-asset-details-3278820,https://da.gd/aohhjt
Investing,"Huobi introduces HTX token with benefits, sets conversion deadline",https://www.investing.com/news/cryptocurrency-news/huobi-introduces-htx-token-with-benefits-sets-conversion-deadline-93CH-3278817,https://da.gd/EoWF
Investing,Israeli strike on Damascus kills four Iranian Revolutionary Guards,https://www.investing.com/news/world-news/israeli-strike-on-damascus-kills-iranian-guards-official-source-in-regional-prosyria-alliance-3278798,https://da.gd/1WS6
