feed,title,long_url,short_url
Investing,Vitalik Buterin Shares New Ethereum Vision,https://www.investing.com/news/cryptocurrency-news/vitalik-buterin-shares-new-ethereum-vision-3278855,https://da.gd/jYG5a
Investing,Ethereum (ETH) Surpassed Bitcoin (BTC) for Second Time Ever,https://www.investing.com/news/cryptocurrency-news/ethereum-eth-surpassed-bitcoin-btc-for-second-time-ever-3278854,https://da.gd/tqsiUG
Investing,Ethereum (ETH) Layer 2 Networks Growth Is Crucial: Here's Why,https://www.investing.com/news/cryptocurrency-news/ethereum-eth-layer-2-networks-growth-is-crucial-heres-why-3278853,https://da.gd/5GxRU
Investing,Can Solana (SOL) Continue Its Path Up in 2024?,https://www.investing.com/news/cryptocurrency-news/can-solana-sol-continue-its-path-up-in-2024-3278852,https://da.gd/PvAOT
Investing,Top Cryptocurrencies to Watch in 2024,https://www.investing.com/news/cryptocurrency-news/top-cryptocurrencies-to-watch-in-2024-3278851,https://da.gd/SxXOIa
Investing,"Ethereum (ETH) Has to Break This Major Resistance Ahead of $2,500",https://www.investing.com/news/cryptocurrency-news/ethereum-eth-has-to-break-this-major-resistance-ahead-of-2500-3278850,https://da.gd/haZXIG
Investing,"Ethereum's Vitalik Buterin Shuffles USDC Funds, Likely Reason",https://www.investing.com/news/cryptocurrency-news/ethereums-vitalik-buterin-shuffles-usdc-funds-likely-reason-3278849,https://da.gd/4eA1Lz
Investing,Whales Buying Ethereum (ETH) and Bitcoin (BTC) Dump,https://www.investing.com/news/cryptocurrency-news/whales-buying-ethereum-eth-and-bitcoin-btc-dump-3278848,https://da.gd/KkfiGh
Investing,Ethereum L2s Surpassed All Other Blockchains by TVL: Details,https://www.investing.com/news/cryptocurrency-news/ethereum-l2s-surpassed-all-other-blockchains-by-tvl-details-3278847,https://da.gd/CfWX
Investing,XRP Saw Biggest Price Drop Since August: Here's What Happened,https://www.investing.com/news/cryptocurrency-news/xrp-saw-biggest-price-drop-since-august-heres-what-happened-3278846,https://da.gd/AEwcdy
