feed,title,long_url,short_url
InsiderMonkey,What Makes Alliant Energy Corporation (LNT) a Good Investment Bet?,https://insidermonkey.com/blog/--1310791,
InsiderMonkey,UAE Ranks Below Other Gulf States in World’s Top Destinations for Work Visas,https://insidermonkey.com/blog/--1304383,
InsiderMonkey,Top Institutions Point to Blockchain Interoperability as Critical to Asset Tokenization,https://insidermonkey.com/blog/--1310735,
InsiderMonkey,BetFury Announces $20 Million Cryptodrop Event,https://insidermonkey.com/blog/--1310719,
InsiderMonkey,Universal Health Realty Income Trust (UHT) Fell in Q1 Along with the Sector,https://insidermonkey.com/blog/--1310777,
InsiderMonkey,13 Best Quality Stocks To Buy,https://insidermonkey.com/blog/--1309561,
InsiderMonkey,Here’s Why Lamar Advertising Company (LAMR) Fits Artisan Value Income Fund’s Process,https://insidermonkey.com/blog/--1310730,
