feed,title,long_url,short_url
Investing,"ReserveBlock Foundation Announces the RBX Network Masternode Release & Presale for Governance, Consensus, and Block Rewards in Conjunction With the Networks Public Testnet",https://investing.com/news/-2760139,
Investing,Russian government and central bank agree to treat Bitcoin as currency,https://investing.com/news/-2760136,
Investing,$4K Ethereum by July? ETH price posts fastest recovery to date from 50% drawdown,https://investing.com/news/-2760124,
Investing,Pocket Network Growth Up 80% MoM To 9.5 Billion Relays Due To Industry Demand,https://investing.com/news/-2760119,
Investing,"GALA Surges Price to Over +80%, Gears to Hit $0.60 Soon",https://investing.com/news/-2760118,
Investing,Bitcoin Lightning Network goes live on Cash App,https://investing.com/news/-2760113,
