feed,title,long_url,short_url
SeekingAlpha,"National Retail Properties stock gains 5% after Q4 beat, stronger guidance",https://seekingalpha.com/news/3797836,
SeekingAlpha,BrewBilt Brewing rallies 16% on commencing craft brewery facility construction,https://seekingalpha.com/news/3797834,
SeekingAlpha,Canopy Growth leads Canadian cannabis stocks higher after Q3 earnings,https://seekingalpha.com/news/3797833,
SeekingAlpha,Joby Aviation jumped 21% yesterday but Morgan Stanley says it can triple from there,https://seekingalpha.com/news/3797832,
SeekingAlpha,"National Retail Properties stock gains 5% after Q4 beat, stronger guidance",https://seekingalpha.com/news/3797831,
SeekingAlpha,Timberland: Track Record Of Capital Management,https://seekingalpha.com/article/4485445,
