feed,title,long_url,short_url
SeekingAlpha,Rezolute GAAP EPS of -$0.80,https://seekingalpha.com/news/3798247,
SeekingAlpha,"Monarch Casino & Resort GAAP EPS of -$1.02 misses by $1.92, revenue of $111.06M beats by $12.6M",https://seekingalpha.com/news/3798246,
SeekingAlpha,"GFL Environmental Non-GAAP EPS of C$0.07 misses by $0.07, revenue of C$1.54B",https://seekingalpha.com/news/3798245,
SeekingAlpha,Two Harbors Investment Q4 earnings beat as net interest income falls,https://seekingalpha.com/news/3798244,
SeekingAlpha,"ChampionX Non-GAAP EPS of $0.26 beats by $0.02, revenue of $822.15M misses by $11.74M",https://seekingalpha.com/news/3798235,
