feed,title,long_url,short_url
ETFTrends:DailyRecap,VettaFi Nominated for Two ETF Express US 2022 Awards,https://www.etftrends.com/vettafi-nominated-for-two-etf-express-us-2022-awards/,https://bit.ly/3Lnwa4F
ETFTrends:DailyRecap,An Advisors Guide to Cloud Computing and the Future of the Internet,https://www.etftrends.com/disruptive-technology-channel/an-advisors-guide-to-cloud-computing-and-the-future-of-the-internet/,https://bit.ly/3UgTSnq
ETFTrends:DailyRecap,ETF Strategies to Access the Growing ESG Opportunities,https://www.etftrends.com/esg-channel/etf-strategies-to-access-the-growing-esg-opportunities/,https://bit.ly/3UgaVpC
ETFTrends:DailyRecap,Get Exposure to Real Estate With These 4 ETFs,https://www.etftrends.com/etf-building-blocks-channel/get-exposure-to-real-estate-with-these-4-etfs/,https://bit.ly/3Uf3LC7
ETFTrends:DailyRecap,China’s Economy Demonstrated Recovery in August,https://www.etftrends.com/china-insights-channel/chinas-economy-demonstrated-recovery-in-august/,https://bit.ly/3eYSl5n
ETFTrends:DailyRecap,Target U.S. Large-Caps With These Active ETFs,https://www.etftrends.com/core-strategies-channel/target-u-s-large-caps-with-these-active-etfs/,https://bit.ly/3LmnxHM
ETFTrends:DailyRecap,ARK Estimates Food Delivery at Scale Could Cost $0.40 With Uber Eats–Nuro Partnership,https://www.etftrends.com/disruptive-technology-channel/ark-estimates-food-delivery-at-scale-could-cost-0-40-with-uber-eats-nuro-partnership/,https://bit.ly/3LoZZlI
ETFTrends:DailyRecap,Will Fed Funds Hit 4% During This Hiking Cycle?,https://www.etftrends.com/model-portfolio-channel/will-fed-funds-hit-4-during-this-hiking-cycle/,https://bit.ly/3eU1SdN
ETFTrends:DailyRecap,Redefine What It Means to Be a Quality Company Through Free Cash Flow,https://www.etftrends.com/free-cash-flow-channel/redefine-what-it-means-to-be-a-quality-company-through-the-lens-of-free-cash-flow/,https://bit.ly/3eQha3b
ETFTrends:DailyRecap,Thematic Times: Digging Deeper Into E-Commerce Data,https://www.etftrends.com/thematic-investing-channel/thematic-times-digging-deeper-into-e-commerce-data/,https://bit.ly/3xvKB0T
ETFTrends:DailyRecap,MercadoLibre to Double Its Electric Van Fleet in Latin America,https://www.etftrends.com/emerging-markets-channel/mercadolibre-to-double-its-electric-van-fleet-in-latin-america/,https://bit.ly/3xuqK2h
ETFTrends:DailyRecap,Active Managers on Track to Have Best Year Since 2009,https://www.etftrends.com/active-etf-channel/active-managers-on-track-to-have-best-year-since-2009/,https://bit.ly/3xvKxOH
ETFTrends:DailyRecap,Hashdex Launches First ’33 Act Bitcoin ETF With DEFI,https://www.etftrends.com/hashdex-launches-first-33-act-bitcoin-etf-with-defi/,https://bit.ly/3Sdi34r
ETFTrends:DailyRecap,Look Forward to Future Growth Prospects With This Internet ETF,https://www.etftrends.com/thematic-investing-channel/look-forward-to-future-growth-prospects-with-this-internet-etf/,https://bit.ly/3Lsttir
ETFTrends:DailyRecap,Meet a Strategist: Helios Asks If Recessions Matter,https://www.etftrends.com/etf-strategist-channel/meet-a-strategist-helios-asks-if-recessions-matter/,https://bit.ly/3SaAKpj
ETFTrends:DailyRecap,Get Unique Access to the U.S. Energy Market With RYE,https://www.etftrends.com/portfolio-strategies-channel/get-unique-access-to-the-u-s-energy-market-with-rye/,https://bit.ly/3BN998b
ETFTrends:DailyRecap,Call on CLNR to Play Climate Investing Long Game,https://www.etftrends.com/dual-impact-channel/call-on-clnr-to-play-climate-investing-long-game/,https://bit.ly/3DvThrT
ETFTrends:DailyRecap,How Gloom Can Actually Benefit ESG ETFs,https://www.etftrends.com/etf-education-channel/how-gloom-can-actually-benefit-esg-etfs/,https://bit.ly/3BkBbGU
ETFTrends:DailyRecap,Sprott’s John Ciampaglia Digs Into Nuclear Power,https://www.etftrends.com/gold-silver-investing-channel/sprotts-john-ciampaglia-digs-into-nuclear-power/,https://bit.ly/3xw98D0
ETFTrends:DailyRecap,"Following Ethereum Merge, Pressure on Bitcoin Miners to Up Environmental Awareness",https://www.etftrends.com/crypto-channel/following-ethereum-merge-pressure-on-bitcoin-miners-to-up-environmental-awareness/,https://bit.ly/3Bm0Sqy
ETFTrends:DailyRecap,Bonds Could Bounce Back — Consider Munis as a Way to Play Rebound,https://www.etftrends.com/tactical-allocation-channel/bonds-could-bounce-back-consider-munis-as-a-way-to-play-rebound/,https://bit.ly/3dn6MzE
ETFTrends:DailyRecap,Call on Corporate Bonds With ESG Perks,https://www.etftrends.com/esg-channel/call-on-corporate-bonds-with-esg-perks/,https://bit.ly/3BpzBDq
ETFTrends:DailyRecap,"Despite Rising Dollar, This Metals Mining ETF Is Up 13% YTD",https://www.etftrends.com/leveraged-inverse-channel/despite-rising-dollar-this-metals-mining-etf-is-up-13-ytd/,https://bit.ly/3BmMRsv
