feed,title,long_url,short_url
Investing,Australia's Qantas says engineer strike not expected to impact customers,https://www.investing.com/news/stock-market-news/australias-qantas-says-engineer-strike-not-expected-to-impact-customers-3682164,https://da.gd/Vlaz
Investing,Earnings call: Ladder Capital reports solid Q3 with optimistic outlook,https://www.investing.com/news/stock-market-news/earnings-call-ladder-capital-reports-solid-q3-with-optimistic-outlook-93CH-3682155,https://da.gd/Yghw9
Investing,Earnings call: Origin Bancorp reports growth amid profitability challenges,https://www.investing.com/news/stock-market-news/earnings-call-origin-bancorp-reports-growth-amid-profitability-challenges-93CH-3682143,https://da.gd/XfIt1
Investing,Earnings call: Amerant Bancorp reports Q3 loss amid strategic shifts,https://www.investing.com/news/stock-market-news/earnings-call-amerant-bancorp-reports-q3-loss-amid-strategic-shifts-93CH-3682136,https://da.gd/OzVzY
Investing,"Earnings call: Teck Resources transitions to energy metals, ups returns",https://www.investing.com/news/stock-market-news/earnings-call-teck-resources-transitions-to-energy-metals-ups-returns-93CH-3682139,https://da.gd/Xmxb6M
