feed,title,long_url,short_url
FXEmpire,Germany’s Biggest Landlords Agree $22 Billion Merger,https://www.fxempire.com/news/article/germanys-biggest-landlords-agree-22-billion-merger-733246,https://j.mp/2QOcLlF
FXEmpire,Futures Firm as Tech Stocks Rise on Lower Bond Yields,https://www.fxempire.com/news/article/futures-firm-as-tech-stocks-rise-on-lower-bond-yields-733250,https://j.mp/2SusAPa
FXEmpire,"As Interest Rates Hit Bottom, Debt Does Matter, Says Barclays",https://www.fxempire.com/news/article/as-interest-rates-hit-bottom-debt-does-matter-says-barclays-733254,https://j.mp/2QPA9iJ
FXEmpire,Covid-19 to Speed Up Consolidation of Aircraft Leasing Industry,https://www.fxempire.com/news/article/covid-19-to-speed-up-consolidation-of-aircraft-leasing-industry-smbc-733257,https://j.mp/3vjlA6c
FXEmpire,"China Approves Goldman Sachs, ICBC Joint Wealth Management Venture",https://www.fxempire.com/news/article/china-approves-goldman-sachs-icbc-joint-wealth-management-venture-733260,https://j.mp/3oPhxvG
FXEmpire,"After M&a Boom via Zoom, Dealmakers Hit the Road as Covid-19 Subsides",https://www.fxempire.com/news/article/after-ma-boom-via-zoom-dealmakers-hit-the-road-as-covid-19-subsides-733263,https://j.mp/3bOfJOo
FXEmpire,Portugal Says Tap Can Still Use Rescue Loan Despite Court Ruling,https://www.fxempire.com/news/article/portugal-says-tap-can-still-use-rescue-loan-despite-court-ruling-733280,https://j.mp/3bPXmbQ
FXEmpire,"Portugal’s Economy Recovering Well, May Beat 2021 Forecast, Minister Says",https://www.fxempire.com/news/article/portugals-economy-recovering-well-may-beat-2021-forecast-minister-says-733284,https://j.mp/2SstYBv
FXEmpire,China Launches Antitrust Probe Into Tencent-Backed Property Broker Ke,https://www.fxempire.com/news/article/china-launches-antitrust-probe-into-tencent-backed-property-broker-ke-733272,https://j.mp/2TcRUt7
