feed,title,long_url,short_url
Nasdaq,Better Buy: Etsy vs. JD.com,https://www.nasdaq.com/articles/better-buy%3A-etsy-vs.-jd.com-2021-03-15,https://j.mp/3qYdi0F
Nasdaq,S&P 500 Analyst Moves: CMCSA,https://www.nasdaq.com/articles/sp-500-analyst-moves%3A-cmcsa-2021-03-15,https://j.mp/2OzE2XZ
Nasdaq,Dow Analyst Moves: HD,https://www.nasdaq.com/articles/dow-analyst-moves%3A-hd-2021-03-15,https://j.mp/3qU0lod
Nasdaq,Here's the Next Stock I'm Going to Buy,https://www.nasdaq.com/articles/heres-the-next-stock-im-going-to-buy-2021-03-15,https://j.mp/3cy7ZzN
Nasdaq,"IMF, late-comer on climate change, should embrace ambitious goals - report",https://www.nasdaq.com/articles/imf-late-comer-on-climate-change-should-embrace-ambitious-goals-report-2021-03-15,https://j.mp/3eLizGb
Nasdaq,"Canada sure that all COVID-19 vaccines are safe, including AstraZeneca doses - PM",https://www.nasdaq.com/articles/canada-sure-that-all-covid-19-vaccines-are-safe-including-astrazeneca-doses-pm-2021-03-15,https://j.mp/3bNfl32
Nasdaq,EXCLUSIVE-U.S. data for AstraZeneca vaccine under review by independent advisers -U.S. official,https://www.nasdaq.com/articles/exclusive-u.s.-data-for-astrazeneca-vaccine-under-review-by-independent-advisers-u.s.,https://j.mp/3thf91O
