feed,title,long_url,short_url
Benzinga,"Syrup, Seasoning, Oils, & General Food Global Market Report 2021: COVID 19 Impact and Recovery to 2030",https://www.benzinga.com/pressreleases/21/02/g19416763/syrup-seasoning-oils-general-food-global-market-report-2021-covid-19-impact-and-recovery-to-2030,https://j.mp/2YzUPvy
Benzinga,"Global Barite Market (2020 to 2025) - Growth, Trends, and Forecasts",https://www.benzinga.com/pressreleases/21/02/g19416753/global-barite-market-2020-to-2025-growth-trends-and-forecasts,https://j.mp/39BRIJV
Benzinga,Global VHF Radio Market Forecast to 2027 - COVID-19 Impact and Analysis - ResearchAndMarkets.com,https://www.benzinga.com/pressreleases/21/02/b19416739/global-vhf-radio-market-forecast-to-2027-covid-19-impact-and-analysis-researchandmarkets-com,https://j.mp/3al3KWZ
Benzinga,The Institute for Strategic Enrollment Management at Sunriver Announces Its 2021 Dates,https://www.benzinga.com/pressreleases/21/02/n19416718/the-institute-for-strategic-enrollment-management-at-sunriver-announces-its-2021-dates,https://j.mp/39BuvY8
Benzinga,Eutelsat and TelOne (Pvt) Limited Sign Multi-service Agreement to Bring High Quality Broadband Connectivity to Zimbabwe,https://www.benzinga.com/pressreleases/21/02/b19416716/eutelsat-and-telone-pvt-limited-sign-multi-service-agreement-to-bring-high-quality-broadband-conne,https://j.mp/2MN5lN5
Benzinga,Animal And Pet Food Global Market Report 2021: COVID 19 Impact and Recovery to 2030,https://www.benzinga.com/pressreleases/21/02/g19416714/animal-and-pet-food-global-market-report-2021-covid-19-impact-and-recovery-to-2030,https://j.mp/2YxFUll
