feed,title,long_url,short_url
Benzinga,"Monster Energy's Snow Sports Athletes Dominate with Nine Medals, Including Four Gold, on Day Three of X Games Aspen 2021",https://www.benzinga.com/pressreleases/21/02/n19433138/monster-energys-snow-sports-athletes-dominate-with-nine-medals-including-four-gold-on-day-three-of,https://j.mp/3oCuIyE
Benzinga,"SHAREHOLDER ALERT: WeissLaw LLP Reminds DMYD, EXPC, ATAC, and GIK Shareholders About Its Ongoing Investigations",https://www.benzinga.com/pressreleases/21/02/n19433132/shareholder-alert-weisslaw-llp-reminds-dmyd-expc-atac-and-gik-shareholders-about-its-ongoing-inves,https://j.mp/3rpMMOn
Benzinga,NHN Global Announces Acquisition of Cloudnexa,https://www.benzinga.com/pressreleases/21/02/n19433125/nhn-global-announces-acquisition-of-cloudnexa,https://j.mp/3th66ie
Benzinga,"Survey: As Kidney Patients Await Covid Vaccines, Their Questions Mount",https://www.benzinga.com/pressreleases/21/02/n19433119/survey-as-kidney-patients-await-covid-vaccines-their-questions-mount,https://j.mp/3atdpe8
Benzinga,Raleigh Ad Agency Celebrates 21 Years with New Clients and Expanded Markets,https://www.benzinga.com/pressreleases/21/02/n19433115/raleigh-ad-agency-celebrates-21-years-with-new-clients-and-expanded-markets,https://j.mp/36ufzsQ
