feed,title,long_url,short_url
FXEmpire,Norway to allow SAS to convert debt to equity – minister,https://www.fxempire.com/news/article/norway-to-allow-sas-to-convert-debt-to-equity-minister-1046829,https://bit.ly/3NrpphG
FXEmpire,UK to reduce Heathrow Airport landing fees after airline protests,https://www.fxempire.com/news/article/uk-to-reduce-heathrow-airport-landing-fees-after-airline-protests-1046840,https://bit.ly/3ynzR5A
FXEmpire,Hedge funds turn tail as commodities crumble on recession rumble: McGeever,https://www.fxempire.com/news/article/hedge-funds-turn-tail-as-commodities-crumble-on-recession-rumble-mcgeever-1046824,https://bit.ly/3buSxYc
FXEmpire,"Italy’s De Nora IPO priced at 13.50 eur/share, co valued 2.7 billion euros",https://www.fxempire.com/news/article/italys-de-nora-ipo-priced-at-13-50-eur-share-co-valued-2-7-billion-euros-1046839,https://bit.ly/3OqIF0k
FXEmpire,Cash-starved Sri Lanka to end fuel duopoly to ease fuel shortages,https://www.fxempire.com/news/article/cash-starved-sri-lanka-to-end-fuel-duopoly-to-ease-fuel-shortages-1046822,https://bit.ly/3yp3tiW
FXEmpire,"Australia’s Sayona, partner approve restart of Quebec lithium plant operation",https://www.fxempire.com/news/article/australias-sayona-partner-approve-restart-of-quebec-lithium-plant-operation-1046826,https://bit.ly/3NlbxFO
FXEmpire,"SSE, Equinor to buy UK’s Triton Power for $418 million",https://www.fxempire.com/news/article/sse-equinor-to-buy-uks-triton-power-for-418-million-1046842,https://bit.ly/3yp263O
FXEmpire,China cuts COVID quarantine time for international travellers,https://www.fxempire.com/news/article/china-cuts-covid-quarantine-time-for-international-travellers-1046827,https://bit.ly/3OyFbsM
FXEmpire,Shanghai Disney Resort says to reopen Disneyland theme park on June 30,https://www.fxempire.com/news/article/shanghai-disney-resort-says-to-reopen-disneyland-theme-park-on-june-30-1046828,https://bit.ly/3NsoNbQ
