feed,title,long_url,short_url
SeekingAlpha,S&P Corelogic Case-Shiller HPI in April rises slightly more than expected Y/Y,https://seekingalpha.com/news/3852418,
SeekingAlpha,FHFZ house price index gains 1.6% in April,https://seekingalpha.com/news/3852417,
SeekingAlpha,"Polaris safe position in powersports balanced by supply chain, inflation pressures - Jefferies",https://seekingalpha.com/news/3852416,
SeekingAlpha,Kezar rises 92% after mid-stage data for lead asset in lupus nephritis,https://seekingalpha.com/news/3852415,
SeekingAlpha,MaxLinear announces expiration of HSR waiting period for Silicon Motion acquisition,https://seekingalpha.com/news/3852414,
SeekingAlpha,Star Bulk Carriers: Update On Dry Bulk Markets (Podcast Transcript),https://seekingalpha.com/article/4520548,
SeekingAlpha,Mobilicom Stock: What To Know About This New IPO,https://seekingalpha.com/article/4520607,
SeekingAlpha,Wells Fargo Looks Like A Buy Again After Falling From Its 52-Week Highs,https://seekingalpha.com/article/4520371,
SeekingAlpha,"Is Compass Stock A Buy, Sell, Or Hold As Price Dips?",https://seekingalpha.com/article/4520647,
