feed,title,long_url,short_url
Nasdaq,Oil falls as India's COVID-19 surge to weigh on fuel demand,https://www.nasdaq.com/articles/oil-falls-as-indias-covid-19-surge-to-weigh-on-fuel-demand-2021-04-26,https://j.mp/3nlCSw5
Nasdaq,PostNl raises full-year normalised earnings outlook on strong parcel volume growth,https://www.nasdaq.com/articles/postnl-raises-full-year-normalised-earnings-outlook-on-strong-parcel-volume-growth-2021-04,https://j.mp/3gyUmUy
Nasdaq,Nestle confirms discussions to acquire vitamin maker Bountiful,https://www.nasdaq.com/articles/nestle-confirms-discussions-to-acquire-vitamin-maker-bountiful-2021-04-26,https://j.mp/3nk2vgZ
Nasdaq,"EMERGING MARKETS-Asian FX gain on weaker dollar, Indian shares gain on ICICI Bank boost",https://www.nasdaq.com/articles/emerging-markets-asian-fx-gain-on-weaker-dollar-indian-shares-gain-on-icici-bank-boost-0,https://j.mp/3tSGeJD
Nasdaq,"EMERGING MARKETS-Asian FX gain on weaker dollar, Indian shares gain on ICICI Bank boost",https://www.nasdaq.com/articles/emerging-markets-asian-fx-gain-on-weaker-dollar-indian-shares-gain-on-icici-bank-boost,https://j.mp/3dRjofW
Nasdaq,"Bangladesh issues new tender to buy 50,000 tonnes wheat - traders",https://www.nasdaq.com/articles/bangladesh-issues-new-tender-to-buy-50000-tonnes-wheat-traders-2021-04-26,https://j.mp/32Nfgal
Nasdaq,"Australia, NZ dollars climb as iron ore prices soar",https://www.nasdaq.com/articles/australia-nz-dollars-climb-as-iron-ore-prices-soar-2021-04-26,https://j.mp/3315wcR
Nasdaq,Citigroup steps up Western European corporate banking push,https://www.nasdaq.com/articles/citigroup-steps-up-western-european-corporate-banking-push-2021-04-26,https://j.mp/3sSAk9O
