feed,title,long_url,short_url
SeekingAlpha,Jounce Therapeutics EPS misses by $0.28,https://seekingalpha.com/news/3633054,
SeekingAlpha,On the hour,https://seekingalpha.com/news/3633051,
SeekingAlpha,"Mylan EPS beats by $0.15, misses on revenue",https://seekingalpha.com/news/3633050,
SeekingAlpha,Mortgages in forbearance fall 5% W/W - Black Knight,https://seekingalpha.com/news/3632410,
SeekingAlpha,Tencent-backed Kuaishou Technology files for $5B IPO - Bloomberg,https://seekingalpha.com/news/3633045,
