feed,title,long_url,short_url
SeekingAlpha,First Trust Active Factor Small Cap ETF declares quarterly distribution of $0.0423,https://seekingalpha.com/news/3951254,
SeekingAlpha,First Trust Small Cap Core AlphaDEX Fund declares quarterly distribution of $0.2184,https://seekingalpha.com/news/3951253,
SeekingAlpha,First Trust Small Cap Value AlphaDEX Fund declares quarterly distribution of $0.1347,https://seekingalpha.com/news/3951252,
SeekingAlpha,First Trust Materials AlphaDEX Fund declares quarterly distribution of $0.2467,https://seekingalpha.com/news/3951251,
SeekingAlpha,First Trust Utilities AlphaDEX Fund declares quarterly distribution of $0.1439,https://seekingalpha.com/news/3951250,
SeekingAlpha,First Trust Industrials/Producer Durables AlphaDEX Fund declares quarterly distribution of $0.0952,https://seekingalpha.com/news/3951249,
SeekingAlpha,First Trust Financials AlphaDEX Fund declares quarterly distribution of $0.2096,https://seekingalpha.com/news/3951248,
