feed,title,long_url,short_url
ETF,"Spot Bitcoin ETF Approval: ‘Buy the Rumor, Sell the News?’",http://www.etf.com/sections/news/spot-bitcoin-etf-approval-buy-rumor-sell-news,https://da.gd/QfRiMH
ETF,Advisors Ditch Mutual Funds for ETFs in Year-End Moves,http://www.etf.com/sections/features/capital-gains-drive-moves-etfs,https://da.gd/2wgkF
ETF,ARK and 21Shares to Roll Out Crypto ETF Suite,http://www.etf.com/sections/ark-and-21shares-roll-out-crypto-etf-suite,https://da.gd/HbRNJ
ETF,Avantis Launches 3 Small- and Mid-Cap ETFs,http://www.etf.com/sections/news/avantis-launches-3-small-and-mid-cap-etfs,https://da.gd/Stk1
ETF,"With QQQ, TLT and IWM, Amount Matters",http://www.etf.com/sections/features/qqq-tlt-and-iwm-amount-matters,https://da.gd/oOmE
ETF,Dimensional Fund Advisors Launches Bond ETFs,http://www.etf.com/sections/news/dimensional-fund-advisors-launches-3-new-bond-etfs,https://da.gd/1EsmR7
ETF,U.K.'s FCA Warns Brokers on Fees,http://www.etf.com/sections/news/uks-fca-warns-brokers-fees,https://da.gd/ZUbgT4
ETF,Bitwise CIO Expects Billions to Flow Into Spot Bitcoin ETFs,http://www.etf.com/sections/features/bitwise-cio-expects-billions-flow-spot-bitcoin-etfs,https://da.gd/EQSH
ETF,Shorter Time to Settle Trades Not Expected to Hit ETFs Much,http://www.etf.com/sections/news/shorter-time-settle-trades-not-expected-hit-etfs-much,https://da.gd/IH5FOB
ETF,"ESG Popularity Solid Amid Backlash, Survey Says",http://www.etf.com/sections/news/esg-funds-persevere-headwinds-mount-survey-says,https://da.gd/fU0KF
