feed,title,long_url,short_url
Investing,Precious Metals Trading Made Clear: An Octa Guide,https://www.investing.com/analysis/precious-metals-trading-made-clear-an-octa-guide-200643485,https://da.gd/ZgCru
Investing,CME overtakes Binance to grab largest share of Bitcoin futures open interest,https://www.investing.com/news/cryptocurrency-news/cme-overtakes-binance-to-grab-largest-share-of-bitcoin-futures-open-interest-3230318,https://da.gd/TzJHG
Investing,Ethereum price surge prompts whale deposits and BlackRock Ethereum Trust registration,https://www.investing.com/news/cryptocurrency-news/ethereum-price-surge-prompts-whale-deposits-and-blackrock-ethereum-trust-registration-93CH-3230306,https://da.gd/XhINpR
Investing,"Analysis-Losing ground to rebel alliance, Myanmar junta faces biggest test since coup",https://www.investing.com/news/commodities-news/analysislosing-ground-to-rebel-alliance-myanmar-junta-faces-biggest-test-since-coup-3230309,https://da.gd/Ppgp
Investing,"Earnings call: Achieve Life Sciences progresses with Cytisinicline, prepares for NDA submission",https://www.investing.com/news/stock-market-news/earnings-call-achieve-life-sciences-progresses-with-cytisinicline-prepares-for-nda-submission-93CH-3230320,https://da.gd/6MOWAC
Investing,European shares ease from 3-week high as Powell stamps out rate peak hopes,https://www.investing.com/news/stock-market-news/european-shares-decline-as-powell-stamps-out-rate-peak-hopes-3230143,https://da.gd/CTrGKo
Investing,"Earnings call: SilverCrest reports Q3 2023 results, stays on track to meet yearly guidance",https://www.investing.com/news/stock-market-news/earnings-call-silvercrest-reports-q3-2023-results-stays-on-track-to-meet-yearly-guidance-93CH-3230315,https://da.gd/Yyjhzd
Investing,Earnings call: Synaptics Incorporated forecasts business recovery and top line improvements in 2024,https://www.investing.com/news/stock-market-news/earnings-call-synaptics-incorporated-forecasts-business-recovery-and-top-line-improvements-in-2024-93CH-3230310,https://da.gd/osp04q
Investing,"Earnings call: Tutor Perini reports mixed Q3 2023 results, expects strong cash generation and backlog growth",https://www.investing.com/news/stock-market-news/earnings-call-tutor-perini-reports-mixed-q3-2023-results-expects-strong-cash-generation-and-backlog-growth-93CH-3230313,https://da.gd/4FBeX
Investing,"Earnings call: Organogenesis reports Q3 revenue drop, optimistic for future growth despite challenges",https://www.investing.com/news/stock-market-news/earnings-call-organogenesis-reports-q3-revenue-drop-optimistic-for-future-growth-despite-challenges-93CH-3230307,https://da.gd/oJwJ9S
Investing,"Earnings call: Model N outperforms Q4 2023 guidance, anticipates continued growth",https://www.investing.com/news/stock-market-news/earnings-call-model-n-outperforms-q4-2023-guidance-anticipates-continued-growth-93CH-3230308,https://da.gd/bH2cN
Investing,Accenture invests $3 billion in AI studios across North America,https://www.investing.com/news/stock-market-news/accenture-invests-3-billion-in-ai-studios-across-north-america-93CH-3230311,https://da.gd/J3bpqC
Investing,"Samvardhana Motherson reveals robust Q2 FY24 financials, despite production challenges",https://www.investing.com/news/stock-market-news/samvardhana-motherson-reveals-robust-q2-fy24-financials-despite-production-challenges-93CH-3230316,https://da.gd/sWYV
Investing,World Bank announces $150 million aid package for Sri Lanka amid financial crisis,https://www.investing.com/news/economy/world-bank-announces-150-million-aid-package-for-sri-lanka-amid-financial-crisis-93CH-3230317,https://da.gd/ssFAlh
