feed,title,long_url,short_url
SeekingAlpha,Soho House & Co promotes Tom Collins to Chief Operating Officer,https://seekingalpha.com/news/4034898,
SeekingAlpha,"Tokyo Electron GAAP EPS of ¥294.12, revenue of ¥819.6B",https://seekingalpha.com/news/4034897,
SeekingAlpha,"Altus Group Non-GAAP EPS of C$0.33, revenue of C$185.2M",https://seekingalpha.com/news/4034896,
SeekingAlpha,Dermata Therapeutics GAAP EPS of -$0.54,https://seekingalpha.com/news/4034895,
SeekingAlpha,Grupo Aeroportuario del Pacífico: Efficiency Punished,https://seekingalpha.com/article/4650296,
