feed,title,long_url,short_url
Investing,China declares stealing digital collections like NFTs liable for criminal theft sentence,https://www.investing.com/news/cryptocurrency-news/china-declares-stealing-digital-collections-like-nfts-liable-for-criminal-theft-sentence-3230914,https://da.gd/Q7ad
Investing,"Ethereum (ETH) Fees Surge to Ridiculous Levels, Again",https://www.investing.com/news/cryptocurrency-news/ethereum-eth-fees-surge-to-ridiculous-levels-again-3230881,https://da.gd/yquM
Investing,"Wynn Resorts, Illumina, Plug Power fall premarket; Apple rises",https://www.investing.com/news/stock-market-news/wynn-resorts-illumina-plug-power-fall-premarket-apple-rises-3230690,https://da.gd/Xl7gPO
Investing,UAW workers at GM's Flint assembly narrowly vote against new labor deal,https://www.investing.com/news/stock-market-news/uaw-workers-at-gms-flint-assembly-narrowly-vote-against-new-labor-deal-3230882,https://da.gd/UKkMLt
Investing,Volvo buys battery business from Proterra for $210M,https://www.investing.com/news/stock-market-news/volvo-buys-battery-business-from-proterra-for-210m-432SI-3230878,https://da.gd/80BwCx
Investing,Bitcoin rebounds as market anticipates ETF approval and FED rate cut,https://www.investing.com/news/stock-market-news/bitcoin-rebounds-as-market-anticipates-etf-approval-and-fed-rate-cut-93CH-3230885,https://da.gd/dh7HbF
Investing,Credit Suisse FX head John Estrada exits amid post-takeover reshuffle,https://www.investing.com/news/stock-market-news/credit-suisse-fx-head-john-estrada-exits-amid-posttakeover-reshuffle-93CH-3230890,https://da.gd/tHuW4N
Investing,Apple faces risk of losing top market cap spot to Microsoft amid sales slump,https://www.investing.com/news/stock-market-news/apple-faces-risk-of-losing-top-market-cap-spot-to-microsoft-amid-sales-slump-93CH-3230888,https://da.gd/Pua8F
Investing,Dallas Fed President calls for enhanced US liquidity infrastructure,https://www.investing.com/news/economy/dallas-fed-president-calls-for-enhanced-us-liquidity-infrastructure-93CH-3230913,https://da.gd/eOBc
