feed,title,long_url,short_url
Investing,Crypto market rallies on ETF anticipation and blockchain payment tests,https://www.investing.com/news/cryptocurrency-news/crypto-market-rallies-on-etf-anticipation-and-blockchain-payment-tests-93CH-3231311,https://da.gd/mwdM
Investing,Galaxy Digital predicts Bitcoin ETFs to boost institutional crypto adoption,https://www.investing.com/news/cryptocurrency-news/galaxy-digital-predicts-bitcoin-etfs-to-boost-institutional-crypto-adoption-93CH-3231309,https://da.gd/fFG2
Investing,"Mango Markets’ exploiter to face trial in April, and Coinflux shuts multichain: Finance Redefined",https://www.investing.com/news/cryptocurrency-news/mango-markets-exploiter-to-face-trial-in-april-and-coinflux-shuts-multichain-finance-redefined-3231307,https://da.gd/4lCYqw
Investing,Researchers claim Bitcoin experiment generated almost 300% higher returns than hodling,https://www.investing.com/news/cryptocurrency-news/researchers-claim-bitcoin-experiment-generated-almost-300-higher-returns-than-hodling-3231295,https://da.gd/xaodfs
Investing,Binance CEO freezes $11.8 million after Montenegro kidnapping,https://www.investing.com/news/cryptocurrency-news/binance-ceo-freezes-118-million-after-montenegro-kidnapping-93CH-3231292,https://da.gd/s2kcEg
Investing,Centuria Capital CEO pay exceeds industry norm as AGM approaches,https://www.investing.com/news/stock-market-news/centuria-capital-ceo-pay-exceeds-industry-norm-as-agm-approaches-93CH-3231310,https://da.gd/0pSO
Investing,Exclusive-ICBC injected capital into U.S. unit after hack - sources,https://www.investing.com/news/stock-market-news/exclusiveicbc-injected-capital-into-us-unit-after-hack--sources-3231301,https://da.gd/d5JY6Z
Investing,"Diageo, Illumina, and Plug Power shares tumble on growth concerns",https://www.investing.com/news/stock-market-news/diageo-illumina-and-plug-power-shares-tumble-on-growth-concerns-93CH-3231305,https://da.gd/TYLdf
Investing,Russian stock market sees surge in IPOs and investor interest despite economic concerns,https://www.investing.com/news/stock-market-news/russian-stock-market-sees-surge-in-ipos-and-investor-interest-despite-economic-concerns-93CH-3231304,https://da.gd/aAFlS
Investing,Blink Charging shares surge on raised revenue forecast and Q3 results,https://www.investing.com/news/stock-market-news/blink-charging-shares-surge-on-raised-revenue-forecast-and-q3-results-93CH-3231303,https://da.gd/jPNpK
Investing,PAR Technology CEO to Present at Stephens Investment Conference,https://www.investing.com/news/stock-market-news/par-technology-ceo-to-present-at-stephens-investment-conference-93CH-3231302,https://da.gd/QVrmbY
Investing,Mullen leases former Kraft warehouse for EV production,https://www.investing.com/news/stock-market-news/mullen-leases-former-kraft-warehouse-for-ev-production-432SI-3231296,https://da.gd/dYWWN
Investing,Dubai to showcase demand for jets under shadow of Mideast tensions,https://www.investing.com/news/stock-market-news/dubai-to-showcase-demand-for-jets-under-shadow-of-tensions-3231222,https://da.gd/uA5fv9
Investing,Vuzix shares plummet after larger than expected Q3 losses,https://www.investing.com/news/stock-market-news/vuzix-shares-plummet-after-larger-than-expected-q3-losses-93CH-3231293,https://da.gd/qLk4XT
Investing,Bank of Canada governor warns federal spending hampers inflation fight,https://www.investing.com/news/economy/bank-of-canada-governor-warns-federal-spending-hampers-inflation-fight-93CH-3231300,https://da.gd/z8vn
Investing,University of Michigan reports drop in consumer sentiment to six-month low,https://www.investing.com/news/economy/university-of-michigan-reports-drop-in-consumer-sentiment-to-sixmonth-low-93CH-3231291,https://da.gd/GMMNv9
