feed,title,long_url,short_url
SeekingAlpha,iShares U.S. Oil & Gas Exploration & Production ETF declares quarterly distribution of $0.2601,https://seekingalpha.com/news/3676412,
SeekingAlpha,iShares U.S. Medical Devices ETF declares quarterly distribution of $0.0221,https://seekingalpha.com/news/3676411,
SeekingAlpha,iShares U.S. Insurance ETF (IAK) declares quarterly distribution of $0.5817,https://seekingalpha.com/news/3676410,
SeekingAlpha,iShares U.S. Industrials ETF (IYJ) declares quarterly distribution of $0.1918,https://seekingalpha.com/news/3676409,
SeekingAlpha,iShares U.S. Home Construction ETF declares quarterly distribution of $0.0777,https://seekingalpha.com/news/3676408,
SeekingAlpha,iShares U.S. Healthcare ETF declares quarterly distribution of $0.6606,https://seekingalpha.com/news/3676407,
SeekingAlpha,iShares U.S. Healthcare Providers ETF declares quarterly distribution of $0.4203,https://seekingalpha.com/news/3676406,
