feed,title,long_url,short_url
Investing,Top 10 NFT Projects Soar in Trading Volume Despite Market Dip,https://investing.com/news/-2836902,
Investing,CryptoDep: Top Memecoins By Social Activity 06/14,https://investing.com/news/-2836901,
Investing,"Consensus 2022: Web3, unpacking regulations, and optimism for crypto’s future",https://investing.com/news/-2836900,
Investing,Twists and turns in takeover battle for Spirit Airlines,https://investing.com/news/-2836907,
Investing,"Boeing delivered 29 737 MAX jets in May, notches widebody orders",https://investing.com/news/-2836906,
