feed,title,long_url,short_url
InvestorPlace,3 Small-Cap Stocks With Explosive 2X Growth Potential,https://investorplace.com/2024/07/3-small-cap-stocks-with-explosive-2x-growth-potential/,https://da.gd/TEyAu
InvestorPlace,Why Is Morphic (MORF) Stock Up 75% Today?,https://investorplace.com/2024/07/why-is-morphic-morf-stock-up-75-today/,https://da.gd/nwYzRp
InvestorPlace,Boeing Pleads Guilty: Why BA Stock Is Up on Criminal Case News,https://investorplace.com/2024/07/boeing-pleads-guilty-why-ba-stock-is-up-on-criminal-case-news/,https://da.gd/XOmqL
InvestorPlace,3 Dividend Stocks Crushing the S&P 500 With 30%+ Annual Total Returns,https://investorplace.com/2024/07/3-dividend-stocks-crushing-the-sp-500-with-30-annual-total-returns/,https://da.gd/VVVwZl
InvestorPlace,3 Unshakeable Blue-Chip Stocks to Own Through Any Market,https://investorplace.com/2024/07/3-unshakeable-blue-chip-stocks-to-own-through-any-market/,https://da.gd/VEZh4G
InvestorPlace,NIO Stock Alert: Nio Announces a CFO Shake-Up,https://investorplace.com/2024/07/nio-stock-alert-nio-announces-a-cfo-shake-up/,https://da.gd/a6lwQ
InvestorPlace,Weekly Upgrades and Downgrades,https://investorplace.com/market360/2024/07/20240708-upgrades-downgrades/,https://da.gd/QhQ8h
InvestorPlace,PARA Stock Alert: Paramount FINALLY Reaches Merger Deal With Skydance,https://investorplace.com/2024/07/para-stock-alert-paramount-finally-reaches-merger-deal-with-skydance/,https://da.gd/fGPeS
