feed,title,long_url,short_url
Yahoo,Shopify Stock Just Hit a $100 Billion Milestone: Should You Buy Right Now?,https://www.fool.com/investing/2024/02/29/shopify-stock-just-hit-a-100-billion-milestone/?source=eptyholnk0000202&utm_source=yahoo-host-full&utm_medium=feed&utm_campaign=article&.tsrc=rss,https://da.gd/d7N4fZ
Yahoo,"Tech News Now: More lawsuits pile up against OpenAI, Salesforce announces dividend, and more",https://www.thestreet.com/technology/tech-news-now-more-lawsuits-pile-up-against-openai-salesforce-announces-dividend-and-more?.tsrc=rss,https://da.gd/OD8g9E
Yahoo,The 9-Letter Word Disney Doesn't Want to Mention but Could Be a Big Part of its Future Growth,https://www.fool.com/investing/2024/02/29/the-9-letter-word-disney-doesnt-want-to-mention/?source=eptyholnk0000202&utm_source=yahoo-host-full&utm_medium=feed&utm_campaign=article&.tsrc=rss,https://da.gd/34mJk2
Yahoo,"The Zacks Analyst Blog Highlights Amazon.com, American Express, International Business Machines, Microsoft and The Travelers Companies",https://finance.yahoo.com/news/zacks-analyst-blog-highlights-amazon-141800166.html?.tsrc=rss,https://da.gd/R6IuLC
Yahoo,5 U.S. Bigwigs With Solid Potential for Short-Term Upside,https://finance.yahoo.com/news/5-u-bigwigs-solid-potential-140100408.html?.tsrc=rss,https://da.gd/6wb0m8
