feed,title,long_url,short_url
SeekingAlpha,"SoFi Technologies GAAP EPS of -$0.09 beats by $0.01, revenue of $424M beats by $32.22M",https://seekingalpha.com/news/3898375,
SeekingAlpha,Jim Davis becomes new CEO of Quest Diagnostics,https://seekingalpha.com/news/3898374,
SeekingAlpha,"Hayward Holdings Non-GAAP EPS of $0.14 beats by $0.02, revenue of $245.3M beats by $4.96M",https://seekingalpha.com/news/3898373,
SeekingAlpha,"Catalent Non-GAAP EPS of $0.71 beats by $0.15, revenue of $1.02B misses by $60M, cuts FY22 revenue outlook",https://seekingalpha.com/news/3898372,
SeekingAlpha,Ametek reports Q3 earnings beat; raises FY22 and initiates Q4 guidance,https://seekingalpha.com/news/3898371,
SeekingAlpha,Carvana races higher after J.P. Morgan pulls bear call,https://seekingalpha.com/news/3898370,
SeekingAlpha,AMD's results to come out amid gloomy days for PC market,https://seekingalpha.com/news/3898151,
