feed,title,long_url,short_url
SeekingAlpha,"Revolution Medicines EPS misses by $0.03, misses on revenue",https://seekingalpha.com/news/3635424,
SeekingAlpha,"GoodRx Holdings EPS beats by $0.09, beats on revenue",https://seekingalpha.com/news/3635423,
SeekingAlpha,"Suburban Propane Partners EPS beats by $0.10, misses on revenue",https://seekingalpha.com/news/3635422,
SeekingAlpha,Bioceres beats on revenue,https://seekingalpha.com/news/3635421,
SeekingAlpha,Alithya Group reports Q2 results,https://seekingalpha.com/news/3635420,
SeekingAlpha,"Jerash Holdings EPS beats by $0.08, beats on revenue",https://seekingalpha.com/news/3635419,
SeekingAlpha,"Carlyle Group invests in health, beauty & wellness ecommerce platform",https://seekingalpha.com/news/3635418,
