feed,title,long_url,short_url
InsiderMonkey,Warren Buffett Isn’t Alone — Some Other Top Billionaires are Also Dumping Apple (AAPL),https://insidermonkey.com/blog/--1341403,
InsiderMonkey,Strategic Ways Shipping Containers Can Cut Your Business Expenses,https://insidermonkey.com/blog/--1341914,
InsiderMonkey,Fordefi Unveils First Institutional-Grade MPC Wallet for DeFi on Sui,https://insidermonkey.com/blog/--1341894,
InsiderMonkey,4 Warning Signs to Look for When Choosing a Forex Broker,https://insidermonkey.com/blog/--1341904,
InsiderMonkey,Billionaires are Exiting Intel Corp (NASDAQ:INTC) In Droves,https://insidermonkey.com/blog/--1341398,
InsiderMonkey,Billionaires’ New Favorite AI Stock: QUALCOMM (NASDAQ:QCOM),https://insidermonkey.com/blog/--1341400,
InsiderMonkey,Billionaire Stanley Druckenmiller is Buying Adobe (ADBE): Here’s Why,https://insidermonkey.com/blog/--1341401,
