feed,title,long_url,short_url
Yahoo,"Top Stock Movers Now: Super Micro Computer, JM Smucker, Nvidia, and More",https://www.investopedia.com/top-stock-movers-now-super-micro-computer-jm-smucker-nvidia-and-more-8703201?.tsrc=rss,https://da.gd/t27x
Yahoo,Nvidia’s Blackwell GPU Crushes Its Current Generation,https://finance.yahoo.com/m/56352cc8-b581-3165-9c0b-61e437c1ca75/nvidia%E2%80%99s-blackwell-gpu.html?.tsrc=rss,https://da.gd/5WnXpR
Yahoo,Nvidia Stock Drops 3% Ahead of Earnings,https://finance.yahoo.com/m/ce5ad40d-6ebf-3055-aa68-64e603c41e54/nvidia-stock-drops-3%25-ahead.html?.tsrc=rss,https://da.gd/wC5G
Yahoo,The Nasdaq and the Mag 7 Are Struggling Ahead of Nvidia Earnings,https://finance.yahoo.com/m/d694f0cf-1a8b-3d2b-b42b-57d1cb7702b0/the-nasdaq-and-the-mag-7-are.html?.tsrc=rss,https://da.gd/iALRH9
Yahoo,Nvidia Is the Stock Market's Best Performer—by a Wide Margin,https://finance.yahoo.com/m/2ddc27cc-5998-3e44-bd74-de7a8c5921ce/nvidia-is-the-stock-market%27s.html?.tsrc=rss,https://da.gd/wLcDys
Yahoo,"How Will Nvidia Stock React to Earnings? Options Pricing, History Are Guides",https://finance.yahoo.com/m/1f813620-2671-3091-a34f-d23ae83fbc72/how-will-nvidia-stock-react.html?.tsrc=rss,https://da.gd/eer2M
