feed,title,long_url,short_url
InsiderMonkey,Jim Cramer On Advanced Micro Devices Inc. (AMD): ‘I Think You Can Buy More’,https://insidermonkey.com/blog/--1340839,
InsiderMonkey,Jim Cramer On Walmart Inc. (WMT): ‘You Might Be Surprised By How Great Walmart Is’,https://insidermonkey.com/blog/--1340838,
InsiderMonkey,Jim Cramer Says Costco Wholesale Corporation (COST) Is ‘Like No Other’,https://insidermonkey.com/blog/--1340837,
InsiderMonkey,Jim Cramer Says HCA Healthcare Inc. (HCA) Is ‘The Best’,https://insidermonkey.com/blog/--1340836,
InsiderMonkey,Jim Cramer On Snowflake Inc. (SNOW): ‘Strong Quarter With Results That Exceeded Expectations’,https://insidermonkey.com/blog/--1340835,
InsiderMonkey,Jim Cramer on TJX Companies Inc. (TJX): ‘I’m So Glad We Own It For The Travel Trust’,https://insidermonkey.com/blog/--1340834,
InsiderMonkey,7 Best Bitcoin and Blockchain Stocks To Buy According to Analysts,https://insidermonkey.com/blog/--1341783,
InsiderMonkey,Jim Cramer on International Business Machines Corporation (IBM): ‘I Would Hold On To It Or Consider Buying More’,https://insidermonkey.com/blog/--1340833,
InsiderMonkey,Jim Cramer Says ‘I Would Not Recommend Any Other Insurer On The Show Other Than Chubb Limited (CB)’,https://insidermonkey.com/blog/--1340831,
InsiderMonkey,NVIDIA Corporation (NVDA): Morgan Stanley Upgrade and Initial Blackwell Predictions,https://insidermonkey.com/blog/--1342029,
InsiderMonkey,Jim Cramer Says It’s Still ZIM Integrated Shipping Services Ltd. (ZIM)’s Time,https://insidermonkey.com/blog/--1340830,
InsiderMonkey,Jim Cramer Says Lumen Technologies Inc. (LUMN) Has Been Dramatic and Steep,https://insidermonkey.com/blog/--1340810,
