feed,title,long_url,short_url
FXEmpire,"Daily Gold News: Wednesday, July 6 – Gold Price at New Medium-Term Lows",https://www.fxempire.com/news/article/daily-gold-news-wednesday-july-6-gold-price-at-new-medium-term-lows-1055596,https://bit.ly/3NQWaVQ
FXEmpire,British PM Johnson: My job is to ‘keep going’,https://www.fxempire.com/news/article/british-pm-johnson-my-job-is-to-keep-going-1055603,https://bit.ly/3NOfnY6
FXEmpire,Italy’s 5-Star says it will stay in govt but sets policy conditions,https://www.fxempire.com/news/article/italys-5-star-says-it-will-stay-in-govt-but-sets-policy-conditions-1055602,https://bit.ly/3IhUqDM
FXEmpire,Spain’s Pamplona bull-running fiesta back with a bang after COVID ban,https://www.fxempire.com/news/article/spains-pamplona-bull-running-fiesta-back-with-a-bang-after-covid-ban-1055607,https://bit.ly/3aeWG2l
FXEmpire,Potanin seen as major obstacle to Russian $60bn metal merger,https://www.fxempire.com/news/article/potanin-seen-as-major-obstacle-to-russian-60bn-metal-merger-1055606,https://bit.ly/3AsZ6oA
FXEmpire,"Rogers, Shaw say Canada antitrust talks on blocked deal did not result in resolution",https://www.fxempire.com/news/article/rogers-shaw-say-canada-antitrust-talks-on-blocked-deal-did-not-result-in-resolution-1055599,https://bit.ly/3AtbpRI
FXEmpire,Some 300 inmates on run after suspected Boko Haram raid on Nigeria prison,https://www.fxempire.com/news/article/some-300-inmates-on-run-after-suspected-boko-haram-raid-on-nigeria-prison-1055600,https://bit.ly/3IgwoJs
