feed,title,long_url,short_url
Investing,Gold and Silver Futures See Marginal Decline on MCX,https://www.investing.com/news/commodities-news/gold-and-silver-futures-see-marginal-decline-on-mcx-93CH-3184524,https://da.gd/k0a89x
Investing,Oil prices rebound as tighter supply bets offset rate hike jitters,https://www.investing.com/news/commodities-news/oil-prices-rise-as-t,https://da.gd/Xo6a1
Investing,SEC chief says new California law could 'change baseline' for coming SEC climate rule,https://www.investing.com/news/stock-market-news/sec-chief-says-new-california-law-could-change-baseline-for-coming-sec-climate-rule-3184527,https://da.gd/s6I7Ww
Investing,Rated Labs secures $12.88 million in Series A funding for expansion,https://www.investing.com/news/stock-market-news/rated-labs-secures-1288-million-in-series-a-funding-for-expansion-93CH-3184526,https://da.gd/u2HjK3
Investing,Nike Air Jordan cachet tumbles on resale market. Is sneaker culture moving on?,https://www.investing.com/news/stock-market-news/nike-air-jordan-cachet-tumbles-on-resale-market-is-sneaker-culture-moving-on-3184520,https://da.gd/di4vK
Investing,Crypto exchange Kraken to offer US-listed stocks' trading - Bloomberg News,https://www.investing.com/news/stock-market-news/crypto-exchange-kraken-to-offer-uslisted-stocks-trading--bloomberg-news-3184518,https://da.gd/6CVT
Investing,"Quadrogen Power Systems Sees Significant Revenue Growth, Eyes $30 Million in 2023 Sales",https://www.investing.com/news/stock-market-news/quadrogen-power-systems-sees-significant-revenue-growth-eyes-30-million-in-2023-sales-93CH-3184516,https://da.gd/LNMy
Investing,Goldman Sachs and OMERS partner to tap into Asia-Pacific private credit opportunities,https://www.investing.com/news/stock-market-news/goldman-sachs-and-omers-partner-to-tap-into-asiapacific-pri,https://da.gd/mnnduR
