feed,title,long_url,short_url
InsiderMonkey,Here’s Why ClearBridge Investments Closed its MRC Global (MRC) Position,https://insidermonkey.com/blog/--1018509,
InsiderMonkey,Here’s Why ClearBridge Investments Closed Out its Arista Networks (ANET) Position,https://insidermonkey.com/blog/--1018555,
InsiderMonkey,Here’s What Makes Maravai LifeSciences (MRVI) A Great Investment Choice,https://insidermonkey.com/blog/--1018563,
InsiderMonkey,Here’s Why ClearBridge Investments Sold its AMETEK (AME) Shares,https://insidermonkey.com/blog/--1018567,
InsiderMonkey,Here’s What Makes Cisco Systems (CSCO) A Great Long-Term Investment,https://insidermonkey.com/blog/--1018529,
InsiderMonkey,Here’s Why ClearBridge Investments Became Bullish ON Semiconductor (ON),https://insidermonkey.com/blog/--1018507,
InsiderMonkey,ClearBridge Investments: “We Remain Positive on Amgen (AMGN)”,https://insidermonkey.com/blog/--1018501,
InsiderMonkey,ClearBridge Investments: “Costco (COST) Continued to Execute Well”,https://insidermonkey.com/blog/--1018437,
