feed,title,long_url,short_url
SeekingAlpha,DocGo secures $55M mobile health contracts in Nevada,https://seekingalpha.com/news/3785334,
SeekingAlpha,Citi boosts S&P 500 target for 2022 only a couple of days into the year,https://seekingalpha.com/news/3785323,
SeekingAlpha,Aramark in strategic pact with Patient Engagement Advisors,https://seekingalpha.com/news/3785333,
SeekingAlpha,Estee Lauder falls after Bank of America warns on premium valuation,https://seekingalpha.com/news/3785332,
SeekingAlpha,"Rivian Automotive Bears Watching, Not Buying For The Short Term",https://seekingalpha.com/article/4478009,
