feed,title,long_url,short_url
SeekingAlpha,Taoping announces Hong Kong Data Center expansion plan,https://seekingalpha.com/news/3785397,
SeekingAlpha,"Amazon, Cisco and Lockheed Martin partner on commtech for NASA's Artemis mission",https://seekingalpha.com/news/3785396,
SeekingAlpha,IAC names NFL's Halpin as its new chief financial officer,https://seekingalpha.com/news/3785395,
SeekingAlpha,"MetLife, American Equity stocks climb after Evercore upgrades in 2022 outlook",https://seekingalpha.com/news/3785394,
SeekingAlpha,"Is Ford A Good Stock Pick On EV Momentum? Yes, Based On Its EV Leadership Ambitions",https://seekingalpha.com/article/4477914,
SeekingAlpha,Dollar Eases,https://seekingalpha.com/article/4478029,
SeekingAlpha,4 Of Last Year's Underperformers Ready For Rising In 2022,https://seekingalpha.com/article/4478028,
