feed,title,long_url,short_url
Benzinga,"Proactive news headlines including Fury Gold Mines, Benchmark Metals, ImagineAR and Recruiter.com Group",https://www.benzinga.com/pressreleases/21/02/g19591034/proactive-news-headlines-including-fury-gold-mines-benchmark-metals-imaginear-and-recruiter-com-gr,https://j.mp/2MRjXeV
Benzinga,"Advanced Energy Beats On Q4 Earnings, Names New CEO",https://www.benzinga.com/news/earnings/21/02/19586982/advanced-energy-beats-on-q4-earnings-names-new-ceo,https://j.mp/3a7sm6U
Benzinga,Maple Reinders Consortium Reaches Financial Close on Halifax Regional Municipality Organics Management Infrastructure and Long - Term Operating Contract DBOOT PPP,https://www.benzinga.com/pressreleases/21/02/n19591011/maple-reinders-consortium-reaches-financial-close-on-halifax-regional-municipality-organics-manage,https://j.mp/3jDEBLG
Benzinga,Ellucian Partners with NEOED to Offer Customers Enhanced Talent Management Solutions,https://www.benzinga.com/pressreleases/21/02/n19590997/ellucian-partners-with-neoed-to-offer-customers-enhanced-talent-management-solutions,https://j.mp/3ql60UQ
Benzinga,goPuff chooses EduMe's Workforce Success platform to deliver remote training across 500+ U.S. cities,https://www.benzinga.com/pressreleases/21/02/n19590959/gopuff-chooses-edumes-workforce-success-platform-to-deliver-remote-training-across-500-u-s-cities,https://j.mp/2LC4nTJ
Benzinga,Tom Chisholm Accepted into Forbes Business Council,https://www.benzinga.com/pressreleases/21/02/g19590951/tom-chisholm-accepted-into-forbes-business-council,https://j.mp/3rLR96x
Benzinga,Photronics to Report First Quarter Earnings,https://www.benzinga.com/pressreleases/21/02/g19590948/photronics-to-report-first-quarter-earnings,https://j.mp/3rJote2
Benzinga,"TC PipeLines, LP to release 2020 fourth quarter and year-end financial results on February 24",https://www.benzinga.com/pressreleases/21/02/g19590943/tc-pipelines-lp-to-release-2020-fourth-quarter-and-year-end-financial-results-on-february-24,https://j.mp/3jA3Hea
