feed,title,long_url,short_url
SeekingAlpha,"Western Union EPS beats by $0.03, beats on revenue",https://seekingalpha.com/news/3660790,
SeekingAlpha,"Uber EPS beats by $0.01, misses on revenue",https://seekingalpha.com/news/3660789,
SeekingAlpha,Iridium announces $300M share buyback; shares rise 1%,https://seekingalpha.com/news/3660788,
SeekingAlpha,Travere Therapeutics to raise $150M through public offering,https://seekingalpha.com/news/3660787,
SeekingAlpha,"Pacific Biosciences of California EPS beats by $0.06, beats on revenue",https://seekingalpha.com/news/3660786,
SeekingAlpha,"Axcelis Technologies EPS beats by $0.13, beats on revenue",https://seekingalpha.com/news/3660785,
SeekingAlpha,"Bloom Energy EPS misses by $0.08, beats on revenue",https://seekingalpha.com/news/3660783,
