feed,title,long_url,short_url
SeekingAlpha,Philip Morris: Ray Dalio's Wisdom On Income Generation,https://seekingalpha.com/article/4641324,
SeekingAlpha,Nvidia Stock: High Hopes Could Meet Harsh Reality Next,https://seekingalpha.com/article/4641323,
SeekingAlpha,Evolution AB: An Unknown Gem Dominating The Live Casino Solutions Market,https://seekingalpha.com/article/4641231,
SeekingAlpha,"10-Year U.S. Treasury Yield 'Fair Value' Estimate: October 17, 2023",https://seekingalpha.com/article/4641331,
SeekingAlpha,PRO Webinar Replay: Top Analysts Ranking,https://seekingalpha.com/article/4641338,
SeekingAlpha,Moderna Vs. Novavax: Neither Offering Short-Term Value As Fall Vaccine Season Begins,https://seekingalpha.com/article/4641322,
