feed,title,long_url,short_url
Investing,Bitcoin Price Surges as Skybridge Capital’s Scaramucci Eyes $15 Trillion Market Cap,https://www.investing.com/news/cryptocurrency-news/bitcoin-price-surges-as-skybridge-capitals-scaramucci-eyes-15-trillion-market-cap-93CH-3201196,https://da.gd/8akjt
Investing,AutoNation drops bid for UK auto dealer Pendragon,https://www.investing.com/news/stock-market-news/autonation-drops-bid-for-uk-auto-dealer-pendragon-3201199,https://da.gd/uOACy
Investing,Stellantis cancels presentation at CES tech show due to UAW strike,https://www.investing.com/news/stock-market-news/stellantis-cancels-presentation-at-ces-tech-show-due-to-uaw-strike-3201189,https://da.gd/ooCwZb
Investing,"Tupperware Brands Sees Leadership Change, Stock on the Rise",https://www.investing.com/news/stock-market-news/tupperware-brands-sees-leadership-change-stock-on-the-rise-93CH-3201192,https://da.gd/WHFO
Investing,HSBC Tightens Communication Rules Amid Regulatory Scrutiny,https://www.investing.com/news/stock-market-news/hsbc-tightens-communication-rules-amid-regulatory-scrutiny-93CH-3201193,https://da.gd/SzXjV
Investing,Fed's Barkin sees room for rate decision amid easing inflation pressures,https://www.investing.com/news/economy/feds-barkin-sees-room-for-rate-decision-amid-easing-inflation-pressures-93CH-3201191,https://da.gd/wg3Ln
