feed,title,long_url,short_url
SeekingAlpha,Schwab High Yield Bond ETF declares monthly distribution of $0.322,https://seekingalpha.com/news/4098991,
SeekingAlpha,2s are trading cheaper to fed funds than in the post-July period - Citi,https://seekingalpha.com/news/4098990,
SeekingAlpha,Spirit AeroSystems sues to halt safety probe by Texas,https://seekingalpha.com/news/4098989,
SeekingAlpha,Schwab Municipal Bond ETF declares monthly distribution of $0.1481,https://seekingalpha.com/news/4098988,
SeekingAlpha,Essential Properties Realty Trust: The Value Potential Is Still There After Q1 Earnings,https://seekingalpha.com/article/4688559,
