feed,title,long_url,short_url
CryptoNews,"Whales Dive Back Into Solana Meme Coins with SEALANA Crypto Presale Raising $100,000 in Minutes",https://cryptonews.com/news/whales-dive-back-into-solana-meme-coins-with-sealana-crypto-presale-raising-100000-in-minutes-2.htm,https://da.gd/TTb7mJ
CryptoNews,MoonPay Expands Crypto Trading Options with Integration of PayPal Transactions,https://cryptonews.com/news/moonpay-expands-crypto-trading-options-with-integration-of-paypal-transactions.htm,https://da.gd/EXv2tn
CryptoNews,Bitcoin Price Prediction as Meme Coin Market Recovers – Time to Buy?,https://cryptonews.com/news/bitcoin-price-prediction-as-meme-coin-market-recovers-time-to-buy.htm,https://da.gd/6aYzK1
CryptoNews,Bitcoin Post-Halving Price Consolidation Isn’t Over Yet: Bitfinex,https://cryptonews.com/news/bitcoin-post-halving-price-consolidation-isnt-over-yet-bitfinex.htm,https://da.gd/BGJBW
CryptoNews,Hundred Finance Hacker Transfers Stolen Funds After A Year Of Inactivity,https://cryptonews.com/news/hundred-finance-hacker-transfers-stolen-funds.htm,https://da.gd/Yl0P1
