feed,title,long_url,short_url
Investing,Italy stocks higher at close of trade; Investing.com Italy 40 up 0.98%,https://www.investing.com/news/stock-market-news/italy-stocks-higher-at-close-of-trade-investingcom-italy-40-up-098-4160657,
Investing,Northrop Grumman completes delivery of battle command system to U.S. Army,https://www.investing.com/news/stock-market-news/northrop-grumman-completes-delivery-of-battle-command-system-to-us-army-93CH-4160656,
Investing,Germany stocks mixed at close of trade; DAX up 0.23%,https://www.investing.com/news/stock-market-news/germany-stocks-mixed-at-close-of-trade-dax-up-023-4160646,
Investing,France stocks higher at close of trade; CAC 40 up 0.06%,https://www.investing.com/news/stock-market-news/france-stocks-higher-at-close-of-trade-cac-40-up-006-4160645,
Investing,Belgium stocks lower at close of trade; BEL 20 down 0.13%,https://www.investing.com/news/stock-market-news/belgium-stocks-lower-at-close-of-trade-bel-20-down-013-4160643,
Investing,Wolfe lifts Boeing PT saying stock drop post Q2 overlooks cash flow improvement,https://www.investing.com/news/stock-market-news/wolfe-lifts-boeing-pt-saying-stock-drop-post-q2-overlooks-cash-flow-improvement-4160624,
Investing,Finland stocks lower at close of trade; OMX Helsinki 25 down 0.45%,https://www.investing.com/news/stock-market-news/finland-stocks-lower-at-close-of-trade-omx-helsinki-25-down-045-4160619,
Investing,Ginkgo Bioworks stock rises after securing $4.66M automation contract,https://www.investing.com/news/stock-market-news/ginkgo-bioworks-stock-rises-after-securing-466m-automation-contract-93CH-4160618,
Investing,Safe & Green Holdings stock rises after restructuring private placement,https://www.investing.com/news/stock-market-news/safe--green-holdings-stock-rises-after-restructuring-private-placement-93CH-4160569,
