feed,title,long_url,short_url
Investing,Earnings call: CarMax reports mixed Q2 results amid market challenges,https://www.investing.com/news/stock-market-news/earnings-call-carmax-reports-mixed-q2-results-amid-market-challenges-93CH-3634753,https://da.gd/ezgzh
Investing,"Earnings call: Accenture reports solid FY '24 results, eyes FY '25 growth",https://www.investing.com/news/stock-market-news/earnings-call-accenture-reports-solid-fy-24-results-eyes-fy-25-growth-93CH-3634752,https://da.gd/n6CLVF
Investing,"Earnings call: TD SYNNEX reports strong Q3 growth, optimistic outlook",https://www.investing.com/news/stock-market-news/earnings-call-td-synnex-reports-strong-q3-growth-optimistic-outlook-93CH-3634750,https://da.gd/5lMCos
Investing,"Earnings call: REE Automotive reports reduced losses, robust demand",https://www.investing.com/news/stock-market-news/earnings-call-ree-automotive-reports-reduced-losses-robust-demand-93CH-3634749,https://da.gd/VdDq0D
Investing,Earnings call: VERBIO reports strong Q4 amid market challenges,https://www.investing.com/news/stock-market-news/earnings-call-verbio-reports-strong-q4-amid-market-challenges-93CH-3634747,https://da.gd/gp9b5
