feed,title,long_url,short_url
Investing,Stock market today: S&P 500 rises as cyclicals shine offsetting Alphabet slump,https://www.investing.com/news/stock-market-news/stock-market-today-sp-500-rises-as-cyclicals-shine-offsetting-alphabet-slump-3733718,https://da.gd/0bdjC
Investing,Trump's Wall Street head hunt puts spotlight on Apollo,https://www.investing.com/news/stock-market-news/trumps-wall-street-head-hunt-puts-spotlight-on-apollo-3735981,https://da.gd/J3010v
Investing,Intuit quarterly earnings beats estimates on AI-driven tool demand,https://www.investing.com/news/stock-market-news/intuit-quarterly-earnings-beats-estimates-on-aidriven-tool-demand-3735944,https://da.gd/PQBEU
Investing,"NetApp earnings beat by $0.09, revenue topped estimates",https://www.investing.com/news/stock-market-news/netapp-earnings-beat-by-009-revenue-topped-estimates-3735941,https://da.gd/D0CTV
Investing,"Ross Stores earnings beat by $0.08, revenue fell short of estimates",https://www.investing.com/news/stock-market-news/ross-stores-earnings-beat-by-008-revenue-fell-short-of-estimates-3735940,https://da.gd/2I6dL9
Investing,"Intuit earnings beat by $0.14, revenue topped estimates",https://www.investing.com/news/stock-market-news/intuit-earnings-beat-by-014-revenue-topped-estimates-3735923,https://da.gd/vRCSsV
