feed,title,long_url,short_url
ArXiv,"Quantifying the Blockchain Trilemma: A Comparative Analysis of Algorand, Ethereum 2.0, and Beyond",https://arxiv.org/abs/2407.14335,
ArXiv,Offline Digital Euro: a Minimum Viable CBDC using Groth-Sahai proofs,https://arxiv.org/abs/2407.13776,
ArXiv,SecureVAX: A Blockchain-Enabled Secure Vaccine Passport System,https://arxiv.org/abs/2407.13852,
ArXiv,Who Wins Ethereum Block Building Auctions and Why?,https://arxiv.org/abs/2407.13931,
ArXiv,A trustworthy blockchain-based energy trading scheme for V2G operations in distributed power grids via integrated scheduling and trading framework,https://arxiv.org/abs/2407.13988,
ArXiv,Theoretical Analysis on Block Time Distributions in Byzantine Fault-Tolerant Consensus Blockchains,https://arxiv.org/abs/2407.14299,
