feed,title,long_url,short_url
Investing,2 Energy ETFs For Entry Into The Oil Bull Market As Prices Take A Breather,https://investing.com/analysis/-200621002,
Investing,Canadian PM candidate supports freedom to use Bitcoin as money,https://investing.com/news/-2793621,
Investing,"U.S. Treasury Secretary Makes Positive Remarks on Crypto, Reversing Past Criticisms",https://investing.com/news/-2793616,
Investing,How Precog Finance Creates Profits for its Community Members,https://investing.com/news/-2793615,
Investing,"Law Decoded: Crypto taxes and taxes on crypto, March 21–28",https://i-invdn-com.investing.com/news/cedb56c793cebdd4180320ed33651e41_M.jpg,
Investing,Tata Motors says 20% rise in battery cell costs increasing short-term pressure,https://investing.com/news/-2793622,
Investing,Japan stocks higher at close of trade; Nikkei 225 up 1.10%,https://investing.com/news/-2793617,
