feed,title,long_url,short_url
Benzinga,Dogecoin Up More Than 5% In 24 hours,https://benzinga.com/markets/cryptocurrency/22/01/25024579/dogecoin-up-more-than-5-in-24-hours,https://j.mp/3qk4PaF
Benzinga,Cryptocurrency Binance Coin's Price Increased More Than 4% Within 24 hours,https://benzinga.com/markets/cryptocurrency/22/01/25024573/cryptocurrency-binance-coins-price-increased-more-than-4-within-24-hours,https://j.mp/3flbWJT
Benzinga,Cryptocurrency Cosmos Rises More Than 7% In 24 hours,https://benzinga.com/markets/cryptocurrency/22/01/25024566/cryptocurrency-cosmos-rises-more-than-7-in-24-hours,https://j.mp/3flc38h
Benzinga,Cryptocurrency Shiba Inu's Price Increased More Than 14% Within 24 hours,https://benzinga.com/markets/cryptocurrency/22/01/25024563/cryptocurrency-shiba-inus-price-increased-more-than-14-within-24-hours,https://j.mp/3qjhSJG
Benzinga,Cryptocurrency Solana's Price Increased More Than 5% Within 24 hours,https://benzinga.com/markets/cryptocurrency/22/01/25024559/cryptocurrency-solanas-price-increased-more-than-5-within-24-hours,https://j.mp/3I5i3hT
