feed,title,long_url,short_url
Investing,"Exclusive-Mongolia to deepen cooperation with US on rare earths, PM says on Washington visit",https://www.investing.com/news/commodities-news/exclusivemongolia-to-deepen-cooperation-with-us-on-rare-earths-pm-says-on-washington-visit-3142798,https://da.gd/cOrMBd
Investing,China's July services activity expands at quicker pace - Caixin PMI,https://www.investing.com/news/economic-indicators/chinas-july-services-activity-expands-at-quicker-pace--caixin-pmi-3142788,https://da.gd/ItBmMS
Investing,China’s service sector grows more than expected in July- Caixin PMI,https://www.investing.com/news/economic-indicators/chinas-service-sector-grows-more-than-expected-in-july-caixin-pmi-3142790,https://da.gd/b11d0v
Investing,"Australia trade balance steadies in June as exports, imports shrink",https://www.investing.com/news/economic-indicators/australia-trade-balance-steadies-in-june-as-exports-imports-shrink-3142787,https://da.gd/7FgIH
Investing,Shares of Evergrande services arm drop as trading resumes after 16 months,https://www.investing.com/news/economy/shares-of-evergrande-services-arm-drop-as-trading-resumes-after-16-months-3142789,https://da.gd/1Fmof
