feed,title,long_url,short_url
InvestorPlace,TTOO Stock Alert: Is T2 Biosystems the Next Meme Stock?,https://investorplace.com/2023/08/ttoo-stock-alert-is-t2-biosystems-the-next-meme-stock/,https://da.gd/xxYSXs
InvestorPlace,Why Is Ballard Power (BLDP) Stock Up 7% Today?,https://investorplace.com/2023/08/why-is-ballard-power-bldp-stock-up-7-today/,https://da.gd/dpw8cT
InvestorPlace,RUN Stock Price Prediction: Can Sunrun Really Rally 80% From Here?,https://investorplace.com/2023/08/run-stock-price-prediction-can-sunrun-really-rally-80-from-here/,https://da.gd/MtVJYT
InvestorPlace,Buy Alert: 3 Tech Stocks Nearing Super Attractive Entry Points,https://investorplace.com/2023/08/buy-alert-3-tech-stocks-nearing-super-attractive-entry-points/,https://da.gd/NwlZk
InvestorPlace,Why Is Virax Biolabs (VRAX) Stock Up Today?,https://investorplace.com/2023/08/why-is-virax-biolabs-vrax-stock-up-today/,https://da.gd/8qppi
InvestorPlace,Is a Giant Short Squeeze Brewing in Rite Aid (RAD) Stock?,https://investorplace.com/2023/08/is-a-giant-short-squeeze-brewing-in-rite-aid-rad-stock/,https://da.gd/2EtD4A
InvestorPlace,ROKU Stock Alert: Why Citi Just Downgraded Roku Shares,https://investorplace.com/2023/08/roku-stock-alert-why-citi-just-downgraded-roku-shares/,https://da.gd/7WmZ4
InvestorPlace,Looking for a Bargain? 3 EV Stocks to Buy That Are Down More Than 10% in 2023,https://investorplace.com/2023/08/3-discounted-ev-stocks-that-offer-investors-bargain/,https://da.gd/Zw2OgD
InvestorPlace,Buckle Up! 3 Healthcare Stocks Set to Soar to New Heights,https://investorplace.com/2023/08/buckle-up-3-healthcare-stocks-set-to-soar-to-new-heights/,https://da.gd/ZWn9W
InvestorPlace,3 Picks & Shovels Ways to Play the EV Sector in 2023,https://investorplace.com/2023/08/3-picks-shovels-ways-to-play-the-ev-sector-in-2023/,https://da.gd/ZdK68G
