feed,title,long_url,short_url
InsiderMonkey,"Heartland Financial USA, Inc. (NASDAQ:HTLF) Q2 2023 Earnings Call Transcript",https://insidermonkey.com/blog/--1175453,
InsiderMonkey,Eversource Energy (NYSE:ES) Q2 2023 Earnings Call Transcript,https://insidermonkey.com/blog/--1175454,
InsiderMonkey,"Hologic, Inc. (NASDAQ:HOLX) Q3 2023 Earnings Call Transcript",https://insidermonkey.com/blog/--1175455,
InsiderMonkey,"TrueCar, Inc. (NASDAQ:TRUE) Q2 2023 Earnings Call Transcript",https://insidermonkey.com/blog/--1175456,
InsiderMonkey,MSA Safety Incorporated (NYSE:MSA) Q2 2023 Earnings Call Transcript,https://insidermonkey.com/blog/--1175457,
InsiderMonkey,"Amkor Technology, Inc. (NASDAQ:AMKR) Q2 2023 Earnings Call Transcript",https://insidermonkey.com/blog/--1175458,
InsiderMonkey,"Instructure Holdings, Inc. (NYSE:INST) Q2 2023 Earnings Call Transcript",https://insidermonkey.com/blog/--1175417,
InsiderMonkey,"Benchmark Electronics, Inc. (NYSE:BHE) Q2 2023 Earnings Call Transcript",https://insidermonkey.com/blog/--1175425,
InsiderMonkey,J&J Snack Foods Corp. (NASDAQ:JJSF) Q3 2023 Earnings Call Transcript,https://insidermonkey.com/blog/--1175426,
InsiderMonkey,"Arista Networks, Inc. (NYSE:ANET) Q2 2023 Earnings Call Transcript",https://insidermonkey.com/blog/--1175427,
InsiderMonkey,"Black Stone Minerals, L.P. (NYSE:BSM) Q2 2023 Earnings Call Transcript",https://insidermonkey.com/blog/--1175438,
InsiderMonkey,"Hedge Fund and Insider Trading News: Ray Dalio, Bill Ackman, Elliott Management, Millennium Management, Greenvale Capital, Calculo Evolution Fund, Exxon Mobil Corp (XOM), Snap Inc. (SNAP), and More",https://insidermonkey.com/blog/--1176513,
InsiderMonkey,"Yum China Holdings, Inc. (NYSE:YUMC) Q2 2023 Earnings Call Transcript",https://insidermonkey.com/blog/--1175428,
InsiderMonkey,Lattice Semiconductor Corporation (NASDAQ:LSCC) Q2 2023 Earnings Call Transcript,https://insidermonkey.com/blog/--1175429,
InsiderMonkey,NBT Bancorp Inc. (NASDAQ:NBTB) Q2 2023 Earnings Call Transcript,https://insidermonkey.com/blog/--1175430,
InsiderMonkey,"The Aaron’s Company, Inc. (NYSE:AAN) Q2 2023 Earnings Call Transcript",https://insidermonkey.com/blog/--1175431,
InsiderMonkey,Tenet Healthcare Corporation (NYSE:THC) Q2 2023 Earnings Call Transcript,https://insidermonkey.com/blog/--1175432,
InsiderMonkey,"Comstock Resources, Inc. (NYSE:CRK) Q2 2023 Earnings Call Transcript",https://insidermonkey.com/blog/--1175433,
InsiderMonkey,SBA Communications Corporation (NASDAQ:SBAC) Q2 2023 Earnings Call Transcript,https://insidermonkey.com/blog/--1175434,
