feed,title,long_url,short_url
SeekingAlpha,"OraSure Technologies Non-GAAP EPS of $0.09 beats by $0.09, revenue of $85.44M beats by $21.56M",https://seekingalpha.com/news/3996968,
SeekingAlpha,"CloudFlare Non-GAAP EPS of $0.10 beats by $0.03, revenue of $308.5M beats by $2.68M",https://seekingalpha.com/news/3996967,
SeekingAlpha,"Sprout Social Non-GAAP EPS of $0.07 beats by $0.09, revenue of $79.3M beats by $0.57M",https://seekingalpha.com/news/3996966,
SeekingAlpha,"Fortinet crashes as it lowers full-year guidance, cybersecurity stocks fall",https://seekingalpha.com/news/3996957,
SeekingAlpha,Sprout Social buys Tagger Media for $140M,https://seekingalpha.com/news/3996965,
SeekingAlpha,"Apple Hospitality FFO of $0.49 in-line, revenue of $361.63M beats by $9.25M",https://seekingalpha.com/news/3996964,
SeekingAlpha,"Outfront MediaEPS of -$2.92, revenue of $468.8M misses by $3.8M",https://seekingalpha.com/news/3996963,
