feed,title,long_url,short_url
Benzinga,J.B. Hunt Acquires Furniture Hauler From Bassett In $87 Million Deal,https://benzinga.com/news/22/01/25310483/j-b-hunt-acquires-furniture-hauler-from-bassett-in-87-million-deal,https://bit.ly/3KYeZpJ
Benzinga,Putting Supply Chain Sustainability Into Action — Net-Zero Carbon,https://benzinga.com/markets/22/01/25308609/putting-supply-chain-sustainability-into-action-net-zero-carbon,https://bit.ly/3s8iTDR
Benzinga,What Are Whales Doing With DocuSign,https://benzinga.com/markets/options/22/01/25316953/what-are-whales-doing-with-docusign,https://bit.ly/35Ev1VO
Benzinga,Biden Moves To Regulate Bitcoin,https://benzinga.com/markets/cryptocurrency/22/01/25316964/biden-moves-to-regulate-bitcoin,https://bit.ly/3odtuwk
Benzinga,This Is What Whales Are Betting On Riot Blockchain,https://benzinga.com/markets/options/22/01/25316952/this-is-what-whales-are-betting-on-riot-blockchain,https://bit.ly/3AJPzI1
Benzinga,What Are Whales Doing With Chevron,https://benzinga.com/markets/options/22/01/25316950/what-are-whales-doing-with-chevron,https://bit.ly/3AUxSFK
