feed,title,long_url,short_url
SeekingAlpha,"Sanmina Non-GAAP EPS of $1.08 beats by $0.13, revenue of $1.76B beats by $110M",https://seekingalpha.com/news/3793734,
SeekingAlpha,"Direct Digital downsizes IPO by nearly half, now looks to raise up to $22.6M",https://seekingalpha.com/news/3793733,
SeekingAlpha,"Alexandria Real Estate Equities FFO of $1.97 in-line, revenue of $576.92M beats by $26.88M",https://seekingalpha.com/news/3793732,
SeekingAlpha,"Graco GAAP EPS of $0.69 beats by $0.04, revenue of $539.6M beats by $21.95M",https://seekingalpha.com/news/3793731,
SeekingAlpha,"Woodward GAAP EPS of $0.47 misses by $0.37, revenue of $541.59M misses by $52.6M",https://seekingalpha.com/news/3793727,
SeekingAlpha,Inventiva gets €4M milestone payment from AbbVie in cedirogant trial to treat psoriasis,https://seekingalpha.com/news/3793724,
SeekingAlpha,"Cirrus Logic Non-GAAP EPS of $2.54 beats by $0.40, revenue of $548.4M beats by $39.12M",https://seekingalpha.com/news/3793726,
