feed,title,long_url,short_url
Nasdaq,Infosys reopens offices as India Inc eyes long road back to work,https://www.nasdaq.com/articles/infosys-reopens-offices-as-india-inc-eyes-long-road-back-to-work-2021-07-21,https://j.mp/3ivYunI
Nasdaq,"'Every time, it's messy:' U.S. again approaching debt ceiling",https://www.nasdaq.com/articles/every-time-its-messy%3A-u.s.-again-approaching-debt-ceiling-2021-07-21-0,https://j.mp/3xXMamq
Nasdaq,AMC board names CEO Adam Aron as chairman,https://www.nasdaq.com/articles/amc-board-names-ceo-adam-aron-as-chairman-2021-07-21,https://j.mp/36PVWLF
Nasdaq,Specialty funding solutions provider Preston Hollow Community Capital sets terms for $200 million IPO,https://www.nasdaq.com/articles/specialty-funding-solutions-provider-preston-hollow-community-capital-sets-terms-for-%24200,https://j.mp/3eFpH6d
Nasdaq,Altice's ad-tech platform Teads sets terms for $751 million US IPO,https://www.nasdaq.com/articles/altices-ad-tech-platform-teads-sets-terms-for-%24751-million-us-ipo-2021-07-21,https://j.mp/3iydJfN
