feed,title,long_url,short_url
InvestorPlace,3 Blue-Chip Stocks Set to Triple Soon,https://investorplace.com/2024/05/3-blue-chip-stocks-set-to-triple-soon/,https://da.gd/sQi2
InvestorPlace,Inflation’s Silver Lining: Netflix Stock Poised to Thrive as Streaming Beats Cinemas,https://investorplace.com/2024/05/inflations-silver-lining-netflix-stock-poised-to-thrive-as-streaming-beats-cinemas/,https://da.gd/oeqDo
InvestorPlace,EVTV Stock Earnings: Envirotech Vehicles Reported Results for Q1 2024,https://investorplace.com/earning-results/2024/05/evtv-stock-earnings-envirotech-vehicles-for-q1-of-2024/,https://da.gd/rU54j
InvestorPlace,Crypto Tokenization May Change the World in 2024,https://investorplace.com/hypergrowthinvesting/2024/05/crypto-tokenization-may-change-the-world-in-2024/,https://da.gd/eg0iy
InvestorPlace,WILC Stock Earnings: G. Willi-Food Intl Reported Results for Q1 2024,https://investorplace.com/earning-results/2024/05/wilc-stock-earnings-g-willi-food-intl-for-q1-of-2024/,https://da.gd/euMJh
InvestorPlace,"SLGL Stock Earnings: Sol-Gel Technologies Misses EPS, Misses Revenue for Q1 2024",https://investorplace.com/earning-results/2024/05/slgl-stock-earnings-sol-gel-technologies-for-q1-of-2024/,https://da.gd/58eOq
InvestorPlace,DBGI Stock Earnings: Digital Brands Group Reported Results for Q1 2024,https://investorplace.com/earning-results/2024/05/dbgi-stock-earnings-digital-brands-group-for-q1-of-2024/,https://da.gd/eFKn95
InvestorPlace,3 Penny Stocks That Could Mint New Millionaires,https://investorplace.com/2024/05/3-penny-stocks-that-could-mint-new-millionaires/,https://da.gd/0gNMNQ
InvestorPlace,The 3 Best Stocks Under $10 to Buy for 3X Returns by 2028,https://investorplace.com/2024/05/the-3-best-stocks-under-10-to-buy-for-3x-returns-by-2028/,https://da.gd/nhkil
InvestorPlace,Roaring Kitty’s Rally Cry: 3 Meme Stocks to Pounce On Now,https://investorplace.com/2024/05/three-meme-stocks-to-pounce-on-now/,https://da.gd/NfA3t
InvestorPlace,7 Biotech Stocks That Could Breathe New Life Into Your Portfolio,https://investorplace.com/2024/05/7-biotech-stocks-that-could-breathe-new-life-into-your-portfolio/,https://da.gd/zfiBp3
InvestorPlace,5 Things TGT Stock Investors Should Know as Target Lowers Prices,https://investorplace.com/2024/05/5-things-tgt-stock-investors-should-know-as-target-lowers-prices/,https://da.gd/CFFJC
InvestorPlace,The AI Stock Underdogs: 7 Underappreciated Companies Poised for Greatness,https://investorplace.com/2024/05/the-ai-stock-underdogs-7-underappreciated-companies-poised-for-greatness/,https://da.gd/h7FCt
InvestorPlace,7 Growth Stocks to Buy for a Sizzling Summer,https://investorplace.com/market360/2024/05/7-growth-stocks-to-buy-for-a-sizzling-summer/,https://da.gd/86LiQ
InvestorPlace,3 Reasons Why the Latest CPI Report Is a Win for the Bulls,https://investorplace.com/2024/05/the-cpi-report-is-rallying-the-bulls-3-reasons-they-may-be-right/,https://da.gd/fULYLH
InvestorPlace,GNPX Stock Earnings: Genprex Beats EPS for Q1 2024,https://investorplace.com/earning-results/2024/05/gnpx-stock-earnings-genprex-for-q1-of-2024/,https://da.gd/qyfuX1
InvestorPlace,AONC Stock Earnings: American Oncology Network Reported Results for Q1 2024,https://investorplace.com/earning-results/2024/05/aonc-stock-earnings-american-oncology-network-for-q1-of-2024/,https://da.gd/hH8KA
InvestorPlace,"SYTA Stock Earnings: Siyata Mobile Misses EPS, Beats Revenue for Q1 2024",https://investorplace.com/earning-results/2024/05/syta-stock-earnings-siyata-mobile-for-q1-of-2024/,https://da.gd/sJUD
InvestorPlace,CLRO Stock Earnings: ClearOne Reported Results for Q1 2024,https://investorplace.com/earning-results/2024/05/clro-stock-earnings-clearone-for-q1-of-2024/,https://da.gd/mpPVeS
InvestorPlace,NTWK Stock Earnings: NETSOL Technologies Reported Results for Q3 2024,https://investorplace.com/earning-results/2024/05/ntwk-stock-earnings-netsol-technologies-for-q3-of-2024/,https://da.gd/viQwT
InvestorPlace,"STRR Stock Earnings: Star Equity Hldgs Misses EPS, Misses Revenue for Q1 2024",https://investorplace.com/earning-results/2024/05/strr-stock-earnings-star-equity-hldgs-for-q1-of-2024/,https://da.gd/m3TUS
InvestorPlace,LCID Stock Alert: 5 Investors Betting Big on Lucid Motors,https://investorplace.com/2024/05/lcid-stock-alert-5-investors-betting-big-on-lucid-motors/,https://da.gd/AMXsEp
