feed,title,long_url,short_url
Investing,"Gold Appears To Be Near A Low, Due For Rally",https://investing.com/analysis/-200627383,
Investing,Gold Getting Ready To Follow Junior Miners’ Footsteps,https://investing.com/analysis/-200627382,
Investing,EarthFund Launches ‘Carbon Removal DAO’ To Boost Climate Action,https://investing.com/news/-2849819,
Investing,"Mexico's Arrenda, aimed at making renting easy, raises $26.5 million in early round",https://investing.com/news/-2849822,
Investing,GM Suspends Korea Production as Suppliers Refuse to Supply Parts,https://investing.com/news/-2849804,
