feed,title,long_url,short_url
Investing,"NYSE Index Bounces Off 38.2 Fibonacci Level, Will It Hold?",https://investing.com/analysis/-200627395,
Investing,Three Major Looming Gaps,https://investing.com/analysis/-200627394,
Investing,FTX and FTX US seek even more funding following acquisitions: Report,https://investing.com/news/-2849945,
Investing,U.S. cruise operators' recovery runs into rough weather as labor crisis worsens,https://investing.com/news/-2849947,
Investing,Lyft lays off about 60 workers from rental division,https://investing.com/news/-2849946,
