feed,title,long_url,short_url
SeekingAlpha,"Agilent Technologies EPS beats by $0.14, beats on revenue",https://seekingalpha.com/news/3700036,
SeekingAlpha,Travere Therapeutics shares fall on sparsentan development program regulatory update,https://seekingalpha.com/news/3700035,
SeekingAlpha,"Capital Southwest NII misses by $0.87, misses on total investment income",https://seekingalpha.com/news/3700032,
SeekingAlpha,"Intuit EPS misses by $0.09, misses on revenue",https://seekingalpha.com/news/3700031,
SeekingAlpha,"ReneSola EPS beats by $0.03, beats on revenue",https://seekingalpha.com/news/3700030,
