feed,title,long_url,short_url
SeekingAlpha,BlackRock Short Maturity Municipal Bond ETF declares monthly distribution of $0.1582,https://seekingalpha.com/news/3930772,
SeekingAlpha,iShares BB Rated Corporate Bond ETF declares monthly distribution of $0.3154,https://seekingalpha.com/news/3930771,
SeekingAlpha,iShares 25+ Year Treasury STRIPS Bond ETF declares monthly distribution of $0.0408,https://seekingalpha.com/news/3930770,
SeekingAlpha,iShares ESG Advanced Total USD Bond Market ETF declares monthly distribution of $0.1175,https://seekingalpha.com/news/3930769,
SeekingAlpha,iShares 0-3 Month Treasury Bond ETF declares monthly distribution of $0.3935,https://seekingalpha.com/news/3930768,
SeekingAlpha,iShares ESG Aware U.S. Aggregate Bond ETF declares monthly distribution of $0.1120,https://seekingalpha.com/news/3930767,
SeekingAlpha,iShares Investment Grade Bond Factor ETF declares monthly distribution of $0.1325,https://seekingalpha.com/news/3930766,
