feed,title,long_url,short_url
Nasdaq,UK's Unite Group sells two London properties for 342 mln pounds,https://www.nasdaq.com/articles/uks-unite-group-sells-two-london-properties-for-342-mln-pounds-2021-06-18,https://j.mp/3gDmMw0
Nasdaq,Car dealer Inchcape raises profit view; warns of chip shortage,https://www.nasdaq.com/articles/car-dealer-inchcape-raises-profit-view-warns-of-chip-shortage-2021-06-18,https://j.mp/3vyZBY5
Nasdaq,"With Recent Correction And Possible Regulatory Tailwinds, Are Hydrogen Stocks A Buy?",https://www.nasdaq.com/articles/with-recent-correction-and-possible-regulatory-tailwinds-are-hydrogen-stocks-a-buy-2021-06,https://j.mp/3vyZBr3
Nasdaq,Is Prudential Financial Stock Undervalued?,https://www.nasdaq.com/articles/is-prudential-financial-stock-undervalued-2021-06-18,https://j.mp/3xsyiQA
Nasdaq,WW International Stock Still A Buy After The Big Rally This Year?,https://www.nasdaq.com/articles/ww-international-stock-still-a-buy-after-the-big-rally-this-year-2021-06-18,https://j.mp/3gy0CLU
Nasdaq,DocuSign: Why This Work From Home Stock Has Outperformed Through The Re-Opening,https://www.nasdaq.com/articles/docusign%3A-why-this-work-from-home-stock-has-outperformed-through-the-re-opening-2021-06-18,https://j.mp/35xL3gR
Nasdaq,"After A 7% Drop Over A Week, Will Lincoln National Stock Rebound?",https://www.nasdaq.com/articles/after-a-7-drop-over-a-week-will-lincoln-national-stock-rebound-2021-06-18,https://j.mp/3iXzEyC
Nasdaq,Despite Over 4x Growth Generac Stock May Continue To Rise,https://www.nasdaq.com/articles/despite-over-4x-growth-generac-stock-may-continue-to-rise-2021-06-18,https://j.mp/3iQLLOg
Nasdaq,What To Expect From D.R. Horton Stock Over The Next One Month?,https://www.nasdaq.com/articles/what-to-expect-from-d.r.-horton-stock-over-the-next-one-month-2021-06-18,https://j.mp/3gB1HCL
Nasdaq,Should You Buy Activision Blizzard Stock At $100?,https://www.nasdaq.com/articles/should-you-buy-activision-blizzard-stock-at-%24100-2021-06-18,https://j.mp/3gCVqFg
Nasdaq,What's Next For Sorrento Therapeutics Stock After A Large 50% Rise In A Month?,https://www.nasdaq.com/articles/whats-next-for-sorrento-therapeutics-stock-after-a-large-50-rise-in-a-month-2021-06-18,https://j.mp/3xyrOj0
Nasdaq,What's Next For Nintendo Stock After A 6% Drop And E3 Showcase?,https://www.nasdaq.com/articles/whats-next-for-nintendo-stock-after-a-6-drop-and-e3-showcase-2021-06-18,https://j.mp/2TMIbKA
Nasdaq,What’s Behind Cleveland-Cliffs Stock Jumping 14% In A Week,https://www.nasdaq.com/articles/whats-behind-cleveland-cliffs-stock-jumping-14-in-a-week-2021-06-18,https://j.mp/3q8bumB
Nasdaq,AGCO Stock Likely To Rebound After A 7% Drop In A Week,https://www.nasdaq.com/articles/agco-stock-likely-to-rebound-after-a-7-drop-in-a-week-2021-06-18,https://j.mp/3gCAboe
