feed,title,long_url,short_url
Nasdaq,"Should Investors Worry About Yesterday's Commodities ""Tumble""?",https://www.nasdaq.com/articles/should-investors-worry-about-yesterdays-commodities-tumble-2021-06-18,https://j.mp/3zC86F1
Nasdaq,CANADA FX DEBT-Canadian dollar extends weekly decline on Fed's hawkish shift,https://www.nasdaq.com/articles/canada-fx-debt-canadian-dollar-extends-weekly-decline-on-feds-hawkish-shift-2021-06-18,https://j.mp/35wjpAZ
Nasdaq,"Bullard: Fed's 'hawkish' shift a natural response to stronger inflation, growth",https://www.nasdaq.com/articles/bullard%3A-feds-hawkish-shift-a-natural-response-to-stronger-inflation-growth-2021-06-18,https://j.mp/3cNZSQf
Nasdaq,"JPMmorgan, Citibank, six others cleared for next bond sale - EU Commission source",https://www.nasdaq.com/articles/jpmmorgan-citibank-six-others-cleared-for-next-bond-sale-eu-commission-source-2021-06-18,https://j.mp/3wQYGUB
Nasdaq,US STOCKS-Wall Street drops at open after hawkish Bullard remarks,https://www.nasdaq.com/articles/us-stocks-wall-street-drops-at-open-after-hawkish-bullard-remarks-2021-06-18,https://j.mp/3wFuhbF
Nasdaq,U.S. natgas futures fall on lower demand forecasts after heat waves,https://www.nasdaq.com/articles/u.s.-natgas-futures-fall-on-lower-demand-forecasts-after-heat-waves-2021-06-18,https://j.mp/3q9mXTi
Nasdaq,This Safe 5-Stock Healthcare Portfolio Yields 5.5%,https://www.nasdaq.com/articles/this-safe-5-stock-healthcare-portfolio-yields-5.5-2021-06-18,https://j.mp/3gCDrQp
Nasdaq,Kroger: An Undervalued Dividend Stock?,https://www.nasdaq.com/articles/kroger%3A-an-undervalued-dividend-stock-2021-06-18,https://j.mp/2SCVjlg
Nasdaq,Is It Too Late to Buy Biogen Stock?,https://www.nasdaq.com/articles/is-it-too-late-to-buy-biogen-stock-2021-06-18,https://j.mp/3wFs3sD
