feed,title,long_url,short_url
Investing,"China, Pakistan pledge to boost cooperation on infrastructure, mining projects",https://www.investing.com/news/commodities-news/china-pakistan-pledge-to-boost-cooperation-on-infrastructure-mining-projects-3852708,https://da.gd/rrllo
Investing,"Oil down as US crude inventories swell, traders worry about China-US trade",https://www.investing.com/news/commodities-news/oil-little-changed-as-market-shrugs-off-china-tariffs-but-iran-pressur,https://da.gd/olJh
Investing,DeepSeek fever fuels patriotic bets on Chinese AI stocks,https://www.investing.com/news/stock-market-news/deepseek-fever-fuels-patriotic-bets-on-chinese-ai-stocks-3852706,https://da.gd/CPSHUt
Investing,"Analysis-Trump's de minimis cancellation is bad news for Temu, but worse for Shein",https://www.investing.com/news/stock-market-news/analysistrumps-de-minimis-cancellation-is-bad-news-for-temu-but-worse-for-shein-3852711,https://da.gd/z16c0
Investing,Valencia floods prompt race for funds to boost Spain's climate resilience,https://www.investing.com/news/stock-market-news/valencia-floods-prompt-race-for-funds-to-boost-spains-climate-resilience-3852710,https://da.gd/5RNWM
Investing,Hannover Re sees Los Angeles fires claims of 500-700 million euros,https://www.investing.com/news/stock-market-news/hannover-re-sees-los-angeles-fires-claims-of-500700-million-euros-3852707,https://da.gd/X4eFJ9
Investing,"Maersk shares jump as cash returns surprise, but 2025 outlook remains cautious",https://www.investing.com/news/stock-market-news/maersk-shares-jump-as-cash-returns-surprise-but-2025-outlook-remains-cautious-3852705,https://da.gd/ZEKp
