feed,title,long_url,short_url
Investing,"Will Tariff Tensions Limit Upside for Natural Gas, Oil Prices?",https://www.investing.com/analysis/will-tariff-tensions-limit-upside-for-natural-gas-oil-prices-200657039,https://da.gd/n2aT1p
Investing,Oil Markets Falter as Trump Delays Tariffs - What's Next for Energy?,https://www.investing.com/analysis/oil-markets-falter-as-trump-delays-tariffs--whats-next-for-energy-200656,https://da.gd/Mkv67d
Investing,Taco Bell-parent Yum posts quarterly sales beat as value meals whet demand,https://www.investing.com/news/stock-market-news/taco-bellparent-yum-posts-quarterly-sales-beat-as-value-meals-whet-demand-3853352,https://da.gd/edDVUL
Investing,Bristol sees sharper 2025 revenue drop after better-than-forecast Q4,https://www.investing.com/news/stock-market-news/bristol-sees-sharper-2025-revenue-drop-after-betterthanforecast-q4-3853351,https://da.gd/QkrD
Investing,"Philip Morris earnings missed by $0.01, revenue topped estimates",https://www.investing.com/news/stock-market-news/philip-morris-earnings-missed-by-001-revenue-topped-estimates-3853347,https://da.gd/J2PSDC
Investing,"Yum! Brands earnings matched, revenue was in line with estimates",https://www.investing.com/news/stock-market-news/yum-brands-earnings-matched-revenue-was-in-line-with-estimates-3853346,https://da.gd/viCwz3
Investing,Peloton stock jumps as company raises profit outlook,https://www.investing.com/news/stock-market-news/peloton-stock-jumps-5-as-company-raises-profit-outlook-3853320,https://da.gd/Sr7Zn
Investing,Under Armour lifts annual profit forecast,https://www.investing.com/news/stock-market-news/under-armour-lifts-annual-profit-forecast-3853318,https://da.gd/C4X2
Investing,"Tapestry stock leaps on boosted 2025 outlook, Q2 results beat",https://www.investing.com/news/stock-market-news/tapestry-stock-leaps-on-boosted-2025-outlook-q2-results-beat-3853317,https://da.gd/fPyk5Y
Investing,"Bristol-Myers Squibb earnings beat by $0.20, revenue topped estimates",https://www.investing.com/news/stock-market-news/bristolmyers-squibb-earnings-beat-by-020-revenue-topped-estimates-3853309,https://da.gd/69Zeh
Investing,"Bank of England cuts rates, sees higher inflation and weaker growth",https://www.investing.com/news/economy-news/bank-of-england-cuts-rates-sees-higher-inflation-and-weaker-growth-3853321,https://da.gd/xQtG6
Investing,Lilly forecasts 2025 profit largely above estimates on weight-loss drug strength,https://www.investing.com/news/economy-news/eli-lilly-forecasts-2025-profit-largely-above-estimates-on-launch-of-weightloss-drug-in-new-markets-3853267,https://da.gd/o7qrNS
Investing,Bank of England cuts base rate by 25 bps to 4.5%,https://www.investing.com/news/economy/bank-of-england-cuts-base-rate-by-25-bps-to-45-3852966,https://da.gd/ClSl
