feed,title,long_url,short_url
SeekingAlpha,Chatham Lodging says cash burn is better than expected,https://seekingalpha.com/news/3600738,
SeekingAlpha,"Spire EPS in-line, beats on revenue",https://seekingalpha.com/news/3600737,
SeekingAlpha,"Oasis Petroleum EPS beats by $0.36, misses on revenue",https://seekingalpha.com/news/3600736,
SeekingAlpha,Palo Alto upgraded at BTIG ahead of FQ4 report,https://seekingalpha.com/news/3600735,
SeekingAlpha,"Vericel EPS beats by $0.02, beats on revenue",https://seekingalpha.com/news/3600734,
SeekingAlpha,"Monster Beverage +5% after big quarter, positive bump from BofA",https://seekingalpha.com/news/3600733,
