feed,title,long_url,short_url
Investing,UAE Quits OPEC: Why the Real Oil Shock Is Still Ahead,https://www.investing.com/analysis/uae-quits-opec-why-the-real-oil-shock-is-still-ahead-200679372,
Investing,"Wall St mixed at open ahead of Big Tech earnings, Fed meeting",https://www.investing.com/news/stock-market-news/wall-st-mixed-at-open-ahead-of-big-tech-earnings-fed-meeting-4645472,
Investing,US bans Chinese air bag components tied to 10 deaths,https://www.investing.com/news/stock-market-news/us-bans-chinese-air-bag-components-tied-to-10-deaths-4645471,
Investing,"Families of Canadian mass shooting victims sue OpenAI, CEO Altman in US court",https://www.investing.com/news/stock-market-news/families-of-canadian-mass-shooting-victims-sue-openai-ceo-altman-in-us-court-4645467,
Investing,2 Top SaaS Stocks to Own Into Q1 Results Amid AI and Macro Fears: MS,https://www.investing.com/news/stock-market-news/2-top-saas-stocks-to-own-into-q1-results-amid-ai-and-macro-fears-ms-93CH-4645434,
Investing,Blackstone creates AI-focused division on West Coast,https://www.investing.com/news/stock-market-news/blackstone-creates-aifocused-division-on-west-coast-93CH-4645444,
Investing,Penske Automotive stock surges 7% on earnings beat,https://www.investing.com/news/stock-market-news/penske-automotive-stock-surges-7-on-earnings-beat-93CH-4645442,
Investing,Avalyn Pharma files for 16.67M share IPO at $16-$18/sh,https://www.investing.com/news/stock-market-news/avalyn-pharma-files-for-1667m-share-ipo-at-1618sh-432SI-4645433,
Investing,US single-family housing starts jump to 13-month high in March,https://www.investing.com/news/economic-indicators/us-singlefamily-housing-starts-jump-to-13month-high-in-march-4645443,
