feed,title,long_url,short_url
Yahoo,"Walmart Q4 revenue soars, boosted by strength in web sales during COVID-19; stock drops",https://finance.yahoo.com/news/walmart-q-4-earnings-results-and-wage-increases-121139661.html,https://yhoo.it/2Zst8Fk
Yahoo,"Retirement Balances Hit Records, So Do Ranks Of Fidelity 401(k) And IRA Millionaires",https://www.investors.com/etfs-and-funds/retirement/retirement-savings-balances-hit-record-number-fidelity-investments-401k-ira-millionaires-set-records/?src=A00220&yptr=yahoo,https://j.mp/2LZPryW
Yahoo,"Ether Looks Overleveraged as Cryptocurrency Hits New High Over $1,900",https://finance.yahoo.com/news/ether-looks-overleveraged-cryptocurrency-hits-103429203.html,https://yhoo.it/2NgfTFf
Yahoo,Which Electric Vehicle Stocks Are Worth the Money?,https://finance.yahoo.com/m/340692ea-6783-3e84-bc67-a6a7a81bf344/which-electric-vehicle-stocks.html?.tsrc=rss,https://yhoo.it/3auBdQ4
Yahoo,Here's My Top Robinhood Stock to Buy Right Now,https://finance.yahoo.com/m/6d9bddbd-3773-378a-9839-f37b69499443/here%27s-my-top-robinhood-stock.html?.tsrc=rss,https://yhoo.it/3pwbM51
Yahoo,Forget Bitcoin: Buy These Dominant Tech Stocks Instead,https://finance.yahoo.com/m/5c9d26a5-21d6-300b-8f47-ea944d7718ed/forget-bitcoin%3A-buy-these.html?.tsrc=rss,https://yhoo.it/3dqfBq6
