feed,title,long_url,short_url
InvestorPlace,"BOX Stock Earnings: Box Beats EPS, Beats Revenue for Q1 2025",https://investorplace.com/earning-results/2024/05/box-stock-earnings-box-for-q1-of-2025/,https://da.gd/SMjoby
InvestorPlace,"APPS Stock Earnings: Digital Turbine Beats EPS, Misses Revenue for Q4 2024",https://investorplace.com/earning-results/2024/05/apps-stock-earnings-digital-turbine-for-q4-of-2024/,https://da.gd/zDZm0f
InvestorPlace,"CAVA Stock Earnings: Cava Group Beats EPS, Beats Revenue for Q1 2024",https://investorplace.com/earning-results/2024/05/cava-stock-earnings-cava-group-for-q1-of-2024/,https://da.gd/QmgR
InvestorPlace,"OOMA Stock Earnings: Ooma Beats EPS, Beats Revenue for Q1 2025",https://investorplace.com/earning-results/2024/05/ooma-stock-earnings-ooma-for-q1-of-2025/,https://da.gd/6UJRJ
InvestorPlace,"HEI Stock Earnings: Heico Beats EPS, Beats Revenue for Q2 2024",https://investorplace.com/earning-results/2024/05/hei-stock-earnings-heico-for-q2-of-2024/,https://da.gd/VqdW0
InvestorPlace,"CLLS Stock Earnings: Cellectis Beats EPS, Beats Revenue for Q1 2024",https://investorplace.com/earning-results/2024/05/clls-stock-earnings-cellectis-for-q1-of-2024/,https://da.gd/up03VE
