feed,title,long_url,short_url
Benzinga,Apria Announces Launch of Initial Public Offering,https://www.benzinga.com/pressreleases/21/02/g19461500/apria-announces-launch-of-initial-public-offering,https://j.mp/3tnIgSg
Benzinga,Italy Cards and Payments Market Opportunities and Risks to 2024,https://www.benzinga.com/pressreleases/21/02/g19461518/italy-cards-and-payments-market-opportunities-and-risks-to-2024,https://j.mp/3pNZypa
Benzinga,"Global Biosimilar Hormones Market Report 2020: COVID-19 impacts, Growth and Changes - Forecast to 2030 - ResearchAndMarkets.com",https://www.benzinga.com/pressreleases/21/02/b19461516/global-biosimilar-hormones-market-report-2020-covid-19-impacts-growth-and-changes-forecast-to-2030,https://j.mp/39K8fvf
Benzinga,Veoneer: Financial Report October - December 2020,https://www.benzinga.com/pressreleases/21/02/n19461515/veoneer-financial-report-october-december-2020,https://j.mp/2MSC3wx
Benzinga,"Global Liposomal Drug Delivery Devices Market 2020: Major Players are Fudan-Zhangjiang, Pacira, Johnson and Johnson, Gilead Sciences, Novartis, Luye Pharma, CSPC, Ipsen and Teva Pharma - ResearchAndMarkets.com",https://www.benzinga.com/pressreleases/21/02/b19461506/global-liposomal-drug-delivery-devices-market-2020-major-players-are-fudan-zhangjiang-pacira-johns,https://j.mp/3at53mR
Benzinga,Adhesives Global Market Report 2021: COVID 19 Impact and Recovery to 2030,https://www.benzinga.com/pressreleases/21/02/g19461499/adhesives-global-market-report-2021-covid-19-impact-and-recovery-to-2030,https://j.mp/2YEMgPV
Benzinga,Worldwide Rugged Tablet Industry to 2025 - Impact Analysis of COVID-19,https://www.benzinga.com/pressreleases/21/02/g19461481/worldwide-rugged-tablet-industry-to-2025-impact-analysis-of-covid-19,https://j.mp/3oIEq2t
