feed,title,long_url,short_url
SeekingAlpha,Costco smashes January sales estimates,https://seekingalpha.com/news/3658068,
SeekingAlpha,Infrastructure and Energy Alternatives launches secondary offering,https://seekingalpha.com/news/3658065,
SeekingAlpha,Kaleido Biosciences announces $50M proposed public offering,https://seekingalpha.com/news/3658063,
SeekingAlpha,IAC/InterActive EPS of $5.59,https://seekingalpha.com/news/3658062,
SeekingAlpha,"Merck baldness drug Propecia linked to reports of suicide and suicidal behavior, Reuters reports",https://seekingalpha.com/news/3658038,
SeekingAlpha,"Trinseo EPS beats by $0.01, beats on revenue",https://seekingalpha.com/news/3658061,
SeekingAlpha,"American Superconductor EPS in-line, misses on revenue",https://seekingalpha.com/news/3658060,
