feed,title,long_url,short_url
Investing,Cointelegraph’s Accelerator Program launches and is seeking Web3 startups,https://www.investing.com/news/cryptocurrency-news/cointelegraphs-accelerator-program-launches-and-is-seeking-web3-startups-2977028,https://da.gd/WCAwXC
Investing,ETH May Drop in the Coming 24 Hours After Altcoin Prices Surge,https://www.investing.com/news/cryptocurrency-news/eth-may-drop-in-the-coming-24-hours-after-altcoin-prices-surge-2977024,https://da.gd/YLeU5
Investing,"Bumper green aluminium output is good news for carmakers, and climate",https://www.investing.com/news/world-news/bumper-green-aluminium-output-is-good-news-for-carmakers-and-climate-2977026,https://da.gd/Emct
Investing,European Natural Gas Prices Fall as Mild Winter Crimps Demand,https://www.investing.com/news/commodities-news/european-natural-gas-prices-fall-as-mild-winter-crimps-demand-2976848,https://da.gd/sJSqUR
Investing,Alibaba signs cooperation agreement with authorities in China's Hangzhou -media,https://www.investing.com/news/stock-market-news/alibaba-signs-cooperation-agreement-with-authorities-in-chinas-hangzhou-media-2977025,https://da.gd/vELd
Investing,Euronav tumbles after Frontline abandons tanker merger deal,https://www.investing.com/news/stock-market-news/euronav-tumbles-after-frontline-abandons-tanker-merger-deal-2977019,https://da.gd/UfbA
Investing,"U.S.'s Yellen chairs meeting with UK, Australia, Canada, New Zealand ministers",https://www.investing.com/news/economy/uss-yellen-chairs-meeting-with-uk-australia-canada-new-zealand-ministers-2977029,https://da.gd/JlsPki
Investing,Goldman No Longer Sees Euro-Area Recession as It Lifts Outlook,https://www.investing.com/news/economy/goldman-no-longer-sees-euroarea-recession-as-it-lifts-outlook-2976892,https://da.gd/bYijd
Investing,India's inflation likely remained steady at 5.90% in December: Reuters poll,https://www.investing.com/news/economy/indias-inflation-likely-remained-steady-at-590-in-december-,https://da.gd/Wl2Hx
