feed,title,long_url,short_url
Investing,AI makes the metaverse safer and more inclusive: The Sandbox co-founder,https://www.investing.com/news/cryptocurrency-news/ai-makes-the-metaverse-safer-and-more-inclusive-the-sandbox-cofounder-3045317,https://da.gd/XCuc3I
Investing,SEC Chair Gensler Insists Crypto “Regulations Already Exist” Ahead of Hearing,https://www.investing.com/news/cryptocurrency-news/sec-chair-gensler-insists-crypto-regulations-already-exist-ahead-of-hearing-3045302,https://da.gd/DtVNU
Investing,"Yuga Labs BAYC Swamp Enriched with 30,000 HV-MTL Mecha NFTs",https://www.investing.com/news/cryptocurrency-news/yuga-labs-bayc-swamp-enriched-with-30000-hvmtl-mecha-nfts-3045301,https://da.gd/gyLQ2
Investing,Yuzo Kano Returns to BitFlyer as the Chief Executive Officer,https://www.investing.com/news/cryptocurrency-news/yuzo-kano-returns-to-bitflyer-as-the-chief-executive-officer-3045300,https://da.gd/lCA4kj
Investing,"Texas judge blocks Obamacare coverage mandate for PrEP, cancer screening",https://www.investing.com/news/stock-market-news/texas-judge-blocks-obamacare-coverage-mandate-for-prep-cancer-screening-3045325,https://da.gd/1qbqPa
Investing,Bed Bath & Beyond announces $300 million stock offering,https://www.investing.com/news/stock-market-news/bed-bath--beyond-announces-300-million-stock-offering-3045318,https://da.gd/UCdnB4
Investing,Manchester United returns to profit but Champions League absence hurts,https://www.investing.com/news/stock-market-news/manchester-united-returns-to-profit-but-champions-league-absence-hurts-3045294,https://da.gd/tPGsHN
Investing,Spain's parliament approves revenue-focused pensions overhaul,https://www.investing.com/news/economy/spains-parliament-approves-revenuefocused-pensions-overhaul-3045307,https://da.gd/kLTh5
