feed,title,long_url,short_url
SeekingAlpha,Why did Charles Schwab stock go down today? Analyst downgrade,https://seekingalpha.com/news/3952870,
SeekingAlpha,"Sachem Capital GAAP EPS of $0.46 beats by $0.01, revenue of $52.28M beats by $2.58M",https://seekingalpha.com/news/3952869,
SeekingAlpha,Lisata Therapeutics GAAP EPS of -$0.76 beats by $0.26,https://seekingalpha.com/news/3952868,
SeekingAlpha,"Kingstone GAAP EPS of -$0.37 misses by $0.35, revenue of $37.09M beats by $6.59M",https://seekingalpha.com/news/3952867,
SeekingAlpha,Eyenovia GAAP EPS of -$0.17 beats by $0.03,https://seekingalpha.com/news/3952866,
