feed,title,long_url,short_url
SeekingAlpha,"RadNet's Aidence, Google Health enter collaboration for lung cancer screening",https://seekingalpha.com/news/3911513,
SeekingAlpha,Anheuser-Busch InBev rallies after JPMorgan flips from bear to bull,https://seekingalpha.com/news/3911512,
SeekingAlpha,Wolfden announces C$2.7M financing,https://seekingalpha.com/news/3911511,
SeekingAlpha,World Health Organization renames monkeypox as mpox,https://seekingalpha.com/news/3911510,
SeekingAlpha,AFK: Struggling To Find Stability,https://seekingalpha.com/article/4560793,
