feed,title,long_url,short_url
Investing,Stock Market Outlook: Can Thursday Undo Wednesday’s Damage?,https://www.investing.com/analysis/stock-market-outlook-can-thursday-undo-wednesdays-damage-200682406,
Investing,"FOMC Meeting in Summary: Steady Rates, Hawkish Tilt, and a Communication Overhaul",https://www.investing.com/analysis/fomc-meeting-in-summary-steady-rates-hawkish-tilt-and-a-communication-overhaul-200682405,
Investing,What pet owners need to know about New World screwworm,https://www.investing.com/news/commodities-news/what-pet-owners-need-to-know-about-new-world-screwworm-4749972,
Investing,"Top Networking Stocks for the $1 Trillion AI Infrastructure Buildout, Per Barclays",https://www.investing.com/news/stock-market-news/top-networking-stocks-for-the-1-trillion-ai-infrastructure-buildout-per-barclays-93CH-4750031,
Investing,Why is Tesco stock sliding today?,https://www.investing.com/news/stock-market-news/why-is-tesco-stock-sliding-today-93CH-4750035,
Investing,Enanta Pharmaceuticals stock rises on RSV drug trial plans,https://www.investing.com/news/stock-market-news/enanta-pharmaceuticals-stock-rises-on-rsv-drug-trial-plans-93CH-4750032,
Investing,"Architect Labs raises $24 million to take on Broadcom, Marvell custom chip business",https://www.investing.com/news/stock-market-news/architect-labs-raises-24-million-to-take-on-broadcom-marvell-custom-chip-business-4750029,
Investing,Factbox-Airlines resume some Middle East flights but disruption continues,https://www.investing.com/news/stock-market-news/factboxairlines-resume-some-middle-east-flights-but-disruption-continues-4750023,
Investing,Quantumscape shares jump on Honda battery deal,https://www.investing.com/news/stock-market-news/quantumscape-shares-jump-on-honda-battery-deal-93CH-4750019,
Investing,IREN stock jumps 5% as Jefferies initiates with buy rating,https://www.investing.com/news/stock-market-news/iren-stock-jumps-5-as-jefferies-initiates-with-buy-rating-93CH-4750004,
Investing,"Wednesday’s insider buys and sells: Star Equity, Airbnb featured",https://www.investing.com/news/stock-market-news/wednesdays-insider-buys-and-sells-star-equity-airbnb-featured-93CH-4750000,
Investing,J.P. Morgan Names Top UK Leisure Picks as Political Uncertainty Tests Consumer Spending,https://www.investing.com/news/stock-market-news/jp-morgan-names-top-uk-leisure-picks-as-political-uncertainty-tests-consumer-spending-93CH-4749970,
Investing,Canada industrial product prices beat estimates on shipping disruptions,https://www.investing.com/news/economy-news/canada-industrial-product-prices-beat-estimates-on-shipping-disruptions-93CH-4750033,
