feed,title,long_url,short_url
ETFTrends,Tackle Long-Term Travel Goals With Bond Ladders,https://www.etftrends.com/ntam-content-hub/tackle-long-term-travel-goals-bond-ladders/,
ETFTrends,Navigating 2026’s Geopolitical Shift With Gold Miners,https://www.etftrends.com/gold-silver-investing-content-hub/navigating-2026s-geopolitical-shift-gold-miners/,
ETFTrends,Ballast a Portfolio With This Investment-Grade Bond ETF,https://www.etftrends.com/etf-investing-content-hub/ballast-portfolio-investment-grade-bond-etf/,
ETFTrends,MFS Launches Active Blended Research Emerging Markets ETF,https://www.etftrends.com/mfs-launches-active-blended-research-emerging-markets-etf/,
ETFTrends,ETF of the Week: State Street SPDR SSGA US Lg Cap Low Vol Index ETF (LGLV),https://www.etftrends.com/etf-strategist-content-hub/etf-of-the-week-state-street-spdr-ssga-us-lg-cap-low-vol-index-etf-lglv/,
