feed,title,long_url,short_url
SeekingAlpha,"Aehr Test Systems Non-GAAP EPS of $0.84 beats by $0.74, revenue of $16.6M beats by $1.15M",https://seekingalpha.com/news/4124768,
SeekingAlpha,Broken Vineyard Wind turbine blade washes up on Nantucket beach,https://seekingalpha.com/news/4124766,
SeekingAlpha,"J.B. Hunt Transport Services GAAP EPS of $1.32 misses by $0.19, revenue of $2.93B misses by $100M",https://seekingalpha.com/news/4124764,
SeekingAlpha,"Hancock Whitney GAAP EPS of $1.31 beats by $0.11, revenue of $359.6M beats by $0.48M",https://seekingalpha.com/news/4124767,
SeekingAlpha,Cleveland-Cliffs Is Opportunistic In Acquiring Stelco During Cyclical Downturn,https://seekingalpha.com/article/4704426,
