feed,title,long_url,short_url
Yahoo,Qualcomm evaluates acquisition of UK chip designer Alphawave,https://finance.yahoo.com/news/qualcomm-offers-acquire-chip-designer-111209538.html,https://da.gd/tbg6F
Yahoo,3 Harsh Social Security Truths That Could Derail Your Retirement Security,https://finance.yahoo.com/news/3-harsh-social-security-truths-111100131.html,https://da.gd/VsGHV
Yahoo,"2 Brand-New Reasons to Buy and Hold XRP and Solana With $2,500",https://finance.yahoo.com/news/2-brand-reasons-buy-hold-111500059.html,https://da.gd/PLkmLf
Yahoo,"Crypto Daybook Americas: Bitcoin Slides to $83K as U.S. Tariffs Rattle Stocks, Currencies",https://finance.yahoo.com/news/crypto-daybook-americas-bitcoin-slides-111500295.html,https://da.gd/FpGasB
Yahoo,"Regulation, openness, and a modern platform needed for legacy banks to embrace cryptos",https://finance.yahoo.com/news/regulation-openness-modern-platform-needed-112021320.html,https://da.gd/VM2x2
Yahoo,Apple leads decline in tech stocks after Trump announces sweeping new tariffs,https://finance.yahoo.com/news/apple-leads-decline-tech-stocks-112158467.html,https://da.gd/A0tH
Yahoo,Private equity wants the $12 trillion Americans have stashed in their 401(k) plans. A study says the upside temptation might not be worth the risk.,https://finance.yahoo.com/news/private-equity-wants-12-trillion-112400084.html,https://da.gd/WV2w
