feed,title,long_url,short_url
ETFdb:DailyRecap,Top Performing Leveraged/Inverse ETFs: 01/23/2022,https://etfdb.com/leveraged-inverse-channel/top-performing-leveraged-2022-01-23/,https://bit.ly/3tXMOBg
ETFdb:DailyRecap,Cathie Wood Will Deliver a Keynote at Exchange,https://etfdb.com/disruptive-technology-channel/cathie-wood-will-deliver-a-keynote-at-exchange/,https://bit.ly/3GXAmoS
ETFdb:DailyRecap,Merger Arbitrage is an Alternative Investment Strategy,https://etfdb.com/alternatives-channel/merger-arbitrage-is-an-alternative-strategy/,https://bit.ly/3IGSZ0V
ETFdb:DailyRecap,Cap-Weighting Critical When Indexing Biotech,https://etfdb.com/nasdaq-portfolio-solutions-channel/cap-weighting-critical-when-indexing-biotech/,https://bit.ly/3fUBQV0
ETFdb:DailyRecap,Biden Administration to Weigh In on Cryptocurrency,https://etfdb.com/crypto-channel/biden-administration-to-weigh-in-on-cryptocurrency/,https://bit.ly/3u0phjo
ETFdb:DailyRecap,EMQQ Fundamental Story Remains Compelling,https://etfdb.com/emerging-markets-channel/emqq-fundamental-story-remains-compelling/,https://bit.ly/3fTnGUh
ETFdb:DailyRecap,EM Local Currency Bonds Ready for Redemption,https://etfdb.com/tactical-allocation-channel/em-local-currency-bonds-ready-for-redemption/,https://bit.ly/3KISuoP
ETFdb:DailyRecap,"Thematic Strategies Are Down, Not Out",https://etfdb.com/etf-building-blocks-channel/thematic-strategies-are-down-not-out/,https://bit.ly/3IDscmc
ETFdb:DailyRecap,Invest in the Visa of the Digital Economy,https://etfdb.com/crypto-channel/invest-in-the-visa-of-the-digital-economy/,https://bit.ly/3fZ7IIi
ETFdb:DailyRecap,Junk Bond ETFs Stumble Early In 2022,https://etfdb.com/fixed-income-channel/junk-bonds-stumble-early-in-2022/,https://bit.ly/3H3bfB0
ETFdb:DailyRecap,Is It Time to Buy the Renewable Energy Dip?,https://etfdb.com/multi-asset-channel/is-it-time-to-buy-the-renewable-energy-dip/,https://bit.ly/3KKxPRp
ETFdb:DailyRecap,"In Current Climate, This Dividend Fund Looks Strong",https://etfdb.com/model-portfolio-channel/in-current-climate-this-dividend-fund-looks-strong/,https://bit.ly/3G0ejfS
ETFdb:DailyRecap,Add Additional Alternative Assets Amid Volatility,https://etfdb.com/innovative-etfs-channel/add-additional-alternative-assets-amid-volatility/,https://bit.ly/3IyNYaD
ETFdb:DailyRecap,Strategas Launches 2 Active Funds,https://etfdb.com/news/2022/01/25/strategas-launches-2-active-funds/,https://bit.ly/3rLYLri
ETFdb:DailyRecap,An Issuer’s Perspective on Active and Passive Launches,https://etfdb.com/active-etf-channel/an-issuers-perspective-on-active-and-passive-launches/,https://bit.ly/3fSl2hz
ETFdb:DailyRecap,Investing in the EV Ecosystem With KraneShares,https://etfdb.com/china-insights-channel/invsting-in-the-ev-ecosystem-with-kraneshares/,https://bit.ly/3G4NcQN
