feed,title,long_url,short_url
Investing,OPEC+ unlikely to change output policy at April 3 meeting,https://www.investing.com/news/commodities-news/opec-unlikely-to-change-output-policy-at-april-3-meeting-3361461,https://da.gd/3KH1
Investing,Roivant's anti-inflammatory drug succeeds in mid-stage study,https://www.investing.com/news/stock-market-news/roivants-antiinflammatory-drug-succeeds-in-midstage-study-3361475,https://da.gd/9AGV
Investing,"Renault's Ampere starts development of new electric Twingo, sources say",https://www.investing.com/news/stock-market-news/renaults-ampere-starts-development-of-new-electric-twingo-sources-say-3361460,https://da.gd/1mfwz
Investing,Tommy Hilfiger-owner PVH shares plummet after downbeat annual forecast,https://www.investing.com/news/stock-market-news/tommy-hilfigerowner-pvh-shares-plummet-after-downbeat-annual-forecast-3361473,https://da.gd/cHdd
Investing,Citi: Is a faster FinTech stock recovery possible?,https://www.investing.com/news/stock-market-news/citi-is-a-faster-fintech-stock-recovery-possible-432SI-3361459,https://da.gd/nMam
Investing,Safety testing company UL Solutions eyes up to $5.8 billion valuation in US IPO,https://www.investing.com/news/stock-market-news/safety-testing-company-ul-solutions-eyes-up-to-58-billion-valuation-in-us-ipo-3361439,https://da.gd/YKgltJ
Investing,UL Solutions Announces 28M Share IPO at $26-$29/sh,https://www.investing.com/news/stock-market-news/ul-solutions-announces-28m-share-ipo-at-2629sh-432SI-3361368,https://da.gd/HVv47U
Investing,Verve Therapeutics pauses enrollment in early-stage gene therapy study for high cholesterol levels,https://www.investing.com/news/economy/verve-therapeutics-pauses-enrollment-in-earlystage-gene-therapy-study-for-high-cholesterol-levels-3361484,https://da.gd/GgYub
