feed,title,long_url,short_url
Yahoo,23andMe Stock Jumps on News of Plans to Take It Private,https://www.wsj.com/livecoverage/stock-market-today-earnings-04-18-2024/card/23andme-stock-jumps-on-news-of-plans-to-take-it-private-2HWuQ5NIbyIm05awdq8c?siteid=yhoof2&yptr=yahoo,https://da.gd/KGHi
Yahoo,Jim Cramer’s New Picks: 10 Stocks to Buy,https://finance.yahoo.com/news/jim-cramer-picks-10-stocks-145544421.html?.tsrc=rss,https://da.gd/IPqVG
Yahoo,"Amazon Aims to Outdo Walmart's Retail Game, Boosts Cashierless Tech in Stores",https://finance.yahoo.com/news/amazon-aims-outdo-walmarts-retail-145322895.html?.tsrc=rss,https://da.gd/jDx3
Yahoo,Netflix stock has been on massive run — that makes for 'tricky' earnings set up,https://finance.yahoo.com/news/netflix-stock-has-been-on-massive-run--that-makes-for-tricky-earnings-set-up-143650237.html?.tsrc=rss,https://da.gd/7mQlb
Yahoo,Netflix Earnings: Here’s What to Expect,https://finance.yahoo.com/m/4ab4832f-b07f-36d3-8535-e0ceaf369301/netflix-earnings%3A-here%E2%80%99s-what.html?.tsrc=rss,https://da.gd/QhOQJ
