feed,title,long_url,short_url
InvestorPlace,Why Is NeuBase Therapeutics (NBSE) Stock Up 19% Today?,https://investorplace.com/2023/09/why-is-neubase-therapeutics-nbse-stock-up-19-today/,https://da.gd/nYG1Y
InvestorPlace,"3 EV Stocks to Invest in for Big-Time, Long-Term Gains",https://investorplace.com/2023/09/3-ev-stocks-to-invest-in-for-big-time-long-term-gains/,https://da.gd/TDPn6
InvestorPlace,LCID Stock Outlook: Why Lucid Is Cruising Down a Dead End Street,https://investorplace.com/market360/2023/09/lcid-stock-outlook-why-lucid-is-cruising-down-a-dead-end-street/,https://da.gd/kprhDB
InvestorPlace,Today’s Biggest Pre-Market Stock Movers: 10 Top Gainers and Losers on Wednesday,https://investorplace.com/2023/09/todays-biggest-pre-market-stock-movers-10-top-gainers-and-losers-on-wednesday-sept-6th/,https://da.gd/EWvK1
InvestorPlace,It’s Time to Bet on SOFI Stock BEFORE Its Upcoming Breakout,https://investorplace.com/2023/09/its-time-to-bet-on-sofi-stock-before-its-upcoming-breakout/,https://da.gd/5Iko
