feed,title,long_url,short_url
SeekingAlpha,"NeuroPace GAAP EPS of -$0.36 beats by $0.11, revenue of $16.5M beats by $3.87M",https://seekingalpha.com/news/3999460,
SeekingAlpha,"Atara Biotherapeutics GAAP EPS of -$0.68 misses by $0.01, revenue of $0.96M misses by $2.81M",https://seekingalpha.com/news/3999459,
SeekingAlpha,"Aeva Technologies Non-GAAP EPS of -$0.13 beats by $0.01, revenue of $0.74M misses by $0.01M",https://seekingalpha.com/news/3999457,
SeekingAlpha,"PubMatic Non-GAAP EPS of $0.02 beats by $0.03, revenue of $63.3M beats by $3.51M",https://seekingalpha.com/news/3999456,
SeekingAlpha,"PetIQ Non-GAAP EPS of $0.46 beats by $0.20, revenue of $314.5M beats by $40.73M",https://seekingalpha.com/news/3999455,
SeekingAlpha,Tenon Medical GAAP EPS of $0.33,https://seekingalpha.com/news/3999454,
SeekingAlpha,"Super Micro Computer Non-GAAP EPS of $3.51 beats by $0.60, revenue of $2.18B beats by $200M",https://seekingalpha.com/news/3999453,
