feed,title,long_url,short_url
SeekingAlpha,Cutera misses Q2 top and bottom line estimates; updates FY23 outlook,https://seekingalpha.com/news/3999636,
SeekingAlpha,"Viridian Therapeutics GAAP EPS of -$1.27 in-line, revenue of $0.07M misses by $0.13M",https://seekingalpha.com/news/3999634,
SeekingAlpha,"LiveVox GAAP EPS of -$0.05 beats by $0.01, revenue of $35.4M beats by $0.72M",https://seekingalpha.com/news/3999633,
SeekingAlpha,Sun Life Financial reports Q2 results,https://seekingalpha.com/news/3999632,
SeekingAlpha,"Caribou Bioscience GAAP EPS of -$0.48 beats by $0.01, revenue of $3.76M beats by $0.69M",https://seekingalpha.com/news/3999631,
SeekingAlpha,"Full House Resorts GAAP EPS of -$0.16 misses by $0.19, revenue of $59.4M misses by $2.81M",https://seekingalpha.com/news/3999630,
