feed,title,long_url,short_url
Investing,S&P 500 Faces Technical Inflection as Fed Speech Looms,https://www.investing.com/analysis/sp-500-forecast-spx-rises-ahead-of-powells-jackson-hole-speech-200665752,
Investing,Competitive pressures are rising for this Chinese EV manufacturer says Macquarie,https://www.investing.com/news/stock-market-news/competitive-pressures-are-rising-for-this-chinese-ev-manufacturer-says-macquarie-4206977,
Investing,Wolfe upgrades Roblox as it sees catalysts from ads and regional pricing,https://www.investing.com/news/stock-market-news/wolfe-upgrades-roblox-as-it-sees-catalysts-from-ads-and-regional-pricing-4206961,
Investing,Boston Fed's Collins sees balanced risks ahead of Powell speech,https://www.investing.com/news/stock-market-news/boston-feds-collins-sees-balanced-risks-ahead-of-powell-speech-93CH-4206946,
Investing,Global equity fund inflows cool on caution over tech sector selloff,https://www.investing.com/news/economy-news/global-equity-fund-inflows-cool-on-caution-over-tech-sector-selloff-4206981,
Investing,Analysis-Norway's giant fund in election crosshairs over Israel investments,https://www.investing.com/news/economy-news/analysisnorways-giant-fund-in-election-crosshairs-over-israel-investments-4206979,
Investing,Iran nuclear talks with European powers set for next week,https://www.investing.com/news/economy-news/iran-nuclear-talks-with-european-powers-set-for-next-week-93CH-4206971,
