feed,title,long_url,short_url
Investing,Rumors of Emergency BoJ Meeting Send U.S. Dollar Lower Against Yen,https://www.investing.com/analysis/rumors-of-emergency-boj-meeting-send-us-dollar-lower-against-yen-200634411,https://da.gd/aBP8y
Investing,"Commodities Week Ahead: Chinese, U.S. Data to Spin Different Tales for Oil",https://www.investing.com/analysis/commodities-week-ahead-chinese-us-data-to-spin-different-tales-for-oil-200634422,https://da.gd/lTVHzY
Investing,"Gold Holds Above $1,900. But for How Long?",https://www.investing.com/analysis/gold-holds-above-1900-but-for-how-long-200634398,https://da.gd/eojW3R
Investing,TUI boss: we are open to a big shareholder,https://www.investing.com/news/stock-market-news/tui-boss-we-are-open-to-a-big-shareholder-2981434,https://da.gd/b8dLX
Investing,German economy expected to contract slightly in 2023 - BDI,https://www.investing.com/news/economic-indicators/german-economy-expected-to-contract-slightly-in-2023--bdi-2981426,https://da.gd/T13o
