feed,title,long_url,short_url
Yahoo,Roblox stock pops after upbeat bookings update,https://www.marketwatch.com/story/roblox-stock-pops-after-upbeat-bookings-update-01673964748?siteid=yhoof2&yptr=yahoo,https://da.gd/iJNZ
Yahoo,"Musk, Twitter's Owner, Says a User Blocked Him on the Platform",https://finance.yahoo.com/m/163d8ff8-e589-32f8-879a-61f14c598ce2/musk%2C-twitter%27s-owner%2C-says-a.html?.tsrc=rss,https://da.gd/Xsgh
Yahoo,Musk’s 2018 tweets about taking Tesla private have their day(s) in court,https://finance.yahoo.com/news/musk-2018-tweets-taking-tesla-134430706.html?.tsrc=rss,https://da.gd/T9gQA
Yahoo,Apple unveils host of Macs including new MacBook Pro with faster M2 chips,https://www.independent.co.uk/tech/apple-unveils-host-of-new-macs-with-b2263718.html?.tsrc=rss,https://da.gd/B1Lt1
Yahoo,"Apple launches new macbooks, Mac mini in rare January launch",https://finance.yahoo.com/news/apple-launches-macbooks-mac-mini-141835395.html?.tsrc=rss,https://da.gd/SX62Fy
