feed,title,long_url,short_url
Investing,Russian oil price in roubles falls 11% in May amid currency gains,https://www.investing.com/news/commodities-news/russian-oil-price-in-roubles-falls-11-in-may-amid-currency-gains-93CH-4709875,
Investing,"U.S. Home Prices Show Slight Decline in Growth, Falling Short of Forecast",https://www.investing.com/news/economic-indicators/us-home-prices-show-slight-decline-in-growth-falling-short-of-forecast-93CH-4709885,
Investing,Singapore Q1 GDP growth revised up to 6%; 2026 outlook maintained,https://www.investing.com/news/economic-indicators/singapore-q1-gdp-growth-revised-up-to-60-2026-outlook-maintain,
Investing,"US, Armenia sign strategic partnership agreement",https://www.investing.com/news/economy-news/us-armenia-sign-strategic-partnership-agreement-93CH-4709964,
Investing,"Energy shock persistence to decide ECB’s next move, Sleijpen says",https://www.investing.com/news/economy-news/energy-shock-persistence-to-decide-ecbs-next-move-sleijpen-says-4709941,
