feed,title,long_url,short_url
Investing,Bitcoin (BTC) Gas Skyrocketing as Trader Spends $3.14 Million in Fees,https://www.investing.com/news/cryptocurrency-news/bitcoin-btc-gas-skyrocketing-as-trader-spends-314-million-in-fees-3242110,https://da.gd/Ho107
Investing,Econergy secures €60 million for Romania's largest solar project,https://www.investing.com/news/stock-market-news/econergy-secures-60-million-for-romanias-largest-solar-project-93CH-3242107,https://da.gd/60PS
Investing,"State Bank of India announces recruitment for 5,280 CBO positions",https://www.investing.com/news/stock-market-news/state-bank-of-india-announces-recruitment-for-5280-cbo-positions-93CH-3242106,https://da.gd/N0bT
Investing,Saudi Arabia stocks lower at close of trade; Tadawul All Share down 0.20%,https://www.investing.com/news/stock-market-news/saudi-arabia-stocks-lower-at-close-of-trade-tadawul-all-share-down-020-3242094,https://da.gd/Yahgh
Investing,Russia's sanctioned Sovcombank requests US licence to make UN climate payments,https://www.investing.com/news/economy/russias-sanctioned-sovcombank-requests-us-licence-to-make-un-climate-payments-3242105,https://da.gd/M1YjI
