feed,title,long_url,short_url
Investing,Market Outlook: Dollar at a Key Zone as Gold and Bitcoin React to US CPI Data,https://www.investing.com/analysis/market-outlook-dollar-at-a-key-zone-as-gold-and-bitcoin-react-to-us-cpi-data-200674670,
Investing,Dow vs. Gold: Dow Stays Calm While Gold Sends Warning Signals,https://www.investing.com/analysis/dow-vs-gold-dow-stays-calm-while-gold-sends-warning-signals-200674668,
Investing,"Gold Climbs Back Above $5,000—Can it Hold?",https://www.investing.com/analysis/gold-climbs-back-above-5000can-it-hold-200674669,
Investing,Gold: Technical Indecision Builds After Sharp Pullback From Peaks,https://www.investing.com/analysis/gold-technical-indecision-builds-after-sharp-pullback-from-peaks-200674625,
Investing,Montage Technology soars 64% in Hong Kong debut after $900 million IPO,https://www.investing.com/news/stock-market-news/montage-technology-soars-64-in-hong-kong-debut-after-900-million-ipo-93CH-4492937,
Investing,"Warpaint London shares rise after Barry M acquisition, despite challenging FY25",https://www.investing.com/news/stock-market-news/warpaint-london-shares-rise-after-barry-m-acquisition-despite-challenging-fy25-4492934,
Investing,Lloyds Enterprises shares drop as company swings to quarterly loss,https://www.investing.com/news/stock-market-news/lloyds-enterprises-shares-drop-as-company-swings-to-quarterly-loss-93CH-4492894,
Investing,"UBS banked Ghislaine Maxwell for years, moving her money after Epstein’s arrest",https://www.investing.com/news/stock-market-news/ubs-banked-ghislaine-maxwell-for-years-moving-her-money-after-epsteins-arrest-4492890,
Investing,Slovenia’s inflation rate eases to 2.6% in January,https://www.investing.com/news/economic-indicators/slovenias-inflation-rate-eases-to-26-in-january-93CH-4492936,
Investing,Euro zone investor morale rises sharply in February,https://www.investing.com/news/economic-indicators/euro-zone-investor-morale-rises-sharply-in-february-4492889,
Investing,"Barclays says AI impact will shape rates, jobs and debt sustainability",https://www.investing.com/news/economy-news/barclays-says-ai-impact-will-shape-rates-jobs-and-debt-sustainability-4492888,
