feed,title,long_url,short_url
SeekingAlpha,Tamarack Valley Energy beats on revenue,https://seekingalpha.com/news/3667603,
SeekingAlpha,INVO Bioscience gets regulatory approval to import Invocell into Mexico,https://seekingalpha.com/news/3667601,
SeekingAlpha,MingZhu Logistics +12% as it announces major cooperation agreement,https://seekingalpha.com/news/3667598,
SeekingAlpha,Intellipharmaceutics International reports FY results,https://seekingalpha.com/news/3667600,
SeekingAlpha,Voyager Digital reports FQ2 results,https://seekingalpha.com/news/3667599,
SeekingAlpha,Krystal Biotech reports Q4 results,https://seekingalpha.com/news/3667597,
SeekingAlpha,"CoreLogic EPS beats by $0.22, beats on revenue",https://seekingalpha.com/news/3667596,
