feed,title,long_url,short_url
Nasdaq,"NBA-Lakers not close to hitting panic button, says Davis",https://www.nasdaq.com/articles/nba-lakers-not-close-to-hitting-panic-button-says-davis-2021-03-01,https://j.mp/3q0enV2
Nasdaq,"US STOCKS-S&P 500 set for best day in nine months on vaccine, stimulus cheer",https://www.nasdaq.com/articles/us-stocks-sp-500-set-for-best-day-in-nine-months-on-vaccine-stimulus-cheer-2021-03-01,https://j.mp/2NJAcLE
Nasdaq,S&P 500 Analyst Moves: PYPL,https://www.nasdaq.com/articles/sp-500-analyst-moves%3A-pypl-2021-03-01,https://j.mp/3sDqIjQ
Nasdaq,Dow Analyst Moves: BA,https://www.nasdaq.com/articles/dow-analyst-moves%3A-ba-2021-03-01,https://j.mp/2O6Upe1
Nasdaq,"As pandemic eases elsewhere, some Caribbean states face worst outbreaks yet",https://www.nasdaq.com/articles/as-pandemic-eases-elsewhere-some-caribbean-states-face-worst-outbreaks-yet-2021-03-01,https://j.mp/3dX85TD
Nasdaq,UK to offer world's first retail sovereign green bonds,https://www.nasdaq.com/articles/uk-to-offer-worlds-first-retail-sovereign-green-bonds-2021-03-01,https://j.mp/2O9DEik
Nasdaq,fuboTV Stock Has a Lot to Prove This Week,https://www.nasdaq.com/articles/fubotv-stock-has-a-lot-to-prove-this-week-2021-03-01,https://j.mp/3b6eESk
Nasdaq,Five injured in Baghdad protest ahead of Pope visit to Iraq,https://www.nasdaq.com/articles/five-injured-in-baghdad-protest-ahead-of-pope-visit-to-iraq-2021-03-01,https://j.mp/3q3ycL1
Nasdaq,Rugby-Referee Gauzere admits to making mistakes in England's loss to Wales - Jutge,https://www.nasdaq.com/articles/rugby-referee-gauzere-admits-to-making-mistakes-in-englands-loss-to-wales-jutge-2021-03-01,https://j.mp/3bLmv6K
Nasdaq,GLOBAL MARKETS-Wall Street rises on U.S. stimulus and vaccine hopes as bond markets calm,https://www.nasdaq.com/articles/global-markets-wall-street-rises-on-u.s.-stimulus-and-vaccine-hopes-as-bond-markets-calm,https://j.mp/2PeK9AS
