feed,title,long_url,short_url
SeekingAlpha,Ingersoll Rand acquires Air Dimensions for $70.5M,https://seekingalpha.com/news/3759922,
SeekingAlpha,"CB Financial Services EPS misses by $0.08, misses on revenue",https://seekingalpha.com/news/3759921,
SeekingAlpha,Comscore partners with Vistar Media for DOOH audience targeting,https://seekingalpha.com/news/3759920,
SeekingAlpha,"Ultra Clean Holdings pops following earnings report, solid guidance",https://seekingalpha.com/news/3759919,
SeekingAlpha,Altria decides to keep large stake in Anheuser-Busch InBev,https://seekingalpha.com/news/3759918,
SeekingAlpha,"Repsol, S.A. reports Q3 results",https://seekingalpha.com/news/3759916,
