feed,title,long_url,short_url
SeekingAlpha,ResMed posts FQ1 earnings beat on sleep and respiratory care products strength,https://seekingalpha.com/news/3760553,
SeekingAlpha,"Hilltop EPS beats by $0.33, beats on revenue",https://seekingalpha.com/news/3760552,
SeekingAlpha,Eutelsat Communications reports Q1 results,https://seekingalpha.com/news/3760551,
SeekingAlpha,"U.S. Century Bank EPS beats by $0.14, beats on revenue",https://seekingalpha.com/news/3760550,
SeekingAlpha,Richards Packaging Income Fund reports Q3 results,https://seekingalpha.com/news/3760549,
