feed,title,long_url,short_url
Nasdaq,Apple Inc spending from 'green bonds' hits $2.8 billion,https://www.nasdaq.com/articles/apple-inc-spending-from-green-bonds-hits-%242.8-billion-2021-03-17,https://j.mp/2P2jPtS
Nasdaq,"Illuminate Financial secures JPMorgan, Barclays backing for new fund",https://www.nasdaq.com/articles/illuminate-financial-secures-jpmorgan-barclays-backing-for-new-fund-2021-03-17,https://j.mp/3eOXjzA
Nasdaq,FOCUS-Power Play: Volkswagen abruptly pulls plug on South Korean battery makers,https://www.nasdaq.com/articles/focus-power-play%3A-volkswagen-abruptly-pulls-plug-on-south-korean-battery-makers-2021-03-17,https://j.mp/3cysaxe
Nasdaq,Raiffeisen to distribute up to half its profits in medium term,https://www.nasdaq.com/articles/raiffeisen-to-distribute-up-to-half-its-profits-in-medium-term-2021-03-17,https://j.mp/3ln2tUo
Nasdaq,Italy's Generali studying 2 bln euro acquisition in Russia-paper,https://www.nasdaq.com/articles/italys-generali-studying-2-bln-euro-acquisition-in-russia-paper-2021-03-17,https://j.mp/3f0KIJJ
