feed,title,long_url,short_url
Investing,"Citi cautiously positive on Asia stocks, sees 10% upside in 2025",https://www.investing.com/news/stock-market-news/citi-cautiously-positive-on-asia-stocks-sees-10-upside-in-2025-3838501,https://da.gd/pBa0b
Investing,"US stock futures steady after Fed's rate decision; Apple, Visa earnings loom",https://www.investing.com/news/stock-market-news/us-stock-futures-steady-after-feds-rate-decision-apple-visa-earnings-loom-3838488,https://da.gd/M5T5JL
Investing,"Tesla shares rise past disappointing Q4 as Musk talks up FSD, affordable models",https://www.investing.com/news/stock-market-news/tesla-shares-rise-past-disappointing-q4-as-musk-talks-up-fsd-affordable-models-3838485,https://da.gd/Knt9G
Investing,"Fed rate actions in 2025 seen in a narrow band, Goldman Sachs CEO says",https://www.investing.com/news/economy-news/fed-rate-actions-in-2025-seen-in-a-narrow-band-goldman-sachs-ceo-says-3838499,https://da.gd/K4vWj
Investing,Dollar set to pounce on euro if ECB offers dovish guidance,https://www.investing.com/news/economy-news/dollar-set-to-pounce-on-euro-if-ecb-offers-dovish-guidance-3838494,https://da.gd/nqrZ
