feed,title,long_url,short_url
Yahoo,Tesla stock rises after company pledges return to growth after Q4 results disappoint,https://finance.yahoo.com/news/tesla-stock-rises-after-company-pledges-return-to-growth-after-q4-results-disappoint-230732196.html,https://da.gd/ijo9
Yahoo,Vale posts highest annual iron ore output since 2018 despite fourth-quarter slide,https://finance.yahoo.com/news/iron-ore-output-brazils-vale-212036267.html,https://da.gd/nbxl
Yahoo,Australia's Whitehaven Coal rises on strong second quarter output,https://finance.yahoo.com/news/australias-whitehaven-coal-second-quarter-220946923.html,https://da.gd/MuVOA1
Yahoo,Analysis-HSBC's global brand in the balance as it doubles down on Asia bet,https://finance.yahoo.com/news/analysis-hsbcs-global-brand-balance-000456505.html,https://da.gd/lby9vk
Yahoo,Star Entertainment to divest Star Sydney Event Centre assets as it hunts for cash,https://finance.yahoo.com/news/star-entertainment-divest-star-sydney-215400159.html,https://da.gd/xp7L7
Yahoo,Nvidia faces a reckoning as Chinese upstart raises questions about Wall Street's darling,https://finance.yahoo.com/news/nvidia-faces-reckoning-upstart-rival-213941123.html,https://da.gd/2ZCFPC
Yahoo,1 Super Semiconductor ETF to Buy in the Wake of the DeepSeek Sell-Off,https://www.fool.com/investing/2025/01/30/1-semiconductor-etf-to-buy-wake-deepseek-sell-off/?source=eptyholnk0000202&utm_source=yahoo-host-full&utm_medium=feed&utm_campaign=article&referring_guid=bca4c4a0-cbdc-4b5c-a294-1e7a26e51e2d&.tsrc=rss,https://da.gd/azQaB
