feed,title,long_url,short_url
SeekingAlpha,Nikola announces CEO transition with Lohscheller to take over for the retiring Russell,https://seekingalpha.com/news/3870615,
SeekingAlpha,Vera Therapeutics GAAP EPS of -$0.55 beats by $0.17,https://seekingalpha.com/news/3870614,
SeekingAlpha,"Array Technology rallies on bullish outlook, solid earnings beat: Q2",https://seekingalpha.com/news/3870613,
SeekingAlpha,"Outlook for stocks is 'sticky and tricky,' slowdown has 'long way to go' - Barclays exec",https://seekingalpha.com/news/3870610,
SeekingAlpha,"NewLake Capital Partners GAAP EPS of $0.18 misses by $0.07, revenue of $10.5M beats by $0.31M",https://seekingalpha.com/news/3870612,
SeekingAlpha,"Crawford United GAAP EPS of $0.34 misses by $0.31, revenue of $31.9M misses by $0.2M",https://seekingalpha.com/news/3870611,
