feed,title,long_url,short_url
SeekingAlpha,"FlexShopper GAAP EPS of $0.51 beats by $0.57, revenue of $36.54M beats by $4.46M",https://seekingalpha.com/news/3871128,
SeekingAlpha,Milestone Pharmaceuticals GAAP EPS of -$0.39 misses by $0.03,https://seekingalpha.com/news/3871127,
SeekingAlpha,"Linamar GAAP EPS of C$1.61, revenue of C$1.98B",https://seekingalpha.com/news/3871126,
SeekingAlpha,"Pason Systems GAAP EPS of C$0.33, revenue of C$73.61M",https://seekingalpha.com/news/3871125,
SeekingAlpha,"Bolt Biotherapeutics GAAP EPS of -$0.61 beats by $0.08, revenue of $1.39M beats by $0.89M",https://seekingalpha.com/news/3871124,
SeekingAlpha,"AssetMark Financial platform assets rose over 5% in July, net flows slid",https://seekingalpha.com/news/3871123,
SeekingAlpha,"Sonder Holdings Q2 revenue up Y/Y, Q3 guidance above consensus",https://seekingalpha.com/news/3871122,
