feed,title,long_url,short_url
SeekingAlpha,Goldman Sachs Access High Yield Corporate Bond ETF declares monthly distribution of $0.2074,https://seekingalpha.com/news/4043692,
SeekingAlpha,Goldman Sachs Access Emerging Markets USD Bond ETF declares monthly distribution of $0.1937,https://seekingalpha.com/news/4043691,
SeekingAlpha,FT Cboe Vest Gold Target Income ETF declares monthly distribution of $0.1331,https://seekingalpha.com/news/4043690,
SeekingAlpha,FlexShares iBoxx 5-Year Target Duration TIPS Index Fund declares monthly distribution of $0.0828,https://seekingalpha.com/news/4043689,
SeekingAlpha,FlexShares iBoxx 3-Year Target Duration TIPS Index Fund declares monthly distribution of $0.0800,https://seekingalpha.com/news/4043688,
