feed,title,long_url,short_url
InvestorPlace,"Decoding Apple’s Stock Trajectory: Time to Buy, Hold, or Sell AAPL?",https://investorplace.com/market360/2023/12/decoding-apples-stock-trajectory-time-to-buy-hold-or-sell-aapl/,https://da.gd/yMJjX
InvestorPlace,"The Verdict on BlackRock: Time to Buy, Hold, or Offload BLK Stock?",https://investorplace.com/2023/12/the-verdict-on-blackrock-time-to-buy-hold-or-offload-blk-stock/,https://da.gd/m0jv8k
InvestorPlace,Forget PayPal Stock. Here’s Something Even Better.,https://investorplace.com/2023/12/forget-paypal-stock-heres-something-even-better/,https://da.gd/6ZTOB
InvestorPlace,The 3 Best Dow Stocks to Buy in December,https://investorplace.com/2023/12/the-3-best-dow-stocks-to-buy-in-december/,https://da.gd/PqG9Re
InvestorPlace,Don’t Risk a Dead-Money December With Nio Stock,https://investorplace.com/market360/2023/12/dont-risk-a-dead-money-december-with-nio-stock/,https://da.gd/8lVo5i
InvestorPlace,Can Nvidia Ever Be a $2 Trillion Stock?,https://investorplace.com/2023/12/can-nvidia-ever-be-a-2-trillion-stock/,https://da.gd/HaYx
InvestorPlace,Modernizing a Classic: 3 Fresh Takes on How to Play the 60/40 Portfolio Strategy,https://investorplace.com/2023/12/modernizing-a-classic-3-fresh-takes-on-how-to-play-the-60-40-portfolio-strategy/,https://da.gd/ziE24
InvestorPlace,Palantir’s AI Surge: Is PLTR Stock Really Worth the Hype?,https://investorplace.com/2023/12/palantirs-ai-surge-is-pltr-stock-really-worth-the-hype/,https://da.gd/8sVV
InvestorPlace,3 Bright AI Stocks Bound to Make Your Portfolio Shine,https://investorplace.com/2023/12/3-bright-ai-stocks-bound-to-make-your-portfolio-shine/,https://da.gd/lzKVg
