feed,title,long_url,short_url
Cointelegraph,Stakeholders urge Nigeria to adopt compliance-focused crypto regulation,https://cointelegraph.com/news/nigerian-crypto-experts-advocate-compliance-focused-regulation?utm_source=rss_feed&utm_medium=rss%3F1724589702027&utm_campaign=rss_partner_inbound,https://da.gd/XAsfDA
Cointelegraph,WazirX slams external forces for delaying restructuring efforts,https://cointelegraph.com/news/wazirx-criticizes-external-forces-delaying-recoveryg-efforts?utm_source=rss_feed&utm_medium=rss%3F1724589702027&utm_campaign=rss_partner_inbound,https://da.gd/C6a1UP
Cointelegraph,Telegram founder Pavel Durov arrested — What we know so far,https://cointelegraph.com/news/telegram-ceo-pavel-durov-arrested-france?utm_source=rss_feed&utm_medium=rss%3F1724589702027&utm_campaign=rss_partner_inbound,https://da.gd/mn7QQ
Cointelegraph,"US trustee challenges FTX reorganization plan, citing legal concerns",https://cointelegraph.com/news/ftx-bankruptcy-plan-us-trustee-objections?utm_source=rss_feed&utm_medium=rss%3F1724589702027&utm_campaign=rss_partner_inbound,https://da.gd/ZH0Ttu
Cointelegraph,Toncoin open interest surges 32% following Pavel Durov's arrest,https://cointelegraph.com/news/toncoin-open-interest-surges-pavel-durov-telegram-ceo?utm_source=rss_feed&utm_medium=rss%3F1724589702027&utm_campaign=rss_partner_inbound,https://da.gd/28DqhO
Cointelegraph,Bitcoin chart signals possible 'extremely' quick move to $68K  —Traders,https://cointelegraph.com/news/bitcoin-chart-price-pattern-bullish-crypto-traders-68k?utm_source=rss_feed&utm_medium=rss%3F1724589702027&utm_campaign=rss_partner_inbound,https://da.gd/hyDxRA
Cointelegraph,"CZ and Binance face new lawsuit, RFK Jr suspends campaign, and more: Hodler’s Digest Aug. 18 – 24",https://cointelegraph.com/magazine/binance-cz-lawsuit-rfk-jr-donald-trump-presidential-campaign-kraken-hodlers-digest/?utm_source=rss_feed&utm_medium=rss%3F1724589702027&utm_campaign=rss_partner_inbound,https://da.gd/gmycG
Cointelegraph,Breaking: Telegram CEO Pavel Durov arrested in France,https://cointelegraph.com/news/breaking-telegram-ceo-pavel-durov-allegedly-arrested-in-france?utm_source=rss_feed&utm_medium=rss%3F1724589702027&utm_campaign=rss_partner_inbound,https://da.gd/U64b
Cointelegraph,Federal agencies are missing the mark on celebrity crypto endorsements,https://cointelegraph.com/news/federal-agencies-are-missing-the-mark-on-celebrity-crypto-endorsements?utm_source=rss_feed&utm_medium=rss%3F1724589702027&utm_campaign=rss_partner_inbound,https://da.gd/9TMQ
Cointelegraph,DNA computing breakthrough could turn living cells into functioning blockchains,https://cointelegraph.com/news/dna-computing-breakthrough-could-turn-living-cells-into-functioning-blockchains?utm_source=rss_feed&utm_medium=rss%3F1724589702027&utm_campaign=rss_partner_inbound,https://da.gd/TipKtu
Cointelegraph,Meta cancels next-gen headset as Reality Labs remains mired in VR,https://cointelegraph.com/news/meta-cancels-next-gen-headset-reality-labs-remains-mired-vr?utm_source=rss_feed&utm_medium=rss%3F1724589702027&utm_campaign=rss_partner_inbound,https://da.gd/w0O3
Cointelegraph,Big tech is prepping an explosive pivot to robotics,https://cointelegraph.com/news/big-tech-ai-prepping-explosive-pivot-robotics-robots?utm_source=rss_feed&utm_medium=rss%3F1724589702027&utm_campaign=rss_partner_inbound,https://da.gd/CwBUXR
Cointelegraph,Why is Solana (SOL) price up today?,https://cointelegraph.com/news/why-is-solana-price-up-this-week?utm_source=rss_feed&utm_medium=rss%3F1724589702027&utm_campaign=rss_partner_inbound,https://da.gd/1YDd
Cointelegraph,Whatever happened to the 10 biggest projects from the ICO era?,https://cointelegraph.com/news/10-ico-tokens-fundraising-eos-telegram?utm_source=rss_feed&utm_medium=rss%3F1724589702027&utm_campaign=rss_partner_inbound,https://da.gd/fzhf
Cointelegraph,"EU AI rules stifle innovation, Meta and Spotify CEOs warn",https://cointelegraph.com/news/meta-spotify-criticize-eu-ai-regulations?utm_source=rss_feed&utm_medium=rss%3F1724589702027&utm_campaign=rss_partner_inbound,https://da.gd/F0TZRQ
Cointelegraph,"Polygon’s Discord channel hacked, team works to regain control",https://cointelegraph.com/news/polygon-discord-hack-security-concerns?utm_source=rss_feed&utm_medium=rss%3F1724589702027&utm_campaign=rss_partner_inbound,https://da.gd/4xwKdZ
Cointelegraph,Analyst eyes Ether ‘major push’ to $3.5K amid traders betting on upswing,https://cointelegraph.com/news/ethereum-price-crypto-analyst-bullish-chart-future-traders?utm_source=rss_feed&utm_medium=rss%3F1724589702027&utm_campaign=rss_partner_inbound,https://da.gd/XVIs2S
Cointelegraph,Hong Kong Bitcoin ETFs top $250M AUM,https://cointelegraph.com/news/hong-kong-bitcoin-etfs-surpass-2-billion-osl-dominance?utm_source=rss_feed&utm_medium=rss%3F1724589702027&utm_campaign=rss_partner_inbound,https://da.gd/menNgK
Cointelegraph,Bitcoin’s Coinbase premium hits 39-day high as $63K is reclaimed,https://cointelegraph.com/news/bitcoin-btc-coinbase-premium-united-states-demand-binance-worldwide?utm_source=rss_feed&utm_medium=rss%3F1724589702027&utm_campaign=rss_partner_inbound,https://da.gd/fnSGYD
Cointelegraph,Tether has ‘redistributed’ $108.8M in USDT from illicit activity since 2014,https://cointelegraph.com/news/tether-stablecoin-usdt-criminal-united-states-cyber-fraud?utm_source=rss_feed&utm_medium=rss%3F1724589702027&utm_campaign=rss_partner_inbound,https://da.gd/IFiyz5
Cointelegraph,Solana TVL hits near 1-year high — Will SOL price follow?,https://cointelegraph.com/news/solana-tvl-hits-near-1-year-high-will-sol-price-follow?utm_source=rss_feed&utm_medium=rss%3F1724589702027&utm_campaign=rss_partner_inbound,https://da.gd/qpbN
Cointelegraph,"Perplexity AI’s ad integration plan draws shock, mockery: ‘This company is toast’",https://cointelegraph.com/news/perplexity-ai-ad-integration-plan-draws-shock-mockery-company-toast?utm_source=rss_feed&utm_medium=rss%3F1724589702027&utm_campaign=rss_partner_inbound,https://da.gd/ZjlJc
Cointelegraph,Crypto advocates file brief against SEC's investor tracking database,https://cointelegraph.com/news/sec-database-privacy-lawsuit-crypto-groups?utm_source=rss_feed&utm_medium=rss%3F1724589702027&utm_campaign=rss_partner_inbound,https://da.gd/F0yY2J
Cointelegraph,Court denies Kraken’s motion to dismiss SEC lawsuit,https://cointelegraph.com/news/court-denies-kraken-motion-dismiss-sec-lawsuit?utm_source=rss_feed&utm_medium=rss%3F1724589702027&utm_campaign=rss_partner_inbound,https://da.gd/uhxS
Cointelegraph,Past rate cuts indicate potential crypto bull market catalyst — 21Shares,https://cointelegraph.com/news/past-rate-cuts-indicate-potential-bull-market-catalyst-21-shares?utm_source=rss_feed&utm_medium=rss%3F1724589702027&utm_campaign=rss_partner_inbound,https://da.gd/Pk1l25
Cointelegraph,Crypto Biz: Consolidation ramps up among crypto firms,https://cointelegraph.com/news/crypto-biz-consolidation-ramps-up-among-crypto-firms?utm_source=rss_feed&utm_medium=rss%3F1724589702027&utm_campaign=rss_partner_inbound,https://da.gd/462Ig
Cointelegraph,Here’s what happened in crypto today,https://cointelegraph.com/news/what-happened-in-crypto-today?utm_source=rss_feed&utm_medium=rss%3F1724589702027&utm_campaign=rss_partner_inbound,https://da.gd/OlFEnh
Cointelegraph,"RFK Jr says he is suspending, not terminating, presidential campaign",https://cointelegraph.com/news/rfk-jr-suspending-2024-presidential-bid?utm_source=rss_feed&utm_medium=rss%3F1724589702027&utm_campaign=rss_partner_inbound,https://da.gd/HRJhHP
Cointelegraph,"Bitcoin miner profits drop as halving, power costs weigh — JPMorgan",https://cointelegraph.com/news/bitcoin-miner-profits-drop-halving-power-costs-weigh-on-performance-jp-morgan?utm_source=rss_feed&utm_medium=rss%3F1724589702027&utm_campaign=rss_partner_inbound,https://da.gd/gAiHNL
Cointelegraph,"Proof-of-Ink to boost Web3 adoption, Fed rate cut could spur DeFi summer: Finance Redefined",https://cointelegraph.com/news/proof-of-ink-boost-web3-adoption-fed-rate-cut-spur-defi-summer-finance-redefined?utm_source=rss_feed&utm_medium=rss%3F1724589702027&utm_campaign=rss_partner_inbound,https://da.gd/y8tTI
