feed,title,long_url,short_url
ETFTrends:DailyRecap,An ETF to Consider as Nickel Will Play a Key Role in the Energy Transition,https://www.etftrends.com/gold-silver-investing-channel/an-etf-to-consider-as-nickel-will-play-key-role-in-energy-transition/,https://da.gd/06TlIu
ETFTrends:DailyRecap,Call on KURE for China Healthcare Advancements,https://www.etftrends.com/china-insights-channel/call-on-kure-for-china-healthcare-advancements/,https://da.gd/d0E3Nq
ETFTrends:DailyRecap,ESG ETFs Can Find Audience With Younger Investors,https://www.etftrends.com/etf-education-channel/esg-etfs-can-find-audience-with-younger-investors/,https://da.gd/F5MHN
ETFTrends:DailyRecap,An Electrifying Outlook for Electric Metals,https://www.etftrends.com/climate-insights-channel/an-electrifying-outlook-for-electric-metals/,https://da.gd/CIQk
ETFTrends:DailyRecap,ChatGPT: Keep Talking and Nobody Explodes,https://www.etftrends.com/chatgpt-keep-talking-nobody-explodes/,https://da.gd/ttplY
ETFTrends:DailyRecap,MLPs and the Fastest-Growing Hydrocarbon You’ve Not Heard Of,https://www.etftrends.com/energy-infrastructure-channel/mlps-and-the-fastest-growing-hydrocarbon-youve-not-heard-of/,https://da.gd/WplDB
ETFTrends:DailyRecap,Auour Investments: Silicon Valley Bank: When Success Fails,https://www.etftrends.com/etf-strategist-channel/auour-investments-silicon-valley-bank-when-success-fails/,https://da.gd/Nk1v
ETFTrends:DailyRecap,China Pops and KraneShares ETFs Benefit,https://www.etftrends.com/china-insights-channel/china-pops-kraneshares-etfs-benefit/,https://da.gd/3UCJ84
ETFTrends:DailyRecap,"Todd Rosenbluth Talks Ultra-Short ETFs, Active Management, and ESG on Bloomberg’s “ETF IQ”",https://www.etftrends.com/todd-rosenbluth-talks-ultra-short-etfs-active-management-esg-bloombergs-etf-iq/,https://da.gd/d41m3
ETFTrends:DailyRecap,Model Portfolios for Clients: Finding the Right Fit,https://www.etftrends.com/model-portfolio-channel/model-portfolios-for-clients-finding-right-fit/,https://da.gd/xNm6Lk
ETFTrends:DailyRecap,The Investment Case for the Energy Transition Portfolio,https://www.etftrends.com/etf-building-blocks-channel/investment-case-for-energy-transition-portfolio/,https://da.gd/LYIQZM
ETFTrends:DailyRecap,Add More Duration to Your Portfolio,https://www.etftrends.com/fixed-income-channel/add-more-duration-to-your-portfolio/,https://da.gd/1w3jY
ETFTrends:DailyRecap,"With Volatility Rising, Consider Low Volatility ETF LVOL",https://www.etftrends.com/core-strategies-channel/volatility-rising-consider-low-volatility-etf-lvol/,https://da.gd/WXR1O
ETFTrends:DailyRecap,Inflation Hasn’t Cooled Yet — Client Portfolios May Need an Inflation Hedge,https://www.etftrends.com/market-insights-channel/inflation-hasnt-cooled-yet-client-portfolios-still-need-an-inflation-hedge/,https://da.gd/xvuxZ
ETFTrends:DailyRecap,"As Bank Stocks Rally, Check Out RYF",https://www.etftrends.com/portfolio-strategies-channel/bank-stocks-rally-check-out-ryf/,https://da.gd/8QuN
ETFTrends:DailyRecap,Banks Rebound (But Doubt Remains),https://www.etftrends.com/active-etf-channel/banks-rebound-doubt-remains/,https://da.gd/bsiM5
ETFTrends:DailyRecap,Financials Remain in Focus but Not All ETFs Are the Same,https://www.etftrends.com/institutional-income-channel/financials-remain-focus-not-all-etfs-are-same/,https://da.gd/R7y2
ETFTrends:DailyRecap,"Millennial, Gen Z Spending Habits Could Power This ETF",https://www.etftrends.com/disruptive-technology-channel/millennial-gen-z-spending-habits-could-power-this-etf/,https://da.gd/NMZlPt
