feed,title,long_url,short_url
SeekingAlpha,"Aspira Women’s Health GAAP EPS of -$0.08 beats by $0.01, revenue of $1.85M misses by $0.05M",https://seekingalpha.com/news/3816407,
SeekingAlpha,MBC's video streaming service to host WWE in MENA region,https://seekingalpha.com/news/3816406,
SeekingAlpha,AllianceBernstein CFO Ali Dibadj resigns,https://seekingalpha.com/news/3816404,
SeekingAlpha,Starbucks sees union push by employees hit its hometown,https://seekingalpha.com/news/3816403,
SeekingAlpha,"WuXi AppTec Non-GAAP EPS of RMB1.75, revenue of RMB22.9B",https://seekingalpha.com/news/3816400,
