feed,title,long_url,short_url
SeekingAlpha,"Schneider National Non-GAAP EPS of $0.57 beats by $0.03, revenue of $1.6B beats by $30M",https://seekingalpha.com/news/3828595,
SeekingAlpha,Argo Group jumps after confirming it's exploring strategic alternatives,https://seekingalpha.com/news/3828593,
SeekingAlpha,"California Water Service GAAP EPS of $0.02 misses by $0.01, revenue of $172.99M beats by $14.64M",https://seekingalpha.com/news/3828592,
SeekingAlpha,Linde posts earnings beat and raise but warns of potential Russia charges,https://seekingalpha.com/news/3828594,
SeekingAlpha,Bread Financial credit card delinquency rate improves in March,https://seekingalpha.com/news/3828591,
