feed,title,long_url,short_url
InvestorPlace,The Polestar SPAC Merger Will Push GGPI Stock to New Highs,https://investorplace.com/2022/04/the-polestar-spac-merger-will-push-ggpi-stock-to-new-highs/,https://bit.ly/3kn0C2s
InvestorPlace,Is FB Stock a Buy on Q1 Earnings? 3 Analysts Weigh In on Meta Platforms,https://investorplace.com/2022/04/is-fb-stock-a-buy-on-q1-earnings-3-analysts-weigh-in-on-meta-platforms/,https://bit.ly/3y06GWn
InvestorPlace,This Is Why EVgo Inc. Could Accelerate to Higher Highs,https://investorplace.com/2022/04/this-is-why-evgo-inc-could-accelerate-to-higher-highs/,https://bit.ly/3xY4X40
InvestorPlace,Apple Is the Ultimate Market Bellwether,https://investorplace.com/2022/04/aapl-stock-is-the-ultimate-market-bellwether/,https://bit.ly/3s07HKy
InvestorPlace,FuboTV Stock Might Have Fallen Too Far Too Fast,https://investorplace.com/2022/04/fubo-stock-why-fubotv-shares-might-have-fallen-too-far-too-fast/,https://bit.ly/37JOcit
