feed,title,long_url,short_url
SeekingAlpha,Morgan Stanley expects a soft landing and three 25 basis point cuts in 2024,https://seekingalpha.com/news/4138582,
SeekingAlpha,Ballard Power Systems reports mixed Q2 results; updates FY24 outlook,https://seekingalpha.com/news/4138585,
SeekingAlpha,Annexon Biosciences GAAP EPS of -$0.23,https://seekingalpha.com/news/4138584,
SeekingAlpha,Shift4 Payments plans to offer $1.1B worth of senior notes in a private offering,https://seekingalpha.com/news/4138583,
SeekingAlpha,"Realty Income: 5.2% Yield, 73% Pay-Out Ratio, Consistent Growth",https://seekingalpha.com/article/4713676,
