feed,title,long_url,short_url
SeekingAlpha,Crescent Capital BDC reports Q2 results,https://seekingalpha.com/news/4138837,
SeekingAlpha,"FreightCar America Non-GAAP EPS of $0.05 in-line, revenue of $147.42M beats by $20.32M",https://seekingalpha.com/news/4138836,
SeekingAlpha,NET Power reports Q2 results,https://seekingalpha.com/news/4138835,
SeekingAlpha,Autodesk benefits from virtual design and construction: Baird,https://seekingalpha.com/news/4138813,
SeekingAlpha,"Fathom Holdings GAAP EPS of -$0.07 beats by $0.14, revenue of $89.2M beats by $1.34M",https://seekingalpha.com/news/4138834,
SeekingAlpha,"DoubleDown Interactive GAAP EPS of $13.39, revenue of $88.24M beats by $4.8M",https://seekingalpha.com/news/4138833,
SeekingAlpha,Pfizer trades in the red for seven straight days,https://seekingalpha.com/news/4138831,
