feed,title,long_url,short_url
ETFTrends,New Sanctions Send Russia ETFs Reeling,https://www.etftrends.com/new-sanctions-send-russia-etfs-reeling/,https://bit.ly/3K2NJoT
ETFTrends,"Survey: How Advisors View MLPs, ESG & the Energy Transition",https://www.etftrends.com/energy-infrastructure-channel/survey-how-advisors-view-mlps-esg-the-energy-transition/,https://bit.ly/3Iupy2n
ETFTrends,Protecting Your Retirement Nest Egg From Inflation,https://www.etftrends.com/retirement-income-channel/protecting-your-retirement-nest-egg-from-inflation/,https://bit.ly/3prUQ2t
ETFTrends,Ethereum 2.0 Could Add ESG Component to 2nd-Largest Cryptocurrency,https://www.etftrends.com/crypto-channel/ethereum-2-0-could-add-esg-component-to-2nd-largest-cryptocurrency/,https://bit.ly/3HqZOCB
ETFTrends,Conflict in Ukraine Could Drive Copper Prices Higher,https://www.etftrends.com/thematic-investing-channel/conflict-in-ukraine-could-push-copper-prices-higher/,https://bit.ly/3swbH6e
ETFTrends,Protect Against EM Volatility Amid Russia-Ukraine Conflict With QLVE,https://www.etftrends.com/multi-asset-channel/protect-against-em-volatility-amid-russia-ukraine-conflict-with-qlve/,https://bit.ly/35F0hEd
ETFTrends,A Shift Back to Safe Havens Is Fueling an Appetite for Munis,https://www.etftrends.com/fixed-income-channel/a-shift-back-to-safe-havens-is-fueling-an-appetite-for-munis/,https://bit.ly/3srI8mb
ETFTrends,"Potential Negotiations Between Russia and Ukraine Weigh on Gold, Silver",https://www.etftrends.com/nasdaq-portfolio-solutions-channel/potential-negotiations-between-russia-ukraine-weigh-on-gold-silver/,https://bit.ly/3vs3Acr
ETFTrends,Bet on Buffett With This Japan ETF,https://www.etftrends.com/model-portfolio-channel/bet-on-buffett-with-this-japan-etf/,https://bit.ly/3vngQPP
ETFTrends,Could Old-Fashioned Energy be the Next Growth Sector?,https://www.etftrends.com/etf-strategist-channel/could-old-fashioned-energy-be-the-next-growth-sector/,https://bit.ly/3BYsK3M
ETFTrends,These 3 Dividend ETFs Are Perfect for Income-Seekers,https://www.etftrends.com/dividend-channel/these-3-dividend-etfs-are-perfect-for-income-seekers/,https://bit.ly/3thECKh
ETFTrends,SBIO Is a Good Place to Be for Biotech Innovation,https://www.etftrends.com/etf-building-blocks-channel/sbio-is-a-good-place-to-be-for-biotech-innovation/,https://bit.ly/3ILr8ND
ETFTrends,Blockchain Technology Set to Revolutionize the Lending Industry,https://www.etftrends.com/crypto-channel/blockchain-technology-set-to-revolutionize-the-lending-industry/,https://bit.ly/3BY0Epr
ETFTrends,Financial Donations to Ukraine Are Showing Up in the Form of Bitcoin,https://www.etftrends.com/crypto-channel/financial-donations-to-ukraine-are-showing-up-in-the-form-of-bitcoin/,https://bit.ly/3IvgiuJ
