feed,title,long_url,short_url
SeekingAlpha,"Sienna Senior Living announces new acquisitions, $75M bought deal public offering",https://seekingalpha.com/news/3807300,
SeekingAlpha,GoodRx slips after Q4 miss and soft guidance,https://seekingalpha.com/news/3807297,
SeekingAlpha,"UserTesting Non-GAAP EPS of -$0.12 beats by $0.06, revenue of $42.48M beats by $3.47M",https://seekingalpha.com/news/3807296,
SeekingAlpha,Atossa Therapeutics GAAP EPS of -$0.18,https://seekingalpha.com/news/3807295,
SeekingAlpha,U. S. Steel to insource pig iron producing with new caster at Gary Works mill,https://seekingalpha.com/news/3807301,
SeekingAlpha,"Gulfport Q4 results -- in line earnings, production guided lower",https://seekingalpha.com/news/3807294,
