feed,title,long_url,short_url
Yahoo,BP and Apollo agree on $1bn deal for 25% stake in bp TANAP,https://finance.yahoo.com/news/bp-apollo-agree-1bn-deal-103111812.html,https://da.gd/CGTRJ4
Yahoo,Most Americans mentally spend their paycheck before they get it: How to avoid paycheck stress,https://finance.yahoo.com/news/most-americans-mentally-spend-paycheck-103100256.html,https://da.gd/O1YPX9
Yahoo,2 High-Quality Dividend Stocks to Buy Right Now,https://finance.yahoo.com/news/2-high-quality-dividend-stocks-103000996.html,https://da.gd/ccZAxi
Yahoo,"If You'd Invested $10,000 in Monster Beverage Stock 5 Years Ago, Here's How Much You'd Have Today",https://finance.yahoo.com/news/youd-invested-10-000-monster-103000234.html,https://da.gd/kMOcQq
Yahoo,Hedge fund Elliott says it may take further action on LME voided nickel trades,https://finance.yahoo.com/news/hedge-fund-elliott-looking-further-093621581.html,https://da.gd/JSCowq
Yahoo,US stock futures jump after reports that Trump will narrow tariffs,https://finance.yahoo.com/news/us-stock-futures-jump-reports-102731974.html,https://da.gd/XJamI
Yahoo,AI chip makerFuriosaAI rejects Meta’s $800m offer,https://finance.yahoo.com/news/ai-chip-makerfuriosaai-rejects-meta-102300919.html,https://da.gd/srv5I
Yahoo,Rumble Stock: A Millionaire-Maker in the Making?,https://www.fool.com/investing/2025/03/24/rumble-stock-a-millionaire-maker-in-the-making/?source=eptyholnk0000202&utm_source=yahoo-host-full&utm_medium=feed&utm_campaign=article&referring_guid=b17c7840-b27f-4013-a7ae-b0d9af70ee84&.tsrc=rss,https://da.gd/BjTMb
