feed,title,long_url,short_url
SeekingAlpha,"Franklin Covey EPS misses by $0.49, misses on revenue",https://seekingalpha.com/news/3590036,
SeekingAlpha,"Simulations Plus EPS beats by $0.06, beats on revenue",https://seekingalpha.com/news/3590035,
SeekingAlpha,Blackstone's Life Sciences fund final close at $4.6B; strategic investments snapshot,https://seekingalpha.com/news/3590023,
SeekingAlpha,WD-40 EPS beats by $0.11,https://seekingalpha.com/news/3590034,
SeekingAlpha,DTE Energy gets Michigan Commission approval,https://seekingalpha.com/news/3590027,
