feed,title,long_url,short_url
Investopedia,"Elon Musk's DOGE Is Hiring—Here Are the Details By Colin Laidley Published Nov 15, 2024",https://investopedia.com/--8746098,
Investopedia,"Department of Education Announces New Application Date For SAVE Plan Alternatives By Elizabeth Guevara Published Nov 15, 2024",https://investopedia.com/--8745653,
Investopedia,"Why Has Warren Buffett Been Selling So Much Stock? By Andrew Kessel Published Nov 15, 2024",https://investopedia.com/--8746033,
Investopedia,"Vaccine Maker Stocks Slump After RFK Jr. Nominated as HHS Head By Aaron McDade Published Nov 15, 2024",https://investopedia.com/--8745974,
Investopedia,"Spectrum Brands' Stock Falls as Remington Parent's Earnings Miss Estimates By Nisha Gopalan Published Nov 15, 2024",https://investopedia.com/--8746003,
Investopedia,"Today's Refinance Rates by State – Nov. 15, 2024 By Jen Hubley Luckwaldt Published Nov 15, 2024",https://investopedia.com/--8746147,
