feed,title,long_url,short_url
SeekingAlpha,"Pieris Pharmaceuticals GAAP EPS of -$0.45 beats by $0.02, revenue of $25.9M misses by $0.67M",https://seekingalpha.com/news/3952163,
SeekingAlpha,Sharecare reports mixed Q4 earnings; initiates Q1 and FY23 outlook,https://seekingalpha.com/news/3952162,
SeekingAlpha,GlycoMimetics GAAP EPS of -$0.19 misses by $0.02,https://seekingalpha.com/news/3952161,
SeekingAlpha,Accor is tipped by Deutsche Bank for short-term rally,https://seekingalpha.com/news/3952160,
SeekingAlpha,"bluebird bio GAAP EPS of -$0.38 misses by $0.18, revenue of $0.06M misses by $15.34M",https://seekingalpha.com/news/3952159,
