feed,title,long_url,short_url
FXEmpire,More EU sanctions should hit Russian arms production – Czech Foreign Minister,https://www.fxempire.com/news/article/more-eu-sanctions-should-hit-russian-arms-production-czech-foreign-minister-1263513,https://da.gd/TiLCBh
FXEmpire,"With music and gifts, Philippines welcomes back Chinese tourists",https://www.fxempire.com/news/article/with-music-and-gifts-philippines-welcomes-back-chinese-tourists-1263517,https://da.gd/jbvP6
FXEmpire,"Futures edge lower as earnings roll in, chipmakers retreat",https://www.fxempire.com/news/article/futures-edge-lower-as-earnings-roll-in-chipmakers-retreat-1263518,https://da.gd/IsT6k
FXEmpire,"OPEC+ panel unlikely to tweak oil policy at Feb. 1 meeting, sources say",https://www.fxempire.com/news/article/opec-panel-unlikely-to-tweak-oil-policy-at-feb-1-meeting-sources-say-1263514,https://da.gd/qgx4
FXEmpire,"Lockheed Martin profit outlook disappoints as supply, labour squeeze persists",https://www.fxempire.com/news/article/lockheed-martin-profit-outlook-disappoints-as-supply-labour-squeeze-persists-1263519,https://da.gd/E9qKt
