feed,title,long_url,short_url
SeekingAlpha,SuperBuzz completes private placement offering of $0.44M,https://seekingalpha.com/news/3950990,
SeekingAlpha,Hot Stocks: CBRL and SCHL rises on analyst upgrade; ATVI up as regulator eases enquiry scope; SCHL slides on guidance cut,https://seekingalpha.com/news/3950988,
SeekingAlpha,The Metals Company stock dips as losses widen,https://seekingalpha.com/news/3950989,
SeekingAlpha,Bitcoin Is Benefiting From Banking Sector Fallout,https://seekingalpha.com/article/4589894,
SeekingAlpha,Bail In Or Wipe Out? Caution Warranted On Exotic AT1 Debt,https://seekingalpha.com/article/4589893,
SeekingAlpha,Build-A-Bear Workshop: Turnaround Story Keeps Getting Better,https://seekingalpha.com/article/4589892,
