feed,title,long_url,short_url
Benzinga,Galapagos announces first dosing in MANGROVE Phase 2 trial with GLPG2737 in polycystic kidney disease,https://www.benzinga.com/pressreleases/20/12/g18604442/galapagos-announces-first-dosing-in-mangrove-phase-2-trial-with-glpg2737-in-polycystic-kidney-dise,https://j.mp/3msMtQt
Benzinga,Celyad Oncology to Participate in a Fireside Chat at the JMP Securities Hematology Summit,https://www.benzinga.com/pressreleases/20/12/g18604440/celyad-oncology-to-participate-in-a-fireside-chat-at-the-jmp-securities-hematology-summit,https://j.mp/3msrxcA
Benzinga,Micron Medical Hosting Key Opinion Leader Webinar on Protect PNS: A Percutaneous Wireless Micro-Neurostimulation Technology for Overactive Bladder December 9 at 11am EST,https://www.benzinga.com/pressreleases/20/12/g18604439/micron-medical-hosting-key-opinion-leader-webinar-on-protect-pns-a-percutaneous-wireless-micro-neu,https://j.mp/39Bylkn
Benzinga,PDF Solutions Completes Acquisition of Cimetrix,https://www.benzinga.com/pressreleases/20/12/g18604394/pdf-solutions-completes-acquisition-of-cimetrix,https://j.mp/37sxobh
Benzinga,"First Hawaiian to Participate in the Goldman Sachs Financial Services Conference December 8, 2020",https://www.benzinga.com/pressreleases/20/12/g18604393/first-hawaiian-to-participate-in-the-goldman-sachs-financial-services-conference-december-8-2020,https://j.mp/2KSaqTn
