feed,title,long_url,short_url
Investing,Solar stocks plummet after Trump's tax bill advances in US House,https://www.investing.com/news/stock-market-news/solar-stocks-plummet-after-trumps-tax-bill-advances-in-us-house-4059762,https://da.gd/NW6AAm
Investing,"Fannie, Freddie OTC shares soar after Trump comments on spin-off",https://www.investing.com/news/stock-market-news/fannie-freddie-otc-shares-soar-after-trump-comments-on-spinoff-4059760,https://da.gd/w7vJe
Investing,Marqeta stock sinks amid short seller scrutiny,https://www.investing.com/news/stock-market-news/marqeta-stock-sinks-amid-short-seller-scrutiny-93CH-4059755,https://da.gd/GMOFG
Investing,Saudi Arabia stocks lower at close of trade; Tadawul All Share down 1.02%,https://www.investing.com/news/stock-market-news/saudi-arabia-stocks-lower-at-close-of-trade-tadawul-all-share-down-102-4059752,https://da.gd/WjIuSJ
Investing,"Citi shuffles MedTech stocks: BDX downgraded, ITGR raised; reiterates top pick",https://www.investing.com/news/stock-market-news/citi-shuffles-medtech-stocks-bdx-downgraded-itgr-raised-reiterates-top-pick-4059733,https://da.gd/rUmpwm
