feed,title,long_url,short_url
Benzinga,Anonymous Bitcoin Whale Just Moved $24M Worth Of BTC Off Coinbase,https://benzinga.com/markets/cryptocurrency/23/01/30528191/anonymous-bitcoin-whale-just-moved-24m-worth-of-btc-off-coinbase,https://da.gd/Baz7g
Benzinga,Bitcoin Whale Just Transferred $34M Worth of BTC Onto Coinbase,https://benzinga.com/markets/cryptocurrency/23/01/30528188/bitcoin-whale-just-transferred-34m-worth-of-btc-onto-coinbase,https://da.gd/7K64WD
Benzinga,"Bitcoin Whale Moves 2,000 BTC Off Binance",https://benzinga.com/markets/cryptocurrency/23/01/30528184/bitcoin-whale-moves-2-000-btc-off-binance,https://da.gd/EcEgK
Benzinga,Ethereum Whale Just Transferred $47M Worth of ETH Onto Coinbase,https://benzinga.com/markets/cryptocurrency/23/01/30528180/ethereum-whale-just-transferred-47m-worth-of-eth-onto-coinbase,https://da.gd/KZJapU
Benzinga,"5,000 Bitcoin Was Just Transferred Between 2 Wallets",https://benzinga.com/markets/cryptocurrency/23/01/30528173/5-000-bitcoin-was-just-transferred-between-2-wallets,https://da.gd/Xisszf
Benzinga,This Wallet Just Transferred $142M Worth Of ETH,https://benzinga.com/markets/cryptocurrency/23/01/30528166/this-wallet-just-transferred-142m-worth-of-eth,https://da.gd/QF1eT4
Benzinga,Stablecoin NFTs? Archimedes Launches Leveraged Yield App With Origin Dollar (OUSD),https://benzinga.com/markets/cryptocurrency/23/01/30527942/stablecoin-nfts-archimedes-launches-leveraged-yield-app-with-origin-dollar-ousd,https://da.gd/CO9Ib
