feed,title,long_url,short_url
Investing,Norway stocks higher at close of trade; Oslo OBX up 0.10%,https://www.investing.com/news/stock-market-news/norway-stocks-higher-at-close-of-trade-oslo-obx-up-010-4311196,
Investing,Israel stocks higher at close of trade; TA 35 up 0.15%,https://www.investing.com/news/stock-market-news/israel-stocks-higher-at-close-of-trade-ta-35-up-015-4311195,
Investing,Oilfield giants pivot to booming AI infrastructure as drilling demand wanes,https://www.investing.com/news/stock-market-news/oilfield-giants-pivot-to-booming-ai-infrastructure-as-drilling-demand-wanes-4311194,
Investing,Greece stocks lower at close of trade; Athens General Composite down 0.42%,https://www.investing.com/news/stock-market-news/greece-stocks-lower-at-close-of-trade-athens-general-composite-down-042-4311184,
Investing,Factbox-US government shutdown: How it affects key economic data publishing,https://www.investing.com/news/economy-news/factboxus-government-shutdown-how-it-affects-key-economic-data-publishing-4311192,
