feed,title,long_url,short_url
FXEmpire,Refinitiv says it is investigating potential service issue,https://www.fxempire.com/news/article/refinitiv-says-it-is-investigating-potential-service-issue-1074295,https://bit.ly/3z9fTuN
FXEmpire,Drone saves 14-year-old from drowning on a Spanish beach,https://www.fxempire.com/news/article/drone-saves-14-year-old-from-drowning-on-a-spanish-beach-1074296,https://bit.ly/3zu6YFq
FXEmpire,Thailand probing potential losses for users of crypto platform Zipmex,https://www.fxempire.com/news/article/thailand-probing-potential-losses-for-users-of-crypto-platform-zipmex-1074309,https://bit.ly/3BevCv3
FXEmpire,China confirms warnings to U.S. on Pelosi’s possible Taiwan visit,https://www.fxempire.com/news/article/china-confirms-warnings-to-u-s-on-pelosis-possible-taiwan-visit-1074294,https://bit.ly/3zt5IT8
FXEmpire,German union calls on Lufthansa ground staff to walk out on Wednesday,https://www.fxempire.com/news/article/german-union-calls-on-lufthansa-ground-staff-to-walk-out-on-wednesday-1074307,https://bit.ly/3Bkc3BL
FXEmpire,Japan slashes fiscal year GDP growth f’cast to 2.0% on global demand slump,https://www.fxempire.com/news/article/japan-slashes-fiscal-year-gdp-growth-fcast-to-2-0-on-global-demand-slump-1074293,https://bit.ly/3PtRRkW
