feed,title,long_url,short_url
Investing,Gala Games Teams up with Battle Island for an Animated Series,https://investing.com/news/-2853231,
Investing,Shiba Inu Plans Launch of New Visa Card; Burn Rate Reverses,https://investing.com/news/-2853230,
Investing,Huobi Lists DeFiChain’s DFI Token; Withdrawals To Start on July 26,https://investing.com/news/-2853229,
Investing,NFT utility to remedy ticketing dilemmas? Experts weigh-in,https://investing.com/news/-2853228,
Investing,Philips Shares Tumble Below Nine-Year Low After Weak Q2 Performance,https://investing.com/news/-2853227,
