feed,title,long_url,short_url
SeekingAlpha,"Heidrick & Struggles GAAP EPS of $1.19 beats by $0.23, revenue of $298.7M beats by $4.34M, Q3 revenue forecast below estimates",https://seekingalpha.com/news/3860225,
SeekingAlpha,Legend Biotech stock slides on proposed ADS offering,https://seekingalpha.com/news/3860224,
SeekingAlpha,"NXP Semiconductors GAAP EPS of $2.53 beats by $0.10, revenue of $3.31B beats by $40M",https://seekingalpha.com/news/3860223,
SeekingAlpha,"PetMed Express GAAP EPS of $0.14 misses by $0.14, revenue of $70.18M misses by $8.07M",https://seekingalpha.com/news/3860222,
SeekingAlpha,Why did UiPath stock slump today? Tech stocks weaken ahead of earnings,https://seekingalpha.com/news/3860213,
