feed,title,long_url,short_url
SeekingAlpha,"Mohawk Non-GAAP EPS of $2.95 beats by $0.09, revenue of $2.76B beats by $40M",https://seekingalpha.com/news/3798896,
SeekingAlpha,"Confluent Non-GAAP EPS of -$0.19 beats by $0.02, revenue of $119.9M beats by $10.1M",https://seekingalpha.com/news/3798895,
SeekingAlpha,First Western Financial appoints Julie Courkamp to newly created COO role,https://seekingalpha.com/news/3798894,
SeekingAlpha,BARK jumps after partnership with Walmart is disclosed,https://seekingalpha.com/news/3798893,
SeekingAlpha,"Insperity Non-GAAP EPS of $0.34 misses by $0.40, revenue of $1.29B beats by $50M",https://seekingalpha.com/news/3798891,
