feed,title,long_url,short_url
InvestorPlace,"If You Can Only Buy One Crypto, It Better Be One of These 3 Names",https://investorplace.com/2023/07/cryptos-to-buy/,https://da.gd/hRYvP
InvestorPlace,3 Stocks to Buy for 5-Bagger Returns by 2025,https://investorplace.com/2023/07/3-stocks-to-buy-for-5-bagger-returns-by-2025/,https://da.gd/GCEdQ
InvestorPlace,3 Stocks to Buy Before They Become Future Dividend Aristocrats,https://investorplace.com/2023/07/3-stocks-to-buy-before-they-become-future-dividend-aristocrats/,https://da.gd/OEdQN
InvestorPlace,MULN Stock Alert: Mullen Automotive Announces New Pilot Program,https://investorplace.com/2023/07/muln-stock-alert-mullen-automotive-announces-new-pilot-program/,https://da.gd/EBBFZ
InvestorPlace,"If You Can Only Buy One Cybersecurity Stock, It Better Be One of These 3 Names",https://investorplace.com/2023/07/if-you-can-only-buy-one-cybersecurity-stock-it-better-be-one-of-these-3-names/,https://da.gd/ANcr
InvestorPlace,DDOG Stock Alert: Is Datadog the Next Big AI Play?,https://investorplace.com/2023/07/ddog-stock-alert-is-datadog-the-next-big-ai-play/,https://da.gd/Er8oi5
InvestorPlace,W Stock Alert: Wayfair Launches New Generative AI Tools,https://investorplace.com/2023/07/w-stock-alert-wayfair-launches-new-generative-ai-tools/,https://da.gd/wfTl2I
InvestorPlace,3 Millionaire-Maker Cryptos to Buy Before the Window Closes,https://investorplace.com/2023/07/3-millionaire-maker-cryptos-to-buy-before-the-window-closes/,https://da.gd/0lmup
InvestorPlace,"7 Lithium Stocks to Buy to Turn $5,000 into $1 Million",https://investorplace.com/2023/07/7-lithium-stocks-to-buy-to-turn-5000-into-1-million/,https://da.gd/OXmxN
InvestorPlace,"If You Can Only Buy One Robotics Stock, It Better Be One of These 3 Names",https://investorplace.com/2023/07/if-you-can-only-buy-one-robotics-stock-it-better-be-one-of-these-3-names/,https://da.gd/r3Qr
InvestorPlace,"If You Can Only Buy One Semiconductor Stock, It Better Be One of These 3 Names",https://investorplace.com/2023/07/if-you-can-only-buy-one-semiconductor-stock-it-better-be-one-of-these-3-names/,https://da.gd/Cyo2
InvestorPlace,"Dear AMC Stock Fans, Mark Your Calendars for Aug. 8",https://investorplace.com/2023/07/dear-amc-stock-fans-mark-your-calendars-for-aug-8/,https://da.gd/BCLSlM
