feed,title,long_url,short_url
Benzinga,Carvana Stock Is Rising Wednesday: What's Driving The Action?,https://benzinga.com/news/24/07/39708417/carvana-stock-is-rising-wednesday-whats-driving-the-action,https://da.gd/G1p2w
Benzinga,What's Going On With Virgin Galactic Stock Wednesday?,https://benzinga.com/news/24/07/39708397/whats-going-on-with-virgin-galactic-stock-wednesday,https://da.gd/7VAf
Benzinga,How To Successfully Trade News In Crypto,https://benzinga.com/markets/cryptocurrency/24/07/39708396/how-to-successfully-trade-news-in-crypto,https://da.gd/ykrDSJ
Benzinga,Top 3 Tech Stocks That Could Blast Off In July,https://benzinga.com/trading-ideas/long-ideas/24/07/39708384/top-3-tech-stocks-that-could-blast-off-in-july,https://da.gd/sHqe7
Benzinga,"As Tesla Surges 44% In 10 Sessions, Bearish Analyst Smells Stock Manipulation: 'They Keep Buying Puts To Cause Inorganic Buying'",https://benzinga.com/markets/equities/24/07/39708329/as-tesla-surges-44-in-10-sessions-bearish-analyst-smells-stock-manipulation-they-keep-buying-put,https://da.gd/rUZy
