feed,title,long_url,short_url
InvestorPlace,"NIC Stock Earnings: Nicolet Bankshares Beats EPS, Beats Revenue for Q2 2024",https://investorplace.com/earning-results/2024/07/nic-stock-earnings-nicolet-bankshares-for-q2-of-2024/,https://da.gd/zlzUVS
InvestorPlace,CARV Stock Earnings: Carver Bancorp Reported Results for Q4 2024,https://investorplace.com/earning-results/2024/07/carv-stock-earnings-carver-bancorp-for-q4-of-2024/,https://da.gd/37etTh
InvestorPlace,"BFC Stock Earnings: Bank First Beats EPS, Misses Revenue for Q2 2024",https://investorplace.com/earning-results/2024/07/bfc-stock-earnings-bank-first-for-q2-of-2024/,https://da.gd/6LyzU
InvestorPlace,"EQBK Stock Earnings: Equity Bancshares Beats EPS, Beats Revenue for Q2 2024",https://investorplace.com/earning-results/2024/07/eqbk-stock-earnings-equity-bancshares-for-q2-of-2024/,https://da.gd/VvGa
InvestorPlace,"WAFD Stock Earnings: WaFd Beats EPS, Beats Revenue for Q3 2024",https://investorplace.com/earning-results/2024/07/wafd-stock-earnings-wafd-for-q3-of-2024/,https://da.gd/AFm6
InvestorPlace,"FULT Stock Earnings: Fulton Financial Beats EPS, Beats Revenue for Q2 2024",https://investorplace.com/earning-results/2024/07/fult-stock-earnings-fulton-financial-for-q2-of-2024/,https://da.gd/nfIG
