feed,title,long_url,short_url
Nasdaq,Danone To Convert Indirect Stake In China's Mengniu To Direct For Planned Disposal,https://www.nasdaq.com/articles/danone-to-convert-indirect-stake-in-chinas-mengniu-to-direct-for-planned-disposal-2021-03,https://j.mp/3uRO1IC
Nasdaq,"Russia's Fix Price sets IPO range, market cap could top $8 bln",https://www.nasdaq.com/articles/russias-fix-price-sets-ipo-range-market-cap-could-top-%248-bln-2021-03-01,https://j.mp/2ZYyjx9
Nasdaq,Norway's Flyr airline rises 20% after IPO,https://www.nasdaq.com/articles/norways-flyr-airline-rises-20-after-ipo-2021-03-01,https://j.mp/3r4yzGH
Nasdaq,"Eurofins launches prescription-free COVID-19 test, eyes further growth",https://www.nasdaq.com/articles/eurofins-launches-prescription-free-covid-19-test-eyes-further-growth-2021-03-01,https://j.mp/2PdG2VK
Nasdaq,Iran insists U.S. lift sanctions first to revive nuclear deal talks,https://www.nasdaq.com/articles/iran-insists-u.s.-lift-sanctions-first-to-revive-nuclear-deal-talks-2021-03-01,https://j.mp/3kz5II1
Nasdaq,Spanish factory activity grows in Feb at fastest pace in 7 months - PMI,https://www.nasdaq.com/articles/spanish-factory-activity-grows-in-feb-at-fastest-pace-in-7-months-pmi-2021-03-01,https://j.mp/2MDTfGC
Nasdaq,"Banks in EU should publish yardstick of 'green' activity, says watchdog",https://www.nasdaq.com/articles/banks-in-eu-should-publish-yardstick-of-green-activity-says-watchdog-2021-03-01,https://j.mp/3r9GQsU
Nasdaq,European stocks rebound as bond markets stabilise,https://www.nasdaq.com/articles/european-stocks-rebound-as-bond-markets-stabilise-2021-03-01,https://j.mp/3uGE6VY
Nasdaq,China studies recertification plan for Boeing 737 MAX - aviation regulator,https://www.nasdaq.com/articles/china-studies-recertification-plan-for-boeing-737-max-aviation-regulator-2021-03-01,https://j.mp/3aZVEEN
