feed,title,long_url,short_url
Nasdaq,Wells Fargo dresses for party it may miss,https://www.nasdaq.com/articles/wells-fargo-dresses-for-party-it-may-miss-2021-07-14,https://j.mp/3kjpAky
Nasdaq,Wall St eases as declines in cyclicals outweigh boost from growth stocks,https://www.nasdaq.com/articles/wall-st-eases-as-declines-in-cyclicals-outweigh-boost-from-growth-stocks-2021-07-14,https://j.mp/3yZ0HhQ
Nasdaq,"Brazil lifts growth forecast, hopes to raise $20 billion with tax reforms",https://www.nasdaq.com/articles/brazil-lifts-growth-forecast-hopes-to-raise-%2420-billion-with-tax-reforms-2021-07-14,https://j.mp/3xF6l8B
Nasdaq,Cucinelli's top shareholder starts placement of 0.95% stake,https://www.nasdaq.com/articles/cucinellis-top-shareholder-starts-placement-of-0.95-stake-2021-07-14,https://j.mp/2VMvVe5
Nasdaq,"Over 10,000 species risk extinction in Amazon, says landmark report",https://www.nasdaq.com/articles/over-10000-species-risk-extinction-in-amazon-says-landmark-report-2021-07-14,https://j.mp/36Fy1OI
Nasdaq,Tencent-backed analytics firm Amplitude confidentially files for direct listing,https://www.nasdaq.com/articles/tencent-backed-analytics-firm-amplitude-confidentially-files-for-direct-listing-2021-07-14,https://j.mp/3i8IOXa
Nasdaq,"Britain, EU must use caution in new online rules - UN",https://www.nasdaq.com/articles/britain-eu-must-use-caution-in-new-online-rules-un-2021-07-14,https://j.mp/3xFzi4z
Nasdaq,"FIGS’s Success Story One of Vision, Dedication by Female Co-Founders",https://www.nasdaq.com/articles/figss-success-story-one-of-vision-dedication-by-female-co-founders-2021-07-14,https://j.mp/3B38Y6w
