feed,title,long_url,short_url
Investing,"Bitcoin (BTC) Price to Dip Below $55,000, Warns Top Analyst",https://www.investing.com/news/cryptocurrency-news/bitcoin-btc-price-to-dip-below-55000-warns-top-analyst-3432334,https://da.gd/1QNhK
Investing,Italy's Pirelli confirms guidance after Q1 operating profit tops estimates,https://www.investing.com/news/stock-market-news/italys-pirelli-confirms-guidance-after-q1-operating-profit-tops-estimates-3432349,https://da.gd/FFPg
Investing,Earnings call: Suncor Energy boasts record production and sales,https://www.investing.com/news/stock-market-news/earnings-call-suncor-energy-boasts-record-production-and-sales-93CH-3432347,https://da.gd/uBVCk
Investing,Earnings call: Tripadvisor reports steady growth amid strategic shifts,https://www.investing.com/news/stock-market-news/earnings-call-tripadvisor-reports-steady-growth-amid-strategic-shifts-93CH-3432346,https://da.gd/EReT
Investing,Bank of America's data shows continued spending momentum among consumers,https://www.investing.com/news/stock-market-news/bank-of-americas-data-shows-continued-spending-momentum-among-consumers-432SI-3432340,https://da.gd/ujIxz
Investing,"Earnings call: Seer, Inc. faces revenue decline, plans strategic adjustments",https://www.investing.com/news/stock-market-news/earnings-call-seer-inc-faces-revenue-decline-plans-strategic-adjustments-93CH-3432339,https://da.gd/7G7WO
