feed,title,long_url,short_url
SeekingAlpha,"Ouster GAAP EPS of -$0.55 beats by $0.24, revenue of $26M beats by $0.55M",https://seekingalpha.com/news/4104141,
SeekingAlpha,INmune Bio reports Q1 GAAP EPS of -$0.61,https://seekingalpha.com/news/4104140,
SeekingAlpha,"E.W. Scripps GAAP EPS of -$0.15 beats by $0.09, revenue of $561.4M misses by $7.26M",https://seekingalpha.com/news/4104139,
SeekingAlpha,Invivyd GAAP EPS of -$0.38 beats by $0.13,https://seekingalpha.com/news/4104138,
SeekingAlpha,Bowlero announces acquisition of Thunderbowl Lanes in Michigan,https://seekingalpha.com/news/4104137,
SeekingAlpha,"AMN Healthcare Services Non-GAAP EPS of $0.97 beats by $0.01, revenue of $820.88M beats by $4.38M",https://seekingalpha.com/news/4104136,
SeekingAlpha,"LightPath Technologies GAAP EPS of -$0.07 misses by $0.03, revenue of $7.6M misses by $0.38M",https://seekingalpha.com/news/4104135,
