feed,title,long_url,short_url
SeekingAlpha,Grindr reports Q1 results,https://seekingalpha.com/news/4104188,
SeekingAlpha,"Evolv Technologies Non-GAAP EPS of -$0.09 misses by $0.03, revenue of $21.7M misses by $1.34M",https://seekingalpha.com/news/4104187,
SeekingAlpha,"Getty Images Holdings GAAP EPS of $0.03, revenue of $222.3M",https://seekingalpha.com/news/4104185,
SeekingAlpha,Artisan Partners posts 2.9% decrease in April AUM,https://seekingalpha.com/news/4104184,
SeekingAlpha,"Drilling Tools International GAAP EPS of $0.11, revenue of $37M",https://seekingalpha.com/news/4104183,
SeekingAlpha,"CS Disco GAAP EPS of -$0.17 beats by $0.02, revenue of $35.6M in-line",https://seekingalpha.com/news/4104182,
