feed,title,long_url,short_url
Investing,Earnings call: Brookfield Corporation reports strong Q1 financials,https://www.investing.com/news/stock-market-news/earnings-call-brookfield-corporation-reports-strong-q1-financials-93CH-3433254,https://da.gd/odIZH
Investing,"Earnings call: SLR Investment Corp. posts solid Q1 growth, eyes ABL expansion",https://www.investing.com/news/stock-market-news/earnings-call-slr-investment-corp-posts-solid-q1-growth-eyes-abl-expansion-93CH-3433239,https://da.gd/HkIEU
Investing,Earnings call: Riley Exploration Permian sees growth in Q1 2024,https://www.investing.com/news/stock-market-news/earnings-call-riley-exploration-permian-sees-growth-in-q1-2024-93CH-3433230,https://da.gd/2ypwS
Investing,Earnings call: Altimmune reports progress in pemvidutide trials,https://www.investing.com/news/stock-market-news/earnings-call-altimmune-reports-progress-in-pemvidutide-trials-93CH-3433234,https://da.gd/asHoa
Investing,"Earnings call: Ramaco Resources reports mixed Q1 results, eyes growth",https://www.investing.com/news/stock-market-news/earnings-call-ramaco-resources-reports-mixed-q1-results-eyes-growth-93CH-3433228,https://da.gd/NO1ita
Investing,Earnings call: Papa John's announces mixed Q1 results amid strategic shifts,https://www.investing.com/news/stock-market-news/earnings-call-papa-johns-announces-mixed-q1-results-amid-strategic-shifts-93CH-3433229,https://da.gd/FtY9q1
Investing,Earnings call: SNDL reports growth and positive outlook in Q1 2024,https://www.investing.com/news/stock-market-news/earnings-call-sndl-reports-growth-and-positive-outlook-in-q1-2024-93CH-3433227,https://da.gd/Hy8O
Investing,Earnings call: FreightCar America sees 99% revenue surge in Q1 2024,https://www.investing.com/news/stock-market-news/earnings-call-freightcar-america-sees-99-revenue-surge-in-q1-2024-93CH-3433224,https://da.gd/i6gmQj
