feed,title,long_url,short_url
InsiderMonkey,Oklo Inc. (NYSE:OKLO) Q4 2024 Earnings Call Transcript,https://insidermonkey.com/blog/--1493416,
InsiderMonkey,KB Home (NYSE:KBH) Q1 2025 Earnings Call Transcript,https://insidermonkey.com/blog/--1493415,
InsiderMonkey,Adaptimmune Therapeutics plc (NASDAQ:ADAP) Q4 2024 Earnings Call Transcript,https://insidermonkey.com/blog/--1493414,
InsiderMonkey,"NEXGEL, Inc. (NASDAQ:NXGL) Q4 2024 Earnings Call Transcript",https://insidermonkey.com/blog/--1493412,
InsiderMonkey,Why AppLovin Corp. (APP) Went Up On Tuesday?,https://insidermonkey.com/blog/--1493273,
InsiderMonkey,Why Freeport-McMoran Inc. (FCX) Went Up On Tuesday?,https://insidermonkey.com/blog/--1493301,
InsiderMonkey,Why Banco Bradesco SA (BBD) Went Up On Tuesday?,https://insidermonkey.com/blog/--1493310,
InsiderMonkey,Why Cemex SAB de CV (CX) Went Up On Tuesday?,https://insidermonkey.com/blog/--1493312,
InsiderMonkey,Why Carvana Co. (CVNA) Went Up On Tuesday?,https://insidermonkey.com/blog/--1493275,
InsiderMonkey,Why The Trade Desk Inc. (TTD) Went Up On Tuesday?,https://insidermonkey.com/blog/--1493280,
InsiderMonkey,Why International Paper Company (IP) Went Up On Tuesday?,https://insidermonkey.com/blog/--1493293,
InsiderMonkey,Why Sandstorm Gold Ltd. (SAND) Went Up On Tuesday?,https://insidermonkey.com/blog/--1493303,
InsiderMonkey,Why Mobileye Global Inc. (MBLY) Went Up On Tuesday?,https://insidermonkey.com/blog/--1493305,
InsiderMonkey,Why Trump Media and Technology Group Corp. (DJT) Went Up On Tuesday?,https://insidermonkey.com/blog/--1493307,
