feed,title,long_url,short_url
SeekingAlpha,"RealNetworks CFO to leave, interim appointed",https://seekingalpha.com/news/3856798,
SeekingAlpha,"Orkla Non-GAAP EPS of NOK1.33, revenue of NOK14.3B beats by NOK12.95B",https://seekingalpha.com/news/3856797,
SeekingAlpha,Truist takes down estimates for online travel stocks amid rising recession risk,https://seekingalpha.com/news/3856796,
SeekingAlpha,Empire State Realty Trust upgraded to Market Perform at BMO on tourist rebound,https://seekingalpha.com/news/3856795,
SeekingAlpha,Don't Lose Your Nerve: 4 Ways To Reduce Equity Risk,https://seekingalpha.com/article/4523291,
