feed,title,long_url,short_url
SeekingAlpha,"Becton, Dickinson and Magnolia to collaborate on reducing blood culture contamination",https://seekingalpha.com/news/3892131,
SeekingAlpha,Merck to license TB drug candidates to Gates Foundation's research arm,https://seekingalpha.com/news/3892134,
SeekingAlpha,Intel's Mobileye targeting up to $16B valuation in IPO,https://seekingalpha.com/news/3892136,
SeekingAlpha,RedHill Biopharma receives Nasdaq notification regarding minimum bid price deficiency,https://seekingalpha.com/news/3892135,
SeekingAlpha,Renault and Nissan close in on new alliance deal,https://seekingalpha.com/news/3892133,
SeekingAlpha,Weatherford to redeem $125M senior notes due 2024,https://seekingalpha.com/news/3892132,
