feed,title,long_url,short_url
SeekingAlpha,Inpixon stock slides after pricing $15M securities offering,https://seekingalpha.com/news/3892315,
SeekingAlpha,"NMTR, ZVO and AGFY among mid-day movers",https://seekingalpha.com/news/3892312,
SeekingAlpha,Teva data indicates long-term benefit of Austedo for chorea associated with Huntington's,https://seekingalpha.com/news/3892309,
SeekingAlpha,What's in store for Europe's largest tech company-ASML's Q3 earnings?,https://seekingalpha.com/news/3892311,
SeekingAlpha,Grocery Outlet is a sell at Quo Vadis because earnings may be revised lower,https://seekingalpha.com/news/3892310,
SeekingAlpha,Crude oil turns sharply lower as U.S. nears new Strategic Petroleum Reserve sale,https://seekingalpha.com/news/3892313,
SeekingAlpha,ETO: Globally Diversified CEF With A History Of Strong And Steady Yield,https://seekingalpha.com/article/4547235,
