feed,title,long_url,short_url
CryptoNews,"TOKEN2049 Day 2 Recap: Branching Crypto Cap, Uniting L2s, Tokenizing Staking and More",https://cryptonews.com/news/token2049-day-2-recap-branching-crypto-cap-uniting-l2s-tokenizing-staking-and-more.htm,https://da.gd/9zFk4
CryptoNews,"Riot Platforms Reports $211.8M Q1 2024 Net Income, Falls Short of Revenue Expectations",https://cryptonews.com/news/riot-platforms-reports-211-8m-q1-2024-net-income.htm,https://da.gd/1xqe
CryptoNews,UK FCA Dedicated 30% of Financial Crime Personnel to Monitor Crypto Companies in 2023,https://cryptonews.com/news/uk-fca-allocates-30-to-crypto-oversight-in-2023.htm,https://da.gd/mfgkh
CryptoNews,"Bitcoin Price Prediction: BTC at $57,520 Amid FOMC Updates and Roger Ver Tax Fraud Allegations",https://cryptonews.com/news/bitcoin-price-prediction-btc-at-57520-amid-fomc-updates-and-roger-ver-tax-fraud-allegations.htm,https://da.gd/kue8
CryptoNews,"BlackRock’s IBIT Experiences $37M Outflows for First Time, Other Funds See Combined $526.8M Withdrawals",https://cryptonews.com/news/blackrock-ibit-experiences-37m-outflows-for-first-time.htm,https://da.gd/6emY2e
