feed,title,long_url,short_url
Investing,"After-hours movers: Micron, Five Below, DLocal Limited",https://www.investing.com/news/stock-market-news/afterhours-movers-micron-five-below-dlocal-limited-432SI-4569323,
Investing,U.S. stocks lower at close of trade; Dow Jones Industrial Average down 1.64%,https://www.investing.com/news/stock-market-news/us-stocks-lower-at-close-of-trade-dow-jones-industrial-average-down-164-4569300,
Investing,Canada stocks lower at close of trade; S&P/TSX Composite down 1.87%,https://www.investing.com/news/stock-market-news/canada-stocks-lower-at-close-of-trade-sptsx-composite-down-187-4569278,
Investing,Brazil stocks lower at close of trade; Bovespa down 0.43%,https://www.investing.com/news/stock-market-news/brazil-stocks-lower-at-close-of-trade-bovespa-down-043-4569270,
Investing,War hits Tehran’s grand bazaar as prices surge and shops shut,https://www.investing.com/news/economic-indicators/war-hits-tehrans-grand-bazaar-as-prices-surge-and-shops-shut-4569307,
