feed,title,long_url,short_url
FXEmpire,UK prosecutors authorise more charges against actor Spacey for sexual assault,https://www.fxempire.com/news/article/uk-prosecutors-authorise-more-charges-against-actor-spacey-for-sexual-assault-1199733,https://bit.ly/3ECGSmr
FXEmpire,France’s Macron: China can play bigger role in Russia de-escalation,https://www.fxempire.com/news/article/frances-macron-china-can-play-bigger-role-in-russia-de-escalation-1199742,https://bit.ly/3AhYNvO
FXEmpire,COP27: Climate talks get boost from G20 declaration,https://www.fxempire.com/news/article/cop27-climate-talks-get-boost-from-g20-declaration-1199735,https://bit.ly/3EDrGFD
FXEmpire,Brazil’s Lula to put climate at center of first post-election speech abroad,https://www.fxempire.com/news/article/brazils-lula-to-put-climate-at-center-of-first-post-election-speech-abroad-1199737,https://bit.ly/3ED7Rye
FXEmpire,"In Polish village where missile struck, terrified locals face up to tragedy",https://www.fxempire.com/news/article/in-polish-village-where-missile-struck-terrified-locals-face-up-to-tragedy-1199744,https://bit.ly/3AhYNMk
FXEmpire,"Bank-fintech ventures benefit consumers, enhance competition: U.S. Treasury",https://www.fxempire.com/news/article/bank-fintech-ventures-benefit-consumers-enhance-competition-u-s-treasury-1199738,https://bit.ly/3g7TZCB
FXEmpire,Fowl play: Large turkeys scarce ahead of big U.S. Thanksgiving gatherings,https://www.fxempire.com/news/article/fowl-play-large-turkeys-scarce-ahead-of-big-u-s-thanksgiving-gatherings-1199736,https://bit.ly/3EDeDnG
