feed,title,long_url,short_url
SeekingAlpha,"JZZ Technologies, Oxygen Mortgage to set up new real estate JV",https://seekingalpha.com/news/3908604,
SeekingAlpha,TPT Global Tech signs strategic investment & partnership agreement Black Pearl Investments,https://seekingalpha.com/news/3908603,
SeekingAlpha,Micron shares falter after weakened 2023 market outlook,https://seekingalpha.com/news/3908602,
SeekingAlpha,Galexxy Holdings intends to pursue dual listing on the Upstream platform,https://seekingalpha.com/news/3908601,
SeekingAlpha,AbbVie's migraine med Ubrelvy approved in Canada,https://seekingalpha.com/news/3908598,
SeekingAlpha,"Industrial production unexpectedly slips in October, September's figure revised down",https://seekingalpha.com/news/3908600,
