feed,title,long_url,short_url
Benzinga,A Look Into Lowe's Companies' Debt,https://benzinga.com/news/22/11/29754421/a-look-into-lowes-companies-debt,https://bit.ly/3EAyDaq
Benzinga,Check Out What Whales Are Doing With MCD,https://benzinga.com/markets/options/22/11/29754424/check-out-what-whales-are-doing-with-mcd,https://bit.ly/3gcs8RK
Benzinga,Check Out What Whales Are Doing With ETSY,https://benzinga.com/markets/options/22/11/29753040/check-out-what-whales-are-doing-with-etsy,https://bit.ly/3UPjB6s
Benzinga,Check Out What Whales Are Doing With QCOM,https://benzinga.com/markets/options/22/11/29752594/check-out-what-whales-are-doing-with-qcom,https://bit.ly/3UJDhbM
Benzinga,Cryptocurrency Chiliz's Price Increased More Than 7% Within 24 hours,https://benzinga.com/markets/cryptocurrency/22/11/29754410/cryptocurrency-chilizs-price-increased-more-than-7-within-24-hours,https://bit.ly/3hRRhBO
Benzinga,Check Out What Whales Are Doing With Zoom Video Comms,https://benzinga.com/markets/options/22/11/29752571/check-out-what-whales-are-doing-with-zoom-video-comms,https://bit.ly/3AmP5IR
Benzinga,Cryptocurrency The Open Network Up More Than 6% In 24 hours,https://benzinga.com/markets/cryptocurrency/22/11/29754406/cryptocurrency-the-open-network-up-more-than-6-in-24-hours,https://bit.ly/3gcs98g
Benzinga,Cryptocurrency Cosmos Hub Decreases More Than 3% Within 24 hours,https://benzinga.com/markets/cryptocurrency/22/11/29754389/cryptocurrency-cosmos-hub-decreases-more-than-3-within-24-hours,https://bit.ly/3hRRiFS
Benzinga,Avalanche Down More Than 3% Within 24 hours,https://benzinga.com/markets/cryptocurrency/22/11/29754385/avalanche-down-more-than-3-within-24-hours,https://bit.ly/3hRRi8Q
