feed,title,long_url,short_url
Cointelegraph,California DMV putting vehicle titles on a subnet is innovation theater,https://cointelegraph.com/news/california-dmv-vehicle-titles-subnet-innovation-theater?utm_source=rss_feed&utm_medium=rss%3F1724360026615&utm_campaign=rss_partner_inbound,https://da.gd/BbgoNy
Cointelegraph,Here’s what happened in crypto today,https://cointelegraph.com/news/what-happened-in-crypto-today?utm_source=rss_feed&utm_medium=rss%3F1724360026615&utm_campaign=rss_partner_inbound,https://da.gd/J4mnxx
Cointelegraph,Why is the crypto market up today?,https://cointelegraph.com/news/why-is-the-crypto-market-up-today?utm_source=rss_feed&utm_medium=rss%3F1724360026615&utm_campaign=rss_partner_inbound,https://da.gd/fqmu7
Cointelegraph,Bitcoin exchange inflow has fallen sharply in August — CryptoQuant,https://cointelegraph.com/news/bitcoin-exchange-inflows-drop-significantly-august?utm_source=rss_feed&utm_medium=rss%3F1724360026615&utm_campaign=rss_partner_inbound,https://da.gd/1DiA
Cointelegraph,Changpeng Zhao moved to custody of field office ahead of Sept release,https://cointelegraph.com/news/changpeng-zhao-moved-prison-facility-september-release?utm_source=rss_feed&utm_medium=rss%3F1724360026615&utm_campaign=rss_partner_inbound,https://da.gd/y7NY9I
Cointelegraph,Mercado Libre launches USD-pegged Meli Dollar stablecoin in Brazil,https://cointelegraph.com/news/mercado-libre-launches-meli-dollar-stablecoin-brazil?utm_source=rss_feed&utm_medium=rss%3F1724360026615&utm_campaign=rss_partner_inbound,https://da.gd/i9nb9l
Cointelegraph,HTC launches no-code game creator for ‘Viverse’ metaverse,https://cointelegraph.com/news/htc-launches-no-code-game-creator-viverse-metaverse?utm_source=rss_feed&utm_medium=rss%3F1724360026615&utm_campaign=rss_partner_inbound,https://da.gd/0mnW
Cointelegraph,Anchorage adds PayPal stablecoin yield to custody platform,https://cointelegraph.com/news/anchorage-adds-paypal-stablecoin-yield-custody-platform?utm_source=rss_feed&utm_medium=rss%3F1724360026615&utm_campaign=rss_partner_inbound,https://da.gd/iSPZQ
Cointelegraph,3 reasons why Bitcoin price could hit $68K in September,https://cointelegraph.com/news/3-reasons-why-bitcoin-price-could-hit-68-k-in-september?utm_source=rss_feed&utm_medium=rss%3F1724360026615&utm_campaign=rss_partner_inbound,https://da.gd/juke
Cointelegraph,Partner of ex-FTX exec hit with campaign finance charges,https://cointelegraph.com/news/ftx-partner-michelle-bond-campaign-finance-charges?utm_source=rss_feed&utm_medium=rss%3F1724360026615&utm_campaign=rss_partner_inbound,https://da.gd/yd8hWQ
Cointelegraph,UK risks quantum startup exodus after Labour slashes incentives,https://cointelegraph.com/news/uk-risks-quantum-computing-startup-exodus-labour-slashes-incentives?utm_source=rss_feed&utm_medium=rss%3F1724360026615&utm_campaign=rss_partner_inbound,https://da.gd/qbbtG
Cointelegraph,Metaverse pioneer and movie VFX team unite for blockchain project,https://cointelegraph.com/news/lamina1-weta-workshop-metaverse-artefact?utm_source=rss_feed&utm_medium=rss%3F1724360026615&utm_campaign=rss_partner_inbound,https://da.gd/FsNzjL
Cointelegraph,"AI drone ‘hellscape’ plan for Taiwan, LLMs too dumb to destroy humanity: AI Eye",https://cointelegraph.com/magazine/ai-drone-hellscape-plan-for-taiwan-llms-too-dumb-to-destroy-humanity-ai-eye/?utm_source=rss_feed&utm_medium=rss%3F1724360026615&utm_campaign=rss_partner_inbound,https://da.gd/jb3jI
Cointelegraph,Grayscale launches investment fund for AVAX token,https://cointelegraph.com/news/grayscale-launches-investment-fund-avax-token?utm_source=rss_feed&utm_medium=rss%3F1724360026615&utm_campaign=rss_partner_inbound,https://da.gd/U916ef
Cointelegraph,Why is the BNB price up today?,https://cointelegraph.com/news/why-is-bnb-price-up-today?utm_source=rss_feed&utm_medium=rss%3F1724360026615&utm_campaign=rss_partner_inbound,https://da.gd/YkSC
Cointelegraph,Magic Eden Foundation launches ME token for cross-chain trading,https://cointelegraph.com/news/magic-eden-foundation-launches-me-token-cross-chain-trading?utm_source=rss_feed&utm_medium=rss%3F1724360026615&utm_campaign=rss_partner_inbound,https://da.gd/cPnr3
Cointelegraph,Compliance experts should help regulate crypto — Silk Road 2.0 founder,https://cointelegraph.com/news/compliance-regulate-crypto-silk-road?utm_source=rss_feed&utm_medium=rss%3F1724360026615&utm_campaign=rss_partner_inbound,https://da.gd/jmtFfb
Cointelegraph,Ocean Nodes Incentive Program delayed for back-end improvements,https://cointelegraph.com/news/ocean-protocol-delays-node-incentive-program?utm_source=rss_feed&utm_medium=rss%3F1724360026615&utm_campaign=rss_partner_inbound,https://da.gd/T1NNqa
Cointelegraph,Franklin Templeton expands blockchain fund to Avalanche network,https://cointelegraph.com/news/franklin-templeton-onchain-us-money-fund-avalanche-expansion?utm_source=rss_feed&utm_medium=rss%3F1724360026615&utm_campaign=rss_partner_inbound,https://da.gd/r1bYp
Cointelegraph,Nearly 80% of hacked cryptocurrencies never recover in price — Immunefi,https://cointelegraph.com/news/crypto-hacks-price-declines-report-2024?utm_source=rss_feed&utm_medium=rss%3F1724360026615&utm_campaign=rss_partner_inbound,https://da.gd/MZ2b6
Cointelegraph,India’s crypto future hinges on gov’t consultation paper,https://cointelegraph.com/news/india-crypto-regulation-dea-paper-september?utm_source=rss_feed&utm_medium=rss%3F1724360026615&utm_campaign=rss_partner_inbound,https://da.gd/UDGTi
Cointelegraph,Hong Kong targets noncompliant crypto exchanges in licensing push,https://cointelegraph.com/news/hong-kong-crypto-exchanges-license-scrutiny?utm_source=rss_feed&utm_medium=rss%3F1724360026615&utm_campaign=rss_partner_inbound,https://da.gd/cALbBl
Cointelegraph,FTX says creditors supported reorganization plan with 95% vote,https://cointelegraph.com/news/ftx-reorganization-plan-gains-creditor-support?utm_source=rss_feed&utm_medium=rss%3F1724360026615&utm_campaign=rss_partner_inbound,https://da.gd/Dkey
Cointelegraph,Former TON Foundation execs establish new community initiative,https://cointelegraph.com/news/former-ton-execs-establish-community-initiative?utm_source=rss_feed&utm_medium=rss%3F1724360026615&utm_campaign=rss_partner_inbound,https://da.gd/9OOV1
Cointelegraph,Why is Bitcoin price stuck?,https://cointelegraph.com/news/why-is-bitcoin-price-stuck?utm_source=rss_feed&utm_medium=rss%3F1724360026615&utm_campaign=rss_partner_inbound,https://da.gd/arvxQ
Cointelegraph,Bitcoin ‘ripe for short squeeze’ as bulls pressure $62K BTC price wall,https://cointelegraph.com/news/bitcoin-short-squeeze-bulls-pressure-62k-btc-price-wall?utm_source=rss_feed&utm_medium=rss%3F1724360026615&utm_campaign=rss_partner_inbound,https://da.gd/Ha1HG5
Cointelegraph,"OriginTrail, The Blockchain Socialist and CryptoHarlem update The Agenda on the state of crypto",https://cointelegraph.com/news/origin-trail-blockchain-socialist-crypto-harlem-update-agenda-state-crypto?utm_source=rss_feed&utm_medium=rss%3F1724360026615&utm_campaign=rss_partner_inbound,https://da.gd/kAR0ET
Cointelegraph,NYSE calls out crypto provider SOS for noncompliance,https://cointelegraph.com/news/sos-limited-nyse-noncompliance-share-price-warning?utm_source=rss_feed&utm_medium=rss%3F1724360026615&utm_campaign=rss_partner_inbound,https://da.gd/r7dqEh
Cointelegraph,‘Gangsta’s Paradise’ rapper Coolio resurrected in metaverse tribute,https://cointelegraph.com/news/coolio-gangstas-paradise-30th-anniversary-metaverse?utm_source=rss_feed&utm_medium=rss%3F1724360026615&utm_campaign=rss_partner_inbound,https://da.gd/pCWUZ
Cointelegraph,Spot Ethereum ETFs record longest outflow streak amid drying investments,https://cointelegraph.com/news/ethereum-etfs-record-longest-outflow-five-days?utm_source=rss_feed&utm_medium=rss%3F1724360026615&utm_campaign=rss_partner_inbound,https://da.gd/sf99O
