feed,title,long_url,short_url
InsiderMonkey,"Is Starwood Property Trust, Inc. (STWD) Going to Burn These Hedge Funds?",https://insidermonkey.com/blog/--882056,https://j.mp/36B4uqW
InsiderMonkey,"Penske Automotive Group, Inc. (PAG): Hedge Funds Are Nibbling",https://insidermonkey.com/blog/--882050,https://j.mp/3liqaMi
InsiderMonkey,Is Enova International Inc (ENVA) A Good Stock To Buy?,https://insidermonkey.com/blog/--882053,https://j.mp/3jzaQKT
InsiderMonkey,"Is Advanced Energy Industries, Inc. (AEIS) A Good Stock To Buy?",https://insidermonkey.com/blog/--882062,https://j.mp/3cYXpRW
InsiderMonkey,"Mastech Digital (MHH) Has Risen 207% in Last One Year, Outperforms Market",https://insidermonkey.com/blog/--882197,https://j.mp/36y4MyE
