feed,title,long_url,short_url
Yahoo,SSCI RFVS Application,https://finance.yahoo.com/news/ssci-rfvs-application-160222094.html,https://yhoo.it/3hjdYea
Yahoo,Exela and Powerbridge Are the Latest to Ride the Reddit-Meme Wave,https://www.thestreet.com/investing/exela-powerbridge-reddit-meme-wave-frenzy?puc=yahoo&cm_ven=YAHOO&yptr=yahoo,https://j.mp/2TmaCij
Yahoo,BNY Mellon Investing Unit Remains Skeptical of Accepting Crypto,https://finance.yahoo.com/news/bny-mellon-investing-unit-remains-112323998.html?.tsrc=rss,https://yhoo.it/3qFu2uP
Yahoo,"This new ‘Tesla fighter’ from Mercedes beats out the Model S on two key measures, UBS says",https://finance.yahoo.com/m/6aa12e96-c278-3250-bd65-7a0cd1e9441e/this-new-%E2%80%98tesla-fighter%E2%80%99-from.html?.tsrc=rss,https://yhoo.it/2Udum7Y
Yahoo,"The Zacks Analyst Blog Highlights: Google, Visa, Eli Lilly, Amgen and Sony Group",https://finance.yahoo.com/news/zacks-analyst-blog-highlights-google-104310221.html?.tsrc=rss,https://yhoo.it/3AdHMBv
