feed,title,long_url,short_url
Nasdaq,UniCredit sells first AT1 bond under new CEO Orcel,https://www.nasdaq.com/articles/unicredit-sells-first-at1-bond-under-new-ceo-orcel-2021-06-30,https://j.mp/2SD7cHH
Nasdaq,Blackstone seeks more than $600 mln in damages in Italy property dispute - filing,https://www.nasdaq.com/articles/blackstone-seeks-more-than-%24600-mln-in-damages-in-italy-property-dispute-filing-2021-06-0,https://j.mp/3ycyMdQ
Nasdaq,PayPal appoints HP CEO Lores to board,https://www.nasdaq.com/articles/paypal-appoints-hp-ceo-lores-to-board-2021-06-30,https://j.mp/362Vuct
Nasdaq,Bulgaria-owned Huvepharma backs out of Amsterdam IPO,https://www.nasdaq.com/articles/bulgaria-owned-huvepharma-backs-out-of-amsterdam-ipo-2021-06-30,https://j.mp/3w8nMgc
Nasdaq,"'Extreme' white dwarf sets cosmic records for small size, huge mass",https://www.nasdaq.com/articles/extreme-white-dwarf-sets-cosmic-records-for-small-size-huge-mass-2021-06-30,https://j.mp/3dtRVAh
Nasdaq,EXCLUSIVE-Swiss telecoms group Salt targets $2.7 bln valuation in autumn float -sources,https://www.nasdaq.com/articles/exclusive-swiss-telecoms-group-salt-targets-%242.7-bln-valuation-in-autumn-float-sources,https://j.mp/2TgkKcG
Nasdaq,Daniel Loeb-backed SentinelOne valued at $11.7 bln as shares jump in debut,https://www.nasdaq.com/articles/daniel-loeb-backed-sentinelone-valued-at-%2411.7-bln-as-shares-jump-in-debut-2021-06-30,https://j.mp/3h5uM9u
Nasdaq,Swedish right-wing hopeful seeks to woo centrists in PM bid,https://www.nasdaq.com/articles/swedish-right-wing-hopeful-seeks-to-woo-centrists-in-pm-bid-2021-06-30,https://j.mp/3jqqUBz
Nasdaq,Juventus to propose rights issue of up to 400 mln euro to mitigate COVID-19 impact,https://www.nasdaq.com/articles/juventus-to-propose-rights-issue-of-up-to-400-mln-euro-to-mitigate-covid-19-impact-2021-06,https://j.mp/3x79deo
