feed,title,long_url,short_url
Nasdaq,Damian Pelliccione: How an LGBTQ+ Streaming Network is Changing the World,https://www.nasdaq.com/articles/damian-pelliccione%3A-how-an-lgbtq-streaming-network-is-changing-the-world-2021-06-30,https://j.mp/3h77xMf
Nasdaq,RSI Alert: Hilton Grand Vacations (HGV) Now Oversold,https://www.nasdaq.com/articles/rsi-alert%3A-hilton-grand-vacations-hgv-now-oversold-2021-06-30,https://j.mp/3h8L4P6
Nasdaq,Anheuser-Busch InBev Enters Oversold Territory (BUD),https://www.nasdaq.com/articles/anheuser-busch-inbev-enters-oversold-territory-bud-2021-06-30,https://j.mp/3dubFnt
Nasdaq,ETR Crosses Critical Technical Indicator,https://www.nasdaq.com/articles/etr-crosses-critical-technical-indicator-2021-06-30,https://j.mp/3jICBDZ
Nasdaq,"Colombia first-quarter coal output down 28% on year, gold production up 23%",https://www.nasdaq.com/articles/colombia-first-quarter-coal-output-down-28-on-year-gold-production-up-23-2021-06-30,https://j.mp/3A9qFkl
Nasdaq,Relative Strength Alert For JOYY,https://www.nasdaq.com/articles/relative-strength-alert-for-joyy-2021-06-30,https://j.mp/2SDMmrP
Nasdaq,iShares 5-10 Year Investment Grade Corporate Bond (IGIB) Shares Cross Above 200 DMA,https://www.nasdaq.com/articles/ishares-5-10-year-investment-grade-corporate-bond-igib-shares-cross-above-200-dma-2021-06,https://j.mp/2UfO56S
Nasdaq,Aspen Technology (AZPN) Shares Cross Below 200 DMA,https://www.nasdaq.com/articles/aspen-technology-azpn-shares-cross-below-200-dma-2021-06-30,https://j.mp/2TeXN9P
