feed,title,long_url,short_url
Investing,"Oil loading in Venezuela slows, more ships make U-turns after new US interceptions",https://www.investing.com/news/commodities-news/oil-loading-in-venezuela-slows-more-ships-make-uturns-after-new-us-interceptions-4419836,
Investing,France stocks lower at close of trade; CAC 40 down 0.37%,https://www.investing.com/news/stock-market-news/france-stocks-lower-at-close-of-trade-cac-40-down-037-4419859,
Investing,Belgium stocks lower at close of trade; BEL 20 down 0.36%,https://www.investing.com/news/stock-market-news/belgium-stocks-lower-at-close-of-trade-bel-20-down-036-4419857,
Investing,Sweden stocks higher at close of trade; OMX Stockholm 30 up 0.13%,https://www.investing.com/news/stock-market-news/sweden-stocks-higher-at-close-of-trade-omx-stockholm-30-up-013-4419847,
Investing,Finland stocks higher at close of trade; OMX Helsinki 25 up 0.35%,https://www.investing.com/news/stock-market-news/finland-stocks-higher-at-close-of-trade-omx-helsinki-25-up-035-4419844,
Investing,First Solar shares rise as Google parent acquires Intersect for $4.75B,https://www.investing.com/news/stock-market-news/first-solar-shares-rise-as-google-parent-acquires-intersect-for-475b-93CH-4419843,
Investing,ECB’s Schnabel says no rate hike expected soon despite inflation,https://www.investing.com/news/economy-news/ecbs-schnabel-says-no-rate-hike-expected-soon-despite-inflation-93CH-4419852,
