feed,title,long_url,short_url
SeekingAlpha,"UPS GAAP EPS of $3.05 beats by $0.16, revenue of $24.4B beats by $600M",https://seekingalpha.com/news/3826609,
SeekingAlpha,Shenandoah Telecom powered Glo Fiber expands fiber-optic network to York County,https://seekingalpha.com/news/3826608,
SeekingAlpha,"Armstrong World Non-GAAP EPS of $1.02 misses by $0.11, revenue of $282.6M misses by $7.01M",https://seekingalpha.com/news/3826607,
SeekingAlpha,"AGM Group GAAP EPS of $0.17, revenue of $31.37M",https://seekingalpha.com/news/3826606,
SeekingAlpha,"Southside Bancshares GAAP EPS of $0.77 beats by $0.07, revenue of $59.63M misses by $2.87M",https://seekingalpha.com/news/3826605,
