feed,title,long_url,short_url
Investing,Gucci-owner’s new strategy looks half dressed,https://www.investing.com/news/stock-market-news/gucciowners-new-strategy-looks-half-dressed-4618014,
Investing,"EQT restarts sale of contact lens maker Ginko in at least $1 billion deal, sources say",https://www.investing.com/news/stock-market-news/eqt-restarts-sale-of-contact-lens-maker-ginko-in-at-least-1-billion-deal-sources-say-4617133,
Investing,"PepsiCo climbs premarket; Abbott Laboratories, Travelers fall",https://www.investing.com/news/stock-market-news/pepsico-climbs-premarket-abbott-laboratories-travelers-fall-4617939,
Investing,"Stellantis, Microsoft sign five-year partnership for AI push",https://www.investing.com/news/stock-market-news/stellantis-microsoft-sign-fiveyear-partnership-for-ai-push-4617944,
Investing,Oracle stock gains on AWS partnership and tech sector strength,https://www.investing.com/news/stock-market-news/oracle-stock-gains-on-aws-partnership-and-tech-sector-strength-93CH-4617937,
Investing,Can the risk-on rally reboot software stocks?,https://www.investing.com/news/stock-market-news/can-the-riskon-rally-reboot-software-stocks-4617879,
