feed,title,long_url,short_url
Investing,Stock market today: S&P 500 shrugs off inflation surprise as focus shifts to Fed,https://www.investing.com/news/stock-market-news/stock-market-today-sp-500-shrugs-off-inflation-surprise-as-focus-shifts-to-fed-3612513,https://da.gd/CkoSL
Investing,Brazil stocks lower at close of trade; Bovespa down 0.36%,https://www.investing.com/news/stock-market-news/brazil-stocks-lower-at-close-of-trade-bovespa-down-036-3614328,https://da.gd/3r8AX
Investing,Adobe weaker guidance offsets better-than-expected Q3 results,https://www.investing.com/news/stock-market-news/adobe-weaker-guidance-offsets-betterthanexpected-q3-results-3614322,https://da.gd/YOxsP
Investing,"RH shares gain over 3% as Q2 earnings, revenue beat expectations",https://www.investing.com/news/stock-market-news/rh-shares-gain-over-3-as-q2-earnings-revenue-beat-expectations-93CH-3614319,https://da.gd/dFOTsA
Investing,"Citi gives Alstom a Buy rating, but warns of risks",https://www.investing.com/news/stock-market-news/citi-gives-alstom-a-buy-rating-but-warns-of-risks-3614283,https://da.gd/BlbIRL
Investing,"Adobe earnings beat by $0.12, revenue topped estimates",https://www.investing.com/news/stock-market-news/adobe-earnings-beat-by-012-revenue-topped-estimates-3614274,https://da.gd/qybm
