feed,title,long_url,short_url
Nasdaq,Netflix's Reed Hastings exercised $612 mln from stock options in 2020,https://www.nasdaq.com/articles/netflixs-reed-hastings-exercised-%24612-mln-from-stock-options-in-2020-2021-04-23,https://j.mp/2QtHBjh
Nasdaq,"GRAINS-Corn, soy extend multi-year highs on tightening global supplies",https://www.nasdaq.com/articles/grains-corn-soy-extend-multi-year-highs-on-tightening-global-supplies-2021-04-23,https://j.mp/2Pg3K44
Nasdaq,"Checking In on C3.ai, Snowflake, and ZoomInfo",https://www.nasdaq.com/articles/checking-in-on-c3.ai-snowflake-and-zoominfo-2021-04-23,https://j.mp/32InL6t
Nasdaq,Israeli police clash with Palestinians as East Jerusalem tensions flare during Ramadan,https://www.nasdaq.com/articles/israeli-police-clash-with-palestinians-as-east-jerusalem-tensions-flare-during-ramadan,https://j.mp/3aAJoKn
Nasdaq,Newmont-Barrick miner in Chile says to continue despite legal setback,https://www.nasdaq.com/articles/newmont-barrick-miner-in-chile-says-to-continue-despite-legal-setback-2021-04-23,https://j.mp/3tORdDF
