feed,title,long_url,short_url
Benzinga,"Europe EdTech and Smart Classroom Market Forecast to 2027 - COVID-19 Impact and Regional Analysis by Component, Deployment Type, and End-User",https://www.benzinga.com/pressreleases/21/01/g19181979/europe-edtech-and-smart-classroom-market-forecast-to-2027-covid-19-impact-and-regional-analysis-by,https://j.mp/3nPWyqy
Benzinga,COVID-19 Expert Panel provides science-based advice on optimizing testing and screening in Canada,https://www.benzinga.com/pressreleases/21/01/n19181957/covid-19-expert-panel-provides-science-based-advice-on-optimizing-testing-and-screening-in-canada,https://j.mp/35LUEky
Benzinga,Seizure of Contraband and Unauthorized Items at Donnacona Institution,https://www.benzinga.com/pressreleases/21/01/n19181945/seizure-of-contraband-and-unauthorized-items-at-donnacona-institution,https://j.mp/3ifYVSi
Benzinga,Application Services Expand to Meet Enterprise Demand for Digital Transformation,https://www.benzinga.com/pressreleases/21/01/b19181946/application-services-expand-to-meet-enterprise-demand-for-digital-transformation,https://j.mp/3sso4hk
Benzinga,An Homage to Nature: THOMAS SABO launches the Spring/Summer Collections 2021,https://www.benzinga.com/pressreleases/21/01/n19181886/an-homage-to-nature-thomas-sabo-launches-the-springsummer-collections-2021,https://j.mp/2NbtX2B
Benzinga,An Homage to Nature: THOMAS SABO launches the Spring/Summer Collections 2021,https://www.benzinga.com/pressreleases/21/01/n19181882/an-homage-to-nature-thomas-sabo-launches-the-springsummer-collections-2021,https://j.mp/35IUg6G
Benzinga,Driving Operational Excellence At Times of Uncertainty Through Continuous Innovation: Learn How Quantzig's Redefined Portfolio of Industrial Manufacturing Analytics Solutions Can Help Businesses Lead in the Next Normal,https://www.benzinga.com/pressreleases/21/01/b19181929/driving-operational-excellence-at-times-of-uncertainty-through-continuous-innovation-learn-how-qua,https://j.mp/2XKSjlv
Benzinga,"H&R Announces Date of Fourth Quarter 2020 Earnings Release, Conference Call and Webcast and Declares January & February 2021 Distributions",https://www.benzinga.com/pressreleases/21/01/n19181873/h-r-announces-date-of-fourth-quarter-2020-earnings-release-conference-call-and-webcast-and-declare,https://j.mp/2N2DPLH
