feed,title,long_url,short_url
Benzinga,"The global virtualized evolved packet core (vepc) market size is expected to grow from USD 3.9 billion in 2020 to USD 13.7 billion by 2026, at a Compound Annual Growth Rate (CAGR) of 22.8%",https://www.benzinga.com/pressreleases/21/02/g19633262/the-global-virtualized-evolved-packet-core-vepc-market-size-is-expected-to-grow-from-usd-3-9-billi,https://j.mp/3tMzFc1
Benzinga,"Outlook on the Gypsum, Anhydrite and Limestone Global Market to 2025 - Increase Profit Margins - ResearchAndMarkets.com",https://www.benzinga.com/pressreleases/21/02/b19633261/outlook-on-the-gypsum-anhydrite-and-limestone-global-market-to-2025-increase-profit-margins-resear,https://j.mp/373UfL2
Benzinga,"Samsung Canada launches the Chromebook 4 and Chromebook 4+: Fast, Tough, and Smart, all at the same time",https://www.benzinga.com/pressreleases/21/02/g19633186/samsung-canada-launches-the-chromebook-4-and-chromebook-4-fast-tough-and-smart-all-at-the-same-tim,https://j.mp/2OwtYyF
Benzinga,"Worldwide Automotive Artificial Intelligence Industry to 2026 - Players Include Alphabet, Intel and IBM Among Others",https://www.benzinga.com/pressreleases/21/02/g19633179/worldwide-automotive-artificial-intelligence-industry-to-2026-players-include-alphabet-intel-and-i,https://j.mp/2Zbozz6
Benzinga,"Global Smart Education & Learning Market, Forecast & Opportunities Report 2021-2026 - ResearchAndMarkets.com",https://www.benzinga.com/pressreleases/21/02/b19633177/global-smart-education-learning-market-forecast-opportunities-report-2021-2026-researchandmarkets-,https://j.mp/3jFGDea
