feed,title,long_url,short_url
SeekingAlpha,Olema stock soars 12% as FDA grants fast track status to OP-1250 for breast cancer subtype,https://seekingalpha.com/news/3859022,
SeekingAlpha,New Relic may be worth $60-$80/share in a potential sale - analysts,https://seekingalpha.com/news/3859021,
SeekingAlpha,"Columbia Banking System GAAP EPS of $0.75 misses by $0.02, revenue of $172.46M misses by $5.31M",https://seekingalpha.com/news/3859020,
SeekingAlpha,GeoPark says oil and gas production up 14% Y/Y in Q2 2022,https://seekingalpha.com/news/3859019,
SeekingAlpha,"CSX stock gains on strong earnings, analyst upgrade",https://seekingalpha.com/news/3859018,
SeekingAlpha,"East West Bancorp GAAP EPS of $1.81 beats by $0.11, revenue of $551.39M beats by $26.02M",https://seekingalpha.com/news/3859017,
SeekingAlpha,"The Fed Is Killing Your Portfolio, You Need To Save It",https://seekingalpha.com/article/4524456,
