feed,title,long_url,short_url
Investing,"Greenland residents overwhelmingly reject Trump's overtures, poll reveals",https://www.investing.com/news/stock-market-news/greenland-residents-overwhelmingly-reject-trumps-overtures-poll-reveals-93CH-3835229,https://da.gd/nbYjn
Investing,"Coinbase secures Argentina entry, aims to boost financial independence",https://www.investing.com/news/stock-market-news/coinbase-secures-argentina-entry-aims-to-boost-financial-independence-93CH-3835225,https://da.gd/Ro4KAB
Investing,Airbus opens door to new space charge in 2024 results,https://www.investing.com/news/stock-market-news/airbus-opens-door-to-new-space-charge-in-2024-results-3835221,https://da.gd/naVSNX
Investing,"Nvidia, Royal Caribbean lead Tuesday's market cap stock movers",https://www.investing.com/news/stock-market-news/nvidia-royal-caribbean-lead-tuesdays-market-cap-stock-movers-93CH-3835214,https://da.gd/ilJjy
Investing,"Microsoft, Tesla, Meta lead earnings lineup for Wednesday",https://www.investing.com/news/stock-market-news/microsoft-tesla-meta-lead-earnings-lineup-for-wednesday-93CH-3835212,https://da.gd/njb1
Investing,"Rayonier Advanced Materials Inc. rating upgraded to 'B' at S&P, outlook remains steady",https://www.investing.com/news/stock-market-news/rayonier-advanced-materials-inc-rating-upgraded-to-b-at-sp-outlook-remains-steady-93CH-3835208,https://da.gd/Ny9C8
Investing,"Fed decision, crude inventories, and trade balance data due Wednesday",https://www.investing.com/news/stock-market-news/fed-decision-crude-inventories-and-trade-balance-data-due-wednesday-93CH-3835207,https://da.gd/cxWry
Investing,Explainer-Does Trump administration's spending pause violate US law?,https://www.investing.com/news/economy-news/explainerdoes-trump-administrations-spending-pause-violate-us-law-3835231,https://da.gd/odPidB
Investing,"Nutrition programs unaffected by Trump funding freeze, White House says",https://www.investing.com/news/economy-news/nutrition-programs-unaffected-by-trump-funding-freeze-white-house-says-3835210,https://da.gd/gFZAWF
