feed,title,long_url,short_url
Nasdaq,Moderna hopes to deliver COVID vaccines to Germany faster - report,https://www.nasdaq.com/articles/moderna-hopes-to-deliver-covid-vaccines-to-germany-faster-report-2021-06-24,https://j.mp/3wRUMe4
Nasdaq,China coke futures track spot prices higher on supply worries,https://www.nasdaq.com/articles/china-coke-futures-track-spot-prices-higher-on-supply-worries-2021-06-24,https://j.mp/2T4qXYR
Nasdaq,Japan regulator grants safety approval to Chugoku Elec's reactor restart,https://www.nasdaq.com/articles/japan-regulator-grants-safety-approval-to-chugoku-elecs-reactor-restart-2021-06-24,https://j.mp/3d5cYZG
Nasdaq,Sterling takes a breather as BoE policy decision looms,https://www.nasdaq.com/articles/sterling-takes-a-breather-as-boe-policy-decision-looms-2021-06-24,https://j.mp/3qmeCLW
Nasdaq,French business confidence at 14-year high in June,https://www.nasdaq.com/articles/french-business-confidence-at-14-year-high-in-june-2021-06-24,https://j.mp/3vT25AH
Nasdaq,BOJ's Kuroda says supporting climate efforts will help economy,https://www.nasdaq.com/articles/bojs-kuroda-says-supporting-climate-efforts-will-help-economy-2021-06-24,https://j.mp/3zVOSdy
Nasdaq,Foreigners turn net buyers of Japanese stocks for the week to June 18,https://www.nasdaq.com/articles/foreigners-turn-net-buyers-of-japanese-stocks-for-the-week-to-june-18-2021-06-24,https://j.mp/3wWExMH
