feed,title,long_url,short_url
FXEmpire,"ArcelorMittal Q2 earnings beat expectations, buys Brazil’s CSP",https://www.fxempire.com/news/article/arcelormittal-q2-earnings-beat-expectations-buys-brazils-csp-1078348,https://bit.ly/3oAwum9
FXEmpire,"Analysis-After another jumbo Fed hike, some investors see glimmers of hope",https://www.fxempire.com/news/article/analysis-after-another-jumbo-fed-hike-some-investors-see-glimmers-of-hope-1078342,https://bit.ly/3J9vor3
FXEmpire,Britain says Ukraine’s counterattack in Kherson gains momentum,https://www.fxempire.com/news/article/britain-says-ukraines-counterattack-in-kherson-gains-momentum-1078346,https://bit.ly/3JedW4w
FXEmpire,"Spain’s Telefonica raises annual forecast, posts 320-million-euro Q2 profit",https://www.fxempire.com/news/article/spains-telefonica-raises-annual-forecast-posts-320-million-euro-q2-profit-1078347,https://bit.ly/3cREa0Y
FXEmpire,"Analysis-As inflation soars, European consumer goods M&A slows",https://www.fxempire.com/news/article/analysis-as-inflation-soars-european-consumer-goods-ma-slows-1078341,https://bit.ly/3OHxeAB
