feed,title,long_url,short_url
SeekingAlpha,"Houlihan Lokey Non-GAAP EPS of $1.10 beats by $0.16, revenue of $419M beats by $22.14M",https://seekingalpha.com/news/3862755,
SeekingAlpha,"World Fuel Non-GAAP EPS of $0.41 beats by $0.12, revenue of $17.12B beats by $5.03B",https://seekingalpha.com/news/3862754,
SeekingAlpha,"Eversource Energy GAAP EPS of $0.84 beats by $0.02, revenue of $2.57B beats by $280M",https://seekingalpha.com/news/3862753,
SeekingAlpha,"Kinsale Capital GAAP EPS of $1.17 misses by $0.47, revenue of $178.96M misses by $18.45M",https://seekingalpha.com/news/3862752,
SeekingAlpha,"First Western Financial GAAP EPS of $0.46 misses by $0.17, revenue of $27.08M misses by $0.78M",https://seekingalpha.com/news/3862751,
