feed,title,long_url,short_url
SeekingAlpha,"Shell Midstream Partners GAAP EPS of $0.33, revenue of $149M",https://seekingalpha.com/news/3862819,
SeekingAlpha,"TFS Financial GAAP EPS of $0.06 in-line, revenue of $76.98M beats by $11.81M",https://seekingalpha.com/news/3862818,
SeekingAlpha,"FAT Brands Non-GAAP EPS of -$0.19 beats by $0.69, revenue of $102.79M beats by $0.79M",https://seekingalpha.com/news/3862817,
SeekingAlpha,"Oceanagold Non-GAAP EPS of $0.05, revenue of $229M",https://seekingalpha.com/news/3862816,
SeekingAlpha,IMAX manages Q2 revenue beat after string of blockbusters,https://seekingalpha.com/news/3862815,
SeekingAlpha,"Professional Holding GAAP EPS of $0.50 beats by $0.10, revenue of $25M beats by $3.26M",https://seekingalpha.com/news/3862814,
SeekingAlpha,"Celanese Non-GAAP EPS of $4.99 beats by $0.43, revenue of $2.49B beats by $100M",https://seekingalpha.com/news/3862813,
