feed,title,long_url,short_url
SeekingAlpha,"Hot Stocks: QDEL COVID tests; CERN confirms ORCL deal; RUN, CGC downgrades",https://seekingalpha.com/news/3781934,
SeekingAlpha,SPDR Portfolio Emerging Markets ETF declares semi-annual distribution of $0.9491,https://seekingalpha.com/news/3781936,
SeekingAlpha,SPDR Portfolio Developed World ex-US ETF declares semi-annual distribution of $0.5981,https://seekingalpha.com/news/3781935,
SeekingAlpha,SPDR S&P China ETF declares semi-annual distribution of $0.9015,https://seekingalpha.com/news/3781933,
SeekingAlpha,SPDR S&P International Small Cap ETF declares semi-annual distribution of $0.6654,https://seekingalpha.com/news/3781932,
