feed,title,long_url,short_url
FXEmpire,Montenegro declares Russian diplomat persona non grata,https://www.fxempire.com/news/article/montenegro-declares-russian-diplomat-persona-non-grata-923334,https://bit.ly/35TL4PO
FXEmpire,TSX futures down as Ukraine conflict escalates,https://www.fxempire.com/news/article/tsx-futures-down-as-ukraine-conflict-escalates-923329,https://bit.ly/3HBVBfn
FXEmpire,Foreign minister accuses Russian soldiers of rape in Ukrainian cities,https://www.fxempire.com/news/article/foreign-minister-accuses-russian-soldiers-of-rape-in-ukrainian-cities-923338,https://bit.ly/3HHaw8h
FXEmpire,Maersk curbs Belarus cargo delveries due to Ukraine sanctions,https://www.fxempire.com/news/article/maersk-curbs-belarus-cargo-delveries-due-to-ukraine-sanctions-923333,https://bit.ly/3KehHq6
FXEmpire,Ukrainian city of Mykolayiv issues air raid warning as Russians attack,https://www.fxempire.com/news/article/ukrainian-city-of-mykolayiv-issues-air-raid-warning-as-russians-attack-923335,https://bit.ly/3vJz9yV
FXEmpire,"Moscow awaits Ukraine’s response after talks, Kremlin says",https://www.fxempire.com/news/article/moscow-awaits-ukraines-response-after-talks-kremlin-says-923337,https://bit.ly/3HJdY1Y
