feed,title,long_url,short_url
Benzinga,Check Out What Whales Are Doing With PYPL,https://benzinga.com/markets/options/22/03/26000134/check-out-what-whales-are-doing-with-pypl,https://bit.ly/3hEEDCF
Benzinga,Looking At AerCap Holdings's Recent Whale Trades,https://benzinga.com/markets/options/22/03/26000130/looking-at-aercap-holdingss-recent-whale-trades,https://bit.ly/3CctYbX
Benzinga,Check Out What Whales Are Doing With HUBS,https://benzinga.com/markets/options/22/03/26000126/check-out-what-whales-are-doing-with-hubs,https://bit.ly/3IQCtMo
Benzinga,This Is What Whales Are Betting On Roblox,https://benzinga.com/markets/options/22/03/25999380/this-is-what-whales-are-betting-on-roblox,https://bit.ly/3pFeI21
Benzinga,Check Out What Whales Are Doing With XOM,https://benzinga.com/markets/options/22/03/25999375/check-out-what-whales-are-doing-with-xom,https://bit.ly/3IJ7Rfr
