feed,title,long_url,short_url
Motley,"After the Hindenburg Report, Is Super Micro Computer Stock a Buy or a Sell?",https://www.fool.com/investing/2024/09/08/after-hindenburg-report-is-supermicro-buy-or-sell/?source=iedfolrf0000001,https://da.gd/m7Lf
Motley,Warren Buffett Is Buying Sirius XM Stock. Should You?,https://www.fool.com/investing/2024/09/08/warren-buffett-is-buying-siriusxm-stock-should-you/?source=iedfolrf0000001,https://da.gd/aB3R
Motley,"Apple Stock: Buy, Sell, or Hold?",https://www.fool.com/investing/2024/09/08/apple-stock-buy-sell-or-hold/?source=iedfolrf0000001,https://da.gd/YUAJg
Motley,"2 Nasdaq Stocks to Buy Before They Soar as Much as 141%, According to Select Wall Street Analysts",https://www.fool.com/investing/2024/09/08/2-nasdaq-stocks-wall-street-analyst/?source=iedfolrf0000001,https://da.gd/l55b
Motley,"1 Unstoppable Stock That Could Join Apple, Microsoft, Nvidia, Alphabet, Amazon, and Meta in the $1 Trillion Club by 2030",https://www.fool.com/investing/2024/09/08/1-unstoppable-stock-that-could-join-apple-microsof/?source=iedfolrf0000001,https://da.gd/mqqGA
