feed,title,long_url,short_url
SeekingAlpha,"Stericycle Non-GAAP EPS of $0.57 beats by $0.01, revenue of $664.9M misses by $11.52M",https://seekingalpha.com/news/4093970,
SeekingAlpha,Opera beats top-line and bottom-line estimates; initiates Q2 and raises FY24 outlook,https://seekingalpha.com/news/4093969,
SeekingAlpha,DTE Energy GAAP EPS of $1.67,https://seekingalpha.com/news/4093968,
SeekingAlpha,"Traditions Bancorp GAAP EPS of $0.49, revenue of $6.42M",https://seekingalpha.com/news/4093967,
SeekingAlpha,"Arch Resources GAAP EPS of $2.98 beats by $0.10, revenue of $680.19M beats by $82.24M",https://seekingalpha.com/news/4093966,
SeekingAlpha,"Nasdaq Non-GAAP EPS of $0.63 misses by $0.02, revenue of $1.12B in-line",https://seekingalpha.com/news/4093965,
