feed,title,long_url,short_url
SeekingAlpha,"United Bankshares GAAP EPS of $0.64 misses by $0.01, revenue of $255.57M misses by $1.98M",https://seekingalpha.com/news/4094031,
SeekingAlpha,BHP bid for Anglo American makes strategic sense but would face high hurdles,https://seekingalpha.com/news/4094030,
SeekingAlpha,Bristol-Myers posts Q1 beat despite growth headwinds,https://seekingalpha.com/news/4094029,
SeekingAlpha,"Tractor Supply GAAP EPS of $1.83 beats by $0.11, revenue of $3.39B misses by $10M",https://seekingalpha.com/news/4094028,
SeekingAlpha,"TriCo Bancshares GAAP EPS of $0.83, revenue of $98.5M",https://seekingalpha.com/news/4094027,
SeekingAlpha,ZROZ Vs. EDV: Which Zero Coupon Treasury ETF Is Better?,https://seekingalpha.com/article/4686055,
