feed,title,long_url,short_url
SeekingAlpha,Hess Midstream Partners reports mixed Q1 results; reaffirms FY24 outlook,https://seekingalpha.com/news/4094038,
SeekingAlpha,"Shyft Non-GAAP EPS of -$0.04 beats by $0.13, revenue of $197.9M beats by $13.62M",https://seekingalpha.com/news/4094035,
SeekingAlpha,GE Vernova reports Q1 results,https://seekingalpha.com/news/4094034,
SeekingAlpha,"FTI Consulting GAAP EPS of $2.23 beats by $0.48, revenue of $928.55M beats by $26.78M",https://seekingalpha.com/news/4094032,
SeekingAlpha,Newmont in charts: Gold sales and production rose more than 30% Y/Y in Q1,https://seekingalpha.com/news/4094033,
