feed,title,long_url,short_url
SeekingAlpha,"Comfort Systems GAAP EPS of $2.69 beats by $0.69, revenue of $1.53B beats by $60M",https://seekingalpha.com/news/4094512,
SeekingAlpha,"The Hartford  Non-GAAP EPS of $2.34 misses by $0.10, revenue of $6.42B misses by $70M",https://seekingalpha.com/news/4094511,
SeekingAlpha,Earnings Summary: Intel issues weak guidance,https://seekingalpha.com/news/4094509,
SeekingAlpha,Gilead Sciences in charts: Revenue from oncology rises most among products; Veklury dips in Q1,https://seekingalpha.com/news/4094488,
SeekingAlpha,"Alphabet jumps 12% as YouTube, search drive easy revenue beat",https://seekingalpha.com/news/4094507,
SeekingAlpha,"L3Harris Technologies Non-GAAP EPS of $3.06 beats by $0.15, revenue of $5.21B beats by $130M",https://seekingalpha.com/news/4094510,
SeekingAlpha,"Edwards Lifesciences Non-GAAP EPS of $0.66 beats by $0.02, revenue of $1.6B beats by $30M",https://seekingalpha.com/news/4094508,
