feed,title,long_url,short_url
SeekingAlpha,Invesco Russell 1000 Equal Weight ETF declares quarterly distribution of $0.1690,https://seekingalpha.com/news/4119320,
SeekingAlpha,Invesco FTSE RAFI US 1500 Small-Mid ETF declares quarterly distribution of $0.1562,https://seekingalpha.com/news/4119319,
SeekingAlpha,Invesco FTSE RAFI US 1000 ETF declares quarterly distribution of $0.1732,https://seekingalpha.com/news/4119318,
SeekingAlpha,"Volkswagen to recall over 271,000 U.S. vehicles over airbag issue",https://seekingalpha.com/news/4119317,
SeekingAlpha,Invesco Dynamic Large Cap Value ETF declares quarterly distribution of $0.3201,https://seekingalpha.com/news/4119316,
SeekingAlpha,Invesco Dynamic Large Cap Growth ETF declares quarterly distribution of $0.0080,https://seekingalpha.com/news/4119315,
SeekingAlpha,BUZZ Investing: U.S. Stocks Rally As Nvidia Climbs Higher,https://seekingalpha.com/article/4701104,
