feed,title,long_url,short_url
Investing,UBS: Equities should stay supported despite tech-led volatility,https://www.investing.com/news/stock-market-news/ubs-equities-should-stay-supported-despite-techled-volatility-3496903,https://da.gd/Kzs1
Investing,"Nvidia set to benefit from ""wave"" of enterprise demand for AI agents - Citi",https://www.investing.com/news/stock-market-news/nvidia-set-to-benefit-from-wave-of-enterprise-demand-for-ai-agents--citi-3497153,https://da.gd/ctEAB
Investing,Rivian jumps on Volkswagen's $5 billion 'vote of confidence' investment,https://www.investing.com/news/stock-market-news/rivian-jumps-on-volkswagens-5-billion-vote-of-confidence-investment-3497151,https://da.gd/87hCA
Investing,"FedEx, Rivian, Whirlpool rise premarket; Southwest Airlines, Chipotle fall",https://www.investing.com/news/stock-market-news/fedex-rivian-whirlpool-rise-premarket-southwest-airlines-chipotle-fall-3497134,https://da.gd/r8zgu
Investing,Southwest lowers second-quarter unit revenue forecast,https://www.investing.com/news/stock-market-news/southwest-revises-secondquarter-unit-revenue-forecast-3497125,https://da.gd/84EVBR
Investing,"Euro zone yields edge up before inflation data, caution over France",https://www.investing.com/news/economy-news/euro-zone-yields-edge-up-before-inflation-data-caution-over-france-3497152,https://da.gd/E0Lpa
Investing,Five things to know as India enters JPMorgan EM debt index,https://www.investing.com/news/economy-news/five-things-to-know-as-india-enters-jpmorgan-em-debt-index-3497132,https://da.gd/pzoAQJ
