feed,title,long_url,short_url
SeekingAlpha,WisdomTree Europe Hedged SmallCap Equity Fund declares quarterly distribution of $1.0150,https://seekingalpha.com/news/4119380,
SeekingAlpha,SolarEdge prices $300M convertible debt offering,https://seekingalpha.com/news/4119379,
SeekingAlpha,"Leviathan partners plan to expand capacity, as Israel approves more gas exports",https://seekingalpha.com/news/4119378,
SeekingAlpha,Earnings Summary: General Mills reports mixed Q4 results; initiates FY25 outlook,https://seekingalpha.com/news/4119377,
SeekingAlpha,WisdomTree Europe Hedged Equity Fund declares quarterly distribution of $1.1350,https://seekingalpha.com/news/4119376,
