feed,title,long_url,short_url
Investing,"Australia considering price floor to support critical minerals projects, minister says",https://www.investing.com/news/commodities-news/australia-considering-price-floor-to-support-critical-minerals-projects-minister-says-4169148,
Investing,"Core Scientific shareholders balk at terms of CoreWeave merger offer, FT reports",https://www.investing.com/news/stock-market-news/core-scientific-shareholders-balk-at-terms-of-coreweave-merger-offer-ft-reports-4169150,
Investing,Startup Anduril becomes third U.S. SRM supplier amid rising defense demand,https://www.investing.com/news/stock-market-news/startup-anduril-becomes-third-us-srm-supplier-amid-rising-defense-demand-4169149,
Investing,Saudi non-oil private sector adds jobs despite easing output growth - PMI,https://www.investing.com/news/economic-indicators/saudi-nonoil-private-sector-adds-jobs-despite-easing-output-growth--pmi-4169151,
Investing,"Indonesia Q2 GDP growth at 5.12% y/y, beats expectations",https://www.investing.com/news/economy-news/indonesia-q2-gdp-growth-at-512-yy-beats-expectations-4169152,
