feed,title,long_url,short_url
InsiderMonkey,Jim Cramer on Shake Shack: “Terrific Company With a Stock That Took a Real Header”,https://insidermonkey.com/blog/--1583845,
InsiderMonkey,Jim Cramer Breaks Down the Selloff in Align Technology Stock,https://insidermonkey.com/blog/--1583847,
InsiderMonkey,Jim Cramer Shares His Take on TeraWulf,https://insidermonkey.com/blog/--1583849,
InsiderMonkey,Jim Cramer Calls Lincoln Educational a “Pretty Expensive Stock”,https://insidermonkey.com/blog/--1583851,
InsiderMonkey,Jim Cramer on Core Scientific: “We’re Done With That One”,https://insidermonkey.com/blog/--1583854,
InsiderMonkey,Jim Cramer on Bitmine Immersion: “We Don’t Play That Game”,https://insidermonkey.com/blog/--1583857,
InsiderMonkey,Jim Cramer on Lam Research: “Let it Come in And Then Do Some Buying”,https://insidermonkey.com/blog/--1583859,
InsiderMonkey,Jim Cramer Notes “CoreWeave Was Good”,https://insidermonkey.com/blog/--1583862,
InsiderMonkey,"Jim Cramer on Agnico Eagle: “One of the Best Operators in Space, Maybe the Best”",https://insidermonkey.com/blog/--1583864,
InsiderMonkey,Jim Cramer Defends Fair Isaac After 6% Dip Driven by Regulatory Headwinds,https://insidermonkey.com/blog/--1583866,
InsiderMonkey,Jim Cramer on Carvana: “It Just Keeps Winning”,https://insidermonkey.com/blog/--1583868,
InsiderMonkey,Jim Cramer Questions Spotify’s Latest Numbers,https://insidermonkey.com/blog/--1583872,
InsiderMonkey,Jim Cramer on Wendy’s: “They Got so Much Wrong”,https://insidermonkey.com/blog/--1583876,
InsiderMonkey,"Jim Cramer on Apple: “Own it, Don’t Trade It”",https://insidermonkey.com/blog/--1583879,
InsiderMonkey,Jim Cramer on Amazon: “It’s Just Going to Be Another Buy”,https://insidermonkey.com/blog/--1583887,
InsiderMonkey,Jim Cramer Highlights Meta’s AI Investment and Strong Earnings Beat,https://insidermonkey.com/blog/--1583891,
InsiderMonkey,Jim Cramer Highlights Microsoft’s $4 Trillion Moment and AI-Driven Strength,https://insidermonkey.com/blog/--1583894,
InsiderMonkey,Jim Cramer Calls Out Figma Valuation as Detached From Fundamentals,https://insidermonkey.com/blog/--1583898,
InsiderMonkey,AGCO (AGCO) Declares $0.29 Quarterly Dividend for September 2025,https://insidermonkey.com/blog/--1583690,
InsiderMonkey,"RBC Capital Raises Nutrien (NTR) Price Target to $70, Keeps “Outperform”",https://insidermonkey.com/blog/--1583705,
