feed,title,long_url,short_url
Investing,The Crypto Market Is in No Hurry to Gain Ground,https://www.investing.com/analysis/the-crypto-market-is-in-no-hurry-to-gain-ground-200677970,
Investing,3 Sectors to Buy While They’re Down and 1 to Walk Away From,https://www.investing.com/analysis/3-sectors-to-buy-while-theyre-down-and-1-to-walk-away-from-200677987,
Investing,"Colruyt shares fall as UBS cuts rating to ‘neutral’ on margin, competition woes",https://www.investing.com/news/stock-market-news/colruyt-shares-fall-as-ubs-cuts-rating-to-neutral-on-margin-competition-woes-4600527,
Investing,Barclays: Packaged Food Companies Pull Back on Promotions After Disappointing Returns,https://www.investing.com/news/stock-market-news/barclays-packaged-food-companies-pull-back-on-promotions-after-disappointing-returns-93CH-4600525,
Investing,"Baird: Plastic resin prices jump 30% year-to-date, further gains expected",https://www.investing.com/news/stock-market-news/baird-plastic-resin-prices-jump-30-yeartodate-further-gains-expected-93CH-4600509,
Investing,TSX futures point lower with Trump’s deadline fast approaching,https://www.investing.com/news/stock-market-news/tsx-futures-point-lower-with-trumps-deadline-fast-approaching-4600505,
Investing,US core capital goods orders increase in February,https://www.investing.com/news/economic-indicators/us-core-capital-goods-orders-increase-in-february-4600508,
Investing,Danone CEO says Iran war may lead to higher food prices,https://www.investing.com/news/economy-news/danone-ceo-says-iran-war-may-lead-to-higher-food-prices-4600524,
Investing,"Williams expects 2026 inflation at 2.75%, cites war impact",https://www.investing.com/news/economy-news/williams-expects-2026-inflation-at-275-cites-war-impact-93CH-4600504,
