feed,title,long_url,short_url
Investing,RLX Technology stock rises after share repurchase program extension,https://www.investing.com/news/stock-market-news/rlx-technology-stock-rises-after-share-repurchase-program-extension-93CH-4426626,
Investing,Marti stock rises as ride-hailing service surpasses year-end targets,https://www.investing.com/news/stock-market-news/marti-stock-rises-as-ridehailing-service-surpasses-yearend-targets-93CH-4426625,
Investing,Cable One stock falls after CEO transition announcement,https://www.investing.com/news/stock-market-news/cable-one-stock-falls-after-ceo-transition-announcement-93CH-4426620,
Investing,Laser Photonics stock rises after regaining Nasdaq compliance,https://www.investing.com/news/stock-market-news/laser-photonics-stock-rises-after-regaining-nasdaq-compliance-93CH-4426618,
Investing,Bioatla stock rises after $40 million SPV deal to advance cancer drug,https://www.investing.com/news/stock-market-news/bioatla-stock-rises-after-40-million-spv-deal-to-advance-cancer-drug-93CH-4426614,
Investing,"Wall Street opens subdued in last session of 2025, eyes yearly gains",https://www.investing.com/news/stock-market-news/wall-street-opens-subdued-in-last-session-of-2025-eyes-yearly-gains-4426613,
