feed,title,long_url,short_url
FXEmpire,France’s Attal says: French companies must implement sanctions against Russia,https://www.fxempire.com/news/article/frances-attal-says-french-companies-must-implement-sanctions-against-russia-934796,https://bit.ly/37pFQf7
FXEmpire,Ocado strikes tech deal with Auchan Poland,https://www.fxempire.com/news/article/ocado-strikes-tech-deal-with-auchan-poland-934801,https://bit.ly/3MQxLk1
FXEmpire,Imperial Brands flags small profit hit from Russia exit,https://www.fxempire.com/news/article/imperial-brands-flags-small-profit-hit-from-russia-exit-934797,https://bit.ly/36j6Cpc
FXEmpire,U.S. troops in S.Korea step up missile defence drills amid signs of N.Korea test,https://www.fxempire.com/news/article/u-s-troops-in-s-korea-step-up-missile-defence-drills-amid-signs-of-n-korea-test-934798,https://bit.ly/3w6GU1T
FXEmpire,"Volkswagen sold 2 million fewer cars due to chips, warns supply chain troubles not over",https://www.fxempire.com/news/article/volkswagen-sold-2-million-fewer-cars-due-to-chips-warns-supply-chain-troubles-not-over-934799,https://bit.ly/3KGfeFa
FXEmpire,Ukraine aims to deliver aid to Mariupol and open more humanitarian corridors,https://www.fxempire.com/news/article/ukraine-aims-to-deliver-aid-to-mariupol-and-open-more-humanitarian-corridors-934800,https://bit.ly/3J8XvFY
FXEmpire,Car distributor Inchcape begins transition of Russia operations,https://www.fxempire.com/news/article/car-distributor-inchcape-begins-transition-of-russia-operations-934803,https://bit.ly/3w8lCkC
FXEmpire,Informa reports higher 2021 profit as events resume after pandemic gloom,https://www.fxempire.com/news/article/informa-reports-higher-2021-profit-as-events-resume-after-pandemic-gloom-934804,https://bit.ly/3MNXQQL
