feed,title,long_url,short_url
FXEmpire,"SoftBank execs to leave boards of India’s Paytm, Policybazaar – source",https://www.fxempire.com/news/article/softbank-execs-to-leave-boards-of-indias-paytm-policybazaar-source-935221,https://bit.ly/3IeSHgS
FXEmpire,"U.S.-listed China stocks fall on COVID surge, Russia",https://www.fxempire.com/news/article/u-s-listed-china-stocks-fall-on-covid-surge-russia-935222,https://bit.ly/3IeDCfw
FXEmpire,Analysis-BoE’s Bailey heads into tough third year with criticisms ringing,https://www.fxempire.com/news/article/analysis-boes-bailey-heads-into-tough-third-year-with-criticisms-ringing-935213,https://bit.ly/3MQ6T3y
FXEmpire,Credit Suisse says 11 claims filed in Greensill funds case,https://www.fxempire.com/news/article/credit-suisse-says-11-claims-filed-in-greensill-funds-case-935212,https://bit.ly/3MNLFmW
FXEmpire,Germany’s Scholz urges immediate ceasefire in Ukraine,https://www.fxempire.com/news/article/germanys-scholz-urges-immediate-ceasefire-in-ukraine-935203,https://bit.ly/3MQ05mC
FXEmpire,Jordan’s Abdullah says Ukraine should not derail Mideast peace,https://www.fxempire.com/news/article/jordans-abdullah-says-ukraine-should-not-derail-mideast-peace-935204,https://bit.ly/3CLoqoM
FXEmpire,Futures edge higher ahead of Fed meeting,https://www.fxempire.com/news/article/futures-edge-higher-ahead-of-fed-meeting-935199,https://bit.ly/35Zzing
FXEmpire,Slovakia charges two people with espionage for Russia,https://www.fxempire.com/news/article/slovakia-charges-two-people-with-espionage-for-russia-935205,https://bit.ly/3Id0kEN
