feed,title,long_url,short_url
Cointelegraph,Maker DeFi lending protocol rebrands to Sky ahead of USDS stablecoin launch,https://cointelegraph.com/news/maker-rebrands-sky-launches-usds-sky-token?utm_source=rss_feed&utm_medium=rss%3F1724761593736&utm_campaign=rss_partner_inbound,https://da.gd/7AhvE
Cointelegraph,BTC price warning: Binance ‘wants blood’ amid sub-$60K Bitcoin target,https://cointelegraph.com/news/btc-price-warning-binance-sub-60k-bitcoin-target?utm_source=rss_feed&utm_medium=rss%3F1724761593736&utm_campaign=rss_partner_inbound,https://da.gd/n4u93
Cointelegraph,Bitcoin 3-year chart pattern nears breakout point as analyst expects 312% ROI,https://cointelegraph.com/news/bitcoin-3-year-chart-pattern-breakout-analyst-roi?utm_source=rss_feed&utm_medium=rss%3F1724761593736&utm_campaign=rss_partner_inbound,https://da.gd/zLcdM
Cointelegraph,"Rise of Telegram Mini Apps: How it started, and how it’s going",https://cointelegraph.com/news/telegram-mini-apps-rise-ton-foundation?utm_source=rss_feed&utm_medium=rss%3F1724761593736&utm_campaign=rss_partner_inbound,https://da.gd/gTXHbE
Cointelegraph,"Celsius distributes $2.5B to 251,000 creditors amid bankruptcy proceedings",https://cointelegraph.com/news/celsius-bankruptcy-returns-2-53-billion-creditors?utm_source=rss_feed&utm_medium=rss%3F1724761593736&utm_campaign=rss_partner_inbound,https://da.gd/Qph9
Cointelegraph,AI tokens market cap rebound 79.7% to $32B amid renewed investor confidence,https://cointelegraph.com/news/ai-big-data-crypto-market-recovery-aug?utm_source=rss_feed&utm_medium=rss%3F1724761593736&utm_campaign=rss_partner_inbound,https://da.gd/b1MP
Cointelegraph,New Zealand introduces OECD crypto reporting framework in new tax bill,https://cointelegraph.com/news/new-zealand-crypto-reporting-oecd-framework?utm_source=rss_feed&utm_medium=rss%3F1724761593736&utm_campaign=rss_partner_inbound,https://da.gd/5iskT
Cointelegraph,Telegram CEO Pavel Durov’s arrest has worrying implications for crypto,https://cointelegraph.com/news/telegram-ceo-durov-arrest-privacy-crypto?utm_source=rss_feed&utm_medium=rss%3F1724761593736&utm_campaign=rss_partner_inbound,https://da.gd/ZAI09
Cointelegraph,White hat ‘SEAL’ team protecting from crypto hacks surpasses 900 investigations,https://cointelegraph.com/news/ethical-hackers-alliance-crypto-hack-protection?utm_source=rss_feed&utm_medium=rss%3F1724761593736&utm_campaign=rss_partner_inbound,https://da.gd/aagtKt
Cointelegraph,"Bitcoin’s ‘most interesting monthly candle’ emerges, but don’t celebrate yet",https://cointelegraph.com/news/bitcoin-most-interesting-monthly-candle-emerges-dont-celebrate-yet?utm_source=rss_feed&utm_medium=rss%3F1724761593736&utm_campaign=rss_partner_inbound,https://da.gd/J3x8
Cointelegraph,Bitcoin millionaires surge 111% in a year amid crypto rally,https://cointelegraph.com/news/bitcoin-millionaires-surge-111-in-year-amid-crypto-rally?utm_source=rss_feed&utm_medium=rss%3F1724761593736&utm_campaign=rss_partner_inbound,https://da.gd/cqZfff
Cointelegraph,BlackRock ETF sees biggest inflow in 35 days as Bitcoin weekly rally pauses,https://cointelegraph.com/news/blackrock-bitcoin-etf-monthly-record-inflow-btc-under-64k?utm_source=rss_feed&utm_medium=rss%3F1724761593736&utm_campaign=rss_partner_inbound,https://da.gd/q6C5O
Cointelegraph,Elon Musk voices support for sweeping AI safety regulations,https://cointelegraph.com/news/elon-musk-supports-sweeping-ai-safety-regulations?utm_source=rss_feed&utm_medium=rss%3F1724761593736&utm_campaign=rss_partner_inbound,https://da.gd/JKxK1
Cointelegraph,Bitcoin poised for $150K ‘batshit season’ but sellers could dent rally,https://cointelegraph.com/news/bitcoin-entering-batshit-season-banana-zone-says-analyst?utm_source=rss_feed&utm_medium=rss%3F1724761593736&utm_campaign=rss_partner_inbound,https://da.gd/Pum38
Cointelegraph,Mark Zuckerberg says he ‘regrets’ bowing to COVID-19 censorship pressure,https://cointelegraph.com/news/meta-zuckerberg-regrets-bowing-government-covid-19-censorship?utm_source=rss_feed&utm_medium=rss%3F1724761593736&utm_campaign=rss_partner_inbound,https://da.gd/rdpVO
Cointelegraph,"Martin Shkreli must give up copies of one-off Wu-Tang album, says judge",https://cointelegraph.com/news/martin-shkreli-must-cede-wu-tang-album-copies-judge?utm_source=rss_feed&utm_medium=rss%3F1724761593736&utm_campaign=rss_partner_inbound,https://da.gd/6DX9r
Cointelegraph,SEC charges siblings over $60M Ponzi touting crypto trading bot,https://cointelegraph.com/news/sec-charges-2-brothers-over-60-million-crypto-trading-bot-ponzi?utm_source=rss_feed&utm_medium=rss%3F1724761593736&utm_campaign=rss_partner_inbound,https://da.gd/YFIpn9
Cointelegraph,Base hits 1M daily active addresses as Basenames takes off,https://cointelegraph.com/news/base-hits-1-million-daily-active-addresses-as-basenames-takes-off?utm_source=rss_feed&utm_medium=rss%3F1724761593736&utm_campaign=rss_partner_inbound,https://da.gd/6qsZcf
Cointelegraph,Trump and New York governor propose shift to nuclear energy,https://cointelegraph.com/news/president-trump-new-york-governor-propose-shift-nuclear-energy?utm_source=rss_feed&utm_medium=rss%3F1724761593736&utm_campaign=rss_partner_inbound,https://da.gd/VF52Z1
Cointelegraph,PayPal’s PYUSD stablecoin hits $1B market cap,https://cointelegraph.com/news/paypal-pyusd-stablecoin-1-billion-market-cap?utm_source=rss_feed&utm_medium=rss%3F1724761593736&utm_campaign=rss_partner_inbound,https://da.gd/qOQm
Cointelegraph,Cyberattacks target French government websites: Report,https://cointelegraph.com/news/cyberattacks-target-french-government-websites-report?utm_source=rss_feed&utm_medium=rss%3F1724761593736&utm_campaign=rss_partner_inbound,https://da.gd/DUXD
Cointelegraph,Telegram CEO Pavel Durov arrested in France: Law Decoded,https://cointelegraph.com/news/telegram-ceo-pavel-durov-arrested-france-law-decoded?utm_source=rss_feed&utm_medium=rss%3F1724761593736&utm_campaign=rss_partner_inbound,https://da.gd/sGzYi
Cointelegraph,Abra settles with SEC over unregistered securities charges,https://cointelegraph.com/news/sec-abra-unregistered-crypto-securities?utm_source=rss_feed&utm_medium=rss%3F1724761593736&utm_campaign=rss_partner_inbound,https://da.gd/RnQWFT
Cointelegraph,Bitcoin’s weekend rally fizzles under $64K — Pro traders take neutral positions,https://cointelegraph.com/news/bitcoin-s-weekend-rally-fizzles-and-under-64-k-pro-traders-take-neutral-positions?utm_source=rss_feed&utm_medium=rss%3F1724761593736&utm_campaign=rss_partner_inbound,https://da.gd/NIjIR
Cointelegraph,Rumpel Labs to launch platform for tokenizing airdrop points,https://cointelegraph.com/news/rumpel-labs-launch-platform-tokenizing-airdrop-points?utm_source=rss_feed&utm_medium=rss%3F1724761593736&utm_campaign=rss_partner_inbound,https://da.gd/KuHYp0
Cointelegraph,Here’s what happened in crypto today,https://cointelegraph.com/news/what-happened-in-crypto-today?utm_source=rss_feed&utm_medium=rss%3F1724761593736&utm_campaign=rss_partner_inbound,https://da.gd/dC4B
Cointelegraph,Bitcoin miner Rhodium files for bankruptcy in Texas court,https://cointelegraph.com/news/bitcoin-miner-rhodium-files-bankruptcy-texas?utm_source=rss_feed&utm_medium=rss%3F1724761593736&utm_campaign=rss_partner_inbound,https://da.gd/ms9QE
Cointelegraph,Telegram is under investigation in India: Report,https://cointelegraph.com/news/telegram-under-investigation-india-report?utm_source=rss_feed&utm_medium=rss%3F1724761593736&utm_campaign=rss_partner_inbound,https://da.gd/baCkZ
Cointelegraph,"Price analysis 8/26: SPX, DXY, BTC, ETH, BNB, SOL, XRP, DOGE, TON, ADA",https://cointelegraph.com/news/price-analysis-8-26-spx-dxy-btc-eth-bnb-sol-xrp-doge-ton-ada?utm_source=rss_feed&utm_medium=rss%3F1724761593736&utm_campaign=rss_partner_inbound,https://da.gd/PQHGKh
Cointelegraph,US authorities oppose ex-FTX exec’s motion to void plea deal,https://cointelegraph.com/news/ftx-exec-motion-void-plea-deal-opposed?utm_source=rss_feed&utm_medium=rss%3F1724761593736&utm_campaign=rss_partner_inbound,https://da.gd/22aLH
