feed,title,long_url,short_url
Cointelegraph,Nigeria’s SEC issues first license to local crypto exchange,https://cointelegraph.com/news/quidax-first-nigerian-sec-licensed-crypto-exchange?utm_source=rss_feed&utm_medium=rss%3F1724763749507&utm_campaign=rss_partner_inbound,https://da.gd/sIO3
Cointelegraph,Here’s what happened in crypto today,https://cointelegraph.com/news/what-happened-in-crypto-today?utm_source=rss_feed&utm_medium=rss%3F1724763749507&utm_campaign=rss_partner_inbound,https://da.gd/DDl2MQ
Cointelegraph,Binance under scrutiny for seizing Palestinian crypto funds,https://cointelegraph.com/news/binance-seize-funds-palestine-israel?utm_source=rss_feed&utm_medium=rss%3F1724763749507&utm_campaign=rss_partner_inbound,https://da.gd/5hk3ro
Cointelegraph,CoinDCX’s Okto wallet secures operational license in UAE free zone,https://cointelegraph.com/news/okto-wallet-uae-license-web3-adoption?utm_source=rss_feed&utm_medium=rss%3F1724763749507&utm_campaign=rss_partner_inbound,https://da.gd/xbpR
Cointelegraph,Maker DeFi lending protocol rebrands to Sky ahead of USDS stablecoin launch,https://cointelegraph.com/news/maker-rebrands-sky-launches-usds-sky-token?utm_source=rss_feed&utm_medium=rss%3F1724763749507&utm_campaign=rss_partner_inbound,https://da.gd/nR3MI
Cointelegraph,BTC price warning: Binance ‘wants blood’ amid sub-$60K Bitcoin target,https://cointelegraph.com/news/btc-price-warning-binance-sub-60k-bitcoin-target?utm_source=rss_feed&utm_medium=rss%3F1724763749507&utm_campaign=rss_partner_inbound,https://da.gd/quc03
Cointelegraph,Bitcoin 3-year chart pattern nears breakout point as analyst expects 312% ROI,https://cointelegraph.com/news/bitcoin-3-year-chart-pattern-breakout-analyst-roi?utm_source=rss_feed&utm_medium=rss%3F1724763749507&utm_campaign=rss_partner_inbound,https://da.gd/rQ9nCr
Cointelegraph,"Rise of Telegram Mini Apps: How it started, and how it’s going",https://cointelegraph.com/news/telegram-mini-apps-rise-ton-foundation?utm_source=rss_feed&utm_medium=rss%3F1724763749507&utm_campaign=rss_partner_inbound,https://da.gd/fOOEK5
Cointelegraph,"Celsius distributes $2.5B to 251,000 creditors amid bankruptcy proceedings",https://cointelegraph.com/news/celsius-bankruptcy-returns-2-53-billion-creditors?utm_source=rss_feed&utm_medium=rss%3F1724763749507&utm_campaign=rss_partner_inbound,https://da.gd/bdzWJI
Cointelegraph,AI tokens market cap rebound 79.7% to $32B amid renewed investor confidence,https://cointelegraph.com/news/ai-big-data-crypto-market-recovery-aug?utm_source=rss_feed&utm_medium=rss%3F1724763749507&utm_campaign=rss_partner_inbound,https://da.gd/HYZQE
Cointelegraph,New Zealand introduces OECD crypto reporting framework in new tax bill,https://cointelegraph.com/news/new-zealand-crypto-reporting-oecd-framework?utm_source=rss_feed&utm_medium=rss%3F1724763749507&utm_campaign=rss_partner_inbound,https://da.gd/yiBQD9
Cointelegraph,Telegram CEO Pavel Durov’s arrest has worrying implications for crypto,https://cointelegraph.com/news/telegram-ceo-durov-arrest-privacy-crypto?utm_source=rss_feed&utm_medium=rss%3F1724763749507&utm_campaign=rss_partner_inbound,https://da.gd/24XG
Cointelegraph,White hat ‘SEAL’ team protecting from crypto hacks surpasses 900 investigations,https://cointelegraph.com/news/ethical-hackers-alliance-crypto-hack-protection?utm_source=rss_feed&utm_medium=rss%3F1724763749507&utm_campaign=rss_partner_inbound,https://da.gd/67gxM
Cointelegraph,"Bitcoin’s ‘most interesting monthly candle’ emerges, but don’t celebrate yet",https://cointelegraph.com/news/bitcoin-most-interesting-monthly-candle-emerges-dont-celebrate-yet?utm_source=rss_feed&utm_medium=rss%3F1724763749507&utm_campaign=rss_partner_inbound,https://da.gd/ghqZ8
Cointelegraph,Bitcoin millionaires surge 111% in a year amid crypto rally,https://cointelegraph.com/news/bitcoin-millionaires-surge-111-in-year-amid-crypto-rally?utm_source=rss_feed&utm_medium=rss%3F1724763749507&utm_campaign=rss_partner_inbound,https://da.gd/r7KBd8
Cointelegraph,BlackRock ETF sees biggest inflow in 35 days as Bitcoin weekly rally pauses,https://cointelegraph.com/news/blackrock-bitcoin-etf-monthly-record-inflow-btc-under-64k?utm_source=rss_feed&utm_medium=rss%3F1724763749507&utm_campaign=rss_partner_inbound,https://da.gd/ustBi3
Cointelegraph,Elon Musk voices support for sweeping AI safety regulations,https://cointelegraph.com/news/elon-musk-supports-sweeping-ai-safety-regulations?utm_source=rss_feed&utm_medium=rss%3F1724763749507&utm_campaign=rss_partner_inbound,https://da.gd/sNiNh
Cointelegraph,Bitcoin poised for $150K ‘batshit season’ but sellers could dent rally,https://cointelegraph.com/news/bitcoin-entering-batshit-season-banana-zone-says-analyst?utm_source=rss_feed&utm_medium=rss%3F1724763749507&utm_campaign=rss_partner_inbound,https://da.gd/yxoN0y
Cointelegraph,Mark Zuckerberg says he ‘regrets’ bowing to COVID-19 censorship pressure,https://cointelegraph.com/news/meta-zuckerberg-regrets-bowing-government-covid-19-censorship?utm_source=rss_feed&utm_medium=rss%3F1724763749507&utm_campaign=rss_partner_inbound,https://da.gd/7vwfj
Cointelegraph,"Martin Shkreli must give up copies of one-off Wu-Tang album, says judge",https://cointelegraph.com/news/martin-shkreli-must-cede-wu-tang-album-copies-judge?utm_source=rss_feed&utm_medium=rss%3F1724763749507&utm_campaign=rss_partner_inbound,https://da.gd/Dtmp
Cointelegraph,SEC charges siblings over $60M Ponzi touting crypto trading bot,https://cointelegraph.com/news/sec-charges-2-brothers-over-60-million-crypto-trading-bot-ponzi?utm_source=rss_feed&utm_medium=rss%3F1724763749507&utm_campaign=rss_partner_inbound,https://da.gd/HKWcG
Cointelegraph,Base hits 1M daily active addresses as Basenames takes off,https://cointelegraph.com/news/base-hits-1-million-daily-active-addresses-as-basenames-takes-off?utm_source=rss_feed&utm_medium=rss%3F1724763749507&utm_campaign=rss_partner_inbound,https://da.gd/lgDjpE
Cointelegraph,Trump and New York governor propose shift to nuclear energy,https://cointelegraph.com/news/president-trump-new-york-governor-propose-shift-nuclear-energy?utm_source=rss_feed&utm_medium=rss%3F1724763749507&utm_campaign=rss_partner_inbound,https://da.gd/yUH5X
Cointelegraph,PayPal’s PYUSD stablecoin hits $1B market cap,https://cointelegraph.com/news/paypal-pyusd-stablecoin-1-billion-market-cap?utm_source=rss_feed&utm_medium=rss%3F1724763749507&utm_campaign=rss_partner_inbound,https://da.gd/OrhaK
Cointelegraph,Cyberattacks target French government websites: Report,https://cointelegraph.com/news/cyberattacks-target-french-government-websites-report?utm_source=rss_feed&utm_medium=rss%3F1724763749507&utm_campaign=rss_partner_inbound,https://da.gd/pwPaL
Cointelegraph,Telegram CEO Pavel Durov arrested in France: Law Decoded,https://cointelegraph.com/news/telegram-ceo-pavel-durov-arrested-france-law-decoded?utm_source=rss_feed&utm_medium=rss%3F1724763749507&utm_campaign=rss_partner_inbound,https://da.gd/lAIJsS
Cointelegraph,Abra settles with SEC over unregistered securities charges,https://cointelegraph.com/news/sec-abra-unregistered-crypto-securities?utm_source=rss_feed&utm_medium=rss%3F1724763749507&utm_campaign=rss_partner_inbound,https://da.gd/d2c8ij
Cointelegraph,Bitcoin’s weekend rally fizzles under $64K — Pro traders take neutral positions,https://cointelegraph.com/news/bitcoin-s-weekend-rally-fizzles-and-under-64-k-pro-traders-take-neutral-positions?utm_source=rss_feed&utm_medium=rss%3F1724763749507&utm_campaign=rss_partner_inbound,https://da.gd/atOj08
Cointelegraph,Rumpel Labs to launch platform for tokenizing airdrop points,https://cointelegraph.com/news/rumpel-labs-launch-platform-tokenizing-airdrop-points?utm_source=rss_feed&utm_medium=rss%3F1724763749507&utm_campaign=rss_partner_inbound,https://da.gd/AuGea
Cointelegraph,Bitcoin miner Rhodium files for bankruptcy in Texas court,https://cointelegraph.com/news/bitcoin-miner-rhodium-files-bankruptcy-texas?utm_source=rss_feed&utm_medium=rss%3F1724763749507&utm_campaign=rss_partner_inbound,https://da.gd/7Gmcl
