feed,title,long_url,short_url
Yahoo,Nvidia Stock Earnings Preview: 5 Big Factors,https://finance.yahoo.com/news/nvidia-stock-earnings-preview-5-130000005.html?.tsrc=rss,https://da.gd/Be4OU
Yahoo,"Meta Platforms, Inc. (META) Is a Trending Stock: Facts to Know Before Betting on It",https://finance.yahoo.com/news/meta-platforms-inc-meta-trending-130018374.html?.tsrc=rss,https://da.gd/L3TQ
Yahoo,"Investors Heavily Search Amazon.com, Inc. (AMZN): Here is What You Need to Know",https://finance.yahoo.com/news/investors-heavily-search-amazon-com-130017472.html?.tsrc=rss,https://da.gd/0ELpe
Yahoo,"Netflix, Inc. (NFLX) is Attracting Investor Attention: Here is What You Should Know",https://finance.yahoo.com/news/netflix-inc-nflx-attracting-investor-130016247.html?.tsrc=rss,https://da.gd/dH0m3
Yahoo,Apple Inc. (AAPL) Is a Trending Stock: Facts to Know Before Betting on It,https://finance.yahoo.com/news/apple-inc-aapl-trending-stock-130015922.html?.tsrc=rss,https://da.gd/laYqgW
