feed,title,long_url,short_url
Cointelegraph,Why is Bitcoin price down today?,https://cointelegraph.com/news/why-is-bitcoin-price-down-today?utm_source=rss_feed&utm_medium=rss%3F1724784986452&utm_campaign=rss_partner_inbound,https://da.gd/Qu3o
Cointelegraph,TON Society issues open letter to France urging Pavel Durov's release,https://cointelegraph.com/news/ton-society-issues-open-letter-france-urging-pavel-durov-release?utm_source=rss_feed&utm_medium=rss%3F1724784986452&utm_campaign=rss_partner_inbound,https://da.gd/xzU5
Cointelegraph,Blockchain database firm SxT Labs raises $20M in Series A round,https://cointelegraph.com/news/blockchain-database-firm-sxt-labs-secures-20-million-funding?utm_source=rss_feed&utm_medium=rss%3F1724784986452&utm_campaign=rss_partner_inbound,https://da.gd/GBKrM
Cointelegraph,Bitcoin strength wanes as crypto market stuck in 5 month ‘structurally ordered downtrend’,https://cointelegraph.com/news/bitcoin-wanes-as-crypto-market-in-5-month-downtrend?utm_source=rss_feed&utm_medium=rss%3F1724784986452&utm_campaign=rss_partner_inbound,https://da.gd/MB78dF
Cointelegraph,Why is the crypto market down today?,https://cointelegraph.com/news/why-is-the-crypto-market-down-today?utm_source=rss_feed&utm_medium=rss%3F1724784986452&utm_campaign=rss_partner_inbound,https://da.gd/MFwad
Cointelegraph,Vitalik Buterin breaks down 2023 Ethereum Foundation spending,https://cointelegraph.com/news/vitalik-buterin-breakdown-2023-ethereum-foundation-spending?utm_source=rss_feed&utm_medium=rss%3F1724784986452&utm_campaign=rss_partner_inbound,https://da.gd/ykc8zT
Cointelegraph,Calls to release Binance exec intensify after 6 months in Nigerian detention,https://cointelegraph.com/news/binance-exec-nigeria-custody-health-concerns-release?utm_source=rss_feed&utm_medium=rss%3F1724784986452&utm_campaign=rss_partner_inbound,https://da.gd/Q9sMO5
Cointelegraph,SOON closes funding round for Solana-based layer 2,https://cointelegraph.com/news/soon-closes-funding-round-solana-based-layer-2?utm_source=rss_feed&utm_medium=rss%3F1724784986452&utm_campaign=rss_partner_inbound,https://da.gd/wI1T8o
Cointelegraph,CME to launch bite-sized Bitcoin ‘Friday’ futures in bid for retail,https://cointelegraph.com/news/cme-launch-bite-sized-bitcoin-friday-futures-retail?utm_source=rss_feed&utm_medium=rss%3F1724784986452&utm_campaign=rss_partner_inbound,https://da.gd/YZ3XWq
Cointelegraph,Bitcoin exchanges are witnessing 3rd-biggest net daily outflow of 2024,https://cointelegraph.com/news/bitcoin-exchanges-third-biggest-net-daily-outflow-2024?utm_source=rss_feed&utm_medium=rss%3F1724784986452&utm_campaign=rss_partner_inbound,https://da.gd/iuDm2
Cointelegraph,Gameplay Galaxy raises $24M seed round for Web3 gaming platform,https://cointelegraph.com/news/gameplay-galaxy-raises-24-m-seed-round-for-web3-gaming-platform?utm_source=rss_feed&utm_medium=rss%3F1724784986452&utm_campaign=rss_partner_inbound,https://da.gd/7eojX
Cointelegraph,"Elon Musk is worth 100K followers: Yat Siu, X Hall of Flame",https://cointelegraph.com/magazine/animoca-brands-yat-siu-blockchain-gaming-elon-musk-x-hall-of-flame/?utm_source=rss_feed&utm_medium=rss%3F1724784986452&utm_campaign=rss_partner_inbound,https://da.gd/FjbFhf
Cointelegraph,Gavin Wood’s biggest hope: Free crypto transactions and Web3 tech worldwide,https://cointelegraph.com/news/gavin-wood-web3-cryptocurrency-ethereum-fee-free-transactions?utm_source=rss_feed&utm_medium=rss%3F1724784986452&utm_campaign=rss_partner_inbound,https://da.gd/h4JU2
Cointelegraph,New node certification could coax more institutions into Ether staking,https://cointelegraph.com/news/nors-certification-bring-more-institutions-ethereum-staking?utm_source=rss_feed&utm_medium=rss%3F1724784986452&utm_campaign=rss_partner_inbound,https://da.gd/VUe4Y
Cointelegraph,Iota completes EU blockchain pre-commercial phase,https://cointelegraph.com/news/iota-completes-eu-blockchain-pre-commercial-phase?utm_source=rss_feed&utm_medium=rss%3F1724784986452&utm_campaign=rss_partner_inbound,https://da.gd/Nh8RM
Cointelegraph,Bet more on the Bitcoin miners cashing in on AI,https://cointelegraph.com/news/bet-more-on-the-bitcoin-miners-cashing-in-on-ai?utm_source=rss_feed&utm_medium=rss%3F1724784986452&utm_campaign=rss_partner_inbound,https://da.gd/p3XELZ
Cointelegraph,"Nasdaq wants to launch a Bitcoin index options, seeks SEC approval",https://cointelegraph.com/news/nasdaq-bitcoin-index-options-sec-approval?utm_source=rss_feed&utm_medium=rss%3F1724784986452&utm_campaign=rss_partner_inbound,https://da.gd/bVaCVs
Cointelegraph,"Ethereum whales buy big as ETH bottom approaches, analysts predict",https://cointelegraph.com/news/ether-whales-accumulate-540m-price-bottom-nears?utm_source=rss_feed&utm_medium=rss%3F1724784986452&utm_campaign=rss_partner_inbound,https://da.gd/isKbI
Cointelegraph,AI vs. human leadership: Debate over plan to govern Cheyenne with AI,https://cointelegraph.com/news/ai-human-mayor-wyoming-usa-cheyenne?utm_source=rss_feed&utm_medium=rss%3F1724784986452&utm_campaign=rss_partner_inbound,https://da.gd/qU21
Cointelegraph,Nigeria’s SEC issues first license to local crypto exchange,https://cointelegraph.com/news/quidax-first-nigerian-sec-licensed-crypto-exchange?utm_source=rss_feed&utm_medium=rss%3F1724784986452&utm_campaign=rss_partner_inbound,https://da.gd/y8LfP
Cointelegraph,Here’s what happened in crypto today,https://cointelegraph.com/news/what-happened-in-crypto-today?utm_source=rss_feed&utm_medium=rss%3F1724784986452&utm_campaign=rss_partner_inbound,https://da.gd/zhXl0
Cointelegraph,Binance under scrutiny for seizing Palestinian crypto funds,https://cointelegraph.com/news/binance-seize-funds-palestine-israel?utm_source=rss_feed&utm_medium=rss%3F1724784986452&utm_campaign=rss_partner_inbound,https://da.gd/lT7FW
Cointelegraph,CoinDCX’s Okto wallet secures operational license in UAE free zone,https://cointelegraph.com/news/okto-wallet-uae-license-web3-adoption?utm_source=rss_feed&utm_medium=rss%3F1724784986452&utm_campaign=rss_partner_inbound,https://da.gd/oDi6
Cointelegraph,Maker DeFi lending protocol rebrands to Sky ahead of USDS stablecoin launch,https://cointelegraph.com/news/maker-rebrands-sky-launches-usds-sky-token?utm_source=rss_feed&utm_medium=rss%3F1724784986452&utm_campaign=rss_partner_inbound,https://da.gd/32rdA
Cointelegraph,BTC price warning: Binance ‘wants blood’ amid sub-$60K Bitcoin target,https://cointelegraph.com/news/btc-price-warning-binance-sub-60k-bitcoin-target?utm_source=rss_feed&utm_medium=rss%3F1724784986452&utm_campaign=rss_partner_inbound,https://da.gd/Kqr7gf
Cointelegraph,Bitcoin 3-year chart pattern nears breakout point as analyst expects 312% ROI,https://cointelegraph.com/news/bitcoin-3-year-chart-pattern-breakout-analyst-roi?utm_source=rss_feed&utm_medium=rss%3F1724784986452&utm_campaign=rss_partner_inbound,https://da.gd/cSewX
Cointelegraph,"Rise of Telegram Mini Apps: How it started, and how it’s going",https://cointelegraph.com/news/telegram-mini-apps-rise-ton-foundation?utm_source=rss_feed&utm_medium=rss%3F1724784986452&utm_campaign=rss_partner_inbound,https://da.gd/S5VBNw
Cointelegraph,"Celsius distributes $2.5B to 251,000 creditors amid bankruptcy proceedings",https://cointelegraph.com/news/celsius-bankruptcy-returns-2-53-billion-creditors?utm_source=rss_feed&utm_medium=rss%3F1724784986452&utm_campaign=rss_partner_inbound,https://da.gd/68siy
Cointelegraph,AI tokens market cap rebound 79.7% to $32B amid renewed investor confidence,https://cointelegraph.com/news/ai-big-data-crypto-market-recovery-aug?utm_source=rss_feed&utm_medium=rss%3F1724784986452&utm_campaign=rss_partner_inbound,https://da.gd/cIv6o
Cointelegraph,New Zealand introduces OECD crypto reporting framework in new tax bill,https://cointelegraph.com/news/new-zealand-crypto-reporting-oecd-framework?utm_source=rss_feed&utm_medium=rss%3F1724784986452&utm_campaign=rss_partner_inbound,https://da.gd/HUHyo5
