feed,title,long_url,short_url
FXEmpire,"Russia says Mariupol, Berdyansk ports ready to ship grain",https://www.fxempire.com/news/article/russia-says-mariupol-berdyansk-ports-ready-to-ship-grain-1025530,https://bit.ly/3MoT6zB
FXEmpire,Russia CDS committee to meet on Wednesday after “credit event” call,https://www.fxempire.com/news/article/russia-cds-committee-to-meet-on-wednesday-after-credit-event-call-1025527,https://bit.ly/3mnmhsg
FXEmpire,Emerging markets with twin 4% deficits to hit record – Fitch,https://www.fxempire.com/news/article/emerging-markets-with-twin-4-deficits-to-hit-record-fitch-1025525,https://bit.ly/3MuWmJz
FXEmpire,"Syrian, Russian forces boosted after Turkey signals operation – officials",https://www.fxempire.com/news/article/syrian-russian-forces-boosted-after-turkey-signals-operation-officials-1025526,https://bit.ly/3mkfHT9
FXEmpire,Pacific Islands Forum mend rift as super powers focus on region,https://www.fxempire.com/news/article/pacific-islands-forum-mend-rift-as-super-powers-focus-on-region-1025529,https://bit.ly/3xanVm6
FXEmpire,Polish court rejects appeal against PKN Orlen’s takeover of Polska Press-PAP,https://www.fxempire.com/news/article/polish-court-rejects-appeal-against-pkn-orlens-takeover-of-polska-press-pap-1025531,https://bit.ly/3xoYr5F
