feed,title,long_url,short_url
ETFTrends,ESGB: Active Approach to ESG Fixed Income Expansion,https://www.etftrends.com/dual-impact-channel/esgb-active-approach-to-esg-fixed-income-expansion/,https://bit.ly/3PYvbKe
ETFTrends,Study Shows Recent Correlation Between Bitcoin and Stocks Is Temporary,https://www.etftrends.com/crypto-channel/study-shows-recent-correlation-between-bitcoin-and-stocks-is-temporary/,https://bit.ly/3MnkkXf
ETFTrends,Newday’s AHOY Invests in Ocean Health,https://www.etftrends.com/newdays-ahoy-invests-in-ocean-health/,https://bit.ly/3NlWFYB
ETFTrends,Get Active ESG Exposure as the Industry Continues Expansion,https://www.etftrends.com/core-strategies-channel/get-active-esg-exposure-as-the-industry-continues-expansion/,https://bit.ly/3xoTLg4
ETFTrends,Basic Could Be Beautiful When Biotech Bounces Back,https://www.etftrends.com/tactical-allocation-channel/basic-could-be-beautiful-when-biotech-bounces-back/,https://bit.ly/3Mvu6qm
ETFTrends,Research Shows More Investors Are Shifting Towards Frontier Markets,https://www.etftrends.com/thematic-investing-channel/research-shows-more-investors-are-shifting-towards-frontier-markets/,https://bit.ly/3mqoZxb
ETFTrends,ESG Could Be Way to Access Small-Cap Bargains,https://www.etftrends.com/esg-channel/esg-could-be-way-to-access-small-cap-bargains/,https://bit.ly/39aD7ri
ETFTrends,Are Innovative Growth ETFs Reflecting a Turn for the Better?,https://www.etftrends.com/disruptive-technology-channel/are-innovative-growth-etfs-reflecting-a-turn-for-the-better/,https://bit.ly/3xzLd6p
