feed,title,long_url,short_url
InvestorPlace,Why Marathon Digital Stock Could Be the Best Way to Profit from the Bitcoin Hype,https://investorplace.com/2024/04/why-marathon-digital-stock-could-be-the-best-way-to-profit-from-the-bitcoin-hype/,https://da.gd/aslRdj
InvestorPlace,Why Amazon Stock Could Soar 27% and Beyond,https://investorplace.com/2024/04/why-amazon-stock-could-soar-27-and-beyond/,https://da.gd/VoSVUc
InvestorPlace,AMD’s Overlooked AI Potential: 3 Reasons to Buy the Dip Before the Market Catches On,https://investorplace.com/2024/04/amds-overlooked-ai-potential-3-reasons-to-buy-the-dip-before-the-market-catches-on/,https://da.gd/ZCO0AZ
InvestorPlace,Is Alibaba Stock Worth Buying at a 30% Discount?,https://investorplace.com/2024/04/is-alibaba-stock-worth-buying-at-a-30-discount/,https://da.gd/9ciFVP
InvestorPlace,Nvidia Stock’s Hype Cycle: Why the AI Bubble May Burst Sooner Than You Think,https://investorplace.com/2024/04/nvidia-stocks-hype-cycle-why-the-ai-bubble-may-burst-sooner-than-you-think/,https://da.gd/BvbLA
InvestorPlace,The 3 Best Lithium Stocks to Buy in April 2024,https://investorplace.com/2024/04/the-3-best-lithium-stocks-to-buy-in-april-2024/,https://da.gd/HRTUW
InvestorPlace,3 Stocks That Top Investors Are Loading Up On Now,https://investorplace.com/2024/04/3-stocks-that-top-investors-are-loading-up-on-now/,https://da.gd/6mhgm
InvestorPlace,The Secret Sauce Fueling Palantir Stock’s Meteoric Rise,https://investorplace.com/2024/04/the-secret-sauce-fueling-palantir-stocks-meteoric-rise/,https://da.gd/3j7H
InvestorPlace,AZ Stock Earnings: A2Z Smart Techs Reported Results for Q4 2023,https://investorplace.com/earning-results/2024/04/az-stock-earnings-a2z-smart-techs-for-q4-of-2023/,https://da.gd/E7YAb
InvestorPlace,MTBL Stock Earnings: Moatable Reported Results for Q4 2023,https://investorplace.com/earning-results/2024/04/mtbl-stock-earnings-moatable-for-q4-of-2023/,https://da.gd/yrB3p
InvestorPlace,LTRY Stock Earnings: Lottery.com Reported Results for Q4 2023,https://investorplace.com/earning-results/2024/04/ltry-stock-earnings-lottery-com-for-q4-of-2023/,https://da.gd/JoyEn
