feed,title,long_url,short_url
Investing,ETH’s Rapid Move Into Exchanges Could Be a Sign of Strength,https://investing.com/news/-2844065,
Investing,ApeCoin Holders Prepare for Massive Breakout After Ape Fest ’22,https://investing.com/news/-2844063,
Investing,Bollywood A-lister-backed GARI token plunge sparks rug pull rumors,https://investing.com/news/-2844062,
Investing,Wall St turns gloomy on Tesla after deliveries fall for first time in two years,https://investing.com/news/-2844064,
Investing,'Perfect Storm is Here': Barclays Cuts Price Targets on U.S. Internet Stocks,https://investing.com/news/-2844061,
Investing,Meta is 'Top Recession Stock' - BofA Securities Bullish on Facebook's Parent Despite Recent Weakness,https://investing.com/news/-2844060,
