feed,title,long_url,short_url
SeekingAlpha,Amazon is in exclusive talks for podcasting's Wondery - WSJ,https://seekingalpha.com/news/3640937,
SeekingAlpha,Methode Electronics Q2 2021 Earnings Preview,https://seekingalpha.com/news/3640936,
SeekingAlpha,"CPTA leads financial gainers, LU and LYL among losers",https://seekingalpha.com/news/3640935,
SeekingAlpha,On the hour,https://seekingalpha.com/news/3640934,
SeekingAlpha,Engie: New CEO To Continue Switch To Renewables,https://seekingalpha.com/article/4392575,
SeekingAlpha,SoftBank: Undervalued And With Better Returns,https://seekingalpha.com/article/4392573,
