feed,title,long_url,short_url
Benzinga,NASSCOM extends warmest congratulations to the U.S. President Joseph R. Biden and U.S. Vice President Kamala D. Harris in the U.S. Administration,https://www.benzinga.com/pressreleases/21/01/n19250605/nasscom-extends-warmest-congratulations-to-the-u-s-president-joseph-r-biden-and-u-s-vice-president,https://j.mp/2XZFUdJ
Benzinga,Engine Capital And Hawk Ridge Issue Open Letter To Board Of Adtalem Global Education,https://www.benzinga.com/pressreleases/21/01/n19250599/engine-capital-and-hawk-ridge-issue-open-letter-to-board-of-adtalem-global-education,https://j.mp/39V71Mm
Benzinga,Jetsons Robotics Partners with Powermat to Manage Power and Provide Advanced Wireless Charging Technology to Enhance the Operations of Autonomous Solar Panel Cleaning-Robots for Commercial and Industrial Solar Installations,https://www.benzinga.com/pressreleases/21/01/n19250594/jetsons-robotics-partners-with-powermat-to-manage-power-and-provide-advanced-wireless-charging-tec,https://j.mp/2XXL4XJ
Benzinga,"Mitek to Report First Quarter Fiscal 2021 Financial Results on January 28, 2021",https://www.benzinga.com/pressreleases/21/01/g19250543/mitek-to-report-first-quarter-fiscal-2021-financial-results-on-january-28-2021,https://j.mp/393yKLZ
Benzinga,"Lantronix to Report Fiscal 2021 Second Quarter Results on February 11, 2021",https://www.benzinga.com/pressreleases/21/01/g19250540/lantronix-to-report-fiscal-2021-second-quarter-results-on-february-11-2021,https://j.mp/3pheufa
Benzinga,Amicus Therapeutics Announces Presentations and Posters at the 17th Annual WORLDSymposium™ 2021,https://www.benzinga.com/pressreleases/21/01/g19250537/amicus-therapeutics-announces-presentations-and-posters-at-the-17th-annual-worldsymposium-2021,https://j.mp/2MbNKhy
Benzinga,"Ultralife Corporation to Report Fourth Quarter Results on February 4, 2021",https://www.benzinga.com/pressreleases/21/01/g19250535/ultralife-corporation-to-report-fourth-quarter-results-on-february-4-2021,https://j.mp/3bZA0Bx
Benzinga,"Amplify Energy Announces Appointment of Chief Executive Officer, Chief Financial Officer and Chairman of the Board",https://www.benzinga.com/pressreleases/21/01/g19250530/amplify-energy-announces-appointment-of-chief-executive-officer-chief-financial-officer-and-chairm,https://j.mp/39V72jo
Benzinga,Cerevel Therapeutics Announces the Appointments of Deval Patrick and Deborah Baron to its Board of Directors,https://www.benzinga.com/pressreleases/21/01/g19250528/cerevel-therapeutics-announces-the-appointments-of-deval-patrick-and-deborah-baron-to-its-board-of,https://j.mp/3bZVMVC
Benzinga,Genetic Technologies Provides Update on its COVID-19 Disease Severity Risk Test and Expansion into Germline Testing,https://www.benzinga.com/pressreleases/21/01/g19250527/genetic-technologies-provides-update-on-its-covid-19-disease-severity-risk-test-and-expansion-into,https://j.mp/3pbenSI
Benzinga,Martin Marietta Announces Fourth-Quarter and Full-Year 2020 Earnings Conference Call,https://www.benzinga.com/pressreleases/21/01/g19250516/martin-marietta-announces-fourth-quarter-and-full-year-2020-earnings-conference-call,https://j.mp/3phetrC
Benzinga,"Orphan Drugs Market to Reach USD 340.84 Billion by 2027; Increasing Number of Regulatory Approvals will Contribute to Market Growth, says Fortune Business Insights™",https://www.benzinga.com/pressreleases/21/01/g19250513/orphan-drugs-market-to-reach-usd-340-84-billion-by-2027-increasing-number-of-regulatory-approvals-,https://j.mp/3o7EbgW
