feed,title,long_url,short_url
Benzinga,2021 Robert F. Kennedy Book and Journalism Awards Now Open for Submissions,https://www.benzinga.com/pressreleases/21/01/g19261971/2021-robert-f-kennedy-book-and-journalism-awards-now-open-for-submissions,https://j.mp/2Y1sWfr
Benzinga,"Scott+Scott Attorneys at Law LLP Investigates FireEye, Inc.'s Directors and Officers for Breach of Fiduciary Duties – FEYE",https://www.benzinga.com/pressreleases/21/01/b19261961/scott-scott-attorneys-at-law-llp-investigates-fireeye-inc-s-directors-and-officers-for-breach-of-f,https://j.mp/3bXQ0Uv
Benzinga,"ROSEN, A TOP RANKED LAW FIRM, Announces Filing of Securities Class Action Lawsuit Against CleanSpark, Inc.; Encourages Investors with Losses in Excess of $100K to Contact Firm – CLSK",https://www.benzinga.com/pressreleases/21/01/b19261934/rosen-a-top-ranked-law-firm-announces-filing-of-securities-class-action-lawsuit-against-cleanspark,https://j.mp/3ixt3ZN
Benzinga,Shareholder Alert: Robbins LLP Announces That Decision Diagnostics Corp. (DECN) is Being Sued for Misleading Shareholders,https://www.benzinga.com/pressreleases/21/01/b19261915/shareholder-alert-robbins-llp-announces-that-decision-diagnostics-corp-decn-is-being-sued-for-misl,https://j.mp/3o6rPG2
Benzinga,"Joint Reconstruction Devices Market Size, Share & Trends Analysis Report by Product (knee replacement, hip replacement, and trauma and extremities) and by Region, and Segment Forecast, 2020 - 2024 | Technavio",https://www.benzinga.com/pressreleases/21/01/b19261904/joint-reconstruction-devices-market-size-share-trends-analysis-report-by-product-knee-replacement-,https://j.mp/39Sosxh
Benzinga,"FDA Listed, Alcohol-Free Hand Sanitizer from Disinfect & Shield™ Kills COVID-19 On Contact and Remains on Skin for Hours",https://www.benzinga.com/pressreleases/21/01/b19261891/fda-listed-alcohol-free-hand-sanitizer-from-disinfect-shield-kills-covid-19-on-contact-and-remains,https://j.mp/3970sHm
Benzinga,Scott+Scott Attorneys at Law LLP Continues Investigating SolarWinds Corporation's Directors and Officers for Breach of Fiduciary Duties – SWI,https://www.benzinga.com/pressreleases/21/01/b19261890/scott-scott-attorneys-at-law-llp-continues-investigating-solarwinds-corporations-directors-and-off,https://j.mp/39O2wmW
