feed,title,long_url,short_url
Benzinga,Vista Gold Drilling Confirms North Extension of the Batman Core Zone at the Mt Todd Gold Project,https://www.benzinga.com/pressreleases/21/01/g19266135/vista-gold-drilling-confirms-north-extension-of-the-batman-core-zone-at-the-mt-todd-gold-project,https://j.mp/362iPvl
Benzinga,Rock Out Kid Clothing Launches Kickstarter Campaign,https://www.benzinga.com/pressreleases/21/01/n19266132/rock-out-kid-clothing-launches-kickstarter-campaign,https://j.mp/3iAVINw
Benzinga,Red Cat to Host Investor Update Call on January 25 at 4:15 pm ET,https://www.benzinga.com/pressreleases/21/01/n19266127/red-cat-to-host-investor-update-call-on-january-25-at-4-15-pm-et,https://j.mp/361MuVu
Benzinga,Notice from the Office of the Secretary - Ontario Securities Commission,https://www.benzinga.com/pressreleases/21/01/n19266115/notice-from-the-office-of-the-secretary-ontario-securities-commission,https://j.mp/3pd74Kg
Benzinga,Lithium-Ion Battery Separator Market Research 2021-2025 | Market Impact Analysis for the New Normal |Technavio,https://www.benzinga.com/pressreleases/21/01/b19266101/lithium-ion-battery-separator-market-research-2021-2025-market-impact-analysis-for-the-new-normal-,https://j.mp/396UYMW
Benzinga,Contango Completes Acquisition of Mid-Con Energy Partners,https://www.benzinga.com/pressreleases/21/01/g19266080/contango-completes-acquisition-of-mid-con-energy-partners,https://j.mp/3p80Zi7
Benzinga,Message from the Governor General,https://www.benzinga.com/pressreleases/21/01/n19266090/message-from-the-governor-general,https://j.mp/2Y1yQNH
Benzinga,Great Bear Announces Upsized Bought Deal Private Placement of Flow-Through Common Shares and Common Shares to C$70 Million,https://www.benzinga.com/pressreleases/21/01/n19266075/great-bear-announces-upsized-bought-deal-private-placement-of-flow-through-common-shares-and-commo,https://j.mp/2MabClZ
Benzinga,Ceramic Balls Market Research 2021-2025|COVID-19 Market Impacts and Recovery Analysis|Technavio,https://www.benzinga.com/pressreleases/21/01/b19266060/ceramic-balls-market-research-2021-2025-covid-19-market-impacts-and-recovery-analysis-technavio,https://j.mp/395D2m0
