feed,title,long_url,short_url
SeekingAlpha,DuPont beats top-line and bottom-line estimates; initiates Q2 and raises FY24 outlook,https://seekingalpha.com/news/4097040,
SeekingAlpha,"Generac Non-GAAP EPS of $0.88 beats by $0.17, revenue of $889.27M misses by $3.44M",https://seekingalpha.com/news/4097039,
SeekingAlpha,"Entegris Non-GAAP EPS of $0.68, revenue of $771M",https://seekingalpha.com/news/4097038,
SeekingAlpha,"Barrick Gold Non-GAAP EPS of $0.19 beats by $0.04, revenue of $2.75B beats by $10M",https://seekingalpha.com/news/4097037,
SeekingAlpha,"Pfizer plans direct-to-consumer platform to sell Covid, migraine drugs - report",https://seekingalpha.com/news/4097035,
SeekingAlpha,Microsoft's motivation to invest in OpenAI came amid fears of lagging behind Google - report,https://seekingalpha.com/news/4097032,
