feed,title,long_url,short_url
SeekingAlpha,"New York Community Bancorp Non-GAAP EPS of -$0.25 misses by $0.12, revenue of $633M misses by $161.57M",https://seekingalpha.com/news/4097144,
SeekingAlpha,Yum! Brands slides after reporting rare drop in same-store sales,https://seekingalpha.com/news/4097142,
SeekingAlpha,Dayforce beats top-line and bottom-line estimates; initiates Q2 and updates FY24 outlook,https://seekingalpha.com/news/4097141,
SeekingAlpha,Uranium miners surge as U.S. Senate passes bill banning Russian imports,https://seekingalpha.com/news/4097140,
SeekingAlpha,Donald Trump boosts stake in his media firm to ~65%,https://seekingalpha.com/news/4097073,
