feed,title,long_url,short_url
Yahoo,IBM to remain in the Dow after Kyndryl is spun off,https://www.marketwatch.com/story/ibm-to-remain-in-the-dow-after-kyndryl-is-spun-off-2021-11-02?siteid=yhoof2&yptr=yahoo,https://on.mktw.net/3pZEbUN
Yahoo,Ford Shares Downgraded at Nomura Based on Valuation,https://finance.yahoo.com/news/ford-shares-downgraded-nomura-based-111745554.html,https://yhoo.it/3q10f1E
Yahoo,Will November Bring a Massive Altcoin Season?,https://finance.yahoo.com/news/november-bring-massive-altcoin-season-174000935.html?.tsrc=rss,https://yhoo.it/3BEWJMc
Yahoo,Manufacturing Sector PMIs for October Deliver Little EUR Comfort,https://finance.yahoo.com/news/manufacturing-sector-pmis-october-deliver-124602041.html?.tsrc=rss,https://yhoo.it/3EATwPO
Yahoo,Mitt Romney says a billionaire tax will trigger demand for these two assets — get in now before the super-rich swarm,https://finance.yahoo.com/news/mitt-romney-says-billionaire-tax-174700759.html?.tsrc=rss,https://yhoo.it/3GNaOuT
Yahoo,UPDATE 1-Facebook will shut down facial recognition system,https://finance.yahoo.com/news/1-facebook-shut-down-facial-174527433.html?.tsrc=rss,https://yhoo.it/31p2L7w
