feed,title,long_url,short_url
Investing,5 Undervalued Stocks to Consider as Trump’s Reciprocal Tariffs Kick In,https://www.investing.com/analysis/5-undervalued-stocks-to-consider-as-trumps-reciprocal-tariffs-kick-in-200659271,https://da.gd/pDlyEz
Investing,"GameStop Insiders Continue to Buy Amid Tariff Turmoil, Bitcoin Pivot",https://www.investing.com/analysis/gamestop-insiders-continue-to-buy-amid-tariff-turmoil-bitcoin-pivot-200659276,https://da.gd/mzVrnG
Investing,"Analysis-In Saudi debut, Tesla faces desert heat, few chargers, but no Musk protests",https://www.investing.com/news/stock-market-news/analysisin-saudi-debut-tesla-faces-desert-heat-few-chargers-but-no-musk-protests-3976198,https://da.gd/NZdTEq
Investing,Walmart stock falls on tariff worries despite reaffirming Q1 outlook,https://www.investing.com/news/stock-market-news/walmart-stock-falls-on-tariff-worries-despite-reaffirming-q1-outlook-93CH-3976189,https://da.gd/uziy2
Investing,Walmart reaffirms annual forecasts,https://www.investing.com/news/stock-market-news/walmart-reaffirms-annual-sales-forecast-3976109,https://da.gd/928us4
Investing,TSX futures slip as barrage of Trump tariffs kick in,https://www.investing.com/news/stock-market-news/tsx-futures-slip-as-barrage-of-trump-tariffs-kick-in-3976126,https://da.gd/THJ8f
Investing,"India weighs export support measures amid U.S. tariff hike, say government sources",https://www.investing.com/news/economy-news/india-weighs-export-support-measures-amid-us-tariff-hike-say-government-sources-3976190,https://da.gd/ws0S8p
Investing,China announces 84% tariff on U.S. goods in response to Trump levies,https://www.investing.com/news/economy/china-announces-84-tariff-on-us-goods-in-response-to-trump-levies-3976168,https://da.gd/xVYzw
Investing,"US 30-year mortgage rate dropped last week, applications surged",https://www.investing.com/news/economy-news/us-30year-mortgage-rate-dropped-last-week-applications-surged-3976137,https://da.gd/wOXAg
