feed,title,long_url,short_url
SeekingAlpha,"Southern States Bancshares Non-GAAP EPS of $0.47, revenue of $15.85M",https://seekingalpha.com/news/3790588,
SeekingAlpha,DraftKings attracts higher estimates from BofA but New York tax rate is seen as a drag on profits,https://seekingalpha.com/news/3790587,
SeekingAlpha,FDA puts clinical hold on Viking Therapeutics' Phase 1b trial of VK0214 in X-ALD,https://seekingalpha.com/news/3790586,
SeekingAlpha,Channing F. Chen is the new finance chief at Triccar,https://seekingalpha.com/news/3790585,
SeekingAlpha,Innovent's Pemazyre for bile cancer gets approval in Hong Kong,https://seekingalpha.com/news/3790584,
