feed,title,long_url,short_url
InsiderMonkey,Stephens Lowers Atlassian (TEAM) PT but Says AI Fears Are Overblown,https://insidermonkey.com/blog/--1590855,
InsiderMonkey,Why SoundHound AI’s (SOUN) Amelia Acquisition Could Pay Off in the Long Run,https://insidermonkey.com/blog/--1590853,
InsiderMonkey,Alphabet Stock (GOOGL) Gets Buy Reaffirmation as DoJ Case Looms,https://insidermonkey.com/blog/--1590805,
InsiderMonkey,Vistra Stock (VST) Gets Bullish Call from BofA With $220 Target,https://insidermonkey.com/blog/--1590804,
InsiderMonkey,Why JPMorgan Is Sticking With Micron (MU) Stock for the Long Haul,https://insidermonkey.com/blog/--1590803,
InsiderMonkey,Deutsche Bank Sticks With Buy on Snowflake (SNOW) Ahead of Q2 Results,https://insidermonkey.com/blog/--1590802,
InsiderMonkey,Constellation Energy (CEG) Price Target Raised to $375 After Q2 Beat and Strong Outlook,https://insidermonkey.com/blog/--1590801,
InsiderMonkey,Why Analysts See More Upside Ahead for Talen Energy (TLN),https://insidermonkey.com/blog/--1590800,
InsiderMonkey,Palo Alto Networks (PANW) Gets Rating Upgrade on Platformization Momentum,https://insidermonkey.com/blog/--1590799,
InsiderMonkey,Palantir (PLTR) Strengthens Ties With SOMPO in Multi-Year AI Partnership,https://insidermonkey.com/blog/--1590798,
InsiderMonkey,C3.ai (AI) Downgraded to Market Perform by Northland—Here’s What Went Wrong,https://insidermonkey.com/blog/--1590797,
InsiderMonkey,BigBear.ai (BBAI) Gets a Price Target Hike—But Q2 Results Tell Another Story,https://insidermonkey.com/blog/--1590796,
InsiderMonkey,"Pinterest, Inc. (PINS) Is One Of The “Most Undervalued Companies,” Says Jim Cramer",https://insidermonkey.com/blog/--1590846,
InsiderMonkey,"Reddit, Inc. (RDDT) Is One Of The “Most Undervalued Companies,” Says Jim Cramer",https://insidermonkey.com/blog/--1590780,
InsiderMonkey,"Papa John’s International, Inc. (PZZA)’s Had A Surprisingly Good Quarter, Says Jim Cramer",https://insidermonkey.com/blog/--1590782,
InsiderMonkey,"e.l.f. Beauty, Inc. (ELF): “Right Now, They Don’t Like It,” Says Jim Cramer",https://insidermonkey.com/blog/--1590778,
InsiderMonkey,"Fastly, Inc. (FSLY) Made A “Major Comeback,” Says Jim Cramer",https://insidermonkey.com/blog/--1590777,
InsiderMonkey,"Cloudflare, Inc. (NET) “Is By Far My Favorite,” Says Jim Cramer",https://insidermonkey.com/blog/--1590776,
InsiderMonkey,"CrowdStrike Holdings, Inc. (CRWD): “I Think It’s Terrific,” Says Jim Cramer",https://insidermonkey.com/blog/--1590775,
InsiderMonkey,"Jim Cramer Says He Still Likes Palo Alto Networks, Inc. (PANW)",https://insidermonkey.com/blog/--1590774,
