feed,title,long_url,short_url
SeekingAlpha,"agilon health down 8%, prices ~87M shares secondary offering",https://seekingalpha.com/news/3971981,
SeekingAlpha,"Red White & Bloom Brands GAAP EPS of -C$0.60, revenue of C$97.49M",https://seekingalpha.com/news/3971980,
SeekingAlpha,Atlantic Lithium appoints COO Muller as new CEO,https://seekingalpha.com/news/3971979,
SeekingAlpha,Shift Technologies stock slips on missed interest payment,https://seekingalpha.com/news/3971978,
SeekingAlpha,Ringing The Canadian Bell: BCE - 6% Yield - To Hold Or Sell,https://seekingalpha.com/article/4604962,
SeekingAlpha,Waste Management: NRG And Recycling Are Growth Drivers,https://seekingalpha.com/article/4604959,
SeekingAlpha,"Wall Street Breakfast Podcast: 13F Filings: Berkshire Takes New Stakes In COF, DEO",https://seekingalpha.com/article/4604970,
