feed,title,long_url,short_url
SeekingAlpha,"Morgan Stanley touts Mondelez, BellRing Brands as top packaged food picks",https://seekingalpha.com/news/3972237,
SeekingAlpha,"Sigyn Therapeutics, Inc. GAAP EPS of -$0.03",https://seekingalpha.com/news/3972236,
SeekingAlpha,"SinglePoint GAAP EPS of -$0.02, revenue of $5.72M",https://seekingalpha.com/news/3972235,
SeekingAlpha,Amcomri Entertainment reports Q1 results,https://seekingalpha.com/news/3972233,
SeekingAlpha,"Vertex Resource Group Ltd. GAAP EPS of $0.07, revenue of $58.7M",https://seekingalpha.com/news/3972231,
