feed,title,long_url,short_url
ETFTrends:DailyRecap,"As Gross Points to Low Fee TIPS ETFs, Try This Vanguard ETF",https://www.etftrends.com/fixed-income-channel/as-gross-points-to-low-fee-tips-etfs-try-this-vanguard-etf/,https://bit.ly/3TYv2HR
ETFTrends:DailyRecap,Analysts Bullish on This Top QARP Holding’s Growth Potential,https://www.etftrends.com/global-diversification-channel/analysts-bullish-on-this-top-qarp-holdings-growth-potential/,https://bit.ly/3TYTclz
ETFTrends:DailyRecap,"As Earnings Misses Pile Up, DBMF Rides Market Volatility",https://www.etftrends.com/managed-futures-channel/as-earnings-misses-pile-up-dbmf-rides-market-volatility/,https://bit.ly/3zmCeG6
ETFTrends:DailyRecap,"Tom Lydon Talks Dollar Strength, Tech, and More on Yahoo!",https://www.etftrends.com/china-insights-channel/tom-lydon-talks-dollar-strength-tech-and-more-on-yahoo/,https://bit.ly/3zmCeWC
ETFTrends:DailyRecap,Vikram Malhotra on The Blockchain Interviews With Dan Weiskopf,https://www.etftrends.com/crypto-channel/vikram-malhotra-on-the-blockchain-interviews-with-dan-weiskopf/,https://bit.ly/3U3dSsz
ETFTrends:DailyRecap,Silver Prices Set to Soar as Dollar Retreats,https://www.etftrends.com/gold-silver-investing-channel/silver-prices-set-to-soar-as-dollar-retreats/,https://bit.ly/3zi291m
ETFTrends:DailyRecap,Why Investors Should Be Looking at an Active Commodity ETF Today,https://www.etftrends.com/megatrends-channel/why-investors-should-be-looking-at-an-active-commodity-etf-today/,https://bit.ly/3zi28KQ
ETFTrends:DailyRecap,DTEC Rallies While Big Tech Tumbles,https://www.etftrends.com/etf-building-blocks-channel/dtec-rallies-while-big-tech-tumbles/,https://bit.ly/3TVJotf
ETFTrends:DailyRecap,TTAC Takes Advantage of Google’s Free Cash Flow,https://www.etftrends.com/free-cash-flow-channel/ttac-takes-advantage-of-googles-free-cash-flow/,https://bit.ly/3N7srcF
ETFTrends:DailyRecap,Clean Energy Fund TAN Ranks #1 for Highest 5-Year ETF Returns,https://www.etftrends.com/innovative-etfs-channel/clean-energy-fund-tan-ranks-1-for-highest-5-year-etf-returns/,https://bit.ly/3DAWV3k
ETFTrends:DailyRecap,Exercise Tax Loss Harvesting With High-Growth Thematic ETFs,https://www.etftrends.com/thematic-investing-channel/exercise-tax-loss-harvesting-with-high-growth-thematic-etfs/,https://bit.ly/3DBoOsd
ETFTrends:DailyRecap,Buy Into Large-Cap Value Stocks With AVLV,https://www.etftrends.com/core-strategies-channel/buy-into-large-value-stocks-with-avlv/,https://bit.ly/3THAr6t
ETFTrends:DailyRecap,"T. Rowe Price Launches U.S. High Yield ETF, ‘THYF’",https://www.etftrends.com/active-etf-channel/t-rowe-price-launches-u-s-high-yield-fixed-income-etf/,https://bit.ly/3SEU0Lm
ETFTrends:DailyRecap,Lydon Tackles Small-Caps and More on “Mornings With Maria”,https://www.etftrends.com/lydon-tackles-small-caps-and-more-on-mornings-with-maria/,https://bit.ly/3Ne3jRl
ETFTrends:DailyRecap,A Guide to the WisdomTree Rebalance Making Waves in EM,https://www.etftrends.com/model-portfolio-channel/a-guide-to-the-wisdomtree-rebalance-making-waves-in-em/,https://bit.ly/3W4cBU4
ETFTrends:DailyRecap,First Trust Launches Aerospace & Defense ETF With MISL,https://www.etftrends.com/first-trust-launches-aerospace-defense-etf-with-misl/,https://bit.ly/3Dad9PC
ETFTrends:DailyRecap,Focusing on Foundational Elements in Healthcare Evolution,https://www.etftrends.com/future-etfs-channel/focusing-on-foundational-elements-in-healthcare-evolution/,https://bit.ly/3fbQbj9
ETFTrends:DailyRecap,Good News for These ETFs: Investors Are Buying Tech Stocks,https://www.etftrends.com/etf-education-channel/good-news-for-these-etfs-investors-are-buying-tech-stocks/,https://bit.ly/3WgOYb8
ETFTrends:DailyRecap,ESG & Wide Moats Could Be Potent Combination,https://www.etftrends.com/tactical-allocation-channel/esg-wide-moats-could-be-potent-combination/,https://bit.ly/3fbQbQb
ETFTrends:DailyRecap,Optimistic October Is Bringing Bullish S&P 500 Bets Back to Life,https://www.etftrends.com/leveraged-inverse-channel/optimistic-october-is-bringing-bullish-sp-500-bets-back-to-life/,https://bit.ly/3DyafFR
ETFTrends:DailyRecap,China Still Risky but Still Offering Opportunity,https://www.etftrends.com/volatility-resource-channel/china-still-risky-but-still-offering-opportunity/,https://bit.ly/3SFpC3t
ETFTrends:DailyRecap,Meet an Advisor: Mike Durso of Shorehaven Wealth,https://www.etftrends.com/exchange-an-etf-experience/meet-an-advisor-mike-durso-of-shorehaven-wealth/,https://bit.ly/3SH5z4N
ETFTrends:DailyRecap,Another Chance for XBTF on the Safe Haven Front,https://www.etftrends.com/crypto-channel/another-chance-for-xbtf-on-the-safe-haven-front/,https://bit.ly/3fbQ8DZ
ETFTrends:DailyRecap,The Case for a Strategic Allocation to High Yield Bonds,https://www.etftrends.com/active-etf-channel/the-case-for-a-strategic-allocation-to-high-yield-bonds/,https://bit.ly/3W6dgEI
ETFTrends:DailyRecap,South Korea Dials Up Its Purchases on Corporate Bonds,https://www.etftrends.com/fixed-income-channel/south-korea-dials-up-its-purchases-on-corporate-bonds/,https://bit.ly/3zjH7zv
ETFTrends:DailyRecap,Combine Low-Vol Bitcoin With Growth Tech in ARKW,https://www.etftrends.com/disruptive-technology-channel/combine-low-vol-bitcoin-with-growth-tech-in-arkw/,https://bit.ly/3W6AAlu
ETFTrends:DailyRecap,SPHQ: Bringing Clarity to Quality,https://www.etftrends.com/innovative-etfs-channel/sphq-bringing-clarity-to-quality/,https://bit.ly/3Ncna3l
ETFTrends:DailyRecap,MBNE Could Be Meaningful as More States Embrace ESG Munis,https://www.etftrends.com/esg-channel/mbne-could-be-meaningful-as-more-states-embrace-esg-munis/,https://bit.ly/3TwDfmV
ETFTrends:DailyRecap,ETF Prime: VettaFi and Advisor Perspectives Poised to Be a Powerhouse,https://www.etftrends.com/etf-prime/etf-prime-vettafi-and-advisor-perspectives-poised-to-be-a-powerhouse/,https://bit.ly/3W2LnNG
ETFTrends:DailyRecap,Capitalize on Big Decarbonization With KGHG,https://www.etftrends.com/climate-insights-channel/capitalize-on-big-decarbonization-with-kghg/,https://bit.ly/3W6hCM3
ETFTrends:DailyRecap,Look to the Dow for Earnings Season Stability,https://www.etftrends.com/retirement-income-channel/look-to-the-dow-for-earnings-season-stability/,https://bit.ly/3W22b7q
ETFTrends:DailyRecap,Some Strategists Say Now’s the Time to Buy Into Emerging Markets,https://www.etftrends.com/emerging-markets-channel/some-strategists-say-nows-the-time-to-buy-into-emerging-markets/,https://bit.ly/3SEwM82
ETFTrends:DailyRecap,An ETF to Tap Into the Growing Opportunity in California’s Carbon Market,https://www.etftrends.com/climate-insights-channel/an-etf-to-tap-into-the-growing-opportunity-in-californias-carbon-market/,https://bit.ly/3gL59gj
ETFTrends:DailyRecap,The Case for Broad-Based Commodities,https://www.etftrends.com/megatrends-channel/the-case-for-broad-based-commodities/,https://bit.ly/3DAss5L
ETFTrends:DailyRecap,Move to the Ultra-Short End of the Maturity Curve With CLTL and PVI,https://www.etftrends.com/innovative-etfs-channel/move-to-the-ultra-short-end-of-the-maturity-curve-with-cltl-and-pvi/,https://bit.ly/3W4Xg5O
