feed,title,long_url,short_url
SeekingAlpha,"Carrier Global Non-GAAP EPS of $0.70 beats by $0.05, revenue of $5.45B in-line, raises FY22 outlook, announces $2B buyback",https://seekingalpha.com/news/3896255,
SeekingAlpha,"Keurig Dr Pepper Non-GAAP EPS of $0.46 in-line, revenue of $3.62B misses by $10M",https://seekingalpha.com/news/3896254,
SeekingAlpha,"DAQO New Energy Non-GAAP EPADS of $7.70 beats by $0.42, revenue of $1.22B misses by $10M",https://seekingalpha.com/news/3896253,
SeekingAlpha,"Honeywell Non-GAAP EPS of $2.25 beats by $0.10, revenue of $8.95B misses by $50M",https://seekingalpha.com/news/3896252,
SeekingAlpha,WEX boosts share repurchase authorization to $650M,https://seekingalpha.com/news/3896251,
SeekingAlpha,"GasLog Partners Non-GAAP EPS of $0.63 beats by $0.27, revenue of $95.68M beats by $20.49M",https://seekingalpha.com/news/3896250,
SeekingAlpha,"Merck Non-GAAP EPS of $1.85 beats by $0.14, revenue of $15B beats by $950M, raises FY22 outlook",https://seekingalpha.com/news/3896248,
