feed,title,long_url,short_url
FXEmpire,Swedish grid operator proposes $5 billion power price subsidy,https://www.fxempire.com/news/article/swedish-grid-operator-proposes-5-billion-power-price-subsidy-1176392,https://bit.ly/3TYjpAM
FXEmpire,EU Energy Commissioner discusses gas price cap with Norway,https://www.fxempire.com/news/article/eu-energy-commissioner-discusses-gas-price-cap-with-norway-1176391,https://bit.ly/3syvQYn
FXEmpire,Factbox-Has Putin threatened to use nuclear weapons?,https://www.fxempire.com/news/article/factbox-has-putin-threatened-to-use-nuclear-weapons-1176385,https://bit.ly/3DEQFb7
FXEmpire,Lagarde comments at ECB press conference,https://www.fxempire.com/news/article/lagarde-comments-at-ecb-press-conference-6-1176384,https://bit.ly/3DBGsvN
FXEmpire,Instant view: US Q3 GDP rise helps soft landing case,https://www.fxempire.com/news/article/instant-view-us-q3-gdp-rise-helps-soft-landing-case-1176383,https://bit.ly/3DxubaP
