feed,title,long_url,short_url
SeekingAlpha,Will Gilead Q3 results bring positive surprise with focus on cancer portfolio?,https://seekingalpha.com/news/3896563,
SeekingAlpha,Envirotech Vehicles receives purchase order for prisoner transport van,https://seekingalpha.com/news/3896567,
SeekingAlpha,"Bread Financial delinquency, net charge-off rates approach prepandemic levels",https://seekingalpha.com/news/3896566,
SeekingAlpha,Amedisys downgraded at Raymond James on second guidance cut for the year,https://seekingalpha.com/news/3896565,
SeekingAlpha,"Alpine Immune Sciences: ALPN-202 May Be Dead, But The Company Isn't",https://seekingalpha.com/article/4549819,
