feed,title,long_url,short_url
Investing,"Earnings call: DarioHealth posts mixed Q4 results, eyes synergy from Twill acquisition",https://www.investing.com/news/stock-market-news/earnings-call-dariohealth-posts-mixed-q4-results-eyes-synergy-from-twill-acquisition-93CH-3359945,https://da.gd/lC3yc
Investing,"Earnings call: Nuvve reports solid Q4 growth, eyes expansion in 2024",https://www.investing.com/news/stock-market-news/earnings-call-nuvve-reports-solid-q4-growth-eyes-expansion-in-2024-93CH-3359941,https://da.gd/vMUfw
Investing,Earnings call: INmune Bio reports on trials and financials for Q4 2023,https://www.investing.com/news/stock-market-news/earnings-call-inmune-bio-reports-on-trials-and-financials-for-q4-2023-93CH-3359939,https://da.gd/v8pG
Investing,Earnings call: P3 Health Partners reports growth and positive 2024 outlook,https://www.investing.com/news/stock-market-news/earnings-call-p3-health-partners-reports-growth-and-positive-2024-outlook-93CH-3359938,https://da.gd/MVQ8Ie
Investing,"Earnings call: Telesat navigates competitive challenges, focuses on Lightspeed",https://www.investing.com/news/stock-market-news/earnings-call-telesat-navigates-competitive-challenges-focuses-on-lightspeed-93CH-3359936,https://da.gd/BJ8X
Investing,Earnings call: Gold Royalty reports positive Q4 results amid rising gold prices,https://www.investing.com/news/stock-market-news/earnings-call-gold-royalty-reports-positive-q4-results-amid-rising-gold-prices-93CH-3359935,https://da.gd/t07Q
Investing,Earnings call: Sharecare reports steady growth amid strategic review,https://www.investing.com/news/stock-market-news/earnings-call-sharecare-reports-steady-growth-amid-strategic-review-93CH-3359934,https://da.gd/FhTxp2
