feed,title,long_url,short_url
SeekingAlpha,"VirTra GAAP EPS of $0.77 beats by $0.11, revenue of $38.04M beats by $0.74M",https://seekingalpha.com/news/4085961,
SeekingAlpha,CPS announces renewal of $200 million credit facility,https://seekingalpha.com/news/4085960,
SeekingAlpha,"GSE Systems Non-GAAP EPS of -$0.28, revenue of $10.2M",https://seekingalpha.com/news/4085959,
SeekingAlpha,Yield10 Bioscience GAAP EPS of -$0.27 beats by $0.03,https://seekingalpha.com/news/4085958,
SeekingAlpha,Omeros GAAP EPS of -$0.63 misses by $0.07,https://seekingalpha.com/news/4085957,
SeekingAlpha,SANUWAVE Health appoints Peter Sorensen as CFO,https://seekingalpha.com/news/4085956,
