feed,title,long_url,short_url
SeekingAlpha,ProMIS Neurosciences reports FY results,https://seekingalpha.com/news/4085997,
SeekingAlpha,AST SpaceMobile GAAP EPS of -$1.07 misses by $0.16,https://seekingalpha.com/news/4085996,
SeekingAlpha,BioStem Technologies reports Q4 results,https://seekingalpha.com/news/4085995,
SeekingAlpha,Rocket Lab sets launch window for next Electron mission,https://seekingalpha.com/news/4085994,
SeekingAlpha,Vornado Realty files for mixed shelf offering,https://seekingalpha.com/news/4085993,
SeekingAlpha,Gladstone Capital to implement 1-for-2 reverse stock split,https://seekingalpha.com/news/4085991,
SeekingAlpha,"Pioneer Power GAAP EPS of -$0.07 misses by $0.08, revenue of $7.7M misses by $3.19M",https://seekingalpha.com/news/4085990,
