feed,title,long_url,short_url
SeekingAlpha,"MSG Entertainment names Michael Grau as Executive Vice President, Finance",https://seekingalpha.com/news/4062871,
SeekingAlpha,"AECOM Technology Non-GAAP EPS of $1.05 beats by $0.10, revenue of $3.9B beats by $240M",https://seekingalpha.com/news/4062869,
SeekingAlpha,"Simon Property Q4 earnings beat consensus, but 2024 guidance underwhelms",https://seekingalpha.com/news/4062868,
SeekingAlpha,"Kilroy Realty FFO of $1.08 beats by $0.03, revenue of $269.02M misses by $15.47M",https://seekingalpha.com/news/4062867,
SeekingAlpha,"J&J Snack Foods Non-GAAP EPS of $0.52 misses by $0.26, revenue of $348.3M misses by $14.57M",https://seekingalpha.com/news/4062866,
