feed,title,long_url,short_url
InsiderMonkey,"Vistra Corp. (VST) Gains Momentum with Power Demand Surge, RBC Capital Raises Price Target to $141",https://insidermonkey.com/blog/--1372184,
InsiderMonkey,"Vertiv Holdings Co (VRT) Poised for Growth Amid Rising AI Data Center Demands, Evercore ISI Raises Price Target to $125",https://insidermonkey.com/blog/--1372181,
InsiderMonkey,"JPMorgan Raises GE Vernova Inc. (GEV) Price Target to $285, Highlights Upcoming Investor Event as Key Catalyst",https://insidermonkey.com/blog/--1372177,
InsiderMonkey,"Deutsche Bank Reiterates Buy Rating on Dell Technologies Inc. (DELL) with $144 Target, Citing AI Server Momentum and Enterprise Growth",https://insidermonkey.com/blog/--1372175,
InsiderMonkey,"Citi Lowers Lam Research Corporation (LRCX) Price Target to $893, Maintains Buy Rating Amid Concerns of Mid-Cycle Correction",https://insidermonkey.com/blog/--1372124,
