feed,title,long_url,short_url
Nasdaq,"EMERGING MARKETS-Taiwan, Philippines lead Asia share declines as U.S. yields push higher",https://www.nasdaq.com/articles/emerging-markets-taiwan-philippines-lead-asia-share-declines-as-u.s.-yields-push-higher,https://j.mp/3cM3Xnx
Nasdaq,JGB futures fall after BOJ widens 10-year yield trading band,https://www.nasdaq.com/articles/jgb-futures-fall-after-boj-widens-10-year-yield-trading-band-2021-03-19,https://j.mp/3cIy674
Nasdaq,BUZZ-COMMENT-USD/JPY steady as BOJ delivers on expectations,https://www.nasdaq.com/articles/buzz-comment-usd-jpy-steady-as-boj-delivers-on-expectations-2021-03-19,https://j.mp/38WG1MT
Nasdaq,"Sensex, Nifty Extend Losses As Bond Yields Spike",https://www.nasdaq.com/articles/sensex-nifty-extend-losses-as-bond-yields-spike-2021-03-19,https://j.mp/3cRePjM
Nasdaq,"China's yuan weakens on dollar strength, Sino-U.S. tensions",https://www.nasdaq.com/articles/chinas-yuan-weakens-on-dollar-strength-sino-u.s.-tensions-2021-03-19,https://j.mp/2OFShL6
Nasdaq,Lenders flock to Trafigura's jumbo US$5.5bn SLL,https://www.nasdaq.com/articles/lenders-flock-to-trafiguras-jumbo-us%245.5bn-sll-2021-03-19,https://j.mp/38Yzf9o
