feed,title,long_url,short_url
SeekingAlpha,First Trust TCW Securitized Plus ETF declares monthly distribution of $0.0275,https://seekingalpha.com/news/3817627,
SeekingAlpha,First Trust Hedged BuyWrite Income ETF declares monthly distribution of $0.0550,https://seekingalpha.com/news/3817626,
SeekingAlpha,LiqTech International plummets after Stephens lowers price target,https://seekingalpha.com/news/3817625,
SeekingAlpha,First Trust BuyWrite Income ETF declares monthly distribution of $0.1500,https://seekingalpha.com/news/3817624,
SeekingAlpha,First Trust Low Duration Opportunities ETF declares monthly distribution of $0.0775,https://seekingalpha.com/news/3817623,
