feed,title,long_url,short_url
Investing,TTL: Blockchain Engineers Owe Fiduciary and Tortious Duties,https://www.investing.com/news/cryptocurrency-news/ttl-blockchain-engineers-owe-fiduciary-and-tortious-duties-2960117,
Investing,"“Bitcoin Is Islamic”, Economist Bruce Fenton Makes Sweeping Claims",https://www.investing.com/news/cryptocurrency-news/bitcoin-is-islamic-economist-bruce-fenton-makes-sweeping-claims-2960116,
Investing,European Gas Prices Swing as LNG Surge Battles Arctic Blast,https://www.investing.com/news/commodities-news/european-gas-prices-swing-as-lng-surge-battles-arctic-blast-2960101,
Investing,Exclusive-Chinese grab Russian car market share after Western rivals depart,https://www.investing.com/news/stock-market-news/exclusivechinese-grab-russian-car-market-share-after-western-rivals-depart-2960118,
Investing,"French farmer wins $11,700 in Bayer pesticide fumes case",https://www.investing.com/news/economy/french-farmer-wins-11700-in-bayer-pesticide-fumes-case-2960112,
Investing,"Calvin Klein owner PVH is a Top Idea for 2023 at UBS, stock 'underappreciated'",https://www.investing.com/news/stock-market-news/calvin-klein-owner-pvh-is-a-top-idea-for-2023-at-ubs-stock-underappreciated-432SI-2960100,
Investing,Unilever mulls $3 billion sale of some U.S. ice cream brands - Bloomberg News,https://www.investing.com/news/stock-market-news/unilever-mulls-3-billion-sale-of-some-us-ice-cream-brands--bloomberg-news-2960102,
Investing,BAT falls after warning of faster sales decline in U.S,https://www.investing.com/news/stock-market-news/bat-falls-after-warning-of-faster-sales-decline-in-us-2960099,
Investing,TSX futures muted as gold prices slip; U.S. jobs data in focus,https://www.investing.com/news/economy/tsx-futures-muted-as-gold-prices-slip-us-jobs-data-in-focus-2960119,
Investing,China's COVID easing seen knocking growth early next year before recovery kicks in,https://www.investing.com/news/economy/chinas-covid-easing-seen-knocking-growth-early-next-year-before-recovery-kicks-in-2960114,
Investing,EU markets watchdog raps national regulators over Brexit hubs,https://www.investing.com/news/stock-market-news/eu-markets-watchdog-raps-national-regulators-over-brexit-hubs-2960113,
