feed,title,long_url,short_url
Investing,"S&P 500 Update: Bulls Fumbled, Pullback Underway",https://www.investing.com/analysis/sp-500-update-bulls-fumbled-pullback-underway-200633285,
Investing,Bitcoin takes liquidity near $17K as US dollar shows weakness pre-CPI,https://www.investing.com/news/cryptocurrency-news/bitcoin-takes-liquidity-near-17k-as-us-dollar-shows-weakness-precpi-2960406,
Investing,Germany stocks higher at close of trade; DAX up 0.02%,https://www.investing.com/news/stock-market-news/germany-stocks-higher-at-close-of-trade-dax-up-002-2960404,
Investing,Bank of Canada says any further rate decisions to depend on economic data,https://www.investing.com/news/economy/bank-of-canada-says-any-further-rate-decisions-to-depend-on-economic-data-2960401,
Investing,Column-When market forecasters should earn their spurs: McGeever,https://www.investing.com/news/economy/columnwhen-market-forecasters-should-earn-their-spurs-mcgeever-2960403,
