feed,title,long_url,short_url
Nasdaq,Danone names Barry Callebaut's Saint-Affrique as new CEO,https://www.nasdaq.com/articles/danone-names-barry-callebauts-saint-affrique-as-new-ceo-2021-05-17,https://j.mp/2QqsaIJ
Nasdaq,Some U.S. gas stations still without fuel after Colonial reopens after hack,https://www.nasdaq.com/articles/some-u.s.-gas-stations-still-without-fuel-after-colonial-reopens-after-hack-2021-05-17,https://j.mp/3yjBHlR
Nasdaq,"POLL-U.S. corn planting seen 84% complete, soybean planting at 60%",https://www.nasdaq.com/articles/poll-u.s.-corn-planting-seen-84-complete-soybean-planting-at-60-2021-05-17,https://j.mp/3fs1a3V
Nasdaq,Portuguese lender Millennium bcp's first-quarter profit jumps 64%,https://www.nasdaq.com/articles/portuguese-lender-millennium-bcps-first-quarter-profit-jumps-64-2021-05-17-0,https://j.mp/2RYZlDF
Nasdaq,Biden to announce U.S. will send 20 mln vaccines abroad by end of June,https://www.nasdaq.com/articles/biden-to-announce-u.s.-will-send-20-mln-vaccines-abroad-by-end-of-june-2021-05-17,https://j.mp/3eTzciP
Nasdaq,Bank of England's Vlieghe says UK not facing an economic 'boom',https://www.nasdaq.com/articles/bank-of-englands-vlieghe-says-uk-not-facing-an-economic-boom-2021-05-17-0,https://j.mp/2SRTMqZ
