feed,title,long_url,short_url
Investing,"Moderate, Steady Growth Expected for US Q1 GDP",https://www.investing.com/analysis/moderate-steady-growth-expected-for-us-q1-gdp-200657432,https://da.gd/5mpgia
Investing,US Dollar: A Quieter Market Session Could Favour the Currency,https://www.investing.com/analysis/us-dollar-a-quieter-market-session-could-favour-the-currency-200657427,https://da.gd/4ncxc
Investing,"Metaplanet Increases Bitcoin Stash to 2,000 BTC After Latest Purchase",https://www.investing.com/news/cryptocurrency-news/metaplanet-increases-bitcoin-stash-to-2000-btc-after-latest-purchase-3872352,https://da.gd/fu5l
Investing,Stifel aggressively raises its Rheinmetall stock target on new NATO targets,https://www.investing.com/news/stock-market-news/stifel-aggressively-raises-its-rheinmetall-stock-target-on-new-nato-targets-3872360,https://da.gd/EeipPc
Investing,Analysis-Ukraine ceasefire hopes offer Europe's markets a tailwind in the shadow of tariffs,https://www.investing.com/news/economy-news/analysisukraine-ceasefire-hopes-offer-europes-markets-a-tailwind-in-the-shadow-of-tariffs-3872356,https://da.gd/xycH0
