feed,title,long_url,short_url
InsiderMonkey,"Hedge Funds Are Piling Into Allogene Therapeutics, Inc. (ALLO)",https://insidermonkey.com/blog/--880629,https://j.mp/2S7tjSM
InsiderMonkey,"Do Hedge Funds Love Hostess Brands, Inc. (TWNK)?",https://insidermonkey.com/blog/--880593,https://j.mp/2GiMdn2
InsiderMonkey,Is Realogy Holdings Corp (RLGY) A Good Stock To Buy?,https://insidermonkey.com/blog/--880622,https://j.mp/2GfpsjT
InsiderMonkey,Do Hedge Funds Love GrafTech International Ltd. (EAF)?,https://insidermonkey.com/blog/--880612,https://j.mp/2GiMfeE
InsiderMonkey,Hedge Funds Are Coming Back To Lennox International Inc. (LII),https://insidermonkey.com/blog/--880582,https://j.mp/3ijgShk
InsiderMonkey,Hedge Funds Have Never Been This Bullish On Houlihan Lokey Inc (HLI),https://insidermonkey.com/blog/--880604,https://j.mp/2G1FfDj
InsiderMonkey,"Should I Buy H&R Block, Inc. (HRB)?",https://insidermonkey.com/blog/--880574,https://j.mp/2Gl5lks
InsiderMonkey,Is Western Alliance Bancorporation (WAL) Going to Burn These Hedge Funds?,https://insidermonkey.com/blog/--880595,https://j.mp/3igqeum
InsiderMonkey,Should I Buy Mr. Cooper Group Inc. (COOP)?,https://insidermonkey.com/blog/--880586,https://j.mp/33gGsPX
InsiderMonkey,"What Do Hedge Funds Think About J.B. Hunt Transport Services, Inc. (JBHT)?",https://insidermonkey.com/blog/--880564,https://j.mp/3n4pmg0
