feed,title,long_url,short_url
Benzinga,3 Crypto Stocks to Watch Closely for Bitcoin's Bullish Run,https://benzinga.com/markets/cryptocurrency/24/05/38986783/3-crypto-stocks-to-watch-closely-for-bitcoins-bullish-run,https://da.gd/FGE6
Benzinga,Synopsys Options Trading: A Deep Dive into Market Sentiment,https://benzinga.com/insights/options/24/05/38991129/synopsys-options-trading-a-deep-dive-into-market-sentiment,https://da.gd/FO4Ldw
Benzinga,Unpacking the Latest Options Trading Trends in Celestica,https://benzinga.com/insights/options/24/05/38991128/unpacking-the-latest-options-trading-trends-in-celestica,https://da.gd/WL3pj
Benzinga,Decoding Roku's Options Activity: What's the Big Picture?,https://benzinga.com/insights/options/24/05/38991121/decoding-rokus-options-activity-whats-the-big-picture,https://da.gd/EJW6i
Benzinga,Endava PLC Sponsored ADR Surpasses Q3 Earnings and Revenue Estimates,https://benzinga.com/news/earnings/24/05/38986779/endava-plc-sponsored-adr-surpasses-q3-earnings-and-revenue-estimates,https://da.gd/9k1KU
Benzinga,Cinemark Shows Fast-Paced Momentum But Is Still a Bargain Stock,https://benzinga.com/news/earnings/24/05/38986716/cinemark-shows-fast-paced-momentum-but-is-still-a-bargain-stock,https://da.gd/oxnFLL
