feed,title,long_url,short_url
SeekingAlpha,"Tesla is tagged with a bear rating by HSBC due to risks around Elon Musk, late timelines",https://seekingalpha.com/news/4033906,
SeekingAlpha,"TransDigm Group Non-GAAP EPS of $8.03 beats by $0.51, revenue of $1.85B beats by $10M",https://seekingalpha.com/news/4033905,
SeekingAlpha,"Benson Hill GAAP EPS of -$0.09, revenue of $113.1M",https://seekingalpha.com/news/4033904,
SeekingAlpha,Ares Capital appoints Scott Lem as chief financial officer,https://seekingalpha.com/news/4033903,
SeekingAlpha,"Rogers Non-GAAP EPS of C$1.27, revenue of C$5.09B; reaffirms FY23 guidance",https://seekingalpha.com/news/4033902,
SeekingAlpha,"Vertex Non-GAAP EPS of $0.10 beats by $0.01, revenue of $145.03M beats by $2.83M",https://seekingalpha.com/news/4033901,
