feed,title,long_url,short_url
SeekingAlpha,Panbela Therapeutics GAAP EPS of -$2.69 misses by $0.63,https://seekingalpha.com/news/4034550,
SeekingAlpha,"Everbridge Non-GAAP EPS of $0.46 beats by $0.04, revenue of $114.19M beats by $0.53M",https://seekingalpha.com/news/4034549,
SeekingAlpha,"Green Dot Non-GAAP EPS of $0.14 misses by $0.07, revenue of $348.6M beats by $15.93M",https://seekingalpha.com/news/4034548,
SeekingAlpha,"Granite Ridge Resources Non-GAAP EPS of $0.21, revenue of $108.4M",https://seekingalpha.com/news/4034546,
SeekingAlpha,"RxSight Non-GAAP EPS of -$0.19 beats by $0.16, revenue of $22.2M beats by $1.65M",https://seekingalpha.com/news/4034547,
SeekingAlpha,ADDvantage Technologies announces 1-for-10 reverse stock split as part of Nasdaq compliance plan,https://seekingalpha.com/news/4034545,
SeekingAlpha,NDMO: 7.5% Yield And Tax Free To Boot,https://seekingalpha.com/article/4650006,
SeekingAlpha,Bit Digital: Adapting To New Realities But Important To Obtain Management Update,https://seekingalpha.com/article/4650005,
