feed,title,long_url,short_url
SeekingAlpha,"Lions Gate Entertainment Non-GAAP EPS of $0.21 beats by $0.29, revenue of $1B misses by $10M",https://seekingalpha.com/news/4034556,
SeekingAlpha,"Composecure Non-GAAP EPS of $0.24, revenue of $96.9M",https://seekingalpha.com/news/4034555,
SeekingAlpha,"Innovate GAAP EPS of -$0.09, revenue of $375.3M",https://seekingalpha.com/news/4034553,
SeekingAlpha,Unity Software plummets after earnings; interim CEO vows to change strategy,https://seekingalpha.com/news/4034544,
SeekingAlpha,Abercrombie & Fitch announces election of Arturo Nuñez to its board of directors,https://seekingalpha.com/news/4034552,
SeekingAlpha,"SoundHound AI GAAP EPS of -$0.09 in-line, revenue of $13.3M beats by $0.51M",https://seekingalpha.com/news/4034551,
