feed,title,long_url,short_url
Cointelegraph,"Crypto is down, but FET and AI tokens are up — Here’s why",https://cointelegraph.com/news/crypto-is-down-but-fet-and-ai-tokens-are-up-here-s-why?utm_source=rss_feed&utm_medium=rss%3F1724808356111&utm_campaign=rss_partner_inbound,https://da.gd/mqwW
Cointelegraph,"Sony debuts Soneium Minato testnet, Web3 developer incubator",https://cointelegraph.com/news/sony-soneium-blockchain-testnet-incubator-launch?utm_source=rss_feed&utm_medium=rss%3F1724808356111&utm_campaign=rss_partner_inbound,https://da.gd/y3ORtV
Cointelegraph,Critical bug identified and remedied in Circle’s Noble-CCTP,https://cointelegraph.com/news/critical-bug-identified-remedied-circle-noble-cctp?utm_source=rss_feed&utm_medium=rss%3F1724808356111&utm_campaign=rss_partner_inbound,https://da.gd/JZyY
Cointelegraph,Ondo’s USDY yield coin expands to Arbitrum,https://cointelegraph.com/news/ondo-usdy-yieldcoin-expands-arbitrum?utm_source=rss_feed&utm_medium=rss%3F1724808356111&utm_campaign=rss_partner_inbound,https://da.gd/JWmSO
Cointelegraph,"US lawmaker reports AERO, GRT and VELO investments in 2024",https://cointelegraph.com/news/mike-collins-lawmaker-aero-grt-velo-investments?utm_source=rss_feed&utm_medium=rss%3F1724808356111&utm_campaign=rss_partner_inbound,https://da.gd/r5dSdC
Cointelegraph,"Watchdog alleges Super Micro is riddled with accounting, sanctions scandals",https://cointelegraph.com/news/hindenburg-report-super-micro-allegations-accounting-scandals?utm_source=rss_feed&utm_medium=rss%3F1724808356111&utm_campaign=rss_partner_inbound,https://da.gd/uq6A
Cointelegraph,Here’s what happened in crypto today,https://cointelegraph.com/news/what-happened-in-crypto-today?utm_source=rss_feed&utm_medium=rss%3F1724808356111&utm_campaign=rss_partner_inbound,https://da.gd/tZzRXt
Cointelegraph,Why is Bitcoin price down today?,https://cointelegraph.com/news/why-is-bitcoin-price-down-today?utm_source=rss_feed&utm_medium=rss%3F1724808356111&utm_campaign=rss_partner_inbound,https://da.gd/gH4L
Cointelegraph,TON Society issues open letter to France urging Pavel Durov’s release,https://cointelegraph.com/news/ton-society-issues-open-letter-france-urging-pavel-durov-release?utm_source=rss_feed&utm_medium=rss%3F1724808356111&utm_campaign=rss_partner_inbound,https://da.gd/WOO6Xw
Cointelegraph,Blockchain database firm SxT Labs raises $20M in Series A round,https://cointelegraph.com/news/blockchain-database-firm-sxt-labs-secures-20-million-funding?utm_source=rss_feed&utm_medium=rss%3F1724808356111&utm_campaign=rss_partner_inbound,https://da.gd/vZbL9P
Cointelegraph,Bitcoin strength wanes as crypto market stuck in 5 month ‘structurally ordered downtrend’,https://cointelegraph.com/news/bitcoin-wanes-as-crypto-market-in-5-month-downtrend?utm_source=rss_feed&utm_medium=rss%3F1724808356111&utm_campaign=rss_partner_inbound,https://da.gd/NaUKht
Cointelegraph,Why is the crypto market down today?,https://cointelegraph.com/news/why-is-the-crypto-market-down-today?utm_source=rss_feed&utm_medium=rss%3F1724808356111&utm_campaign=rss_partner_inbound,https://da.gd/EIEX
Cointelegraph,Vitalik Buterin breaks down 2023 Ethereum Foundation spending,https://cointelegraph.com/news/vitalik-buterin-breakdown-2023-ethereum-foundation-spending?utm_source=rss_feed&utm_medium=rss%3F1724808356111&utm_campaign=rss_partner_inbound,https://da.gd/Oj5XU7
Cointelegraph,Calls to release Binance exec intensify after 6 months in Nigerian detention,https://cointelegraph.com/news/binance-exec-nigeria-custody-health-concerns-release?utm_source=rss_feed&utm_medium=rss%3F1724808356111&utm_campaign=rss_partner_inbound,https://da.gd/XR3K5W
Cointelegraph,SOON closes funding round for Solana-based layer 2,https://cointelegraph.com/news/soon-closes-funding-round-solana-based-layer-2?utm_source=rss_feed&utm_medium=rss%3F1724808356111&utm_campaign=rss_partner_inbound,https://da.gd/t9umnl
Cointelegraph,CME to launch bite-sized Bitcoin ‘Friday’ futures in bid for retail,https://cointelegraph.com/news/cme-launch-bite-sized-bitcoin-friday-futures-retail?utm_source=rss_feed&utm_medium=rss%3F1724808356111&utm_campaign=rss_partner_inbound,https://da.gd/ZaxmB
Cointelegraph,Bitcoin exchanges are witnessing 3rd-biggest net daily outflow of 2024,https://cointelegraph.com/news/bitcoin-exchanges-third-biggest-net-daily-outflow-2024?utm_source=rss_feed&utm_medium=rss%3F1724808356111&utm_campaign=rss_partner_inbound,https://da.gd/kmiDv
Cointelegraph,Gameplay Galaxy raises $24M seed round for Web3 gaming platform,https://cointelegraph.com/news/gameplay-galaxy-raises-24-m-seed-round-for-web3-gaming-platform?utm_source=rss_feed&utm_medium=rss%3F1724808356111&utm_campaign=rss_partner_inbound,https://da.gd/3a7x8o
Cointelegraph,"Elon Musk is worth 100K followers: Yat Siu, X Hall of Flame",https://cointelegraph.com/magazine/animoca-brands-yat-siu-blockchain-gaming-elon-musk-x-hall-of-flame/?utm_source=rss_feed&utm_medium=rss%3F1724808356111&utm_campaign=rss_partner_inbound,https://da.gd/Wk9ByW
Cointelegraph,Gavin Wood’s biggest hope: Free crypto transactions and Web3 tech worldwide,https://cointelegraph.com/news/gavin-wood-web3-cryptocurrency-ethereum-fee-free-transactions?utm_source=rss_feed&utm_medium=rss%3F1724808356111&utm_campaign=rss_partner_inbound,https://da.gd/Oe2Jj
Cointelegraph,New node certification could coax more institutions into Ether staking,https://cointelegraph.com/news/nors-certification-bring-more-institutions-ethereum-staking?utm_source=rss_feed&utm_medium=rss%3F1724808356111&utm_campaign=rss_partner_inbound,https://da.gd/cM0ckP
Cointelegraph,Iota completes EU blockchain pre-commercial phase,https://cointelegraph.com/news/iota-completes-eu-blockchain-pre-commercial-phase?utm_source=rss_feed&utm_medium=rss%3F1724808356111&utm_campaign=rss_partner_inbound,https://da.gd/lWoO0R
Cointelegraph,Bet more on the Bitcoin miners cashing in on AI,https://cointelegraph.com/news/bet-more-on-the-bitcoin-miners-cashing-in-on-ai?utm_source=rss_feed&utm_medium=rss%3F1724808356111&utm_campaign=rss_partner_inbound,https://da.gd/XC4dgF
Cointelegraph,"Nasdaq wants to launch a Bitcoin index options, seeks SEC approval",https://cointelegraph.com/news/nasdaq-bitcoin-index-options-sec-approval?utm_source=rss_feed&utm_medium=rss%3F1724808356111&utm_campaign=rss_partner_inbound,https://da.gd/NnRua
Cointelegraph,"Ethereum whales buy big as ETH bottom approaches, analysts predict",https://cointelegraph.com/news/ether-whales-accumulate-540m-price-bottom-nears?utm_source=rss_feed&utm_medium=rss%3F1724808356111&utm_campaign=rss_partner_inbound,https://da.gd/lCwio
Cointelegraph,AI vs. human leadership: Debate over plan to govern Cheyenne with AI,https://cointelegraph.com/news/ai-human-mayor-wyoming-usa-cheyenne?utm_source=rss_feed&utm_medium=rss%3F1724808356111&utm_campaign=rss_partner_inbound,https://da.gd/DmPkQ
Cointelegraph,Nigeria’s SEC issues first license to local crypto exchange,https://cointelegraph.com/news/quidax-first-nigerian-sec-licensed-crypto-exchange?utm_source=rss_feed&utm_medium=rss%3F1724808356111&utm_campaign=rss_partner_inbound,https://da.gd/q1OYoy
Cointelegraph,Binance under scrutiny for seizing Palestinian crypto funds,https://cointelegraph.com/news/binance-seize-funds-palestine-israel?utm_source=rss_feed&utm_medium=rss%3F1724808356111&utm_campaign=rss_partner_inbound,https://da.gd/Zf05
Cointelegraph,CoinDCX’s Okto wallet secures operational license in UAE free zone,https://cointelegraph.com/news/okto-wallet-uae-license-web3-adoption?utm_source=rss_feed&utm_medium=rss%3F1724808356111&utm_campaign=rss_partner_inbound,https://da.gd/cTYye
Cointelegraph,Maker DeFi lending protocol rebrands to Sky ahead of USDS stablecoin launch,https://cointelegraph.com/news/maker-rebrands-sky-launches-usds-sky-token?utm_source=rss_feed&utm_medium=rss%3F1724808356111&utm_campaign=rss_partner_inbound,https://da.gd/Oyx8Rs
