feed,title,long_url,short_url
Investing,Earnings call: Welltower sees record capital deployment and growth in 2023,https://www.investing.com/news/stock-market-news/earnings-call-welltower-sees-record-capital-deployment-and-growth-in-2023-93CH-3303848,https://da.gd/oZyidE
Investing,"Earnings call: Waste Connections reports robust Q4 growth, bullish 2024 outlook",https://www.investing.com/news/stock-market-news/earnings-call-waste-connections-reports-robust-q4-growth-bullish-2024-outlook-93CH-3303847,https://da.gd/pdrctH
Investing,"Earnings call: Waste Connections reports robust Q4 growth, bullish 2024 outlook",https://www.investing.com/news/stock-market-news/earnings-call-waste-connections-reports-robust-q4-growth-bullish-2024-outlook-93CH-3303846,https://da.gd/y3WwvP
Investing,"Earnings call: Wabtec reports robust Q4 results, optimistic 2024 outlook",https://www.investing.com/news/stock-market-news/earnings-call-wabtec-reports-robust-q4-results-optimistic-2024-outlook-93CH-3303845,https://da.gd/xN7q
Investing,Earnings call: VPG posts solid Q4 with strong revenue and EPS growth,https://www.investing.com/news/stock-market-news/earnings-call-vpg-posts-solid-q4-with-strong-revenue-and-eps-growth-93CH-3303844,https://da.gd/HHRDJ
Investing,EnerSys to build lithium-ion gigafactory in South Carolina,https://www.investing.com/news/stock-market-news/enersys-to-build-lithiumion-gigafactory-in-south-carolina-93CH-3303843,https://da.gd/dzwkYQ
Investing,Republican warns of 'serious national security threat' linked to Russian nuclear weapon - report,https://www.investing.com/news/stock-market-news/republican-warns-of-serious-national-security-threat-linked-to-russian-nuclear-weapon--report-432SI-3303836,https://da.gd/A9X6Yu
Investing,PPL appoints new Chief Technology and Innovation Officer,https://www.investing.com/news/stock-market-news/ppl-appoints-new-chief-technology-and-innovation-officer-93CH-3303840,https://da.gd/uBVSP
Investing,Why Is Bright Horizons (BFAM) Stock Soaring Today,https://www.investing.com/news/stock-market-news/why-is-bright-horizons-bfam-stock-soaring-today-3303839,https://da.gd/GKyd
Investing,US SEC proposes to update definition of 'qualifying' VC funds,https://www.investing.com/news/economy/us-sec-proposes-to-update-definition-of-qualifying-vc-funds-3303842,https://da.gd/AcMJA3
