feed,title,long_url,short_url
Investing,"Cisco earnings beat by $0.03, revenue topped estimates",https://www.investing.com/news/stock-market-news/cisco-earnings-beat-by-003-revenue-topped-estimates-3303921,https://da.gd/VnfJJG
Investing,"Tinder, other Match dating apps encourage compulsive use, lawsuit claims",https://www.investing.com/news/stock-market-news/tinder-other-match-dating-apps-encourage-compulsive-use-lawsuit-claims-3303904,https://da.gd/9lMCGv
Investing,NVR Inc. sets $750 million stock buyback plan,https://www.investing.com/news/stock-market-news/nvr-inc-sets-750-million-stock-buyback-plan-93CH-3303889,https://da.gd/FDSUlp
Investing,U.S. Senator Shelley Moore Capito Just Reported a Sale of $ENB stock,https://www.investing.com/news/stock-market-news/us-senator-shelley-moore-capito-just-reported-a-sale-of-enb-stock-3303878,https://da.gd/64rs
Investing,U.S. Senator Shelley Moore Capito Just Reported a Sale of $ES stock,https://www.investing.com/news/stock-market-news/us-senator-shelley-moore-capito-just-reported-a-sale-of-es-stock-3303877,https://da.gd/w4qW8
Investing,Earnings call: Genasys secures $60M FEMA-funded project in Puerto Rico,https://www.investing.com/news/stock-market-news/earnings-call-genasys-secures-60m-femafunded-project-in-puerto-rico-93CH-3303879,https://da.gd/zkctBW
Investing,Earnings call: Equity Commonwealth reports Q4 and full-year 2023 results,https://www.investing.com/news/stock-market-news/earnings-call-equity-commonwealth-reports-q4-and-fullyear-2023-results-93CH-3303874,https://da.gd/2tZ7nR
Investing,Earnings call: GlobalFoundries exceeds expectations in Q4 and FY2023,https://www.investing.com/news/stock-market-news/earnings-call-globalfoundries-exceeds-expectations-in-q4-and-fy2023-93CH-3303935,https://da.gd/5nqHV4
Investing,"Fed's Barr: January data shows path to 2% inflation will be ""bumpy""",https://www.investing.com/news/economy/feds-barr-january-data-shows-path-to-2-inflation-will-be-bumpy-3303926,https://da.gd/3vOLdy
