feed,title,long_url,short_url
SeekingAlpha,"Occidental Petroleum Non-GAAP EPS of $0.74 beats by $0.05, revenue of $7.53B beats by $660M",https://seekingalpha.com/news/4067133,
SeekingAlpha,"PC Connection Non-GAAP EPS of $0.90 beats by $0.02, revenue of $696.5M beats by $22.91M",https://seekingalpha.com/news/4067132,
SeekingAlpha,Meta elects Hock E. Tan and John Arnold as directors,https://seekingalpha.com/news/4067130,
SeekingAlpha,Prime Medicine stock falls on proposed public offering of common stock,https://seekingalpha.com/news/4067129,
SeekingAlpha,Cisco tumbles amid weak Q3 guidance,https://seekingalpha.com/news/4066822,
SeekingAlpha,"Park City Group GAAP EPS of $0.07, revenue of $5.13M",https://seekingalpha.com/news/4067127,
SeekingAlpha,"Albemarle Non-GAAP EPS of $1.85 beats by $0.74, revenue of $2.36B beats by $180M",https://seekingalpha.com/news/4067131,
