feed,title,long_url,short_url
SeekingAlpha,"Antero Midstream Non-GAAP EPS of $0.24 misses by $0.02, revenue of $260.17M beats by $2.85M",https://seekingalpha.com/news/4067146,
SeekingAlpha,"Four Corners Property Trust FFO of $0.41 in-line, revenue of $65.14M beats by $0.31M",https://seekingalpha.com/news/4067145,
SeekingAlpha,NETSTREIT FFO of $0.31 beats by $0.02,https://seekingalpha.com/news/4067144,
SeekingAlpha,Udemy authorizes $100M share repurchase program,https://seekingalpha.com/news/4067143,
SeekingAlpha,"Twilio in charts: Q4 customer accounts inch lower Q/Q, dollar-based net expansion rate at 102%",https://seekingalpha.com/news/4067073,
SeekingAlpha,"Adaptive Biotechnologies GAAP EPS of -$0.48 misses by $0.15, revenue of $45.78M misses by $2.68M",https://seekingalpha.com/news/4067142,
