feed,title,long_url,short_url
Investing,Whale Purchases Over $79.2 Million Worth Of Ethereum,https://www.investing.com/news/cryptocurrency-news/whale-purchases-over-792-million-worth-of-ethereum-3006785,https://da.gd/Jyn7O5
Investing,Binance CEO Tweets About Falling BUSD Market Capitalization,https://www.investing.com/news/cryptocurrency-news/binance-ceo-tweets-about-falling-busd-market-capitalization-3006784,https://da.gd/nDNtDr
Investing,"HubSpot gains 11% as profit outlook crushes estimates, analysts raise targets",https://www.investing.com/news/stock-market-news/hubspot-gains-11-as-profit-outlook-crushes-estimates-analysts-raise-targets-432SI-3006757,https://da.gd/0ayr7
Investing,Steep levies on Russian aluminium could threaten U.S. nickel supply,https://www.investing.com/news/economic-indicators/steep-levies-on-russian-aluminium-could-threaten-us-nickel-supply-3006764,https://da.gd/ydKgri
Investing,"German producer prices ease, but at lower pace than expected",https://www.investing.com/news/economy/german-producer-prices-ease-but-at-lower-pace-than-expected-3006755,https://da.gd/9IGF
