feed,title,long_url,short_url
SeekingAlpha,"Direxion Daily Robotic, AI & Automation Index Bull 2X Shares declares quarterly distribution of $0.0232",https://seekingalpha.com/news/3982168,
SeekingAlpha,Direxion Daily Small Cap Bear 3X Shares declares quarterly distribution of $0.2275,https://seekingalpha.com/news/3982167,
SeekingAlpha,JPMorgan Realty Income ETF declares quarterly distribution of $0.4694,https://seekingalpha.com/news/3982166,
SeekingAlpha,Direxion Daily 7-10 Year Treasury Bear 3X Shares declares quarterly distribution of $0.2186,https://seekingalpha.com/news/3982165,
SeekingAlpha,JPMorgan Diversified Return U.S. Small Cap Equity ETF declares quarterly distribution of $0.2046,https://seekingalpha.com/news/3982164,
SeekingAlpha,Direxion Daily 7-10 Year Treasury Bull 3X Shares declares quarterly distribution of $0.2186,https://seekingalpha.com/news/3982163,
SeekingAlpha,Direxion Daily TSLA Bear 1X Shares declares quarterly distribution of $0.0832,https://seekingalpha.com/news/3982162,
