feed,title,long_url,short_url
Benzinga,Enea Signs Traffic Management Contract Worth USD 1.3 Million,https://www.benzinga.com/pressreleases/20/07/n16476670/enea-signs-traffic-management-contract-worth-usd-1-3-million,https://j.mp/2ZrljPL
Benzinga,McGrath RentCorp Sets Second Quarter 2020 Financial Results Date and Time,https://www.benzinga.com/pressreleases/20/07/g16476652/mcgrath-rentcorp-sets-second-quarter-2020-financial-results-date-and-time,https://j.mp/3isbbiD
Benzinga,"WillScot and Mobile Mini Complete Combination, Creating a North American Leader in Modular Space and Portable Storage Solutions",https://www.benzinga.com/pressreleases/20/07/g16476651/willscot-and-mobile-mini-complete-combination-creating-a-north-american-leader-in-modular-space-an,https://j.mp/2NNaO3O
Benzinga,Bank OZK Announces Increased Regular Quarterly Dividend,https://www.benzinga.com/pressreleases/20/07/g16476650/bank-ozk-announces-increased-regular-quarterly-dividend,https://j.mp/2YO6vvq
Benzinga,"Frequency Electronics, Inc. Announces Significant Contract Win",https://www.benzinga.com/pressreleases/20/07/g16476649/frequency-electronics-inc-announces-significant-contract-win,https://j.mp/2YPKZqc
Benzinga,"Cytokinetics to Host Virtual Investor & Analyst Day on July 15, 2020",https://www.benzinga.com/pressreleases/20/07/g16476627/cytokinetics-to-host-virtual-investor-analyst-day-on-july-15-2020,https://j.mp/2Zr6WLs
Benzinga,"Align Technology to Announce Second Quarter 2020 Results on July 22, 2020",https://www.benzinga.com/pressreleases/20/07/g16476626/align-technology-to-announce-second-quarter-2020-results-on-july-22-2020,https://j.mp/3eRgfdP
Benzinga,NASA Awards NOAA's Space Weather Follow On-Lagrange 1 (SWFO-L1) Solar Wind Plasma Sensor (SWiPS),https://www.benzinga.com/pressreleases/20/07/n16476624/nasa-awards-noaas-space-weather-follow-on-lagrange-1-swfo-l1-solar-wind-plasma-sensor-swips,https://j.mp/2ZH1iFd
