feed,title,long_url,short_url
Yahoo,"GM Stock Extends Breakout On Signs Of EV Acceleration, $6 Billion Share Buyback",https://finance.yahoo.com/m/1692789a-12db-38bd-90e5-dfb88deb2e73/gm-stock-extends-breakout-on.html?.tsrc=rss,https://da.gd/hATmN
Yahoo,A Data-Driven Analysis of Netflix's Streaming Dominance and Future Outlook,https://finance.yahoo.com/news/data-driven-analysis-netflixs-streaming-140001320.html?.tsrc=rss,https://da.gd/IyjUHI
Yahoo,"Apple upgraded, Shopify initiated: Wall Street's top analyst calls",https://finance.yahoo.com/news/apple-upgraded-shopify-initiated-wall-134911471.html?.tsrc=rss,https://da.gd/qGktjy
Yahoo,Apple's AI Innovations Unlikely To Spur iPhone Upgrade Cycle,https://finance.yahoo.com/m/39eaa549-5ed3-39f6-a7ff-ba6ffdd40ff7/apple%27s-ai-innovations.html?.tsrc=rss,https://da.gd/eCY3
Yahoo,Nvidia Eclipsing Apple Threatens Radical Shakeup of $67 Billion ETF,https://finance.yahoo.com/news/nvidia-eclipsing-apple-threatens-radical-134050752.html?.tsrc=rss,https://da.gd/iYI6lK
Yahoo,"Amazon.com, Inc. (AMZN) Is a Trending Stock: Facts to Know Before Betting on It",https://finance.yahoo.com/news/amazon-com-inc-amzn-trending-130015746.html?.tsrc=rss,https://da.gd/Ab4Je
Yahoo,Apple Inc. (AAPL) Is a Trending Stock: Facts to Know Before Betting on It,https://finance.yahoo.com/news/apple-inc-aapl-trending-stock-130013291.html?.tsrc=rss,https://da.gd/X5Tf7M
Yahoo,"Should You Bet on ""Apple Intelligence"" With These ETFs?",https://finance.yahoo.com/news/bet-apple-intelligence-etfs-123000912.html?.tsrc=rss,https://da.gd/07d6hl
