feed,title,long_url,short_url
SeekingAlpha,"Abiomed Non-GAAP EPS of $1.13 beats by $0.16, revenue of $261.18M beats by $9.71M",https://seekingalpha.com/news/3795413,
SeekingAlpha,Senate hearing: Raskin says Fed's job is not to direct bank lending,https://seekingalpha.com/news/3795412,
SeekingAlpha,"WEC Energy GAAP EPS of $0.71 beats by $0.04, revenue of $2.2B beats by $340M; reaffirms full year guidance",https://seekingalpha.com/news/3795411,
SeekingAlpha,"Estee Lauder sees strong demand across skincare, fragrances and hair products while makeup still lags",https://seekingalpha.com/news/3795410,
SeekingAlpha,"CSW Industrials GAAP EPS of $0.52, revenue of $136.3M",https://seekingalpha.com/news/3795409,
