feed,title,long_url,short_url
SeekingAlpha,Kiromic BioPharma appoints interim CEO,https://seekingalpha.com/news/3795569,
SeekingAlpha,Lipocine announces FDA accepted the marketing application for Tlando,https://seekingalpha.com/news/3795568,
SeekingAlpha,"Dassault Systemes Non-GAAP EPS of €0.29, revenue of €1.37B",https://seekingalpha.com/news/3795567,
SeekingAlpha,AnPac rises 6% on filing for FDA breakthrough device status for cancer detection system,https://seekingalpha.com/news/3795566,
SeekingAlpha,Extendicare to sell retirement living operations to SiennaSabra for $307.5M,https://seekingalpha.com/news/3795565,
SeekingAlpha,Stantec nabs $45M contract from Bureau of Reclamation,https://seekingalpha.com/news/3795564,
