feed,title,long_url,short_url
SeekingAlpha,MP Materials plunges on short call from Bonitas Research,https://seekingalpha.com/news/3795582,
SeekingAlpha,Catalyst gets court's favorable judgement in FDA lawsuit over rival drug approval,https://seekingalpha.com/news/3795578,
SeekingAlpha,monday.com: A Lot Of Room For Growth Ahead,https://seekingalpha.com/article/4483882,
SeekingAlpha,MEG Energy: Small Producer With Big Potential,https://seekingalpha.com/article/4483881,
SeekingAlpha,Novartis: A Good Long-Term Pick,https://seekingalpha.com/article/4483880,
