feed,title,long_url,short_url
Investing,"Toyota raises tender price for Toyota Industries to 18,800 yen per share",https://www.investing.com/news/stock-market-news/toyota-raises-tender-price-for-toyota-industries-to-18800-yen-per-share-93CH-4446306,
Investing,Nokian Tyres appoints Timo Koponen as new CFO,https://www.investing.com/news/stock-market-news/nokian-tyres-appoints-timo-koponen-as-new-cfo-93CH-4446302,
Investing,"Jeronimo Martins reports solid Poland sales, shares dip 2%",https://www.investing.com/news/stock-market-news/jeronimo-martins-reports-solid-poland-sales-shares-dip-2-93CH-4446301,
Investing,HSBC upgrades EssilorLuxottica on $200 bln AI smart glasses outlook; shares up,https://www.investing.com/news/stock-market-news/hsbc-upgrades-essilorluxottica-on-200-bln-ai-smart-glasses-outlook-shares-up-4446298,
Investing,"Hedge funds held onto heavily crowded positions in tech in 2025, Hazeltree report",https://www.investing.com/news/stock-market-news/hedge-funds-held-onto-heavily-crowded-positions-in-tech-in-2025-hazeltree-report-4446295,
Investing,Tubacex shares drop after flagging negative accounting adjustment,https://www.investing.com/news/stock-market-news/tubacex-shares-drop-after-flagging-negative-accounting-adjustment-93CH-4446286,
Investing,Trip.com shares fall as China launches monopoly investigation,https://www.investing.com/news/stock-market-news/tripcom-shares-fall-as-china-launches-monopoly-investigation-93CH-4446262,
Investing,"Romania’s inflation rate edges lower in December, still near 10%",https://www.investing.com/news/economic-indicators/romanias-inflation-rate-edges-lower-in-december-still-near-10-93CH-4446291,
Investing,Bank of England’s Taylor sees inflation hitting target by mid-2026,https://www.investing.com/news/economy-news/bank-of-englands-taylor-sees-inflation-hitting-target-by-mid2026-93CH-4446272,
