feed,title,long_url,short_url
Investing,TTM Technologies stock soars after CEO projects 15-20% annual growth,https://www.investing.com/news/stock-market-news/ttm-technologies-stock-soars-after-ceo-projects-1520-annual-growth-93CH-4447889,
Investing,U.K. stocks higher at close of trade; Investing.com United Kingdom 100 up 0.35%,https://www.investing.com/news/stock-market-news/uk-stocks-higher-at-close-of-trade-investingcom-united-kingdom-100-up-035-4447879,
Investing,U.K. stocks higher at close of trade; Investing.com United Kingdom 100 up 0.35%,https://www.investing.com/news/stock-market-news/uk-stocks-higher-at-close-of-trade-investingcom-united-kingdom-100-up-035-4447878,
Investing,Spain stocks higher at close of trade; IBEX 35 up 0.05%,https://www.investing.com/news/stock-market-news/spain-stocks-higher-at-close-of-trade-ibex-35-up-005-4447877,
Investing,Spain stocks higher at close of trade; IBEX 35 up 0.05%,https://www.investing.com/news/stock-market-news/spain-stocks-higher-at-close-of-trade-ibex-35-up-005-4447876,
Investing,Portugal stocks higher at close of trade; PSI up 0.10%,https://www.investing.com/news/stock-market-news/portugal-stocks-higher-at-close-of-trade-psi-up-010-4447875,
Investing,Netherlands stocks lower at close of trade; AEX down 0.04%,https://www.investing.com/news/stock-market-news/netherlands-stocks-lower-at-close-of-trade-aex-down-004-4447873,
