feed,title,long_url,short_url
Yahoo,Daily – Vickers Top Buyers & Sellers for 04/18/2025,https://finance.yahoo.com/research/reports/ARGUS_43282_TopBottomInsiderActivity_1744973245000?yptr=yahoo&ncid=yahooproperties_plusresear_nm5q6ze1cei,https://da.gd/dCzc
Yahoo,The US freight recession is showing no signs of relenting,https://finance.yahoo.com/news/us-freight-recession-showing-no-021108615.html,https://da.gd/kGo2T
Yahoo,3 No-Brainer Artificial Intelligence (AI) Stocks to Buy Right Now,https://www.fool.com/investing/2025/04/18/3-no-brainer-artificial-intelligence-ai-stocks-to/?source=eptyholnk0000202&utm_source=yahoo-host-full&utm_medium=feed&utm_campaign=article&referring_guid=80e2c825-1ff7-4a19-a729-6ccb50cc3798&.tsrc=rss,https://da.gd/yBT6E
Yahoo,Tesla Vs. BYD: Tesla Earnings Due With Focus On This. Fast-Charging Rival Also On Tap.,https://finance.yahoo.com/m/29c92e28-b5ab-392e-8f22-ae525864f9e8/tesla-vs.-byd%3A-tesla-earnings.html?.tsrc=rss,https://da.gd/SK1uw
Yahoo,Netflix Stock Poised To Break Out After Earnings Beat,https://finance.yahoo.com/m/f2810c74-db90-346d-ab49-2fd248f0afda/netflix-stock-poised-to-break.html?.tsrc=rss,https://da.gd/kS7oV4
