feed,title,long_url,short_url
Investing,Ceasefire Forex Trade Setups: Master EUR/USD Strength and Hidden CAD/USD Trends,https://www.investing.com/analysis/ceasefire-forex-trade-setups-master-eurusd-strength-and-hidden-cadusd-trends-200678292,
Investing,S&P 500: Earnings Become the Next Test With War and Inflation Already Priced In,https://www.investing.com/analysis/sp-500-earnings-become-the-next-test-with-war-and-inflation-already-priced-in-200678284,
Investing,A ‘Suez’ Moment for the US?,https://www.investing.com/analysis/a-suez-moment-for-the-us-200678279,
Investing,"CPI Signals, Key Data Ahead, and S&P 500 Technical Scenarios",https://www.investing.com/analysis/cpi-signals-key-data-ahead-and-sp-500-technical-scenarios-200678278,
Investing,The Case Against Blind Bullishness in Modern Markets,https://www.investing.com/analysis/the-case-against-blind-bullishness-in-modern-markets-200678277,
