feed,title,long_url,short_url
SeekingAlpha,TILT Holdings CEO Gary Santo resigns,https://seekingalpha.com/news/3959366,
SeekingAlpha,AGNC Investment Q1 earnings decline from Q4 amid challenging markets,https://seekingalpha.com/news/3959365,
SeekingAlpha,"Crown Holdings Non-GAAP EPS of $1.20 beats by $0.15, revenue of $2.97B misses by $130M",https://seekingalpha.com/news/3959364,
SeekingAlpha,"Ameriprise Financial Non-GAAP EPS of $7.25 beats by $0.04, revenue of $3.69B in-line",https://seekingalpha.com/news/3959363,
SeekingAlpha,"Alexandria Real Estate Equities FFO of $2.19 beats by $0.04, revenue of $700.8M beats by $14.1M",https://seekingalpha.com/news/3959362,
SeekingAlpha,"Enterprise Financial Services GAAP EPS of $1.46 beats by $0.09, revenue of $156.43M beats by $3.19M",https://seekingalpha.com/news/3959361,
SeekingAlpha,"Tenable Holdings Non-GAAP EPS of $0.11 beats by $0.08, revenue of $188.84M beats by $1.7M",https://seekingalpha.com/news/3959360,
