feed,title,long_url,short_url
SeekingAlpha,"Community Bancorp GAAP EPS of $0.61, revenue of $10.3M",https://seekingalpha.com/news/3959377,
SeekingAlpha,"Canadian National Railway Non-GAAP EPS of C$1.82 beats by C$0.10, revenue of C$4.31B beats by C$60M",https://seekingalpha.com/news/3959376,
SeekingAlpha,"Whirlpool rallies after Q1 results, full-year guidance top expectations",https://seekingalpha.com/news/3959375,
SeekingAlpha,Why did Coinbase stock slip today? Crypto prices extend retreat,https://seekingalpha.com/news/3959373,
SeekingAlpha,"Nabors GAAP EPS of $4.11 beats by $2.95, revenue of $789M beats by $16.13M",https://seekingalpha.com/news/3959372,
SeekingAlpha,Why did Rumble stock rise today? Tucker Carlson's on the market,https://seekingalpha.com/news/3959371,
