feed,title,long_url,short_url
SeekingAlpha,"Meta plans to make company leaner, cut down on VP positions: report",https://seekingalpha.com/news/4115358,
SeekingAlpha,"LICT GAAP EPS of $295.00, revenue of $33.5M",https://seekingalpha.com/news/4115372,
SeekingAlpha,Nike loses bid to trademark 'footware' by EU court,https://seekingalpha.com/news/4115369,
SeekingAlpha,ASLAN Pharmaceuticals files to sell 61.9M ordinary shares for holders,https://seekingalpha.com/news/4115368,
SeekingAlpha,DXY slows worst drop in 6 months as Powell voices wobbly confidence in CPI progress,https://seekingalpha.com/news/4115367,
