feed,title,long_url,short_url
SeekingAlpha,"Instacart, IBM sign mutual patent agreement",https://seekingalpha.com/news/3660183,
SeekingAlpha,"Mattel EPS beats by $0.16, beats on revenue",https://seekingalpha.com/news/3660182,
SeekingAlpha,"Rapid7 EPS beats by $0.01, beats on revenue",https://seekingalpha.com/news/3660181,
SeekingAlpha,"Manitowoc EPS beats by $0.10, misses on revenue",https://seekingalpha.com/news/3660180,
SeekingAlpha,KalVista announces proposed 4.5M public offering,https://seekingalpha.com/news/3660179,
SeekingAlpha,"PennantPark FII misses by $0.01, misses on total investment income",https://seekingalpha.com/news/3660178,
SeekingAlpha,"Alteryx EPS beats by $0.31, beats on revenue",https://seekingalpha.com/news/3660177,
