feed,title,long_url,short_url
SeekingAlpha,"American Tower FFO of $2.46 misses by $0.06, revenue of $2.71B beats by $30M",https://seekingalpha.com/news/3939790,
SeekingAlpha,"Papa John's Non-GAAP EPS of $0.71 beats by $0.04, revenue of $526.23M beats by $2.15M",https://seekingalpha.com/news/3939788,
SeekingAlpha,"Planet Fitness powers up strong quarter off record membership growth, new stores",https://seekingalpha.com/news/3939784,
SeekingAlpha,"Quanta Services Non-GAAP EPS of $1.68 beats by $0.07, revenue of $4.42B beats by $140M",https://seekingalpha.com/news/3939782,
SeekingAlpha,American Electric Power beats Q4 top and bottom line estimates; reaffirms FY23 outlook,https://seekingalpha.com/news/3939781,
SeekingAlpha,"Computer Task Group GAAP EPS of $0.14, revenue of $77.9M",https://seekingalpha.com/news/3939780,
