feed,title,long_url,short_url
SeekingAlpha,Synopsys enters $300M accelerated share repurchase agreement,https://seekingalpha.com/news/3939953,
SeekingAlpha,"Trimas GAAP EPS of $0.45 misses by $0.16, revenue of $203.3M misses by $8.35M",https://seekingalpha.com/news/3939954,
SeekingAlpha,"Thunderbird Entertainment GAAP EPS of -C$0.006, revenue of C$47.96M",https://seekingalpha.com/news/3939951,
SeekingAlpha,"Howden Joinery Group Plc FY GAAP EPS, revenue up Y/Y",https://seekingalpha.com/news/3939950,
SeekingAlpha,"Hikma Pharmaceuticals GAAP EPS of $1.81, revenue of $2.52B",https://seekingalpha.com/news/3939949,
