feed,title,long_url,short_url
Investing,DeFi Technologies subsidiary Valour surpasses $274 million in AUM,https://investing.com/news/-2795125,
Investing,"$350,000 Bored Ape NFT sells for just $115",https://investing.com/news/-2795116,
Investing,ECB official suggests importance of physical stores accepting digital euro,https://investing.com/news/-2795112,
Investing,Alibaba leads $60M funding round for AR startup Nreal,https://investing.com/news/-2795100,
Investing,Aave v3 launch triggers 50% rally from long-term descending channel pattern,https://investing.com/news/-2795092,
