feed,title,long_url,short_url
SeekingAlpha,Vanguard Intermediate-Term Corporate Bond ETF declares monthly distribution of $0.1811,https://seekingalpha.com/news/3819470,
SeekingAlpha,Vanguard Short-Term Corporate Bond ETF declares monthly distribution of $0.1064,https://seekingalpha.com/news/3819469,
SeekingAlpha,Vanguard Long-Term Treasury ETF declares monthly distribution of $0.1481,https://seekingalpha.com/news/3819468,
SeekingAlpha,Vanguard Intermediate-Term Treasury ETF declares monthly distribution of $0.0678,https://seekingalpha.com/news/3819467,
SeekingAlpha,Vanguard Short-Term Treasury ETF declares monthly distribution of $0.0243,https://seekingalpha.com/news/3819466,
SeekingAlpha,Vanguard Total World Bond ETF declares monthly distribution of $0.0910,https://seekingalpha.com/news/3819465,
