feed,title,long_url,short_url
SeekingAlpha,Truist Bank to redeem senior notes due May 2022,https://seekingalpha.com/news/3819545,
SeekingAlpha,"Pioneer Power GAAP EPS of -$0.16 misses by $0.10, revenue of $3.5M misses by $2.47M",https://seekingalpha.com/news/3819544,
SeekingAlpha,SunPower says in talks with First Solar to develop residential panels,https://seekingalpha.com/news/3819543,
SeekingAlpha,"Blend Labs GAAP EPS of -$0.32 misses by $0.08, revenue of $80.99M misses by $0.26M",https://seekingalpha.com/news/3819542,
SeekingAlpha,AgileThought reports Q4 results,https://seekingalpha.com/news/3819541,
SeekingAlpha,"Arco Platform GAAP EPS of -$0.10 misses by $0.39, revenue of $460.8M beats by $380.32M",https://seekingalpha.com/news/3819539,
