feed,title,long_url,short_url
SeekingAlpha,Hawkins increases revolving credit facility to $250M,https://seekingalpha.com/news/3819586,
SeekingAlpha,"Aravive GAAP EPS of -$0.62 misses by $0.02, revenue of $0.99M misses by $0.52M",https://seekingalpha.com/news/3819585,
SeekingAlpha,"BM Technologies GAAP EPS of $0.26, revenue of $25.3M",https://seekingalpha.com/news/3819584,
SeekingAlpha,Soleno Therapeutics GAAP EPS of -$0.04,https://seekingalpha.com/news/3819583,
SeekingAlpha,Defense Technologies International announces reverse stock split,https://seekingalpha.com/news/3819582,
SeekingAlpha,"Odyssey Marine Exploration GAAP EPS of -$0.75, revenue of $0.92M",https://seekingalpha.com/news/3819581,
SeekingAlpha,"Interpace Biosciences GAAP EPS of -$0.89, revenue of $10.86M",https://seekingalpha.com/news/3819580,
