feed,title,long_url,short_url
Benzinga,Cryptocurrency Uniswap Up More Than 7% In 24 hours,https://benzinga.com/markets/cryptocurrency/23/12/36363067/cryptocurrency-uniswap-up-more-than-7-in-24-hours,https://da.gd/b0mW
Benzinga,Check Out What Whales Are Doing With JNJ,https://benzinga.com/markets/options/23/12/36363065/check-out-what-whales-are-doing-with-jnj,https://da.gd/yDkp4
Benzinga,Behind the Scenes of Costco Wholesale's Latest Options Trends,https://benzinga.com/markets/options/23/12/36363062/behind-the-scenes-of-costco-wholesales-latest-options-trends,https://da.gd/BdLrAy
Benzinga,Lido Staked Ether Up More Than 4% In 24 hours,https://benzinga.com/markets/cryptocurrency/23/12/36363061/lido-staked-ether-up-more-than-4-in-24-hours,https://da.gd/YFp2H
Benzinga,Spotlight on Advanced Micro Devices: Analyzing the Surge in Options Activity,https://benzinga.com/markets/options/23/12/36363059/spotlight-on-advanced-micro-devices-analyzing-the-surge-in-options-activity,https://da.gd/MZRm
Benzinga,Polygon's Price Increased More Than 8% Within 24 hours,https://benzinga.com/markets/cryptocurrency/23/12/36363012/polygons-price-increased-more-than-8-within-24-hours,https://da.gd/H5HSN
Benzinga,Ethereum Up More Than 4% In 24 hours,https://benzinga.com/markets/cryptocurrency/23/12/36362975/ethereum-up-more-than-4-in-24-hours,https://da.gd/DHPv
