feed,title,long_url,short_url
InvestorPlace,"8 Top Penny Stocks to Watch Today: EVGRF, PTE, BLCT, GNPX, AFI, CELZ, AUVI, WAVE",https://investorplace.com/2022/01/8-top-penny-stocks-to-watch-today-evgrf-pte-blct-gnpx-afi-celz-auvi-wave/,https://j.mp/3zjvirO
InvestorPlace,Pay Attention to Decentraland Now As It Starts to Strutt Its Stuff,https://investorplace.com/2022/01/pay-attention-to-decentraland-now-as-it-starts-to-strutt-its-stuff/,https://j.mp/3mScQBJ
InvestorPlace,"Chinese EV Stocks: What Is Going on With NIO, LI, XPEV Today?",https://investorplace.com/2022/01/chinese-ev-stocks-what-is-going-on-with-nio-li-xpev-today/,https://j.mp/32NSYZz
InvestorPlace,Upstart’s Outlook Has Brightened with Long-Term Opportunities,https://investorplace.com/2022/01/the-outlook-for-upst-stock-has-brightened-with-long-term-opportunities/,https://j.mp/3qQGKYq
InvestorPlace,3 Stocks to Buy for a Miracle Comeback in 2022,https://investorplace.com/2022/01/3-stocks-to-buy-for-a-miracle-comeback-in-2022/,https://j.mp/31oHds2
