feed,title,long_url,short_url
SeekingAlpha,"Hut 8, Iris Energy among financial movers",https://seekingalpha.com/news/4083830,
SeekingAlpha,"Altisource Portfolio Solutions, Fathom Holdings in real estate losers",https://seekingalpha.com/news/4083829,
SeekingAlpha,Northern Star seeks OK to expand Kalgoorlie 'Super Pit' gold mine,https://seekingalpha.com/news/4083828,
SeekingAlpha,FTEC: Concentration Increases Volatility,https://seekingalpha.com/article/4680503,
SeekingAlpha,Advanced Durable Goods Shipments Feb 2024: Still Weak,https://seekingalpha.com/article/4680511,
