feed,title,long_url,short_url
Motley,1 Top Energy Stock I Wouldn't Hesitate to Buy in June,https://www.fool.com/investing/2025/06/04/1-top-energy-stock-i-wouldnt-hesitate-to-buy-in-ju/?source=iedfolrf0000001,https://da.gd/iPMvf
Motley,Warren Buffett's Favorite Stock Is Crushing the S&P 500 in 2025. Here's Why It's Still a Buy.,https://www.fool.com/investing/2025/06/04/warren-buffetts-stock-crushing-sp-500-in-2025-buy/?source=iedfolrf0000001,https://da.gd/lb3e8
Motley,This Quantum Computing Stock Soared Over 30% In May. Is It a Buy Now?,https://www.fool.com/investing/2025/06/04/this-quantum-computing-stock-soared-over-50-in-may/?source=iedfolrf0000001,https://da.gd/RQyv7q
Motley,The Kind of Artificial Intelligence (AI) Stock Warren Buffett Might Buy (if He Invested in AI),https://www.fool.com/investing/2025/06/04/the-kind-of-artificial-intelligence-ai-stock-warre/?source=iedfolrf0000001,https://da.gd/kh7th
Motley,1 No-Brainer Artificial Intelligence (AI) Stock to Buy on the Dip,https://www.fool.com/investing/2025/06/04/1-no-brainer-artificial-intelligence-ai-stock-to-b/?source=iedfolrf0000001,https://da.gd/E0co2
