feed,title,long_url,short_url
Investing,CrowdStrike Misses Q2 Guidance but Full-Year Outlook and EPS Bump Signal Strength,https://www.investing.com/analysis/crowdstrike-eyes-longterm-growth-as-guidance-miss-fails-to-deter-bulls-200661712,https://da.gd/uxEbt
Investing,Cango Inc. Amends Share-Settled Crypto Mining Assets Acquisitions,https://www.investing.com/news/cryptocurrency-news/cango-inc-amends-sharesettled-crypto-mining-assets-acquisitions-432SI-4079861,https://da.gd/xwyh
Investing,Tesla's German car sales continue to decline in May,https://www.investing.com/news/stock-market-news/teslas-german-car-sales-continue-to-decline-in-may-4079870,https://da.gd/bYEWaL
Investing,US senators press antitrust enforcers over Rocket-Redfin deal,https://www.investing.com/news/stock-market-news/us-senators-press-antitrust-enforcers-over-rocketredfin-deal-4079869,https://da.gd/PKxrO
Investing,U.K. finance minister rules out similar tax hikes to last year,https://www.investing.com/news/economy-news/uk-finance-minister-rules-out-similar-tax-hikes-to-last-year-4079895,https://da.gd/mez78B
Investing,"BOJ to consider slowing pace of bond tapering next year, sources say",https://www.investing.com/news/economy-news/boj-to-consider-slowing-pace-of-bond-tapering-next-year-sources-say-4079893,https://da.gd/rOXSj
Investing,Swiss deflation paves way for rate cut in June: Wells Fargo,https://www.investing.com/news/economy/swiss-deflation-paves-way-for-rate-cut-in-june-wells-fargo-4079887,https://da.gd/gCqKL4
Investing,"Bank of Canada most likely to hold rates after rise in core inflation, GDP surprise",https://www.investing.com/news/economy-news/bank-of-canada-most-likely-to-hold-rates-after-rise-in-core-inflation-gdp-surprise-4079871,https://da.gd/0eXXp
Investing,"New York pension scheme weighs year-end review of asset allocation, FT reports",https://www.investing.com/news/economy-news/new-york-pension-scheme-weighs-yearend-review-of-asset-allocation-ft-reports-4079856,https://da.gd/u7za
