feed,title,long_url,short_url
SeekingAlpha,The Baldwin Group prices credit facilities to borrow up to $1.44B,https://seekingalpha.com/news/4107373,
SeekingAlpha,Cirrus Logic slides as Benchmark cuts on valuation concerns,https://seekingalpha.com/news/4107369,
SeekingAlpha,Replimune Group GAAP EPS of -$3.24 misses by $0.07,https://seekingalpha.com/news/4107372,
SeekingAlpha,"4 stocks to watch on Thursday: WMT, DE and more",https://seekingalpha.com/news/4107371,
SeekingAlpha,"Industrial production growth stalls in April, missing consensus",https://seekingalpha.com/news/4107368,
SeekingAlpha,Helios Towers reports Q1 results,https://seekingalpha.com/news/4107367,
SeekingAlpha,Soluna Holdings reports Q1 results,https://seekingalpha.com/news/4107366,
