feed,title,long_url,short_url
SeekingAlpha,"Questor Technology GAAP EPS of -C$0.02, revenue of C$0.73M",https://seekingalpha.com/news/4107403,
SeekingAlpha,NexLiving Communities reports Q1 results,https://seekingalpha.com/news/4107402,
SeekingAlpha,"Crown Capital Partners GAAP EPS of -$0.11, revenue of $17.73M",https://seekingalpha.com/news/4107401,
SeekingAlpha,"Cansortium CFO resigns, Patricia Fonseca re-appointed to post",https://seekingalpha.com/news/4107400,
SeekingAlpha,Marex reports FY results,https://seekingalpha.com/news/4107399,
