feed,title,long_url,short_url
InvestorPlace,3 Top Semiconductor Stocks Primed to Produce Outsized Profits,https://investorplace.com/2024/05/3-top-semiconductor-stocks-primed-to-produce-outsized-profits/,https://da.gd/LmE9al
InvestorPlace,CTCX Stock Earnings: Carmell Therapeutics Reported Results for Q4 2023,https://investorplace.com/earning-results/2024/05/ctcx-stock-earnings-carmell-therapeutics-for-q4-of-2023/,https://da.gd/k4CVzu
InvestorPlace,TTNP Stock Earnings: Titan Pharmaceuticals Reported Results for Q4 2023,https://investorplace.com/earning-results/2024/05/ttnp-stock-earnings-titan-pharmaceuticals-for-q4-of-2023/,https://da.gd/ddIdDp
InvestorPlace,"CSLR Stock Earnings: Complete Solaria Misses EPS, Misses Revenue for Q1 2024",https://investorplace.com/earning-results/2024/05/cslr-stock-earnings-complete-solaria-for-q1-of-2024/,https://da.gd/42Ib
InvestorPlace,MUFG Stock Earnings: Mitsubishi UFJ Finl Gr Beats EPS for Q4 2023,https://investorplace.com/earning-results/2024/05/mufg-stock-earnings-mitsubishi-ufj-finl-gr-for-q4-of-2023/,https://da.gd/bPAz7
InvestorPlace,SMXT Stock Earnings: SolarMax Technology Reported Results for Q1 2024,https://investorplace.com/earning-results/2024/05/smxt-stock-earnings-solarmax-technology-for-q1-of-2024/,https://da.gd/8ZSPw
InvestorPlace,MLSS Stock Earnings: Milestone Scientific Reported Results for Q1 2024,https://investorplace.com/earning-results/2024/05/mlss-stock-earnings-milestone-scientific-for-q1-of-2024/,https://da.gd/x1fkt
InvestorPlace,"USAS Stock Earnings: Americas Gold And Silver Misses EPS, Misses Revenue for Q1 2024",https://investorplace.com/earning-results/2024/05/usas-stock-earnings-americas-gold-and-silver-for-q1-of-2024/,https://da.gd/GrPy1H
InvestorPlace,ASPI Stock Earnings: ASP Isotopes Reported Results for Q1 2024,https://investorplace.com/earning-results/2024/05/aspi-stock-earnings-asp-isotopes-for-q1-of-2024/,https://da.gd/yA9yg
InvestorPlace,VHC Stock Earnings: VirnetX Holding Reported Results for Q1 2024,https://investorplace.com/earning-results/2024/05/vhc-stock-earnings-virnetx-holding-for-q1-of-2024/,https://da.gd/5E56
InvestorPlace,VERY Stock Earnings: Vericity Reported Results for Q1 2024,https://investorplace.com/earning-results/2024/05/very-stock-earnings-vericity-for-q1-of-2024/,https://da.gd/5ZAlYu
InvestorPlace,TAIT Stock Earnings: Taitron Components Reported Results for Q1 2024,https://investorplace.com/earning-results/2024/05/tait-stock-earnings-taitron-components-for-q1-of-2024/,https://da.gd/PhOerK
InvestorPlace,RENB Stock Earnings: Renovaro Biosciences Reported Results for Q3 2024,https://investorplace.com/earning-results/2024/05/renb-stock-earnings-renovaro-biosciences-for-q3-of-2024/,https://da.gd/ymLgb
InvestorPlace,CTM Stock Earnings: Castellum Reported Results for Q1 2024,https://investorplace.com/earning-results/2024/05/ctm-stock-earnings-castellum-for-q1-of-2024/,https://da.gd/N2emO
InvestorPlace,MTA Stock Earnings: Metalla Royalty Reported Results for Q1 2024,https://investorplace.com/earning-results/2024/05/mta-stock-earnings-metalla-royalty-for-q1-of-2024/,https://da.gd/aaYos
InvestorPlace,"GTEC Stock Earnings: Greenland Technologies Beats EPS, Misses Revenue for Q1 2024",https://investorplace.com/earning-results/2024/05/gtec-stock-earnings-greenland-technologies-for-q1-of-2024/,https://da.gd/X4Bro
InvestorPlace,LRHC Stock Earnings: La Rosa Holdings Reported Results for Q1 2024,https://investorplace.com/earning-results/2024/05/lrhc-stock-earnings-la-rosa-holdings-for-q1-of-2024/,https://da.gd/Gex3C7
InvestorPlace,PBBK Stock Earnings: PB Bankshares Reported Results for Q1 2024,https://investorplace.com/earning-results/2024/05/pbbk-stock-earnings-pb-bankshares-for-q1-of-2024/,https://da.gd/fXT3
InvestorPlace,AGBA Stock Earnings: AGBA Group Holding Reported Results for Q1 2024,https://investorplace.com/earning-results/2024/05/agba-stock-earnings-agba-group-holding-for-q1-of-2024/,https://da.gd/9gJzmC
InvestorPlace,MACK Stock Earnings: Merrimack Pharmaceuticals Reported Results for Q1 2024,https://investorplace.com/earning-results/2024/05/mack-stock-earnings-merrimack-pharmaceuticals-for-q1-of-2024/,https://da.gd/VDSP6r
InvestorPlace,MSAI Stock Earnings: Infrared Cameras Holdings Reported Results for Q1 2024,https://investorplace.com/earning-results/2024/05/msai-stock-earnings-infrared-cameras-holdings-for-q1-of-2024/,https://da.gd/k8iQyt
InvestorPlace,"CLIR Stock Earnings: ClearSign Technologies Meets EPS, Beats Revenue for Q1 2024",https://investorplace.com/earning-results/2024/05/clir-stock-earnings-clearsign-technologies-for-q1-of-2024/,https://da.gd/KH2fn
InvestorPlace,Why Is Kulr Technology (KULR) Stock Down 28% Today?,https://investorplace.com/2024/05/why-is-kulr-technology-kulr-stock-down-28-today/,https://da.gd/OhLf
