feed,title,long_url,short_url
Benzinga,"AIG Reduces Corebridge Stake, Sells 120M Shares To Nippon Life",https://benzinga.com/m-a/24/05/38874554/aig-reduces-corebridge-stake-sells-120m-shares-to-nippon-life,https://da.gd/OT2OAV
Benzinga,"Market Clubhouse Morning Memo - May 16th, 2024 (Trade Strategy For SPY, QQQ, AAPL, MSFT, NVDA, GOOGL, META And TSLA)",https://benzinga.com/markets/24/05/38874522/market-clubhouse-morning-memo-may-16th-2024-trade-strategy-for-spy-qqq-aapl-msft-nvda-googl-meta-and,https://da.gd/fpEo0
Benzinga,Vertiv Hldgs Options Trading: A Deep Dive into Market Sentiment,https://benzinga.com/insights/options/24/05/38874493/vertiv-hldgs-options-trading-a-deep-dive-into-market-sentiment,https://da.gd/R9S8Z
Benzinga,Market Whales and Their Recent Bets on TSM Options,https://benzinga.com/insights/options/24/05/38874491/market-whales-and-their-recent-bets-on-tsm-options,https://da.gd/IWBFZt
Benzinga,This Is What Whales Are Betting On Trade Desk,https://benzinga.com/insights/options/24/05/38874488/this-is-what-whales-are-betting-on-trade-desk,https://da.gd/q5ClH
