feed,title,long_url,short_url
Nasdaq,Daily Markets: Taking a Breather Before The Earnings Marathon,https://www.nasdaq.com/articles/daily-markets%3A-taking-a-breather-before-the-earnings-marathon-2021-04-12,https://j.mp/3wX7Lf1
Nasdaq,Role of an Exchange: The Facts on SPACs,https://www.nasdaq.com/articles/role-of-an-exchange%3A-the-facts-on-spacs-2021-04-12,https://j.mp/3wQZVTM
Nasdaq,"Role of an Exchange: SPACs Offer Unique Opportunities, But Proceed at Your Own Risk",https://www.nasdaq.com/articles/role-of-an-exchange%3A-spacs-offer-unique-opportunities-but-proceed-at-your-own-risk-2021-04,https://j.mp/3wNbBHi
Nasdaq,Role of an Exchange: Five Key Questions to Consider About SPACs,https://www.nasdaq.com/articles/role-of-an-exchange%3A-five-key-questions-to-consider-about-spacs-2021-04-12,https://j.mp/326ulDt
Nasdaq,United Airlines sees first-quarter revenue falling 66%,https://www.nasdaq.com/articles/united-airlines-sees-first-quarter-revenue-falling-66-2021-04-12,https://j.mp/3a2hRRI
Nasdaq,"Myovant, Pfizer Initiate SERENE Study Evaluating Contraceptive Efficacy Of Relugolix",https://www.nasdaq.com/articles/myovant-pfizer-initiate-serene-study-evaluating-contraceptive-efficacy-of-relugolix-2021,https://j.mp/3mH0YRW
Nasdaq,Ingersoll Rand To Sell Club Car Business To Platinum Equity In All-cash Deal Valued At $1.68 Bln,https://www.nasdaq.com/articles/ingersoll-rand-to-sell-club-car-business-to-platinum-equity-in-all-cash-deal-valued-at-%241,https://j.mp/3d8l9on
Nasdaq,Ameriprise Financial To Buy BMO's EMEA Asset Management Business For About US$845 Mln,https://www.nasdaq.com/articles/ameriprise-financial-to-buy-bmos-emea-asset-management-business-for-about-us%24845-mln-2021,https://j.mp/2Qf6hM3
Nasdaq,"Philippines, U.S. launch military drills amid South China Sea tensions",https://www.nasdaq.com/articles/philippines-u.s.-launch-military-drills-amid-south-china-sea-tensions-2021-04-12,https://j.mp/2Ro70Ln
Nasdaq,How Okta Increased Its Addressable Market by $15 Billion,https://www.nasdaq.com/articles/how-okta-increased-its-addressable-market-by-%2415-billion-2021-04-12,https://j.mp/3tfma3C
Nasdaq,Medtronic: FDA Grants De Novo Clearance For GI Genius Intelligent Endoscopy Module,https://www.nasdaq.com/articles/medtronic%3A-fda-grants-de-novo-clearance-for-gi-genius-intelligent-endoscopy-module-2021-04,https://j.mp/3a5RFWl
Nasdaq,Creval investor DGFD asks Credit Agricole to up bid price,https://www.nasdaq.com/articles/creval-investor-dgfd-asks-credit-agricole-to-up-bid-price-2021-04-12,https://j.mp/3g1NTkL
Nasdaq,Enveric Biosciences Names Carter Ward CFO - Quick Facts,https://www.nasdaq.com/articles/enveric-biosciences-names-carter-ward-cfo-quick-facts-2021-04-12,https://j.mp/3uNU7sH
