feed,title,long_url,short_url
SeekingAlpha,"Baker Hughes files for mixed shelf, size not disclosed",https://seekingalpha.com/news/4042510,
SeekingAlpha,Eos Energy files for $300M mixed securities shelf,https://seekingalpha.com/news/4042509,
SeekingAlpha,Cancer test developer Personalis to cut 65 jobs to reduce costs,https://seekingalpha.com/news/4042508,
SeekingAlpha,BlackRock Short Maturity Bond ETF declares monthly distribution of $0.2349,https://seekingalpha.com/news/4042507,
SeekingAlpha,Novo Nordisk reportedly paid over $25M to doctors to promote obesity drugs,https://seekingalpha.com/news/4042506,
