feed,title,long_url,short_url
gNews,"Robinhood Traders Suddenly Love Antero Midstream, But Why? And Is There A Better Option? - Forbes",https://www.forbes.com/sites/christopherhelman/2020/08/28/robinhood-traders-suddenly-love-antero-midstream-but-why-and-is-there-a-better-option/,https://j.mp/3gFGCna
gNews,Hedge funds are scrambling to find data on Robinhood - Business Insider - Business Insider,https://www.businessinsider.com/top-finance-stories-of-the-day-for-august-13-2020-8,https://j.mp/3ltoelf
gNews,A Robinhood Pop Doesn't Make Ocugen Stock a Smart Investment - InvestorPlace,https://investorplace.com/2020/08/robinhood-pop-ocgn-stock-smart-investment/,https://j.mp/2YEINBt
gNews,3 High-Growth Stocks Robinhood Investors Are Buying Hand Over Fist - Nasdaq,https://www.nasdaq.com/articles/3-high-growth-stocks-robinhood-investors-are-buying-hand-over-fist-2020-07-28,https://j.mp/34Gg3fq
gNews,DeFi Project Spotlight: Matcha and “The Robinhood of Ethereum” - Crypto Briefing,https://cryptobriefing.com/defi-project-spotlight-matcha-robinhood-ethereum/,https://j.mp/3b7mRDW
