feed,title,long_url,short_url
SeekingAlpha,"Where Food Comes From GAAP EPS of $0.02, revenue of $5.3M",https://seekingalpha.com/news/3971291,
SeekingAlpha,"Jaguar Health GAAP EPS of -$2.39, revenue of $1.97M",https://seekingalpha.com/news/3971290,
SeekingAlpha,"Vodacom GAAP EPS of R948.00,cents revenue of R119.2B",https://seekingalpha.com/news/3971289,
SeekingAlpha,InspireMD to raise $113.M via private placement,https://seekingalpha.com/news/3971288,
SeekingAlpha,"Star Equity Holdings Non-GAAP EPS of $0.06, revenue of $25.7M misses by $1.3M",https://seekingalpha.com/news/3971287,
