feed,title,long_url,short_url
SeekingAlpha,Park City Group reports FQ3 results,https://seekingalpha.com/news/3971663,
SeekingAlpha,"Dragonfly Energy GAAP EPS of $0.10 beats by $0.24, revenue of $18.8M beats by $0.45M",https://seekingalpha.com/news/3971661,
SeekingAlpha,"Trxade Group GAAP EPS of -$0.03 in-line, revenue of $2.25M misses by $0.41M",https://seekingalpha.com/news/3971660,
SeekingAlpha,"Pioneer Power reports Q1 results, reaffirms FY 2023 revenue guidance",https://seekingalpha.com/news/3971659,
SeekingAlpha,Northern Oil and Gas to buy 30% stake in Forge assets in $162M deal,https://seekingalpha.com/news/3971662,
SeekingAlpha,Know Labs GAAP EPS of -$0.10,https://seekingalpha.com/news/3971658,
