feed,title,long_url,short_url
SeekingAlpha,Franklin Resources: Buying Does Not Solve Underlying Problems,https://seekingalpha.com/article/4613490,
SeekingAlpha,Picking A Winner In Apartment REITs,https://seekingalpha.com/article/4612926,
SeekingAlpha,Occidental Petroleum: Is It A Buy Below Berkshire's Average Purchases?,https://seekingalpha.com/article/4613463,
SeekingAlpha,Rally Fades After Fed Warning,https://seekingalpha.com/article/4613470,
SeekingAlpha,Why I Ceased Buying Rental Properties To Buy REITs Instead,https://seekingalpha.com/article/4613480,
