feed,title,long_url,short_url
Benzinga,What Does Dun & Bradstreet Hldgs's Debt Look Like?,https://benzinga.com/news/22/02/25600316/what-does-dun-bradstreet-hldgss-debt-look-like,https://bit.ly/3sBPz9m
Benzinga,5 Value Stocks To Watch In The Communication Services Sector,https://benzinga.com/news/22/02/25600309/5-value-stocks-to-watch-in-the-communication-services-sector,https://bit.ly/33mYxP6
Benzinga,What Does Cedar Fair's Debt Look Like?,https://benzinga.com/news/22/02/25600289/what-does-cedar-fairs-debt-look-like,https://bit.ly/3sBUd73
Benzinga,A Look Into Oil States International's Debt,https://benzinga.com/news/22/02/25600278/a-look-into-oil-states-internationals-debt,https://bit.ly/3oMyp7U
Benzinga,5 Value Stocks To Watch In The Healthcare Sector,https://benzinga.com/news/22/02/25600277/5-value-stocks-to-watch-in-the-healthcare-sector,https://bit.ly/3Lx472q
Benzinga,A Look Into Nutrien's Debt,https://benzinga.com/news/22/02/25600265/a-look-into-nutriens-debt,https://bit.ly/366DBwB
Benzinga,A Look Into Kadant's Debt,https://benzinga.com/news/22/02/25600141/a-look-into-kadants-debt,https://bit.ly/3sBPyCk
Benzinga,What Does KAR Auction Services's Debt Look Like?,https://benzinga.com/news/22/02/25600111/what-does-kar-auction-servicess-debt-look-like,https://bit.ly/3rLOw7f
Benzinga,Overview Of Value Stocks In The Real Estate Sector,https://benzinga.com/news/22/02/25600069/overview-of-value-stocks-in-the-real-estate-sector,https://bit.ly/3gKLv0S
