feed,title,long_url,short_url
Investing,NFTs are changing the way photographers create and market content,https://investing.com/news/-2792581,
Investing,"Like Get Rich Schemes, NFT Hype Has Slowly Fizzles Out, but the Possibilities Remains Endless",https://investing.com/news/-2792580,
Investing,Cryptocurrency vs. Stocks: Key differences explained,https://investing.com/news/-2792578,
Investing,Is Illuvium the first fun crypto RPG video game?,https://investing.com/news/-2792573,
Investing,Privacy coins are surging. Will regulatory pressure stall their stellar run?,https://investing.com/news/-2792572,
Investing,Dogecoin signals bottoming out as DOGE rebounds 30% in two weeks — What's next?,https://investing.com/news/-2792568,
Investing,Here is how studying tokens’ price history helps patient traders enjoy consistent average gains,https://investing.com/news/-2792561,
Investing,6 Questions for Mitch Liu of Theta Labs,https://investing.com/news/-2792558,
Investing,Streaming showdown and a ceremony shakeup set stage for Oscar Sunday,https://investing.com/news/-2792515,
Investing,Israel stocks lower at close of trade; TA 35 down 0.06%,https://investing.com/news/-2792579,
Investing,"Daimler Truck sees electric trucks costs staying high, FT says",https://investing.com/news/-2792559,
