feed,title,long_url,short_url
SeekingAlpha,OIG and ACHR among industrial movers,https://seekingalpha.com/news/3988849,
SeekingAlpha,Sono Group stock plummets 32% on delisting notice from Nasdaq,https://seekingalpha.com/news/3988848,
SeekingAlpha,IPO Update: Advanced Biomed Finalizes $112 Million U.S. IPO Plan,https://seekingalpha.com/article/4618119,
SeekingAlpha,UniCredit: Cheap Valuation And Hefty Capital Returns,https://seekingalpha.com/article/4618118,
SeekingAlpha,"Meta Platforms: Threads Is A Cannibalizing App, But A Winner In The Long Run",https://seekingalpha.com/article/4618117,
