feed,title,long_url,short_url
Investing,"IBM earnings beat by $0.16, revenue fell short of estimates",https://www.investing.com/news/stock-market-news/ibm-earnings-beat-by-016-revenue-fell-short-of-estimates-3129201,https://da.gd/Wd85BA
Investing,"Kinder Morgan earnings matched, revenue fell short of estimates",https://www.investing.com/news/stock-market-news/kinder-morgan-earnings-matched-revenue-fell-short-of-estimates-3129200,https://da.gd/5Quo3q
Investing,IBM misses second-quarter revenue estimates as IT spending cools,https://www.investing.com/news/stock-market-news/ibm-misses-secondquarter-revenue-estimates-as-it-spending-cools-3129195,https://da.gd/ichE3
Investing,"United Airlines Holdings earnings beat by $1.05, revenue topped estimates",https://www.investing.com/news/stock-market-news/united-airlines-holdings-earnings-beat-by-105-revenue-topped-estimates-3129190,https://da.gd/2ZDS9
Investing,"Tesla earnings beat by $0.12, revenue topped estimates",https://www.investing.com/news/stock-market-news/tesla-earnings-beat-by-012-revenue-topped-estimates-3129189,https://da.gd/Rk9TI
Investing,"Netflix tops Wall Street forecasts with password limits, ad option",https://www.investing.com/news/stock-market-news/netflix-tops-wall-street-forecasts-with-password-limits-ad-option-3129186,https://da.gd/r34x
Investing,Sequoia Capital partner Michael Moritz to exit firm after 38 years,https://www.investing.com/news/stock-market-news/sequoia-capital-partner-michael-moritz-to-exit-firm-after-38-years-3129185,https://da.gd/w2aG1
Investing,Tesla reports sequentially lower quarterly gross margin,https://www.investing.com/news/economy/tesla-reports-sequentially-lower-quarterly-gross-margin-3129196,https://da.gd/6lz5
