feed,title,long_url,short_url
gNews,Robinhood drew 34% of crypto revenue from being ‘overexposed’ to Dogecoin (DOGE) - CryptoSlate,https://cryptoslate.com/robinhood-drew-34-of-crypto-revenue-from-being-overexposed-to-dogecoin-doge/,https://j.mp/3hf4K3w
gNews,Online brokerage Robinhood makes U.S. IPO filing public - Reuters,https://www.reuters.com/technology/online-brokerage-robinhood-makes-us-ipo-filing-public-2021-07-01/,https://reut.rs/3qL835Q
gNews,Forget Robinhood! Canada’s Version Is Much Better - Yahoo Canada Finance,https://ca.finance.yahoo.com/news/forget-robinhood-canada-version-much-210036849.html,https://yhoo.it/3dEkTgO
gNews,Robinhood crypto trading outage strikes as Dogecoin spikes [Update] - SlashGear,https://www.slashgear.com/robinhood-crypto-trading-outage-strikes-as-dogecoin-spikes-04671520/,https://j.mp/3hwmJSf
gNews,Why Robinhood froze the buying of some stocks : Planet Money - NPR,https://www.npr.org/2021/02/02/963466346/robinhoods-very-bad-day,https://n.pr/3tsHinx
