feed,title,long_url,short_url
SeekingAlpha,HBT Financial announces $15M stock repurchase program,https://seekingalpha.com/news/3630740,
SeekingAlpha,Spotify rolling out stand-alone streaming on Apple Watch,https://seekingalpha.com/news/3630739,
SeekingAlpha,"Trecora Resources EPS in-line, misses on revenue",https://seekingalpha.com/news/3630738,
SeekingAlpha,"Five Prime Therapeutics EPS misses by $0.15, misses on revenue",https://seekingalpha.com/news/3630737,
SeekingAlpha,Weyco reports Q3 results,https://seekingalpha.com/news/3630736,
SeekingAlpha,"Kimball Electronics EPS beats by $0.32, beats on revenue",https://seekingalpha.com/news/3630735,
SeekingAlpha,Two more Lyft execs depart ahead of important ballot measure - The Information,https://seekingalpha.com/news/3630734,
