feed,title,long_url,short_url
SeekingAlpha,"Apple could aid 20% of all consumers around the world access AI, Wedbush says",https://seekingalpha.com/news/4147948,
SeekingAlpha,Papa John’s International names Vasconi as chief digital and technology officer,https://seekingalpha.com/news/4147952,
SeekingAlpha,Summit stock soars as lung cancer drug beats Merck’s Keytruda in late-stage trial,https://seekingalpha.com/news/4147951,
SeekingAlpha,"Palantir, BP ink pact for new AI capabilities",https://seekingalpha.com/news/4147949,
SeekingAlpha,Mobilicom reports 1H results,https://seekingalpha.com/news/4147950,
