feed,title,long_url,short_url
SeekingAlpha,"CCC Intelligent GAAP EPS of $0.03 beats by $0.03, revenue of $232.6M beats by $2.43M",https://seekingalpha.com/news/4130567,
SeekingAlpha,"Advanced Micro Devices Non-GAAP EPS of $0.69 beats by $0.01, revenue of $5.84B beats by $120M",https://seekingalpha.com/news/4130566,
SeekingAlpha,Earnings Summary: MSFT beats on earnings and revenue,https://seekingalpha.com/news/4130557,
SeekingAlpha,Parsons to buy BlackSignal Technologies,https://seekingalpha.com/news/4130560,
SeekingAlpha,"LendingClub GAAP EPS of $0.13 beats by $0.09, revenue of $187.2M beats by $10.17M",https://seekingalpha.com/news/4130559,
SeekingAlpha,Anatomy Of A 3X-Leveraged Position With Tail-Risk Hedges,https://seekingalpha.com/article/4708168,
