feed,title,long_url,short_url
Benzinga,Why Canadian Imperial Bank is a Great Dividend Stock Right Now,https://benzinga.com/news/earnings/24/07/40046084/why-canadian-imperial-bank-is-a-great-dividend-stock-right-now,https://da.gd/jb0cyj
Benzinga,Sysco Q4 Earnings: How Key Metrics Compare to Wall Street Estimates,https://benzinga.com/news/earnings/24/07/40041791/sysco-q4-earnings-how-key-metrics-compare-to-wall-street-estimates,https://da.gd/LWVxtC
Benzinga,"Bitcoin, Ethereum, Dogecoin Slide, But: 'Bitcoin Is Still On Track For A September Breakout,' Highlights Trader",https://benzinga.com/markets/cryptocurrency/24/07/40050330/bitcoin-ethereum-dogecoin-slide-but-bitcoin-is-still-on-track-for-a-september-breakout-hig,https://da.gd/RgyMwQ
Benzinga,CECO Environmental Surpasses Q2 Earnings Estimates,https://benzinga.com/news/earnings/24/07/40038605/ceco-environmental-surpasses-q2-earnings-estimates,https://da.gd/vWKMss
Benzinga,"Hayward Holdings, Inc. Tops Q2 Earnings and Revenue Estimates",https://benzinga.com/news/earnings/24/07/40038604/hayward-holdings-inc-tops-q2-earnings-and-revenue-estimates,https://da.gd/ocy01Z
