feed,title,long_url,short_url
InvestorPlace,The Top 3 Nasdaq Stocks to Buy Now: Summer 2024,https://investorplace.com/2024/07/the-top-3-nasdaq-stocks-to-buy-now-summer-2024/,https://da.gd/6Nrv
InvestorPlace,Quant Ratings Updated on 158 Stocks,https://investorplace.com/market360/2024/07/quant-ratings-updated-on-158-stocks/,https://da.gd/N17Gp
InvestorPlace,The Top 3 Software Stocks to Buy Now: Summer 2024,https://investorplace.com/2024/07/the-top-3-software-stocks-to-buy-now-summer-2024/,https://da.gd/FfP6m
InvestorPlace,Should You Buy Intel (INTC) Stock Before Aug. 1?,https://investorplace.com/2024/07/should-you-buy-intel-intc-stock-before-aug-1/,https://da.gd/dzfbg
InvestorPlace,FUPBY Stock Earnings: Fuchs Petrolub Reported Results for Q2 2024,https://investorplace.com/earning-results/2024/07/fupby-stock-earnings-fuchs-petrolub-for-q2-of-2024/,https://da.gd/wtH8ue
InvestorPlace,"IDR Stock Earnings: Idaho Strategic Resources Beats EPS, Beats Revenue for Q2 2024",https://investorplace.com/earning-results/2024/07/idr-stock-earnings-idaho-strategic-resources-for-q2-of-2024/,https://da.gd/cJrr4
InvestorPlace,Get Your Money Out of These 3 Semiconductor Stocks by 2025,https://investorplace.com/2024/07/get-your-money-out-of-these-3-semiconductor-stocks-by-2025/,https://da.gd/xIRLG
InvestorPlace,Symbotic (SYM) Stock Is Down 25% on Weak Guidance. What’s Going on with the AI Darling?,https://investorplace.com/2024/07/symbotic-sym-stock-is-down-25-on-weak-guidance-whats-going-on-with-the-ai-darling/,https://da.gd/LzTZMT
InvestorPlace,STLA Stock Alert: Stellantis Warns of More Layoffs Ahead. What to Watch.,https://investorplace.com/2024/07/stla-stock-alert-stellantis-warns-of-more-layoffs-ahead-what-to-watch/,https://da.gd/cN4Y
InvestorPlace,Q3’s Rising Stars: 8 Dividend Stocks for Your Must-Watch List,https://investorplace.com/2024/07/q3s-rising-stars-8-dividend-stocks-for-your-must-watch-list/,https://da.gd/7xoyWm
InvestorPlace,PLUG Stock Alert: Plug Power Names New Chief Operating Officer,https://investorplace.com/2024/07/plug-stock-alert-plug-power-names-new-chief-operating-officer/,https://da.gd/h8Oqa
