feed,title,long_url,short_url
FXEmpire,Energy crisis chips away at Europe’s industrial might,https://www.fxempire.com/news/article/energy-crisis-chips-away-at-europes-industrial-might-1182046,https://bit.ly/3Ds4RTm
FXEmpire,Flags at half-mast as India’s Gujarat mourns deadly bridge collapse,https://www.fxempire.com/news/article/flags-at-half-mast-as-indias-gujarat-mourns-deadly-bridge-collapse-1182042,https://bit.ly/3UhU0SN
FXEmpire,Obama warns ‘more people are going to get hurt’ if political climate persists,https://www.fxempire.com/news/article/obama-warns-more-people-are-going-to-get-hurt-if-political-climate-persists-1182043,https://bit.ly/3DwbLqE
FXEmpire,"KFC’s Middle East and North Africa franchisee plans dual listing in UAE, Saudi",https://www.fxempire.com/news/article/kfcs-middle-east-and-north-africa-franchisee-plans-dual-listing-in-uae-saudi-1182047,https://bit.ly/3Ds4SXq
FXEmpire,Chinese zone that hosts Foxconn’s Zhengzhou plant imposes fresh lockdown,https://www.fxempire.com/news/article/chinese-zone-that-hosts-foxconns-zhengzhou-plant-imposes-fresh-lockdown-1182048,https://bit.ly/3UhU1pP
