feed,title,long_url,short_url
Benzinga,Board Member At This Health Care Company Buys $355K of Stock,https://benzinga.com/news/22/11/29523625/board-member-at-this-health-care-company-buys-355k-of-stock,https://bit.ly/3h4rNRc
Benzinga,Chief Financial Officer At This Health Care Company Sells $407K of Stock,https://benzinga.com/news/22/11/29523623/chief-financial-officer-at-this-health-care-company-sells-407k-of-stock,https://bit.ly/3U140Qz
Benzinga,Mobivity Holdings Board Member Makes $5.59M Stock Purchase,https://benzinga.com/news/22/11/29523620/mobivity-holdings-board-member-makes-5-59m-stock-purchase,https://bit.ly/3UhWaSl
Benzinga,Group President At This Health Care Company Sells $2.20M of Stock,https://benzinga.com/news/22/11/29523618/group-president-at-this-health-care-company-sells-2-20m-of-stock,https://bit.ly/3U4Khj1
Benzinga,T-Mobile US Recent Insider Activity,https://benzinga.com/news/22/11/29523616/t-mobile-us-recent-insider-activity,https://bit.ly/3FMkyYa
Benzinga,Federated Hermes VP Trades $1.06M In Company Stock,https://benzinga.com/news/22/11/29523613/federated-hermes-vp-trades-1-06m-in-company-stock,https://bit.ly/3TYxLSb
