feed,title,long_url,short_url
SeekingAlpha,"Fastly Non-GAAP EPS of -$0.14 beats by $0.03, revenue of $108.5M beats by $4.84M",https://seekingalpha.com/news/3900186,
SeekingAlpha,"Energy Recovery Non-GAAP EPS of $0.12 beats by $0.01, revenue of $30.5M misses by $3.83M",https://seekingalpha.com/news/3900185,
SeekingAlpha,Global Medical REIT GAAP EPS of $0.12,https://seekingalpha.com/news/3900184,
SeekingAlpha,"Inari Medical GAAP EPS of -$0.19 beats by $0.06, revenue of $96.2M beats by $5.37M",https://seekingalpha.com/news/3900183,
SeekingAlpha,Fisker Non-GAAP EPS of -$0.49 misses by $0.05,https://seekingalpha.com/news/3900182,
SeekingAlpha,"Warrior Met Coal GAAP EPS of $1.90 beats by $0.06, revenue of $371.94M beats by $1.2M",https://seekingalpha.com/news/3900181,
SeekingAlpha,Why did Airbnb stock slide today? Unsteady forward guidance,https://seekingalpha.com/news/3900180,
