feed,title,long_url,short_url
SeekingAlpha,"Continental Resources Non-GAAP EPS of $2.88 misses by $0.09, revenue of $2.45B beats by $10M",https://seekingalpha.com/news/3900229,
SeekingAlpha,"Hawkins GAAP EPS of $0.86 beats by $0.02, revenue of $241.2M beats by $7.89M",https://seekingalpha.com/news/3900228,
SeekingAlpha,"Etsy stock surge over 10% on revenue beat, strong sales forecast",https://seekingalpha.com/news/3900227,
SeekingAlpha,"Earthstone Energy Non-GAAP EPS of $2.09 beats by $0.67, revenue of $531.5M beats by $71.06M",https://seekingalpha.com/news/3900226,
SeekingAlpha,"Identive GAAP EPS of $0.01 misses by $0.05, revenue of $31M misses by $4.74M",https://seekingalpha.com/news/3900225,
SeekingAlpha,"Rocky Brands Non-GAAP EPS of $0.75 beats by $0.58, revenue of $147.5M beats by $6.6M",https://seekingalpha.com/news/3900224,
SeekingAlpha,"Roku slides 18% on heavier loss, downbeat Q4 forecast",https://seekingalpha.com/news/3900223,
