feed,title,long_url,short_url
SeekingAlpha,"Lincoln National Non-GAAP EPS of -$10.23 misses by $12.02, revenue of $4.8B beats by $410M",https://seekingalpha.com/news/3900378,
SeekingAlpha,Acadia Pharmaceuticals sees Q3 mixed bag as it beats on bottom line but misses on top,https://seekingalpha.com/news/3900374,
SeekingAlpha,"Equitable Holdings Non-GAAP EPS of $1.28 beats by $0.18, revenue of $3.0B misses by $130M",https://seekingalpha.com/news/3900377,
SeekingAlpha,Aurora Innovation GAAP EPS of -$0.17,https://seekingalpha.com/news/3900376,
SeekingAlpha,"Allstate Non-GAAP EPS of -$1.56 beats by $0.03, revenue of $13.21B misses by $90M",https://seekingalpha.com/news/3900375,
SeekingAlpha,"Cross Country Healthcare Non-GAAP EPS of $1.07 beats by $0.12, revenue of $636.09M beats by $17.62M",https://seekingalpha.com/news/3900372,
SeekingAlpha,"CSG Systems International GAAP EPS of $0.40, revenue of $273.31M",https://seekingalpha.com/news/3900370,
