feed,title,long_url,short_url
SeekingAlpha,Gear Energy reports Q3 results,https://seekingalpha.com/news/3900460,
SeekingAlpha,Landmark Bancorp reports Q3 results,https://seekingalpha.com/news/3900461,
SeekingAlpha,"Radian Group Non-GAAP EPS of $1.31, revenue of $296.19M",https://seekingalpha.com/news/3900459,
SeekingAlpha,"Trinseo Non-GAAP EPS of -$2.91 misses by $0.48, revenue of $1.18B",https://seekingalpha.com/news/3900458,
SeekingAlpha,"Spin Master Corp. Non-GAAP EPS of $1.08 misses by $0.29, revenue of $624M misses by $299.07M",https://seekingalpha.com/news/3900457,
SeekingAlpha,"Ashford Non-GAAP EPS of $1.48, revenue of $164.61M",https://seekingalpha.com/news/3900456,
SeekingAlpha,"Ceridian HCM Non-GAAP EPS of $0.20 beats by $0.08, revenue of $315.6M beats by $10.04M",https://seekingalpha.com/news/3900455,
