feed,title,long_url,short_url
SeekingAlpha,CF Industries sinks after wide Q3 earnings miss; unveils new $3B stock buyback,https://seekingalpha.com/news/3900470,
SeekingAlpha,"Bristow Group GAAP EPS of $0.58 beats by $0.37, revenue of $307.3M in-line",https://seekingalpha.com/news/3900469,
SeekingAlpha,"Maui Land & Pineapple GAAP EPS of $0.01, revenue of $2.6M",https://seekingalpha.com/news/3900468,
SeekingAlpha,"EPR Properties stock jumps on higher year guidance, solid Q3 beat",https://seekingalpha.com/news/3900467,
SeekingAlpha,"KRONOS Worldwide GAAP EPS of $0.18, revenue of $459.6M",https://seekingalpha.com/news/3900465,
SeekingAlpha,Morguard reports Q3 results,https://seekingalpha.com/news/3900464,
SeekingAlpha,"Curo Group Non-GAAP EPS of -$0.29 misses by $0.33, revenue of $214.12M misses by $8.76M",https://seekingalpha.com/news/3900463,
