feed,title,long_url,short_url
SeekingAlpha,"Ranger Energy Services GAAP EPS of $0.25 misses by $0.08, revenue of $157.5M beats by $3.2M",https://seekingalpha.com/news/3963247,
SeekingAlpha,Molson Coors stock moves higher on big bottom line beat,https://seekingalpha.com/news/3963246,
SeekingAlpha,Pfizer tops Q1 2023 forecasts as COVID franchise outperforms,https://seekingalpha.com/news/3963245,
SeekingAlpha,DT Midstream Non-GAAP EPS of $0.84 misses by $0.09,https://seekingalpha.com/news/3963244,
SeekingAlpha,"Harmony Biosciences Non-GAAP EPS of $0.66 beats by $0.10, revenue of $119.13M beats by $2.94M",https://seekingalpha.com/news/3963243,
SeekingAlpha,"Repligen Non-GAAP EPS of $0.64 beats by $0.05, revenue of $182.66M beats by $1.23M",https://seekingalpha.com/news/3963242,
SeekingAlpha,Public Service beats Q1 top and bottom line estimates; reaffirms FY23 outlook,https://seekingalpha.com/news/3963241,
