feed,title,long_url,short_url
SeekingAlpha,"Franklin Electric GAAP EPS of $0.79 beats by $0.15, revenue of $484.55M beats by $8.29M",https://seekingalpha.com/news/3963276,
SeekingAlpha,Laser Photonics sells third CleanTech System,https://seekingalpha.com/news/3963274,
SeekingAlpha,Textainer Group Holdings reports mixed Q1 earnings,https://seekingalpha.com/news/3963273,
SeekingAlpha,"Oxford Square Capital GAAP EPS of $0.13 beats by $0.02, revenue of $12.94M beats by $0.74M",https://seekingalpha.com/news/3963272,
SeekingAlpha,"Sysco Non-GAAP EPS of $0.90 misses by $0.02, revenue of $18.9B beats by $340M",https://seekingalpha.com/news/3963271,
SeekingAlpha,Annaly Capital upgraded to Overweight at Piper on avenues for returns,https://seekingalpha.com/news/3963270,
SeekingAlpha,"Insight Enterprises Non-GAAP EPS of $1.78 misses by $0.04, revenue of $2.3B misses by $270M",https://seekingalpha.com/news/3963269,
