feed,title,long_url,short_url
SeekingAlpha,"Shyft Non-GAAP EPS of $0.56 beats by $0.09, revenue of $277.3M beats by $44.82M",https://seekingalpha.com/news/3805036,
SeekingAlpha,"MGP Ingredients Non-GAAP EPS of $0.87 beats by $0.24, revenue of $166.8M beats by $13.53M",https://seekingalpha.com/news/3805035,
SeekingAlpha,Obsidian Energy GAAP EPS of $0.27,https://seekingalpha.com/news/3805034,
SeekingAlpha,Tesla slides to six-month low after Russia attacks Ukraine,https://seekingalpha.com/news/3805033,
SeekingAlpha,"Intellia Therapeutics GAAP EPS of -$1.09 misses by $0.15, revenue of $12.85M beats by $5.02M",https://seekingalpha.com/news/3805032,
SeekingAlpha,"Radius Health Non-GAAP EPS of $0.05 misses by $0.03, revenue of $65.1M beats by $2.04M",https://seekingalpha.com/news/3805031,
SeekingAlpha,"Laureate Education GAAP EPS of $0.15 misses by $0.01, revenue of $296.7M beats by $0.75M",https://seekingalpha.com/news/3805030,
