feed,title,long_url,short_url
SeekingAlpha,Enstar reports Q4 results,https://seekingalpha.com/news/3805088,
SeekingAlpha,"Home Point Capital GAAP EPS of $0.14 beats by $0.08, revenue of $180.5M beats by $2.95M",https://seekingalpha.com/news/3805087,
SeekingAlpha,Arrowhead finishes enrollment in phase 2b trial of ARO-ANG3 for mixed dyslipidemia,https://seekingalpha.com/news/3805084,
SeekingAlpha,"Tenneco Non-GAAP EPS of -$0.11, revenue of $4.4B",https://seekingalpha.com/news/3805085,
SeekingAlpha,Olo drops 6% despite 30% Y/Y surge in revenue,https://seekingalpha.com/news/3805086,
SeekingAlpha,Deutsche Telekom AG reports Q4 results,https://seekingalpha.com/news/3805083,
