feed,title,long_url,short_url
SeekingAlpha,"Altus Group Non-GAAP EPS of C$0.42, revenue of C$162.9M",https://seekingalpha.com/news/3805635,
SeekingAlpha,Vista Gold GAAP EPS of -$0.14,https://seekingalpha.com/news/3805634,
SeekingAlpha,"Cohen & Steers raises $305M in its Fund's IPO, fund trading started today",https://seekingalpha.com/news/3805632,
SeekingAlpha,"Saul Centers GAAP EPS of $0.40, revenue of $60.24M",https://seekingalpha.com/news/3805631,
SeekingAlpha,"Playtika GAAP EPS of $0.25 beats by $0.07, revenue of $649M beats by $7.15M",https://seekingalpha.com/news/3805630,
