feed,title,long_url,short_url
Investing,S&P 500: Stocks Set to Retrace as Tariff Concerns Resurface,https://www.investing.com/analysis/sp-500-stocks-set-to-retrace-as-tariff-concerns-resurface-200660355,https://da.gd/Cffi1
Investing,Duncan Aldred promoted to President of GM North America operations,https://www.investing.com/news/stock-market-news/duncan-aldred-promoted-to-president-of-gm-north-america-operations-93CH-4022335,https://da.gd/tCTvE
Investing,Phillip Capital downgrades Spotify and Microsoft following share price strength,https://www.investing.com/news/stock-market-news/phillip-capital-downgrades-spotify-and-microsoft-following-share-price-strength-4022306,https://da.gd/jEezcx
Investing,US service sector picks up in April; price pressures rise,https://www.investing.com/news/economic-indicators/us-service-sector-picks-up-in-april-price-pressures-rise-4022325,https://da.gd/pI0CGA
Investing,"U.S. non-manufacturing sector shows unexpected strength, ISM PMI rises to 51.6",https://www.investing.com/news/economic-indicators/us-nonmanufacturing-sector-shows-unexpected-strength-ism-pmi-rises-to-516-93CH-4022308,https://da.gd/z5KBb
Investing,Canada's services PMI shows steep contraction in April activity,https://www.investing.com/news/economic-indicators/canadas-services-pmi-shows-steep-contraction-in-april-activity-4022297,https://da.gd/3GdzE
