feed,title,long_url,short_url
Investing,"NFTs, the Pandemic and the Aura of Human Encounters",https://investing.com/news/-2600610,
Investing,El Salvador Prepares for Bitcoin Adoption—Installs 200 Bitcoin ATMs,https://investing.com/news/-2600609,
Investing,Google searches for Bitcoin drops to 9-month low,https://investing.com/news/-2600608,
Investing,TinyHero — The next generation NFT gaming on Polygon,https://investing.com/news/-2600607,
Investing,Uber Stock: Fret Not over Recent Struggles,https://investing.com/news/-2600617,
Investing,Robinhood Stock Looks Attractive after Correction,https://investing.com/news/-2600616,
Investing,IM Cannabis: a Multi-National Operator Making Moves,https://investing.com/news/-2600615,
Investing,Will TJX Stock Continue to Make New Highs?,https://investing.com/news/-2600614,
Investing,3 Gig Economy Stocks to Avoid After Judge Rules Prop 22 Unconstitutional,https://investing.com/news/-2600613,
Investing,Is Polaris Headed for a Breakdown?,https://investing.com/news/-2600612,
Investing,3 Media Stocks to Consider Adding to Your Portfolio,https://investing.com/news/-2600611,
