feed,title,long_url,short_url
SeekingAlpha,Natural gas inventory build slightly above estimates,https://seekingalpha.com/news/3702937,
SeekingAlpha,Roche: Leading Pharmaceutical Company In The Next Decade,https://seekingalpha.com/article/4432792,
SeekingAlpha,"BP Midstream Partners: Attractive Distribution, Possible Reconsolidation Target",https://seekingalpha.com/article/4432858,
SeekingAlpha,"DIA Is Starting To Turn Around, Wait For The Buy Signal",https://seekingalpha.com/article/4432857,
SeekingAlpha,United Rentals: A Fascinating Stock For Many Reasons,https://seekingalpha.com/article/4432856,
