feed,title,long_url,short_url
TheStreet,Home Depot Has an Amazing Solution to the Millennial Home Ownership Problem,https://www.thestreet.com/housing/home-depot-has-an-amazing-solution-to-the-millennial-home-ownership-problem,https://da.gd/igp0fK
TheStreet,"Broadcom Earnings Top Street Forecasts, AI Demand Seen Driving Revenue Gains",https://www.thestreet.com/investing/stocks/broadcom-earnings-top-forecasts-ai-demand-to-drive-revenue-gains,https://da.gd/3vg3Py
TheStreet,Spirit Airlines Struggles Through Another Day of Disastrous Delays,https://www.thestreet.com/lifestyle/spirit-airlines-struggles-through-another-day-of-disastrous-delays,https://da.gd/lH1Vfv
TheStreet,There’s More Bad News for Disgruntled Bud Light Consumers,https://www.thestreet.com/retailers/theres-more-bad-news-for-disgruntled-bud-light-consumers,https://da.gd/pxOe
TheStreet,Walmart Makes a Big Move to Solve a Problem Amazon Struggles With,https://www.thestreet.com/retailers/walmart-makes-a-big-move-to-solve-a-problem-amazon-struggles-with,https://da.gd/42dE
