feed,title,long_url,short_url
SeekingAlpha,On the hour,https://seekingalpha.com/news/3644036,
SeekingAlpha,Amazon Prime Video coming to Sky set-top boxes,https://seekingalpha.com/news/3644035,
SeekingAlpha,Algonquin buys majority stake in Texas wind farms from RWE in ~$600M deal,https://seekingalpha.com/news/3644034,
SeekingAlpha,Perspecta awarded $112M program for SE&I at the Space Development Agency,https://seekingalpha.com/news/3644033,
SeekingAlpha,Blackstone Real Estate acquires lab office portfolio from Brookfield Fund,https://seekingalpha.com/news/3644031,
SeekingAlpha,Crunchyroll Sale Confirms AMCX Undervaluation,https://seekingalpha.com/article/4394453,
SeekingAlpha,Peloton: Will Not Work Out In The Long Term - Churn Is Already High,https://seekingalpha.com/article/4394564,
SeekingAlpha,PCI Offers A Juicy 10%+ Yield,https://seekingalpha.com/article/4394448,
SeekingAlpha,Neptune Wellness: Changes Focus And Revenues Soar Upward,https://seekingalpha.com/article/4394563,
