feed,title,long_url,short_url
Yahoo,"GE HealthCare Blames Tariffs For Lowering 2025 Profit Outlook, Initiates Stock Buyback",https://finance.yahoo.com/news/ge-healthcare-blames-tariffs-lowering-152845879.html,https://da.gd/ybhbo
Yahoo,"Nike Stock, Retailers Downgraded On Tariffs, 'Mild' Recession Expectations",https://www.investors.com/news/nike-stock-retailers-downgraded-on-tariffs-mild-recession-expectations/?src=A00220&yptr=yahoo,https://da.gd/f1WP
Yahoo,"Meta Platforms, Inc. (META): Among Billionaire Cliff Asness’ Stock Picks with Huge Upside Potential",https://finance.yahoo.com/news/meta-platforms-inc-meta-among-152502471.html,https://da.gd/e8ai0B
Yahoo,NVIDIA Corporation (NVDA): Among Billionaire Cliff Asness’ Stock Picks with Huge Upside Potential,https://finance.yahoo.com/news/nvidia-corporation-nvda-among-billionaire-152246683.html,https://da.gd/6zLh9
Yahoo,"Arista Networks, Inc. (ANET): Among Billionaire Cliff Asness’ Stock Picks with Huge Upside Potential",https://finance.yahoo.com/news/arista-networks-inc-anet-among-152102030.html,https://da.gd/xqQ65
Yahoo,"Amazon.com, Inc. (AMZN): Among Billionaire Cliff Asness’ Stock Picks with Huge Upside Potential",https://finance.yahoo.com/news/amazon-com-inc-amzn-among-152032505.html,https://da.gd/Rq61c
