feed,title,long_url,short_url
Benzinga,Proofpoint To Acquire Data Security Provider InteliSecure For $62.5M,https://benzinga.com/m-a/21/02/19775137/proofpoint-to-acquire-data-security-provider-intelisecure-for-62-5m,
Benzinga,"Global Dried Blood Spot Collection Cards Market (2020 to 2027) - Share, Size, Trends, Industry Analysis Report",https://benzinga.com/pressreleases/21/02/n19778680/global-dried-blood-spot-collection-cards-market-2020-to-2027-share-size-trends-industry-analysis-r,
Benzinga,All Black ASTM Level 3 Surgical Masks Made in USA are Now Available for Medical and General Public Use from Flora Med Supplies,https://benzinga.com/pressreleases/21/02/n19778679/all-black-astm-level-3-surgical-masks-made-in-usa-are-now-available-for-medical-and-general-public,
Benzinga,"Global Virtual Reality (VR) in Gaming, Education, and Simulations Report 2021-2026 - ResearchAndMarkets.com",https://benzinga.com/pressreleases/21/02/b19778662/global-virtual-reality-vr-in-gaming-education-and-simulations-report-2021-2026-researchandmarkets-,
Benzinga,"The Métis Nation, with support from Veterans Affairs Canada, announce the Métis Veterans Legacy Commemorative Program",https://benzinga.com/pressreleases/21/02/n19778644/the-m-tis-nation-with-support-from-veterans-affairs-canada-announce-the-m-tis-veterans-legacy-comm,
Benzinga,Fibre Channel Industry Association Elects 2021 Board of Directors as Fibre Channel Remains the Network Protocol of Choice for Datacenter Storage,https://benzinga.com/pressreleases/21/02/n19778634/fibre-channel-industry-association-elects-2021-board-of-directors-as-fibre-channel-remains-the-net,
Benzinga,Global Infertility Treatment Devices and Equipment Market (2020 to 2027) - COVID-19 Impact and Analysis - ResearchAndMarkets.com,https://benzinga.com/pressreleases/21/02/b19778620/global-infertility-treatment-devices-and-equipment-market-2020-to-2027-covid-19-impact-and-analysi,
