feed,title,long_url,short_url
Investing,China launches blockchain-powered data exchange,https://www.investing.com/news/cryptocurrency-news/china-launches-blockchainpowered-data-exchange-3160087,https://da.gd/d0FaT
Investing,WeWork tapping advisers for restructuring help - Bloomberg News,https://www.investing.com/news/stock-market-news/wework-tapping-advisers-for-restructuring-help--bloomberg-news-3160089,https://da.gd/MEPE7
Investing,Germany stocks higher at close of trade; DAX up 0.15%,https://www.investing.com/news/stock-market-news/germany-stocks-higher-at-close-of-trade-dax-up-015-3160084,https://da.gd/PI7ZH
Investing,J&J's Janssen to close part of its vaccine division -Telegraaf,https://www.investing.com/news/stock-market-news/jjs-janssen-to-close-part-,https://da.gd/wqaNYf
Investing,White House wants to cut delay before government comments on economic data,https://www.investing.com/news/economic-indicators/white-house-wants-to-cut-delay-before-government-comments-on-economic-data-3160093,https://da.gd/eq8He
Investing,Mortgage lender Better set for Nasdaq debut in test for choppy markets,https://www.investing.com/news/economy/mortgage-lender-better-set-for-nasdaq-debut-in-test-for-choppy-markets-3160090,https://da.gd/7tl1J
Investing,Argentina secures $7.5 billion disbursement as IMF board OKs reviews -govt,https://www.investing.com/news/economy/argentina-secures-75-billion-disbursement-as-imf-board-oks-reviews-govt-3160085,https://da.gd/Tfg18Q
