feed,title,long_url,short_url
Investing,3 reasons why investors should remain bullish on Apple stock: Needham,https://www.investing.com/news/stock-market-news/3-reasons-why-investors-should-remain-bullish-on-apple-stock-needham-3629316,https://da.gd/fh4Y
Investing,BofA clients drove strongest equity inflows in nearly 2 years during Fed cut week,https://www.investing.com/news/stock-market-news/bofa-clients-drove-strongest-equity-inflows-in-nearly-2-years-during-fed-cut-week-3629301,https://da.gd/CbLDMo
Investing,JPMorgan unit backs Centivo's $75 million equity and debt raise,https://www.investing.com/news/stock-market-news/jpmorgan-unit-backs-centivos-75-million-equity-and-debt-raise-3629256,https://da.gd/KO6BtF
Investing,Novo Nordisk CEO faces US Congress scrutiny over weight-loss drug pricing,https://www.investing.com/news/stock-market-news/novo-nordisk-ceo-faces-us-congress-scrutiny-over-weightloss-drug-pricing-3629257,https://da.gd/W43cH
Investing,Eli Lilly's Alzheimer's drug approved in Japan,https://www.investing.com/news/stock-market-news/eli-lillys-alzheimers-drug-approved-in-japan-3629266,https://da.gd/av1Lb
Investing,European luxury firms rise after China unveils new stimulus package,https://www.investing.com/news/stock-market-news/european-luxury-firms-rise-after-china-unveils-new-stimulus-package-3629259,https://da.gd/VaAkZh
Investing,"Exclusive-Leading German institutes slash GDP forecast to -0.1% in 2024, say sources",https://www.investing.com/news/economic-indicators/exclusiveleading-german-institutes-slash-gdp-forecast-to-01-in-2024-say-sources-3629312,https://da.gd/kVNF6
Investing,"Futures rise on soft landing optimism, China stimulus",https://www.investing.com/news/economy-news/futures-rise-on-soft-landing-optimism-china-stimulus-3629273,https://da.gd/D0axl
Investing,US bond ETF launches up 50% from year-ago levels,https://www.investing.com/news/economy-news/us-bond-etf-launches-up-50-from-yearago-levels-3629247,https://da.gd/dSZCA
Investing,Fed's rate cut offers limited relief for US factories facing China competition,https://www.investing.com/news/economy-news/feds-rate-cut-offers-limited-relief-for-us-factories-facing-china-competition-3629246,https://da.gd/cnMt4b
