feed,title,long_url,short_url
Benzinga,What's Going On With Paramount Global Stock After Revealing Massive Layoff Plans?,https://benzinga.com/markets/equities/24/09/41008872/whats-going-on-with-paramount-global-stock-after-revealing-massive-layoff-plans,https://da.gd/yUMqFO
Benzinga,"ANSYS, Taiwan Semiconductor, Microsoft Team Up To Supercharge Next-Gen Chip Simulations",https://benzinga.com/news/24/09/41008834/ansys-taiwan-semiconductor-microsoft-team-up-to-supercharge-next-gen-chip-simulations,https://da.gd/ETcGQP
Benzinga,"Gene Therapy-Focused Bluebird Bio Restructures, Cuts Is Workforce By 25%, Seeks To Breakeven Next Year",https://benzinga.com/general/biotech/24/09/41008825/gene-therapy-focused-bluebird-bio-restructures-cuts-is-workforce-by-25-seeks-to-breakeven-next-ye,https://da.gd/TH7pP
Benzinga,"Snowflake To Offer $2B In Convertible Notes, Analyst Says It's 'From A Position Of Financial Strength'",https://benzinga.com/news/24/09/41008816/snowflake-to-offer-2b-in-convertible-notes-analyst-says-its-from-a-position-of-financial-strength,https://da.gd/ts8BH
Benzinga,Decoding AppLovin's Options Activity: What's the Big Picture?,https://benzinga.com/insights/options/24/09/41008858/decoding-applovins-options-activity-whats-the-big-picture,https://da.gd/6UQThL
Benzinga,GE Vernova's Options: A Look at What the Big Money is Thinking,https://benzinga.com/insights/options/24/09/41008857/ge-vernovas-options-a-look-at-what-the-big-money-is-thinking,https://da.gd/bZvxC
Benzinga,Check Out What Whales Are Doing With QCOM,https://benzinga.com/insights/options/24/09/41008854/check-out-what-whales-are-doing-with-qcom,https://da.gd/w0F0
