feed,title,long_url,short_url
SeekingAlpha,MSC Industrial Supply Co. announces promotion of Martina McIsaac to President and COO,https://seekingalpha.com/news/4152907,
SeekingAlpha,Trinity acquires preeclampsia test developer Metabolomics,https://seekingalpha.com/news/4152906,
SeekingAlpha,Earnings Snapshot: KB Home beats on topline but EPS falls short of estimates in FQ3,https://seekingalpha.com/news/4152904,
SeekingAlpha,CACI awarded $314M task order,https://seekingalpha.com/news/4152905,
SeekingAlpha,Lifeway Foods confirms receipt of non-binding bid from Danone,https://seekingalpha.com/news/4152903,
