feed,title,long_url,short_url
Investing,Ethereum Foundation Report Reveals $1.6B Treasury Holdings,https://investing.com/analysis/-200622359,
Investing,Bitcoin Looks For Support At Around 37k,https://investing.com/analysis/-200622336,
Investing,Cardano Looks Ready For An Upswing To $1,https://investing.com/analysis/-200622333,
Investing,"Gold Climbs Back To $2,000 In Thin Holiday Trading",https://investing.com/analysis/-200622368,
Investing,"Earnings Season Off To Shaky Start As Investors Eye Consumption, Musk",https://investing.com/analysis/-200622371,
Investing,Indexes Close Lower Leaving Correction Intact,https://investing.com/analysis/-200622369,
Investing,S&P 500 E-Mini: Double Top Bear Flag,https://investing.com/analysis/-200622367,
Investing,The Energy Report: Delayed Action,https://investing.com/analysis/-200622373,
Investing,"Regulations set the table for more talent, capital and building in crypto industry",https://investing.com/news/-2805377,
Investing,MetaMask Warns Mobile Wallet Users of iCloud Phishing Attacks,https://investing.com/news/-2805364,
Investing,Nakamoto Games Announces Stablecoin Development and NAKAVERSE Land Sale as Part of Wide-Ranging Ecosystem Enhancements,https://investing.com/news/-2805363,
Investing,"Bitcoin sell-off worsens despite massive whale purchases, analysts warn of a 30% crash",https://investing.com/news/-2805361,
Investing,Myspace founder predicts blockchain gaming to be ‘dominant place’ for socializing,https://investing.com/news/-2805358,
Investing,"AMC Theatres mobile app accepts Dogecoin, Shiba Inu and more",https://investing.com/news/-2805344,
Investing,Biden Announces His Pick for Fed Vice Chair for Supervision,https://investing.com/news/-2805336,
Investing,"The world doesn’t need banks, policymakers or NGOs — It needs DeFi",https://investing.com/news/-2805330,
Investing,Beanstalk Farms Loses $182 Million In DeFi Cyber Attacks,https://investing.com/news/-2805316,
Investing,Iran to stiffen penalties for illegal use of subsidized energy in crypto mining,https://investing.com/news/-2805314,
Investing,S&P 500 inches higher as strong BofA results offset tech weakness,https://investing.com/news/-2805277,
Investing,Bank of America beats profit estimates on strength in consumer lending,https://investing.com/news/-2805251,
Investing,"Ukraine says first civilians killed in Lviv, fighters cling on in Mariupol",https://investing.com/news/-2805103,
Investing,"Sri Lankan president says regrets crisis, expands cabinet ahead of IMF talks",https://investing.com/news/-2805170,
Investing,Lawmaker Raskin sees hope for U.S. climate legislation this year,https://investing.com/news/-2805266,
Investing,Saudi Feb crude exports hit near two-year high - JODI,https://investing.com/news/-2805282,
Investing,Penske Automotive unit orders 750 Ford electric cargo vans,https://investing.com/news/-2805380,
Investing,Progressive Downgraded to Underweight at Piper Sandler,https://investing.com/news/-2805374,
Investing,Saudi Arabia stocks higher at close of trade; Tadawul All Share up 0.37%,https://investing.com/news/-2805371,
Investing,Sirius XM Stock Downgraded at Morgan Stanley on Macro Headwinds,https://investing.com/news/-2805343,
Investing,J&J settles with West Virginia on opioid litigation for $99 million,https://investing.com/news/-2805319,
Investing,Trading Boom Over? Charles Schwab Stock Tumbles 5% After EPS and Revenue Miss,https://investing.com/news/-2805335,
Investing,Wendy's Dips Following BMO Capital Downgrade,https://investing.com/news/-2805352,
Investing,Verizon raises minimum wage to $20 an hour for U.S employees,https://investing.com/news/-2805351,
Investing,Copy Tesla's Model or You'll Struggle to Keep Up Says Piper Sandler After Downgrading Aptiv to Underweight,https://investing.com/news/-2805326,
