feed,title,long_url,short_url
FXEmpire,Putin says Russia’s future actions depend on security guarantees,https://www.fxempire.com/news/article/putin-says-russias-future-actions-depend-on-security-guarantees-848965,https://j.mp/32jbUPL
FXEmpire,Muted Christmas joy in La Palma evacuees’ caravan as volcano falls silent,https://www.fxempire.com/news/article/muted-christmas-joy-in-la-palma-evacuees-caravan-as-volcano-falls-silent-848968,https://j.mp/3Frm2El
FXEmpire,Analysis-How 2021 became the year of ESG investing,https://www.fxempire.com/news/article/analysis-how-2021-became-the-year-of-esg-investing-848966,https://j.mp/3sqv6Wx
FXEmpire,Europe gas prices dip as Russian gas flows remain in reverse,https://www.fxempire.com/news/article/europe-gas-prices-dip-as-russian-gas-flows-remain-in-reverse-848971,https://j.mp/3egR7yD
FXEmpire,Wall St firms grapple with return-to-office conundrum as Omicron explodes,https://www.fxempire.com/news/article/wall-st-firms-grapple-with-return-to-office-conundrum-as-omicron-explodes-848970,https://j.mp/3EmEmgK
FXEmpire,Iran nuclear talks to resume on Dec. 27,https://www.fxempire.com/news/article/iran-nuclear-talks-to-resume-on-dec-27-848964,https://j.mp/32dGAlz
FXEmpire,Some European banks put off decision to move forward with new payments system,https://www.fxempire.com/news/article/some-european-banks-put-off-decision-to-move-forward-with-new-payments-system-848969,https://j.mp/3H6LWO5
