feed,title,long_url,short_url
SeekingAlpha,First Trust India NIFTY 50 Equal Weight ETF declares quarterly distribution of $0.5000,https://seekingalpha.com/news/3783212,
SeekingAlpha,First Trust Switzerland AlphaDEX Fund declares quarterly distribution of $0.3502,https://seekingalpha.com/news/3783210,
SeekingAlpha,First Trust Asia Pacific ex-Japan AlphaDEX Fund declares quarterly distribution of $0.9457,https://seekingalpha.com/news/3783209,
SeekingAlpha,First Trust Latin America AlphaDEX Fund declares quarterly distribution of $0.3972,https://seekingalpha.com/news/3783208,
SeekingAlpha,First Trust United Kingdom AlphaDEX Fund declares quarterly distribution of $0.3439,https://seekingalpha.com/news/3783207,
SeekingAlpha,First Trust Japan AlphaDEX Fund declares quarterly distribution of $0.6870,https://seekingalpha.com/news/3783206,
SeekingAlpha,First Trust Germany AlphaDEX Fund declares quarterly distribution of $0.1738,https://seekingalpha.com/news/3783205,
SeekingAlpha,Texas Instruments Is A Great Backdoor Play On The Green Economy,https://seekingalpha.com/article/4476614,
