feed,title,long_url,short_url
Investing,A Red Hot Sector Few Investors Are Piled Into With a 7.2% Dividend,https://www.investing.com/analysis/a-red-hot-sector-few-investors-are-piled-into-with-a-72-dividend-200673459,
Investing,"Top 3 AI Stocks Dominating the Market, According to WarrenAI",https://www.investing.com/news/stock-market-news/top-3-ai-stocks-dominating-the-market-according-to-warrenai-4453606,
Investing,"Morgan Stanley sees ""limited tactical downside"" to EU stocks amid Greenland crisis",https://www.investing.com/news/stock-market-news/morgan-stanley-sees-limited-tactical-downside-to-eu-stocks-amid-greenland-crisis-4453604,
Investing,"Trump to meet global CEOs in Davos, with US policy in focus",https://www.investing.com/news/economy-news/trump-to-meet-global-ceos-in-davos-with-us-policy-in-focus-4453607,
Investing,"Cook case could lead to ’cause’ protections for Fed, or a roadmap for dismissals",https://www.investing.com/news/economy-news/cook-case-could-lead-to-cause-protections-for-fed-or-a-roadmap-for-dismissals-4453603,
