feed,title,long_url,short_url
CryptoNewsFlash,"Buy The Dip or Purchase Presale Tokens? Bitcoin, Ethereum, And Golteum Battle",https://crypto-news-flash.com/buy-the-dip-or-purchase-presale-tokens-bitcoin-ethereum-and-golteum-battle/,https://da.gd/ZpaC
CryptoNewsFlash,WisdomTree’s Ethereum and Stellar-based fund approved – Will it drive ETH and XLM prices up?,https://crypto-news-flash.com/wisdomtrees-ethereum-and-stellar-based-fund-approved-will-it-drive-eth-and-xlm-prices-up/,https://da.gd/pB8Xp3
CryptoNewsFlash,Binance is save and solvent – Exchange’s outflows of multiple billion-$s normal everyday business,https://crypto-news-flash.com/binance-is-save-and-solvent-exchanges-outflows-of-multiple-billion-s-normal-everyday-business/,https://da.gd/sg3Kq
CryptoNewsFlash,Polygon is ‘unlocking something big’ as daily active Web3 users explode – Will MATIC price follow?,https://crypto-news-flash.com/polygon-is-unlocking-something-big-as-daily-active-web3-users-explode-will-matic-price-follow/,https://da.gd/3UUVvT
CryptoNewsFlash,Solana price is down 95% but community is still growing – Bright future ahead for SOL,https://crypto-news-flash.com/solana-price-is-down-95-but-community-is-still-growing-bright-future-ahead-for-sol/,https://da.gd/peem
CryptoNewsFlash,Bullish news: Bitcoin to become legal tender to drive BTC adoption for 211M people worldwide,https://crypto-news-flash.com/bullish-news-bitcoin-to-become-legal-tender-to-drive-btc-adoption-for-211m-people-worldwide/,https://da.gd/GrBvb
CryptoNewsFlash,Ethereum Code Review: Is it Legit or Scam?,https://crypto-news-flash.com/ethereum-code-review-is-it-legit-or-scam/,https://da.gd/mDUMp
CryptoNewsFlash,Massive Ethereum wallets move ETH to exchanges – Will a sell off drive ETH price to $850?,https://crypto-news-flash.com/massive-ethereum-wallets-move-eth-to-exchanges-will-a-sell-off-drive-eth-price-to-850/,https://da.gd/eNvt
CryptoNewsFlash,"Cardano leading the race before Polkadot, Cosmos and Ethereum – Will it drive ADA to $5?",https://crypto-news-flash.com/cardano-leading-the-race-before-polkadot-cosmos-and-ethereum-will-it-drive-ada-to-5/,https://da.gd/1bjL1W
CryptoNewsFlash,Understanding the Impact of Cryptocurrency Education on Online Gaming Platforms,https://crypto-news-flash.com/understanding-the-impact-of-cryptocurrency-education-on-online-gaming-platforms/,https://da.gd/2Jo7G
