feed,title,long_url,short_url
Investing,Ethereum (ETH) at Critical Juncture as Michaël van de Poppe Predicts Bullish Breakout,https://www.investing.com/news/cryptocurrency-news/ethereum-eth-at-critical-juncture-as-michael-van-de-poppe-predicts-bullish-breakout-3273616,https://da.gd/QwNHnA
Investing,"Ethereum (ETH) Jumps 11.4%, Here's How Whales Are Changing Game",https://www.investing.com/news/cryptocurrency-news/ethereum-eth-jumps-114-heres-how-whales-are-changing-game-3273615,https://da.gd/jvczmm
Investing,"'Rich Dad Poor Dad' Author Shares How Much BTC He Bought After ETF Approval, SHIB Erases Another Zero, Ripple CEO Celebrates SEC Approval: Crypto News Digest by U.Today",https://www.investing.com/news/cryptocurrency-news/rich-dad-poor-dad-author-shares-how-much-btc-he-bought-after-etf-approval-shib-erases-another-zero-ripple-ceo-celebrates-sec-approval-crypto-news-digest-by-utoday-3273613,https://da.gd/pzCp
Investing,"Coinbase , Others on Fall as Bitcoin Hits Low",https://www.investing.com/news/cryptocurrency-news/coinbase--others-on-fall-as-bitcoin-hits-low-432SI-3273605,https://da.gd/BDW7FF
Investing,CoinShares to acquire Valkyrie Funds after US spot bitcoin ETF approval,https://www.investing.com/news/stock-market-news/coinshares-to-acquire-valkyrie-funds-after-us-spot-bitcoin-etf-approval-3273612,https://da.gd/COhBSK
Investing,Stocks will most likely under-react to earnings - Bernstein,https://www.investing.com/news/stock-market-news/stocks-will-most-likely-underreact-to-earnings--bernstein-432SI-3273610,https://da.gd/Of484H
Investing,"Citi to slash 20,000 jobs, streamline management in major overhaul",https://www.investing.com/news/stock-market-news/citi-to-slash-20000-jobs-streamline-management-in-major-overhaul-93CH-3273608,https://da.gd/YchnsP
Investing,Vulcan Minerals reports high-grade copper and gold assay results,https://www.investing.com/news/stock-market-news/vulcan-minerals-reports-highgrade-copper-and-gold-assay-results-93CH-3273606,https://da.gd/0Zo1e
Investing,"Citigroup sees headcount dropping 20,000 by 2026",https://www.investing.com/news/stock-market-news/citigroup-sees-headcount-dropping-20000-by-2026-3273600,https://da.gd/4SDD9
Investing,"Big U.S. bank profits fall on insurance fund charges, falling lending margins",https://www.investing.com/news/economy/big-us-bank-profits-fall-on-insurance-fund-charges-falling-lending-margins-3273609,https://da.gd/VNSG7w
