feed,title,long_url,short_url
SeekingAlpha,HPE notches seventh consecutive session of loss,https://seekingalpha.com/news/4090676,
SeekingAlpha,"Las Vegas Sands Non-GAAP EPS of $0.75 beats by $0.13, revenue of $2.96B beats by $20M",https://seekingalpha.com/news/4090675,
SeekingAlpha,"Banner Non-GAAP EPS of $1.22 beats by $0.09, revenue of $144.6M misses by $6.44M",https://seekingalpha.com/news/4090672,
SeekingAlpha,"Martin Midstream Partners GAAP EPS of $0.08 beats by $0.02, revenue of $180.83M misses by $17.97M",https://seekingalpha.com/news/4090677,
SeekingAlpha,"CSX GAAP EPS of $0.46 beats by $0.01, revenue of $3.68B beats by $10M",https://seekingalpha.com/news/4090671,
