feed,title,long_url,short_url
Investing,"Australia’s ASX sees 2026 costs soar amid CEO exit, regulatory probe",https://www.investing.com/news/stock-market-news/australias-asx-sees-2026-costs-soar-amid-ceo-exit-regulatory-probe-4501578,
Investing,Boeing sees significant supply chain quality gains,https://www.investing.com/news/stock-market-news/boeing-sees-significant-supply-chain-quality-gains-4501577,
Investing,New rule to bar green card holders from US Small Business Administration loans,https://www.investing.com/news/stock-market-news/new-rule-to-bar-green-card-holders-from-us-small-business-administration-loans-4501572,
Investing,Spirit Airlines seeks court approval to auction 20 Airbus jets for about $500 million,https://www.investing.com/news/stock-market-news/spirit-airlines-seeks-court-approval-to-auction-20-airbus-jets-for-about-500-million-4501554,
Investing,XFLH Capital prices $100 million IPO at $10 per unit,https://www.investing.com/news/stock-market-news/xflh-capital-prices-100-million-ipo-at-10-per-unit-432SI-4501555,
Investing,AbbVie sues US health agency over Botox price controls,https://www.investing.com/news/stock-market-news/abbvie-sues-us-health-agency-over-botox-price-controls-4501551,
Investing,"UK housing market shows early signs of recovery, RICS survey shows",https://www.investing.com/news/economic-indicators/uk-housing-market-shows-early-signs-of-recovery-rics-survey-shows-4501557,
