feed,title,long_url,short_url
ETFTrends,Fidelity Enters Active CLO Arena With 2 New ETFs,https://www.etftrends.com/fidelity-enters-active-clo-arena-2-new-etfs/,
ETFTrends,Nuveen Acquires Schroders in Cash Acquisition,https://www.etftrends.com/fixed-income-content-hub/nuveen-acquires-schroders-cash-acquisition/,
ETFTrends,Trying to Retire Early? Distributing Ladder ETFs Could Help,https://www.etftrends.com/ntam-content-hub/trying-retire-early-distributing-ladder-etfs-help/,
ETFTrends,State Street Debuts Low-Cost Active Money Market ETF,https://www.etftrends.com/etf-strategist-content-hub/state-street-debuts-low-cost-active-money-market-etf/,
ETFTrends,An Active Solution for Blue Chip Growth in 2026,https://www.etftrends.com/etf-investing-content-hub/active-solution-blue-chip-growth-2026/,
ETFTrends,ETF of the Week: NEOS Russell 2000 High Income ETF (IWMI),https://www.etftrends.com/monthly-income-content-hub/neos-russell-2000-high-income-etf-iwmi-etf-of-the-week-3/,
ETFTrends,ESG ETFs Show Surprising Resilience Despite Headwinds,https://www.etftrends.com/esg-etfs-surprising-resilience-despite-headwinds/,
