feed,title,long_url,short_url
Nasdaq,CEOs Must Become More Hands-On in the Post-Pandemic World,https://www.nasdaq.com/articles/ceos-must-become-more-hands-on-in-the-post-pandemic-world-2021-05-21,https://j.mp/3wsvRNh
Nasdaq,Disney Makes Gains in Streaming Wars Against Netflix,https://www.nasdaq.com/articles/disney-makes-gains-in-streaming-wars-against-netflix-2021-05-21,https://j.mp/347Yx22
Nasdaq,Argentina's key grains port snarled after strike over vaccine access,https://www.nasdaq.com/articles/argentinas-key-grains-port-snarled-after-strike-over-vaccine-access-2021-05-21-0,https://j.mp/3v97S5J
Nasdaq,"Brazil govt cuts 2021 budget deficit forecast to $35 bln, or 2.2% of GDP",https://www.nasdaq.com/articles/brazil-govt-cuts-2021-budget-deficit-forecast-to-%2435-bln-or-2.2-of-gdp-2021-05-21,https://j.mp/3oK4ifV
Nasdaq,"Canada extends ban on passenger flights from India, Pakistan",https://www.nasdaq.com/articles/canada-extends-ban-on-passenger-flights-from-india-pakistan-2021-05-21,https://j.mp/3v9iphp
