feed,title,long_url,short_url
Investing,Traders Position in Indices Hoping 'All Will Be Fine',https://www.investing.com/analysis/traders-position-in-indices-hoping-all-will-be-fine-200668387,
Investing,Nasdaq Tests Multi-Month Uptrend as Rebound Potential Emerges,https://www.investing.com/analysis/nasdaq-tests-multimonth-uptrend-as-rebound-potential-emerges-200668389,
Investing,Gold Technical Map Reveals Precision Zones for Smart Money Entries,https://www.investing.com/analysis/gold-technical-map-reveals-precision-zones-for-smart-money-entries-200668388,
Investing,Silver Momentum Rises as Gold Encounters Resistance Across Multi-Timeframes,https://www.investing.com/analysis/silver-momentum-rises-as-gold-encounters-resistance-across-multitimeframes-200668384,
Investing,Australia consults on critical minerals stockpile ahead of Albanese-Trump meeting,https://www.investing.com/news/commodities-news/australia-consults-on-critical-minerals-stockpile-ahead-of-albanesetrump-meeting-4283276,
Investing,"BofA lifts gold target to $5,000/oz, sees silver staying in deficit",https://www.investing.com/news/commodities-news/bofa-lifts-gold-target-to-5000oz-sees-silver-staying-in-deficit-4283272,
Investing,Indonesia stocks lower at close of trade; IDX Composite Index down 0.28%,https://www.investing.com/news/stock-market-news/indonesia-stocks-lower-at-close-of-trade-idx-composite-index-down-028-4283288,
Investing,LG Electronics guides for smaller-than-expected profit decline,https://www.investing.com/news/stock-market-news/lg-electronics-guides-for-smallerthanexpected-profit-decline-93CH-4283287,
Investing,"Allwyn and OPAP announce €16 billion all-share merger, plan dual listing",https://www.investing.com/news/stock-market-news/allwyn-and-opap-announce-16-billion-allshare-merger-plan-dual-listing-93CH-4283284,
Investing,China's September exports to Russia show steepest decline in seven months,https://www.investing.com/news/economic-indicators/chinas-september-exports-to-russia-show-steepest-decline-in-seven-months-4283281,
