feed,title,long_url,short_url
Cointelegraph,Thailand crypto market is shifting away from retail: Binance Thailand CEO,https://cointelegraph.com/news/thailand-crypto-market-shifting-retail-institutional-binance-thailand-ceo?utm_source=rss_feed&utm_medium=rss%3FREFRESH1635338032360&utm_campaign=rss_partner_inbound,https://da.gd/0RrRVP
Cointelegraph,Netherlands seeks input on crypto tax monitoring laws to align with EU,https://cointelegraph.com/news/netherlands-input-crypto-tax-monitoring-bill-align-eu?utm_source=rss_feed&utm_medium=rss%3FREFRESH1635338032360&utm_campaign=rss_partner_inbound,https://da.gd/VEg5
Cointelegraph,Rotation out of ETH into SOL causes another surge in bearishness,https://cointelegraph.com/news/ether-bitcoin-ratio-hits-lowest-3-years-bearishness-high?utm_source=rss_feed&utm_medium=rss%3FREFRESH1635338032360&utm_campaign=rss_partner_inbound,https://da.gd/g3vRJf
Cointelegraph,BingX launches ‘ShieldX’ wallet firewall months after $52M hack,https://cointelegraph.com/news/bingx-launches-security-initiative-after-multi-million-dollar-hack?utm_source=rss_feed&utm_medium=rss%3FREFRESH1635338032360&utm_campaign=rss_partner_inbound,https://da.gd/DJA1o
Cointelegraph,Microsoft shareholder proposes firm look into investing in Bitcoin,https://cointelegraph.com/news/microsoft-board-assess-investing-bitcoin-shareholder-vote?utm_source=rss_feed&utm_medium=rss%3FREFRESH1635338032360&utm_campaign=rss_partner_inbound,https://da.gd/SPXOW
Cointelegraph,US government crypto wallets hacked for $20M — Arkham Intelligence,https://cointelegraph.com/news/us-government-crypto-hacked-arkham-intelligence?utm_source=rss_feed&utm_medium=rss%3FREFRESH1635338032360&utm_campaign=rss_partner_inbound,https://da.gd/iDxUo6
Cointelegraph,"India mulls new crypto ban to support CBDC, Lazarus Group strikes again: Asia Express",https://cointelegraph.com/magazine/india-bitcoin-ban-bingx-hacker-lazarus-asia-express/?utm_source=rss_feed&utm_medium=rss%3FREFRESH1635338032360&utm_campaign=rss_partner_inbound,https://da.gd/2BFo
Cointelegraph,Standard Chartered predicts Bitcoin surge to $125K with Trump win,https://cointelegraph.com/news/bitcoin-price-prediction-republican-election-impact?utm_source=rss_feed&utm_medium=rss%3FREFRESH1635338032360&utm_campaign=rss_partner_inbound,https://da.gd/VGzrfJ
Cointelegraph,US lawmaker claims crypto PACs forced out ’important voices in Congress’,https://cointelegraph.com/news/representative-summer-lee-crypto-pacs-money-influencing-elections?utm_source=rss_feed&utm_medium=rss%3FREFRESH1635338032360&utm_campaign=rss_partner_inbound,https://da.gd/8sAI
Cointelegraph,Fireblocks launches $1M grant program to boost PYUSD developer adoption,https://cointelegraph.com/news/fireblocks-launches-grant-program-pyusd-developer-adoption?utm_source=rss_feed&utm_medium=rss%3FREFRESH1635338032360&utm_campaign=rss_partner_inbound,https://da.gd/7rPwUp
Cointelegraph,Here’s what happened in crypto today,https://cointelegraph.com/news/what-happened-in-crypto-today?utm_source=rss_feed&utm_medium=rss%3FREFRESH1635338032360&utm_campaign=rss_partner_inbound,https://da.gd/Wo5pYi
Cointelegraph,Why is Bitcoin price up today?,https://cointelegraph.com/news/why-is-bitcoin-price-up-today?utm_source=rss_feed&utm_medium=rss%3FREFRESH1635338032360&utm_campaign=rss_partner_inbound,https://da.gd/mOOg3P
Cointelegraph,Solana again clocks record-breaking fee revenue,https://cointelegraph.com/news/total-economic-activity-solana-all-time-high?utm_source=rss_feed&utm_medium=rss%3FREFRESH1635338032360&utm_campaign=rss_partner_inbound,https://da.gd/vhgm7W
Cointelegraph,Pennsylvania House of Representatives passes pro-crypto bill,https://cointelegraph.com/news/pennsylvania-house-passes-crypto-regulation-bill?utm_source=rss_feed&utm_medium=rss%3FREFRESH1635338032360&utm_campaign=rss_partner_inbound,https://da.gd/9K3M6
Cointelegraph,Crypto-native AI will transform Web3: Coinbase Ventures,https://cointelegraph.com/news/crypto-native-ai-transform-web3-coinbase-ventures?utm_source=rss_feed&utm_medium=rss%3FREFRESH1635338032360&utm_campaign=rss_partner_inbound,https://da.gd/cD4rXF
Cointelegraph,OpenAI’s ‘AGI Readiness’ chief quits — ‘I want to be less biased’,https://cointelegraph.com/news/openai-agi-readiness-chief-quits?utm_source=rss_feed&utm_medium=rss%3FREFRESH1635338032360&utm_campaign=rss_partner_inbound,https://da.gd/exdd0A
Cointelegraph,R3 explores strategic options amid blockchain industry challenges,https://cointelegraph.com/news/r3-strategic-options-blockchain-partnerships?utm_source=rss_feed&utm_medium=rss%3FREFRESH1635338032360&utm_campaign=rss_partner_inbound,https://da.gd/xEi9f
Cointelegraph,Altcoin season ‘more probable’ once Bitcoin hits $80K — Hashkey Capital,https://cointelegraph.com/news/bitcoin-price-80k-altcoin-season-hashkey-capital-crypto-analyst-predictions?utm_source=rss_feed&utm_medium=rss%3FREFRESH1635338032360&utm_campaign=rss_partner_inbound,https://da.gd/mTC1
Cointelegraph,‘Unusually’ large Bitcoin ETF inflows spark concerns of BTC price decline,https://cointelegraph.com/news/spot-bitcoin-etf-inflows-btc-price-decline-concerns-crypto-analysts?utm_source=rss_feed&utm_medium=rss%3FREFRESH1635338032360&utm_campaign=rss_partner_inbound,https://da.gd/pxxuE
Cointelegraph,Ankr integrates TON into Web3 API services for developers,https://cointelegraph.com/news/ankr-integrates-ton-web3-api-services-developers?utm_source=rss_feed&utm_medium=rss%3FREFRESH1635338032360&utm_campaign=rss_partner_inbound,https://da.gd/c8It2
Cointelegraph,Independence Day director creating TV series based on Web3 game,https://cointelegraph.com/news/independence-day-director-tv-series-space-nation-web3-game?utm_source=rss_feed&utm_medium=rss%3FREFRESH1635338032360&utm_campaign=rss_partner_inbound,https://da.gd/XgQPt
Cointelegraph,Polymarket claims to have identified Trump whale,https://cointelegraph.com/news/polymarket-claims-identified-trump-whale?utm_source=rss_feed&utm_medium=rss%3FREFRESH1635338032360&utm_campaign=rss_partner_inbound,https://da.gd/owFrtG
Cointelegraph,Bitcoin whale accumulation hits 670K all-time high amid BTC’s v-shaped bounce,https://cointelegraph.com/news/bitcoin-whale-s-holding-reaches-ath-at-670-k-amidst-btc-s-v-pattern-recovery?utm_source=rss_feed&utm_medium=rss%3FREFRESH1635338032360&utm_campaign=rss_partner_inbound,https://da.gd/sV3L6
Cointelegraph,US gov’t cites ex-FTX exec’s ‘exemplary cooperation’ before sentencing,https://cointelegraph.com/news/ftx-nishad-singh-sentencing-memo-prosecutors-cooperation?utm_source=rss_feed&utm_medium=rss%3FREFRESH1635338032360&utm_campaign=rss_partner_inbound,https://da.gd/sjPBtz
Cointelegraph,Mech shooter game MetalCore moves to Solana,https://cointelegraph.com/news/mech-shooter-game-metal-core-moves-solana?utm_source=rss_feed&utm_medium=rss%3FREFRESH1635338032360&utm_campaign=rss_partner_inbound,https://da.gd/jUzdb5
Cointelegraph,A bizarre cult is growing around AI-created memecoin ‘religions’: AI Eye,https://cointelegraph.com/magazine/a-bizarre-cult-is-growing-around-ai-created-memecoin-religions-ai-eye/?utm_source=rss_feed&utm_medium=rss%3FREFRESH1635338032360&utm_campaign=rss_partner_inbound,https://da.gd/yMh9
Cointelegraph,Why is Solana (SOL) price up today?,https://cointelegraph.com/news/why-is-solana-price-up-this-week?utm_source=rss_feed&utm_medium=rss%3FREFRESH1635338032360&utm_campaign=rss_partner_inbound,https://da.gd/V9v6
Cointelegraph,Binance exec leaves Nigeria after authorities drop final charges,https://cointelegraph.com/news/binance-tigran-gambaryan-nigeria-authorities-drop-charges?utm_source=rss_feed&utm_medium=rss%3FREFRESH1635338032360&utm_campaign=rss_partner_inbound,https://da.gd/3SYRT
Cointelegraph,Consensys urges clear crypto rules in letter to future US president,https://cointelegraph.com/news/consensys-urges-clear-crypto-rules-in-open-letter-to-future-us-president?utm_source=rss_feed&utm_medium=rss%3FREFRESH1635338032360&utm_campaign=rss_partner_inbound,https://da.gd/DVZyV
Cointelegraph,RWA market still has one big hurdle to jump before it can take off,https://cointelegraph.com/news/rwa-market-hurdle-adoption-blockchain-ai?utm_source=rss_feed&utm_medium=rss%3FREFRESH1635338032360&utm_campaign=rss_partner_inbound,https://da.gd/pNPw8q
