feed,title,long_url,short_url
TMF,You Have Another 2 Weeks to Lower Your Tax Bill With This Smart Move,https://www.fool.com/taxes/2020/06/30/you-have-another-2-weeks-to-lower-your-tax-bill-wi.aspx?source=iedfolrf0000001,https://j.mp/2YLYmHN
TMF,Great News for Taxpayers: You'll Soon Be Able to File Amended Returns Online,https://www.fool.com/taxes/2020/06/29/great-news-for-taxpayers-youll-soon-be-able-to-fil.aspx?source=iedfolrf0000001,https://j.mp/31yn4NG
TMF,There's Still Time to Reap This Lucrative Tax Break,https://www.fool.com/taxes/2020/06/29/theres-still-time-to-reap-this-lucrative-tax-break.aspx?source=iedfolrf0000001,https://j.mp/38fj5qN
TMF,Did Pushing Back the Tax-Filing Deadline Do Americans a Disservice?,https://www.fool.com/taxes/2020/06/28/did-pushing-back-the-tax-filing-deadline-do-americ.aspx?source=iedfolrf0000001,https://j.mp/2Aoal5e
TMF,Gearing Up to File Your Taxes? Beware These Potential Audit Triggers,https://www.fool.com/taxes/2020/06/28/gearing-up-to-file-your-taxes-beware-these-potenti.aspx?source=iedfolrf0000001,https://j.mp/3gdO1u9
TMF,Trump Assures a Second Stimulus Check Is Coming: Here's What to Expect,https://www.fool.com/taxes/2020/06/28/trump-assures-a-second-stimulus-check-is-coming-he.aspx?source=iedfolrf0000001,https://j.mp/3ePPy9F
TMF,"The Tax Break for Work-at-Home Expenses Disappeared at the Wrong Time, But Some States Still Let You Deduct Them",https://www.fool.com/taxes/2020/06/26/the-tax-break-for-work-at-home-expenses-disappeare.aspx?source=iedfolrf0000001,https://j.mp/3ePPsyP
TMF,The IRS Will Pay Interest on Tax Refunds Issued After April 15 -- Even for Filers Who Haven't Submitted Their Taxes Yet,https://www.fool.com/taxes/2020/06/25/the-irs-will-pay-interest-on-tax-refunds-issued-af.aspx?source=iedfolrf0000001,https://j.mp/3dPIIPU
TMF,Tax Refund Delays Are Happening at the Worst Time. Here's Why.,https://www.fool.com/taxes/2020/06/24/tax-refund-delays-are-happening-at-the-worst-time.aspx?source=iedfolrf0000001,https://j.mp/3isEBx0
TMF,Liquidating Investments During COVID-19? Don't Make This 1 Mistake,https://www.fool.com/taxes/2020/06/24/liquidating-investments-during-covid-19-dont-make.aspx?source=iedfolrf0000001,https://j.mp/2BUpDix
TMF,Hurting Financially During the COVID-19 Crisis? 3 Tax Breaks That Can Help,https://www.fool.com/taxes/2020/06/23/hurting-financially-during-the-covid-19-crisis-3-t.aspx?source=iedfolrf0000001,https://j.mp/2NHIVKn
TMF,3 Off-the-Cuff Second Stimulus Proposals Being Considered,https://www.fool.com/taxes/2020/06/21/3-off-the-cuff-second-stimulus-proposals-being-con.aspx?source=iedfolrf0000001,https://j.mp/2NG8BqS
TMF,33% of Americans Are Convinced They'll Have Less Income in 2020 Due to COVID-19,https://www.fool.com/taxes/2020/06/20/33-of-americans-are-convinced-theyll-have-less-inc.aspx?source=iedfolrf0000001,https://j.mp/2BXxVpW
TMF,Use These 4 Tax Strategies to Decrease What You Owe,https://www.fool.com/taxes/2020/06/19/use-these-4-tax-strategies-to-decrease-what-you-ow.aspx?source=iedfolrf0000001,https://j.mp/2BgZRoM
TMF,37% of Americans Are Sorely Misinformed About Unemployment and Taxes,https://www.fool.com/taxes/2020/06/19/37-of-americans-are-sorely-misinformed-about-unemp.aspx?source=iedfolrf0000001,https://j.mp/31BqUpl
TMF,Stimulus for Travel? The Explore America Tax Credit Raises More Questions Than Answers,https://www.fool.com/taxes/2020/06/18/stimulus-for-travel-the-explore-america-tax-credit.aspx?source=iedfolrf0000001,https://j.mp/3gi6eqH
TMF,This Important Deadline Is Now Just 1 Month Away,https://www.fool.com/taxes/2020/06/15/this-important-deadline-is-now-just-1-month-away.aspx?source=iedfolrf0000001,https://j.mp/31u2r5n
TMF,This Is the Biggest Hurdle to a Second Stimulus Check,https://www.fool.com/taxes/2020/06/15/this-is-the-biggest-hurdle-to-a-second-stimulus-ch.aspx?source=iedfolrf0000001,https://j.mp/31yncwE
TMF,New Data Stokes the Call for a Second Stimulus Check,https://www.fool.com/taxes/2020/06/13/new-data-stokes-the-call-for-a-second-stimulus-che.aspx?source=iedfolrf0000001,https://j.mp/2BXkZQx
TMF,Haven't Filed Your 2019 Taxes Yet? 3 Things You Need to Know,https://www.fool.com/taxes/2020/06/12/havent-filed-your-2019-taxes-yet-3-things-you-need.aspx?source=iedfolrf0000001,https://j.mp/3gcewQK
TMF,How Are Unemployment Benefits Taxed?,https://www.fool.com/taxes/2020/06/09/how-are-unemployment-benefits-taxed.aspx?source=iedfolrf0000001,https://j.mp/38e80WY
TMF,Your Stimulus Debit Card Is Making These 3 Companies Happy,https://www.fool.com/taxes/2020/06/08/your-stimulus-debit-card-is-making-these-3-compani.aspx?source=iedfolrf0000001,https://j.mp/3dOqSwS
TMF,Strapped for Cash During COVID-19? 3 Ways to Get It From the IRS,https://www.fool.com/taxes/2020/06/08/strapped-for-cash-during-covid-19-3-ways-to-get-it.aspx?source=iedfolrf0000001,https://j.mp/3gfPX5C
TMF,"Still Owed a Tax Refund for 2019? Don't Do This, or You'll Have to Wait Months to Get It",https://www.fool.com/taxes/2020/06/07/still-owed-a-tax-refund-for-2019-dont-do-this-or-y.aspx?source=iedfolrf0000001,https://j.mp/3gcNuc0
TMF,Done With Taxes in 2020? 4 Steps to Make Next Year's Easier,https://www.fool.com/taxes/2020/06/07/done-with-taxes-in-2020-4-steps-to-make-next-years.aspx?source=iedfolrf0000001,https://j.mp/2BYspmA
TMF,"A New Stimulus Proposal Would Give Folks $1,200, With a Very Large Catch",https://www.fool.com/taxes/2020/06/07/a-new-stimulus-proposal-would-give-folks-1200-with.aspx?source=iedfolrf0000001,https://j.mp/38fUHoV
TMF,Own a Small Business? You Need to Know About These Coronavirus Tax Credits,https://www.fool.com/taxes/2020/06/06/own-a-small-business-you-need-to-know-about-these.aspx?source=iedfolrf0000001,https://j.mp/31v2jTa
TMF,3 Tax Moves That Could Save You Money During COVID-19,https://www.fool.com/taxes/2020/06/06/3-tax-moves-that-could-save-you-money-during-covid.aspx?source=iedfolrf0000001,https://j.mp/2VyOcZc
TMF,Still Working on Your Taxes? 4 Steps to Lessen the Burden,https://www.fool.com/taxes/2020/06/06/still-working-on-your-taxes-4-steps-to-lessen-the.aspx?source=iedfolrf0000001,https://j.mp/3dPIHvk
TMF,3 Big Reasons a Second Stimulus Check Is Likely,https://www.fool.com/taxes/2020/06/06/3-big-reasons-a-second-stimulus-check-is-likely.aspx?source=iedfolrf0000001,https://j.mp/3gkCKsh
TMF,1 New COVID-19 Rule the IRS Wants You to Know,https://www.fool.com/taxes/2020/06/03/1-new-covid-19-rule-the-irs-wants-you-to-know.aspx?source=iedfolrf0000001,https://j.mp/2BQY6P1
TMF,Filing an Amended Tax Return Just Got Easier. Here's Why.,https://www.fool.com/taxes/2020/06/03/filing-an-amended-tax-return-just-got-easier-heres.aspx?source=iedfolrf0000001,https://j.mp/3dNctRD
TMF,Your Last-Gasp Shot at a Stimulus Check Is Coming: Here's How It'll Work,https://www.fool.com/taxes/2020/06/02/your-last-gasp-shot-at-a-stimulus-check-is-coming.aspx?source=iedfolrf0000001,https://j.mp/2YN64S3
TMF,A Second Stimulus Bill Has Reached the Senate: Here Are 3 Reasons It Won't Pass,https://www.fool.com/taxes/2020/05/31/a-second-stimulus-bill-has-reached-the-senate-here.aspx?source=iedfolrf0000001,https://j.mp/38h77gc
TMF,Big Changes May Be Coming to Your Next Stimulus Check,https://www.fool.com/taxes/2020/05/30/big-changes-may-be-coming-to-your-next-stimulus-ch.aspx?source=iedfolrf0000001,https://j.mp/2NLO2t2
TMF,Will Social Security Beneficiaries Qualify for a Second Stimulus Check?,https://www.fool.com/taxes/2020/05/25/will-social-security-beneficiaries-qualify-for-a-s.aspx?source=iedfolrf0000001,https://j.mp/3dLFQUb
TMF,Need Money During COVID-19? Here's 1 Simple Way to Get the IRS to Give It to You,https://www.fool.com/taxes/2020/05/24/need-money-during-covid-19-heres-1-simple-way-to-g.aspx?source=iedfolrf0000001,https://j.mp/38gtx11
TMF,There's an Unorthodox Stimulus Proposal Gathering Steam on Social Media,https://www.fool.com/taxes/2020/05/24/theres-an-unorthodox-stimulus-proposal-gathering-s.aspx?source=iedfolrf0000001,https://j.mp/38hZl5Q
TMF,"Your Next ""Stimulus Check"" Could Have Big Strings Attached",https://www.fool.com/taxes/2020/05/23/your-next-stimulus-check-could-have-big-strings-at.aspx?source=iedfolrf0000001,https://j.mp/3dL8R2p
TMF,4 Things You Need to Know About Taxes in a COVID-19 World,https://www.fool.com/taxes/2020/05/23/4-things-you-need-to-know-about-covid-19-and-taxes.aspx?source=iedfolrf0000001,https://j.mp/2BtE5Oz
TMF,There Are Now 7 Second Stimulus Proposals -- Which Do You Favor?,https://www.fool.com/taxes/2020/05/23/there-are-now-7-second-stimulus-proposals-which-do.aspx?source=iedfolrf0000001,https://j.mp/31vRrUX
TMF,3 Tax Mistakes You Can't Afford to Make During the COVID-19 Crisis,https://www.fool.com/taxes/2020/05/22/3-tax-mistakes-you-cant-afford-to-make-during-the.aspx?source=iedfolrf0000001,https://j.mp/2ZoAw45
TMF,Eliminate These Costly Tax Mistakes Before 2021,https://www.fool.com/taxes/2020/05/22/eliminate-these-costly-tax-mistakes-before-2021.aspx?source=iedfolrf0000001,https://j.mp/3gjcOx7
TMF,"Could You Use an Extra $2,779 Right Now? Here's How You May Be Able to Get It",https://www.fool.com/taxes/2020/05/21/could-you-use-an-extra-2779-right-now-heres-how-yo.aspx?source=iedfolrf0000001,https://j.mp/2VyOdfI
TMF,Collecting Unemployment Benefits Due to COVID-19? Prepare for a Hefty Tax Bill,https://www.fool.com/taxes/2020/05/19/collecting-unemployment-benefits-due-to-covid-19-p.aspx?source=iedfolrf0000001,https://j.mp/2ZsXjvJ
TMF,Still Don't Have Your Stimulus Check? Here Are the 5 Likeliest Reasons Why,https://www.fool.com/taxes/2020/05/17/still-dont-have-your-stimulus-check-here-are-the-5.aspx?source=iedfolrf0000001,https://j.mp/31xcCGj
TMF,3 Ways Parents Could Get More Stimulus Money,https://www.fool.com/taxes/2020/05/16/3-ways-parents-could-get-more-stimulus-money.aspx?source=iedfolrf0000001,https://j.mp/38kA0s6
TMF,"A New COVID-19 Relief Bill Offers Up to $6,000 per Household -- and Much More",https://www.fool.com/taxes/2020/05/16/a-new-covid-19-relief-bill-offers-up-to-6000-per-h.aspx?source=iedfolrf0000001,https://j.mp/2BQsCIG
TMF,Here's Who Could Finally Get a Stimulus Check,https://www.fool.com/taxes/2020/05/14/heres-who-could-finally-get-a-stimulus-check.aspx?source=iedfolrf0000001,https://j.mp/2ZpqI9V
TMF,There's a Surprise Tax Break in the Latest Stimulus Payment Plan,https://www.fool.com/taxes/2020/05/13/theres-a-surprise-tax-break-in-the-latest-stimulus.aspx?source=iedfolrf0000001,https://j.mp/3icMrux
