feed,title,long_url,short_url
SeekingAlpha,Manufacturing PMI,https://seekingalpha.com/news/3587755,
SeekingAlpha,Citron pulls bearish Cytodyn report,https://seekingalpha.com/news/3587750,
SeekingAlpha,Chiasma prices public offering at $4/share,https://seekingalpha.com/news/3587753,
SeekingAlpha,"IAC, Match Group complete business separation",https://seekingalpha.com/news/3587754,
SeekingAlpha,The Nest Egg Portfolio: Averaging Down On Eurocommercial Properties,https://seekingalpha.com/article/4356485,
SeekingAlpha,Moderna: Trading In A COVID-19 Bubble - 70% Downside,https://seekingalpha.com/article/4356553,
