feed,title,long_url,short_url
CoinDesk,"Kyber Network Advises Liquidity Providers to Withdraw Funds Amid Vulnerability, Token Drops 2%",https://www.coindesk.com/business/2023/04/17/kyber-network-advises-liquidity-providers-to-withdraw-funds-amid-vulnerability-token-drops-2/?utm_medium=referral&utm_source=rss&utm_campaign=headlines,https://da.gd/mg6Fd
CoinDesk,First Mover Americas: Ether Holds Above $2K,https://www.coindesk.com/markets/2023/04/17/first-mover-americas-ether-holds-above-2k/?utm_medium=referral&utm_source=rss&utm_campaign=headlines,https://da.gd/ktus
CoinDesk,Much Ado About =Nil;,https://www.coindesk.com/consensus-magazine/2023/04/17/cryptocurrency-zero-knowledge-blockchain-nil-foundation/?utm_medium=referral&utm_source=rss&utm_campaign=headlines,https://da.gd/JZCUmI
CoinDesk,Sempo Delivers Cash Aid for the Unbanked in Crisis,https://www.coindesk.com/consensus-magazine/2023/04/17/humanitarian-aid-transformed-crypto-startup-sempo/?utm_medium=referral&utm_source=rss&utm_campaign=headlines,https://da.gd/rZA8r
CoinDesk,BTQ Prepares Today to Defend Against Tomorrow’s Quantum-Computing Threat,https://www.coindesk.com/consensus-magazine/2023/04/17/btq/?utm_medium=referral&utm_source=rss&utm_campaign=headlines,https://da.gd/NQtKUt
CoinDesk,Rainbow Helps Users Slide Into the Crypto Economy,https://www.coindesk.com/consensus-magazine/2023/04/17/rainbow-ethereum-wallet-mobile-first-design/?utm_medium=referral&utm_source=rss&utm_campaign=headlines,https://da.gd/vrIHCn
CoinDesk,Scroll Aims to Be the Turtle That Wins the Ethereum Scaling Race,https://www.coindesk.com/consensus-magazine/2023/04/17/ethereum-zkevms-scroll-network-scalability/?utm_medium=referral&utm_source=rss&utm_campaign=headlines,https://da.gd/z6PxoY
