feed,title,long_url,short_url
SeekingAlpha,"DexCom raised, AngioDynamics cut as RayJay reviews post-COVID MedTech",https://seekingalpha.com/news/3956908,
SeekingAlpha,SoundHound up 6% on $100M financing,https://seekingalpha.com/news/3956907,
SeekingAlpha,Sana Biotechnology Is Technically Overbought So Buy It Later,https://seekingalpha.com/article/4594453,
SeekingAlpha,Why I Sold Spirit Realty And Reinvested In Spirit Realty's Preferred Stock,https://seekingalpha.com/article/4594443,
SeekingAlpha,Apple Is Up 30% YTD And Shares Could Reach All-Time Highs In 2023,https://seekingalpha.com/article/4594099,
SeekingAlpha,Attention All Shoppers: 3 Intriguing Bargains In Shopping Center REITs,https://seekingalpha.com/article/4594105,
SeekingAlpha,"Peloton: If I Owned It, I Would Have Sold It",https://seekingalpha.com/article/4594397,
SeekingAlpha,Are Agency Mortgages A Home Run?,https://seekingalpha.com/article/4594447,
SeekingAlpha,"Intrepid Potash, Inc. Is A Hold For Now",https://seekingalpha.com/article/4594446,
