feed,title,long_url,short_url
Investing,The Energy Report: Quicker Phase to Higher Gas Prices,https://www.investing.com/analysis/the-energy-report-quicker-phase-to-higher-gas-prices-200637277,https://da.gd/LI0m74
Investing,Saudi Arabia stocks higher at close of trade; Tadawul All Share up 1.19%,https://www.investing.com/news/stock-market-news/saudi-arabia-stocks-higher-at-close-of-trade-tadawul-all-share-up-119-3057071,https://da.gd/Ldlt
Investing,U.S. stocks inch higher as investors await more bank earnings,https://www.investing.com/news/stock-market-news/us-stocks-inch-higher-as-investors-await-more-bank-earnings-3057056,https://da.gd/lq4TU
Investing,Merck to take $10.3 billion R&D charge for Prometheus deal this year,https://www.investing.com/news/stock-market-news/merck-to-take-103-billion-rd-charge-for-prometheus-deal-this-year-3057068,https://da.gd/toPZ9
Investing,"VW, Rivian, Nissan, BMW lose access to U.S. EV tax credits",https://www.investing.com/news/stock-market-news/vw-rivian-nissan-bmw-lose-access-to-us-ev-tax-credits-3057066,https://da.gd/5th8E
Investing,Factbox-How big U.S. banks are managing bad loan reserves,https://www.investing.com/news/economy/factboxhow-big-us-banks-are-managing-bad-loan-reserves-3057076,https://da.gd/Ue97ve
Investing,US homebuilder sentiment improves for fourth straight month -NAHB,https://www.investing.com/news/economy/us-homebuilder-sentiment-improves-for-fourth-straight-month-nahb-3057060,https://da.gd/1S35Y
