feed,title,long_url,short_url
Investing,Arbitrum Foundation Says 700 Million ARB Won’t Be Moved To New Wallet,https://www.investing.com/news/cryptocurrency-news/arbitrum-foundation-says-700-million-arb-wont-be-moved-to-new-wallet-3050138,https://da.gd/Jwb3
Investing,"Jane Street, Tower Research and Radix are Binance’s ‘VIP’ clients in CFTC suit: Report",https://www.investing.com/news/cryptocurrency-news/jane-street-tower-research-and-radix-are-binances-vip-clients-in-cftc-suit-report-3050131,https://da.gd/RPqW1k
Investing,"Leonardo, Siemens sign deal to create cybersecurity platform",https://www.investing.com/news/stock-market-news/leonardo-siemens-sign-deal-to-create-cybersecurity-platform-3050134,https://da.gd/y19guW
Investing,UK house-building falls by most since 2020 as interest rates bite -PMI,https://www.investing.com/news/economic-indicators/uk-housebuilding-falls-by-most-since-2020-as-interest-rates-bite-pmi-3050143,https://da.gd/bZNE3z
Investing,Analysis-New BOJ chief to slowly unwind Kuroda's policy experiment,https://www.investing.com/news/economy/analysisnew-boj-chief-to-slowly-unwind-kurodas-policy-experiment-3050140,https://da.gd/6PQtk
