feed,title,long_url,short_url
SeekingAlpha,Oncocyte gets US patent linked to early detection of organ transplant rejection,https://seekingalpha.com/news/3758926,
SeekingAlpha,Wholesale inventories rise in September,https://seekingalpha.com/news/3758925,
SeekingAlpha,Data443 Risk Mitigation reports Q3 results,https://seekingalpha.com/news/3758924,
SeekingAlpha,"Farmers National EPS beats by $0.06, misses on revenue",https://seekingalpha.com/news/3758922,
SeekingAlpha,Health tech company Marpai prices $25M IPO,https://seekingalpha.com/news/3758921,
