feed,title,long_url,short_url
Nasdaq,"EXCLUSIVE-Facebook rejects talks with Australia publisher, testing world's toughest online law",https://www.nasdaq.com/articles/exclusive-facebook-rejects-talks-with-australia-publisher-testing-worlds-toughest-online,https://j.mp/2U2PSvY
Nasdaq,Private equity group CD&R plans to raise offer for UDG Healthcare,https://www.nasdaq.com/articles/private-equity-group-cdr-plans-to-raise-offer-for-udg-healthcare-2021-06-25,https://j.mp/3jpVJqb
Nasdaq,China listing frenzy in U.S. set to be boosted by Didi IPO,https://www.nasdaq.com/articles/china-listing-frenzy-in-u.s.-set-to-be-boosted-by-didi-ipo-2021-06-25,https://j.mp/3jdpH08
Nasdaq,"Japan's Rakuten to use Cisco routing tech for 5G, IoT services",https://www.nasdaq.com/articles/japans-rakuten-to-use-cisco-routing-tech-for-5g-iot-services-2021-06-25,https://j.mp/2T5tlyv
Nasdaq,Thailand to sell $1.57 bln govt savings bonds for support measures,https://www.nasdaq.com/articles/thailand-to-sell-%241.57-bln-govt-savings-bonds-for-support-measures-2021-06-25,https://j.mp/3dfofXA
Nasdaq,"FOREX-Dollar dips, but with a wary eye on U.S. inflation data",https://www.nasdaq.com/articles/forex-dollar-dips-but-with-a-wary-eye-on-u.s.-inflation-data-2021-06-25,https://j.mp/3vPyBnm
Nasdaq,German consumer morale rises more than expected heading into July- GfK,https://www.nasdaq.com/articles/german-consumer-morale-rises-more-than-expected-heading-into-july-gfk-2021-06-25,https://j.mp/35RpxE8
