feed,title,long_url,short_url
SeekingAlpha,Instant buyer home purchases approach pre-pandemic levels in May - Redfin,https://seekingalpha.com/news/3710111,
SeekingAlpha,"Fuwei Films stock soars premarket as Q1 earnings, revenues post strong Y/Y gains",https://seekingalpha.com/news/3710117,
SeekingAlpha,On the hour,https://seekingalpha.com/news/3710121,
SeekingAlpha,Netflix gets bullish upgrade at Credit Suisse on normalizing subscriber growth,https://seekingalpha.com/news/3710116,
SeekingAlpha,Hudbay resumes full production at Manitoba mine after fatality,https://seekingalpha.com/news/3710118,
