feed,title,long_url,short_url
ETFTrends,Don’t Miss Portfolio Yield Potential With NEOS Income ETFs,https://www.etftrends.com/monthly-income-channel/portfolio-yield-potential-neos-income-etfs/,https://da.gd/N4Te
ETFTrends,How Capturing the Night Effect With NSPL Can Enhance Portfolios,https://www.etftrends.com/night-effect-channel/how-capturing-night-effect-nspl-enhance-portfolios/,https://da.gd/9n6x
ETFTrends,Top Performing ETFs: Semiconductor ETFs Dominate,https://www.etftrends.com/tactical-allocation-channel/semiconductor-etfs-dominate-top-performing-etfs/,https://da.gd/guWjrm
ETFTrends,Managed Futures ETF DBMF Finds Footing in May,https://www.etftrends.com/managed-futures-channel/managed-futures-etf-finds-footing-may/,https://da.gd/BAro
ETFTrends,This Week in ETFs: BlackRock Debuts Two Actively Managed Funds,https://www.etftrends.com/blackrock-debuts-actively-managed-funds-week-in-etfs/,https://da.gd/1nUAy
ETFTrends,This Tax-Focused ETF Is Signaling a Buy,https://www.etftrends.com/core-strategies-channel/tax-focused-etf-is-signaling-buy/,https://da.gd/EOlWup
ETFTrends,Nvidia Shares Soar Alongside Strong AI Chip Demand,https://www.etftrends.com/disruptive-technology-channel/nvidia-shares-soar-alongside-strong-ai-chip-demand/,https://da.gd/n7VY
ETFTrends,"Lifted by Nvidia, SOXQ and PSI Among Best-Performing ETFs",https://www.etftrends.com/innovative-etfs-channel/lifted-nvidia-soxq-psi-among-best-performing-etfs/,https://da.gd/zHA3k
ETFTrends,KDIV to Benefit From Electronic Market 4.27% CAGR Growth,https://www.etftrends.com/china-insights-channel/electronic-market-growth-kdiv-captures/,https://da.gd/U0Qm
ETFTrends,ETF 360: Dan Philips on a Quality Low Volatility Approach,https://www.etftrends.com/etf-360-channel/etf-360-dan-philips-quality-low-volatility-approach/,https://da.gd/qH52Y
