feed,title,long_url,short_url
Investing,China says it will take all steps to guard its interests after latest Trump tariffs,https://www.investing.com/news/commodities-news/china-says-it-will-take-all-steps-to-guard-its-interests-after-latest-trump-tariffs-3922804,https://da.gd/USRgv
Investing,"Rheinmetall forecasts 2025 sales jump on Ukraine war, US decoupling",https://www.investing.com/news/stock-market-news/rheinmetall-forecasts-2025-sales-jump-on-ukraine-war-us-decoupling-3922796,https://da.gd/S52SmP
Investing,Swedish battery maker Northvolt files for bankruptcy,https://www.investing.com/news/stock-market-news/swedish-battery-maker-northvolt-files-for-bankruptcy-3922794,https://da.gd/njdy5i
Investing,"Avolta reports strong 2024 growth, expands global footprint and digital innovation",https://www.investing.com/news/stock-market-news/avolta-reports-strong-2024-growth-expands-global-footprint-and-digital-innovation-3922788,https://da.gd/PxU9Tf
Investing,J.P. Morgan economist sees 40% US recession chance and risks to 'exorbitant privilege',https://www.investing.com/news/economic-indicators/jp-morgan-economist-sees-40-us-recession-chance-and-risks-to-exorbitant-privilege-3922803,https://da.gd/AkdMW
