feed,title,long_url,short_url
Benzinga,Mastercard's Conservative Outlook and Relative P/E Discount Make It a Favorable Bet: Analysts Raise Price Targets,https://benzinga.com/news/23/07/33446103/mastercards-conservative-outlook-and-relative-pe-discount-make-it-a-favorable-bet-analysts-raise-pri,https://da.gd/A3NOh
Benzinga,"If You Invested $1000 In This Stock 10 Years Ago, You Would Have $18,000 Today",https://benzinga.com/news/earnings/23/07/33448346/if-you-invested-1000-in-this-stock-10-years-ago-you-would-have-18-000-today,https://da.gd/wbrWc
Benzinga,Here's How Much You Would Have Made Owning Sea Stock In The Last 5 Years,https://benzinga.com/news/earnings/23/07/33448345/heres-how-much-you-would-have-made-owning-sea-stock-in-the-last-5-years,https://da.gd/Nvt7f
Benzinga,Price Over Earnings Overview: GLOBALFOUNDRIES,https://benzinga.com/news/23/07/33448344/price-over-earnings-overview-globalfoundries,https://da.gd/ysaEu
Benzinga,Crude Oil Edges Higher; Colgate-Palmolive Posts Upbeat Earnings,https://benzinga.com/news/earnings/23/07/33448340/crude-oil-edges-higher-colgate-palmolive-posts-upbeat-earnings,https://da.gd/mqApvZ
