feed,title,long_url,short_url
SeekingAlpha,"Earth Science Tech, Inc. reports FQ1 results",https://seekingalpha.com/news/3992950,
SeekingAlpha,PlantX Life reports FY results,https://seekingalpha.com/news/3992954,
SeekingAlpha,"Meridian Bank GAAP EPS of $0.41, revenue of $43M",https://seekingalpha.com/news/3992961,
SeekingAlpha,"Canfor Non-GAAP EPS of -C$0.36, revenue of C$1.45B",https://seekingalpha.com/news/3992966,
SeekingAlpha,"Acadia Healthcare up 7% on 2023 revenue guidance boost, earnings",https://seekingalpha.com/news/3993120,
