feed,title,long_url,short_url
TheStreet,Hong Kong And Mainland Markets Rise As China's Economic Growth In 2020 Beats Expectations,https://www.thestreet.com/partner/hong-kong-and-mainland-markets-rise-as-china-s-economic-growth-in-2020-beats-expectations-15541107,https://j.mp/3ioGLxT
TheStreet,China GDP: Economy Ends Coronavirus-ravaged Year With Strong Growth Surge,https://www.thestreet.com/partner/china-gdp-economy-ends-coronavirus-ravaged-year-with-strong-growth-surge-15541109,https://j.mp/3queYin
TheStreet,"Hong Kong's Ocean Park Seeks HK$2.8 Billion To Survive As It Transitions With New Entertainment Zone, Conservation Efforts",https://www.thestreet.com/partner/hong-kong-s-ocean-park-seeks-hk-2-8-billion-to-survive-as-it-transitions-with-new-entertainment-zone-conservation-efforts-15541110,https://j.mp/3bQ8xCq
TheStreet,"Hong Kong-based Tech, Chinese Finance Firms To Hire More In 2021, Michael Page Survey Finds",https://www.thestreet.com/partner/hong-kong-based-tech-chinese-finance-firms-to-hire-more-in-2021-michael-page-survey-finds-15541108,https://j.mp/38VkTHa
TheStreet,"China Stock Alarm Bells Rebuffed As JPMorgan, BlackRock Stay Upbeat, Market Barometers Remain A Distance From 2015 Crash Triggers",https://www.thestreet.com/partner/china-stock-alarm-bells-rebuffed-as-jpmorgan-blackrock-stay-upbeat-market-barometers-remain-a-distance-from-2015-crash-triggers-15541112,https://j.mp/2LL41Ku
