feed,title,long_url,short_url
FXEmpire,U.S. House panel refers Amazon to Justice Department amid competition probe,https://www.fxempire.com/news/article/u-s-house-panel-refers-amazon-to-justice-department-amid-competition-probe-928922,https://bit.ly/3CGl7j3
FXEmpire,PM Johnson says Britain will gain from accepting Ukrainian refugees,https://www.fxempire.com/news/article/pm-johnson-says-britain-will-gain-from-accepting-ukrainian-refugees-928923,https://bit.ly/3sRHy1g
FXEmpire,"80,035 Ukrainian refugees registered in Germany so far -ministry",https://www.fxempire.com/news/article/80035-ukrainian-refugees-registered-in-germany-so-far-ministry-928924,https://bit.ly/3i9wbM9
FXEmpire,Ukraine calls for ceasefire to repair power line to Chernobyl nuclear plant,https://www.fxempire.com/news/article/ukraine-calls-for-ceasefire-to-repair-power-line-to-chernobyl-nuclear-plant-928925,https://bit.ly/3pLmfwr
FXEmpire,German foreign minister to meet Moldavian president this week,https://www.fxempire.com/news/article/german-foreign-minister-to-meet-moldavian-president-this-week-928926,https://bit.ly/3HXOluq
