feed,title,long_url,short_url
FXEmpire,Erdogan says Turkey ready to cooperate with Israel on energy,https://www.fxempire.com/news/article/erdogan-says-turkey-ready-to-cooperate-with-israel-on-energy-929276,https://bit.ly/3hUK2Wd
FXEmpire,"IOM calls for Ukraine ceasefire, humanitarian corridors",https://www.fxempire.com/news/article/iom-calls-for-ukraine-ceasefire-humanitarian-corridors-929281,https://bit.ly/34rMPmI
FXEmpire,Russia’s “Z” campaign drums up support for ‘operation’ in Ukraine,https://www.fxempire.com/news/article/russias-z-campaign-drums-up-support-for-operation-in-ukraine-929285,https://bit.ly/3HXSCyj
FXEmpire,Exclusive-BNP Paribas bars Russia-based staff from computer systems as cyber attack fears grow,https://www.fxempire.com/news/article/exclusive-bnp-paribas-bars-russia-based-staff-from-computer-systems-as-cyber-attack-fears-grow-929275,https://bit.ly/34rMOPG
FXEmpire,"EU blacklists Aeroflot CEO, more oligarchs in new sanction round – Official Journal",https://www.fxempire.com/news/article/eu-blacklists-aeroflot-ceo-more-oligarchs-in-new-sanction-round-official-journal-929280,https://bit.ly/3tDRnPw
FXEmpire,EU says Russia reports of biolabs in Ukraine likely disinformation,https://www.fxempire.com/news/article/eu-says-russia-reports-of-biolabs-in-ukraine-likely-disinformation-929283,https://bit.ly/3MBTBaD
