feed,title,long_url,short_url
Investing,Is Autozone A Buy Ahead Of Earnings Release?,https://investing.com/analysis/-200629488,
Investing,Can Roblox Reverse Its Falling Bookings Amid Rising Engagements?,https://investing.com/analysis/-200629487,
Investing,Celsius co-founder declares his equity is ‘worthless’ in court,https://investing.com/news/-2887227,
Investing,King dollar stomps on yen as U.S. yields rise,https://investing.com/news/-2886997,
Investing,Germany's Scholz: prices for energy deliveries must be lowered,https://investing.com/news/-2887239,
Investing,UK credit default swaps hit fresh 27 month high,https://investing.com/news/-2887252,
Investing,Europe's alternatives if Russia shuts off gas supply,https://investing.com/news/-2887237,
Investing,"UniCredit CEO sees ""shallow"" recession ahead",https://investing.com/news/-2887228,
