feed,title,long_url,short_url
SeekingAlpha,SoFi signs on Justin Herbert for new brand campaign,https://seekingalpha.com/news/3880856,
SeekingAlpha,"Canada's Ivey PMI jumps to 60.9, above 49.6 last month",https://seekingalpha.com/news/3880855,
SeekingAlpha,Starbucks' Howard Schultz praises incoming CEO as he preps for final exit,https://seekingalpha.com/news/3880854,
SeekingAlpha,CEL-SCI to soon address FDA concerns on cancer therapy,https://seekingalpha.com/news/3880853,
SeekingAlpha,Canoo: Buy This Cheap EV Stock For The Long Term,https://seekingalpha.com/article/4539361,
SeekingAlpha,UiPath Q2 Earnings: Plenty Of Warning Signs For Investors,https://seekingalpha.com/article/4539360,
SeekingAlpha,What To Do After Open Text Buys Micro Focus,https://seekingalpha.com/article/4539359,
