feed,title,long_url,short_url
SeekingAlpha,"Altice USA taps Comcast's Mathew for CEO, with Goei becoming chairman",https://seekingalpha.com/news/3881003,
SeekingAlpha,"Yext Non-GAAP EPS of -$0.03 beats by $0.02, revenue of $100.87M beats by $1.22M",https://seekingalpha.com/news/3881002,
SeekingAlpha,Rexford Industrial Realty acquires industrial properties in California for $338.9M,https://seekingalpha.com/news/3881001,
SeekingAlpha,"Couchbase GAAP EPS of -$0.34 beats by $0.05, revenue of $39.8M beats by $3.94M",https://seekingalpha.com/news/3881000,
SeekingAlpha,"Intapp Non-GAAP EPS of -$0.04 beats by $0.04, revenue of $75.52M beats by $4.06M",https://seekingalpha.com/news/3880999,
