feed,title,long_url,short_url
Investing,Gold prices steady at 10-day high as rate cut bets grow,https://www.investing.com/news/commodities-news/gold-prices-steady-at-10day-high-as-rate-cut-bets-grow-3508141,https://da.gd/sP36M
Investing,Alaska sues to challenge new NPR-A oil and gas leasing rules,https://www.investing.com/news/commodities-news/alaska-sues-to-challenge-new-npra-oil-and-gas-leasing-rules-3508140,https://da.gd/2ORS1
Investing,"China's Sinopec strikes large oil, gas flow at South China Sea well",https://www.investing.com/news/commodities-news/ch,https://da.gd/WTig
Investing,"Morning Bid: Bets mount for US rate cut, UK political shake up",https://www.investing.com/news/economy-news/morning-bid-bets-mount-for-us-rate-cut-uk-political-shake-up-3508142,https://da.gd/KbJu
Investing,"Not politics, not interest rates: India's surging economy at risk from water",https://www.investing.com/news/economy-news/not-politics-not-interest-rates-indias-surging-economy-at-risk-from-water-3508139,https://da.gd/N9bp
