feed,title,long_url,short_url
Investing,Apple airlifted iPhones worth a record $2 billion from India in March as Trump tariffs loomed,https://www.investing.com/news/stock-market-news/apple-airlifted-iphones-worth-a-record-2-billion-from-india-in-march-as-trump-tariffs-loomed-3986233,https://da.gd/lxxTTF
Investing,China customs chief urges businesses to diversify amid U.S. tariffs,https://www.investing.com/news/stock-market-news/china-customs-chief-urges-businesses-to-diversify-amid-us-tariffs-93CH-3986230,https://da.gd/9CHB
Investing,Wall Street sees strategic continuity as Caterpillar names Creed CEO,https://www.investing.com/news/stock-market-news/wall-street-sees-strategic-continuity-as-caterpillar-names-creed-ceo-3986229,https://da.gd/s5UV71
Investing,Mexico negotiates water-sharing agreement with northern states,https://www.investing.com/news/stock-market-news/mexico-negotiates-watersharing-agreement-with-northern-states-93CH-3986228,https://da.gd/LxVxqQ
Investing,Canadian home sales post weakest March since 2009 on tariff uncertainty,https://www.investing.com/news/economic-indicators/canadian-home-sales-post-weakest-march-since-2009-on-tariff-uncertainty-3986218,https://da.gd/SDft9y
Investing,Law firm Susman Godfrey asks judge to block Trump executive order,https://www.investing.com/news/economy-news/law-firm-susman-godfrey-asks-judge-to-block-trump-executive-order-3986215,https://da.gd/Y344n
