feed,title,long_url,short_url
Yahoo,J&J sees tariff impact from exports to China more than global imports: CFO,https://finance.yahoo.com/news/jj-sees-tariff-impact-from-exports-to-china-more-than-global-imports-cfo-155153851.html,https://da.gd/KJfg2
Yahoo,U.S. Energy Development extends Permian footprint with $390m asset acquisition,https://finance.yahoo.com/news/u-energy-development-extends-permian-154801094.html,https://da.gd/NbB634
Yahoo,Big Banks Alarmed After Their Regulator Gets Hacked,https://www.wsj.com/finance/regulation/big-banks-alarmed-after-their-regulator-gets-hacked-2721678d?siteid=yhoof2&yptr=yahoo,https://da.gd/L4Cm
Yahoo,Grant Cardone Torches Income Taxes: 'Show Me One Thread Of Proof Of How Federal Tax Dollars Improved Conditions For You Or Your Family',https://finance.yahoo.com/news/grant-cardone-torches-income-taxes-154537344.html,https://da.gd/ek6Vn
Yahoo,J&J Increases Outlook After Beating 1Q Expectations,https://www.wsj.com/business/earnings/j-j-increases-outlook-after-beating-1q-expectations-36cda438?siteid=yhoof2&yptr=yahoo,https://da.gd/4pbo
Yahoo,Travel Stocks Are No Ticket to Paradise,https://www.wsj.com/livecoverage/stock-market-trump-tariffs-trade-war-04-15-25/card/-travel-stocks-are-no-ticket-to-paradise-TtlyfRjmJAtCzVcwDrBW?siteid=yhoof2&yptr=yahoo,https://da.gd/xRamBe
Yahoo,"Asset finance new business sees 1% growth in February 2025, reports FLA",https://finance.yahoo.com/news/asset-finance-business-sees-1-154026906.html,https://da.gd/esAb1
Yahoo,How Is China Retaliating Against Trump’s Tariffs?,https://www.wsj.com/livecoverage/stock-market-trump-tariffs-trade-war-04-15-25/card/how-is-china-retaliating-against-trump-s-tariffs--w7NgeuD17GdlKfVhsIet?siteid=yhoof2&yptr=yahoo,https://da.gd/kTDsCP
