feed,title,long_url,short_url
InsiderMonkey,ConocoPhillips (COP): One of the Best Oil Stocks to Invest in According to Billionaires,https://insidermonkey.com/blog/--1508639,
InsiderMonkey,Chevron Corporation (CVX): Among the Best Oil Stocks to Invest in According to Billionaires,https://insidermonkey.com/blog/--1508637,
InsiderMonkey,Valero Energy Corporation (VLO): Among the Best Oil Stocks to Invest in According to Billionaires,https://insidermonkey.com/blog/--1508636,
InsiderMonkey,Jim Cramer Sees Strength in Walmart Inc. (WMT) Despite Rate Worries – “Don’t Count Retail Out”,https://insidermonkey.com/blog/--1508464,
InsiderMonkey,15 Best Blue Chip Stocks to Buy According to Billionaires,https://insidermonkey.com/blog/--1506963,
InsiderMonkey,Jim Cramer Watches Blackstone Inc. (BX) for Clues on NVIDIA – “A Data Center Reality Check”,https://insidermonkey.com/blog/--1508489,
InsiderMonkey,Jim Cramer Warns to Wait Before Trading American Express Company (AXP) – “Trust Me on This”,https://insidermonkey.com/blog/--1508472,
InsiderMonkey,Vistra Corp. (VST): Valuation Already Prices in Nuclear Play,https://insidermonkey.com/blog/--1508594,
InsiderMonkey,Jim Cramer Calls UnitedHealth Group Incorporated (UNH) a Universal Buy – “The Only Gimme”,https://insidermonkey.com/blog/--1508473,
InsiderMonkey,"Hedge Fund and Insider Trading News: Bill Ackman, Warren Buffett, L1 Capital, Millennium Management, Elliott Management, Eagle Capital Growth Fund Inc (GRF), JPMorgan Chase & Co (JPM), and More",https://insidermonkey.com/blog/--1508692,
