feed,title,long_url,short_url
Investing,"Bitcoin dominance lifts crypto market, Render shows resilience with whale activity",https://www.investing.com/news/cryptocurrency-news/bitcoin-dominance-lifts-crypto-market-render-shows-resilience-with-whale-activity-93CH-3251959,https://da.gd/5feXxW
Investing,Tucker Carlson’s new media company moves toward launch,https://www.investing.com/news/stock-market-news/tucker-carlsons-new-media-company-moves-toward-launch-3251960,https://da.gd/ut6fH
Investing,Swedish court rules against Tesla in postal service dispute,https://www.investing.com/news/stock-market-news/swedish-court-rules-against-tesla-in-postal-service-dispute-432SI-3251958,https://da.gd/kecdt
Investing,Trump defense presents expert witness in civil fraud trial,https://www.investing.com/news/stock-market-news/trump-defense-presents-expert-witness-in-civil-fraud-trial-93CH-3251956,https://da.gd/WtAgg
Investing,India to maintain governance stability with interim budget in February,https://www.investing.com/news/economy/india-to-maintain-governance-stability-with-interim-budget-in-february-93CH-3251957,https://da.gd/9LE5
