feed,title,long_url,short_url
SeekingAlpha,"Magellan Aerospace GAAP EPS of C$0.07, revenue of C$223.38M",https://seekingalpha.com/news/3966360,
SeekingAlpha,"Chuy's stock charges higher on earnings beat, boosted guidance",https://seekingalpha.com/news/3966359,
SeekingAlpha,"PNM Resources GAAP EPS of $0.64 beats by $0.26, revenue of $544.07M beats by $83.93M",https://seekingalpha.com/news/3966358,
SeekingAlpha,Coda Octopus appoints an interim CFO,https://seekingalpha.com/news/3966357,
SeekingAlpha,"National Healthcare Non-GAAP EPS of $0.79, revenue of $269.56M",https://seekingalpha.com/news/3966356,
