feed,title,long_url,short_url
CryptoNews,Binance Co-Founder Says Former CEO CZ Is in a ‘Positive Situation’ Ahead of Sentencing,https://cryptonews.com/news/binance-co-founder-says-former-ceo-cz-is-in-a-positive-situation-ahead-of-sentencing.htm,https://da.gd/uiLT2w
CryptoNews,"Best Crypto to Buy Now April 19 – Bitcoin, Dogwifhat, THORChain",https://cryptonews.com/news/best-crypto-to-buy-now-april-19-bitcoin-dogwifhat-thorchain.htm,https://da.gd/olnlXq
CryptoNews,"Litecoin Price Prediction as LTC Consolidates at $80 Level – $1,000 LTC Possible?",https://cryptonews.com/news/litecoin-price-prediction-as-ltc-consolidates-at-80-level-1000-ltc-possible.htm,https://da.gd/BNavDd
CryptoNews,Bitcoin’s Fourth Halving Imminent: Less Than 100 Blocks Away – Here’s What Happens Next,https://cryptonews.com/news/bitcoins-fourth-halving-imminent-less-than-100-blocks-away-heres-what-happens-next.htm,https://da.gd/YiTmW0
CryptoNews,"SEC Reworks Justin Sun Tron Lawsuit, Claims Founder “Traveled Extensively”",https://cryptonews.com/news/justin-sun-tron-lawsuit-edited-after-trn-foundation-founder-tries-to-dismiss-claims.htm,https://da.gd/41DT8
CryptoNews,Discover Why Crypto Whales Are Quietly Stocking Up on This GambleFi Token for the 2024 Bull Run,https://cryptonews.com/news/discover-why-crypto-whales-are-quietly-stocking-up-on-this-gamblefi-token-for-the-2024-bull-run.htm,https://da.gd/N5gH
CryptoNews,Pepe Holders Are Moving Their Investments to a New Bitcoin Project – What’s Behind the Shift?,https://cryptonews.com/news/pepe-holders-are-moving-their-investments-to-a-new-bitcoin-project-whats-behind-the-shift.htm,https://da.gd/5xixU2
CryptoNews,Galactic Group Launch AAA Web3 Play-to-Own Game Publisher With World-Class Talent,https://cryptonews.com/news/galactic-group-launch-aaa-web3-game-publisher.htm,https://da.gd/zgWl4k
CryptoNews,"Andreas Brekken, Founder of SideShift.ai, on Bull Run, Meme Coins, and Ethereum Sharding | Ep. 327",https://cryptonews.com/exclusives/andreas-brekken-founder-of-sideshift-ai-on-bull-run-meme-coins-and-ethereum-sharding-ep-327.htm,https://da.gd/2mAxa
CryptoNews,HashKey Exchange Suspends Binance Deposits and Withdrawals Citing Policy Adjustments,https://cryptonews.com/news/hashkey-exchange-suspends-binance-deposits-and-withdrawals-citing-policy-adjustments.htm,https://da.gd/81fkg
CryptoNews,"BlockDAG Sparks Investor Interest with 30,000x ROI Potential Amid Moon Keynote Teaser as Polkadot & Shiba Inu Prices Surge",https://cryptonews.com/news/blockdag-sparks-investor-interest-with-30000x-roi-potential-amid-moon-keynote-teaser-as-polkadot-shiba-inu-prices-surge.htm,https://da.gd/NFDIV
