feed,title,long_url,short_url
Yahoo,Could Arm Holdings Become the Next Nvidia?,https://www.fool.com/investing/2024/03/18/could-arm-holdings-become-the-next-nvidia/?source=eptyholnk0000202&utm_source=yahoo-host-full&utm_medium=feed&utm_campaign=article&.tsrc=rss,https://da.gd/SKhHPB
Yahoo,"SoundHound AI Stock Still Has Upside After a Big Surge, According to 1 Wall Street Analyst. Is the Stock a Buy Around a 2-Year High?",https://www.fool.com/investing/2024/03/18/soundhound-ai-stock-still-has-upside-after-a-huge/?source=eptyholnk0000202&utm_source=yahoo-host-full&utm_medium=feed&utm_campaign=article&.tsrc=rss,https://da.gd/E1qHE
Yahoo,Tesla Stock Investors Should Start Realizing This Now,https://www.fool.com/investing/2024/03/18/tesla-stock-investors-should-start-realizing-this/?source=eptyholnk0000202&utm_source=yahoo-host-full&utm_medium=feed&utm_campaign=article&.tsrc=rss,https://da.gd/LOLOw
Yahoo,Super Micro Computer Trades Near All-Time Highs: Is the Stock Still a Buy?,https://www.fool.com/investing/2024/03/18/super-micro-computer-trades-near-all-time-highs-is/?source=eptyholnk0000202&utm_source=yahoo-host-full&utm_medium=feed&utm_campaign=article&.tsrc=rss,https://da.gd/4sp4
Yahoo,Nvidia's Artificial Intelligence (AI) Conference Starts Monday and Here Are Some Sessions Nvidia Investors Should Watch,https://www.fool.com/investing/2024/03/18/nvidias-artificial-intelligence-ai-conference-star/?source=eptyholnk0000202&utm_source=yahoo-host-full&utm_medium=feed&utm_campaign=article&.tsrc=rss,https://da.gd/OgENNt
