feed,title,long_url,short_url
InsiderMonkey,Is CRAI A Good Stock To Buy Now?,https://insidermonkey.com/blog/--901385,https://j.mp/2KliaNq
InsiderMonkey,Where Do Hedge Funds Stand On Coca-Cola Consolidated Inc. (COKE)?,https://insidermonkey.com/blog/--901382,https://j.mp/37R9Qgs
InsiderMonkey,Is EMKR A Good Stock To Buy Now?,https://insidermonkey.com/blog/--901379,https://j.mp/2LxrPBh
InsiderMonkey,Is INFU A Good Stock To Buy Now?,https://insidermonkey.com/blog/--901376,https://j.mp/3a60sIL
InsiderMonkey,Is AUB A Good Stock To Buy Now?,https://insidermonkey.com/blog/--899052,https://j.mp/3mdV88C
