feed,title,long_url,short_url
SeekingAlpha,Oppenheimer’s Bullish Composite has reached “excessive” levels,https://seekingalpha.com/news/4121230,
SeekingAlpha,Actelis announces exercise of warrants for $2.25M gross proceeds,https://seekingalpha.com/news/4121229,
SeekingAlpha,Lincoln Gold upsizes private placement,https://seekingalpha.com/news/4121228,
SeekingAlpha,iShares iBonds Dec 2026 Term Treasury ETF declares monthly distribution of $0.0769,https://seekingalpha.com/news/4121227,
SeekingAlpha,"Meta, Snap, Google in focus as SCOTUS dismisses rulings to restrict social media",https://seekingalpha.com/news/4121217,
SeekingAlpha,iShares iBonds Dec 2025 Term Treasury ETF declares monthly distribution of $0.0834,https://seekingalpha.com/news/4121226,
