feed,title,long_url,short_url
ZeroHedgeRU,Summer Might Be About To Heat Up For The VIX,https://www.zerohedge.com/markets/summer-might-be-about-heat-vix,https://da.gd/ksbQuz
ZeroHedgeRU,'Shark Tank' Star Daymond John Granted Restraining Order Against Contestants,https://www.zerohedge.com/markets/shark-tank-star-daymond-john-granted-restraining-order-against-contestants,https://da.gd/EUmwWN
ZeroHedgeRU,"Hedge Fund CIO: ""Balance Sheet Weakness Is The Cost Of Artificial Stability""",https://www.zerohedge.com/markets/hedge-fund-cio-balance-sheet-weakness-cost-artificial-stability,https://da.gd/bMB5
ZeroHedgeRU,"Millennials & Gen Z's Can't Afford To Buy A Home No Matter How Much They Save, So Why Not Embrace Nihilism And Buy Taylor Swift Tickets",https://www.zerohedge.com/markets/millennials-gen-zs-cant-afford-buy-home-no-matter-how-much-they-save-so-why-not-embrace,https://da.gd/sLXTl1
ZeroHedgeRU,"Key Events This Extremely Busy Week: Buckle Up For Fed, ECB, BOJ, PMIs, GDP, PCE And 48% Of S&P Reporting",https://www.zerohedge.com/markets/key-events-extremely-busy-week-buckle-fed-ecb-boj-pmis-gdp-pce-and-48-sp-reporting,https://da.gd/uGw68
ZeroHedgeRU,US PMIs Scream Stagflation As Services Sector Slumps,https://www.zerohedge.com/personal-finance/us-pmis-signal-scream-stagflation-services-sector-slumps,https://da.gd/XYAy
ZeroHedgeRU,"China's Politburo Aims To Stabilize Property Market By Intensifying ""Counter-Cyclical Adjustments""",https://www.zerohedge.com/markets/chinas-politburo-amis-stabilize-property-market-intensifying-counter-cyclical-adjustments,https://da.gd/Z9DCc
