feed,title,long_url,short_url
ETFTrends,SPY Is a Critical Part of the ETF Industry,https://www.etftrends.com/spy-is-a-critical-part-of-the-etf-industry/,https://da.gd/nf73
ETFTrends,Balaji Venkataraman: Bond Rate Risk Has Subsided,https://www.etftrends.com/core-strategies-channel/venkataraman-bond-rate-risk-has-subsided/,https://da.gd/zsDwk7
ETFTrends,Corey Hoffstein and Jason Buck Discuss the Cockroach Portfolio on Flirting With Models,https://www.etftrends.com/exchange-an-etf-experience/hoffstein-and-buck-discuss-the-cockroach-portfolio-on-flirting-with-models/,https://da.gd/bp2s
ETFTrends,Finance’s Big Thinkers Take On Institutional Failure,https://www.etftrends.com/finances-big-thinkers-take-on-institutional-failure/,https://da.gd/1Ipg
ETFTrends,The February 2023 Dashboard: Our Three Layers of Risk Management,https://www.etftrends.com/etf-strategist-channel/the-february-2023-dashboard-our-three-layers-of-risk-management/,https://da.gd/woD0
ETFTrends,NUSI Offered Noteworthy Volatility Reduction in 2022,https://www.etftrends.com/retirement-income-channel/nusi-offered-noteworthy-volatility-reduction-in-2022/,https://da.gd/fsQAVi
ETFTrends,Temporary Optimism,https://www.etftrends.com/etf-strategist-channel/temporary-optimism/,https://da.gd/VbJyIA
ETFTrends,Calamos Investments Launches New Sustainable Equities ETF SROI,https://www.etftrends.com/calamos-investments-launches-new-sustainable-equities-etf-sroi/,https://da.gd/82Unp0
ETFTrends,Exchange Gives Back: Volunteers Partner With Surfrider to Keep Miami Beach Clean,https://www.etftrends.com/exchange-an-etf-experience/exchange-gives-back-volunteers-partner-with-surfrider-to-keep-miami-beach-clean/,https://da.gd/XTZcKb
ETFTrends,Why Are Active ETFs so Popular? Because They Exist,https://www.etftrends.com/active-etf-channel/why-are-active-etfs-so-popular-because-they-exist/,https://da.gd/vJGfD
