feed,title,long_url,short_url
SeekingAlpha,"ePlus Non-GAAP EPS of $1.38, revenue of $623.5M",https://seekingalpha.com/news/3933232,
SeekingAlpha,Voya Financial Non-GAAP EPS of $2.18 beats by $0.64,https://seekingalpha.com/news/3933231,
SeekingAlpha,KKR Real Estate Finance Trust Q4 results mixed,https://seekingalpha.com/news/3933228,
SeekingAlpha,"StoneX GAAP EPS of $3.62 beats by $1.49, revenue of $654.8M",https://seekingalpha.com/news/3933227,
SeekingAlpha,Longboard Pharma launches $20M stock offering,https://seekingalpha.com/news/3933226,
SeekingAlpha,"Zurn Water Solutions Non-GAAP EPS of $0.16 misses by $0.01, revenue of $340M misses by $4.77M",https://seekingalpha.com/news/3933225,
SeekingAlpha,"Tenable Holdings Non-GAAP EPS of $0.12 beats by $0.05, revenue of $184.63M beats by $3.25M, revenue guidance below consensus",https://seekingalpha.com/news/3933224,
