feed,title,long_url,short_url
Benzinga,"SHAREHOLDER ALERT: WeissLaw LLP Reminds COHR, NHLD, MGLN, and SMTX Shareholders About Its Ongoing Investigations",https://www.benzinga.com/pressreleases/21/01/n19332010/shareholder-alert-weisslaw-llp-reminds-cohr-nhld-mgln-and-smtx-shareholders-about-its-ongoing-inve,https://j.mp/3qRKabA
Benzinga,"CuePath Launches Contactless Medication Adherence Service for North American Home Care Agencies, Partners with The Care Company in First Agreement",https://www.benzinga.com/pressreleases/21/01/n19331986/cuepath-launches-contactless-medication-adherence-service-for-north-american-home-care-agencies-pa,https://j.mp/3t2oyeG
Benzinga,"With COVID-19 on the Rise Amid Vaccine Shortages, Black Clergy Join National Effort to Ramp up COVID-19 Testing in Communities Hardest Hit by Coronavirus",https://www.benzinga.com/pressreleases/21/01/n19331985/with-covid-19-on-the-rise-amid-vaccine-shortages-black-clergy-join-national-effort-to-ramp-up-covi,https://j.mp/2NGc4ZR
Benzinga,"CuePath Launches Contactless Medication Adherence Service for North American Home Care Agencies, Partners with The Care Company in First Agreement",https://www.benzinga.com/pressreleases/21/01/n19331983/cuepath-launches-contactless-medication-adherence-service-for-north-american-home-care-agencies-pa,https://j.mp/3sZaLFt
Benzinga,"Andrew Limbek Joins Psychemedics Corporation as Vice President, Controller",https://www.benzinga.com/pressreleases/21/01/g19331968/andrew-limbek-joins-psychemedics-corporation-as-vice-president-controller,https://j.mp/3a4HDnM
Benzinga,Survey & Ballot Systems Wins BoardRoom Magazine 'Excellence in Achievement' Award,https://www.benzinga.com/pressreleases/21/01/n19331935/survey-ballot-systems-wins-boardroom-magazine-excellence-in-achievement-award,https://j.mp/3cqQ7bJ
Benzinga,Suridata.ai Closes Seed Round led by the Israel – Colorado Innovation Fund,https://www.benzinga.com/pressreleases/21/01/g19331927/suridata-ai-closes-seed-round-led-by-the-israel-colorado-innovation-fund,https://j.mp/3aaqM2G
Benzinga,PerkinElmer Launches Industry-First GPCR TR-FRET Binding Assay and Beta-Arrestin Kits to Help Advance Therapeutics Discovery,https://www.benzinga.com/pressreleases/21/01/b19331921/perkinelmer-launches-industry-first-gpcr-tr-fret-binding-assay-and-beta-arrestin-kits-to-help-adva,https://j.mp/3oeIwiA
