feed,title,long_url,short_url
SeekingAlpha,Alvotech starts confirmatory patient trial of J&J Simponi biosimilar,https://seekingalpha.com/news/3965372,
SeekingAlpha,"WESCO Non-GAAP EPS of $3.75 beats by $0.17, revenue of $5.5B beats by $50M",https://seekingalpha.com/news/3965377,
SeekingAlpha,"Aurinia Pharma GAAP EPS of -$0.18 beats by $0.04, revenue of $34.41M beats by $6.29M",https://seekingalpha.com/news/3965376,
SeekingAlpha,"Ball Non-GAAP EPS of $0.69 beats by $0.18, revenue of $3.49B misses by $80M",https://seekingalpha.com/news/3965375,
SeekingAlpha,"Genesis Energy GAAP EPS of -$0.21 misses by $0.34, revenue of $790.61M",https://seekingalpha.com/news/3965374,
SeekingAlpha,Stanley Black & Decker reports mixed Q1 earnings; reaffirms FY23 outlook,https://seekingalpha.com/news/3965373,
SeekingAlpha,"Oaktree Specialty Lending NII of $0.62 misses by $0.01, Adj. total investment income of $95.7M beats by $2.58M",https://seekingalpha.com/news/3965371,
