feed,title,long_url,short_url
Investing,Lockheed realigns space business to boost efficiency,https://www.investing.com/news/stock-market-news/lockheed-realigns-space-business-to-boost-efficiency-3073252,https://da.gd/8FTQy4
Investing,"Midday movers: PacWest Bancorp, Paramount Global, Shopify and more",https://www.investing.com/news/stock-market-news/midday-movers-pacwest-bancorp-paramount-global-shopify-and-more-3073247,https://da.gd/KJFxO
Investing,Stanley Black & Decker results mixed as revenue impacted by lower consumer and DIY volume,https://www.investing.com/news/stock-market-news/stanley-black--decker-results-mixed-as-revenue-impacted-by-lower-consumer-and-diy-volume-432SI-3073244,https://da.gd/hVzeuz
Investing,Raymond James cuts estimates on Revolve Group following 1Q miss,https://www.investing.com/news/stock-market-news/raymond-james-cuts-estimates-on-revolve-group-following-1q-miss-432SI-3073243,https://da.gd/3llMyV
Investing,"VP Harris tells Microsoft, Google they have legal responsibility to ensure safety of AI products",https://www.investing.com/news/stock-market-news/vp-harris-tells-microsoft-google-they-have-legal-responsibility-to-ensure-safety-of-ai-products-3073241,https://da.gd/jvDm0r
Investing,Wingstop downgraded at Citi as 'cracks are forming in US macro,https://www.investing.com/news/stock-market-news/wingstop-downgraded-at-citi-as-cracks-are-forming-in-us-macro-432SI-3073231,https://da.gd/ZImX
