feed,title,long_url,short_url
SeekingAlpha,"Netflix stock not facing an HBO Max 'Death Star', analyst says",https://seekingalpha.com/news/3641724,
SeekingAlpha,Meten EdtechX reports Q3 results,https://seekingalpha.com/news/3641723,
SeekingAlpha,Genius Brands promotes Michael Jaffa to COO,https://seekingalpha.com/news/3641722,
SeekingAlpha,Construction Partners acquires an asphalt and paving contractor,https://seekingalpha.com/news/3641721,
SeekingAlpha,Castle Biosciences' clinical impact of melanoma prognostic test published in Future Oncology,https://seekingalpha.com/news/3641720,
