feed,title,long_url,short_url
SeekingAlpha,CCA Industries reports Q3 results,https://seekingalpha.com/news/3753397,
SeekingAlpha,S&P 500’s weekly market breakdown and sector performance,https://seekingalpha.com/news/3753396,
SeekingAlpha,Credit Acceptance extends revolving secured warehouse facility,https://seekingalpha.com/news/3753395,
SeekingAlpha,FCPT acquires Chili’s restaurant property for $3.2M,https://seekingalpha.com/news/3753390,
SeekingAlpha,Mudrick Capital Acquisition Corp. II: Attractive Warrants After Failed Deal,https://seekingalpha.com/article/4460145,
