feed,title,long_url,short_url
Benzinga,Polkadot Rises More Than 3% In 24 hours,https://benzinga.com/insights/cryptocurrency/24/02/37009965/polkadot-rises-more-than-3-in-24-hours,https://da.gd/4SFF9
Benzinga,Wrapped Bitcoin Up More Than 4% In 24 hours,https://benzinga.com/insights/cryptocurrency/24/02/37009935/wrapped-bitcoin-up-more-than-4-in-24-hours,https://da.gd/X7jPeO
Benzinga,Cardano Up More Than 10% In 24 hours,https://benzinga.com/insights/cryptocurrency/24/02/37009923/cardano-up-more-than-10-in-24-hours,https://da.gd/IXp2d
Benzinga,BNB's Price Increased More Than 5% Within 24 hours,https://benzinga.com/insights/cryptocurrency/24/02/37009898/bnbs-price-increased-more-than-5-within-24-hours,https://da.gd/Jtbog
Benzinga,Decoding Palo Alto Networks's Options Activity: What's the Big Picture?,https://benzinga.com/insights/options/24/02/37009881/decoding-palo-alto-networkss-options-activity-whats-the-big-picture,https://da.gd/0usUw
Benzinga,Comcast's Options: A Look at What the Big Money is Thinking,https://benzinga.com/insights/options/24/02/37009876/comcasts-options-a-look-at-what-the-big-money-is-thinking,https://da.gd/DKslu2
Benzinga,Apple's Holiday Quarter Broke Years-Long Streak Of Revenue Declines But China Slowdown Overshadowed Even Its Record Service Revenue,https://benzinga.com/news/24/02/37009787/apples-holiday-quarter-broke-years-long-streak-of-revenue-declines-but-china-slowdown-overshadowed-e,https://da.gd/0souN
