feed,title,long_url,short_url
SeekingAlpha,"eGain Communications Non-GAAP EPS of $0.11 beats by $0.03, revenue of $23.8M beats by $0.23M",https://seekingalpha.com/news/4064827,
SeekingAlpha,GoDaddy appoints Jared Sine as its chief strategy & legal officer,https://seekingalpha.com/news/4064824,
SeekingAlpha,"Sensus Healthcare GAAP EPS of $0.26 beats by $0.12, revenue of $12.6M beats by $0.54M",https://seekingalpha.com/news/4064823,
SeekingAlpha,"Boyd Gaming Non-GAAP EPS of $1.66 beats by $0.17, revenue of $954.41M beats by $25.35M",https://seekingalpha.com/news/4064822,
SeekingAlpha,Regency Centers FFO of $1.02 in-line,https://seekingalpha.com/news/4064821,
SeekingAlpha,"Pinterest dips 11% on revenue miss, light guidance",https://seekingalpha.com/news/4064819,
SeekingAlpha,CloudFlare beats top-line and bottom-line estimates; initiates Q1 and FY24 outlook,https://seekingalpha.com/news/4064820,
