feed,title,long_url,short_url
SeekingAlpha,"Iteris GAAP EPS of $0.01 in-line, revenue of $42.13M beats by $0.39M",https://seekingalpha.com/news/4064846,
SeekingAlpha,"VeriSign GAAP EPS of $2.60 beats by $0.74, revenue of $380.4M beats by $2.53M",https://seekingalpha.com/news/4064845,
SeekingAlpha,COPT Defense Properties announces 2024 outlook,https://seekingalpha.com/news/4064844,
SeekingAlpha,"SPS Commerce Non-GAAP EPS of $0.75 beats by $0.05, revenue of $145M beats by $2.21M",https://seekingalpha.com/news/4064843,
SeekingAlpha,"Take-Two falls 7% on holiday bookings miss, trimmed full-year guidance",https://seekingalpha.com/news/4064841,
SeekingAlpha,"Viad Non-GAAP EPS of -$0.79 misses by $0.04, revenue of $291.7M beats by $14.58M",https://seekingalpha.com/news/4064842,
SeekingAlpha,FirstEnergy Non-GAAP EPS of $0.62 beats by $0.03,https://seekingalpha.com/news/4064840,
SeekingAlpha,Xenon Pharmaceuticals: Analysts Still Positive Despite Recent Trial 'Setbacks',https://seekingalpha.com/article/4668768,
