feed,title,long_url,short_url
Investing,Bubble or the Next AI Investment Cycle? What We Learned From Megacap Earnings,https://www.investing.com/analysis/bubble-or-the-next-ai-investment-cycle-what-we-learned-from-megacap-earnings-200669469,
Investing,Mexico stocks lower at close of trade; S&P/BMV IPC down 0.19%,https://www.investing.com/news/stock-market-news/mexico-stocks-lower-at-close-of-trade-spbmv-ipc-down-019-4325600,
Investing,Russia stocks lower at close of trade; MOEX Russia Index down 1.31%,https://www.investing.com/news/stock-market-news/russia-stocks-lower-at-close-of-trade-moex-russia-index-down-131-4325592,
Investing,Colombia stocks lower at close of trade; COLCAP down 0.18%,https://www.investing.com/news/stock-market-news/colombia-stocks-lower-at-close-of-trade-colcap-down-018-4325591,
Investing,Dynamix Corporation III raises $201.25 million in IPO,https://www.investing.com/news/stock-market-news/dynamix-corporation-iii-raises-20125-million-in-ipo-432SI-4325548,
