feed,title,long_url,short_url
Investing,"BioCryst Pharmaceuticals options trading jumps to 13,522",https://www.investing.com/news/stock-market-news/biocryst-pharmaceuticals-options-trading-jumps-to-13522-93CH-4758682,
Investing,U.K. stocks higher at close of trade; Investing.com United Kingdom 100 up 0.22%,https://www.investing.com/news/stock-market-news/uk-stocks-higher-at-close-of-trade-investingcom-united-kingdom-100-up-022-4758679,
Investing,Spain stocks lower at close of trade; IBEX 35 down 0.45%,https://www.investing.com/news/stock-market-news/spain-stocks-lower-at-close-of-trade-ibex-35-down-045-4758674,
Investing,Portugal stocks lower at close of trade; PSI down 0.88%,https://www.investing.com/news/stock-market-news/portugal-stocks-lower-at-close-of-trade-psi-down-088-4758671,
Investing,Netherlands stocks lower at close of trade; AEX down 0.03%,https://www.investing.com/news/stock-market-news/netherlands-stocks-lower-at-close-of-trade-aex-down-003-4758669,
Investing,Italy stocks lower at close of trade; Investing.com Italy 40 down 0.67%,https://www.investing.com/news/stock-market-news/italy-stocks-lower-at-close-of-trade-investingcom-italy-40-down-067-4758668,
Investing,Germany stocks lower at close of trade; DAX down 0.71%,https://www.investing.com/news/stock-market-news/germany-stocks-lower-at-close-of-trade-dax-down-071-4758667,
