feed,title,long_url,short_url
InsiderMonkey,Bitdeer Technologies (BTDR): Top Crypto and AI Play in Situational Awareness Portfolio,https://insidermonkey.com/blog/--1787249,
InsiderMonkey,Leopold Aschenbrenner’s Situational Awareness Surprising AI Stock Pick in 2026,https://insidermonkey.com/blog/--1787246,
InsiderMonkey,Emp Metals Receives Final Major Equipment Shipment at Project Aurora Demonstration Plant,https://insidermonkey.com/blog/--1788673,
InsiderMonkey,Here’s Why JPMorgan (JPM) is Among the 10 All-Time High Stocks with Legs to Rally Further,https://insidermonkey.com/blog/--1788800,
InsiderMonkey,Wells Fargo Raises its Price Target on Lam Research (LRCX),https://insidermonkey.com/blog/--1788802,
InsiderMonkey,Bernstein Raises its Price Target on Arm Holdings (ARM),https://insidermonkey.com/blog/--1788803,
InsiderMonkey,Wells Fargo Raises its Price Target on KLA Corporation (KLAC),https://insidermonkey.com/blog/--1788804,
InsiderMonkey,Scotiabank Raises its Price Target on Bank of Montreal (BMO),https://insidermonkey.com/blog/--1788807,
InsiderMonkey,Scotiabank Raises its Price Target on Toronto-Dominion Bank (TD),https://insidermonkey.com/blog/--1788808,
InsiderMonkey,Marriott (MAR) Hotel Owners Seek More Bonvoy Revenue,https://insidermonkey.com/blog/--1788809,
InsiderMonkey,BofA Raises its Price Target on CSX Corporation (CSX),https://insidermonkey.com/blog/--1788810,
InsiderMonkey,ASML Holding (ASML): The Best All-Time High Stock with Legs to Rally Further,https://insidermonkey.com/blog/--1788811,
