feed,title,long_url,short_url
FXEmpire,"As fuel prices rise to record highs, governments look for solutions",https://www.fxempire.com/news/article/as-fuel-prices-rise-to-record-highs-governments-look-for-solutions-930352,https://bit.ly/3hVZHF2
FXEmpire,Lithuania tightens state of emergency over Ukraine invasion,https://www.fxempire.com/news/article/lithuania-tightens-state-of-emergency-over-ukraine-invasion-930282,https://bit.ly/3vVWBsB
FXEmpire,U.S. health insurer Anthem plans to rebrand as Elevance Health,https://www.fxempire.com/news/article/u-s-health-insurer-anthem-plans-to-rebrand-as-elevance-health-930360,https://bit.ly/3IcXWhr
FXEmpire,Peloton to test new price plans – WSJ,https://www.fxempire.com/news/article/peloton-to-test-new-price-plans-wsj-930351,https://bit.ly/3I3tDcG
FXEmpire,Octopus Renewables signs deals to increase wind power portfolio,https://www.fxempire.com/news/article/octopus-renewables-signs-deals-to-increase-wind-power-portfolio-930354,https://bit.ly/37lDrST
