feed,title,long_url,short_url
ETFTrends:DailyRecap,3 Types of Commodity ETFs,https://www.etftrends.com/etf-education-channel/3-types-of-commodities-etfs/,https://bit.ly/3pSjUzX
ETFTrends:DailyRecap,Long-Term Investors Should Stick to Stocks,https://www.etftrends.com/portfolio-strategies-channel/long-term-investors-should-stick-to-stocks/,https://bit.ly/3sW10tz
ETFTrends:DailyRecap,"President Biden Issues Executive Order on Cryptocurrencies, Crypto Gains",https://www.etftrends.com/crypto-channel/biden-issues-executive-order-on-cryptocurrencies-bitcoin-gains/,https://bit.ly/3J1wyns
ETFTrends:DailyRecap,U.S. Shale Won’t Be Pressuring Oil ETFs Any Time Soon,https://www.etftrends.com/alternatives-channel/us-shale-wont-be-pressuring-oil-etfs-any-time-soon/,https://bit.ly/3tOv61H
ETFTrends:DailyRecap,Under The Hood Of ASET,https://www.etftrends.com/multi-asset-channel/under-the-hood-of-aset/,https://bit.ly/36aWjU8
ETFTrends:DailyRecap,Corporate Bond ETFs Reflect Growing Unease in Credit Market,https://www.etftrends.com/corporate-bond-etfs-reflect-growing-unease-in-credit-market/,https://bit.ly/3MDvLeY
ETFTrends:DailyRecap,"European Carbon Allowances Markets on the Rise Again, KEUA Captures",https://www.etftrends.com/climate-insights-channel/european-carbon-allowances-markets-on-the-rise-again-keua-captures/,https://bit.ly/35G99tE
ETFTrends:DailyRecap,Wheat ETF Retreats as Russia-Ukraine War Shows Limited Global Supply Impact,https://www.etftrends.com/alternatives-channel/wheat-etf-retreats-as-russia-ukraine-war-shows-limited-impact-on-global-supply/,https://bit.ly/3I0915h
ETFTrends:DailyRecap,China: The Next Global Equity Boon with Rate Cuts Near?,https://www.etftrends.com/china-insights-channel/china-the-next-global-equity-boon-with-rate-cuts-near/,https://bit.ly/3vSQPIg
ETFTrends:DailyRecap,An Advisor’s Guide to Which Industries Would Drive Inflation Down,https://www.etftrends.com/china-insights-channel/advisors-guide-to-industries-necessary-to-drive-inflation-down/,https://bit.ly/3Kr7syE
ETFTrends:DailyRecap,The Advisor’s Guide to Sector Equal Weighting,https://www.etftrends.com/etf-building-blocks-channel/the-advisors-guide-to-sector-equal-weighting/,https://bit.ly/3MDvMj2
ETFTrends:DailyRecap,"Growth Stock ETFs Surge as Bargain Hunters Pick Up Cheap, Beaten-Down Segments",https://www.etftrends.com/core-strategies-channel/growth-stock-etfs-surge-as-bargain-hunters-pick-up-cheap-beaten-down-segments/,https://bit.ly/3I3wfqV
ETFTrends:DailyRecap,"As Commodity Prices Soar, Consider GCC",https://www.etftrends.com/modern-portfolio-channel/as-commodity-prices-soar-consider-gcc/,https://bit.ly/34tfNCH
ETFTrends:DailyRecap,Investors De-Risk From Cryptocurrencies as Russia-Ukraine Conflict Heightens,https://www.etftrends.com/crypto-channel/investors-de-risk-from-cryptocurrencies-as-russia-ukraine-conflict-heightens/,https://bit.ly/34xi7c2
ETFTrends:DailyRecap,Rosy Prospects for This ESG ETF,https://www.etftrends.com/portfolio-strategies-channel/rosy-prospects-for-this-esg-etf/,https://bit.ly/3pOtRy8
ETFTrends:DailyRecap,Bipartisan Group of Senators Proposes Freeze on Russia Gold Reserves,https://www.etftrends.com/gold-silver-investing-channel/bipartisan-group-of-senators-proposes-freeze-on-russia-gold-reserves/,https://bit.ly/3sXumb9
ETFTrends:DailyRecap,ETF 360: Q&A With Dimensional Fund Advisors’ Dave Plecha,https://www.etftrends.com/etf-360-channel/etf-360-qa-with-dimensional-fund-advisors-dave-plecha/,https://bit.ly/364S8Jt
ETFTrends:DailyRecap,Top Performing Leveraged/Inverse ETFs: 03/06/2022,https://www.etftrends.com/leveraged-inverse-channel/top-performing-leveragedinverse-etfs-03062022/,https://bit.ly/3sZ0zi8
ETFTrends:DailyRecap,Global Dividends Continue Resurgence,https://www.etftrends.com/model-portfolio-channel/global-dividends-continue-resurgence/,https://bit.ly/3sWUGlR
ETFTrends:DailyRecap,Russia’s Ukraine Invasion Highlights Crypto Benefits,https://www.etftrends.com/disruptive-technology-channel/russias-ukraine-invasion-highlights-crypto-benefits/,https://bit.ly/3MDdj5Z
ETFTrends:DailyRecap,Julex Capital Macro Chart Book – February 2022,https://www.etftrends.com/etf-strategist-channel/julex-capital-macro-chart-book-february-2022/,https://bit.ly/3MDcM44
ETFTrends:DailyRecap,"Active Management Fees Down, But Won’t Keep Dropping",https://www.etftrends.com/active-etf-channel/active-management-fees-down-but-wont-keep-dropping/,https://bit.ly/3MzRlAX
ETFTrends:DailyRecap,Nottingham Advisors: Tension All Around – Monthly Market Wrap,https://www.etftrends.com/etf-strategist-channel/nottingham-advisors-tension-all-around-monthly-market-wrap/,https://bit.ly/3J0Glu2
ETFTrends:DailyRecap,Tips to Consider When Evaluating Clean Energy ETFs,https://www.etftrends.com/etf-building-blocks-channel/tips-to-consider-when-evaluating-clean-energy-etfs/,https://bit.ly/3hRMtZV
ETFTrends:DailyRecap,Inside Exchange — Matt Hougan,https://www.etftrends.com/exchange-an-etf-experience/inside-exchange-matt-hougan/,https://bit.ly/3KqBYc2
ETFTrends:DailyRecap,"GM Electric Vehicles Can Power Homes, KARS Invests",https://www.etftrends.com/climate-insights-channel/gm-electric-vehicles-can-power-homes-kars-invests/,https://bit.ly/3MDdjmv
ETFTrends:DailyRecap,Avoiding Some Emerging Markets Problems,https://www.etftrends.com/emerging-markets-channel/avoiding-some-emerging-markets-problems/,https://bit.ly/3vTGfRe
ETFTrends:DailyRecap,Equal Weight Can Be Advantageous as Rates Rise,https://www.etftrends.com/portfolio-strategies-channel/equal-weight-can-be-advantageous-as-rates-rise/,https://bit.ly/374KleX
ETFTrends:DailyRecap,Gold ETFs Among Top Commodities Considerations,https://www.etftrends.com/tactical-allocation-channel/gold-etfs-among-top-commodities-considerations/,https://bit.ly/3tIZhXR
ETFTrends:DailyRecap,This Dividend ETF Has Inflation-Fighting Credentials,https://www.etftrends.com/etf-building-blocks-channel/this-dividend-etf-has-inflation-fighting-credentials/,https://bit.ly/3Kuoqwm
ETFTrends:DailyRecap,Will a Potential for Deflation Make Long Treasuries Appealing?,https://www.etftrends.com/fixed-income-channel/will-a-potential-for-a-deflationary-environment-make-long-treasurys-appealing/,https://bit.ly/3pSZvui
ETFTrends:DailyRecap,Get a Leg Up on a Potential Emerging Markets Opportunity With TLTE,https://www.etftrends.com/multi-asset-channel/get-a-leg-up-on-a-potential-emerging-markets-opportunity-with-tlte/,https://bit.ly/3J0aw4v
ETFTrends:DailyRecap,Why This Gold Miners ETF Matters Now,https://www.etftrends.com/model-portfolio-channel/why-this-gold-miners-etf-matters-now/,https://bit.ly/3vSQ9CE
