feed,title,long_url,short_url
SeekingAlpha,"Alto Ingredients GAAP EPS of $0.49, revenue of $385M",https://seekingalpha.com/news/3812352,
SeekingAlpha,"Smith Micro Software Non-GAAP EPS of -$0.04 misses by $0.01, revenue of $14.68M misses by $0.55M",https://seekingalpha.com/news/3812351,
SeekingAlpha,"Lineage Cell Therapeutics GAAP EPS of -$0.17 misses by $0.12, revenue of $1.2M beats by $0.56M",https://seekingalpha.com/news/3812350,
SeekingAlpha,Corvus Pharmaceuticals GAAP EPS of -$0.20 misses by $0.01,https://seekingalpha.com/news/3812349,
SeekingAlpha,Oracle plunges as Q3 results miss expectations,https://seekingalpha.com/news/3812204,
SeekingAlpha,"Red Robin Gourmet Burgers GAAP EPS of -$1.03, revenue of $283.4M",https://seekingalpha.com/news/3812348,
SeekingAlpha,WM Technology appoints Anthony Bay as chairman,https://seekingalpha.com/news/3812347,
