feed,title,long_url,short_url
TheStreet,Coronavirus: US Vaccine Candidate Does Well In Experiment Targeting Common Mutation,https://www.thestreet.com/partner/coronavirus-us-vaccine-candidate-does-well-in-experiment-targeting-common-mutation-15381983,https://j.mp/2WX6Vy9
TheStreet,Heavy Rains Threaten Further Flooding Across Large Parts Of China,https://www.thestreet.com/partner/heavy-rains-threaten-further-flooding-across-large-parts-of-china-15381984,https://j.mp/3hzsb59
TheStreet,"Pfizer Endorses CanSino's Meningitis Vaccine, Giving Chinese Biotech Company A Shot In The Arm",https://www.thestreet.com/partner/pfizer-endorses-cansino-s-meningitis-vaccine-giving-chinese-biotech-company-a-shot-in-the-arm-15381986,https://j.mp/32VV0Vp
TheStreet,"Battered By Covid-19 Third Wave And US-China Showdown, Hong Kong Recovery Could Take Longer Than Expected: Finance Chief",https://www.thestreet.com/partner/battered-by-covid-19-third-wave-and-us-china-showdown-hong-kong-recovery-could-take-longer-than-expected-finance-chief-15381987,https://j.mp/3jGaLWm
TheStreet,US Trade Negotiators May 'smell Blood In The Water' If China Makes Concessions In EU Talks,https://www.thestreet.com/partner/us-trade-negotiators-may-smell-blood-in-the-water-if-china-makes-concessions-in-eu-talks-15381985,https://j.mp/2WXtnaK
