feed,title,long_url,short_url
SeekingAlpha,"Venus Concept EPS misses by $0.02, beats on revenue",https://seekingalpha.com/news/3605353,
SeekingAlpha,"aTyr Pharma EPS beats by $0.04, misses on revenue",https://seekingalpha.com/news/3605352,
SeekingAlpha,"Farfetch EPS beats by $0.04, beats on revenue",https://seekingalpha.com/news/3605351,
SeekingAlpha,"ElectroCore EPS beats by $0.07, misses on revenue",https://seekingalpha.com/news/3605350,
SeekingAlpha,"AudioEye EPS beats by $0.01, beats on revenue",https://seekingalpha.com/news/3605349,
SeekingAlpha,"XpresSpa Can Benefit From The Covid Situation, But It Could Be As Risky As The Virus",https://seekingalpha.com/article/4368478,
