feed,title,long_url,short_url
SeekingAlpha,IQiyi -13.8% after disclosing SEC probe following on Wolfpack report,https://seekingalpha.com/news/3605427,
SeekingAlpha,Regulus Therapeutics EPS misses by $0.12,https://seekingalpha.com/news/3605426,
SeekingAlpha,Armata Pharmaceuticals EPS beats by $0.09,https://seekingalpha.com/news/3605423,
SeekingAlpha,Dillard's +11% after better-than-feared results for pandemic quarter,https://seekingalpha.com/news/3605422,
SeekingAlpha,Natural Gas: Supply Won't Keep Up With The Rebound In Demand,https://seekingalpha.com/article/4368487,
