feed,title,long_url,short_url
SeekingAlpha,"Sierra Wireless GAAP EPS of $0.23 beats by $0.44, revenue of $173M beats by $29.9M",https://seekingalpha.com/news/3837233,
SeekingAlpha,89bio GAAP EPS of -$1.26 beats by $0.03,https://seekingalpha.com/news/3837234,
SeekingAlpha,"Innovative Solutions and Support GAAP EPS of $0.08, revenue of $6.85M",https://seekingalpha.com/news/3837232,
SeekingAlpha,Savara GAAP EPS of -$0.05 beats by $0.03,https://seekingalpha.com/news/3837231,
SeekingAlpha,"Steris Non-GAAP EPS of $2.04 beats by $0.02, revenue of $1.2B beats by $30M",https://seekingalpha.com/news/3837230,
SeekingAlpha,DiDi Global falls after saying it needs to complete cybersecurity review,https://seekingalpha.com/news/3837229,
