feed,title,long_url,short_url
Investing,Exclusive-US plans to blacklist company that ordered TSMC chip found in Huawei processor -- source,https://www.investing.com/news/stock-market-news/exclusiveus-plans-to-blacklist-company-that-ordered-tsmc-chip-found-in-huawei-processor--source-3784888,https://da.gd/9yHI
Investing,Norway stocks lower at close of trade; Oslo OBX down 0.38%,https://www.investing.com/news/stock-market-news/norway-stocks-lower-at-close-of-trade-oslo-obx-down-038-3784902,https://da.gd/DSSM2
Investing,"UBS sees S&P 500 hitting 6,600 despite fewer Fed cuts",https://www.investing.com/news/stock-market-news/ubs-sees-sp-500-hitting-6600-despite-fewer-fed-cuts-93CH-3784898,https://da.gd/TPo7c
Investing,Greece stocks lower at close of trade; Athens General Composite down 0.26%,https://www.investing.com/news/stock-market-news/greece-stocks-lower-at-close-of-trade-athens-general-composite-down-026-3784895,https://da.gd/S1e4
Investing,Biden administration to blacklist Chinese firm over illegal TSMC chip use,https://www.investing.com/news/stock-market-news/biden-administration-to-blacklist-chinese-firm-over-illegal-tsmc-chip-use-93CH-3784890,https://da.gd/cHdEYl
Investing,"Youxin Technology Opens At $4.08, IPO Priced At $4.50",https://www.investing.com/news/stock-market-news/youxin-technology-opens-at-408-ipo-priced-at-450-432SI-3784883,https://da.gd/uCgh
