feed,title,long_url,short_url
InsiderMonkey,Don’t Be Fooled: Broadcom (AVGO) Isn’t Nvidia’s (NVDA) Real Competitor,https://insidermonkey.com/blog/--1411290,
InsiderMonkey,TransAlta (TAC) Positioned for AI Growth: What’s Next?,https://insidermonkey.com/blog/--1411173,
InsiderMonkey,Advanced Micro Devices (AMD) Co-Leads $3.5 Billion Financing Round for Vultr to Boost AI and Cloud Infrastructure,https://insidermonkey.com/blog/--1411078,
InsiderMonkey,Why Did Sterling Infrastructure Inc. (STRL) Jump Yesterday?,https://insidermonkey.com/blog/--1411336,
InsiderMonkey,QUALCOMM Incorporated (QCOM) Projects $1.4 Billion Savings in Arm Royalties Through Nuvia Acquisition,https://insidermonkey.com/blog/--1411076,
InsiderMonkey,Why Did Lumen Technologies Inc. (LUMN) Jump Yesterday?,https://insidermonkey.com/blog/--1411329,
InsiderMonkey,Cloudflare (NET) Price Target Raised to $125 by Jefferies Amid Anticipated AI Benefits,https://insidermonkey.com/blog/--1411073,
InsiderMonkey,"Zoom Communications (ZM) Upgraded to Buy by Jefferies, Price Target Raised to $100",https://insidermonkey.com/blog/--1411072,
InsiderMonkey,Why Did Powell Industries Inc. (POWL) Jump Yesterday?,https://insidermonkey.com/blog/--1411318,
InsiderMonkey,Lumen Technologies (LUMN) Partners with Prometheus Hyperscale to Enhance Sustainable AI Infrastructure,https://insidermonkey.com/blog/--1411071,
InsiderMonkey,Tevogen Bio (TVGN) Advances AI-Driven Immunotherapy with New Patent Filing,https://insidermonkey.com/blog/--1411070,
InsiderMonkey,The Next Nvidia: Will Sky-High Expectations Impact Broadcom (AVGO) Stock in the Future?,https://insidermonkey.com/blog/--1410222,
InsiderMonkey,Bank of America Sees Bright Future for Ciena Corp (CIEN) with Raised Price Target,https://insidermonkey.com/blog/--1409454,
InsiderMonkey,"BlackBerry (BB) Stock Soars on Results, Upgrade",https://insidermonkey.com/blog/--1411257,
InsiderMonkey,"Analyst on Alphabet (GOOG): ‘The Cash Cow Keeps Going, Antitrust Doesn’t Care’",https://insidermonkey.com/blog/--1410229,
InsiderMonkey,Why Did Bill Holdings Inc. (BILL) Jump Yesterday?,https://insidermonkey.com/blog/--1411314,
InsiderMonkey,Why Did Doximity Inc. (DOCS) Jump Yesterday?,https://insidermonkey.com/blog/--1411312,
InsiderMonkey,Why Did Geo Group Inc. (GEO) Jump Yesterday?,https://insidermonkey.com/blog/--1411308,
InsiderMonkey,Why Did Centessa Pharmaceuticals PLC (CNTA) Jump Yesterday?,https://insidermonkey.com/blog/--1411304,
