feed,title,long_url,short_url
CryptoNews,Shiba Inu Price Crashes as $6M Whale Sell-Off Sparks Chaos – Buy the Dip or More Selling to Come?,https://cryptonews.com/news/shiba-inu-price-crashes-as-6m-whale-sell-off-sparks-chaos-buy-the-dip-or-more-selling-to-come/,https://da.gd/rM41
CryptoNews,Binance Founder CZ Amazed to Learn Revolut Has Listed BNB,https://cryptonews.com/news/binance-founder-cz-says-revolut-has-listed-bnb/,https://da.gd/mI1bx
CryptoNews,Floki and Bonk Are Falling Fast – Could This Signal a Bigger Crypto Market Collapse?,https://cryptonews.com/news/floki-and-bonk-are-falling-fast-could-this-signal-a-bigger-crypto-market-collapse/,https://da.gd/HfFMR9
CryptoNews,Stablecoin Supply in Ethereum Layer 2s Reaches $13.5 Billion,https://cryptonews.com/news/stablecoin-supply-in-ethereum-layer-2s-reaches-13-5-billion/,https://da.gd/IsTgaL
CryptoNews,MiCA in Germany: Bundestag Passes New Law To Strengthen Crypto Oversight,https://cryptonews.com/news/mica-in-germany-bundestag-passes-law-finmadig-to-strengthen-crypto-oversight/,https://da.gd/gI8W
