feed,title,long_url,short_url
Yahoo,Analysis-US stocks face headwind from rising yields after Fed signals fewer rate cuts,https://finance.yahoo.com/news/analysis-us-stocks-face-headwind-053439809.html,https://da.gd/7qRMO
Yahoo,"Seeing low-income consumers squeezed, retailers target $10 and under gifts",https://finance.yahoo.com/news/seeing-low-income-consumers-squeezed-110144541.html,https://da.gd/NmYjw
Yahoo,"Unable to Criticize Putin, Russian Oligarchs Turn Ire on Central Banker",https://www.wsj.com/world/russia/unable-to-criticize-putin-russian-oligarchs-turn-ire-on-central-banker-1888bd64?siteid=yhoof2&yptr=yahoo,https://da.gd/KwiQ
Yahoo,Robinhood's surge towards profitability brings it back to the top of the financial world,https://finance.yahoo.com/news/robinhoods-surge-towards-profitability-brings-it-back-to-the-top-of-the-financial-world-110048551.html,https://da.gd/IrZwm
Yahoo,How a 40-year mortgage loan works,https://finance.yahoo.com/personal-finance/mortgages/article/40-year-mortgage-181845597.html,https://da.gd/bAp7q
Yahoo,Stock market outlook for 2025: 4 experts weigh in,https://finance.yahoo.com/personal-finance/investing/article/stock-market-outlook-2025-183956903.html,https://da.gd/HUwm2k
Yahoo,CIT Bank review (2024),https://finance.yahoo.com/personal-finance/banking/review/cit-bank-review-174351675.html,https://da.gd/EBDlH
Yahoo,How to use mortgage forbearance to avoid foreclosure,https://finance.yahoo.com/personal-finance/mortgages/article/mortgage-forbearance-202136083.html,https://da.gd/MH5op
Yahoo,"What credit cardholders should know for 2025: Predictions, interest rates, changing benefits, and more",https://finance.yahoo.com/personal-finance/credit-cards/article/what-credit-cardholders-should-know-2025-215423049.html,https://da.gd/jbyxQ
