feed,title,long_url,short_url
Nasdaq,GLOBAL MARKETS-Asian equities poised to seesaw as U.S. economic news pushes indexes lower,https://www.nasdaq.com/articles/global-markets-asian-equities-poised-to-seesaw-as-u.s.-economic-news-pushes-indexes-lower,https://j.mp/3rqtZlC
Nasdaq,"Exchange operator Cboe to buy Chi-X Asia Pacific to tap into Australia, Japan",https://www.nasdaq.com/articles/exchange-operator-cboe-to-buy-chi-x-asia-pacific-to-tap-into-australia-japan-2021-03-24-0,https://j.mp/31dGBll
Nasdaq,Renewed Selling Pressure Expected For Malaysia Stock Market,https://www.nasdaq.com/articles/renewed-selling-pressure-expected-for-malaysia-stock-market-2021-03-24,https://j.mp/39fX0Ku
Nasdaq,XP brokerage eyes creation of power trading unit in Brazil this year,https://www.nasdaq.com/articles/xp-brokerage-eyes-creation-of-power-trading-unit-in-brazil-this-year-2021-03-24,https://j.mp/2QFY6c5
Nasdaq,Buy Lululemon Stock Down 20% Before Earnings for Big Growth Upside?,https://www.nasdaq.com/articles/buy-lululemon-stock-down-20-before-earnings-for-big-growth-upside-2021-03-24,https://j.mp/3tShwbT
