feed,title,long_url,short_url
Benzinga,"Abbott Laboratories, Nasdaq, Spirit AeroSystems And Other Big Stocks Moving Higher On Wednesday",https://benzinga.com/news/23/10/35310235/abbott-laboratories-nasdaq-spirit-aerosystems-and-other-big-stocks-moving-higher-on-wednesday,https://da.gd/I759
Benzinga,What's Going On With Nvidia Stock Wednesday?,https://benzinga.com/news/23/10/35308526/whats-going-on-with-nvidia-stock-wednesday,https://da.gd/axh3w
Benzinga,TD Synnex Board Member Trades $80.23M In Company Stock,https://benzinga.com/news/23/10/35311132/td-synnex-board-member-trades-80-23m-in-company-stock,https://da.gd/EA7X4A
Benzinga,Journey Medical Insider Trades Send a Signal,https://benzinga.com/news/23/10/35311127/journey-medical-insider-trades-send-a-signal,https://da.gd/GeXv
Benzinga,Board Member of Charter Communications Makes $48.36M Sale,https://benzinga.com/news/23/10/35311126/board-member-of-charter-communications-makes-48-36m-sale,https://da.gd/FESdj
Benzinga,President and CEO At This Financials Company Sells $198K of Stock,https://benzinga.com/news/23/10/35311123/president-and-ceo-at-this-financials-company-sells-198k-of-stock,https://da.gd/EFN8Ja
Benzinga,Cerevel Therapeutics Hldg Board Member Makes $20.00M Stock Purchase,https://benzinga.com/news/23/10/35311121/cerevel-therapeutics-hldg-board-member-makes-20-00m-stock-purchase,https://da.gd/DNnpmE
Benzinga,Massive Insider Trade At Barnwell Industries,https://benzinga.com/news/23/10/35311120/massive-insider-trade-at-barnwell-industries,https://da.gd/exBIB
Benzinga,Massive Insider Trade At Abercrombie & Fitch,https://benzinga.com/news/23/10/35311116/massive-insider-trade-at-abercrombie-fitch,https://da.gd/LoTo9g
Benzinga,Mercury Sys EVP Sold $63K In Company Stock,https://benzinga.com/news/23/10/35311112/mercury-sys-evp-sold-63k-in-company-stock,https://da.gd/MaIcKO
Benzinga,Blackstone Mortgage Trust Board Member Trades Company's Stock,https://benzinga.com/news/23/10/35311108/blackstone-mortgage-trust-board-member-trades-companys-stock,https://da.gd/Ir3nL
Benzinga,Blackstone Mortgage Trust Board Member Makes $58K Stock Purchase,https://benzinga.com/news/23/10/35311104/blackstone-mortgage-trust-board-member-makes-58k-stock-purchase,https://da.gd/fZZVU
Benzinga,51K Reasons To Be Bullish On Blackstone Mortgage Trust Stock,https://benzinga.com/news/23/10/35311102/51k-reasons-to-be-bullish-on-blackstone-mortgage-trust-stock,https://da.gd/1zZfOi
Benzinga,G-III Apparel Group Board Member Trades Company's Stock,https://benzinga.com/news/23/10/35311098/g-iii-apparel-group-board-member-trades-companys-stock,https://da.gd/rrVMS
