feed,title,long_url,short_url
Benzinga,"Iodine Market to Reach USD 1283 Million by 2027; Increasing Applications across Diverse Industry Verticals will Emerge in Favor of Market Growth, says Fortune Business Insights™",https://www.benzinga.com/pressreleases/20/10/g17923134/iodine-market-to-reach-usd-1283-million-by-2027-increasing-applications-across-diverse-industry-ve,https://j.mp/2H1ivUl
Benzinga,Badger Daylighting Ltd. October 2020 Cash Dividend and Upcoming Events,https://www.benzinga.com/pressreleases/20/10/g17923133/badger-daylighting-ltd-october-2020-cash-dividend-and-upcoming-events,https://j.mp/3k4dFnv
Benzinga,More Ontarians take action on hunger in response to rising food support needs,https://www.benzinga.com/pressreleases/20/10/g17923132/more-ontarians-take-action-on-hunger-in-response-to-rising-food-support-needs,https://j.mp/31bKSG9
Benzinga,"NeuroMetrix, Inc. Announces Date for Third Quarter 2020 Financial Results Conference Call",https://www.benzinga.com/pressreleases/20/10/g17923131/neurometrix-inc-announces-date-for-third-quarter-2020-financial-results-conference-call,https://j.mp/353ANvZ
Benzinga,"Financial Wellness Meets Physical Health: CoxHealth Partners with Even, Offering Responsible Earned Wage Access to its Entire Workforce",https://www.benzinga.com/pressreleases/20/10/n17923124/financial-wellness-meets-physical-health-coxhealth-partners-with-even-offering-responsible-earned-,https://j.mp/37aFeYU
Benzinga,Abaco Announces Significant Win from Major European Technology Company to Help Equip Helicopter Cabin Computer,https://www.benzinga.com/pressreleases/20/10/n17923108/abaco-announces-significant-win-from-major-european-technology-company-to-help-equip-helicopter-ca,https://j.mp/3lMCpBa
Benzinga,STMicroelectronics Acquires Power Amplifier and RF Front-End-Module Specialist SOMOS Semiconductor,https://www.benzinga.com/pressreleases/20/10/g17923092/stmicroelectronics-acquires-power-amplifier-and-rf-front-end-module-specialist-somos-semiconductor,https://j.mp/3784Oh5
Benzinga,"Spartacus Acquisition Corporation Announces Pricing of $200,000,000 Initial Public Offering",https://www.benzinga.com/pressreleases/20/10/g17923083/spartacus-acquisition-corporation-announces-pricing-of-200-000-000-initial-public-offering,https://j.mp/3521KAd
