feed,title,long_url,short_url
Investing,Latino Leaders Follow El Salvador’s Lead Embracing BTC,https://investing.com/news/-2527324,
Investing,Ethereum-powered Winding Tree Hires Eric Leopold as Advisor,https://investing.com/news/-2527320,
Investing,"Trump slams Bitcoin, thinks it could be “a scam”",https://investing.com/news/-2527316,
Investing,"MicroStrategy eyes more Bitcoin investment, plans to raise another $400M",https://investing.com/news/-2527315,
Investing,Octopus protocol: Disrupting The DeFi Derivatives Market,https://investing.com/news/-2527313,
Investing,Hong Kong includes central bank digital currency in fintech strategy,https://investing.com/news/-2527311,
