feed,title,long_url,short_url
Motley,What Beaten-Down Tech Stock is Cathie Wood Buying Now?,https://www.fool.com/investing/2025/11/03/what-beaten-down-tech-stock-is-cathie-wood-buying/?source=iedfolrf0000001,
Motley,My Honest Opinion of the YieldMax MSTR Option Income Strategy ETF,https://www.fool.com/investing/2025/11/03/my-honest-opinion-of-the-yieldmax-mstr-etf/?source=iedfolrf0000001,
Motley,"The Best Warren Buffett Stocks to Buy With $1,000 Right Now",https://www.fool.com/investing/2025/11/03/the-best-warren-buffett-stocks-to-buy-with-1000-ri/?source=iedfolrf0000001,
Motley,"Meta's Stock Dropped, but Its AI Strategy May Be Stronger Than Ever",https://www.fool.com/investing/2025/11/03/metas-stock-dropped-but-its-ai-strategy-may-be-str/?source=iedfolrf0000001,
Motley,"Warren Buffett Called Dividend Growers the ""Secret Sauce"" to Massive Gains: Are They Still Delivering for Berkshire Hathaway?",https://www.fool.com/investing/2025/11/03/warren-buffett-called-dividend-growers-the-secret/?source=iedfolrf0000001,
Motley,Think It's Too Late to Buy SoundHound AI Stock? Here's the 1 Reason Why There's Still Time,https://www.fool.com/investing/2025/11/03/think-late-buy-soundhound-stock-reason-still-time/?source=iedfolrf0000001,
