feed,title,long_url,short_url
SeekingAlpha,"Enterprise Group GAAP EPS of C$0.06, revenue of C$10.01M",https://seekingalpha.com/news/3970005,
SeekingAlpha,Better Therapeutics GAAP EPS of -$0.39,https://seekingalpha.com/news/3970004,
SeekingAlpha,"Microbix Biosystems net income of C$0.03M, revenue of C$4.21M",https://seekingalpha.com/news/3970003,
SeekingAlpha,"Sylogist Non-GAAP EPS of $0.16, revenue of $15.9M",https://seekingalpha.com/news/3970002,
SeekingAlpha,Groupon Earnings Review: Fall From Grace,https://seekingalpha.com/article/4602998,
