feed,title,long_url,short_url
SeekingAlpha,Kintara Therapeutics GAAP EPS of -$1.94,https://seekingalpha.com/news/3970024,
SeekingAlpha,Theriva Biologics GAAP EPS of -$0.30 beats by $0.09,https://seekingalpha.com/news/3970022,
SeekingAlpha,Longtime stakeholder Artal exits WeightWatchers; shares fall,https://seekingalpha.com/news/3970023,
SeekingAlpha,"Milestone Pharmaceuticals GAAP EPS of -$0.35 beats by $0.05, revenue of $1M",https://seekingalpha.com/news/3970021,
SeekingAlpha,First American by Deluxe expands partnership with SwipeSimple,https://seekingalpha.com/news/3970020,
SeekingAlpha,Abeona Therapeutics GAAP EPS of -$0.54 beats by $0.07,https://seekingalpha.com/news/3970019,
