feed,title,long_url,short_url
SeekingAlpha,Pulse Biosciences GAAP EPS of -$0.26 misses by $0.04,https://seekingalpha.com/news/3970354,
SeekingAlpha,"Motorsport Games GAAP EPS of -$2.33 beats by $1.02, revenue of $1.73M misses by $0.03M",https://seekingalpha.com/news/3970350,
SeekingAlpha,authID reports Q1 results,https://seekingalpha.com/news/3970349,
SeekingAlpha,Cadence Design Systems appoints Mary Louise Krakauer as board chair,https://seekingalpha.com/news/3970348,
SeekingAlpha,Eledon Pharmaceuticals GAAP EPS of -$0.75 misses by $0.11,https://seekingalpha.com/news/3970347,
SeekingAlpha,Ventyx Biosciences GAAP EPS of -$0.68 misses by $0.03,https://seekingalpha.com/news/3970346,
SeekingAlpha,Invivyd GAAP EPS of -$0.32 misses by $0.02,https://seekingalpha.com/news/3970345,
