feed,title,long_url,short_url
SeekingAlpha,"RiceBran Technologies GAAP EPS of -$0.31, revenue of $9.27M",https://seekingalpha.com/news/3970463,
SeekingAlpha,East Side Games Group reports Q1 results,https://seekingalpha.com/news/3970459,
SeekingAlpha,"VYNE Therapeutics GAAP EPS of -$1.74 beats by $0.87, revenue of $0.1M",https://seekingalpha.com/news/3970458,
SeekingAlpha,"GAAP EPS of -$0.08 in-line, revenue of $71.57M beats by $2.24M",https://seekingalpha.com/news/3970457,
SeekingAlpha,Histogen GAAP EPS of -$0.81,https://seekingalpha.com/news/3970456,
