feed,title,long_url,short_url
SeekingAlpha,Xenetic Biosciences reports Q1 results,https://seekingalpha.com/news/3970577,
SeekingAlpha,TFF Pharmaceuticals GAAP EPS of -$0.19 beats by $0.01,https://seekingalpha.com/news/3970576,
SeekingAlpha,Aura Biosciences GAAP EPS of -$0.46 beats by $0.08,https://seekingalpha.com/news/3970575,
SeekingAlpha,"Park Lawn  Non-GAAP EPS of C$0.24, revenue of C$86.73M misses by C$0.98M",https://seekingalpha.com/news/3970574,
SeekingAlpha,Structure Therapeutics GAAP EPS of -$0.25 beats by $0.09,https://seekingalpha.com/news/3970573,
SeekingAlpha,AN2 Therapeutics GAAP EPS of -$0.79,https://seekingalpha.com/news/3970572,
SeekingAlpha,"VerticalScope Holdings GAAP EPS of -$0.21 beats by $0.23, revenue of $12.9M misses by $7.99M",https://seekingalpha.com/news/3970571,
