feed,title,long_url,short_url
SeekingAlpha,Lululemon rallies as international growth story gains traction,https://seekingalpha.com/news/3977195,
SeekingAlpha,"Hudbay surges as proxy advisors ISS, Glass Lewis support Copper Mountain merger",https://seekingalpha.com/news/3977194,
SeekingAlpha,"Riot Platforms, Opendoor Technologies among financials losers, Diversified Healthcare Trust in gainers",https://seekingalpha.com/news/3977193,
SeekingAlpha,AT&T's Capital Structure Signals No Problem At All For The Common Stock,https://seekingalpha.com/article/4609081,
SeekingAlpha,Lincoln Educational: Unemployment Spike Is What's Needed For A Sustained Rally,https://seekingalpha.com/article/4609080,
SeekingAlpha,Ford Envy Coming Soon In Tesla Superchargers,https://seekingalpha.com/article/4609032,
SeekingAlpha,Mixed Messages On U.S. Jobs Leaves The Market Little Wiser,https://seekingalpha.com/article/4609095,
