feed,title,long_url,short_url
SeekingAlpha,"Pulse Seismic EPS of $0.03, revenue of $6.3M",https://seekingalpha.com/news/4127509,
SeekingAlpha,Grupo Televisa reports Q2 results,https://seekingalpha.com/news/4127508,
SeekingAlpha,Bradda Head Lithium GAAP EPS of -$0.15,https://seekingalpha.com/news/4127506,
SeekingAlpha,Apple's App Store conduct under probe by Spain's antitrust agency,https://seekingalpha.com/news/4127497,
SeekingAlpha,The AI Data Center Construction Boom Is Just Beginning,https://seekingalpha.com/article/4706113,
SeekingAlpha,Find Better Stock Ideas With Seeking Alpha PRO,https://seekingalpha.com/article/4705929,
