feed,title,long_url,short_url
Yahoo,It's a Bad Day for the Mag 7. Here's How Much They Lost.,https://finance.yahoo.com/m/5874a99d-cc45-322a-b317-c86f149b58cb/it%27s-a-bad-day-for-the-mag-7..html?.tsrc=rss,https://da.gd/yW3AP9
Yahoo,Elon Musk Has an Idea for Tesla: Buy a Piece of His AI Start-Up,https://finance.yahoo.com/m/75f557c7-e3c4-3e82-9ab2-679eec17ca56/elon-musk-has-an-idea-for.html?.tsrc=rss,https://da.gd/Y33OI
Yahoo,"Nvidia Stock Falls, but Alphabet Is Buying Up Its Chips",https://finance.yahoo.com/m/5a07580c-8840-3a61-80a6-6ae23311d140/nvidia-stock-falls%2C-but.html?.tsrc=rss,https://da.gd/Iea9
Yahoo,Tesla’s Bad News Is Dragging Down Other EV Stocks. BYD and NIO Are Slumping.,https://finance.yahoo.com/m/f967dd83-9421-35bf-bd86-4efec6e505bd/tesla%E2%80%99s-bad-news-is-dragging.html?.tsrc=rss,https://da.gd/5CuSy8
Yahoo,"Apple’s AI iPhone Could Boost Sales, but One Bear Isn’t Swayed",https://finance.yahoo.com/m/1003f3aa-df37-3757-b70c-c1dd298f7782/apple%E2%80%99s-ai-iphone-could-boost.html?.tsrc=rss,https://da.gd/sDif5
