feed,title,long_url,short_url
SeekingAlpha,"Chipotle Mexican Grill Non-GAAP EPS of $0.34 beats by $0.02, revenue of $2.97B beats by $30M",https://seekingalpha.com/news/4127851,
SeekingAlpha,"Rollins Non-GAAP EPS of $0.27 in-line, revenue of $892M misses by $2.66M",https://seekingalpha.com/news/4127850,
SeekingAlpha,TransCode Therapeutics announces closing of public offering,https://seekingalpha.com/news/4127849,
SeekingAlpha,"ServiceNow Non-GAAP EPS of $3.13 beats by $0.29, revenue of $2.63B beats by $20M",https://seekingalpha.com/news/4127848,
SeekingAlpha,"Carlisle Non-GAAP EPS of $6.24 beats by $0.22, revenue of $1.5B beats by $50M",https://seekingalpha.com/news/4127847,
SeekingAlpha,"Getty Realty FFO of $0.58 beats by $0.04, revenue of $49.94M beats by $1.2M",https://seekingalpha.com/news/4127846,
SeekingAlpha,Kemper announces Q2 preliminary results,https://seekingalpha.com/news/4127845,
SeekingAlpha,Realty Income: What The Bulls Are Missing,https://seekingalpha.com/article/4706275,
