feed,title,long_url,short_url
ETFTrends,BNDI Outperforms the Broad Bond Market By 100 BPS YTD,https://www.etftrends.com/monthly-income-channel/bond-market-outperformance-bndi-ytd/,https://da.gd/1tVhjj
ETFTrends,NDJI Rallied in July on Dow Jones Performance Streak,https://www.etftrends.com/retirement-income-channel/dow-jones-performance-streak-ndji/,https://da.gd/IwvqjV
ETFTrends,"As Power Generation Falls, EU Allowances Prove Resilient",https://www.etftrends.com/climate-insights-channel/eu-allowances-prove-resilient/,https://da.gd/WTFt
ETFTrends,Rosenbluth Digs Into the Types of AI Funds of TD Ameritrade,https://www.etftrends.com/artificial-intelligence-channel/rosenbluth-digs-types-ai-funds-td-ameritrade/,https://da.gd/LstT
ETFTrends,Cryptocurrencies: Bitcoin Holds Steady for 3rd Straight Week,https://www.etftrends.com/crytpo-channel/cryptocurrencies-bitcoin-holds-steady-3rd-straight-week/,https://da.gd/1cNE
