feed,title,long_url,short_url
InvestorPlace,DWAC Stock Alert: Trump SPAC Delays Key Shareholder Meeting,https://investorplace.com/2023/08/dwac-stock-alert-trump-spac-delays-key-shareholder-meeting/,https://da.gd/bP6N
InvestorPlace,MULN Stock Alert: Mullen Launches Stock Buyback Program,https://investorplace.com/2023/08/muln-stock-alert-mullen-launches-stock-buyback-program/,https://da.gd/0UL2
InvestorPlace,Why Are Cannabis Stocks Up Today?,https://investorplace.com/2023/08/why-are-cannabis-stocks-up-today-3/,https://da.gd/VcgRg
InvestorPlace,IDEX Stock Alert: Ideanomics Receives Non-Compliance Notice,https://investorplace.com/2023/08/idex-stock-alert-ideanomics-receives-non-compliance-notice/,https://da.gd/H79IHa
InvestorPlace,3 Sorry EV Stocks to Sell in August Before It’s Too Late,https://investorplace.com/2023/08/3-sorry-ev-stocks-to-sell-in-august-before-its-too-late/,https://da.gd/3HnQ5
InvestorPlace,Why Recent Reinflation Fears Are Way Overblown,https://investorplace.com/hypergrowthinvesting/2023/08/why-recent-reinflation-fears-are-way-overblown/,https://da.gd/2yaNJu
InvestorPlace,The 3 Most Undervalued High-Yield Stocks to Buy Now: August 2023,https://investorplace.com/2023/08/the-3-most-undervalued-high-yield-stocks-to-buy-now-august-2023/,https://da.gd/reMOPo
InvestorPlace,CVS Stock Alert: Blue Shield of California Ditches CVS for Mark Cuban,https://investorplace.com/2023/08/cvs-stock-alert-blue-shield-of-california-ditches-cvs-for-mark-cuban/,https://da.gd/rPSvI
InvestorPlace,3 Best Defensive Stocks to Protect Your Portfolio in August 2023,https://investorplace.com/2023/08/3-best-defensive-stocks-to-protect-your-portfolio-in-august-2023/,https://da.gd/C1jTa
InvestorPlace,3 Super Speculative AI Stocks Not Worth the Risk,https://investorplace.com/2023/08/3-super-speculative-ai-stocks-not-worth-the-risk/,https://da.gd/ZMVU6
InvestorPlace,Why Is Hawaiian Electric (HE) Stock Down 17% Today?,https://investorplace.com/2023/08/why-is-hawaiian-electric-he-stock-down-17-today/,https://da.gd/JJcdU
