feed,title,long_url,short_url
Investing,Bitcoin (BTC) Price Pump Potential Outlined by Bloomberg Strategist,https://www.investing.com/news/cryptocurrency-news/bitcoin-btc-price-pump-potential-outlined-by-bloomberg-strategist-3156737,https://da.gd/XZKs
Investing,Ethereum is a 'dumpster fire' — Charles Hoskinson,https://www.investing.com/news/cryptocurrency-news/ethereum-is-a-dumpster-fire--charles-hoskinson-3156736,https://da.gd/Un8kS
Investing,ERCOT issues voluntary power conservation call in Texas heat wave,https://www.investing.com/news/commodities-news/ercot-issues-voluntary-power-conservation-call-in-texas-heat-wave-3156732,https://da.gd/Jw03c
Investing,Germany stocks lower at close of trade; DAX down 0.71%,https://www.investing.com/news/stock-market-news/germany-stocks-lower-at-close-of-trade-dax-down-071-3156741,https://da.gd/6yhFK1
Investing,Price of a strike at the Detroit automakers: $5 billion -study,https://www.investing.com/news/stock-market-news/price-of-a-strike-at-the-detroit-automakers-5-billion-study-3156740,https://da.gd/rvoS
Investing,"Nike v. Adidas: Soccer World Cup sponsors gear up for England, Spain finale",https://www.investing.com/news/stock-market-news/nike-v-adidas-soccer-world-cup-sponsors-gear-up-for-england-spain-finale-3156739,https://da.gd/uRwGR
Investing,France stocks lower at close of trade; CAC 40 down 0.94%,https://www.investing.com/news/stock-market-news/france-stocks-lower-at-close-of-trade-cac-40-down-094-3156735,https://da.gd/eSsVM1
Investing,Microsoft to shut Xbox 360's online store next year,https://www.investing.com/news/stock-market-news/microsoft-to-shut-xbox-360s-online-store-next-year-3156733,https://da.gd/VDfwc6
