feed,title,long_url,short_url
Investing,SpaceX sold $373M worth of Bitcoin acquired in 2021-2022: Report,https://www.investing.com/news/cryptocurrency-news/spacex-sold-373m-worth-of-bitcoin-acquired-in-20212022-report-3156924,https://da.gd/SK5Gpn
Investing,US Bitcoin Reports July 2023 Production and Operations Updates,https://www.investing.com/news/cryptocurrency-news/us-bitcoin-reports-july-2023-production-and-operations-updates-432SI-3156923,https://da.gd/na7nn
Investing,Bitcoin Falls 10% In Bearish Trade,https://www.investing.com/news/cryptocurrency-news/bitcoin-falls-10-in-bearish-trade-3156919,https://da.gd/erL8I
Investing,EOS Falls 11% In Bearish Trade,https://www.investing.com/news/cryptocurrency-news/eos-falls-11-in-bearish-trade-3156918,https://da.gd/f31A4t
Investing,Moderna's updated COVID vaccine effective against 'Eris' variant in humans,https://www.investing.com/news/stock-market-news/modernas-updated-covid-vaccine-effective-against-eris-variant-in-humans-3156925,https://da.gd/Ls1wtG
Investing,Keysight Technologies stock drops 7% despite Q3 EPS beat & in line revenues,https://www.investing.com/news/stock-market-news/keysight-technologies-stock-drops-7-despite-q3-eps-beat--in-line-revenues-432SI-3156913,https://da.gd/4072oX
Investing,"After-hours movers: Farfetch sinks on weak results and outlook, Ross Stores gains",https://www.investing.com/news/stock-market-news/afterhours-movers-farfetch-sinks-on-weak-results-and-outlook-ross-stores-gains-432SI-3156908,https://da.gd/R00Sr3
Investing,"Marketmind: Adjusting to a new, higher yield world",https://www.investing.com/news/economy/marketmind-adjusting-to-a-new-higher-yield-world-3156920,https://da.gd/yRSVyG
