feed,title,long_url,short_url
Investors,"Urban Outfitters Stock Near 6-Year High, Tops Key Benchmark",https://www.investors.com/news/urban-outfitters-meets-80-plus-relative-strength-rating-benchmark/,https://da.gd/YN9ukm
Investors,Best Buy Stock Reaches 80-Plus RS Rating Benchmark,https://www.investors.com/news/best-buy-stock-reaches-80-plus-rs-rating-benchmark/,https://da.gd/CYk8vD
Investors,Altria Group Stock Sees Improved Relative Strength,https://www.investors.com/news/altria-group-stock-sees-improved-relative-strength/,https://da.gd/hMqzn
Investors,Pershing Square Portfolio: Bill Ackman Bets On Six High-Quality Stocks,https://www.investors.com/news/pershing-square-portfolio-bill-ackman-bets/,https://da.gd/HnIsRf
Investors,Reddit Stock Sees Improved Technical Strength,https://www.investors.com/news/reddit-stock-sees-improved-technical-strength/,https://da.gd/ItqpHe
