feed,title,long_url,short_url
InvestorPlace,I Asked ChatGPT for 10 Meme Stocks to Buy. Here’s What It Recommended.,https://investorplace.com/2023/03/i-asked-chatgpt-for-10-meme-stocks-to-buy-heres-what-it-recommended/,https://da.gd/W3C4
InvestorPlace,Why Are Stocks Down Today?,https://investorplace.com/2023/03/why-are-stocks-down-today-22/,https://da.gd/hgMg
InvestorPlace,SGML Stock Alert: Elon Musk Sends Sigma Lithium Down,https://investorplace.com/2023/03/sgml-stock-alert-elon-musk-sends-sigma-lithium-down/,https://da.gd/o0IXN1
InvestorPlace,APE Stock Alert: AMC’s Preferred Shares Could Climb 150% From Here,https://investorplace.com/2023/03/ape-stock-alert-amcs-preferred-shares-could-climb-150-from-here/,https://da.gd/NYbf7
InvestorPlace,Why Are Chip Stocks Down Today?,https://investorplace.com/2023/03/why-are-chip-stocks-down-today-march-2/,https://da.gd/BOW8K
InvestorPlace,BioRestorative Therapeutics (BRTX) Stock Soars 40% on Patent News,https://investorplace.com/2023/03/biorestorative-therapeutics-brtx-stock-soars-40-on-patent-news/,https://da.gd/ebPqI
InvestorPlace,Tesla Sends MP Materials (MP) Stock Down 11%,https://investorplace.com/2023/03/tesla-sends-mp-materials-mp-stock-down-11/,https://da.gd/TNMm
InvestorPlace,Tesla Sends Wolfspeed (WOLF) Stock Down 11%,https://investorplace.com/2023/03/tesla-sends-wolfspeed-wolf-stock-down-11/,https://da.gd/M48htm
InvestorPlace,Waymo Layoffs 2023: What to Know About the Latest Waymo Job Cuts,https://investorplace.com/2023/03/waymo-layoffs-2023-what-to-know-about-the-latest-waymo-job-cuts/,https://da.gd/NBUnr
InvestorPlace,NIO Stock Slips After JPMorgan Downgrade,https://investorplace.com/2023/03/nio-stock-slips-after-jpmorgan-downgrade/,https://da.gd/hfZl
InvestorPlace,MSFT Stock: The Case for Microsoft Hitting $350 by 2024,https://investorplace.com/2023/03/msft-stock-the-case-for-microsoft-hitting-350-by-2024/,https://da.gd/7ucLKp
InvestorPlace,BBBY Stock: Bed Bath & Beyond Treks Higher After FINALLY Making Interest Payments,https://investorplace.com/2023/03/bbby-stock-bed-bath-beyond-treks-higher-after-finally-making-interest-payments/,https://da.gd/jLNAe
