feed,title,long_url,short_url
SeekingAlpha,"SIGA Technologies GAAP EPS of -$0.01, revenue of $11.4M",https://seekingalpha.com/news/3943592,
SeekingAlpha,"ChargePoint Holdings GAAP EPS of -$0.23 misses by $0.01, revenue of $152.82M misses by $11.71M",https://seekingalpha.com/news/3943591,
SeekingAlpha,"NeuroPace reports Q4 results, co guides FY 2023 revenue above consensus",https://seekingalpha.com/news/3943590,
SeekingAlpha,"Zscaler Non-GAAP EPS of $0.37 beats by $0.08, revenue of $387.6M beats by $22.82M",https://seekingalpha.com/news/3943589,
SeekingAlpha,"Marvell Technology Group Non-GAAP EPS of $0.46 misses by $0.01, revenue of $1.42B beats by $10M",https://seekingalpha.com/news/3943588,
