feed,title,long_url,short_url
Nasdaq,Asian Shares Inch Higher On US Stimulus Cheer,https://www.nasdaq.com/articles/asian-shares-inch-higher-on-us-stimulus-cheer-2021-03-12,https://j.mp/2Oom4aQ
Nasdaq,"EXCLUSIVE-Posco's steel plant in India faces disruption, hampering auto supply chain",https://www.nasdaq.com/articles/exclusive-poscos-steel-plant-in-india-faces-disruption-hampering-auto-supply-chain-2021-03,https://j.mp/30EvZM1
Nasdaq,EMERGING MARKETS-Most Asian stocks eye weekly gains; Philippine lags on recovery worries,https://www.nasdaq.com/articles/emerging-markets-most-asian-stocks-eye-weekly-gains-philippine-lags-on-recovery-worries,https://j.mp/3qDkrTS
Nasdaq,Climbing without a map: Japan's nuclear clean-up has no end in sight,https://www.nasdaq.com/articles/climbing-without-a-map%3A-japans-nuclear-clean-up-has-no-end-in-sight-2021-03-12,https://j.mp/3qDYNyH
Nasdaq,Charterhouse in exclusive talks to sell majority stake in Cooper,https://www.nasdaq.com/articles/charterhouse-in-exclusive-talks-to-sell-majority-stake-in-cooper-2021-03-12,https://j.mp/3la92d9
Nasdaq,"Housebuilder Berkeley flags delays following Brexit, sticks to targets",https://www.nasdaq.com/articles/housebuilder-berkeley-flags-delays-following-brexit-sticks-to-targets-2021-03-12,https://j.mp/3tbJq27
Nasdaq,UK government intervenes in deep coal mine plan,https://www.nasdaq.com/articles/uk-government-intervenes-in-deep-coal-mine-plan-2021-03-12,https://j.mp/3vq87dl
