feed,title,long_url,short_url
Nasdaq,Boxing-Braekhus ready to reclaim belts as equality battle goes on,https://www.nasdaq.com/articles/boxing-braekhus-ready-to-reclaim-belts-as-equality-battle-goes-on-2021-03-12,https://j.mp/3qHJ95w
Nasdaq,"Chile's Codelco sees copper demand rising, prices strong for 3-4 years -chairman",https://www.nasdaq.com/articles/chiles-codelco-sees-copper-demand-rising-prices-strong-for-3-4-years-chairman-2021-03-12,https://j.mp/2Ot6nzd
Nasdaq,"Cricket-Archer, Roy help England steamroll India in T20 series opener",https://www.nasdaq.com/articles/cricket-archer-roy-help-england-steamroll-india-in-t20-series-opener-2021-03-12,https://j.mp/2ORdKjB
Nasdaq,Amazon's Pouncing on an Opportunity in Grocery,https://www.nasdaq.com/articles/amazons-pouncing-on-an-opportunity-in-grocery-2021-03-12,https://j.mp/2NcKNOR
Nasdaq,Major Averages Continue To Turn In Mixed Performance In Mid-Day Trading,https://www.nasdaq.com/articles/major-averages-continue-to-turn-in-mixed-performance-in-mid-day-trading-2021-03-12,https://j.mp/3ewVvec
Nasdaq,"US STOCKS-S&P 500, Nasdaq fall as yields spike",https://www.nasdaq.com/articles/us-stocks-sp-500-nasdaq-fall-as-yields-spike-2021-03-12,https://j.mp/3qH9Bfp
