feed,title,long_url,short_url
SeekingAlpha,"FS Bancorp GAAP EPS of $1.04 beats by $0.10, revenue of $35.88M beats by $1.48M",https://seekingalpha.com/news/3961025,
SeekingAlpha,"Brooge Energy Non-GAAP EPS of $0.31, revenue of $81.54M",https://seekingalpha.com/news/3961024,
SeekingAlpha,"First Bancorp GAAP EPS of $0.37 misses by $0.25, revenue of $106.02M misses by $7.15M",https://seekingalpha.com/news/3961023,
SeekingAlpha,Clear Blue Technologies International reports FY results,https://seekingalpha.com/news/3961022,
SeekingAlpha,"First US Bancshares Non-GAAP EPS of $0.33, revenue of $10.26M",https://seekingalpha.com/news/3961021,
SeekingAlpha,Westwood Holdings reports Q1 results,https://seekingalpha.com/news/3961020,
