feed,title,long_url,short_url
Benzinga,OnTime Networks' Ultra-Rugged Airborne CR-6228 28-Port GbE/10GbE Switch/Router selected by Airbus for A330 Multi Role Tanker Transport (MRTT) mission network system,https://www.benzinga.com/pressreleases/21/02/n19552937/ontime-networks-ultra-rugged-airborne-cr-6228-28-port-gbe10gbe-switchrouter-selected-by-airbus-for,https://j.mp/3cODpnc
Benzinga,Tencent Music Entertainment Group Invests in Audio Entertainment Ecosystem to Drive Long-term Growth,https://www.benzinga.com/pressreleases/21/02/n19552936/tencent-music-entertainment-group-invests-in-audio-entertainment-ecosystem-to-drive-long-term-grow,https://j.mp/3aKAKYY
Benzinga,"Document Security Systems, Inc., Coinstreet Partners and GSX Group Collaborate to Develop Digital Asset Exchange Business in the US",https://www.benzinga.com/pressreleases/21/02/n19552935/document-security-systems-inc-coinstreet-partners-and-gsx-group-collaborate-to-develop-digital-ass,https://j.mp/3pYVzX0
Benzinga,"Pivotal Investment Corp. III Announces Pricing of Upsized $240,000,000 Initial Public Offering",https://www.benzinga.com/pressreleases/21/02/b19552942/pivotal-investment-corp-iii-announces-pricing-of-upsized-240-000-000-initial-public-offering,https://j.mp/3oVVhyU
Benzinga,"Cleveland-Cliffs Prices Public Offering of Common Shares, including 40,000,000 Common Shares by ArcelorMittal",https://www.benzinga.com/pressreleases/21/02/b19552934/cleveland-cliffs-prices-public-offering-of-common-shares-including-40-000-000-common-shares-by-arc,https://j.mp/3jtWxbv
