feed,title,long_url,short_url
Investing,United Airlines Soars Ahead of Earning. Time to Deplane?,https://www.investing.com/analysis/united-airlines-soars-ahead-of-earning-time-to-deplane-200634500,https://da.gd/KSFpw
Investing,Crypto Market May Not Be Heading for a Bull Run Just Yet,https://www.investing.com/news/cryptocurrency-news/crypto-market-may-not-be-heading-for-a-bull-run-just-yet-2983524,https://da.gd/HFLn
Investing,U.S. Authorities Nab Crypto Exchange Founder Over Money Laundering,https://www.investing.com/news/cryptocurrency-news/us-authorities-nab-crypto-exchange-founder-over-money-laundering-2983523,https://da.gd/6jSv
Investing,Deliveroo upgrades profit margin outlook despite slip in Q4 orders,https://www.investing.com/news/stock-market-news/deliveroo-upgrades-profit-margin-outlook-despite-slip-in-q4-orders-2983514,https://da.gd/x2CjP
Investing,Davos 2023: Trip.com hopes China overseas travel capacity back to normal by Q3,https://www.investing.com/news/economy/davos-2023-tripcom-hopes-china-overseas-travel-capacity-back-to-normal-by-q3-2983525,https://da.gd/oW6zB
