feed,title,long_url,short_url
InsiderMonkey,Here’s Why Argenx SE (ARGX) Slipped in Q1,https://insidermonkey.com/blog/--1753184,
InsiderMonkey,What Makes BillionToOne (BLLN) a Revolutionizer in Genetic Testing?,https://insidermonkey.com/blog/--1753203,
InsiderMonkey,"American Financial Group, Inc. (NYSE:AFGC) Q1 2026 Earnings Call Transcript",https://insidermonkey.com/blog/--1753364,
InsiderMonkey,"Empire State Realty OP, L.P. (AMEX:ESBA) Q1 2026 Earnings Call Transcript",https://insidermonkey.com/blog/--1753363,
InsiderMonkey,Balchem Corporation (NASDAQ:BCPC) Q1 2026 Earnings Call Transcript,https://insidermonkey.com/blog/--1753362,
InsiderMonkey,Does Guardant Health (GH) Have Long-Runway for Growth?,https://insidermonkey.com/blog/--1753201,
InsiderMonkey,What Makes Merck & Co. (MRK) an Investment Bet?,https://insidermonkey.com/blog/--1753199,
InsiderMonkey,Johnson & Johnson’s (JNJ) Accelerating Growth Justifies the Higher Multiple,https://insidermonkey.com/blog/--1753197,
InsiderMonkey,Baron Health Care Fund’s Performance Impacted by Amgen (AMGN) Omission,https://insidermonkey.com/blog/--1753195,
