feed,title,long_url,short_url
SeekingAlpha,Smurfit Kappa reports 1H results,https://seekingalpha.com/news/3596512,
SeekingAlpha,"Magellan Health Services EPS beats by $0.02, beats on revenue",https://seekingalpha.com/news/3596511,
SeekingAlpha,Entergy EPS beats by $0.11,https://seekingalpha.com/news/3596510,
SeekingAlpha,"Central Pacific Financial EPS beats by $0.13, beats on revenue",https://seekingalpha.com/news/3596508,
SeekingAlpha,"CGI Group EPS beats by C$0.06, beats on revenue",https://seekingalpha.com/news/3596507,
SeekingAlpha,"Boston Scientific EPS beats by $0.10, beats on revenue",https://seekingalpha.com/news/3596506,
SeekingAlpha,"Strategic Education EPS beats by $0.37, beats on revenue",https://seekingalpha.com/news/3596505,
