feed,title,long_url,short_url
Investing,IMF working paper proposes country-level assessment matrix for crypto risks,https://www.investing.com/news/cryptocurrency-news/imf-working-paper-proposes-countrylevel-assessment-matrix-for-crypto-risks-3188175,https://da.gd/oQZUZH
Investing,"Bitfarms scales up operations, despite mining less BTC than previous year",https://www.investing.com/news/cryptocurrency-news/bitfarms-scales-up-operations-despite-mining-less-btc-than-previous-year-93CH-3188166,https://da.gd/aIyarn
Investing,"Rivian gains on upgrade, FedEx raised to Positive: 6 big analyst picks & cuts",https://www.investing.com/news/stock-market-news/rivian-gains-on-upgrade-fedex-raised-to-positive-6-big-analyst-picks--cuts-3187952,https://da.gd/Igv2z
Investing,Cigna Group announces settlement with US on claims it overcharged Medicare Advantage program,https://www.investing.com/news/stock-market-news/cigna-group-announces-settlement-with-us-on-claims-it-overcharged-medicare-advantage-program-3188177,https://da.gd/my2O3r
Investing,Credo Technology the first with a commercially available AEC product - Barclays,https://www.investing.com/news/stock-market-news/credo-technology-the-first-with-a-commercially-available-aec-product--barclays-432SI-3188176,https://da.gd/Mahmo
Investing,"Rivian delivers softer-than-expected annual deliveries forecast, shares dip",https://www.investing.com/news/stock-market-news/rivian-delivers-softerthanexpected-annual-deliveries-forecast-shares-dip-3188172,https://da.gd/ghY0cw
Investing,Broadcom Unveils Sian Dsp for Efficient Hyperscale Data Centers,https://www.investing.com/news/stock-market-news/broadcom-unveils-sian-dsp-for-efficient-hyperscale-data-centers-93CH-3188165,https://da.gd/sTqE
Investing,"Nextleaf Solutions announces leadership changes, adds new CFO and Board Member",https://www.investing.com/news/stock-market-news/nextleaf-solutions-announces-leadership-changes-adds-new-cfo-and-board-member-93CH-3188167,https://da.gd/noG6e
Investing,India’s Financial Sector Sees Surge Following JP Morgan’s Inclusion of Government Bonds in Index,https://www.investing.com/news/economy/indias-financial-sector-sees-surge-following-jp-morgans-inclusion-of-government-bonds-in-index-93CH-3188179,https://da.gd/YdEpN4
Investing,US manufacturing sector eyes recovery in September as production picks up -ISM,https://www.investing.com/news/economy/us-manufacturing-sector-eyes-recovery-in-september-as-production-picks-up-ism-3188163,https://da.gd/VGq3
