feed,title,long_url,short_url
ETFTrends,Why Are Investors Allocating to RSP?,https://www.etftrends.com/portfolio-strategies-channel/why-are-investors-allocating-to-rsp/,https://bit.ly/3RQnMNN
ETFTrends,ETF of the Week: Utilities Select Sector SPDR Fund (XLU),https://www.etftrends.com/etf-of-the-week-utilities-select-sector-spdr-fund-xlu/,https://bit.ly/3BJltWV
ETFTrends,Everything Advisors Need to Know About Adding Japan Exposure,https://www.etftrends.com/global-diversification-channel/everything-advisors-need-to-know-about-adding-japan-exposure/,https://bit.ly/3BJZLlH
ETFTrends,Beyond the Backlash: Why ESG Matters More Than Ever,https://www.etftrends.com/esg-channel/beyond-the-backlash-why-esg-matters-more-than-ever/,https://bit.ly/3djXpRk
ETFTrends,ARKG Offers Exposure to Advancements in Synthetic Biology,https://www.etftrends.com/disruptive-technology-channel/arkg-offers-exposure-to-advancements-in-synthetic-biology/,https://bit.ly/3BMpdr2
ETFTrends,"Why Investors Should Consider Midstream, Energy Infrastructure ETFs Today",https://www.etftrends.com/energy-infrastructure-channel/why-investors-should-consider-midstream-energy-infrastructure-etfs-today/,https://bit.ly/3QRk70G
ETFTrends,Get Less Whipsawed by Choppy Markets With This Low Volatility Fund,https://www.etftrends.com/core-strategies-channel/get-less-whipsawed-by-choppy-markets-with-this-low-volatility-fund/,https://bit.ly/3RQ8KaD
ETFTrends,Andrew Beer Digs Into DBMF’s Performance YTD,https://www.etftrends.com/managed-futures-channel/andrew-beer-digs-into-dbmf-performance-ytd/,https://bit.ly/3BKAGr1
ETFTrends,VettaFi Vice Chair Tom Lydon Appears on Fox Business to Discuss Dollar Strength,https://www.etftrends.com/vettafi-vice-chair-tom-lydon-appears-on-fox-business-to-discuss-dollar-strength/,https://bit.ly/3BM0tiC
ETFTrends,State Street’s Allison Bonds on the Generational Opportunities for Advisors,https://www.etftrends.com/state-streets-allison-bonds-on-the-generational-opportunities-for-advisors/,https://bit.ly/3R2BAnf
ETFTrends,Countries Like Brazil & India Serve as Bright Spots in the EM Landscape,https://www.etftrends.com/emerging-markets-channel/countries-like-brazil-india-serve-as-bright-spots-in-the-em-landscape/,https://bit.ly/3RPpSxm
ETFTrends,OneAscent Launches Two New International Equity Funds With OAIM & OAEM,https://www.etftrends.com/oneascent-launches-two-new-international-equity-funds-with-oaim-oaem/,https://bit.ly/3eSWK9M
