feed,title,long_url,short_url
Investing,Economic Week Ahead: PMI Data and Fed Commentary to Shape Rate Outlook,https://www.investing.com/analysis/economic-week-ahead-pmi-data-and-fed-commentary-to-shape-rate-outlook-200677054,
Investing,"Asia Wrap: Oil Artery Tightens, System Chokes",https://www.investing.com/analysis/asia-wrap-oil-artery-tightens-system-chokes-200677061,
Investing,S&P 500: Oversold Signals Clash With a Rapid Shift in Rate Expectations,https://www.investing.com/analysis/sp-500-oversold-signals-clash-with-a-rapid-shift-in-rate-expectations-200677043,
Investing,Lululemon’s Share Price Bottom Is In: Nowhere to Go But Up,https://www.investing.com/analysis/lululemons-share-price-bottom-is-in-nowhere-to-go-but-up-2006,
Investing,"Gold, Silver: Metals Buckle as Yields Spike and Hormuz Risks Escalate",https://www.investing.com/analysis/gold-silver-metals-buckle-as-yields-spike-and-hormuz-risks-escalate-200677053,
Investing,"Top 4 Japanese Chemical Stocks, According to Morgan Stanley",https://www.investing.com/news/stock-market-news/top-4-japanese-chemical-stocks-according-to-morgan-stanley-93CH-4574234,
