feed,title,long_url,short_url
Investing,"FX Alert: When Everything Sells at Once, Buy the US Dollar?",https://www.investing.com/analysis/fx-alert-when-everything-sells-at-once-buy-the-us-dollar-200677082,
Investing,Week Ahead: Central Banks on Hold Amid Energy Price Shock,https://www.investing.com/analysis/week-ahead-central-banks-on-hold-amid-energy-price-shock-200677079,
Investing,Gold miners slide sharply as bullion extends steep losses on rate fears,https://www.investing.com/news/stock-market-news/gold-miners-slide-sharply-as-bullion-extends-steep-losses-on-rate-fears-4574361,
Investing,DiaSorin shares plunge 17% as 2026 margin outlook shadows FY25 earnings,https://www.investing.com/news/stock-market-news/diasorin-shares-plunge-17-as-2026-margin-outlook-shadows-fy25-earnings-4574389,
Investing,"ECB won’t hesitate to act if inflation at risk of getting entrenched, Kazimir says",https://www.investing.com/news/economy-news/ecb-wont-hesitate-to-act-if-inflation-at-risk-of-getting-entrenched-kazimir-says-4574390,
