feed,title,long_url,short_url
Investopedia,"Costco Profit Tops Expectations But Revenue Growth Disappoints; Stock Moves Lower By Stephen Wisnefski Published Mar 07, 2024",https://investopedia.com/--8605941,
Investopedia,"Cyber Monday CD Deal: 6% on a 1-Year Term, Today Only By Sabrina Karl Published Nov 27, 2023",https://investopedia.com/--8406921,
Investopedia,"Alibaba May Report Slowest-Ever Quarterly Revenue Growth By Nathan Reiff Published Feb 21, 2023",https://investopedia.com/--7111767,
Investopedia,"Coinbase Revenue Could Plunge More Than 75% Amid Crypto Slump By Nathan Reiff Published Feb 17, 2023",https://investopedia.com/--7111063,
Investopedia,"Nvidia Bulls See AI Boost Offsetting PC Slump By Igor Greenwald Published Feb 17, 2023",https://investopedia.com/--7108863,
