feed,title,long_url,short_url
Investing,Gemini Offers Staking In Lead-Up To ETH Merge,https://investing.com/analysis/-200628725,
Investing,Gemini Launches Crypto Staking Reward Service,https://investing.com/analysis/-200628723,
Investing,Why The UK Prime Minister Election May Not Lead To Big Moves In Pound Sterling,https://investing.com/analysis/-200628718,
Investing,2 Key Indicators For U.S. Fed Shift,https://investing.com/analysis/-200628719,
Investing,Hit In The Face With A Throw Pillow,https://investing.com/analysis/-200628722,
Investing,Solana-Based Wallet Will Burn NFTs To Protect Customers From Scammers,https://investing.com/news/-2876168,
Investing,"Aid for Ukraine’s $54M crypto fund buys vests, scopes and UAVs",https://investing.com/news/-2876167,
Investing,China's cyber watchdog tries to assuage concerns of internet firms,https://investing.com/news/-2876086,
