feed,title,long_url,short_url
Investing,"Dollar roars higher, stocks muted amid Fed uncertainty, recession risks",https://investing.com/analysis/-200628748,
Investing,Gold: The Grind Lower Begins As Mixed Data Sends Markets Awry,https://investing.com/analysis/-200628743,
Investing,Bitcoin Drops 7% to Hit 3-Week Lows,https://investing.com/news/-2876376,
Investing,ByteDance's Douyin teams up with Alibaba's Ele.me in mini programme push,https://investing.com/news/-2876430,
Investing,Biden names new director of White House management and administration,https://investing.com/news/-2876414,
