feed,title,long_url,short_url
SeekingAlpha,Intema signs LOI to acquire Parabellum Media,https://seekingalpha.com/news/3778272,
SeekingAlpha,StealthGas EPS beats by $0.03,https://seekingalpha.com/news/3778271,
SeekingAlpha,"Roblox faces challenges 'aging up' its user base, according to KeyBanc",https://seekingalpha.com/news/3778264,
SeekingAlpha,"Brown-Forman misses on revenue and earnings, raises FY outlook",https://seekingalpha.com/news/3778270,
SeekingAlpha,Honeywell cut to Neutral at BofA on supply chain challenges,https://seekingalpha.com/news/3778269,
SeekingAlpha,What Does The Success Of Quantum Stocks Mean For Crypto?,https://seekingalpha.com/article/4474050,
