feed,title,long_url,short_url
SeekingAlpha,Why did Didi stock fall today? Blame heavy volume,https://seekingalpha.com/news/3785998,
SeekingAlpha,"WD-40 EPS beats by $0.09, beats on revenue",https://seekingalpha.com/news/3785999,
SeekingAlpha,"Top-rated portfolio strategist sees real rates, stocks rising in 2022 - Bloomberg",https://seekingalpha.com/news/3785984,
SeekingAlpha,"Simulations Plus EPS beats by $0.05, beats on revenue",https://seekingalpha.com/news/3785997,
SeekingAlpha,Time To Sail With Carnival Cruise Lines,https://seekingalpha.com/article/4478301,
