feed,title,long_url,short_url
FXEmpire,Wall St focused on payrolls with Fed’s ‘full employment’ brass ring within reach,https://www.fxempire.com/news/article/wall-st-focused-on-payrolls-with-feds-full-employment-brass-ring-within-reach-858657,https://j.mp/3JNI4Uh
FXEmpire,Alaska Airlines reduces January flight schedule by about 10%,https://www.fxempire.com/news/article/alaska-airlines-reduces-january-flight-schedule-by-about-10-858660,https://j.mp/3tjH7O3
FXEmpire,"Lawyer for Maxwell juror has defended fake heiress, Alec Baldwin stalker",https://www.fxempire.com/news/article/lawyer-for-maxwell-juror-has-defended-fake-heiress-alec-baldwin-stalker-858661,https://j.mp/3G5fAmG
FXEmpire,"Nigeria is working on COVID-19 vaccine, president says",https://www.fxempire.com/news/article/nigeria-is-working-on-covid-19-vaccine-president-says-858663,https://j.mp/3f4C8rP
FXEmpire,James Hardie ousts CEO Jack Truong,https://www.fxempire.com/news/article/james-hardie-ousts-ceo-jack-truong-858662,https://j.mp/3eVjC5i
