feed,title,long_url,short_url
Investing,FTX debtors object to Genesis’ ‘critical’ claims estimate of ‘$0.00’,https://www.investing.com/news/cryptocurrency-news/ftx-debtors-object-to-genesis-critical-claims-estimate-of-000-3097857,https://da.gd/qBNL
Investing,Foxconn's May sales drop 9.5% y/y on smartphone weakness,https://www.investing.com/news/stock-market-news/foxconns-may-sales-drop-95-yy-on-smartphone-weakness-3097859,https://da.gd/BfKc7u
Investing,Analysis-Smaller UK firms attractive targets for PE buyouts,https://www.investing.com/news/stock-market-news/analysissmaller-uk-firms-attractive-targets-for-pe-buyouts-3097849,https://da.gd/JWXw0
Investing,German engineering orders back to double-digit drop in April - VDMA,https://www.investing.com/news/economic-indicators/german-engineering-orders-back-to-doubledigit-drop-in-april--vdma-3097858,https://da.gd/rBuWT
Investing,Euro zone business growth slowed in May as factories struggled-PMI,https://www.investing.com/news/economy/euro-zone-business-growth-slowed-in-may-as-factories-struggledpmi-3097850,https://da.gd/Y6a8vA
