feed,title,long_url,short_url
Investing,"S&P 500 Faces Resistance at 5,700 as Traders Eye Fed Commentary",https://www.investing.com/analysis/sp-500-faces-resistance-at-5700-as-traders-eye-fed-commentary-200660420,https://da.gd/8lAjE
Investing,Loomis expands ATM services with $72 million Burroughs acquisition,https://www.investing.com/news/stock-market-news/loomis-expands-atm-services-with-72-million-burroughs-acquisition-93CH-4025259,https://da.gd/3V0oY
Investing,Antalpha initiates roadshow for IPO with expected pricing between $11 and $13,https://www.investing.com/news/stock-market-news/antalpha-initiates-roadshow-for-ipo-with-expected-pricing-between-11-and-13-93CH-4025258,https://da.gd/38lzs6
Investing,"Spooked by US tariffs, retailers look for growth in Europe",https://www.investing.com/news/stock-market-news/spooked-by-us-tariffs-retailers-look-for-growth-in-europe-4025257,https://da.gd/RZSll
Investing,"Monroe Capital, SMBC, MA Financial form $1.7B joint venture for middle market loans",https://www.investing.com/news/stock-market-news/monroe-capital-smbc-ma-financial-form-17b-joint-venture-for-middle-market-loans-93CH-4025256,https://da.gd/xsRLVk
Investing,Major universities sue to block Trump cuts to NSF research funding,https://www.investing.com/news/stock-market-news/major-universities-sue-to-block-trump-cuts-to-nsf-research-funding-4025229,https://da.gd/xGWoq
Investing,Canada's Ivey PMI shows activity contracting in April,https://www.investing.com/news/economic-indicators/canadas-ivey-pmi-shows-activity-contracting-in-april-4025260,https://da.gd/BFdne
Investing,New York Fed finds easing supply chain pressure in April,https://www.investing.com/news/economic-indicators/new-york-fed-finds-easing-supply-chain-pressure-in-april-4025248,https://da.gd/eCfn0
Investing,Merz elected German chancellor after initial shock defeat,https://www.investing.com/news/economy-news/merz-elected-german-chancellor-after-initial-shock-defeat-4025249,https://da.gd/3xblH
