feed,title,long_url,short_url
Investing,Bitcoin to Dominate Market 90%+ in Next 15 Years: Willy Woo,https://www.investing.com/news/cryptocurrency-news/bitcoin-to-dominate-market-90-in-next-15-years-willy-woo-4026663,https://da.gd/jdTPJH
Investing,Trump funding cuts force layoffs at US renewable energy research lab,https://www.investing.com/news/commodities-news/trump-funding-cuts-force-layoffs-at-us-renewable-energy-research-lab-4026629,https://da.gd/VHH8Yn
Investing,Nubank taps former Brazil central bank chief Campos Neto to management team,https://www.investing.com/news/stock-market-news/nubank-taps-former-brazil-central-bank-chief-campos-neto-to-management-team-4026698,https://da.gd/KdOJN
Investing,Meta suit against Israel's NSO offered rare insight into world of cyberespionage,https://www.investing.com/news/stock-market-news/meta-suit-against-israels-nso-offered-rare-insight-into-world-of-cyberespionage-4026630,https://da.gd/gjqC
Investing,New Zealand central bank warns of risks to financial system amid global volatility,https://www.investing.com/news/economy-news/new-zealand-central-bank-warns-of-risks-to-financial-system-amid-global-volatility-4026689,https://da.gd/9msL
Investing,"Trump in no rush for trade deals, wants everyone to ""pay to shop"" in America",https://www.investing.com/news/economy/trump-in-no-rush-for-trade-deals-wants-everyone-to-pay-to-shop-in-america-4026498,https://da.gd/Qk2Dm
