feed,title,long_url,short_url
Yahoo,"Dow Jones Extends Win Streak After Powell's Comments; Meta, Solar Stock Shine Late",https://finance.yahoo.com/m/39a8bf6f-9360-3a12-9d34-d8d16d73f43f/dow-jones-extends-win-streak.html?.tsrc=rss,https://da.gd/o0Oo
Yahoo,"Facebook Parent Meta Breaks Quarterly Losing Streak, Shares Surge",https://finance.yahoo.com/m/bef93d85-422f-36ee-b64a-c34114f8a2d4/facebook-parent-meta-breaks.html?.tsrc=rss,https://da.gd/4Q8R5
Yahoo,Mark Zuckerberg cements dominance as Facebook tops 3 billion monthly users,https://uk.finance.yahoo.com/news/mark-zuckerberg-cements-dominance-facebook-205814152.html?.tsrc=rss,https://da.gd/NPoQIX
Yahoo,Amazon Debuts HIPAA-Eligible Generative AI for Healthcare Providers,https://finance.yahoo.com/m/16a0dbdf-6e53-3ab7-9e28-d5964f46c9df/amazon-debuts-hipaa-eligible.html?.tsrc=rss,https://da.gd/QAgiCM
Yahoo,Facebook parent Meta posts strong revenue growth amid restructuring,https://finance.yahoo.com/m/c18bf215-d482-3c6f-8f39-1ef0f41d3077/facebook-parent-meta-posts.html?.tsrc=rss,https://da.gd/o0gCW
Yahoo,EBay Drops as Quarterly Profit Outlook Misses Estimates,https://finance.yahoo.com/news/ebay-drops-quarterly-profit-outlook-203656678.html?.tsrc=rss,https://da.gd/n0eit2
Yahoo,"Meta Shares Climb After Revenue, Forecast Beat Estimates",https://finance.yahoo.com/news/meta-shares-climb-revenue-forecast-203108871.html?.tsrc=rss,https://da.gd/98EMI
Yahoo,"Meta Stock Leaps As Mark Zuckerberg Touts AI Pipeline In Solid Q2 Earnings, Revenue Outlook",https://finance.yahoo.com/m/6e282dc8-ff18-30c3-a7d0-56e0fc66472b/meta-stock-leaps-as-mark.html?.tsrc=rss,https://da.gd/d6ZE1h
Yahoo,Facebook parent Meta forecasts quarterly revenue above estimates,https://finance.yahoo.com/news/facebook-parent-meta-forecasts-quarterly-200714524.html?.tsrc=rss,https://da.gd/IORYdw
Yahoo,5 Incredible Earnings Charts,https://finance.yahoo.com/news/5-incredible-earnings-charts-185500584.html?.tsrc=rss,https://da.gd/cTdV4o
