feed,title,long_url,short_url
SeekingAlpha,Match Group ticks higher amid activist speculation after 13F filing,https://seekingalpha.com/news/4003050,
SeekingAlpha,Nexus REIT reports Q2 results,https://seekingalpha.com/news/4003049,
SeekingAlpha,"Southland Holdings Non-GAAP EPS of -$0.76, revenue of $257M",https://seekingalpha.com/news/4003048,
SeekingAlpha,"MGO Global GAAP EPS of -$0.09, revenue of $1.95M",https://seekingalpha.com/news/4003047,
SeekingAlpha,"Nasdaq, S&P, Dow retreat on hot retail sales data, weakness in financial stocks",https://seekingalpha.com/news/4003042,
