feed,title,long_url,short_url
InvestorPlace,Avocado Prices: What to Expect After Inspection Pause Ends,https://investorplace.com/2024/06/avocado-prices-what-to-expect-after-inspection-pause-ends/,https://da.gd/EUuLBw
InvestorPlace,Wall Street Favorites: 7 Growth Stocks With Strong Buy Ratings for June 2024,https://investorplace.com/2024/06/wall-street-favorites-7-growth-stocks-with-strong-buy-ratings-for-june-2024/,https://da.gd/lD51d
InvestorPlace,"WGO Stock Earnings: Winnebago Industries Misses EPS, Misses Revenue for Q3 2024",https://investorplace.com/earning-results/2024/06/wgo-stock-earnings-winnebago-industries-for-q3-of-2024/,https://da.gd/0fSKlG
InvestorPlace,"DRI Stock Earnings: Darden Restaurants Beats EPS, Misses Revenue for Q4 2024",https://investorplace.com/earning-results/2024/06/dri-stock-earnings-darden-restaurants-for-q4-of-2024/,https://da.gd/Zj586
InvestorPlace,"ACB Stock Earnings: Aurora Cannabis Misses EPS, Misses Revenue for Q4 2024",https://investorplace.com/earning-results/2024/06/acb-stock-earnings-aurora-cannabis-for-q4-of-2024/,https://da.gd/1oLf
InvestorPlace,"JBL Stock Earnings: Jabil Beats EPS, Beats Revenue for Q3 2024",https://investorplace.com/earning-results/2024/06/jbl-stock-earnings-jabil-for-q3-of-2024/,https://da.gd/hdDmM
InvestorPlace,Why Is Trump Media (DJT) Stock Down 11% Today?,https://investorplace.com/2024/06/why-is-trump-media-djt-stock-down-11-today/,https://da.gd/oxrNdB
InvestorPlace,Elon Musk Just Supercharged DELL Stock. Where Does It Go Next?,https://investorplace.com/2024/06/elon-musk-just-supercharged-dell-stock-where-does-it-go-next/,https://da.gd/kwBu8J
InvestorPlace,NKLA Stock Plunges as Nikola Announces 1-for-30 Reverse Split,https://investorplace.com/2024/06/nkla-stock-plunges-as-nikola-announces-1-for-30-reverse-split/,https://da.gd/wX30A
