feed,title,long_url,short_url
SeekingAlpha,Google to pay $118M to settle female employees' discrimination suit,https://seekingalpha.com/news/3847996,
SeekingAlpha,"'We're in a bloodbath' for stocks and crypto, but you should be buying - Anthony Scaramucci",https://seekingalpha.com/news/3847992,
SeekingAlpha,"Better Choice promotes Sauermann to COO, Young to CSO",https://seekingalpha.com/news/3847995,
SeekingAlpha,"Funko acquired high-end collectible company, Mondo",https://seekingalpha.com/news/3847994,
SeekingAlpha,Ulta Beauty is seen as a winner by JPMorgan amid the retail carnage,https://seekingalpha.com/news/3847993,
SeekingAlpha,Crypto bank Silvergate Capital lands Overweight rating from Wells Fargo on rising rates,https://seekingalpha.com/news/3847991,
SeekingAlpha,Electro-Sensors stock gains premarket on merger with Mobile X Global,https://seekingalpha.com/news/3847990,
