feed,title,long_url,short_url
Benzinga,Novavax' Sees Conditional Approval Of COVID-19 Vaccine Booster In Australia As US FDA Delays Its Decision,https://benzinga.com/general/biotech/22/06/27674141/conditional-approval-of-novavaxs-covid-19-vaccine-booster-in-australia-as-fda-delays-its-decision,https://bit.ly/3MGchoI
Benzinga,Pitney Bowes SendPro 360 Achieves FedRAMP Security Authorization,https://benzinga.com/news/22/06/27672776/pitney-bowes-sendpro-360-achieves-fedramp-security-authorization,https://bit.ly/3Hqpgd5
Benzinga,Here's How Much You Would Have Made Owning Equinix Stock In The Last 10 Years,https://benzinga.com/news/earnings/22/06/27672839/heres-how-much-you-would-have-made-owning-equinix-stock-in-the-last-10-years,https://bit.ly/3NOwryd
Benzinga,Here's How Much $1000 Invested In Enphase Energy 10 Years Ago Would Be Worth Today,https://benzinga.com/news/earnings/22/06/27672834/heres-how-much-1000-invested-in-enphase-energy-10-years-ago-would-be-worth-today,https://bit.ly/3QfHj9U
Benzinga,"Here's How Mizuho Views AMD, Nvidia, Qualcomm",https://benzinga.com/news/22/06/27674267/heres-how-mizuho-views-amd-nvidia-qualcomm,https://bit.ly/3tAy2zE
Benzinga,"Benzinga's Top Ratings Upgrades, Downgrades For June 13, 2022",https://benzinga.com/analyst-ratings/upgrades/22/06/27672844/benzingas-top-ratings-upgrades-downgrades-for-june-13-2022,https://bit.ly/3OdF31a
