feed,title,long_url,short_url
Investing,Gold Holds Near Record Highs Driven by Inflation Data and Geopolitical Tensions,https://www.investing.com/analysis/gold-holds-near-record-highs-driven-by-inflation-data-and-geopolitical-tensions-200666747,
Investing,"Copper prices stay high on Indonesia supply concerns, China demand outlook",https://www.investing.com/news/commodities-news/copper-prices-stay-high-on-indonesia-supply-concerns-china-demand-outlook-93CH-4234863,
Investing,Indonesia stocks higher at close of trade; IDX Composite Index up 0.75%,https://www.investing.com/news/stock-market-news/indonesia-stocks-higher-at-close-of-trade-idx-composite-index-up-075-4234869,
Investing,Noba Bank Group plans Nasdaq Stockholm IPO at $3.74 billion valuation,https://www.investing.com/news/stock-market-news/noba-bank-group-plans-nasdaq-stockholm-ipo-at-374-billion-valuation-93CH-4234866,
Investing,Barrick sells Hemlo gold mine to Carcetti Capital for up to $1.09 billion,https://www.investing.com/news/stock-market-news/barrick-sells-hemlo-gold-mine-to-carcetti-capital-for-up-to-109-billion-93CH-4234864,
Investing,Norwegian companies expect elevated output growth in H2 2025,https://www.investing.com/news/stock-market-news/norwegian-companies-expect-elevated-output-growth-in-h2-2025-93CH-4234859,
Investing,Iberdrola boosts stake in Neoenergia to 83.8% after $2.2bn purchase,https://www.investing.com/news/stock-market-news/iberdrola-boosts-stake-in-neoenergia-to-838-after-22bn-purchase-4234835,
Investing,German business insolvencies rise 12.2% in first half of 2025,https://www.investing.com/news/economic-indicators/german-business-insolvencies-rise-122-in-first-half-of-2025-93CH-4234849,
Investing,"UK housing market shows signs of cooling, RICS survey reveals",https://www.investing.com/news/economic-indicators/uk-housing-market-shows-signs-of-cooling-rics-survey-reveals-93CH-4234840,
Investing,"Norwegian companies expect elevated output growth, central bank survey shows",https://www.investing.com/news/economy-news/norwegian-companies-expect-elevated-output-growth-central-bank-survey-shows-4234860,
Investing,"Futures higher; CPI, ECB decision ahead; Adobe to report - what’s moving markets",https://www.investing.com/news/economy/futures-higher-cpi-ecb-decision-ahead-adobe-to-report--whats-moving-markets-4234814,
