feed,title,long_url,short_url
Investing,"'Rich Dad Poor Dad' Author: Bitcoin Will ‘Bloom, Bloom’ As ‘Buggiest Crash’ Is Coming in Feb 2025",https://www.investing.com/news/cryptocurrency-news/rich-dad-poor-dad-author-bitcoin-will-bloom-bloom-as-buggiest-crash-is-coming-in-feb-2025-3831782,https://da.gd/yro09
Investing,"Bitcoin (BTC) Wants to Claim $110,000, Ethereum (ETH)'s Crucial Price Battle to Begin, Solana (SOL) on Verge of Skyrocketing?",https://www.investing.com/news/cryptocurrency-news/bitcoin-btc-wants-to-claim-110000-ethereum-eths-crucial-price-battle-to-begin-solana-sol-on-verge-o,https://da.gd/qRsaG
Investing,World Bank president cautions against hasty reaction to Trump policies,https://www.investing.com/news/commodities-news/world-bank-president-cautions-against-hasty-reaction-to-trump-policies-3831766,https://da.gd/0oSwX
Investing,"MicroStrategy purchases over 10,000 bitcoin using proceeds from share sales",https://www.investing.com/news/stock-market-news/microstrategy-purchases-over-10000-bitcoin-using-proceeds-from-share-sales-93CH-3831775,https://da.gd/75mus
Investing,Humanity Protocol valued at $1.1 billion after latest fundraise,https://www.investing.com/news/stock-market-news/humanity-protocol-valued-at-11-billion-after-latest-fundraise-3831761,https://da.gd/8OZl5
Investing,Deutsche Bank questions stock market's tariff response,https://www.investing.com/news/stock-market-news/deutsche-bank-questions-stock-markets-tariff-response-93CH-3831751,https://da.gd/MPTZBI
Investing,Diversified Energy set to acquire Maverick Natural Resources for $1.3 billion- WSJ,https://www.investing.com/news/stock-market-news/diversified-energy-set-to-acquire-maverick-natural-resources-for-13-billion-wsj-93CH-3831750,https://da.gd/iwrqsi
Investing,SoFi Technologies reports strong Q4 results but stock drops on guidance,https://www.investing.com/news/stock-market-news/sofi-technologies-reports-strong-q4-results-but-stock-drops-on-guidance-3831748,https://da.gd/XWvXe
Investing,Selloff in REIT stocks amid DeepSeek fears overdone: Mizuho,https://www.investing.com/news/stock-market-news/selloff-in-reit-stocks-amid-deepseek-fears-overdone-mizuho-3831743,https://da.gd/0ucjpB
