feed,title,long_url,short_url
TheStreet,Will mortgage rates finally help housing?,https://www.thestreet.com/real-estate/will-mortgage-rates-finally-help-housing,https://da.gd/HUlJ5
TheStreet,Big tech earnings could save market rally or trigger summer slump,https://www.thestreet.com/investing/stocks/big-tech-earnings-could-save-market-rally-or-trigger-summer-slump,https://da.gd/o1NVF
TheStreet,A key Walmart partnership has ended and customers won't be happy,https://www.thestreet.com/retail/a-key-walmart-partnership-has-ended-and-customers-wont-be-happy,https://da.gd/cP6uP
TheStreet,Key retailer nears Chapter 11 bankruptcy 'worst-case scenario',https://www.thestreet.com/retail/key-retailer-nears-chapter-11-bankruptcy-worst-case-scenario,https://da.gd/Q9QZF
TheStreet,Carnival Cruise Line solves an embarrassing passenger problem,https://www.thestreet.com/travel/carnival-cruise-line-solves-an-embarrassing-passenger-problem,https://da.gd/YJAR
TheStreet,Restaurant chain closing more locations in Chapter 11 bankruptcy,https://www.thestreet.com/restaurants/restaurant-chain-closing-more-locations-in-chapter-11-bankruptcy,https://da.gd/lrpfoy
TheStreet,Southwest's main investor is still mad at the airline,https://www.thestreet.com/travel/southwest-elliott-investment-seating-changes,https://da.gd/RpDXl
