feed,title,long_url,short_url
SeekingAlpha,Nationwide Russell 2000 Risk-Managed Income ETF declares monthly distribution of $0.1094,https://seekingalpha.com/news/4040359,
SeekingAlpha,Quebec Rare Earth acquires additional land surrounding lynx REE project,https://seekingalpha.com/news/4040358,
SeekingAlpha,Nationwide Nasdaq-100 Risk-Managed Income ETF declares monthly distribution of $0.1421,https://seekingalpha.com/news/4040357,
SeekingAlpha,Safe Bulkers sells MV Pedhoulas Cherry for $26.6M,https://seekingalpha.com/news/4040356,
SeekingAlpha,Salesforce expands Amazon partnership to list software on AWS marketplace,https://seekingalpha.com/news/4040351,
SeekingAlpha,T. Rowe Price Ultra Short-Term Bond ETF declares monthly distribution of $0.2185,https://seekingalpha.com/news/4040355,
SeekingAlpha,T. Rowe Price U.S. High Yield ETF declares monthly distribution of $0.3515,https://seekingalpha.com/news/4040354,
