feed,title,long_url,short_url
Investing,The Energy Report: Gobble Squabble,https://www.investing.com/analysis/the-energy-report-gobble-squabble-200643913,https://da.gd/bPtuY
Investing,Barclays and NatWest announce mortgage rate cuts,https://www.investing.com/news/stock-market-news/barclays-and-natwest-announce-mortgage-rate-cuts-93CH-3244121,https://da.gd/wb0IyR
Investing,Textron Aviation to drive 2024 to 2025 gains - TD Cowen,https://www.investing.com/news/stock-market-news/textron-aviation-to-drive-2024-to-2025-gains--td-cowen-432SI-3244117,https://da.gd/AV2x
Investing,"Tesla stock struggles amid Twitter-related sell-offs, says investor",https://www.investing.com/news/stock-market-news/tesla-stock-struggles-amid-twitterrelated-selloffs-says-investor-93CH-3244119,https://da.gd/iEjR
Investing,Why Is Roku (ROKU) Stock Soaring Today,https://www.investing.com/news/stock-market-news/why-is-roku-roku-stock-soaring-today-3244116,https://da.gd/J5OWrK
Investing,ExxonMobil sets sights on EV market with lithium production plans,https://www.investing.com/news/stock-market-news/exxonmobil-sets-sights-on-ev-market-with-lithium-production-plans-93CH-3244115,https://da.gd/EjHx16
Investing,Boeing and Bombardier Vie for Canada's Multi-Mission Aircraft Contract,https://www.investing.com/news/stock-market-news/boeing-and-bombardier-vie-for-canadas-multimission-aircraft-contract-93CH-3244114,https://da.gd/NyPN
Investing,PNC Bank announces closure of 19 branches across multiple states by February 2024,https://www.investing.com/news/stock-market-news/pnc-bank-announces-closure-of-19-branches-across-multiple-states-by-february-2024-93CH-3244112,https://da.gd/XZmWs
Investing,"More US shoppers tack on buy now, pay later debt for Cyber Monday",https://www.investing.com/news/economy/more-us-shoppers-tack-on-buy-now-pay-later-debt-for-cyber-monday-3244118,https://da.gd/OWJqQP
