feed,title,long_url,short_url
CryptoNews,WisdomTree Files an S-1 Registration with SEC for XRP ETF,https://cryptonews.com/news/wisdomtree-files-an-s-1-registration-with-sec-for-xrp-etf/,https://da.gd/MIV2w
CryptoNews,China’s Digital Yuan Still Encounters Challenges in Adoption: Report,https://cryptonews.com/news/chinas-digital-yuan-still-encounters-challenges-in-adoption-report/,https://da.gd/1yCYS
CryptoNews,Strong Buy Signals Emerge as Saylor Predicts Microsoft Could Add $4.9T with Bitcoin – Will BTC Hit $150K?,https://cryptonews.com/news/strong-buy-signals-emerge-as-saylor-predicts-microsoft-could-add-4-9t-with-bitcoin-will-btc-hit-150k/,https://da.gd/So5ZEM
CryptoNews,Coinbase Exec Predicts Stablecoin Regulations by 2025 After Trump Win,https://cryptonews.com/news/coinbase-exec-predicts-stablecoin-regulations-by-2025-trump-win/,https://da.gd/URc52
CryptoNews,"Crypto Spot Trading Volume Surges to $2.71 Trillion in November, Doubling October’s Numbers",https://cryptonews.com/news/crypto-spot-trading-volume-surges-to-2-71-trillion-in-november-doubling-octobers-numbers/,https://da.gd/KqNRr
CryptoNews,"Clipper DEX Says Withdrawal Vulnerability Led to $450K Hack, Denies Private Key Leak",https://cryptonews.com/news/clipper-dex-says-withdrawal-vulnerability-led-to-450k-hack-denies-private-key-leak/,https://da.gd/VNtiX6
