feed,title,long_url,short_url
Investing,"Trump Media, TAE Technologies to combine in $6 billion deal",https://www.investing.com/news/stock-market-news/trump-media-tae-technologies-to-combine-in-6-billion-deal-4414623,
Investing,"Compass-Anywhere brokerage deal would hurt homebuyers, US Senators say",https://www.investing.com/news/stock-market-news/compassanywhere-brokerage-deal-would-hurt-homebuyers-us-senators-say-4414535,
Investing,"This power infrastructure stock is a buy opportunity after pullback, analyst says",https://www.investing.com/news/stock-market-news/this-power-infrastructure-stock-is-a-buy-opportunity-after-pullback-analyst-says-4414609,
Investing,Lufthansa looks to US flyers opting for premium to boost sales,https://www.investing.com/news/stock-market-news/lufthansa-looks-to-us-flyers-opting-for-premium-to-boost-sales-4414534,
Investing,Explainer-How does the EU want to use Russia’s frozen assets for Ukraine?,https://www.investing.com/news/stock-market-news/explainerhow-does-the-eu-want-to-use-russias-frozen-assets-for-ukraine-4414581,
Investing,Banks win bid to block $3.6 billion mass forex UK lawsuit,https://www.investing.com/news/stock-market-news/banks-win-bid-to-block-36,
Investing,Germany launches €30 billion fund to mobilize private investment,https://www.investing.com/news/economic-indicators/germany-launches-30-billion-fund-to-mobilize-private-investment-4414599,
