feed,title,long_url,short_url
Investing,Actelis Networks stock plummets after pricing public offering,https://www.investing.com/news/stock-market-news/actelis-networks-stock-plummets-after-pricing-public-offering-93CH-4415576,
Investing,Circle Internet Group stock rises after strategic partnership with Intuit,https://www.investing.com/news/stock-market-news/circle-internet-group-stock-rises-after-strategic-partnership-with-intuit-93CH-4415572,
Investing,Prudential puts key units under CEO Sullivan in leadership overhaul,https://www.investing.com/news/stock-market-news/prudential-puts-key-units-under-ceo-sullivan-in-leadership-overhaul-4415567,
Investing,"SailPoint eyes 2026 growth, CEO McClain calls risk reduction the ‘real ROI’ of AI",https://www.investing.com/news/stock-market-news/sailpoint-eyes-2026-growth-ceo-mcclain-calls-risk-reduction-the-real-roi-of-ai-4415561,
Investing,Blackstone in talks with Revolut to offer funds via fintech platform - Bloomberg,https://www.investing.com/news/stock-market-news/blackstone-in-talks-with-revolut-to-offer-funds-via-fintech-platform--bloomberg-93CH-4415555,
Investing,Morocco stocks higher at close of trade; Moroccan All Shares up 0.30%,https://www.investing.com/news/stock-market-news/morocco-stocks-higher-at-close-of-trade-moroccan-all-shares-up-030-4415554,
Investing,Rubio says US sanctioning ICC judges for targeting Israel,https://www.investing.com/news/economy-news/rubio-says-us-sanctioning-icc-judges-for-targeting-israel-4415574,
