feed,title,long_url,short_url
Cointelegraph,Telegram is under investigation in India: Report,https://cointelegraph.com/news/telegram-under-investigation-india-report?utm_source=rss_feed&utm_medium=rss%3F1724694461960&utm_campaign=rss_partner_inbound,https://da.gd/OXFir
Cointelegraph,"Price analysis 8/26: SPX, DXY, BTC, ETH, BNB, SOL, XRP, DOGE, TON, ADA",https://cointelegraph.com/news/price-analysis-8-26-spx-dxy-btc-eth-bnb-sol-xrp-doge-ton-ada?utm_source=rss_feed&utm_medium=rss%3F1724694461960&utm_campaign=rss_partner_inbound,https://da.gd/8ys7bV
Cointelegraph,US authorities oppose ex-FTX exec’s motion to void plea deal,https://cointelegraph.com/news/ftx-exec-motion-void-plea-deal-opposed?utm_source=rss_feed&utm_medium=rss%3F1724694461960&utm_campaign=rss_partner_inbound,https://da.gd/Vulvee
Cointelegraph,EigenLayer’s EigenDA to support layer-2 native token restaking,https://cointelegraph.com/news/eigenlayer-eigenda-support-layer-2-native-token-restaking?utm_source=rss_feed&utm_medium=rss%3F1724694461960&utm_campaign=rss_partner_inbound,https://da.gd/XVLR
Cointelegraph,French authorities can hold Pavel Durov until Aug. 28,https://cointelegraph.com/news/french-authorities-pavel-durov-custody?utm_source=rss_feed&utm_medium=rss%3F1724694461960&utm_campaign=rss_partner_inbound,https://da.gd/q27rj
Cointelegraph,Ethereum's 40-month slump vs. Bitcoin won't end in a dollar 'freefall' scenario,https://cointelegraph.com/news/ethereum-40-month-slump-bitcoin-dollar-freefall-scenario?utm_source=rss_feed&utm_medium=rss%3F1724694461960&utm_campaign=rss_partner_inbound,https://da.gd/CBI7i
Cointelegraph,France’s Macron denies Pavel Durov arrest was political,https://cointelegraph.com/news/france-president-emmanuel-macron-pavel-durov-arrest-not-political?utm_source=rss_feed&utm_medium=rss%3F1724694461960&utm_campaign=rss_partner_inbound,https://da.gd/Ozi4x
Cointelegraph,Bitcoin liquidity sinks to $62.5K as BTC price struggles at US open,https://cointelegraph.com/news/bitcoin-liquidity-sinks-62-5-k-btc-price-struggles-us-open?utm_source=rss_feed&utm_medium=rss%3F1724694461960&utm_campaign=rss_partner_inbound,https://da.gd/ZIw8XP
Cointelegraph,"Crypto-Sec: DeFi Saver ownership phish, iVest shuts down after attack, plus hackathon clipboard hijack",https://cointelegraph.com/magazine/crypto-sec-defi-phishing-malware-hackathon/?utm_source=rss_feed&utm_medium=rss%3F1724694461960&utm_campaign=rss_partner_inbound,https://da.gd/UTOa5
Cointelegraph,Here’s what happened in crypto today,https://cointelegraph.com/news/what-happened-in-crypto-today?utm_source=rss_feed&utm_medium=rss%3F1724694461960&utm_campaign=rss_partner_inbound,https://da.gd/jO95X
Cointelegraph,4 reasons why Bitcoin may see $60K before $70K,https://cointelegraph.com/news/4-reasons-why-bitcoin-may-re-test-60-k-before-70-k?utm_source=rss_feed&utm_medium=rss%3F1724694461960&utm_campaign=rss_partner_inbound,https://da.gd/V0JOG2
Cointelegraph,Argentina adds Ethereum to Buenos Aires high school curriculum,https://cointelegraph.com/news/argentina-ethereum-education-buenos-aires-schools?utm_source=rss_feed&utm_medium=rss%3F1724694461960&utm_campaign=rss_partner_inbound,https://da.gd/qlpXr3
Cointelegraph,Stacks' Nakamoto Upgrade will revolutionize DeFi on Bitcoin,https://cointelegraph.com/news/stacks-nakamoto-upgrade-bringing-new-era-bitcoin-defi?utm_source=rss_feed&utm_medium=rss%3F1724694461960&utm_campaign=rss_partner_inbound,https://da.gd/ccwP8
Cointelegraph,Bitcoin poised for breakout as US money market funds reach $6.2T,https://cointelegraph.com/news/us-money-market-funds-bitcoin-breakout?utm_source=rss_feed&utm_medium=rss%3F1724694461960&utm_campaign=rss_partner_inbound,https://da.gd/4i4h7
Cointelegraph,India amasses 5M central bank digital currency users,https://cointelegraph.com/news/india-cbdc-pilot-5-million-users?utm_source=rss_feed&utm_medium=rss%3F1724694461960&utm_campaign=rss_partner_inbound,https://da.gd/Uxj7J
Cointelegraph,Vitalik Buterin responds to criticism that Ethereum ‘doesn’t care’ about DeFi,https://cointelegraph.com/news/vitalik-buterin-defends-defi-after-critique?utm_source=rss_feed&utm_medium=rss%3F1724694461960&utm_campaign=rss_partner_inbound,https://da.gd/qC5r
Cointelegraph,Concerns grow over Binance executive’s health during detention in Nigeria,https://cointelegraph.com/news/nigerian-binance-executive-tigran-gambaryan-detention-health-concerns?utm_source=rss_feed&utm_medium=rss%3F1724694461960&utm_campaign=rss_partner_inbound,https://da.gd/7DIHBp
Cointelegraph,Crypto investment products see largest inflows in 5 weeks,https://cointelegraph.com/news/crypto-investment-largest-inflows-5-weeks?utm_source=rss_feed&utm_medium=rss%3F1724694461960&utm_campaign=rss_partner_inbound,https://da.gd/M2l2aF
Cointelegraph,Bitcoin Runes records 15.6M NFT transactions in 4 months,https://cointelegraph.com/news/bitcoin-runes-nft-protocol-transaction-fees-stats?utm_source=rss_feed&utm_medium=rss%3F1724694461960&utm_campaign=rss_partner_inbound,https://da.gd/rGPFX
Cointelegraph,NFTs show signs of life as weekly volumes turn positive,https://cointelegraph.com/news/nft-weekly-sales-surge-top-blockchains?utm_source=rss_feed&utm_medium=rss%3F1724694461960&utm_campaign=rss_partner_inbound,https://da.gd/2qtodh
Cointelegraph,BTC price dip gone by September? 5 things to know in Bitcoin this week,https://cointelegraph.com/news/btc-price-dip-gone-september-5-things-bitcoin-this-week?utm_source=rss_feed&utm_medium=rss%3F1724694461960&utm_campaign=rss_partner_inbound,https://da.gd/bqfNd5
Cointelegraph,Binance Labs says new AI investments will support wave of AI-powered DApps,https://cointelegraph.com/news/binance-labs-ai-startups-investments?utm_source=rss_feed&utm_medium=rss%3F1724694461960&utm_campaign=rss_partner_inbound,https://da.gd/GwiPm
Cointelegraph,"Men in crypto less attractive to women than cosplayers, anime buffs: Survey",https://cointelegraph.com/news/crypto-ranked-top-unattractive-hobby-women-survey?utm_source=rss_feed&utm_medium=rss%3F1724694461960&utm_campaign=rss_partner_inbound,https://da.gd/CFjTlp
Cointelegraph,Stablecoin market cap hits new all-time high amid 11 months of growth,https://cointelegraph.com/news/stablecoin-market-cap-hits-new-all-time-high?utm_source=rss_feed&utm_medium=rss%3F1724694461960&utm_campaign=rss_partner_inbound,https://da.gd/PYhp4
Cointelegraph,AI tokens surge ahead of ‘Super Bowl’ Nvidia earnings report,https://cointelegraph.com/news/ai-tokens-surge-ahead-nvidia-q2-earnings-report?utm_source=rss_feed&utm_medium=rss%3F1724694461960&utm_campaign=rss_partner_inbound,https://da.gd/jLLtD9
Cointelegraph,"Polygon Discord compromise hits Avalanche, ZKsync hours later",https://cointelegraph.com/news/polygon-discord-scam-hits-avalanche-zksync-hours-later?utm_source=rss_feed&utm_medium=rss%3F1724694461960&utm_campaign=rss_partner_inbound,https://da.gd/B0A7rg
Cointelegraph,ETH once pumped 6x after a big Ethereum Foundation sale — Arkham,https://cointelegraph.com/news/ethereum-foundation-sells-ether-kraken-eth-price?utm_source=rss_feed&utm_medium=rss%3F1724694461960&utm_campaign=rss_partner_inbound,https://da.gd/ZR0LhV
Cointelegraph,Mac users warned over malware ‘Cthulhu’ that steals crypto wallets,https://cointelegraph.com/news/mac-users-warned-over-malware-cthulhusteals-crypto-wallets?utm_source=rss_feed&utm_medium=rss%3F1724694461960&utm_campaign=rss_partner_inbound,https://da.gd/Ml1OJu
Cointelegraph,Rumble boss ‘departed’ from Europe after Telegram CEO arrest,https://cointelegraph.com/news/rumble-ceo-fled-europe-france-arrests-telegram-pavel-durov?utm_source=rss_feed&utm_medium=rss%3F1724694461960&utm_campaign=rss_partner_inbound,https://da.gd/3FGRv
Cointelegraph,Memecoin Shiba Inu unveils plans to launch DAO,https://cointelegraph.com/news/memecoin-shiba-inu-unveils-plans-to-launch-dao?utm_source=rss_feed&utm_medium=rss%3F1724694461960&utm_campaign=rss_partner_inbound,https://da.gd/H1Gi
