feed,title,long_url,short_url
SeekingAlpha,Kona Gold Solutions reports Q2 results,https://seekingalpha.com/news/3731398,
SeekingAlpha,BioLargo reports Q2 results,https://seekingalpha.com/news/3731397,
SeekingAlpha,EQONEX launches institutional crypto lending platform to meet demand,https://seekingalpha.com/news/3731354,
SeekingAlpha,PowerBand Solutions reports 1H results,https://seekingalpha.com/news/3731396,
SeekingAlpha,Marketing Alliance reports Q1 results,https://seekingalpha.com/news/3731395,
SeekingAlpha,"BHP, Petroleo Brasileiro, Roblox among premarket losers' pack",https://seekingalpha.com/news/3731394,
SeekingAlpha,Centene subsidiary Buckeye Health Plan awarded Ohio Medicaid contract,https://seekingalpha.com/news/3731392,
