feed,title,long_url,short_url
SeekingAlpha,Lazard assets under management rises slightly to $252.7B in March,https://seekingalpha.com/news/3822634,
SeekingAlpha,Pacira BioSciences sees 32% growth in Q1 revenue: Prelim,https://seekingalpha.com/news/3822633,
SeekingAlpha,Farmmi receives multi-product order for shipment to Western Asia,https://seekingalpha.com/news/3822632,
SeekingAlpha,"CarMax, Myovant Sciences, Zosano Pharma among premarket losers' pack",https://seekingalpha.com/news/3822631,
SeekingAlpha,Beyond Meat gains after big expansion of meatless chicken tenders distribution,https://seekingalpha.com/news/3822630,
SeekingAlpha,"Still A Bear Market Rally? Or, Is The Bull Back?",https://seekingalpha.com/article/4500949,
SeekingAlpha,CTO Realty Growth: A 7% Yielder Not To Miss,https://seekingalpha.com/article/4500912,
