feed,title,long_url,short_url
SeekingAlpha,Delta Apparel expects FQ2 net sales growth of 20% Y/Y,https://seekingalpha.com/news/3822637,
SeekingAlpha,electroCore rises 4% PM as 1Q22 revenue expected above the consensus,https://seekingalpha.com/news/3822636,
SeekingAlpha,Veru rises 8% premarket after closing Monday up 182% due to COVID candidate data,https://seekingalpha.com/news/3822635,
SeekingAlpha,Can Ford Motors Stock Reach $30?,https://seekingalpha.com/article/4500860,
SeekingAlpha,AT&T And Warner Bros. Discovery: The Market Is Already Rewarding Shareholders,https://seekingalpha.com/article/4500951,
SeekingAlpha,Prologis Wins As Supply Chains Break Down Again,https://seekingalpha.com/article/4500950,
