feed,title,long_url,short_url
ETFTrends:DailyRecap,What Role Can Active ETFs Play in a Portfolio?,https://www.etftrends.com/etf-investing-channel/what-role-active-etfs-play-portfolio/,https://da.gd/3g69bD
ETFTrends:DailyRecap,Two Measures of Inflation and Fed Policy,https://www.etftrends.com/commodities-channel/two-measures-inflation-fed-policy/,https://da.gd/UE2rz
ETFTrends:DailyRecap,ETF of the Week: RiverFront Strategic Income Fund (RIGS),https://www.etftrends.com/etf-of-the-week/riverfront-strategic-income-fund-rigs-etf-of-the-week/,https://da.gd/fsADI
ETFTrends:DailyRecap,India Still an Attractive Destination for Emerging Markets Investors,https://www.etftrends.com/leveraged-inverse-channel/india-attractive-destination-emerging-markets-investors/,https://da.gd/gaRsuv
ETFTrends:DailyRecap,VettaFi Repeats as Best ETF Research Award Winner,https://www.etftrends.com/vettafi-repeats-best-etf-research-award-winner/,https://da.gd/l34yu
ETFTrends:DailyRecap,"When Allocating to High Yield, Choose Your Entry Points With Precision",https://www.etftrends.com/institutional-income-strategies-channel/allocating-high-yield-choose-entry-points-precision/,https://da.gd/bPpa3
ETFTrends:DailyRecap,White House Investment Bodes Well for This Clean Energy ETF,https://www.etftrends.com/etf-building-blocks-channel/white-house-investment-bodes-well-clean-energy-etf/,https://da.gd/2CYIA
ETFTrends:DailyRecap,READ: What Makes That Ticker Tick: Zeno Mercer and ROBO’s 10th Anniversary,https://www.etftrends.com/disruptive-technology-channel/read-what-makes-that-ticker-tick-robos-zeno-mercer-robos-10th-anniversary/,https://da.gd/rruQ6c
ETFTrends:DailyRecap,Grid Spending Could Boost Electrification Metals Demand,https://www.etftrends.com/climate-insights-channel/grid-spending-boost-electrification-metals-demand/,https://da.gd/62s0
ETFTrends:DailyRecap,Reasons to Be Bullish on Investment Grade Corporate Credit,https://www.etftrends.com/esg-channel/reasons-bullish-investment-grade-corporate-credit/,https://da.gd/Wd9qM
ETFTrends:DailyRecap,GDP Surges as Sentiment Slides: A Week of Economic Insights,https://www.etftrends.com/innovative-etfs-channel/gdp-surges-sentiment-slides-week-economic-insights/,https://da.gd/RqlnKo
ETFTrends:DailyRecap,Asset Allocation Quarterly Fourth Quarter 2023,https://www.etftrends.com/etf-strategist-channel/asset-allocation-quarterly-fourth-quarter-2023/,https://da.gd/7lYIE
ETFTrends:DailyRecap,60/40 Portfolio Falls Short in Current Environment,https://www.etftrends.com/market-insights-channel/60-40-portfolio-short-current-environment/,https://da.gd/FH4rF
ETFTrends:DailyRecap,Look Beyond Bonds to Equities for Income Amid High Rates,https://www.etftrends.com/retirement-income-channel/income-equities-amidst-high-rates/,https://da.gd/bS8XCN
ETFTrends:DailyRecap,VIDEO: ETF of the Week: VanEck Morningstar Wide Moat ETF (MOAT),https://www.etftrends.com/tactical-allocation-channel/video-etf-week-vaneck-morningstar-wide-moat-etf-moat/,https://da.gd/QmeLZ
ETFTrends:DailyRecap,What You Might Have Missed at Friday’s Income Strategy Symposium,https://www.etftrends.com/what-might-missed-fridays-income-strategy-symposium/,https://da.gd/BcUDm
ETFTrends:DailyRecap,IMF 2023 Fall Meetings: The World Begins to Worry About the U.S. Fiscal Deficit,https://www.etftrends.com/tactical-allocation-channel/imf-2023-fall-meetings-world-begins-worry-us-fiscal-deficit/,https://da.gd/zjm2S4
