feed,title,long_url,short_url
SeekingAlpha,"AMD in charts: Data center, gaming and embedded revenues slip Y/Y",https://seekingalpha.com/news/4027399,
SeekingAlpha,"Lumen Non-GAAP EPS of -$0.09 misses by $0.15, revenue of $3.64B beats by $30M",https://seekingalpha.com/news/4027401,
SeekingAlpha,"Meritage Homes GAAP EPS of $5.98 beats by $0.87, revenue of $1.61B beats by $50M",https://seekingalpha.com/news/4027402,
SeekingAlpha,"Assurant Non-GAAP EPS of $4.29 beats by $1.70, revenue of $2.77B beats by $70M",https://seekingalpha.com/news/4027400,
SeekingAlpha,"Ternium Non-GAAP EPADS of $1.38 misses by $0.12, revenue of $5.19B",https://seekingalpha.com/news/4027398,
