feed,title,long_url,short_url
SeekingAlpha,"EnLink Midstream GAAP EPS of $0.06 misses by $0.07, revenue of $1.75B misses by $300M",https://seekingalpha.com/news/4027449,
SeekingAlpha,"Centerra Gold Non-GAAP EPS of $0.20 beats by $0.04, revenue of $343.9M beats by $16.29M",https://seekingalpha.com/news/4027448,
SeekingAlpha,Taseko Mines says UIC permit for Florence Copper is now effective,https://seekingalpha.com/news/4027447,
SeekingAlpha,"U.S. crude stockpiles rose 1.35M barrels last week, API says",https://seekingalpha.com/news/4027446,
SeekingAlpha,CCD: The Premium Has Finally Deflated (Rating Upgrade),https://seekingalpha.com/article/4645574,
SeekingAlpha,"Starbucks: Weight Loss, China, Margins, And Growth Questions Heading Into Earnings",https://seekingalpha.com/article/4645571,
SeekingAlpha,It's Time To Consider Buying Google,https://seekingalpha.com/article/4645567,
