feed,title,long_url,short_url
Investing,Binance withdrawals and BUSD redemptions surge post Paxos crackdown,https://www.investing.com/news/cryptocurrency-news/binance-withdrawals-and-busd-redemptions-surge-post-paxos-crackdown-3002943,https://da.gd/9EBJON
Investing,U.S. inflation slowed slightly in January - Labor Department,https://www.investing.com/news/economic-indicators/us-inflation-slowed-slightly-in-january--labor-department-3002904,https://da.gd/wjniHM
Investing,"OPEC Sees Oil Market a Bit Tighter on More Demand, Less Supply",https://www.investing.com/news/commodities-news/opec-sees-oil-market-a-bit-tighter-on-more-demand-less-supply-3002937,https://da.gd/8pFbG
Investing,Goldman Sachs sees favorable dynamics for long-term security software investors,https://www.investing.com/news/stock-market-news/goldman-sachs-sees-favorable-dynamics-for-longterm-security-software-investors-432SI-3002939,https://da.gd/zgDc
Investing,"Burger King owner Restaurant Brands falls on EPS miss, promotes Kobza to CEO",https://www.investing.com/news/stock-market-news/burger-king-owner-restaurant-brands-falls-on-eps-miss-promotes-kobza-to-ceo-432SI-3002930,https://da.gd/koEg0
Investing,U.S. consumer prices increase in January; trend slowing,https://www.investing.com/news/economy/us-consumer-prices-increase-in-january-trend-slowing-3002945,https://da.gd/umLrf
Investing,"Argentine teachers, doctors 'drown' under spiraling prices as inflation nears 100%",https://www.investing.com/news/economy/argentine-teachers-doctors-drown-under-spiraling-prices-as-inflation-nears-100-3002958,https://da.gd/fszkb
