feed,title,long_url,short_url
Benzinga,H&R Announces $300MM Private Placement of Senior Unsecured Debentures,https://www.benzinga.com/pressreleases/21/02/n19714565/h-r-announces-300mm-private-placement-of-senior-unsecured-debentures,https://j.mp/3pyR1pg
Benzinga,Norwegian Cruise Line Holdings to Hold Conference Call on Fourth Quarter and Full Year 2020 Financial Results,https://www.benzinga.com/pressreleases/21/02/g19714467/norwegian-cruise-line-holdings-to-hold-conference-call-on-fourth-quarter-and-full-year-2020-financ,https://j.mp/3jZHGWq
Benzinga,Lincoln Electric Board Declares Dividend,https://www.benzinga.com/pressreleases/21/02/g19714465/lincoln-electric-board-declares-dividend,https://j.mp/3aqaZ1c
Benzinga,"Prudential Bancorp, Inc. Announces Declaration of Quarterly Cash Dividend",https://www.benzinga.com/pressreleases/21/02/g19714464/prudential-bancorp-inc-announces-declaration-of-quarterly-cash-dividend,https://j.mp/3u9pI8n
Benzinga,"Shenandoah Telecommunications Company to Hold its Fourth Quarter 2020 Earnings Call at 8:30 a.m. on Thursday, February 25, 2021",https://www.benzinga.com/pressreleases/21/02/g19714463/shenandoah-telecommunications-company-to-hold-its-fourth-quarter-2020-earnings-call-at-8-30-a-m-on,https://j.mp/3rXIoGg
Benzinga,NVIDIA Announces Upcoming Events for Financial Community,https://www.benzinga.com/pressreleases/21/02/g19714460/nvidia-announces-upcoming-events-for-financial-community,https://j.mp/37oHN8T
Benzinga,Emclaire Financial Corp Announces Quarterly Dividend,https://www.benzinga.com/pressreleases/21/02/g19714459/emclaire-financial-corp-announces-quarterly-dividend,https://j.mp/3au5Sgx
Benzinga,"Baytex Conference Call and Webcast on Fourth Quarter and Full Year 2020 Financial and Operating Results to be Held on February 25, 2021",https://www.benzinga.com/pressreleases/21/02/g19714456/baytex-conference-call-and-webcast-on-fourth-quarter-and-full-year-2020-financial-and-operating-re,https://j.mp/2ZrVdfS
