feed,title,long_url,short_url
Benzinga,Will Investors Notice Exciting Sign On United Therapeutics's Chart?,https://benzinga.com/markets/22/06/27649086/will-investors-notice-exciting-sign-on-united-therapeuticss-chart,https://bit.ly/3NJ6r7f
Benzinga,Death Cross Looms Over Hewlett Packard Investors,https://benzinga.com/markets/22/06/27649065/death-cross-looms-over-hewlett-packard-investors,https://bit.ly/3zsF11h
Benzinga,This Foreboding Sign Looms Over Crown Holdings's Chart,https://benzinga.com/markets/22/06/27649052/this-foreboding-sign-looms-over-crown-holdingss-chart,https://bit.ly/3MzLgmV
Benzinga,This Foreboding Sign Looms Over Boston Properties's Chart,https://benzinga.com/markets/22/06/27649047/this-foreboding-sign-looms-over-boston-propertiess-chart,https://bit.ly/3Qejr6A
Benzinga,Will Chart Analysts Notice Bad Omen on Albertsons Companies's Chart,https://benzinga.com/markets/22/06/27649026/will-chart-analysts-notice-bad-omen-on-albertsons-companiess-chart,https://bit.ly/3xDqu1b
