feed,title,long_url,short_url
Benzinga,Here's How Much $100 Invested In Discover Financial 15 Years Ago Would Be Worth Today,https://benzinga.com/news/earnings/22/06/27654209/heres-how-much-100-invested-in-discover-financial-15-years-ago-would-be-worth-today,https://bit.ly/3zwb7ZT
Benzinga,$100 Invested In This Stock 5 Years Ago Would Be Worth $300 Today,https://benzinga.com/news/earnings/22/06/27654208/100-invested-in-this-stock-5-years-ago-would-be-worth-300-today,https://bit.ly/3NIIU6i
Benzinga,What Are Whales Doing With Snowflake,https://benzinga.com/markets/options/22/06/27654238/what-are-whales-doing-with-snowflake,https://bit.ly/3MEdL2z
Benzinga,What Are Whales Doing With Cigna,https://benzinga.com/markets/options/22/06/27654222/what-are-whales-doing-with-cigna,https://bit.ly/3MU9Ij7
Benzinga,Why Polen Capital Sold Starbucks In Q1,https://benzinga.com/general/hedge-funds/22/06/27653762/polen-capital-sold-starbux-heres-why,https://bit.ly/3NFOiav
Benzinga,Virtual Land Just Sold For 2 ETH In The SandBox,https://benzinga.com/markets/cryptocurrency/22/06/27654197/virtual-land-just-sold-for-2-eth-in-the-sandbox,https://bit.ly/3mF5z7T
Benzinga,"Bored Ape #7818 Just Sold For $202,233 In ETH",https://benzinga.com/markets/cryptocurrency/22/06/27654195/bored-ape-7818-just-sold-for-202-233-in-eth,https://bit.ly/3xOrm3v
Benzinga,"Here's Why This Rare CryptoPunk NFT Just Sold For $80,050 In ETH",https://benzinga.com/markets/cryptocurrency/22/06/27654191/heres-why-this-rare-cryptopunk-nft-just-sold-for-80-050-in-eth,https://bit.ly/3O5kWSH
Benzinga,"Here's Why This Rare CryptoPunk NFT Just Sold For $87,634 In ETH",https://benzinga.com/markets/cryptocurrency/22/06/27654190/heres-why-this-rare-cryptopunk-nft-just-sold-for-87-634-in-eth,https://bit.ly/3xp8V3A
