feed,title,long_url,short_url
SeekingAlpha,"Quaker Houghton  EPS beats by $0.36, beats on revenue",https://seekingalpha.com/news/3724490,
SeekingAlpha,"Oasis Midstream Partners EPS beats by $0.05, misses on revenue",https://seekingalpha.com/news/3724489,
SeekingAlpha,"Paycom tops Q2 estimates, raises full-year outlook",https://seekingalpha.com/news/3724488,
SeekingAlpha,"TTEC Holdings EPS beats by $0.30, beats on revenue",https://seekingalpha.com/news/3724486,
SeekingAlpha,"Retail Properties of America FFO beats by $0.06, beats on revenue",https://seekingalpha.com/news/3724485,
SeekingAlpha,"Oasis Petroleum EPS misses by $0.05, beats on revenue",https://seekingalpha.com/news/3724484,
