feed,title,long_url,short_url
Benzinga,PayBito Collaborates with a USA-Based Organization to Offer DeFi Payment Solutions,https://www.benzinga.com/pressreleases/21/01/n19094619/paybito-collaborates-with-a-usa-based-organization-to-offer-defi-payment-solutions,https://j.mp/39jQKk7
Benzinga,"The global market for MRD testing is predicted to grow at a CAGR of 15.64% over the forecast period, 2020-2025",https://www.benzinga.com/pressreleases/21/01/g19094559/the-global-market-for-mrd-testing-is-predicted-to-grow-at-a-cagr-of-15-64-over-the-forecast-period,https://j.mp/3bwxm5Z
Benzinga,Global Scuba Diving Equipment Market to Reach $4.7 Billion by 2027,https://www.benzinga.com/pressreleases/21/01/g19094554/global-scuba-diving-equipment-market-to-reach-4-7-billion-by-2027,https://j.mp/3brlUsh
Benzinga,ZTE Wins the Privacy Strategy Contribution Award from BSI,https://www.benzinga.com/pressreleases/21/01/n19094553/zte-wins-the-privacy-strategy-contribution-award-from-bsi,https://j.mp/35tP72d
Benzinga,ZTE Wins the Privacy Strategy Contribution Award from BSI,https://www.benzinga.com/pressreleases/21/01/n19094552/zte-wins-the-privacy-strategy-contribution-award-from-bsi,https://j.mp/3scOkfI
