feed,title,long_url,short_url
SeekingAlpha,"GasLog EPS beats by $0.20, misses on revenue",https://seekingalpha.com/news/3692142,
SeekingAlpha,"Suburban Propane Partners EPS beats by $0.28, beats on revenue",https://seekingalpha.com/news/3692141,
SeekingAlpha,The Very Good Food inks U.S. distribution agreement with United Natural Foods,https://seekingalpha.com/news/3692140,
SeekingAlpha,"Ranpak Holdings EPS beats by $0.10, beats on revenue",https://seekingalpha.com/news/3692139,
SeekingAlpha,ArcelorMittal racks up 'strongest in a decade' Q1 as steel prices surge,https://seekingalpha.com/news/3692138,
SeekingAlpha,"Kymera Therapeutics EPS misses by $0.14, misses on revenue",https://seekingalpha.com/news/3692137,
SeekingAlpha,Axcella Health EPS beats by $0.01,https://seekingalpha.com/news/3692136,
