feed,title,long_url,short_url
Nasdaq,US STOCKS-Futures flat after jobless claims data; drugmakers extend fall,https://www.nasdaq.com/articles/us-stocks-futures-flat-after-jobless-claims-data-drugmakers-extend-fall-2021-05-06,https://j.mp/33lPOsI
Nasdaq,U.S. natgas futures steady ahead of storage report,https://www.nasdaq.com/articles/u.s.-natgas-futures-steady-ahead-of-storage-report-2021-05-06,https://j.mp/3vKlmET
Nasdaq,"South Korea’s NOFI buys corn in 276,000 tonne tender -trade",https://www.nasdaq.com/articles/south-koreas-nofi-buys-corn-in-276000-tonne-tender-trade-2021-05-06-0,https://j.mp/3f1G1h1
Nasdaq,Oil Prices Slip Despite Big Fall in U.S. Crude Inventories,https://www.nasdaq.com/articles/oil-prices-slip-despite-big-fall-in-u.s.-crude-inventories-2021-05-06,https://j.mp/3eSijni
Nasdaq,Bacanora shares surge after $264.5 mln takeover by Ganfeng Lithium,https://www.nasdaq.com/articles/bacanora-shares-surge-after-%24264.5-mln-takeover-by-ganfeng-lithium-2021-05-06,https://j.mp/3h9SW30
