feed,title,long_url,short_url
Yahoo,Energy Transfer Made $2.4 Billion From Texas Winter Storm,https://finance.yahoo.com/news/energy-transfer-made-2-4-202459131.html,https://yhoo.it/3er4Cg2
Yahoo,AMC Chain Posts $567.2 Million Loss as Film Fans Trickle Back,https://finance.yahoo.com/news/amc-chain-posts-567-2-202634465.html,https://yhoo.it/3vKkOyQ
Yahoo,"Microchip Technology Beats March-Quarter Sales, Earnings Targets",https://www.investors.com/news/technology/mchp-stock-news-microchip-technology-beats-march-quarter-targets/?src=A00220&yptr=yahoo,https://j.mp/2RASNuY
Yahoo,Peloton Erases Gain as Investors Await Revised Forecast,https://finance.yahoo.com/news/peloton-reports-sales-more-double-200429759.html,https://yhoo.it/2R2xX7J
Yahoo,"Groupon found COVID gains from Botox and liposuction, and now sees a recovery for other offers",https://www.marketwatch.com/story/groupon-found-covid-gains-from-botox-and-liposuction-and-now-sees-a-recovery-for-other-offers-11620332258?siteid=yhoof2&yptr=yahoo,https://on.mktw.net/3xQg3pl
