feed,title,long_url,short_url
SeekingAlpha,"Byrna Technologies GAAP EPS of -$0.01 misses by $0.04, revenue of $16.02M misses by $0.34M",https://seekingalpha.com/news/3934192,
SeekingAlpha,"Canopy FQ3 revenue slumps on competition; restructures business, to cut ~60% jobs",https://seekingalpha.com/news/3934188,
SeekingAlpha,BlackRock is bullish on the metaverse: ‘Opportunities are here and now’,https://seekingalpha.com/news/3934163,
SeekingAlpha,"Perella Weinberg Partners Non-GAAP EPS of $0.11 beats by $0.10, revenue of $183.1M beats by $51.68M, $100M share repurchases authorized",https://seekingalpha.com/news/3934191,
SeekingAlpha,"Ralph Lauren Non-GAAP EPS of $3.35 beats by $0.42, revenue of $1.83B beats by $70M",https://seekingalpha.com/news/3934189,
