feed,title,long_url,short_url
Investing,Tether (USDT) Reveals $700M Profit in Last Quarter Despite Crypto Market Turmoil,https://www.investing.com/news/cryptocurrency-news/tether-usdt-reveals-700m-profit-in-last-quarter-despite-crypto-market-turmoil-2999726,https://da.gd/rb4Z0
Investing,AI to feature prominently in the crypto user experience — Nansen CEO,https://www.investing.com/news/cryptocurrency-news/ai-to-feature-prominently-in-the-crypto-user-experience--nansen-ceo-2999725,https://da.gd/e33rQ
Investing,"U.S. demand boosts L'Oreal fourth-quarter sales, China weighs",https://www.investing.com/news/stock-market-news/us-demand-boosts-loreal-fourthquarter-sales-china-weighs-2999729,https://da.gd/0trKV
Investing,"High-tech dashboards, driving assistants vex luxury vehicle owners -study",https://www.investing.com/news/stock-market-news/hightech-dashboards-driving-assistants-vex-luxury-vehicle-owners-study-2999730,https://da.gd/0n7Ov
Investing,"Analysis-Biden team shrugs off polls, targets key voters ahead of 2024 run",https://www.investing.com/news/economy/analysisbiden-team-shrugs-off-polls-targets-key-voters-ahead-of-2024-run-2999732,https://da.gd/FdBJT
