feed,title,long_url,short_url
ETF,Zero Fee ETF Crosses $1B In AUM for First Time,https://www.etf.com/sections/features-and-news/zero-fee-etf-crosses-1b-aum-first-time?utm_source=etfcom&utm_medium=rss&utm_campaign=etfcom-rss,https://da.gd/XCxuJV
ETF,"Ernie Bot, Bard, Others Square Off Against ChatGPT as AI Race Heats Up",https://www.etf.com/sections/features-and-news/ernie-bot-bard-others-square-against-chatgpt-ai-race-heats?utm_source=etfcom&utm_medium=rss&utm_campaign=etfcom-rss,https://da.gd/Zlwy
ETF,SQQQ Inflows Soar as Investors Bet Against Tech,https://www.etf.com/sections/features-and-news/sqqq-inflows-soar-investors-bet-against-tech?utm_source=etfcom&utm_medium=rss&utm_campaign=etfcom-rss,https://da.gd/oWgN
ETF,Currency ETFs Serving as Commodity Proxies,https://www.etf.com/sections/features-and-news/currency-etfs-serving-commodity-proxies?utm_source=etfcom&utm_medium=rss&utm_campaign=etfcom-rss,https://da.gd/6Zq7
ETF,ETFs Concealing Billions of Dollars of Insider Trades,https://www.etf.com/sections/features-and-news/etfs-concealing-billions-dollars-insider-trades?utm_source=etfcom&utm_medium=rss&utm_campaign=etfcom-rss,https://da.gd/IQihO
ETF,"ETF Fund Flows For February 8, 2023",https://www.etf.com/sections/daily-etf-flows/etf-fund-flows-2023-02-08?utm_source=etfcom&utm_medium=rss&utm_campaign=etfcom-rss,https://da.gd/x8bdh
ETF,"ETF League Table as of February 8, 2023",https://www.etf.com/sections/etf-league-tables/etf-league-table-2023-02-08?utm_source=etfcom&utm_medium=rss&utm_campaign=etfcom-rss,https://da.gd/ZoYM9
