feed,title,long_url,short_url
SeekingAlpha,PHI Group and Vietnam-based Saphia Alkali join hands for international market products,https://seekingalpha.com/news/3983561,
SeekingAlpha,General Mills drops after organic sales fall short of expectations,https://seekingalpha.com/news/3983560,
SeekingAlpha,Snowflake rises as Wall Street sees 'favorable' risk-reward after investor day,https://seekingalpha.com/news/3983556,
SeekingAlpha,"Is MoonLake Immunotherapeutics Stock A Buy, Sell, Or Hold After Jumping 100%?",https://seekingalpha.com/article/4614019,
SeekingAlpha,'Macro Drives Everything' Julian Lin And Romil Patel On ZIM Integrated,https://seekingalpha.com/article/4614079,
