feed,title,long_url,short_url
SeekingAlpha,"Juniper Networks EPS in-line, misses on revenue",https://seekingalpha.com/news/3758489,
SeekingAlpha,"Horizon Technology Finance EPS beats by $0.07, beats on revenue",https://seekingalpha.com/news/3758488,
SeekingAlpha,"Fortune Brands Home & Security EPS beats by $0.12, beats on revenue",https://seekingalpha.com/news/3758486,
SeekingAlpha,"STAG Industrial refinances credit facility, unsecured term loan and reprices unsecured debt",https://seekingalpha.com/news/3758487,
SeekingAlpha,"Four Corners Property Trust FFO in-line, misses on revenue",https://seekingalpha.com/news/3758484,
SeekingAlpha,"Nabors EPS misses by $1.73, beats on revenue",https://seekingalpha.com/news/3758483,
