feed,title,long_url,short_url
Investing,Oil falls on demand concerns after Fed signals slower easing ahead,https://www.investing.com/news/commodities-news/oil-falls-on-demand-concerns-after-fed-signals-slower-easing-ahead-3780896,https://da.gd/VPL0
Investing,Oil prices dip as dollar surges on hawkish Fed outlook,https://www.investing.com/news/commodities-news/oil-prices-dip-as-dollar-surges-on-hawkish-fed-outlook-3780887,https://da.gd/yABxYm
Investing,Cocoa futures hit fresh record over Ivory Coast output concerns,https://www.investing.com/news/commodities-news/cocoa-futures-hit-fresh-record-over-ivory-coast-output-concern,https://da.gd/3FDxO
Investing,"Champion Iron jumps on deal with Nippon Steel, Sojitz to develop Kami project",https://www.investing.com/news/stock-market-news/champion-iron-jumps-on-deal-with-nippon-steel-sojitz-to-develop-kami-project-3780890,https://da.gd/grolL
Investing,Warner Bros Discovery names key executives under US Networks business head Channing Dungey,https://www.investing.com/news/stock-market-news/warner-bros-discovery-names-key-executives-under-us-networks-business-head-channing-dungey-3,https://da.gd/baDzO
Investing,Column-Fed's hawkish cut fires up rate hike debate: McGeever,https://www.investing.com/news/economy-news/columnfeds-hawkish-cut-fires-up-rate-hike-debate-mcgeever-3780898,https://da.gd/qTXxTr
