feed,title,long_url,short_url
Yahoo,KPMG hires former SEC acting chief accountant Melissa Rocha,https://finance.yahoo.com/news/kpmg-hires-former-sec-acting-121355834.html,https://da.gd/cLeRX
Yahoo,"Altria tops quarterly profit estimates, flags $873 million NJOY impairment",https://finance.yahoo.com/news/altria-tops-quarterly-profit-estimates-121051606.html,https://da.gd/o2tI1
Yahoo,Dow Jones Futures Rise Ahead Of Key Economic Data; Spotify Plunges On Earnings,https://www.investors.com/market-trend/stock-market-today/dow-jones-sp500-nasdaq-spotify-earnings-spot-stock/?src=A00220&yptr=yahoo,https://da.gd/dXmO
Yahoo,Analyst Report: SAP SE,https://finance.yahoo.com/research/reports/ARGUS_3373_AnalystReport_1745924743000?yptr=yahoo&ncid=yahooproperties_plusresear_nm5q6ze1cei,https://da.gd/z6dAO
Yahoo,1 Growth Stock Down 40% in 2025: Should You Buy It With $100 Right Now?,https://finance.yahoo.com/news/1-growth-stock-down-40-121000587.html,https://da.gd/jtCU8
Yahoo,AICPA responds to draft bill to dissolve PCAOB and shift duties to SEC,https://finance.yahoo.com/news/aicpa-responds-draft-bill-dissolve-120730657.html,https://da.gd/hkx6S
Yahoo,How To Earn $500 A Month From Starbucks Stock Ahead Of Q2 Earnings,https://finance.yahoo.com/news/earn-500-month-starbucks-stock-121225487.html,https://da.gd/B5JUT
Yahoo,Stock-Split Watch: Is Nvidia Next?,https://finance.yahoo.com/news/stock-split-watch-nvidia-next-121100513.html,https://da.gd/nnESM
Yahoo,Analyst Report: Healthpeak Properties Inc,https://finance.yahoo.com/research/reports/ARGUS_3034_AnalystReport_1745924743000?yptr=yahoo&ncid=yahooproperties_plusresear_nm5q6ze1cei,https://da.gd/rPTWe
Yahoo,Stock-Split Watch: Is Nvidia Next?,https://www.fool.com/investing/2025/04/29/stock-split-watch-is-nvidia-next/?.tsrc=rss,https://da.gd/0rFrKb
