feed,title,long_url,short_url
Investing,"Renault, Stellantis' Spain factories resume production after power outage",https://www.investing.com/news/stock-market-news/renault-stellantis-spain-factories-resume-production-after-power-outage-4010590,https://da.gd/cK9f
Investing,JPMorgan is convinced of the long-term opportunity for Qualcomm,https://www.investing.com/news/stock-market-news/jpmorgan-is-convinced-of-the-longterm-opportunity-for-qualcomm-4010554,https://da.gd/QKFZWK
Investing,"Billionaire investor John Paulson sees gold near $5,000 by 2028",https://www.investing.com/news/stock-market-news/billionaire-investor-john-paulson-sees-gold-near-5000-by-2028-4010553,https://da.gd/GFVvxD
Investing,"Volaris downgraded by analysts on macro risks, weak U.S.-Mexico demand",https://www.investing.com/news/stock-market-news/volaris-downgraded-by-analysts-on-macro-risks-weak-usmexico-demand-4010552,https://da.gd/G6Rl2
Investing,"Liberal victory signals policy shift under Carney, says CIBC’s Shenfeld",https://www.investing.com/news/economy-news/liberal-victory-signals-policy-shift-under-carney-says-cibcs-shenfeld-4010568,https://da.gd/25Sdg
