feed,title,long_url,short_url
SeekingAlpha,Meta launches AI model for coding,https://seekingalpha.com/news/4006283,
SeekingAlpha,Akamai acquires enterprise customer contracts from StackPath,https://seekingalpha.com/news/4006286,
SeekingAlpha,Hertz Global eyes expanding electric vehicle fleet into New York City through Revel deal,https://seekingalpha.com/news/4006281,
SeekingAlpha,Google: Undervalued And Positioned To Gain From Economic Strength,https://seekingalpha.com/article/4631075,
SeekingAlpha,Energy Transfer: Potential Energy Trade Of The Decade,https://seekingalpha.com/article/4631051,
