feed,title,long_url,short_url
Benzinga,Frontier Communications 10% Owner Trades $3.22M In Company Stock,https://benzinga.com/news/23/08/34044035/frontier-communications-10-owner-trades-3-22m-in-company-stock,https://da.gd/5BWV
Benzinga,Frontier Communications 10% Owner Trades Company's Stock,https://benzinga.com/news/23/08/34044034/frontier-communications-10-owner-trades-companys-stock,https://da.gd/tr7wXy
Benzinga,10% Owner of Frontier Communications Purchased $3.22M In Stock,https://benzinga.com/news/23/08/34044033/10-owner-of-frontier-communications-purchased-3-22m-in-stock,https://da.gd/hJ2im
Benzinga,Frontier Communications Insider Trades Send a Signal,https://benzinga.com/news/23/08/34044030/frontier-communications-insider-trades-send-a-signal,https://da.gd/Ga63o7
Benzinga,Seer Insider Trades Send a Signal,https://benzinga.com/news/23/08/34044029/seer-insider-trades-send-a-signal,https://da.gd/GUZk
Benzinga,FTAI Infrastructure Board Member Awarded $42K Worth of Stock Options,https://benzinga.com/news/23/08/34044026/ftai-infrastructure-board-member-awarded-42k-worth-of-stock-options,https://da.gd/QyNlMH
Benzinga,Director at FTAI Aviation Exercises Options Worth $457K,https://benzinga.com/news/23/08/34044006/director-at-ftai-aviation-exercises-options-worth-457k,https://da.gd/I1DNHZ
Benzinga,"Choice Hotels Intl Chief Commercial Officer Acquires 2,458 Shares After Exercising Company Stock Options",https://benzinga.com/news/23/08/34044002/choice-hotels-intl-chief-commercial-officer-acquires-2-458-shares-after-exercising-company-stock-opt,https://da.gd/YOQvtI
Benzinga,"Weyco Group VP Acquires 4,500 Shares After Exercising Company Stock Options",https://benzinga.com/news/23/08/34044000/weyco-group-vp-acquires-4-500-shares-after-exercising-company-stock-options,https://da.gd/Lec9K
Benzinga,iBio Chief Financial Officer Awarded $19K Worth of Stock Options,https://benzinga.com/news/23/08/34043999/ibio-chief-financial-officer-awarded-19k-worth-of-stock-options,https://da.gd/n3GxI8
Benzinga,"Amylyx Pharma Chief Financial Officer Acquires 18,165 Shares After Exercising Company Stock Options",https://benzinga.com/news/23/08/34043998/amylyx-pharma-chief-financial-officer-acquires-18-165-shares-after-exercising-company-stock-options,https://da.gd/CLfo
Benzinga,"Fortinet CFO & Chief Accounting Officer Acquires 24,715 Shares After Exercising Company Stock Options",https://benzinga.com/news/23/08/34043995/fortinet-cfo-chief-accounting-officer-acquires-24-715-shares-after-exercising-company-stock-options,https://da.gd/04Efe
Benzinga,Director at Lattice Semiconductor Exercises Options Worth $1.89M,https://benzinga.com/news/23/08/34043992/director-at-lattice-semiconductor-exercises-options-worth-1-89m,https://da.gd/m0Wu
Benzinga,Chief Commercial Officer at West Pharmaceutical Servs Exercises Options Worth $1.35M,https://benzinga.com/news/23/08/34043990/chief-commercial-officer-at-west-pharmaceutical-servs-exercises-options-worth-1-35m,https://da.gd/SJ2wBf
Benzinga,Pennant Gr Chief Operating Officer Awarded $83K Worth of Stock Options,https://benzinga.com/news/23/08/34043983/pennant-gr-chief-operating-officer-awarded-83k-worth-of-stock-options,https://da.gd/yecOzp
