feed,title,long_url,short_url
ETFTrends,A Short Bitcoin ETF Is Becoming a Popular Way To Bet Against Cryptocurrencies,https://www.etftrends.com/crypto-channel/a-short-bitcoin-etf-is-becoming-a-popular-way-to-bet-against-cryptocurrencies/,https://bit.ly/3NSIhqa
ETFTrends,The Advisors Guide to Currency Hedging When the Dollar Is Strong,https://www.etftrends.com/model-portfolio-channel/the-advisors-guide-to-currency-hedging-when-the-dollar-is-strong/,https://bit.ly/3RkcCB8
ETFTrends,Yahoo Finance: Dave Nadig Talks Energy’s Relationship to the Economy,https://www.etftrends.com/energy-infrastructure-channel/yahoo-finance-dave-nadig-talks-energys-relationship-to-the-economy/,https://bit.ly/3yjsR8Q
ETFTrends,Some Could Turn to Tech-Heavy Growth ETFs in a Recession,https://www.etftrends.com/etf-education-channel/some-could-turn-to-tech-heavy-growth-etfs-in-a-recession/,https://bit.ly/3RhRX0g
ETFTrends,The Merits of Equal Weighting by Sector,https://www.etftrends.com/etf-building-blocks-channel/under-the-hood-of-eql-equal-weighting-by-sector/,https://bit.ly/3NKKLH3
ETFTrends,ETF Edge: Todd Rosenbluth on Commodities and Crypto,https://www.etftrends.com/crypto-channel/etf-edge-todd-rosenbluth-on-commodities-and-crypto/,https://bit.ly/3yWnnT3
ETFTrends,Healthcare Sector ETFs Are at the Mercy of Expiring Government Subsidies,https://www.etftrends.com/healthcare-sector-etfs-are-at-the-mercy-of-expiring-government-subsidies/,https://bit.ly/3yMZ2Pq
ETFTrends,Baby Boomers Likely to Underestimate Their Retirement Income Needs,https://www.etftrends.com/retirement-income-channel/baby-boomers-likely-to-underestimate-their-retirement-income-needs/,https://bit.ly/3yN9gPN
