feed,title,long_url,short_url
Benzinga,Cryptocurrency Axie Infinity's Price Increased More Than 3% Within 24 hours,https://benzinga.com/markets/cryptocurrency/22/07/27987438/cryptocurrency-axie-infinitys-price-increased-more-than-3-within-24-hours,https://bit.ly/3Ayhe0s
Benzinga,Cryptocurrency Theta Network's Price Increased More Than 4% Within 24 hours,https://benzinga.com/markets/cryptocurrency/22/07/27987436/cryptocurrency-theta-networks-price-increased-more-than-4-within-24-hours,https://bit.ly/3NRsM1A
Benzinga,Cryptocurrency Internet Computer's Price Increased More Than 8% Within 24 hours,https://benzinga.com/markets/cryptocurrency/22/07/27987434/cryptocurrency-internet-computers-price-increased-more-than-8-within-24-hours,https://bit.ly/3Ijvmwo
Benzinga,Cryptocurrency Chainlink Rises More Than 4% In 24 hours,https://benzinga.com/markets/cryptocurrency/22/07/27987433/cryptocurrency-chainlink-rises-more-than-4-in-24-hours,https://bit.ly/3Az52N0
Benzinga,Dogecoin Up More Than 3% In 24 hours,https://benzinga.com/markets/cryptocurrency/22/07/27987421/cryptocurrency-dogecoin-up-more-than-3-in-24-hours,https://bit.ly/3AunWEE
