feed,title,long_url,short_url
ETFTrends,Michael Arone: How Much Is Bad News Priced Into The Markets?,https://www.etftrends.com/michael-arone-how-much-is-bad-news-priced-into-the-markets/,https://bit.ly/3ymdLPW
ETFTrends,Traders Could Look to VIX ETFs to Hedge Against a Turn for the Worse,https://www.etftrends.com/traders-could-look-to-vix-etfs-to-hedge-against-a-turn-for-the-worse/,https://bit.ly/3NQT7Nv
ETFTrends,Agribusiness ETFs Took a Dive in the Second Quarter,https://www.etftrends.com/agribusiness-etfs-took-a-dive-in-the-second-quarter/,https://bit.ly/3atv4GB
ETFTrends,Bargain Hunters Can Find Some Cheap Picks Among Asia ETFs,https://www.etftrends.com/bargain-hunters-can-find-some-cheap-picks-among-asia-etfs/,https://bit.ly/3atv3m1
ETFTrends,Top Fed Official Supports Three-Quarter Point Rate Increase in July,https://www.etftrends.com/model-portfolio-channel/top-fed-official-supports-three-quarter-point-rate-increase-in-july/,https://bit.ly/3atv49z
ETFTrends,ETF of the Week: KFA Mount Lucas Index Strategy ETF (KMLM),https://www.etftrends.com/etf-of-the-week/etf-of-the-week-kfa-mount-lucas-index-strategy-etf-kmlm/,https://bit.ly/3ysXcl4
ETFTrends,China ETFs Climb as Beijing Throws More Support at the Economy,https://www.etftrends.com/china-etfs-climb-as-beijing-throws-more-support-at-the-economy/,https://bit.ly/3atv2yt
ETFTrends,"Inflation and the Fed’s Response; Too Little, Too Late",https://www.etftrends.com/etf-strategist-channel/inflation-and-the-feds-response-too-little-too-late/,https://bit.ly/3Ri7UUl
ETFTrends,U.K. ETFs Gain After Prime Minister Boris Johnson’s Resignation,https://www.etftrends.com/u-k-etfs-gain-after-prime-minister-boris-johnsons-resignation/,https://bit.ly/3bYQhsw
ETFTrends,Matthews Asia Hires Michael Barrer as Head of ETF Capital Markets,https://www.etftrends.com/matthews-asia-hires-michael-barrer-as-head-of-etf-capital-markets/,https://bit.ly/3NVSjGV
ETFTrends,Weekly Talking Points for Financial Advisors (7/05/2022),https://www.etftrends.com/etf-strategist-channel/weekly-talking-points-for-financial-advisors-7-05-2022/,https://bit.ly/3NVqsqu
ETFTrends,Every Tesla Model In Top 10 Greenest EVs in U.S,https://www.etftrends.com/climate-insights-channel/every-tesla-model-in-top-10-greenest-evs-in-u-s/,https://bit.ly/3RhzT6q
