feed,title,long_url,short_url
Benzinga,DHL Aims To Advance Women In Its Ranks,https://www.benzinga.com/news/20/08/17214903/dhl-aims-to-advance-women-in-its-ranks,https://j.mp/32k90Gt
Benzinga,Why KeyBanc Is Bullish On Pinduoduo Despite Short-Term Challenges,https://www.benzinga.com/analyst-ratings/analyst-color/20/08/17211329/why-keybanc-is-bullish-on-pinduoduo-despite-short-term-challenges,https://j.mp/3aR0OBr
Benzinga,Gulf Freight Markets Brace For Storms – Freightwaves NOW,https://www.benzinga.com/news/20/08/17214907/gulf-freight-markets-brace-for-storms-freightwaves-now,https://j.mp/3aUhXKv
Benzinga,Why Overstock Is Trading Lower Today,https://www.benzinga.com/news/20/08/17215665/why-overstock-is-trading-lower-today,https://j.mp/34tZlzV
Benzinga,Marketing Firm Triples in Size During Pandemic,https://www.benzinga.com/pressreleases/20/08/r17215742/marketing-firm-triples-in-size-during-pandemic,https://j.mp/32owlGP
