feed,title,long_url,short_url
InsiderMonkey,Artisan Mid Cap Fund Exited Lululemon Athletica (LULU) Due To Valuation Discipline,https://insidermonkey.com/blog/--1288093,
InsiderMonkey,Here’s Why Artisan Mid Cap Fund Exited WESCO International (WCC),https://insidermonkey.com/blog/--1288096,
InsiderMonkey,"NeurAxis, Inc. (NASDAQ:NRXS) Q4 2023 Earnings Call Transcript",https://insidermonkey.com/blog/--1288069,
InsiderMonkey,"Delta Air Lines, Inc. (NYSE:DAL) Q1 2024 Earnings Call Transcript",https://insidermonkey.com/blog/--1288071,
InsiderMonkey,"SMART Global Holdings, Inc. (NASDAQ:SGH) Q2 2024 Earnings Call Transcript",https://insidermonkey.com/blog/--1288068,
InsiderMonkey,"Rent the Runway, Inc. (NASDAQ:RENT) Q4 2023 Earnings Call Transcript",https://insidermonkey.com/blog/--1288070,
InsiderMonkey,WD-40 Company (NASDAQ:WDFC) Q2 2024 Earnings Call Transcript,https://insidermonkey.com/blog/--1288067,
InsiderMonkey,"PriceSmart, Inc. (NASDAQ:PSMT) Q2 2024 Earnings Call Transcript",https://insidermonkey.com/blog/--1288065,
InsiderMonkey,Altamira Therapeutics Ltd. (NASDAQ:CYTO) Q4 2023 Earnings Call Transcript,https://insidermonkey.com/blog/--1288072,
InsiderMonkey,"Nauticus Robotics, Inc. (NASDAQ:KITT) Q4 2023 Earnings Call Transcript",https://insidermonkey.com/blog/--1288066,
InsiderMonkey,Artisan Mid Cap Fund Added NVR as Homebuilder Orders Accelerate,https://insidermonkey.com/blog/--1288075,
