feed,title,long_url,short_url
Benzinga,$1000 Invested In Fastenal 20 Years Ago Would Be Worth This Much Today,https://benzinga.com/news/earnings/23/09/34454257/1000-invested-in-fastenal-20-years-ago-would-be-worth-this-much-today,https://da.gd/vPnc
Benzinga,Here's How Much You Would Have Made Owning Caterpillar Stock In The Last 20 Years,https://benzinga.com/news/earnings/23/09/34454221/heres-how-much-you-would-have-made-owning-caterpillar-stock-in-the-last-20-years,https://da.gd/Ljnql
Benzinga,This Is What Whales Are Betting On DocuSign,https://benzinga.com/markets/options/23/09/34454331/this-is-what-whales-are-betting-on-docusign,https://da.gd/oP3TF
Benzinga,Check Out What Whales Are Doing With MRNA,https://benzinga.com/markets/options/23/09/34454328/check-out-what-whales-are-doing-with-mrna,https://da.gd/Htlmtq
Benzinga,Polygon Decreases More Than 3% Within 24 hours,https://benzinga.com/markets/cryptocurrency/23/09/34454287/polygon-decreases-more-than-3-within-24-hours,https://da.gd/cJRua
Benzinga,Toncoin Falls More Than 6% In 24 hours,https://benzinga.com/markets/cryptocurrency/23/09/34454258/toncoin-falls-more-than-6-in-24-hours,https://da.gd/hs7S
Benzinga,Polkadot Decreases More Than 4% Within 24 hours,https://benzinga.com/markets/cryptocurrency/23/09/34454196/polkadot-decreases-more-than-4-within-24-hours,https://da.gd/4lyL7
