feed,title,long_url,short_url
InsiderMonkey,SRK Capital’s Q4 2023 Investor Letter,https://insidermonkey.com/blog/--1262089,
InsiderMonkey,Here’s Why Belden (BDC) Declined in Q4,https://insidermonkey.com/blog/--1262086,
InsiderMonkey,Several Positive Factors Led Dycom Industries (DY) to Outperform in Q4,https://insidermonkey.com/blog/--1262074,
InsiderMonkey,Live Oak Bancshares (LOB): The Top Performer of SouthernSun Small Cap Strategy in Q4,https://insidermonkey.com/blog/--1262065,
InsiderMonkey,SouthernSun Small Cap Strategy’s Q4 2023 Investor Letter,https://insidermonkey.com/blog/--1262062,
