feed,title,long_url,short_url
Investing,Eli Lilly Pushes Tesla Off From the Magnificent 7 - But Can It Stay There?,https://www.investing.com/analysis/eli-lilly-pushes-tesla-off-from-the-magnificent-7--but-can-it-stay-there-200646236,https://da.gd/77ZVVP
Investing,"Garmin Shares Surge on Q4 EPS Beat, Robust FY2024 Outlook",https://www.investing.com/news/stock-market-news/garmin-shares-surge-on-q4-eps-beat-robust-fy2024-outlook-93CH-3309670,https://da.gd/hDF2JG
Investing,"WalkMe earnings beat by $0.04, revenue topped estimates",https://www.investing.com/news/stock-market-news/walkme-earnings-beat-by-004-revenue-topped-estimates-3309668,https://da.gd/bq2cSK
Investing,Ryder opens new Texas logistics hub to bolster US-Mexico trade,https://www.investing.com/news/stock-market-news/ryder-opens-new-texas-logistics-hub-to-bolster-usmexico-trade-93CH-3309656,https://da.gd/eOimNS
Investing,Zimmer Biomet sets quarterly cash dividend for Q1 2024 at $0.24,https://www.investing.com/news/stock-market-news/zimmer-biomet-sets-quarterly-cash-dividend-for-q1-2024-at-024-93CH-3309655,https://da.gd/TujK
Investing,Emergent BioSolutions appoints new CEO to drive growth,https://www.investing.com/news/stock-market-news/emergent-biosolutions-appoints-new-ceo-to-drive-growth-93CH-3309648,https://da.gd/TAt7ad
Investing,Vertiv's FQ4 earnings top estimates but March quarter guidance falls short; shares dip,https://www.investing.com/news/stock-market-news/vertivs-fq4-earnings-top-estimates-but-march-quarter-guidance-falls-short-shares-dip-432SI-3309646,https://da.gd/U2nLn3
Investing,Plug Power Inks Major Deal for EV Facility Hydrogen Solutions,https://www.investing.com/news/stock-market-news/plug-power-inks-major-deal-for-ev-facility-hydrogen-solutions-93CH-3309647,https://da.gd/phctH
Investing,FDA grants priority review for Regeneron's myeloma therapy,https://www.investing.com/news/stock-market-news/fda-grants-priority-review-for-regenerons-myeloma-therapy-93CH-3309645,https://da.gd/UiPA6
Investing,Bio-Path Holdings announces 1-for-20 reverse stock split,https://www.investing.com/news/stock-market-news/biopath-holdings-announces-1for20-reverse-stock-split-93CH-3309640,https://da.gd/VNwKG7
Investing,"Analog Devices earnings beat by $0.02, revenue topped estimates",https://www.investing.com/news/stock-market-news/analog-devices-earnings-beat-by-002-revenue-topped-estimates-3309637,https://da.gd/4hmpD
Investing,"Exclusive-US targets China's top chipmaking plant after Huawei Mate 60 Pro, sources say",https://www.investing.com/news/economy/exclusiveus-targets-chinas-top-chipmaking-plant-after-huawei-mate-60-pro-sources-say-3309654,https://da.gd/lSnmdi
