feed,title,long_url,short_url
SeekingAlpha,New York Mortgage Trust Q4 earnings jump amid lower market volatility,https://seekingalpha.com/news/4069918,
SeekingAlpha,"Vital Energy Non-GAAP EPS of $2.55 beats by $0.09, revenue of $444.52M beats by $3.78M",https://seekingalpha.com/news/4069917,
SeekingAlpha,"TrueBlue Non-GAAP EPS of $0.08 beats by $0.07, revenue of $492M beats by $19.47M",https://seekingalpha.com/news/4069916,
SeekingAlpha,"Avangrid Non-GAAP EPS of $0.97 beats by $0.06, revenue of $2.28B misses by $120M",https://seekingalpha.com/news/4069915,
SeekingAlpha,"Encore Capital GAAP EPS of -$11.40, revenue of $277.4M",https://seekingalpha.com/news/4069914,
SeekingAlpha,"Perdoceo Education Non-GAAP EPS of $0.27 beats by $0.04, revenue of $147.92M beats by $1.72M",https://seekingalpha.com/news/4069913,
SeekingAlpha,Goosehead Insurance announces CEO transition,https://seekingalpha.com/news/4069912,
