feed,title,long_url,short_url
SeekingAlpha,Inseego reports mixed Q4 results; initiates Q1 FY24 outlook,https://seekingalpha.com/news/4069947,
SeekingAlpha,"Chesapeake Utilities Non-GAAP EPS of $1.64 beats by $0.09, revenue of $185.34M misses by $49.26M",https://seekingalpha.com/news/4069946,
SeekingAlpha,"Texas Pacific Land GAAP EPS of $14.73 beats by $2.27, revenue of $166.7M beats by $14.5M",https://seekingalpha.com/news/4069944,
SeekingAlpha,"ONE Gas GAAP EPS of $1.27 in-line, revenue of $605.92M misses by $145.85M",https://seekingalpha.com/news/4069945,
SeekingAlpha,Occidental Petroleum: Valuation Premium To Peers Not Justified,https://seekingalpha.com/article/4672121,
