feed,title,long_url,short_url
SeekingAlpha,Trilogy Metals: Ambler Access Draft SEIS Expected In Q2 2023,https://seekingalpha.com/article/4545245,
SeekingAlpha,"Vestas Wind Systems: Wind Is Not Going Away, Contrarian Opportunity",https://seekingalpha.com/article/4545244,
SeekingAlpha,WuXi Biologics: Geopolitical Risks Draw Investors' Attention,https://seekingalpha.com/article/4545243,
SeekingAlpha,Thyssenkrupp Trades At Discount Multiple Due To Questionable Outlook,https://seekingalpha.com/article/4544575,
SeekingAlpha,"Tilray Earnings: Misses All Around, But Does It Matter? Probably Not",https://seekingalpha.com/article/4545242,
