feed,title,long_url,short_url
Investing,U.S. Initial Jobless Claims Edged Down to 250k Last Week,https://investing.com/news/-2875728,
Investing,Bluebird Bio Extends Rally as Analysts Reflect Positively on Zynteglo Approval,https://investing.com/news/-2875780,
Investing,Google employees petition bosses for abortion policy changes,https://investing.com/news/-2875786,
Investing,CFRA Raises Estimates on Tesla as Inflation Bill Cuts Competition,https://investing.com/news/-2875771,
Investing,"Pre-Open Movers: Bed Bath Falls as Cohen Files to Sell, Kohl's Lower Following EPS",https://investing.com/news/-2875785,
