feed,title,long_url,short_url
Benzinga,"$100 Invested In This Stock 10 Years Ago Would Be Worth $1,500 Today",https://benzinga.com/news/earnings/22/08/28552351/100-invested-in-this-stock-10-years-ago-would-be-worth-1-500-today,https://bit.ly/3pz02kt
Benzinga,$100 Invested In Estee Lauder 20 Years Ago Would Be Worth This Much Today,https://benzinga.com/news/earnings/22/08/28552352/100-invested-in-estee-lauder-cos-20-years-ago-would-be-worth-this-much-today,https://bit.ly/3PzCUgz
Benzinga,Moderna Whale Trades Spotted,https://benzinga.com/markets/options/22/08/28552302/moderna-whale-trades-spotted,https://bit.ly/3pqjSyq
Benzinga,Apple Whale Trades Spotted,https://benzinga.com/markets/options/22/08/28552312/apple-whale-trades-spotted,https://bit.ly/3QXunFn
Benzinga,This Is What Whales Are Betting On ASML Holding,https://benzinga.com/markets/options/22/08/28552320/this-is-what-whales-are-betting-on-asml-holding,https://bit.ly/3QU6P48
