feed,title,long_url,short_url
Investing,Earnings call: F.N.B. Corporation posts record earnings and stable deposits,https://www.investing.com/news/stock-market-news/earnings-call-fnb-corporation-posts-record-earnings-and-stable-deposits-93CH-3280144,https://da.gd/RXfMuB
Investing,Earnings call: Fifth Third Bancorp posts record revenue in Q4 2023,https://www.investing.com/news/stock-market-news/earnings-call-fifth-third-bancorp-posts-record-revenue-in-q4-2023-93CH-3280143,https://da.gd/PX6q5
Investing,Earnings call: Comerica Outlines Strategic Actions Amidst 2023 Challenges,https://www.investing.com/news/stock-market-news/earnings-call-comerica-outlines-strategic-actions-amidst-2023-challenges-93CH-3280142,https://da.gd/iwiye
Investing,"Earnings call: PPG reports record sales, optimistic 2024 outlook",https://www.investing.com/news/stock-market-news/earnings-call-ppg-reports-record-sales-optimistic-2024-outlook-93CH-3280141,https://da.gd/ZKsz
Investing,"Brown & Brown's Q4 profit jumps on robust growth in fee, investment income",https://www.investing.com/news/stock-market-news/brown--browns-q4-profit-jumps-on-robust-growth-in-fee-investment-income-3280140,https://da.gd/AiNm6
