feed,title,long_url,short_url
Investing,ETH ETF Next? Seasoned VC Vance Spencer Shares His Views,https://www.investing.com/news/cryptocurrency-news/eth-etf-next-seasoned-vc-vance-spencer-shares-his-views-3280986,https://da.gd/qNpZa
Investing,Ethereum (ETH) Staking Ratio Surprisingly Keeps Surging Despite Shapella,https://www.investing.com/news/cryptocurrency-news/ethereum-eth-staking-ratio-surprisingly-keeps-surging-despite-shapella-3280985,https://da.gd/SUh4VY
Investing,"BlackRock's Updated Bitcoin (BTC) Holdings Uncovered, Hold on Tight",https://www.investing.com/news/cryptocurrency-news/blackrocks-updated-bitcoin-btc-holdings-uncovered-hold-on-tight-3280984,https://da.gd/a6DUkg
Investing,"Binance Issues Important Notice for BTC, XRP, ADA Futures Traders: Details",https://www.investing.com/news/cryptocurrency-news/binance-issues-important-notice-for-btc-xrp-ada-futures-traders-details-3280983,https://da.gd/fjYbq
Investing,Bitcoin Might Explode as Weekly Golden Cross Forms: Details,https://www.investing.com/news/cryptocurrency-news/bitcoin-might-explode-as-weekly-golden-cross-forms-details-3280982,https://da.gd/r0QK0
Investing,Most of Approved Spot Bitcoin ETFs Will Not Make It: Grayscale CEO,https://www.investing.com/news/cryptocurrency-news/most-of-approved-spot-bitcoin-etfs-will-not-make-it-grayscale-ceo-3280981,https://da.gd/1aYdOy
Investing,"XRP to Crash to Virtual Zero Against Bitcoin, Predicts Max Keiser",https://www.investing.com/news/cryptocurrency-news/xrp-to-crash-to-virtual-zero-against-bitcoin-predicts-max-keiser-3280980,https://da.gd/13EYvI
Investing,"Grayscale Dumps $2.14 Billion in BTC, Ripple CLO Exposes Major Misconduct in Coinbase v. SEC Case, Gemini's Cryptic XRP Posts Stir Community: Crypto News Digest by U.Today",https://www.investing.com/news/cryptocurrency-news/grayscale-dumps-214-billion-in-btc-ripple-clo-exposes-major-misconduct-in-coinbase-v-sec-case-geminis-cryptic-xrp-posts-stir-community-crypto-news-digest-by-utoday-3280979,https://da.gd/d1HRo
Investing,Biden to court support of auto workers at UAW event,https://www.investing.com/news/stock-market-news/biden-to-court-support-of-auto-workers-at-uaw-event-3280975,https://da.gd/zGxxK
Investing,Piper Sandler to announce Q4 and full-year 2023 earnings on Feb 2,https://www.investing.com/news/stock-market-news/piper-sandler-to-announce-q4-and-fullyear-2023-earnings-on-feb-2-93CH-3280974,https://da.gd/ICkIx4
Investing,Apple Car launch delayed to 2028 - report,https://www.investing.com/news/stock-market-news/apple-car-launch-delayed-to-2028--report-432SI-3280973,https://da.gd/jNq34
Investing,Fitch forecasts weakened economic outlook for Latin America in 2024,https://www.investing.com/news/economic-indicators/fitch-forecasts-weakened-economic-outlook-for-latin-america-in-2024-3280987,https://da.gd/WJpHj
