feed,title,long_url,short_url
InsiderMonkey,ARM Holdings (ARM) Launches AI Storytelling Platform,https://insidermonkey.com/blog/--1392252,
InsiderMonkey,Jones Lang LaSalle (JLL)’s AI Data Center Boom: Surpassing Earnings Expectations and Market Projections,https://insidermonkey.com/blog/--1392248,
InsiderMonkey,"Tetra Tech, Inc (TTEK)’s Strategic Moves Amid AI Surge: Analyst Insights and Market Reactions",https://insidermonkey.com/blog/--1392247,
InsiderMonkey,Taiwan Semiconductor Manufacturing Company (TSM) Faces Market Uncertainty Despite $6.6 Billion CHIPS Act Boost,https://insidermonkey.com/blog/--1392256,
InsiderMonkey,Meta Platforms (META) Faces New Rival as Rokid Unveils AI-Enhanced Smart Glasses,https://insidermonkey.com/blog/--1392257,
InsiderMonkey,NVIDIA Corp. (NVDA) Poised for Growth with AI Demand and Analyst Upgrades,https://insidermonkey.com/blog/--1392261,
InsiderMonkey,Amazon.com (AMZN) Enhances Fire Tablets with Cutting-Edge AI Features,https://insidermonkey.com/blog/--1392258,
InsiderMonkey,Delcath Systems Stock (NASDAQ:DCTH) Among the Best Multibagger Stock to Buy Heading into 2025,https://insidermonkey.com/blog/--1392344,
