feed,title,long_url,short_url
SeekingAlpha,"Entegris Non-GAAP EPS of $1.00 misses by $0.05, revenue of $692.49M beats by $26.59M",https://seekingalpha.com/news/3864447,
SeekingAlpha,"Syneos Health Non-GAAP EPS of $1.25 beats by $0.06, revenue of $1.36B misses by $30M",https://seekingalpha.com/news/3864446,
SeekingAlpha,"Air Canada GAAP EPS of -C$1.60, revenue of C$3.98B; reaffirms FY22 EBITDA margin guidance",https://seekingalpha.com/news/3864445,
SeekingAlpha,AbbVie to pay $40M upfront to Sosei under pact to develop drugs for neurological diseases,https://seekingalpha.com/news/3864442,
SeekingAlpha,"Atkore International Non-GAAP EPS of $6.07 beats by $0.85, revenue of $1.06B beats by $50M",https://seekingalpha.com/news/3864444,
SeekingAlpha,"GEO Group exceeds Q2 consensus, raises FY2022 outlook",https://seekingalpha.com/news/3864443,
