feed,title,long_url,short_url
SeekingAlpha,"Sprott GAAP EPS of $0.03, revenue of $25.08M",https://seekingalpha.com/news/3864534,
SeekingAlpha,"Pinterest surges 20% as Elliott moves in, Susquehanna upgrades, citing new catalysts",https://seekingalpha.com/news/3864533,
SeekingAlpha,"LGI Homes GAAP EPS of $5.20 beats by $0.96, revenue of $723.07M beats by $7.42M",https://seekingalpha.com/news/3864532,
SeekingAlpha,"WEC Energy GAAP EPS of $0.91 beats by $0.06, revenue of $2.13B beats by $370M, raises FY earning guidance",https://seekingalpha.com/news/3864530,
SeekingAlpha,"Oatly GAAP EPS of -$0.12 beats by $0.02, revenue of $177.96M misses by $5.56M",https://seekingalpha.com/news/3864529,
SeekingAlpha,DuPont tops Q2 earnings estimates but sees 'slightly weaker' Q3 sales,https://seekingalpha.com/news/3864531,
SeekingAlpha,Charah Solutions secures multiple contracts from Southeast U.S. utilities,https://seekingalpha.com/news/3864528,
