feed,title,long_url,short_url
SeekingAlpha,CareTrust REIT extends secured loan on California skilled nursing facilities,https://seekingalpha.com/news/3864574,
SeekingAlpha,Orthofix inks licensing deal with CGBio for bone graft product Novosis,https://seekingalpha.com/news/3864572,
SeekingAlpha,"IPG Photonics GAAP EPS of $1.10 misses by $0.04, revenue of $377M beats by $3.74M",https://seekingalpha.com/news/3864573,
SeekingAlpha,"Koninklijke DSM N.V. Non-GAAP EPS of €1.89, revenue of €4.11B misses by €1.11B",https://seekingalpha.com/news/3864571,
SeekingAlpha,"Illinois Tool Works GAAP EPS of $2.37 beats by $0.15, revenue of $4B beats by $20M",https://seekingalpha.com/news/3864570,
