feed,title,long_url,short_url
SeekingAlpha,"Ascendas Real Estate Investment Trust 1H amount available for distribution, revenue up",https://seekingalpha.com/news/3864635,
SeekingAlpha,WSP to acquire Capita's Capita REI and GL Hearn Businesses in UK,https://seekingalpha.com/news/3864634,
SeekingAlpha,"Red Light Holland  GAAP EPS of C$0.04, revenue of C$2.3M",https://seekingalpha.com/news/3864633,
SeekingAlpha,Astellas Pharma announces new medical chief,https://seekingalpha.com/news/3864632,
SeekingAlpha,"Gatekeeper Systems GAAP EPS of $0.00, revenue of $4.39M",https://seekingalpha.com/news/3864631,
