feed,title,long_url,short_url
ETFTrends,Post-Rate Hike Depression Pulls This Leveraged ETF Higher,https://www.etftrends.com/leveraged-inverse-channel/post-rate-hike-depression-pulls-this-leveraged-etf-higher/,https://bit.ly/388vwZO
ETFTrends,Which FlexShares ETFs Were the Most Popular in April?,https://www.etftrends.com/multi-asset-channel/which-flexshares-etfs-were-the-most-popular-in-april/,https://bit.ly/3LRBeOd
ETFTrends,Advisors Prefer Active Management for Fixed Income,https://www.etftrends.com/active-etf-channel/advisors-prefer-active-management-for-fixed-income-investments/,https://bit.ly/3vRIBQr
ETFTrends,Grayscale Files Form 10s on 3 Crypto Trusts,https://www.etftrends.com/crypto-channel/grayscale-files-form-10s-on-three-crypto-trusts/,https://bit.ly/3KLMaeV
ETFTrends,RSPE: Right Idea for ESG Ratings Clarity,https://www.etftrends.com/portfolio-strategies-channel/rspe-right-idea-for-esg-ratings-clarity/,https://bit.ly/3vQ1RNZ
ETFTrends,These 2 ETFs Offer Diversified Exposure to the Crypto Industry,https://www.etftrends.com/crypto-channel/these-2-etfs-offer-diversified-exposure-to-the-crypto-industry/,https://bit.ly/3w90j0G
ETFTrends,Battered Biotech Space Now Unbelievably Inexpensive,https://www.etftrends.com/nasdaq-portfolio-solutions-channel/battered-biotech-space-now-unbelievably-inexpensive/,https://bit.ly/3FleSCs
ETFTrends,Electric Vehicle Investing Isn’t Just About Auto Stocks,https://www.etftrends.com/etf-education-channel/electric-vehicle-investing-isnt-just-about-auto-stocks/,https://bit.ly/3kPuJzQ
ETFTrends,GRNB: An ETF to Consider for Climate-Focused Investors,https://www.etftrends.com/tactical-allocation-channel/grnb-an-etf-to-consider-for-climate-focused-investors/,https://bit.ly/3ygpbWZ
ETFTrends,Brazil Internet Opportunity Beckons With FMQQ,https://www.etftrends.com/emerging-markets-channel/brazil-internet-opportunity-beckons-with-fmqq/,https://bit.ly/3MYM0Cm
ETFTrends,Disruptive Growth Will Have Its Day Again,https://www.etftrends.com/disruptive-technology-channel/disruptive-growth-will-have-its-day-again/,https://bit.ly/3LWy5Ne
