feed,title,long_url,short_url
SeekingAlpha,Vanguard Intermediate-Term Corporate Bond ETF declares monthly distribution of $0.1951,https://seekingalpha.com/news/3618525,
SeekingAlpha,Vanguard Short-Term Corporate Bond ETF declares monthly distribution of $0.1410,https://seekingalpha.com/news/3618524,
SeekingAlpha,Vanguard Long-Term Treasury ETF declares monthly distribution of $0.1345,https://seekingalpha.com/news/3618523,
SeekingAlpha,Vanguard Intermediate-Term Treasury ETF declares monthly distribution of $0.0755,https://seekingalpha.com/news/3618522,
SeekingAlpha,Vanguard Short-Term Treasury ETF declares monthly distribution of $0.0403,https://seekingalpha.com/news/3618521,
SeekingAlpha,Vanguard Total World Bond ETF declares monthly distribution of $0.0994,https://seekingalpha.com/news/3618520,
