feed,title,long_url,short_url
Investing,"Exclusive-Shell slows investments in offshore wind, splits power business",https://www.investing.com/news/stock-market-news/exclusiveshell-slows-investments-in-offshore-wind-splits-power-business-3754486,https://da.gd/3v28pp
Investing,Turkey stocks higher at close of trade; BIST 100 up 0.60%,https://www.investing.com/news/stock-market-news/turkey-stocks-higher-at-close-of-trade-bist-100-up-060-3754447,https://da.gd/BNumK
Investing,"Salesforce, Servicenow lead Wednesday's market cap stock movers",https://www.investing.com/news/stock-market-news/salesforce-servicenow-lead-wednesdays-market-cap-stock-movers-93CH-3754438,https://da.gd/IcGJTr
Investing,BofA sees modest Nifty growth in 2025,https://www.investing.com/news/stock-market-news/bofa-sees-modest-nifty-growth-in-2025-3754432,https://da.gd/EDxFJ
Investing,NexGen Energy shares rise on new US uranium sales deals,https://www.investing.com/news/stock-market-news/nexgen-energy-shares-rise-on-new-us-uranium-sales-deals-93CH-3754428,https://da.gd/6xen
Investing,Significant drop in EIA crude oil inventories signals bullish trend for crude prices,https://www.investing.com/news/economic-indicators/significant-drop-in-eia-crude-oil-inventories-signals-bullish-trend-for-crude-prices-93CH-3754434,https://da.gd/C4bgI
Investing,US factory orders rise marginally in October,https://www.investing.com/news/economic-indicators/us-factory-orders-rise-marginally-in-october-3754425,https://da.gd/Yu2Q
Investing,"Macron aims to install new French PM quickly if government falls, sources say",https://www.investing.com/news/economy-news/macron-aims-to-install-new-french-pm-quickly-if-government-falls-sources-say-3754477,https://da.gd/KdUP2Z
