feed,title,long_url,short_url
InsiderMonkey,15 AI News That You Should Not Miss,https://insidermonkey.com/blog/--1401886,
InsiderMonkey,Jim Cramer on Dow Inc. (DOW): ‘It Is Worthwhile Speculation’,https://insidermonkey.com/blog/--1402415,
InsiderMonkey,"Jim Cramer on Recursion Pharmaceuticals, Inc. (RXRX): ‘It Is Worthwhile Speculation’",https://insidermonkey.com/blog/--1402408,
InsiderMonkey,"Jim Cramer on Red Cat Holdings, Inc. (RCAT): ‘I Don’t Want To Bet That It’s Going To Go Up A Thousand Percent’",https://insidermonkey.com/blog/--1402396,
InsiderMonkey,"Analog Devices, Inc. (ADI): Close to Becoming a Dividend Aristocrat",https://insidermonkey.com/blog/--1401497,
InsiderMonkey,Jim Cramer’s Lightning Round: 7 Stocks to Watch,https://insidermonkey.com/blog/--1402334,
