feed,title,long_url,short_url
Benzinga,Citigroup Whale Trades For December 21,https://benzinga.com/markets/options/21/12/24720681/citigroup-whale-trades-for-december-21,https://j.mp/3ecwhQT
Benzinga,Ford Motor Whale Trades Spotted,https://benzinga.com/markets/options/21/12/24720672/ford-motor-whale-trades-spotted,https://j.mp/3yOw6oD
Benzinga,What Are Whales Doing With United Airlines Holdings,https://benzinga.com/markets/options/21/12/24720395/what-are-whales-doing-with-united-airlines-holdings,https://j.mp/3pgiQWr
Benzinga,GameStop Whale Trades Spotted,https://benzinga.com/markets/options/21/12/24720383/gamestop-whale-trades-spotted,https://j.mp/3spl33K
Benzinga,Booking Holdings Whale Trades For December 21,https://benzinga.com/markets/options/21/12/24720171/booking-holdings-whale-trades-for-december-21,https://j.mp/3FhX4HF
Benzinga,Check Out What Whales Are Doing With COIN,https://benzinga.com/markets/options/21/12/24720162/check-out-what-whales-are-doing-with-coin,https://j.mp/3miRMUL
Benzinga,Apple Whale Trades Spotted,https://benzinga.com/markets/options/21/12/24720071/apple-whale-trades-spotted,https://j.mp/3pePfN1
Benzinga,Looking At PayPal Holdings's Recent Whale Trades,https://benzinga.com/markets/options/21/12/24720068/looking-at-paypal-holdingss-recent-whale-trades,https://j.mp/3qiK2De
Benzinga,This Is What Whales Are Betting On Novavax,https://benzinga.com/markets/options/21/12/24719881/this-is-what-whales-are-betting-on-novavax,https://j.mp/3pf6TAd
Benzinga,Rivian Automotive Whale Trades For December 21,https://benzinga.com/markets/options/21/12/24719873/rivian-automotive-whale-trades-for-december-21,https://j.mp/3spl1ZG
Benzinga,Ominous Death Cross Forms On TransDigm Gr's Chart,https://benzinga.com/markets/21/12/24719540/ominous-death-cross-forms-on-transdigm-grs-chart,https://j.mp/3stzqUP
Benzinga,A Bullish Sign Appears On Constellation Brands's Chart,https://benzinga.com/markets/21/12/24719531/a-bullish-sign-appears-on-constellation-brandss-chart,https://j.mp/3FxBBdX
Benzinga,Hopeful Golden Cross Forms On Canadian Pacific Railway's Chart,https://benzinga.com/markets/21/12/24719528/hopeful-golden-cross-forms-on-canadian-pacific-railways-chart,https://j.mp/3FkD32X
Benzinga,Will Chart Analysts Notice Bad Omen on Capital One Financial's Chart,https://benzinga.com/markets/21/12/24719521/will-chart-analysts-notice-bad-omen-on-capital-one-financials-chart,https://j.mp/3pf6T3b
