feed,title,long_url,short_url
SeekingAlpha,Fidelity Sustainable High Yield ETF declares monthly distribution of $0.2590,https://seekingalpha.com/news/4145241,
SeekingAlpha,Fidelity Sustainable Core Plus Bond ETF declares monthly distribution of $0.1780,https://seekingalpha.com/news/4145240,
SeekingAlpha,Fidelity Preferred Securities & Income ETF declares monthly distribution of $0.0880,https://seekingalpha.com/news/4145239,
SeekingAlpha,Fidelity Low Duration Bond Factor ETF declares monthly distribution of $0.2410,https://seekingalpha.com/news/4145237,
SeekingAlpha,Fidelity Limited Term Bond ETF declares monthly distribution of $0.1730,https://seekingalpha.com/news/4145236,
