feed,title,long_url,short_url
InvestorPlace,Is Moderna the Next Gilead or the Next Regeneron?,https://investorplace.com/2022/02/mrna-stock-is-moderna-the-next-gilead-or-the-next-regeneron/,https://bit.ly/3sViW6I
InvestorPlace,Cenntro Electric Stock May Be Worth the Risk After This Massive Selloff,https://investorplace.com/2022/02/cenn-stock-may-be-worth-the-risk-after-this-massive-selloff/,https://bit.ly/3H3PcJK
InvestorPlace,Post-SPAC Black Rifle Coffee Stock Needs Some Time to Percolate,https://investorplace.com/2022/02/purpose-and-fanbase-give-brcc-stock-its-early-potential/,https://bit.ly/3H6fwmt
InvestorPlace,Roblox Stock Looks a Lot Better By the Numbers Than You Might Think,https://investorplace.com/2022/02/rblx-stock-looks-a-lot-better-by-the-numbers-than-you-might-think/,https://bit.ly/3Ic7f1O
InvestorPlace,Rivian Automotive Is Finally at a Price Investors Can Take Seriously,https://investorplace.com/2022/02/rivn-stock-is-finally-at-a-price-investors-can-take-seriously/,https://bit.ly/36BcgmN
InvestorPlace,Vinco Ventures  Stock Looks Scary as It Continues Its Acquisition Plans,https://investorplace.com/2022/02/bbig-stock-looks-scary-as-it-continues-its-acquisition-plans/,https://bit.ly/33Es2Mj
InvestorPlace,Strong Balance Sheet Makes PayPal Stock a Hard-to-Resist Holding,https://investorplace.com/2022/02/strong-balance-sheet-makes-pypl-stock-a-hard-to-resist-holding/,https://bit.ly/35jYPXm
InvestorPlace,Roblox Is a Metaverse Stock That You Genuinely Shouldn’t Miss,https://investorplace.com/2022/02/rblx-is-a-metaverse-stock-that-you-genuinely-shouldnt-miss/,https://bit.ly/36wzZ7v
InvestorPlace,3 Stocks to Buy as Investors Double Down on Digital Health,https://investorplace.com/2022/02/3-digital-health-stocks-to-buy-as-investors-double-down-tdoc-bfly-mdt-edoc/,https://bit.ly/3BIA5EI
InvestorPlace,Snap Stock Is Set to Go After a Splendid Earnings Report,https://investorplace.com/2022/02/snap-stock-is-set-to-go-after-a-splendid-earnings-report/,https://bit.ly/3s8EvRV
