feed,title,long_url,short_url
SeekingAlpha,"EnPro Non-GAAP EPS of $1.23 beats by $0.23, revenue of $280.8M beats by $27.03M; initiates FY22 guidance",https://seekingalpha.com/news/3802314,
SeekingAlpha,Vontier launches $250M in accelerated share repurchase program,https://seekingalpha.com/news/3802313,
SeekingAlpha,"Air Canada expands North American network this summer, strengthens market position",https://seekingalpha.com/news/3802311,
SeekingAlpha,Energy Transfer: Unit Price Should Rise Along With The Distribution,https://seekingalpha.com/article/4488950,
SeekingAlpha,Galapagos: A History Of Disruptive Failures,https://seekingalpha.com/article/4488948,
