feed,title,long_url,short_url
SeekingAlpha,DraftKings slumps after Wells Fargo pulls bull rating,https://seekingalpha.com/news/3802406,
SeekingAlpha,Rocket Mortgage stock slips after Bank of America downgrade to Neutral,https://seekingalpha.com/news/3802405,
SeekingAlpha,Athira Pharma's Alzheimer's therapy ATH-1017 shows promise in phase 1 study,https://seekingalpha.com/news/3802401,
SeekingAlpha,Best and worst stocks sensitive to Russia and Ukraine from J.P. Morgan,https://seekingalpha.com/news/3802362,
SeekingAlpha,Athenex names new CFO,https://seekingalpha.com/news/3802402,
SeekingAlpha,"Kiniksa Pharmaceuticals GAAP EPS of -$0.53 misses by $0.13, revenue of $18.7M beats by $1.12M",https://seekingalpha.com/news/3802400,
