feed,title,long_url,short_url
FXEmpire,U.S. opposes Canada’s digital services tax proposal,https://www.fxempire.com/news/article/u-s-opposes-canadas-digital-services-tax-proposal-907872,https://bit.ly/3H5etmQ
FXEmpire,"Small businesses still struggling financially, Fed survey finds",https://www.fxempire.com/news/article/small-businesses-still-struggling-financially-fed-survey-finds-907874,https://bit.ly/3v9VOUD
FXEmpire,Explainer-How close is Iran to being able to build a nuclear bomb?,https://www.fxempire.com/news/article/explainer-how-close-is-iran-to-being-able-to-build-a-nuclear-bomb-907875,https://bit.ly/3s6B3qV
FXEmpire,Russia says it will evacuate its diplomats from Ukraine,https://www.fxempire.com/news/article/russia-says-it-will-evacuate-its-diplomats-from-ukraine-907879,https://bit.ly/3IfIMc2
FXEmpire,Police in large numbers at Amsterdam Apple Store; broadcaster reports hostage taking,https://www.fxempire.com/news/article/police-in-large-numbers-at-amsterdam-apple-store-broadcaster-reports-hostage-taking-907881,https://bit.ly/3LOq3Xf
