feed,title,long_url,short_url
InvestorPlace,7 Luxury Apparel Stocks That Will Strut Their Way Through 2022,https://investorplace.com/2022/02/7-luxury-apparel-stocks-that-will-strut-their-way-through-2022/,https://bit.ly/35lssaM
InvestorPlace,Snap Stock Remains Rich But Will Its Sustainability Last,https://investorplace.com/2022/02/snap-stock-remains-rich-but-will-its-sustainability-last/,https://bit.ly/3BL0rFR
InvestorPlace,Macy’s Stock Dividend News: How Much Is the M Stock Dividend? When Will It Get Paid Out?,https://investorplace.com/2022/02/macys-stock-dividend-news-how-much-is-the-m-stock-dividend-when-will-it-get-paid-out/,https://bit.ly/36rdu3H
InvestorPlace,Robinhood Is a Fintech Pioneer with Several Problems in Tow,https://investorplace.com/2022/02/hood-stock-is-a-fintech-pioneer-with-several-problems-in-tow/,https://bit.ly/3BVtnvb
InvestorPlace,3 Altcoins to Buy That Can Survive and Thrive Despite a Crypto Crash,https://investorplace.com/2022/02/3-altcoins-to-buy-that-can-survive-and-thrive-despite-a-crypto-crash/,https://bit.ly/35cFLdL
InvestorPlace,Pinterest Stock Is A Pandemic Play That’s Had its Day,https://investorplace.com/2022/02/pins-stock-pandemic-play-thats-had-its-day/,https://bit.ly/3p9PzfQ
