feed,title,long_url,short_url
Benzinga,"Global Abrasive Market Predicted to Surpass $64,873.4 Million, Growing at 6.1% CAGR from 2020 to 2026 - [243 pages] Informative Report by Research Dive",https://www.benzinga.com/pressreleases/21/01/g19202266/global-abrasive-market-predicted-to-surpass-64-873-4-million-growing-at-6-1-cagr-from-2020-to-2026,https://j.mp/2XSnjQQ
Benzinga,"Disclosure Under Chapter 9 Section 5 of the Securities Market Act (BlackRock, Inc.)",https://www.benzinga.com/pressreleases/21/01/tr19202257/disclosure-under-chapter-9-section-5-of-the-securities-market-act-blackrock-inc,https://j.mp/38UjpNJ
Benzinga,"Global Hair Loss Treatment Market to Surpass US$ 5,461.1 Million at a CAGR of 6.2% during 2020-2027, Says Coherent Market Insights (CMI)",https://www.benzinga.com/pressreleases/21/01/b19202262/global-hair-loss-treatment-market-to-surpass-us-5-461-1-million-at-a-cagr-of-6-2-during-2020-2027-,https://j.mp/2XSnk7m
Benzinga,"CJF Launches $10,000 Award for Climate Solutions Reporting",https://www.benzinga.com/pressreleases/21/01/n19202256/cjf-launches-10-000-award-for-climate-solutions-reporting,https://j.mp/2XNtJk2
Benzinga,"Global Cosmetic Packaging Market Outlook Report 2019-2027 with Benchmarking of Key Players Based on Product Portfolio, Geographical Presence, and Strategic Alliances - ResearchAndMarkets.com",https://www.benzinga.com/pressreleases/21/01/b19202255/global-cosmetic-packaging-market-outlook-report-2019-2027-with-benchmarking-of-key-players-based-o,https://j.mp/3sB3VWB
Benzinga,"Auto Catalyst Market Research Report by Type, by Application - Global Forecast to 2025 - Cumulative Impact of COVID-19",https://www.benzinga.com/pressreleases/21/01/g19202253/auto-catalyst-market-research-report-by-type-by-application-global-forecast-to-2025-cumulative-imp,https://j.mp/35Rw41R
Benzinga,United States Clinical Chemistry and Immunoassay In-Vitro Diagnostics Market Report 2020: Serology Assays for COVID-19 Diagnosis Present an Immediate Growth Opportunity,https://www.benzinga.com/pressreleases/21/01/g19202251/united-states-clinical-chemistry-and-immunoassay-in-vitro-diagnostics-market-report-2020-serology-,https://j.mp/2XSnkUU
Benzinga,"Healthcare Artificial Intelligence Market, 2027 - Market is Expected to Grow at a CAGR of 41.4% - ResearchAndMarkets.com",https://www.benzinga.com/pressreleases/21/01/b19202252/healthcare-artificial-intelligence-market-2027-market-is-expected-to-grow-at-a-cagr-of-41-4-resear,https://j.mp/2M2kycK
Benzinga,NAV CANADA reports December traffic figures,https://www.benzinga.com/pressreleases/21/01/g19202247/nav-canada-reports-december-traffic-figures,https://j.mp/39I1OaP
Benzinga,StorageMart Earns Newsweek's Best Customer Service 2021 Award,https://www.benzinga.com/pressreleases/21/01/n19202189/storagemart-earns-newsweeks-best-customer-service-2021-award,https://j.mp/2LWZJQ6
