feed,title,long_url,short_url
Investing,"NFT warranties can help mass adoption of the technology, says Web3 exec",https://www.investing.com/news/cryptocurrency-news/nft-warranties-can-help-mass-adoption-of-the-technology-says-web3-exec-3053764,https://da.gd/Cm9oA
Investing,Three Events Set To Create High Impact On Crypto Today,https://www.investing.com/news/cryptocurrency-news/three-events-set-to-create-high-impact-on-crypto-today-3053746,https://da.gd/DZg1i
Investing,Bank of America: BTC Rally Supported By Hoarding After Surge,https://www.investing.com/news/cryptocurrency-news/bank-of-america-btc-rally-supported-by-hoarding-after-surge-3053744,https://da.gd/j14V
Investing,Validator service to use API for ETH staking process,https://www.investing.com/news/cryptocurrency-news/validator-service-to-use-api-for-eth-staking-process-3053743,https://da.gd/pPmo8
Investing,Amazon's Twitch is worth $45 billion - Needham & Company,https://www.investing.com/news/stock-market-news/amazons-twitch-is-worth-45-billion--needham--company-432SI-3053757,https://da.gd/PYum
Investing,Saudi Arabia stocks higher at close of trade; Tadawul All Share up 0.80%,https://www.investing.com/news/stock-market-news/saudi-arabia-stocks-higher-at-close-of-trade-tadawul-all-share-up-080-3053762,https://da.gd/5O0Be
Investing,"FDIC official blames SVB demise on management failures, says tougher rules are not the answer",https://www.investing.com/news/stock-market-news/fdic-official-blames-svb-demise-on-management-failures-says-tougher-rules-are-not-the-answer-3053758,https://da.gd/8wTjyO
Investing,EU to speed up how regulators tackle failing banks - EU documents,https://www.investing.com/news/stock-market-news/eu-to-speed-up-how-regulators-tackle-failing-banks--eu-documents-3053748,https://da.gd/OU1OzM
Investing,"Bank of Canada sees stronger 2023 growth, indicates recession risk has shrunk",https://www.investing.com/news/economy/bank-of-canada-sees-stronger-2023-growth-indicates-recession-risk-has-shrunk-3053760,https://da.gd/5AmGeY
Investing,NPR to quit Twitter after being labeled as 'state-affiliated media',https://www.investing.com/news/economy/npr-to-quit-twitter-after-being-labeled-as-stateaffiliated-media-3053759,https://da.gd/YsRo
Investing,Euro zone inflation outlook warrants 50 bps hike in May: ECB's Holzmann,https://www.investing.com/news/economy/euro-zone-inflation-outlook-warrants-50-bps-hike-in-may-ecbs-holzmann-3053753,https://da.gd/OmscO
