feed,title,long_url,short_url
SeekingAlpha,"Powell's hawkish remarks send stocks, bonds, bitcoin tumbling",https://seekingalpha.com/news/3775444,
SeekingAlpha,"TDG, HXL and TGI among healthcare movers",https://seekingalpha.com/news/3775443,
SeekingAlpha,"KKR, Wells Fargo seek to expand footprint at Hudson Yards to retain workers - WSJ",https://seekingalpha.com/news/3775440,
SeekingAlpha,NameSilo Technologies reports Q3 results,https://seekingalpha.com/news/3775442,
SeekingAlpha,Air Products Will Continue To Expand,https://seekingalpha.com/article/4472525,
