feed,title,long_url,short_url
SeekingAlpha,"The Brink's EPS beats by $0.45, beats on revenue",https://seekingalpha.com/news/3628032,
SeekingAlpha,"PBF Energy EPS misses by $0.20, beats on revenue",https://seekingalpha.com/news/3628031,
SeekingAlpha,"IDEXX Laboratories EPS beats by $0.31, beats on revenue",https://seekingalpha.com/news/3628030,
SeekingAlpha,"WEX EPS misses by $0.13, misses on revenue",https://seekingalpha.com/news/3628029,
SeekingAlpha,"Carrier Global EPS beats by $0.21, beats on revenue",https://seekingalpha.com/news/3628028,
