feed,title,long_url,short_url
FXEmpire,Israeli forces kill two Palestinians in the West Bank,https://www.fxempire.com/news/article/israeli-forces-kill-two-palestinians-in-the-west-bank-1148106,https://bit.ly/3fBRTKH
FXEmpire,Kremlin prefers ‘balance’ after Putin ally suggests using nuclear bomb in Ukraine,https://www.fxempire.com/news/article/kremlin-prefers-balance-after-putin-ally-suggests-using-nuclear-bomb-in-ukraine-1148095,https://bit.ly/3UXAYlN
FXEmpire,Inflation to put U.S. auto industry in low gear,https://www.fxempire.com/news/article/inflation-to-put-u-s-auto-industry-in-low-gear-1148105,https://bit.ly/3UYpKO4
FXEmpire,Commodity trader Mercuria signs 70.5 billion yen Samurai loan facility,https://www.fxempire.com/news/article/commodity-trader-mercuria-signs-70-5-billion-yen-samurai-loan-facility-1148108,https://bit.ly/3rpxgUx
FXEmpire,Reducing energy waste key to meeting climate goals,https://www.fxempire.com/news/article/reducing-energy-waste-key-to-meeting-climate-goals-1148107,https://bit.ly/3V0Q1uX
FXEmpire,"Nepal coalition to aim for growth if returned to power, finance minister says",https://www.fxempire.com/news/article/nepal-coalition-to-aim-for-growth-if-returned-to-power-finance-minister-says-1148096,https://bit.ly/3V0ElIW
