feed,title,long_url,short_url
SeekingAlpha,Adamis Pharmaceuticals considers sale of company as part of strategic alternatives review,https://seekingalpha.com/news/3888223,
SeekingAlpha,EMA panel approves amending label for Galapagos' Jyseleca on testicular function effects,https://seekingalpha.com/news/3888226,
SeekingAlpha,Lumen Technologies sells ILEC business in 20 states to Brightspeed,https://seekingalpha.com/news/3888225,
SeekingAlpha,Rocket Pharmaceuticals slides over 6% after hours on $100M stock offering,https://seekingalpha.com/news/3888224,
SeekingAlpha,MFS Government Markets Income Trust declines by -90.4% to $0.0217/share,https://seekingalpha.com/news/3888207,
SeekingAlpha,Mosaic says Hurricane Ian could cut phosphate production by 250K tons,https://seekingalpha.com/news/3888227,
