feed,title,long_url,short_url
TheCapital,Bitcoin in Reversal: Temporary correction or start of a new downtrend?,https://medium.com/thecapital/bitcoin-in-reversal-temporary-correction-or-start-of-a-new-downtrend-bd863629e129?source=rss----c4037b4d8519---4,https://da.gd/xoFKj
TheCapital,Altcoin investing: What you need to know,https://medium.com/thecapital/altcoin-investing-what-you-need-to-know-eaecc7b315ee?source=rss----c4037b4d8519---4,https://da.gd/Uriwpp
TheCapital,Metaverse Casino: Experience the Future of Virtual Betting,https://medium.com/thecapital/metaverse-casino-experience-the-future-of-virtual-betting-0620f3f406e8?source=rss----c4037b4d8519---4,https://da.gd/D5ezj
TheCapital,Metaverse Gaming Platforms You Should Explore Today: Best Options for 2025,https://medium.com/thecapital/metaverse-metaverse-gaming-platforms-you-should-explore-today-best-options-for-2025-7e6857cf4e39?source=rss----c4037b4d8519---4,https://da.gd/1pg6V
TheCapital,The Metaverse in 2025: How Virtual Realities Will Ignite an Epic Transformation in Society,https://medium.com/thecapital/the-metaverse-in-2025-how-virtual-realities-will-ignite-an-epic-transformation-in-society-4e5b479a9720?source=rss----c4037b4d8519---4,https://da.gd/jh0YU
