feed,title,long_url,short_url
Investing,U.S. farming businesses want Biden to allow more investment in Cuba,https://www.investing.com/news/commodities-news/us-farming-businesses-want-biden-to-allow-more-investment-in-cuba-3048968,https://da.gd/dZuMQ
Investing,Citi outlines 2 key drivers for ONEOK upgrade,https://www.investing.com/news/stock-market-news/citi-outlines-2-key-drivers-for-oneok-upgrade-432SI-3048970,https://da.gd/Vjgj1
Investing,Deckers Brands lifted at Piper Sandler as UGG and HOKA score well in survey,https://www.investing.com/news/stock-market-news/deckers-brands-lifted-at-piper-sandler-as-ugg-and-hoka-score-well-in-survey-432SI-3048954,https://da.gd/jLaYCT
Investing,Ukraine hopes to get $1.8 billion from IMF in two more tranches in 2023,https://www.investing.com/news/economy/ukraine-hopes-to-get-18-billion-from-imf-in-two-more-tranches-in-2023-3048971,https://da.gd/eduGp
Investing,ECB's Centeno says mortgage default risk in Portugal is low,https://www.investing.com/news/economy/ecbs-centeno-says-mortgage-default-risk-in-portugal-is-low-3048969,https://da.gd/2tsD
