feed,title,long_url,short_url
Investing,"In case you missed it, 7 big dividend hikes: Halliburton, United Rentals",https://www.investing.com/news/stock-market-news/in-case-you-missed-it-7-big-dividend-hikes-halliburton-un,https://da.gd/PvGC6l
Investing,Bed Bath & Beyond likely to file for bankruptcy this week - Reuters,https://www.investing.com/news/stock-market-news/bed-bath--beyond-likely-to-file-for-bankruptcy-this-week--reuters-432SI-2991924,https://da.gd/tk9o
Investing,Explainer-How did a radioactive capsule go missing in Australia and how dangerous is it?,https://www.investing.com/news/stock-market-news/explainerhow-did-a-radioactive-capsule-go-missing-in-australia-and-how-dangerous-is-it-2991920,https://da.gd/7zARZ
Investing,Explainer-Adani vs Hindenburg: What you need to know,https://www.investing.com/news/stock-market-news/explaine,https://da.gd/eLKk
Investing,"Italy's economy contracts by 0.1% in Q4, raising recession fears",https://www.investing.com/news/economic-indicators/italys-economy-contracts-by-01-in-q4-raising-recession-fears-2991926,https://da.gd/wbET
Investing,Sri Lanka's key inflation rate eases to 54.2% in January,https://www.investing.com/news/economy/sri-lankas-key-inflation-rate-eases-to-542-in-january-2991925,https://da.gd/ZYbg
Investing,"Euro zone economy unexpectedly expands in Q4, avoids recession",https://www.investing.com/news/economy/euro-zone-economy-unexpectedly-expands-in-q4-avoids-recession-2991910,https://da.gd/sEeRm8
Investing,"Japan Inc strives to lure skilled workers as inflation, labour crunch bite",https://www.investing.com/news/economy/ja,https://da.gd/r4TQ4
