feed,title,long_url,short_url
FXEmpire,EU commissioner: we don’t want a subsidy war with U.S,https://www.fxempire.com/news/article/eu-commissioner-we-dont-want-a-subsidy-war-with-u-s-1270143,https://da.gd/viy77
FXEmpire,High interest rates to hold back gold’s rally: Reuters poll,https://www.fxempire.com/news/article/high-interest-rates-to-hold-back-golds-rally-reuters-poll-1270141,https://da.gd/dcTMu
FXEmpire,Fed officials see lots of room to shed bonds from balance sheet,https://www.fxempire.com/news/article/fed-officials-see-lots-of-room-to-shed-bonds-from-balance-sheet-1270136,https://da.gd/ML6n6d
FXEmpire,"Parents grieve for three-month old baby, a victim of Afghanistan’s deadly winter",https://www.fxempire.com/news/article/parents-grieve-for-three-month-old-baby-a-victim-of-afghanistans-deadly-winter-1270139,https://da.gd/gnJwZ
FXEmpire,Biden continues infrastructure tour with stop in New York City on Tuesday,https://www.fxempire.com/news/article/biden-continues-infrastructure-tour-with-stop-in-new-york-city-on-tuesday-1270138,https://da.gd/mbzC
