feed,title,long_url,short_url
SeekingAlpha,"Pathfinder GAAP EPS of $0.58, revenue of $13.08M",https://seekingalpha.com/news/3930145,
SeekingAlpha,Taysha falls as FDA seeks additional dosing for CNS disorder candidate,https://seekingalpha.com/news/3930141,
SeekingAlpha,"Northeast Community Bancorp GAAP EPS of $0.54 misses by $0.02, revenue of $21.73M beats by $2.14M",https://seekingalpha.com/news/3930140,
SeekingAlpha,Johnson & Johnson: Starting To Look Interesting Again,https://seekingalpha.com/article/4573999,
SeekingAlpha,"Golar LNG: Natural Gas Export Boom Waning, Bearish Chart Ahead Of Earnings",https://seekingalpha.com/article/4573998,
