feed,title,long_url,short_url
SeekingAlpha,Angel Oak Mortgage participates in $580.5M securitization,https://seekingalpha.com/news/3930189,
SeekingAlpha,"NewMarket GAAP EPS of $9.26, revenue of $682.56M",https://seekingalpha.com/news/3930187,
SeekingAlpha,Vornado Realty Trust expects $600M non-cash impairment charges in Q4,https://seekingalpha.com/news/3930186,
SeekingAlpha,"Meta, Pinterest drop amid fallout from Snap earnings decline",https://seekingalpha.com/news/3930185,
SeekingAlpha,"Ashland Non-GAAP EPS of $0.97 beats by $0.03, revenue of $525M beats by $8.42M",https://seekingalpha.com/news/3930184,
SeekingAlpha,Cannabis vaping and tobacco products vendor Ispire files for $42M IPO,https://seekingalpha.com/news/3930183,
