feed,title,long_url,short_url
Yahoo,Is PayPal Holdings (PYPL) the Best Nancy Pelosi Stock to Invest In Now?,https://finance.yahoo.com/news/paypal-holdings-pypl-best-nancy-213541352.html,https://da.gd/2TbScl
Yahoo,Pentair price target lowered to $95 from $104 at Goldman Sachs,https://finance.yahoo.com/news/pentair-price-target-lowered-95-213105536.html,https://da.gd/T6Dj7
Yahoo,"Alaska Air pulls its 2025 outlook, sees weaker profit in second quarter",https://finance.yahoo.com/news/alaska-air-pulls-2025-outlook-213640295.html,https://da.gd/8Ocka
Yahoo,Is Kingsoft Cloud Holdings (KC) the Best Multibagger Stock to Buy According to Billionaires?,https://finance.yahoo.com/news/kingsoft-cloud-holdings-kc-best-213923881.html,https://da.gd/4IOL4
Yahoo,"Is IonQ, Inc. (IONQ) the Best Multibagger Stock to Buy According to Billionaires?",https://finance.yahoo.com/news/ionq-inc-ionq-best-multibagger-214024721.html,https://da.gd/xEU5lM
Yahoo,"Rocket Lab USA, Inc. (RKLB): One of the Best Multibagger Stocks to Buy According to Billionaires",https://finance.yahoo.com/news/rocket-lab-usa-inc-rklb-214159011.html,https://da.gd/0LfhuA
Yahoo,How your vehicle’s make and model affect car insurance costs,https://finance.yahoo.com/personal-finance/insurance/article/how-make-and-model-affect-car-insurance-costs-214303855.html,https://da.gd/DORUbL
Yahoo,Is Amazon a Better Stock to Buy Right Now Than Costco? The Answer Might Surprise You,https://www.fool.com/investing/2025/04/25/is-amazon-a-better-stock-to-buy-right-now-than-cos/?.tsrc=rss,https://da.gd/CsjRC
