feed,title,long_url,short_url
Investing,Finland stocks higher at close of trade; OMX Helsinki 25 up 0.20%,https://www.investing.com/news/stock-market-news/finland-stocks-higher-at-close-of-trade-omx-helsinki-25-up-020-4005072,https://da.gd/6JleF
Investing,Brazil's Vale sees no material impacts from trade war so far,https://www.investing.com/news/stock-market-news/brazils-vale-sees-no-material-impacts-from-trade-war-so-far-4005068,https://da.gd/A10W
Investing,Barry Callebaut AG ratings affirmed with a negative outlook by S&P Global,https://www.investing.com/news/stock-market-news/barry-callebaut-ag-ratings-affirmed-with-a-negative-outlook-by-sp-global-93CH-4005044,https://da.gd/O8Vg4
Investing,Kirby Corporation's credit rating lifted to Baa2 by Moody's Ratings,https://www.investing.com/news/stock-market-news/kirby-corporations-credit-rating-lifted-to-baa2-by-moodys-ratings-93CH-4005043,https://da.gd/ovfXhy
Investing,Brendan Hanrahan appointed as U.S. State Department's top official for Europe,https://www.investing.com/news/stock-market-news/brendan-hanrahan-appointed-as-us-state-departments-top-official-for-europe-93CH-4005034,https://da.gd/9geH
Investing,Luigi Mangione due in court for arraignment as prosecutors seek death penalty,https://www.investing.com/news/stock-market-news/luigi-mangione-due-in-court-for-arraignment-as-prosecutors-seek-death-penalty-4005016,https://da.gd/zkqlgX
Investing,"IMF's Georgieva says Argentine people to decide election, government should keep reforms",https://www.investing.com/news/economy-news/imfs-georgieva-says-argentine-people-to-decide-election-government-should-keep-reforms-4005071,https://da.gd/Xa53D
Investing,"Trump tariffs likely to push down UK inflation, BoE's Greene says",https://www.investing.com/news/economy-news/trump-tariffs-likely-to-push-down-uk-inflation-boes-greene-says-4005070,https://da.gd/mXKlg
