feed,title,long_url,short_url
SeekingAlpha,"MKS Instruments Q1 EPS, revenue estimates up y/y",https://seekingalpha.com/news/3826287,
SeekingAlpha,"EDRY, WKEY and HPK among mid-day movers",https://seekingalpha.com/news/3826283,
SeekingAlpha,Ford ramps up F-150 Lightning plans with EV pickup seen dominating like the Model T,https://seekingalpha.com/news/3826282,
SeekingAlpha,Lockheed's F-35 at risk of costly fixes - Bloomberg,https://seekingalpha.com/news/3826281,
SeekingAlpha,Twitter legs up 7% to high as $44 million Musk takeover inches closer,https://seekingalpha.com/news/3826280,
