feed,title,long_url,short_url
Investing,Denmark stocks higher at close of trade; OMX Copenhagen 20 up 0.78%,https://investing.com/news/-2534030,
Investing,U.S. House panel to start review of antitrust bills next week,https://investing.com/news/-2534029,
Investing,Croatia's hypercar maker Rimac explores strategic options,https://investing.com/news/-2534028,
Investing,Should You Buy the Dip in Livent Corp.?,https://investing.com/news/-2534027,
Investing,Is FedEx a Good Air Freight Stock to Add to Your Portfolio?,https://investing.com/news/-2534025,
Investing,Morgan Stanley hires senior Credit Suisse dealmaker Weinberger - source,https://investing.com/news/-2534026,
Investing,"After Reporting Earnings, is Marvell Technology a Buy?",https://investing.com/news/-2534024,
