feed,title,long_url,short_url
Benzinga,"Industrial safety Market Size Value Estimated to be Worth USD 10.63 Billion By 2030, at a CAGR of 6.7%: Polaris Market Research",https://benzinga.com/pressreleases/22/11/n29571354/industrial-safety-market-size-value-estimated-to-be-worth-usd-10-63-billion-by-2030-at-a-cagr-of-6,
Benzinga,"Penetration Testing Market to Garner $5.3 Bn, Globally, by 2031 at 13.1% CAGR, Says Allied Market Research",https://benzinga.com/pressreleases/22/11/n29571352/penetration-testing-market-to-garner-5-3-bn-globally-by-2031-at-13-1-cagr-says-allied-market-resea,
Benzinga,"Downstream Processing Market is expected to generate a revenue of USD 60.98 Billion by 2028, Globally, at 16.30% CAGR: Verified Market Research®",https://benzinga.com/pressreleases/22/11/n29571350/downstream-processing-market-is-expected-to-generate-a-revenue-of-usd-60-98-billion-by-2028-global,
Benzinga,With 5.4% of CAGR The Meal Replacement Market Size is Anticipated to Grow US$15.5 billion by 2026 says a Report by MarketsandMarkets™,https://benzinga.com/pressreleases/22/11/g29571339/with-5-4-of-cagr-the-meal-replacement-market-size-is-anticipated-to-grow-us-15-5-billion-by-2026-s,
Benzinga,"Airport Services Market to Touch USD 241.07 Billion by 2030, Capturing a CAGR of 18% - Report by Market Research Future (MRFR)",https://benzinga.com/pressreleases/22/11/g29571338/airport-services-market-to-touch-usd-241-07-billion-by-2030-capturing-a-cagr-of-18-report-by-marke,
