feed,title,long_url,short_url
SeekingAlpha,"Pactiv Evergreen plunges 17% on lower sales, profit; 1,300 job cuts coming",https://seekingalpha.com/news/3945071,
SeekingAlpha,"Zymeworks GAAP EPS of $4.65 beats by $2.16, revenue of $402.49M beats by $188.16M",https://seekingalpha.com/news/3945070,
SeekingAlpha,"Full House Resorts GAAP EPS of -$0.20 misses by $0.09, revenue of $36.08M misses by $3.45M",https://seekingalpha.com/news/3945069,
SeekingAlpha,"BSQUARE GAAP EPS of -$0.06, revenue of $7.96M",https://seekingalpha.com/news/3945064,
SeekingAlpha,Why did Grayscale Bitcoin Trust stock jump up today? SEC's rejection of bitcoin ETF argued,https://seekingalpha.com/news/3945061,
SeekingAlpha,"Maxeon Solar Technologies GAAP EPS of -$1.84 misses by $0.63, revenue of $323.5M beats by $7.8M, FY23 guidance below consensus",https://seekingalpha.com/news/3945060,
