feed,title,long_url,short_url
InsiderMonkey,Here’s What Makes Maximus (MMS) a Great Investment Choice,https://insidermonkey.com/blog/--1044262,
InsiderMonkey,RF Capital: “Sprouts (SFM) Continues to Make Progress Despite Inflation and Supply Chain Constraints”,https://insidermonkey.com/blog/--1044270,
InsiderMonkey,Nordstern Capital: “StoneCo (STNE) is Going to Be a Winner”,https://insidermonkey.com/blog/--1044277,
InsiderMonkey,Here’s What Makes Cameco (CCJ) a Smart Long-Term Investment,https://insidermonkey.com/blog/--1044290,
InsiderMonkey,Here’s Why Aristotle Capital Disposed its Axalta (AXTA) Shares,https://insidermonkey.com/blog/--1044295,
