feed,title,long_url,short_url
SeekingAlpha,Siemens announces flexible working app to return to the office,https://seekingalpha.com/news/3594217,
SeekingAlpha,"First Merchants EPS beats by $0.15, misses on revenue",https://seekingalpha.com/news/3594215,
SeekingAlpha,"Popular EPS beats by $0.57, misses on revenue",https://seekingalpha.com/news/3594214,
SeekingAlpha,"Union Pacific EPS beats by $0.09, misses on revenue",https://seekingalpha.com/news/3594213,
SeekingAlpha,PulteGroup rises 5% as Q2 EPS beats; expects improved conditions in H2,https://seekingalpha.com/news/3594212,
SeekingAlpha,Chevron Scores A Win With Noble Energy,https://seekingalpha.com/article/4360158,
