feed,title,long_url,short_url
SeekingAlpha,II-VI announces public stock offering,https://seekingalpha.com/news/3587330,
SeekingAlpha,Himax to aid Microcontrollers for Google's TensorFlow,https://seekingalpha.com/news/3587315,
SeekingAlpha,CenturyLink bags order from NASA for network connectivity business,https://seekingalpha.com/news/3587329,
SeekingAlpha,"Chip stocks see further momentum thanks to Micron, Xilinx",https://seekingalpha.com/news/3587325,
SeekingAlpha,Cummins details successful patent action against Turbo Lab,https://seekingalpha.com/news/3587328,
SeekingAlpha,Shake Shack announces expansion plans in China,https://seekingalpha.com/news/3587326,
SeekingAlpha,"Zscaler: Great Story, Terrible Price",https://seekingalpha.com/article/4356249,
SeekingAlpha,Air-France KLM: A Political Mess,https://seekingalpha.com/article/4356353,
SeekingAlpha,When Primary Is Secondary,https://seekingalpha.com/article/4356352,
