feed,title,long_url,short_url
Benzinga,Unusual Options Activity Insight: Chewy,https://benzinga.com/markets/options/21/06/21529926/unusual-options-activity-insight-chewy,https://j.mp/35e98ci
Benzinga,Understanding NVIDIA's Unusual Options Activity,https://benzinga.com/markets/options/21/06/21529917/understanding-nvidias-unusual-options-activity,https://j.mp/35anP03
Benzinga,Unusual Options Activity Insight: Amazon.com,https://benzinga.com/markets/options/21/06/21529908/unusual-options-activity-insight-amazon-com,https://j.mp/3iA72vu
Benzinga,Unusual Options Activity Insight: Barrick Gold,https://benzinga.com/markets/options/21/06/21529898/unusual-options-activity-insight-barrick-gold,https://j.mp/3pJh7Ye
Benzinga,Analyzing Ford Motor's Unusual Options Activity,https://benzinga.com/markets/options/21/06/21529897/analyzing-ford-motors-unusual-options-activity,https://j.mp/357mbwi
Benzinga,Unusual Options Activity Insight: General Motors,https://benzinga.com/markets/options/21/06/21529875/unusual-options-activity-insight-general-motors,https://j.mp/3gb6quC
Benzinga,Understanding iShares China Large-Cap ETF's Unusual Options Activity,https://benzinga.com/markets/options/21/06/21529871/understanding-ishares-china-large-cap-etfs-unusual-options-activity,https://j.mp/3cAtnVM
Benzinga,The Differences In Bitcoin And Ethereum Performance Drivers,https://benzinga.com/markets/cryptocurrency/21/06/21530022/the-differences-in-bitcoin-and-ethereum-performance-drivers,https://j.mp/3vfEv0H
Benzinga,Understanding SPDR S&P Regional Banking ETF's Unusual Options Activity,https://benzinga.com/markets/options/21/06/21529864/understanding-spdr-s-p-regional-banking-etfs-unusual-options-activity,https://j.mp/3gewPaL
Benzinga,Analyzing Dropbox's Unusual Options Activity,https://benzinga.com/markets/options/21/06/21529860/analyzing-dropboxs-unusual-options-activity,https://j.mp/3xcGmVw
Benzinga,Understanding iShares Silver Trust's Unusual Options Activity,https://benzinga.com/markets/options/21/06/21529855/understanding-ishares-silver-trusts-unusual-options-activity,https://j.mp/3gfYKr6
