feed,title,long_url,short_url
Nasdaq,BP looks to spin off Iraq operations into standalone company - WSJ,https://www.nasdaq.com/articles/bp-looks-to-spin-off-iraq-operations-into-standalone-company-wsj-2021-06-11,https://j.mp/3cAABZU
Nasdaq,How Much Is Cryptocurrency Mining Influencing Chip Demand,https://www.nasdaq.com/articles/how-much-is-cryptocurrency-mining-influencing-chip-demand-2021-06-11,https://j.mp/3zh5pZo
Nasdaq,June 2022 Options Now Available For The Materials Select Sector SPDR Fund (XLI),https://www.nasdaq.com/articles/june-2022-options-now-available-for-the-materials-select-sector-spdr-fund-xli-2021-06-11,https://j.mp/3gtgOwy
Nasdaq,FactSet Research Systems Breaks Above 200-Day Moving Average - Bullish for FDS,https://www.nasdaq.com/articles/factset-research-systems-breaks-above-200-day-moving-average-bullish-for-fds-2021-06-11,https://j.mp/3xgcbwA
Nasdaq,Amazon raises minimum pay in Germany to 12 euros per hour,https://www.nasdaq.com/articles/amazon-raises-minimum-pay-in-germany-to-12-euros-per-hour-2021-06-11,https://j.mp/3izCeej
Nasdaq,"Got $3,000? 2 Tech Stocks to Buy and Hold for the Long Term",https://www.nasdaq.com/articles/got-%243000-2-tech-stocks-to-buy-and-hold-for-the-long-term-2021-06-11,https://j.mp/2Tq3od6
Nasdaq,"ACWI, XOM, NFLX, CRM: Large Outflows Detected at ETF",https://www.nasdaq.com/articles/acwi-xom-nflx-crm%3A-large-outflows-detected-at-etf-2021-06-11,https://j.mp/3zmZvWu
