feed,title,long_url,short_url
SeekingAlpha,Tilray expands medical cannabis product offering in Australia; shares down 5%,https://seekingalpha.com/news/3791147,
SeekingAlpha,"City Holding GAAP EPS of $1.54 beats by $0.21, revenue of $58.24M beats by $1.68M",https://seekingalpha.com/news/3791146,
SeekingAlpha,Weidai updates ADS-to-share ratio change to 1-to-5 from 1-to-3,https://seekingalpha.com/news/3791145,
SeekingAlpha,"NextEra Energy Partners GAAP EPS of -$0.12 misses by $0.83, revenue of $232M misses by $126.81M",https://seekingalpha.com/news/3791143,
SeekingAlpha,Pfizer and BioNTech launch trial for Omicron-specific COVID-19 shot,https://seekingalpha.com/news/3791142,
