feed,title,long_url,short_url
Investing,"Reddio’s Exclusive Token Generation Event (TGE) and Alpha Trading on Binance Wallet - May 29, 2025",https://www.investing.com/news/cryptocurrency-news/reddios-exclusive-token-generation-event-tge-and-alpha-trading-on-binance-wallet--may-29-2025-4069639,https://da.gd/FIYsWW
Investing,"Tariffs more priced in, but 'Big Beautiful Bill' not as much, warns BofA",https://www.investing.com/news/stock-market-news/tariffs-more-priced-in-but-big-beautiful-bill-not-as-much-warns-bofa-4069664,https://da.gd/n6J5
Investing,"Volkswagen recalls 171,381 vehicles in the U.S. due to rearview camera issues",https://www.investing.com/news/stock-market-news/volkswagen-recalls-171381-vehicles-in-the-us-due-to-rearview-camera-issues-93CH-4069658,https://da.gd/EREM
Investing,Xiaomi's Tesla Y rival YU7 hits showrooms in Beijing,https://www.investing.com/news/stock-market-news/xiaomis-tesla-y-rival-yu7-hits-showrooms-in-beijing-4069642,https://da.gd/GKRQm9
Investing,Taiwan central bank will take 'timely' steps to ensure financial stability,https://www.investing.com/news/economic-indicators/taiwan-central-bank-will-take-timely-steps-to-ensure-financial-stability-4069685,https://da.gd/SUonh
