feed,title,long_url,short_url
Investing,CrowdStrike Stock Slips: Analyst Downgrades Before Earnings,https://www.investing.com/analysis/crowdstrike-stock-slips-analyst-downgrades-before-earnings-200661463,https://da.gd/d970A
Investing,Deutsche Boerse rally shows a European re-rating is underway,https://www.investing.com/news/stock-market-news/deutsche-boerse-rally-shows-a-european-rerating-is-underway-4070274,https://da.gd/vqcPk
Investing,"Germany mulls 10% tax on large online platforms, heightens trade tensions",https://www.investing.com/news/stock-market-news/germany-mulls-10-tax-on-large-online-platforms-heightens-trade-tensions-93CH-4070281,https://da.gd/RrVYF
Investing,"U.S. initial jobless claims rise, exceeding forecast and previous figures",https://www.investing.com/news/economic-indicators/us-initial-jobless-claims-rise-exceeding-forecast-and-previous-figures-93CH-4070331,https://da.gd/t9Wq
Investing,"US Economy Shows Slight Decline with GDP at -0.2%, Beating Forecast",https://www.investing.com/news/economic-indicators/us-economy-shows-slight-decline-with-gdp-at-02-beating-forecast-93CH-4070300,https://da.gd/kWi3A
Investing,ECB to cut rates on June 5 but skip July as end of easing campaign nears: Reuters poll,https://www.investing.com/news/economy-news/ecb-to-cut-rates-on-june-5-but-skip-july-as-end-of-easing-campaign-nears-reuters-poll-4070310,https://da.gd/2WcG6h
Investing,White House adviser anticipates more trade deals despite court ruling,https://www.investing.com/news/economy-news/white-house-adviser-anticipates-more-trade-deals-despite-court-ruling-93CH-4070250,https://da.gd/j4qtj1
Investing,Hungary's banking sector remains strong amid potential stress scenarios,https://www.investing.com/news/economy-news/hungarys-banking-sector-remains-strong-amid-potential-stress-scenarios-93CH-4070244,https://da.gd/RSA9eD
