feed,title,long_url,short_url
Yahoo,Dow Jones Futures Fall As Netflix Dives On Subscriber Guidance; Ugly Market Reversals Teach Painful Lesson,https://www.investors.com/market-trend/stock-market-today/dow-jones-futures-netflix-dives-on-subscriber-guidance-ugly-market-reversals-teach-painful-lesson/?src=A00220&yptr=yahoo,https://bit.ly/3IkQ8uk
Yahoo,Netflix Plunges After Disappointing With Forecast for New Users,https://finance.yahoo.com/news/netflix-plunges-disappointing-forecast-users-215649851.html,https://yhoo.it/3tM1Mui
Yahoo,"Tru Independence Asset Management 2, Llc Buys Vanguard Value ETF, Vanguard Small Cap Value ETF,",https://finance.yahoo.com/news/tru-independence-asset-management-2-223822811.html?.tsrc=rss,https://yhoo.it/3Im2Ngp
Yahoo,"AAFMAA Wealth Management & Trust LLC Buys Caterpillar Inc, Target Corp, PowerShares QQQ",https://finance.yahoo.com/news/aafmaa-wealth-management-trust-llc-223803661.html?.tsrc=rss,https://yhoo.it/3GPFM5o
Yahoo,"Campbell Capital Management Inc Buys Norwegian Cruise Line Holdings, PayPal Holdings Inc,",https://finance.yahoo.com/news/campbell-capital-management-inc-buys-223823528.html?.tsrc=rss,https://yhoo.it/3KwIizs
Yahoo,"Sheets Smith Wealth Management Buys iShares Short-Term National Muni Bond ETF, iShares National",https://finance.yahoo.com/news/sheets-smith-wealth-management-buys-223822113.html?.tsrc=rss,https://yhoo.it/3ruUMyU
Yahoo,"Fusion Family Wealth LLC Buys Invesco BulletShares 2023 Corporate Bond ETF, Tesla Inc, MSCI USA",https://finance.yahoo.com/news/fusion-family-wealth-llc-buys-223820064.html?.tsrc=rss,https://yhoo.it/3GPFLhQ
Yahoo,"Reitz Capital Advisors LLC Buys PIMCO Enhanced Low Duration Active Exchange-Traded, Schwab U.S. ...",https://finance.yahoo.com/news/reitz-capital-advisors-llc-buys-223819511.html?.tsrc=rss,https://yhoo.it/3Akaelz
Yahoo,Horst & Graben Wealth Management LLC Buys Schwab U.S. ...,https://finance.yahoo.com/news/horst-graben-wealth-management-llc-223813271.html?.tsrc=rss,https://yhoo.it/3Isjnvn
Yahoo,"Chapman Investment Management, LLC Buys Charles Schwab Corp, Tesla Inc, KLA Corp, Sells",https://finance.yahoo.com/news/chapman-investment-management-llc-buys-223804833.html?.tsrc=rss,https://yhoo.it/3GOTKo4
Yahoo,"CRA Financial Services, LLC Buys South Jersey Industries Inc, Innovator U.S. ...",https://finance.yahoo.com/news/cra-financial-services-llc-buys-223802160.html?.tsrc=rss,https://yhoo.it/3FH0d37
Yahoo,"Mcdaniel Terry & Co Buys Amphenol Corp, Thermo Fisher Scientific Inc, Adobe Inc, Sells 3M",https://finance.yahoo.com/news/mcdaniel-terry-co-buys-amphenol-223823947.html?.tsrc=rss,https://yhoo.it/3ruuzRe
Yahoo,"Sugarloaf Wealth Management, LLC Buys BTC BlackRock Ultra Short-Term Bond ETF, PIMCO Dynamic",https://finance.yahoo.com/news/sugarloaf-wealth-management-llc-buys-223817250.html?.tsrc=rss,https://yhoo.it/3nIoak8
Yahoo,Netflix Earnings: What Happened with NFLX,https://finance.yahoo.com/m/e2afbca9-f62d-3ccc-9e89-88a36ac54d70/netflix-earnings%3A-what.html?.tsrc=rss,https://yhoo.it/33Wk5BR
