feed,title,long_url,short_url
Yahoo,"Sure, You Can Now Delay RMDs. But Think Twice Before You Actually Do",https://finance.yahoo.com/news/now-delay-rmds-think-twice-140025184.html,https://da.gd/M53U
Yahoo,Nvidia and Meta Have Soared. Now It’s Amazon’s Turn.,https://finance.yahoo.com/m/a68e8af0-27cc-3e84-907d-f5c1309304ce/nvidia-and-meta-have-soared..html?.tsrc=rss,https://da.gd/wict
Yahoo,Meta expects to lay off almost 20% of Irish workforce,https://finance.yahoo.com/news/meta-expects-lay-off-almost-131004649.html?.tsrc=rss,https://da.gd/Wa5Jn
Yahoo,Netflix Viewers: Check Your Email. The Password Sharing Crackdown Has Begun.,https://finance.yahoo.com/m/eea9888f-67da-349a-a404-388cf59455f2/netflix-viewers%3A-check-your.html?.tsrc=rss,https://da.gd/9LWb
Yahoo,5 Reasons To Cancel Your Music Subscription Service,https://finance.yahoo.com/news/5-reasons-cancel-music-subscription-130110386.html?.tsrc=rss,https://da.gd/9CoEV
Yahoo,Meta Loses Another EU Lawsuit Shortly After Hefty Penalty For Data Privacy Breach,https://finance.yahoo.com/news/meta-loses-another-eu-lawsuit-130008575.html?.tsrc=rss,https://da.gd/3RTe94
Yahoo,Can an A.I. algorithm spot the next Facebook or Uber? The founder of this European VC firm thinks so,https://finance.yahoo.com/news/algorithm-spot-next-facebook-uber-105953168.html?.tsrc=rss,https://da.gd/9yjoNm
