feed,title,long_url,short_url
FXEmpire,Italy’s right asks president to name Meloni prime minister,https://www.fxempire.com/news/article/italys-right-asks-president-to-name-meloni-prime-minister-1169681,https://bit.ly/3VOPDQA
FXEmpire,"Turkey’s Erdogan says he will meet with Swedish PM Kristersson discuss extraditions, NATO bid",https://www.fxempire.com/news/article/turkeys-erdogan-says-he-will-meet-with-swedish-pm-kristersson-discuss-extraditions-nato-bid-1169682,https://bit.ly/3CRlEir
FXEmpire,Sri Lanka central bank governor sees inflation peaking – Bloomberg News,https://www.fxempire.com/news/article/sri-lanka-central-bank-governor-sees-inflation-peaking-bloomberg-news-1169674,https://bit.ly/3ePsJrP
FXEmpire,American B-1B bombers land in Guam to ‘deter adversaries’ and reassure allies,https://www.fxempire.com/news/article/american-b-1b-bombers-land-in-guam-to-deter-adversaries-and-reassure-allies-1169676,https://bit.ly/3ePsJIl
FXEmpire,Pakistan election commission disqualifies former PM khan from public office – local media,https://www.fxempire.com/news/article/pakistan-election-commission-disqualifies-former-pm-khan-from-public-office-local-media-1169673,https://bit.ly/3z24Bt0
FXEmpire,Japan’s wine tipplers see glass half empty as weak yen pushes prices higher,https://www.fxempire.com/news/article/japans-wine-tipplers-see-glass-half-empty-as-weak-yen-pushes-prices-higher-1169671,https://bit.ly/3MPKtji
FXEmpire,Analysis-U.S. Republicans aim at Ukraine aid but unlikely to block it,https://www.fxempire.com/news/article/analysis-u-s-republicans-aim-at-ukraine-aid-but-unlikely-to-block-it-1169678,https://bit.ly/3MPMuMs
