feed,title,long_url,short_url
FXEmpire,"Brazil’s Embraer, Air Force agree on cutting KC-390 orders",https://www.fxempire.com/news/article/brazils-embraer-air-force-agree-on-cutting-kc-390-orders-1169918,https://bit.ly/3z0R98G
FXEmpire,Mexico will propose expanding U.S. humanitarian access for Venezuelans,https://www.fxempire.com/news/article/mexico-will-propose-expanding-u-s-humanitarian-access-for-venezuelans-1169917,https://bit.ly/3CSzSj1
FXEmpire,"EU proposes matching UK move to boost ‘dark’ share trading, documents show",https://www.fxempire.com/news/article/eu-proposes-matching-uk-move-to-boost-dark-share-trading-documents-show-1169915,https://bit.ly/3TJ0F86
FXEmpire,Turkey says not right for U.S. to pressure Saudi Arabia over oil output,https://www.fxempire.com/news/article/turkey-says-not-right-for-u-s-to-pressure-saudi-arabia-over-oil-output-1169913,https://bit.ly/3sfJpf6
FXEmpire,"Exclusive-In letter, Sweden lists ‘concrete actions’ on Turkey’s concerns over NATO bid",https://www.fxempire.com/news/article/exclusive-in-letter-sweden-lists-concrete-actions-on-turkeys-concerns-over-nato-bid-1169912,https://bit.ly/3CPn6C1
