feed,title,long_url,short_url
Investing,Bitcoin (BTC) Obliterates Stock Market in Performance,https://www.investing.com/news/cryptocurrency-news/bitcoin-btc-obliterates-stock-market-in-performance-3209763,https://da.gd/rxdbz
Investing,"Merck&Co earnings beat by $0.18, revenue topped estimates",https://www.investing.com/news/stock-market-news/merckco-earnings-beat-by-018-revenue-topped-estimates-3209786,https://da.gd/FEfi9Q
Investing,Hasbro cuts annual sales outlook on weaker toy business,https://www.investing.com/news/stock-market-news/hasbro-cuts-annual-sales-outlook-on-weaker-toy-business-3209785,https://da.gd/mFDXj1
Investing,"Mobileye Global earnings beat by $0.05, revenue topped estimates",https://www.investing.com/news/stock-market-news/mobileye-global-earnings-beat-by-005-revenue-topped-estimates-3209782,https://da.gd/tnq4d
Investing,"Hasbro earnings missed by $0.13, revenue fell short of estimates",https://www.investing.com/news/stock-market-news/hasbro-earnings-missed-by-013-revenue-fell-short-of-estimates-3209781,https://da.gd/vEHiZ
Investing,Merck 3rd-quarter profit tops expectations on COVID pill surprise,https://www.investing.com/news/stock-market-news/merck-3rdquarter-profit-tops-expectations-on-covid-pill-surprise-3209780,https://da.gd/zqdvP
Investing,"Southwest Airlines profit falls, expects higher deliveries from Boeing in 2023",https://www.investing.com/news/stock-market-news/southwest-airlines-profit-falls-expects-higher-deliveries-from-boeing-in-2023-3209775,https://da.gd/REHNsf
Investing,Overstock (NASDAQ:OSTK) Misses Q3 Sales Targets,https://www.investing.com/news/stock-market-news/overstock-nasdaqostk-misses-q3-sales-targets-3209766,https://da.gd/GRsWxz
Investing,UPS falls after cutting full-year revenue outlook on 'unfavorable macroeconomic conditions',https://www.investing.com/news/stock-market-news/ups-falls-after-cutting-fullyear-revenue-outlook-on-unfavorable-macroeconomic-conditions-432SI-3209734,https://da.gd/NfxF7M
