feed,title,long_url,short_url
SeekingAlpha,Invesco CEF Income Composite ETF declares monthly distribution of $0.1468,https://seekingalpha.com/news/3927930,
SeekingAlpha,Invesco KBW Premium Yield Equity REIT ETF declares monthly distribution of $0.1316,https://seekingalpha.com/news/3927929,
SeekingAlpha,NextEra Energy plunges as FPL head departs after campaign finance probe,https://seekingalpha.com/news/3927928,
SeekingAlpha,Amazon: AWS Can't Save This,https://seekingalpha.com/article/4572329,
SeekingAlpha,Texas Instruments: Near-Term Macro Headwinds But Long-Term Benefits Of Leading Analog Market Share,https://seekingalpha.com/article/4572341,
