feed,title,long_url,short_url
Benzinga,Bitcoin Rises More Than 3% In 24 hours,https://benzinga.com/insights/cryptocurrency/24/09/40796767/bitcoin-rises-more-than-3-in-24-hours,https://da.gd/A3ew94
Benzinga,"This Chart Before Buying AI Stocks, Apple Loses $14B Fight",https://benzinga.com/markets/24/09/40796752/this-chart-before-buying-ai-stocks-apple-loses-14b-fight,https://da.gd/PVaqYn
Benzinga,Evaluating Verizon Communications Against Peers In Diversified Telecommunication Services Industry,https://benzinga.com/insights/news/24/09/40796742/evaluating-verizon-communications-against-peers-in-diversified-telecommunication-services-industry,https://da.gd/JbBUo
Benzinga,"Performance Comparison: Cheniere Energy And Competitors In Oil, Gas & Consumable Fuels Industry",https://benzinga.com/insights/news/24/09/40796730/performance-comparison-cheniere-energy-and-competitors-in-oil-gas-amp-consumable-fuels-industry,https://da.gd/Dr8v4
Benzinga,Behind the Scenes of Affirm Holdings's Latest Options Trends,https://benzinga.com/insights/options/24/09/40796721/behind-the-scenes-of-affirm-holdingss-latest-options-trends,https://da.gd/hsQxV
Benzinga,Check Out What Whales Are Doing With TGT,https://benzinga.com/insights/options/24/09/40796719/check-out-what-whales-are-doing-with-tgt,https://da.gd/jJiQ
Benzinga,PDD Holdings's Options: A Look at What the Big Money is Thinking,https://benzinga.com/insights/options/24/09/40796709/pdd-holdingss-options-a-look-at-what-the-big-money-is-thinking,https://da.gd/59ePM
Benzinga,"Inquiry Into Apple's Competitor Dynamics In Technology Hardware, Storage & Peripherals Industry",https://benzinga.com/insights/news/24/09/40796688/inquiry-into-apples-competitor-dynamics-in-technology-hardware-storage-amp-peripherals-industry,https://da.gd/T1Xn94
Benzinga,Solana Rises More Than 6% In 24 hours,https://benzinga.com/insights/cryptocurrency/24/09/40796687/solana-rises-more-than-6-in-24-hours,https://da.gd/EFD24
