feed,title,long_url,short_url
InsiderMonkey,"High Margins, Low Upside: Paychex, Inc. (PAYX) Gets a Hold",https://insidermonkey.com/blog/--1629626,
InsiderMonkey,"Fortinet, Inc. (FTNT) Extends Armis Partnership; UBS Stays Neutral",https://insidermonkey.com/blog/--1629629,
InsiderMonkey,"KeyBanc Raises FY26 Estimates, Keeps Synopsys, Inc. (SNPS) at Overweight",https://insidermonkey.com/blog/--1629631,
InsiderMonkey,Here’s Why Goldman Sachs Upgraded Joint Stock Company Kaspi.kz (KSPI) to Buy,https://insidermonkey.com/blog/--1629633,
InsiderMonkey,"Shopify Inc. (SHOP)’s ChatGPT Move Could Change the Game, Benchmark Thinks So",https://insidermonkey.com/blog/--1629635,
InsiderMonkey,Intuit Expands Mid-Market Reach with Aprio Partnership,https://insidermonkey.com/blog/--1629637,
InsiderMonkey,"Automatic Data Processing, Inc. (ADP) Could Deliver an EPS Upside, Says Jefferies",https://insidermonkey.com/blog/--1629639,
InsiderMonkey,"Salesforce, Inc. (CRM)’s ‘Agentic Enterprise’ Vision Wins Canaccord’s Confidence",https://insidermonkey.com/blog/--1629641,
InsiderMonkey,Adobe Launches LLM Optimizer to Help Brands Win the AI Race,https://insidermonkey.com/blog/--1629643,
InsiderMonkey,Barclays Sees Opportunity in SAP SE (NYSE:SAP)’s Weakness,https://insidermonkey.com/blog/--1629654,
InsiderMonkey,"Oracle Puts AI at the Core of Its Future, and It’s Just Getting Started",https://insidermonkey.com/blog/--1629658,
