feed,title,long_url,short_url
Investing,Earnings call: Standard BioTools achieves growth and synergy targets in Q1,https://www.investing.com/news/stock-market-news/earnings-call-standard-biotools-achieves-growth-and-synergy-targets-in-q1-93CH-3436438,https://da.gd/qPAOVE
Investing,"Earnings call: Power Corporation Posts Strong Q1 Earnings, Eyes Growth",https://www.investing.com/news/stock-market-news/earnings-call-power-corporation-posts-strong-q1-earnings-eyes-growth-93CH-3436435,https://da.gd/tgT1p
Investing,Earnings call: iSpecimen reports mixed Q1 2024 results amid strategic shifts,https://www.investing.com/news/stock-market-news/earnings-call-ispecimen-reports-mixed-q1-2024-results-amid-strategic-shifts-93CH-3436423,https://da.gd/RzIH2
Investing,"Earnings call: Supremex reports mixed Q1 results, optimistic outlook",https://www.investing.com/news/stock-market-news/earnings-call-supremex-reports-mixed-q1-results-optimistic-outlook-93CH-3436421,https://da.gd/e9wsq
Investing,"Earnings call: The Real Brokerage sees record Q1 revenue, bullish on 2024",https://www.investing.com/news/stock-market-news/earnings-call-the-real-brokerage-sees-record-q1-,https://da.gd/dpOFl
