feed,title,long_url,short_url
SeekingAlpha,Forte Biosciences GAAP EPS of -$0.16,https://seekingalpha.com/news/4105519,
SeekingAlpha,Hesai Group announces management and board changes,https://seekingalpha.com/news/4105518,
SeekingAlpha,Mercy to use Senseonics Eversense RPM to monitor diabetic patients,https://seekingalpha.com/news/4105517,
SeekingAlpha,Marathon Petroleum President Mannen to assume CEO role; Hennigan to become Chairman,https://seekingalpha.com/news/4105516,
SeekingAlpha,Kingstone reports Q1 results,https://seekingalpha.com/news/4105515,
SeekingAlpha,Astrotech GAAP EPS of -$1.93,https://seekingalpha.com/news/4105514,
SeekingAlpha,"Infinera Non-GAAP EPS of $0.12 beats by $0.02, revenue of $453.46M beats by $13.49M",https://seekingalpha.com/news/4105513,
