feed,title,long_url,short_url
Investing,U.S. stocks higher at close of trade; Dow Jones Industrial Average up 0.20%,https://www.investing.com/news/stock-market-news/us-stocks-higher-at-close-of-trade-dow-jones-industrial-average-up-020-4134421,
Investing,60 Degrees Pharmaceuticals stock surges on canine babesiosis treatment plans,https://www.investing.com/news/stock-market-news/60-degrees-pharmaceuticals-stock-surges-on-canine-babesiosis-treatment-plans-93CH-4134417,
Investing,Canada stocks higher at close of trade; S&P/TSX Composite up 0.65%,https://www.investing.com/news/stock-market-news/canada-stocks-higher-at-close-of-trade-sptsx-composite-up-065-4134416,
Investing,US delays rule on Gulf of Mexico whale protections by two years,https://www.investing.com/news/stock-market-news/us-delays-rule-on-gulf-of-mexico-whale-protections-by-two-years-4134415,
Investing,Brazil stocks lower at close of trade; Bovespa down 0.65%,https://www.investing.com/news/stock-market-news/brazil-stocks-lower-at-close-of-trade-bovespa-down-065-4134414,
Investing,Jersey Mike's to raise $400 million in asset-backed securities - Bloomberg,https://www.investing.com/news/stock-market-news/jersey-mikes-to-raise-400-million-in-assetbacked-securities--bloomberg-93CH-4134402,
Investing,La-Z-Boy stock falls after lowering fiscal Q1 outlook,https://www.investing.com/news/stock-market-news/lazboy-stock-falls-after-lowering-fiscal-q1-outlook-93CH-4134401,
Investing,Stock market today: S&P 500 ekes out gain as Trump says open to deals on tariffs,https://www.investing.com/news/stock-market-news/stock-market-today-sp-500-ekes-out-gain-as-trump-says-open-to-deals-on-tariffs-4132810,
Investing,U.S. senators urge Trump administration to back higher pilot retirement age,https://www.investing.com/news/economy-news/us-senators-urge-trump-administration-to-back-higher-pilot-retirement-age-93CH-4134413,
