feed,title,long_url,short_url
SeekingAlpha,Moderna submits clinical data for FDA to review its booster COVID-19 shot,https://seekingalpha.com/news/3736378,
SeekingAlpha,"Meten Holding slumps 31% amid plans of stock, warrants offering",https://seekingalpha.com/news/3736377,
SeekingAlpha,Grindrod Shipping announces IVS Pinehurst charter extension; closing of IVS Bulk acquisition,https://seekingalpha.com/news/3736376,
SeekingAlpha,Veeva Systems stock slides despite upside earnings report and guidance,https://seekingalpha.com/news/3736374,
SeekingAlpha,"Nasdaq hits new record high, S&P slumps and banks continue to weigh on Dow",https://seekingalpha.com/news/3736369,
