feed,title,long_url,short_url
FXEmpire,Jury to resume deliberations in Ghislaine Maxwell sex abuse case,https://www.fxempire.com/news/article/jury-to-resume-deliberations-in-ghislaine-maxwell-sex-abuse-case-850688,https://j.mp/3px4jpI
FXEmpire,Ethiopian Airlines says to resume using Boeing 737 Max planes in Feb,https://www.fxempire.com/news/article/ethiopian-airlines-says-to-resume-using-boeing-737-max-planes-in-feb-850685,https://j.mp/314CprC
FXEmpire,Female trucker sounds alarm on Spain’s haulier shortage,https://www.fxempire.com/news/article/female-trucker-sounds-alarm-on-spains-haulier-shortage-850687,https://j.mp/3457cG1
FXEmpire,Shoppers largely steer clear of central London Boxing Day sales,https://www.fxempire.com/news/article/shoppers-largely-steer-clear-of-central-london-boxing-day-sales-850691,https://j.mp/32FWYuE
FXEmpire,Piraeus Bank pursues balance sheet clean up with bad loan sale,https://www.fxempire.com/news/article/piraeus-bank-pursues-balance-sheet-clean-up-with-bad-loan-sale-850690,https://j.mp/3Eun4hK
