feed,title,long_url,short_url
InvestorPlace,3 Metaverse Stocks to Invest in for the Internet’s Next Evolution,https://investorplace.com/2023/10/3-metaverse-stocks-to-invest-in-for-the-internets-next-evolution/,https://da.gd/EpY0P
InvestorPlace,3 Stocks Poised to Make a Comeback,https://investorplace.com/2023/10/3-stocks-poised-to-make-a-comeback/,https://da.gd/MtGO
InvestorPlace,AI Chip Wars: Why AMD’s Acquisition Spells Huge Opportunity,https://investorplace.com/2023/10/amd-stock-still-a-high-confidence-buy-for-the-ai-chip-war/,https://da.gd/fIxX
InvestorPlace,ORCL Stock Alert: Analysts Defend Oracle After AI Event,https://investorplace.com/2023/10/orcl-stock-alert-analysts-defend-oracle-after-ai-event/,https://da.gd/SiNP
InvestorPlace,Will Solar Stocks Be the Next Big Short Squeeze?,https://investorplace.com/2023/10/will-solar-stocks-be-the-next-big-short-squeeze/,https://da.gd/wAqtCt
