feed,title,long_url,short_url
Nasdaq,Volkswagen’s Tesla race hits wrong gear in China,https://www.nasdaq.com/articles/volkswagens-tesla-race-hits-wrong-gear-in-china-2021-06-23,https://j.mp/3d9219o
Nasdaq,Ryanair CEO sees travel 'mushrooming' despite COVID-19 restrictions,https://www.nasdaq.com/articles/ryanair-ceo-sees-travel-mushrooming-despite-covid-19-restrictions-2021-06-23,https://j.mp/35KVJbZ
Nasdaq,CBSH Crosses Above Average Analyst Target,https://www.nasdaq.com/articles/cbsh-crosses-above-average-analyst-target-2021-06-23,https://j.mp/3qiCeky
Nasdaq,AEO Crosses Above Average Analyst Target,https://www.nasdaq.com/articles/aeo-crosses-above-average-analyst-target-2021-06-23,https://j.mp/35N1gPu
Nasdaq,DXC Technology Reaches Analyst Target Price,https://www.nasdaq.com/articles/dxc-technology-reaches-analyst-target-price-2021-06-23,https://j.mp/3jdoWnM
Nasdaq,WFC Crosses Above Average Analyst Target,https://www.nasdaq.com/articles/wfc-crosses-above-average-analyst-target-2021-06-23,https://j.mp/3gY6sVN
Nasdaq,KFY Crosses Above Average Analyst Target,https://www.nasdaq.com/articles/kfy-crosses-above-average-analyst-target-2021-06-23,https://j.mp/3xIgvoE
Nasdaq,Cintas Reaches Analyst Target Price,https://www.nasdaq.com/articles/cintas-reaches-analyst-target-price-2021-06-23,https://j.mp/3gPIMEk
Nasdaq,Globus Medical Reaches Analyst Target Price,https://www.nasdaq.com/articles/globus-medical-reaches-analyst-target-price-2021-06-23,https://j.mp/2SXsTT2
Nasdaq,Bottles to bricks: Lego finds the right fit with recycled plastic,https://www.nasdaq.com/articles/bottles-to-bricks%3A-lego-finds-the-right-fit-with-recycled-plastic-2021-06-23,https://j.mp/2SRVdX4
Nasdaq,Soccer-Belgium slam UEFA on rainbow colours and plan own display,https://www.nasdaq.com/articles/soccer-belgium-slam-uefa-on-rainbow-colours-and-plan-own-display-2021-06-23,https://j.mp/3qlz3sz
