feed,title,long_url,short_url
SeekingAlpha,"W.W. Grainger rises beating Q3 estimates, raising sales guidance",https://seekingalpha.com/news/3897274,
SeekingAlpha,"First Home Bancorp Non-GAAP EPS of -$0.35, revenue of $18.97M",https://seekingalpha.com/news/3897273,
SeekingAlpha,"York Traditions Bank GAAP EPS of $0.58, revenue of $8.21M",https://seekingalpha.com/news/3897272,
SeekingAlpha,"Savi Financial GAAP EPS of $0.25, revenue of $6.73M",https://seekingalpha.com/news/3897271,
SeekingAlpha,"American Business Bank  GAAP EPS of $1.44, revenue of $34.46M",https://seekingalpha.com/news/3897268,
