feed,title,long_url,short_url
InsiderMonkey,Why DexCom Inc. (DXCM) Soared Last Week,https://insidermonkey.com/blog/--1524221,
InsiderMonkey,Why Wayfair Inc. (W) Soared Last Week,https://insidermonkey.com/blog/--1524223,
InsiderMonkey,Why Arista Networks Inc. (ANET) Soared Last Week,https://insidermonkey.com/blog/--1524224,
InsiderMonkey,"Why Aurora Innovation, Inc. (AUR) Soared Last Week",https://insidermonkey.com/blog/--1524225,
InsiderMonkey,Why Summit Therapeutics Inc. (SMMT) Soared Last Week,https://insidermonkey.com/blog/--1524226,
InsiderMonkey,Why Carrier Global Corporation (CARR) Soared Last Week,https://insidermonkey.com/blog/--1524227,
InsiderMonkey,Why Hesai Group (HSAI) Soared Last Week,https://insidermonkey.com/blog/--1524228,
InsiderMonkey,"Why CoreWeave, Inc. (CRWV) Soared Last Week",https://insidermonkey.com/blog/--1524229,
InsiderMonkey,"Why Hims & Hers Health, Inc. (HIMS) Soared Last Week",https://insidermonkey.com/blog/--1524232,
InsiderMonkey,Why Pony AI Inc. (PONY) Soared Last Week,https://insidermonkey.com/blog/--1524222,
