feed,title,long_url,short_url
SeekingAlpha,iShares 20+ Year Treasury Bond ETF declares monthly distribution of $0.2800,https://seekingalpha.com/news/4017602,
SeekingAlpha,"Essential Utilities to sell microgrid, district energy projects in $165M deal",https://seekingalpha.com/news/4017600,
SeekingAlpha,Berkshire Hathaway's selling streak in HP continues,https://seekingalpha.com/news/4017479,
SeekingAlpha,iShares 10-20 Year Treasury Bond ETF declares monthly distribution of $0.3560,https://seekingalpha.com/news/4017599,
SeekingAlpha,iShares TIPS Bond ETF declares monthly distribution of $0.1714,https://seekingalpha.com/news/4017598,
SeekingAlpha,Micron: Best To Stay On The Sidelines,https://seekingalpha.com/article/4638705,
SeekingAlpha,Google: Don't Worry About Antitrust,https://seekingalpha.com/article/4638704,
