feed,title,long_url,short_url
SeekingAlpha,9F Inc CFO Yanjun Lin to resign,https://seekingalpha.com/news/3701567,
SeekingAlpha,"Kirkland's EPS beats by $0.10, misses on revenue",https://seekingalpha.com/news/3701566,
SeekingAlpha,Canopy Growth EPS of -C$1.85,https://seekingalpha.com/news/3701565,
SeekingAlpha,GEO Group appoints George C. Zoley as Executive Chairman and Jose Gordo as CEO,https://seekingalpha.com/news/3701564,
SeekingAlpha,JNJ to hear from supreme court regarding $2 billion talc verdict,https://seekingalpha.com/news/3701563,
