feed,title,long_url,short_url
SeekingAlpha,Poseida Therapeutics stock slides on proposed stock offering,https://seekingalpha.com/news/3866316,
SeekingAlpha,"ARC Document Solutions Non-GAAP EPS of $0.08, revenue of $74.6M",https://seekingalpha.com/news/3866315,
SeekingAlpha,"BlackRock Capital Investment Non-GAAP NII of $0.08 in-line, Total investment income of $12.27M beats by $0.5M",https://seekingalpha.com/news/3866314,
SeekingAlpha,"Bandwidth GAAP EPS of -$0.04 beats by $0.61, revenue of $136M beats by $2.44M",https://seekingalpha.com/news/3866313,
SeekingAlpha,"Vanda Pharmaceuticals GAAP EPS of $0.05, revenue of $64.39M",https://seekingalpha.com/news/3866312,
SeekingAlpha,"Qorvo Non-GAAP EPS of $2.25 beats by $0.13, revenue of $1.04B beats by $10M",https://seekingalpha.com/news/3866311,
SeekingAlpha,"Nabriva Therapeutics GAAP EPS of -$0.18 beats by $0.02, revenue of $9.19M beats by $0.66M",https://seekingalpha.com/news/3866310,
