feed,title,long_url,short_url
Nasdaq,"FOREX-Dollar index steady on mix of gains, losses on major currencies",https://www.nasdaq.com/articles/forex-dollar-index-steady-on-mix-of-gains-losses-on-major-currencies-2021-05-27,https://j.mp/3fRIkUk
Nasdaq,Canada's Pieridae plans to capture carbon at Alberta gas facility,https://www.nasdaq.com/articles/canadas-pieridae-plans-to-capture-carbon-at-alberta-gas-facility-2021-05-27,https://j.mp/3fsdWRn
Nasdaq,Argentine soy crop estimate raised to 43.5 mln tonnes thanks to good yields -exchange,https://www.nasdaq.com/articles/argentine-soy-crop-estimate-raised-to-43.5-mln-tonnes-thanks-to-good-yields-exchange-2021,https://j.mp/34lN3bB
Nasdaq,"Amazon CEO Jeff Bezos to Formally Step Down, Turn Reins Over to Andy Jassy",https://www.nasdaq.com/articles/amazon-ceo-jeff-bezos-to-formally-step-down-turn-reins-over-to-andy-jassy-2021-05-27,https://j.mp/2QY7zM9
Nasdaq,Full results at Exxon Mobil board may take until next week,https://www.nasdaq.com/articles/full-results-at-exxon-mobil-board-may-take-until-next-week-2021-05-27,https://j.mp/2R3bozS
Nasdaq,Mortgage Rates Slip Below 3%,https://www.nasdaq.com/articles/mortgage-rates-slip-below-3-2021-05-27,https://j.mp/3wQZlVF
