feed,title,long_url,short_url
Investing,Gold Rallies to Record Levels as Markets Brace for Trump’s Tariff Impact,https://www.investing.com/analysis/gold-rallies-to-record-levels-as-markets-brace-for-trumps-tariff-impact-200658880,https://da.gd/9BxRvE
Investing,Brazil's coffee farmers turn to costly irrigation to quench global demand for the brew,https://www.investing.com/news/commodities-news/brazils-coffee-farmers-turn-to-costly-irrigation-to-quench-global-demand-for-the-brew-3956668,https://da.gd/4vsB9v
Investing,"Tesla deliveries likely fell as competition, Musk backlash surge",https://www.investing.com/news/stock-market-news/tesla-deliveries-likely-fell-as-competition-musk-backlash-surge-3956674,https://da.gd/RHAMx
Investing,"HSBC says it remains ""positive on banks"" despite looming economic uncertainty",https://www.investing.com/news/stock-market-news/hsbc-says-it-remains-positive-on-banks-despite-looming-economic-uncertainty-3956666,https://da.gd/PqkcT
Investing,"As ‘Buy Canadian’ grows, more US companies say retailers turning away their products",https://www.investing.com/news/stock-market-news/as-buy-canadian-grows-more-us-companies-say-retailers-turning-away-their-products-3956665,https://da.gd/2kJdxL
Investing,Washington tells Repsol its license in Venezuela to be revoked,https://www.investing.com/news/stock-market-news/washington-tells-repsol-its-license-in-venezuela-to-be-revoked-3956652,https://da.gd/XG76pz
Investing,"Airbus getting better at managing supply chain disruptions, senior executive says",https://www.investing.com/news/stock-market-news/airbus-getting-better-at-managing-supply-chain-disruptions-senior-executive-says-3956643,https://da.gd/OpjKE
Investing,Trump auto tariffs threaten new supply-price shock,https://www.investing.com/news/economy-news/trump-auto-tariffs-threaten-new-supplyprice-shock-3956669,https://da.gd/spfJi6
