feed,title,long_url,short_url
Nasdaq,Vietnam raises anti-dumping duties on some Chinese aluminium products,https://www.nasdaq.com/articles/vietnam-raises-anti-dumping-duties-on-some-chinese-aluminium-products-2021-04-27,https://j.mp/2Qyyiic
Nasdaq,Sweden's Boliden wary of pandemic risks after Q1 profit jumps,https://www.nasdaq.com/articles/swedens-boliden-wary-of-pandemic-risks-after-q1-profit-jumps-2021-04-27,https://j.mp/3tResx0
Nasdaq,"Taiwan’s MFIG tenders to buy up to 65,000 tonnes corn",https://www.nasdaq.com/articles/taiwans-mfig-tenders-to-buy-up-to-65000-tonnes-corn-2021-04-27,https://j.mp/3ntk9yL
Nasdaq,Finnish state investor Solidium sells 6.3% stake in SSAB,https://www.nasdaq.com/articles/finnish-state-investor-solidium-sells-6.3-stake-in-ssab-2021-04-27,https://j.mp/3dUojMX
Nasdaq,"Wintershall Dea Q1 operating profit jumps 47%, resumes dividend",https://www.nasdaq.com/articles/wintershall-dea-q1-operating-profit-jumps-47-resumes-dividend-2021-04-27,https://j.mp/3ewueXL
Nasdaq,Organisers of Russia's Segezha IPO guiding for pricing at 7.75-8 roubles per share - three sources,https://www.nasdaq.com/articles/organisers-of-russias-segezha-ipo-guiding-for-pricing-at-7.75-8-roubles-per-share-three,https://j.mp/3aZAN4j
Nasdaq,Whitbread posts annual loss of $1.4 bln on pandemic travel curbs,https://www.nasdaq.com/articles/whitbread-posts-annual-loss-of-%241.4-bln-on-pandemic-travel-curbs-2021-04-27,https://j.mp/3etiDss
Nasdaq,Finnair raises savings target after steep Q1 loss,https://www.nasdaq.com/articles/finnair-raises-savings-target-after-steep-q1-loss-2021-04-27,https://j.mp/3dUNdw8
