feed,title,long_url,short_url
Nasdaq,2 Hot Biotech IPOs to Consider,https://www.nasdaq.com/articles/2-hot-biotech-ipos-to-consider-2021-04-27,https://j.mp/3xlsj0G
Nasdaq,A Product Recall Crashed Elanco's Stock. Is This a Buying Opportunity?,https://www.nasdaq.com/articles/a-product-recall-crashed-elancos-stock.-is-this-a-buying-opportunity-2021-04-27,https://j.mp/2PpZejx
Nasdaq,This Baby Berkshire Hathaway Is Down 40% Off Its Highs. Is It Time to Buy?,https://www.nasdaq.com/articles/this-baby-berkshire-hathaway-is-down-40-off-its-highs.-is-it-time-to-buy-2021-04-27,https://j.mp/3nrgaCI
Nasdaq,3 Dividend Stocks That Just Hiked Their Payouts,https://www.nasdaq.com/articles/3-dividend-stocks-that-just-hiked-their-payouts-2021-04-27,https://j.mp/32P4XCv
Nasdaq,How Important is ESG Investing?,https://www.nasdaq.com/articles/how-important-is-esg-investing-2021-04-27,https://j.mp/3sTlEr1
