feed,title,long_url,short_url
Benzinga,RenalytixAI to Present at the 39th Annual J.P. Morgan Healthcare Conference,https://www.benzinga.com/pressreleases/21/01/g18997505/renalytixai-to-present-at-the-39th-annual-j-p-morgan-healthcare-conference,https://j.mp/3ndtOYo
Benzinga,DZS Appoints Matt Bross and Barbara Carbone to Board of Directors,https://www.benzinga.com/pressreleases/21/01/g18997471/dzs-appoints-matt-bross-and-barbara-carbone-to-board-of-directors,https://j.mp/3hFXI6u
Benzinga,"Celldex Appoints Freddy A. Jimenez, Esq. as Senior Vice President and General Counsel",https://www.benzinga.com/pressreleases/21/01/g18997424/celldex-appoints-freddy-a-jimenez-esq-as-senior-vice-president-and-general-counsel,https://j.mp/38bB1nA
Benzinga,"Pliant Therapeutics Announces Appointment of Gregory P. Cosgrove, M.D., FCCP, as Vice President of Clinical Development, IPF",https://www.benzinga.com/pressreleases/21/01/g18997320/pliant-therapeutics-announces-appointment-of-gregory-p-cosgrove-m-d-fccp-as-vice-president-of-clin,https://j.mp/389Z5Hu
Benzinga,Costamare Inc. Declares Quarterly Dividend on its Preferred and Common Stock,https://www.benzinga.com/pressreleases/21/01/g18997318/costamare-inc-declares-quarterly-dividend-on-its-preferred-and-common-stock,https://j.mp/2JGx80z
Benzinga,MiMedx to Participate at the H.C. Wainwright BioConnect 2021 Conference,https://www.benzinga.com/pressreleases/21/01/g18997317/mimedx-to-participate-at-the-h-c-wainwright-bioconnect-2021-conference,https://j.mp/3b8gORM
Benzinga,Kratos Receives $11 Million Development Contract for Next Generation Satellite Program,https://www.benzinga.com/pressreleases/21/01/g18997315/kratos-receives-11-million-development-contract-for-next-generation-satellite-program,https://j.mp/2JGx8xB
Benzinga,PHOTO RELEASE — Huntington Ingalls Industries Expands Unmanned Capabilities By Acquiring Autonomy Business from Spatial Integrated Systems,https://www.benzinga.com/pressreleases/21/01/g18997314/photo-release-huntington-ingalls-industries-expands-unmanned-capabilities-by-acquiring-autonomy-bu,https://j.mp/3pKuMNG
Benzinga,ORYZON to Present a Corporate Update and to Hold Multiple Virtual Corporate Activities in January 2021,https://www.benzinga.com/pressreleases/21/01/g18997312/oryzon-to-present-a-corporate-update-and-to-hold-multiple-virtual-corporate-activities-in-january-,https://j.mp/3pNWEQU
Benzinga,"Better Choice Appoints Consumer Packaged Goods Industry Veteran, Scott Lerner, as New CEO",https://www.benzinga.com/pressreleases/21/01/g18997289/better-choice-appoints-consumer-packaged-goods-industry-veteran-scott-lerner-as-new-ceo,https://j.mp/3nbTRzr
Benzinga,Builders FirstSource Completes Combination with BMC Stock Holdings,https://www.benzinga.com/pressreleases/21/01/g18997286/builders-firstsource-completes-combination-with-bmc-stock-holdings,https://j.mp/3b7uyvO
Benzinga,Sio Gene Therapies to Sell Arvelle Stake as Part of Angelini Pharma's Acquisition of Arvelle Therapeutics,https://www.benzinga.com/pressreleases/21/01/g18997282/sio-gene-therapies-to-sell-arvelle-stake-as-part-of-angelini-pharmas-acquisition-of-arvelle-therap,https://j.mp/3hFljo1
Benzinga,Pandion Therapeutics Announces Positive Top-Line Phase 1a Clinical Data Showing PT101 was Well-Tolerated and Selectively Expanded Regulatory T cells,https://www.benzinga.com/pressreleases/21/01/g18997281/pandion-therapeutics-announces-positive-top-line-phase-1a-clinical-data-showing-pt101-was-well-tol,https://j.mp/3b5Uqs5
