feed,title,long_url,short_url
Benzinga,Insights Into Astrazeneca Q1: Wall Street Projections for Key Metrics,https://benzinga.com/news/earnings/24/04/38358475/insights-into-astrazeneca-q1-wall-street-projections-for-key-metrics,https://da.gd/BcYxBg
Benzinga,Intel Q1 Earnings Preview: What You Should Know Beyond the Headline Estimates,https://benzinga.com/news/earnings/24/04/38358483/intel-q1-earnings-preview-what-you-should-know-beyond-the-headline-estimates,https://da.gd/Jq7mEp
Benzinga,"Exploring Analyst Estimates for Caterpillar Q1 Earnings, Beyond Revenue and EPS",https://benzinga.com/news/earnings/24/04/38358517/exploring-analyst-estimates-for-caterpillar-q1-earnings-beyond-revenue-and-eps,https://da.gd/g6RPGT
Benzinga,"Exploring Analyst Estimates for Alphabet Q1 Earnings, Beyond Revenue and EPS",https://benzinga.com/news/24/04/38358530/exploring-analyst-estimates-for-alphabet-q1-earnings-beyond-revenue-and-eps,https://da.gd/HePFUS
Benzinga,American Airlines Q1 Earnings on the Horizon: Analysts' Insights on Key Performance Measures,https://benzinga.com/news/earnings/24/04/38358552/american-airlines-q1-earnings-on-the-horizon-analysts-insights-on-key-performance-measures,https://da.gd/Muqe
Benzinga,Insights Into Royal Caribbean Q1: Wall Street Projections for Key Metrics,https://benzinga.com/news/24/04/38358586/insights-into-royal-caribbean-q1-wall-street-projections-for-key-metrics,https://da.gd/9D1s
Benzinga,Unlocking Q1 Potential of TFI International: Exploring Wall Street Estimates for Key Metrics,https://benzinga.com/news/earnings/24/04/38358587/unlocking-q1-potential-of-tfi-international-exploring-wall-street-estimates-for-key-metrics,https://da.gd/ao8u6
Benzinga,"Zacks Industry Outlook Highlights Tyson Foods, Hormel Foods and Pilgrim's Pride",https://benzinga.com/news/24/04/38358589/zacks-industry-outlook-highlights-tyson-foods-hormel-foods-and-pilgrims-pride,https://da.gd/Oksgv
Benzinga,MainStreet Bank Q1 Earnings and Revenues Lag Estimates,https://benzinga.com/news/earnings/24/04/38358593/mainstreet-bank-q1-earnings-and-revenues-lag-estimates,https://da.gd/3TQbT
Benzinga,Sierra Bancorp Surpasses Q1 Earnings and Revenue Estimates,https://benzinga.com/news/earnings/24/04/38358598/sierra-bancorp-surpasses-q1-earnings-and-revenue-estimates,https://da.gd/lYmn
