feed,title,long_url,short_url
Investing,Exclusive: OpenTrade raises $4M to build future of real world asset-backed lending,https://www.investing.com/news/cryptocurrency-news/exclusive-opentrade-raises-4m-to-build-future-of-real-world-assetbacked-lending-3739390,https://da.gd/vkWe
Investing,Mubadala Capital set to acquire CI Financial in $4.7 billion deal,https://www.investing.com/news/stock-market-news/mubadala-capital-set-to-acquire-ci-financial-in-47-billion-deal-93CH-3739420,https://da.gd/JjkX
Investing,"Hedge funds dump utilities stocks, pile into power: Goldman Sachs",https://www.investing.com/news/stock-market-news/hedge-funds-dump-utilities-stocks-pile-into-power-goldman-sachs-3739409,https://da.gd/k9MA5B
Investing,IBM and AWS expand AI collaboration with new offerings,https://www.investing.com/news/stock-market-news/ibm-and-aws-expand-ai-collaboration-with-new-offerings-93CH-3739397,https://da.gd/C04FO
Investing,"U.S. lawmakers say Hong Kong is becoming hub for financial crime, WSJ reports",https://www.investing.com/news/world-news/us-lawmakers-say-hong-kong-is-becoming-hub-for-financial-crime-wsj-reports-3739375,https://da.gd/lb4e7M
