feed,title,long_url,short_url
SeekingAlpha,"Apartment Investment GAAP EPS of -$0.02, revenue of $45.67M",https://seekingalpha.com/news/3998630,
SeekingAlpha,"PRA Group GAAP EPS of -$0.10 misses by $0.04, revenue of $209.24M beats by $4.14M",https://seekingalpha.com/news/3998629,
SeekingAlpha,"Acutus Medical Non-GAAP EPS of -$0.60 beats by $0.02, revenue of $5.3M beats by $0.8M",https://seekingalpha.com/news/3998628,
SeekingAlpha,"Veeco Instruments Non-GAAP EPS of $0.36 beats by $0.06, revenue of $161.64M beats by $3.75M",https://seekingalpha.com/news/3998627,
SeekingAlpha,Hewlett Packard Enterprise CFO Tarek Robbiati resigns,https://seekingalpha.com/news/3998626,
SeekingAlpha,"Viant Technology GAAP EPS of -$0.07 beats by $0.04, revenue of $57.22M beats by $3.83M",https://seekingalpha.com/news/3998625,
SeekingAlpha,Hercules Capital stock falls after company announces public offering of common stock,https://seekingalpha.com/news/3998624,
