feed,title,long_url,short_url
SeekingAlpha,"Crane NXT Non-GAAP EPS of $1.12 beats by $0.21, revenue of $352.4M beats by $15.87M",https://seekingalpha.com/news/3998715,
SeekingAlpha,"Douglas Elliman GAAP EPS of -$0.06 beats by $0.01, revenue of $275.9M beats by $33.84M",https://seekingalpha.com/news/3998714,
SeekingAlpha,Coinbase starts tender offer to buy up to $150M of its senior notes,https://seekingalpha.com/news/3998713,
SeekingAlpha,"Apollo Medical GAAP EPS of $0.28 beats by $0.03, revenue of $348.2M beats by $6.23M",https://seekingalpha.com/news/3998712,
SeekingAlpha,EZGO Technologies reports Q2 results,https://seekingalpha.com/news/3998711,
SeekingAlpha,"Ranger Energy Services GAAP EPS of $0.24 misses by $0.18, revenue of $163.2M misses by $5.2M",https://seekingalpha.com/news/3998710,
SeekingAlpha,"CompassEPS of -$0.10, revenue of $1.49B misses by $20M",https://seekingalpha.com/news/3998709,
