feed,title,long_url,short_url
SeekingAlpha,Tim Lalonde is the finance chief of Evercore,https://seekingalpha.com/news/3926258,
SeekingAlpha,Retail recovery: Ralph Lauren and PVH land bull ratings from Barclays,https://seekingalpha.com/news/3926257,
SeekingAlpha,"Dr. Reddy's prepare to file for Rituxan biosimilar in US, EU as trials completed",https://seekingalpha.com/news/3926255,
SeekingAlpha,"Schlumberger Limited Non-GAAP EPS of $0.71 beats by $0.03, revenue of $7.9B beats by $110M",https://seekingalpha.com/news/3926256,
SeekingAlpha,Introducing My 2023 Income Compounder Portfolio,https://seekingalpha.com/article/4571088,
SeekingAlpha,PIMCO Muni CEFs (Finally) Re-Rate For The New Environment,https://seekingalpha.com/article/4571062,
