feed,title,long_url,short_url
Yahoo,"Shopify Seeks to Protect CEO’s Voting Power, Split Stock",https://www.wsj.com/articles/shopify-seeks-to-protect-ceos-voting-power-split-stock-11649674860?siteid=yhoof2&yptr=yahoo,https://on.wsj.com/3jrH9NC
Yahoo,10-year Treasury yield top 2.75% as traders await inflation data,https://www.marketwatch.com/story/10-year-treasury-yield-top-2-75-as-traders-await-inflation-data-11649674687?siteid=yhoof2&yptr=yahoo,https://on.mktw.net/3DYIPrk
Yahoo,"Here are the Fortune 100 Best Companies to Work For® in 2022, according to nearly 1 million employees",https://finance.yahoo.com/news/fortune-100-best-companies-2022-110000904.html,https://yhoo.it/3joajx5
Yahoo,Pfizer names CFO from Lowe's to replace Frank D'Amelio,https://www.marketwatch.com/story/pfizer-names-cfo-from-lowes-to-replace-frank-damelio-2022-04-11?siteid=yhoof2&yptr=yahoo,https://on.mktw.net/37FdlKN
Yahoo,Wild Start To The Year Prompts Investors To Check Their Portfolios,https://www.investors.com/etfs-and-funds/wild-start-to-the-year-prompts-investors-to-check-their-portfolios/?src=A00220&yptr=yahoo,https://bit.ly/3jrHakE
Yahoo,"These 3 ETF Picks Will Help You Beat A Tough Market, Advisor Says",https://www.investors.com/etfs-and-funds/best-etfs-to-help-you-beat-a-tough-market/?src=A00220&yptr=yahoo,https://bit.ly/3LXG2RI
Yahoo,Russian Oil Exports Are Forced on Longer Voyages to Find Buyers,https://finance.yahoo.com/news/russian-oil-exports-forced-longer-103833137.html,https://yhoo.it/3LLXfOa
