feed,title,long_url,short_url
InvestorPlace,3 Brilliant Blue-Chip Stocks for Lucrative Long-Term Growth,https://investorplace.com/2023/08/3-brilliant-blue-chip-stocks-for-lucrative-long-term-growth/,https://da.gd/r61G5p
InvestorPlace,Why AMD Stock Is a Must-Own AI Chip Play,https://investorplace.com/2023/08/why-amd-stock-is-a-must-own-ai-chip-play/,https://da.gd/J0DXxK
InvestorPlace,Why This Speculative Fintech Stock Is One to Watch,https://investorplace.com/2023/08/why-this-speculative-fintech-stock-is-one-to-watch/,https://da.gd/ZKqy0b
InvestorPlace,The 3 Most Promising Retirement Stocks to Own Now,https://investorplace.com/2023/08/the-3-most-promising-retirement-stocks-to-own-now/,https://da.gd/zX1m
InvestorPlace,From Selloff to Surge: The Stage Is Set for September’s Market Rebound,https://investorplace.com/hypergrowthinvesting/2023/08/from-selloff-to-surge-the-stage-is-set-for-septembers-market-rebound/,https://da.gd/99eSH
InvestorPlace,Knightscope (KSCP) Stock Pops 3% on New 7-Robot Contract,https://investorplace.com/2023/08/knightscope-kscp-stock-pops-3-on-new-7-robot-contract/,https://da.gd/i5TRIf
