feed,title,long_url,short_url
SeekingAlpha,Fidelity Limited Term Bond ETF declares monthly distribution of $0.1520,https://seekingalpha.com/news/4073288,
SeekingAlpha,Fidelity Investment Grade Securitized ETF declares monthly distribution of $0.1230,https://seekingalpha.com/news/4073287,
SeekingAlpha,Fidelity Investment Grade Bond ETF declares monthly distribution of $0.1570,https://seekingalpha.com/news/4073286,
SeekingAlpha,Fidelity High Yield Factor ETF declares monthly distribution of $0.2650,https://seekingalpha.com/news/4073285,
SeekingAlpha,Micron stock set to close in red after six-day rally,https://seekingalpha.com/news/4073284,
