feed,title,long_url,short_url
SeekingAlpha,"Inter Parfums Q4 results, 2024 guidance leaves much to be desired",https://seekingalpha.com/news/4073375,
SeekingAlpha,Nippon Steel committed to finding common ground with USW over US Steel - report,https://seekingalpha.com/news/4073373,
SeekingAlpha,American Financial Group files automatic mixed securities shelf,https://seekingalpha.com/news/4073374,
SeekingAlpha,Tamarack Valley Energy reports FY results,https://seekingalpha.com/news/4073372,
SeekingAlpha,Easterly Government Properties files automatic mixed securities shelf,https://seekingalpha.com/news/4073371,
