feed,title,long_url,short_url
SeekingAlpha,Manning Ventures to acquire copper project in Nevada,https://seekingalpha.com/news/4075945,
SeekingAlpha,"Google's AI search rival startup Perplexity seeks funding, eyes $1B valuation - report",https://seekingalpha.com/news/4075942,
SeekingAlpha,"Copper, base metals mostly drop as Chinese stimulus underwhelms",https://seekingalpha.com/news/4075944,
SeekingAlpha,Palantir likely wins $178M TITAN contract with US Army: William Blair,https://seekingalpha.com/news/4075933,
SeekingAlpha,Hut 8 presents operations update for February,https://seekingalpha.com/news/4075943,
