feed,title,long_url,short_url
Nasdaq,It's Never Been Easier to Retire on Dividends (Can Be Done on $600K),https://www.nasdaq.com/articles/its-never-been-easier-to-retire-on-dividends-can-be-done-on-%24600k-2021-04-06,https://j.mp/3fYMnzZ
Nasdaq,"Energy Sector Update for 04/06/2021: BP, PTEN, XLE, USO, UNG",https://www.nasdaq.com/articles/energy-sector-update-for-04-06-2021%3A-bp-pten-xle-uso-ung-2021-04-06,https://j.mp/2OvKZte
Nasdaq,"Financial Sector Update for 04/06/2021: ARES, CS, XLF, FAS, FAZ",https://www.nasdaq.com/articles/financial-sector-update-for-04-06-2021%3A-ares-cs-xlf-fas-faz-2021-04-06,https://j.mp/3rSD9Y7
Nasdaq,"Health Care Sector Update for 04/06/2021: TMDX, DVAX, ABCM, XLV, IBB",https://www.nasdaq.com/articles/health-care-sector-update-for-04-06-2021%3A-tmdx-dvax-abcm-xlv-ibb-2021-04-06,https://j.mp/3dCgwC5
Nasdaq,"Consumer Sector Update for 04/06/2021: RMO, SIG, BLMN, XLP, XLY",https://www.nasdaq.com/articles/consumer-sector-update-for-04-06-2021%3A-rmo-sig-blmn-xlp-xly-2021-04-06,https://j.mp/3ml5mFW
Nasdaq,"Technology Sector Update for 04/06/2021: GBOX, MRVL, PRSP, XLK, SOXX",https://www.nasdaq.com/articles/technology-sector-update-for-04-06-2021%3A-gbox-mrvl-prsp-xlk-soxx-2021-04-06,https://j.mp/3uEZESn
