feed,title,long_url,short_url
Benzinga,Foot Locker And The Ebbing Tide Of Discretionary Spending,https://benzinga.com/news/earnings/23/05/32498849/foot-locker-and-the-ebbing-tide-of-discretionary-spending,https://da.gd/4drhyb
Benzinga,Bouncing Back Like a True Blue: Analyst Sees Upswing in Staffing Star's Fortunes,https://benzinga.com/analyst-ratings/analyst-color/23/05/32513679/bouncing-back-like-a-true-blue-analyst-sees-upswing-in-staffing-stars-fortunes,https://da.gd/UIlfcG
Benzinga,Check Out What Whales Are Doing With TTD,https://benzinga.com/markets/options/23/05/32515807/check-out-what-whales-are-doing-with-ttd,https://da.gd/PCnxe
Benzinga,Check Out What Whales Are Doing With SCHW,https://benzinga.com/markets/options/23/05/32515790/check-out-what-whales-are-doing-with-schw,https://da.gd/x3v6Qm
Benzinga,Shiba Inu Up More Than 3% In 24 hours,https://benzinga.com/markets/cryptocurrency/23/05/32515754/shiba-inu-up-more-than-3-in-24-hours,https://da.gd/hP2CiH
