feed,title,long_url,short_url
Yahoo,Amarin: Could the New CEO Help Vazkepa’s European Push?,https://finance.yahoo.com/news/amarin-could-ceo-help-vazkepa-190537195.html,https://yhoo.it/2PSK5ru
Yahoo,Magna International Rises on Reports of LG Venture on Apple Car,https://www.thestreet.com/investing/magna-spikes-amid-reports-of-lg-partnership-on-apple-car?puc=yahoo&cm_ven=YAHOO&yptr=yahoo,https://j.mp/32eldwC
Yahoo,This VC Gave Coinbase Its First Check,https://finance.yahoo.com/news/vc-gave-coinbase-first-check-185339363.html?.tsrc=rss,https://yhoo.it/3a8orq5
Yahoo,Coinbase Listing: The Journey From Y Combinator to Nasdaq,https://finance.yahoo.com/news/coinbase-listing-journey-y-combinator-185231860.html?.tsrc=rss,https://yhoo.it/3aqkvkH
Yahoo,"Amazon Donates $1.75 million to construct new STEAM high school in Onondaga County, New York",https://finance.yahoo.com/news/amazon-donates-1-75-million-193200771.html?.tsrc=rss,https://yhoo.it/3g4cOUN
