feed,title,long_url,short_url
SeekingAlpha,A viable 'KURE' for what ails volatile U.S. portfolios,https://seekingalpha.com/news/3591113,
SeekingAlpha,SoftLab9 Software Solutions changes name to Softlab9 Technologies,https://seekingalpha.com/news/3591170,
SeekingAlpha,Generation Mining to trade on TSX,https://seekingalpha.com/news/3591169,
SeekingAlpha,"Kura Sushi USA EPS misses by $0.30, misses on revenue",https://seekingalpha.com/news/3591168,
SeekingAlpha,Whitehaven Coal beats quarterly output expectations,https://seekingalpha.com/news/3591167,
SeekingAlpha,The AMD Superiority,https://seekingalpha.com/article/4358455,
