feed,title,long_url,short_url
FXEmpire,White House says Pelosi has a right to visit Taiwan,https://www.fxempire.com/news/article/white-house-says-pelosi-has-a-right-to-visit-taiwan-1082486,https://bit.ly/3znUOwG
FXEmpire,"Sierra Leone doctors strike over pay, fuel allowances",https://www.fxempire.com/news/article/sierra-leone-doctors-strike-over-pay-fuel-allowances-1082488,https://bit.ly/3bmUdmU
FXEmpire,"‘You can’t switch off death,’ German crematorium boss warns as energy crisis looms",https://www.fxempire.com/news/article/you-cant-switch-off-death-german-crematorium-boss-warns-as-energy-crisis-looms-1082489,https://bit.ly/3cXczeP
FXEmpire,Apple is sued by French app developers over app store fees,https://www.fxempire.com/news/article/apple-is-sued-by-french-app-developers-over-app-store-fees-1082485,https://bit.ly/3OQTOGX
FXEmpire,"‘The government didn’t do anything’: Mexican, Brazilian monkeypox responses draw concern",https://www.fxempire.com/news/article/the-government-didnt-do-anything-mexican-brazilian-monkeypox-responses-draw-concern-1082487,https://bit.ly/3QfXGmd
