feed,title,long_url,short_url
FXEmpire,U.S.-backed force in Syria wants ‘stronger’ U.S. warning for Turkey,https://www.fxempire.com/news/article/u-s-backed-force-in-syria-wants-stronger-u-s-warning-for-turkey-1213272,https://bit.ly/3UeIIyf
FXEmpire,Israeli PM Lapid urges world leaders to prevent ICJ opinion on Israel’s occupation,https://www.fxempire.com/news/article/israeli-pm-lapid-urges-world-leaders-to-prevent-icj-opinion-on-israels-occupation-1213260,https://bit.ly/3GSQBq4
FXEmpire,Middle of nowhere: Desert complex makes World Cup affordable for some,https://www.fxempire.com/news/article/middle-of-nowhere-desert-complex-makes-world-cup-affordable-for-some-1213275,https://bit.ly/3gHqnMH
FXEmpire,Three U.S. citizens indicted for funding Cameroon insurgents,https://www.fxempire.com/news/article/three-u-s-citizens-indicted-for-funding-cameroon-insurgents-1213273,https://bit.ly/3ENCjnT
FXEmpire,UK says will allow banks to take more risk to stay competitive,https://www.fxempire.com/news/article/uk-says-will-allow-banks-to-take-more-risk-to-stay-competitive-1213276,https://bit.ly/3GWiYUm
FXEmpire,Once arcane job openings survey becomes darling of Fed’s eye,https://www.fxempire.com/news/article/once-arcane-job-openings-survey-becomes-darling-of-feds-eye-1213258,https://bit.ly/3UheJpl
FXEmpire,Brazil stocks set to rally 13% by end-2023 despite policy uncertainty: Reuters poll,https://www.fxempire.com/news/article/brazil-stocks-set-to-rally-13-by-end-2023-despite-policy-uncertainty-reuters-poll-1213259,https://bit.ly/3Fa0Ncl
FXEmpire,BlockFi makes first appearance in bankruptcy court,https://www.fxempire.com/news/article/blockfi-makes-first-appearance-in-bankruptcy-court-1213257,https://bit.ly/3EO5bww
FXEmpire,"In Mexico, birdwatching offers fragile lifeline for nature, economy",https://www.fxempire.com/news/article/in-mexico-birdwatching-offers-fragile-lifeline-for-nature-economy-1213271,https://bit.ly/3UfBzh6
