feed,title,long_url,short_url
BeInCrypto,Meme Coin Dominance Falls to 18-Month Low – What’s Behind the Drop?,https://beincrypto.com/meme-coin-dominance-drop/,
BeInCrypto,Bitcoin Drops on PPI Data: Is More Downside Ahead?,https://beincrypto.com/bitcoin-drops-on-ppi-data-is-more-downside-ahead/,
BeInCrypto,"Bitcoin’s $117,400 CME Gap Closure Sparks Euphoria — and Caution",https://beincrypto.com/bitcoins-cme-gap-euphoria-caution/,
BeInCrypto,HBAR Price Consolidation May Continue As Outflows Reach 2-Month High,https://beincrypto.com/hbar-price-consolidation-may-continue/,
BeInCrypto,"Binance Bitcoin Deposits Surge, Signaling Potential Sell-Off Ahead",https://beincrypto.com/binance-bitcoin-deposits-surge-signaling-potential-sell-off-ahead/,
