feed,title,long_url,short_url
SeekingAlpha,"VYNE Therapeutics Non-GAAP EPS of -$0.20 beats by $0.06, revenue of $2.29M misses by $1.83M",https://seekingalpha.com/news/3814534,
SeekingAlpha,Benchmark 'skeptical' of Netflix plan to crack down on password sharing,https://seekingalpha.com/news/3814533,
SeekingAlpha,"Optical Cable GAAP EPS of -$0.12, revenue of $14.44M",https://seekingalpha.com/news/3814532,
SeekingAlpha,Revolve Group is called the ultimate reopening play by Needham,https://seekingalpha.com/news/3814531,
SeekingAlpha,IMV GAAP EPS of -$0.49 misses by $0.04,https://seekingalpha.com/news/3814530,
SeekingAlpha,CinCor Pharma to join Russell 2000 and Russell 3000 Indexes,https://seekingalpha.com/news/3814529,
