feed,title,long_url,short_url
SeekingAlpha,"FedEx falls after higher transportation, labor costs contribute to profit miss",https://seekingalpha.com/news/3814754,
SeekingAlpha,"Quest Resource Non-GAAP EPS of $0.08, revenue of $46.4M",https://seekingalpha.com/news/3814752,
SeekingAlpha,"High Tide GAAP EPS of -C$0.14, revenue of C$72.22M",https://seekingalpha.com/news/3814749,
SeekingAlpha,"Red Cat Holdings GAAP EPS of -$0.05, revenue of $1.86M",https://seekingalpha.com/news/3814748,
SeekingAlpha,"Dynagas LNG Partners LP GAAP EPS of $0.23, revenue of $35.68M",https://seekingalpha.com/news/3814747,
SeekingAlpha,Pulmatrix regains compliance with Nasdaq minimum bid price rule,https://seekingalpha.com/news/3814746,
