feed,title,long_url,short_url
TheStreet,A weird romance: Why car nerds are head over heels for station wagons,https://www.thestreet.com/automotive/a-weird-romance-car-nerds-love-station-wagons,https://da.gd/SmuG
TheStreet,Sam's Club makes a key move designed to trump Costco,https://www.thestreet.com/retail/sams-club-makes-a-key-move-designed-to-trump-costco,https://da.gd/0jcFG0
TheStreet,"Carnival, Royal Caribbean rival makes huge beverage change",https://www.thestreet.com/travel/carnival-royal-caribbean-rival-makes-huge-beverage-change,https://da.gd/tkZTNg
TheStreet,Costco has a new way to make money members will love,https://www.thestreet.com/retail/costco-has-a-new-way-to-make-money-members-will-love,https://da.gd/YB713
TheStreet,Disney World and Disneyland make changes Ron DeSantis will hate,https://www.thestreet.com/travel/disney-world-disneyland-makes-changes-ron-desantis-will-hate,https://da.gd/SzONT
