feed,title,long_url,short_url
SeekingAlpha,Hagerty appoints Patrick McClymont as CFO,https://seekingalpha.com/news/3875788,
SeekingAlpha,"Square lets U.K.-based sellers offer Buy Now, Pay Later solution via Clearpay",https://seekingalpha.com/news/3875787,
SeekingAlpha,Helius Medical adds 32% as Roth launches coverage with Buy,https://seekingalpha.com/news/3875786,
SeekingAlpha,Beyond Air affiliate Beyond Cancer doses patient in phase 1 study of ultra-high concentration nitric oxide therapy,https://seekingalpha.com/news/3875785,
SeekingAlpha,Datasea stock gains 6% premarket on $4.4M procurement deal for 5G messaging services,https://seekingalpha.com/news/3875784,
SeekingAlpha,BigCommerce forms strategic partnership with SheerID,https://seekingalpha.com/news/3875783,
