feed,title,long_url,short_url
Benzinga,Someone Just Sent $22M In Bitcoin Onto Coinbase,https://benzinga.com/markets/cryptocurrency/22/08/28604066/someone-just-sent-22m-in-bitcoin-onto-coinbase,https://bit.ly/3KgsyRN
Benzinga,Ethereum Whale Just Transferred $36M Worth of ETH Onto Binance,https://benzinga.com/markets/cryptocurrency/22/08/28604063/ethereum-whale-just-transferred-36m-worth-of-eth-onto-binance,https://bit.ly/3KmdRwn
Benzinga,Bitcoin Whale Just Transferred $37M Worth of BTC Onto Coinbase,https://benzinga.com/markets/cryptocurrency/22/08/28604057/bitcoin-whale-just-transferred-37m-worth-of-btc-onto-coinbase,https://bit.ly/3Kg7Hh9
Benzinga,Anonymous Bitcoin Whale Just Moved $65M Worth Of BTC Off Coinbase,https://benzinga.com/markets/cryptocurrency/22/08/28604054/anonymous-bitcoin-whale-just-moved-65m-worth-of-btc-off-coinbase,https://bit.ly/3Kg7HOb
Benzinga,This Wallet Just Transferred $70M Worth Of BTC Onto Gemini,https://benzinga.com/markets/cryptocurrency/22/08/28604050/this-wallet-just-transferred-70m-worth-of-btc-onto-gemini,https://bit.ly/3pCbgow
