feed,title,long_url,short_url
InsiderMonkey,Hedge Funds Aren’t Crazy About Burlington Stores Inc (BURL),https://insidermonkey.com/blog/--875195,https://j.mp/33dLz1Z
InsiderMonkey,Hedge Funds Aren’t Crazy About Cerner Corporation (CERN) Anymore,https://insidermonkey.com/blog/--875198,https://j.mp/3hdWTjB
InsiderMonkey,Neurocrine Biosciences (NBIX): Hedge Funds In Wait-and-See Mode,https://insidermonkey.com/blog/--875201,https://j.mp/2RhHwMl
InsiderMonkey,"Is Ulta Beauty, Inc. (ULTA) A Good Stock To Buy?",https://insidermonkey.com/blog/--875209,https://j.mp/3ho5Dnz
InsiderMonkey,Wright Medical (WMGI): Hedge Fund Interest Inching Up,https://insidermonkey.com/blog/--875212,https://j.mp/2ZpU9tg
InsiderMonkey,"Hedge Funds Have Never Been This Bullish On Alnylam Pharmaceuticals, Inc. (ALNY)",https://insidermonkey.com/blog/--875215,https://j.mp/3ijCxXI
InsiderMonkey,"Here is What Hedge Funds Think About CF Industries Holdings, Inc. (CF)",https://insidermonkey.com/blog/--875350,https://j.mp/35oq4OS
InsiderMonkey,"General Mills, Inc. (GIS): Hedge Funds Taking Some Chips Off The Table",https://insidermonkey.com/blog/--875359,https://j.mp/2GLwVYi
