feed,title,long_url,short_url
Yahoo,Central banks turn more cautious on rate cuts,https://finance.yahoo.com/news/central-banks-turn-more-cautious-124521193.html,https://da.gd/2LpUJC
Yahoo,"Exchange-Traded Funds, Equity Futures Lower Pre-Bell as Investors Digest Fed's Rate Decision",https://finance.yahoo.com/news/exchange-traded-funds-equity-futures-122556897.html?.tsrc=rss,https://da.gd/eK6XV
Yahoo,'Musk needs to change course': One of Tesla's biggest bulls says Musk needs to balance DOGE as stock flounders,https://finance.yahoo.com/news/musk-needs-to-change-course-one-of-teslas-biggest-bulls-says-musk-needs-to-balance-doge-as-stock-flounders-125300115.html?.tsrc=rss,https://da.gd/AZPxo
Yahoo,Tesla Recalls Cybertrucks After Steel Trim Pieces Come Loose,https://finance.yahoo.com/news/tesla-recalls-cybertrucks-steel-trim-120719082.html?.tsrc=rss,https://da.gd/8pz4r
Yahoo,"Tesla Needs CEO Musk to Balance DOGE Focus, Outline Vehicle Roadmap to Avoid Brand Crisis, Wedbush Says",https://finance.yahoo.com/news/tesla-needs-ceo-musk-balance-120712807.html?.tsrc=rss,https://da.gd/AXlMWm
