feed,title,long_url,short_url
SeekingAlpha,Acerus Pharmaceuticals reports Q4 results,https://seekingalpha.com/news/3671640,
SeekingAlpha,"Shyft EPS beats by $0.02, beats on revenue",https://seekingalpha.com/news/3671639,
SeekingAlpha,"General Electric continues to slide premarket, Oppenheimer weighs in",https://seekingalpha.com/news/3671638,
SeekingAlpha,BWX Technologies' subsidiary nabs $35M in contracts under two programs,https://seekingalpha.com/news/3671637,
SeekingAlpha,"Revlon EPS beats by $0.47, misses on revenue",https://seekingalpha.com/news/3671636,
SeekingAlpha,Endo proposes private offering of senior secured notes,https://seekingalpha.com/news/3671635,
SeekingAlpha,ADT upgraded at Deutsche Bank on Google solution potential,https://seekingalpha.com/news/3671634,
