feed,title,long_url,short_url
SeekingAlpha,BondBloxx US High Yield Telecom Media Technology Sector ETF declares monthly distribution of $0.1729,https://seekingalpha.com/news/4146794,
SeekingAlpha,BondBloxx US High Yield Industrial Sector ETF declares monthly distribution of $0.1725,https://seekingalpha.com/news/4146793,
SeekingAlpha,Codelco bids $500M for stake in Teck Resources Chilean copper mine - Bloomberg,https://seekingalpha.com/news/4146792,
SeekingAlpha,BondBloxx US High Yield Healthcare Sector ETF declares monthly distribution of $0.2866,https://seekingalpha.com/news/4146791,
SeekingAlpha,BondBloxx US High Yield Financial & REIT Sector ETF declares monthly distribution of $0.1899,https://seekingalpha.com/news/4146790,
SeekingAlpha,Xtrackers High Beta High Yield Bond ETF declares monthly distribution of $0.2733,https://seekingalpha.com/news/4146789,
SeekingAlpha,BondBloxx US High Yield Energy Sector ETF declares monthly distribution of $0.3389,https://seekingalpha.com/news/4146788,
SeekingAlpha,Peaking Back In On Intra-Cellular Therapies,https://seekingalpha.com/article/4718923,
SeekingAlpha,"AIG: An Insurance Heavyweight To Hold, Awaiting The Next Dip",https://seekingalpha.com/article/4718921,
SeekingAlpha,What A Difference A Day Makes,https://seekingalpha.com/article/4718920,
