feed,title,long_url,short_url
Investing,US Steel closes sharply on report Biden set to block merger with Nippon Steel,https://www.investing.com/news/stock-market-news/us-steel-closes-sharply-on-report-biden-set-to-block-merger-with-nippon-steel-3601672,https://da.gd/a7H0z
Investing,Earnings call: OPAP S.A. reports strong Q2 with online growth,https://www.investing.com/news/stock-market-news/earnings-call-opap-sa-reports-strong-q2-with-online-growth-93CH-3601671,https://da.gd/wJbgC
Investing,"Earnings call: Sportsman's Warehouse faces sales dip, focuses on core growth",https://www.investing.com/news/stock-market-news/earnings-call-sportsmans-warehouse-faces-sales-dip-focuses-on-core-growth-93CH-3601669,https://da.gd/9VcuV
Investing,"Earnings call: Asana reports steady Q2 growth, plans AI Studio launch",https://www.investing.com/news/stock-market-news/earnings-call-asana-reports-steady-q2-growth-plans-ai-studio-launch-93CH-3601666,https://da.gd/jj7IRf
Investing,"After-hours movers: HPE, Topgolf Callaway, Fortive and more",https://www.investing.com/news/stock-market-news/afterhours-movers-hpe-topgolf-callaway-fortive-and-more-432SI-3601656,https://da.gd/Ut8QN
Investing,Earnings call: America's Car-Mart navigates market with strategic focus,https://www.investing.com/news/stock-market-news/earnings-call-americas-carmart-navigates-market-with-strategic-focus-93CH-3601657,https://da.gd/92lDCe
