feed,title,long_url,short_url
SeekingAlpha,Catalent promotes internal candidate to serve as SVP & CFO,https://seekingalpha.com/news/3694445,
SeekingAlpha,AcuityAds Holdings reports Q1 results,https://seekingalpha.com/news/3694443,
SeekingAlpha,"Palantir stock pulls back despite Q1 revenue beat, upside sales guidance",https://seekingalpha.com/news/3694442,
SeekingAlpha,AstraZeneca urged by EU to deliver 120 million COVID-19 vaccine doses by end of June,https://seekingalpha.com/news/3694441,
SeekingAlpha,"Novanta EPS beats by $0.19, beats on revenue",https://seekingalpha.com/news/3694440,
