feed,title,long_url,short_url
SeekingAlpha,"Citi drops Alphabet from Recommended List, adding ViacomCBS in place",https://seekingalpha.com/news/3694646,
SeekingAlpha,IEI: Duration Risk In Action,https://seekingalpha.com/article/4427342,
SeekingAlpha,"If You Took A Bath On Bellatrix, You Can Make A Ton On Spartan Delta",https://seekingalpha.com/article/4427341,
SeekingAlpha,Coming Around To Stablecoins: USDC,https://seekingalpha.com/article/4427340,
SeekingAlpha,Nikola's Prospects Remain Dim,https://seekingalpha.com/article/4427339,
