feed,title,long_url,short_url
InsiderMonkey,12 Best Autonomous Driving Stocks To Buy Now,https://insidermonkey.com/blog/--1253260,
InsiderMonkey,5 Best Autonomous Driving Stocks To Buy Now,https://insidermonkey.com/blog/--1253665,
InsiderMonkey,Philip Morris International Inc. (NYSE:PM) Q4 2023 Earnings Call Transcript,https://insidermonkey.com/blog/--1258096,
InsiderMonkey,"Phillips Edison & Company, Inc. (NASDAQ:PECO) Q4 2023 Earnings Call Transcript",https://insidermonkey.com/blog/--1258097,
InsiderMonkey,Lattice Semiconductor Corporation (NASDAQ:LSCC) Q4 2023 Earnings Call Transcript,https://insidermonkey.com/blog/--1258110,
InsiderMonkey,James Hardie Industries plc (NYSE:JHX) Q3 2024 Earnings Call Transcript,https://insidermonkey.com/blog/--1258108,
InsiderMonkey,"PetVivo Holdings, Inc. (NASDAQ:PETV) Q3 2024 Earnings Call Transcript",https://insidermonkey.com/blog/--1258109,
InsiderMonkey,"Beyond Air, Inc. (NASDAQ:XAIR) Q3 2024 Earnings Call Transcript",https://insidermonkey.com/blog/--1258111,
