feed,title,long_url,short_url
SeekingAlpha,AgeX to collaborate with Ohio State University in AgeX-BAT1 research,https://seekingalpha.com/news/3671138,
SeekingAlpha,Vertex Pharma launches VX-880 study in diabetes; secures Fast Track tag,https://seekingalpha.com/news/3671137,
SeekingAlpha,Associated Banc-Corp names new president & CEO,https://seekingalpha.com/news/3671136,
SeekingAlpha,"BioDelivery Sciences EPS beats by $0.04, beats on revenue",https://seekingalpha.com/news/3671135,
SeekingAlpha,Establishment Labs beats on revenue,https://seekingalpha.com/news/3671134,
SeekingAlpha,"Vera Bradley EPS misses by $0.08, misses on revenue",https://seekingalpha.com/news/3671133,
