feed,title,long_url,short_url
Yahoo,Lyft's first-quarter bookings forecast pressured by fierce competition with Uber,https://finance.yahoo.com/news/lyfts-first-quarter-bookings-forecast-210654175.html,https://da.gd/ad9cO
Yahoo,China's Mixue seeks US$500 million in Hong Kong IPO after Guming's share sale,https://finance.yahoo.com/news/chinas-mixue-seeks-us-500-093000840.html,https://da.gd/yRiy3q
Yahoo,Moonshot firm ispace upbeat as Trump keeps Artemis lunar missions with Japan,https://finance.yahoo.com/news/moonshot-firm-ispace-upbeat-trump-092504754.html,https://da.gd/OeEnLV
Yahoo,DoorDash tops quarterly revenue estimates on strong online orders during holidays,https://finance.yahoo.com/news/doordash-tops-quarterly-revenue-estimates-210728795.html,https://da.gd/lJqKKP
Yahoo,"Australia business confidence improves even as conditions slacken, survey says",https://finance.yahoo.com/news/australia-business-confidence-improves-even-003132076.html,https://da.gd/oTQTud
Yahoo,Bain Capital says it may withdraw tender offer proposal for Fuji Soft,https://finance.yahoo.com/news/bain-capital-says-may-withdraw-012101261.html,https://da.gd/LcF4f
Yahoo,"Dollar falls as tariff concerns ease, Fed's Powell stays patient on rate cuts",https://finance.yahoo.com/news/dollar-underpinned-latest-tariff-moves-013319323.html,https://da.gd/19iGEE
Yahoo,"Oil prices climb to 2-week high on supply worries, US tariffs check gains",https://finance.yahoo.com/news/oil-steady-investors-digest-u-013758250.html,https://da.gd/JGnPR
Yahoo,Prediction: Nvidia Stock Is Going to Surge After Feb. 26,https://finance.yahoo.com/news/prediction-nvidia-stock-going-surge-085700268.html,https://da.gd/ygVUY
