feed,title,long_url,short_url
Investing,"BofA Securities downgrades Entain to ""neutral"" following CEO’s sudden exit",https://www.investing.com/news/stock-market-news/bofa-securities-downgrades-entain-to-neutral-following-ceos-sudden-exit-3864379,https://da.gd/tSThGb
Investing,OneStream shares tumble after Q4 results and downgrades,https://www.investing.com/news/stock-market-news/onestream-shares-tumble-after-q4-results-and-downgrades-93CH-3864375,https://da.gd/GzFdo3
Investing,Nike to witness 'slow growth with little margin rebound': UBS,https://www.investing.com/news/stock-market-news/nike-to-witness-slow-growth-with-little-margin-rebound-ubs-3864369,https://da.gd/ng2ll
Investing,"Kraft Heinz, Lyft fall premarket; CVS Health, DoorDash and Restaurant Brands rise",https://www.investing.com/news/stock-market-news/kraft-heinz-lyft-fall-premarket-cvs-health-doordash-and-restaurant-brands-rise-3864341,https://da.gd/WQz2d
Investing,Saudi Arabia stocks lower at close of trade; Tadawul All Share down 0.31%,https://www.investing.com/news/stock-market-news/saudi-arabia-stocks-lower-at-close-of-trade-tadawul-all-share-down-031-3864366,https://da.gd/CRzJM
Investing,Neuphoria Therapeutics shares surge on $15M Merck payment,https://www.investing.com/news/stock-market-news/neuphoria-therapeutics-shares-surge-on-15m-merck-payment-93CH-3864349,https://da.gd/9JOI5
