feed,title,long_url,short_url
Investing,BlackRock’s Quiet Bitcoin Accumulation Strategy — A Power Move?,https://www.investing.com/analysis/blackrocks-quiet-bitcoin-accumulation-strategy--a-power-move-200660236,https://da.gd/JYX8E
Investing,"Top Trader Brandt Predicts Bitcoin to $150,000 by September, Here’s Big Nuance",https://www.investing.com/news/cryptocurrency-news/top-trader-brandt-predicts-bitcoin-to-150000-by-september-heres-big-nuance-4017949,https://da.gd/KfiYjG
Investing,'We Love to See It': Top Trader Issues Big Bitcoin Price Update,https://www.investing.com/news/cryptocurrency-news/we-love-to-see-it-top-trader-issues-big-bitcoin-price-update-4017947,https://da.gd/ycM22P
Investing,Canada stocks lower at close of trade; S&P/TSX Composite down 0.19%,https://www.investing.com/news/stock-market-news/canada-stocks-lower-at-close-of-trade-sptsx-composite-down-019-4017945,https://da.gd/hzDO5
Investing,Roku forecasts second-quarter revenue below estimates as economic uncertainty weighs,https://www.investing.com/news/stock-market-news/roku-forecasts-secondquarter-revenue-below-estimates-4017856,https://da.gd/VU58
Investing,"Amgen quarterly profit tops Wall Street view, sales up 11%",https://www.investing.com/news/stock-market-news/amgen-quarterly-profit-tops-wall-street-view-sales-up-11-4017919,https://da.gd/Zk4VI
Investing,Amazon reports soft guidance after Q1 results beat,https://www.investing.com/news/stock-market-news/amazon-reports-soft-guidance-after-q1-results-beat-4017845,https://da.gd/Zuq46
