feed,title,long_url,short_url
Cointelegraph,FBI will use NFTs to contact victims of crypto fraud scheme Clucoin,https://cointelegraph.com/news/fbi-use-nfts-contact-victims-crypto-fraud-scheme-clucoin?utm_source=rss_feed&utm_medium=rss%3F1724379227063&utm_campaign=rss_partner_inbound,https://da.gd/AXCT
Cointelegraph,"Bitcoin miners steamrolled after electricity thefts, exchange ‘closure’ scam: Asia Express",https://cointelegraph.com/magazine/bitcoin-mining-crackdown-epicenters-nft-phishing-scam-asia-express/?utm_source=rss_feed&utm_medium=rss%3F1724379227063&utm_campaign=rss_partner_inbound,https://da.gd/Lh8fcs
Cointelegraph,Is it time for Avalanche (AVAX) price to turn bullish?,https://cointelegraph.com/news/is-it-time-for-avalanche-avax-price-to-turn-bullish?utm_source=rss_feed&utm_medium=rss%3F1724379227063&utm_campaign=rss_partner_inbound,https://da.gd/gYXoW
Cointelegraph,Kamala Harris campaign may focus on highlighting innovation over crypto,https://cointelegraph.com/news/kamala-harris-campaign-innovation-crypto?utm_source=rss_feed&utm_medium=rss%3F1724379227063&utm_campaign=rss_partner_inbound,https://da.gd/exm8g
Cointelegraph,Bitcoin is holding $60K — Here’s why it’s important,https://cointelegraph.com/news/bitcoin-is-holding-60k-here-s-why-its-important?utm_source=rss_feed&utm_medium=rss%3F1724379227063&utm_campaign=rss_partner_inbound,https://da.gd/Y7sDc
Cointelegraph,Elon Musk’s Twitter buyout is going so poorly that banks had to issue pay cuts,https://cointelegraph.com/news/elon-musk-twitter-buyout-going-poorly-banks-issue-pay-cuts?utm_source=rss_feed&utm_medium=rss%3F1724379227063&utm_campaign=rss_partner_inbound,https://da.gd/0fUSB
Cointelegraph,California DMV putting vehicle titles on a subnet is innovation theater,https://cointelegraph.com/news/california-dmv-vehicle-titles-subnet-innovation-theater?utm_source=rss_feed&utm_medium=rss%3F1724379227063&utm_campaign=rss_partner_inbound,https://da.gd/W7UEZ
Cointelegraph,Here’s what happened in crypto today,https://cointelegraph.com/news/what-happened-in-crypto-today?utm_source=rss_feed&utm_medium=rss%3F1724379227063&utm_campaign=rss_partner_inbound,https://da.gd/PeFP1
Cointelegraph,Why is the crypto market up today?,https://cointelegraph.com/news/why-is-the-crypto-market-up-today?utm_source=rss_feed&utm_medium=rss%3F1724379227063&utm_campaign=rss_partner_inbound,https://da.gd/G4CU
Cointelegraph,Bitcoin exchange inflow has fallen sharply in August — CryptoQuant,https://cointelegraph.com/news/bitcoin-exchange-inflows-drop-significantly-august?utm_source=rss_feed&utm_medium=rss%3F1724379227063&utm_campaign=rss_partner_inbound,https://da.gd/Sy7o
Cointelegraph,Changpeng Zhao moved to custody of field office ahead of Sept release,https://cointelegraph.com/news/changpeng-zhao-moved-prison-facility-september-release?utm_source=rss_feed&utm_medium=rss%3F1724379227063&utm_campaign=rss_partner_inbound,https://da.gd/Eb0mY
Cointelegraph,Mercado Libre launches USD-pegged Meli Dollar stablecoin in Brazil,https://cointelegraph.com/news/mercado-libre-launches-meli-dollar-stablecoin-brazil?utm_source=rss_feed&utm_medium=rss%3F1724379227063&utm_campaign=rss_partner_inbound,https://da.gd/zt3ua5
Cointelegraph,HTC launches no-code game creator for ‘Viverse’ metaverse,https://cointelegraph.com/news/htc-launches-no-code-game-creator-viverse-metaverse?utm_source=rss_feed&utm_medium=rss%3F1724379227063&utm_campaign=rss_partner_inbound,https://da.gd/6jWh3
Cointelegraph,Anchorage Digital adds PayPal stablecoin yield to custody platform,https://cointelegraph.com/news/anchorage-adds-paypal-stablecoin-yield-custody-platform?utm_source=rss_feed&utm_medium=rss%3F1724379227063&utm_campaign=rss_partner_inbound,https://da.gd/Qevph2
Cointelegraph,3 reasons why Bitcoin price could hit $68K in September,https://cointelegraph.com/news/3-reasons-why-bitcoin-price-could-hit-68-k-in-september?utm_source=rss_feed&utm_medium=rss%3F1724379227063&utm_campaign=rss_partner_inbound,https://da.gd/ICyTJK
Cointelegraph,Partner of ex-FTX exec hit with campaign finance charges,https://cointelegraph.com/news/ftx-partner-michelle-bond-campaign-finance-charges?utm_source=rss_feed&utm_medium=rss%3F1724379227063&utm_campaign=rss_partner_inbound,https://da.gd/aNrWLc
Cointelegraph,UK risks quantum startup exodus after Labour slashes incentives,https://cointelegraph.com/news/uk-risks-quantum-computing-startup-exodus-labour-slashes-incentives?utm_source=rss_feed&utm_medium=rss%3F1724379227063&utm_campaign=rss_partner_inbound,https://da.gd/lRWjrL
Cointelegraph,Metaverse pioneer and movie VFX team unite for blockchain project,https://cointelegraph.com/news/lamina1-weta-workshop-metaverse-artefact?utm_source=rss_feed&utm_medium=rss%3F1724379227063&utm_campaign=rss_partner_inbound,https://da.gd/epFG
Cointelegraph,"AI drone ‘hellscape’ plan for Taiwan, LLMs too dumb to destroy humanity: AI Eye",https://cointelegraph.com/magazine/ai-drone-hellscape-plan-for-taiwan-llms-too-dumb-to-destroy-humanity-ai-eye/?utm_source=rss_feed&utm_medium=rss%3F1724379227063&utm_campaign=rss_partner_inbound,https://da.gd/MdJ8l
Cointelegraph,Grayscale launches investment fund for AVAX token,https://cointelegraph.com/news/grayscale-launches-investment-fund-avax-token?utm_source=rss_feed&utm_medium=rss%3F1724379227063&utm_campaign=rss_partner_inbound,https://da.gd/m2slQ
Cointelegraph,Why is the BNB price up today?,https://cointelegraph.com/news/why-is-bnb-price-up-today?utm_source=rss_feed&utm_medium=rss%3F1724379227063&utm_campaign=rss_partner_inbound,https://da.gd/W0idKB
Cointelegraph,Magic Eden Foundation launches ME token for cross-chain trading,https://cointelegraph.com/news/magic-eden-foundation-launches-me-token-cross-chain-trading?utm_source=rss_feed&utm_medium=rss%3F1724379227063&utm_campaign=rss_partner_inbound,https://da.gd/RYfC4
Cointelegraph,Compliance experts should help regulate crypto — Silk Road 2.0 founder,https://cointelegraph.com/news/compliance-regulate-crypto-silk-road?utm_source=rss_feed&utm_medium=rss%3F1724379227063&utm_campaign=rss_partner_inbound,https://da.gd/h1GG
Cointelegraph,Ocean Nodes Incentive Program delayed for back-end improvements,https://cointelegraph.com/news/ocean-protocol-delays-node-incentive-program?utm_source=rss_feed&utm_medium=rss%3F1724379227063&utm_campaign=rss_partner_inbound,https://da.gd/MquKbj
Cointelegraph,Franklin Templeton expands blockchain fund to Avalanche network,https://cointelegraph.com/news/franklin-templeton-onchain-us-money-fund-avalanche-expansion?utm_source=rss_feed&utm_medium=rss%3F1724379227063&utm_campaign=rss_partner_inbound,https://da.gd/Bvso
Cointelegraph,Nearly 80% of hacked cryptocurrencies never recover in price — Immunefi,https://cointelegraph.com/news/crypto-hacks-price-declines-report-2024?utm_source=rss_feed&utm_medium=rss%3F1724379227063&utm_campaign=rss_partner_inbound,https://da.gd/XepMMg
Cointelegraph,India’s crypto future hinges on gov’t consultation paper,https://cointelegraph.com/news/india-crypto-regulation-dea-paper-september?utm_source=rss_feed&utm_medium=rss%3F1724379227063&utm_campaign=rss_partner_inbound,https://da.gd/uvkoYm
Cointelegraph,Hong Kong targets noncompliant crypto exchanges in licensing push,https://cointelegraph.com/news/hong-kong-crypto-exchanges-license-scrutiny?utm_source=rss_feed&utm_medium=rss%3F1724379227063&utm_campaign=rss_partner_inbound,https://da.gd/EhoJNi
Cointelegraph,FTX says creditors supported reorganization plan with 95% vote,https://cointelegraph.com/news/ftx-reorganization-plan-gains-creditor-support?utm_source=rss_feed&utm_medium=rss%3F1724379227063&utm_campaign=rss_partner_inbound,https://da.gd/I5tj0
Cointelegraph,Former TON Foundation execs establish new community initiative,https://cointelegraph.com/news/former-ton-execs-establish-community-initiative?utm_source=rss_feed&utm_medium=rss%3F1724379227063&utm_campaign=rss_partner_inbound,https://da.gd/aXmht
