feed,title,long_url,short_url
Cointelegraph,OmegaPro co-founder arrested over $4 billion crypto scam,https://cointelegraph.com/news/omegapro-ceo-arrested-over-4-billion-crypto-scam?utm_source=rss_feed&utm_medium=rss%3F1724391834766&utm_campaign=rss_partner_inbound,https://da.gd/cFCCT
Cointelegraph,ETH Dencun upgrade attracts more L2 bots and failed txs: Galaxy Research,https://cointelegraph.com/news/bot-driven-l2-transaction-failures-surge-following-ethereum-s-fee-reducing-upgrade?utm_source=rss_feed&utm_medium=rss%3F1724391834766&utm_campaign=rss_partner_inbound,https://da.gd/D8mfx
Cointelegraph,SEC opposes Richard Heart’s bid to dismiss $1B securities lawsuit,https://cointelegraph.com/news/sec-rebuffs-richard-heart-bid-dismiss-1-billion-securities-lawsuit?utm_source=rss_feed&utm_medium=rss%3F1724391834766&utm_campaign=rss_partner_inbound,https://da.gd/oaq3V
Cointelegraph,Justin Sun says removing 12K Bitcoin from USDD is just ‘DeFi 101’,https://cointelegraph.com/news/justin-sun-says-removing-12k-bitcoin-usdd-defi-101?utm_source=rss_feed&utm_medium=rss%3F1724391834766&utm_campaign=rss_partner_inbound,https://da.gd/ajgyuM
Cointelegraph,Bitcoin miner OTC balances reach 2-year high — Why it’s a bearish signal,https://cointelegraph.com/news/bitcoin-miner-otc-balances-high-bearish-price-btc?utm_source=rss_feed&utm_medium=rss%3F1724391834766&utm_campaign=rss_partner_inbound,https://da.gd/JiaPC
Cointelegraph,FBI will use NFTs to contact victims of crypto fraud scheme Clucoin,https://cointelegraph.com/news/fbi-use-nfts-contact-victims-crypto-fraud-scheme-clucoin?utm_source=rss_feed&utm_medium=rss%3F1724391834766&utm_campaign=rss_partner_inbound,https://da.gd/hhfrA
Cointelegraph,"Bitcoin miners steamrolled after electricity thefts, exchange ‘closure’ scam: Asia Express",https://cointelegraph.com/magazine/bitcoin-mining-crackdown-epicenters-nft-phishing-scam-asia-express/?utm_source=rss_feed&utm_medium=rss%3F1724391834766&utm_campaign=rss_partner_inbound,https://da.gd/Z55MT
Cointelegraph,Is it time for Avalanche (AVAX) price to turn bullish?,https://cointelegraph.com/news/is-it-time-for-avalanche-avax-price-to-turn-bullish?utm_source=rss_feed&utm_medium=rss%3F1724391834766&utm_campaign=rss_partner_inbound,https://da.gd/rhZDOy
Cointelegraph,Kamala Harris campaign may focus on highlighting innovation over crypto,https://cointelegraph.com/news/kamala-harris-campaign-innovation-crypto?utm_source=rss_feed&utm_medium=rss%3F1724391834766&utm_campaign=rss_partner_inbound,https://da.gd/BBnKR
Cointelegraph,Bitcoin is holding $60K — Here’s why it’s important,https://cointelegraph.com/news/bitcoin-is-holding-60k-here-s-why-its-important?utm_source=rss_feed&utm_medium=rss%3F1724391834766&utm_campaign=rss_partner_inbound,https://da.gd/tnimi
Cointelegraph,Elon Musk’s Twitter buyout is going so poorly that banks had to issue pay cuts,https://cointelegraph.com/news/elon-musk-twitter-buyout-going-poorly-banks-issue-pay-cuts?utm_source=rss_feed&utm_medium=rss%3F1724391834766&utm_campaign=rss_partner_inbound,https://da.gd/5M0Y5
Cointelegraph,California DMV putting vehicle titles on a subnet is innovation theater,https://cointelegraph.com/news/california-dmv-vehicle-titles-subnet-innovation-theater?utm_source=rss_feed&utm_medium=rss%3F1724391834766&utm_campaign=rss_partner_inbound,https://da.gd/ovwwJ
Cointelegraph,Here’s what happened in crypto today,https://cointelegraph.com/news/what-happened-in-crypto-today?utm_source=rss_feed&utm_medium=rss%3F1724391834766&utm_campaign=rss_partner_inbound,https://da.gd/j5ihcG
Cointelegraph,Why is the crypto market up today?,https://cointelegraph.com/news/why-is-the-crypto-market-up-today?utm_source=rss_feed&utm_medium=rss%3F1724391834766&utm_campaign=rss_partner_inbound,https://da.gd/0yhUGx
Cointelegraph,Bitcoin exchange inflow has fallen sharply in August — CryptoQuant,https://cointelegraph.com/news/bitcoin-exchange-inflows-drop-significantly-august?utm_source=rss_feed&utm_medium=rss%3F1724391834766&utm_campaign=rss_partner_inbound,https://da.gd/CKBX
Cointelegraph,Changpeng Zhao moved to custody of field office ahead of Sept release,https://cointelegraph.com/news/changpeng-zhao-moved-prison-facility-september-release?utm_source=rss_feed&utm_medium=rss%3F1724391834766&utm_campaign=rss_partner_inbound,https://da.gd/s1Be4s
Cointelegraph,Mercado Libre launches USD-pegged Meli Dollar stablecoin in Brazil,https://cointelegraph.com/news/mercado-libre-launches-meli-dollar-stablecoin-brazil?utm_source=rss_feed&utm_medium=rss%3F1724391834766&utm_campaign=rss_partner_inbound,https://da.gd/CADBW
Cointelegraph,HTC launches no-code game creator for ‘Viverse’ metaverse,https://cointelegraph.com/news/htc-launches-no-code-game-creator-viverse-metaverse?utm_source=rss_feed&utm_medium=rss%3F1724391834766&utm_campaign=rss_partner_inbound,https://da.gd/b5xKg
Cointelegraph,Anchorage Digital adds PayPal stablecoin yield to custody platform,https://cointelegraph.com/news/anchorage-adds-paypal-stablecoin-yield-custody-platform?utm_source=rss_feed&utm_medium=rss%3F1724391834766&utm_campaign=rss_partner_inbound,https://da.gd/PzGus
Cointelegraph,3 reasons why Bitcoin price could hit $68K in September,https://cointelegraph.com/news/3-reasons-why-bitcoin-price-could-hit-68-k-in-september?utm_source=rss_feed&utm_medium=rss%3F1724391834766&utm_campaign=rss_partner_inbound,https://da.gd/y9RaD
Cointelegraph,Partner of ex-FTX exec hit with campaign finance charges,https://cointelegraph.com/news/ftx-partner-michelle-bond-campaign-finance-charges?utm_source=rss_feed&utm_medium=rss%3F1724391834766&utm_campaign=rss_partner_inbound,https://da.gd/IyAEa3
Cointelegraph,UK risks quantum startup exodus after Labour slashes incentives,https://cointelegraph.com/news/uk-risks-quantum-computing-startup-exodus-labour-slashes-incentives?utm_source=rss_feed&utm_medium=rss%3F1724391834766&utm_campaign=rss_partner_inbound,https://da.gd/CQpE
Cointelegraph,Metaverse pioneer and movie VFX team unite for blockchain project,https://cointelegraph.com/news/lamina1-weta-workshop-metaverse-artefact?utm_source=rss_feed&utm_medium=rss%3F1724391834766&utm_campaign=rss_partner_inbound,https://da.gd/qcYUe
Cointelegraph,"AI drone ‘hellscape’ plan for Taiwan, LLMs too dumb to destroy humanity: AI Eye",https://cointelegraph.com/magazine/ai-drone-hellscape-plan-for-taiwan-llms-too-dumb-to-destroy-humanity-ai-eye/?utm_source=rss_feed&utm_medium=rss%3F1724391834766&utm_campaign=rss_partner_inbound,https://da.gd/taXMWA
Cointelegraph,Grayscale launches investment fund for AVAX token,https://cointelegraph.com/news/grayscale-launches-investment-fund-avax-token?utm_source=rss_feed&utm_medium=rss%3F1724391834766&utm_campaign=rss_partner_inbound,https://da.gd/rFTHL
Cointelegraph,Why is the BNB price up today?,https://cointelegraph.com/news/why-is-bnb-price-up-today?utm_source=rss_feed&utm_medium=rss%3F1724391834766&utm_campaign=rss_partner_inbound,https://da.gd/Xatg
Cointelegraph,Magic Eden Foundation launches ME token for cross-chain trading,https://cointelegraph.com/news/magic-eden-foundation-launches-me-token-cross-chain-trading?utm_source=rss_feed&utm_medium=rss%3F1724391834766&utm_campaign=rss_partner_inbound,https://da.gd/KJ8rFO
Cointelegraph,Compliance experts should help regulate crypto — Silk Road 2.0 founder,https://cointelegraph.com/news/compliance-regulate-crypto-silk-road?utm_source=rss_feed&utm_medium=rss%3F1724391834766&utm_campaign=rss_partner_inbound,https://da.gd/2iIb
Cointelegraph,Ocean Nodes Incentive Program delayed for back-end improvements,https://cointelegraph.com/news/ocean-protocol-delays-node-incentive-program?utm_source=rss_feed&utm_medium=rss%3F1724391834766&utm_campaign=rss_partner_inbound,https://da.gd/8Ctxz
Cointelegraph,Franklin Templeton expands blockchain fund to Avalanche network,https://cointelegraph.com/news/franklin-templeton-onchain-us-money-fund-avalanche-expansion?utm_source=rss_feed&utm_medium=rss%3F1724391834766&utm_campaign=rss_partner_inbound,https://da.gd/mt56gW
