feed,title,long_url,short_url
Cointelegraph,Mac users beware: AMOS malware clones wallet apps and comes for your crypto,https://cointelegraph.com/news/mac-amos-malware-clones-wallet-crypto?utm_source=rss_feed&utm_medium=rss%3F1724420587754&utm_campaign=rss_partner_inbound,https://da.gd/B2ndI
Cointelegraph,"Tether shuns blockchain launch, cites market concerns",https://cointelegraph.com/news/tether-shun-blockchain-launch-cites-saturation-strategy?utm_source=rss_feed&utm_medium=rss%3F1724420587754&utm_campaign=rss_partner_inbound,https://da.gd/epZ5kV
Cointelegraph,Fetch.ai launches Innovation Lab with $10M fund for startups,https://cointelegraph.com/news/fetch-ai-innovation-lab-10-m-fund-startups?utm_source=rss_feed&utm_medium=rss%3F1724420587754&utm_campaign=rss_partner_inbound,https://da.gd/xrWg
Cointelegraph,"RFK Jr drops out of presidential race, while Trump takes lead on Polymarket",https://cointelegraph.com/news/rfk-jr-drops-out-presidential-elections-race?utm_source=rss_feed&utm_medium=rss%3F1724420587754&utm_campaign=rss_partner_inbound,https://da.gd/kS6fcP
Cointelegraph,Here’s what happened in crypto today,https://cointelegraph.com/news/what-happened-in-crypto-today?utm_source=rss_feed&utm_medium=rss%3F1724420587754&utm_campaign=rss_partner_inbound,https://da.gd/iE99
Cointelegraph,Is XRP bottoming out versus Bitcoin? Chart fractal mirrors 500% rally setup,https://cointelegraph.com/news/xrp-bottoming-bitcoin-chart-fractal-500-rally-setup?utm_source=rss_feed&utm_medium=rss%3F1724420587754&utm_campaign=rss_partner_inbound,https://da.gd/2gBd
Cointelegraph,China accessing high-level AI chips banned by the US: Report,https://cointelegraph.com/news/china-ai-cloud-us-chip-ban-loophole?utm_source=rss_feed&utm_medium=rss%3F1724420587754&utm_campaign=rss_partner_inbound,https://da.gd/pgLNv
Cointelegraph,$24M CryptoPunk sale shows either ‘NFTs are over’ or ‘this is the bottom’,https://cointelegraph.com/news/cryptopunk-nft-sale-market-decline?utm_source=rss_feed&utm_medium=rss%3F1724420587754&utm_campaign=rss_partner_inbound,https://da.gd/rs7EV
Cointelegraph,El Salvador’s Bitcoin holdings grow by 162 BTC with daily buys,https://cointelegraph.com/news/el-salvador-daily-bitcoin-purchases-bukele-strategy?utm_source=rss_feed&utm_medium=rss%3F1724420587754&utm_campaign=rss_partner_inbound,https://da.gd/hJ6fEV
Cointelegraph,Anthropic jumps in on tug-of-war over California AI bill,https://cointelegraph.com/news/california-ai-regulation-anthropic-support?utm_source=rss_feed&utm_medium=rss%3F1724420587754&utm_campaign=rss_partner_inbound,https://da.gd/5VPr6
Cointelegraph,Bitcoin braces for Fed’s Powell as $61K BTC price eyes next breakout,https://cointelegraph.com/news/bitcoin-fed-powell-61k-btc-price-next-breakout?utm_source=rss_feed&utm_medium=rss%3F1724420587754&utm_campaign=rss_partner_inbound,https://da.gd/Gjj4yV
Cointelegraph,Proof-of-Ink by Gavin Wood: The tattoo that secures your Web3 privacy,https://cointelegraph.com/news/proof-of-ink-gavin-wood-tattoo-web3-privacy?utm_source=rss_feed&utm_medium=rss%3F1724420587754&utm_campaign=rss_partner_inbound,https://da.gd/uEJmn5
Cointelegraph,Upbit to pause NEAR deposits for network upgrade,https://cointelegraph.com/news/upbit-suspends-near-protocol-network-upgrade?utm_source=rss_feed&utm_medium=rss%3F1724420587754&utm_campaign=rss_partner_inbound,https://da.gd/HorXyM
Cointelegraph,Soneium blockchain launched by Sony to attract Web3 developers,https://cointelegraph.com/news/sony-startale-joint-venture-ethereum-layer2-blockchain-soneium?utm_source=rss_feed&utm_medium=rss%3F1724420587754&utm_campaign=rss_partner_inbound,https://da.gd/8hvUi
Cointelegraph,Decentralized naming could bring ‘next billion’ users to Bitcoin,https://cointelegraph.com/news/decentralized-naming-bitcoin-secure-domains?utm_source=rss_feed&utm_medium=rss%3F1724420587754&utm_campaign=rss_partner_inbound,https://da.gd/U3dUy
Cointelegraph,Bitcoin avg. transaction fee rises 937.7% in 24 hours,https://cointelegraph.com/news/bitcoin-transaction-fees-surge-24-hours?utm_source=rss_feed&utm_medium=rss%3F1724420587754&utm_campaign=rss_partner_inbound,https://da.gd/ZfuZD
Cointelegraph,Crypto pyramid scheme leader extradited to China after global pursuit,https://cointelegraph.com/news/china-extradites-crypto-scam-mastermind-thailand?utm_source=rss_feed&utm_medium=rss%3F1724420587754&utm_campaign=rss_partner_inbound,https://da.gd/1Tvc0
Cointelegraph,Australian regulator claims win over Kraken’s Bit Trade in federal court,https://cointelegraph.com/news/asic-wins-case-against-crypto-exchange-operator-bit-trade?utm_source=rss_feed&utm_medium=rss%3F1724420587754&utm_campaign=rss_partner_inbound,https://da.gd/2831M2
Cointelegraph,Bitcoin must ‘clear resistance’ at $62K to avoid another ‘Black Monday’,https://cointelegraph.com/news/bitcoin-price-resistance-level-crypto-black-monday-kraken-crypto-update?utm_source=rss_feed&utm_medium=rss%3F1724420587754&utm_campaign=rss_partner_inbound,https://da.gd/7AV2g
Cointelegraph,Crypto law firm loses appeal to force SEC’s hand on Ether classification,https://cointelegraph.com/news/hodl-law-court-loss-challenging-sec-eth-security?utm_source=rss_feed&utm_medium=rss%3F1724420587754&utm_campaign=rss_partner_inbound,https://da.gd/BtsL
Cointelegraph,"2 pig butcher busts: Feds recover $5M, ex-Kansas bank CEO jailed",https://cointelegraph.com/news/crypto-pig-butcher-busts-see-5-m-recovered-former-bank-ceo-jailed?utm_source=rss_feed&utm_medium=rss%3F1724420587754&utm_campaign=rss_partner_inbound,https://da.gd/0JezVV
Cointelegraph,OmegaPro co-founder arrested over $4B crypto scam,https://cointelegraph.com/news/omegapro-ceo-arrested-over-4-billion-crypto-scam?utm_source=rss_feed&utm_medium=rss%3F1724420587754&utm_campaign=rss_partner_inbound,https://da.gd/rfpjwH
Cointelegraph,ETH Dencun upgrade attracts more L2 bots and failed txs: Galaxy Research,https://cointelegraph.com/news/bot-driven-l2-transaction-failures-surge-following-ethereum-s-fee-reducing-upgrade?utm_source=rss_feed&utm_medium=rss%3F1724420587754&utm_campaign=rss_partner_inbound,https://da.gd/a2aRuU
Cointelegraph,SEC opposes Richard Heart’s bid to dismiss $1B securities lawsuit,https://cointelegraph.com/news/sec-rebuffs-richard-heart-bid-dismiss-1-billion-securities-lawsuit?utm_source=rss_feed&utm_medium=rss%3F1724420587754&utm_campaign=rss_partner_inbound,https://da.gd/st3Az
Cointelegraph,Justin Sun says removing 12K Bitcoin from USDD is just ‘DeFi 101’,https://cointelegraph.com/news/justin-sun-says-removing-12k-bitcoin-usdd-defi-101?utm_source=rss_feed&utm_medium=rss%3F1724420587754&utm_campaign=rss_partner_inbound,https://da.gd/ixtRI
Cointelegraph,Bitcoin miner OTC balances reach 2-year high — Why it’s a bearish signal,https://cointelegraph.com/news/bitcoin-miner-otc-balances-high-bearish-price-btc?utm_source=rss_feed&utm_medium=rss%3F1724420587754&utm_campaign=rss_partner_inbound,https://da.gd/6SC3zu
Cointelegraph,FBI will use NFTs to contact victims of crypto fraud scheme Clucoin,https://cointelegraph.com/news/fbi-use-nfts-contact-victims-crypto-fraud-scheme-clucoin?utm_source=rss_feed&utm_medium=rss%3F1724420587754&utm_campaign=rss_partner_inbound,https://da.gd/fPdJbo
Cointelegraph,"Bitcoin miners steamrolled after electricity thefts, exchange ‘closure’ scam: Asia Express",https://cointelegraph.com/magazine/bitcoin-mining-crackdown-epicenters-nft-phishing-scam-asia-express/?utm_source=rss_feed&utm_medium=rss%3F1724420587754&utm_campaign=rss_partner_inbound,https://da.gd/LDndsc
Cointelegraph,Is it time for Avalanche (AVAX) price to turn bullish?,https://cointelegraph.com/news/is-it-time-for-avalanche-avax-price-to-turn-bullish?utm_source=rss_feed&utm_medium=rss%3F1724420587754&utm_campaign=rss_partner_inbound,https://da.gd/NroHSd
Cointelegraph,Kamala Harris campaign may focus on highlighting innovation over crypto,https://cointelegraph.com/news/kamala-harris-campaign-innovation-crypto?utm_source=rss_feed&utm_medium=rss%3F1724420587754&utm_campaign=rss_partner_inbound,https://da.gd/AjXLH
