feed,title,long_url,short_url
Investing,Margin Balances Suggest Risks Are Building,https://www.investing.com/analysis/margin-balances-suggest-risks-are-building-200657651,https://da.gd/68Nyb
Investing,"Gold Prices Hover Near Record Highs Amid Geopolitical Tensions, Tariff Concerns",https://www.investing.com/analysis/gold-prices-hover-near-record-highs-amid-geopolitical-tensions-tariff-concerns-200657652,https://da.gd/cgKPw
Investing,"S&P 500 E-Mini: Bulls Hold the Line, but Bears Eye a Trend Reversal",https://www.investing.com/analysis/sp-500-emini-bulls-hold-the-line-but-bears-eye-a-trend-reversal-200657650,https://da.gd/yVxlh
Investing,"Euro Rises on Germany Election, US Dollar Slips on Growth Worries",https://www.investing.com/analysis/euro-rises-on-germany-election-us-dollar-slips-on-growth-worries-200657636,https://da.gd/PHfB
Investing,"Weaker 2025 S&P 500 EPS Estimates Follow Same Pattern as Late ’23, Early ’24",https://www.investing.com/analysis/weaker-2025-sp-500-eps-estimates-follow-same-pattern-as-late-23-early-24-200657648,https://da.gd/PhnTv
Investing,"Thai car production slumps 24.63% in January as sales, exports fall",https://www.investing.com/news/economy-news/thai-car-production-slumps-2463-in-january-as-sales-exports-fall-3885359,https://da.gd/kAfu
