feed,title,long_url,short_url
CryptoNews,"Georgia State Pushes Harder for Bitcoin Stockpile, Senate Proposes Second BTC Reserve Bill",https://cryptonews.com/news/georgia-state-pushes-harder-for-bitcoin-reserve-bill/,https://da.gd/rpHCj0
CryptoNews,Only 44% of Spot Bitcoin ETF Inflows Aim for the Long Haul: 10x Research,https://cryptonews.com/news/only-44-of-spot-bitcoin-etf-inflows-aim-for-the-long-haul-10x-research/,https://da.gd/Ued2F
CryptoNews,Bybit Hack Proceeds May Now Be Routed Through Mixers: Elliptic,https://cryptonews.com/news/bybit-hack-proceeds-may-now-be-routed-through-mixers-elliptic/,https://da.gd/4qT1H
CryptoNews,"HK Asia Board Approves Bitcoin Investment, Acquires 7.88 BTC for $761,705",https://cryptonews.com/news/hk-asia-board-approves-bitcoin-investment-acquires-7-88-btc-for-761705/,https://da.gd/U3PbYi
CryptoNews,Montana House Lawmakers Vote Against Bitcoin Reserve Bill,https://cryptonews.com/news/montana-house-lawmakers-vote-against-bitcoin-reserve-bill/,https://da.gd/RDEjW
CryptoNews,"Stablecoin Bank Infini Hit by $49.5M Exploit, Founder Vows Full Repayment",https://cryptonews.com/news/stablecoin-bank-infini-hit-by-49-5m-exploit-days-after-bybit-hack/,https://da.gd/Va5A6
CryptoNews,"Bybit CEO: ETH Gap Closed Post $1.4B Hack, Exchange to Publish POR Audit",https://cryptonews.com/news/bybit-ceo-eth-gap-closed-exchange-to-publish-proof-of-reserves/,https://da.gd/ygu5V3
CryptoNews,Russia Rolls Out CDBC Anti-fraud System as Digital RUB Rollout Nears,https://cryptonews.com/news/russia-rolls-out-cdbc-anti-fraud-system-as-digital-rub-rollout-nears/,https://da.gd/kEjeXv
