feed,title,long_url,short_url
Investing,Lucid stock dips after Redburn-Atlantic slashes price target,https://www.investing.com/news/stock-market-news/lucid-stock-dips-after-redburnatlantic-slashes-price-target-3886974,https://da.gd/pV1n0v
Investing,Nvidia takes EU antitrust regulators to court for probing AI startup Run:ai bid,https://www.investing.com/news/stock-market-news/nvidia-takes-eu-antitrust-regulators-to-court-for-probing-ai-startup-runai-bid-3886967,https://da.gd/DCsmH6
Investing,Nvidia sues EU regulators over Run:ai deal scrutiny,https://www.investing.com/news/stock-market-news/nvidia-sues-eu-regulators-over-runai-deal-scrutiny-93CH-3886969,https://da.gd/8CSdi
Investing,Palliser asks Rio Tinto to seek Australian shareholder vote on dual listing,https://www.investing.com/news/stock-market-news/palliser-asks-rio-tinto-to-seek-australian-shareholder-vote-on-dual-listing-3886968,https://da.gd/vG6zY
Investing,U.K. stocks lower at close of trade; Investing.com United Kingdom 100 down 0.07%,https://www.investing.com/news/stock-market-news/uk-stocks-lower-at-close-of-trade-investingcom-united-kingdom-100-down-007-3886966,https://da.gd/PWAY8
Investing,Sweden stocks lower at close of trade; OMX Stockholm 30 down 0.39%,https://www.investing.com/news/stock-market-news/sweden-stocks-lower-at-close-of-trade-omx-stockholm-30-down-039-3886964,https://da.gd/52Ui7D
Investing,Spain stocks higher at close of trade; IBEX 35 up 0.48%,https://www.investing.com/news/stock-market-news/spain-stocks-higher-at-close-of-trade-ibex-35-up-048-3886963,https://da.gd/jS9Ja
Investing,Portugal stocks higher at close of trade; PSI up 1.62%,https://www.investing.com/news/stock-market-news/portugal-stocks-higher-at-close-of-trade-psi-up-162-3886962,https://da.gd/3n5zc
