feed,title,long_url,short_url
Yahoo,Resilient rejection rates illustrate truckload capacity’s decline,https://finance.yahoo.com/news/resilient-rejection-rates-illustrate-truckload-063000125.html,https://da.gd/gyr7P
Yahoo,The Long Nights and Drug Addiction That Drove a Banker to Insider Trading,https://www.wsj.com/finance/insider-trading-banker-adderall-john-femenia-wells-fargo-f606ec4a?siteid=yhoof2&yptr=yahoo,https://da.gd/EIOc
Yahoo,What is the average net worth by age?,https://finance.yahoo.com/personal-finance/banking/article/average-net-worth-by-age-175554485.html,https://da.gd/2Kppq
Yahoo,"Prediction: This Spectacular Stock Will Join Nvidia, Apple, and Microsoft in the $3 Trillion Club in 2026",https://finance.yahoo.com/news/prediction-spectacular-stock-join-nvidia-090700612.html,https://da.gd/wgLvDl
Yahoo,3 No-Brainer High-Yield Dividend Stocks to Buy Right Now for Less Than $200,https://finance.yahoo.com/news/3-no-brainer-high-yield-090500410.html,https://da.gd/DMrSqs
