feed,title,long_url,short_url
Yahoo,S&P 500 Gains and Losses Today: Equifax Stock Jumps as Earnings Show Resilience,https://finance.yahoo.com/news/p-500-gains-losses-today-211158592.html,https://da.gd/OqNSW
Yahoo,Tesla’s profits plummet to five-year low as Musk pays the price of Trump,https://finance.yahoo.com/news/tesla-profits-plummet-five-low-211012018.html,https://da.gd/AnKHlb
Yahoo,CEOs Haven't Been This Gloomy About the US Economy Since the Financial Crisis,https://finance.yahoo.com/news/ceos-havent-gloomy-us-economy-211446199.html,https://da.gd/g1CFy9
Yahoo,"Tesla Profit Sinks, Hurt by Backlash Over Elon Musk’s Political Role",https://www.wsj.com/business/autos/tesla-tsla-q1-earnings-report-2025-f7120a39?siteid=yhoof2&yptr=yahoo,https://da.gd/0LXHN
Yahoo,Plug Power Inc. (PLUG): Among EV Penny Stock From $10 to Under $1,https://finance.yahoo.com/news/plug-power-inc-plug-among-224403742.html,https://da.gd/BJ7L9i
Yahoo,Bitcoin Tops $93K as Trump's U.S-China Tariff Optimism Fuels Crypto Rally,https://finance.yahoo.com/news/bitcoin-tops-93k-trumps-u-211152254.html,https://da.gd/PlKs0M
