feed,title,long_url,short_url
SeekingAlpha,"Boyd Group Services Non-GAAP EPS of C$0.56, revenue of C$625.7M beats by C$17.39M",https://seekingalpha.com/news/3904780,
SeekingAlpha,Hoth Therapeutics regains compliance with Nasdaq listing rules,https://seekingalpha.com/news/3904778,
SeekingAlpha,"Stella Jones Non-GAAP EPS of $1.07, revenue of C$842M beats by C$293.92M",https://seekingalpha.com/news/3904777,
SeekingAlpha,"Trane Technologies Offers A Multipart Puzzle Between Industry Drivers, Macro Risk, And Valuation",https://seekingalpha.com/article/4555447,
SeekingAlpha,"FedEx And UPS: For Value, Look Elsewhere",https://seekingalpha.com/article/4555445,
