feed,title,long_url,short_url
SeekingAlpha,Crescent Capital BDC Non-GAAP EPS of $0.42,https://seekingalpha.com/news/3905051,
SeekingAlpha,"MaxCyte GAAP EPS of -$0.06 beats by $0.03, revenue of $10.6M beats by $0.17M",https://seekingalpha.com/news/3905050,
SeekingAlpha,"Coeur Mining Non-GAAP EPS of -$0.16 misses by $0.10, revenue of $183M misses by $17.91M",https://seekingalpha.com/news/3905049,
SeekingAlpha,"United Insurance Holdings GAAP EPS of -$1.65, revenue of $123.79M",https://seekingalpha.com/news/3905048,
SeekingAlpha,"BigBear.ai GAAP EPS of -$0.13 misses by $0.02, revenue of $40.7M beats by $0.79M",https://seekingalpha.com/news/3905047,
