feed,title,long_url,short_url
SeekingAlpha,IO Biotech GAAP EPS of -$0.56 in-line,https://seekingalpha.com/news/3905167,
SeekingAlpha,NEXON  reports Q3 results,https://seekingalpha.com/news/3905166,
SeekingAlpha,"Celsius stock surges on strong sales, profit growth",https://seekingalpha.com/news/3905165,
SeekingAlpha,Aprea Therapeutics GAAP EPS of -$0.12 misses by $0.03,https://seekingalpha.com/news/3905164,
SeekingAlpha,"Waitr Non-GAAP EPS of -$0.06 misses by $0.01, revenue of $25.1M misses by $2.31M",https://seekingalpha.com/news/3905163,
SeekingAlpha,DiaMedica Therapeutics GAAP EPS of -$0.12 beats by $0.03,https://seekingalpha.com/news/3905162,
SeekingAlpha,DICE Therapeutics GAAP EPS of -$0.55 beats by $0.05,https://seekingalpha.com/news/3905161,
SeekingAlpha,Infrastructure: Diversification Through Alternative Investments,https://seekingalpha.com/article/4555589,
