feed,title,long_url,short_url
Investing,President Biden announces former Ripple adviser as pick for Fed vice chair for supervision,https://investing.com/news/-2805043,
Investing,Top universities have added crypto to the curriculum,https://investing.com/news/-2805042,
Investing,"Price analysis 4/15: BTC, ETH, BNB, XRP, SOL, ADA, LUNA, AVAX, DOGE, DOT",https://investing.com/news/-2805039,
Investing,Crypto is going mainstream: Here’s how the future founders will build on it,https://investing.com/news/-2805037,
Investing,"Top 5 cryptocurrencies to watch this week: BTC, XRP, LINK, BCH, FIL",https://investing.com/news/-2805034,
Investing,Crypto Twitter reacts as Russian gov’t reviews finalized crypto bill,https://investing.com/news/-2805031,
Investing,"While men wanted, women did: Empowering female creators with NFTs and crypto",https://investing.com/news/-2805029,
