feed,title,long_url,short_url
Investing,US Strategic Petroleum Reserve drops to lowest since 1983,https://www.investing.com/news/commodities-news/us-strategic-petroleum-reserve-drops-to-lowest-since-1983-93CH-4777158,
Investing,Retail investors largely unaware of SEC semiannual reporting proposal,https://www.investing.com/news/stock-market-news/retail-investors-largely-unaware-of-sec-semiannual-reporting-proposal-4777177,
Investing,Jefferies notes utility outages during July heat and storms,https://www.investing.com/news/stock-market-news/jefferies-notes-utility-outages-during-july-heat-and-storms-93CH-4777167,
Investing,"Klaus Schwab seeks advisory role at World Economic Forum, WSJ reports",https://www.investing.com/news/economy-news/klaus-schwab-seeks-advisory-role-at-world-economic-forum-wsj-reports-93CH-4777168,
Investing,ECB’s Schnabel says Iran shock is not over,https://www.investing.com/news/economy-news/ecbs-schnabel-says-iran-shock-is-not-over-4777165,
Investing,ECB’s Schnabel says euro zone recovery incomplete despite oil drop,https://www.investing.com/news/economy-news/ecbs-schnabel-says-euro-zone-recovery-incomplete-despite-oil-drop-93CH-4777162,
