feed,title,long_url,short_url
Investing,Trump's DEI cuts force Davos elite to find new words for diversity,https://www.investing.com/news/stock-market-news/trumps-dei-cuts-force-davos-elite-to-find-new-words-for-diversity-3825383,https://da.gd/uDh5r
Investing,Trump signs memorandum to counter cost-of-living crisis,https://www.investing.com/news/stock-market-news/trump-signs-memorandum-to-counter-costofliving-crisis-93CH-3825379,https://da.gd/lLpBCb
Investing,Analysis-Investors balked at Venture Global's earnings outlook before IPO price cut,https://www.investing.com/news/stock-market-news/analysisinvestors-balked-at-venture-globals-earnings-outlook-before-ipo-price-cut-3825378,https://da.gd/An5ED
Investing,Samsung unveils Galaxy S25 phone with Qualcomm chips and enhanced AI features,https://www.investing.com/news/stock-market-news/samsung-unveils-galaxy-s25-phone-with-qualcomm-chips-and-enhanced-ai-features-3825376,https://da.gd/7UKF
Investing,Snap and Reddit offer discounts to attract advertisers - The Information,https://www.investing.com/news/stock-market-news/snap-and-reddit-offer-discounts-to-attract-advertisers--the-information-93CH-3825375,https://da.gd/nLYj5
Investing,"CEOs ramp up deal outlook under Trump, EY survey shows",https://www.investing.com/news/stock-market-news/ceos-ramp-up-deal-outlook-under-trump-ey-survey-shows-3825373,https://da.gd/GFh6ST
Investing,"Samsung set to launch ultrathin Galaxy S25 Edge, challenging Apple",https://www.investing.com/news/stock-market-news/samsung-set-to-launch-,https://da.gd/so3D
