feed,title,long_url,short_url
Cointelegraph,HTC launches no-code game creator for ‘Viverse’ metaverse,https://cointelegraph.com/news/htc-launches-no-code-game-creator-viverse-metaverse?utm_source=rss_feed&utm_medium=rss%3F1724351471502&utm_campaign=rss_partner_inbound,https://da.gd/1mnaNk
Cointelegraph,Anchorage adds PayPal stablecoin yield to custody platform,https://cointelegraph.com/news/anchorage-adds-paypal-stablecoin-yield-custody-platform?utm_source=rss_feed&utm_medium=rss%3F1724351471502&utm_campaign=rss_partner_inbound,https://da.gd/T0G8Xd
Cointelegraph,3 reasons why Bitcoin price could hit $68K in September,https://cointelegraph.com/news/3-reasons-why-bitcoin-price-could-hit-68-k-in-september?utm_source=rss_feed&utm_medium=rss%3F1724351471502&utm_campaign=rss_partner_inbound,https://da.gd/BfboXg
Cointelegraph,Partner of ex-FTX exec hit with campaign finance charges,https://cointelegraph.com/news/ftx-partner-michelle-bond-campaign-finance-charges?utm_source=rss_feed&utm_medium=rss%3F1724351471502&utm_campaign=rss_partner_inbound,https://da.gd/Yhj8I
Cointelegraph,UK risks quantum startup exodus after Labour slashes incentives,https://cointelegraph.com/news/uk-risks-quantum-computing-startup-exodus-labour-slashes-incentives?utm_source=rss_feed&utm_medium=rss%3F1724351471502&utm_campaign=rss_partner_inbound,https://da.gd/8ot324
Cointelegraph,Metaverse pioneer and movie VFX team unite for blockchain project,https://cointelegraph.com/news/lamina1-weta-workshop-metaverse-artefact?utm_source=rss_feed&utm_medium=rss%3F1724351471502&utm_campaign=rss_partner_inbound,https://da.gd/6gth0i
Cointelegraph,"AI drone ‘hellscape’ plan for Taiwan, LLMs too dumb to destroy humanity: AI Eye",https://cointelegraph.com/magazine/ai-drone-hellscape-plan-for-taiwan-llms-too-dumb-to-destroy-humanity-ai-eye/?utm_source=rss_feed&utm_medium=rss%3F1724351471502&utm_campaign=rss_partner_inbound,https://da.gd/XZtYu
Cointelegraph,Grayscale launches investment fund for AVAX token,https://cointelegraph.com/news/grayscale-launches-investment-fund-avax-token?utm_source=rss_feed&utm_medium=rss%3F1724351471502&utm_campaign=rss_partner_inbound,https://da.gd/yvq8
Cointelegraph,Why is the BNB price up today?,https://cointelegraph.com/news/why-is-bnb-price-up-today?utm_source=rss_feed&utm_medium=rss%3F1724351471502&utm_campaign=rss_partner_inbound,https://da.gd/6Q37qP
Cointelegraph,Magic Eden Foundation launches ME token for cross-chain trading,https://cointelegraph.com/news/magic-eden-foundation-launches-me-token-cross-chain-trading?utm_source=rss_feed&utm_medium=rss%3F1724351471502&utm_campaign=rss_partner_inbound,https://da.gd/KCob1
Cointelegraph,Compliance experts should help regulate crypto — Silk Road 2.0 founder,https://cointelegraph.com/news/compliance-regulate-crypto-silk-road?utm_source=rss_feed&utm_medium=rss%3F1724351471502&utm_campaign=rss_partner_inbound,https://da.gd/06AAf
Cointelegraph,Ocean Nodes Incentive Program delayed for back-end improvements,https://cointelegraph.com/news/ocean-protocol-delays-node-incentive-program?utm_source=rss_feed&utm_medium=rss%3F1724351471502&utm_campaign=rss_partner_inbound,https://da.gd/Dw5w3F
Cointelegraph,Franklin Templeton expands blockchain fund to Avalanche network,https://cointelegraph.com/news/franklin-templeton-onchain-us-money-fund-avalanche-expansion?utm_source=rss_feed&utm_medium=rss%3F1724351471502&utm_campaign=rss_partner_inbound,https://da.gd/MDeSc
Cointelegraph,Nearly 80% of hacked cryptocurrencies never recover in price — Immunefi,https://cointelegraph.com/news/crypto-hacks-price-declines-report-2024?utm_source=rss_feed&utm_medium=rss%3F1724351471502&utm_campaign=rss_partner_inbound,https://da.gd/QO7QNy
Cointelegraph,India’s crypto future hinges on gov’t consultation paper,https://cointelegraph.com/news/india-crypto-regulation-dea-paper-september?utm_source=rss_feed&utm_medium=rss%3F1724351471502&utm_campaign=rss_partner_inbound,https://da.gd/lotZ
Cointelegraph,Here’s what happened in crypto today,https://cointelegraph.com/news/what-happened-in-crypto-today?utm_source=rss_feed&utm_medium=rss%3F1724351471502&utm_campaign=rss_partner_inbound,https://da.gd/DsEo
Cointelegraph,Hong Kong targets noncompliant crypto exchanges in licensing push,https://cointelegraph.com/news/hong-kong-crypto-exchanges-license-scrutiny?utm_source=rss_feed&utm_medium=rss%3F1724351471502&utm_campaign=rss_partner_inbound,https://da.gd/Y5AD31
Cointelegraph,FTX says creditors supported reorganization plan with 95% vote,https://cointelegraph.com/news/ftx-reorganization-plan-gains-creditor-support?utm_source=rss_feed&utm_medium=rss%3F1724351471502&utm_campaign=rss_partner_inbound,https://da.gd/4MTLE
Cointelegraph,Former TON Foundation execs establish new community initiative,https://cointelegraph.com/news/former-ton-execs-establish-community-initiative?utm_source=rss_feed&utm_medium=rss%3F1724351471502&utm_campaign=rss_partner_inbound,https://da.gd/63QouZ
Cointelegraph,Why is Bitcoin price stuck?,https://cointelegraph.com/news/why-is-bitcoin-price-stuck?utm_source=rss_feed&utm_medium=rss%3F1724351471502&utm_campaign=rss_partner_inbound,https://da.gd/WyInZS
Cointelegraph,Bitcoin ‘ripe for short squeeze’ as bulls pressure $62K BTC price wall,https://cointelegraph.com/news/bitcoin-short-squeeze-bulls-pressure-62k-btc-price-wall?utm_source=rss_feed&utm_medium=rss%3F1724351471502&utm_campaign=rss_partner_inbound,https://da.gd/9arr
Cointelegraph,"OriginTrail, The Blockchain Socialist and CryptoHarlem update The Agenda on the state of crypto",https://cointelegraph.com/news/origin-trail-blockchain-socialist-crypto-harlem-update-agenda-state-crypto?utm_source=rss_feed&utm_medium=rss%3F1724351471502&utm_campaign=rss_partner_inbound,https://da.gd/oGBeYR
Cointelegraph,NYSE calls out crypto provider SOS for noncompliance,https://cointelegraph.com/news/sos-limited-nyse-noncompliance-share-price-warning?utm_source=rss_feed&utm_medium=rss%3F1724351471502&utm_campaign=rss_partner_inbound,https://da.gd/Z7Ib
Cointelegraph,‘Gangsta’s Paradise’ rapper Coolio resurrected in metaverse tribute,https://cointelegraph.com/news/coolio-gangstas-paradise-30th-anniversary-metaverse?utm_source=rss_feed&utm_medium=rss%3F1724351471502&utm_campaign=rss_partner_inbound,https://da.gd/PTr18
Cointelegraph,Spot Ethereum ETFs record longest outflow streak amid drying investments,https://cointelegraph.com/news/ethereum-etfs-record-longest-outflow-five-days?utm_source=rss_feed&utm_medium=rss%3F1724351471502&utm_campaign=rss_partner_inbound,https://da.gd/E5KoND
Cointelegraph,Telecom company fined $1M for role in Biden deepfake scam,https://cointelegraph.com/news/texas-telecom-fined-1m-biden-deepfake-scam?utm_source=rss_feed&utm_medium=rss%3F1724351471502&utm_campaign=rss_partner_inbound,https://da.gd/7HmfS
Cointelegraph,DBS Bank pilots blockchain-based government grants,https://cointelegraph.com/news/dbs-bank-blockchain-government-grants?utm_source=rss_feed&utm_medium=rss%3F1724351471502&utm_campaign=rss_partner_inbound,https://da.gd/wJAt
Cointelegraph,California senator slams OpenAI’s opposition to AI safety bill,https://cointelegraph.com/news/california-senator-challenges-openai-opposition-ai-safety-bill?utm_source=rss_feed&utm_medium=rss%3F1724351471502&utm_campaign=rss_partner_inbound,https://da.gd/PTFvm
Cointelegraph,Nvidia crypto sales case could see flood of ‘frivolous’ lawsuits — Advocate body,https://cointelegraph.com/news/nvidia-crypto-sales-case-could-flood-crypto-frivolous-lawsuits?utm_source=rss_feed&utm_medium=rss%3F1724351471502&utm_campaign=rss_partner_inbound,https://da.gd/hNAYb
Cointelegraph,Bitcoin open interest jumps $1.3B following Fed's 'dovish' minutes,https://cointelegraph.com/news/bitcoin-open-interest-spikes-united-states-federal-reserve-dovish-tone-interest-rates?utm_source=rss_feed&utm_medium=rss%3F1724351471502&utm_campaign=rss_partner_inbound,https://da.gd/QUkFF9
