feed,title,long_url,short_url
SeekingAlpha,"Pushpay Holdings Limited GAAP EPS of $0.77, revenue of $103.02M",https://seekingalpha.com/news/3904190,
SeekingAlpha,Canadian Apartment Properties REIT reports Q3 results,https://seekingalpha.com/news/3904189,
SeekingAlpha,Unity Biotechnology GAAP EPS of -$1.36 misses by $0.30,https://seekingalpha.com/news/3904188,
SeekingAlpha,"MSP Recovery Q3 GAAP EPS of -$0.01, revenue of $8.3M",https://seekingalpha.com/news/3904186,
SeekingAlpha,Annovis Bio GAAP EPS of -$0.93 beats by $0.08,https://seekingalpha.com/news/3904185,
SeekingAlpha,"Hot Stocks: Crypto plunges on FTX liquidity crunch; RCM drops 50%; HIMS, SANM rise on earnings",https://seekingalpha.com/news/3904182,
SeekingAlpha,"Raytheon: Mixed Q3 Due To Supply Chain Issues, But Improving",https://seekingalpha.com/article/4555001,
