feed,title,long_url,short_url
Investing,GameStop Leans on Efficiency Gains While Revenue Weakness Leaves Questions Open,https://www.investing.com/analysis/gamestop-leans-on-efficiency-gains-while-revenue-weakness-leaves-questions-open-200671611,
Investing,"Apple CEO pushes for changes in US child online safety bill, citing privacy concerns",https://www.investing.com/news/stock-market-news/apple-ceo-pushes-for-changes-in-us-child-online-safety-bill-citing-privacy-concerns-4402104,
Investing,"Nvidia, AI stocks fall after Oracle earnings underwhelm",https://www.investing.com/news/stock-market-news/nvidia-ai-stocks-fall-after-oracle-earnings-underwhelm-4402102,
Investing,"Exclusive-China’s ZTE may pay more than $1 billion to the US over foreign bribery allegations, sources say",https://www.investing.com/news/stock-market-news/exclusivechinas-zte-may-pay-more-than-1-billion-to-the-us-over-foreign-bribery-allegations-sources-say-4402101,
Investing,Welsh Carson-backed Lumexa Imaging raises $463 million in US IPO,https://www.investing.com/news/stock-market-news/welsh-,
Investing,"UK housing market slows after tax-raising budget, RICS survey shows",https://www.investing.com/news/economic-indicators/uk-housing-market-slows-after-taxraising-budget-rics-survey-shows-4402105,
