feed,title,long_url,short_url
Investing,Moody’s upgrades Cencora’s senior unsecured rating to Baa1,https://www.investing.com/news/stock-market-news/moodys-upgrades-cencoras-senior-unsecured-rating-to-baa1-93CH-4295370,
Investing,How AI will change the healthcare landscape,https://www.investing.com/news/stock-market-news/how-ai-will-change-the-healthcare-landscape-4295369,
Investing,S&P downgrades Office Properties Income Trust notes to ’D’ after missed payment,https://www.investing.com/news/stock-market-news/sp-downgrades-office-properties-income-trust-notes-to-d-after-missed-payment-93CH-4295362,
Investing,Viavi Solutions downgraded to ’B+’ at S&P after completing Spirent assets deal,https://www.investing.com/news/stock-market-news/viavi-solutions-downgraded-to-b-at-sp-after-completing-spirent-assets-deal-93CH-4295361,
Investing,Janus International Group upgraded to ’BB-’ by S&P on low leverage,https://www.investing.com/news/stock-market-news/janus-international-group-upgraded-to-bb-by-sp-on-low-leverage-93CH-4295360,
Investing,Clear Channel Outdoor stock soars after Mubadala Capital takeover report,https://www.investing.com/news/stock-market-news/clear-channel-outdoor-stock-soars-after-mubadala-capital-takeover-report-93CH-4295357,
Investing,Trump administration freezes another $11 billion in infrastructure spending in shutdown fight,https://www.investing.com/news/economy-news/trump-administration-freezes-another-11-billion-in-infrastructure-spending-in-shutdown-fight-4295352,
Investing,investors stuck in twilight zone of risk and reward: Macquarie,https://www.investing.com/news/economy-news/investors-stuck-in-twilight-zone-of-risk-and-reward-macquarie-4295359,
