feed,title,long_url,short_url
FXEmpire,Lone survivor of Indian helicopter crash that killed defence chief dies,https://www.fxempire.com/news/article/lone-survivor-of-indian-helicopter-crash-that-killed-defence-chief-dies-841020,https://j.mp/3m7dOJP
FXEmpire,Suntory CEO says quick rollout of vaccine boosters key for Japan service sector,https://www.fxempire.com/news/article/suntory-ceo-says-quick-rollout-of-vaccine-boosters-key-for-japan-service-sector-841014,https://j.mp/3m96r4C
FXEmpire,"Russia, U.S. discuss Moscow’s demand for security guarantees",https://www.fxempire.com/news/article/russia-u-s-discuss-moscows-demand-for-security-guarantees-841015,https://j.mp/3dRFldI
FXEmpire,COVID-19 vaccines may be less effective against Omicron – WHO,https://www.fxempire.com/news/article/covid-19-vaccines-may-be-less-effective-against-omicron-who-841016,https://j.mp/3yqxeyx
FXEmpire,Russia hopeful of space rides from NASA to ISS from 2022 – agency head,https://www.fxempire.com/news/article/russia-hopeful-of-space-rides-from-nasa-to-iss-from-2022-agency-head-841018,https://j.mp/3IOSLWd
FXEmpire,Journalist travelling with top U.S. diplomat Blinken positive for COVID-19,https://www.fxempire.com/news/article/journalist-travelling-with-top-u-s-diplomat-blinken-positive-for-covid-19-841019,https://j.mp/3GKKPDH
FXEmpire,Lithuanian diplomats leave China as relations sour over Taiwan,https://www.fxempire.com/news/article/lithuanian-diplomats-leave-china-as-relations-sour-over-taiwan-841021,https://j.mp/3GIKiCa
