feed,title,long_url,short_url
SeekingAlpha,Reinsurance Group of America cut at JPMorgan as EPS consensus overstates earnings power,https://seekingalpha.com/news/3897713,
SeekingAlpha,"Capital Power GAAP EPS of $0.20, revenue of $786M beats by $334.48M",https://seekingalpha.com/news/3897712,
SeekingAlpha,Bergio reports Q3 results,https://seekingalpha.com/news/3897711,
SeekingAlpha,Rigetti Computing dips 4% on CEO transition,https://seekingalpha.com/news/3897710,
SeekingAlpha,FDA grants Alzamend Neuro 'Study May Proceed' letter for dementia IND ALZN002,https://seekingalpha.com/news/3897709,
SeekingAlpha,Align Technology enters $200M accelerated stock repurchase agreement,https://seekingalpha.com/news/3897707,
SeekingAlpha,Texas Roadhouse loses a bull after earnings,https://seekingalpha.com/news/3897708,
SeekingAlpha,"JNK: Reasonable High Yield Corporate Bond ETF, But Better Choices Out There",https://seekingalpha.com/article/4551046,
