feed,title,long_url,short_url
Benzinga,What Does Petrobras Brasileiro's Debt Look Like?,https://benzinga.com/news/22/10/29480462/what-does-petrobras-brasileiros-debt-look-like,https://bit.ly/3zwq0uy
Benzinga,Lakeland Financial Board Member Trades Company's Stock,https://benzinga.com/news/22/10/29480444/lakeland-financial-board-member-trades-companys-stock,https://bit.ly/3TTmjal
Benzinga,Biohaven Insider Trades Send a Signal,https://benzinga.com/news/22/10/29480441/biohaven-insider-trades-send-a-signal,https://bit.ly/3foEZQn
Benzinga,3M EVP & Chief Legal Officer Trades Company's Stock,https://benzinga.com/news/22/10/29480440/3m-evp-chief-legal-officer-trades-companys-stock,https://bit.ly/3NjcCQd
Benzinga,3M Insider Trades Send a Signal,https://benzinga.com/news/22/10/29480437/3m-insider-trades-send-a-signal,https://bit.ly/3FraTGy
