feed,title,long_url,short_url
SeekingAlpha,Southwest Airlines is the top airlines stock pick at Morgan Stanley with 2023 setup looking strong,https://seekingalpha.com/news/3897792,
SeekingAlpha,Vanguard Ultra-Short Bond ETF declares monthly distribution of $4.3000,https://seekingalpha.com/news/3897791,
SeekingAlpha,Vanguard Tax-Exempt Bond ETF declares monthly distribution of $3.8300,https://seekingalpha.com/news/3897790,
SeekingAlpha,Vanguard Emerging Markets Government Bond ETF declares monthly distribution of $7.6500,https://seekingalpha.com/news/3897789,
SeekingAlpha,Vanguard Total International Bond ETF declares monthly distribution of $2.9800,https://seekingalpha.com/news/3897788,
SeekingAlpha,"SunCoke Energy surges on strong Q3 results, EBITDA guidance",https://seekingalpha.com/news/3897787,
SeekingAlpha,Dallas Fed Manufacturing Survey -19.4 in October,https://seekingalpha.com/news/3897786,
