feed,title,long_url,short_url
SeekingAlpha,Brixmor Property FFO matches consensus as leasing activity goes strong,https://seekingalpha.com/news/3935456,
SeekingAlpha,Electrovaya reports Q1 results,https://seekingalpha.com/news/3935455,
SeekingAlpha,Farmmi reports FY results,https://seekingalpha.com/news/3935454,
SeekingAlpha,"Seven Hills Realty Trust Non-GAAP EPS of $0.37 beats by $0.12, revenue of $9.29M",https://seekingalpha.com/news/3935453,
SeekingAlpha,"Arch Capital Q4 non-GAAP EPS beats estimate, gross premiums written rises +30% Y/Y",https://seekingalpha.com/news/3935452,
SeekingAlpha,"FirstEnergy Non-GAAP EPS of $0.50 misses by $0.03, revenue of $12.5B",https://seekingalpha.com/news/3935451,
