feed,title,long_url,short_url
Investing,Dell launches $699 XPS 13 laptop to compete with Apple’s MacBook Neo,https://www.investing.com/news/stock-market-news/dell-launches-699-xps-13-laptop-to-compete-with-apples-macbook-neo-93CH-4717971,
Investing,"South Korea factory activity growth hits over 5-year high, PMI shows",https://www.investing.com/news/economic-indicators/south-korea-factory-activity-growth-hits-over-5year-high-pmi-shows-4717969,
Investing,Japan’s Q1 capex stalls as Iran war concerns weigh on business confidence,https://www.investing.com/news/economy-news/japans-q1-capex-stalls-as-iran-war-concerns-weigh-on-business-confidence-4717972,
Investing,"Dollar steadies as markets await signals on Iran war, central banks",https://www.investing.com/news/economy-news/dollar-steadies-as-markets-await-signals-on-iran-war-central-banks-4717970,
Investing,Fed’s Powell warns that politicizing the Fed would cost public trust,https://www.investing.com/news/economy-news/feds-powell-warns-that-politicizing-the-fed-would-cost-public-trust-4717967,
