feed,title,long_url,short_url
Investing,Nvidia courts Korea’s tech giants at Taipei dinner as AI push deepens,https://www.investing.com/news/stock-market-news/nvidia-courts-koreas-tech-giants-at-taipei-dinner-as-ai-push-deepens-4719826,
Investing,Why is Duke Energy stock sliding today?,https://www.investing.com/news/stock-market-news/why-is-duke-energy-stock-sliding-today-93CH-4719815,
Investing,Why is Wynn Resorts stock surging today?,https://www.investing.com/news/stock-market-news/why-is-wynn-resorts-stock-surging-today-93CH-4719800,
Investing,Poland stocks lower at close of trade; WIG30 down 1.72%,https://www.investing.com/news/stock-market-news/poland-stocks-lower-at-close-of-trade-wig30-down-172-4719793,
Investing,Iran eyes limited US deal to relieve economic strain and buy time,https://www.investing.com/news/economy-news/iran-eyes-limited-us-deal-to-relieve-economic-strain-and-buy-time-4719827,
