feed,title,long_url,short_url
Investing,Bitcoin’s June Setup Hinges on the Battle Between $72K and $74.5K,https://www.investing.com/analysis/bitcoins-june-setup-hinges-on-the-battle-between-72k-and-745k-200681302,
Investing,The Energy Report: Knowing When to Quit,https://www.investing.com/analysis/the-energy-report-knowing-when-to-quit-200681298,
Investing,Gold Futures Test Key Support as US-Iran War Keeps Volatility Elevated,https://www.investing.com/analysis/gold-futures-test-key-support-as-usiran-war-keeps-volatility-elevated-200681291,
Investing,Instant View: Anthropic IPO filing ratifies Wall Street’s AI obsession,https://www.investing.com/news/stock-market-news/instant-view-anthropic-ipo-filing-ratifies-wall-streets-ai-obsession-4720246,
Investing,BP tasks independent director Amanda Blanc to lead search for next chair,https://www.investing.com/news/stock-market-news/bp-tasks-independent-director-amanda-blanc-to-lead-search-for-next-chair-4720240,
Investing,HPE expects to achieve 2028 financial targets this year after record quarter on AI boom,https://www.investing.com/news/stock-market-news/hpe-expects-to-achieve-2028-financial-targets-this-year-after-record-quarter-on-ai-boom-4720207,
Investing,Fulcrum Therapeutics stock plunges 30% on program discontinuation,https://www.investing.com/news/stock-market-news/fulcrum-therapeutics-stock-plunges-30-on-program-discontinuation-93CH-4720206,
Investing,SpaceX reserves 5% of IPO shares for select employees and individuals,https://www.investing.com/news/stock-market-news/spacex-reserves-5-of-ipo-shares-for-select-employees-and-individuals-4720152,
Investing,"SpaceX sets aside 5% of IPO shares for selected buyers, waives lock-up",https://www.investing.com/news/stock-market-news/spacex-sets-aside-5-of-ipo-shares-for-selected-buyers-waives-lockup-4720144,
