feed,title,long_url,short_url
Investing,Microchip Technology stock jumps on data center growth outlook,https://www.investing.com/news/stock-market-news/microchip-technology-stock-jumps-on-data-center-growth-outlook-93CH-4720339,
Investing,Abivax stock surges 20% on positive ulcerative colitis trial,https://www.investing.com/news/stock-market-news/abivax-stock-surges-20-on-positive-ulcerative-colitis-trial-93CH-4720337,
Investing,U.S. stocks higher at close of trade; Dow Jones Industrial Average up 0.09%,https://www.investing.com/news/stock-market-news/us-stocks-higher-at-close-of-trade-dow-jones-industrial-average-up-009-4720325,
Investing,Canada stocks lower at close of trade; S&P/TSX Composite down 0.10%,https://www.investing.com/news/stock-market-news/canada-stocks-lower-at-close-of-trade-sptsx-composite-down-010-4720307,
Investing,Brazil stocks lower at close of trade; Bovespa down 0.91%,https://www.investing.com/news/stock-market-news/brazil-stocks-lower-at-close-of-trade-bovespa-down-091-4720304,
