feed,title,long_url,short_url
Nasdaq,U.S. Senate Republicans block bill on probe of deadly Capitol riot,https://www.nasdaq.com/articles/u.s.-senate-republicans-block-bill-on-probe-of-deadly-capitol-riot-2021-05-28,https://j.mp/34oPYQv
Nasdaq,Neymar hits back at Nike over sexual-assault probe,https://www.nasdaq.com/articles/neymar-hits-back-at-nike-over-sexual-assault-probe-2021-05-28,https://j.mp/3fRJYFs
Nasdaq,Bullish Two Hundred Day Moving Average Cross - CRON,https://www.nasdaq.com/articles/bullish-two-hundred-day-moving-average-cross-cron-2021-05-28,https://j.mp/3bWftNt
Nasdaq,S&P 500 Analyst Moves: FB,https://www.nasdaq.com/articles/sp-500-analyst-moves%3A-fb-2021-05-28,https://j.mp/3fwYtQa
Nasdaq,Ansys Breaks Above 200-Day Moving Average - Bullish for ANSS,https://www.nasdaq.com/articles/ansys-breaks-above-200-day-moving-average-bullish-for-anss-2021-05-28,https://j.mp/3oWVoMi
Nasdaq,Bloom Energy Breaks Above 200-Day Moving Average - Bullish for BE,https://www.nasdaq.com/articles/bloom-energy-breaks-above-200-day-moving-average-bullish-for-be-2021-05-28,https://j.mp/34pRGB8
Nasdaq,DXCM Makes Bullish Cross Above Critical Moving Average,https://www.nasdaq.com/articles/dxcm-makes-bullish-cross-above-critical-moving-average-2021-05-28,https://j.mp/3yJJ9qM
Nasdaq,PLUG Makes Bullish Cross Above Critical Moving Average,https://www.nasdaq.com/articles/plug-makes-bullish-cross-above-critical-moving-average-2021-05-28,https://j.mp/3i1OXpx
Nasdaq,QTRX Crosses Above Key Moving Average Level,https://www.nasdaq.com/articles/qtrx-crosses-above-key-moving-average-level-2021-05-28,https://j.mp/3hYH4kX
Nasdaq,American Woodmark Becomes Oversold (AMWD),https://www.nasdaq.com/articles/american-woodmark-becomes-oversold-amwd-2021-05-28,https://j.mp/3frquZk
Nasdaq,Farfetch (FTCH) Shares Cross Above 200 DMA,https://www.nasdaq.com/articles/farfetch-ftch-shares-cross-above-200-dma-2021-05-28,https://j.mp/2SzRFIj
