feed,title,long_url,short_url
InsiderMonkey,"Arcosa, Inc. (NYSE:ACA) Q4 2023 Earnings Call Transcript",https://insidermonkey.com/blog/--1264514,
InsiderMonkey,Federal Agricultural Mortgage Corporation (NYSE:AGM) Q4 2023 Earnings Call Transcript,https://insidermonkey.com/blog/--1264551,
InsiderMonkey,"Warner Bros. Discovery, Inc. (NASDAQ:WBD) Q4 2023 Earnings Call Transcript",https://insidermonkey.com/blog/--1264552,
InsiderMonkey,FTAI Aviation Ltd (NASDAQ:FTAI) Q4 2023 Earnings Call Transcript,https://insidermonkey.com/blog/--1264516,
InsiderMonkey,"Bloomin’ Brands, Inc. (NASDAQ:BLMN) Q4 2023 Earnings Call Transcript",https://insidermonkey.com/blog/--1264553,
InsiderMonkey,Galapagos NV (NASDAQ:GLPG) Q4 2023 Earnings Call Transcript,https://insidermonkey.com/blog/--1264554,
InsiderMonkey,"Banco Latinoamericano de Comercio Exterior, S. A. (NYSE:BLX) Q4 2023 Earnings Call Transcript",https://insidermonkey.com/blog/--1264517,
InsiderMonkey,"Frontier Communications Parent, Inc. (NASDAQ:FYBR) Q4 2023 Earnings Call Transcript",https://insidermonkey.com/blog/--1264555,
InsiderMonkey,"Fomento Económico Mexicano, S.A.B. de C.V. (NYSE:FMX) Q4 2023 Earnings Call Transcript",https://insidermonkey.com/blog/--1264557,
InsiderMonkey,"Grupo Aeroportuario del Centro Norte, S.A.B. de C.V. (NASDAQ:OMAB) Q4 2023 Earnings Call Transcript",https://insidermonkey.com/blog/--1264511,
InsiderMonkey,Coca-Cola Europacific Partners PLC (NASDAQ:CCEP) Q4 2023 Earnings Call Transcript,https://insidermonkey.com/blog/--1264558,
InsiderMonkey,AngloGold Ashanti Limited (NYSE:AU) Q4 2023 Earnings Call Transcript,https://insidermonkey.com/blog/--1264559,
InsiderMonkey,Invesco Mortgage Capital Inc. (NYSE:IVR) Q4 2023 Earnings Call Transcript,https://insidermonkey.com/blog/--1264512,
InsiderMonkey,The E.W. Scripps Company (NASDAQ:SSP) Q4 2023 Earnings Call Transcript,https://insidermonkey.com/blog/--1264560,
InsiderMonkey,Ritchie Bros. Auctioneers Incorporated (NYSE:RBA) Q4 2023 Earnings Call Transcript,https://insidermonkey.com/blog/--1264561,
InsiderMonkey,"Perimeter Solutions, SA (NYSE:PRM) Q4 2023 Earnings Call Transcript",https://insidermonkey.com/blog/--1264509,
InsiderMonkey,"SenesTech, Inc. (NASDAQ:SNES) Q4 2023 Earnings Call Transcript",https://insidermonkey.com/blog/--1264502,
InsiderMonkey,"Ryman Hospitality Properties, Inc. (NYSE:RHP) Q4 2023 Earnings Call Transcript",https://insidermonkey.com/blog/--1264505,
InsiderMonkey,"Universal Insurance Holdings, Inc. (NYSE:UVE) Q4 2023 Earnings Call Transcript",https://insidermonkey.com/blog/--1264503,
