feed,title,long_url,short_url
SeekingAlpha,AstraZeneca signs deal with NetScientific for COVID-19 test,https://seekingalpha.com/news/3703568,
SeekingAlpha,Lion Electric appoints Francois Beaulieu as Chief Information Officer,https://seekingalpha.com/news/3703567,
SeekingAlpha,Well Health Technologies to acquire MyHealth Partners for C$206M,https://seekingalpha.com/news/3703563,
SeekingAlpha,SpringWorks teams up with Seagen to evaluate nirogacestat combo in multiple myeloma,https://seekingalpha.com/news/3703566,
SeekingAlpha,Teledoc faces no imminent threat from Amazon: analysts,https://seekingalpha.com/news/3703565,
