feed,title,long_url,short_url
SeekingAlpha,Nabors Industries rallies on Q4 earnings beat,https://seekingalpha.com/news/3665669,
SeekingAlpha,Bristol-Myers receives FDA’s orphan drug designation for multiple myeloma therapy,https://seekingalpha.com/news/3665668,
SeekingAlpha,California Water Service Q4 2020 Earnings Preview,https://seekingalpha.com/news/3665667,
SeekingAlpha,Resideo Technologies Q4 2020 Earnings Preview,https://seekingalpha.com/news/3665666,
SeekingAlpha,Workhorse short sellers vindicated in USPS electric vehicle award,https://seekingalpha.com/news/3665665,
SeekingAlpha,Editas Medicine Q4 2020 Earnings Preview,https://seekingalpha.com/news/3665663,
