feed,title,long_url,short_url
SeekingAlpha,Janney upgrades Owl Rock Capital on prospects for lower cost capital,https://seekingalpha.com/news/3665724,
SeekingAlpha,Cleveland-Cliffs Q4 2020 Earnings Preview,https://seekingalpha.com/news/3665722,
SeekingAlpha,ViiV Healthcare seeks expanded label for HIV treatment Cabenuva,https://seekingalpha.com/news/3665720,
SeekingAlpha,Plug Power Q4 2020 Earnings Preview,https://seekingalpha.com/news/3665719,
SeekingAlpha,"Altice USA, Discovery reach new distribution deal",https://seekingalpha.com/news/3665716,
