feed,title,long_url,short_url
SeekingAlpha,NetApp shares pull back as forecast fails to impress,https://seekingalpha.com/news/3665874,
SeekingAlpha,"Encore Capital EPS misses by $0.83, beats on revenue",https://seekingalpha.com/news/3665873,
SeekingAlpha,"Zovio  EPS beats by $0.09, misses on revenue",https://seekingalpha.com/news/3665872,
SeekingAlpha,"Inogen EPS beats by $0.03, beats on revenue",https://seekingalpha.com/news/3665871,
SeekingAlpha,"Merit Medical Systems EPS beats by $0.11, beats on revenue",https://seekingalpha.com/news/3665870,
SeekingAlpha,"Booking Holdings EPS beats by $3.65, beats on revenue",https://seekingalpha.com/news/3665869,
SeekingAlpha,Adamas Pharmaceuticals launches follow-on public offering,https://seekingalpha.com/news/3665868,
