feed,title,long_url,short_url
SeekingAlpha,"TRI Pointe EPS beats by $0.19, beats on revenue",https://seekingalpha.com/news/3624660,
SeekingAlpha,"Insteel EPS beats by $0.20, beats on revenue",https://seekingalpha.com/news/3624659,
SeekingAlpha,"Corus Entertainment EPS beats by C$0.11, misses on revenue",https://seekingalpha.com/news/3624658,
SeekingAlpha,"Patterson-UTI Energy EPS beats by $0.01, beats on revenue",https://seekingalpha.com/news/3624657,
SeekingAlpha,"Danaher EPS beats by $0.36, beats on revenue",https://seekingalpha.com/news/3624656,
