feed,title,long_url,short_url
TheStreet,Debt-trap Diplomacy? Report Finds China Can Crunch On Loans If Displeased,https://www.thestreet.com/partner/debt-trap-diplomacy-report-finds-china-can-crunch-on-loans-if-displeased-15610393,https://j.mp/2PkOGSQ
TheStreet,"China's Economic Recovery Continued In March, Driven By Better-than-expected Surge In Service Sector",https://www.thestreet.com/partner/china-s-economic-recovery-continued-in-march-driven-by-better-than-expected-surge-in-service-sector-15610394,https://j.mp/3dpc8pU
TheStreet,"Don't Doubt Hong Kong's Importance To China, Say Experts, As They Outline Strengths That Can Help Country Become Global Tech Power",https://www.thestreet.com/partner/don-t-doubt-hong-kong-s-importance-to-china-say-experts-as-they-outline-strengths-that-can-help-country-become-global-tech-power-15610398,https://j.mp/3rxTtNX
TheStreet,"BioNTech Vaccine: Fosun Pharma Says A New Shipment Is Ready For Delivery To Hong Kong And Macau, Pending Results Of Investigation Into Defective Packaging In The First Batch",https://www.thestreet.com/partner/biontech-vaccine-fosun-pharma-says-a-new-shipment-is-ready-for-delivery-to-hong-kong-and-macau-pending-results-of-investigation-into-defective-packaging-in-the-first-batch-15610395,https://j.mp/3w9otY9
TheStreet,Covid-19 Forces Businesses In Shanghai To Leave Central Commerce Districts To Save Rent,https://www.thestreet.com/partner/covid-19-forces-businesses-in-shanghai-to-leave-central-commerce-districts-to-save-rent-15610396,https://j.mp/3u0JyC6
TheStreet,China Tries To Plug Funding Black Hole In Green Energy Scheme,https://www.thestreet.com/partner/china-tries-to-plug-funding-black-hole-in-green-energy-scheme-15610402,https://j.mp/3wdiDov
TheStreet,"China-Australia Relations: More Than 11,000 Litres Of Wine Detained In Shenzhen As Ban Continues",https://www.thestreet.com/partner/china-australia-relations-more-than-11-000-litres-of-wine-detained-in-shenzhen-as-ban-continues-15610401,https://j.mp/3wfJ4Kk
