feed,title,long_url,short_url
Investing,"Air Canada bets on new US-bound business routes from Toronto, despite trade tensions",https://www.investing.com/news/stock-market-news/air-canada-bets-on-new-usbound-business-routes-from-toronto-despite-trade-tensions-4305585,
Investing,Avery Dennison upgraded to Buy on Walmart RFID rollout,https://www.investing.com/news/stock-market-news/avery-dennison-upgraded-to-buy-on-walmart-rfid-rollout-4305576,
Investing,U.K. stocks higher at close of trade; Investing.com United Kingdom 100 up 0.60%,https://www.investing.com/news/stock-market-news/uk-stocks-higher-at-close-of-trade-investingcom-united-kingdom-100-up-060-4305567,
Investing,Spain stocks higher at close of trade; IBEX 35 up 0.23%,https://www.investing.com/news/stock-market-news/spain-stocks-higher-at-close-of-trade-ibex-35-up-023-4305566,
Investing,Portugal stocks higher at close of trade; PSI up 0.58%,https://www.investing.com/news/stock-market-news/portugal-stocks-higher-at-close-of-trade-psi-up-058-4305565,
Investing,Netherlands stocks higher at close of trade; AEX up 0.82%,https://www.investing.com/news/stock-market-news/netherlands-stocks-higher-at-close-of-trade-aex-up-082-4305562,
Investing,Italy stocks higher at close of trade; Investing.com Italy 40 up 0.34%,https://www.investing.com/news/stock-market-news/italy-stocks-higher-at-close-of-trade-investingcom-italy-40-up-034-4305559,
Investing,Freddie Mac reports 30-year mortgage rate falls to 6.19%,https://www.investing.com/news/economy-news/freddie-mac-reports-30year-mortgage-rate-falls-to-619-93CH-4305548,
