feed,title,long_url,short_url
Investing,"Marketmind: China supports, peak rate haze",https://www.investing.com/news/commodities-news/marketmind-china-supports-peak-rate-haze-3114130,https://da.gd/eaDg2
Investing,Snowflake gains on AI-focused partnership with Nvidia,https://www.investing.com/news/stock-market-news/snowflake-gains-on-aifocused-partnership-with-nvidia-432SI-3114136,https://da.gd/yO1T
Investing,Sale of maker of Purell hand sanitizer falls flat -sources,https://www.investing.com/news/stock-market-news/sale-of-maker-of-purell-hand-sanitizer-falls-flat-sources-3114145,https://da.gd/8LXX
Investing,J&J's $8.9 billion talc settlement faces US bankruptcy test,https://www.investing.com/news/stock-market-news/jjs-89-billion-talc-settlement-faces-us-bankruptcy-test-3114113,https://da.gd/RqjE8
Investing,Alphabet stock earns 2nd downgrade in two days as Bernstein cuts on 'fair valuation',https://www.investing.com/news/stock-market-news/alphabet-stock-earns-2nd-downgrade-in-two-days-as-bernstein-cuts-on-fair-valuation-432SI-3114095,https://da.gd/G4L77
Investing,"Delta seen lifting earnings outlook on strong demand, lower fuel costs",https://www.investing.com/news/economy/delta-seen-lifting-earnings-outlook-on-strong-demand-lower-fuel-costs-3114112,https://da.gd/xxqK
