feed,title,long_url,short_url
Benzinga,Why Centogene (CNTG) Stock Is Roaring Higher Tuesday,https://benzinga.com/news/23/06/33026766/why-centogene-cntg-stock-is-roaring-higher-tuesday,https://da.gd/8a7lH1
Benzinga,Here's How Much $100 Invested In HDFC Bank 20 Years Ago Would Be Worth Today,https://benzinga.com/news/earnings/23/06/33028071/heres-how-much-100-invested-in-hdfc-bank-20-years-ago-would-be-worth-today,https://da.gd/6UHc5d
Benzinga,$100 Invested In Home Depot 10 Years Ago Would Be Worth This Much Today,https://benzinga.com/news/earnings/23/06/33028070/100-invested-in-home-depot-10-years-ago-would-be-worth-this-much-today,https://da.gd/k1Npr9
Benzinga,This Is What Whales Are Betting On Baidu,https://benzinga.com/markets/options/23/06/33028083/this-is-what-whales-are-betting-on-baidu,https://da.gd/DVqqEG
Benzinga,Check Out What Whales Are Doing With XOM,https://benzinga.com/markets/options/23/06/33028082/check-out-what-whales-are-doing-with-xom,https://da.gd/RoRSfz
