feed,title,long_url,short_url
SeekingAlpha,First Trust Tactical High Yield ETF declares monthly distribution of $0.1900,https://seekingalpha.com/news/3983306,
SeekingAlpha,Legg Mason Small-Cap Quality Value ETF declares quarterly distribution of $0.1143,https://seekingalpha.com/news/3983305,
SeekingAlpha,"Micron Q3 2023 earnings on deck, what to expect",https://seekingalpha.com/news/3983304,
SeekingAlpha,First Trust Senior Loan Fund declares monthly distribution of $0.2850,https://seekingalpha.com/news/3983303,
SeekingAlpha,Franklin LibertyQ U.S. Small Cap Equity ETF declares quarterly distribution of $0.1226,https://seekingalpha.com/news/3983302,
SeekingAlpha,Franklin LibertyQ U.S. Mid Cap Equity ETF declares quarterly distribution of $0.1379,https://seekingalpha.com/news/3983301,
SeekingAlpha,First Trust SSI Strategic Convertible Securities ETF declares monthly distribution of $0.0400,https://seekingalpha.com/news/3983300,
