feed,title,long_url,short_url
Yahoo,Lordstown banktrupcy points to EV hype that didn't deliver,https://finance.yahoo.com/news/lordstown-banktrupcy-points-to-ev-hype-that-didnt-deliver-183537361.html?.tsrc=rss,https://da.gd/prSP
Yahoo,Elon Musk Drops News That May Forever Change Cars,https://finance.yahoo.com/m/683ec382-12c3-3b67-9e1e-1950ca94eeb3/elon-musk-drops-news-that-may.html?.tsrc=rss,https://da.gd/auTzbG
Yahoo,Alphabet Stock’s Pressures Are Building. Why It’s ‘Time to Move to the Sidelines.’,https://finance.yahoo.com/m/ddb79116-2055-3ad7-82c0-11d14fa80221/alphabet-stock%E2%80%99s-pressures.html?.tsrc=rss,https://da.gd/7C3FfW
Yahoo,Tesla Is Partnering Up With Yet Another Legacy Automaker,https://finance.yahoo.com/m/a870722a-fadb-3529-b3d9-a8ae6b69103e/tesla-is-partnering-up-with.html?.tsrc=rss,https://da.gd/K2wZ
Yahoo,ETFs to Watch as Nvidia & Snowflake Tie Up to Boost Generative AI,https://finance.yahoo.com/news/etfs-watch-nvidia-snowflake-tie-170000861.html?.tsrc=rss,https://da.gd/VsHsV
