feed,title,long_url,short_url
Investing,US Treasury sells $44B 7-Year Treasuries at lower yield as bond demand swells,https://www.investing.com/news/stock-market-news/us-treasury-sells-44b-7year-treasuries-at-lower-yield-as-bond-demand-swells-3499951,https://da.gd/E4RJf
Investing,Earnings call: AGF Management reports growth and strategic acquisitions,https://www.investing.com/news/stock-market-news/earnings-call-agf-management-reports-growth-and-strategic-acquisitions-93CH-3499934,https://da.gd/ssTTca
Investing,Earnings call: Couche-Tard reports mixed Q4 results amid CEO transition,https://www.investing.com/news/stock-market-news/earnings-call-couchetard-reports-mixed-q4-results-amid-ceo-transition-93CH-3499937,https://da.gd/EhCE
Investing,Earnings call: Concentrix reports strong Q2 with revenue surge,https://www.investing.com/news/stock-market-news/earnings-call-concentrix-reports-strong-q2-with-revenue-surge-93CH-3499932,https://da.gd/3tCTN
Investing,"Earnings call: AeroVironment boasts record revenue, eyes further growth",https://www.investing.com/news/stock-market-news/earnings-call-aerovironment-boasts-record-revenue-eyes-further-growth-93CH-3499933,https://da.gd/LItEf
