feed,title,long_url,short_url
InsiderMonkey,"Why NIKE, Inc. (NKE) Is the Best Fitness and Gym Stock to Buy Now?",https://insidermonkey.com/blog/--1407069,
InsiderMonkey,Why BellRing Brands (BRBR) Is the Best Fitness and Gym Stock to Buy Now?,https://insidermonkey.com/blog/--1407067,
InsiderMonkey,Why Dick’s Sporting Goods (DKS) Is the Best Fitness and Gym Stock to Buy Now?,https://insidermonkey.com/blog/--1407065,
InsiderMonkey,Jim Cramer Discussed 18 Companies That Hit $100 Billion in Market Cap in 2024,https://insidermonkey.com/blog/--1407036,
InsiderMonkey,Why Planet Fitness (PLNT) Is the Best Fitness and Gym Stock to Buy Now?,https://insidermonkey.com/blog/--1407063,
InsiderMonkey,"Hedge Fund and Insider Trading News: Dan Loeb, Warren Buffett, Ray Dalio, Citadel Investment Group, Jackson Financial Inc (JXN), GigaCloud Technology Inc (GCT), and More",https://insidermonkey.com/blog/--1407198,
