feed,title,long_url,short_url
Investing,Mexico stocks higher at close of trade; S&P/BMV IPC up 0.72%,https://www.investing.com/news/stock-market-news/mexico-stocks-higher-at-close-of-trade-spbmv-ipc-up-072-3772330,https://da.gd/Ez35ZV
Investing,Canada stocks lower at close of trade; S&P/TSX Composite down 0.54%,https://www.investing.com/news/stock-market-news/canada-stocks-lower-at-close-of-trade-sptsx-composite-down-054-3772324,https://da.gd/9nM9
Investing,Brazil stocks lower at close of trade; Bovespa down 1.16%,https://www.investing.com/news/stock-market-news/brazil-stocks-lower-at-close-of-trade-bovespa-down-116-3772322,https://da.gd/aEFP7C
Investing,OpenAI fires back at Elon Musk bid to block for-profit conversion,https://www.investing.com/news/stock-market-news/openai-fires-back-at-elon-musk-bid-to-block-forprofit-conversion-3772314,https://da.gd/pQN2sF
Investing,Russia stocks lower at close of trade; MOEX Russia Index down 0.32%,https://www.investing.com/news/stock-market-news/russia-stocks-lower-at-close-of-trade-moex-russia-index-down-032-3772312,https://da.gd/sNnPNT
Investing,Colombia stocks lower at close of trade; COLCAP down 0.36%,https://www.investing.com/news/stock-market-news/colombia-stocks-lower-at-close-of-trade-colcap-down-036-3772310,https://da.gd/EsVxP
Investing,Stock market today: S&P 500 snaps 3-week win streak ahead of Fed meeting next week,https://www.investing.com/news/stock-market-news/stock-market-today-sp-500-snaps-3week-win-streak-ahead-of-fed-meeting-next-week-3770360,https://da.gd/DnnCH
