feed,title,long_url,short_url
InvestorPlace,Comeback Heroes: Keep Your Eyes on These 3 High-Momentum Stocks,https://investorplace.com/2024/03/comeback-heroes-keep-your-eyes-on-these-3-high-momentum-stocks/,https://da.gd/PbrnHH
InvestorPlace,Fantom Price Predictions: Where Will the FTM Crypto Go Ahead of the Sonic Upgrade?,https://investorplace.com/2024/03/fantom-price-predictions-where-will-the-ftm-crypto-go-ahead-of-the-sonic-upgrade/,https://da.gd/NOsfp
InvestorPlace,SEEL Stock Earnings: Seelos Therapeutics Beats EPS for Q4 2023,https://investorplace.com/earning-results/2024/03/seel-stock-earnings-seelos-therapeutics-for-q4-of-2023/,https://da.gd/wPLMiJ
InvestorPlace,"HOOK Stock Earnings: HOOKIPA Pharma Misses EPS, Beats Revenue for Q4 2023",https://investorplace.com/earning-results/2024/03/hook-stock-earnings-hookipa-pharma-for-q4-of-2023/,https://da.gd/grb5F
InvestorPlace,"STRR Stock Earnings: Star Equity Hldgs Beats EPS, Beats Revenue for Q4 2023",https://investorplace.com/earning-results/2024/03/strr-stock-earnings-star-equity-hldgs-for-q4-of-2023/,https://da.gd/qMDQEG
InvestorPlace,3 Stocks at Risk of a Dividend Cut: March 2024,https://investorplace.com/2024/03/3-stocks-at-risk-of-a-dividend-cut-march-2024/,https://da.gd/VZcbc
InvestorPlace,Wall Street’s Favorite S&P 500 Stocks? 3 Names That Could Make You Filthy Rich,https://investorplace.com/2024/03/wall-streets-favorite-sp-500-stocks-3-names-that-could-make-you-filthy-rich/,https://da.gd/0XBdK
InvestorPlace,The FINRA Crackdown on Social Media Influencers Should Be a Wake-Up Call to Investors,https://investorplace.com/2024/03/the-finra-crackdown-on-social-media-influencers-should-be-a-wake-up-call-to-investors/,https://da.gd/HfTz
InvestorPlace,Wall Street’s Favorite Cybersecurity Stocks? 3 Names That Could Make You Filthy Rich,https://investorplace.com/2024/03/wall-streets-favorite-cybersecurity-stocks-3-names-that-could-make-you-filthy-rich/,https://da.gd/vVauYD
InvestorPlace,3 Stocks That Could Make You Richer Than Your Wildest Dreams,https://investorplace.com/2024/03/3-stocks-that-could-make-you-richer-than-your-wildest-dreams/,https://da.gd/0DpAH1
InvestorPlace,3 Sub-$10 Stocks Poised to Triple Before 2025 Ends,https://investorplace.com/2024/03/3-sub-10-stocks-poised-to-triple-before-2025-ends/,https://da.gd/qqVZK
