feed,title,long_url,short_url
Investing,Accountable Raises $7.5M Led by Pantera Capital to Set New Standard for Real-Time Financial Verification,https://www.investing.com/news/cryptocurrency-news/accountable-raises-75m-led-by-pantera-capital-to-set-new-standard-for-realtime-financial-verification-4316606,
Investing,"U.S. eyeing AI dominance through private sector, federal policies - Raymond James",https://www.investing.com/news/stock-market-news/us-eyeing-ai--dominance-through-private-sector-federal-policies--raymond-james-4316634,
Investing,Jamf stock soars after Francisco Partners agrees to acquire in $2.2B deal,https://www.investing.com/news/stock-market-news/jamf-stock-soars-after-francisco-partners-agrees-to-acquire-in-22b-deal-93CH-4316632,
Investing,Cognizant raises annual adjusted profit forecast on strong client spending,https://www.investing.com/news/stock-market-news/cognizant-raises-annual-adjusted-profit-forecast-on-strong-client-spending-4316251,
Investing,22nd Century Group stock surges after $9.5 million insurance settlement,https://www.investing.com/news/stock-market-news/22nd-century-group-stock-surges-after-95-million-insurance-settlement-93CH-4316624,
Investing,Garmin lifts annual profit outlook; outdoor unit weakness weighs on shares,https://www.investing.com/news/stock-market-news/garmin-lifts-annual-profit-outlook-outdoor-unit-weakness-weighs-on-shares-4316605,
