feed,title,long_url,short_url
Investing,Big Tech Faces Big Week as Nvidia Tops $5 Trillion and AI Job Cuts Mount,https://www.investing.com/analysis/big-tech-faces-big-week-as-nvidia-tops-5-trillion-and-ai-job-cuts-mount-200669320,
Investing,One of the Best AI Stocks Just Got Better After Blowout Earnings,https://www.investing.com/analysis/one-of-the-best-ai-stocks-just-got-better-after-blowout-earnings-200669321,
Investing,"Bank Leumi outlook revised to stable by Fitch, IDR affirmed at A-",https://www.investing.com/news/stock-market-news/bank-leumi-outlook-revised-to-stable-by-fitch-idr-affirmed-at-a-93CH-4317187,
Investing,Fitch downgrades Orbia to ’BBB-’ amid persistent leverage concerns,https://www.investing.com/news/stock-market-news/fitch-downgrades-orbia-to-bbb-amid-persistent-leverage-concerns-93CH-4317185,
Investing,Genuine Parts Co. downgraded to ’BBB-’ by S&P on high debt levels,https://www.investing.com/news/stock-market-news/genuine-parts-co-downgraded-to-bbb-by-sp-on-high-debt-levels-93CH-4317183,
