feed,title,long_url,short_url
CryptoNews,"Bitcoin Bulls Push Price Above $60,000 As These Key Macro Tailwinds Come In – BTC Breakout Back to $70,000 Incoming?",https://cryptonews.com/news/bitcoin-bulls-push-price-above-60000-as-these-key-macro-tailwinds-come-in-btc-breakout-back-to-70000-incoming.htm,https://da.gd/0SQa
CryptoNews,"Shiba Inu’s Future Tied to a Crucial Token, Shytoshi Kusama Reveals – Impact on SHIB Price?",https://cryptonews.com/news/shiba-inus-future-tied-to-a-crucial-token-shytoshi-kusama-reveals-impact-on-shib-price.htm,https://da.gd/zsV8f
CryptoNews,Finnish Broker Coinmotion Expands Crypto Offerings with Bitpanda Partnership,https://cryptonews.com/news/coinmotion-expands-crypto-offerings-with-bitpanda-technology-solutions.htm,https://da.gd/kyVvz
CryptoNews,VanEck Exec Points to 2018 Fraud Case as Key to Solana ETF Approval,https://cryptonews.com/news/vaneck-exec-points-to-2018-fraud-case-as-key-to-solana-etf-approval.htm,https://da.gd/ek9C
CryptoNews,"Dogwifhat Climbs 8%, Is This the Start of a Massive Recovery?",https://cryptonews.com/news/dogwifhat-climbs-8-is-this-the-start-of-a-massive-recovery.htm,https://da.gd/wr2AaM
CryptoNews,Meme Coin Prices Rally – Find Out Which Coin Is Set to Soar Next,https://cryptonews.com/news/meme-coin-prices-rally-find-out-which-coin-is-set-to-soar-next.htm,https://da.gd/Bp3f
CryptoNews,Floki Becomes the Best Performer – Should You Buy Now or Is It Too Late?,https://cryptonews.com/news/floki-becomes-the-best-performer-should-you-buy-now-or-is-it-too-late.htm,https://da.gd/a99G7
