feed,title,long_url,short_url
Benzinga,"Two Day Online Conference: Financial Accounting & Reporting Update 2021 - May 19th-20th, 2021 - ResearchAndMarkets.com",https://www.benzinga.com/pressreleases/21/01/b19115884/two-day-online-conference-financial-accounting-reporting-update-2021-may-19th-20th-2021-researchan,https://j.mp/3spt9r1
Benzinga,"Vizsla Expands Strike of Tajitos Vein Zone, Intersects 1,607 G/t Silver Equiv. Over 7.55 Metres To Panuco, Mexico",https://www.benzinga.com/pressreleases/21/01/n19115881/vizsla-expands-strike-of-tajitos-vein-zone-intersects-1-607-gt-silver-equiv-over-7-55-metres-to-pa,https://j.mp/2XALZNi
Benzinga,Tarachi Provides Review of 2020 and Outlook for 2021,https://www.benzinga.com/pressreleases/21/01/n19115880/tarachi-provides-review-of-2020-and-outlook-for-2021,https://j.mp/2LsMdDP
Benzinga,Geopolitics are Strangling the Global Telecoms Supply Chain,https://www.benzinga.com/pressreleases/21/01/n19115878/geopolitics-are-strangling-the-global-telecoms-supply-chain,https://j.mp/3i3xMlA
Benzinga,SIU School of Dental Medicine Names Cornell Thomas Chief Diversity Officer,https://www.benzinga.com/pressreleases/21/01/n19115877/siu-school-of-dental-medicine-names-cornell-thomas-chief-diversity-officer,https://j.mp/3i6V5Lb
Benzinga,"Altaro, backup solution provider and Veeam rival, acquired by Hornetsecurity",https://www.benzinga.com/pressreleases/21/01/n19115876/altaro-backup-solution-provider-and-veeam-rival-acquired-by-hornetsecurity,https://j.mp/38ACfco
Benzinga,Jacobs Secures Positions on Transport for London's Transport Planning & Impact Monitoring Services Framework,https://www.benzinga.com/pressreleases/21/01/n19115875/jacobs-secures-positions-on-transport-for-londons-transport-planning-impact-monitoring-services-fr,https://j.mp/3nCnqdI
Benzinga,Leading Facial Recognition Technology Provider Corsight AI Appoints Former UK Surveillance Camera Commissioner Tony Porter as Chief Privacy Officer,https://www.benzinga.com/pressreleases/21/01/n19115872/leading-facial-recognition-technology-provider-corsight-ai-appoints-former-uk-surveillance-camera-,https://j.mp/38xozyS
Benzinga,Techorizon announces the launch of the latest version of THeCRF 4.0,https://www.benzinga.com/pressreleases/21/01/n19115865/techorizon-announces-the-launch-of-the-latest-version-of-thecrf-4-0,https://j.mp/3i66z1C
Benzinga,Techorizon announces the launch of the latest version of THeCRF 4.0,https://www.benzinga.com/pressreleases/21/01/n19115863/techorizon-announces-the-launch-of-the-latest-version-of-thecrf-4-0,https://j.mp/3oBwAIN
Benzinga,Penetron Secures a Santiago Residential Tower Against Groundwater,https://www.benzinga.com/pressreleases/21/01/n19115862/penetron-secures-a-santiago-residential-tower-against-groundwater,https://j.mp/2XxoZiq
Benzinga,Culture Days 2021 is RE:IMAGINEd,https://www.benzinga.com/pressreleases/21/01/g19115860/culture-days-2021-is-re-imagined,https://j.mp/3nAYtiS
