feed,title,long_url,short_url
Benzinga,Shermco Industries acquires Ready Engineering,https://www.benzinga.com/pressreleases/21/01/n19127658/shermco-industries-acquires-ready-engineering,https://j.mp/3i7trhe
Benzinga,"Hastings & Hastings Wins $1,750,000 Settlement for Accident Victim",https://www.benzinga.com/pressreleases/21/01/n19127643/hastings-hastings-wins-1-750-000-settlement-for-accident-victim,https://j.mp/2LH7nxR
Benzinga,Media Alert: Wolters Kluwer Launches Enhanced Paycheck Protection Program Solution for New Round of Stimulus Funding,https://www.benzinga.com/pressreleases/21/01/b19127629/media-alert-wolters-kluwer-launches-enhanced-paycheck-protection-program-solution-for-new-round-of,https://j.mp/39tV1Bk
Benzinga,Industry Expert Kevin Wierenga Joins Vari® Executive Leadership,https://www.benzinga.com/pressreleases/21/01/n19127602/industry-expert-kevin-wierenga-joins-vari-executive-leadership,https://j.mp/3i8hjMR
Benzinga,"Indiana Sportsbooks Surpass $300 Million in December, Nearly Reaching $2 Billion for 2020, According to PlayIndiana",https://www.benzinga.com/pressreleases/21/01/n19127595/indiana-sportsbooks-surpass-300-million-in-december-nearly-reaching-2-billion-for-2020-according-t,https://j.mp/3nGjV5Q
Benzinga,Allen Wine Group Announces New Compliance Division,https://www.benzinga.com/pressreleases/21/01/n19127582/allen-wine-group-announces-new-compliance-division,https://j.mp/3bwNMeB
Benzinga,Prime Minister announces new Commissioner of Nunavut,https://www.benzinga.com/pressreleases/21/01/n19127580/prime-minister-announces-new-commissioner-of-nunavut,https://j.mp/2Li0lA0
Benzinga,Citizens Against Government Waste Names Gov. Andrew Cuomo 2020 Porker of the Year,https://www.benzinga.com/pressreleases/21/01/b19127588/citizens-against-government-waste-names-gov-andrew-cuomo-2020-porker-of-the-year,https://j.mp/3oz3b1I
Benzinga,"Global Palm Vein Biometrics Market Growth, Trends, Forecasts Report 2020-2025 - ResearchAndMarkets.com",https://www.benzinga.com/pressreleases/21/01/b19127586/global-palm-vein-biometrics-market-growth-trends-forecasts-report-2020-2025-researchandmarkets-com,https://j.mp/3i7tqKc
