feed,title,long_url,short_url
Investing,Gold Near Record Highs Amid Fed Uncertainty and Geopolitical Risks,https://www.investing.com/analysis/gold-near-record-highs-amid-fed-uncertainty-and-geopolitical-risks-200667551,
Investing,US Dollar Surges as Fed Signals No October Rate Cut,https://www.investing.com/analysis/us-dollar-surges-as-fed-signals-no-october-rate-cut-200667550,
Investing,Markets Await PCE Print as Fed Divisions Keep Rate Outlook Fluid,https://www.investing.com/analysis/markets-await-pce-print-as-fed-divisions-keep-rate-outlook-fluid-200667549,
Investing,US Dollar In Recovery Mode After Solid Data - More Gains In Sight?,https://www.investing.com/analysis/us-dollar-in-recovery-mode-after-solid-data--more-gains-in-sight-200667547,
Investing,"Malaysia asks U.S. for zero tariff rate on furniture, automotive and aerospace parts",https://www.investing.com/news/commodities-news/malaysia-asks-us-for-zero-tariff-rate-on-furniture-automotive-and-aerospace-parts-4257009,
Investing,Baidu plans to launch fully driverless robotaxis in Dubai by Q1 2026,https://www.investing.com/news/stock-market-news/baidu-plans-to-launch-fully-driverless-robotaxis-in-dubai-by-q1-2026-93CH-4257008,
Investing,European Space Agency warns against monopolies as satellite merger looms,https://www.investing.com/news/stock-market-news/european-space-agency-warns-against-monopolies-as-satellite-merger-looms-4257007,
Investing,German truck makers slip while Volvo rises following U.S. tariff announcement,https://www.investing.com/news/stock-market-news/german-truck-makers-slip-while-volvo-rises-following-us-tariff-announcement-4257004,
Investing,Indonesia stocks higher at close of trade; IDX Composite Index up 0.49%,https://www.investing.com/news/stock-market-news/indonesia-stocks-higher-at-close-of-trade-idx-composite-index-up-049-4257002,
