feed,title,long_url,short_url
SeekingAlpha,"IonQ GAAP EPS of -$0.12, revenue of $2.76M",https://seekingalpha.com/news/3907402,
SeekingAlpha,Eledon Pharmaceuticals GAAP EPS of -$0.73,https://seekingalpha.com/news/3907398,
SeekingAlpha,"Stryve Foods Non-GAAP EPS of -$0.15, revenue of $6.2M misses by $1.74M",https://seekingalpha.com/news/3907397,
SeekingAlpha,"Ginkgo Bioworks Holdings GAAP EPS of -$0.41 misses by $0.20, revenue of $66.4M beats by $5.97M",https://seekingalpha.com/news/3907395,
SeekingAlpha,"Quest Resource Non-GAAP EPS of $0.04 misses by $0.06, revenue of $73.4M misses by $0.87M",https://seekingalpha.com/news/3907394,
SeekingAlpha,"ChickenSoup Entertainment GAAP EPS of -$1.13, revenue of $72.4M",https://seekingalpha.com/news/3907393,
SeekingAlpha,"AcelRx Pharmaceuticals GAAP EPS of -$0.94 beats by $0.26, revenue of $0.51M misses by $0.12M",https://seekingalpha.com/news/3907392,
