feed,title,long_url,short_url
SeekingAlpha,Publicis plans to invest €300M in AI over 3 years,https://seekingalpha.com/news/4058343,
SeekingAlpha,"Xcel Energy Non-GAAP EPS of $0.83 in-line, revenue of $3.44B misses by $560M",https://seekingalpha.com/news/4058345,
SeekingAlpha,Commodity Roundup: Oil prices up $1; China stimulus lifts base metals,https://seekingalpha.com/news/4058344,
SeekingAlpha,Virtu Financial Non-GAAP EPS of $0.27 misses by $0.13,https://seekingalpha.com/news/4058342,
SeekingAlpha,"Dow Non-GAAP EPS of $0.43 beats by $0.03, revenue of $10.62B beats by $220M",https://seekingalpha.com/news/4058341,
