feed,title,long_url,short_url
SeekingAlpha,Invesco Select Growth ETF declares quarterly distribution of $0.0025,https://seekingalpha.com/news/3884049,
SeekingAlpha,"Apple's satellite phone ambitions could mean new users, boon for Globalstar - FT",https://seekingalpha.com/news/3884048,
SeekingAlpha,Invesco SmallCap Quality ETF declares quarterly distribution of $0.1245,https://seekingalpha.com/news/3884047,
SeekingAlpha,Invesco MidCap Momentum ETF declares quarterly distribution of $0.3296,https://seekingalpha.com/news/3884046,
SeekingAlpha,Invesco 500 Pure Growth ETF declares quarterly distribution of $0.4114,https://seekingalpha.com/news/3884045,
SeekingAlpha,Loonie called a short at TD as Canada's debt issue prompts BOC to fall behind Fed,https://seekingalpha.com/news/3884044,
SeekingAlpha,US Air Force selects Northrop Grumman for ABMS DI Consortium,https://seekingalpha.com/news/3884043,
