feed,title,long_url,short_url
SeekingAlpha,"Duke Energy Non-GAAP EPS of $1.30 misses by $0.03, revenue of $7.13B beats by $810M",https://seekingalpha.com/news/3834832,
SeekingAlpha,"Party City Non-GAAP EPS of -$0.22 misses by $0.10, revenue of $432.98M misses by $2.82M",https://seekingalpha.com/news/3834831,
SeekingAlpha,"TreeHouse Foods Non-GAAP EPS of -$0.15 beats by $0.37, revenue of $1.14B beats by $50M; reaffirms FY22 guidance",https://seekingalpha.com/news/3834830,
SeekingAlpha,"Zhongchao GAAP EPS of $0.01, revenue of $16.29M",https://seekingalpha.com/news/3834828,
SeekingAlpha,BitNile sees Q1 prelim revenue growth of 142%,https://seekingalpha.com/news/3834827,
SeekingAlpha,Lion Electric hits key milestone with miles driven,https://seekingalpha.com/news/3834826,
