feed,title,long_url,short_url
SeekingAlpha,"3D Systems Non-GAAP EPS of -$0.06 misses by $0.06, revenue of $133M beats by $0.33M",https://seekingalpha.com/news/3835322,
SeekingAlpha,"OPKO Health GAAP EPS of -$0.08 misses by $0.02, revenue of $329.2M misses by $2.25M",https://seekingalpha.com/news/3835320,
SeekingAlpha,"Alto Ingredients GAAP EPS of -$0.04 misses by $0.15, revenue of $308.12M misses by $33.66M",https://seekingalpha.com/news/3835321,
SeekingAlpha,"JFrog GAAP EPS of $0.00 beats by $0.12, revenue of $63.7M beats by $2.55M",https://seekingalpha.com/news/3835319,
SeekingAlpha,"BioLife Solutions GAAP EPS of -$0.17 beats by $0.09, revenue of $36.22M misses by $1.98M",https://seekingalpha.com/news/3835318,
SeekingAlpha,RingCentral hires former HP Enterprise exec as CFO,https://seekingalpha.com/news/3835317,
