feed,title,long_url,short_url
SeekingAlpha,"Advanced Emissions Solutions GAAP EPS of -$0.17, revenue of $26.4M",https://seekingalpha.com/news/3835461,
SeekingAlpha,"The Eastern Company Non-GAAP EPS of $0.46, revenue of $69.01M",https://seekingalpha.com/news/3835460,
SeekingAlpha,"Tidewater Non-GAAP EPS of -$0.28 beats by $0.32, revenue of $105.73M beats by $8.93M",https://seekingalpha.com/news/3835459,
SeekingAlpha,"Mammoth Energy Services Non-GAAP EPS of -$0.32, revenue of $62.3M",https://seekingalpha.com/news/3835458,
SeekingAlpha,"Univar Solutions Non-GAAP EPS of $1.07 beats by $0.30, revenue of $2.88B beats by $270M",https://seekingalpha.com/news/3835457,
SeekingAlpha,Helios Technologies to acquire Taimi RD,https://seekingalpha.com/news/3835456,
SeekingAlpha,"Mesa Air Non-GAAP EPS of -$0.29 beats by $0.04, revenue of $123.21M misses by $3.92M",https://seekingalpha.com/news/3835454,
