feed,title,long_url,short_url
SeekingAlpha,InflaRx launches vilobelimab for severe COVID,https://seekingalpha.com/news/3981437,
SeekingAlpha,Top pharma lobby sues U.S. govt. over Medicare drug pricing negotiations,https://seekingalpha.com/news/3981469,
SeekingAlpha,ProShares UltraPro Dow30 declares quarterly distribution of $0.2069,https://seekingalpha.com/news/3981468,
SeekingAlpha,ProShares Ultra Utilities declares quarterly distribution of $0.3655,https://seekingalpha.com/news/3981467,
SeekingAlpha,ProShares Ultra Telecommunications declares quarterly distribution of $0.0089,https://seekingalpha.com/news/3981466,
SeekingAlpha,ProShares Ultra MidCap400 declares quarterly distribution of $0.1209,https://seekingalpha.com/news/3981465,
