feed,title,long_url,short_url
SeekingAlpha,Integra LifeSciences appoints Lea Daniels Knight as CFO,https://seekingalpha.com/news/3981725,
SeekingAlpha,Logitech approves new $1B stock buyback,https://seekingalpha.com/news/3981724,
SeekingAlpha,Larimar Therapeutics to join Russell 3000 Index,https://seekingalpha.com/news/3981721,
SeekingAlpha,Gulfport Energy slides on 1.3M-share secondary offering,https://seekingalpha.com/news/3981723,
SeekingAlpha,"Avid Bioservices GAAP EPS of $0.00 misses by $0.01, revenue of $39.8M beats by $0.9M",https://seekingalpha.com/news/3981719,
