feed,title,long_url,short_url
InsiderMonkey,Sify Technologies Limited (NASDAQ:SIFY) Q1 2023 Earnings Call Transcript,https://insidermonkey.com/blog/--1170310,
InsiderMonkey,"Insteel Industries, Inc. (NYSE:IIIN) Q3 2023 Earnings Call Transcript",https://insidermonkey.com/blog/--1170312,
InsiderMonkey,MarketAxess Holdings Inc. (NASDAQ:MKTX) Q2 2023 Earnings Call Transcript,https://insidermonkey.com/blog/--1170313,
InsiderMonkey,Synovus Financial Corp. (NYSE:SNV) Q2 2023 Earnings Call Transcript,https://insidermonkey.com/blog/--1170270,
InsiderMonkey,Preferred Bank (NASDAQ:PFBC) Q2 2023 Earnings Call Transcript,https://insidermonkey.com/blog/--1170272,
InsiderMonkey,"United Airlines Holdings, Inc. (NASDAQ:UAL) Q2 2023 Earnings Call Transcript",https://insidermonkey.com/blog/--1170264,
InsiderMonkey,"Steel Dynamics, Inc. (NASDAQ:STLD) Q2 2023 Earnings Call Transcript",https://insidermonkey.com/blog/--1170284,
InsiderMonkey,Kenvue Inc. (NYSE:KVUE) Q2 2023 Earnings Call Transcript,https://insidermonkey.com/blog/--1170314,
InsiderMonkey,Wintrust Financial Corporation (NASDAQ:WTFC) Q2 2023 Earnings Call Transcript,https://insidermonkey.com/blog/--1170275,
InsiderMonkey,National Bank Holdings Corporation (NYSE:NBHC) Q2 2023 Earnings Call Transcript,https://insidermonkey.com/blog/--1170276,
InsiderMonkey,Discover Financial Services (NYSE:DFS) Q2 2023 Earnings Call Transcript,https://insidermonkey.com/blog/--1170277,
