feed,title,long_url,short_url
InsiderMonkey,"Hedge Funds Have Never Been This Bullish On ABM Industries, Inc. (ABM)",https://insidermonkey.com/blog/--882114,https://j.mp/3l7xsCK
InsiderMonkey,"Hedge Funds Have Never Been This Bullish On Hibbett Sports, Inc. (HIBB)",https://insidermonkey.com/blog/--882133,https://j.mp/30ClpFw
InsiderMonkey,"Hedge Funds Are Coming Back To Century Communities, Inc (CCS)",https://insidermonkey.com/blog/--882070,https://j.mp/30CHUdz
InsiderMonkey,Do Hedge Funds Love McGrath RentCorp (MGRC)?,https://insidermonkey.com/blog/--882075,https://j.mp/33uXGZK
InsiderMonkey,Hedge Funds Are Betting On Tronox Holdings Plc (TROX) Again,https://insidermonkey.com/blog/--882078,https://j.mp/36xULSb
