feed,title,long_url,short_url
Investing,"Tesla's Optimus program leader departs, autopilot head assumes role - Bloomberg",https://www.investing.com/news/stock-market-news/teslas-optimus-program-leader-departs-autopilot-head-assumes-role--bloomberg-93CH-4085684,https://da.gd/R9XI2r
Investing,Opendoor Technologies stock falls following reverse split proposal,https://www.investing.com/news/stock-market-news/opendoor-technologies-stock-falls-following-reverse-split-proposal-93CH-4085683,https://da.gd/JZhqSb
Investing,U.S. stocks higher at close of trade; Dow Jones Industrial Average up 1.05%,https://www.investing.com/news/stock-market-news/us-stocks-higher-at-close-of-trade-dow-jones-industrial-average-up-105-4085682,https://da.gd/KgVgh
Investing,Canada stocks higher at close of trade; S&P/TSX Composite up 0.33%,https://www.investing.com/news/stock-market-news/canada-stocks-higher-at-close-of-trade-sptsx-composite-up-033-4085673,https://da.gd/lDAdZ
Investing,Brazil stocks lower at close of trade; Bovespa down 0.07%,https://www.investing.com/news/stock-market-news/brazil-stocks-lower-at-close-of-trade-bovespa-down-007-4085672,https://da.gd/1tXCXD
Investing,Trading Day: Markets rise above the fray,https://www.investing.com/news/economy-news/trading-day-markets-rise-above-the-fray-4085685,https://da.gd/ntDaJw
