feed,title,long_url,short_url
SeekingAlpha,SPDR Barclays High Yield Bond ETF declares monthly distribution of $0.4997,https://seekingalpha.com/news/3880007,
SeekingAlpha,SPDR Bloomberg Barclays International Corporate Bond ETF declares monthly distribution of $0.0143,https://seekingalpha.com/news/3880006,
SeekingAlpha,SPDR Nuveen S&P High Yield Municipal Bond ETF declares monthly distribution of $0.1565,https://seekingalpha.com/news/3880005,
SeekingAlpha,SPDR SSGA Fixed Income Sector Rotation ETF declares monthly distribution of $0.0491,https://seekingalpha.com/news/3880004,
SeekingAlpha,SPDR Bloomberg Barclays Emerging Markets Local Bond ETF declares monthly distribution of $0.0907,https://seekingalpha.com/news/3880003,
SeekingAlpha,SPDR Blackstone High Income ETF declares monthly distribution of $0.1500,https://seekingalpha.com/news/3880002,
