feed,title,long_url,short_url
Benzinga,This Is What Whales Are Betting On Salesforce,https://benzinga.com/insights/options/24/09/40738209/this-is-what-whales-are-betting-on-salesforce,https://da.gd/93CDO
Benzinga,"Down -12.14% in 4 Weeks, Here's Why Karyopharm Therapeutics Looks Ripe for a Turnaround",https://benzinga.com/general/biotech/24/09/40732995/down-12-14-in-4-weeks-heres-why-karyopharm-therapeutics-looks-ripe-for-a-turnaround,https://da.gd/ZCEqR
Benzinga,"Down -15.66% in 4 Weeks, Here's Why Innoviz Technologies Looks Ripe for a Turnaround",https://benzinga.com/news/earnings/24/09/40732997/down-15-66-in-4-weeks-heres-why-innoviz-technologies-looks-ripe-for-a-turnaround,https://da.gd/fUPKV
Benzinga,Dollar Tree Faces Mounting Headwinds: Analysts Lower Price Forecasts Amid Competitive Pressures and Rising Costs,https://benzinga.com/analyst-ratings/analyst-color/24/09/40738159/dollar-tree-faces-mounting-headwinds-analysts-lower-price-forecasts-amid-competitiv,https://da.gd/KJwSm
Benzinga,"Down -5.46% in 4 Weeks, Here's Why SurModics Looks Ripe for a Turnaround",https://benzinga.com/news/earnings/24/09/40732998/down-5-46-in-4-weeks-heres-why-surmodics-looks-ripe-for-a-turnaround,https://da.gd/ugof
