feed,title,long_url,short_url
SeekingAlpha,"Prestige Consumer Healthcare GAAP EPS of $1.02 beats by $0.02, revenue of $289.3M beats by $6.07M",https://seekingalpha.com/news/3900647,
SeekingAlpha,"Vontier Non-GAAP EPS of $0.86 in-line, revenue of $788M misses by $23.31M",https://seekingalpha.com/news/3900646,
SeekingAlpha,WESCO reports Q3 mixed earnings; narrows FY22 outlook,https://seekingalpha.com/news/3900645,
SeekingAlpha,KBR secures $120M analytic modeling and data science contracts,https://seekingalpha.com/news/3900644,
SeekingAlpha,"Pediatrix Medical Group GAAP EPS of $0.37 misses by $0.11, revenue of $489.92M misses by $21.54M",https://seekingalpha.com/news/3900643,
SeekingAlpha,"Ingredion Non-GAAP EPS of $1.73 beats by $0.11, revenue of $2.02B misses by $10M",https://seekingalpha.com/news/3900642,
