feed,title,long_url,short_url
SeekingAlpha,"iRadimed Non-GAAP EPS of $0.29 beats by $0.05, revenue of $13.4M beats by $0.23M",https://seekingalpha.com/news/3900769,
SeekingAlpha,"Orthofix Non-GAAP EPS of $0.13 beats by $0.01, revenue of $114M beats by $12.77M",https://seekingalpha.com/news/3900767,
SeekingAlpha,"Gannett GAAP EPS of -$0.39 misses by $0.15, revenue of $717.9M misses by $27.6M",https://seekingalpha.com/news/3900768,
SeekingAlpha,"Wayfair notches lighter than expected loss, but loses active users",https://seekingalpha.com/news/3900766,
SeekingAlpha,COMPASS Pathways ADS GAAP EPS of -$0.43 beats by $0.22,https://seekingalpha.com/news/3900765,
SeekingAlpha,CyberArk reports Q3 earnings beat; raises FY22 guidance,https://seekingalpha.com/news/3900764,
