feed,title,long_url,short_url
SeekingAlpha,Madrigal Pharmaceuticals GAAP EPS of -$4.75 misses by $0.61,https://seekingalpha.com/news/3900937,
SeekingAlpha,"Perma-Fix Environmental Services GAAP EPS of $0.05, revenue of $18.47M",https://seekingalpha.com/news/3900936,
SeekingAlpha,"Yandex GAAP EPS of $2.02, revenue of $2.32B",https://seekingalpha.com/news/3900935,
SeekingAlpha,"Copper, base metals sink as 'doggedly hawkish' Fed rattles investors",https://seekingalpha.com/news/3900934,
SeekingAlpha,"e.l.f. stock jumps 10% premarket on raised outlook amid strong demand, market share gains",https://seekingalpha.com/news/3900933,
SeekingAlpha,Lincoln National down as notable items impact earnings negatively,https://seekingalpha.com/news/3900932,
SeekingAlpha,Royal Caribbean Cruise stock sails lower on large loss forecasts,https://seekingalpha.com/news/3900931,
