feed,title,long_url,short_url
FXEmpire,ISM Non-Manufacturing PMI Missed Analyst Expectations,https://www.fxempire.com/news/article/ism-non-manufacturing-pmi-missed-analyst-expectations-1184431,https://bit.ly/3Uhmegk
FXEmpire,"U.S. is not in recession, data strong, says White House",https://www.fxempire.com/news/article/u-s-is-not-in-recession-data-strong-says-white-house-1184476,https://bit.ly/3FGCrI1
FXEmpire,"Albania’s Rama chastises “madhouse” UK in migrant row, praises Germany",https://www.fxempire.com/news/article/albanias-rama-chastises-madhouse-uk-in-migrant-row-praises-germany-1184490,https://bit.ly/3Wq78qR
FXEmpire,Crude Oil Price Forecast – Crude Oil Markets Pull Back a Bit During Thursday Volatility,https://www.fxempire.com/forecasts/article/crude-oil-price-forecast-crude-oil-markets-pull-back-a-bit-during-thursday-volatility-1184496,https://bit.ly/3FYyvCP
FXEmpire,Natural Gas Price Forecast – Natural Gas Markets Continue to Consolidate,https://www.fxempire.com/forecasts/article/natural-gas-price-forecast-natural-gas-markets-continue-to-consolidate-13-1184473,https://bit.ly/3UptVBw
