feed,title,long_url,short_url
SeekingAlpha,"JBG Smith, JPMorgan Global Alternative form JV for National Landing development",https://seekingalpha.com/news/3690756,
SeekingAlpha,Gladstone Commercial portfolio occupancy in excess of 95% as of April end,https://seekingalpha.com/news/3690755,
SeekingAlpha,Stelco Holdings reports Q1 results,https://seekingalpha.com/news/3690754,
SeekingAlpha,"Mayville Engineering EPS beats by $0.04, beats on revenue",https://seekingalpha.com/news/3690753,
SeekingAlpha,"Sangamo shares fall after hours as Q1 net loss widens, misses on EPS",https://seekingalpha.com/news/3690750,
SeekingAlpha,Australia and New Zealand Banking reports Q1 results,https://seekingalpha.com/news/3690752,
