feed,title,long_url,short_url
Nasdaq,Brazil's Raizen signals IPO filing is imminent,https://www.nasdaq.com/articles/brazils-raizen-signals-ipo-filing-is-imminent-2021-05-31,https://j.mp/2R9F0LX
Nasdaq,Australian shares slide on rising COVID-19 cases; tech stocks drag,https://www.nasdaq.com/articles/australian-shares-slide-on-rising-covid-19-cases-tech-stocks-drag-2021-05-31,https://j.mp/3wRTeQV
Nasdaq,"PRECIOUS-Gold hovers near 5-month peak on weaker dollar, inflation jitters",https://www.nasdaq.com/articles/precious-gold-hovers-near-5-month-peak-on-weaker-dollar-inflation-jitters-2021-05-31,https://j.mp/3yMv7Vz
Nasdaq,Renesas to restore fire-hit chip plant to 100% capacity around mid-June,https://www.nasdaq.com/articles/renesas-to-restore-fire-hit-chip-plant-to-100-capacity-around-mid-june-2021-05-31,https://j.mp/3z21UWK
Nasdaq,"GRAINS-Corn jumps as much as 2% on cold U.S. weather, Chinese demand",https://www.nasdaq.com/articles/grains-corn-jumps-as-much-as-2-on-cold-u.s.-weather-chinese-demand-2021-05-31,https://j.mp/3g1YzOq
