feed,title,long_url,short_url
SeekingAlpha,Pluralsight's Q1 prelim revenue in-line with estimates,https://seekingalpha.com/news/3677470,
SeekingAlpha,Workhorse Group gains after ARK Invest adds shares again,https://seekingalpha.com/news/3677469,
SeekingAlpha,The Asset Allocator: MMT - Neither Modern Nor Monetary Nor A Theory (Podcast),https://seekingalpha.com/article/4416065,
SeekingAlpha,Intermedia Cloud Communications Proposes Terms For $300 Million IPO,https://seekingalpha.com/article/4416656,
SeekingAlpha,Follow The Money,https://seekingalpha.com/article/4416671,
