feed,title,long_url,short_url
SeekingAlpha,MarineMax to acquire IGY Marinas for $480M in cash,https://seekingalpha.com/news/3869619,
SeekingAlpha,"Clearside Biomedical GAAP EPS of -$0.13 beats by $0.01, revenue of $0.38M beats by $0.08M",https://seekingalpha.com/news/3869618,
SeekingAlpha,Nuvei reports mixed Q2 earnings,https://seekingalpha.com/news/3869617,
SeekingAlpha,"Kaltura Non-GAAP EPS of $0.08 beats by $0.18, revenue of $42M beats by $0.25M",https://seekingalpha.com/news/3869615,
SeekingAlpha,"CleanSpark to acquire active bitcoin mining site in Washington, Georgia",https://seekingalpha.com/news/3869614,
SeekingAlpha,"Chicago Atlantic Real Estate Finance Non-GAAP EPS of $0.50, Net Interest Income of $11.4M misses by $0.03M",https://seekingalpha.com/news/3869613,
SeekingAlpha,"Sterling Check Non-GAAP EPS of $0.33 beats by $0.07, revenue of $205.6M beats by $13.96M",https://seekingalpha.com/news/3869612,
