feed,title,long_url,short_url
SeekingAlpha,Nevada DOT consults Jacobs to develop EV infrastructure deployment plan,https://seekingalpha.com/news/3869756,
SeekingAlpha,"AFC Gamma Non-GAAP EPS of $0.69 beats by $0.14, Net Interest Income of $19.9M beats by $2.32M",https://seekingalpha.com/news/3869755,
SeekingAlpha,Achilles Therapeutics GAAP EPS of -$0.44 beats by $0.13,https://seekingalpha.com/news/3869754,
SeekingAlpha,Genasys nabs $2.2M LRAD order for commercial security,https://seekingalpha.com/news/3869753,
SeekingAlpha,Constellation Brands may have to rethink production options in Mexico due to drought,https://seekingalpha.com/news/3869752,
SeekingAlpha,"Signet Jewelers agrees to buy Blue Nile, cuts EPS/revenue guidance",https://seekingalpha.com/news/3869751,
SeekingAlpha,"Fusion Pharmaceuticals GAAP EPS of -$0.44 beats by $0.09, revenue of $0.57M beats by $0.46M",https://seekingalpha.com/news/3869750,
