feed,title,long_url,short_url
SeekingAlpha,"America First Multifamily Investors GAAP EPS of $1.03, revenue of $19.2M beats by $1.45M",https://seekingalpha.com/news/3833366,
SeekingAlpha,Cathie Wood and Elon Musk see eye-to-eye on actively managed funds,https://seekingalpha.com/news/3833331,
SeekingAlpha,"Aurora Spine Corporation GAAP EPS of -$0.01, revenue of $2.96M",https://seekingalpha.com/news/3833365,
SeekingAlpha,Rambus to acquire Hardent for data center solutions,https://seekingalpha.com/news/3833364,
SeekingAlpha,"Melco Resorts & Entertainment Non-GAAP EPADS of -$0.369 beats by $0.03, revenue of $474.95M misses by $32.82M",https://seekingalpha.com/news/3833363,
SeekingAlpha,"Twilio rises after Q1 earnings beat, but analysts lower price targets on lower multiple",https://seekingalpha.com/news/3833362,
