feed,title,long_url,short_url
SeekingAlpha,"Repare Therapeutics GAAP EPS of -$0.83 beats by $0.04, revenue of $0.41M misses by $1.55M",https://seekingalpha.com/news/3833973,
SeekingAlpha,"Trisura Group Non-GAAP EPS of $0.45, revenue of $481.4M",https://seekingalpha.com/news/3833972,
SeekingAlpha,Longboard Pharmaceuticals GAAP EPS of -$0.56,https://seekingalpha.com/news/3833971,
SeekingAlpha,NextCure GAAP EPS of -$0.74 misses by $0.07,https://seekingalpha.com/news/3833970,
SeekingAlpha,"Arc Resources GAAP EPS of -C$0.10 misses by $0.52, revenue of C$2B",https://seekingalpha.com/news/3833969,
SeekingAlpha,"Gritstone Oncology GAAP EPS of -$0.34 beats by $0.02, revenue of $7.19M beats by $2.98M",https://seekingalpha.com/news/3833968,
SeekingAlpha,Cyteir Therapeutics GAAP EPS of -$0.40 misses by $0.01,https://seekingalpha.com/news/3833967,
