feed,title,long_url,short_url
Investing,Texas Blockchain Council director announces run for State House,https://www.investing.com/news/cryptocurrency-news/texas-blockchain-council-director-announces-run-for-state-house-3125636,https://da.gd/5MPda
Investing,Texas power use breaks record for second day in heat wave,https://www.investing.com/news/commodities-news/texas-power-use-breaks-record-for-second-day-in-heat-wave-3125634,https://da.gd/3zSdf
Investing,Australia govt appoints Michele Bullock as next central bank governor,https://www.investing.com/news/economy/australia-govt-appoints-michele-bullock-as-next-central-bank-governor-3125637,https://da.gd/nJc50
Investing,Factbox-Potential candidates as next chief of Australia's central bank,https://www.investing.com/news/economy/factboxpotential-candidates-as-next-chief-of-australias-central-bank-3125635,https://da.gd/g4lFr
Investing,Australia's central bank chief will not be reappointed -media,https://www.investing.com/news/economy/australias-central-bank-chief-will-not-be-reappointed-media-3125633,https://da.gd/lgJ94Z
