feed,title,long_url,short_url
Investing,Morocco stocks higher at close of trade; Moroccan All Shares up 0.78%,https://www.investing.com/news/stock-market-news/morocco-stocks-higher-at-close-of-trade-moroccan-all-shares-up-078-4803802,
Investing,SanDisk stock split: is it in the cards?,https://www.investing.com/news/stock-market-news/sandisk-stock-split-is-it-in-the-cards-93CH-4803798,
Investing,Webull stock rises after expanding paper trading features,https://www.investing.com/news/stock-market-news/webull-stock-rises-after-expanding-paper-trading-features-93CH-4803792,
Investing,Norway stocks higher at close of trade; Oslo OBX up 0.90%,https://www.investing.com/news/stock-market-news/norway-stocks-higher-at-close-of-trade-oslo-obx-up-090-4803780,
Investing,Corning stock may see 10% move on July 28 earnings report,https://www.investing.com/news/stock-market-news/corning-stock-may-see-10-move-on-july-28-earnings-report-93CH-4803779,
Investing,Israel stocks higher at close of trade; TA 35 up 1.39%,https://www.investing.com/news/stock-market-news/israel-stocks-higher-at-close-of-trade-ta-35-up-139-4803778,
Investing,Avis Budget shares may move 9.7% on upcoming earnings report,https://www.investing.com/news/stock-market-news/avis-budget-shares-may-move-97-on-upcoming-earnings-report-93CH-4803775,
