feed,title,long_url,short_url
Investing,US senator urges Wall Street to reject ’troubling’ paid early access to Trump posts,https://www.investing.com/news/stock-market-news/us-senator-urges-wall-street-to-reject-troubling-paid-early-access-to-trump-posts-4804057,
Investing,OpenAI adds two banking executives to board - WSJ,https://www.investing.com/news/stock-market-news/openai-adds-two-banking-executives-to-board--wsj-93CH-4804055,
Investing,Open AI Adding Two Independent Board Members Ahead of IPO - WSJ,https://www.investing.com/news/stock-market-news/open-ai-adding-two-independent-board-members-ahead-of-ipo--wsj-432SI-4804053,
Investing,Iraq’s minister says U.S. deals worth up to $200 billion,https://www.investing.com/news/economy-news/iraqs-minister-says-us-deals-worth-up-to-200-billion-93CH-4804065,
Investing,"US military training to suffer without funding boost, Hegseth says",https://www.investing.com/news/economy-news/us-military-training-to-suffer-without-funding-boost-hegseth-says-4804062,
