feed,title,long_url,short_url
ETFdb:DailyRecap,AllianzIM Expands ETF Suite With 2 New Funds,https://etfdb.com/news/2023/03/01/allianzim-expands-etf-suite-with-2-new-funds/,https://da.gd/NopLe
ETFdb:DailyRecap,"China Push for ESG Disclosure, Carbon Neutrality Shift",https://etfdb.com/china-insights-channel/china-push-for-esg-disclosure-carbon-neutrality-shift/,https://da.gd/vO9W
ETFdb:DailyRecap,"Corn, Wheat Remains Volatile Due to Ukraine Conflict",https://etfdb.com/commodities-channel/corn-wheat-remains-volatile-due-to-ukraine-conflict/,https://da.gd/3CePu4
ETFdb:DailyRecap,"Among Chip Stocks, Bargains Abound",https://etfdb.com/tactical-allocation-channel/among-chip-stocks-bargains-abound/,https://da.gd/ur8kX
ETFdb:DailyRecap,"Bull vs. Bear: I, Robotics Investor",https://etfdb.com/disruptive-technology-channel/weekly-bull-vs-bear-i-robotics-investor/,https://da.gd/dZNVN
ETFdb:DailyRecap,ETF Prime: Rosenbluth on Morgan Stanley's ESG Products,https://etfdb.com/etf-prime/etf-prime-rosenbluth-on-morgan-stanley-s-esg-products/,https://da.gd/OhvBrv
ETFdb:DailyRecap,Night Sessions Lag as Volatile Month Comes to a Close,https://etfdb.com/night-effect-channel/night-sessions-lag-as-volatile-month-comes-to-a-close/,https://da.gd/XBvq0
ETFdb:DailyRecap,European Equities on the Mind? Don’t Sleep on FLEH,https://etfdb.com/volatility-resource-channel/european-equities-on-the-mind-don-t-sleep-on-fleh/,https://da.gd/UfHCe
ETFdb:DailyRecap,Top Performing Leveraged/Inverse ETFs: 02/26/2023,https://etfdb.com/leveraged-inverse-channel/top-performing-leveraged-2023-02-26/,https://da.gd/cRsxJ
ETFdb:DailyRecap,"As Bitcoin Retreats, India Pushes for Crypto Regulation",https://etfdb.com/crypto-channel/as-bitcoin-retreats-india-pushes-for-crypto-regulation/,https://da.gd/l8mMZ
ETFdb:DailyRecap,As Stocks Remain Pricy Investors Turn to Fixed Income,https://etfdb.com/institutional-income-strategies-channel/as-stocks-remain-pricy-investors-turn-to-fixed-income/,https://da.gd/crox
ETFdb:DailyRecap,Artificial Intelligence & Investing,https://etfdb.com/etf-strategist-channel/artificial-intelligence-investing/,https://da.gd/gcRcOx
ETFdb:DailyRecap,Can the Fed Stick the Landing?,https://etfdb.com/etf-strategist-channel/can-the-fed-stick-the-landing/,https://da.gd/YAd3W
