feed,title,long_url,short_url
Investing,More alarm bells sound on slowing demand for electric vehicles,https://www.investing.com/news/stock-market-news/more-alarm-bells-sound-on-slowing-demand-for-electric-vehicles-3208873,https://da.gd/uX1W
Investing,Mexican carrier Volaris sees Pratt & Whitney inspection agreement in next month,https://www.investing.com/news/stock-market-news/mexican-carrier-volaris-sees-pratt--whitney-inspection-agreement-in-next-month-3208870,https://da.gd/p2Yo4
Investing,Hmd Global Forecasts Sales Boost With Easy Pay Finance Program In India,https://www.investing.com/news/stock-market-news/hmd-global-forecasts-sales-boost-with-easy-pay-finance-program-in-india-93CH-3208868,https://da.gd/Ogw9o
Investing,Stellantis closing in on deal to acquire 20% of China's Leapmotor,https://www.investing.com/news/stock-market-news/stellantis-closing-in-on-deal-to-acquire-20-of-chinas-leapmotor-432SI-3208865,https://da.gd/Zq76
Investing,"Earnings call: KKR Real Estate Finance Trust reports Q3 2023 earnings, maintains strong liquidity",https://www.investing.com/news/stock-market-news/earnings-call-kkr-real-estate-finance-trust-reports-q3-2023-earnings-maintains-strong-liquidity-93CH-3208867,https://da.gd/TajuP
Investing,Retailer Carrefour confident over year-end even as Q3 sales growth slows,https://www.investing.com/news/stock-market-news/retailer-carrefour-confident-over-yearend-even-as-q3-sales-growth-slows-3208866,https://da.gd/V9KD4
Investing,Affirm Holdings cut at Compass Point as analysts believe environment will remain under pressure,https://www.investing.com/news/stock-market-news/affirm-holdings-cut-at-compass-point-as-analysts-believe-environment-will-remain-under-pressure-432SI-3208860,https://da.gd/xtlZ1F
Investing,Top Bank of Canada officials speak after rate decision,https://www.investing.com/news/economy/top-bank-of-canada-officials-speak-after-rate-decision-3208864,https://da.gd/eeFgK
