feed,title,long_url,short_url
SeekingAlpha,Regis Resources reports Q1 results,https://seekingalpha.com/news/4024545,
SeekingAlpha,"Columbia Financial GAAP EPS of $0.09 beats by $0.02, revenue of $57.12M beats by $9.43M",https://seekingalpha.com/news/4024544,
SeekingAlpha,"Morningstar Non-GAAP EPS of $1.28, revenue of $515.5M",https://seekingalpha.com/news/4024543,
SeekingAlpha,"Agnico Eagle Non-GAAP EPS of $0.44 beats by $0.02, revenue of $1.64B in-line",https://seekingalpha.com/news/4024542,
SeekingAlpha,Scholar Rock: SMA Data Readout In 2024 Makes This Worth A Look,https://seekingalpha.com/article/4643504,
