feed,title,long_url,short_url
Investing,US lawmakers discuss digital assets and the House gets a new Speaker,https://www.investing.com/news/cryptocurrency-news/us-lawmakers-discuss-digital-assets-and-the-house-gets-a-new-speaker-3209278,https://da.gd/qfmoDB
Investing,Bankrupt FTX and Alameda Research liquidate $8.6 million in crypto assets,https://www.investing.com/news/cryptocurrency-news/bankrupt-ftx-and-alameda-research-liquidate-86-million-in-crypto-assets-93CH-3209265,https://da.gd/CV7G
Investing,Morgan Stanley names insider Ted Pick as CEO,https://www.investing.com/news/stock-market-news/morgan-stanley-names-ted-pick-as-ceo-3209272,https://da.gd/YVYhn
Investing,Teradyne (NASDAQ:TER) Surprises With Q3 Sales But Quarterly Guidance Underwhelms,https://www.investing.com/news/stock-market-news/teradyne-nasdaqter-surprises-with-q3-sales-but-quarterly-guidance-underwhelms-3209279,https://da.gd/mmLyK
Investing,Tech Mahindra reports significant YoY drop in Q2 net profit,https://www.investing.com/news/stock-market-news/tech-mahindra-reports-significant-yoy-drop-in-q2-net-profit-93CH-3209275,https://da.gd/2qdcs
Investing,Federal regulators finalize climate risk management principles for large banks,https://www.investing.com/news/stock-market-news/federal-regulators-finalize-climate-risk-management-principles-for-large-banks-93CH-3209274,https://da.gd/AgbAh
Investing,Meta reports Q3 revenue growth of 23% to $34.15 billion,https://www.investing.com/news/stock-market-news/meta-reports-q3-revenue-growth-of-23-to-3415-billion-93CH-3209270,https://da.gd/cQcyVY
Investing,"Sibanye-Stillwater restructures South African PGM operations, impacting over 4,000",https://www.investing.com/news/stock-market-news/sibanyestillwater-restructures-south-african-pgm-operations-impacting-over-4000-93CH-3209266,https://da.gd/BhrmG
Investing,Chinese firms to invest nearly $1 billion in northern Mexico -state officials,https://www.investing.com/news/economy/chinese-firms-to-invest-nearly-1-billion-in-northern-mexico-state-officials-3209294,https://da.gd/09Tnf
Investing,Australia's Coles sees Q1 sales jump nearly 4% on at-home consumption,https://www.investing.com/news/economy/australias-coles-sees-q1-sales-jump-nearly-4-on-athome-consumption-3209282,https://da.gd/SA3L6
Investing,Top cycling teams explore creating new competitive league -sources,https://www.investing.com/news/economy/top-cycling-teams-explore-creating-new-competitive-league-sources-3209273,https://da.gd/4FKkW
Investing,"Marketmind: A familiar pattern - stocks slump, yields spike",https://www.investing.com/news/economy/marketmind-a-familiar-pattern--stocks-slump-yields-spike-3209271,https://da.gd/WCSxTQ
