feed,title,long_url,short_url
Nasdaq,Cinven mulls options as Sanne rejects $1.90 bln buyout proposal,https://www.nasdaq.com/articles/cinven-mulls-options-as-sanne-rejects-%241.90-bln-buyout-proposal-2021-05-14,https://j.mp/33OtBDL
Nasdaq,"Mizuho profit beats estimates, sees credit costs halving this year",https://www.nasdaq.com/articles/mizuho-profit-beats-estimates-sees-credit-costs-halving-this-year-2021-05-14,https://j.mp/33EXtT8
Nasdaq,British commodities broker Marex Spectron plans London float,https://www.nasdaq.com/articles/british-commodities-broker-marex-spectron-plans-london-float-2021-05-14,https://j.mp/3fkbuuL
Nasdaq,Sohu.com Q1 Total Revenues Up 24%; Provides Q2 Outlook - Quick Facts,https://www.nasdaq.com/articles/sohu.com-q1-total-revenues-up-24-provides-q2-outlook-quick-facts-2021-05-14,https://j.mp/33EcTHo
Nasdaq,Japan stocks log biggest weekly loss in 9 months as virus wave weighs,https://www.nasdaq.com/articles/japan-stocks-log-biggest-weekly-loss-in-9-months-as-virus-wave-weighs-2021-05-14,https://j.mp/3yl0lTs
Nasdaq,Sage Group HY Profit Down,https://www.nasdaq.com/articles/sage-group-hy-profit-down-2021-05-14,https://j.mp/33M6utu
