feed,title,long_url,short_url
SeekingAlpha,"Sunoco LP GAAP EPS of $2.95, revenue of $6.32B beats by $710M",https://seekingalpha.com/news/4027679,
SeekingAlpha,"Silicon Laboratories Non-GAAP EPS of $0.62 beats by $0.01, revenue of $204M beats by $3.82M",https://seekingalpha.com/news/4027678,
SeekingAlpha,CVS Health swings to profits in Q3 as opioid overhang clears,https://seekingalpha.com/news/4027677,
SeekingAlpha,Estee Lauder stock plunges as Asia headwinds weigh on annual outlook,https://seekingalpha.com/news/4027676,
SeekingAlpha,EyePoint Pharmaceuticals beats Q3 top and bottom line estimates,https://seekingalpha.com/news/4027675,
SeekingAlpha,"Xponential Fitness: BofA sees signs of impending risk, cuts to 'neutral'",https://seekingalpha.com/news/4027674,
SeekingAlpha,"Bally's GAAP EPS of -$1.15 misses by $1.00, revenue of $632.5M misses by $2.04M",https://seekingalpha.com/news/4027673,
