feed,title,long_url,short_url
Nasdaq,First Week of September 17th Options Trading For Carlyle Group (CG),https://www.nasdaq.com/articles/first-week-of-september-17th-options-trading-for-carlyle-group-cg-2021-03-02,https://j.mp/2Pv9zut
Nasdaq,First Week of October 15th Options Trading For Canadian Solar (CSIQ),https://www.nasdaq.com/articles/first-week-of-october-15th-options-trading-for-canadian-solar-csiq-2021-03-02,https://j.mp/3sIqbgA
Nasdaq,First Week of October 15th Options Trading For Costco Wholesale,https://www.nasdaq.com/articles/first-week-of-october-15th-options-trading-for-costco-wholesale-2021-03-02,https://j.mp/3kDSCcC
Nasdaq,First Week of LBTYA October 15th Options Trading,https://www.nasdaq.com/articles/first-week-of-lbtya-october-15th-options-trading-2021-03-02,https://j.mp/3qdF8oV
Nasdaq,First Week of GOOS October 15th Options Trading,https://www.nasdaq.com/articles/first-week-of-goos-october-15th-options-trading-2021-03-02,https://j.mp/30biSkZ
Nasdaq,New York Life Insurance to pay $10.9 mln for improper annuity swapping,https://www.nasdaq.com/articles/new-york-life-insurance-to-pay-%2410.9-mln-for-improper-annuity-swapping-2021-03-02,https://j.mp/3rdwJ6g
Nasdaq,COLUMN-Global manufacturing surge accelerates goods inflation: Kemp,https://www.nasdaq.com/articles/column-global-manufacturing-surge-accelerates-goods-inflation%3A-kemp-2021-03-02,https://j.mp/3qdF4pb
