feed,title,long_url,short_url
SeekingAlpha,"Protalix BioTherapeutics GAAP EPS of -$0.22 beats by $0.17, revenue of $62.89M beats by $17.75M",https://seekingalpha.com/news/3941031,
SeekingAlpha,Should Wall Street move to a four-day trading week?,https://seekingalpha.com/news/3941030,
SeekingAlpha,Softbank and Ant Group likely to offload Paytm stake in open market,https://seekingalpha.com/news/3941029,
SeekingAlpha,"Fisker GAAP EPS of -$0.54 misses by $0.16, revenue of $0.31M misses by $0.71M",https://seekingalpha.com/news/3941028,
SeekingAlpha,General Motors is still a buy at BofA with EV investments seen paying off in long term,https://seekingalpha.com/news/3941027,
SeekingAlpha,Ready Capital to acquire Broadmark in all-stock deal,https://seekingalpha.com/news/3941026,
