feed,title,long_url,short_url
Investing,The Hormuz Defense Hedge: Cashing In on Chaos,https://www.investing.com/analysis/the-hormuz-defense-hedge-cashing-in-on-chaos-200679901,
Investing,Anheuser-Busch Stock Jumps as Volume Growth Signals Turnaround,https://www.investing.com/analysis/anheuserbusch-stock-jumps-as-volume-growth-signals-turnaround-200679899,
Investing,Israel stocks lower at close of trade; TA 35 down 0.80%,https://www.investing.com/news/stock-market-news/israel-stocks-lower-at-close-of-trade-ta-35-down-080-4668606,
Investing,Kinsale Capital stock falls after short seller report,https://www.investing.com/news/stock-market-news/kinsale-capital-stock-falls-after-short-seller-report-93CH-4668605,
Investing,Why is H&R Block stock surging today?,https://www.investing.com/news/stock-market-news/why-is-hr-block-stock-surging-today-93CH-4668601,
Investing,Why is Warby Parker stock surging today?,https://www.investing.com/news/stock-market-news/why-is-warby-parker-stock-surging-today-93CH-4668599,
Investing,Greece stocks higher at close of trade; Athens General Composite up 0.25%,https://www.investing.com/news/stock-market-news/greece-stocks-higher-at-close-of-trade-athens-general-composite-up-025-4668594,
Investing,"Whirlpool shares tumble after revenue miss, dividend suspension",https://www.investing.com/news/stock-market-news/whirlpool-shares-tumble-after-revenue-miss-dividend-suspension-4668577,
