feed,title,long_url,short_url
SeekingAlpha,Hutchmed gets approval to market Elunate for colorectal cancer in Macau,https://seekingalpha.com/news/3807482,
SeekingAlpha,"22nd Century GAAP EPS of -$0.09, revenue of $8M",https://seekingalpha.com/news/3807484,
SeekingAlpha,"Everi Holdings GAAP EPS of $0.88 beats by $0.52, revenue of $180.39M beats by $12.9M",https://seekingalpha.com/news/3807483,
SeekingAlpha,"Amarin Non-GAAP EPS of $0.06 beats by $0.09, revenue of $144.49M beats by $2.32M",https://seekingalpha.com/news/3807481,
SeekingAlpha,"Bank of Nova Scotia Non-GAAP EPS of C$2.15 beats by C$0.10, revenue of C$8.05B beats by C$180M",https://seekingalpha.com/news/3807480,
SeekingAlpha,Global stock markets mixed as Ukraine-Russia tension deepens,https://seekingalpha.com/news/3807479,
