feed,title,long_url,short_url
SeekingAlpha,Zoom drops as price target cut at Citi on weak guidance,https://seekingalpha.com/news/3807557,
SeekingAlpha,"Binance takes equity stake in Malaysian trading platform, MX Global",https://seekingalpha.com/news/3807558,
SeekingAlpha,CGI intends to repurchase 3.97M of its shares held by CDPQ,https://seekingalpha.com/news/3807556,
SeekingAlpha,"APi Group Non-GAAP EPS of $0.29 beats by $0.03, revenue of $1.1B beats by $134.19M",https://seekingalpha.com/news/3807555,
SeekingAlpha,"Arbe Robotics GAAP EPS of -$0.27 misses by $0.11, revenue of $0.5M",https://seekingalpha.com/news/3807554,
