feed,title,long_url,short_url
Benzinga,High Tide Is Considered a Good Investment by Brokers: Is That True?,https://benzinga.com/news/earnings/24/05/38966313/high-tide-is-considered-a-good-investment-by-brokers-is-that-true,https://da.gd/wIDph
Benzinga,Is Tractor Supply Co. Outperforming Other Retail-Wholesale Stocks This Year?,https://benzinga.com/news/earnings/24/05/38966260/is-tractor-supply-co-outperforming-other-retail-wholesale-stocks-this-year,https://da.gd/XAVSW6
Benzinga,Lightspeed Faction Leads $7.7 Million Series A Round for DePIN Weather Startup WeatherXM,https://benzinga.com/markets/cryptocurrency/24/05/38964316/lightspeed-faction-leads-7-7-million-series-a-round-for-depin-weather-startup-weatherxm,https://da.gd/6KYl
Benzinga,Should Value Investors Buy Brinker International Stock?,https://benzinga.com/news/24/05/38966235/should-value-investors-buy-brinker-international-stock,https://da.gd/yNIE
Benzinga,Ethereum Liquid Restaking Platform Kelp Raises Token Round at $90 Million Valuation,https://benzinga.com/markets/cryptocurrency/24/05/38961861/ethereum-liquid-restaking-platform-kelp-raises-token-round-at-90-million-valuation,https://da.gd/3aTWFK
Benzinga,5 Low Price-to-Sales Stocks to Make a Profitable Portfolio,https://benzinga.com/news/earnings/24/05/38966314/5-low-price-to-sales-stocks-to-make-a-profitable-portfolio,https://da.gd/YVmJch
Benzinga,Are Construction Stocks Lagging AZEK This Year?,https://benzinga.com/news/earnings/24/05/38966292/are-construction-stocks-lagging-azek-this-year,https://da.gd/DVOSd
