feed,title,long_url,short_url
InvestorPlace,STRW Stock Earnings: Strawberry Fields REIT Reported Results for Q4 2023,https://investorplace.com/earning-results/2024/03/strw-stock-earnings-strawberry-fields-reit-for-q4-of-2023/,https://da.gd/EBXk
InvestorPlace,AUMN Stock Earnings: Golden Minerals Misses Revenue for Q4 2023,https://investorplace.com/earning-results/2024/03/aumn-stock-earnings-golden-minerals-for-q4-of-2023/,https://da.gd/ESMpJa
InvestorPlace,SRRK Stock Earnings: Scholar Rock Holding Misses EPS for Q4 2023,https://investorplace.com/earning-results/2024/03/srrk-stock-earnings-scholar-rock-holding-for-q4-of-2023/,https://da.gd/6MftCD
InvestorPlace,FORTY Stock Earnings: Formula Sys (1985) Reported Results for Q4 2023,https://investorplace.com/earning-results/2024/03/forty-stock-earnings-formula-sys-1985-for-q4-of-2023/,https://da.gd/82Gcc
InvestorPlace,LIXT Stock Earnings: Lixte Biotech Hldgs Reported Results for Q4 2023,https://investorplace.com/earning-results/2024/03/lixt-stock-earnings-lixte-biotech-hldgs-for-q4-of-2023/,https://da.gd/HOl7Oo
InvestorPlace,"ZTO Stock Earnings: ZTO Express (Cayman) Beats EPS, Misses Revenue for Q4 2023",https://investorplace.com/earning-results/2024/03/zto-stock-earnings-zto-express-cayman-for-q4-of-2023/,https://da.gd/L1E284
InvestorPlace,MAG Stock Earnings: MAG Silver Beats EPS for Q4 2023,https://investorplace.com/earning-results/2024/03/mag-stock-earnings-mag-silver-for-q4-of-2023/,https://da.gd/S8WsD
InvestorPlace,COYA Stock Earnings: Coya Therapeutics Reported Results for Q4 2023,https://investorplace.com/earning-results/2024/03/coya-stock-earnings-coya-therapeutics-for-q4-of-2023/,https://da.gd/0eWe1
InvestorPlace,GDEV Stock Earnings: GDEV Reported Results for Q4 2023,https://investorplace.com/earning-results/2024/03/gdev-stock-earnings-gdev-for-q4-of-2023/,https://da.gd/twZEk
InvestorPlace,TYRA Stock Earnings: Tyra Biosciences Misses EPS for Q4 2023,https://investorplace.com/earning-results/2024/03/tyra-stock-earnings-tyra-biosciences-for-q4-of-2023/,https://da.gd/RsXmPL
InvestorPlace,ACET Stock Earnings: Adicet Bio Meets EPS for Q4 2023,https://investorplace.com/earning-results/2024/03/acet-stock-earnings-adicet-bio-for-q4-of-2023/,https://da.gd/WepkE
InvestorPlace,DMAC Stock Earnings: DiaMedica Therapeutics Meets EPS for Q4 2023,https://investorplace.com/earning-results/2024/03/dmac-stock-earnings-diamedica-therapeutics-for-q4-of-2023/,https://da.gd/1BeExf
InvestorPlace,WWR Stock Earnings: Westwater Resources Reported Results for Q4 2023,https://investorplace.com/earning-results/2024/03/wwr-stock-earnings-westwater-resources-for-q4-of-2023/,https://da.gd/QvICM
InvestorPlace,TPST Stock Earnings: Tempest Therapeutics Beats EPS for Q4 2023,https://investorplace.com/earning-results/2024/03/tpst-stock-earnings-tempest-therapeutics-for-q4-of-2023/,https://da.gd/Yqskm
InvestorPlace,"IBRX Stock Earnings: ImmunityBio Misses EPS, Beats Revenue for Q4 2023",https://investorplace.com/earning-results/2024/03/ibrx-stock-earnings-immunitybio-for-q4-of-2023/,https://da.gd/glrf
InvestorPlace,"HROW Stock Earnings: Harrow Health Misses EPS, Misses Revenue for Q4 2023",https://investorplace.com/earning-results/2024/03/hrow-stock-earnings-harrow-health-for-q4-of-2023/,https://da.gd/sl2lLc
