feed,title,long_url,short_url
Investing,Bitcoin slips amid minor global market gains,https://www.investing.com/news/cryptocurrency-news/bitcoin-slips-amid-minor-global-market-gains-93CH-3237663,https://da.gd/zX0cE
Investing,BJ's (NYSE:BJ) Posts Q3 Sales In Line With Estimates,https://www.investing.com/news/stock-market-news/bjs-nysebj-posts-q3-sales-in-line-with-estimates-3237664,https://da.gd/q0DVO
Investing,"Gap shares soar on Old Navy brand renewal, controlled inventory",https://www.investing.com/news/stock-market-news/gap-shares-soar-on-old-navy-brand-renewal-controlled-inventory-3237660,https://da.gd/D94pq
Investing,Tristar Acquisition I Corp sees strong institutional investor influence,https://www.investing.com/news/stock-market-news/tristar-acquisition-i-corp-sees-strong-institutional-investor-influence-93CH-3237659,https://da.gd/KMqBdb
Investing,Olin Corporation outperforms industry average with 25% ROE,https://www.investing.com/news/stock-market-news/olin-corporation-outperforms-industry-average-with-25-roe-93CH-3237657,https://da.gd/Lllo
Investing,Lilly extends tender offer to acquire Point Biopharma to Dec 1,https://www.investing.com/news/stock-market-news/lilly-extends-tender-offer-to-acquire-point-biopharma-to-dec-1-3237649,https://da.gd/0CCsa1
Investing,Adecoagro stock seen as undervalued despite volatility risks,https://www.investing.com/news/stock-market-news/adecoagro-stock-seen-as-undervalued-despite-volatility-risks-93CH-3237648,https://da.gd/OFLjmS
Investing,UK stocks rally on rate cut hopes and AstraZeneca's drug approval,https://www.investing.com/news/stock-market-news/uk-stocks-rally-on-rate-cut-hopes-and-astrazenecas-drug-approval-93CH-3237650,https://da.gd/CzbOMS
