feed,title,long_url,short_url
SeekingAlpha,"QinetiQ Group plc GAAP EPS of 11p, revenue of £883.1M",https://seekingalpha.com/news/4038280,
SeekingAlpha,"SKIN, DDL, SPB among consumer staples movers",https://seekingalpha.com/news/4038274,
SeekingAlpha,"La Rosa Holdings in real estate gainers, reAlpha Tech in losers",https://seekingalpha.com/news/4038273,
SeekingAlpha,"Qifu Technology, Banco Macro, LoanDepot among financials gainers",https://seekingalpha.com/news/4038272,
SeekingAlpha,Gulf & Pacific Equities reports Q3 results,https://seekingalpha.com/news/4038271,
