feed,title,long_url,short_url
Investors,Three Fast-Moving Regional Banks Help Drive This ETF Breakout,https://www.investors.com/news/bank-of-hawaii/,
Investors,Lithium Giant's Monster 250% Rally Faces Test With Q4 Earnings,https://www.investors.com/news/albermarle-stock-alb-stock-lithium/,
Investors,Beazer Homes Stock Scores Relative Strength Rating Upgrade,https://www.investors.com/news/beazer-homes-stock-scores-relative-strength-rating-upgrade/,
Investors,Chip Equipment Maker Axcelis Technologies Gets RS Rating Lift,https://www.investors.com/news/chip-equipment-maker-axcelis-technologies-gets-rs-rating-lift/,
Investors,"InterContinental Hotels Stock Pops To Record High Amid Strong, Continuing Profit Growth",https://www.investors.com/news/intercontinental-hotels-relative-strength-rating-climbs-to-74/,
