feed,title,long_url,short_url
Investing,"Binance Delists Top BTC and ETH Pairs, New Binance CEO's Connection With Ripple Uncovered, SHIB Rep Teases 'Testing That Will Shape Future of Ecosystem': Crypto News Digest by U.Today",https://www.investing.com/news/cryptocurrency-news/binance-delists-top-btc-and-eth-pairs-new-binance-ceos-connection-with-ripple-uncovered-shib-rep-teases-testing-that-will-shape-future-of-ecosystem-crypto-news-digest-by-utoday-3242935,https://da.gd/1wSj
Investing,Dogecoin sees heightened activity with new investor interest and transfers,https://www.investing.com/news/cryptocurrency-news/dogecoin-sees-heightened-activity-with-new-investor-interest-and-transfers-93CH-3242933,https://da.gd/CrAo
Investing,"ARB token shows signs of recovery, eyes $1.35 target",https://www.investing.com/news/cryptocurrency-news/arb-token-shows-signs-of-recovery-eyes-135-target-93CH-3242925,https://da.gd/1LGQ6
Investing,Ex-Binance CEO Zhao urges judge to allow him to leave US before sentencing,https://www.investing.com/news/stock-market-news/exbinance-ceo-zhao-urges-judge-to-allow-him-leave-us-before-sentencing-3242921,https://da.gd/gP6nj
Investing,Denmark stocks higher at close of trade; OMX Copenhagen 20 up 0.67%,https://www.investing.com/news/stock-market-news/denmark-stocks-higher-at-close-of-trade-omx-copenhagen-20-up-067-3242934,https://da.gd/XdIZ
Investing,MSC Industrial Direct ROCE outperforms industry average,https://www.investing.com/news/stock-market-news/msc-industrial-direct-roce-outperforms-industry-average-93CH-3242932,https://da.gd/IzzsK
Investing,Bandhan Bank board approves Ghosh for another term as CEO,https://www.investing.com/news/stock-market-news/bandhan-bank-board-approves-ghosh-for-another-term-as-ceo-93CH-3242931,https://da.gd/mb6tA
Investing,Talanx boosts Latin America presence with Liberty Seguros buy,https://www.investing.com/news/stock-market-news/talanx-boosts-latin-america-presence-with-liberty-seguros-buy-93CH-3242924,https://da.gd/qcFXd
Investing,"Summit Materials stock rises, matches industry PE ratio",https://www.investing.com/news/stock-market-news/summit-materials-stock-rises-matches-industry-pe-ratio-93CH-3242919,https://da.gd/Kdrij
Investing,"Rover Group stock soars despite low ROE, analysts optimistic",https://www.investing.com/news/stock-market-news/rover-group-stock-soars-despite-low-roe-analysts-optimistic-93CH-3242917,https://da.gd/oNNtmW
Investing,Home working may be helping Brazil's inflation ease - central bank study,https://www.investing.com/news/economy/home-working-may-be-helping-brazils-inflation-ease--central-bank-study-3242923,https://da.gd/zqmuf
Investing,UN conference adopts 2030 goal on cleaner aviation fuels,https://www.investing.com/news/economy/un-conference-adopts-2030-goal-on-cleaner-aviation-fuels-3242918,https://da.gd/IfnaSP
