feed,title,long_url,short_url
SeekingAlpha,"Destination XL Non-GAAP EPS of $0.23 beats by $0.05, revenue of $140M beats by $1.45M",https://seekingalpha.com/news/4005906,
SeekingAlpha,"CollPlant Biotechnologies Non-GAAP EPS of $0.52, revenue of $10.2M beats by $4.86M",https://seekingalpha.com/news/4005905,
SeekingAlpha,"Hain Celestial Non-GAAP EPS of $0.11 beats by $0.01, revenue of $447.84M beats by $5.46M",https://seekingalpha.com/news/4005904,
SeekingAlpha,SharkNinja reports double-digit sales and adjusted earnings growth in Q2,https://seekingalpha.com/news/4005903,
SeekingAlpha,"Opera GAAP EPS of $0.15 beats by $0.03, revenue of $94.13M beats by $2.47M",https://seekingalpha.com/news/4005902,
