feed,title,long_url,short_url
SeekingAlpha,"Ulta Beauty raises forecasts, shares up after the close",https://seekingalpha.com/news/4006167,
SeekingAlpha,"Credo Technology Non-GAAP EPS of -$0.03 in-line, revenue of $35.1M beats by $0.83M",https://seekingalpha.com/news/4006166,
SeekingAlpha,POSaBIT Systems reports Q2 results,https://seekingalpha.com/news/4006165,
SeekingAlpha,WSFS Financial names Arthur Bacci as interim finance chief,https://seekingalpha.com/news/4006164,
SeekingAlpha,"American Software Non-GAAP EPS of $0.12 beats by $0.02, revenue of $29.16M misses by $0.08M",https://seekingalpha.com/news/4006162,
