feed,title,long_url,short_url
Investing,Commodities Outlook 2024: Cautious Optimism,https://www.investing.com/analysis/commodities-outlook-2024-cautious-optimism-200644137,https://da.gd/iQdQA
Investing,"Flewber Global trims IPO size, targets $15 million raise",https://www.investing.com/news/stock-market-news/flewber-global-trims-ipo-size-targets-15-million-raise-93CH-3249446,https://da.gd/xAMRhf
Investing,Adani Group stocks rally on power demand and funding news,https://www.investing.com/news/stock-market-news/adani-group-stocks-rally-on-power-demand-and-funding-news-93CH-3249433,https://da.gd/GjAP7
Investing,Russia to more than halve deferred FX purchases in coming month,https://www.investing.com/news/economic-indicators/russia-to-more-than-halve-deferred-fx-purchases-in-coming-month-3249437,https://da.gd/wnVmNj
Investing,"Japan's inflation eases, supporting BOJ's steady policy stance",https://www.investing.com/news/economy/japans-inflation-eases-supporting-bojs-steady-policy-stance-93CH-3249475,https://da.gd/dUbx
Investing,"Britain's dominant services sector rebounds, cost burdens persist",https://www.investing.com/news/economy/britains-dominant-services-sector-rebounds-cost-burdens-persist-3249458,https://da.gd/d6Ct
