feed,title,long_url,short_url
SeekingAlpha,"Village Super Market GAAP EPS of $0.78, revenue of $536.4M",https://seekingalpha.com/news/4043364,
SeekingAlpha,"Intercontinental Exchange gets partial win, $155M award in PennyMac case",https://seekingalpha.com/news/4043363,
SeekingAlpha,"America's Car-Mart EPS of -$4.30, revenue of $361.6M misses by $14.35M",https://seekingalpha.com/news/4043362,
SeekingAlpha,Digihost Technology says its November BTC output rises 26% Y/Y,https://seekingalpha.com/news/4043361,
SeekingAlpha,2 REITs Aggressively Repurchasing Shares,https://seekingalpha.com/article/4655205,
SeekingAlpha,BYD: Buy The Dip,https://seekingalpha.com/article/4656023,
