feed,title,long_url,short_url
ETFTrends:DailyRecap,Has the Magnificent Seven Run Peaked? Consider These 2 S&P 500 ETFs,https://www.etftrends.com/innovative-etfs-channel/has-magnificent-seven-run-peaked-consider-2-sp-500-etfs/,https://da.gd/gfWQR
ETFTrends:DailyRecap,The EAC Positions Exchange to Solve Client Concerns,https://www.etftrends.com/exchange-an-etf-experience/eac-positions-exchange-solve-client-concerns/,https://da.gd/nn7IlZ
ETFTrends:DailyRecap,These 4 ETFs Won the Market Sell-Off Monday,https://www.etftrends.com/innovative-etfs-channel/these-4-etfs-won-market-selloff-monday/,https://da.gd/0AF12i
ETFTrends:DailyRecap,Cryptocurrencies: Bitcoin Plummets to 5-Month Low,https://www.etftrends.com/crypto-channel/cryptocurrencies-bitcoin-plummets-five-month-low/,https://da.gd/AK3Ar
ETFTrends:DailyRecap,Moat Investing Could Be Ideal in Tumultuous Times,https://www.etftrends.com/tactical-allocation-channel/moat-investing-could-ideal-tumultuous-times/,https://da.gd/FpFAB
ETFTrends:DailyRecap,Rate Cuts Could Provide Relief for These ETFs,https://www.etftrends.com/etf-education-channel/rate-cuts-could-provide-relief-etfs/,https://da.gd/qNpU
ETFTrends:DailyRecap,Second Quarter Sales Add Bullish Vibes to EVs and This ETF,https://www.etftrends.com/leveraged-inverse-channel/second-quarter-sales-add-bullish-vibes-evs-etf/,https://da.gd/ATyM
ETFTrends:DailyRecap,Why did the Market Drop so Fast? Making Rational Sense of an Irrational Market,https://www.etftrends.com/etf-strategist-channel/why-did-market-drop-fast-making-rational-sense-irrational-market/,https://da.gd/YW6A4e
ETFTrends:DailyRecap,"CIO Thoughts: Is the Great Rotation Under Attack, Given bad News Is Back to Being bad News?",https://www.etftrends.com/etf-strategist-channel/cio-thoughts-is-great-rotation-under-attack-bad-news-back-being-bad-news/,https://da.gd/9ekwY
ETFTrends:DailyRecap,3 Funds to Consider for the Front End of the Yield Curve,https://www.etftrends.com/fixed-income-channel/3-funds-consider-front-end-yield-curve/,https://da.gd/bNBs
ETFTrends:DailyRecap,Remembering the Tempo and Rhythms of Financial Markets,https://www.etftrends.com/etf-strategist-channel/remembering-tempo-rhythms-financial-markets/,https://da.gd/0mhi
ETFTrends:DailyRecap,Disruptive Theme of the Week: Where’s The Juice?,https://www.etftrends.com/disruptive-technology-channel/wheres-juice-disruptive-theme-of-the-week/,https://da.gd/JN1Pq3
ETFTrends:DailyRecap,"For an Edge With International Stocks, Consider Quality",https://www.etftrends.com/model-portfolio-channel/edge-international-stocks-consider-quality/,https://da.gd/vLJEBh
ETFTrends:DailyRecap,The Great Rotation: Just Getting Started?,https://www.etftrends.com/great-rotation-just-getting-started/,https://da.gd/N1ElRO
ETFTrends:DailyRecap,IWMI Roars Out of the Gate With 14.03% Distribution Yield,https://www.etftrends.com/monthly-income-channel/iwmi-roars-14-03-distribution-yield/,https://da.gd/3WSrx
