feed,title,long_url,short_url
SeekingAlpha,Algonquin Power to sell renewable energy business to LS Power for up to $2.5B,https://seekingalpha.com/news/4138005,
SeekingAlpha,"Canterbury Park GAAP EPS of $0.07, revenue of $16.2M",https://seekingalpha.com/news/4138004,
SeekingAlpha,"AlTi Global GAAP EPS of -$0.18, revenue of $49.45M misses by $2.35M",https://seekingalpha.com/news/4138003,
SeekingAlpha,Savers Value Village Non-GAAP EPS of $0.14,https://seekingalpha.com/news/4138002,
SeekingAlpha,Connexa Sports Technologies reports Q1 results,https://seekingalpha.com/news/4138001,
