feed,title,long_url,short_url
InvestorPlace,SVT Stock Earnings: Servotronics Reported Results for Q2 2024,https://investorplace.com/earning-results/2024/08/svt-stock-earnings-servotronics-for-q2-of-2024/,https://da.gd/OHXgEg
InvestorPlace,TCI Stock Earnings: Transcontinental Realty Reported Results for Q2 2024,https://investorplace.com/earning-results/2024/08/tci-stock-earnings-transcontinental-realty-for-q2-of-2024/,https://da.gd/SAow9
InvestorPlace,RGLS Stock Earnings: Regulus Therapeutics Misses EPS for Q2 2024,https://investorplace.com/earning-results/2024/08/rgls-stock-earnings-regulus-therapeutics-for-q2-of-2024/,https://da.gd/pfcIk
InvestorPlace,TNYA Stock Earnings: Tenaya Therapeutics Beats EPS for Q2 2024,https://investorplace.com/earning-results/2024/08/tnya-stock-earnings-tenaya-therapeutics-for-q2-of-2024/,https://da.gd/odiUDd
InvestorPlace,SANA Stock Earnings: Sana Biotechnology Misses EPS for Q2 2024,https://investorplace.com/earning-results/2024/08/sana-stock-earnings-sana-biotechnology-for-q2-of-2024/,https://da.gd/tGfjXY
InvestorPlace,"SNOA Stock Earnings: Sonoma Pharmaceuticals Misses EPS, Misses Revenue for Q1 2025",https://investorplace.com/earning-results/2024/08/snoa-stock-earnings-sonoma-pharmaceuticals-for-q1-of-2025/,https://da.gd/kRv934
InvestorPlace,SENEA Stock Earnings: Seneca Foods Reported Results for Q1 2025,https://investorplace.com/earning-results/2024/08/senea-stock-earnings-seneca-foods-for-q1-of-2025/,https://da.gd/c9zUKa
InvestorPlace,"SCYX Stock Earnings: SCYNEXIS Misses EPS, Misses Revenue for Q2 2024",https://investorplace.com/earning-results/2024/08/scyx-stock-earnings-scynexis-for-q2-of-2024/,https://da.gd/dPgw2s
InvestorPlace,SABS Stock Earnings: SAB Biotherapeutics Beats EPS for Q2 2024,https://investorplace.com/earning-results/2024/08/sabs-stock-earnings-sab-biotherapeutics-for-q2-of-2024/,https://da.gd/pGPvh
InvestorPlace,Why Is American Vanguard (AVD) Stock Down 28% Today?,https://investorplace.com/2024/08/why-is-american-vanguard-avd-stock-down-28-today/,https://da.gd/iNZvIu
InvestorPlace,Why Is AN2 Therapeutics (ANTX) Stock Down 35% Today?,https://investorplace.com/2024/08/why-is-an2-therapeutics-antx-stock-down-35-today/,https://da.gd/EpnZl
InvestorPlace,The 3 Best Cloud Gaming Stocks to Buy in August 2024,https://investorplace.com/2024/08/the-3-best-cloud-gaming-stocks-to-buy-in-august-2024/,https://da.gd/8BGe19
InvestorPlace,Why Is Nauticus Robotics (KITT) Stock Up 40% Today?,https://investorplace.com/2024/08/why-is-nauticus-robotics-kitt-stock-up-40-today/,https://da.gd/GP93
InvestorPlace,CYAN Stock Earnings: Cyanotech Reported Results for Q1 2025,https://investorplace.com/earning-results/2024/08/cyan-stock-earnings-cyanotech-for-q1-of-2025/,https://da.gd/lanG
InvestorPlace,ECO Stock Earnings: Okeanis Eco Tankers Reported Results for Q2 2024,https://investorplace.com/earning-results/2024/08/eco-stock-earnings-okeanis-eco-tankers-for-q2-of-2024/,https://da.gd/5h1uVf
InvestorPlace,3 Tech Stocks to Dump After Disappointing Q2 Earnings,https://investorplace.com/2024/08/3-tech-stocks-to-dump-after-disappointing-q2-earnings/,https://da.gd/pBxn
InvestorPlace,ORGS Stock Earnings: Orgenesis Reported Results for Q2 2024,https://investorplace.com/earning-results/2024/08/orgs-stock-earnings-orgenesis-for-q2-of-2024/,https://da.gd/1dHQ
InvestorPlace,"KRON Stock Earnings: Kronos Bio Beats EPS, Beats Revenue for Q2 2024",https://investorplace.com/earning-results/2024/08/kron-stock-earnings-kronos-bio-for-q2-of-2024/,https://da.gd/zSY9R
InvestorPlace,"LOGC Stock Earnings: ContextLogic Misses EPS, Beats Revenue for Q2 2024",https://investorplace.com/earning-results/2024/08/logc-stock-earnings-contextlogic-for-q2-of-2024/,https://da.gd/hAb4Dt
InvestorPlace,MIST Stock Earnings: Milestone Pharmaceuticals Beats EPS for Q2 2024,https://investorplace.com/earning-results/2024/08/mist-stock-earnings-milestone-pharmaceuticals-for-q2-of-2024/,https://da.gd/moLt1O
InvestorPlace,INTS Stock Earnings: Intensity Therapeutics Misses EPS for Q2 2024,https://investorplace.com/earning-results/2024/08/ints-stock-earnings-intensity-therapeutics-for-q2-of-2024/,https://da.gd/ShyAeM
InvestorPlace,IOR Stock Earnings: Income Opportunity Realty Reported Results for Q2 2024,https://investorplace.com/earning-results/2024/08/ior-stock-earnings-income-opportunity-realty-for-q2-of-2024/,https://da.gd/do5iMX
InvestorPlace,"NUTX Stock Earnings: Nutex Health Misses EPS, Beats Revenue for Q2 2024",https://investorplace.com/earning-results/2024/08/nutx-stock-earnings-nutex-health-for-q2-of-2024/,https://da.gd/ond0eB
InvestorPlace,Why Is Iteris (ITI) Stock Up 64% Today?,https://investorplace.com/2024/08/why-is-iteris-iti-stock-up-64-today/,https://da.gd/3AVAk4
InvestorPlace,Why Investors Should Take UBER Stock for a Ride After Earnings,https://investorplace.com/2024/08/why-investors-should-take-uber-stock-for-a-ride-after-earnings/,https://da.gd/BRfo
InvestorPlace,Today’s Biggest Pre-Market Stock Movers: 10 Top Gainers and Losers on Friday,https://investorplace.com/2024/08/todays-biggest-pre-market-stock-movers-10-top-gainers-and-losers-on-friday-aug-9th/,https://da.gd/I0BuMC
