feed,title,long_url,short_url
SeekingAlpha,"Avid Bioservices EPS beats by $0.04, beats on revenue",https://seekingalpha.com/news/3670450,
SeekingAlpha,"Benefitfocus EPS beats by $0.13, beats on revenue",https://seekingalpha.com/news/3670449,
SeekingAlpha,"Del Taco Restaurants EPS beats by $0.06, beats on revenue",https://seekingalpha.com/news/3670448,
SeekingAlpha,Heritage Global reports Q4 results,https://seekingalpha.com/news/3670447,
SeekingAlpha,"Castle Biosciences EPS misses by $0.11, beats on revenue",https://seekingalpha.com/news/3670445,
SeekingAlpha,Itron launches $350M follow-on offering & $400M senior notes offering,https://seekingalpha.com/news/3670446,
SeekingAlpha,"Synchronoss Technologies EPS beats by $0.27, beats on revenue",https://seekingalpha.com/news/3670444,
