feed,title,long_url,short_url
Investing,New testimony raises pressure on UK’s Starmer over choice of envoy to US,https://www.investing.com/news/stock-market-news/new-testimony-raises-pressure-on-uks-starmer-over-choice-of-envoy-to-us-4625845,
Investing,Goldman expects U.S. equity market to continue making new highs,https://www.investing.com/news/stock-market-news/goldman-expects-us-equity-market-to-continue-making-new-highs-4625847,
Investing,MSCI quarterly profit rises on index segment strength,https://www.investing.com/news/stock-market-news/msci-quarterly-profit-rises-on-index-segment-strength-4625840,
Investing,"""AI eats software"" theme is yielding a buy opportunity in this stock: Berenberg",https://www.investing.com/news/stock-market-news/ai-eats-software-theme-is-yielding-a-buy-opportunity-in-this-stock-berenberg-4625830,
Investing,Avis Budget stock surges on short squeeze dynamics,https://www.investing.com/news/stock-market-news/avis-budget-stock-surges-on-short-squeeze-dynamics-4625811,
