feed,title,long_url,short_url
SeekingAlpha,Ivanhoe Electric to launch $150M public stock offering,https://seekingalpha.com/news/4011564,
SeekingAlpha,"MIND Technology GAAP EPS of -$0.18 misses by $0.04, revenue of $8.75M misses by $0.45M",https://seekingalpha.com/news/4011563,
SeekingAlpha,OKYO Pharma announces public offering of ordinary shares,https://seekingalpha.com/news/4011562,
SeekingAlpha,Gladstone Investment partners with Xyresic Capital to buy The E3 Company,https://seekingalpha.com/news/4011560,
SeekingAlpha,"Semtech Non-GAAP EPS of $0.11 beats by $0.09, revenue of $238.37M beats by $1M",https://seekingalpha.com/news/4011561,
