feed,title,long_url,short_url
ETFTrends:DailyRecap,Defensive ETFs Are Turning Heads as Investors Seek Safer Plays,https://www.etftrends.com/defensive-etfs-are-turning-heads-as-investors-seek-safer-plays/,https://bit.ly/3we0doe
ETFTrends:DailyRecap,Precious Metals Saw Rocky April but Have Big Breakout Potential,https://www.etftrends.com/gold-silver-investing-channel/precious-metals-saw-rocky-april-but-have-big-breakout-potential/,https://bit.ly/38Z9Csb
ETFTrends:DailyRecap,Hedge Against Market Volatility With This Managed Futures Fund,https://www.etftrends.com/managed-futures-channel/hedge-against-market-volatility-with-this-managed-futures-fund/,https://bit.ly/3kM7Woe
ETFTrends:DailyRecap,How to Meet Your Self-Employed Clients’ Retirement Needs,https://www.etftrends.com/retirement-income-channel/how-to-meet-your-self-employed-clients-retirement-needs/,https://bit.ly/3yk5aP6
ETFTrends:DailyRecap,Market Sell-Off May Be a Boon to Value Stocks,https://www.etftrends.com/core-strategies-channel/market-sell-off-may-be-a-boon-to-value-stocks/,https://bit.ly/391uX3S
ETFTrends:DailyRecap,ENFR and AMLP Offer Exposure to Midstream’s Growth Opportunities,https://www.etftrends.com/energy-infrastructure-channel/enfr-and-amlp-offer-exposure-to-midstreams-growth-opportunities/,https://bit.ly/3w7fUxO
ETFTrends:DailyRecap,This Pharmaceutical Company Is Growing — Here’s How to Invest,https://www.etftrends.com/dual-impact-channel/this-pharmaceutical-company-is-growing-heres-how-to-invest/,https://bit.ly/38VxzjY
ETFTrends:DailyRecap,Curious About the Benefits of a Carbon Cap-and-Trade Program?,https://www.etftrends.com/climate-insights-channel/curious-about-the-benefits-of-a-carbon-cap-and-trade-program/,https://bit.ly/3FnG974
ETFTrends:DailyRecap,Get Low Volatility and High Dividend Via This ETF,https://www.etftrends.com/innovative-etfs-channel/get-low-volatility-and-high-dividend-via-this-etf/,https://bit.ly/3kLctHF
ETFTrends:DailyRecap,Post-Rate Hike Depression Pulls This Leveraged ETF Higher,https://www.etftrends.com/leveraged-inverse-channel/post-rate-hike-depression-pulls-this-leveraged-etf-higher/,https://bit.ly/388vwZO
ETFTrends:DailyRecap,Which FlexShares ETFs Were the Most Popular in April?,https://www.etftrends.com/multi-asset-channel/which-flexshares-etfs-were-the-most-popular-in-april/,https://bit.ly/3LRBeOd
ETFTrends:DailyRecap,Advisors Prefer Active Management for Fixed Income,https://www.etftrends.com/active-etf-channel/advisors-prefer-active-management-for-fixed-income-investments/,https://bit.ly/3vRIBQr
ETFTrends:DailyRecap,Grayscale Files Form 10s on 3 Crypto Trusts,https://www.etftrends.com/crypto-channel/grayscale-files-form-10s-on-three-crypto-trusts/,https://bit.ly/3KLMaeV
ETFTrends:DailyRecap,RSPE: Right Idea for ESG Ratings Clarity,https://www.etftrends.com/portfolio-strategies-channel/rspe-right-idea-for-esg-ratings-clarity/,https://bit.ly/3vQ1RNZ
ETFTrends:DailyRecap,These 2 ETFs Offer Diversified Exposure to the Crypto Industry,https://www.etftrends.com/crypto-channel/these-2-etfs-offer-diversified-exposure-to-the-crypto-industry/,https://bit.ly/3w90j0G
ETFTrends:DailyRecap,Battered Biotech Space Now Unbelievably Inexpensive,https://www.etftrends.com/nasdaq-portfolio-solutions-channel/battered-biotech-space-now-unbelievably-inexpensive/,https://bit.ly/3FleSCs
ETFTrends:DailyRecap,Electric Vehicle Investing Isn’t Just About Auto Stocks,https://www.etftrends.com/etf-education-channel/electric-vehicle-investing-isnt-just-about-auto-stocks/,https://bit.ly/3kPuJzQ
ETFTrends:DailyRecap,GRNB: An ETF to Consider for Climate-Focused Investors,https://www.etftrends.com/tactical-allocation-channel/grnb-an-etf-to-consider-for-climate-focused-investors/,https://bit.ly/3ygpbWZ
ETFTrends:DailyRecap,Brazil Internet Opportunity Beckons With FMQQ,https://www.etftrends.com/emerging-markets-channel/brazil-internet-opportunity-beckons-with-fmqq/,https://bit.ly/3MYM0Cm
ETFTrends:DailyRecap,Disruptive Growth Will Have Its Day Again,https://www.etftrends.com/disruptive-technology-channel/disruptive-growth-will-have-its-day-again/,https://bit.ly/3LWy5Ne
ETFTrends:DailyRecap,How to Navigate Market Volatility With Managed Futures,https://www.etftrends.com/china-insights-channel/how-to-navigate-market-volatility-with-managed-futures/,https://bit.ly/3vRxfvL
