feed,title,long_url,short_url
SeekingAlpha,VanEck Vectors Short High-Yield Municipal Index ETF declares monthly distribution of $0.0468,https://seekingalpha.com/news/3931457,
SeekingAlpha,VanEck Vectors Long Municipal Index ETF declares monthly distribution of $0.0462,https://seekingalpha.com/news/3931456,
SeekingAlpha,VanEck Vectors Municipal Allocation ETF declares monthly distribution of $0.0742,https://seekingalpha.com/news/3931455,
SeekingAlpha,VanEck Vectors Intermediate Municipal Index ETF declares monthly distribution of $0.0923,https://seekingalpha.com/news/3931454,
SeekingAlpha,VanEck Vectors Emerging Markets High Yield Bond ETF declares monthly distribution of $0.0978,https://seekingalpha.com/news/3931453,
SeekingAlpha,VanEck Vectors High-Yield Municipal Index ETF declares monthly distribution of $0.1788,https://seekingalpha.com/news/3931452,
SeekingAlpha,VanEck Vectors Investment Grade Floating Rate ETF declares monthly distribution of $0.1198,https://seekingalpha.com/news/3931451,
