feed,title,long_url,short_url
TheCapital,"What is Impermanent Loss, and How to Reduce It in Automated Market Makers",https://medium.com/the-capital/what-is-impermanent-loss-and-how-to-reduce-it-in-automated-market-makers-2785b806273b?source=rss----c4037b4d8519---4,https://bit.ly/3OqK2eW
TheCapital,Peter Brandt: Bear market will allow Coinbase to steal customer funds,https://medium.com/the-capital/peter-brandt-bear-market-will-allow-coinbase-to-steal-customer-funds-92eb151ed06f?source=rss----c4037b4d8519---4,https://bit.ly/3n9y3Xm
TheCapital,Why The Collapse Of The FAANG Shares Increases The Risk Of A Major Bear Market,https://medium.com/the-capital/why-the-collapse-of-the-faang-shares-increases-the-risk-of-a-major-bear-market-648d13c40b6e?source=rss----c4037b4d8519---4,https://bit.ly/3n4hLPD
TheCapital,Is This The Single Greatest Predictor Of Stock Market Returns?,https://medium.com/the-capital/is-this-the-single-greatest-predictor-of-stock-market-returns-a9acdd0c53c0?source=rss----c4037b4d8519---4,https://bit.ly/3OwEFLp
TheCapital,The Dangers And Opportunities Lurking In Magazine Covers,https://medium.com/the-capital/the-dangers-and-opportunities-lurking-in-magazine-covers-15121a47c341?source=rss----c4037b4d8519---4,https://bit.ly/3y7BbJO
TheCapital,NFT Influencer Marketing Guide 2022,https://medium.com/the-capital/nft-influencer-marketing-guide-2022-7b3fbe2b38d2?source=rss----c4037b4d8519---4,https://bit.ly/3QNm8wn
