feed,title,long_url,short_url
Investing,"AI unlikely to destroy jobs, but cost to certain workers may be ‘brutal’ — UN study",https://www.investing.com/news/cryptocurrency-news/ai-unlikely-to-destroy-jobs-but-cost-to-certain-workers-may-be-brutal--un-study-3158654,https://da.gd/4Ypdd
Investing,"China fines Mintz $1.5 million for 'unapproved' work, after raiding its Beijing office",https://www.investing.com/news/stock-market-news/china-fines-mintz-15-million-for-unapproved-work-after-raiding-its-beijing-office-3158655,https://da.gd/dDyFKT
Investing,U.S. retail traders eye a fresh piece of the crypto derivatives pie,https://www.investing.com/news/stock-market-news/us-retail-traders-eye-a-fresh-piece-of-the-crypto-derivatives-pie-3158652,https://da.gd/H76zz
Investing,Lawsuit claiming Apple Watch sensor exhibits 'racial bias' is dismissed,https://www.investing.com/news/stock-market-news/lawsuit-claiming-apple-watch-sensor-exhibits-racial-bias-is-dismissed-31,https://da.gd/usXcP
Investing,S.African Reserve Bank to kick off easing cycle early next year -economists: Reuters poll,https://www.investing.com/news/economy/safrican-reserve-bank-to-kick-off-easing-cycle-early-next-year-economists-reuters-poll-3158653,https://da.gd/9z02E4
Investing,"Analysis-From stocks to bitcoin, soaring US yields cast shadow over risk asset rally",https://www.investing.com/news/economy/analysisfrom-stocks-to-bitcoin-soaring-us-yields-cast-shadow-over-risk-asset-rally-3158650,https://da.gd/XoeQW
