feed,title,long_url,short_url
Motley,Buying These 3 Stocks Could Be the Smartest Investing Move You Ever Make,https://www.fool.com/investing/2023/08/22/buying-these-3-stocks-could-be-the-smartest-invest/?source=iedfolrf0000001,https://da.gd/jhbC8O
Motley,This Dirt-Cheap Divided King Just Raised Its Payout to a Record High,https://www.fool.com/investing/2023/08/22/this-dirt-cheap-divided-king-just-raised-its-payou/?source=iedfolrf0000001,https://da.gd/vicZ
Motley,The Most Important Investment Chart You'll Ever See,https://www.fool.com/investing/2023/08/22/the-most-important-investment-chart-youll-ever-see/?source=iedfolrf0000001,https://da.gd/vknXEf
Motley,Better Cybersecurity Stock: Palo Alto Networks vs. Fortinet,https://www.fool.com/investing/2023/08/22/better-cybersecurity-stock-palo-alto-networks-ftnt/?source=iedfolrf0000001,https://da.gd/M6w6D
Motley,2 Under-the-Radar Gaming Stocks You Can Buy and Hold for the Next Decade,https://www.fool.com/investing/2023/08/22/2-under-the-radar-gaming-stocks-you-can-buy-and-ho/?source=iedfolrf0000001,https://da.gd/lgpU
Motley,"Bargain Hunting for Stocks: Down 35%, It's Time to Buy This Incredible, High-Growth Bank Stock",https://www.fool.com/investing/2023/08/22/bargain-hunting-for-stocks-down-35-its-time-to-buy/?source=iedfolrf0000001,https://da.gd/VS7i
