feed,title,long_url,short_url
ETFTrends,"ETF Prime: Morris on the Energy Sector, Plus BlackRock’s Philosophy and the LZRD ETF",https://www.etftrends.com/etf-prime-channel/morris-energy-sector-blackrock-philosophy-lzrd-etf-etf-prime/,https://da.gd/8elTi
ETFTrends,Direct Indexing’s Time Has Arrived,https://www.etftrends.com/direct-indexing-channel/direct-indexing-time-arrived/,https://da.gd/a4A3ab
ETFTrends,"Boards Need to Increase ESG Activity, Scrutiny",https://www.etftrends.com/esg-channel/boards-need-increase-esg-activity-scrutiny/,https://da.gd/4zOTxN
ETFTrends,Data Collaboration Should Rally Investors Around This ETF,https://www.etftrends.com/innovative-etfs-channel/data-collaboration-should-rally-investors-around-etf/,https://da.gd/EJQsm
ETFTrends,A Silver Rebound is Brewing Despite Interest Rate Pressure,https://www.etftrends.com/gold-silver-investing-channel/silver-rebound-brewing-despite-interest-rate-pressure/,https://da.gd/djm5M
ETFTrends,Congress Asset Management Launches 2 Active Equity Growth ETFs,https://www.etftrends.com/congress-asset-management-launches-2-active-equity-growth-etfs/,https://da.gd/MhTonc
ETFTrends,Day Hagan/Ned Davis Research Smart Sector®,https://www.etftrends.com/etf-strategist-channel/smart-sector-strategy/,https://da.gd/HQL5f
ETFTrends,Go Active for International Equity ETFs – Here’s Why,https://www.etftrends.com/active-etfs-channel/active-international-equity-etfs-why/,https://da.gd/jJVeE
ETFTrends,Madison Investments Expands Active ETF Suite with Covered Call ETF,https://www.etftrends.com/madison-active-suite-covered-call-etf/,https://da.gd/YldRs
ETFTrends,U.S. Manufacturing: Set to Become the Next Big Thing,https://www.etftrends.com/etf-strategist-channel/us-manufacturing-become-next-big-thing/,https://da.gd/QjHv
ETFTrends,Use Free Cash Flow to Avoid Hollywood Accounting,https://www.etftrends.com/free-cash-flow-channel/use-free-cash-flow-to-avoid-hollywood-accounting/,https://da.gd/Iqut
ETFTrends,How Sustainable Funds Got Their Grooves Back,https://www.etftrends.com/etf-education-channel/how-sustainable-funds-got-grooves-back/,https://da.gd/3fsU5
