feed,title,long_url,short_url
InvestorPlace,Barclays Layoffs 2024: What to Know About the Latest BCS Job Cuts,https://investorplace.com/2024/03/barclays-layoffs-2024-what-to-know-about-the-latest-bcs-job-cuts/,https://da.gd/1ZKgo
InvestorPlace,RDDT Stock IPO: 7 Things to Know as Reddit Starts Trading Today,https://investorplace.com/2024/03/rddt-stock-ipo-7-things-to-know-as-reddit-starts-trading-today/,https://da.gd/lQjEem
InvestorPlace,"PTEN Stock Earnings: Patterson-UTI Energy Meets EPS, Beats Revenue for Q4 2023",https://investorplace.com/earning-results/2024/03/pten-stock-earnings-patterson-uti-energy-for-q4-of-2023/,https://da.gd/66vJPj
InvestorPlace,"Why Are Chip Stocks MU, NVDA, AMD, INTC Up Today?",https://investorplace.com/2024/03/why-are-chip-stocks-mu-nvda-amd-intc-up-today/,https://da.gd/s8qm
InvestorPlace,ALAB Stock: Astera Labs Pops a Stunning 70% After IPO,https://investorplace.com/2024/03/alab-stock-astera-labs-pops-a-stunning-70-after-ipo/,https://da.gd/HF09
InvestorPlace,PARA Stock Alert: Watch This $11 Billion Catalyst for Paramount Shares,https://investorplace.com/2024/03/para-stock-alert-watch-this-11-billion-catalyst-for-paramount-shares/,https://da.gd/ovXgD
InvestorPlace,Why Is Five Below (FIVE) Stock Down 12% Today?,https://investorplace.com/2024/03/why-is-five-below-five-stock-down-12-today/,https://da.gd/mTk4MK
InvestorPlace,"Nio’s Perfect Storm: Weak Deliveries, Price Wars, and Analyst Downgrades Spell Disaster",https://investorplace.com/2024/03/nios-perfect-storm-weak-deliveries-price-wars-and-analyst-downgrades-spell-disaster/,https://da.gd/YWPRw
InvestorPlace,Investor Alert: Why NVDA Stock’s 30% Upside Potential Is Just the Beginning,https://investorplace.com/2024/03/investor-alert-why-nvda-stocks-30-upside-potential-is-just-the-beginning/,https://da.gd/UkrC0M
