feed,title,long_url,short_url
SeekingAlpha,SPDR Portfolio Short Term Corporate Bond ETF declares monthly distribution of $0.1128,https://seekingalpha.com/news/4074724,
SeekingAlpha,SPDR Portfolio Long Term Corporate Bond ETF declares monthly distribution of $0.0958,https://seekingalpha.com/news/4074723,
SeekingAlpha,ThreeD Capital reports Q2 results,https://seekingalpha.com/news/4074722,
SeekingAlpha,SPDR Barclays Convertible Securities ETF declares monthly distribution of $0.1257,https://seekingalpha.com/news/4074721,
SeekingAlpha,SPDR MarketAxess Investment Grade 400 Corporate Bond ETF declares monthly distribution of $0.4193,https://seekingalpha.com/news/4074720,
