feed,title,long_url,short_url
SeekingAlpha,VanEck HIP Sustainable Muni ETF declares monthly distribution of $0.0800,https://seekingalpha.com/news/4074871,
SeekingAlpha,Trio Petroleum announces noncompliance notice with NYSE American listing standards,https://seekingalpha.com/news/4074870,
SeekingAlpha,VanEck Vectors Short Municipal Index ETF declares monthly distribution of $0.0300,https://seekingalpha.com/news/4074869,
SeekingAlpha,VanEck Vectors Short High-Yield Municipal Index ETF declares monthly distribution of $0.0500,https://seekingalpha.com/news/4074868,
SeekingAlpha,VanEck Vectors Preferred Securities Ex Financials ETF declares monthly distribution of $0.09,https://seekingalpha.com/news/4074867,
SeekingAlpha,VanEck Vectors Long Municipal Index ETF declares monthly distribution of $0.0500,https://seekingalpha.com/news/4074866,
