feed,title,long_url,short_url
SeekingAlpha,"Ether Capital GAAP EPS of -C$0.10, revenue of C$1.5M",https://seekingalpha.com/news/3816855,
SeekingAlpha,"Nasdaq, S&P, Dow futures rise as yields race higher again",https://seekingalpha.com/news/3816850,
SeekingAlpha,"Alaska Air provides long-term financial framework, FY22 outlook; renews BofA partnership agreement",https://seekingalpha.com/news/3816854,
SeekingAlpha,Yunji regains compliance with Nasdaq's minimum bid price requirement,https://seekingalpha.com/news/3816853,
SeekingAlpha,Werner Enterprises is upgraded at Wells Fargo with earnings expected to improve,https://seekingalpha.com/news/3816852,
