feed,title,long_url,short_url
SeekingAlpha,"SolarWinds Non-GAAP EPS of $0.30 beats by $0.04, revenue of $186.72M beats by $4.88M",https://seekingalpha.com/news/3801400,
SeekingAlpha,NexPoint Real Estate Finance GAAP EPS of $0.54 beats by $0.05,https://seekingalpha.com/news/3801398,
SeekingAlpha,"Finnair Oyj GAAP EPS of -€0.06, revenue of €413.5M",https://seekingalpha.com/news/3801397,
SeekingAlpha,Barksdale receives $1.98M from debt repayment,https://seekingalpha.com/news/3801396,
SeekingAlpha,Zai Lab's repotrectinib for lung cancer subtype gets breakthrough therapy tag in China,https://seekingalpha.com/news/3801393,
