feed,title,long_url,short_url
InvestorPlace,BOTJ Stock Earnings: Bank of the James Finl Gr Reported Results for Q1 2024,https://investorplace.com/earning-results/2024/04/botj-stock-earnings-bank-of-the-james-finl-gr-for-q1-of-2024/,https://da.gd/jDPZo
InvestorPlace,SJ Stock Earnings: Scienjoy Holding Reported Results for Q4 2023,https://investorplace.com/earning-results/2024/04/sj-stock-earnings-scienjoy-holding-for-q4-of-2023/,https://da.gd/WVcLW
InvestorPlace,HFBL Stock Earnings: Home Federal Bancorp Reported Results for Q3 2024,https://investorplace.com/earning-results/2024/04/hfbl-stock-earnings-home-federal-bancorp-for-q3-of-2024/,https://da.gd/hOusq
InvestorPlace,"CBFV Stock Earnings: CB Financial Services Beats EPS, Beats Revenue for Q1 2024",https://investorplace.com/earning-results/2024/04/cbfv-stock-earnings-cb-financial-services-for-q1-of-2024/,https://da.gd/IjeHD
InvestorPlace,AFBI Stock Earnings: Affinity Bancshares Reported Results for Q1 2024,https://investorplace.com/earning-results/2024/04/afbi-stock-earnings-affinity-bancshares-for-q1-of-2024/,https://da.gd/vBcfn
InvestorPlace,FCAP Stock Earnings: First Cap Reported Results for Q1 2024,https://investorplace.com/earning-results/2024/04/fcap-stock-earnings-first-cap-for-q1-of-2024/,https://da.gd/gVDo
