feed,title,long_url,short_url
SeekingAlpha,Hasbro posts mixed earnings as holiday toy sales slump,https://seekingalpha.com/news/3937060,
SeekingAlpha,US Foods tops EBIDTA expectations on solid case volume growth,https://seekingalpha.com/news/3937059,
SeekingAlpha,"Visteon Non-GAAP EPS of $1.32 misses by $0.17, revenue of $1.06B beats by $102.54M",https://seekingalpha.com/news/3937058,
SeekingAlpha,Hyatt Hotels reports Q4 earnings; initiates FY23 outlook,https://seekingalpha.com/news/3937057,
SeekingAlpha,"Stepan Non-GAAP EPS of $0.59 beats by $0.03, revenue of $627.18M misses by $0.99M",https://seekingalpha.com/news/3937056,
SeekingAlpha,SCHD Or Treasuries: Which Is Best For Retirees' Income Needs?,https://seekingalpha.com/article/4578860,
