feed,title,long_url,short_url
SeekingAlpha,Keyera GAAP EPS of -C$0.37,https://seekingalpha.com/news/3937097,
SeekingAlpha,Henry Schein issues 2023 EPS guidance that comes in above consensus,https://seekingalpha.com/news/3937095,
SeekingAlpha,"PBF Energy, Eni to develop Louisiana biorefinery; Eni to invest up to $885M",https://seekingalpha.com/news/3937096,
SeekingAlpha,"Largo President and CEO steps down, interim CEO appointed",https://seekingalpha.com/news/3937094,
SeekingAlpha,"Glencore GAAP EPS of $1.33, revenue of $255.98B",https://seekingalpha.com/news/3937093,
