feed,title,long_url,short_url
Benzinga,Understanding Aqua Metals's Unusual Options Activity,https://benzinga.com/markets/options/21/05/21339609/understanding-aqua-metalss-unusual-options-activity,https://j.mp/3furlIz
Benzinga,Analyzing General Electric's Unusual Options Activity,https://benzinga.com/markets/options/21/05/21339575/analyzing-general-electrics-unusual-options-activity,https://j.mp/3uvkNOn
Benzinga,Understanding AMC Entertainment's Unusual Options Activity,https://benzinga.com/markets/options/21/05/21339572/understanding-amc-entertainments-unusual-options-activity,https://j.mp/3fN7KSW
Benzinga,Unusual Options Activity Insight: NIO,https://benzinga.com/markets/options/21/05/21339568/unusual-options-activity-insight-nio,https://j.mp/3vvNr34
Benzinga,Unusual Options Activity Insight: NVIDIA,https://benzinga.com/markets/options/21/05/21339560/unusual-options-activity-insight-nvidia,https://j.mp/3yOzpMa
Benzinga,Unusual Options Activity Insight: 3D Sys 3D Sys,https://benzinga.com/markets/options/21/05/21339551/unusual-options-activity-insight-3d-sys-3d-sys,https://j.mp/3yNcBfJ
