feed,title,long_url,short_url
Investing,Buffett’s Cash Hoard Signals Market Caution—3 Value Stocks to Watch Now,https://www.investing.com/analysis/warren-buffett-hoards-cash3-value-stocks-to-watch-now-200665606,
Investing,"JPMorgan and MUFG near $22 billion data center financing deal in Texas, FT reports",https://www.investing.com/news/stock-market-news/jpmorgan-and-mufg-near-22-billion-data-center-financing-deal-in-texas-ft-reports-4201905,
Investing,H1 2025 earnings review: What’s driving U.K. corporate performance,https://www.investing.com/news/stock-market-news/h1-2025-earnings-review-whats-driving-uk-corporate-performance-4201925,
Investing,Dayforce stock rises after confirming takeover talks with Thoma Bravo,https://www.investing.com/news/stock-market-news/dayforce-stock-rises-after-confirming-takeover-talks-with-thoma-bravo-93CH-4201910,
Investing,"Exclusive-Amazon looks to ditch homegrown software for Android in Fire tablet revamp, sources say",https://www.investing.com/news/stock-market-news/exclusiveamazon-looks-to-ditch-homegrown-software-for-android-in-fire-tablet-revamp-sources-say-4201884,
Investing,"India stocks set for modest gains as US tariffs, foreign outflows cloud outlook: Reuters poll",https://www.investing.com/news/economy-news/india-stocks-set-for-modest-gains-as-us-tariffs-foreign-outflows-cloud-outlook-reuters-poll-4201926,
Investing,Switzerland moves to strengthen its competitiveness after US tariffs,https://www.investing.com/news/economy-news/switzerland-moves-to-strengthen-its-competitiveness-after-us-tariffs-4201924,
Investing,"Swedish government maintains 2025 GDP growth forecast, raises 2026",https://www.investing.com/news/economy-news/swedish-government-maintains-2025-gdp-growth-forecast-raises-2026-93CH-4201906,
Investing,Russia's Lavrov: Security talks without Moscow are 'road to nowhere',https://www.investing.com/news/economy-news/russias-lavrov-security-talks-without-moscow-are-road-to-nowhere-4201889,
Investing,European share gains to be kept in check by Trump tariffs- Reuters poll,https://www.investing.com/news/economy-news/european-share-gains-to-be-kept-in-check-by-trump-tariffs-reuters-poll-4201883,
