feed,title,long_url,short_url
Benzinga,Analyzing Carnival's Unusual Options Activity,https://www.benzinga.com/markets/options/20/11/18466640/analyzing-carnivals-unusual-options-activity,https://j.mp/2UI69n9
Benzinga,"Markets On The Fence: Vaccine Optimism Vs. Worries About Virus, Stimulus, Fed Lending",https://www.benzinga.com/news/earnings/20/11/18466575/markets-on-the-fence-vaccine-optimism-vs-worries-about-virus-stimulus-fed-lending,https://j.mp/3nHRW6l
Benzinga,Analyzing Spirit Airlines's Unusual Options Activity,https://www.benzinga.com/markets/options/20/11/18466597/analyzing-spirit-airliness-unusual-options-activity,https://j.mp/2ULbIS8
Benzinga,TWC Enterprises Limited Increases Ownership Position in Automotive Properties REIT,https://www.benzinga.com/pressreleases/20/11/g18466568/twc-enterprises-limited-increases-ownership-position-in-automotive-properties-reit,https://j.mp/3kOHic7
Benzinga,Unusual Options Activity Insight: Agios Pharmaceuticals,https://www.benzinga.com/general/health-care/20/11/18466507/unusual-options-activity-insight-agios-pharmaceuticals,https://j.mp/38Y9Tte
Benzinga,Analyzing ViacomCBS's Unusual Options Activity,https://www.benzinga.com/markets/options/20/11/18466498/analyzing-viacomcbss-unusual-options-activity,https://j.mp/3kTanmx
Benzinga,Understanding Workday's Unusual Options Activity,https://www.benzinga.com/markets/options/20/11/18466487/understanding-workdays-unusual-options-activity,https://j.mp/3kOHhF5
