feed,title,long_url,short_url
SeekingAlpha,SPAC Cova Acquisition is said in talks to take Indonesian online travel co. Tiket.com public,https://seekingalpha.com/news/3697747,
SeekingAlpha,CBL Properties Q1 earnings reflect lower interest expense during Chapter 11,https://seekingalpha.com/news/3697746,
SeekingAlpha,Tata Motors beats on revenue,https://seekingalpha.com/news/3697745,
SeekingAlpha,Gran Tierra Energy shuts some Colombia wells amid protests,https://seekingalpha.com/news/3697744,
SeekingAlpha,Stemcell Holdings reports Q1 results,https://seekingalpha.com/news/3697743,
SeekingAlpha,Lightwave Logic reports Q1 results,https://seekingalpha.com/news/3697742,
SeekingAlpha,Rivian stocks up on Tesla employees ahead of launch of new EV models,https://seekingalpha.com/news/3697741,
