feed,title,long_url,short_url
ETFTrends,"China’s Top Stocks Beat Expectations, but Macro Challenges Loom",https://www.etftrends.com/china-insights-channel/chinas-top-stocks-beat-expectations-but-macro-challenges-loom/,https://bit.ly/3cV03wI
ETFTrends,ETF Leaders Powered by the NYSE: V-Square Quantitative Management’s Mamadou-Abou Sarr,https://www.etftrends.com/etf-leaders-powered-by-the-nyse-v-square-quantitative-managements-mamadou-abou-sarr/,https://bit.ly/3qeAf1p
ETFTrends,TCW Taps Goldman Exec Katie Koch to Head Asset Manager,https://www.etftrends.com/tcw-taps-goldman-exec-katie-koch-to-head-global-asset-manager/,https://bit.ly/3qhCfpE
ETFTrends,The Era of the Fed Put – Is It Over?,https://www.etftrends.com/etf-strategist-channel/the-era-of-the-fed-put-is-it-over/,https://bit.ly/3BeQpy9
ETFTrends,This Author Sees a Coming Global Gold Standard,https://www.etftrends.com/gold-silver-investing-channel/this-author-sees-a-coming-global-gold-standard/,https://bit.ly/3cOQZJA
ETFTrends,Lithium: The Benefits of Diversifying Globally Across the EV Industry,https://www.etftrends.com/climate-insights-channel/lithium-the-benefits-of-diversifying-globally-across-the-ev-industry/,https://bit.ly/3Bjvudu
ETFTrends,India Fintech Market to Reach $1 Trillion by 2030,https://www.etftrends.com/emerging-markets-channel/india-fintech-market-to-reach-1-trillion-by-2030/,https://bit.ly/3BhZHte
ETFTrends,"Stability.AI Debuted Most Provocative Open-Source Text-to-Image Model, ARK Says",https://www.etftrends.com/disruptive-technology-channel/stability-ai-debuted-most-provocative-open-source-text-to-image-model-ark-says/,https://bit.ly/3BfQv8P
ETFTrends,"As Global Inflation Eases, China Could Be at Forefront of Rally",https://www.etftrends.com/thematic-investing-channel/as-global-inflation-eases-china-could-be-at-forefront-of-rally/,https://bit.ly/3cOR6Vw
ETFTrends,3 ETF Options as Latest Jobs Report Pushes Treasury Yields Lower,https://www.etftrends.com/fixed-income-channel/3-etf-options-as-latest-jobs-report-pushes-treasury-yields-lower/,https://bit.ly/3BfQwcT
ETFTrends,Consumer Sentiment Could Apply More Downward Pressure on This ETF,https://www.etftrends.com/leveraged-inverse-channel/consumer-sentiment-could-apply-more-downward-pressure-on-this-etf/,https://bit.ly/3Bj7JCj
ETFTrends,2 Alternative Ideas for Fighting Inflation,https://www.etftrends.com/alternatives-channel/2-alternative-ideas-for-fighting-inflation/,https://bit.ly/3cQYX4V
ETFTrends,FGLD Could Be Ideal Recession Protection,https://www.etftrends.com/volatility-resource-channel/fgld-could-be-ideal-recession-protection/,https://bit.ly/3Bgsrmg
ETFTrends,Go With GDOC as Healthcare Revolution Gains Momentum,https://www.etftrends.com/future-etfs-channel/go-with-gdoc-as-healthcare-revolution-gains-momentum/,https://bit.ly/3BgBpQi
ETFTrends,HART Beat to Practical Healthcare ETF,https://www.etftrends.com/dual-impact-channel/hart-beat-to-practical-healthcare-etf/,https://bit.ly/3Bk2pyD
ETFTrends,These Corporate Bonds Offer Surprising Benefits,https://www.etftrends.com/tactical-allocation-channel/these-corporate-bonds-offer-surprising-benefits/,https://bit.ly/3Bgsgr6
ETFTrends,ESG Is Not the Dark Lord We Do Not Speak Of,https://www.etftrends.com/esg-channel/esg-is-not-the-dark-lord-we-do-not-speak-of/,https://bit.ly/3BljHLL
ETFTrends,Why We’re Bullish on ATOM,https://www.etftrends.com/crypto-channel/why-were-bullish-on-atom/,https://bit.ly/3BfQvFR
ETFTrends,“Dormant Supply Peak” Could Push Bitcoin Prices Higher,https://www.etftrends.com/crypto-channel/dormant-supply-peak-could-push-bitcoin-prices-higher/,https://bit.ly/3BfQrpB
ETFTrends,"The U.S. Jobs Market Has Fully Recovered, Favoring Travel And Shipping Industries",https://www.etftrends.com/the-u-s-jobs-market-has-fully-recovered-favoring-travel-and-shipping-industries/,https://bit.ly/3BgoxtE
ETFTrends,Managing Portfolio Volatility as Correlations Rise,https://www.etftrends.com/model-portfolio-channel/managing-portfolio-volatility-as-correlations-rise/,https://bit.ly/3BiDqeZ
ETFTrends,The Era Of Low Inflation May Be Over. Are Commodities The Solution?,https://www.etftrends.com/the-era-of-low-inflation-may-be-over-are-commodities-the-solution/,https://bit.ly/3qdOqEb
ETFTrends,It’s Beginning to Look a Lot Like 2001,https://www.etftrends.com/2022/09/its-beginning-to-look-a-lot-like-2001/,https://bit.ly/3BjFIdI
ETFTrends,Energy Sector’s Relative Strength Against The Market Is Looking Very Attractive,https://www.etftrends.com/energy-sectors-relative-strength-against-the-market-is-looking-very-attractive/,https://bit.ly/3cV0eYU
