feed,title,long_url,short_url
SeekingAlpha,InVitro International reports Q2 results,https://seekingalpha.com/news/3694590,
SeekingAlpha,Hilton Worldwide lands higher price target from UBS as recovery visibility improves,https://seekingalpha.com/news/3694589,
SeekingAlpha,Vallon Pharmaceuticals names new CFO,https://seekingalpha.com/news/3694588,
SeekingAlpha,"Perrigo EPS misses by $0.07, misses on revenue",https://seekingalpha.com/news/3694587,
SeekingAlpha,Vallon Pharmaceuticals names Leanne Kelly as chief financial officer,https://seekingalpha.com/news/3694586,
SeekingAlpha,Surna reports Q1 results,https://seekingalpha.com/news/3694585,
SeekingAlpha,SPAC Tuscan Holdings drops after extending time to complete Microvast deal,https://seekingalpha.com/news/3694584,
