feed,title,long_url,short_url
SeekingAlpha,"Ethan Allen Interiors Non-GAAP EPS of $0.67 misses by $0.09, revenue of $167.28M misses by $11.92M",https://seekingalpha.com/news/4058139,
SeekingAlpha,Tourmaline Bio looks to raise cash through a public offering,https://seekingalpha.com/news/4058138,
SeekingAlpha,"ServiceNow Non-GAAP EPS of $3.11 beats by $0.33, revenue of $2.44B beats by $40M",https://seekingalpha.com/news/4058135,
SeekingAlpha,"Las Vegas Sands Non-GAAP EPS of $0.57 misses by $0.04, revenue of $2.92B beats by $40M",https://seekingalpha.com/news/4058134,
SeekingAlpha,"Seagate Technology Non-GAAP EPS of $0.12 beats by $0.18, revenue of $1.56B beats by $10M",https://seekingalpha.com/news/4058133,
SeekingAlpha,"ResMed Non-GAAP EPS of $1.88 beats by $0.10, revenue of $1.2B beats by $50M",https://seekingalpha.com/news/4058132,
