feed,title,long_url,short_url
SeekingAlpha,"MGIC Investment EPS misses by $0.10, revenue in-line",https://seekingalpha.com/news/3600444,
SeekingAlpha,"EZCORP EPS misses by $0.11, misses on revenue",https://seekingalpha.com/news/3600445,
SeekingAlpha,"Hyster-Yale Materials Handling EPS beats by $0.23, misses on revenue",https://seekingalpha.com/news/3600443,
SeekingAlpha,"Modine Manufacturing EPS beats by $0.03, misses on revenue",https://seekingalpha.com/news/3600438,
SeekingAlpha,"Mayville Engineering EPS misses by $0.12, misses on revenue",https://seekingalpha.com/news/3600436,
SeekingAlpha,"EnLink Midstream EPS beats by $0.01, misses on revenue",https://seekingalpha.com/news/3600435,
