feed,title,long_url,short_url
SeekingAlpha,PacBio upgraded to buy at Cowen on 'growth transformation story',https://seekingalpha.com/news/3953152,
SeekingAlpha,Instil Bio GAAP EPS of -$0.41 in-line,https://seekingalpha.com/news/3953160,
SeekingAlpha,Amarin announces resignation of CEO,https://seekingalpha.com/news/3953159,
SeekingAlpha,Howmet Aerospace upgraded to Buy at Benchmark,https://seekingalpha.com/news/3953158,
SeekingAlpha,Asure Software Stock: Great Company But With A Premium Valuation,https://seekingalpha.com/article/4591487,
