feed,title,long_url,short_url
SeekingAlpha,Vanguard Short-Term Inflation-Protected Securities ETF declares quarterly distribution of $0.0287,https://seekingalpha.com/news/3953274,
SeekingAlpha,Vanguard Ultra-Short Bond ETF declares monthly distribution of $0.1580,https://seekingalpha.com/news/3953273,
SeekingAlpha,Vanguard Tax-Exempt Bond ETF declares monthly distribution of $0.1127,https://seekingalpha.com/news/3953272,
SeekingAlpha,Vanguard Emerging Markets Government Bond ETF declares monthly distribution of $0.2882,https://seekingalpha.com/news/3953271,
SeekingAlpha,Vanguard Total International Bond ETF declares monthly distribution of $0.0716,https://seekingalpha.com/news/3953270,
SeekingAlpha,Vanguard Mortgage-Backed Securities ETF declares monthly distribution of $0.1161,https://seekingalpha.com/news/3953269,
