feed,title,long_url,short_url
Investing,Earnings call: CytomX updates on Probody platform and financial health,https://www.investing.com/news/stock-market-news/earnings-call-cytomx-updates-on-probody-platform-and-financial-health-93CH-3333308,https://da.gd/G9tKAH
Investing,"Earnings call: Mission Produce reports strong Q1 growth, eyes expansion",https://www.investing.com/news/stock-market-news/earnings-call-mission-produce-reports-strong-q1-growth-eyes-expansion-93CH-3333306,https://da.gd/G7GAL
Investing,Earnings call: Central Puerto reports a significant increase in installed capacity,https://www.investing.com/news/stock-market-news/earnings-call-central-puerto-reports-a-significant-increase-in-installed-capacity-93CH-3333304,https://da.gd/VEVHd
Investing,Earnings call: Endeavour Silver outlines robust 2023 financials,https://www.investing.com/news/stock-market-news/earnings-call-endeavour-silver-outlines-robust-2023-financials-93CH-3333294,https://da.gd/cv25e
Investing,Earnings call: OSG reports strong Q4 and bullish 2024 outlook,https://www.investing.com/news/stock-market-news/earnings-call-osg-reports-strong-q4-and-bullish-2024-outlook-93CH-3333293,https://da.gd/WDQDG2
Investing,"Japan PPI inflation up more than expected in Feb, furthers BOJ pivot bets",https://www.investing.com/news/economic-indicators/japan-ppi-inflation-up-more-than-expected-in-feb-furthers-boj-pivot-bets-3333305,https://da.gd/9VzX9Z
