feed,title,long_url,short_url
InvestorPlace,Why Are Stocks Up Today?,https://investorplace.com/2024/03/why-are-stocks-up-today-36/,https://da.gd/0lo4w
InvestorPlace,Investing at Mach Speed: 3 Flying Car Stocks for the Boldest Investors,https://investorplace.com/2024/03/investing-at-mach-speed-3-flying-car-stocks-for-the-boldest-investors/,https://da.gd/c4QH37
InvestorPlace,Workhorse Layoffs 2024: What to Know About the Latest WKHS Job Cuts,https://investorplace.com/2024/03/workhorse-layoffs-2024-what-to-know-about-the-latest-wkhs-job-cuts-wkhs-stock/,https://da.gd/KPxtge
InvestorPlace,The Bitcoin Frenzy: Why Buying the Hype Could Burn You,https://investorplace.com/2024/03/the-bitcoin-frenzy-why-buying-the-hype-could-burn-you/,https://da.gd/AO0DxU
InvestorPlace,The 3 Most Undervalued Semiconductor Stocks to Buy in March 2024,https://investorplace.com/2024/03/the-3-most-undervalued-semiconductor-stocks-to-buy-in-march-2024/,https://da.gd/UYumR3
InvestorPlace,Utility Stocks Are Sending an Early Warning Signal,https://investorplace.com/2024/03/utility-stocks-are-sending-an-early-warning-signal/,https://da.gd/1OeqHd
InvestorPlace,"Green Profits, Clean Conscience: 3 Renewable Energy Stocks to Buy Now",https://investorplace.com/2024/03/green-profits-clean-conscience-3-renewable-energy-stocks-to-buy-now/,https://da.gd/2Uaru
InvestorPlace,3 Stocks to Buy as Bitcoin Reaches New Heights in March,https://investorplace.com/2024/03/3-stocks-to-buy-as-bitcoin-reaches-new-heights-in-march/,https://da.gd/3PIgP3
InvestorPlace,3 Stocks to Buy Before the Fintech Sector Starts to Sizzle Again,https://investorplace.com/2024/03/3-stocks-to-buy-before-the-fintech-sector-starts-to-sizzle-again/,https://da.gd/07tM4c
InvestorPlace,Xiaomi Just Gave NIO Stock a Major Lift,https://investorplace.com/2024/03/xiaomi-just-gave-nio-stock-a-major-lift/,https://da.gd/2eqdOl
