feed,title,long_url,short_url
SeekingAlpha,"Nature's Sunshine GAAP EPS of $0.46 beats by $0.31, revenue of $108.9M misses by $2.2M",https://seekingalpha.com/news/4078629,
SeekingAlpha,"Aterian GAAP EPS of -$0.10 beats by $0.03, revenue of $32.75M beats by $2.48M",https://seekingalpha.com/news/4078627,
SeekingAlpha,ODDITY Tech stock falls after L Catterton files to sell 4M class A shares in co,https://seekingalpha.com/news/4078626,
SeekingAlpha,voxeljet extends loan financing with Anzu to effect the delisting of its ADSs,https://seekingalpha.com/news/4078625,
SeekingAlpha,"Oportun Financial Non-GAAP EPS of -$0.54 misses by $0.26, revenue of $263M beats by $1.09M",https://seekingalpha.com/news/4078624,
SeekingAlpha,"GLD And SLV Both Poised To Break Out, Especially SLV",https://seekingalpha.com/article/4677706,
SeekingAlpha,Grab: Its Profitability Could Reveal Undervaluation,https://seekingalpha.com/article/4677705,
