feed,title,long_url,short_url
InsiderMonkey,"Bitdeer (BTDR) Rebounds, Hits New High on Stellar Bitcoin Mining Performance",https://insidermonkey.com/blog/--1629047,
InsiderMonkey,Navitas (NVTS) Jumps to All-Time High on Launch of Chip to Support Next-Gen AI,https://insidermonkey.com/blog/--1629046,
InsiderMonkey,Microvast (MVST) Soars to Fresh Record on China Lithium Battery Restrictions,https://insidermonkey.com/blog/--1629045,
InsiderMonkey,Hillenbrand (HI) Climbs 18% on $3.8 Billion Lone Star Merger,https://insidermonkey.com/blog/--1629044,
InsiderMonkey,NuScale (SMR) Soars to New High on US Army Nuclear Tech Adoption,https://insidermonkey.com/blog/--1629043,
InsiderMonkey,Hims & Hers (HIMS) Soars 16% as Firm On Track to Book $1 Billion Revenues from Women Segment,https://insidermonkey.com/blog/--1629042,
InsiderMonkey,"Fluence Energy (FLNC) Climbs 16% on New 160-MW Solar, Battery Deal",https://insidermonkey.com/blog/--1629041,
InsiderMonkey,Applied Optoelectronics (AAOI) Soars 15.7% on Booming AI,https://insidermonkey.com/blog/--1629040,
InsiderMonkey,"Recursion Pharmaceuticals (RXRX) Extends Gains, Jumps 15.28% on Major AI Event",https://insidermonkey.com/blog/--1629039,
InsiderMonkey,Sandisk (SNDK) Soars to All-Time High on Price Target Upgrades,https://insidermonkey.com/blog/--1628911,
InsiderMonkey,Analyst Says Fears About Kalshi Impact on DraftKings (DKNG) ‘Not Substantive’,https://insidermonkey.com/blog/--1627135,
InsiderMonkey,Analyst Says NVIDIA (NVDA) Valuation Still ‘Reasonable’ – Here’s Why,https://insidermonkey.com/blog/--1627058,
