feed,title,long_url,short_url
CryptoDailyUK,Raffle Coin's Bold Market Entry: Binance Coin & Tether Users Seize Early Advantage Anticipating Major Altcoin Triumphs,https://cryptodaily.co.uk/2024/04/raffle-coins-bold-market-entry-binance-coin-tether-users-seize-early-advantage-anticipating-major-altcoin-triumphs,https://da.gd/IP2Ujh
CryptoDailyUK,Uniswap & Chainlink's Presale Frenzy for Raffle Coin Cryptosphere Buzzes with 1000% Upside Predictions,https://cryptodaily.co.uk/2024/04/uniswap-chainlinks-presale-frenzy-for-raffle-coin-cryptosphere-buzzes-with-1000-upside-predictions,https://da.gd/ppAoma
CryptoDailyUK,Disruptive Potential in E-Commerce Draws Stellar & Cardano to Pushd Stage 6,https://cryptodaily.co.uk/2024/04/disruptive-potential-in-e-commerce-draws-stellar-cardano-to-pushd-stage-6,https://da.gd/WsIA
CryptoDailyUK,Kelexo (KLXO) Lending Revolution Smashes Stage 2 Presale As Unprecedented Interest with 20X Gains Predicted Rallying Uniswap (UNI) & Chainlink (LINK) Holders,https://cryptodaily.co.uk/2024/04/kelexo-klxo-lending-revolution-smashes-stage-2-presale-as-unprecedented-interest-with-20x-gains-predicted-rallying-uniswap-uni-chainlink-link-holders,https://da.gd/O7nUp
CryptoDailyUK,Fezoo Presale Enthralls Chainlink and Uniswap Holders: Decentralized Exchange Eyeing Binance Market Share,https://cryptodaily.co.uk/2024/04/fezoo-presale-enthralls-chainlink-and-uniswap-holders-decentralized-exchange-eyeing-binance-market-share,https://da.gd/V8eZQF
