feed,title,long_url,short_url
SeekingAlpha,"Paysafe stock climbs after new chairman names, strong '22 guidance issued",https://seekingalpha.com/news/3808358,
SeekingAlpha,"TrackX Holdings GAAP EPS of C$0.00, revenue of C$0.53M",https://seekingalpha.com/news/3808357,
SeekingAlpha,"Salesforce pops as Q4 results beat expectations, analysts heap praise",https://seekingalpha.com/news/3808353,
SeekingAlpha,Baudax Bio wins new U.S. patent for pain therapy,https://seekingalpha.com/news/3808356,
SeekingAlpha,"Dollar Tree GAAP EPS of $2.01 beats by $0.25, revenue of $7.08B misses by $40M",https://seekingalpha.com/news/3808355,
SeekingAlpha,"Abercrombie & Fitch Co. Non-GAAP EPS of $1.14 misses by $0.13, revenue of $1.16B misses by $20M",https://seekingalpha.com/news/3808354,
