feed,title,long_url,short_url
SeekingAlpha,Peabody jumps 3% with the launch of R3 Renewables,https://seekingalpha.com/news/3808425,
SeekingAlpha,Dollar Tree slips after sales forecast falls short of estimates,https://seekingalpha.com/news/3808424,
SeekingAlpha,Alcoa extends sizzling run higher as aluminum streaks to another record,https://seekingalpha.com/news/3808422,
SeekingAlpha,Intercept slips after another delay for NASH readout,https://seekingalpha.com/news/3808421,
SeekingAlpha,Skillful Craftsman Education stock gains on partnership for training metaverse platform,https://seekingalpha.com/news/3808420,
SeekingAlpha,America First Multifamily Investors announces 1-for-3 reverse unit split,https://seekingalpha.com/news/3808418,
