feed,title,long_url,short_url
InvestorPlace,The 3 Best Under $50 Stocks to Buy in May 2024,https://investorplace.com/2024/05/the-3-best-under-50-stocks-to-buy-in-may-2024/,https://da.gd/k2ZZTg
InvestorPlace,Why Is iSun (ISUN) Stock Up 47% Today?,https://investorplace.com/2024/05/why-is-isun-isun-stock-up-47-today/,https://da.gd/RZZ9Z
InvestorPlace,"MHGVY Stock Earnings: Mowi Misses EPS, Beats Revenue for Q1 2024",https://investorplace.com/earning-results/2024/05/mhgvy-stock-earnings-mowi-for-q1-of-2024/,https://da.gd/S8YmUs
InvestorPlace,Today’s Biggest Pre-Market Stock Movers: 10 Top Gainers and Losers on Wednesday,https://investorplace.com/2024/05/todays-biggest-pre-market-stock-movers-10-top-gainers-and-losers-on-wednesday-may-8th/,https://da.gd/Mt5m
InvestorPlace,3 Tech Stock Darlings to Scoop Up After Q2 earnings,https://investorplace.com/2024/05/3-tech-stock-darlings-to-scoop-up-after-q2-earnings/,https://da.gd/IdyLG
