feed,title,long_url,short_url
SeekingAlpha,"B. Riley sees heavy upside in Globalstar off latest results, mystery customer",https://seekingalpha.com/news/3868853,
SeekingAlpha,"VLTA, REAL and YSG are among consumer movers",https://seekingalpha.com/news/3868852,
SeekingAlpha,Nektar downgraded at JPMorgan citing setup after end to anti-cancer program,https://seekingalpha.com/news/3868851,
SeekingAlpha,Cocrystal engages Open Orphan to conduct mid-stage trial of oral influenza drug in UK,https://seekingalpha.com/news/3868850,
SeekingAlpha,"Trimble: Solid Quarter, Shares Still Cheap",https://seekingalpha.com/article/4531466,
