feed,title,long_url,short_url
SeekingAlpha,"Root GAAP EPS of -$0.36 beats by $0.08, revenue of $80.4M misses by $0.68M",https://seekingalpha.com/news/3869240,
SeekingAlpha,"Cepton Non-GAAP EPS of -$0.09 in-line, revenue of $2.6M beats by $0.43M",https://seekingalpha.com/news/3869239,
SeekingAlpha,"eHealth Non-GAAP EPS of -$1.15 misses by $0.08, revenue of $50.41M misses by $24.48M",https://seekingalpha.com/news/3869238,
SeekingAlpha,"Gevo Non-GAAP EPS of -$0.09 misses by $0.01, revenue of $0.1M misses by $0.29M",https://seekingalpha.com/news/3869237,
SeekingAlpha,"Upstart provides soft Q3 guidance, Q2 earnings miss on funding constraints",https://seekingalpha.com/news/3869236,
SeekingAlpha,"MagnaChip Semiconductor Non-GAAP EPS of $0.23 beats by $0.05, revenue of $101.4M beats by $0.27M",https://seekingalpha.com/news/3869235,
SeekingAlpha,Novavax sinks back to losses after massive 2Q topline miss,https://seekingalpha.com/news/3869233,
