feed,title,long_url,short_url
gNews,War and asset prices - Financial Times,https://news.google.com/rss/articles/CBMiP2h0dHBzOi8vd3d3LmZ0LmNvbS9jb250ZW50L2MzMjIwN2ExLWE4YTUtNDYyZS05MzE1LWJlNDZiNzA3ZGFhNNIBAA?oc=5,https://da.gd/7aQNJg
gNews,Energy & Utilities Roundup: Market Talk - WSJ - The Wall Street Journal,https://news.google.com/rss/articles/CBMiU2h0dHBzOi8vd3d3Lndzai5jb20vZmluYW5jZS9pbnZlc3RpbmcvZW5lcmd5LXV0aWxpdGllcy1yb3VuZHVwLW1hcmtldC10YWxrLTFlNzJhNmQ50gEA?oc=5,https://da.gd/cYYuiW
gNews,Equity Markets Rise as Traders Parse IMF Projections - Marketscreener.com,https://news.google.com/rss/articles/CBMie2h0dHBzOi8vd3d3Lm1hcmtldHNjcmVlbmVyLmNvbS9xdW90ZS9pbmRleC9TLVAtNTAwLTQ5ODUvbmV3cy9FcXVpdHktTWFya2V0cy1SaXNlLWFzLVRyYWRlcnMtUGFyc2UtSU1GLVByb2plY3Rpb25zLTQ1MDMyODE4L9IBAA?oc=5,https://da.gd/cjMFjW
gNews,Luxury Goods Stocks Tumble on LVMH Results - The Wall Street Journal,https://news.google.com/rss/articles/CBMijQFodHRwczovL3d3dy53c2ouY29tL2xpdmVjb3ZlcmFnZS9zdG9jay1tYXJrZXQtdG9kYXktZG93LWpvbmVzLTEwLTExLTIwMjMvY2FyZC9sdXh1cnktZ29vZHMtc3RvY2tzLXR1bWJsZS1vbi1sdm1oLXJlc3VsdHMtSmxEMnRyUmFzRVhqUGZjbGlJZkTSAQA?oc=5,https://da.gd/0l3uU
gNews,Senstar Technologies Ltd. (NASDAQ:SNT) Is Going Strong But Fundamentals Appear To Be Mixed : Is There A Clear Direction For The Stock? - Yahoo Finance,https://news.google.com/rss/articles/CBMiUWh0dHBzOi8vZmluYW5jZS55YWhvby5jb20vbmV3cy9zZW5zdGFyLXRlY2hub2xvZ2llcy1sdGQtbmFzZGFxLXNudC0xMDQ3MzgzODkuaHRtbNIBWWh0dHBzOi8vZmluYW5jZS55YWhvby5jb20vYW1waHRtbC9uZXdzL3NlbnN0YXItdGVjaG5vbG9naWVzLWx0ZC1uYXNkYXEtc250LTEwNDczODM4OS5odG1s?oc=5,https://da.gd/05gxBy
gNews,Global stock markets mostly higher ahead of Fed minutes - Seeking Alpha,https://news.google.com/rss/articles/CBMiXWh0dHBzOi8vc2Vla2luZ2FscGhhLmNvbS9uZXdzLzQwMTk2MDUtZ2xvYmFsLXN0b2NrLW1hcmtldHMtbW9zdGx5LWhpZ2hlci1haGVhZC1vZi1mZWQtbWludXRlc9IBAA?oc=5,https://da.gd/Yh4xBs
