feed,title,long_url,short_url
InvestorPlace,PXD Stock Alert: The $60 Billion Reason Pioneer Natural Resources Is Up Today,https://investorplace.com/2023/10/pxd-stock-alert-the-60-billion-reason-pioneer-natural-resources-is-up-today/,https://da.gd/0Fab2d
InvestorPlace,Hidden Gems: 7 Under-the-Radar Stocks with Skyrocketing Potential,https://investorplace.com/2023/10/hidden-gems-7-under-the-radar-stocks-with-skyrocketing-potential/,https://da.gd/5PituH
InvestorPlace,3 Growth Stocks To Make You The Millionaire Next Door: October Edition,https://investorplace.com/2023/10/3-growth-stocks-to-make-you-the-millionaire-next-door-october-edition/,https://da.gd/kPVJb
InvestorPlace,Why Is Hyliion (HYLN) Stock Down 37% Today?,https://investorplace.com/2023/10/why-is-hyliion-hyln-stock-down-37-today/,https://da.gd/s7fEop
InvestorPlace,The Big Buy-and-Hold Oil Stock You Can’t Afford to Ignore,https://investorplace.com/2023/10/cvx-stock-is-a-big-oil-buy-and-hold-you-cant-afford-to-ignore/,https://da.gd/mcvFX
InvestorPlace,How AMD Is Gaining Ground in the AI Chip Market and What It Means for Investors,https://investorplace.com/2023/10/amd-stock-buy/,https://da.gd/bpvrt
InvestorPlace,Why Is Silk Road Medical (SILK) Stock Down 40% Today?,https://investorplace.com/2023/10/why-is-silk-road-medical-silk-stock-down-40-today/,https://da.gd/Hzj9WP
InvestorPlace,The 3 Hottest Energy Stocks to Invest in Right Now,https://investorplace.com/2023/10/the-3-hottest-energy-stocks-to-invest-in-right-now/,https://da.gd/ppMk
InvestorPlace,Why Is Wheeler Real Estate IT (WHLR) Stock Up 116% Today?,https://investorplace.com/2023/10/why-is-wheeler-real-estate-it-whlr-stock-up-116-today/,https://da.gd/zW1b
InvestorPlace,Why Is Tempest Therapeutics (TPST) Stock Up 325% Today?,https://investorplace.com/2023/10/why-is-tempest-therapeutics-tpst-stock-up-325-today/,https://da.gd/ncN0Or
InvestorPlace,Today’s Biggest Pre-Market Stock Movers: 10 Top Gainers and Losers on Wednesday,https://investorplace.com/2023/10/todays-biggest-pre-market-stock-movers-10-top-gainers-and-losers-on-wednesday-oct-11th/,https://da.gd/UCMnU
