feed,title,long_url,short_url
SeekingAlpha,Ventas Q3 Earnings Preview,https://seekingalpha.com/news/3632340,
SeekingAlpha,Domtar Q3 2020 Earnings Preview,https://seekingalpha.com/news/3632339,
SeekingAlpha,Coty FQ1 Earnings Preview,https://seekingalpha.com/news/3632337,
SeekingAlpha,"New data on lead drug propels Oncternal Therapeutics, up 78%",https://seekingalpha.com/news/3632323,
SeekingAlpha,Xcel Energy set for new 20-year Boulder power deal after vote,https://seekingalpha.com/news/3632338,
