feed,title,long_url,short_url
SeekingAlpha,"Bonanza Creek EPS misses by $0.26, misses on revenue",https://seekingalpha.com/news/3632620,
SeekingAlpha,"Puma Biotechnology EPS misses by $0.46, misses on revenue",https://seekingalpha.com/news/3632619,
SeekingAlpha,"Teradata EPS beats by $0.13, beats on revenue",https://seekingalpha.com/news/3632618,
SeekingAlpha,"Uber slides after Q3 misses, dragging down Lyft",https://seekingalpha.com/news/3632616,
SeekingAlpha,"Chuy's EPS beats by $0.19, beats on revenue",https://seekingalpha.com/news/3632615,
SeekingAlpha,"CryoPort EPS misses by $0.16, beats on revenue",https://seekingalpha.com/news/3632614,
