feed,title,long_url,short_url
Investing,Rheinmetall target raised at UBS as Trump continues to push for higher defense spe,https://www.investing.com/news/stock-market-news/rheinmetall-target-raised-at-ubs-as-trump-continues-to-push-for-higher-defense-spe-3826997,https://da.gd/jBbdA
Investing,Analysis-Britain appeals to Big Tech with change of regulatory guard,https://www.investing.com/news/stock-market-news/analysisbritain-appeals-to-big-tech-with-change-of-regulatory-guard-3826996,https://da.gd/2rVUl
Investing,"Electronic Arts, American Airlines, Boston Beer fall premarket; Ge Aerospace rise",https://www.investing.com/news/stock-market-news/electronic-arts-american-airlines-boston-beer-fall-premarket--ge-aerospace-rise-3826972,https://da.gd/jGQWG
Investing,"Union Pacific earnings beat by $0.14, revenue was in line with estimates",https://www.investing.com/news/stock-market-news/union-pacific-earnings-beat-by-014-revenue-was-in-line-with-estimates-3826994,https://da.gd/Vgiu6
Investing,"LA fire insured losses estimated at $28 billion, KCC says",https://www.investing.com/news/stock-market-news/la-fire-insured-losses-estimated-at-28-billion-kcc-says-3826982,https://da.gd/kRTM5
Investing,Saudi Arabia stocks lower at close of trade; Tadawul All Share down 0.07%,https://www.investing.com/news/stock-market-news/saudi-arabia-stocks-lower-at-close-of-trade-tadawul-all-share-down-007-3826986,https://da.gd/avBCs
Investing,Vigil Neuroscience shares rise on positive Alzheimer's trial data,https://www.investing.com/news/stock-market-news/vigil-neuroscience-shares-rise-on-positive-alzheimers-trial-data-93CH-3826984,https://da.gd/33XLuA
Investing,Mexico annual inflation hits lowest level in nearly four years,https://www.investing.com/news/economy-news/mexico-annual-inflation-hits-lowest-level-in-nearly-four-years-3826971,https://da.gd/CoPx5K
