feed,title,long_url,short_url
Yahoo,"Stock market today: Dow rises, Nasdaq slips as Trump takes the spotlight at Davos",https://finance.yahoo.com/news/live/stock-market-today-dow-rises-nasdaq-slips-as-trump-takes-the-spotlight-at-davos-143103433.html,https://da.gd/lnXqzi
Yahoo,Meta Gets Price Target Hikes Ahead Of Earnings. All Eyes Are On This Number.,https://www.investors.com/news/technology/meta-stock-q4-2024-earnings-report-preview-facebook/?src=A00220&yptr=yahoo,https://da.gd/RaTQP
Yahoo,Natural Foods Market Ripe For The Picking With Early Entry,https://www.investors.com/research/sprouts-farmers-market-stock-sfm/?src=A00220&yptr=yahoo,https://da.gd/UuXkE2
Yahoo,Behind MicroStrategy’s Bitcoin Bet: Investors Who Usually Play It Safe,https://www.wsj.com/finance/investing/behind-microstrategys-bitcoin-bet-investors-who-usually-play-it-safe-0e9dfd00?siteid=yhoof2&yptr=yahoo,https://da.gd/D72Ki
Yahoo,U.S. Natural Gas Inventories Fall Less Than Expected,https://www.wsj.com/finance/commodities-futures/europes-gas-price-jump-on-supply-fears-24865570?siteid=yhoof2&yptr=yahoo,https://da.gd/YqfG2d
Yahoo,Salzgitter in Talks With Suitors After $1.2 Billion Takeover Approach,https://www.wsj.com/business/deals/salzgitter-in-talks-with-suitors-after-1-2-billion-takeover-approach-d773449e?siteid=yhoof2&yptr=yahoo,https://da.gd/xx8Tn1
Yahoo,Tesla Q4 Earnings Preview: What's at Stake for Investors?,https://finance.yahoo.com/news/tesla-q4-earnings-preview-whats-170016428.html?.tsrc=rss,https://da.gd/XtyatD
Yahoo,"Tesla to Focus Resources on Physical AI Technology, Oppenheimer Says",https://finance.yahoo.com/news/tesla-focus-resources-physical-ai-165905482.html?.tsrc=rss,https://da.gd/hRevE
Yahoo,"Market Chatter: Apple, Google, Smartphone Makers Pressed by India to Open Up App Stores",https://finance.yahoo.com/news/market-chatter-apple-google-smartphone-161800066.html?.tsrc=rss,https://da.gd/CyEeIT
