feed,title,long_url,short_url
Investing,Chart Of The Day: U.S. Dollar Completes a Major Bullish Pattern,https://investing.com/analysis/-200603577,
Investing,Crypto: El Salvador Moving Forward With Bitcoin While China Widens Ban,https://investing.com/analysis/-200603571,
Investing,"This 'Hidden' Play On 5G Yields 6.4%, With Big Gains Ahead",https://investing.com/analysis/-200603556,
Investing,Crude Oil Technical Outlook: Weakness Lies Ahead,https://investing.com/analysis/-200603572,
Investing,The Energy Report: Crisis Pause,https://www.investing.com/analysis/the-energy-report-c,
Investing,"Bitcoin yet to prove inflation hedge status, but the time may come soon",https://investing.com/news/-2630846,
Investing,(no title),https://i-invdn-com.investing.com/news/LYNXMPEB2U113_M.jpg,
Investing,Bombardier gets $534 million order for Challenger 3500 jets,https://investing.com/news/-2630855,
Investing,Lordstown Jumps on Report Foxconn May Buy its Ohio Plant,https://investing.com/news/-2630800,
