feed,title,long_url,short_url
SeekingAlpha,Kroger adds Impossible Burger to meal kit plan,https://seekingalpha.com/news/3591176,
SeekingAlpha,John Harrison as Comstock's SVP/Development,https://seekingalpha.com/news/3591175,
SeekingAlpha,ElectroCore sees modest sequential rise in Q2 revenue,https://seekingalpha.com/news/3591174,
SeekingAlpha,Neuronetics names new CEO,https://seekingalpha.com/news/3591173,
SeekingAlpha,Fed's Intervention In Corporate Credit: A Risky Venture,https://seekingalpha.com/article/4358462,
