feed,title,long_url,short_url
InvestorPlace,TSM Stock Alert: Taiwan Semi Just Got a $6.6 Billion Boost,https://investorplace.com/2024/04/tsm-stock-alert-taiwan-semi-just-got-a-6-6-billion-boost/,https://da.gd/xD89y1
InvestorPlace,Best Buy Layoffs 2024: What to Know About the Latest Geek Squad Job Cuts,https://investorplace.com/2024/04/best-buy-layoffs-2024-what-to-know-about-the-latest-geek-squad-job-cuts/,https://da.gd/t3Xjn9
InvestorPlace,TSLA Stock Alert: Tesla Has a Major Catalyst Coming on Aug. 8. Can It Survive Until Then?,https://investorplace.com/2024/04/tsla-stock-alert-tesla-has-a-major-catalyst-coming-on-aug-8-can-it-survive-until-then/,https://da.gd/rljyfb
InvestorPlace,3 Financial Stocks Short Sellers Are Banking On to Fail,https://investorplace.com/2024/04/3-financial-stocks-short-sellers-are-banking-on-to-fail/,https://da.gd/TCFXbG
InvestorPlace,LUV Stock Alert: The FAA Will Probe Southwest Airlines Flight Over Engine Cover Mishap,https://investorplace.com/2024/04/luv-stock-alert-the-faa-will-probe-southwest-airlines-flight-over-engine-cover-mishap/,https://da.gd/X1WS
InvestorPlace,Why Is 22nd Century (XXII) Stock Down 33% Today?,https://investorplace.com/2024/04/why-is-22nd-century-xxii-stock-down-33-today/,https://da.gd/CmsU7b
InvestorPlace,CVU Stock Earnings: CPI Aerostructures Reported Results for Q4 2023,https://investorplace.com/earning-results/2024/04/cvu-stock-earnings-cpi-aerostructures-for-q4-of-2023/,https://da.gd/C3AjPo
InvestorPlace,Why Is Perion Network (PERI) Stock Down 39% Today?,https://investorplace.com/2024/04/why-is-perion-network-peri-stock-down-39-today/,https://da.gd/S6pZMb
