feed,title,long_url,short_url
Investing,Fed Cuts Rates Amid Economic and Geopolitical Risks,https://www.investing.com/analysis/fed-cuts-rates-amid-economic-and-geopolitical-risks-200667108,
Investing,Anglo American cuts jobs in Australia amid coal market challenges,https://www.investing.com/news/stock-market-news/anglo-american-cuts-jobs-in-australia-amid-coal-market-challenges-93CH-4244042,
Investing,Kone shares climb on report of potential bid for rival TK Elevator,https://www.investing.com/news/stock-market-news/kone-shares-climb-on-report-of-potential-bid-for-rival-tk-elevator-4244039,
Investing,Indonesia stocks lower at close of trade; IDX Composite Index down 0.35%,https://www.investing.com/news/stock-market-news/indonesia-stocks-lower-at-close-of-trade-idx-composite-index-down-035-4244026,
Investing,Moldova's central bank cuts key interest rate to 6%,https://www.investing.com/news/economic-indicators/moldovas-central-bank-cuts-key-interest-rate-to-6-93CH-4244041,
Investing,ECB’s de Guindos: Rate cut cycle may not be over yet,https://www.investing.com/news/economy-news/ecbs-de-guindos-rate-cut-cycle-may-not-be-over-yet-93CH-4244043,
Investing,ECB’s de Guindos urges caution on rates amid high uncertainty,https://www.investing.com/news/economy-news/ecbs-de-guindos-urges-caution-on-rates-amid-high-uncertainty-93CH-4244036,
Investing,Irish central bank raises forecasts for economic growth,https://www.investing.com/news/economy-news/irish-central-bank-raises-forecasts-for-economic-growth-93CH-4244035,
