feed,title,long_url,short_url
InsiderMonkey,Cloudflare (NET) Partners with JD.com to Create an International Platform,https://insidermonkey.com/blog/--1663277,
InsiderMonkey,Here’s What Wall Street Thinks About American Tower Corporation (AMT),https://insidermonkey.com/blog/--1663278,
InsiderMonkey,"Wall Street Maintains a Positive Outlook on Marvell Technology (MRVL), Here’s Why",https://insidermonkey.com/blog/--1663279,
InsiderMonkey,Here’s What Analysts Think About Snowflake Inc (SNOW),https://insidermonkey.com/blog/--1663280,
InsiderMonkey,"Moody’s Rating Upgrades MercadoLibre, Inc. (MELI), Here’s Why",https://insidermonkey.com/blog/--1663281,
InsiderMonkey,"Advanced Micro Devices (AMD) Down More Than 13.9%, Here’s What You Need to Know",https://insidermonkey.com/blog/--1663282,
InsiderMonkey,Here’s What Wall Street Has to Say About Spotify Technology (SPOT),https://insidermonkey.com/blog/--1663283,
InsiderMonkey,"Alibaba Group Holding (BABA) Making Advancements With Open Source AI Models, Here’s What You Need to Know",https://insidermonkey.com/blog/--1663284,
InsiderMonkey,Here’s What You Need to Know About Netflix (NFLX),https://insidermonkey.com/blog/--1663285,
InsiderMonkey,"Broadcom Inc. (AVGO) Down 19% Since Q4 2025 Results, Here’s Why",https://insidermonkey.com/blog/--1663286,
InsiderMonkey,​NVIDIA Corporation (NVDA) Launches a New Family of Open Source AI Models,https://insidermonkey.com/blog/--1663287,
InsiderMonkey,"Here’s What Wall Street Thinks About Meta Platforms, Inc (META)",https://insidermonkey.com/blog/--1663288,
InsiderMonkey,10 Best EV Stocks to Buy Heading into 2026,https://insidermonkey.com/blog/--1662985,
InsiderMonkey,Truist and RBC Capital Raise Price Targets on Intuitive Surgical (ISRG),https://insidermonkey.com/blog/--1663090,
InsiderMonkey,Analysts Get Bullish on Charles Schwab (SCHW),https://insidermonkey.com/blog/--1663092,
InsiderMonkey,"Barclays Raises Union Pacific (UNP) Price Target, Keeps Overweight Rating",https://insidermonkey.com/blog/--1663096,
InsiderMonkey,UBS Reiterates Buy Rating on Boston Scientific (BSX),https://insidermonkey.com/blog/--1663101,
InsiderMonkey,Analysts Stay Bullish on ServiceNow (NOW) Amid Armis Acquisition Talks,https://insidermonkey.com/blog/--1663103,
InsiderMonkey,"Boeing (BA) Gets Buy Rating from Citi, Completes Spirit AeroSystems Acquisition",https://insidermonkey.com/blog/--1663105,
