feed,title,long_url,short_url
Investing,NFTs will act as high-end property during boom cycles: Real Vision CEO,https://www.investing.com/news/cryptocurrency-news/nfts-will-act-as-highend-property-during-boom-cycles-real-vision-ceo-3008424,https://da.gd/XbV3As
Investing,Fresh earthquake hits Turkey-Syria border two weeks after disaster,https://www.investing.com/news/world-news/turkey-clears-away-rubble-from-earthquake-rescue-efforts-wind-down-3007965,https://da.gd/zL8dOF
Investing,Analysis-Looming U.S. default risk prompts investors to cut some debt exposure,https://www.investing.com/news/stock-market-news/analysislooming-us-default-risk-prompts-investors-to-cut-some-debt-exposure-3008422,https://da.gd/78fC0A
Investing,"HSBC logs sharp jump in Q4 profit, flags special dividend",https://www.investing.com/news/stock-market-news/hsbc-logs-sharp-jump-in-q4-profit-flags-special-dividend-3008419,https://da.gd/8Mr47
Investing,How to afford the big price tag of your lifetime 'bucket list',https://www.investing.com/news/economy/how-to-afford-the-big-price-tag-of-your-lifetime-bucket-list-3008425,https://da.gd/2UUT
Investing,Hong Kong under pressure to cut spending in budget as deficit soars,https://www.investing.com/news/economy/hong-kong-under-pressure-to-cut-spending-in-budget-as-deficit-soars-3008421,https://da.gd/2SI7Lh
Investing,Bank of Korea: benefits from China's recovery to be less than in past,https://www.investing.com/news/economy/bank-of-korea-benefits-from-chinas-recovery-to-be-less-than-in-past-3008420,https://da.gd/51UclH
