feed,title,long_url,short_url
SeekingAlpha,Molson Coors reports mixed Q4 earnings; initiates FY23 outlook,https://seekingalpha.com/news/3938254,
SeekingAlpha,General Mills raises guidance ahead of CAGNY presentation,https://seekingalpha.com/news/3938252,
SeekingAlpha,"BioCryst Pharmaceuticals Non-GAAP EPS of -$0.38 misses by $0.18, revenue of $79.5M beats by $5.32M",https://seekingalpha.com/news/3938253,
SeekingAlpha,"LGI Homes Non-GAAP EPS of $1.45 misses by $0.23, revenue of $488.26M misses by $42.43M",https://seekingalpha.com/news/3938251,
SeekingAlpha,"Dana Non-GAAP EPS of -$0.10 misses by $0.36, revenue of $2.56B beats by $50M, introduces 2023 guidance",https://seekingalpha.com/news/3938250,
SeekingAlpha,Wall Street Breakfast Podcast: Putin Responds To Biden's Ukraine Visit,https://seekingalpha.com/article/4580174,
