feed,title,long_url,short_url
SeekingAlpha,"Xperi Non-GAAP EPS of $0.08 beats by $0.51, revenue of $135.53M beats by $5.04M, guidance in-line",https://seekingalpha.com/news/3938764,
SeekingAlpha,TPG RE Finance Trust GAAP EPS of $0.42 beats by $0.29,https://seekingalpha.com/news/3938763,
SeekingAlpha,"Ritchie Bros Auctioneers Non-GAAP EPS of $0.68 beats by $0.09, revenue of $443.9M beats by $27.82M",https://seekingalpha.com/news/3938762,
SeekingAlpha,Exact Sciences slips despite Q4 beat after in-line outlook,https://seekingalpha.com/news/3938761,
SeekingAlpha,"Toll Brothers GAAP EPS of $1.70 beats by $0.31, revenue of $1.78B beats by $40M",https://seekingalpha.com/news/3938760,
SeekingAlpha,"ProPetroEPS of $0.12, revenue of $348.92M beats by $2.92M",https://seekingalpha.com/news/3938759,
SeekingAlpha,"National Health Investors GAAP EPS of $0.04 misses by $0.65, revenue of $70.66M misses by $4.97M",https://seekingalpha.com/news/3938758,
