feed,title,long_url,short_url
FXEmpire,France to turn off hot water in public offices to save energy,https://www.fxempire.com/news/article/france-to-turn-off-hot-water-in-public-offices-to-save-energy-1151674,https://bit.ly/3rAH5z7
FXEmpire,Texas to execute inmate who won religious rights case,https://www.fxempire.com/news/article/texas-to-execute-inmate-who-won-religious-rights-case-1151673,https://bit.ly/3VfNBce
FXEmpire,U.S. awards $75 million loan to California county to extend high occupancy vehicle lanes,https://www.fxempire.com/news/article/u-s-awards-75-million-loan-to-california-county-to-extend-high-occupancy-vehicle-lanes-1151669,https://bit.ly/3fKI9gV
FXEmpire,"FedEx Express pilots, management file for mediation",https://www.fxempire.com/news/article/fedex-express-pilots-management-file-for-mediation-1151670,https://bit.ly/3V5eVJZ
FXEmpire,"About 101,000 still without power in Puerto Rico two weeks after Hurricane Fiona",https://www.fxempire.com/news/article/about-101000-still-without-power-in-puerto-rico-two-weeks-after-hurricane-fiona-1151679,https://bit.ly/3RCfgRE
FXEmpire,Florida beachfront paradise shattered by Hurricane Ian,https://www.fxempire.com/news/article/florida-beachfront-paradise-shattered-by-hurricane-ian-1151668,https://bit.ly/3e6Ap8D
