feed,title,long_url,short_url
Investing,"Amazon, Microsoft Aim for All-Time Highs Going All-In on AI: Hype or Opportunity?",https://www.investing.com/analysis/amazon-microsoft-aim-for-alltime-highs-going-allin-on-ai-hype-or-opportunity-200641835,https://da.gd/H0tSE
Investing,"Russell 2000 Holds Steady; Nasdaq, S&P 500 Search for Support: What Lies Ahead?",https://www.investing.com/analysis/russell-2000-holds-steady-nasdaq-sp-500-search-for-support-what-li,https://da.gd/ubM8m
Investing,Google Cloud teams up with Web3 startup to make DeFi mainstream,https://www.investing.com/news/cryptocurrency-news/google-cloud-teams-up-with-web3-startup-to-make-defi-mainstream-3174490,https://da.gd/RIOdC
Investing,"Binance faces legal tussle with SEC, sets hearing date amid leadership changes and layoffs",https://www.investing.com/news/cryptocurrency-news/binance-faces-legal-tussle-with-sec-sets-hearing-date-amid-leadership-changes-and-layoffs-93CH-3174473,https://da.gd/zjzzm
Investing,CVC Capital Partners plans billion-dollar IPO for German retailer Douglas,https://www.investing.com/news/stock-market-news/cvc-capital-partners-plans-billiondollar-ipo-for-german-retailer-douglas-93CH-3174488,https://da.gd/vzcRV5
Investing,Lazard's next CEO Peter Orszag plans to double revenue by 2030,https://www.investing.com/news/stock-market-news/lazards-next-ceo-peter-orszag-plans-to-double-revenue-by-2030-3174484,https://da.gd/gKxpA
Investing,Arm Holdings makes debut on Nasdaq amidst mixed European market sentiment,https://www.investing.com/news/stock-market-news/arm-holdings-makes-debut-on-nasdaq-amidst-mixed-european-market-sentiment-93CH-3174482,https://da.gd/TQgZyn
Investing,Equifax Canada reports record high credit card balances amid rising inflation,https://www.investing.com/news/stock-market-news/equifax-canada-reports-record-high-credit-card-balances-amid-rising-inflation-93CH-3174477,https://da.gd/Z4OJ16
Investing,Canadian Western Bank announces dividend of $0.33 per share: a look at its dividend history and growth,https://www.investing.com/news/stock-market-news/canadian-western-bank-announces-dividend-of-033-per-share-a-look-at-its-dividend-history-and-growth-93CH-3174475,https://da.gd/T0VIRk
Investing,Redburn upgrades Carnival Crop and Norwegian Cruise Lines as sector 'has exited intensive care',https://www.investing.com/news/stock-market-news/redburn-upgrades-carnival-crop-and-norwegian-cruise-lines-as-sector-has-exited-intensive-care-432SI-3174455,https://da.gd/l7pmD
Investing,Credit card debt in Canada hits record high amid inflation and interest rate hikes,https://www.investing.com/news/economic-indicators/credit-card-debt-in-canada-hits-record-high-amid-inflation-and-interest-rate-hikes-93CH-3174492,https://da.gd/ImNYU
Investing,BofA Global Research expects hit to U.S. GDP growth from auto workers' strike,https://www.investing.com/news/economic-indicators/bofa-global-research-expects-hit-to-us-g,https://da.gd/nQsM6W
Investing,Deutsche Bank to hold crypto for institutional clients,https://www.investing.com/news/economy/deutsche-bank-to-hold-crypto-for-institutional-clients-3174476,https://da.gd/Vag6
Investing,UAW set to go on strike against the 'Detroit Three' automakers,https://www.investing.com/news/economy/uaw-set-to-go-on-strike-against-the-detroit-three-automakers-3174479,https://da.gd/v2qX
Investing,ECB raises interest rates by 25 basis points,https://www.investing.com/news/economy/ecb-raises-interest-rates-by-25-basis-points-3174474,https://da.gd/DlVLp
