feed,title,long_url,short_url
ETFTrends:DailyRecap,VettaFi’s Growing Thematic Index Family Supports Key Slice of Portfolios,https://www.etftrends.com/disruptive-technology-channel/vettafis-growing-thematic-index-family-supports-slice-portfolios/,https://da.gd/CgEE2
ETFTrends:DailyRecap,Direxion Launches Nvidia Single Stock Leveraged and Inverse ETFs,https://www.etftrends.com/leveraged-inverse-channel/direxion-launches-nvidia-single-stock-leveraged-inverse-etfs/,https://da.gd/kpOKL
ETFTrends:DailyRecap,New California Law Could Put Spotlight on This ETF,https://www.etftrends.com/etf-education-channel/new-california-law-could-put-spotlight-on-this-etf/,https://da.gd/aptc
ETFTrends:DailyRecap,Preparing for Retirement: 5 Overlooked Financial Steps to Take in Your 30s and 40s,https://www.etftrends.com/financial-literacy-channel/preparing-retirement-5-overlooked-financial-steps-30s-40s/,https://da.gd/tN83
ETFTrends:DailyRecap,"Monetary Tightening Might Boost Bitcoin, Says Crypto Expert",https://www.etftrends.com/crypto-channel/monetary-tightening-might-boost-bitcoin-says-crypto-expert/,https://da.gd/zCwMp
ETFTrends:DailyRecap,A Company’s Value is Based on its Future Free Cash Flow,https://www.etftrends.com/free-cash-flow-channel/companys-value-based-on-future-free-cash-flow/,https://da.gd/F6oLx
ETFTrends:DailyRecap,How Higher Rates Could Actually Help Muni Bond ETFs,https://www.etftrends.com/tactical-allocation-channel/how-higher-rates-help-muni-bond-etfs/,https://da.gd/cK4Rr
ETFTrends:DailyRecap,Harbor Launches Active Dynamic Multi-Asset ETF: MAPP,https://www.etftrends.com/market-insights-channel/harbor-launches-active-dynamic-multi-asset-etf-mapp/,https://da.gd/gW2DH4
ETFTrends:DailyRecap,Inside the Consumer Price Index: August 2023,https://www.etftrends.com/commodities-channel/inside-the-consumer-price-index-august-2023/,https://da.gd/NtRG2
ETFTrends:DailyRecap,Consider Treasuries of Any Duration as Yields Near 5%,https://www.etftrends.com/fixed-income-channel/consider-treasuries-any-duration-yields-near-5/,https://da.gd/Pb9Tb
ETFTrends:DailyRecap,A Look at Energy Stocks and the Strength of Technology,https://www.etftrends.com/etf-strategist-channel/look-energy-stocks-strength-technology/,https://da.gd/hGQct
ETFTrends:DailyRecap,Fiscal Tightening Looms,https://www.etftrends.com/etf-strategist-channel/fiscal-tightening-looms/,https://da.gd/wUyXp
ETFTrends:DailyRecap,More Investors Can Enjoy Direct Indexing’s Tax-Loss Harvesting Capabilities,https://www.etftrends.com/direct-indexing-channel/more-investors-direct-indexings-tax-loss-harvesting-capabilities/,https://da.gd/6eem
ETFTrends:DailyRecap,Top ETF Holding Enbridge Adds U.S. Utilities Assets,https://www.etftrends.com/energy-infrastructure-channel/top-etf-holding-enbridge-adds-u-s-utilities-assets/,https://da.gd/bvhC
ETFTrends:DailyRecap,Active International ETF ‘OSEA’ Outperforms in 1st Year,https://www.etftrends.com/market-insights-channel/active-international-etf-osea-outperforms-1st-year/,https://da.gd/jGNsOX
ETFTrends:DailyRecap,Mastering Money: How the 80/20 Rule Can Help You Save and Simplify Your Finances,https://www.etftrends.com/financial-literacy-channel/80-20-rule-help-save-simplify-your-finances/,https://da.gd/MkE3P
ETFTrends:DailyRecap,Central Banks and Investors Are Interested in Gold,https://www.etftrends.com/tactical-allocation-channel/central-banks-investors-interested-gold/,https://da.gd/0ngi3
ETFTrends:DailyRecap,What’s Behind Soaring College Costs and What You Can Do,https://www.etftrends.com/financial-literacy-channel/soaring-college-costs-what-can-do/,https://da.gd/zzsr
ETFTrends:DailyRecap,Eyeing Foreign Equities? Check This ETF Duo First,https://www.etftrends.com/etf-building-blocks-channel/eyeing-foreign-equities-check-this-etf-duo-first/,https://da.gd/FQG3WT
ETFTrends:DailyRecap,Dimensional Actively Seeks U.S. Core Equities With DCOR,https://www.etftrends.com/dimensional-actively-seeks-u-s-core-equities-with-dcor/,https://da.gd/Ef9csp
ETFTrends:DailyRecap,Global X Adds to Thematic Suite With New Defense Tech ETF,https://www.etftrends.com/global-x-thematic-suite-defense-tech-etf/,https://da.gd/4vWoYk
ETFTrends:DailyRecap,Japan ETF DXJ Nearing $3 Billion AUM Mark,https://www.etftrends.com/model-portfolio-channel/japan-etf-dxj-nearing-3-billion-aum-mark/,https://da.gd/vfGc9
ETFTrends:DailyRecap,"Invesco’s Bank Loan ETF Offers High Yield, Outpaces Active Peers",https://www.etftrends.com/innovative-etf-channel/invescos-bank-loan-etf-offers-high-yield-outpaces-active-peers/,https://da.gd/al5r
ETFTrends:DailyRecap,Equity Symposium Set to Cast a Wide Net,https://www.etftrends.com/tactical-allocation-channel/equity-symposium-set-to-cast-a-wide-net/,https://da.gd/KUX0
ETFTrends:DailyRecap,Counter Rising Rates With This Multi-Income ETF,https://www.etftrends.com/core-strategies-channel/counter-rising-rates-multi-income-etf/,https://da.gd/bXdii5
ETFTrends:DailyRecap,Touchstone’s Active ETF Lineup Is Focused on Income,https://www.etftrends.com/equity-etf-channel/touchstones-active-etf-lineup-is-focused-on-income/,https://da.gd/ivVGe
ETFTrends:DailyRecap,Get Active Smid Cap Exposure in TMSL,https://www.etftrends.com/active-etf-channel/active-smid-cap-exposure-tmsl/,https://da.gd/xxUvz
