feed,title,long_url,short_url
Benzinga,goeasy Ltd. Provides Update on Sale of Equity Interest in PayBright,https://www.benzinga.com/pressreleases/21/01/g19180613/goeasy-ltd-provides-update-on-sale-of-equity-interest-in-paybright,https://j.mp/38JsWXK
Benzinga,Versus Systems Inc. Announces Pricing of its Public Offering,https://www.benzinga.com/pressreleases/21/01/g19180614/versus-systems-inc-announces-pricing-of-its-public-offering,https://j.mp/3oOTlJ5
Benzinga,Trevali to Restart Caribou Mine with Improved Economics; Continues Studies on Longer Term Value Potential,https://www.benzinga.com/pressreleases/21/01/n19180611/trevali-to-restart-caribou-mine-with-improved-economics-continues-studies-on-longer-term-value-pot,https://j.mp/38M0u7G
Benzinga,RTX Extends Family of Sheerlink™ Product Solutions,https://www.benzinga.com/pressreleases/21/01/b19180618/rtx-extends-family-of-sheerlink-product-solutions,https://j.mp/3ifOePE
Benzinga,"Vietnam $7.32 Billion Internet of Things Market, Competition, Forecast & Opportunities, 2025 - ResearchAndMarkets.com",https://www.benzinga.com/pressreleases/21/01/b19180615/vietnam-7-32-billion-internet-of-things-market-competition-forecast-opportunities-2025-researchand,https://j.mp/39wOfeo
Benzinga,Afya Limited Announces that Whitebook was ranked as one of the 10 Top Apps in Brazil by Consumer Spend in 2020,https://www.benzinga.com/pressreleases/21/01/g19180610/afya-limited-announces-that-whitebook-was-ranked-as-one-of-the-10-top-apps-in-brazil-by-consumer-s,https://j.mp/38M0tRa
Benzinga,"Nuvolo Launches Connected Workplace, Transforming Modern IWMS",https://www.benzinga.com/pressreleases/21/01/n19180587/nuvolo-launches-connected-workplace-transforming-modern-iwms,https://j.mp/39BaU97
Benzinga,"$241 Million Solid-State Transformer Markets, 2025 - Market for HV/MV to Account for the Largest Market Share",https://www.benzinga.com/pressreleases/21/01/g19180578/241-million-solid-state-transformer-markets-2025-market-for-hvmv-to-account-for-the-largest-market,https://j.mp/2LDnHA7
Benzinga,Global Online Survey Software Industry,https://www.benzinga.com/pressreleases/21/01/g19180577/global-online-survey-software-industry,https://j.mp/35J6ts1
Benzinga,"Fintech SaaS Company 'AskMyAdvisor™' Introduces Innovative Digital Solution to Help Solve The COVID Disruption of In-Person Advisory Services for Accountants, Attorneys, Financial Advisors and Realtors",https://www.benzinga.com/pressreleases/21/01/n19180584/fintech-saas-company-askmyadvisor-introduces-innovative-digital-solution-to-help-solve-the-covid-d,https://j.mp/3ifbAVL
Benzinga,The National Alliance for Insurance Education & Research CISR High School Program Exam Success,https://www.benzinga.com/pressreleases/21/01/n19180573/the-national-alliance-for-insurance-education-research-cisr-high-school-program-exam-success,https://j.mp/3bGbiG2
Benzinga,"Global Vials Market Report 2020: Industry Analysis, Trends, Market Size, and Forecasts 2018-2026 - ResearchAndMarkets.com",https://www.benzinga.com/pressreleases/21/01/b19180569/global-vials-market-report-2020-industry-analysis-trends-market-size-and-forecasts-2018-2026-resea,https://j.mp/39AMEEb
Benzinga,Partnership for Responsible Addressable Media Invites Industry to Contribute Addressability Code For Collaborative Development,https://www.benzinga.com/pressreleases/21/01/n19180560/partnership-for-responsible-addressable-media-invites-industry-to-contribute-addressability-code-f,https://j.mp/35LkRjh
Benzinga,"""For the Defense,"" a rakontur Podcast Chronicling Famous Defense Attorneys and Their Most Fascinating Trials Launches Its Second Season on January 26, 2021",https://www.benzinga.com/pressreleases/21/01/b19180561/for-the-defense-a-rakontur-podcast-chronicling-famous-defense-attorneys-and-their-most-fascinating,https://j.mp/2Nbkp7L
