feed,title,long_url,short_url
Benzinga,"The Europe dermatology treatment devices market is expected to reach US$ 2,198.26 million in 2027 from US$ 1,380.20 million in 2019",https://www.benzinga.com/pressreleases/21/01/g19181846/the-europe-dermatology-treatment-devices-market-is-expected-to-reach-us-2-198-26-million-in-2027-f,https://j.mp/3nTiUru
Benzinga,Cominar Real Estate Investment Trust Announces January 2021 Monthly Distribution,https://www.benzinga.com/pressreleases/21/01/n19181861/cominar-real-estate-investment-trust-announces-january-2021-monthly-distribution,https://j.mp/39t6EZe
Benzinga,Global and China Automotive Intelligent Cockpit Design Report 2020: User Experience-Centric Cockpit Scenario-Based Interaction Modes will Become Pervasive,https://www.benzinga.com/pressreleases/21/01/n19181769/global-and-china-automotive-intelligent-cockpit-design-report-2020-user-experience-centric-cockpit,https://j.mp/3bIGDIs
Benzinga,Antimicrobial Additives Market Size to Reach $7.5 Billion by 2027 | CAGR: 6.8%: AMR,https://www.benzinga.com/pressreleases/21/01/g19181764/antimicrobial-additives-market-size-to-reach-7-5-billion-by-2027-cagr-6-8-amr,https://j.mp/38MadLe
Benzinga,"Global Pet Wearables Market Report 2020: Size, Market Share, Application Analysis, Regional Outlook, Growth Trends, Key Players, Competitive Strategies and Forecasts, 2018-2028 - ResearchAndMarkets.com",https://www.benzinga.com/pressreleases/21/01/b19181755/global-pet-wearables-market-report-2020-size-market-share-application-analysis-regional-outlook-gr,https://j.mp/2XFjUEV
