feed,title,long_url,short_url
SeekingAlpha,API bullish - if confirmed by DOE tomorrow,https://seekingalpha.com/news/3797580,
SeekingAlpha,"NCR Non-GAAP EPS of $0.76 beats by $0.06, revenue of $2.03B misses by $20M",https://seekingalpha.com/news/3797579,
SeekingAlpha,"Mandiant Non-GAAP EPS of -$0.10 beats by $0.03, revenue of $132.89M beats by $1.31M",https://seekingalpha.com/news/3797578,
SeekingAlpha,"Mandiant Non-GAAP EPS of -$0.10 beats by $0.03, revenue of $132.89M beats by $1.31M",https://seekingalpha.com/news/3797577,
SeekingAlpha,Why did Novavax stock drop today? Concerns on COVID-19 vaccine deliveries,https://seekingalpha.com/news/3797576,
