feed,title,long_url,short_url
Investing,Crypto Analyst Shares His Concerns that BTC Seems A Bit “Exhausted”,https://www.investing.com/news/cryptocurrency-news/crypto-analyst-shares-his-concerns-that-btc-seems-a-bit-exhausted-3034493,https://da.gd/Ig2yTK
Investing,Cardano (ADA) Price Prediction: What to Expect in the Next 48 Hours,https://www.investing.com/news/cryptocurrency-news/cardano-ada-price-prediction-what-to-expect-in-the-next-48-hours-3034490,https://da.gd/VAv5pE
Investing,Euro zone regulators back debt hierarchy after write-off in CS bonds,https://www.investing.com/news/stock-market-news/euro-zone-regulators-back-debt-hierarchy-after-writeoff-in-cs-bonds-3034456,https://da.gd/ljGaD
Investing,India stocks lower at close of trade; Nifty 50 down 0.65%,https://www.investing.com/news/stock-market-news/india-stocks-lower-at-close-of-trade-nifty-50-down-065-3034476,https://da.gd/XRvsy
Investing,Banks borrow only token amounts via Fed's dollar swap facility,https://www.investing.com/news/economy/banks-borrow-only-token-amounts-via-feds-dollar-swap-facility-3034495,https://da.gd/B9iVI
Investing,European supervisors say shares should be wiped out before bonds,https://www.investing.com/news/economy/european-supervisors-say-shares-should-be-wiped-out-before-bonds-3034485,https://da.gd/5J6Ye
Investing,Kremlin tells officials to stop using iPhones - Kommersant newspaper,https://www.investing.com/news/economy/kremlin-tells-officials-to-stop-using-iphones--kommersant-newspaper-3034477,https://da.gd/vnk2OQ
