feed,title,long_url,short_url
Benzinga,Global Aluminum Curtain Wall Market Is Projected to Exhibit at A CAGR Of 9.50% Over the Forecast Period; Quince Market Insights,https://benzinga.com/pressreleases/21/12/g24496388/global-aluminum-curtain-wall-market-is-projected-to-exhibit-at-a-cagr-of-9-50-over-the-forecast-pe,
Benzinga,"Incontinence Care Products Market Size [2021-2028] is Projected to Reach USD 24.35 Billion by 2026, Exhibiting a CAGR of 6.9%",https://benzinga.com/pressreleases/21/12/g24496437/incontinence-care-products-market-size-2021-2028-is-projected-to-reach-usd-24-35-billion-by-2026-e,
Benzinga,"The data integration market size to grow from USD 11.6 billion in 2021 to USD 19.6 billion by 2026, at a Compound Annual Growth Rate (CAGR) of 11.0%",https://benzinga.com/pressreleases/21/12/g24496412/the-data-integration-market-size-to-grow-from-usd-11-6-billion-in-2021-to-usd-19-6-billion-by-2026,
Benzinga,"At 5.9% CAGR, Skincare Market Size is Projected to Reach USD 198.13 Bn by 2027, Says Brandessence Market Research",https://benzinga.com/pressreleases/21/12/n24496397/at-5-9-cagr-skincare-market-size-is-projected-to-reach-usd-198-13-bn-by-2027-says-brandessence-mar,
Benzinga,"9.65% CAGR Growth in Microbial Fuel Cell Market |17,000+ Technavio Reports",https://benzinga.com/pressreleases/21/12/n24496391/9-65-cagr-growth-in-microbial-fuel-cell-market-17-000-technavio-reports,
