feed,title,long_url,short_url
Yahoo,Goldman Sachs and Wells Fargo Boost Shareholder Payouts,https://www.wsj.com/articles/goldman-sachs-and-wells-fargo-boost-shareholder-payouts-11656367062?siteid=yhoof2&yptr=yahoo,https://on.wsj.com/3NpezZQ
Yahoo,Alphabet Inc. (GOOG) Dips More Than Broader Markets: What You Should Know,https://finance.yahoo.com/news/alphabet-inc-goog-dips-more-214509054.html?.tsrc=rss,https://yhoo.it/3NjUCU8
Yahoo,Apple (AAPL) Flat As Market Sinks: What You Should Know,https://finance.yahoo.com/news/apple-aapl-flat-market-sinks-214509561.html?.tsrc=rss,https://yhoo.it/3NmWSKd
Yahoo,Alphabet (GOOGL) Dips More Than Broader Markets: What You Should Know,https://finance.yahoo.com/news/alphabet-googl-dips-more-broader-214509217.html?.tsrc=rss,https://yhoo.it/3OqW8Fr
Yahoo,Netflix (NFLX) Dips More Than Broader Markets: What You Should Know,https://finance.yahoo.com/news/netflix-nflx-dips-more-broader-214509833.html?.tsrc=rss,https://yhoo.it/3NkvYTi
