feed,title,long_url,short_url
Investing,White House silent on whether it will return $5.2M in donations from SBF,https://www.investing.com/news/cryptocurrency-news/white-house-silent-on-whether-it-will-return-52m-in-donations-from-sbf-2963837,https://da.gd/RnKG
Investing,Exclusive-Barclays turbocharges 2030 sustainable finance target to $1 trln,https://www.investing.com/news/commodities-news/exclusivebarclays-turbocharges-2030-sustainable-finance-target-to-1-trln-2963839,https://da.gd/OGyY17
Investing,HSBC to stop funding new oil and gas fields,https://www.investing.com/news/stock-market-news/hsbc-to-cut-funding-for-new-oil-and-gas-fields-2963836,https://da.gd/UacY
Investing,Australia stocks higher at close of trade; S&P/ASX 200 up 0.67%,https://www.investing.com/news/stock-market-news/australia-stocks-higher-at-close-of-trade-spasx-200-up-067-2963835,https://da.gd/ZYddYi
Investing,Volkswagen replaces chief designer with Porsche hire - Handelsblatt,https://www.investing.com/news/stock-market-news/volkswagen-replaces-chief-designer-with-porsche-hire--handelsblatt-2963834,https://da.gd/sYAG5
Investing,Japan stocks higher at close of trade; Nikkei 225 up 0.75%,https://www.investing.com/news/stock-market-news/japan-stocks-higher-at-close-of-trade-nikkei-225-up-075-2963824,https://da.gd/8R72
