feed,title,long_url,short_url
ETFTrends:DailyRecap,Financial Pros Still Back ESG,https://www.etftrends.com/esg-channel/financial-pros-still-back-esg/,https://bit.ly/3UBBMvp
ETFTrends:DailyRecap,"Consider Japan, Dividends in ETFs for 2023",https://www.etftrends.com/model-portfolio-channel/consider-japan-dividends-in-etfs-for-2023/,https://bit.ly/3iD5nXV
ETFTrends:DailyRecap,Cerulli White Paper Reveals Direct Indexing Poised for Growth,https://www.etftrends.com/cerulli-white-paper-reveals-direct-indexing-poised-for-growth/,https://bit.ly/3FvpUqz
ETFTrends:DailyRecap,Googling the Alphabet Trade,https://www.etftrends.com/leveraged-inverse-channel/googling-the-alphabet-trade/,https://bit.ly/3FDjZ2N
ETFTrends:DailyRecap,Look to Matthews Active ETFs for Quality in Emerging Markets,https://www.etftrends.com/emerging-markets-channel/look-to-matthews-active-etfs-for-quality-in-emerging-markets/,https://bit.ly/3FrDE5A
ETFTrends:DailyRecap,"Seek Active, Non-Transparent ESG Equities in ESGA",https://www.etftrends.com/core-strategies-channel/seek-active-non-transparent-esg-equities-in-esga/,https://bit.ly/3HlMN0C
ETFTrends:DailyRecap,"Main Management Market Note: December 2, 2022",https://www.etftrends.com/etf-strategist-channel/main-management-market-note-december-2-2022/,https://bit.ly/3H9vm3u
ETFTrends:DailyRecap,Bloomberg: Rosenbluth Discusses Vanguard’s Ascension,https://www.etftrends.com/bloomberg-iq-rosenbluth-discusses-vanguards-ascension/,https://bit.ly/3H7OcYO
ETFTrends:DailyRecap,Turn to Real Assets While Inflation Persists,https://www.etftrends.com/free-cash-flow-channel/turn-to-real-assets-while-inflation-persists/,https://bit.ly/3Fq7dnX
ETFTrends:DailyRecap,Dave Nadig Talks Repositioning on CNBC’s ETF Edge,https://www.etftrends.com/nadig-talks-repositioning-on-cnbcs-etf-edge/,https://bit.ly/3F4r22S
ETFTrends:DailyRecap,Midstream/MLPs: Can the Tailwinds Continue into 2023?,https://www.etftrends.com/energy-infrastructure-channel/midstream-mlps-can-the-tailwinds-continue-into-2023/,https://bit.ly/3F3ap7O
ETFTrends:DailyRecap,3 ETFs in “Oversold” Territory to Start the Week,https://www.etftrends.com/china-insights-channel/3-etfs-in-oversold-territory-to-start-the-week/,https://bit.ly/3F6a7Nc
ETFTrends:DailyRecap,Fixed Income Offers Opportunities Not Seen in Over a Decade,https://www.etftrends.com/fixed-income-channel/fixed-income-offers-opportunities-not-seen-in-over-a-decade/,https://bit.ly/3FvQu2Q
ETFTrends:DailyRecap,Target Equities Responsibly During a Volatile January,https://www.etftrends.com/active-etf-channel/target-equities-responsibly-during-a-volatile-january/,https://bit.ly/3H9vlfW
ETFTrends:DailyRecap,RSP Saw $1.4 Billion in November Flows as Methodology Outperforms,https://www.etftrends.com/portfolio-strategies-channel/rsp-sees-1-4-billion-in-november-flows-as-methodology-outperforms/,https://bit.ly/3F4QFR1
ETFTrends:DailyRecap,"TAN Jumps 17% Last Month, Remains Top ETF by 5-Year Returns",https://www.etftrends.com/innovative-etfs-channel/tan-jumps-17-last-month-remains-top-etf-by-5-year-returns/,https://bit.ly/3VReouF
ETFTrends:DailyRecap,EQL and OUSM Lead in November Flows Across ALPS’ ETFs,https://www.etftrends.com/etf-building-blocks-channel/eql-and-ousm-lead-in-november-flows-across-alps-etfs/,https://bit.ly/3P58VON
ETFTrends:DailyRecap,Southeast Asia Offers Growth Exposure for 2023,https://www.etftrends.com/thematic-investing-channel/southeast-asia-offers-growth-exposure-for-2023/,https://bit.ly/3P0DVzB
ETFTrends:DailyRecap,Wall Street Banks See More Weakness in S&P 500 Next Year,https://www.etftrends.com/leveraged-inverse-channel/wall-street-banks-see-more-weakness-in-sp-500-next-year/,https://bit.ly/3P6TgOX
ETFTrends:DailyRecap,"Bitcoin Sees Minor Price Recovery, but No Bottom in Sight Yet",https://www.etftrends.com/crypto-channel/bitcoin-sees-minor-price-recovery-but-no-bottom-in-sight-yet/,https://bit.ly/3itXOmg
ETFTrends:DailyRecap,Smooth Out Volatility in 2023 With DBMF,https://www.etftrends.com/managed-futures-channel/smooth-out-volatility-in-2023-with-dbmf/,https://bit.ly/3F7nEEr
ETFTrends:DailyRecap,Losing Fear of Inflation Is Crucial for 2023 and Beyond,https://www.etftrends.com/retirement-income-channel/losing-fear-of-inflation-is-crucial-for-2023-and-beyond/,https://bit.ly/3F4t4zV
ETFTrends:DailyRecap,Meet an Advisor: John Davi of Astoria Advisors,https://www.etftrends.com/exchange-an-etf-experience/meet-an-advisor-john-davi-of-astoria-advisors/,https://bit.ly/3P6N6P4
ETFTrends:DailyRecap,China on Blistering Pace of Meeting Clean Energy Adoption Goals — KGRN Invests,https://www.etftrends.com/climate-insights-channel/china-on-blistering-pace-of-meeting-clean-energy-adoption-goals-kgrn-invests/,https://bit.ly/3P2iYUK
ETFTrends:DailyRecap,Blockchain Gaming Proving Resilient Among Crypto Calamity,https://www.etftrends.com/crypto-channel/blockchain-gaming-proving-resilient-among-crypto-calamity/,https://bit.ly/3itXRhW
ETFTrends:DailyRecap,Tech Tailwinds Could Reappear for QQQ in 2023,https://www.etftrends.com/etf-education-channel/tech-tailwinds-could-reappear-for-qqq-in-2023/,https://bit.ly/3F7nGfx
ETFTrends:DailyRecap,VNM Could Be Compelling 2023 International Opportunity,https://www.etftrends.com/tactical-allocation-channel/vnm-could-be-compelling-2023-international-opportunity/,https://bit.ly/3F7Jsjn
ETFTrends:DailyRecap,Go International to Diversify Your Dividends in ETF LVHI,https://www.etftrends.com/volatility-resource-channel/go-international-to-diversify-your-dividends-in-etf-lvhi/,https://bit.ly/3iuaxp0
ETFTrends:DailyRecap,What Changed in Top Momentum ETF MTUM in Late 2022,https://www.etftrends.com/what-changed-in-top-momentum-etf-mtum-in-late-2022/,https://bit.ly/3VW0gQP
