feed,title,long_url,short_url
Benzinga,"Switchback Energy Acquisition Corporation Adjourns Special Meeting of Stockholders to February 25, 2021 to Allow Stockholders More Time to Vote",https://www.benzinga.com/pressreleases/21/02/g19620155/switchback-energy-acquisition-corporation-adjourns-special-meeting-of-stockholders-to-february-25-,https://j.mp/2Z9iFi0
Benzinga,Insights on the Freight Transport Management Global Market to 2026 - North America is Expected to Hold a Major Share - ResearchAndMarkets.com,https://www.benzinga.com/pressreleases/21/02/b19620149/insights-on-the-freight-transport-management-global-market-to-2026-north-america-is-expected-to-ho,https://j.mp/3aW232D
Benzinga,IIROC Trading Halt - AIME.P,https://www.benzinga.com/pressreleases/21/02/n19620145/iiroc-trading-halt-aime-p,https://j.mp/3qbkg2I
Benzinga,Alectra Completes Private Placement Offering of $300 Million Aggregate Principal Amount of 1.751% Series 2021-1 Senior Unsecured Debentures Due 2031,https://www.benzinga.com/pressreleases/21/02/n19620141/alectra-completes-private-placement-offering-of-300-million-aggregate-principal-amount-of-1-751-se,https://j.mp/2NgcJkD
Benzinga,"Alto Adds Several Prominent Crypto Fund Managers to its Platform, Continues to Expand Access to Alternative Asset Investing via IRA",https://www.benzinga.com/pressreleases/21/02/g19620123/alto-adds-several-prominent-crypto-fund-managers-to-its-platform-continues-to-expand-access-to-alt,https://j.mp/3tJRJDD
Benzinga,Barrett-Jackson to Auction 2022 Cadillac CT5-V Blackwing VIN 001 and CT4-V Blackwing VIN 001 for Charity During Scottsdale Auction,https://www.benzinga.com/pressreleases/21/02/b19620095/barrett-jackson-to-auction-2022-cadillac-ct5-v-blackwing-vin-001-and-ct4-v-blackwing-vin-001-for-c,https://j.mp/2MOyzfe
Benzinga,RedHawk Agrees to Purchase Med Tech Farms LLC,https://www.benzinga.com/pressreleases/21/02/n19620094/redhawk-agrees-to-purchase-med-tech-farms-llc,https://j.mp/3aSDHqE
