feed,title,long_url,short_url
SeekingAlpha,"Expedia EPS misses by $0.73, misses on revenue",https://seekingalpha.com/news/3661384,
SeekingAlpha,"Limelight Networks EPS misses by $0.05, misses on revenue",https://seekingalpha.com/news/3661383,
SeekingAlpha,"DexCom EPS misses by $0.01, beats on revenue",https://seekingalpha.com/news/3661382,
SeekingAlpha,Dow closes flat as Bitcoin surges to all-time high,https://seekingalpha.com/news/3661378,
SeekingAlpha,"Orbital becoming 'market leader in solar farm construction,' B. Riley says",https://seekingalpha.com/news/3661385,
