feed,title,long_url,short_url
Nasdaq,Turkish cenbank holds rates at 19% under Erdogan's new chief,https://www.nasdaq.com/articles/turkish-cenbank-holds-rates-at-19-under-erdogans-new-chief-2021-04-15,https://j.mp/3acUXah
Nasdaq,3 Reasons I Just Bought Snap,https://www.nasdaq.com/articles/3-reasons-i-just-bought-snap-2021-04-15,https://j.mp/3slm6yj
Nasdaq,Thermo Fisher to buy PPD in $21 billion deal,https://www.nasdaq.com/articles/thermo-fisher-to-buy-ppd-in-%2421-billion-deal-2021-04-15,https://j.mp/3smnHUv
Nasdaq,Barrick's first-quarter gold output falls nearly 9%,https://www.nasdaq.com/articles/barricks-first-quarter-gold-output-falls-nearly-9-2021-04-15,https://j.mp/2RtkCoG
Nasdaq,"US STOCKS-Futures rise on solid corporate results, jobless claims data awaited",https://www.nasdaq.com/articles/us-stocks-futures-rise-on-solid-corporate-results-jobless-claims-data-awaited-2021-04-15,https://j.mp/3wZZJSe
Nasdaq,Shopping for a Home? Be Ready to Make an Earnest Money Deposit,https://www.nasdaq.com/articles/shopping-for-a-home-be-ready-to-make-an-earnest-money-deposit-2021-04-15,https://j.mp/3e9llmV
Nasdaq,INSIGHT- Tensions rise within Biden administration as migrant kids crowd shelters,https://www.nasdaq.com/articles/insight-tensions-rise-within-biden-administration-as-migrant-kids-crowd-shelters-2021-04,https://j.mp/2Q30UQg
Nasdaq,ANALYSIS-Stagflation-lite looms for Brazil,https://www.nasdaq.com/articles/analysis-stagflation-lite-looms-for-brazil-2021-04-15,https://j.mp/3tlUkTw
