feed,title,long_url,short_url
Benzinga,A Bearish Sign Appears On United Rentals's Chart,https://benzinga.com/markets/23/06/32817721/a-bearish-sign-appears-on-united-rentalss-chart,https://da.gd/FqM1
Benzinga,A Bearish Sign Appears On Thermo Fisher Scientific's Chart,https://benzinga.com/markets/23/06/32817711/a-bearish-sign-appears-on-thermo-fisher-scientifics-chart,https://da.gd/gaxq
Benzinga,A Bullish Sign Appears On Brookfield Infr Partners's Chart,https://benzinga.com/markets/23/06/32817703/a-bullish-sign-appears-on-brookfield-infr-partnerss-chart,https://da.gd/Xms2t
Benzinga,Golden Cross Appears Before AvalonBay Communities Investors,https://benzinga.com/markets/23/06/32817697/golden-cross-appears-before-avalonbay-communities-investors,https://da.gd/QRnh
Benzinga,Ominous Death Cross Forms On Zebra Technologies's Chart,https://benzinga.com/markets/23/06/32817687/ominous-death-cross-forms-on-zebra-technologiess-chart,https://da.gd/z72c
Benzinga,Will Chart Analysts Notice Bad Omen on Willis Towers Watson's Chart,https://benzinga.com/markets/23/06/32817682/will-chart-analysts-notice-bad-omen-on-willis-towers-watsons-chart,https://da.gd/kk0OO
Benzinga,A Bearish Sign Appears On Steel Dynamics's Chart,https://benzinga.com/markets/23/06/32817670/a-bearish-sign-appears-on-steel-dynamicss-chart,https://da.gd/vNTOn
Benzinga,Hopeful Golden Cross Forms On Datadog's Chart,https://benzinga.com/markets/23/06/32817620/hopeful-golden-cross-forms-on-datadogs-chart,https://da.gd/j29oIb
