feed,title,long_url,short_url
InvestorPlace,3 Cryptos With Major Catalysts Coming in June 2023,https://investorplace.com/2023/06/3-cryptos-with-major-catalysts-coming-in-june-2023/,https://da.gd/aGgQ65
InvestorPlace,3 Stocks to Buy for Easy Exposure to AI,https://investorplace.com/2023/06/3-stocks-to-buy-for-easy-exposure-to-ai/,https://da.gd/Dcyn
InvestorPlace,"Dear RIVN Stock Holders, Mark Your Calendars for June 20",https://investorplace.com/2023/06/dear-rivn-stock-holders-mark-your-calendars-for-june-20/,https://da.gd/DQgkIw
InvestorPlace,"Dear SOFI Stock Fans, Mark Your Calendars for June 30",https://investorplace.com/2023/06/dear-sofi-stock-fans-mark-your-calendars-for-june-30/,https://da.gd/SMrKgO
InvestorPlace,Why Li Auto May Be the True Contender in China’s EV Market,https://investorplace.com/2023/06/why-li-auto-may-be-the-true-contender-in-chinas-ev-market/,https://da.gd/ifJSUj
InvestorPlace,Why Is Ballard Power (BLDP) Stock Up 13% Today?,https://investorplace.com/2023/06/why-is-ballard-power-bldp-stock-up-13-today/,https://da.gd/1I6D
InvestorPlace,Stability Meets Growth: 3 Undervalued Blue-Chip Stock Picks,https://investorplace.com/2023/06/stability-meets-growth-3-undervalued-blue-chip-stock-picks/,https://da.gd/gOhpiL
InvestorPlace,"Dear PLUG Stock Fans, Mark Your Calendars for June 14",https://investorplace.com/2023/06/dear-plug-stock-fans-mark-your-calendars-for-june-14/,https://da.gd/xei0zt
InvestorPlace,FUV Stock Alert: Why Is Arcimoto Falling Today?,https://investorplace.com/2023/06/fuv-stock-alert-why-is-arcimoto-falling-today/,https://da.gd/7Pnmtb
