feed,title,long_url,short_url
Investing,​​Crypto fund outflows reach $417M over 8 weeks as investor caution persists,https://www.investing.com/news/cryptocurrency-news/crypto-fund-outflows-reach-417m-over-8-weeks-as-investor-caution-persists-3103576,https://da.gd/rUsuyR
Investing,Oracle beats quarterly revenue estimates,https://www.investing.com/news/stock-market-news/oracle-beats-quarterly-revenue-estimates-3103605,https://da.gd/5nQC
Investing,US Senate leaders unveil $107B aviation policy bill,https://www.investing.com/news/stock-market-news/us-senate-leaders-unveil-107b-aviation-policy-bill-3103603,https://da.gd/9Hx36l
Investing,Stock market today: Dow closes higher on strength in tech ahead of Fed meeting,https://www.investing.com/news/stock-market-news/stock-market-today-dow-closes-higher-on-strength-in-tech-ahead-of-fed-meeting-3103601,https://da.gd/V5EszK
Investing,"Oracle earnings beat by $0.09, revenue topped estimates",https://www.investing.com/news/stock-market-news/oracle-earnings-beat-by-009-revenue-topped-estimates-3103595,https://da.gd/2b1u
