feed,title,long_url,short_url
Investing,Trump says the U.S. and Iran getting along very well,https://www.investing.com/news/commodities-news/trump-says-the-us-and-iran-getting-along-very-well-4770551,
Investing,Top insider buys and sells disclosed for Tuesday,https://www.investing.com/news/stock-market-news/top-insider-buys-and-sells-disclosed-for-tuesday-93CH-4770561,
Investing,"Meta to sell excess AI computing capacity via cloud business, Bloomberg News reports",https://www.investing.com/news/stock-market-news/meta-to-sell-excess-ai-computing-capacity-via-cloud-business-bloomberg-news-reports-4770550,
Investing,BofA Names Top 10 U.S. Stock Ideas Across Sectors,https://www.investing.com/news/stock-market-news/bofa-names-top-10-us-stock-ideas-across-sectors-93CH-4770555,
Investing,Nebius stock plummets as Meta plans cloud computing business,https://www.investing.com/news/stock-market-news/nebius-stock-plummets-as-meta-plans-cloud-computing-business-93CH-4770548,
Investing,CoreWeave and Nebius shares fall on Meta cloud report,https://www.investing.com/news/stock-market-news/coreweave-and-nebius-shares-fall-on-meta-cloud-report-93CH-4770539,
Investing,Trump on financial disclosures: Everyone’s profiting because stock market is up,https://www.investing.com/news/economy-news/trump-on-financial-disclosures-everyones-profiting-because-stock-market-is-up-4770557,
