feed,title,long_url,short_url
SeekingAlpha,Moderna says Noubar Afeya sells 15K shares in the company,https://seekingalpha.com/news/4019149,
SeekingAlpha,"Apollo Global Management, Blue Owl cut to Perform at Oppenheimer on valuation",https://seekingalpha.com/news/4019148,
SeekingAlpha,Nuvalent chief medical officer discloses sale of over 7K shares,https://seekingalpha.com/news/4019147,
SeekingAlpha,Exxon's top shale executive arrested on sexual assault charge in Texas,https://seekingalpha.com/news/4019146,
SeekingAlpha,EV Company News For The Month Of September 2023,https://seekingalpha.com/article/4639718,
