feed,title,long_url,short_url
InsiderMonkey,Public Storage’s (PSA) Strong Dividend History Makes it a Key Retirement Dividend Stock,https://insidermonkey.com/blog/--1581347,
InsiderMonkey,Retirement Dividend Stocks Spotlight: How Emerson Electric (EMR) Provides Consistent Payouts,https://insidermonkey.com/blog/--1581345,
InsiderMonkey,Aflac (AFL): A Reliable Retirement Dividend Stock for Steady Income,https://insidermonkey.com/blog/--1581344,
InsiderMonkey,12 Unstoppable Artificial Intelligence (AI) Stocks to Buy Right Now,https://insidermonkey.com/blog/--1580850,
InsiderMonkey,Cheniere Energy Partners (CQP) Gains Amid a Bullish Outlook for American LNG,https://insidermonkey.com/blog/--1581291,
InsiderMonkey,Venture Global (VG) Gains Following Progress on New LNG Project,https://insidermonkey.com/blog/--1581288,
InsiderMonkey,10 Best Low Cost Stocks To Buy Under $50,https://insidermonkey.com/blog/--1579576,
InsiderMonkey,Here is Why Expand Energy (EXE) Gained This Week,https://insidermonkey.com/blog/--1581289,
InsiderMonkey,Constellation Energy Corporation (CEG) Gains Following FERC Approval on Calpine Deal,https://insidermonkey.com/blog/--1581290,
InsiderMonkey,Vistra Corp. (VST): Among the Energy Stocks that Gained This Week,https://insidermonkey.com/blog/--1581287,
InsiderMonkey,TechnipFMC (FTI) Soars Following Impressive Q2 Results,https://insidermonkey.com/blog/--1581321,
InsiderMonkey,Here is Why OKLO Soared This Week,https://insidermonkey.com/blog/--1581322,
InsiderMonkey,Solaris Energy (SEI) Gains Following a Strong Q2 Performance,https://insidermonkey.com/blog/--1581323,
InsiderMonkey,Here is Why Ranger Energy (RNGR) Soared This Week,https://insidermonkey.com/blog/--1581324,
InsiderMonkey,Expro Group Holdings (XPRO) Skyrockets Following an Impressive Q2 Performance,https://insidermonkey.com/blog/--1581325,
InsiderMonkey,13 Best Major Stocks to Invest in Now,https://insidermonkey.com/blog/--1579985,
InsiderMonkey,Eaton and ChargePoint Establish Industry-First EV Charging Partnership,https://insidermonkey.com/blog/--1579656,
InsiderMonkey,10 Stocks Crushing With Whopping Double-Digit Gains,https://insidermonkey.com/blog/--1581270,
InsiderMonkey,Why These Energy Stocks are Gaining This Week,https://insidermonkey.com/blog/--1580002,
