feed,title,long_url,short_url
InsiderMonkey,Headwaters Capital Management’s Top Contributor: Climb Global (CLMB),https://insidermonkey.com/blog/--1425033,
InsiderMonkey,Headwaters Capital Management’s Q4 2024 Investor Letter,https://insidermonkey.com/blog/--1424996,
InsiderMonkey,Coinbase Global (COIN) Rebounded Strongly in Q4,https://insidermonkey.com/blog/--1425071,
InsiderMonkey,12 Cheapest Stocks with Biggest Upside Potential,https://insidermonkey.com/blog/--1424837,
InsiderMonkey,Peloton Interactive (PTON) Climbed 85.8% in Q4,https://insidermonkey.com/blog/--1424968,
InsiderMonkey,Several Setbacks Dragged CVS Health Corp. (CVS) in Q4,https://insidermonkey.com/blog/--1424991,
InsiderMonkey,Here’s Why IAC (IAC) Slid in Q4,https://insidermonkey.com/blog/--1424983,
InsiderMonkey,Crocs (CROX) Slide due to Heydudes’ Struggle to Gain Traction,https://insidermonkey.com/blog/--1424975,
InsiderMonkey,Torram’s Pre-Seed Closure Paves the Way for Institutional-Grade DeFi on Bitcoin,https://insidermonkey.com/blog/--1425047,
InsiderMonkey,Reddio Launches Public Testnet: A New Era of Parallel EVM Powering Autonomous AI,https://insidermonkey.com/blog/--1425038,
