feed,title,long_url,short_url
SeekingAlpha,Gap is downgraded at Wells Fargo after CEO exit,https://seekingalpha.com/news/3855950,
SeekingAlpha,Xos nabs purchase order for 10 Stepvans from Zeem Solutions,https://seekingalpha.com/news/3855949,
SeekingAlpha,"Destiny Media Technologies GAAP EPS of $0.00, revenue of $0.99M",https://seekingalpha.com/news/3855948,
SeekingAlpha,"Apple lowering trade-in prices, implies 'strong demand,' BofA says",https://seekingalpha.com/news/3855947,
SeekingAlpha,"AngioDynamics Non-GAAP EPS of $0.01 in-line, revenue of $87M beats by $4.09M",https://seekingalpha.com/news/3855946,
SeekingAlpha,XPO Logistics names planned spin-off company as RXO,https://seekingalpha.com/news/3855945,
