feed,title,long_url,short_url
SeekingAlpha,Toll Brothers cut to Underperform at BofA amid rising interest rates; earnings peak in 2022?,https://seekingalpha.com/news/3792511,
SeekingAlpha,"First Mid Bancshares Non-GAAP EPS of $0.94 misses by $0.01, revenue of $60.87M",https://seekingalpha.com/news/3792512,
SeekingAlpha,Korea's largest IPO closes up 40% as leading battery supplier goes public,https://seekingalpha.com/news/3792510,
SeekingAlpha,Nanalysis Scientific upsizes offering to C$10.75M,https://seekingalpha.com/news/3792509,
SeekingAlpha,"Carter Bank & Trust  GAAP EPS of $0.21, revenue of $33.83M",https://seekingalpha.com/news/3792508,
SeekingAlpha,"HomeTrust Bancshares GAAP EPS of $0.68 beats by $0.12, revenue of $37.35M in-line",https://seekingalpha.com/news/3792507,
SeekingAlpha,"HarborOne GAAP EPS of $1.14 beats by $0.92, revenue of $53.15M beats by $20.6M",https://seekingalpha.com/news/3792506,
