feed,title,long_url,short_url
SeekingAlpha,"CBTX GAAP EPS of -$0.02 misses by $0.26, revenue of $34.91M beats by $0.54M",https://seekingalpha.com/news/3792693,
SeekingAlpha,Why did Lucid Group stock plunge today? EV stocks are losing their growth premiums,https://seekingalpha.com/news/3792692,
SeekingAlpha,"Western Digital Non-GAAP EPS of $2.30 beats by $0.18, revenue of $4.83B beats by $10M",https://seekingalpha.com/news/3792691,
SeekingAlpha,Penn National Gaming gets nod to offer online sports betting in Louisiana,https://seekingalpha.com/news/3792690,
SeekingAlpha,"Clearfield GAAP EPS of $0.75, revenue of $51.1M",https://seekingalpha.com/news/3792689,
