feed,title,long_url,short_url
SeekingAlpha,Apple soars after Q1 earnings top estimates,https://seekingalpha.com/news/3792536,
SeekingAlpha,"South Plains Financial GAAP EPS of $0.79 beats by $0.12, revenue of $54.38M beats by $0.43M",https://seekingalpha.com/news/3792778,
SeekingAlpha,"Glacier Bancorp GAAP EPS of $0.46 beats by $0.03, revenue of $221.98M misses by $6.91M",https://seekingalpha.com/news/3792776,
SeekingAlpha,Clearfield reinstates and expands share repurchase program to $22M,https://seekingalpha.com/news/3792777,
SeekingAlpha,Mitek Systems' Monopoly Status Will Allow It To Exert Pricing Power,https://seekingalpha.com/article/4482241,
