feed,title,long_url,short_url
InvestorPlace,Nelson Peltz Just Gave Up on Disney (DIS) Stock,https://investorplace.com/2024/05/nelson-peltz-just-gave-up-on-disney-dis-stock/,https://da.gd/ll7mU
InvestorPlace,3 Sorry Insurance Stocks to Sell in May While You Still Can,https://investorplace.com/2024/05/3-sorry-insurance-stocks-to-sell-in-may-while-you-still-can/,https://da.gd/vG2gV
InvestorPlace,Why Is UiPath (PATH) Stock Down 30% Today?,https://investorplace.com/2024/05/why-is-uipath-path-stock-down-30-today/,https://da.gd/m2B6bF
InvestorPlace,TKC Stock Earnings: Turkcell Iletisim Reported Results for Q1 2024,https://investorplace.com/earning-results/2024/05/tkc-stock-earnings-turkcell-iletisim-for-q1-of-2024/,https://da.gd/EOrLv
InvestorPlace,Why Is NovaBay Pharmaceuticals (NBY) Stock Down 39% Today?,https://investorplace.com/2024/05/why-is-novabay-pharmaceuticals-nby-stock-down-39-today/,https://da.gd/tcfu0x
