feed,title,long_url,short_url
Investing,UK’s Segro rebuffs Prologis’ third takeover bid,https://www.investing.com/news/stock-market-news/uks-segro-rebuffs-prologis-third-takeover-bid-4799858,
Investing,ChinaSoft International shares jump after Moonshot AI partnership,https://www.investing.com/news/stock-market-news/chinasoft-international-shares-jump-after-moonshot-ai-partnership-4799854,
Investing,Why is Alibaba stock surging today?,https://www.investing.com/news/stock-market-news/why-is-alibaba-stock-surging-today-93CH-4799850,
Investing,Croma Security reports 15% revenue growth on acquisitions,https://www.investing.com/news/stock-market-news/croma-security-reports-15-revenue-growth-on-acquisitions-93CH-4799846,
Investing,AKVA reports Q2 revenue growth with EBIT rising 25%,https://www.investing.com/news/stock-market-news/akva-reports-q2-revenue-growth-with-ebit-rising-25-93CH-4799842,
