feed,title,long_url,short_url
Investing,Why is Chipotle Mexican Grill stock sliding today?,https://www.investing.com/news/stock-market-news/why-is-chipotle-mexican-grill-stock-sliding-today-93CH-4801423,
Investing,U.K. stocks lower at close of trade; Investing.com United Kingdom 100 down 0.73%,https://www.investing.com/news/stock-market-news/uk-stocks-lower-at-close-of-trade-investingcom-united-kingdom-100-down-073-4801421,
Investing,Spain stocks lower at close of trade; IBEX 35 down 0.05%,https://www.investing.com/news/stock-market-news/spain-stocks-lower-at-close-of-trade-ibex-35-down-005-4801420,
Investing,Portugal stocks higher at close of trade; PSI up 0.09%,https://www.investing.com/news/stock-market-news/portugal-stocks-higher-at-close-of-trade-psi-up-009-4801419,
Investing,Netherlands stocks lower at close of trade; AEX down 0.13%,https://www.investing.com/news/stock-market-news/netherlands-stocks-lower-at-close-of-trade-aex-down-013-4801417,
Investing,Italy stocks lower at close of trade; Investing.com Italy 40 down 0.16%,https://www.investing.com/news/stock-market-news/italy-stocks-lower-at-close-of-trade-investingcom-italy-40-down-016-4801416,
Investing,Germany stocks mixed at close of trade; DAX up 0.12%,https://www.investing.com/news/stock-market-news/germany-stocks-mixed-at-close-of-trade-dax-up-012-4801415,
Investing,France stocks mixed at close of trade; CAC 40 up 0.02%,https://www.investing.com/news/stock-market-news/france-stocks-mixed-at-close-of-trade-cac-40-up-002-4801414,
Investing,Belgium stocks lower at close of trade; BEL 20 down 0.20%,https://www.investing.com/news/stock-market-news/belgium-stocks-lower-at-close-of-trade-bel-20-down-020-4801413,
Investing,"Private investors must pile cash into defence to fill public funding gap, executives say",https://www.investing.com/news/stock-market-news/private-investors-must-pile-cash-into-defence-to-fill-public-funding-gap-executives-say-4801411,
