feed,title,long_url,short_url
InsiderMonkey,Jim Cramer on Bloom Energy: “All the Data Centers Are Going Crazy for It”,https://insidermonkey.com/blog/--1761115,
InsiderMonkey,Jim Cramer on ASML: “Let’s Just Hope for a Down Day and Get In”,https://insidermonkey.com/blog/--1761124,
InsiderMonkey,Jim Cramer Considers Steel Dynamics a “Great Company”,https://insidermonkey.com/blog/--1761127,
InsiderMonkey,Jim Cramer on Digi Power X: “I Have to Say Pass”,https://insidermonkey.com/blog/--1761133,
InsiderMonkey,Jim Cramer on Element Solutions: “I Gave the Stock My Enthusiastic Endorsement”,https://insidermonkey.com/blog/--1761140,
InsiderMonkey,Jim Cramer on Affirm: “This Is Now a Very Profitable Business”,https://insidermonkey.com/blog/--1761153,
InsiderMonkey,Jim Cramer on Waste Management: “Let Me Do Some Work About Who’s Driving the Stock Lower”,https://insidermonkey.com/blog/--1761156,
InsiderMonkey,Jim Cramer Says “Valero Will Print Money for You”,https://insidermonkey.com/blog/--1761160,
InsiderMonkey,Jim Cramer on United Parcel: “I Don’t Buy Stocks for Yield. I Buy Stocks for Growth”,https://insidermonkey.com/blog/--1761162,
InsiderMonkey,Jim Cramer Highlights Applied Materials and the Shortage of Semiconductor Equipment,https://insidermonkey.com/blog/--1761164,
InsiderMonkey,Jim Cramer Calls Figma an “Eclectic Design Distributor That’s Made Life Difficult for Adobe”,https://insidermonkey.com/blog/--1761169,
InsiderMonkey,Jim Cramer on Cisco: “The Future Is Bright for the Data Center Part of the Business”,https://insidermonkey.com/blog/--1761171,
InsiderMonkey,Jim Cramer Calls NVIDIA’s Investment in Nebius a “Big Deal”,https://insidermonkey.com/blog/--1761178,
InsiderMonkey,Jim Cramer on Under Armour: “I Think the Turnaround Is Here”,https://insidermonkey.com/blog/--1761188,
InsiderMonkey,Jim Cramer on On Holding: “Very Quick Management Turnover There Without a Lot of Explanation”,https://insidermonkey.com/blog/--1761191,
InsiderMonkey,Jim Cramer Discusses Venture Global’s Pullback,https://insidermonkey.com/blog/--1761194,
InsiderMonkey,Jim Cramer Calls Qnity an “Unheralded Semiconductor Play”,https://insidermonkey.com/blog/--1761197,
InsiderMonkey,"Jim Cramer on Constellation Energy: “The Earnings Have Been Fine, It’s the Zeitgeist That Matters There”",https://insidermonkey.com/blog/--1761201,
InsiderMonkey,Jim Cramer on Restaurant Brands: “They Reported a Pretty Solid Quarter”,https://insidermonkey.com/blog/--1761145,
