feed,title,long_url,short_url
Investing,Disney Valuation Looks Cheap as Streaming Turns Profitable and Parks Hold Up,https://www.investing.com/analysis/disney-valuation-looks-cheap-as-streaming-turns-profitable-and-parks-hold-up-200674794,
Investing,Spotify Record Earnings: Why Wall Street Says the Stock Could Double,https://www.investing.com/analysis/spotify-record-earnings-why-wall-street-says-the-stock-could-double-200674795,
Investing,White House says Trump plans to formalize regulatory rollback on greenhouse gases,https://www.investing.com/news/commodities-news/white-house-says-trump-plans-to-formalize-regulatory-rollback-on-greenhouse-gases-4497738,
Investing,QVC Group stock tumbles after report of potential bankruptcy filing,https://www.investing.com/news/stock-market-news/qvc-group-stock-tumbles-after-report-of-potential-bankruptcy-filing-93CH-4497745,
Investing,Uptrend Holdings Files for upsized 3.75M Share IPO at $4-$5/sh,https://www.investing.com/news/stock-market-news/uptrend-holdings-files-for-upsized-375m-share-ipo-at-45sh-432SI-4497726,
Investing,"Tesla director Kimbal Musk linked to women through Epstein, emails show",https://www.investing.com/news/economy-news/tesla-director-kimbal-musk-linked-to-women-through-epstein-emails-show-93CH-4497729,
