feed,title,long_url,short_url
Yahoo,"Geoffrey Hinton, Ex-OpenAI Insiders, And Top AI Experts Sound Alarm On OpenAI's Restructuring: Warn It Could Strip Public Of Oversight, Betray AGI Mission",https://finance.yahoo.com/news/geoffrey-hinton-ex-openai-insiders-182524598.html,https://da.gd/gsowx
Yahoo,Instagram co-founder reveals shocking truth about Mark Zuckerberg,https://finance.yahoo.com/news/instagram-co-founder-reveals-shocking-183300171.html,https://da.gd/e8InF
Yahoo,Covenant Logistics predicts ‘delay’ in improved freight market,https://finance.yahoo.com/news/covenant-logistics-predicts-delay-improved-193345993.html,https://da.gd/9rqV3i
Yahoo,Oil Sees Moderate Pickup as Oversupply Concerns Linger,https://www.wsj.com/finance/commodities-futures/oil-consolidates-as-traders-assess-mixed-signals-fdd18437?siteid=yhoof2&yptr=yahoo,https://da.gd/kKVdZ
Yahoo,Airbus Executive: Tariffs Could Unravel Aerospace Supply Chain’s Post-Covid Recovery,https://www.wsj.com/livecoverage/stock-market-trump-tariffs-trade-war-04-24-25/card/airbus-executive-tariffs-could-unravel-aerospace-supply-chain-s-post-covid-recovery-X910sIRPhCdXJhGw8ehk?siteid=yhoof2&yptr=yahoo,https://da.gd/t5Rez
Yahoo,Elon Musk's Wealth Skyrockets By Billions As Tesla Stock Rallies After Billionaire CEO Steps Back From DOGE,https://finance.yahoo.com/news/elon-musks-wealth-skyrockets-billions-183924683.html,https://da.gd/PA7f
