feed,title,long_url,short_url
Investing,AstraZeneca Beats Expectations in Q3,https://www.investing.com/analysis/astrazeneca-beats-expectations-in-q3-200669734,
Investing,S&P 500 E-Mini: Stocks Bounce Off Support Levels in the Longer Term Bull Trend,https://www.investing.com/analysis/sp-500-emini-stocks-bounce-off-support-levels-in-the-longer-term-bull-trend-200669733,
Investing,ITV delivers solid Q3 performance despite challenging ad market,https://www.investing.com/news/stock-market-news/itv-delivers-solid-q3-performance-despite-challenging-ad-market-93CH-4336613,
Investing,We told you first: These AI-picked stocks are up 20%+ in the first few days of Nov,https://www.investing.com/news/stock-market-news/we-told-you-first-these-aipicked-stocks-are-up-20-in-the-first-few-days-of-nov-4336544,
Investing,"UK construction activity falls to lowest since 2020 as civil work plummets, PMI shows",https://www.investing.com/news/economic-indicators/uk-construction-activity-falls-to-lowest-since-2020-as-civil-work-plummets-pmi-shows-4336630,
Investing,"Germany facing rising financial stability risk, Bundesbank warns",https://www.investing.com/news/economy-news/germany-facing-rising-financial-stability-risk-bundesbank-warns-4336611,
Investing,"ECB comfortable with rates; sees only temporary inflation undershoot, VP says",https://www.investing.com/news/economy-news/ecb-comfortable-with-rates-sees-only-temporary-inflation-undershoot-vp-says-4336610,
Investing,"Norges Bank holds policy rate at 4.0%, signals no rush to cut",https://www.investing.com/news/economy-news/norges-bank-holds-policy-rate-at-40-signals-no-rush-to-cut-93CH-4336555,
