feed,title,long_url,short_url
Motley,What Is One of the Best AI Stocks to Buy Before the Next Market Rally?,https://www.fool.com/investing/2025/11/06/what-is-one-of-the-best-ai-stocks-to-buy-before/?source=iedfolrf0000001,
Motley,Massive News for Alphabet Stock Investors!,https://www.fool.com/investing/2025/11/06/massive-news-for-alphabet-stock-investors/?source=iedfolrf0000001,
Motley,Is This the Beginning of a Stock Market Sell-Off?,https://www.fool.com/investing/2025/11/06/is-this-the-beginning-of-a-stock-market-sell-off/?source=iedfolrf0000001,
Motley,3 Risks Investors Should Know Before Buying Interactive Brokers Stock,https://www.fool.com/investing/2025/11/06/3-risks-investors-should-know-before-buying-intera/?source=iedfolrf0000001,
Motley,Is This Texas-Based Company a No-Brainer Buy for Energy Investors?,https://www.fool.com/investing/2025/11/06/is-this-texas-based-company-a-no-brainer-buy-xom/?source=iedfolrf0000001,
