feed,title,long_url,short_url
Benzinga,"Sentient Energy® Acquires Key Assets of Varentec® to Give Utilities Comprehensive Visibility, Analytics, and Control to the Distribution Grid Edge",https://benzinga.com/pressreleases/21/02/g19801541/sentient-energy-acquires-key-assets-of-varentec-to-give-utilities-comprehensive-visibility-analyti,
Benzinga,Curran Investment Management Receives Numerous Rankings by Broadridge Lipper for Curran Core Growth Equity Strategy Q4 2020,https://benzinga.com/pressreleases/21/02/g19801595/curran-investment-management-receives-numerous-rankings-by-broadridge-lipper-for-curran-core-growt,
Benzinga,Global Automotive Technology Report 2020 - Supply Chain to CASE Will Unwind New Revenue Models by Leveraging Secured Solutions,https://benzinga.com/pressreleases/21/02/n19801599/global-automotive-technology-report-2020-supply-chain-to-case-will-unwind-new-revenue-models-by-le,
Benzinga,"$ 6.74 Billion Growth in Global Ceramic Packaging Market During 2021-2025 | Featuring Key Vendors Including Aerospace Semiconductor Inc., AMETEK Inc., and Aptasic SA | Technavio",https://benzinga.com/pressreleases/21/02/n19801598/6-74-billion-growth-in-global-ceramic-packaging-market-during-2021-2025-featuring-key-vendors-incl,
Benzinga,Ask Kodiak and Coterie Partner for Business Classification and Ease of Integration,https://benzinga.com/pressreleases/21/02/g19801596/ask-kodiak-and-coterie-partner-for-business-classification-and-ease-of-integration,
Benzinga,Eco Conscious Freight Truck Innovator Tevva Over-Subscribed In Latest $12.5 Million Private Financial Raise,https://benzinga.com/pressreleases/21/02/n19801588/eco-conscious-freight-truck-innovator-tevva-over-subscribed-in-latest-12-5-million-private-financi,
Benzinga,"World Cocoa Powder (Not Containing Added Sugar) Market Analysis, Forecast, Size, Trends and Insights Report 2021 - ResearchAndMarkets.com",https://benzinga.com/pressreleases/21/02/b19801565/world-cocoa-powder-not-containing-added-sugar-market-analysis-forecast-size-trends-and-insights-re,
Benzinga,Roanoke College Appoints New Vice President of Resource Development,https://benzinga.com/pressreleases/21/02/n19801548/roanoke-college-appoints-new-vice-president-of-resource-development,
Benzinga,IIROC Trade Resumption - SCR,https://benzinga.com/pressreleases/21/02/n19801542/iiroc-trade-resumption-scr,
Benzinga,"Australia's Leading Cosmeceutical Skincare Brand, Ultraceuticals, Arrives In The United States",https://benzinga.com/pressreleases/21/02/n19801538/australias-leading-cosmeceutical-skincare-brand-ultraceuticals-arrives-in-the-united-states,
Benzinga,Alpha Capital's SPAC Closes $230 Million IPO on Nasdaq,https://benzinga.com/pressreleases/21/02/b19801537/alpha-capitals-spac-closes-230-million-ipo-on-nasdaq,
Benzinga,Blue Cross and Blue Shield of Minnesota announces first-of-its-kind dietary support for high-risk pregnant women and their families,https://benzinga.com/pressreleases/21/02/n19801520/blue-cross-and-blue-shield-of-minnesota-announces-first-of-its-kind-dietary-support-for-high-risk-,
Benzinga,Firm Value Democratizes Access to Private Capital Partners,https://benzinga.com/pressreleases/21/02/n19801518/firm-value-democratizes-access-to-private-capital-partners,
