feed,title,long_url,short_url
SeekingAlpha,"Hersha Hospitality FFO beats by $0.15, misses on revenue",https://seekingalpha.com/news/3665152,
SeekingAlpha,"Western Midstream Partners EPS beats by $0.03, misses on revenue",https://seekingalpha.com/news/3665150,
SeekingAlpha,Infinera falls 3.3% as product sales decline leads to Q4 revenue miss,https://seekingalpha.com/news/3665149,
SeekingAlpha,Intuit slumps as late tax season cuts FQ2 sales,https://seekingalpha.com/news/3665147,
SeekingAlpha,HV Bancorp approves stock repurchase program,https://seekingalpha.com/news/3665148,
SeekingAlpha,"CoStar Group EPS beats by $0.44, beats on revenue",https://seekingalpha.com/news/3665146,
SeekingAlpha,"OneSpan EPS beats by $0.02, beats on revenue",https://seekingalpha.com/news/3665145,
