feed,title,long_url,short_url
Yahoo,"With Tariffs in Play, Is a Container Demand Recession on Deck?",https://finance.yahoo.com/news/tariffs-play-container-demand-recession-212344233.html,https://da.gd/kAsAzC
Yahoo,"Treasuries typically provide safe haven, but bond yields are spiking again as investors debate the Fed’s next move",https://finance.yahoo.com/news/treasuries-typically-safe-haven-bond-213325911.html,https://da.gd/WhtaTk
Yahoo,Dogecoin Is Falling Today -- Is It Time to Buy the Cryptocurrency?,https://finance.yahoo.com/news/dogecoin-falling-today-time-buy-220400461.html,https://da.gd/U7nA
Yahoo,Is Daqo New Energy Corp. (DQ) the Best Clean Energy Stock to Buy According to Billionaires?,https://finance.yahoo.com/news/daqo-energy-corp-dq-best-221049126.html,https://da.gd/Kzvn
Yahoo,"Is L3Harris Technologies, Inc. (LHX) Among Defense Stocks with the Highest EPS Growth in 5 Years?",https://finance.yahoo.com/news/l3harris-technologies-inc-lhx-among-221104579.html,https://da.gd/tDVd86
Yahoo,Is Microsoft Corporation (MSFT) the Best Stock to Buy According to Billionaire Steve Cohen?,https://finance.yahoo.com/news/microsoft-corporation-msft-best-stock-221127046.html,https://da.gd/hUEbt
Yahoo,"Is Amazon.com, Inc. (AMZN) the Best Stock to Buy According to Billionaire Steve Cohen?",https://finance.yahoo.com/news/amazon-com-inc-amzn-best-221146630.html,https://da.gd/3hfN1
