feed,title,long_url,short_url
Investing,Analysis-New LNG plant to boost Venture Global profits as Calcasieu serves long-term customers,https://www.investing.com/news/stock-market-news/analysisnew-lng-plant-to-boost-venture-global-profits-as-calcasieu-serves-longterm-customers-3979993,https://da.gd/7JFQ0I
Investing,US 30-year auction better-than-feared,https://www.investing.com/news/stock-market-news/us-30year-auction-betterthanfeared-3979992,https://da.gd/sU1BPt
Investing,Canadian government invites US banks for meeting - Bloomberg,https://www.investing.com/news/stock-market-news/canadian-government-invites-us-banks-for-meeting--bloomberg-93CH-3979990,https://da.gd/REKn
Investing,US and Vietnam to commence reciprocal trade talks,https://www.investing.com/news/stock-market-news/us-and-vietnam-to-commence-reciprocal-trade-talks-93CH-3979989,https://da.gd/ED4zB
Investing,"Restarting coal plants after Trump's executive orders makes no economic sense, report says",https://www.investing.com/news/stock-market-news/restarting-coal-plants-after-trumps-executive-orders-makes-no-economic-sense-report-says-3979984,https://da.gd/jEqvRn
Investing,Trump considers congressional approval for buy foreign ships,https://www.investing.com/news/stock-market-news/trump-considers-congressional-approval-for-buy-foreign-ships-93CH-3979975,https://da.gd/qDaETp
Investing,Citi names insider Raymond Gatcliffe as CEO of Canada operations,https://www.investing.com/news/stock-market-news/citi-names-insider-raymond-gatcliffe-as-ceo-of-canada-operations-3979973,https://da.gd/qW9UMG
