feed,title,long_url,short_url
ZeroHedgeRU,The Minimum Wage Does More Harm Than Good,https://www.zerohedge.com/personal-finance/minimum-wage-does-more-harm-good,https://da.gd/WJhn
ZeroHedgeRU,Has The Housing Market Bottomed? The Surprising Result From A Little-Known Market Indicator,https://www.zerohedge.com/markets/has-housing-market-bottomed-surprising-result-little-known-market-indicator,https://da.gd/5qnp3
ZeroHedgeRU,The Absurdity Of Elon Musk's Fraud Trial,https://www.zerohedge.com/markets/absurdity-elon-musks-fraud-trial,https://da.gd/GBC3
ZeroHedgeRU,"""This Is Not A Normal Situation"": A Semiconductor Rout Is On As Supply Balloons And Demand Dissipates",https://www.zerohedge.com/markets/not-normal-situation-semiconductor-rout-supply-balloons-and-demand-dissipates,https://da.gd/L2dtR
ZeroHedgeRU,"""In More Than 40 Years Of Trading, Never Have I Witnessed A Market Fighting The Fed As Boldly As This One""",https://www.zerohedge.com/markets/more-40-years-trading-never-have-i-witnessed-market-fighting-fed-boldly-one,https://da.gd/ejKkml
ZeroHedgeRU,Demographically Sobering Thoughts On US Employment In The Next Five Years,https://www.zerohedge.com/personal-finance/demographically-sobering-thoughts-us-employment-next-five-years,https://da.gd/LPt4pL
ZeroHedgeRU,"Investors Have Become Super-Bullish On Oil, Pile Into Futures At Fastest Rate Since Dec 2020",https://www.zerohedge.com/markets/investors-have-become-super-bullish-oil-pile-futures-fastest-rate-dec-2020,https://da.gd/5TP4U1
ZeroHedgeRU,"""Recession Is On Its Way"" - Dallas Fed Shows Factory Activity Slumps For 9th Straight Month",https://www.zerohedge.com/personal-finance/recession-its-way-dallas-fed-shows-factory-activity-slumps-9th-straight-month,https://da.gd/B0guBH
ZeroHedgeRU,Bitcoin Premium Hits 60% In Nigeria As Country Limits ATM Cash Withdrawals,https://www.zerohedge.com/crypto/bitcoin-premium-hits-60-nigeria-country-limits-arm-cash-withdrawals,https://da.gd/hshO
ZeroHedgeRU,Hedge Funds Are Record Short Bonds As Market Cuts Dovish Fed Bets,https://www.zerohedge.com/markets/hedge-funds-are-record-short-bonds-market-cuts-dovish-fed-bets,https://da.gd/n3yX
