feed,title,long_url,short_url
Investing,Why is the crypto market down today?,https://www.investing.com/news/cryptocurrency-news/why-is-the-crypto-market-down-today-2991631,https://da.gd/YNjBz
Investing,"U.S. airlines cancel over 1,000 flights over winter storm",https://www.investing.com/news/stock-market-news/us-airlines-cancel-over-1000-flights-over-winter-storm-2991633,https://da.gd/DdmhbQ
Investing,Ex-Allianz executive wants Structured Alpha fraud charges dismissed over lawyers' alleged conflict,https://www.investing.com/news/stock-market-news/exallianz-executive-wants-structured-alpha-fraud-charges-dismissed-over-lawyers-alleged-conflict-2991628,https://da.gd/rNdEw8
Investing,"Nike sues Lululemon, says footwear infringes patents",https://www.investing.com/news/stock-market-news/nike-sues-lululemon-says-footwear-infringes-patents-2991630,https://da.gd/yWtA9l
Investing,U.S. stops granting export licenses for China's Huawei - sources,https://www.investing.com/news/economy/us-stops-granting-export-licenses-for-chinas-huawei--sources-2991629,https://da.gd/G8dhf8
