feed,title,long_url,short_url
Yahoo,"PPI Delivers Good News After Hot CPI, But More Trump Tariffs Are On Tap; S&P 500 Futures Rise",https://www.investors.com/news/economy/ppi-cpi-inflation-trump-tariffs-fed-jerome-powell-sp-500/?src=A00220&yptr=yahoo,https://da.gd/L0plGO
Yahoo,Understanding Net 30 Terms for Fleet Fuel Cards,https://finance.yahoo.com/news/understanding-net-30-terms-fleet-135054544.html,https://da.gd/QsC3M
Yahoo,Maximizing Spot Rates While Leveraging Direct Shipper Freight,https://finance.yahoo.com/news/maximizing-spot-rates-while-leveraging-134646089.html,https://da.gd/NFR0ww
Yahoo,Trump Calls for Lower Interest Rates as Powell Heads to Hill,https://finance.yahoo.com/news/trump-calls-lowering-interest-rates-133420516.html,https://da.gd/C0FwO
Yahoo,"Got $5,000? 2 Tech Stocks to Buy and Hold for the Long Term",https://www.fool.com/investing/2025/02/13/got-5000-2-tech-stocks-buy-and-hold-long-term/?source=eptyholnk0000202&utm_source=yahoo-host-full&utm_medium=feed&utm_campaign=article&referring_guid=60547838-8af7-4a02-a86e-8ec495fa6c55&.tsrc=rss,https://da.gd/eXBWr
Yahoo,Elon Musk says he'll drop $97B OpenAI purchase offer if ChatGPT maker stays a nonprofit,https://www.foxbusiness.com/technology/elon-musk-says-hell-drop-97b-openai-purchase-offer-chatgpt-maker-stays-nonprofit?.tsrc=rss,https://da.gd/egEe0
