feed,title,long_url,short_url
Investing,"Mastercard stock rises on robust 2024 revenue, crypto integration",https://www.investing.com/news/cryptocurrency-news/mastercard-stock-rises-on-robust-2024-revenue-crypto-integration-93CH-3868419,https://da.gd/T4Stw
Investing,Chainalysis forecasts surge in crypto scam revenue by 2025,https://www.investing.com/news/cryptocurrency-news/chainalysis-forecasts-surge-in-crypto-scam-revenue-by-2025-93CH-3868418,https://da.gd/2XXIuk
Investing,Is Intel a new favorite long idea on Wall Street?,https://www.investing.com/news/stock-market-news/is-intel-a-new-favorite-long-idea-on-wall-street-3868432,https://da.gd/Pvww
Investing,Norway stocks higher at close of trade; Oslo OBX up 0.13%,https://www.investing.com/news/stock-market-news/norway-stocks-higher-at-close-of-trade-oslo-obx-up-013-3868412,https://da.gd/SDPx5P
Investing,Israel stocks higher at close of trade; TA 35 up 1.80%,https://www.investing.com/news/stock-market-news/israel-stocks-higher-at-close-of-trade-ta-35-up-180-3868408,https://da.gd/lXEY6x
Investing,Morgan Stanley plans to expand X debt offering due to strong demand - Bloomberg,https://www.investing.com/news/stock-market-news/morgan-stanley-plans-to-expand-x-debt-offering-due-to-strong-demand--bloomberg-93CH-3868407,https://da.gd/W8eDK
