feed,title,long_url,short_url
Investing,Brazil's Petrobras to pay $283 million to settle U.S. court dispute with EIG,https://www.investing.com/news/stock-market-news/brazils-petrobras-to-pay-283-million-to-settle-us-court-dispute-with-eig-3917036,https://da.gd/CICK3n
Investing,Soccer-Liverpool sign multi-year deal with Adidas to replace Nike,https://www.investing.com/news/stock-market-news/soccerliverpool-sign-multiyear-deal-with-adidas-to-replace-nike-3917033,https://da.gd/DJqlv
Investing,Makino Milling Machine receives more acquisition proposals,https://www.investing.com/news/stock-market-news/makino-milling-machine-receives-more-acquisition-proposals-93CH-3917031,https://da.gd/Ekwwt
Investing,"Citi downgrades Alstom to ""neutral,"" citing valuation concerns and growth limits",https://www.investing.com/news/stock-market-news/citi-downgrades-alstom-to-neutral-citing-valuation-concerns-and-growth-limits-3917028,https://da.gd/htbxp
Investing,Ford to invest $4.76 billion in German unit for European revival,https://www.investing.com/news/stock-market-news/ford-to-invest-476-billion-in-german-unit-for-european-revival-93CH-3917025,https://da.gd/4WZ2K
Investing,Japan's Makino Milling says it received buyout offers rivalling Nidec's,https://www.investing.com/news/stock-market-news/japans-makino-milling-says-it-received-buyout-offers-rivalling-nidecs-3917022,https://da.gd/VA5Zk6
Investing,US regulator clears path for banks to engage in some crypto activities,https://www.investing.com/news/economy-news/us-regulator-clears-path-for-banks-to-engage-in-some-crypto-activities-3917038,https://da.gd/jPpDL
Investing,Saudi Arabia's Q4 economy growth boosted by non-oil and government activities,https://www.investing.com/news/economy-news/saudi-arabias-q4-economy-growth-boosted-by-nonoil-and-government-activities-93CH-3917027,https://da.gd/ScK2uI
Investing,Thailand aims to boost economic growth with $4.4 billion stimulus measures,https://www.investing.com/news/economy-news/thailand-aims-to-boost-economic-growth-with-44-billion-stimulus-measures-93CH-3917023,https://da.gd/JL9h
