feed,title,long_url,short_url
ETFdb:DailyRecap,Agricultural ETFs Continue to Surge as Wheat and Oats Futures Make Gains,https://etfdb.com/commodities-channel/agricultural-etfs-surge-wheat-oats-futures-gain/,https://da.gd/UELPF
ETFdb:DailyRecap,Meet an Advisor: Charlotte Geletka,https://etfdb.com/news/2023/07/07/charlotte-geletka-meet-advisor/,https://da.gd/s8hhoJ
ETFdb:DailyRecap,Wide Moat Stocks Look Appealing on Valuation,https://etfdb.com/tactical-allocation-channel/on-valuation-wide-moat-stocks-look-appealing/,https://da.gd/0fhQgm
ETFdb:DailyRecap,California Carbon Allowances Are a Less Volatile Commodity,https://etfdb.com/climate-insights-channel/california-carbon-allowances-less-volatile-commodity/,https://da.gd/eGem
ETFdb:DailyRecap,Direct Indexing Mitigates Concentration Risk,https://etfdb.com/direct-indexing-channel/direct-indexing-mitigates-concentration-risk/,https://da.gd/IJfMa4
ETFdb:DailyRecap,Soybean ETFs Still Rallying After Surprise USDA Report,https://etfdb.com/commodities-channel/soybean-etfs-still-rallying-after-surprise-usda-report/,https://da.gd/PA9b4
ETFdb:DailyRecap,Active Managers Have An Edge in Dividend Growth Investing,https://etfdb.com/market-insights-channel/active-managers-have-edge-dividend-growth-investing/,https://da.gd/xj7zg
ETFdb:DailyRecap,Play the “Bank Walk” on Credit in Value ETFs,https://etfdb.com/model-portfolio-channel/play-the-bank-walk-on-credit-in-value-etfs/,https://da.gd/qWVNF
ETFdb:DailyRecap,KMLM Climbs on Fed Rate Hike Fears This Month,https://etfdb.com/china-insights-channel/month-kmlm-climbs-fed-rate-hike-fears/,https://da.gd/DmDhHO
ETFdb:DailyRecap,Take Advantage of Soaring Treasury Yields With XTWO,https://etfdb.com/institutional-income-strategies-channel/xtwo-take-advantage-soaring-treasury-yields/,https://da.gd/3Bs7s
ETFdb:DailyRecap,Enterprise Value May Be a Better Gauge Than Market Cap,https://etfdb.com/free-cash-flow-channel/enterprise-value-may-be-better-gauge-than-market-cap/,https://da.gd/2tPIZ
ETFdb:DailyRecap,ETF of the Week: NEOS S&P 500 High Income ETF (SPYI),https://etfdb.com/monthly-income-channel/etf-week-spyi/,https://da.gd/IlUqdS
ETFdb:DailyRecap,Silver Has Its Own Avenues to Shine,https://etfdb.com/alternatives-channel/silver-has-avenues-shine/,https://da.gd/0Dcmr
ETFdb:DailyRecap,Fixed Income Symposium Set Ahead of Next FOMC,https://etfdb.com/fixed-income-channel/vettafi-announces-fixed-income-symposium/,https://da.gd/UM26pp
ETFdb:DailyRecap,Mid-year Outlook: Preparing for an Eventual Slowdown,https://etfdb.com/retirement-income-channel/mid-year-outlook-preparing-eventual-slowdown/,https://da.gd/I0yAz
ETFdb:DailyRecap,Opportunities Abound With Equal-Weight Sector ETFs,https://etfdb.com/portfolio-strategies-channel/equal-weight-sector-etf-opportunities-abound/,https://da.gd/3lIw
ETFdb:DailyRecap,One of the Largest Canadian Fund Managers Sees Value in Bonds,https://etfdb.com/fixed-income-channel/mackenzie-investments-sees-value-bonds/,https://da.gd/iEkRvO
ETFdb:DailyRecap,The Role Dividend ETF SDOG Can Play in a Portfolio,https://etfdb.com/etf-education-channel/role-of-sdog-portfolio/,https://da.gd/SjAz
