feed,title,long_url,short_url
Benzinga,ORIC Pharmaceuticals to Participate in Upcoming Investor Conferences,https://www.benzinga.com/pressreleases/20/09/g17359583/oric-pharmaceuticals-to-participate-in-upcoming-investor-conferences,https://j.mp/3gOp9sN
Benzinga,Murphy USA to Participate in Upcoming Investor Conference,https://www.benzinga.com/pressreleases/20/09/g17359581/murphy-usa-to-participate-in-upcoming-investor-conference,https://j.mp/3hTMlHA
Benzinga,Osmotica to Present at 2020 Wells Fargo Virtual Healthcare Conference,https://www.benzinga.com/pressreleases/20/09/g17359580/osmotica-to-present-at-2020-wells-fargo-virtual-healthcare-conference,https://j.mp/3bt4auM
Benzinga,Rekor Systems' Eyal Hen Featured at The LD 500 Virtual Conference,https://www.benzinga.com/pressreleases/20/09/g17359578/rekor-systems-eyal-hen-featured-at-the-ld-500-virtual-conference,https://j.mp/3bpMgsD
Benzinga,Supernus to Present at the Wells Fargo Virtual Health Care Conference,https://www.benzinga.com/pressreleases/20/09/g17359577/supernus-to-present-at-the-wells-fargo-virtual-health-care-conference,https://j.mp/3gWcMuO
Benzinga,eBay Teams Up with UPS® to Offer New Shipping Options on Its Marketplace,https://www.benzinga.com/pressreleases/20/09/n17359572/ebay-teams-up-with-ups-to-offer-new-shipping-options-on-its-marketplace,https://j.mp/2EQRh1E
Benzinga,DBV Technologies to Participate in Multiple September Investor Conferences,https://www.benzinga.com/pressreleases/20/09/g17359553/dbv-technologies-to-participate-in-multiple-september-investor-conferences,https://j.mp/3gWcMei
