feed,title,long_url,short_url
SeekingAlpha,Stagwell reports Q3 results,https://seekingalpha.com/news/3763738,
SeekingAlpha,Agios Pharmaceuticals EPS beats by $1.46,https://seekingalpha.com/news/3763737,
SeekingAlpha,"Athene Holding EPS beats by $0.47, misses on net investment income",https://seekingalpha.com/news/3763736,
SeekingAlpha,"Virtu Financial EPS beats by $0.08, beats on revenue",https://seekingalpha.com/news/3763735,
SeekingAlpha,"Sapiens EPS beats by $0.02, beats on revenue",https://seekingalpha.com/news/3763734,
SeekingAlpha,"Macerich FFO beats by $0.02, beats on revenue",https://seekingalpha.com/news/3763733,
SeekingAlpha,"SSR Mining EPS beats by $0.06, misses on revenue; updates full year guidance",https://seekingalpha.com/news/3763732,
