feed,title,long_url,short_url
InsiderMonkey,Maplebear Inc. (CART) Rated as Outperform at Citizens JMP amid Growing Shoppers Order Density,https://insidermonkey.com/blog/--1567362,
InsiderMonkey,Amazon (AMZN) Considers Additional Investment in Anthropic,https://insidermonkey.com/blog/--1567365,
InsiderMonkey,Bernstein Touts Coupang (CPNG) as a Clear Winner in Korean e-Commerce Market,https://insidermonkey.com/blog/--1567355,
InsiderMonkey,Home Depot’s (HD) $5.5B GMS Acquisition Solidifies Bullish Analyst Confidence,https://insidermonkey.com/blog/--1567370,
InsiderMonkey,Morgan Stanley Bullish About Chewy (CHWY) Prospects in $40B Veterinary Clinic Market,https://insidermonkey.com/blog/--1567374,
InsiderMonkey,"Walmart (WMT) Recalls 850,000 Water Bottles Over Safety Risk",https://insidermonkey.com/blog/--1567379,
InsiderMonkey,"Temu’s Q2 Boom Driven by EU and Latin America, Under PDD’s Leadership",https://insidermonkey.com/blog/--1567385,
InsiderMonkey,Mercado Libre (MELI) Earns Full Investment Grade Status from SP,https://insidermonkey.com/blog/--1567390,
InsiderMonkey,UBS Affirms JD.com’s (JD) ‘Buy’ rating Cuts Price Target on Spending Concerns,https://insidermonkey.com/blog/--1567394,
InsiderMonkey,Jefferies Upbeat on Alibaba’s (BABA) AI Cloud and Instant Commerce Growth,https://insidermonkey.com/blog/--1567396,
InsiderMonkey,Jim Cramer Reiterates $200 PT for Palantir,https://insidermonkey.com/blog/--1567328,
InsiderMonkey,Jim Cramer Says “Chevron Will be a Winner”,https://insidermonkey.com/blog/--1567331,
InsiderMonkey,Jim Cramer on Crocs: “There’s No Sin in Saying It’s Too Hard”,https://insidermonkey.com/blog/--1567333,
InsiderMonkey,Jim Cramer on Sunoco: “Wish They Could Somehow Issue More Stock”,https://insidermonkey.com/blog/--1567335,
InsiderMonkey,Jim Cramer Says He Believes in Carvana,https://insidermonkey.com/blog/--1567338,
InsiderMonkey,Jim Cramer on MNTN: “Good Way to Play the Ad-tech Space”,https://insidermonkey.com/blog/--1567340,
InsiderMonkey,Jim Cramer Calls Capital One Financial a Buy,https://insidermonkey.com/blog/--1567342,
InsiderMonkey,Jim Cramer Recommends Buying Goldman Sachs,https://insidermonkey.com/blog/--1567344,
InsiderMonkey,Jim Cramer on AT&T: “This Thing is a Really Good Situation”,https://insidermonkey.com/blog/--1567346,
InsiderMonkey,Jim Cramer Says He Likes Datadog but its not “What I Want to Recommend Anymore”,https://insidermonkey.com/blog/--1567348,
