feed,title,long_url,short_url
Investing,U.S. stocks mixed at close of trade; Dow Jones Industrial Average down 0.28%,https://www.investing.com/news/stock-market-news/us-stocks-mixed-at-close-of-trade-dow-jones-industrial-average-down-028-3759968,https://da.gd/82Vbc
Investing,Mexico stocks lower at close of trade; S&P/BMV IPC down 0.82%,https://www.investing.com/news/stock-market-news/mexico-stocks-lower-at-close-of-trade-spbmv-ipc-down-082-3759954,https://da.gd/x5acXq
Investing,Colombia stocks lower at close of trade; COLCAP down 1.26%,https://www.investing.com/news/stock-market-news/colombia-stocks-lower-at-close-of-trade-colcap-down-126-3759951,https://da.gd/E7pDYY
Investing,Canada stocks higher at close of trade; S&P/TSX Composite up 0.05%,https://www.investing.com/news/stock-market-news/canada-stocks-higher-at-close-of-trade-sptsx-composite-up-005-3759950,https://da.gd/R96lg3
Investing,Brazil stocks lower at close of trade; Bovespa down 1.48%,https://www.investing.com/news/stock-market-news/brazil-stocks-lower-at-close-of-trade-bovespa-down-148-3759949,https://da.gd/RFL3V
