feed,title,long_url,short_url
FXEmpire,Turkey’s Erdogan: Armenian attitude towards Azerbaijan will have consequences,https://www.fxempire.com/news/article/turkeys-erdogan-armenian-attitude-towards-azerbaijan-will-have-consequences-1127296,https://bit.ly/3BfWoSb
FXEmpire,Ivory Coast asks West African bloc to help captive soldiers in Mali,https://www.fxempire.com/news/article/ivory-coast-asks-west-african-bloc-to-help-captive-soldiers-in-mali-1127297,https://bit.ly/3LcjQnU
FXEmpire,Explainer-How could the U.S. sanction China to deter a Taiwan attack?,https://www.fxempire.com/news/article/explainer-how-could-the-u-s-sanction-china-to-deter-a-taiwan-attack-1127288,https://bit.ly/3U9Bgpn
FXEmpire,Russia launched eight cruise missiles against Ukrainian city – official,https://www.fxempire.com/news/article/russia-launched-eight-cruise-missiles-against-ukrainian-city-official-1127298,https://bit.ly/3eRQnDO
FXEmpire,Russian consumer prices drop for 10th week as rate-setting meeting looms,https://www.fxempire.com/news/article/russian-consumer-prices-drop-for-10th-week-as-rate-setting-meeting-looms-1127290,https://bit.ly/3LfmQjh
