feed,title,long_url,short_url
SeekingAlpha,Beat Inflation With Real Estate: W.P. Carey And AvalonBay,https://seekingalpha.com/article/4523020,
SeekingAlpha,"As Energy Stocks Fall, Fundamentals Tell A Different Story",https://seekingalpha.com/article/4523056,
SeekingAlpha,Euro Parity Holds Ahead Of U.S. CPI,https://seekingalpha.com/article/4523063,
SeekingAlpha,Volvo Chugs Along Despite Weakness From China,https://seekingalpha.com/article/4522610,
SeekingAlpha,Santander Hedged And Ready For Higher Rates,https://seekingalpha.com/article/4522691,
SeekingAlpha,"Exxon Mobil: The Good, The Bad, And The Very Ugly",https://seekingalpha.com/article/4522989,
