feed,title,long_url,short_url
SeekingAlpha,Passage Bio GAAP EPS of -$0.49 beats by $0.31,https://seekingalpha.com/news/3905425,
SeekingAlpha,OptiNose reports mixed Q3 earnings; narrows FY22 guidance range,https://seekingalpha.com/news/3905424,
SeekingAlpha,"Radcom Non-GAAP EPS of $0.06 beats by $0.05, revenue of $12M beats by $0.65M",https://seekingalpha.com/news/3905423,
SeekingAlpha,"Honest Company GAAP EPS of -$0.13 misses by $0.05, revenue of $84.58M beats by $0.9M",https://seekingalpha.com/news/3905422,
SeekingAlpha,"Humacyte GAAP EPS of -$0.25 misses by $0.04, revenue of $0.03M misses by $0.17M",https://seekingalpha.com/news/3905421,
SeekingAlpha,"Genius Sports GAAP EPS of -$0.04 beats by $0.04, revenue of $78.65M beats by $1.47M",https://seekingalpha.com/news/3905420,
SeekingAlpha,SPAC Plutonian Acquisition prices $50M IPO,https://seekingalpha.com/news/3905419,
