feed,title,long_url,short_url
Benzinga,Here's How Much You Would Have Made Owning Deere Stock In The Last 5 Years,https://benzinga.com/news/earnings/22/11/29662866/heres-how-much-you-would-have-made-owning-deere-stock-in-the-last-5-years,https://bit.ly/3NWXb05
Benzinga,Here's How Much You Would Have Made Owning SolarEdge Technologies Stock In The Last 5 Years,https://benzinga.com/news/earnings/22/11/29662868/heres-how-much-you-would-have-made-owning-solaredge-technologies-stock-in-the-last-5-years,https://bit.ly/3NWXat3
Benzinga,Here's How Much $1000 Invested In Abbott Laboratories 10 Years Ago Would Be Worth Today,https://benzinga.com/news/earnings/22/11/29663546/heres-how-much-1000-invested-in-abbott-laboratories-10-years-ago-would-be-worth-today,https://bit.ly/3NWX9W1
Benzinga,$100 Invested In Marriott Intl 15 Years Ago Would Be Worth This Much Today,https://benzinga.com/news/earnings/22/11/29663547/100-invested-in-marriott-intl-15-years-ago-would-be-worth-this-much-today,https://bit.ly/3EiWB9Q
Benzinga,Group President of Kyndryl Hldgs Makes $218K Buy,https://benzinga.com/news/22/11/29661219/group-president-of-kyndryl-hldgs-makes-218k-buy,https://bit.ly/3TFNPaF
Benzinga,"Paysafe Shares Pop After Clocking $366M Revenue In Q3 Backed By US SMB, Digital Commerce",https://benzinga.com/news/earnings/22/11/29657672/paysafe-shares-pop-after-clocking-366m-revenue-in-q3-backed-by-us-smb-digital-commerce,https://bit.ly/3EnzHyo
Benzinga,Microsoft Founder Paul Allen's $1.5B Art Collection Breaks Christie's Auction Record,https://benzinga.com/news/22/11/29661997/microsoft-founder-paul-allens-1-5b-art-collection-breaks-christies-auction-record,https://bit.ly/3fV2iBE
Benzinga,Datadog Insider Trades Send a Signal,https://benzinga.com/news/22/11/29661209/datadog-insider-trades-send-a-signal,https://bit.ly/3NYaY6Y
