feed,title,long_url,short_url
InvestorPlace,Next Year’s Biggest Market Champions?,https://investorplace.com/hypergrowthinvesting/2022/11/next-years-biggest-market-champions/,https://bit.ly/3hwftcF
InvestorPlace,Buying Opendoor Today Could Be Like Buying Amazon in 1997,https://investorplace.com/hypergrowthinvesting/2022/11/opendoor-stock-millionaire-maker-supercharge-your-portfolio/,https://bit.ly/3UMAhuQ
InvestorPlace,Why Is Unity (U) Stock Up 25% Today?,https://investorplace.com/2022/11/why-is-unity-u-stock-up-25-percent-today/,https://bit.ly/3WM9Ze5
InvestorPlace,Why Are Stocks Up Today?,https://investorplace.com/2022/11/why-are-stocks-up-today-5/,https://bit.ly/3WUdwHh
InvestorPlace,Be Ready for This Market Phenomenon That Starts Now,https://investorplace.com/smartmoney/2022/11/be-ready-for-this-market-phenomenon-that-starts-now/,https://bit.ly/3WQXkq9
