feed,title,long_url,short_url
SeekingAlpha,"Toast GAAP EPS of -$0.19 beats by $0.01, revenue of $752M beats by $31.08M",https://seekingalpha.com/news/3905960,
SeekingAlpha,"3M, Dupont sued by California AG over toxic 'forever chemicals'",https://seekingalpha.com/news/3905959,
SeekingAlpha,"Matterport Non-GAAP EPS of -$0.09 beats by $0.05, revenue of $37.99M beats by $2.04M",https://seekingalpha.com/news/3905958,
SeekingAlpha,"Maxeon Solar Technologies Non-GAAP EPS of -$1.09, revenue of $275.4M",https://seekingalpha.com/news/3905957,
SeekingAlpha,"FIGS Non-GAAP EPS of $0.02 in-line, revenue of $128.6M beats by $4.23M",https://seekingalpha.com/news/3905956,
SeekingAlpha,"AvePoint Non-GAAP EPS of -$0.04, revenue of $62.7M",https://seekingalpha.com/news/3905955,
