feed,title,long_url,short_url
Investing,Coinbase CLO Paul Grewal Questions SEC’s Updated Disclaimer Language,https://www.investing.com/news/cryptocurrency-news/coinbase-clo-paul-grewal-questions-secs-updated-disclaimer-language-3091892,https://da.gd/zT7bZ
Investing,Italy's UniCredit expands payments partnership with Mastercard,https://www.investing.com/news/stock-market-news/italys-unicredit-expands-payments-partnership-with-mastercard-3091899,https://da.gd/kBjW09
Investing,Factbox-How Americans plan to travel this Memorial Day,https://www.investing.com/news/stock-market-news/factboxhow-americans-plan-to-travel-this-memorial-day-3091897,https://da.gd/Qf3nkq
Investing,UK competition regulator says Meta offers to limit use of ad data,https://www.investing.com/news/stock-market-news/uk-competition-regulator-says-meta-offers-to-limit-use-of-ad-data-3091876,https://da.gd/0q7g
Investing,"Carney's climate alliance sounds alarm on ""political attacks"" on insurers",https://www.investing.com/news/stock-market-news/carneys-climate-alliance-sounds-alarm-on-political-attacks-on-insurers-3091858,https://da.gd/0B6287
Investing,"Futures flat as debt ceiling talks drag on, inflation data in focus",https://www.investing.com/news/stock-market-news/futures-flat-as-debt-ceiling-talks-drag-on-inflation-data-in-focus-3091856,https://da.gd/EzGvy
Investing,Analysis-US Airlines gear up for 'Super Bowl' of travel season,https://www.investing.com/news/stock-market-news/analysisus-airlines-gear-up-for-super-bowl-of-travel-season-3091843,https://da.gd/mhZq4
Investing,Investors have poured $756 billion into cash funds this year - BofA,https://www.investing.com/news/stock-market-news/investors-have-poured-756-billion-into-cash-funds-this-year--bofa-3091842,https://da.gd/oQ7Evl
Investing,"Biden, McCarthy looking to close US debt ceiling deal for two years",https://www.investing.com/news/economy/biden-mccarthy-looking-to-close-us-debt-ceiling-deal-for-two-years-3091830,https://da.gd/2CnJ3z
Investing,"Marketmind: Debt deal is near, Fed peak is not",https://www.investing.com/news/economy/marketmind-debt-deal-is-near-fed-peak-is-not-3091845,https://da.gd/j03uXk
