feed,title,long_url,short_url
Motley,Will Regeneron's COVID Cocktail Win Be Short-Lived?,https://www.fool.com/investing/2021/04/21/will-regenerons-covid-cocktail-win-be-short-lived/?source=iedfolrf0000001,https://j.mp/2QDlruN
Motley,22 Million Seniors Wish They'd Considered This Major Retirement Expense,https://www.fool.com/investing/2021/04/21/22-million-seniors-wish-theyd-considered-this-majo/?source=iedfolrf0000001,https://j.mp/32zyBvC
Motley,Forget Coinbase: These Are 3 of the Best Stocks You Can Buy Right Now,https://www.fool.com/investing/2021/04/21/forget-coinbase-3-best-stocks-can-buy-right-now/?source=iedfolrf0000001,https://j.mp/2PaJ6Cw
Motley,Netflix Earnings in 6 Must-See Metrics,https://www.fool.com/investing/2021/04/21/netflix-earnings-in-6-must-see-metrics/?source=iedfolrf0000001,https://j.mp/2QdQH3Q
Motley,Here's Why Investors Loved Intuitive Surgical's Q1 Results,https://www.fool.com/investing/2021/04/21/heres-why-investors-loved-intuitive-surgicals-q1-r/?source=iedfolrf0000001,https://j.mp/3swUara
