feed,title,long_url,short_url
SeekingAlpha,Economic calendar for July 6,https://seekingalpha.com/news/3712775,
SeekingAlpha,Guess extends CEO contract to 2025 and announces grant of stock options,https://seekingalpha.com/news/3712776,
SeekingAlpha,"Dow Jones, Nasdaq flat after fresh round of record highs",https://seekingalpha.com/news/3712773,
SeekingAlpha,KPS Capital to sell DexKo to Brookfield Business Partners for $3.4B,https://seekingalpha.com/news/3712772,
SeekingAlpha,Swedbank partners with ACI Worldwide to combat card fraud,https://seekingalpha.com/news/3712771,
SeekingAlpha,Nomad Foods launches senior notes tack-on offering,https://seekingalpha.com/news/3712770,
SeekingAlpha,European shares lower; German industrial orders fell 3.7% in May,https://seekingalpha.com/news/3712768,
SeekingAlpha,"Vipshop Holdings Is An Ok Business, But That Might Not Be Enough",https://seekingalpha.com/article/4437962,
SeekingAlpha,VGT: At Risk Of Being Impacted By Supply Chain Ransomware,https://seekingalpha.com/article/4437863,
SeekingAlpha,Project $1M: Mid Year '21 Review,https://seekingalpha.com/article/4437960,
SeekingAlpha,Tracking Stanley Druckenmiller's Duquesne Family Office Portfolio - Q1 2021 Update,https://seekingalpha.com/article/4437955,
SeekingAlpha,Weekly Market Pulse: Contrasts And Contradictions,https://seekingalpha.com/article/4437957,
SeekingAlpha,3 Reasons Munich Re Is Undervalued,https://seekingalpha.com/article/4437954,
SeekingAlpha,"Fnac Darty: Reasonable Performance In 2020, All Eyes On The 2025 Strategic Plan",https://seekingalpha.com/article/4437953,
SeekingAlpha,The R.I.P. Portfolio's Q2 2021 Update,https://seekingalpha.com/article/4437951,
SeekingAlpha,"GDMA: No Clear Benefits Or Advantages, No Reason To Buy",https://seekingalpha.com/article/4437950,
SeekingAlpha,IJR: Small Cap And Conservative Model Portfolio,https://seekingalpha.com/article/4437948,
SeekingAlpha,"China Shows Full Truck Alliance, Kanzhun Who's Boss",https://seekingalpha.com/article/4437952,
SeekingAlpha,IBM: Bright Future Ahead,https://seekingalpha.com/article/4437947,
SeekingAlpha,StealthGas: Significantly Undervalued LPG Shipping Firm,https://seekingalpha.com/article/4437946,
SeekingAlpha,"Commodities Roundup: Oil Prices Keep Surging, But Gold And Copper Falter",https://seekingalpha.com/article/4437949,
SeekingAlpha,"Discover: This Buyback King Is A Buy, Here's Why",https://seekingalpha.com/article/4437943,
SeekingAlpha,Forensic Value Stock Selections: Top Positive And Negative Scoring Stocks For Mid-Year 2021,https://seekingalpha.com/article/4437941,
SeekingAlpha,Keeping Your Portfolio Safe In An Unsafe Market,https://seekingalpha.com/article/4437940,
SeekingAlpha,Politics And The Markets 7/06/21,https://seekingalpha.com/article/4437512,
SeekingAlpha,When Logic And Proportion Have Fallen Sloppy Dead,https://seekingalpha.com/article/4437944,
SeekingAlpha,Bank Of America: An Asset/Income Valuation Suggests Overvaluation,https://seekingalpha.com/article/4437939,
SeekingAlpha,When Will Rising Interest Rates Become A Major Problem For The Stock Market? - Part 2,https://seekingalpha.com/article/4437942,
SeekingAlpha,What To Do After Teva Stock Falls Below $10 Again,https://seekingalpha.com/article/4437938,
SeekingAlpha,Teradata: Don't Miss Out On This Turnaround Play,https://seekingalpha.com/article/4437937,
SeekingAlpha,Prudential Is A 4.5% Yielding Rich Retirement Dream Stock,https://seekingalpha.com/article/4437936,
SeekingAlpha,"NEA: Looking A Bit Pricey, But So Is Everything Else",https://seekingalpha.com/article/4437935,
SeekingAlpha,Dine Brands: A Strong Recovery In Q1,https://seekingalpha.com/article/4437934,
SeekingAlpha,Domo: No Catalysts To Take It Higher,https://seekingalpha.com/article/4437933,
SeekingAlpha,Palantir: A Stock With A $1 Trillion Problem,https://seekingalpha.com/article/4437928,
SeekingAlpha,"Direxion Daily Energy Bull 2x ETF: Drill, Baby, Drill",https://seekingalpha.com/article/4437920,
SeekingAlpha,"All-Weather Portfolio: The Good, The Bad, And The Ugly",https://seekingalpha.com/article/4437914,
SeekingAlpha,"XLY: Looks Good, Take A Position",https://seekingalpha.com/article/4437877,
SeekingAlpha,QYLD: A 10%+ Yielding Alternative To Frothy Tech Stocks,https://seekingalpha.com/article/4437875,
SeekingAlpha,PPLT: Dirt Cheap With A Bright Future,https://seekingalpha.com/article/4437864,
SeekingAlpha,June 2021 Portfolio Update - Summer Brings New Highs,https://seekingalpha.com/article/4437862,
SeekingAlpha,XME: Inflation Headlines Signal Contrarian Profit-Taking Opportunity In Mining,https://seekingalpha.com/article/4437844,
