feed,title,long_url,short_url
SeekingAlpha,"Nasdaq follows Dow Jones, S&P 500 lower as tech turns negative",https://seekingalpha.com/news/3713009,
SeekingAlpha,Mirati in pact with Cowen for sale of $500M of common stock,https://seekingalpha.com/news/3713019,
SeekingAlpha,"Yandex, Grubhub enter multi-year partnership for US college campus deliveries",https://seekingalpha.com/news/3713018,
SeekingAlpha,"Pentagon cancels contentious $10B JEDI contract, but launches new proposal",https://seekingalpha.com/news/3713017,
SeekingAlpha,GasLog Partners rallies to 52-week high as GasLog Ltd. exercises options,https://seekingalpha.com/news/3713016,
SeekingAlpha,Ron Burkle-backed SoHo House’s parent sets IPO valuing social-club chain at some $3B,https://seekingalpha.com/news/3713013,
