feed,title,long_url,short_url
Nasdaq,EU drafts plan to grow 'carbon sinks' in climate change fight,https://www.nasdaq.com/articles/eu-drafts-plan-to-grow-carbon-sinks-in-climate-change-fight-2021-07-06,https://j.mp/3AC42oC
Nasdaq,"GLOBAL MARKETS-Stocks, bond yields, oil fall as risk appetite fades",https://www.nasdaq.com/articles/global-markets-stocks-bond-yields-oil-fall-as-risk-appetite-fades-2021-07-06,https://j.mp/3yln8xA
Nasdaq,How 'Play-To-Earn' Is Changing The Business Of Gaming,https://www.nasdaq.com/articles/how-play-to-earn-is-changing-the-business-of-gaming-2021-07-06,https://j.mp/3AC4286
Nasdaq,FOREX-Dollar edges higher as market awaits clues from U.S. Fed,https://www.nasdaq.com/articles/forex-dollar-edges-higher-as-market-awaits-clues-from-u.s.-fed-2021-07-06-0,https://j.mp/3ABTINq
Nasdaq,Top Stocks To Watch Today? 4 Tech Stocks For Your July Watchlist,https://www.nasdaq.com/articles/top-stocks-to-watch-today-4-tech-stocks-for-your-july-watchlist-2021-07-06,https://j.mp/3yrZKhL
