feed,title,long_url,short_url
Benzinga,"Monday's Market Minute: Finally, Some Rest For The Weary",https://benzinga.com/news/earnings/22/03/26221785/mondays-market-minute-finally-some-rest-for-the-weary,https://bit.ly/36dpm9P
Benzinga,KemPharm's SDX Higher Dose Shows Potential Against Sleep Disorders,https://benzinga.com/general/biotech/22/03/26221726/kempharms-sdx-higher-dose-shows-potential-against-sleep-disorders,https://bit.ly/3Imnhpb
Benzinga,Tonix Says Fibromyalgia Candidate Failed To Achieve Statistical Significance Over Placebo,https://benzinga.com/general/biotech/22/03/26220985/tonix-says-fibromyalgia-candidate-failed-to-achieve-statistical-significance-over-placebo,https://bit.ly/3JJw2Lz
Benzinga,'West Side Story' Star Rachel Zegler Says She's Not Invited To The Oscars Show,https://benzinga.com/general/entertainment/22/03/26221535/west-side-story-star-rachel-zegler-says-shes-not-invited-to-the-oscars-show,https://bit.ly/36xd7Vm
Benzinga,Match Unveils New Dating App - This Time For 'Single Parents',https://benzinga.com/news/22/03/26221223/match-unveils-new-dating-app-this-time-for-single-parents,https://bit.ly/3ImVTXT
