feed,title,long_url,short_url
InsiderMonkey,MasTec (MTZ) is Benefiting from Multiple Tailwinds,https://insidermonkey.com/blog/--1193302,
InsiderMonkey,Licensing Renewals Pushed InterDigital (IDCC),https://insidermonkey.com/blog/--1193293,
InsiderMonkey,What Made Fabrinet (FN) Outperform in Q2?,https://insidermonkey.com/blog/--1193257,
InsiderMonkey,FPA Queens Road Small Cap Value Fund’s Q2 2023 Investor Letter,https://insidermonkey.com/blog/--1193249,
InsiderMonkey,Reasons for the Decline of Adtalem Global Education (ATGE) in Q2,https://insidermonkey.com/blog/--1193243,
InsiderMonkey,25 Biggest Countries Where You Can Use Google Wallet,https://insidermonkey.com/blog/--1192550,
InsiderMonkey,5 Biggest Countries Where You Can Use Google Wallet,https://insidermonkey.com/blog/--1192554,
InsiderMonkey,Royal Caribbean Group (RCL) Rose on Stronger Than Anticipated Consumer Demand,https://insidermonkey.com/blog/--1193236,
InsiderMonkey,Here’s Why Masco Corporation (MAS) Outperformed in Q2,https://insidermonkey.com/blog/--1193234,
InsiderMonkey,Ariel Fund’s Q2 2023 Investor Letter,https://insidermonkey.com/blog/--1193226,
