feed,title,long_url,short_url
CryptoNews,Montenegro’s Constitutional Court Rejects Do Kwon’s Appeal Against Extradition Verdict,https://cryptonews.com/news/court-rejects-do-kwons-appeal-against-extradition-verdict/,https://da.gd/C4SPY
CryptoNews,Japanese Giant Metaplanet Snaps Up 60 Million Bitcoin – Could This Trigger a Bull Run?,https://cryptonews.com/news/japanese-giant-metaplanet-snaps-up-60-million-bitcoin-could-this-trigger-a-bull-run/,https://da.gd/ghR3c
CryptoNews,"Spot Bitcoin ETFs Shed $1.5 Billion in Four-Day Outflow Streak, Largest Since Trump Win",https://cryptonews.com/news/spot-bitcoin-etfs-shed-1-5-billion-in-four-day-outflow-streak-largest-since-trump-win/,https://da.gd/dWeXv
CryptoNews,South Korea’s Crypto Investors Exceed 15M as November Trading Volume Nears Stock Market Levels,https://cryptonews.com/news/south-korea-crypto-investors-exceed-15-million/,https://da.gd/HV7V3Z
CryptoNews,MoonPay Eyes $150M Acquisition of Crypto Payment Platform Helio Pay: Report,https://cryptonews.com/news/moonpay-eyes-150m-acquisition-of-helio-pay/,https://da.gd/3hxtec
CryptoNews,El Salvador’s Bukele ‘May Visit Russia in 2025’ – Will He Talk Bitcoin With Putin?,https://cryptonews.com/news/el-salvadors-bukele-may-visit-russia-in-2025-will-he-talk-bitcoin-with-putin/,https://da.gd/tj1Al
