feed,title,long_url,short_url
Investing,"CAPITRADE, A revolutionary IDO launchpad for Blockchain projects, Integrates Fantom Network",https://investing.com/news/-2762771,
Investing,A Flurry of New and Exciting Developments Launched in the $NAKA Play-to-Earn Ecosystem!,https://investing.com/news/-2762770,
Investing,BattleVerse Brings First DAO Governed GameFi Metaverse,https://investing.com/news/-2762769,
Investing,Hungary's central bank chief wants EU-wide crypto trading and mining ban,https://investing.com/news/-2762767,
Investing,LABEL Foundation’s Operating Company Clesson Raises $2M in Equity Funding,https://investing.com/news/-2762763,
Investing,"Exclusive-U.S. to send 3,000 additional troops to Poland, officials say",https://investing.com/news/-2762577,
