feed,title,long_url,short_url
SeekingAlpha,"Regal-Beloit EPS beats by $0.28, misses on revenue",https://seekingalpha.com/news/3599315,
SeekingAlpha,"UGI EPS beats by $0.24, misses on revenue",https://seekingalpha.com/news/3599313,
SeekingAlpha,RWE signs deal for Nordex projects pipeline,https://seekingalpha.com/news/3599311,
SeekingAlpha,Veracyte launches 6M-share stock offering,https://seekingalpha.com/news/3599312,
SeekingAlpha,"Kennametal EPS beats by $0.03, misses on revenue",https://seekingalpha.com/news/3599310,
SeekingAlpha,"Continental Resources EPS misses by $0.09, misses on revenue",https://seekingalpha.com/news/3599309,
