feed,title,long_url,short_url
SeekingAlpha,Tegna announces Michael Steib as CEO,https://seekingalpha.com/news/4116621,
SeekingAlpha,Chandra Holt steps down as Beyond CEO amid structural changes,https://seekingalpha.com/news/4116634,
SeekingAlpha,"Wheels Up outlines new product portfolio, more Delta perks",https://seekingalpha.com/news/4116632,
SeekingAlpha,Assembly Biosciences closes $12.6M in equity financings,https://seekingalpha.com/news/4116631,
SeekingAlpha,Longeveron announces exercise of warrants for $4.4M gross proceeds,https://seekingalpha.com/news/4116630,
SeekingAlpha,The AZEK Company announces $600M share repurchase program,https://seekingalpha.com/news/4116629,
SeekingAlpha,'Deadpool & Wolverine' to get surprise China release,https://seekingalpha.com/news/4116627,
