feed,title,long_url,short_url
SeekingAlpha,"Chemung Financial Non-GAAP EPS of $1.58 beats by $0.11, revenue of $26.29M beats by $1.34M",https://seekingalpha.com/news/3928319,
SeekingAlpha,Xcel Energy foresees long-term 5%-7% annual EPS growth,https://seekingalpha.com/news/3928318,
SeekingAlpha,"First Foundation Non-GAAP EPS of $0.35 beats by $0.04, revenue of $81.9M misses by $13.95M",https://seekingalpha.com/news/3928317,
SeekingAlpha,"McCormick stock slips on earnings miss, soft profit guidance",https://seekingalpha.com/news/3928316,
SeekingAlpha,"First Mid Bancshares Non-GAAP EPS of $1.01 beats by $0.07, revenue of $63.88M beats by $10.41M",https://seekingalpha.com/news/3928315,
