feed,title,long_url,short_url
SeekingAlpha,WisdomTree Mortgage Plus Bond Fund declares monthly distribution of $0.0750,https://seekingalpha.com/news/3928544,
SeekingAlpha,Moody's works on system to classify stablecoins as scrutiny deepens - report,https://seekingalpha.com/news/3928543,
SeekingAlpha,Dyne hits four-month high as Guggenheim starts with Buy,https://seekingalpha.com/news/3928542,
SeekingAlpha,WisdomTree Interest Rate Hedged U.S. Aggregate Bond Fund declares monthly distribution of $0.1150,https://seekingalpha.com/news/3928541,
SeekingAlpha,WisdomTree Interest Rate Hedged High Yield Bond Fund declares monthly distribution of $0.1000,https://seekingalpha.com/news/3928540,
SeekingAlpha,WisdomTree Floating Rate Treasury Fund declares monthly distribution of $0.1850,https://seekingalpha.com/news/3928539,
