feed,title,long_url,short_url
gNews,Coinbase vs. Robinhood – Forbes Advisor - Investing - Forbes,https://www.forbes.com/advisor/investing/cryptocurrency/coinbase-vs-robinhood/,https://bit.ly/3S2umkp
gNews,"The Rosen Law Firm, P.A. Defeats Motion to Dismiss in Robinhood Securities Class Action - Business Wire",https://www.businesswire.com/news/home/20220819005325/en/The-Rosen-Law-Firm-P.A.-Defeats-Motion-to-Dismiss-in-Robinhood-Securities-Class-Action,https://bwnews.pr/3C897YZ
gNews,"Nasdaq Leads As Stock Market Climbs; PayPal, Robinhood, Ping Among Major Movers - Investor's Business Daily",https://www.investors.com/market-trend/stock-market-today/stock-market-climbs-as-nasdaq-leads/,https://bit.ly/3zsFHSv
gNews,"Cboe Says Robinhood, Virtu Among Potential Partners In Its Crypto Exchange - NDTV Profit",https://www.ndtv.com/business/cboe-says-robinhood-virtu-among-potential-partners-in-its-crypto-exchange-3288218,https://bit.ly/3fbGYXX
gNews,M1 Finance vs. Robinhood -- Which One is Better For You? - Investor Junkie,https://investorjunkie.com/compare/m1-finance-vs-robinhood-which-one-is-better-for-you/,https://bit.ly/3R0vnYW
