feed,title,long_url,short_url
SeekingAlpha,CDC 'preparing for the possibility' bird flu could spread more easily,https://seekingalpha.com/news/4116212,
SeekingAlpha,iShares Global Healthcare ETF declares semi-annual distribution of $0.6723,https://seekingalpha.com/news/4116275,
SeekingAlpha,iShares Global Financials ETF declares semi-annual distribution of $1.4600,https://seekingalpha.com/news/4116274,
SeekingAlpha,iShares Global Energy ETF declares semi-annual distribution of $0.8977,https://seekingalpha.com/news/4116273,
SeekingAlpha,iShares MSCI Water Management Multisector ETF declares semi-annual distribution of $0.2585,https://seekingalpha.com/news/4116272,
SeekingAlpha,Macquarie starts Roblox with bullish view as metaverse play,https://seekingalpha.com/news/4116269,
SeekingAlpha,Stock Market Volatility May Be Due For A Significant Move Higher,https://seekingalpha.com/article/4699293,
