feed,title,long_url,short_url
InsiderMonkey,"Constellation Brands, Inc. (STZ): Things Got Worse Just When You Thought They Couldn’t! Says Jim Cramer",https://insidermonkey.com/blog/--1602744,
InsiderMonkey,Campbell’s (CPB) Jumps 7% on Strong Earnings,https://insidermonkey.com/blog/--1603230,
InsiderMonkey,Rivian Automotive (RIVN) Jumps Ahead of 2 Conferences,https://insidermonkey.com/blog/--1603218,
InsiderMonkey,Ionis Pharma (IONS) Hits New High Anew as Analyst Sees Blockbuster Potential for Olezarsen,https://insidermonkey.com/blog/--1603222,
InsiderMonkey,Bitmine (BMNR) Soars Anew as ETH Treasuru Raises to $8.3 Billion,https://insidermonkey.com/blog/--1603223,
InsiderMonkey,Harmony (HMY) Jumps as Gold Hits Fresh Highs Anew,https://insidermonkey.com/blog/--1603224,
InsiderMonkey,Hims & Hers (HIMS) Steals Spotlight as Court Junks Eli Lilly Lawsuit vs 4 Telehealth Firms,https://insidermonkey.com/blog/--1603228,
InsiderMonkey,Oscar Health (OSCR) Climbs 7.6% as Investors Await Cues on Upcoming Conference,https://insidermonkey.com/blog/--1603232,
InsiderMonkey,NuScale (SMR) Soars 8.5% as Firm Clinches Largest SMR Deployment in US,https://insidermonkey.com/blog/--1603234,
InsiderMonkey,Alphabet (GOOG) Jumps 9% as Firm Spared From Forced Google Chrome Sale,https://insidermonkey.com/blog/--1603237,
InsiderMonkey,"Macy’s (M) Soars 21% on Sales Beat, Raised Growth Outlook",https://insidermonkey.com/blog/--1603239,
InsiderMonkey,10 Best Growth Stocks to Buy for the Next 2 Years,https://insidermonkey.com/blog/--1598096,
InsiderMonkey,Jim Cramer Says Burlington Has “No Real Tariff Exposure”,https://insidermonkey.com/blog/--1603097,
InsiderMonkey,Jim Cramer Says “It’s Painful to Watch Williams-Sonoma Get Dinged”,https://insidermonkey.com/blog/--1603105,
InsiderMonkey,Jim Cramer on Rush Street: “It’s Doing Really Well”,https://insidermonkey.com/blog/--1603108,
InsiderMonkey,Jim Cramer on Circle Internet: “I Need it to Come Down”,https://insidermonkey.com/blog/--1603111,
InsiderMonkey,Jim Cramer on EMCOR: “I Would Hold on to The Stock”,https://insidermonkey.com/blog/--1603114,
InsiderMonkey,Jim Cramer Says Amphenol is an “Amazing Company”,https://insidermonkey.com/blog/--1603117,
InsiderMonkey,Jim Cramer on Gap: “There’s Some Palpable Signs of Return Here”,https://insidermonkey.com/blog/--1603121,
InsiderMonkey,Jim Cramer on Axon: “They Just Keep Delivering Great Numbers”,https://insidermonkey.com/blog/--1603127,
