feed,title,long_url,short_url
SeekingAlpha,"Blade Air Mobility GAAP EPS of -$0.17 misses by $0.03, revenue of $60.99M beats by $7.14M",https://seekingalpha.com/news/3999918,
SeekingAlpha,Sharecare reports mixed Q2 earnings; initiates Q3 and reaffirms FY23 outlook,https://seekingalpha.com/news/3999917,
SeekingAlpha,"Penn National GAAP EPS of $0.48 beats by $0.01, revenue of $1.67B beats by $10M",https://seekingalpha.com/news/3999916,
SeekingAlpha,"Vertex Non-GAAP EPS of $0.08 in-line, revenue of $139.7M beats by $3.62M",https://seekingalpha.com/news/3999915,
SeekingAlpha,Nuvei reports mixed Q2 earnings; initiates Q3 and updates FY23 outlook,https://seekingalpha.com/news/3999914,
