feed,title,long_url,short_url
Investing,US House Financial Services Committee leadership takes opposing sides on the PayPal stablecoin,https://www.investing.com/news/cryptocurrency-news/us-house-financial-services-committee-leadership-takes-opposing-sides-on-the-paypal-stablecoin-3150433,https://da.gd/paWg
Investing,"$287,000 reportedly stolen in hack targeting Aave’s Earning Farm",https://www.investing.com/news/cryptocurrency-news/287000-reportedly-stolen-in-hack-targeting-aaves-earning-farm-3150404,https://da.gd/KqdxR6
Investing,"Stock market today: Dow, S&P 500 slip as tech continues bleed ahead of CPI",https://www.investing.com/news/stock-market-news/stock-market-today-dow-sp-500-slip-as-tech-continues-bleed-ahead-of-cpi-3150260,https://da.gd/WBG7WU
Investing,Disney Q3 revenue falls short as streaming business stutters,https://www.investing.com/news/stock-market-news/disney-q3-revenue-falls-short-as-streaming-business-stutters-3150431,https://da.gd/7RB6yH
Investing,Illumina falls after cutting full-year forecast,https://www.investing.com/news/stock-market-news/illumina-falls-after-cutting-fullyear-forecast-432SI-3150412,https://da.gd/qtRz
Investing,Two Sigma Turmoil: Co-Founders' Feud and Impending Divorce Stir Uncertainty,https://www.investing.com/news/stock-market-news/two-sigma-turmoil-cofounders-feud-and-impending-divorce-stir-uncertainty-3150408,https://da.gd/kUrr48
Investing,Illumina cuts annual profit forecast,https://www.investing.com/news/stock-market-news/illumina-cuts-annual-profit-forecast-3150384,https://da.gd/CLeSm
Investing,U.S. stocks lower at close of trade; Dow Jones Industrial Average down 0.54%,https://www.investing.com/news/stock-market-news/us-stocks-lower-at-close-of-trade-dow-jones-industrial-average-down-054-3150379,https://da.gd/m2FxG
Investing,Stock Market Today: Dow slides as sea of red in tech persists; inflation data eyed,https://www.investing.com/news/stock-market-news/stock-market-today-dow-slides-as-sea-of-red-in-tech-persists-inflation-data-eyed-3150378,https://da.gd/gg8Tn
Investing,Sonos gains 11% after reporting better-than-expected Q3 results,https://www.investing.com/news/stock-market-news/sonos-gains-11-after-reporting-betterthanexpected-q3-results-432SI-3150377,https://da.gd/OZeJZ
