feed,title,long_url,short_url
InsiderMonkey,Maran Capital Management’s Q4 2022 Investor Letter,https://insidermonkey.com/blog/--1120661,
InsiderMonkey,Here’s Why Paycom Software (PAYC) Declined in Q4,https://insidermonkey.com/blog/--1120646,
InsiderMonkey,Polen Capital Global SMID Company Growth Strategy’s Q4 2022 Investor Letter,https://insidermonkey.com/blog/--1120643,
InsiderMonkey,Economic Slowdown Impacted Globant S.A. (GLOB) in Q4,https://insidermonkey.com/blog/--1120640,
InsiderMonkey,Several Reasons for the Outperformance of Aon plc (AON) in Q4,https://insidermonkey.com/blog/--1120637,
InsiderMonkey,Polen Capital International Growth Strategy’s Q4 2022 Investor Letter,https://insidermonkey.com/blog/--1120634,
