feed,title,long_url,short_url
Benzinga,"GDRX INVESTOR FILING DEADLINE: Bernstein Liebhard LLP Reminds Investors of the Deadline to File a Lead Plaintiff Motion In a Securities Class Action Lawsuit Against GoodRx Holdings, Inc",https://www.benzinga.com/pressreleases/21/02/n19476707/gdrx-investor-filing-deadline-bernstein-liebhard-llp-reminds-investors-of-the-deadline-to-file-a-l,https://j.mp/3rijLnn
Benzinga,"Rhinebeck Bancorp, Inc. Reports Results for the Quarter and Year Ended December 31, 2020",https://www.benzinga.com/pressreleases/21/02/n19476697/rhinebeck-bancorp-inc-reports-results-for-the-quarter-and-year-ended-december-31-2020,https://j.mp/39N0QLP
Benzinga,"Helio Health to Participate in BTIG MedTech, Digital Health, Life Science & Diagnostic Tools Conference",https://www.benzinga.com/pressreleases/21/02/n19476694/helio-health-to-participate-in-btig-medtech-digital-health-life-science-diagnostic-tools-conferenc,https://j.mp/3ts9ebs
Benzinga,Quanterix Announces Proposed Public Offering of $200.0 Million of its Common Stock,https://www.benzinga.com/pressreleases/21/02/b19476693/quanterix-announces-proposed-public-offering-of-200-0-million-of-its-common-stock,https://j.mp/3rijKQl
Benzinga,State Of Illinois And ASCM Launch First-Of-Its-Kind Training Program To Prepare Residents For Jobs Fueled By Growing E-Commerce industry,https://www.benzinga.com/pressreleases/21/02/n19476680/state-of-illinois-and-ascm-launch-first-of-its-kind-training-program-to-prepare-residents-for-jobs,https://j.mp/3trEMxM
Benzinga,Trinseo Reports Fourth Quarter and Full-Year 2020 Financial Results,https://www.benzinga.com/pressreleases/21/02/b19476636/trinseo-reports-fourth-quarter-and-full-year-2020-financial-results,https://j.mp/3rnWKiT
Benzinga,Decarbonization Plus Acquisition Corporation II Announces Pricing of Initial Public Offering,https://www.benzinga.com/pressreleases/21/02/n19476624/decarbonization-plus-acquisition-corporation-ii-announces-pricing-of-initial-public-offering,https://j.mp/3tp5OWH
