feed,title,long_url,short_url
Benzinga,TSX Venture Exchange Stock Maintenance Bulletins,https://www.benzinga.com/pressreleases/21/02/n19479609/tsx-venture-exchange-stock-maintenance-bulletins,https://j.mp/3jdISVE
Benzinga,Global Payment Gateways Market Research 2020-2024 | COVID-19 Industry Planning Structure | Technavio,https://www.benzinga.com/pressreleases/21/02/b19479545/global-payment-gateways-market-research-2020-2024-covid-19-industry-planning-structure-technavio,https://j.mp/39HmTn0
Benzinga,A Day of Sharing & Caring,https://www.benzinga.com/pressreleases/21/02/n19479541/a-day-of-sharing-caring,https://j.mp/3atdnmM
Benzinga,"Tsutomu Foods Co.,Ltd. Launches SoyNyack, Gluten-free Konjac Noodles containing Soybeans in the United States",https://www.benzinga.com/pressreleases/21/02/g19479527/tsutomu-foods-co-ltd-launches-soynyack-gluten-free-konjac-noodles-containing-soybeans-in-the-unite,https://j.mp/36C1SYL
Benzinga,"GREENWERKS LLC Acquires New Assets, Licensed Cannabis Businesses, Multiple Revolutionary Technologies; Announces U.S First Nation Projects, Healing Centers and Global Expansions",https://www.benzinga.com/pressreleases/21/02/n19479523/greenwerks-llc-acquires-new-assets-licensed-cannabis-businesses-multiple-revolutionary-technologie,https://j.mp/36Hqfo3
Benzinga,Community Bankers Trust Corporation Announces Quarterly Dividend,https://www.benzinga.com/pressreleases/21/02/n19479511/community-bankers-trust-corporation-announces-quarterly-dividend,https://j.mp/36EhjzZ
