feed,title,long_url,short_url
Investing,"Reino Unido debe flexibilizar las exigencias de KYC para superar a Estados Unidos en lo que respecta a Web3, opina grupo de expertos",https://www.investing.com/news/cryptocurrency-news/reino-unido-debe-flexibilizar-las-exigencias-de-kyc-para-superar-a-estados-unidos-en-lo-que-respecta-a-web3-opina-grupo-de-expertos-3192569,https://da.gd/3os38
Investing,"La cuota de mercado de Binance en el mercado spot disminuye por séptimo mes consecutivo, según un informe",https://www.investing.com/news/cryptocurrency-news/la-cuota-de-mercado-de-binance-en-el-mercado-spot-disminuye-por-septimo-mes-consecutivo-segun-un-informe-3192568,https://da.gd/s1eCSw
Investing,"Alcistas de bitcoin mantienen presión sobre USD 28,000 y se comenta una caída del precio de BTC",https://www.investing.com/news/cryptocurrency-news/alcistas-de-bitcoin-mantienen-presion-sobre-usd-28000-y-se-comenta-una-caida-del-precio-de-btc-3192567,https://da.gd/ntLFSG
Investing,"El comercio minorista de stablecoins aún no está permitido en Hong Kong, según funcionario",https://www.investing.com/news/cryptocurrency-news/el-comercio-minorista-de-stablecoins-aun-no-esta-permitido-en-hong-kong-segun-funcionario-3192566,https://da.gd/WAFhZ
Investing,Los ETF de criptomonedas reciben inversiones millonarias pero están lejos del volumen del mercado spot,https://www.investing.com/news/cryptocurrency-news/los-etf-de-criptomonedas-reciben-inversiones-millonarias-pero-estan-lejos-del-volumen-del-mercado-spot-3192565,https://da.gd/OV1VJ
Investing,La empresa de criptomonedas CoinShares y su proyecto Komainu obtienen el registro de criptomonedas en el Reino Unido,https://www.investing.com/news/cryptocurrency-news/la-empresa-de-criptomonedas-coinshares-y-su-proyecto-komainu-obtienen-el-registro-de-criptomonedas-en-el-reino-unido-3192564,https://da.gd/6UYSHX
Investing,37XDubai: حيث يلتقي الفن بالتكنولوجيا,https://www.investing.com/news/cryptocurrency-news/37xdubai-----3192563,https://da.gd/Gyuz9
Investing,إيلون ماسك يدعو إلى إصلاح هيئة الأوراق المالية والبورصات ووزارة العدل وسط دعوى قضائية لفرض شهادته في تحقيق تويتر,https://www.investing.com/news/cryptocurrency-news/-------------------3192562,https://da.gd/rvnF
Investing,"ليدجر تسرِّح 12٪ من الموظفين، مشيرةً إلى ""الرياح المعاكسة للاقتصاد الكلي""",https://www.investing.com/news/cryptocurrency-news/--12---------3192561,https://da.gd/FprGMA
Investing,الهيئة التنظيمية الأوروبية تنشر الورقة الاستشارية الثانية حول قانون MiCA,https://www.investing.com/news/cryptocurrency-news/---------mica-3192560,https://da.gd/V3kxo9
Investing,"Gold up on day but in 3rd weekly loss, amid massive US jobs growth, Fed worry",https://www.investing.com/news/commodities-news/gold-up-on-day-but-in-3rd-weekly-loss-amid-massive-us-jobs-growth-fed-worry-3192553,https://da.gd/t7C9pW
Investing,What Wall St has to say on potential Exxon-Pioneer deal,https://www.investing.com/news/commodities-news/what-wall-st-has-to-say-on-potential-exxonpioneer-deal-3192547,https://da.gd/TSnfA
Investing,Pioneer shares jump on Exxon mega-merger talks,https://www.investing.com/news/stock-market-news/pioneer-shares-jump-on-merger-talks-with-exxon-3192468,https://da.gd/Q7Lm
Investing,NVIDIA Projected for 100% Earnings Growth Amid Crypto Market Rebound,https://www.investing.com/news/stock-market-news/nvidia-projected-for-100-earnings-growth-amid-crypto-market-rebound-93CH-3192552,https://da.gd/NZWPT
