feed,title,long_url,short_url
Investing,Do Kwon to reportedly appeal against court’s decision to extend detention,https://www.investing.com/news/cryptocurrency-news/do-kwon-to-reportedly-appeal-against-courts-decision-to-extend-detention-3040853,https://da.gd/mLQg1
Investing,Cardano (ADA) Price Prediction: What to Expect in the Next 48 Hours,https://www.investing.com/news/cryptocurrency-news/cardano-ada-price-prediction-what-to-expect-in-the-next-48-hours-3040809,https://da.gd/UylfRz
Investing,Crypto Analyst Identifies Major Pattern on NEO Price Chart,https://www.investing.com/news/cryptocurrency-news/crypto-analyst-identifies-major-pattern-on-neo-price-chart-3040808,https://da.gd/3Kd0
Investing,Alibaba hits new two-week high on news of Jack Ma's return to China,https://www.investing.com/news/stock-market-news/alibaba-hits-new-twoweek-high-on-news-of-jack-mas-return-to-china-3040761,https://da.gd/BiIm
Investing,Lebanon's cabinet reverses decision to delay daylight's savings,https://www.investing.com/news/economy/lebanons-cabinet-reverses-decision-to-delay-daylights-savings-3040862,https://da.gd/ixzpxU
