feed,title,long_url,short_url
TheStreet,Top Wall Street Analyst Highlights Bank Crisis Risk To Tesla Profits,https://www.thestreet.com/investing/stocks/top-wall-street-analyst-reveals-bank-crisis-risk-to-tesla-profits,https://da.gd/EozaGz
TheStreet,Jim Cramer Sees Positive Signs In the Ashes of Silicon Valley Bank,https://www.thestreet.com/personalities/jim-cramer-sees-positive-signs-in-the-ashes-of-silicon-valley-bank,https://da.gd/WV04
TheStreet,Why The SVB Collapse Poses a Risk For Your Future Investments,https://www.thestreet.com/investing/why-the-svb-collapse-poses-a-risk-for-your-future-investments,https://da.gd/mlwhvf
TheStreet,Iconic Las Vegas Casino Responds to 'No Color' Controversy,https://www.thestreet.com/travel/iconic-las-vegas-casino-responds-to-no-color-controversy,https://da.gd/NQupbK
TheStreet,Never Do This on a Carnival or Royal Caribbean Cruise Ship,https://www.thestreet.com/travel/never-do-this-on-a-carnival-or-royal-caribbean-cruise-ship,https://da.gd/FinGQx
