feed,title,long_url,short_url
ETFTrends,Drive Towards Electrification Metals for EVs With KARS & KMET,https://www.etftrends.com/climate-insights-channel/drive-towards-electrification-metals-for-evs-with-kars-kmet/,https://da.gd/UJRP5
ETFTrends,Tech ETFs Have the Right Ingredients for Tricky Market Environments,https://www.etftrends.com/etf-education-channel/tech-etfs-have-right-ingredients-for-tricky-market-environments/,https://da.gd/LJTx
ETFTrends,Compare the Cost of Managed Futures ETFs to Funds,https://www.etftrends.com/managed-futures-channel/compare-cost-managed-futures-etfs-funds/,https://da.gd/3bebXw
ETFTrends,Shades of ’87 as Treasury Yields Plummet,https://www.etftrends.com/etf-strategist-channel/shades-of-87-as-treasury-yields-plummet/,https://da.gd/6hzuqk
ETFTrends,"Despite Rise in EVs, Toyota CEO Also Prioritizes Hydrogen",https://www.etftrends.com/leveraged-inverse-channel/despite-rise-in-evs-toyota-ceo-also-prioritizes-hydrogen/,https://da.gd/WcPBJ
ETFTrends,It’s the Economy That Matters: Home Sales and More,https://www.etftrends.com/its-economy-that-matters-home-sales-more/,https://da.gd/MVb7YK
