feed,title,long_url,short_url
Investing,FTC announces investigation into Voyager’s ‘deceptive and unfair marketing’ of crypto,https://www.investing.com/news/cryptocurrency-news/ftc-announces-investigation-into-voyagers-deceptive-and-unfair-marketing-of-crypto-3010990,https://da.gd/fC0y
Investing,Trade group argues U.S. SEC case unfairly labels crypto as securities,https://www.investing.com/news/cryptocurrency-news/trade-group-argues-us-sec-case-unfairly-labels-crypto-as-securities-432SI-3010986,https://da.gd/6Fvwtj
Investing,Oil: Brent hangs by a thread to $80 support on U.S. rate hike fears,https://www.investing.com/news/commodities-news/oil-brent-hangs-by-a-thread-to-80-support-on-us-rate-hike-fears-3010985,https://da.gd/fCGZ8D
Investing,Explainer: The rise of 0DTE stock options and how they could be a risk to markets,https://www.investing.com/news/stock-market-news/explainer-the-rise-of-0dte-stock-options-and-how-they-could-be-a-risk-to-markets-3010991,https://da.gd/tGs2
Investing,Trade group argues U.S. SEC case unfairly labels crypto as securities,https://www.investing.com/news/stock-market-news/trade-group-argues-us-sec-case-unfairly-labels-crypto-as-securities-3010988,https://da.gd/FYkm
Investing,Third Point to launch proxy fight against Bath & Body Works - WSJ,https://www.investing.com/news/stock-market-news/third-point-to-launch-proxy-fight-against-bath--body-works--wsj-3010982,https://da.gd/6qHks2
Investing,RBNZ's Conway: more uncertainty around GDP projections due to cyclone,https://www.investing.com/news/economy/rbnzs-conway-more-uncertainty-around-gdp-projections-due-to-cyclone-3010983,https://da.gd/HyaQd
