feed,title,long_url,short_url
SeekingAlpha,"D. R. Horton EPS beats by $0.43, beats on revenue",https://seekingalpha.com/news/3595711,
SeekingAlpha,"Xerox EPS beats by $0.15, misses on revenue",https://seekingalpha.com/news/3595710,
SeekingAlpha,Flagstar EPS beats by $0.61,https://seekingalpha.com/news/3595709,
SeekingAlpha,"Arch Coal EPS misses by $0.58, beats on revenue",https://seekingalpha.com/news/3595708,
SeekingAlpha,"Zebra Technologies EPS beats by $0.13, beats on revenue",https://seekingalpha.com/news/3595707,
