feed,title,long_url,short_url
SeekingAlpha,"Seagate Technology EPS misses by $0.10, misses on revenue",https://seekingalpha.com/news/3596195,
SeekingAlpha,"Hawaiian Holdings EPS misses by $0.39, beats on revenue",https://seekingalpha.com/news/3596194,
SeekingAlpha,Glaxo shipping flu vaccine for upcoming season,https://seekingalpha.com/news/3596193,
SeekingAlpha,"Akamai EPS beats by $0.17, beats on revenue",https://seekingalpha.com/news/3596191,
SeekingAlpha,"Alerus Financial Corporation EPS beats by $0.34, beats on revenue",https://seekingalpha.com/news/3596190,
SeekingAlpha,"Luther Burbank EPS beats by $0.01, beats on revenue",https://seekingalpha.com/news/3596187,
