feed,title,long_url,short_url
InvestorPlace,ZURA Stock Alert: Zura Bio SPAC Merger Rally Ends,https://investorplace.com/2023/03/zura-stock-alert-zura-bio-spac-merger-rally-ends/,https://da.gd/bTde7
InvestorPlace,COIN Stock Alert: Cathie Wood Dumps Coinbase Ahead of SEC Warning,https://investorplace.com/2023/03/coin-stock-alert-cathie-wood-dumps-coinbase-ahead-of-sec-warning/,https://da.gd/GPBCrp
InvestorPlace,7 Cannabis Stocks That Can Make You a Millionaire as Legalization Spreads,https://investorplace.com/2023/03/7-cannabis-stocks-that-can-make-you-a-millionaire-as-legalization-spreads/,https://da.gd/MW1PHj
InvestorPlace,Accenture Layoffs 2023: What to Know About the Latest ACN Job Cuts,https://investorplace.com/2023/03/accenture-layoffs-2023-what-to-know-about-the-latest-acn-job-cuts/,https://da.gd/rCOs9
InvestorPlace,"Dear BBBY Stock Fans, Mark Your Calendars for April 3",https://investorplace.com/2023/03/dear-bbby-stock-fans-mark-your-calendars-for-april-3/,https://da.gd/2MmsB
InvestorPlace,AMC Stock Price Predictions: Will AMC Plunge to $1.60?,https://investorplace.com/2023/03/amc-stock-price-predictions-will-amc-plunge-to-1-60/,https://da.gd/bYwzEQ
