feed,title,long_url,short_url
Investing,Cointelegraph Markets Pro delivers alerts for 113% gains from 5 trades in the face of 10% BTC drop,https://www.investing.com/news/cryptocurrency-news/cointelegraph-markets-pro-delivers-alerts-for-113-gains-from-5-trades-in-the-face-of-10-btc-drop-3038136,https://da.gd/D1Udy
Investing,US SEC warns investors about risks of purchasing crypto asset securities,https://www.investing.com/news/cryptocurrency-news/us-sec-warns-investors-about-risks-of-purchasing-crypto-asset-securities-432SI-3038135,https://da.gd/9RND9D
Investing,Twitter CEO Raises Voice Against Fed’s ‘Foolish’ Interest Hikes,https://www.investing.com/news/cryptocurrency-news/twitter-ceo-raises-voice-against-feds-foolish-interest-hikes-3038124,https://da.gd/1o2a0z
Investing,Explainer-What are depleted uranium weapons - and what are the risks?,https://www.investing.com/news/commodities-news/explainerwhat-are-depleted-uranium-weapons--and-what-are-the-risks-3038138,https://da.gd/ZngLk
Investing,US SEC warns investors about risks of purchasing crypto asset securities,https://www.investing.com/news/economy/us-sec-warns-investors-about-risks-of-purchasing-crypto-asset-securities-3038137,https://da.gd/n0CutW
