feed,title,long_url,short_url
ETFTrends,Ninth Consecutive Year for Iberdrola on Most Ethical Companies List,https://www.etftrends.com/dual-impact-channel/ninth-consecutive-year-for-iberdrola-on-most-ethical-companies-list/,https://bit.ly/3u4yHsw
ETFTrends,"Russian Aggression Belies Opportunities With European Stocks, ETFs",https://www.etftrends.com/model-portfolio-channel/russian-aggression-belies-opportunities-with-european-stocks-etfs/,https://bit.ly/3tpNE9z
ETFTrends,Buying Opportunities Emerge in Big Tech,https://www.etftrends.com/nasdaq-portfolio-solutions-channel/buying-opportunities-emerge-in-big-tech/,https://bit.ly/3wahsIX
ETFTrends,KraneShares Adds to Climate Suite With Carbon Transformation ETF,https://www.etftrends.com/climate-insights-channel/kraneshares-adds-to-climate-suite-with-carbon-transformation-etf/,https://bit.ly/3MWfLEJ
ETFTrends,2 Options to Consider if Bond Yields Hit Tech Stocks,https://www.etftrends.com/leveraged-inverse-channel/2-options-to-consider-if-bond-yields-hit-tech-stocks/,https://bit.ly/3KSvTVV
ETFTrends,Russians Snap Up Gold Amid Flight to Safe Haven Assets,https://www.etftrends.com/thematic-investing-channel/russians-snap-up-gold-amid-flight-to-safe-haven-assets/,https://bit.ly/36qA9xe
ETFTrends,Advisors Demanding More ESG Clarity,https://www.etftrends.com/esg-channel/advisors-demanding-more-esg-clarity/,https://bit.ly/3MWck16
ETFTrends,Consider QCON as Rates Rise,https://www.etftrends.com/core-strategies-channel/consider-qcon-as-rates-rise/,https://bit.ly/3MWcky8
ETFTrends,Online Retail Still Pivotal Catalyst for This Internet ETF,https://www.etftrends.com/disruptive-technology-channel/online-retail-still-pivotal-catalyst-for-this-internet-etf/,https://bit.ly/363ZBsu
