feed,title,long_url,short_url
InsiderMonkey,Gurhan Kiziloz Looked Inward to Build Nexus – Now it’s on the Verge of a $1.45bn Revenue Year,https://insidermonkey.com/blog/--1574725,
InsiderMonkey,He Takes Every Risk and Hears No One: Inside Gurhan Kiziloz’s $400M Solo Build,https://insidermonkey.com/blog/--1574722,
InsiderMonkey,The 10 Most Trusted Crypto Recovery Companies in 2025,https://insidermonkey.com/blog/--1574716,
InsiderMonkey,13 Stocks Jim Cramer Looked At,https://insidermonkey.com/blog/--1574163,
InsiderMonkey,How Emerging Technologies Are Reshaping Investment Strategies for 2025,https://insidermonkey.com/blog/--1574711,
InsiderMonkey,Analyst Explains How NVIDIA (NVDA) Can Reach $8 Trillion Market Cap,https://insidermonkey.com/blog/--1572893,
InsiderMonkey,"Cleveland-Cliffs Inc. (CLF): “They Buy Almost All American,” Says Jim Cramer",https://insidermonkey.com/blog/--1573983,
InsiderMonkey,"Apple (AAPL) Isn’t Going To Buy Perplexity, Says Jim Cramer",https://insidermonkey.com/blog/--1574591,
InsiderMonkey,"Coinbase Global (COIN): “For All I Know It’s A Pump And Dump, I Don’t See Anybody Dumping?” Says Jim Cramer",https://insidermonkey.com/blog/--1574590,
InsiderMonkey,"DoorDash (DASH): CEO’s “A Hitter,” Says Jim Cramer",https://insidermonkey.com/blog/--1574588,
InsiderMonkey,"Domino’s Pizza, (DPZ): “Be Prepared To Be steamrolled,” Says Jim Cramer",https://insidermonkey.com/blog/--1574587,
InsiderMonkey,"Sarepta Therapeutics (SRPT): “They Should Be Prosecuted,” Says Jim Cramer",https://insidermonkey.com/blog/--1574586,
InsiderMonkey,"Palo Alto Networks (PANW): “.These Guys Are Frantically Getting Customers,” Says Jim Cramer",https://insidermonkey.com/blog/--1574583,
InsiderMonkey,"Asbury Automotive Group, Inc. (ABG): A Bull Case Theory",https://insidermonkey.com/blog/--1573399,
InsiderMonkey,Brookfield Asset Management Ltd. (BAM): A Bull Case Theory,https://insidermonkey.com/blog/--1573402,
InsiderMonkey,"Cogent Communications Holdings, Inc. (CCOI): A Bull Case Theory",https://insidermonkey.com/blog/--1573406,
InsiderMonkey,"ACM Research, Inc. (ACMR): A Bull Case Theory",https://insidermonkey.com/blog/--1573535,
InsiderMonkey,"Microsoft (MSFT) “Is More Vulnerable Than People Realize,” Says Jim Cramer",https://insidermonkey.com/blog/--1574585,
InsiderMonkey,Constellation Energy Corporation (CEG): A Bull Case Theory,https://insidermonkey.com/blog/--1573409,
InsiderMonkey,Chemed Corporation (CHE): A Bull Case Theory,https://insidermonkey.com/blog/--1573413,
