feed,title,long_url,short_url
Investing,Tether Holdings invests $500 million in Bitcoin mining expansion,https://www.investing.com/news/cryptocurrency-news/tether-holdings-invests-500-million-in-bitcoin-mining-expansion-93CH-3236633,https://da.gd/20dG
Investing,Hashing It Out: How Web3 is causing an evolution of traditional finance,https://www.investing.com/news/cryptocurrency-news/hashing-it-out-how-web3-is-causing-an-evolution-of-traditional-finance-3236631,https://da.gd/EByw
Investing,Industrial production in US declines more than expected in October,https://www.investing.com/news/stock-market-news/industrial-production-in-us-declines-more-than-expected-in-october-93CH-3236642,https://da.gd/LlLU
Investing,CRISPR Therapeutics' gene therapy Casgevy wins UK approval,https://www.investing.com/news/stock-market-news/crispr-therapeutics-gene-therapy-casgevy-wins-uk-approval-93CH-3236639,https://da.gd/1BTiz
Investing,DoorDash will be a prime beneficiary of digital transformation trends - Deutsche Bank,https://www.investing.com/news/stock-market-news/doordash-will-be-a-prime-beneficiary-of-digital-transformation-trends--deutsche-bank-432SI-3236635,https://da.gd/ewCtk
Investing,"Williams-Sonoma (NYSE:WSM) Misses Q3 Sales Targets, Full Year Revenue Guide Lowered",https://www.investing.com/news/stock-market-news/williamssonoma-nysewsm-misses-q3-sales-targets-full-year-revenue-guide-lowered-3236634,https://da.gd/t5zdSb
Investing,AMTE Power shares surge 170% on new funding agreements,https://www.investing.com/news/stock-market-news/amte-power-shares-surge-170-on-new-funding-agreements-93CH-3236625,https://da.gd/HHXT5E
Investing,Boston Beer shares seesaw amid valuation concerns and growth outlook,https://www.investing.com/news/stock-market-news/boston-beer-shares-seesaw-amid-valuation-concerns-and-growth-outlook-93CH-3236624,https://da.gd/qTv2
Investing,FMC Corporation faces lawsuit over alleged patent protection misinformation,https://www.investing.com/news/stock-market-news/fmc-corporation-faces-lawsuit-over-alleged-patent-protection-misinformation-93CH-3236638,https://da.gd/J8qY8x
Investing,Homebuilder confidence weakens again but easing rates may brighten the outlook - NAHB,https://www.investing.com/news/economic-indicators/homebuilder-confidence-weakens-again-but-easing-rates-may-brighten-the-outlook--nahb-3236640,https://da.gd/bQiDSR
Investing,Canada Infrastructure Bank boosts EV charging network with $210M deal,https://www.investing.com/news/economy/canada-infrastructure-bank-boosts-ev-charging-network-with-210m-deal-93CH-3236637,https://da.gd/koMLl
