feed,title,long_url,short_url
Investing,Brazil’s crypto regulatory environment is driving competitiveness — Coinext CEO,https://www.investing.com/news/cryptocurrency-news/brazils-crypto-regulatory-environment-is-driving-competitiveness--coinext-ceo-3236908,https://da.gd/vJ4FN
Investing,Ripple executive criticizes SEC after legal setbacks,https://www.investing.com/news/cryptocurrency-news/ripple-executive-criticizes-sec-after-legal-setbacks-93CH-3236895,https://da.gd/8mbhX
Investing,Marsh & McLennan introduces Unity for Ukrainian grain export insurance,https://www.investing.com/news/stock-market-news/marsh--mclennan-introduces-unity-for-ukrainian-grain-export-insurance-93CH-3236907,https://da.gd/bKQQ
Investing,"Citi downgrades Plug Power, stock falls 7.1% amid liquidity concerns",https://www.investing.com/news/stock-market-news/citi-downgrades-plug-power-stock-falls-71-amid-liquidity-concerns-93CH-3236905,https://da.gd/R0wwf
Investing,Dynacor Group stock climbs 6.5% in recent quarter,https://www.investing.com/news/stock-market-news/dynacor-group-stock-climbs-65-in-recent-quarter-93CH-3236904,https://da.gd/iwJvt
Investing,Israeli private detective sentenced in US to 6-2/3 years for hacker-for-hire scheme,https://www.investing.com/news/stock-market-news/israeli-private-detective-sentenced-in-us-to-623-years-for-hackerforhire-scheme-3236902,https://da.gd/V73Ltl
Investing,Morgan Stanley forecasts economic upturn in Nigeria under President Tinubu,https://www.investing.com/news/stock-market-news/morgan-stanley-forecasts-economic-upturn-in-nigeria-under-president-tinubu-93CH-3236901,https://da.gd/YuyC
Investing,California regulator to decide on PG&E base rate hike request,https://www.investing.com/news/stock-market-news/california-regulator-to-decide-on-pge-base-rate-hike-request-3236896,https://da.gd/6ozran
Investing,JPMorgan thrives amid banking sector challenges with earnings growth,https://www.investing.com/news/stock-market-news/jpmorgan-thrives-amid-banking-sector-challenges-with-earnings-growth-93CH-3236900,https://da.gd/NMU0x
Investing,DBS Group outperforms Toronto-Dominion Bank in investment analysis,https://www.investing.com/news/economy/dbs-group-outperforms-torontodominion-bank-in-investment-analysis-93CH-3236906,https://da.gd/vaJE6
