feed,title,long_url,short_url
SeekingAlpha,Cresco Labs beats on revenue,https://seekingalpha.com/news/3607646,
SeekingAlpha,"Keysight EPS beats by $0.35, beats on revenue",https://seekingalpha.com/news/3607644,
SeekingAlpha,"GAN EPS misses by $0.32, beats on revenue",https://seekingalpha.com/news/3607640,
SeekingAlpha,"Ross Stores EPS beats by $0.16, beats on revenue",https://seekingalpha.com/news/3607639,
SeekingAlpha,Updated FDA adverse event data on breast implants show no definitive link to cancer,https://seekingalpha.com/news/3607637,
SeekingAlpha,"OSI Systems EPS beats by $0.12, misses on revenue",https://seekingalpha.com/news/3607638,
