feed,title,long_url,short_url
Investing,S&P 500: Failed Rally Leaves Door Open for a Bigger Breakdown,https://www.investing.com/analysis/sp-500-failed-rally-leaves-door-open-for-a-bigger-breakdown-200658250,https://da.gd/Cv2EK
Investing,Deutsche Bank sees 2025 revenue gains at all four main businesses,https://www.investing.com/news/stock-market-news/deutsche-bank-sees-2025-revenue-gains-at-all-four-main-businesses-3925841,https://da.gd/FrZUl
Investing,UK's Savills sees office return driving 2025 transaction volumes,https://www.investing.com/news/stock-market-news/uks-savills-sees-office-return-driving-2025-transaction-volumes-3925839,https://da.gd/4SbXpw
Investing,BNP Paribas BP's reports 132% surge in full-year net profit,https://www.investing.com/news/stock-market-news/bnp-paribas-bps-reports-132-surge-in-fullyear-net-profit-3925806,https://da.gd/hImu7L
Investing,Gazprom's grandeur fades as Europe abandons Russian gas,https://www.investing.com/news/stock-market-news/gazproms-grandeur-fades-as-europe-abandons-russian-gas-3925804,https://da.gd/EMT86
Investing,Japan stocks lower at close of trade; Nikkei 225 down 0.03%,https://www.investing.com/news/stock-market-news/japan-stocks-lower-at-close-of-trade-nikkei-225-down-003-3925801,https://da.gd/fxDIGg
Investing,"South Africa's budget may be tweaked further, finance minister says",https://www.investing.com/news/economy-news/south-africas-budget-may-be-tweaked-further-finance-minister-says-3925792,https://da.gd/tV1L9E
