feed,title,long_url,short_url
Cointelegraph,"Turkey tightens crypto regulations with new rules for exchanges, custodians",https://cointelegraph.com/news/turkey-regulator-cmb-two-docs-crypto-regulation?utm_source=rss_feed&utm_medium=rss%3Ft%3D1741866982739&utm_campaign=rss_partner_inbound,https://da.gd/SibRDB
Cointelegraph,"USDC, USDt stablecoins are ‘store of value’ in Latin America — Bitso",https://cointelegraph.com/news/usdc-usdt-stablecoin-store-of-value-latin-america-bitso?utm_source=rss_feed&utm_medium=rss%3Ft%3D1741866982739&utm_campaign=rss_partner_inbound,https://da.gd/5I81K
Cointelegraph,Will Bitcoin price reclaim $95K before the end of March?,https://cointelegraph.com/news/will-bitcoin-price-reclaim-95k-before-end-march?utm_source=rss_feed&utm_medium=rss%3Ft%3D1741866982739&utm_campaign=rss_partner_inbound,https://da.gd/HwcE5w
Cointelegraph,Bybit CEO on ‘brutal’ $4M Hyperliquid loss: Lower leverage as positions grow,https://cointelegraph.com/news/hyperliquid-4-million-loss-leverage-eth-trader?utm_source=rss_feed&utm_medium=rss%3Ft%3D1741866982739&utm_campaign=rss_partner_inbound,https://da.gd/rzcf6
Cointelegraph,"Europeans show little interest in digital euro, ECB study reveals",https://cointelegraph.com/news/europeans-reject-digital-euro-ecb-survey?utm_source=rss_feed&utm_medium=rss%3Ft%3D1741866982739&utm_campaign=rss_partner_inbound,https://da.gd/3NKLm
Cointelegraph,3 reasons why Ethereum can outperform its rivals after crashing to 17-month lows,https://cointelegraph.com/news/ethereum-can-outperform-rivals-crashing-17-month-lows?utm_source=rss_feed&utm_medium=rss%3Ft%3D1741866982739&utm_campaign=rss_partner_inbound,https://da.gd/6xpfh
Cointelegraph,How to buy Bitcoin with a credit card,https://cointelegraph.com/news/how-to-buy-bitcoin-with-a-credit-card?utm_source=rss_feed&utm_medium=rss%3Ft%3D1741866982739&utm_campaign=rss_partner_inbound,https://da.gd/AXuGV
Cointelegraph,Bitcoin must secure weekly close above $89K to confirm bottom has passed,https://cointelegraph.com/news/bitcoin-price-weekly-close-89k-bottom-resume-uptrend-crypto-analyst?utm_source=rss_feed&utm_medium=rss%3Ft%3D1741866982739&utm_campaign=rss_partner_inbound,https://da.gd/PWibO3
Cointelegraph,Ethereum 'falling knife' warning: Is another 30% crash versus Bitcoin coming?,https://cointelegraph.com/news/ethereum-falling-knife-another-30-crash-bitcoin?utm_source=rss_feed&utm_medium=rss%3Ft%3D1741866982739&utm_campaign=rss_partner_inbound,https://da.gd/p0pz3
Cointelegraph,Crypto founders report deluge of North Korean fake Zoom hacking attempts,https://cointelegraph.com/news/crypto-founders-report-deluge-of-north-korean-fake-zoom-hacking-attempts?utm_source=rss_feed&utm_medium=rss%3Ft%3D1741866982739&utm_campaign=rss_partner_inbound,https://da.gd/yzOL5j
Cointelegraph,"Lazarus Group sends 400 ETH to Tornado Cash, deploys new malware",https://cointelegraph.com/news/lazarus-group-deposits-400-eth-into-tornado-cash-new-malware?utm_source=rss_feed&utm_medium=rss%3Ft%3D1741866982739&utm_campaign=rss_partner_inbound,https://da.gd/3MvEMV
Cointelegraph,Argentine lawyer requests Interpol red notice for LIBRA creator: Report,https://cointelegraph.com/news/argentina-lawyer-interpol-arrest-warrant-libra-creator?utm_source=rss_feed&utm_medium=rss%3Ft%3D1741866982739&utm_campaign=rss_partner_inbound,https://da.gd/8HCa
Cointelegraph,Ripple secures Dubai license to offer crypto payments in UAE,https://cointelegraph.com/news/ripple-crypto-payments-license-dubai-regulator-difc?utm_source=rss_feed&utm_medium=rss%3Ft%3D1741866982739&utm_campaign=rss_partner_inbound,https://da.gd/IAxJq
Cointelegraph,"Nebraska governor signs bill to regulate crypto ATMs, citing growing fraud",https://cointelegraph.com/news/nebraska-governor-signs-crypto-atm-fraud-protection-bill?utm_source=rss_feed&utm_medium=rss%3Ft%3D1741866982739&utm_campaign=rss_partner_inbound,https://da.gd/ZRQUAM
Cointelegraph,Hardware wallet Ledger helps competitor Trezor resolve security vulnerability,https://cointelegraph.com/news/trezor-resolves-security-flaw-identified-by-ledger?utm_source=rss_feed&utm_medium=rss%3Ft%3D1741866982739&utm_campaign=rss_partner_inbound,https://da.gd/7SmyLs
Cointelegraph,ETH/BTC hits 5-year low as trader suggests rotation into stronger alts,https://cointelegraph.com/news/ether-bitcoin-ratio-multi-year-low-rotate-altcoins-crypto-analyst?utm_source=rss_feed&utm_medium=rss%3Ft%3D1741866982739&utm_campaign=rss_partner_inbound,https://da.gd/ATOjr
Cointelegraph,Traders could be prepping to buy as USDT activity hits 6-month high,https://cointelegraph.com/news/tether-on-chain-activity-hits-six-month-high-traders-could-be-preparing-buy-santiment?utm_source=rss_feed&utm_medium=rss%3Ft%3D1741866982739&utm_campaign=rss_partner_inbound,https://da.gd/eHMYR
Cointelegraph,"Crypto trading volume slumps, signaling market exhaustion: Analysis",https://cointelegraph.com/news/crypto-trading-volume-decline-reflects-diminishing-trader-enthusiasm-analysts?utm_source=rss_feed&utm_medium=rss%3Ft%3D1741866982739&utm_campaign=rss_partner_inbound,https://da.gd/4TFbqD
Cointelegraph,"Crypto trader gets sandwich attacked in stablecoin swap, loses $215K",https://cointelegraph.com/news/crypto-trader-loses-least-215000-stablecoins-from-sandwich-attack?utm_source=rss_feed&utm_medium=rss%3Ft%3D1741866982739&utm_campaign=rss_partner_inbound,https://da.gd/1gBYy
Cointelegraph,US CPI comes in lower than expected — Are rate cuts coming?,https://cointelegraph.com/news/us-cpi-lower-expected-rate-cuts-coming?utm_source=rss_feed&utm_medium=rss%3Ft%3D1741866982739&utm_campaign=rss_partner_inbound,https://da.gd/flLlZ2
Cointelegraph,Here’s what happened in crypto today,https://cointelegraph.com/news/what-happened-in-crypto-today?utm_source=rss_feed&utm_medium=rss%3Ft%3D1741866982739&utm_campaign=rss_partner_inbound,https://da.gd/gb2isF
Cointelegraph,Rumble embraces Trump-era crypto strategy with $17M BTC purchase,https://cointelegraph.com/news/rumble-bitcoin-purchase-donald-trump-inflation-hedge?utm_source=rss_feed&utm_medium=rss%3Ft%3D1741866982739&utm_campaign=rss_partner_inbound,https://da.gd/DPcf74
Cointelegraph,Banks acting as validators risks centralization — Everstake exec,https://cointelegraph.com/news/banks-as-validators-risks-centralization-everstake-exec?utm_source=rss_feed&utm_medium=rss%3Ft%3D1741866982739&utm_campaign=rss_partner_inbound,https://da.gd/XYaqMU
Cointelegraph,Crypto exchange OKX secures MiFID II license in Europe,https://cointelegraph.com/news/crypto-exchange-okx-mifidii-license-europe?utm_source=rss_feed&utm_medium=rss%3Ft%3D1741866982739&utm_campaign=rss_partner_inbound,https://da.gd/D5SEcX
Cointelegraph,"Bitcoin dominance hits new highs, alts fade: Research",https://cointelegraph.com/news/bitcoin-dominance-reaches-new-highs-alts-fade?utm_source=rss_feed&utm_medium=rss%3Ft%3D1741866982739&utm_campaign=rss_partner_inbound,https://da.gd/g4Uk2I
Cointelegraph,Sui Foundation onboards Blockaid to enhance ecosystem security,https://cointelegraph.com/news/sui-foundation-blockaid-ecosystem-security?utm_source=rss_feed&utm_medium=rss%3Ft%3D1741866982739&utm_campaign=rss_partner_inbound,https://da.gd/KNGQUR
Cointelegraph,SEC postpones ruling on Fidelity Ether ETF options,https://cointelegraph.com/news/sec-delays-decision-on-fidelity-eth-etf-options?utm_source=rss_feed&utm_medium=rss%3Ft%3D1741866982739&utm_campaign=rss_partner_inbound,https://da.gd/BgdjJ
Cointelegraph,SEC’s enforcement case against Ripple may be wrapping up,https://cointelegraph.com/news/sec-enforcement-case-ripple-labs-ending?utm_source=rss_feed&utm_medium=rss%3Ft%3D1741866982739&utm_campaign=rss_partner_inbound,https://da.gd/4WAN
Cointelegraph,"Axie Infinity’s new Web3 game, LVMH sued over NFT patent: Nifty Newsletter",https://cointelegraph.com/news/axie-infinity-web3-game-lvmh-nft-patent-lawsuit-newsletter?utm_source=rss_feed&utm_medium=rss%3Ft%3D1741866982739&utm_campaign=rss_partner_inbound,https://da.gd/9p9UJ0
Cointelegraph,Cboe BZX files Solana ETF application on behalf of Franklin Templeton,https://cointelegraph.com/news/cboe-files-solana-etf-application-behalf-franklin-templeton?utm_source=rss_feed&utm_medium=rss%3Ft%3D1741866982739&utm_campaign=rss_partner_inbound,https://da.gd/Jjmq0s
Cointelegraph,Twitter User Claims TradingView Has Ignored a Fibonacci Retracement Bug for 5 Years,https://cointelegraph.com/news/twitter-user-claims-tradingview-has-ignored-a-fibonacci-retracement-bug-for-5-years?utm_source=rss_feed&utm_medium=rss%3Ft%3D1741866982739&utm_campaign=rss_partner_inbound,https://da.gd/6v7VMm
