feed,title,long_url,short_url
Investing,Stock Market Outlook 2023: Risks Skewed to the Downside,https://www.investing.com/analysis/stock-market-outlook-2023-risks-skewed-to-the-downside-200633732,https://da.gd/z2CVsY
Investing,FTX customers file class-action lawsuit to get priority reparations,https://www.investing.com/news/cryptocurrency-news/ftx-customers-file-classaction-lawsuit-to-get-priority-reparations-2970989,https://da.gd/bEzJJZ
Investing,Tiffany Fong Slams NY Post For Sensational Article on SBF Interview,https://www.investing.com/news/cryptocurrency-news/tiffany-fong-slams-ny-post-for-sensational-article-on-sbf-interview-2970987,https://da.gd/6YvED
Investing,Biden tax credits aim to jolt electric delivery truck demand,https://www.investing.com/news/stock-market-news/biden-tax-credits-aim-to-jolt-electric-delivery-truck-demand-2970990,https://da.gd/BWvne
Investing,"Bolivia to protect big-state economic model, plans‘aggressive’ gas push: minister",https://www.investing.com/news/economic-indicators/bolivia-to-protect-bigstate-economic-model-plansaggressive-gas-push-minister-2970991,https://da.gd/Sisd
Investing,Italy's parliament gives final approval to government's 2023 budget,https://www.investing.com/news/economy/italys-parliament-gives-final-approval-to-governments-2023-budget-2970986,https://da.gd/FadMGD
