feed,title,long_url,short_url
Yahoo,2 Top Artificial Intelligence (AI) Stocks Ready for a Bull Run,https://finance.yahoo.com/news/2-top-artificial-intelligence-ai-101200793.html,https://da.gd/Ymbt
Yahoo,Cathie Wood's Ark Innovation ETF Is Soaring. Can It Make You a Millionaire?,https://www.fool.com/investing/2023/12/14/cathie-woods-ark-innovation-etf-soar-millionaire/?source=eptyholnk0000202&utm_source=yahoo-host-full&utm_medium=feed&utm_campaign=article&.tsrc=rss,https://da.gd/MMRzO
Yahoo,Is Rivian the Best EV Stock to Own in 2024?,https://www.fool.com/investing/2023/12/14/is-rivian-the-best-ev-stock-to-own-in-2024/?source=eptyholnk0000202&utm_source=yahoo-host-full&utm_medium=feed&utm_campaign=article&.tsrc=rss,https://da.gd/kPfe0
Yahoo,2 Top Artificial Intelligence (AI) Stocks Ready for a Bull Run,https://www.fool.com/investing/2023/12/14/2-top-artificial-intelligence-ai-stocks-ready-for/?source=eptyholnk0000202&utm_source=yahoo-host-full&utm_medium=feed&utm_campaign=article&.tsrc=rss,https://da.gd/AWuE
Yahoo,"A Bull Market Is Coming: The 2 Best ""Magnificent Seven"" Stocks to Buy Now, According to Wall Street",https://www.fool.com/investing/2023/12/14/bull-market-coming-best-stocks-to-buy-wall-street/?source=eptyholnk0000202&utm_source=yahoo-host-full&utm_medium=feed&utm_campaign=article&.tsrc=rss,https://da.gd/eprO
