feed,title,long_url,short_url
Investing,Gensler Repeats Concerns That Crypto Lacks Sufficient Oversight - Bloomberg,https://www.investing.com/news/cryptocurrency-news/gensler-repeats-concerns-that-crypto-lacks-sufficient-oversight--bloomberg-432SI-3256890,https://da.gd/N53v
Investing,"US FDA warns Chewy, others over selling unapproved animal antibiotics",https://www.investing.com/news/stock-market-news/us-fda-warns-chewy-others-over-selling-unapproved-animal-antibiotics-3256899,https://da.gd/d7VyI
Investing,Wall Street Embraces Federal Reserve's Monetary Pivot,https://www.investing.com/news/stock-market-news/wall-street-embraces-federal-reserves-monetary-pivot-3256897,https://da.gd/E8tD
Investing,U.S. Dollar Falls as Fed Signals Shift Towards Rate Cuts,https://www.investing.com/news/stock-market-news/us-dollar-falls-as-fed-signals-shift-towards-rate-cuts-3256896,https://da.gd/EruU8
Investing,FTC Set to Rule on Controversial Kroger-Albertsons Deal in January,https://www.investing.com/news/stock-market-news/ftc-set-to-rule-on-controversial-krogeralbertsons-deal-in-january-3256895,https://da.gd/RRcg
Investing,"ECB Holds Rates Steady, Accelerates Exit from Pandemic Stimulus",https://www.investing.com/news/stock-market-news/ecb-holds-rates-steady-accelerates-exit-from-pandemic-stimulus-3256894,https://da.gd/vyJl6
Investing,Starbucks Faces Legal Battle Over Closure of Unionized Stores,https://www.investing.com/news/stock-market-news/starbucks-faces-legal-battle-over-closure-of-unionized-stores-3256893,https://da.gd/l2yVWx
Investing,Denmark stocks higher at close of trade; OMX Copenhagen 20 up 0.31%,https://www.investing.com/news/stock-market-news/denmark-stocks-higher-at-close-of-trade-omx-copenhagen-20-up-031-3256891,https://da.gd/RYjqx
