feed,title,long_url,short_url
Investing,"onsemi: What the Market Gets Wrong, You Can Get Right",https://www.investing.com/analysis/onsemi-what-the-market-gets-wrong-you-can-get-right-200683058,
Investing,Broadcom’s Selloff Looks More Like Valuation Reset Than AI Demand Collapse,https://www.investing.com/analysis/broadcoms-selloff-looks-more-like-valuation-reset-than-ai-demand-collapse-200683057,
Investing,Amazon’s AWS commits $1 billion toward new unit for embedded AI engineers,https://www.investing.com/news/stock-market-news/amazons-aws-commits-1-billion-toward-new-unit-for-embedded-ai-engineers-4768286,
Investing,Pasqal CEO: Aramco deal shows quantum computing moving from research to reality,https://www.investing.com/news/stock-market-news/pasqal-ceo-aramco-deal-shows-quantum-computing-moving-from-research-to-reality-4768285,
Investing,Shell warns LNG supply may fall on Hormuz disruption,https://www.investing.com/news/stock-market-news/shell-warns-lng-supply-may-fall-on-hormuz-disruption-93CH-4768278,
