feed,title,long_url,short_url
Investing,Silver Needs a Close Above 60.88 to Confirm the Correction Is Over,https://www.investing.com/analysis/silver-needs-a-close-above-6088-to-confirm-the-correction-is-over-200683065,
Investing,"C1 Fund CEO defends NAV gap, says digital asset IPO pipeline most active in years",https://www.investing.com/news/stock-market-news/c1-fund-ceo-defends-nav-gap-says-digital-asset-ipo-pipeline-most-active-in-years-4768428,
Investing,Blue Origin shifts to hybrid launch system after rocket explosion,https://www.investing.com/news/stock-market-news/blue-origin-shifts-to-hybrid-launch-system-after-rocket-explosion-4768427,
Investing,FDA clears PM’s Zyn to market as lower cancer risk than cigarettes in 20 variants,https://www.investing.com/news/stock-market-news/fda-clears-pms-zyn-to-market-as-lower-cancer-risk-than-cigarettes-in-20-variants-4768425,
Investing,"ECB may delay rate decision until September, says Dolenc",https://www.investing.com/news/economy-news/ecb-may-delay-rate-decision-until-september-says-dolenc-93CH-4768431,
