feed,title,long_url,short_url
Nasdaq,Relative Strength Alert For Laureate Education,https://www.nasdaq.com/articles/relative-strength-alert-for-laureate-education-2021-04-22,https://j.mp/3epo7Ev
Nasdaq,Emergent BioSolutions is Now Oversold (EBS),https://www.nasdaq.com/articles/emergent-biosolutions-is-now-oversold-ebs-2021-04-22,https://j.mp/2PeviHb
Nasdaq,Xilinx (XLNX) Shares Cross Below 200 DMA,https://www.nasdaq.com/articles/xilinx-xlnx-shares-cross-below-200-dma-2021-04-22,https://j.mp/3vbUMnJ
Nasdaq,Chile mining unions threaten action over government bid to block pensions withdrawal,https://www.nasdaq.com/articles/chile-mining-unions-threaten-action-over-government-bid-to-block-pensions-withdrawal-0,https://j.mp/3vbUQnt
Nasdaq,Here's Why Ocugen Stock Skyrocketed Today,https://www.nasdaq.com/articles/heres-why-ocugen-stock-skyrocketed-today-2021-04-22,https://j.mp/3ndu3EG
Nasdaq,TerrAscend Acquiring 3 Pennsylvania Marijuana Dispensaries for $63 Million,https://www.nasdaq.com/articles/terrascend-acquiring-3-pennsylvania-marijuana-dispensaries-for-%2463-million-2021-04-22,https://j.mp/3neDFiE
Nasdaq,Could MGM Resorts Have a 26% Upside?,https://www.nasdaq.com/articles/could-mgm-resorts-have-a-26-upside-2021-04-22,https://j.mp/3dGhxu8
Nasdaq,"Snap Q1 Results Beat Street View On User Growth, Shares Up 5%",https://www.nasdaq.com/articles/snap-q1-results-beat-street-view-on-user-growth-shares-up-5-2021-04-22,https://j.mp/32BVyOR
Nasdaq,Mattel Posts Narrower-than Expected Q1 Loss,https://www.nasdaq.com/articles/mattel-posts-narrower-than-expected-q1-loss-2021-04-22,https://j.mp/3sNmAgx
