feed,title,long_url,short_url
SeekingAlpha,Delta Air Lines upped at BofA on stronger balance sheet than peers,https://seekingalpha.com/news/3786160,
SeekingAlpha,"Amylyx Pharmaceuticals prices upsized $190M IPO, trading starts today",https://seekingalpha.com/news/3786159,
SeekingAlpha,Willis Towers Watson changes Nasdaq ticker symbol to WTW,https://seekingalpha.com/news/3786158,
SeekingAlpha,Boston Properties raised to Outperform at BMO as high-quality asset values rebound,https://seekingalpha.com/news/3786157,
SeekingAlpha,Investview reports $1.8M in bitcoin gross revenue for December,https://seekingalpha.com/news/3786156,
SeekingAlpha,"Armada Hoffler Properties, Phunware, Dogness among premarket losers' pack",https://seekingalpha.com/news/3786155,
