feed,title,long_url,short_url
Investing,CAVA Group Stock: Time to Take the Dip on This Investment Trip?,https://www.investing.com/analysis/cava-group-stock-time-to-take-the-dip-on-this-investment-trip-200659002,https://da.gd/Asbo0
Investing,Michael Saylor Stuns With Bullish Call: ‘More Bitcoin’ As BTC Breaks Out,https://www.investing.com/news/cryptocurrency-news/michael-saylor-stuns-with-bullish-call-more-bitcoin-as-btc-breaks-out-3963491,https://da.gd/C3fkIk
Investing,"Tesla, Oracle Lead Wednesday's Market Cap Stock Movers",https://www.investing.com/news/stock-market-news/tesla-oracle-lead-wednesdays-market-cap-stock-movers-93CH-3963495,https://da.gd/98KVS
Investing,Factbox-Top cases before the US Supreme Court,https://www.investing.com/news/stock-market-news/factboxtop-cases-before-the-us-supreme-court-3963494,https://da.gd/GhUaL
Investing,"Services PMI, ISM Non-Manufacturing PMI, jobless claims top Thursday's agenda",https://www.investing.com/news/stock-market-news/services-pmi-ism-nonmanufacturing-pmi-jobless-claims-top-thursdays-agenda-93CH-3963492,https://da.gd/hqG3f
Investing,"Conagra, Acuity Brands, Lamb Weston, and more to report Thursday",https://www.investing.com/news/stock-market-news/conagra-acuity-brands-lamb-weston-and-more-to-report-thursday-93CH-3963490,https://da.gd/H2TBfp
Investing,"FDA misses deadline for decision on Novavax's COVID-19 vaccine, source says",https://www.investing.com/news/stock-market-news/fda-misses-deadline-for-decision-on-novavaxs-covid19-vaccine-source-says-3963485,https://da.gd/jqv7E
Investing,Zoop and Hbar Foundation submit late-stage bid for TikTok acquisition,https://www.investing.com/news/stock-market-news/zoop-and-hbar-foundation-submit-latestage-bid-for-tiktok-acquisition-93CH-3963481,https://da.gd/iK5xZD
