feed,title,long_url,short_url
Investing,Interest jumps in US auction of shares in parent of Venezuela-owned Citgo,https://www.investing.com/news/commodities-news/interest-jumps-in-us-auction-of-shares-in-parent-of-venezuelaowned-citgo-3279291,https://da.gd/QkqiFw
Investing,"Boeing, Spirit AeroSystems fall as FAA recommends inspections on separate 737 model",https://www.investing.com/news/stock-market-news/boeing-spirit-aerosystems-fall-as-faa-recommends-inspections-on-separate-737-model-432SI-3279297,https://da.gd/fsoed2
Investing,B. Riley Financial stock drops 19% on SEC probe report,https://www.investing.com/news/stock-market-news/b-riley-financial-stock-drops-19-on-sec-probe-report-432SI-3279292,https://da.gd/6c8RK
Investing,Pro Research: Wall Street dives into Oracle's cloud transition,https://www.investing.com/news/stock-market-news/pro-research-wall-street-dives-into-oracles-cloud-transition-93CH-3279293,https://da.gd/uRp65
Investing,"Archer-Daniels-Midland adjusts earnings forecast, CFO on leave amid inquiry",https://www.investing.com/news/stock-market-news/archerdanielsmidland-adjusts-earnings-forecast-cfo-on-leave-amid-inquiry-93CH-3279287,https://da.gd/0xc3o
Investing,SEC probes B. Riley deals with client tied to failed hedge fund - Bloomberg News,https://i-invdn-com.investing.com/trkd-images/LYNXMPEK0L02J_L.jpg,https://da.gd/yw4HCa
Investing,China's residential foreclosures increase 43% in 2023,https://www.investing.com/news/economy/chinas-residential-foreclosures-increase-43-in-2023-3279296,https://da.gd/TVwV
Investing,"EU growth plan potential 'game changer' for Western Balkans, official says",https://www.investing.com/news/economy/eu-growth-plan-potential-game-changer-for-western-balkans-official-says-3279295,https://da.gd/mEg4d
