feed,title,long_url,short_url
Investing,Ethereum (ETH) Surpassed Bitcoin (BTC) for Second Time Ever,https://www.investing.com/news/cryptocurrency-news/ethereum-eth-surpassed-bitcoin-btc-for-second-time-ever-3279774,https://da.gd/aSsj
Investing,Ethereum (ETH) Layer 2 Networks Growth Is Crucial: Here's Why,https://www.investing.com/news/cryptocurrency-news/ethereum-eth-layer-2-networks-growth-is-crucial-heres-why-3279773,https://da.gd/4CUER
Investing,Can Solana (SOL) Continue Its Path Up in 2024?,https://www.investing.com/news/cryptocurrency-news/can-solana-sol-continue-its-path-up-in-2024-3279772,https://da.gd/MBy2c5
Investing,Top Cryptocurrencies to Watch in 2024,https://www.investing.com/news/cryptocurrency-news/top-cryptocurrencies-to-watch-in-2024-3279771,https://da.gd/58jp
Investing,"Ethereum (ETH) Has to Break This Major Resistance Ahead of $2,500",https://www.investing.com/news/cryptocurrency-news/ethereum-eth-has-to-break-this-major-resistance-ahead-of-2500-3279770,https://da.gd/yjUn
Investing,"Ethereum's Vitalik Buterin Shuffles USDC Funds, Likely Reason",https://www.investing.com/news/cryptocurrency-news/ethereums-vitalik-buterin-shuffles-usdc-funds-likely-reason-3279769,https://da.gd/nDYbva
Investing,Whales Buying Ethereum (ETH) and Bitcoin (BTC) Dump,https://www.investing.com/news/cryptocurrency-news/whales-buying-ethereum-eth-and-bitcoin-btc-dump-3279768,https://da.gd/3MJU
Investing,Ethereum L2s Surpassed All Other Blockchains by TVL: Details,https://www.investing.com/news/cryptocurrency-news/ethereum-l2s-surpassed-all-other-blockchains-by-tvl-details-3279767,https://da.gd/AhN8
Investing,XRP Saw Biggest Price Drop Since August: Here's What Happened,https://www.investing.com/news/cryptocurrency-news/xrp-saw-biggest-price-drop-since-august-heres-what-happened-3279766,https://da.gd/YuOds
Investing,Massive Ethereum Update Is Here: All You Need to Know About Prague,https://www.investing.com/news/cryptocurrency-news/massive-ethereum-update-is-here-all-you-need-to-know-about-prague-3279764,https://da.gd/8LGW0U
Investing,"Dow Jones, Nasdaq, S&P 500 weekly preview: Are new highs sustainable?",https://www.investing.com/news/stock-market-news/dow-jones-nasdaq-sp-500-weekly-preview-are-new-highs-sustainable-3279698,https://da.gd/bu9QjB
Investing,This week in EVs: Musk's AI Ultimatum | Pro Recap,https://www.investing.com/news/stock-market-news/this-week-in-evs-musks-ai-ultim,https://da.gd/XF59ep
Investing,Shares in Trump SPAC surge after Ron DeSantis drops 2024 presidential bid,https://www.investing.com/news/stock-market-news/shares-in-trump-spac-surge-after-ron-desantis-drops-2024-presidential-bid-3279749,https://da.gd/dkw65
Investing,Salesforce a top pick at Morgan Stanley as valuation 'compelling',https://www.investing.com/news/stock-market-news/salesforce-a-top-pick-at-morgan-stanley-as-valuation-compelling-432SI-3279746,https://da.gd/xsrNVE
Investing,Shares in high-growth video platform Rumble are surging today. Here's why,https://www.investing.com/news/stock-market-news/shares-in-highgrowth-video-platform-rumble-are-surging-today-heres-why-432SI-3279740,https://da.gd/GOAe
Investing,"Boeing and Archer-Daniels-Midland stocks dip on FAA recommendation, CFO leave",https://www.investing.com/news/stock-market-news/boeing-and-archerdanielsmidland-stocks-dip-on-faa-recommendation-cfo-leave-93CH-3279741,https://da.gd/NgGheN
Investing,AMD cut at Northland as AI 'not as big as investors are thinking',https://www.investing.com/news/stock-market-news/amd-cut-at-northland-as-ai-not-as-big-as-investors-are-thinking-432SI-3279739,https://da.gd/cFAZe
