feed,title,long_url,short_url
ETFTrends,Higher S&P 500 Earnings Could Benefit This Active ETF,https://www.etftrends.com/monthly-income-channel/higher-sp-500-earnings-could-benefit-active-etf/,https://da.gd/Ylcz5l
ETFTrends,What’s Hot & Not Besides Bitcoin ETFs,https://www.etftrends.com/whats-hot-not-besides-bitcoin-etfs/,https://da.gd/iDGwL
ETFTrends,More Proof of Spot Bitcoin ETFs’ Fast Start,https://www.etftrends.com/crypto-channel/more-proof-spot-bitcoin-etfs-fast-start/,https://da.gd/X1Ms
ETFTrends,What’s Happening in the Housing Market?,https://www.etftrends.com/innovative-etfs-channel/whats-happening-housing-market/,https://da.gd/aAZCW
ETFTrends,Wall Street Banks Bump Up Their Year-End S&P 500 Forecasts,https://www.etftrends.com/leveraged-inverse-channel/wall-street-banks-bump-up-year-end-sp-500-forecasts/,https://da.gd/JPV03
ETFTrends,Fidelity Investments Climbs the Active ETF Ranks,https://www.etftrends.com/etf-investing-channel/fidelity-investments-climbs-the-active-etf-ranks/,https://da.gd/YXhyua
