feed,title,long_url,short_url
Investing,Edward Snowden Shocked at Jamie Dimon's New Bitcoin Criticism Level,https://www.investing.com/news/cryptocurrency-news/edward-snowden-shocked-at-jamie-dimons-new-bitcoin-criticism-level-3279862,https://da.gd/wtr5y
Investing,Elon Musk Surprisingly Reacts to Bitcoin's Epic Surge,https://www.investing.com/news/cryptocurrency-news/elon-musk-surprisingly-reacts-to-bitcoins-epic-surge-3279860,https://da.gd/1EHXc
Investing,H&M pulls ad after complaints over sexualisation of school girls,https://www.investing.com/news/stock-market-news/hm-pulls-ad-after-complaints-over-sexualisation-of-school-girls-3279861,https://da.gd/QkyAf
Investing,Pro Research: Wall Street's in-depth look at Coinbase's trajectory,https://www.investing.com/news/stock-market-news/pro-research-wall-streets-indepth-look-at-coinbases-trajectory-93CH-3279857,https://da.gd/RTDtt
Investing,Israel stocks lower at close of trade; TA 35 down 0.03%,https://www.investing.com/news/stock-market-news/israel-stocks-lower-at-close-of-trade-ta-35-down-003-3279856,https://da.gd/p2Jub
