feed,title,long_url,short_url
Investing,U.S. stocks higher at close of trade; Dow Jones Industrial Average up 0.58%,https://www.investing.com/news/stock-market-news/us-stocks-higher-at-close-of-trade-dow-jones-industrial-average-up-058-4707516,
Investing,Scynexis stock falls 7% on reverse stock split announcement,https://www.investing.com/news/stock-market-news/scynexis-stock-falls-7-on-reverse-stock-split-announcement-93CH-4707514,
Investing,Canada stocks higher at close of trade; S&P/TSX Composite up 0.18%,https://www.investing.com/news/stock-market-news/canada-stocks-higher-at-close-of-trade-sptsx-composite-up-018-4707513,
Investing,Brazil stocks lower at close of trade; Bovespa down 0.81%,https://www.investing.com/news/stock-market-news/brazil-stocks-lower-at-close-of-trade-bovespa-down-081-4707511,
Investing,Warsh elected chair of U.S. Fed’s rate-setting committee,https://www.investing.com/news/economy-news/warsh-elected-chair-of-us-feds-ratesetting-committee-4707498,
