feed,title,long_url,short_url
Investing,"Gold Has Outpaced Stocks Sharply, but a Reversal May Be Closer Than It Seems",https://www.investing.com/analysis/gold-has-outpaced-stocks-sharply-but-a-reversal-may-be-closer-than-it-seems-200659858,https://da.gd/7TF3D
Investing,Intuit shares move higher as HSBC upgrades stock to Buy on attractive valuation,https://www.investing.com/news/stock-market-news/intuit-shares-move-higher-as-hsbc-upgrades-stock-to-buy-on-attractive-valuation-3998372,https://da.gd/r2nbC
Investing,American Express upgraded by Redburn after 25% fall from January high,https://www.investing.com/news/stock-market-news/american-express-upgraded-by-redburn-after-25-fall-from-january-high-3998352,https://da.gd/TOMVY
Investing,Ukraine insists on immediate ceasefire with Moscow,https://www.investing.com/news/stock-market-news/ukraine-insists-on-immediate-ceasefire-with-moscow-93CH-3998346,https://da.gd/WWW0
Investing,"GE Vernova's quarterly revenue beats on strength in power, electrification units",https://www.investing.com/news/stock-market-news/ge-vernovas-quarterly-revenue-beats-on-strength-in-power-electrification-units-3998345,https://da.gd/b0iun
Investing,"Nagel voices concerns over US Treasuries, German economy and global tariffs",https://www.investing.com/news/stock-market-news/nagel-voices-concerns-over-us-treasuries-german-economy-and-global-tariffs-93CH-3998344,https://da.gd/V9mt
Investing,"Exclusive-Putin's central banker Nabiullina will serve until 2027 despite attacks, sources say",https://www.investing.com/news/economy-news/exclusiveputins-central-banker-nabiullina-will-serve-until-2027-despite-attacks-sources-say-3998350,https://da.gd/r0dRnD
