feed,title,long_url,short_url
Investing,"Jobs Picture Deteriorates in ADP Report, Tilting Policy Outlook Toward More Cuts",https://www.investing.com/analysis/jobs-picture-deteriorates-in-adp-report-tilting-policy-outlook-toward-more-cuts-200671229,
Investing,Mizuho’s Katz sees ’fertile’ conditions driving robust M&A market into 2026,https://www.investing.com/news/stock-market-news/mizuhos-katz-sees-fertile-conditions-driving-robust-ma-market-into-2026-4389234,
Investing,Fintech firm Marquis notifies affected business after ransomware breach,https://www.investing.com/news/stock-market-news/fintech-firm-marquis-notifies-affected-business-after-ransomware-breach-4389233,
Investing,Apple’s design executive Alan Dye to join Meta,https://www.investing.com/news/stock-market-news/apples-design-executive-alan-dye-to-join-meta-4389225,
Investing,Push is on in US Congress to impose ban on lawmaker stock trades,https://www.investing.com/news/stock-market-news/push-is-on-in-us-congress-to-impose-ban-on-lawmaker-stock-trades-4389221,
Investing,Zi Yun Dong Fang Limited files for 1.5M share IPO at $4-$6/sh,https://www.investing.com/news/stock-market-news/zi-yun-dong-fang-limited-files-for-15m-share-ipo-at-46sh-432SI-4389209,
