feed,title,long_url,short_url
Motley,3 Reasons Five Below Is a Must-Buy for Long-Term Investors,https://www.fool.com/investing/2025/01/18/3-reasons-five-below-is-a-must-buy-for-long-term-i/?source=iedfolrf0000001,https://da.gd/6DaFZs
Motley,Best Stock to Buy Right Now: British American Tobacco vs. Kraft Heinz,https://www.fool.com/investing/2025/01/18/best-stock-to-buy-right-now-british-american-tobac/?source=iedfolrf0000001,https://da.gd/OupGAx
Motley,"1 Popular Cryptocurrency With 13,031% Upside, According to MicroStrategy's Michael Saylor",https://www.fool.com/investing/2025/01/18/1-cryptocurrency-with-13031-upside-michael-saylor/?source=iedfolrf0000001,https://da.gd/PqBIou
Motley,3 Reasons to Buy EPR Properties Stock Like There's No Tomorrow,https://www.fool.com/investing/2025/01/18/3-reasons-to-buy-epr-properties-stock-like-theres/?source=iedfolrf0000001,https://da.gd/yaRCbR
Motley,The Smartest Dividend Stocks to Buy With $500 Right Now,https://www.fool.com/investing/2025/01/18/the-smartest-dividend-stocks-to-buy-with-500-right/?source=iedfolrf0000001,https://da.gd/bEJJp0
