feed,title,long_url,short_url
SeekingAlpha,"CommScope EPS beats by $0.13, beats on revenue",https://seekingalpha.com/news/3601646,
SeekingAlpha,"Ball EPS beats by $0.09, misses on revenue",https://seekingalpha.com/news/3601645,
SeekingAlpha,"DENTSPLY SIRONA EPS misses by $0.16, misses on revenue",https://seekingalpha.com/news/3601644,
SeekingAlpha,"Amneal Pharmaceuticals EPS beats by $0.03, beats on revenue",https://seekingalpha.com/news/3601643,
SeekingAlpha,"Sierra Wireless EPS beats by $0.05, beats on revenue",https://seekingalpha.com/news/3601642,
SeekingAlpha,"Titan EPS beats by $0.19, beats on revenue",https://seekingalpha.com/news/3601641,
SeekingAlpha,"AES EPS beats by $0.01, misses on revenue",https://seekingalpha.com/news/3601640,
