feed,title,long_url,short_url
SeekingAlpha,Airline stocks take off as Trump backs additional $25B for industry,https://seekingalpha.com/news/3601664,
SeekingAlpha,"Nine Energy Service EPS misses by $0.17, misses on revenue",https://seekingalpha.com/news/3601663,
SeekingAlpha,"Nesco EPS misses by $0.13, misses on revenue",https://seekingalpha.com/news/3601661,
SeekingAlpha,"Colfax EPS beats by $0.03, beats on revenue",https://seekingalpha.com/news/3601659,
SeekingAlpha,"Sprague Resources EPS misses by $0.72, misses on revenue",https://seekingalpha.com/news/3601658,
