feed,title,long_url,short_url
InsiderMonkey,"Analyst Raises Realty Income (O) Price Target, Reiterates Buy Rating",https://insidermonkey.com/blog/--1797614,
InsiderMonkey,Simon Property Group (SPG) Downgraded at Wolfe Research. Here is Why,https://insidermonkey.com/blog/--1797615,
InsiderMonkey,Ford Motor Company (F) Reports Drop in US Sales in the Second Quarter,https://insidermonkey.com/blog/--1797616,
InsiderMonkey,U.S. Bancorp (USB) Price Target Lowered at Oppenheimer. Here is Why,https://insidermonkey.com/blog/--1797617,
InsiderMonkey,Jefferies Boosts Price Target on EOG Resources (EOG). Here is Why,https://insidermonkey.com/blog/--1797618,
InsiderMonkey,Goldman Sachs Removes Duke Energy (DUK) from its US Conviction List,https://insidermonkey.com/blog/--1797620,
InsiderMonkey,NIKE (NKE) Fails to Impress Despite Beating Expectations in Q4 2026,https://insidermonkey.com/blog/--1797622,
InsiderMonkey,PepsiCo (PEP) Price Target Trimmed at JP Morgan. Here is Why,https://insidermonkey.com/blog/--1797628,
InsiderMonkey,UBS Lifts Philip Morris International (PM) Price Target by $14,https://insidermonkey.com/blog/--1797633,
InsiderMonkey,Deutsche Bank Upgrades Comcast (CMCSA) to Buy. Here is Why,https://insidermonkey.com/blog/--1797634,
InsiderMonkey,Exxon Mobil (XOM) Price Target Lowered by $17 at TD Cowen. Here is Why,https://insidermonkey.com/blog/--1797635,
InsiderMonkey,Citi Downgrades Truist Financial (TFC) to Neutral. Here is Why,https://insidermonkey.com/blog/--1797641,
InsiderMonkey,Eni (E) Price Target Lowered by €2.5 at JP Morgan,https://insidermonkey.com/blog/--1797643,
InsiderMonkey,Here is Why Chevron (CVX) is One of the Most Promising Energy Stocks to Buy Now,https://insidermonkey.com/blog/--1797644,
InsiderMonkey,TD Cowen Cuts Price Target on TotalEnergies (TTE). Here is Why,https://insidermonkey.com/blog/--1797645,
InsiderMonkey,Morgan Stanley Trims Price Target on Occidental Petroleum (OXY). Here is Why,https://insidermonkey.com/blog/--1797646,
InsiderMonkey,Jefferies Trims EQT Price Target by $2. Here is Why,https://insidermonkey.com/blog/--1797647,
InsiderMonkey,BP Price Target Cut by £50 at JP Morgan,https://insidermonkey.com/blog/--1797648,
