feed,title,long_url,short_url
Investing,Bank of America extends credit to OpenAI ahead of planned IPO - Bloomberg,https://www.investing.com/news/stock-market-news/bank-of-america-extends-credit-to-openai-ahead-of-planned-ipo--bloomberg-93CH-4781993,
Investing,Trump says he will use old Air Force One to travel to UK with new plane going there too,https://www.investing.com/news/stock-market-news/trump-says-he-will-use-old-air-force-one-to-travel-to-uk-with-new-plane-going-there-too-4781975,
Investing,Norway stocks higher at close of trade; Oslo OBX up 0.55%,https://www.investing.com/news/stock-market-news/norway-stocks-higher-at-close-of-trade-oslo-obx-up-055-4781985,
Investing,Mistral AI unveils robotics model for industrial navigation,https://www.investing.com/news/stock-market-news/mistral-ai-unveils-robotics-model-for-industrial-navigation-93CH-4781981,
Investing,Conagra Brands options signal 5.5% move on July 15 earnings,https://www.investing.com/news/stock-market-news/conagra-brands-options-signal-55-move-on-july-15-earnings-93CH-4781976,
Investing,Israel stocks higher at close of trade; TA 35 up 0.03%,https://www.investing.com/news/stock-market-news/israel-stocks-higher-at-close-of-trade-ta-35-up-003-4781974,
Investing,Why is Beam Therapeutics stock sliding today?,https://www.investing.com/news/stock-market-news/why-is-beam-therapeutics-stock-sliding-today-93CH-4781972,
Investing,Why is Prime Medicine stock surging today?,https://www.investing.com/news/stock-market-news/why-is-prime-medicine-stock-surging-today-93CH-4781970,
