feed,title,long_url,short_url
ArXiv,Are decentralized finance really decentralized? A social network analysis of the Aave protocol on the Ethereum blockchain. (arXiv:2206.08401v1 [econ.GN]),https://arxiv.org/abs/2206.08401,
ArXiv,Identifying Counterfeit Products using Blockchain Technology in Supply Chain System. (arXiv:2206.08565v1 [cs.CR]),https://arxiv.org/abs/2206.08565,
ArXiv,Exploring Web3 From the View of Blockchain. (arXiv:2206.08821v1 [cs.CR]),https://arxiv.org/abs/2206.08821,
ArXiv,What makes Ethereum blockchain transactions be processed fast or slow? An empirical study. (arXiv:2206.08905v1 [cs.SE]),https://arxiv.org/abs/2206.08905,
ArXiv,Blockchain Consensus and Integrity: Similarities and Learnings from Ancient Literature. (arXiv:2006.04487v2 [cs.CR] UPDATED),https://arxiv.org/abs/2006.04487,
