feed,title,long_url,short_url
SeekingAlpha,FT Cboe Vest Gold Target Income ETF declares monthly distribution of $0.1405,https://seekingalpha.com/news/4112418,
SeekingAlpha,Indie Semiconductor gains amid report of sale process,https://seekingalpha.com/news/4112417,
SeekingAlpha,FlexShares iBoxx 5-Year Target Duration TIPS Index Fund declares monthly distribution of $0.1879,https://seekingalpha.com/news/4112415,
SeekingAlpha,Stock volatility may pick up in June after ‘cracks in the ice’ formed in May - CFRA,https://seekingalpha.com/news/4112348,
SeekingAlpha,FlexShares iBoxx 3-Year Target Duration TIPS Index Fund declares monthly distribution of $0.1874,https://seekingalpha.com/news/4112414,
