feed,title,long_url,short_url
SeekingAlpha,"Brookdale Senior Living sees September occupancy rise, but at slower rate",https://seekingalpha.com/news/3743443,
SeekingAlpha,"Tesla sees a new bear on the prowl with Tudor, Pickering warning on competition and valuation",https://seekingalpha.com/news/3743442,
SeekingAlpha,ESE Entertainment reports FQ3 results,https://seekingalpha.com/news/3743440,
SeekingAlpha,CDK Global acquires insurance technology platform Salty Dot,https://seekingalpha.com/news/3743439,
SeekingAlpha,"Biogen, Sage are new buys as Needham initiates coverage on neuro-focused stocks",https://seekingalpha.com/news/3743438,
