feed,title,long_url,short_url
Investing,"Crypto Flipsider News – September 23rd – Crypto Market Recovers After Evergrande Predicament, Dapper Labs Now Valued at $7.6 Billion, Kava Expands DeFi With $185M Fund, The Dogecoin-Musk Relationship,",https://investing.com/news/-2624808,
Investing,Cardano (ADA) Will Moon Shot to $4 by the End of 2021,https://investing.com/news/-2624807,
Investing,ATIF Holdings: Major Short Squeeze Play?,https://investing.com/news/-2624812,
Investing,LoanDepot vs. CURO Group Holdings: Which Financial Stock is a Better Buy?,https://investing.com/news/-2624811,
Investing,Should You Buy the Dip in Peabody Energy?,https://investing.com/news/-2624810,
Investing,Investor Alert: Keep Calm and Carry On,https://investing.com/news/-2624809,
