feed,title,long_url,short_url
Investing,"Chainlink nears $8 milestone, investor interest surges",https://www.investing.com/news/cryptocurrency-news/chainlink-nears-8-milestone-investor-interest-surges-93CH-3184817,https://da.gd/y9nJ3F
Investing,Bitcoin Minetrix introduces stake-to-mine model for efficient crypto mining,https://www.investing.com/news/cryptocurrency-news/bitcoin-minetrix-introduces-staketomine-model-for-efficient-crypto-mining-93CH-3184814,https://da.gd/76sjr
Investing,Canara Bank's inaugural Long Term Infrastructure Bonds issue exceeds expectations,https://www.investing.com/news/stock-market-news/canara-banks-inaugural-long-term-infrastructure-bonds-issue-exceeds-expectations-93CH-3184819,https://da.gd/9jrtir
Investing,"Karnataka seeks enhanced investment, explores potential collaborations with Boeing and GE",https://www.investing.com/news/stock-market-news/karnataka-seeks-enhanced-investment-explores-potential-collaborations-with-boeing-and-ge-93CH-3184818,https://da.gd/f4ZPF
Investing,"ASML's shares edge higher, outpacing S&P 500 despite recent losses",https://www.investing.com/news/stock-market-news/asmls-shares-edge-higher-outpacing-sp-500-despite-recent-losses-93CH-3184816,https://da.gd/cvC9hp
Investing,Tech stocks set to rebound on AI growth and ad-spending recovery,https://www.investing.com/news/stock-market-news/tech-stocks-set-to-rebound-on-ai-growth-and-adspending-recovery-93CH-3184815,https://da.gd/KMARbj
Investing,"Robeco strategizes entry into ETF market, set for 2024 launch",https://www.investing.com/news/stock-market-news/robeco-strategizes-entry-into-etf-market-set-for-2024-launch-93CH-3184813,https://da.gd/Hsj5xr
Investing,Yatra Online's weak debut on Indian exchanges,https://www.investing.com/news/stock-market-news/yatra-onlines-weak-debut-on-indian-exchanges-93CH-3184812,https://da.gd/odw15
