feed,title,long_url,short_url
InvestorPlace,3 Must-Buy Stocks for the Coming Mexico Boom,https://investorplace.com/2023/09/3-must-buy-stocks-for-the-coming-mexico-boom/,https://da.gd/f2BSdy
InvestorPlace,RIVN Stock: Rivian CEO Is Shrugging Off Tesla’s Cybertruck Threat,https://investorplace.com/2023/09/rivn-stock-rivian-ceo-is-shrugging-off-teslas-cybertruck-threat/,https://da.gd/wytHAm
InvestorPlace,"NVAX, AI, CVNA: The 3 Most Shorted Stocks This Month",https://investorplace.com/2023/09/nvax-ai-cvna-the-3-most-shorted-stocks-this-month/,https://da.gd/HvCKe
InvestorPlace,Ticking Time Bombs: 3 Dow Stocks to Dump Before the Damage Is Done,https://investorplace.com/2023/09/ticking-time-bombs-3-dow-stocks-to-dump-before-the-damage-is-done/,https://da.gd/ilblo
InvestorPlace,GME Stock: Wedbush Slams GameStop’s Decision to Make Ryan Cohen CEO,https://investorplace.com/2023/09/gme-stock-wedbush-slams-gamestops-decision-to-make-ryan-cohen-ceo/,https://da.gd/5OFxQ
