feed,title,long_url,short_url
FXEmpire,UK construction sector peps up unexpectedly in October – PMI,https://www.fxempire.com/news/article/uk-construction-sector-peps-up-unexpectedly-in-october-pmi-797631,https://j.mp/3q6XpIs
FXEmpire,World food prices hit new 10-year high in October -FAO,https://www.fxempire.com/news/article/world-food-prices-hit-new-10-year-high-in-october-fao-797622,https://j.mp/2ZPrl0C
FXEmpire,"OPEC+ likely to stick to oil output plan, sources say",https://www.fxempire.com/news/article/opec-likely-to-stick-to-oil-output-plan-sources-say-797624,https://j.mp/3GN38ZN
FXEmpire,"After debt crisis, Greek economy faces climate change threats",https://www.fxempire.com/news/article/after-debt-crisis-greek-economy-faces-climate-change-threats-797625,https://j.mp/3GPFBHr
FXEmpire,Sainsbury’s warns of consumer electronics shortages this Christmas,https://www.fxempire.com/news/article/sainsburys-warns-of-consumer-electronics-shortages-this-christmas-797626,https://j.mp/3q665i0
FXEmpire,Ukraine appoints new defence minister amid scrutiny on Russian troop movements,https://www.fxempire.com/news/article/ukraine-appoints-new-defence-minister-amid-scrutiny-on-russian-troop-movements-797627,https://j.mp/3wdC9S6
