feed,title,long_url,short_url
SeekingAlpha,Dawson Geophysical reports Q3 results,https://seekingalpha.com/news/3764877,
SeekingAlpha,"Walker & Dunlop EPS beats by $0.16, beats on revenue",https://seekingalpha.com/news/3764876,
SeekingAlpha,"Goodrich Petroleum EPS beats by $0.11, beats on revenue",https://seekingalpha.com/news/3764875,
SeekingAlpha,"Vontier EPS beats by $0.06, beats on revenue",https://seekingalpha.com/news/3764874,
SeekingAlpha,"Cigna EPS beats by $0.52, beats on revenue, raises outlook",https://seekingalpha.com/news/3764873,
SeekingAlpha,Sprague Resources EPS of -$4.41,https://seekingalpha.com/news/3764872,
SeekingAlpha,International Paper: Now An Upside - 'BUY',https://seekingalpha.com/article/4465323,
