feed,title,long_url,short_url
SeekingAlpha,Wingstop is defended by Cowen after earnings drop,https://seekingalpha.com/news/3764945,
SeekingAlpha,"Duke Energy EPS beats by $0.08, misses on revenue",https://seekingalpha.com/news/3764944,
SeekingAlpha,Golden Minerals misses on revenue,https://seekingalpha.com/news/3764943,
SeekingAlpha,Madrigal Pharmaceuticals EPS beats by $0.09,https://seekingalpha.com/news/3764942,
SeekingAlpha,"Tuesday Morning EPS misses by $0.09, misses on revenue",https://seekingalpha.com/news/3764941,
SeekingAlpha,Fossil Group raises $140M debt capital,https://seekingalpha.com/news/3764939,
SeekingAlpha,FDA grants Fast Track status to Epizyme's lymphoma treatment EZM0414,https://seekingalpha.com/news/3764938,
