feed,title,long_url,short_url
Investing,"Along With COP26 Summit, 2 Oil Market Events Could Become Price Drivers",https://investing.com/analysis/-200607319,
Investing,"Infamous Squid Coin Token is Pumping Again, Despite Abrupt Developer Abandonment and Multi-millions in Losses",https://investing.com/news/-2667692,
Investing,"The Next Shiba Inu, EverGrow Coin Is Changing the Very Face of Crypto Space",https://investing.com/news/-2667688,
Investing,"Dollar Firms After Fed; Jobless Claims, BoE Meeting - What's Moving Markets",https://investing.com/news/-2667647,
Investing,"Former Airbus chief Jean Pierson has died, say former colleagues",https://investing.com/news/-2667714,
Investing,Volkswagen CEO faces German workers as Tesla tensions flare again,https://investing.com/news/-2667648,
Investing,"Citrix Systems Earnings Beat, Revenue Misses In Q3",https://investing.com/news/-2667706,
Investing,Regeneron profit nearly doubles on strong demand for COVID-19 drug,https://investing.com/news/-2667665,
Investing,"Duke Energy Earnings Beat, Revenue Misses In Q3",https://investing.com/news/-2667681,
