feed,title,long_url,short_url
Yahoo,Stock Market Today: Dow Jones Dips But Tesla Rises; Warren Buffett Gives This Trump Tariff Warning (Live Coverage),https://www.investors.com/market-trend/stock-market-today/dow-jones-sp500-nasdaq-warren-buffett-tariffs-bitcoin/?src=A00220&yptr=yahoo,https://da.gd/BFUCky
Yahoo,Tesla stock pops as Morgan Stanley predicts shares rally to $430 on AI and robotics play,https://finance.yahoo.com/news/tesla-stock-pops-as-morgan-stanley-predicts-shares-rally-to-430-on-ai-and-robotics-play-154641838.html,https://da.gd/gEoqPW
Yahoo,Cryptocurrency exchange Kraken says US SEC will dismiss lawsuit,https://finance.yahoo.com/news/kraken-says-sec-dismiss-lawsuit-153805549.html,https://da.gd/J30KW
Yahoo,VW Stock Rises After Europe Relaxes Emissions Rules,https://www.wsj.com/livecoverage/stock-market-today-dow-sp500-nasdaq-live-03-03-2025/card/vw-stock-rises-after-europe-relaxes-emissions-rules-FW8VA85ycvf7tYM2rBIW?siteid=yhoof2&yptr=yahoo,https://da.gd/fXOMBv
Yahoo,Kraken Says SEC Agrees to Drop Lawsuit Against Crypto Exchange,https://www.wsj.com/livecoverage/stock-market-today-dow-sp500-nasdaq-live-03-03-2025/card/kraken-says-sec-agrees-to-drop-lawsuit-against-crypto-exchange-hMYFVsshfL6mgn1zpZPI?siteid=yhoof2&yptr=yahoo,https://da.gd/zilWY
Yahoo,Kroger CEO Rodney McMullen Resigns After Investigation Into Personal Conduct,https://www.wsj.com/business/retail/kroger-ceo-rodney-mcmullen-resigns-after-investigation-of-personal-conduct-507398ad?siteid=yhoof2&yptr=yahoo,https://da.gd/FB30pC
