feed,title,long_url,short_url
Investing,Fresh Australian Inflation Data on Deck: More Rate Hike Pain Ahead?,https://www.investing.com/analysis/fresh-australian-inflation-data-on-deck-more-rate-hike-pain-ahead-200675493,
Investing,"Economic Week Ahead: PPI, Consumer Confidence, and Fed Surveys in Focus",https://www.investing.com/analysis/economic-week-ahead-ppi-consumer-confidence-and-fed-surveys-i,
Investing,Grey expands business banking with USD accounts and stablecoin support,https://www.investing.com/news/cryptocurrency-news/grey-expands-business-banking-with-usd-accounts-and-stablecoin-support-93CH-4519527,
Investing,Citigroup nears sale of 24% stake in Mexican retail bank - Bloomberg,https://www.investing.com/news/stock-market-news/citigroup-nears-sale-of-24-stake-in-mexican-retail-bank--bloomberg-93CH-4519517,
Investing,AbbVie to invest $380 million to expand US manufacturing in Illinois,https://www.investing.com/news/stock-market-news/abbvie-to-invest-380-million-to-expand-us-manufacturing-in-illinois-4519515,
Investing,U.K. stocks lower at close of trade; Investing.com United Kingdom 100 down 0.12%,https://www.investing.com/news/stock-market-news/uk-stocks-lower-at-close-of-trade-investingcom-united-kingdom-100-down-012-4519513,
Investing,U.K. stocks lower at close of trade; Investing.com United Kingdom 100 down 0.12%,https://www.investing.com/news/stock-market-news/uk-stocks-lower-at-close-of-trade-investingcom-united-kingdom-100-down-012-4519512,
