feed,title,long_url,short_url
Nasdaq,Australia's Lynas to provide Malaysian authorities more info to resume radioactive waste disposal assessment,https://www.nasdaq.com/articles/australias-lynas-to-provide-malaysian-authorities-more-info-to-resume-radioactive-waste,https://j.mp/3vmKOQA
Nasdaq,Samsung's Lee family to pay more than 12 trln won inheritance taxes,https://www.nasdaq.com/articles/samsungs-lee-family-to-pay-more-than-12-trln-won-inheritance-taxes-2021-04-27-0,https://j.mp/3u0NNhd
Nasdaq,BUZZ-COMMENT-Traders may soon be reminded why they like China's yuan,https://www.nasdaq.com/articles/buzz-comment-traders-may-soon-be-reminded-why-they-like-chinas-yuan-2021-04-27,https://j.mp/3gENRQ6
Nasdaq,Thai Shares May Take Further Damage On Wednesday,https://www.nasdaq.com/articles/thai-shares-may-take-further-damage-on-wednesday-2021-04-27,https://j.mp/3voBw6D
Nasdaq,Highwoods Properties Q1 Profit Drops,https://www.nasdaq.com/articles/highwoods-properties-q1-profit-drops-2021-04-27,https://j.mp/3gQ2b8B
Nasdaq,Japanese Market Higher After Early Losses,https://www.nasdaq.com/articles/japanese-market-higher-after-early-losses-2021-04-27,https://j.mp/3u0NGlN
