feed,title,long_url,short_url
SeekingAlpha,"Century Communities EPS beats by $1.43, beats on revenue",https://seekingalpha.com/news/3687344,
SeekingAlpha,"LSB Industries EPS misses by $0.34, misses on revenue",https://seekingalpha.com/news/3687343,
SeekingAlpha,"SP Plus  EPS beats by $0.29, beats on revenue",https://seekingalpha.com/news/3687342,
SeekingAlpha,"Apple EPS beats by $0.42, beats on revenue",https://seekingalpha.com/news/3687341,
SeekingAlpha,Morningstar reports Q1 results,https://seekingalpha.com/news/3687338,
SeekingAlpha,"Matador Resources EPS beats by $0.29, beats on revenue",https://seekingalpha.com/news/3687331,
SeekingAlpha,"Altice USA EPS beats by $0.28, revenue in-line",https://seekingalpha.com/news/3687330,
