feed,title,long_url,short_url
Investing,S&P 500 Eyes Gains Amid Trade Deals - But How Sustainable Is This Rally?,https://www.investing.com/analysis/sp-500-eyes-gains-amid-trade-deals--but-how-sustainable-is-this-rally-200664493,
Investing,PayPal lifts 2025 profit forecast above estimates as turnaround picks up pace,https://www.investing.com/news/stock-market-news/paypal-lifts-2025-profit-forecast-above-estimates-as-turnaround-picks-up-pace-4157007,
Investing,Bakkt stock plunges after pricing $75 million public offering,https://www.investing.com/news/stock-market-news/bakkt-stock-plunges-after-pricing-75-million-public-offering-93CH-4157006,
Investing,Union Pacific to buy Norfolk in $85 billion mega US railroad deal,https://www.investing.com/news/stock-market-news/union-pacific-to-buy-norfolk-in-85-billion-mega-us-railroad-deal-4156986,
Investing,LG Innotek to take stake in lidar maker Aeva as part of $50 million deal,https://www.investing.com/news/stock-market-news/lg-innotek-to-take-stake-in-lidar-maker-aeva-as-part-of-50-million-deal-4156984,
Investing,"P&G signals sluggish annual growth amid leadership change, tariffs",https://www.investing.com/news/stock-market-news/pg-signals-sluggish-annual-growth-amid-leadership-change-tariffs-4156982,
Investing,Earnings replacing tariffs as the primary focus for investors: Barclays,https://www.investing.com/news/stock-market-news/earnings-replacing-tariffs-as-the-primary-focus-for-investors-barclays-4156954,
