feed,title,long_url,short_url
Investing,Bitcoin Suisse expands with Digital Asset License and Investment Business Act Registration Approval in Bermuda,https://www.investing.com/news/cryptocurrency-news/bitcoin-suisse-expands-with-digital-asset-license-and-investment-business-act-registration-approval-in-bermuda-4681843,
Investing,"Qualcomm, Intel among market cap stock movers on Tuesday",https://www.investing.com/news/stock-market-news/qualcomm-intel-among-market-cap-stock-movers-on-tuesday-93CH-4681856,
Investing,"PPI, crude oil inventories among economic data due Wednesday",https://www.investing.com/news/stock-market-news/ppi-crude-oil-inventories-among-economic-data-due-wednesday-93CH-4681847,
Investing,ZoomInfo shares plunge: Analysts downgrade stock on guidance cut,https://www.investing.com/news/stock-market-news/zoominfo-shares-plunge-analysts-downgrade-stock-on-guidance-cut-4681834,
Investing,"ECB may need to raise rates due to Iran war, says Bundesbank chief",https://www.investing.com/news/economy-news/ecb-may-need-to-raise-rates-due-to-iran-war-says-bundesbank-chief-93CH-4681837,
