feed,title,long_url,short_url
Nasdaq,China hog futures plunge 7% as heavy pigs pressure prices,https://www.nasdaq.com/articles/china-hog-futures-plunge-7-as-heavy-pigs-pressure-prices-2021-05-10,https://j.mp/3fadupk
Nasdaq,Taiwan to quarantine pilots of its largest airline amid COVID-19 outbreak,https://www.nasdaq.com/articles/taiwan-to-quarantine-pilots-of-its-largest-airline-amid-covid-19-outbreak-2021-05-10,https://j.mp/3tzjMEm
Nasdaq,South Africa warns of 'vaccine apartheid' if rich countries hog shots,https://www.nasdaq.com/articles/south-africa-warns-of-vaccine-apartheid-if-rich-countries-hog-shots-2021-05-10,https://j.mp/3twTHG4
Nasdaq,Asian Shares Mostly Higher As Rate Worries Ease,https://www.nasdaq.com/articles/asian-shares-mostly-higher-as-rate-worries-ease-2021-05-10,https://j.mp/3tABAPx
Nasdaq,"EMERGING MARKETS-Chinese yuan, Indonesian rupiah jump as dollar weakness boosts Asian FX",https://www.nasdaq.com/articles/emerging-markets-chinese-yuan-indonesian-rupiah-jump-as-dollar-weakness-boosts-asian-fx,https://j.mp/2RI3FqB
Nasdaq,Bill.com (BILL) Stock Jumps 18.3%: Will It Continue to Soar?,https://www.nasdaq.com/articles/bill.com-bill-stock-jumps-18.3%3A-will-it-continue-to-soar-2021-05-10,https://j.mp/33w7fa4
