feed,title,long_url,short_url
SeekingAlpha,BioCorRx gets FDA clearance for BICX104 Opioid Use Disorder treatment trials,https://seekingalpha.com/news/3693824,
SeekingAlpha,iQSTEL to enter $700B 5G market with network carrier partnership,https://seekingalpha.com/news/3693823,
SeekingAlpha,Blackstone faces competing bid for Crown Resorts from Star Entertainment,https://seekingalpha.com/news/3693822,
SeekingAlpha,Nio hopes battery swapping sets it apart in EV battle,https://seekingalpha.com/news/3693821,
SeekingAlpha,Workhorse Group misses on revenue,https://seekingalpha.com/news/3693820,
SeekingAlpha,BIT Mining reports Q1 results,https://seekingalpha.com/news/3693819,
SeekingAlpha,NV5 Global nabs $7M LNG loading system contract,https://seekingalpha.com/news/3693817,
