feed,title,long_url,short_url
Benzinga,AUD/USD Forecast: Hovers Around 0.7690 With A Limited Bullish Potential,https://www.benzinga.com/news/21/01/19227010/audusd-forecast-hovers-around-0-7690-with-a-limited-bullish-potential,https://j.mp/3izXNcv
Benzinga,How The Markets Performed On The Last Day Of Trump's Presidency,https://www.benzinga.com/general/education/21/01/19225452/how-the-markets-performed-on-the-last-day-of-trumps-presidency,https://j.mp/2KtWNKm
Benzinga,"Caravan Health Launches Health Care Podcast ""Health Care by the Numbers""",https://www.benzinga.com/pressreleases/21/01/n19227044/caravan-health-launches-health-care-podcast-health-care-by-the-numbers,https://j.mp/3izXY7F
Benzinga,The AZEK® Company Announces Preliminary First Quarter 2021 Financial Results,https://www.benzinga.com/pressreleases/21/01/b19227032/the-azek-company-announces-preliminary-first-quarter-2021-financial-results,https://j.mp/3o3x3Ci
Benzinga,Midwest Can Reaches Agreement with the EPA on Emissions Testing,https://www.benzinga.com/pressreleases/21/01/b19227031/midwest-can-reaches-agreement-with-the-epa-on-emissions-testing,https://j.mp/3ivemGk
Benzinga,Swish Receives ISO 9001:2015 Certification,https://www.benzinga.com/pressreleases/21/01/n19227019/swish-receives-iso-9001-2015-certification,https://j.mp/39Rcnsl
Benzinga,"Community Health Systems, Inc. Announces Removal of Tender Cap and Increase in Consideration for Its Previously Announced Cash Tender Offer for Junior-Priority Secured Notes Due 2023",https://www.benzinga.com/pressreleases/21/01/b19227017/community-health-systems-inc-announces-removal-of-tender-cap-and-increase-in-consideration-for-its,https://j.mp/38XfEqA
Benzinga,Pennybacker Capital and M2G Ventures Partner to Acquire 1.2 Million Square Feet of Dallas Industrial and Office Space from Retailer Tuesday Morning,https://www.benzinga.com/pressreleases/21/01/n19226996/pennybacker-capital-and-m2g-ventures-partner-to-acquire-1-2-million-square-feet-of-dallas-industri,https://j.mp/3qsPX7k
Benzinga,First Industrial Realty Trust Reports Tax Treatment of Common Stock Distributions,https://www.benzinga.com/pressreleases/21/01/n19226995/first-industrial-realty-trust-reports-tax-treatment-of-common-stock-distributions,https://j.mp/2NlxcV6
Benzinga,"Community Health Systems, Inc. Announces Pricing of $1.775 Billion Junior-Priority Secured Notes",https://www.benzinga.com/pressreleases/21/01/b19226994/community-health-systems-inc-announces-pricing-of-1-775-billion-junior-priority-secured-notes,https://j.mp/3o0Obsv
Benzinga,Commercial Beverage Blender Market to Accelerate at a CAGR of over 2% during 2021-2025 | Technavio,https://www.benzinga.com/pressreleases/21/01/b19226993/commercial-beverage-blender-market-to-accelerate-at-a-cagr-of-over-2-during-2021-2025-technavio,https://j.mp/3qvozW4
Benzinga,Lubricants Market Research Report - Global Forecast to 2024 - Cumulative Impact for COVID-19 Recovery | SpendEdge,https://www.benzinga.com/pressreleases/21/01/b19226992/lubricants-market-research-report-global-forecast-to-2024-cumulative-impact-for-covid-19-recovery-,https://j.mp/3izXYob
