feed,title,long_url,short_url
Benzinga,Nightingale Partners LLC Builds Upon 2020 Accomplishments And Prepares For The Golden Age Of Health Equity,https://www.benzinga.com/pressreleases/21/01/n19083229/nightingale-partners-llc-builds-upon-2020-accomplishments-and-prepares-for-the-golden-age-of-healt,https://j.mp/2XnJ8Y7
Benzinga,Enzychem Lifesciences Presenting at Biotech Showcase Digital 2021,https://www.benzinga.com/pressreleases/21/01/n19083220/enzychem-lifesciences-presenting-at-biotech-showcase-digital-2021,https://j.mp/3bmsr7y
Benzinga,"NASA, FAA Partnership Bolsters American Commercial Space Activities",https://www.benzinga.com/pressreleases/21/01/n19083213/nasa-faa-partnership-bolsters-american-commercial-space-activities,https://j.mp/2XntuMp
Benzinga,"Teva to Host Conference Call to Discuss Fourth Quarter 2020 Financial Results and 2021 Financial Guidance at 8 a.m. ET on February 10, 2021",https://www.benzinga.com/pressreleases/21/01/b19083181/teva-to-host-conference-call-to-discuss-fourth-quarter-2020-financial-results-and-2021-financial-g,https://j.mp/2JVjmr0
Benzinga,"Notice to the media - Minister of Diversity and Inclusion and Youth, Regional Chair, and Medical Officer of Health for the Region of Waterloo to announce Waterloo Safe Voluntary Isolation Site Program",https://www.benzinga.com/pressreleases/21/01/n19083159/notice-to-the-media-minister-of-diversity-and-inclusion-and-youth-regional-chair-and-medical-offic,https://j.mp/2Lzqtps
Benzinga,"REX customer survey reveals COVID-19's effects on home buying and selling, underlines importance of digital capabilities",https://www.benzinga.com/pressreleases/21/01/n19083158/rex-customer-survey-reveals-covid-19s-effects-on-home-buying-and-selling-underlines-importance-of-,https://j.mp/3blpdRH
Benzinga,East Penn Launches New Deka Services Website for Access to Turnkey EF&I and Service Solutions,https://www.benzinga.com/pressreleases/21/01/n19083157/east-penn-launches-new-deka-services-website-for-access-to-turnkey-ef-i-and-service-solutions,https://j.mp/3sfaez5
Benzinga,$1.8 Billion Worldwide Thermal Interface Materials Industry to 2027 - Impact of COVID-19 on the Market,https://www.benzinga.com/pressreleases/21/01/n19083156/1-8-billion-worldwide-thermal-interface-materials-industry-to-2027-impact-of-covid-19-on-the-marke,https://j.mp/38rwJsr
Benzinga,NAV CANADA announces change of location for Annual Meeting,https://www.benzinga.com/pressreleases/21/01/g19083155/nav-canada-announces-change-of-location-for-annual-meeting,https://j.mp/38pvFFp
