feed,title,long_url,short_url
Benzinga,Beigene Insider Trades $33.79 Million In Company Stock,https://benzinga.com/news/21/09/22988132/beigene-insider-trades-33-79-million-in-company-stock,https://j.mp/3kipuJr
Benzinga,CEO Of Salesforce.Com Trades $6.29 Million In Company Stock,https://benzinga.com/news/21/09/22988130/ceo-of-salesforce-com-trades-6-29-million-in-company-stock,https://j.mp/39hq4Rs
Benzinga,WynnBET Enters Multi-Year Partnership With Indianapolis Colts,https://benzinga.com/news/21/09/22987782/wynnbet-enters-multi-year-partnership-with-indianapolis-colts,https://j.mp/3zjtBJi
Benzinga,Notable Advanced Micro Devices Insider Trades $13.58 Million In Company Stock,https://benzinga.com/news/21/09/22988128/notable-advanced-micro-devices-insider-trades-13-58-million-in-company-stock,https://j.mp/3hHCEOx
Benzinga,What Is Happening With Innate Pharma Stock On Friday?,https://benzinga.com/general/biotech/21/09/22988282/what-is-happening-with-innate-pharma-stock-on-friday,https://j.mp/3zlYooZ
