feed,title,long_url,short_url
Investing,"Week Ahead: UK-EU Summit, China Activity Data, RBA, Global PMI Data",https://www.investing.com/analysis/week-ahead-ukeu-summit-china-activity-data-rba-global-pmi-data-200660905,https://da.gd/a2ofEA
Investing,Beyond the headlines: explaining Trump's Gulf 'trillions',https://www.investing.com/news/stock-market-news/beyond-the-headlines-explaining-trumps-gulf-trillions-4050804,https://da.gd/o8lKv
Investing,Trump says U.S. officials will send letters within weeks over trade,https://www.investing.com/news/economy-news/trump-says-us-officials-will-send-letters-within-weeks-over-trade-4050803,https://da.gd/m2hxyJ
Investing,Ontario budget aims to 'tariff-proof' economy as U.S. trade uncertainty weighs,https://www.investing.com/news/economy-news/ontario-budget-aims-to-tariffproof-economy-as-us-trade-uncertainty-weighs-4050785,https://da.gd/JztBCx
Investing,Romania's National Bank holds policy rate amid political unease and Leu pressure,https://www.investing.com/news/economy-news/romanias-national-bank-holds-policy-rate-amid-political-unease-and-leu-pressure-93CH-4050779,https://da.gd/KehjDu
Investing,EU works on new sanction package to pressure Putin,https://www.investing.com/news/economy-news/eu-works-on-new-sanction-package-to-pressure-putin-93CH-4050777,https://da.gd/y6KwUM
