feed,title,long_url,short_url
Investing,U.S. stocks higher at close of trade; Dow Jones Industrial Average up 0.78%,https://www.investing.com/news/stock-market-news/us-stocks-higher-at-close-of-trade-dow-jones-industrial-average-up-078-4051365,https://da.gd/k9w5u
Investing,Canada stocks higher at close of trade; S&P/TSX Composite up 0.29%,https://www.investing.com/news/stock-market-news/canada-stocks-higher-at-close-of-trade-sptsx-composite-up-029-4051363,https://da.gd/VpQo
Investing,Brazil stocks lower at close of trade; Bovespa down 0.11%,https://www.investing.com/news/stock-market-news/brazil-stocks-lower-at-close-of-trade-bovespa-down-011-4051361,https://da.gd/0yqDNI
Investing,Stock market today: S&P 500 climbs to rack up big weekly win on trade optimism,https://www.investing.com/news/stock-market-news/stock-market-today-sp-500-climbs-to-rack-up-big-weeklywin-on-trade-optimism-4049591,https://da.gd/wU4Ofe
Investing,Is the EU at back of the queue for a trade deal?,https://www.investing.com/news/economy-news/is-the-eu-at-back-of-the-queue-for-a-trade-deal-4051351,https://da.gd/L0YqYw
