feed,title,long_url,short_url
Investing,Financials and Real Estate ETFs Witness Strong Rebound,https://www.investing.com/analysis/financials-and-real-estate-etfs-witness-strong-rebound-200643393,https://da.gd/CQK6az
Investing,KSE-100 index experiences volatility amid election clarity and IMF review,https://www.investing.com/news/stock-market-news/kse100-index-experiences-volatility-amid-election-clarity-and-imf-review-93CH-3225215,https://da.gd/VHgh
Investing,"Triumph Group reports robust Q2 fiscal 2024 earnings, raises net sales guidance",https://www.investing.com/news/stock-market-news/triumph-group-reports-robust-q2-fiscal-2024-earnings-raises-net-sales-guidance-93CH-3225214,https://da.gd/xpdLuF
Investing,Expeditors misses profit estimates on gloomy freight demand,https://www.investing.com/news/stock-market-news/expeditors-misses-profit-estimates-on-gloomy-freight-demand-3225213,https://da.gd/siuhv
Investing,Discover Financial faces regulatory scrutiny and legal investigation over credit card misclassification,https://www.investing.com/news/stock-market-news/discover-financial-faces-regulatory-scrutiny-and-legal-investigation-over-credit-card-misclassification-93CH-3225208,https://da.gd/kjxce
