feed,title,long_url,short_url
Investing,"Crypto momentum builds for Dogecoin, XRP, and newcomer Everlodge",https://www.investing.com/news/cryptocurrency-news/crypto-momentum-builds-for-dogecoin-xrp-and-newcomer-everlodge-93CH-3225228,https://da.gd/cyXMk
Investing,"Bitcoin ETF Token's presale attracts $35K in one day, promising deflationary measures",https://www.investing.com/news/cryptocurrency-news/bitcoin-etf-tokens-presale-attracts-35k-in-one-day-promising-deflationary-measures-93CH-3225225,https://da.gd/5rTD
Investing,Simp DAO queen Irene Zhao on why good memes are harder than trading: X Hall of Flame,https://www.investing.com/news/cryptocurrency-news/simp-dao-queen-irene-zhao-on-why-good-memes-are-harder-than-trading-x-hall-of-flame-3225223,https://da.gd/4bKQ
Investing,Bitcoin transaction fees surpass Big Mac price amid October rally,https://www.investing.com/news/cryptocurrency-news/bitcoin-transaction-fees-surpass-big-mac-price-amid-october-rally-93CH-3225220,https://da.gd/XaxBw3
Investing,Coinbase strengthens Global Advisory Council amid heightened crypto scrutiny,https://www.investing.com/news/cryptocurrency-news/coinbase-strengthens-global-advisory-council-amid-heightened-crypto-scrutiny-93CH-3225216,https://da.gd/LKe60O
Investing,Kazakhstan’s authorities confirm they blocked access to Coinbase: Report,https://www.investing.com/news/cryptocurrency-news/kazakhstan,https://da.gd/CtYIU
Investing,Nike comments 'reignite' buy thesis: 6 big analyst picks,https://www.investing.com/news/stock-market-news/nike-comments-reignite-buy-thesis-6-big-analyst-picks-3224597,https://da.gd/vyOMmO
Investing,AMTD IDEA Group revises ADS to Class A share ratio effective November 17,https://www.investing.com/news/stock-market-news/amtd-idea-group-revises-ads-to-class-a-share-ratio-effective-november-17-93CH-3225227,https://da.gd/1lWZwa
Investing,World Kinect gets equal-weight rating at Morgan Stanley,https://www.investing.com/news/stock-market-news/world-kinect-gets-equalweight-rating-at-morgan-stanley-93CH-3225226,https://da.gd/HBugu
Investing,"Oportun Financial reports improved Q3 results, targets cost reductions",https://www.investing.com/news/stock-market-news/oportun-financial-reports-improved-q3-results-targets-cost-reductions-93CH-3225224,https://da.gd/bTlVXo
Investing,Halliburton and Sekal form alliance for automated well construction,https://www.investing.com/news/stock-market-news/halliburton-and-sekal-form-alliance-for-automated-well-construction-93CH-3225219,https://da.gd/uaO6Uj
Investing,"Hamilton Thorne's ownership structure sees balance, hints at future prospects",https://i-invdn-com.investing.com/news/LYNXNPEC0L0PD_M.jpg,https://da.gd/ZsLV
Investing,Oil revenues and tax payments shrink Russia's budget gap in October,https://www.investing.com/news/economic-indicators/oil-revenues-and-tax-payments-shrink-russias-budget-gap-in-october-3225211,https://da.gd/Qfmn97
Investing,Greek central bank governor urges finance ministry to reevaluate tax exemptions,https://www.investing.com/news/economy/greek-central-bank-governor-urges-finance-ministry-to-reevaluate-tax-exemptions-93CH-3225229,https://da.gd/9yxR1g
Investing,Fed's Goolsbee prioritizes inflation control in economic outlook,https://www.investing.com/news/economy/feds-goolsbee-prioritizes-inflation-control-in-economic-outlook-93CH-3225217,https://da.gd/Zt0Ng
