feed,title,long_url,short_url
SeekingAlpha,"NewtekOne GAAP EPS of $0.38 beats by $0.01, revenue of $51M misses by $2.64M",https://seekingalpha.com/news/4032293,
SeekingAlpha,Robinhood Markets reports mixed Q3 earnings; updates FY23 outlook,https://seekingalpha.com/news/4032292,
SeekingAlpha,"Inspire Medical Systems GAAP EPS of -$0.29 beats by $0.27, revenue of $153.3M misses by $1.24M",https://seekingalpha.com/news/4032291,
SeekingAlpha,"ContextLogic GAAP EPS of -$3.35 misses by $0.56, revenue of $60M beats by $2.64M",https://seekingalpha.com/news/4032290,
SeekingAlpha,"Red Violet GAAP EPS of $0.87, revenue of $15.8M",https://seekingalpha.com/news/4032289,
SeekingAlpha,"Marqeta GAAP EPS of -$0.10 misses by $0.01, revenue of $108.89M beats by $13.46M",https://seekingalpha.com/news/4032288,
SeekingAlpha,"Progyny GAAP EPS of $0.16 beats by $0.05, revenue of $280.9M beats by $9.55M",https://seekingalpha.com/news/4032287,
