feed,title,long_url,short_url
SeekingAlpha,"Fidelity National Financial Non-GAAP EPS of $1.23 beats by $0.08, revenue of $2.78B misses by $60M",https://seekingalpha.com/news/4032331,
SeekingAlpha,Gladstone Land FFO of $0.176,https://seekingalpha.com/news/4032330,
SeekingAlpha,"Array Technologies Non-GAAP EPS of $0.21 beats by $0.08, revenue of $350.4M misses by $26.53M",https://seekingalpha.com/news/4032329,
SeekingAlpha,"Noodles & Company Non-GAAP EPS of $0.04 beats by $0.05, revenue of $127.9M beats by $1.77M",https://seekingalpha.com/news/4032328,
SeekingAlpha,Paragon 28 announces new $150M credit facility to replace existing $90M facility,https://seekingalpha.com/news/4032327,
SeekingAlpha,"ESS Tech GAAP EPS of -$0.11 beats by $0.03, revenue of $1.54M misses by $1.58M",https://seekingalpha.com/news/4032326,
SeekingAlpha,"Apple Hospitality FFO of $0.45 in-line, revenue of $385.26M beats by $32.44M",https://seekingalpha.com/news/4032325,
