feed,title,long_url,short_url
SeekingAlpha,"Berkeley Lights EPS misses by $0.03, misses on revenue; reaffirms outlook",https://seekingalpha.com/news/3728684,
SeekingAlpha,"Haemonetics EPS beats by $0.05, beats on revenue",https://seekingalpha.com/news/3728683,
SeekingAlpha,G5 Entertainment AB (publ) reports 1H results,https://seekingalpha.com/news/3728682,
SeekingAlpha,Innoviz Technologies misses on revenue,https://seekingalpha.com/news/3728681,
SeekingAlpha,Cathedral Energy Services reports Q2 results,https://seekingalpha.com/news/3728680,
