feed,title,long_url,short_url
FXEmpire,France’s Socialist party and hard-left LFI form alliance for June parliament vote,https://www.fxempire.com/news/article/frances-socialist-party-and-hard-left-lfi-form-alliance-for-june-parliament-vote-988750,https://bit.ly/3kFUlyO
FXEmpire,"EU to lay out new sanctions on Russia, targeting oil imports",https://www.fxempire.com/news/article/eu-to-lay-out-new-sanctions-on-russia-targeting-oil-imports-988749,https://bit.ly/3P02zjw
FXEmpire,Finnish insurer Sampo’s quarterly earnings beat forecasts,https://www.fxempire.com/news/article/finnish-insurer-sampos-quarterly-earnings-beat-forecasts-988751,https://bit.ly/3LLi38N
FXEmpire,Ryanair load factor tops 90% for first time since COVID-19 began,https://www.fxempire.com/news/article/ryanair-load-factor-tops-90-for-first-time-since-covid-19-began-988746,https://bit.ly/38UdZoo
FXEmpire,"Britain’s WPD pays $19 million for ‘failing vulnerable customers’, regulator says",https://www.fxempire.com/news/article/britains-wpd-pays-19-million-for-failing-vulnerable-customers-regulator-says-988753,https://bit.ly/38OuRws
FXEmpire,Britain’s Boohoo sees tough year ahead as profit falls 28%,https://www.fxempire.com/news/article/britains-boohoo-sees-tough-year-ahead-as-profit-falls-28-988752,https://bit.ly/3kBLEFF
FXEmpire,Cineworld looks to further delay payments to former Regal shareholders,https://www.fxempire.com/news/article/cineworld-looks-to-further-delay-payments-to-former-regal-shareholders-988748,https://bit.ly/3sewkDd
