feed,title,long_url,short_url
SeekingAlpha,"Genco Shipping GAAP EPS of $0.97 beats by $0.01, revenue of $136.2M beats by $42.27M",https://seekingalpha.com/news/3832703,
SeekingAlpha,"UMH Properties FFO of $0.17 misses by $0.04, revenue of $45.9M misses by $0.26M",https://seekingalpha.com/news/3832704,
SeekingAlpha,"Rayonier Non-GAAP EPS of $0.20 beats by $0.04, revenue of $222M misses by $6.87M",https://seekingalpha.com/news/3832702,
SeekingAlpha,"Paratek Pharmaceuticals GAAP EPS of -$0.35 in-line, revenue of $24.86M misses by $2.29M",https://seekingalpha.com/news/3832701,
SeekingAlpha,STORE Capital Q1 earnings beat as portfolio builds; boosts 2022 guidance,https://seekingalpha.com/news/3832700,
SeekingAlpha,"Par Pacific Non-GAAP EPS of -$0.53 misses by $0.21, revenue of $1.35B beats by $40M",https://seekingalpha.com/news/3832699,
SeekingAlpha,"Digi International Non-GAAP EPS of $0.41 beats by $0.09, revenue of $94.71M beats by $5.28M",https://seekingalpha.com/news/3832698,
