feed,title,long_url,short_url
SeekingAlpha,CNX Resources misses top-line and bottom-line estimates; updates FY24 outlook,https://seekingalpha.com/news/4128169,
SeekingAlpha,"TechnipFMC Non-GAAP EPS of $0.43 beats by $0.12, revenue of $2.33B beats by $100M",https://seekingalpha.com/news/4128168,
SeekingAlpha,Earnings Summary: RTX surpasses Q2 estimates and raises FY2024 earnings outlook,https://seekingalpha.com/news/4128167,
SeekingAlpha,"RPM Non-GAAP EPS of $1.56 in-line, revenue of $2B misses by $10M",https://seekingalpha.com/news/4128166,
SeekingAlpha,Southwest Airlines ditches open seating model to offer assigned seats,https://seekingalpha.com/news/4128165,
SeekingAlpha,"Southwest Airlines Non-GAAP EPS of $0.58 beats by $0.07, revenue of $7.35B beats by $10M",https://seekingalpha.com/news/4128164,
SeekingAlpha,Crescent Point Energy reports Q2 results,https://seekingalpha.com/news/4128163,
