feed,title,long_url,short_url
SeekingAlpha,Reliance Steel & Aluminum misses top-line and bottom-line estimates; initiates Q3 outlook,https://seekingalpha.com/news/4128174,
SeekingAlpha,"Bombardier GAAP EPS of $0.12 misses by $0.70, revenue of $2.2B beats by $360M",https://seekingalpha.com/news/4128173,
SeekingAlpha,"Northrop Grumman GAAP EPS of $6.36 beats by $0.45, revenue of $10.22B beats by $200M",https://seekingalpha.com/news/4128172,
SeekingAlpha,"RPC Non-GAAP EPS of $0.15 beats by $0.02, revenue of $364.2M misses by $16.19M",https://seekingalpha.com/news/4128171,
SeekingAlpha,MarineMax beats top-line and bottom-line estimates; reaffirms FY24 outlook,https://seekingalpha.com/news/4128170,
