feed,title,long_url,short_url
Investing,"Bitcoin to hit $1 million mark, predicts BitMEX co-founder",https://www.investing.com/news/cryptocurrency-news/bitcoin-to-hit-1-million-mark-predicts-bitmex-cofounder-93CH-3221900,https://da.gd/SqVt1
Investing,Russia has no plans to lift restrictions on fuel exports right now - RIA cites Novak,https://www.investing.com/news/commodities-news/russia-has-no-plans-to-lift-restrictions-on-fuel-exports-right-now--ria-cites-no,https://da.gd/1JPuQ
Investing,Factbox-The other crypto bosses in US authorities' crosshairs,https://www.investing.com/news/stock-market-news/factboxthe-other-crypto-bosses-in-us-authorities-crosshairs-3221906,https://da.gd/fCs0p
Investing,Houlihan Lokey explores acquisition of private equity specialist Triago,https://www.investing.com/news/stock-market-news/houlihan-lokey-explores-acquisition-of-private-equity-specialist-triago-93CH-3221903,https://da.gd/JPKhsS
Investing,"Amazon's founder Jeff Bezos is moving to Miami, leaving Seattle after nearly 30 years in the city",https://www.investing.com/news/stock-market-news/amazons-founder-jeff-bezos-is-moving-to-miami-leaving-seattle-after-nearly-30-years-in-the-city-432SI-3221902,https://da.gd/gDIG9T
Investing,"JLL expands credit facility to $3.3bn, aligns with sustainability goals",https://www.investing.com/news/stock-market-news/jll-expands-credit-facility-to-33bn-aligns-with-sustainability-goals-93CH-3221901,https://da.gd/J8H4t
Investing,"US job growth slows in October, impacts Bitcoin and other risk assets",https://www.investing.com/news/economy/us-job-growth-slows-in-october-impacts-bitcoin-and-other-risk-assets-93CH-3221907,https://da.gd/BlddSo
