feed,title,long_url,short_url
Benzinga,"Thermal Energy Storage Market Size Research Report [2020–2026]: Global Industry Expected to Grow USD 8558.34 Million, Says Facts & Factors",https://www.benzinga.com/pressreleases/21/01/g19251843/thermal-energy-storage-market-size-research-report-2020-2026-global-industry-expected-to-grow-usd-,https://j.mp/3c0ITL8
Benzinga,Comba Selects Celeno's Wi-Fi Chips to Deliver an Advanced Mobile Broadband Router,https://www.benzinga.com/pressreleases/21/01/n19251677/comba-selects-celenos-wi-fi-chips-to-deliver-an-advanced-mobile-broadband-router,https://j.mp/2NlpSst
Benzinga,OC Health Care Agency Expands Relationship With AM TRACE To Support Response To COVID-19 Pandemic,https://www.benzinga.com/pressreleases/21/01/n19251634/oc-health-care-agency-expands-relationship-with-am-trace-to-support-response-to-covid-19-pandemic,https://j.mp/2NqfVKs
Benzinga,GBLT Corp. Receives USD $4.8 Million Contract With European Mass Merchandiser for Private Battery Label,https://www.benzinga.com/pressreleases/21/01/n19251628/gblt-corp-receives-usd-4-8-million-contract-with-european-mass-merchandiser-for-private-battery-la,https://j.mp/3ivWc7H
Benzinga,"Shell Midstream Partners, L.P. Names Steve Ledbetter as Next CEO",https://www.benzinga.com/pressreleases/21/01/g19251597/shell-midstream-partners-l-p-names-steve-ledbetter-as-next-ceo,https://j.mp/2LPK1GE
Benzinga,Marijuana Strategic Ventures Appoints Arman Tabatabaei to the Board of Directors,https://www.benzinga.com/pressreleases/21/01/g19251585/marijuana-strategic-ventures-appoints-arman-tabatabaei-to-the-board-of-directors,https://j.mp/393JoCr
Benzinga,Protech Home Medical Announces Date and Time for Q4 and Full Year Fiscal 2020 Conference Call and Audio Webcast,https://www.benzinga.com/pressreleases/21/01/g19251562/protech-home-medical-announces-date-and-time-for-q4-and-full-year-fiscal-2020-conference-call-and-,https://j.mp/3qCyZmY
Benzinga,"Clubhouse Media Group Announces Ticker and Corporate Name Change Effective January 20, 2021",https://www.benzinga.com/pressreleases/21/01/g19251548/clubhouse-media-group-announces-ticker-and-corporate-name-change-effective-january-20-2021,https://j.mp/39Vd8Az
Benzinga,GridGain Continues Its Strong Momentum in 2020,https://www.benzinga.com/pressreleases/21/01/g19251542/gridgain-continues-its-strong-momentum-in-2020,https://j.mp/3968lx3
