feed,title,long_url,short_url
Benzinga,Automotive Shocks and Struts Market Research 2021-2025 | Market Planning Structure Due to COVID-19 | Technavio,https://www.benzinga.com/pressreleases/21/01/b19266707/automotive-shocks-and-struts-market-research-2021-2025-market-planning-structure-due-to-covid-19-t,https://j.mp/3iyyibq
Benzinga,Global Landing String Equipment Market Research 2021-2025 | COVID-19 Market Impact Analysis | Technavio,https://www.benzinga.com/pressreleases/21/01/b19266690/global-landing-string-equipment-market-research-2021-2025-covid-19-market-impact-analysis-technavi,https://j.mp/3qFguOF
Benzinga,Air Around the Clock Partners With Lipof & McGee Advertising,https://www.benzinga.com/pressreleases/21/01/b19266689/air-around-the-clock-partners-with-lipof-mcgee-advertising,https://j.mp/2MdFbCS
Benzinga,"SHAREHOLDER ACTION ALERT: The Schall Law Firm Announces the Filing of a Class Action Lawsuit Against 9F Inc. and Encourages Investors with Losses in Excess of $100,000 to Contact the Firm",https://www.benzinga.com/pressreleases/21/01/b19266687/shareholder-action-alert-the-schall-law-firm-announces-the-filing-of-a-class-action-lawsuit-agains,https://j.mp/2Y5sZqs
Benzinga,Clarke Inc. Announces Intention to Make a Substantial Issuer Bid for its Shares,https://www.benzinga.com/pressreleases/21/01/n19266688/clarke-inc-announces-intention-to-make-a-substantial-issuer-bid-for-its-shares,https://j.mp/3iD8Ly6
