feed,title,long_url,short_url
Investing,Earnings call: Atlas Copco Group reports mixed Q2 2024 results,https://www.investing.com/news/stock-market-news/earnings-call-atlas-copco-group-reports-mixed-q2-2024-results-93CH-3528442,https://da.gd/vOQcEp
Investing,Earnings call: Acme United Q2 growth on sales and new acquisitions,https://www.investing.com/news/stock-market-news/earnings-call-acme-united-q2-growth-on-sales-and-new-acquisitions-93CH-3528441,https://da.gd/QJQcq
Investing,Earnings call: Boliden reports strong Q2 with SEK4 billion profit,https://www.investing.com/news/stock-market-news/earnings-call-boliden-reports-strong-q2-with-sek4-billion-profit-93CH-3528437,https://da.gd/l1C1
Investing,Earnings call: Telenor reports strong Q2 with growth in Nordics and Asia,https://www.investing.com/news/stock-market-news/earnings-call-telenor-reports-strong-q2-with-growth-in-nordics-and-asia-93CH-3528436,https://da.gd/BalQ
Investing,Earnings call: Choice Properties REIT reports robust Q2 2024 results,https://www.investing.com/news/stock-market-news/earnings-call-choice-properties-reit-reports-robust-q2-2024-results-93CH-3528433,https://da.gd/NFCoen
