feed,title,long_url,short_url
SeekingAlpha,Senti Biosciences GAAP EPS of -$0.26,https://seekingalpha.com/news/4104506,
SeekingAlpha,Neoleukin Therapeutics GAAP EPS of -$1.00 beats by $0.03,https://seekingalpha.com/news/4104505,
SeekingAlpha,There could be high drama around Tesla's shareholder meeting next month,https://seekingalpha.com/news/4104504,
SeekingAlpha,"Soligenix GAAP EPS of -$0.18, revenue of $0.1M",https://seekingalpha.com/news/4104503,
SeekingAlpha,Suzano S.A. reports Q1 results,https://seekingalpha.com/news/4104502,
