feed,title,long_url,short_url
Investing,"Earnings call: AWH posts robust Q1 growth, plans strategic expansion",https://www.investing.com/news/stock-market-news/earnings-call-awh-posts-robust-q1-growth-plans-strategic-expansion-93CH-3435023,https://da.gd/uEYaq
Investing,"Earnings call: Arcadia Biosciences shows growth in Q1 with GoodWheat, Zola",https://www.investing.com/news/stock-market-news/earnings-call-arcadia-biosciences-shows-growth-in-q1-with-goodwheat-zola-93CH-3435022,https://da.gd/U89l9
Investing,Earnings call: Skanska reports mixed Q1 results amid market challenges,https://www.investing.com/news/stock-market-news/earnings-call-skanska-reports-mixed-q1-results-amid-market-challenges-93CH-3435019,https://da.gd/YgA5
Investing,"Earnings call: Spin Master sees revenue climb, dividend doubles amid challenges",https://www.investing.com/news/stock-market-news/earnings-call-spin-master-sees-revenue-climb-dividend-doubles-amid-challenges-93CH-3435018,https://da.gd/j4u8
Investing,"McDonald's to launch $5 meal deal to lure back customers, Bloomberg News reports",https://www.investing.com/news/stock-market-news/mcdonalds-to-launch-5-meal-deal-to-lure-back-customers-bloomberg-news-reports-3435011,https://da.gd/efAT9D
Investing,Earnings call: CareDx raises 2024 revenue guidance on strong Q1 performance,https://www.investing.com/news/stock-market-news/earnings-call-caredx-raises-2024-revenue-guidance-on-strong-q1-performance-93CH-3435012,https://da.gd/xOYA
Investing,"Earnings call: Wesdome Gold Mines reports solid Q1 performance, on track for 2024",https://www.investing.com/news/stock-market-news/earnings-call-wesdome-gold-mines-reports-solid-q1-performance-on-track-for-2024-93CH-3435010,https://da.gd/MxxNPm
Investing,"Earnings call: Logan Ridge reports strong Q1 growth, optimistic outlook",https://www.investing.com/news/stock-market-news/earnings-call-logan-ridge-reports-strong-q1-growth-optimistic-outlook-93CH-3435007,https://da.gd/5RcO
Investing,Earnings call: Global Water Resources reports mixed Q1 results,https://www.investing.com/news/stock-market-news/earnings-call-global-water-resources-reports-mixed-q1-results-93CH-3435006,https://da.gd/tPGuu
