feed,title,long_url,short_url
TheStreet,"Netflix, NFL Christmas Day deal is officially more than just speculation",https://www.thestreet.com/sports/netflix-nfl-christmas-day-deal-more-than-just-speculation-after-new-report,https://da.gd/YfMVdP
TheStreet,Nissan dealers aren't buying into a desperate plan to move cars,https://www.thestreet.com/automotive/nissan-dealers-arent-buying-into-a-desperate-plan-to-move-cars-,https://da.gd/ohg72
TheStreet,China extends visa-free travel rules for 11 countries,https://www.thestreet.com/travel/which-countries-can-visit-china-without-a-visa-china-is-extends-visa-free-travel-rules-for-11-countries,https://da.gd/dVmNb
TheStreet,Target pulls back its most controversial merchandise after boycott,https://www.thestreet.com/retail/target-pulls-back-most-controversial-merchandise-boycott,https://da.gd/E7XS
TheStreet,Flying your dog into the US just got a lot harder,https://www.thestreet.com/travel/cdc-rules-traveling-with-pets-usa,https://da.gd/5Yeciz
TheStreet,"WNBA is expanding again, now with its first team outside the U.S",https://www.thestreet.com/sports/wnba-expanding-again-first-team-outside-the-us,https://da.gd/fwxjH
TheStreet,Tesla secretly makes a major change to its job postings,https://www.thestreet.com/automotive/tesla-secretly-makes-a-major-change-to-its-job-postings,https://da.gd/HZikgF
