feed,title,long_url,short_url
SeekingAlpha,Edesa Biotech GAAP EPS of -$0.58 beats by $0.11,https://seekingalpha.com/news/4104853,
SeekingAlpha,"Mountain Valley Pipeline passes test after fixing leak, moves to enter service",https://seekingalpha.com/news/4104852,
SeekingAlpha,Beacon announces additional $225M ASR program,https://seekingalpha.com/news/4104851,
SeekingAlpha,"FutureFuel GAAP EPS of $0.10, revenue of $58.28M",https://seekingalpha.com/news/4104850,
SeekingAlpha,"BBX Capital GAAP EPS of -$0.94, revenue of $81M",https://seekingalpha.com/news/4104849,
SeekingAlpha,AirNet Technology files to sell 4.57M shares for holders,https://seekingalpha.com/news/4104846,
SeekingAlpha,"Forward Industries GAAP EPS of -$0.05, revenue of $7.83M",https://seekingalpha.com/news/4104845,
