feed,title,long_url,short_url
SeekingAlpha,"Aquestive Therapeutics, Pharmanovia ink licensing & supply pact for Libervant buccal film",https://seekingalpha.com/news/3886727,
SeekingAlpha,"DocuSign rises as it says it will cut its workforce by 9%, sees charges up to $40M",https://seekingalpha.com/news/3886725,
SeekingAlpha,Merck in pact with Sinopharm to launch oral COVID-19 therapy in China,https://seekingalpha.com/news/3886726,
SeekingAlpha,Real estate ETFs struggle as mortgage rates top highest levels since mid-2008,https://seekingalpha.com/news/3886719,
SeekingAlpha,Rubicon Technologies achieves AWS Smart City Competency,https://seekingalpha.com/news/3886724,
