feed,title,long_url,short_url
Investing,Crypto community unimpressed by SBF’s lengthy Substack letter,https://www.investing.com/news/cryptocurrency-news/crypto-community-unimpressed-by-sbfs-lengthy-substack-letter-2979522,https://da.gd/67VV
Investing,Southwest Airlines sued by shareholders over flight meltdown,https://www.investing.com/news/stock-market-news/southwest-airlines-sued-by-shareholders-over-flight-meltdown-2979519,https://da.gd/actEc
Investing,Adidas loses N.Y. trial against Thom Browne over three-stripe design,https://www.investing.com/news/stock-market-news/adidas-loses-ny-trial-against-thom-browne-over-threestripe-design-2979518,https://da.gd/dHwDOa
Investing,Russia criticises Reuters story on Russian hackers targeting U.S. nuclear scientists,https://www.investing.com/news/economy/russia-criticises-reuters-story-on-russian-hackers-targeting-us-nuclear-scientists-2979521,https://da.gd/WPw0F
Investing,"China's on the move again, economic outlook brightens",https://www.investing.com/news/economy/chinas-on-the-move-again-economic-outlook-brightens-2979517,https://da.gd/FUzc
