feed,title,long_url,short_url
InsiderMonkey,Hedge Funds Keep Betting On TransUnion (TRU),https://insidermonkey.com/blog/--873461,https://j.mp/3jVtfBs
InsiderMonkey,"Is Yum! Brands, Inc. (YUM) Going to Burn These Hedge Funds?",https://insidermonkey.com/blog/--873464,https://j.mp/2ZgSAxZ
InsiderMonkey,Citizens Financial Group Inc (CFG): Hedge Fund Interest Inching Up,https://insidermonkey.com/blog/--873423,https://j.mp/2GH0aeN
InsiderMonkey,Is American Airlines Group Inc (AAL) Going to Burn These Hedge Funds?,https://insidermonkey.com/blog/--873474,https://j.mp/35koVaO
InsiderMonkey,"Should I Buy Advance Auto Parts, Inc. (AAP)?",https://insidermonkey.com/blog/--873469,https://j.mp/2F9YI47
InsiderMonkey,"Nabors Industries (NBR) Has Fallen 64% in Last One Year, Underperforms Market",https://insidermonkey.com/blog/--874390,https://j.mp/3iaAWDp
InsiderMonkey,Hedge Funds Never Been This Bullish On Deckers Outdoor Corp (DECK),https://insidermonkey.com/blog/--873470,https://j.mp/3k0DeVY
InsiderMonkey,"Hedge Funds Are Coming Back To Xilinx, Inc. (XLNX)",https://insidermonkey.com/blog/--873479,https://j.mp/336XtKV
InsiderMonkey,Hedge Funds Aren’t Done Betting On Kansas City Southern (KSU),https://insidermonkey.com/blog/--873480,https://j.mp/336XluV
InsiderMonkey,The Allstate Corporation (ALL): Hedge Fund Interest Inching Up,https://insidermonkey.com/blog/--873487,https://j.mp/3lXD2sJ
InsiderMonkey,Hedge Funds Keep Buying Fidelity National Financial Inc (FNF),https://insidermonkey.com/blog/--873484,https://j.mp/2GGbzLU
InsiderMonkey,"Maxar Technologies (MAXR) Has Risen 235% in Last One Year, Outperforms Market",https://insidermonkey.com/blog/--874255,https://j.mp/32eFiUF
InsiderMonkey,"Just Energy (JE) Has Fallen 78% in Last One Year, Underperforms Market",https://insidermonkey.com/blog/--874241,https://j.mp/2R8u9hH
InsiderMonkey,"Greenhill & Co (GHL) Has Fallen 11% in Last One Year, Underperforms Market",https://insidermonkey.com/blog/--874239,https://j.mp/2DJphfU
InsiderMonkey,"Quad/Graphics (QUAD) Has Fallen 65% in Last One Year, Underperforms Market",https://insidermonkey.com/blog/--874236,https://j.mp/3m5ML0a
InsiderMonkey,"GameStop (GME) Has Risen 78% in Last One Year, Outperforms Market",https://insidermonkey.com/blog/--874233,https://j.mp/32b7w2c
InsiderMonkey,"Apollo Global Management (APO) Has Risen 15% in Last One Year, In-line With Markets",https://insidermonkey.com/blog/--874230,https://j.mp/3kakdRp
InsiderMonkey,"Carlyle Group (CG) Has Risen 5% in Last One Year, Underperforms Market",https://insidermonkey.com/blog/--874224,https://j.mp/3k1ZYFn
InsiderMonkey,Is FedEx Corporation (FDX) A Good Stock To Buy?,https://insidermonkey.com/blog/--873493,https://j.mp/32bgtJ3
InsiderMonkey,Hedge Funds Dipping Their Toes Back Into Synchrony Financial (SYF),https://insidermonkey.com/blog/--873499,https://j.mp/2GHuVQM
