feed,title,long_url,short_url
Motley,1 Undervalued Stock Investors Can Buy Now in April (2026),https://www.fool.com/investing/2026/04/02/1-undervalued-stock-investors-can-buy-now-in-april/?source=iedfolrf0000001,
Motley,I'm Upgrading This Unstoppable Semiconductor Stock to a Buy,https://www.fool.com/investing/2026/04/02/im-upgrading-this-unstoppable-semiconductor-stock/?source=iedfolrf0000001,
Motley,"Is IonQ Stock a Generational Buying Opportunity, or a Falling Knife to Avoid?",https://www.fool.com/investing/2026/04/02/is-ionq-stock-a-generational-buying-opportunity-or/?source=iedfolrf0000001,
Motley,I'm Upgrading Palo Alto Stock to a Buy,https://www.fool.com/investing/2026/04/02/im-upgrading-palo-alto-stock-to-a-buy/?source=iedfolrf0000001,
Motley,Great News for Alphabet Stock Investors,https://www.fool.com/investing/2026/04/02/great-news-for-alphabet-stock-investors/?source=iedfolrf0000001,
Motley,Massive News for Rivian Stock Investors,https://www.fool.com/investing/2026/04/02/massive-news-for-rivian-stock-investors/?source=iedfolrf0000001,
Motley,Should You Buy Uber Stock on the Dip?,https://www.fool.com/investing/2026/04/02/should-you-buy-uber-stock-on-the-dip/?source=iedfolrf0000001,
Motley,1 Unstoppable Dividend Stock to Buy and Hold for a Decade,https://www.fool.com/investing/2026/04/02/1-unstoppable-dividend-stock-to-buy-and-hold-for-a/?source=iedfolrf0000001,
