feed,title,long_url,short_url
Investing,Gold prices rally to new peak amid fears of upcoming Trump tariffs,https://www.investing.com/news/commodities-news/gold-prices-rally-to-new-peak-amid-fears-of-upcoming-trump-tariffs-3959217,https://da.gd/MMOf
Investing,"Gold prices pullback from record high above $3,120/oz as Trump tariffs draw closer",https://www.investing.com/news/commodities-news/gold-price,https://da.gd/rN2qpS
Investing,"Fire at Petronas-operated gas pipeline injures 33, affects homes",https://www.investing.com/news/stock-market-news/fire-at-petronasoperated-gas-pipeline-injures-33-affects-homes-93CH-3959218,https://da.gd/XqYr7N
Investing,Lufthansa says no decline in US bookings despite stricter border policy,https://www.investing.com/news/stock-market-news/lufthansa-says-no-decline-in-us-bookings-despite-stricter-border-policy-3959209,https://da.gd/PsDzq
Investing,Goldman Sachs cuts 12-month forecast for Europe’s STOXX 600 on tariff concerns,https://www.investing.com/news/stock-market-news/goldman-sachs-cuts-12month-forecast-for-europes-stoxx-600-on-tariff-concerns-3959203,https://da.gd/SAdNKh
Investing,Banks face anxious wait as UK Supreme Court considers 'secret' motor finance commissions,https://www.investing.com/news/stock-market-news/banks-face-anxious-wait-as-uk-supreme-court-considers-secret-motor-finance-commissions-3959199,https://da.gd/BVuRKk
Investing,UK shop price decline slows in March; food inflation rises,https://www.investing.com/news/economic-indicators/uk-shop-price-decline-slows-in-march-food-inflation-rises-93CH-3959216,https://da.gd/kD3jN
Investing,Russian manufacturing contracts at fastest pace in three years,https://www.investing.com/news/economic-indicators/russian-manufacturing-contracts-at-fastest-pace-in-three-years-93CH-3959213,https://da.gd/OzX5
Investing,"SpaceX eyes Starlink hub with multiple ground stations in Vietnam, sources say",https://www.investing.com/news/economic-indicators/spacex-eyes-starlink-hub-with-multiple-ground-stations-in-vietnam-sources-say-3959210,https://da.gd/654Uy
Investing,"Russian factory activity sees sharpest decline in nearly three years, PMI shows",https://www.investing.com/news/economic-indicators/russian-factory-activity-sees-sharpest-decline-in-nearly-three-years-pmi-shows-3959207,https://da.gd/hwAdB
