feed,title,long_url,short_url
SeekingAlpha,"Williams-Sonoma soars after comparable sales, margins top estimates",https://seekingalpha.com/news/3842841,
SeekingAlpha,Staffing 360 Solutions gets Nasdaq notice of additional determination of delinquency,https://seekingalpha.com/news/3842840,
SeekingAlpha,"e.l.f. Beauty Non-GAAP EPS of $0.13 beats by $0.07, revenue of $105.14M beats by $13.92M",https://seekingalpha.com/news/3842839,
SeekingAlpha,Snowflake shares plunge in after-hours as first-quarter loss disappoints,https://seekingalpha.com/news/3842837,
SeekingAlpha,Turkey drafts legislation for cryptocurrency market supervision,https://seekingalpha.com/news/3842836,
SeekingAlpha,"Change Healthcare Non-GAAP EPS of $0.39 misses by $0.02, revenue of $920.13M beats by $17.27M",https://seekingalpha.com/news/3842835,
