feed,title,long_url,short_url
Nasdaq,Domino’s Pizza party outlasts the lockdown,https://www.nasdaq.com/articles/dominos-pizza-party-outlasts-the-lockdown-2021-07-22,https://j.mp/3iTw7A7
Nasdaq,"US STOCKS-Wall Street ends higher, boosted by tech, growth stocks",https://www.nasdaq.com/articles/us-stocks-wall-street-ends-higher-boosted-by-tech-growth-stocks-2021-07-22,https://j.mp/2WcIa3F
Nasdaq,RLI Makes Notable Cross Below Critical Moving Average,https://www.nasdaq.com/articles/rli-makes-notable-cross-below-critical-moving-average-2021-07-22,https://j.mp/3eLVFxP
Nasdaq,Viewsroom: Olympic blunders and Robinhood’s IPO,https://www.nasdaq.com/articles/viewsroom%3A-olympic-blunders-and-robinhoods-ipo-2021-07-22,https://j.mp/3BuXWXQ
Nasdaq,"Brazil coffee frost sparks default fears, crop recovery may take years",https://www.nasdaq.com/articles/brazil-coffee-frost-sparks-default-fears-crop-recovery-may-take-years-2021-07-22,https://j.mp/3kQ0b1V
Nasdaq,Wheat deteriorates in parts of Argentina due to poor rains -exchange,https://www.nasdaq.com/articles/wheat-deteriorates-in-parts-of-argentina-due-to-poor-rains-exchange-2021-07-22,https://j.mp/2TsAaKL
Nasdaq,"GRAINS-CBOT wheat snaps winning streak; corn, soybeans also fall",https://www.nasdaq.com/articles/grains-cbot-wheat-snaps-winning-streak-corn-soybeans-also-fall-2021-07-22,https://j.mp/3iG4lGS
