feed,title,long_url,short_url
SeekingAlpha,Unity Software tumbles as Benchmark says current environment likely to be 'challenging',https://seekingalpha.com/news/3849187,
SeekingAlpha,"Kroger Non-GAAP EPS of $1.45 beats by $0.17, revenue of $44.6B beats by $1.55B, raises FY22 guidance",https://seekingalpha.com/news/3849186,
SeekingAlpha,National Vision Holdings sees price target cut from Morgan Stanley,https://seekingalpha.com/news/3849185,
SeekingAlpha,Applied Materials acquires Picosun Oy for undisclosed sum,https://seekingalpha.com/news/3849181,
SeekingAlpha,Legacy Automakers Charge Ahead Of New Entrants In EV Push,https://seekingalpha.com/article/4518715,
SeekingAlpha,Aggressive Tightening Sees Risk Appetites Evaporate,https://seekingalpha.com/article/4518749,
