feed,title,long_url,short_url
Investing,Morning Bid: Waller and Bessent help peg back Treasury yields,https://www.investing.com/news/commodities-news/morning-bid-waller-and-bessent-help-peg-back-treasury-yields-3818567,https://da.gd/q0eLYk
Investing,"NHTSA opens preliminary probe into more than 870,000 GM vehicles",https://www.investing.com/news/stock-market-news/nhtsa-opens-preliminary-probe-into-more-than-870000-gm-vehicles-3818590,https://da.gd/wuU97w
Investing,Citadel Securities seeks to establish brokerage in China,https://www.investing.com/news/stock-market-news/citadel-securities-seeks-to-establish-brokerage-in-china-93CH-3818583,https://da.gd/kcFsL
Investing,This Wall Street quant model ranks the best to worst Magnificent 7 stocks,https://www.investing.com/news/stock-market-news/this-wall-street-quant-model-ranks-the-best-to-worst-magnificent-7-stocks-3818582,https://da.gd/BLCOA
Investing,"Reinsurers drop some Middle East restrictions, sources say",https://www.investing.com/news/stock-market-news/reinsurers-drop-some-middle-east-restrictions-sources-say-3818565,https://da.gd/Sc7VP
Investing,Industry conferences kick off 2025 with more security following murder of US executive,https://www.investing.com/news/stock-market-news/industry-conferences-kick-off-2025-with-more-security-following-murder-of-us-executive-3818562,https://da.gd/idJ9q
Investing,"Anglo American stock is becoming 'too expensive', JPMorgan warns",https://www.investing.com/news/stock-market-news/anglo-american-stock-is-becoming-too-expensive-jpmorgan-warns-3818560,https://da.gd/TpsMuL
Investing,Netflix's sports push likely fueled subscriber growth in holiday quarter,https://www.investing.com/news/stock-market-news/netflixs-sports-push-likely-fueled-subscriber-growth-in-holiday-quarter-3818558,https://da.gd/7GoR0S
Investing,Wall Street banks sense opportunity for looser capital rules as Trump ushers in new era,https://www.investing.com/news/stock-market-news/wall-street-banks-sense-opportunity-for-looser-capital-rules-as-trump-ushers-in-new-era-3818557,https://da.gd/xE1DBW
Investing,Small caps lose Trump bump as rising rates sap strength,https://www.investing.com/news/economy-news/small-caps-lose-trump-bump-as-rising-rates-sap-strength-3818572,https://da.gd/dM8zNd
Investing,"ECB should not rush rate cuts, Nagel says",https://www.investing.com/news/economy-news/ecb-should-not-rush-rate-cuts-nagel-says-3818568,https://da.gd/eNxy9K
Investing,Analysis-Corporate hedging to save debt costs may have worsened 10yr sell-off,https://www.investing.com/news/economy-news/analysiscorporate-hedging-to-save-debt-costs-may-have-worsened-10yr-selloff-3818564,https://da.gd/LDkiDn
Investing,Futures edge higher with all eyes on Trump inauguration,https://www.investing.com/news/economy-news/futures-edge-higher-with-all-eyes-on-trump-inauguration-3818561,https://da.gd/3BaTG2
Investing,Factbox-US stock performance on dates of presidential inaugurations,https://www.investing.com/news/economy-news/factboxus-stock-performance-on-dates-of-presidential-inaugurations-3818555,https://da.gd/j4Exo
Investing,Displaced Los Angeles homeowners face price gouging after wildfires,https://www.investing.com/news/economy-news/displaced-los-angeles-homeowners-face-price-gouging-after-wildfires-3818554,https://da.gd/Yi6si
