feed,title,long_url,short_url
SeekingAlpha,U.S. adds solid 261K jobs in October unemployment rate rises to 3.7%,https://seekingalpha.com/news/3901887,
SeekingAlpha,"5 stocks to watch on Friday: Starbucks, DraftKings, Block and more",https://seekingalpha.com/news/3901882,
SeekingAlpha,"Dorel Industries Non-GAAP EPS of -$1.07, revenue of $374.1M",https://seekingalpha.com/news/3901885,
SeekingAlpha,"Super Group says Digital Gaming acquisition to close in January 2023, reaffirms guidance",https://seekingalpha.com/news/3901884,
SeekingAlpha,"Twin Disc GAAP EPS of -$0.15 misses by $0.30, revenue of $55.9M misses by $2.5M",https://seekingalpha.com/news/3901883,
