feed,title,long_url,short_url
Investing,Hadrian valuation jumps to $7.5B in new funding talks - Bloomberg,https://www.investing.com/news/stock-market-news/hadrian-valuation-jumps-to-75b-in-new-funding-talks--bloomberg-93CH-4756668,
Investing,Commercial Vehicle Group stock gains on Russell 2000 addition,https://www.investing.com/news/stock-market-news/commercial-vehicle-group-stock-gains-on-russell-2000-addition-93CH-4756623,
Investing,Why is FedEx stock tumbling today?,https://www.investing.com/news/stock-market-news/why-is-fedex-stock-tumbling-today-93CH-4756622,
Investing,Morgan Stanley restricts redemptions at private credit fund after withdrawals surge,https://www.investing.com/news/stock-market-news/morgan-stanley-restricts-redemptions-at-private-credit-fund-after-withdrawals-surge-4756615,
Investing,Nike stock rises on CFO transition and tariff refund benefit,https://www.investing.com/news/stock-market-news/nike-stock-rises-on-cfo-transition-and-tariff-refund-benefit-93CH-4756608,
