feed,title,long_url,short_url
ETFTrends,Biotech ETFs Gain Momentum via AI Drug Discovery & Surging MA,https://www.etftrends.com/thematic-investing-content-hub/biotech-etfs-gain-momentum-ai-drug-discovery-surging-ma/,
ETFTrends,Active Tech ETF GTEK Delivers Smashing YTD Performance,https://www.etftrends.com/future-etfs-content-hub/tech-etf-gtek-delivers-smashing-ytd-performance/,
ETFTrends,Bitcoin Miners Are Winning the AI Boom,https://www.etftrends.com/coinshares-content-hub/bitcoin-miners-are-winning-the-ai-boom/,
ETFTrends,"If Rates Rise, Make a Dash to Cash With This ETF",https://www.etftrends.com/monthly-income-content-hub/rates-rise-make-dash-cash-etf/,
ETFTrends,Which Route During a Tech Rout? Two Low Volatility ETFs,https://www.etftrends.com/innovative-etfs-content-hub/route-tech-rout-low-volatility-etfs/,
ETFTrends,Choosing Consumer Discretionary? Give XLY a Try,https://www.etftrends.com/sector-investing-content-hub/choosing-consumer-discretionary-give-xly/,
