feed,title,long_url,short_url
Investing,Euler DeFi Protocol Faces Loss of $177M In Major Attack,https://www.investing.com/news/cryptocurrency-news/euler-defi-protocol-faces-loss-of-177m-in-major-attack-3029335,https://da.gd/qgnfL
Investing,"Price analysis 3/13: SPX, DXY, BTC, ETH, BNB, XRP, ADA, MATIC, DOGE, SOL",https://www.investing.com/news/cryptocurrency-news/price-analysis-313-spx-dxy-btc-eth-bnb-xrp-ada-matic-doge-sol-3029333,https://da.gd/gUixjl
Investing,General Motors Hyundai in talks to acquire GM’s India plant,https://www.investing.com/news/stock-market-news/general-motors-hyundai-in-talks-to-acquire-gms-india-plant-432SI-3029321,https://da.gd/H5Ig
Investing,S&P 500 turns positive after paring losses on bets of less aggressive Fed,https://www.investing.com/news/stock-market-news/sp-500-turns-positive-after-paring-losses-on-bets-of-less-aggressive-fed-3029329,https://da.gd/rJqZ
Investing,White House says regulators have the tools needed for banking disruptions,https://www.investing.com/news/stock-market-news/white-house-says-regulators-have-the-tools-needed-for-banking-disruptions-3029332,https://da.gd/bE7x4
Investing,SVB shock could have chilling effect on British biotech sector,https://www.investing.com/news/economy/svb-shock-could-have-chilling-effect-on-british-biotech-sector-3029334,https://da.gd/tatx
