feed,title,long_url,short_url
SeekingAlpha,Africa Oil Corporation: Buy The Punished Small Cap,https://seekingalpha.com/article/4695979,
SeekingAlpha,SCHI: Corporate Bonds Could Still Avoid Credit Risk (But Not For Long),https://seekingalpha.com/article/4695978,
SeekingAlpha,Universal Health Realty: The Price Decline Created An Opportunity,https://seekingalpha.com/article/4695977,
SeekingAlpha,Weatherford International: Poised For Growth In The Energy Services Bull Market,https://seekingalpha.com/article/4695976,
SeekingAlpha,VGLT: Fed Rate Cut Could Offer Huge Capital Gain Opportunity,https://seekingalpha.com/article/4695975,
