feed,title,long_url,short_url
Yahoo,"The Gross Law Firm Announces Class Actions on Behalf of Shareholders of BIDU, PROG and LX",https://finance.yahoo.com/news/gross-law-firm-announces-class-190000061.html?.tsrc=rss,https://j.mp/33UL6TY
Yahoo,"MONDAY DEADLINE: The Schall Law Firm Announces the Filing of a Class Action Lawsuit Against Baidu, Inc. and Encourages Investors with Losses in Excess of $100,000 to Contact the Firm",https://finance.yahoo.com/news/monday-deadline-schall-law-firm-181000941.html?.tsrc=rss,https://j.mp/33Y8wYz
Yahoo,Trump and Biden will compete in dueling town halls at the same time Thursday,https://finance.yahoo.com/m/8fb81c7f-2095-3086-9b29-5ffd07a8a684/trump-and-biden-will-compete.html?.tsrc=rss,https://j.mp/3lNw1ty
Yahoo,New York Calls for Social Media Oversight After Twitter Hack,https://finance.yahoo.com/news/york-calls-social-media-oversight-175657845.html?.tsrc=rss,https://j.mp/3k1B88R
Yahoo,"The Zacks Analyst Blog Highlights: EnerSys, Albemarle, BorgWarner, Intel and DRIV",https://finance.yahoo.com/news/zacks-analyst-blog-highlights-enersys-175205784.html?.tsrc=rss,https://j.mp/3iWE6dl
