feed,title,long_url,short_url
Benzinga,Paramount Directors Exit As Skydance Merger Talks Continue: Report,https://benzinga.com/general/entertainment/24/04/38202664/paramount-directors-exit-as-skydance-merger-talks-continue-report,https://da.gd/e5upU
Benzinga,"Rare Disease-Focused Rallybio Inks Development Pact With Johnson & Johnson, Stock Shoots Higher",https://benzinga.com/general/biotech/24/04/38202543/rare-disease-focused-rallybio-inks-development-pact-with-johnson-johnson-stock-shoots-higher,https://da.gd/nI8AWY
Benzinga,Verb Technology Stock Is Rising Thursday: What's Going On?,https://benzinga.com/news/24/04/38202542/verb-technology-stock-is-rising-thursday-whats-going-on,https://da.gd/ZYSBK1
Benzinga,Delta Air Lines Analysts Boost Their Forecasts After Upbeat Earnings,https://benzinga.com/news/earnings/24/04/38202532/delta-air-lines-analysts-boost-their-forecasts-after-upbeat-earnings,https://da.gd/6SWZPU
Benzinga,GOP Members Urge Biden To Adopt Cold-War Stance On China: 'Current Approach Will Yield Little Cooperation',https://benzinga.com/news/24/04/38202541/gop-members-urge-biden-to-adopt-cold-war-stance-on-china-current-approach-will-yield-little-cooperat,https://da.gd/pkp20
Benzinga,Rail Vision Stock Is Moving Thursday: What's Going On?,https://benzinga.com/news/24/04/38202509/rail-vision-stock-is-moving-thursday-whats-going-on,https://da.gd/Yccgy4
