feed,title,long_url,short_url
Benzinga,What's Going On With B2Gold Shares Friday?,https://benzinga.com/markets/equities/24/06/39436402/whats-going-on-with-b2gold-shares-friday,https://da.gd/ujI2gA
Benzinga,CarMax Lags Q1 Earnings and Revenue Estimates,https://benzinga.com/news/earnings/24/06/39432385/carmax-lags-q1-earnings-and-revenue-estimates,https://da.gd/6qP1of
Benzinga,"Cango Reduces Risks At Home, Looks Overseas For New Opportunities",https://benzinga.com/markets/asia/24/06/39436329/cango-reduces-risks-at-home-looks-overseas-for-new-opportunities,https://da.gd/TTHr
Benzinga,Decoding Enphase Energy's Options Activity: What's the Big Picture?,https://benzinga.com/insights/options/24/06/39436265/decoding-enphase-energys-options-activity-whats-the-big-picture,https://da.gd/mDLY
Benzinga,Riot Platforms Options Trading: A Deep Dive into Market Sentiment,https://benzinga.com/insights/options/24/06/39436264/riot-platforms-options-trading-a-deep-dive-into-market-sentiment,https://da.gd/e8mIO7
