feed,title,long_url,short_url
Investing,Telsa stock sees $200 billion surge since Trump win,https://www.investing.com/news/stock-market-news/telsa-stock-sees-200-billion-surges-since-trump-win-3712365,https://da.gd/LN7uzQ
Investing,Trump Media shares rise after Trump says he won't sell,https://www.investing.com/news/stock-market-news/trump-media-shares-rise-after-trump-says-he-wont-sell-3712355,https://da.gd/TC2j
Investing,Trump says he has no plans to sell Trump Media stock,https://www.investing.com/news/stock-market-news/trump-says-he-has-no-plans-to-sell-trump-media-stock-3712349,https://da.gd/x5gv
Investing,Turkey stocks higher at close of trade; BIST 100 up 2.67%,https://www.investing.com/news/stock-market-news/turkey-stocks-higher-at-close-of-trade-bist-100-up-267-3712330,https://da.gd/KNrZe
Investing,Thursday's Insider Trading: Top Buys and Sells in US Stocks,https://www.investing.com/news/stock-market-news/thursdays-insider-trading-top-buys-and-sells-in-us-stocks-93CH-3712323,https://da.gd/E1rgo
Investing,"US consumer sentiment rises in November, UMich says",https://www.investing.com/news/economy-news/us-consumer-sentiment-rises-in-november-umich-says-3712324,https://da.gd/59HSa4
