feed,title,long_url,short_url
CoinQuora,Top 10 Best Decentralized Exchanges With The Lowest Trading Fees,http://coinquora.com/top-10-best-decentralized-exchanges-with-the-lowest-trading-fees/,https://bit.ly/3GsKMNR
CoinQuora,"Top 1000 ETH Whales Are HODLing COMP, is DeFi Making a Comeback?",http://coinquora.com/top-1000-eth-whales-are-hodling-comp-is-defi-making-a-comeback/,https://bit.ly/3lLoYDO
CoinQuora,Luna’s Resurrection: Information You Need To Know Ahead of Launch,http://coinquora.com/lunas-resurrection-information-you-need-to-know-ahead-of-launch/,https://bit.ly/3wNFLMD
CoinQuora,Andreessen Horowitz Raise Largest Crypto Fund for A “Golden Era” Web3,http://coinquora.com/andreessen-horowitz-raise-largest-crypto-fund-for-a-golden-era-web3/,https://bit.ly/3PCP6yl
CoinQuora,Researcher Urges Full Disclosure About Stablecoin Investment Risks,http://coinquora.com/researcher-urges-full-disclosure-about-stablecoin-investment-risks/,https://bit.ly/3z5GTNn
CoinQuora,"Whale Buys $1,015,728 Worth of SHIB: Reveals WhaleStats",http://coinquora.com/whale-buys-1015728-worth-of-shib-reveals-whalestats/,https://bit.ly/3MRYLPA
CoinQuora,SEC’s Hester Peirce Says Regulation Will Happen a Lot Quicker,http://coinquora.com/secs-hester-peirce-says-regulation-will-happen-a-lot-quicker/,https://bit.ly/3sXCc4j
CoinQuora,Google on Lookout for Talent To Lead Its Web3 Team,http://coinquora.com/google-on-lookout-for-talent-to-lead-its-web3-team/,https://bit.ly/3MPmK1P
CoinQuora,Brickken Unlocks the Potential of Company Stock Tokenization,http://coinquora.com/brickken-unlocks-the-potential-of-company-stock-tokenization/,https://bit.ly/38nFtmm
CoinQuora,China’s BSN Develops Blockchain Network Unlinked To Cryptos,http://coinquora.com/chinas-bsn-develops-blockchain-network-unlinked-to-cryptos/,https://bit.ly/3wQgTnD
CoinQuora,South Korean Exchanges Shun Do Kwon’s Appeal to List LUNA 2.0,http://coinquora.com/south-korean-exchanges-shun-do-kwons-appeal-to-list-luna-2-0/,https://bit.ly/3PCruK2
CoinQuora,Mastercard Exec is Bullish on Crypto and Blockchain Technology,http://coinquora.com/mastercard-exec-is-bullish-on-crypto-and-blockchain-technology/,https://bit.ly/3PHFqTc
CoinQuora,"Terra Looks to Redeem Itself, Will Launch LUNA 2.0 on May 27",http://coinquora.com/terra-looks-to-redeem-itself-will-launch-luna-2-0-on-may-27/,https://bit.ly/3GoTZqE
CoinQuora,How Blockchain Technology is Reducing the Digital Divide,http://coinquora.com/how-blockchain-technology-is-reducing-the-digital-divide/,https://bit.ly/3z0Ey6b
CoinQuora,Exotic Markets Develops Dual Currency Note Tech on Solana,http://coinquora.com/exotic-markets-develops-dual-currency-note-tech-on-solana/,https://bit.ly/3wSs3Xw
