feed,title,long_url,short_url
Investing,"Google’s Bard overcomes EU hurdles, expands territories and capabilities",https://www.investing.com/news/cryptocurrency-news/googles-bard-overcomes-eu-hurdles-expands-territories-and-capabilities-3126022,https://da.gd/R1TOZ
Investing,Tesla begins sale of Model Y in South Korea,https://www.investing.com/news/stock-market-news/tesla-begins-sale-of-model-y-in-south-korea-432SI-3126021,https://da.gd/Ihex
Investing,Lilly to buy Versanis for up to $1.93 billion to boost obesity drug portfolio,https://www.investing.com/news/stock-market-news/lilly-to-acquire-versanis-for-up-to-193-billion-3126007,https://da.gd/Vh5Lw
Investing,Boyd Gaming to Equal Weight at Morgan Stanley on strong digital performance,https://www.investing.com/news/stock-market-news/boyd-gaming-to-equal-weight-at-morgan-stanley-on-strong-digital-performance-432SI-3125999,https://da.gd/Nbi6b
Investing,"Analysis-As deficit soars, Egypt expands money supply, fuelling inflation",https://www.investing.com/news/economy/analysisas-deficit-soars-egypt-expands-money-supply-fuelling-inflation-3126037,https://da.gd/IVTSY
