feed,title,long_url,short_url
SeekingAlpha,"Osmotica Pharmaceuticals EPS beats by $0.08, misses on revenue",https://seekingalpha.com/news/3696242,
SeekingAlpha,Floor & Decor acquires Spartan Surfaces in expected boost to commercial flooring business,https://seekingalpha.com/news/3696241,
SeekingAlpha,Bionano jumps as Q1 revenue beat expectations with a two-fold rise,https://seekingalpha.com/news/3696240,
SeekingAlpha,aTyr Pharma EPS misses by $0.19,https://seekingalpha.com/news/3696239,
SeekingAlpha,Research Solutions reports Q3 results,https://seekingalpha.com/news/3696238,
SeekingAlpha,The Beauty Health reports Q1 results,https://seekingalpha.com/news/3696237,
SeekingAlpha,"Co-Diagnostics posts Q1 earnings beat, provides FY forecast",https://seekingalpha.com/news/3696236,
