feed,title,long_url,short_url
Nasdaq,Brewin Dolphin's inflows jump as economic outlook boosts investment planning,https://www.nasdaq.com/articles/brewin-dolphins-inflows-jump-as-economic-outlook-boosts-investment-planning-2021-07-23,https://j.mp/3rtXjZP
Nasdaq,Indian telecom firms fall as court dismisses plea on fee owed to govt,https://www.nasdaq.com/articles/indian-telecom-firms-fall-as-court-dismisses-plea-on-fee-owed-to-govt-2021-07-23,https://j.mp/2V9MP5G
Nasdaq,"U.S. seeks 'reliable, predictable' way forward with N. Korea",https://www.nasdaq.com/articles/u.s.-seeks-reliable-predictable-way-forward-with-n.-korea-2021-07-23,https://j.mp/2V8vHxb
Nasdaq,FOREX-Dollar set for second weekly advance as Fed comes into focus,https://www.nasdaq.com/articles/forex-dollar-set-for-second-weekly-advance-as-fed-comes-into-focus-2021-07-23,https://j.mp/36SNHym
Nasdaq,"Car chip shortage to abate, smartphones could be next: industry execs",https://www.nasdaq.com/articles/car-chip-shortage-to-abate-smartphones-could-be-next%3A-industry-execs-2021-07-23,https://j.mp/3Bwz55M
