feed,title,long_url,short_url
SeekingAlpha,Medigene AG reports Q1 results,https://seekingalpha.com/news/4095759,
SeekingAlpha,"Grupo Simec, S.A.B. de C.V. reports Q1 results",https://seekingalpha.com/news/4095757,
SeekingAlpha,Falcon Oil & Gas GAAP EPS of -C$0.003,https://seekingalpha.com/news/4095753,
SeekingAlpha,Psychedelic drug developers could benefit from NIH funding for chronic pain,https://seekingalpha.com/news/4095746,
SeekingAlpha,Katipult Technology reports Q4 results,https://seekingalpha.com/news/4095751,
