feed,title,long_url,short_url
SeekingAlpha,"Kforce GAAP EPS of $0.58 in-line, revenue of $351.9M misses by $3.11M",https://seekingalpha.com/news/4095811,
SeekingAlpha,"Sanmina Non-GAAP EPS of $1.30 beats by $0.05, revenue of $1.83B misses by $60M",https://seekingalpha.com/news/4095809,
SeekingAlpha,"Amkor Technology GAAP EPS of $0.24 beats by $0.13, revenue of $1.37B misses by $10M",https://seekingalpha.com/news/4095810,
SeekingAlpha,"Paramount Global Non-GAAP EPS of $0.62 beats by $0.26, revenue of $7.69B misses by $50M",https://seekingalpha.com/news/4095808,
SeekingAlpha,"Nasdaq, S&P, Dow ended higher in a choppy session as investors shift attention to the Fed",https://seekingalpha.com/news/4095793,
