feed,title,long_url,short_url
Nasdaq,METALS-Copper rises on global economic recovery hopes,https://www.nasdaq.com/articles/metals-copper-rises-on-global-economic-recovery-hopes-2021-04-19,https://j.mp/3x8R5RN
Nasdaq,"ANALYSIS-Beijing huddles with friends, seeks to fracture U.S.-led 'clique'",https://www.nasdaq.com/articles/analysis-beijing-huddles-with-friends-seeks-to-fracture-u.s.-led-clique-2021-04-19,https://j.mp/3v2fNRP
Nasdaq,"Sensex Slumps 900 Points; Nifty Dips Below 14,250",https://www.nasdaq.com/articles/sensex-slumps-900-points-nifty-dips-below-14250-2021-04-19,https://j.mp/3x5D6Mh
Nasdaq,China to bring solar and wind power generation to 11% of total electricity use in 2021,https://www.nasdaq.com/articles/china-to-bring-solar-and-wind-power-generation-to-11-of-total-electricity-use-in-2021-0,https://j.mp/3amBrYW
Nasdaq,"GRAINS-Corn up 1.1% on global supply concerns, fund buying",https://www.nasdaq.com/articles/grains-corn-up-1.1-on-global-supply-concerns-fund-buying-2021-04-19,https://j.mp/3soWQak
