feed,title,long_url,short_url
Investing,"Amazon adds chatbot for its sellers, boosting automation",https://www.investing.com/news/stock-market-news/amazon-adds-chatbot-for-its-sellers-boosting-automation-3623567,https://da.gd/6fH3k
Investing,"Regional bank stocks reach ""inflection point"" after Fed rate cut, JPM says",https://www.investing.com/news/stock-market-news/regional-bank-stocks-reach-inflection-point-after-fed-rate-cut-jpm-says-432SI-3623555,https://da.gd/ZJhP6
Investing,"Social media users lack control over data used by AI, US FTC says",https://www.investing.com/news/stock-market-news/social-media-users-lack-control-over-data-used-by-ai-us-ftc-says-3623558,https://da.gd/wzSofa
Investing,Earnings call: LTG reports resilient performance with strong cost control,https://www.investing.com/news/stock-market-news/earnings-call-ltg-reports-resilient-performance-with-strong-cost-control-93CH-3623542,https://da.gd/hUv0D1
Investing,Earnings call: First High-School Education Group reports H1 2024 results,https://www.investing.com/news/stock-market-news/earnings-call-first-highschool-education-group-reports-h1-2024-results-93CH-3623541,https://da.gd/FGZ2
Investing,Earnings call: Nano Labs reports mixed first half 2024 results amid new launches,https://www.investing.com/news/stock-market-news/earnings-call-nano-labs-reports-mixed-first-half-2024-results-amid-new-launches-93CH-3623536,https://da.gd/EBqnkf
Investing,"Earnings call: WildBrain navigates industry headwinds, eyes growth",https://www.investing.com/news/stock-market-news/earnings-call-wildbrain-navigates-industry-headwinds-eyes-growth-93CH-3623539,https://da.gd/3lZ6
Investing,"Trump claims Fed's jumbo rate cut shows US economy is ""very bad""",https://www.investing.com/news/economy-news/trump-claims-feds-jumbo-rate-cut-shows-us-economy-is-very-bad-3623574,https://da.gd/cGCAi1
Investing,Fed (finally) joins a global rate-cutting cycle,https://www.investing.com/news/economy-news/fed-finally-joins-a-global-ratecutting-cycle-3623534,https://da.gd/APZAT
