feed,title,long_url,short_url
SeekingAlpha,Star Bulk Carriers and Navios Maritime among industrial gainers; GEE Group leads the losers,https://seekingalpha.com/news/3681815,
SeekingAlpha,On the hour,https://seekingalpha.com/news/3681814,
SeekingAlpha,Delta Air Lines Q1 2021 Earnings Preview,https://seekingalpha.com/news/3681813,
SeekingAlpha,Overstock.com rallies as Coinbase debut draws interest again in the stock,https://seekingalpha.com/news/3681812,
SeekingAlpha,"TIGR leads financial gainers, PT and SI among losers",https://seekingalpha.com/news/3681811,
