feed,title,long_url,short_url
Motley,Amazon Stock Is Only Going to Climb,https://www.fool.com/investing/2022/04/09/amazon-stock-is-only-going-to-climb/?source=iedfolrf0000001,https://bit.ly/38ERcN6
Motley,The Market Loves Lululemon Stock After Earnings,https://www.fool.com/investing/2022/04/09/the-market-loves-lululemon-stock-after-earnings/?source=iedfolrf0000001,https://bit.ly/3DVLfH2
Motley,This AI Stock Just Grew Its Revenue 264%,https://www.fool.com/investing/2022/04/09/this-ai-stock-just-grew-its-revenue-264/?source=iedfolrf0000001,https://bit.ly/3JjeUes
Motley,How FuboTV Is Trending in the Right Direction,https://www.fool.com/investing/2022/04/09/how-fubotv-is-trending-in-the-right-direction/?source=iedfolrf0000001,https://bit.ly/3v9xNLX
Motley,These Opportunities Could Make Nvidia Stock Soar,https://www.fool.com/investing/2022/04/09/these-opportunities-could-make-nvidia-stock-soar/?source=iedfolrf0000001,https://bit.ly/3rcHBna
Motley,Is Home Depot Silently Killing Your Portfolio?,https://www.fool.com/investing/2022/04/09/is-home-depot-silently-killing-your-portfolio/?source=iedfolrf0000001,https://bit.ly/3DWommW
Motley,This Turnaround Tech Stock Could Be Huge in 5 Years,https://www.fool.com/investing/2022/04/09/this-turnaround-tech-stock-could-be-huge-in-5-year/?source=iedfolrf0000001,https://bit.ly/37AADkZ
Motley,The Pet-Centric Stock Poised for Strong Growth,https://www.fool.com/investing/2022/04/09/the-pet-centric-stock-poised-for-strong-growth/?source=iedfolrf0000001,https://bit.ly/3Ktqa9h
Motley,Sea Limited Stock Could Resurge After Its Recent Slide,https://www.fool.com/investing/2022/04/09/sea-limited-stock-could-resurge-after-its-recent-s/?source=iedfolrf0000001,https://bit.ly/3Jkh1hX
