feed,title,long_url,short_url
ETFTrends,BlackRock’s Marilyn Watson Sees “A Huge Number of Opportunities in Fixed Income”,https://www.etftrends.com/active-etf-channel/blackrocks-marilyn-watson-sees-a-huge-number-of-opportunities-in-fixed-income/,https://bit.ly/3rE3wn8
ETFTrends,Distillate Targets SMID-Cap Stocks With Strong Free Cash Flow Generation Through DSMC,https://www.etftrends.com/distillate-targets-smid-cap-stocks-with-strong-free-cash-flow-generation-through-dsmc/,https://bit.ly/3edytew
ETFTrends,NightShares Offers 1.5x Exposure to Overnight Markets With NSPL,https://www.etftrends.com/nightshares-offers-1-5x-exposure-to-overnight-markets-with-nspl/,https://bit.ly/3RDUwZz
ETFTrends,Interesting Opportunity With International ESG ETF,https://www.etftrends.com/dual-impact-channel/interesting-opportunity-with-international-esg-etf/,https://bit.ly/3CE61fn
ETFTrends,VanEck Expands Moat Investing Suite With Launch of SMOT,https://www.etftrends.com/tactical-allocation-channel/vaneck-expands-moat-investing-suite-with-launch-of-smot/,https://bit.ly/3SKOcAM
ETFTrends,"Momentum Stocks Worth Buying on Dips, Says Analyst",https://www.etftrends.com/etf-education-channel/momentum-stocks-worth-buying-on-dips-says-analyst/,https://bit.ly/3edytLy
ETFTrends,"Bitcoin Pushes Above $20,000 as Dollar Stumbles for Now",https://www.etftrends.com/crypto-channel/bitcoin-pushes-above-20k-as-dollar-stumbles-for-now/,https://bit.ly/3ea2RXg
ETFTrends,October Rally Could Push This Leveraged S&P ETF Higher,https://www.etftrends.com/leveraged-inverse-channel/october-rally-could-push-this-leveraged-sp-etf-higher/,https://bit.ly/3MguDOC
ETFTrends,Asia Dividend Outlook Attractive With ADIV,https://www.etftrends.com/dividend-channel/asia-dividend-outlook-attractive-with-adiv/,https://bit.ly/3Me34W2
ETFTrends,Blockchain Analytics Could Be Beneficial to the Federal Sector,https://www.etftrends.com/crypto-channel/blockchain-analytics-could-be-beneficial-to-the-federal-sector/,https://bit.ly/3MrUFP3
ETFTrends,Chart of the Week: Advisors Are Taking a Diverse Approach to Income,https://www.etftrends.com/chart-of-the-week-advisors-are-taking-a-diverse-approach-to-income/,https://bit.ly/3SK0DNd
ETFTrends,2 ETFs to Consider as Internet Giant Invests $1 Billion in Cloud Computing,https://www.etftrends.com/thematic-investing-channel/2-etfs-to-consider-as-internet-giant-invests-1-billion-in-cloud-computing/,https://bit.ly/3MaUSG7
ETFTrends,What’s Next?,https://www.etftrends.com/etf-strategist-channel/whats-next/,https://bit.ly/3SJhH6c
ETFTrends,Benefiting From Bear Markets,https://www.etftrends.com/etf-strategist-channel/benefiting-from-bear-markets/,https://bit.ly/3rCaqsN
ETFTrends,Portfolio Allocation During Times of High Inflation,https://www.etftrends.com/etf-strategist-channel/portfolio-allocation-during-times-of-high-inflation/,https://bit.ly/3CE3UIr
ETFTrends,Why Dividend Growth Matters in Today’s Market Environment,https://www.etftrends.com/why-dividend-growth-matters-in-todays-market-environment/,https://bit.ly/3SKOeIU
ETFTrends,Battered Growth Stocks Now Unusually Inexpensive,https://www.etftrends.com/etf-education-channel/battered-growth-stocks-now-unusually-inexpensive/,https://bit.ly/3CACbIG
ETFTrends,Global X Expands Covered Call Suite with Russell 2000 Covered Call & Growth ETF,https://www.etftrends.com/thematic-investing-channel/global-x-expands-covered-call-suite-with-russell-2000-covered-call-growth-etf/,https://bit.ly/3MbNaLI
ETFTrends,Paralel Advisors Launches Debut ETF: The SRH U.S. Quality ETF,https://www.etftrends.com/paralel-advisors-launches-debut-etf-the-srh-u-s-quality-etf/,https://bit.ly/3RDUvEZ
ETFTrends,"Carbon Transition Is Happening, and Investors Need To Take a Position",https://www.etftrends.com/megatrends-channel/carbon-transition-is-happening-and-investors-need-to-take-a-position/,https://bit.ly/3CFllsj
ETFTrends,ACES and SDOG Garner Flows in September,https://www.etftrends.com/etf-building-blocks-channel/aces-and-sdog-garner-flows-in-september/,https://bit.ly/3ryynBs
ETFTrends,ARKK Takes in Nearly Half Billion in September Flows,https://www.etftrends.com/disruptive-technology-channel/arkk-takes-in-nearly-half-billion-in-september-flows/,https://bit.ly/3rDh5mM
ETFTrends,"When Global Recession Threatens, Turn to Trends With Managed Futures",https://www.etftrends.com/managed-futures-channel/when-global-recession-threatens-turn-to-trends-with-managed-futures/,https://bit.ly/3CD2Bte
ETFTrends,Schumer Kicks Off Cybersecurity Awareness Month With Call to Action,https://www.etftrends.com/model-portfolio-channel/schumer-kicks-off-cybersecurity-awareness-month-with-call-to-action/,https://bit.ly/3edAho2
ETFTrends,Take Advantage of the Muni Bond Rally With RVNU,https://www.etftrends.com/global-diversification-channel/take-advantage-of-the-muni-bond-rally-with-rvnu/,https://bit.ly/3rzR73l
ETFTrends,Volatile Markets Provide Opportunities for Active Investors,https://www.etftrends.com/active-etf-channel/volatile-markets-provide-opportunities-for-active-investors/,https://bit.ly/3CDyNg0
ETFTrends,Top Four Big Global Issues Advisors Will Face in 2023,https://www.etftrends.com/exchange-an-etf-experience/top-four-big-global-issues-advisors-will-face-in-2023/,https://bit.ly/3RDUvVv
ETFTrends,"RICs, ETNs, and Choosing the Right MLP Investment",https://www.etftrends.com/energy-infrastructure-channel/rics-etns-and-choosing-the-right-mlp-investment/,https://bit.ly/3fQlXSV
ETFTrends,Picking a Bottom in Tech? Consider This Leveraged ETF,https://www.etftrends.com/leveraged-inverse-channel/picking-a-bottom-in-tech-consider-this-leveraged-etf/,https://bit.ly/3fLyGpO
ETFTrends,Thrivent’s New ESG ETF Targets Small- and Mid-Cap Stocks,https://www.etftrends.com/thrivents-new-esg-etf-targets-small-and-mid-cap-stocks/,https://bit.ly/3fIGrNf
ETFTrends,S&P 500 Equal Weight Slightly Outperforms in Q3,https://www.etftrends.com/portfolio-strategies-channel/sp-500-equal-weight-slightly-outperforms-in-q3/,https://bit.ly/3rGUx4g
ETFTrends,Changing Environmental Order Could Lift GSFP,https://www.etftrends.com/future-etfs-channel/changing-environmental-order-could-lift-gsfp/,https://bit.ly/3RDUwsx
ETFTrends,To Asia for Aristocratic Dividends,https://www.etftrends.com/china-insights-channel/to-asia-for-aristocratic-dividends/,https://bit.ly/3rBw4NT
ETFTrends,Climate Bill Has Notable Global Implications,https://www.etftrends.com/climate-insights-channel/climate-bill-has-notable-global-implications/,https://bit.ly/3SJhHDe
