feed,title,long_url,short_url
Investing,"Australian delivery workers set to gain minimum pay in landmark deal with Uber Eats, DoorDash",https://www.investing.com/news/stock-market-news/australian-delivery-workers-set-to-gain-minimum-pay-in-landmark-deal-with-uber-eats-doordash-4376567,
Investing,Indonesia stocks lower at close of trade; IDX Composite Index down 0.64%,https://www.investing.com/news/stock-market-news/indonesia-stocks-lower-at-close-of-trade-idx-composite-index-down-064-4376566,
Investing,Japan stocks higher at close of trade; Nikkei 225 up 0.07%,https://www.investing.com/news/stock-market-news/japan-stocks-higher-at-close-,
Investing,"German home prices on track for 3%-plus annual rises, further stretching affordability- Reuters poll",https://www.investing.com/news/economic-indicators/german-home-prices-on-track-for-3plus-annual-rises-further-stretching-affordability-reuters-poll-4376561,
Investing,US wholesale inventories revised higher in August,https://www.investing.com/news/economic-indicators/us-wholesale-inventories-revised-higher-in,
