feed,title,long_url,short_url
Investing,Are Options Traders Betting on a Big Move in Marathon (MARA) Stock?,https://investing.com/analysis/-200579542,
Investing,Virtue Poker Launches IDO on SuperFarms’ SuperStarter,https://investing.com/news/-2503942,
Investing,Memes get usecases: FNTX Users Can Buy Condos with DOGE,https://investing.com/news/-2503940,
Investing,eBay enables NFT sales on its platform,https://investing.com/news/-2503937,
Investing,Indonesia considers capital gains tax on cryptocurrency trades,https://investing.com/news/-2503934,
