feed,title,long_url,short_url
Investing,Bored Ape Yacht Club Launches ApeCoin Token,https://investing.com/news/-2787270,
Investing,DecentWorld to Launch Collections of Next-Gen Virtual Real Estate,https://investing.com/news/-2787251,
Investing,Fans Bash Axie Infinity for Excluding Mobile From Origin Trial,https://investing.com/news/-2787249,
Investing,Australian competition regulator takes Meta to court over fake crypto ads,https://investing.com/news/-2787244,
Investing,Rare Bears Discord phishing attack nabs $800K in NFTs,https://investing.com/news/-2787235,
Investing,Leading Cold Vault and MPC Solutions Vendor GK8 onboards Tezos Foundation as a client,https://investing.com/news/-2787226,
Investing,Coinbase Wallet adds support for Solana,https://investing.com/news/-2787223,
Investing,"Dollar in doldrums amid Ukraine hopes, traders weigh Fed's rate plans",https://investing.com/news/-2787165,
