feed,title,long_url,short_url
Benzinga,"If You Invested $100 In This Stock 5 Years Ago, Here's How Much You Would Have Today",https://benzinga.com/news/earnings/22/03/26202778/if-you-invested-100-in-this-stock-5-years-ago-heres-how-much-you-would-have-today,https://bit.ly/3u1XQDW
Benzinga,US Aims To Prevent Russia From Accessing Crypto Amid Its War With Ukraine,https://benzinga.com/markets/cryptocurrency/22/03/26202541/us-aims-to-prevent-russia-from-accessing-crypto-amid-its-war-with-ukraine,https://bit.ly/3KMsYye
Benzinga,$100 Invested In Dollar Tree 15 Years Ago Would Be Worth This Much,https://benzinga.com/news/earnings/22/03/26202777/100-invested-in-dollar-tree-15-years-ago-would-be-worth-this-much,https://bit.ly/3D1mDfK
Benzinga,Wedbush Names Its Favourite Cybersecurity Stocks Gaining From Growing Cyberattacks,https://benzinga.com/news/22/03/26202185/wedbush-names-its-favourite-cybersecurity-stocks-gaining-from-growing-cyberattacks,https://bit.ly/367vm3T
Benzinga,Sorrento's Pain Company Reveals Final Results For SP-102 Data For Sciatica Pain Management,https://benzinga.com/general/biotech/22/03/26202168/sorrentos-pain-company-reveals-final-results-for-sp-102-data-for-sciatica-pain-management,https://bit.ly/3CVxdVf
