feed,title,long_url,short_url
Benzinga,Drake Vs. Josh: Feud Continues Between Former Nickelodeon Sitcom Co-Stars,https://benzinga.com/general/entertainment/22/03/26202484/drake-vs-josh-feud-continues-between-former-nickelodeon-sitcom-co-stars,https://bit.ly/3u81xIj
Benzinga,Why Are Rent The Runway Shares Trading Higher Today,https://benzinga.com/analyst-ratings/analyst-color/22/03/26203771/why-are-rent-the-runway-shares-trading-higher-today,https://bit.ly/3IoMTS2
Benzinga,"If You Invested $1000 In Lululemon 10 Years Ago, Here's How Much You Would Have Today",https://benzinga.com/news/earnings/22/03/26204101/if-you-invested-1000-in-lululemon-10-years-ago-heres-how-much-you-would-have-today,https://bit.ly/3whMtus
Benzinga,Here's How Much $1000 Invested In Chesapeake Energy 5 Years Ago Would Be Worth Today,https://benzinga.com/news/earnings/22/03/26204100/heres-how-much-1000-invested-in-chesapeake-energy-5-years-ago-would-be-worth-today,https://bit.ly/3whMu1u
Benzinga,"Cango Shifts Gears Into Macro Headwinds, With Eye on NEVs and Car Services",https://benzinga.com/news/earnings/22/03/26204102/cango-shifts-gears-into-macro-headwinds-with-eye-on-nevs-and-car-services,https://bit.ly/3N4Iibx
