feed,title,long_url,short_url
ZeroHedgeRU,Inflation Is State-Sponsored Terrorism,https://www.zerohedge.com/markets/inflation-state-sponsored-terrorism,https://bit.ly/3TRnc3D
ZeroHedgeRU,"Goldman Changes Fed Hike View, Now Expects 75bps In Sept After Fed Mouthpiece Report",https://www.zerohedge.com/markets/goldman-changes-fed-hike-view-now-expects-75bps-sept-after-fed-mouthpiece-report,https://bit.ly/3TOKbwp
ZeroHedgeRU,Europe Is Buying All The Russian Oil It Can Before Banning It,https://www.zerohedge.com/commodities/europe-buying-all-russian-oil-it-can-banning-it,https://bit.ly/3Bng9IS
ZeroHedgeRU,"""The Market Backdrop Is One Of Extreme Uncertainty, Extreme Volatility, Extreme Profits, And Extreme Desperation""",https://www.zerohedge.com/markets/market-backdrop-one-extreme-uncertainty-extreme-volatility-extreme-profits-and-extreme,https://bit.ly/3eAtxAc
ZeroHedgeRU,"Stocks & Bonds Dive After Powell Comments, Rate-Hike Odds Surge",https://www.zerohedge.com/markets/stocks-bonds-dive-after-powell-comments,https://bit.ly/3BoU904
