feed,title,long_url,short_url
Benzinga,This Is What Whales Are Betting On Lam Research,https://benzinga.com/markets/options/22/09/28800963/this-is-what-whales-are-betting-on-lam-research,https://bit.ly/3d2qlNt
Benzinga,This Is What Whales Are Betting On Warner Bros.Discovery,https://benzinga.com/markets/options/22/09/28800955/this-is-what-whales-are-betting-on-warner-bros-discovery,https://bit.ly/3x5zYBO
Benzinga,GitLab Whale Trades Spotted,https://benzinga.com/markets/options/22/09/28800951/gitlab-whale-trades-spotted,https://bit.ly/3x6wDmc
Benzinga,"This Plot Of Digital Land Just Sold For $21,652 In MANA In Decentraland",https://benzinga.com/markets/cryptocurrency/22/09/28800924/this-plot-of-digital-land-just-sold-for-21-652-in-mana-in-decentraland,https://bit.ly/3x4Fd4P
Benzinga,Cryptocurrency Lido DAO Decreases More Than 3% Within 24 hours,https://benzinga.com/markets/cryptocurrency/22/09/28800923/cryptocurrency-lido-dao-decreases-more-than-3-within-24-hours,https://bit.ly/3S6yFeb
Benzinga,Cryptocurrency Tezos Rises More Than 6% In 24 hours,https://benzinga.com/markets/cryptocurrency/22/09/28800920/cryptocurrency-tezos-rises-more-than-6-in-24-hours,https://bit.ly/3RQ3Hqs
Benzinga,Cronos's Price Increased More Than 3% Within 24 hours,https://benzinga.com/markets/cryptocurrency/22/09/28800918/cryptocurrency-cronoss-price-increased-more-than-3-within-24-hours,https://bit.ly/3x9nCJ7
Benzinga,Looking At United Parcel Service's Recent Whale Trades,https://benzinga.com/markets/options/22/09/28800421/looking-at-united-parcel-services-recent-whale-trades,https://bit.ly/3qqKpMs
Benzinga,Baidu Whale Trades For September 08,https://benzinga.com/markets/options/22/09/28800430/baidu-whale-trades-for-september-08,https://bit.ly/3QvwL5w
Benzinga,Check Out What Whales Are Doing With HES,https://benzinga.com/markets/options/22/09/28800435/check-out-what-whales-are-doing-with-hes,https://bit.ly/3BrbfdJ
