feed,title,long_url,short_url
InvestorPlace,Will SOFI Stock Be Responsible for a Giant Market Crash?,https://investorplace.com/2022/09/will-sofi-stock-be-responsible-for-a-giant-market-crash/,https://bit.ly/3RNfyoZ
InvestorPlace,Why Did Enphase Energy Just Hit a 52-Week High?,https://investorplace.com/2022/09/why-did-enph-stock-just-hit-a-52-week-high/,https://bit.ly/3RNC3KK
InvestorPlace,An Incredible Stock Market Money-Maker Formed Amid the Chaos,https://investorplace.com/hypergrowthinvesting/2022/09/an-incredible-stock-market-money-making-opportunity-is-fast-approaching/,https://bit.ly/3cUmORv
InvestorPlace,Bilibili (BILI) Stock Drops 18% on Q2 Earnings Miss,https://investorplace.com/2022/09/bilibili-bili-stock-drops-13-percent-on-q2-earnings-miss/,https://bit.ly/3QvaKn6
InvestorPlace,A Sneak Peek at Friday’s Breakthrough Stocks September Monthly Issue,https://investorplace.com/market360/2022/09/20220908-breakthrough-sneak-peak/,https://bit.ly/3QqLnD3
InvestorPlace,Why ‘Sell My House’ Searches Spell Trouble for a Housing Market Crash,https://investorplace.com/2022/09/why-sell-my-house-searches-spell-trouble-for-a-housing-market-crash/,https://bit.ly/3DgtV1n
InvestorPlace,You Should Know About This Profit-Boosting Trend on Pace to Set Records,https://investorplace.com/smartmoney/2022/09/you-should-know-about-this-profit-boosting-trend-on-pace-to-set-records/,https://bit.ly/3cUytQg
