feed,title,long_url,short_url
Benzinga,Looking At Pinterest's Recent Whale Trades,https://benzinga.com/markets/options/22/09/28803477/looking-at-pinterests-recent-whale-trades,https://bit.ly/3QtrhZ4
Benzinga,Wayfair Whale Trades Spotted,https://benzinga.com/markets/options/22/09/28803451/wayfair-whale-trades-spotted,https://bit.ly/3qI2l5H
Benzinga,ServiceNow Whale Trades For September 08,https://benzinga.com/markets/options/22/09/28802648/servicenow-whale-trades-for-september-08,https://bit.ly/3QpRmbb
Benzinga,Paramount Global Whale Trades For September 08,https://benzinga.com/markets/options/22/09/28802628/paramount-global-whale-trades-for-september-08,https://bit.ly/3eq2qrw
Benzinga,Caesars Entertainment Whale Trades Spotted,https://benzinga.com/markets/options/22/09/28802613/caesars-entertainment-whale-trades-spotted,https://bit.ly/3RPSLch
