feed,title,long_url,short_url
Investing,USD/INR: India Central Bank Cut Marks Return to Easing as Tariff Pressures Mount,https://www.investing.com/analysis/usdinr-india-central-bank-cut-marks-return-to-easing-as-tariff-pressures-mount-200671325,
Investing,Stock Continue Higher as Predicted,https://www.investing.com/analysis/stock-continue-higher-as-predicted-200671330,
Investing,Netflix’s Exclusive Warner Bros Talks Mark a Shift in Streaming Economics,https://www.investing.com/analysis/netflixs-exclusive-warner-bros-talks-mark-a-shift-in-streaming-economics-200671326,
Investing,Nvidia: Consolidation Persists as Price Tests Key Moving Averages,https://www.investing.com/analysis/nvidia-consolidation-persists-as-price-tests-key-moving-averages-200671324,
Investing,Silver’s Pullback Sees Long Bias Near Extreme Buy Territory,https://www.investing.com/analysis/silvers-pullback-sees-long-bias-near-extreme-buy-territory-200671329,
Investing,Crude Oil Softens in Asian Trade Session,https://www.investing.com/analysis/crude-oil-softens-in-asian-trade-session-200671328,
Investing,German industrial orders rise more than expected in October,https://www.investing.com/news/economic-indicators/german-industrial-orders-rise-more-than-expected-in-october-4392565,
