feed,title,long_url,short_url
Investing,Silver Disconnection Is Real as Gold and Miners Lag,https://www.investing.com/analysis/silver-disconnection-is-real-as-gold-and-miners-lag-200671381,
Investing,U.S. stocks higher at close of trade; Dow Jones Industrial Average up 0.22%,https://www.investing.com/news/stock-market-news/us-stocks-higher-at-close-of-trade-dow-jones-industrial-average-up-022-4394294,
Investing,Mexico stocks lower at close of trade; S&P/BMV IPC down 0.48%,https://www.investing.com/news/stock-market-news/mexico-stocks-lower-at-close-of-trade-spbmv-ipc-down-048-4394290,
Investing,ServiceNow stock edges higher after shareholders approve 5-for-1 split,https://www.investing.com/news/stock-market-news/servicenow-stock-edges-higher-after-shareholders-approve-5for1-split-93CH-4394289,
Investing,Canada stocks lower at close of trade; S&P/TSX Composite down 0.53%,https://www.investing.com/news/stock-market-news/canada-stocks-lower-at-close-of-trade-sptsx-composite-down-053-4394287,
Investing,Russia stocks higher at close of trade; MOEX Russia Index up 2.01%,https://www.investing.com/news/stock-market-news/russia-stocks-higher-at-close-of-trade-moex-russia-index-up-201-4394268,
Investing,Colombia stocks lower at close of trade; COLCAP down 0.15%,https://www.investing.com/news/stock-market-news/colombia-stocks-lower-at-close-of-trade-colcap-down-015-4394262,
Investing,Monte dei Paschi board backs CEO amid Mediobanca takeover probe,https://www.investing.com/news/stock-market-news/monte-dei-paschi-board-backs-ceo-amid-mediobanca-takeover-probe-93CH-4394253,
Investing,Pheton stock soars after completing acquisition of iTonic Corporation,https://www.investing.com/news/stock-market-news/pheton-stock-soars-after-completing-acquisition-of-itonic-corporation-93CH-4394235,
Investing,SMJ International completes $10.8 million IPO on NYSE American,https://www.investing.com/news/stock-market-news/smj-international-completes-108-million-ipo-on-nyse-american-432SI-4394226,
Investing,Azerbaijan’s outlook revised to positive amid easing tensions with Armenia,https://www.investing.com/news/economy-news/azerbaijans-outlook-revised-to-positive-amid-easing-tensions-with-armenia-93CH-4394273,
