feed,title,long_url,short_url
SeekingAlpha,"Planet Fitness Non-GAAP EPS of $0.71 beats by $0.05, revenue of $300.9M beats by $10.16M",https://seekingalpha.com/news/4134645,
SeekingAlpha,"MarketAxess GAAP EPS of $1.72 beats by $0.04, revenue of $197.7M misses by $0.98M",https://seekingalpha.com/news/4134644,
SeekingAlpha,"Caterpillar Non-GAAP EPS of $5.99 beats by $0.45, revenue of $16.69B beats by $20M",https://seekingalpha.com/news/4134642,
SeekingAlpha,"Fraport AG GAAP EPS of EUR 1.63, revenue of EUR 2.04B",https://seekingalpha.com/news/4134641,
SeekingAlpha,"Bitcoin: Temporary Dip, But Conditions Remain Unfavorable",https://seekingalpha.com/article/4710757,
