feed,title,long_url,short_url
Benzinga,Vornado's Q2 FFO and Revenues Surpass Estimates,https://benzinga.com/news/earnings/24/08/40195839/vornados-q2-ffo-and-revenues-surpass-estimates,https://da.gd/U6dEk
Benzinga,Here's How Much $1000 Invested In Gartner 5 Years Ago Would Be Worth Today,https://benzinga.com/insights/news/24/08/40200536/heres-how-much-1000-invested-in-gartner-5-years-ago-would-be-worth-today,https://da.gd/oDWl2C
Benzinga,"If You Invested $100 In This Stock 15 Years Ago, You Would Have $2,100 Today",https://benzinga.com/insights/news/24/08/40200533/if-you-invested-100-in-this-stock-15-years-ago-you-would-have-2-100-today,https://da.gd/QV3kM
Benzinga,Organon Q2 Earnings: Taking a Look at Key Metrics Versus Estimates,https://benzinga.com/news/earnings/24/08/40195837/organon-q2-earnings-taking-a-look-at-key-metrics-versus-estimates,https://da.gd/bRNJX
Benzinga,Teradata Q2 Earnings: How Key Metrics Compare to Wall Street Estimates,https://benzinga.com/news/earnings/24/08/40195834/teradata-q2-earnings-how-key-metrics-compare-to-wall-street-estimates,https://da.gd/Y6FE0d
Benzinga,Robert Kiyosaki Says The Stock Market Depends On How Long The People Will Let The Government Print The Money – 'It's Gettin Spooky To Me',https://benzinga.com/markets/24/08/40200537/robert-kiyosaki-says-the-stock-market-depends-on-how-long-the-people-will-let-the-government-print-t,https://da.gd/q7PrJP
