feed,title,long_url,short_url
SeekingAlpha,"Enhabit Non-GAAP EPS of $0.07 beats by $0.01, revenue of $260.6M misses by $6.68M",https://seekingalpha.com/news/4135518,
SeekingAlpha,"The Container Store Non-GAAP EPS of -$0.26 misses by $0.05, revenue of $181.9M misses by $10.51M",https://seekingalpha.com/news/4135517,
SeekingAlpha,"Repare Therapeutics GAAP EPS of -$0.82 beats by $0.03, revenue of $1.07M misses by $1.86M",https://seekingalpha.com/news/4135516,
SeekingAlpha,"STEP Energy Services GAAP EPS of C$0.14, revenue of C$231.38M",https://seekingalpha.com/news/4135515,
SeekingAlpha,Cryoport announces $200M repurchase program and repurchase of $160M of convertible senior notes,https://seekingalpha.com/news/4135514,
SeekingAlpha,"Comscore GAAP EPS of -$1.19 misses by $1.25, revenue of $85.8M misses by $3.53M",https://seekingalpha.com/news/4135513,
