feed,title,long_url,short_url
Investing,US Penalizes Crypto Mining Host Bitriver AG and Russian Banks,https://investing.com/news/-2807560,
Investing,"Tetra Staking Wallet Listed on DappRadar, Orbs Gears Up in DeFi",https://investing.com/news/-2807559,
Investing,Euro at one-week highs as rate hike bets grow,https://investing.com/news/-2807424,
Investing,European Stocks Largely Edge Higher; G7 Looks to Support Ukraine,https://investing.com/news/-2807550,
Investing,"Asia shares fall on China slowdown fears, but lower yields limit losses",https://www.investing.com/news/economy/most-asian-indexes-gain-ground-on-us-yield-drop-but-chinese,
