feed,title,long_url,short_url
FXEmpire,"Russia sanctions 61 Canadian officials, journalists, military experts",https://www.fxempire.com/news/article/russia-sanctions-61-canadian-officials-journalists-military-experts-975213,https://bit.ly/3Ostpk0
FXEmpire,"Canada indigenous group meets pope, invite him to ancestral lands",https://www.fxempire.com/news/article/canada-indigenous-group-meets-pope-invite-him-to-ancestral-lands-975218,https://bit.ly/3vClCHF
FXEmpire,Exxon Mobil may completely withdraw from Russia by June 24 – sources,https://www.fxempire.com/news/article/exxon-mobil-may-completely-withdraw-from-russia-by-june-24-sources-975215,https://bit.ly/3v3jNnY
FXEmpire,Russia draws up more restrictions for ‘foreign agents’,https://www.fxempire.com/news/article/russia-draws-up-more-restrictions-for-foreign-agents-975212,https://bit.ly/3xJIgAA
FXEmpire,ITA Airways to open data room for privatisation next week – sources,https://www.fxempire.com/news/article/ita-airways-to-open-data-room-for-privatisation-next-week-sources-975214,https://bit.ly/36yvolw
FXEmpire,"MoneyGram is sued by U.S., New York regulators over remittance transfers",https://www.fxempire.com/news/article/moneygram-is-sued-by-u-s-new-york-regulators-over-remittance-transfers-975208,https://bit.ly/3ECiqQ8
FXEmpire,"US rapidly developed “Ghost” drones for Ukraine, Pentagon says",https://www.fxempire.com/news/article/us-rapidly-developed-ghost-drones-for-ukraine-pentagon-says-975209,https://bit.ly/3EzwF8m
