feed,title,long_url,short_url
Yahoo,A Bull Market Is Coming: 2 Artificial Intelligence (AI) Stocks With Monster Growth Potential to Buy Now and Hold Forever,https://finance.yahoo.com/m/79d14747-2ba4-3b83-a423-9ac92588d93d/a-bull-market-is-coming%3A-2.html?.tsrc=rss,https://da.gd/g8wmK1
Yahoo,"Foot Locker downgraded, Amazon initiated: Wall Street's top analyst calls",https://finance.yahoo.com/news/foot-locker-downgraded-amazon-initiated-135148701.html?.tsrc=rss,https://da.gd/gX60Jh
Yahoo,Amazon Stock Gets a New Buy Rating Ahead of Earnings. There’s More to It Than AWS.,https://finance.yahoo.com/m/6fca1a22-8c8a-3baf-9d6b-d180db810bca/amazon-stock-gets-a-new-buy.html?.tsrc=rss,https://da.gd/8SRTo
Yahoo,The Smartest Investors Are Buying These 3 Stocks Hand Over Fist,https://finance.yahoo.com/m/9843a909-cfc0-3f8b-b082-c3f0aa23327e/the-smartest-investors-are.html?.tsrc=rss,https://da.gd/J7Zk
Yahoo,"Meta’s Threads Still Lags Behind Musk’s X, but Platform Is Growing Again",https://finance.yahoo.com/m/964ef1c5-95fe-3136-9891-245aef9350f2/meta%E2%80%99s-threads-still-lags.html?.tsrc=rss,https://da.gd/a5gZ3
