feed,title,long_url,short_url
Investing,S&P 500 Bulls Living on the Edge: Reversal Likely?,https://www.investing.com/analysis/sp-500-bulls-living-on-the-edge-reversal-likely-200643018,https://da.gd/OqdV8
Investing,IRS proposes unprecedented data-collection on crypto users,https://www.investing.com/news/cryptocurrency-news/irs-proposes-unprecedented-datacollection-on-crypto-users-3207515,https://da.gd/3aJWMa
Investing,Coinbase invokes Major Questions Doctrine in response to SEC allegations,https://www.investing.com/news/cryptocurrency-news/coinbase-invokes-major-questions-doctrine-in-response-to-sec-allegations-93CH-3207509,https://da.gd/ZKbAo3
Investing,Ethereum Sees Price Surge as New Whales Make Substantial Purchases,https://www.investing.com/news/cryptocurrency-news/ethereum-sees-price-surge-as-new-whales-make-substantial-purchases-93CH-3207508,https://da.gd/PpqS9
Investing,Dogecoin Trades Lower Despite Bullish Predictions and Musk’s Endorsement,https://www.investing.com/news/cryptocurrency-news/dogecoin-trades-lower-despite-bullish-predictions-and-musks-endorsement-93CH-3207507,https://da.gd/u1xES
Investing,"Bitcoin Surges Past $35,000 Driven by Anticipated ETF Approvals",https://www.investing.com/news/cryptocurrency-news/bitcoin-surges-past-35000-driven-by-anticipated-etf-approvals-93CH-3207506,https://da.gd/InswI
Investing,Uniper refines its full-year 2023 outlook,https://www.investing.com/news/stock-market-news/uniper-refines-its-fullyear-2023-outlook-3207514,https://da.gd/U4E9bN
Investing,"Meta Platforms, IBM, Boeing earnings: 3 things to watch",https://www.investing.com/news/stock-market-news/meta-platforms-ibm-boeing-earnings-3-things-to-watch-3207510,https://da.gd/DHTOB
