feed,title,long_url,short_url
SeekingAlpha,"CACI awarded NASA contract for human spaceflight systems, software technology III",https://seekingalpha.com/news/4023683,
SeekingAlpha,NextPlay Technologies receives Nasdaq notice regarding delayed Q2 quarterly report,https://seekingalpha.com/news/4023682,
SeekingAlpha,Staffing 360 Solutions receives non-compliance letter from Nasaq,https://seekingalpha.com/news/4023681,
SeekingAlpha,"Hawaiian Holdings Non-GAAP EPS of -$1.06 misses by $0.13, revenue of $727.68M misses by $8.04M",https://seekingalpha.com/news/4023679,
SeekingAlpha,"NBT Bancorp GAAP EPS of $0.54 beats by $0.02, revenue of $135.13M beats by $4.83M",https://seekingalpha.com/news/4023678,
SeekingAlpha,"Matador Resources Non-GAAP EPS of $1.86 beats by $0.21, revenue of $772.29M beats by $70.45M",https://seekingalpha.com/news/4023677,
