feed,title,long_url,short_url
InvestorPlace,7 At-Risk Chinese Stocks to Sell Before They Slide,https://investorplace.com/2024/01/7-at-risk-chinese-stocks-to-sell-before-they-slide/,https://da.gd/uaimWg
InvestorPlace,The Big Short of 2024: 7 Meme Stocks to Bet Against,https://investorplace.com/?p=2645557,https://da.gd/1Sc9ac
InvestorPlace,Intel’s Rocky Ride: Why Patient Investors Could See an INTC Stock Comeback,https://investorplace.com/market360/2024/01/intels-rocky-ride-why-patient-investors-could-see-an-intc-stock-comeback/,https://da.gd/CHo5eH
InvestorPlace,Nvidia Stock Analysis: Why NVDA Remains a Top Pick for 2024,https://investorplace.com/market360/2024/01/nvidia-stock-analysis-why-nvda-remains-a-top-pick-for-2024/,https://da.gd/rb3Qg
InvestorPlace,Palantir Stock Analysis: Where Is PLTR Headed in 2024?,https://investorplace.com/?p=2646403,https://da.gd/nuTC
InvestorPlace,Tesla’s Downfall? Why the Cybertruck Marks the End for TSLA Stock,https://investorplace.com/2024/01/teslas-downfall-why-the-cybertruck-marks-the-end-for-tsla-stock/,https://da.gd/XXVvbT
InvestorPlace,3 Chip Stocks Set for Silicon Success in 2024,https://investorplace.com/2024/01/3-chip-stocks-set-for-silicon-success-in-2024/,https://da.gd/9cVq1E
