feed,title,long_url,short_url
TheStreet,Analysts reveal new price targets for Google ahead Q4 earnings report,https://www.thestreet.com/investing/stocks/analysts-reveal-new-price-targets-for-google-ahead-q4-earnings-report,https://da.gd/KUfho5
TheStreet,"Costco, H-E-B, and Publix overtake Trader Joe's in key area",https://www.thestreet.com/retailers/costco-heb-and-publix-overtake-trader-joes-in-key-areab,https://da.gd/hfesqs
TheStreet,Pfizer surprises with Q4 profit as primary-care sales offset covid slump,https://www.thestreet.com/investing/stocks/pfizer-surprises-with-q4-profit-as-primary-care-sales-offset-covid-slump,https://da.gd/QXKEZ
TheStreet,GM shares leap as upbeat 2024 profit outlook follows solid Q4 earnings,https://www.thestreet.com/investing/stocks/gm-shares-leap-as-upbeat-2024-profit-outlook-follows-solid-q4-earnings,https://da.gd/fk3HZ
TheStreet,"Stock Market Today: Stocks mixed with tech earnings, jobs, Fed in focus",https://www.thestreet.com/investing/stocks/stock-market-today-stocks-mixed-with-tech-earnings-jobs-fed-in-focus,https://da.gd/SNyy
TheStreet,UPS slumps as muted 2024 sales outlook offsets mixed Q4 earnings,https://www.thestreet.com/investing/ups-slumps-as-muted-2024-sales-outlook-offsets-mixed-q4-earnings,https://da.gd/biKmmy
