feed,title,long_url,short_url
Benzinga,Board Member At This Utilities Company Sells $92K of Stock,https://benzinga.com/news/22/11/29906994/board-member-at-this-utilities-company-sells-92k-of-stock,https://bit.ly/3XXboiz
Benzinga,10% Owner At This Information Technology Company Sells $29.21M of Stock,https://benzinga.com/news/22/11/29906993/10-owner-at-this-information-technology-company-sells-29-21m-of-stock,https://bit.ly/3UkMS7T
Benzinga,Remitly Global EVP Trades $53K In Company Stock,https://benzinga.com/news/22/11/29906990/remitly-global-evp-trades-53k-in-company-stock,https://bit.ly/3uj0aqF
Benzinga,Model N Insider Trades Send a Signal,https://benzinga.com/news/22/11/29906987/model-n-insider-trades-send-a-signal,https://bit.ly/3ir08KG
Benzinga,Model N Board Member Trades Company's Stock,https://benzinga.com/news/22/11/29906983/model-n-board-member-trades-companys-stock,https://bit.ly/3VixrhV
Benzinga,Model N Chief Revenue Officer Sold $401K In Company Stock,https://benzinga.com/news/22/11/29906975/model-n-chief-revenue-officer-sold-401k-in-company-stock,https://bit.ly/3isAWDB
Benzinga,President of KBR Makes $177K Sale,https://benzinga.com/news/22/11/29906972/president-of-kbr-makes-177k-sale,https://bit.ly/3isB1Hp
Benzinga,Vivakor Insider Trades Send a Signal,https://benzinga.com/news/22/11/29906970/vivakor-insider-trades-send-a-signal,https://bit.ly/3VkMcRc
Benzinga,HireRight Holdings Director Makes $7.01M Stock Purchase,https://benzinga.com/news/22/11/29906965/hireright-holdings-director-makes-7-01m-stock-purchase,https://bit.ly/3ucBLmJ
Benzinga,HireRight Holdings Recent Insider Activity,https://benzinga.com/news/22/11/29906962/hireright-holdings-recent-insider-activity,https://bit.ly/3ucBKiF
Benzinga,Regional Mgmt Recent Insider Activity,https://benzinga.com/news/22/11/29906958/regional-mgmt-recent-insider-activity,https://bit.ly/3Vivyl3
Benzinga,10% Owner of GoHealth Makes $466K Buy,https://benzinga.com/news/22/11/29906957/10-owner-of-gohealth-makes-466k-buy,https://bit.ly/3VmstAH
Benzinga,Massive Insider Trade At GoHealth,https://benzinga.com/news/22/11/29906954/massive-insider-trade-at-gohealth,https://bit.ly/3Ue4CBK
Benzinga,President and CEO of Montauk Renewables Sold $725K In Stock,https://benzinga.com/news/22/11/29906942/president-and-ceo-of-montauk-renewables-sold-725k-in-stock,https://bit.ly/3udvozO
Benzinga,EVP of PDF Solutions Sold $369K In Stock,https://benzinga.com/news/22/11/29906925/evp-of-pdf-solutions-sold-369k-in-stock,https://bit.ly/3ioOtw2
