feed,title,long_url,short_url
CryptoNews,Bitget Allows Crypto Wallet Users to Login With Telegram,https://cryptonews.com/news/bitget-allows-mpc-wallet-users-to-login-with-telegram.htm,https://da.gd/M5dtgB
CryptoNews,Space and Time Secures $20 Million For Blockchain-AI Integration,https://cryptonews.com/news/space-and-time-secures-20-million-for-blockchain-ai-integration.htm,https://da.gd/FZstYc
CryptoNews,Vitalik Buterin Sheds Light on Ethereum Foundation’s 2023 Spending,https://cryptonews.com/news/vitalik-buterin-sheds-light-on-ethereum-foundations-2023-spending.htm,https://da.gd/SicRA
CryptoNews,Can Bitcoin Enter The “Banana Zone’ And Hit $150k This Year? Real Vision Analysts Say It’s Possible,https://cryptonews.com/news/can-bitcoin-enter-the-banana-zone-and-hit-150k-this-year-real-vision-analysts-say-its-possible.htm,https://da.gd/7hr2JL
CryptoNews,Donald Trump Launches Fourth NFT Series Featuring ‘Debate Suit’ Collectible,https://cryptonews.com/news/donald-trump-launches-fourth-nft-series-featuring-debate-suit-collectible.htm,https://da.gd/dUwwso
