feed,title,long_url,short_url
Investing,Big Time Generates over $100M in Revenue since Preseason,https://www.investing.com/news/cryptocurrency-news/big-time-generates-over-100m-in-revenue-since-preseason-3357081,https://da.gd/t4n7j
Investing,"StakeLayer Launches The First Bitcoin Restaking L2, as BlackRock Shows Institutional Crypto Interest",https://www.investing.com/news/cryptocurrency-news/stakelayer-launches-the-first-bitcoin-restaking-l2-as-blackrock-shows-institutional-crypto-interest-3357080,https://da.gd/jFhy
Investing,"Xiaomi forays into the Chinese EV market with a $30,000 car",https://www.investing.com/news/stock-market-news/xiaomi-forays-into-the-chinese-ev-market-with-a-30000-car-432SI-3357091,https://da.gd/JU9N2
Investing,Factbox-Companies sell their businesses in Russia,https://www.investing.com/news/stock-market-news/factboxcompanies-sell-their-businesses-in-russia-3357079,https://da.gd/xLYvmD
Investing,"U.S. pending home sales increase moderately, NAR says",https://www.investing.com/news/economic-indicators/us-pending-home-sales-increase-moderately-nar-says-3357092,https://da.gd/CUkAU
