feed,title,long_url,short_url
SeekingAlpha,Apple price target raised at Deutsche Bank as growth estimates are too low,https://seekingalpha.com/news/3788642,
SeekingAlpha,JPMorgan Chase credit card charge-off rate improves in December,https://seekingalpha.com/news/3788641,
SeekingAlpha,"FRSX, SLI and BTCS among pre market losers",https://seekingalpha.com/news/3788640,
SeekingAlpha,Biodesix launches tumor profiling test GeneStrat NGS; IQLung Testing Strategy,https://seekingalpha.com/news/3788637,
SeekingAlpha,COP up to buy at GS - Permian deal provides torque to bullish oil price forecast,https://seekingalpha.com/news/3788639,
SeekingAlpha,Jacobs nabs commercial space headquarters campus contract,https://seekingalpha.com/news/3788638,
