feed,title,long_url,short_url
SeekingAlpha,First Financial Bancorp announces stock repurchase plan,https://seekingalpha.com/news/3646628,
SeekingAlpha,MFA Financial to redeem $100M senior notes due 2042,https://seekingalpha.com/news/3646627,
SeekingAlpha,Jupiter Wellness concludes enrollment in eczema study with JW-100,https://seekingalpha.com/news/3646615,
SeekingAlpha,Maxeon Solar receives favorable patent ruling in China,https://seekingalpha.com/news/3646626,
SeekingAlpha,Nautilus perky after Peloton's big M&A move,https://seekingalpha.com/news/3646625,
