feed,title,long_url,short_url
FXEmpire,Family of Ahmaud Arbery wants racial justice as murderers face new trial,https://www.fxempire.com/news/article/family-of-ahmaud-arbery-wants-racial-justice-as-murderers-face-new-trial-880844,https://bit.ly/34g90f4
FXEmpire,Finnish diplomats targeted with Pegasus spyware -ministry,https://www.fxempire.com/news/article/finnish-diplomats-targeted-with-pegasus-spyware-ministry-880851,https://bit.ly/3Hc14ua
FXEmpire,"U.S. Treasury likely to cut auction sizes, possibly for last time",https://www.fxempire.com/news/article/u-s-treasury-likely-to-cut-auction-sizes-possibly-for-last-time-880845,https://bit.ly/3IIaWMz
FXEmpire,European Mali mission sets 2-week deadline for new plan – Danish defence minister,https://www.fxempire.com/news/article/european-mali-mission-sets-2-week-deadline-for-new-plan-danish-defence-minister-880849,https://bit.ly/3u8xIsY
FXEmpire,Germany expelled Russian diplomat over space tech spying -Spiegel,https://www.fxempire.com/news/article/germany-expelled-russian-diplomat-over-space-tech-spying-spiegel-880853,https://bit.ly/3udAahX
FXEmpire,Vatican has signed contract to sell London building at core of corruption trial,https://www.fxempire.com/news/article/vatican-has-signed-contract-to-sell-london-building-at-core-of-corruption-trial-880850,https://bit.ly/32CWdmy
FXEmpire,Daimler AG to rebrand as Mercedes-Benz on Feb. 1,https://www.fxempire.com/news/article/daimler-ag-to-rebrand-as-mercedes-benz-on-feb-1-880854,https://bit.ly/3H5wToi
