feed,title,long_url,short_url
Investing,"Exclusive-Saudi Aramco reducing output at two oilfields, two sources say",https://www.investing.com/news/commodities-news/exclusivesaudi-aramco-reducing-output-at-two-oilfields-two-sources-say-4549816,
Investing,Trump bought Netflix and Warner Bros bonds at height of bidding war with Paramount,https://www.investing.com/news/stock-market-news/trump-bought-netflix-and-warner-bros-bonds-at-height-of-bidding-war-with-paramount-4549831,
Investing,"Amazon’s Zoox to launch command hub in Arizona, expand testing to Dallas and Phoenix",https://www.investing.com/news/stock-market-news/amazons-zoox-to-launch-command-hub-in-arizona-expand-testing-to-dallas-and-phoenix-4549829,
Investing,Live Nation settles US antitrust case,https://www.investing.com/news/stock-market-news/live-nation-settles-us-antitrust-case-4549795,
Investing,Factbox-Governments plan repatriations as Middle East flights stop,https://www.investing.com/news/stock-market-news/factboxgovernments-plan-repatriations-as-middle-east-flights-stop-4549791,
Investing,Shipper MSC introduces emergency fuel surcharges,https://www.investing.com/news/economy-news/shipper-msc-introduces-emergency-fuel-surcharges-4549830,
