feed,title,long_url,short_url
Investing,"Macro remains a risk for American Express, MasterCard and Visa - Monness, Crespi, Hardt",https://www.investing.com/news/stock-market-news/macro-remains-a-risk-for-american-express-mastercard-and-visa--monness-crespi-hardt-432SI-3261030,https://da.gd/iszT9
Investing,MacroGenics gains as Citi upgrades to Buy,https://www.investing.com/news/stock-market-news/macrogenics-gains-as-citi-upgrades-to-buy-432SI-3261003,https://da.gd/cGWQu9
Investing,"HSBC starts McDonald's and Domino's at Buy, favors restaurant stocks leveraging scale",https://www.investing.com/news/stock-market-news/hsbc-starts-mcdonalds-and-dominos-at-buy-favors-restaurant-stocks-leveraging-scale-432SI-3260995,https://da.gd/ntzyT
Investing,Alphabet stock hits a 52-week high as AI rally gets another boost,https://www.investing.com/news/stock-market-news/alphabet-stock-hits-a-52week-high-as-ai-rally-gets-another-boost-432SI-3260984,https://da.gd/ycPiS
Investing,Toyota halts all shipments of Daihatsu brand vehicles,https://www.investing.com/news/stock-market-news/toyota-halts-all-shipments-of-daihatsu-brand-vehicles-432SI-3260949,https://da.gd/93zsk
Investing,Germany to seize more than $790 million from Russian financial group,https://www.investing.com/news/economy/germany-to-seize-more-than-790-million-from-russian-financial-group-3261032,https://da.gd/72yw
