feed,title,long_url,short_url
SeekingAlpha,Sun Country Airlines sees operating margin rise to highest level since before the pandemic,https://seekingalpha.com/news/3761856,
SeekingAlpha,"Avis Budget EPS beats by $4.06, beats on revenue",https://seekingalpha.com/news/3761855,
SeekingAlpha,Cirrus Logic CFO retires,https://seekingalpha.com/news/3761854,
SeekingAlpha,"Intevac EPS beats by $0.08, beats on revenue",https://seekingalpha.com/news/3761853,
SeekingAlpha,"Medallion Financial EPS beats by $0.38, beats on revenue",https://seekingalpha.com/news/3761851,
