feed,title,long_url,short_url
SeekingAlpha,Leggett & Platt falls as lower volumes contribute to earnings miss,https://seekingalpha.com/news/3761957,
SeekingAlpha,Molina Healthcare prices senior notes offering,https://seekingalpha.com/news/3761956,
SeekingAlpha,Gibson Energy reports Q3 results,https://seekingalpha.com/news/3761954,
SeekingAlpha,Lockheed Martin bags Special Ops contract worth $250M,https://seekingalpha.com/news/3761952,
SeekingAlpha,Liquidity Services acquires online marketplace Bid4Assets,https://seekingalpha.com/news/3761953,
SeekingAlpha,NCS Multistage Holdings reports Q3 results,https://seekingalpha.com/news/3761951,
