feed,title,long_url,short_url
Yahoo,5 ETFs Sizzle Last Week Amid Volatility,https://finance.yahoo.com/news/5-etfs-sizzle-last-week-141002504.html?.tsrc=rss,https://da.gd/6yPFQ
Yahoo,China EV Price War Reaches Fever Pitch: An Analysis,https://finance.yahoo.com/news/china-ev-price-war-reaches-142902732.html?.tsrc=rss,https://da.gd/syDH
Yahoo,The Best FAANG Earnings Charts,https://finance.yahoo.com/news/best-faang-earnings-charts-141702608.html?.tsrc=rss,https://da.gd/8XY4Z
Yahoo,Alphabet (GOOGL) Expected to Beat Earnings Estimates: Should You Buy?,https://finance.yahoo.com/news/alphabet-googl-expected-beat-earnings-140102636.html?.tsrc=rss,https://da.gd/NGYhkC
Yahoo,Alphabet Inc. (GOOG) Expected to Beat Earnings Estimates: Can the Stock Move Higher?,https://finance.yahoo.com/news/alphabet-inc-goog-expected-beat-140102475.html?.tsrc=rss,https://da.gd/5rwrl
