feed,title,long_url,short_url
SeekingAlpha,"Whirlpool Non-GAAP EPS of $4.49 misses by $0.86, revenue of $4.78B misses by $370M",https://seekingalpha.com/news/3893400,
SeekingAlpha,"Snap Non-GAAP EPS of $0.08 beats by $0.09, revenue of $1.13B misses by $10M, announced $500M buyback",https://seekingalpha.com/news/3893399,
SeekingAlpha,"Covenant Logistics Non-GAAP EPS of $1.52, revenue of $311.84M",https://seekingalpha.com/news/3893398,
SeekingAlpha,"Robert Half GAAP EPS of $1.53 misses by $0.11, revenue of $1.83B misses by $80M",https://seekingalpha.com/news/3893395,
SeekingAlpha,Will AmEx Q3 results show sustained travel demand or nervous consumers?,https://seekingalpha.com/news/3893394,
