feed,title,long_url,short_url
SeekingAlpha,"Retail Opportunity Investments FFO of $0.28 beats by $0.01, revenue of $85.33M beats by $1.51M",https://seekingalpha.com/news/4092815,
SeekingAlpha,OpGen receives Nasdaq notice regarding delayed Form 10-K,https://seekingalpha.com/news/4092814,
SeekingAlpha,"Matador Resources Non-GAAP EPS of $1.71 beats by $0.18, revenue of $787.69M beats by $46.29M",https://seekingalpha.com/news/4092813,
SeekingAlpha,The Real Good Food Company receives Nasdaq notice of non-compliance,https://seekingalpha.com/news/4092812,
SeekingAlpha,"CoStar Group Non-GAAP EPS of $0.10 beats by $0.03, revenue of $656M beats by $6.51M",https://seekingalpha.com/news/4092811,
SeekingAlpha,"Chubb Non-GAAP EPS of $5.41 beats by $0.11, Net premiums earned of $11.58B beats by $1.31B",https://seekingalpha.com/news/4092810,
SeekingAlpha,"Zurn Water Solutions Non-GAAP EPS of $0.29 beats by $0.03, revenue of $374M beats by $4.98M",https://seekingalpha.com/news/4092809,
