feed,title,long_url,short_url
InsiderMonkey,White Falcon Capital Management’s Q2 2026 Investor Letter,https://insidermonkey.com/blog/--1804016,
InsiderMonkey,Key Catalyst Behind Salesforce’s (CRM) Compelling Outlook,https://insidermonkey.com/blog/--1803974,
InsiderMonkey,Does Mispricing Offer Opportunity in Mastercard (MA)?,https://insidermonkey.com/blog/--1803971,
InsiderMonkey,Montaka Global Investments’ Q2 2026 Investor Letter,https://insidermonkey.com/blog/--1803957,
InsiderMonkey,Jim Cramer Highlights Strong Travel Numbers as Fuel for American Express,https://insidermonkey.com/blog/--1804054,
InsiderMonkey,Temporary Concerns Present Entry Point in Zoetis (ZTS),https://insidermonkey.com/blog/--1803995,
InsiderMonkey,Moon Capital Management Exited DaVita (DVA) with 174% total Return,https://insidermonkey.com/blog/--1803986,
InsiderMonkey,Moon Capital Management’s Q2 2026 Investor Letter,https://insidermonkey.com/blog/--1803981,
InsiderMonkey,An Analysis of SAP SE (SAP) in the AI Transition Era,https://insidermonkey.com/blog/--1803950,
InsiderMonkey,Meta Platforms (META) Strengthens Ad Platform Through Heavy AI Investments,https://insidermonkey.com/blog/--1803943,
InsiderMonkey,STARTRADER Launches SKHY as SK Hynix Makes US Market Debut,https://insidermonkey.com/blog/--1803884,
InsiderMonkey,ZenaTech’s Drone as a Service Closes 26th Acquisition of an Ohio-based Land Surveying Company Licensed in Four States,https://insidermonkey.com/blog/--1804071,
InsiderMonkey,Ironvine Capital Partners’ Q2 2026 Investor Letter,https://insidermonkey.com/blog/--1803939,
InsiderMonkey,"Amphenol Corp (APH), a High-Quality Company, Strengthens From AI Infrastructure Buildout",https://insidermonkey.com/blog/--1804008,
InsiderMonkey,Mastercard (NYSE:MA): Jim Cramer’s “Tech Company in Bank Clothing”,https://insidermonkey.com/blog/--1804018,
InsiderMonkey,Cavco Industries (CVCO) Maintains Dominance in a Concentrated Industry,https://insidermonkey.com/blog/--1804011,
InsiderMonkey,Fastenal Company (FAST) Gains from Reshoring Trends and AI Infrastructure Buildout,https://insidermonkey.com/blog/--1804014,
InsiderMonkey,Brasada Capital Management’s Q2 2026 Investor Letter,https://insidermonkey.com/blog/--1804005,
InsiderMonkey,Jim Cramer Highlights Visa (V) as Consumer Credit Demand Soars,https://insidermonkey.com/blog/--1803792,
