feed,title,long_url,short_url
Investing,"Marvell Technology stock outlook: bull case, bear case, and key risks",https://www.investing.com/news/stock-market-news/marvell-technology-stock-outlook-bull-case-bear-case-and-key-risks-93CH-4810022,
Investing,U.S. stocks lower at close of trade; Dow Jones Industrial Average down 0.97%,https://www.investing.com/news/stock-market-news/us-stocks-lower-at-close-of-trade-dow-jones-industrial-average-down-097-4809993,
Investing,Canada stocks lower at close of trade; S&P/TSX Composite down 0.82%,https://www.investing.com/news/stock-market-news/canada-stocks-lower-at-close-of-trade-sptsx-composite-down-082-4809992,
Investing,Brazil stocks lower at close of trade; Bovespa down 0.46%,https://www.investing.com/news/stock-market-news/brazil-stocks-lower-at-close-of-trade-bovespa-down-046-4809981,
Investing,Newmont beats second-quarter profit estimates on higher gold prices,https://www.investing.com/news/stock-market-news/gold-miner-newmont-beats-secondquarter-profit-estimates-4809939,
