feed,title,long_url,short_url
SeekingAlpha,Arthur J. Gallagher & Co acquires Ericson Insurance Advisors,https://seekingalpha.com/news/4060646,
SeekingAlpha,"5 stocks to watch on Wednesday: Boeing, Qualcomm, Teva Pharmaceutical and more",https://seekingalpha.com/news/4060648,
SeekingAlpha,Starboard views GoDaddy as undervalued with opportunity for growth,https://seekingalpha.com/news/4060645,
SeekingAlpha,TEN announces acquisition of a fleet of five modern environmentally-friendly vessels,https://seekingalpha.com/news/4060644,
SeekingAlpha,Delcath Systems announces CMS established product-specific J-code for HEPZATO,https://seekingalpha.com/news/4060643,
SeekingAlpha,NeurAxis appoints Timothy Henrichs as its CFO,https://seekingalpha.com/news/4060642,
