feed,title,long_url,short_url
Benzinga,"Medical Equipment Maker Thermo Fisher Scientific Clocks 7% Decline In Q4 Organic Sales, Issues Subdued Annual Outlook",https://benzinga.com/news/earnings/24/01/36867922/medical-equipment-maker-thermo-fisher-scientific-clocks-7-decline-in-q4-organic-sales-issues-subdue,https://da.gd/YBydvm
Benzinga,"GameStop, Dogwifhat And 'Dogecoin Killers:' How Memecoins Teach A 'Skill To Succeed' In Crypto",https://benzinga.com/markets/cryptocurrency/24/01/36852842/gamestop-dogwifhat-and-dogecoin-killers-why-memecoins-are-a-skill-to-succeed-in-crypto,https://da.gd/uY0z
Benzinga,Market Whales and Their Recent Bets on AVGO Options,https://benzinga.com/insights/options/24/01/36867842/market-whales-and-their-recent-bets-on-avgo-options,https://da.gd/IvakPS
Benzinga,Decoding JPMorgan Chase's Options Activity: What's the Big Picture?,https://benzinga.com/insights/options/24/01/36867840/decoding-jpmorgan-chases-options-activity-whats-the-big-picture,https://da.gd/zH6bcU
Benzinga,Market Whales and Their Recent Bets on LULU Options,https://benzinga.com/insights/options/24/01/36867837/market-whales-and-their-recent-bets-on-lulu-options,https://da.gd/aZZSSM
Benzinga,The REIT Hack for High Mortgage Times: Profit from Suburban Rentals,https://benzinga.com/real-estate/reit/24/01/36867921/the-reit-hack-for-high-mortgage-times-profit-from-suburban-rentals,https://da.gd/UdEBaO
