feed,title,long_url,short_url
Investing,"Earnings call: A.O. Smith reports record sales, bullish 2024 outlook",https://www.investing.com/news/stock-market-news/earnings-call-ao-smith-reports-record-sales-bullish-2024-outlook-93CH-3288808,https://da.gd/zQrX
Investing,Robert Half drops 10% after EPS,https://www.investing.com/news/stock-market-news/robert-half-drops-10-after-eps-432SI-3288799,https://da.gd/iZnS7
Investing,Earnings call: Axos Financial sees robust growth in Q2 2024,https://www.investing.com/news/stock-market-news/earnings-call-axos-financial-sees-robust-growth-in-q2-2024-93CH-3288807,https://da.gd/GL6zNO
Investing,"Earnings call: BBVA reports record net profit, strong digital growth",https://www.investing.com/news/stock-market-news/earnings-call-bbva-reports-record-net-profit-strong-digital-growth-93CH-3288812,https://da.gd/BTGvnf
Investing,"Earnings call: Cadence Bank reports robust Q4, positive 2024 outlook",https://www.investing.com/news/stock-market-news/earnings-call-cadence-bank-reports-robust-q4-positive-2024-outlook-93CH-3288809,https://da.gd/fLWTBg
Investing,Earnings call: Camden National posts mixed Q4 results amid loan demand,https://www.investing.com/news/stock-market-news/earnings-call-camden-national-posts-mixed-q4-results-amid-loan-demand-93CH-3288803,https://da.gd/gFgt3
Investing,"Earnings call: Calix reports record Q4 revenue, eyes 2024 challenges",https://www.investing.com/news/stock-market-news/earnings-call-calix-reports-record-q4-revenue-eyes-2024-challenges-93CH-3288802,https://da.gd/tukzkA
Investing,"Earnings call: Cleveland-Cliffs outlines 2024 strategy, M&A prospects",https://www.investing.com/news/stock-market-news/earnings-call-clevelandcliffs-outlines-2024-strategy-ma-prospects-93CH-3288811,https://da.gd/XrTYbb
Investing,"Earnings call: Cleveland-Cliffs outlines 2024 strategy, M&A prospects",https://www.investing.com/news/stock-market-news/earnings-call-clevelandcliffs-outlines-2024-strategy-ma-prospects-93CH-3288806,https://da.gd/gilf
