feed,title,long_url,short_url
SeekingAlpha,Waldencast names Manuel Manfredi as CFO,https://seekingalpha.com/news/4061007,
SeekingAlpha,"Eagle Financial Bancorp GAAP EPS of -$0.16, revenue of $2.4M",https://seekingalpha.com/news/4061006,
SeekingAlpha,Alps Global Holding Berhad to go public through SPAC merger,https://seekingalpha.com/news/4061005,
SeekingAlpha,"Exco Technologies GAAP EPS of $0.15, revenue of $156.7M beats by $32.52M",https://seekingalpha.com/news/4061004,
SeekingAlpha,"NewMarket GAAP EPS of $8.38, revenue of $643.35M",https://seekingalpha.com/news/4061003,
