feed,title,long_url,short_url
SeekingAlpha,New finance chief for iCoreConnect,https://seekingalpha.com/news/3670752,
SeekingAlpha,ViacomCBS falls 7% from all-time high; Kass floats equity offering chatter,https://seekingalpha.com/news/3670750,
SeekingAlpha,Veritone spikes after report of exploring potential sale,https://seekingalpha.com/news/3670749,
SeekingAlpha,Blink Charging shoots higher after Cowen points to upside,https://seekingalpha.com/news/3670748,
SeekingAlpha,Cyclo gets positive EMA opinion on rare genetic disorder treatment development plan,https://seekingalpha.com/news/3670746,
