feed,title,long_url,short_url
FXEmpire,Explainer-Italy’s new government challenges sea of maritime laws,https://www.fxempire.com/news/article/explainer-italys-new-government-challenges-sea-of-maritime-laws-1194430,https://bit.ly/3TvbuKL
FXEmpire,"Fiscal and social concerns equally important for Brazil’s economy, Itau CEO says",https://www.fxempire.com/news/article/fiscal-and-social-concerns-equally-important-for-brazils-economy-itau-ceo-says-1194427,https://bit.ly/3UMh1xl
FXEmpire,Belarus inflation falls after Lukashenko bans price rises,https://www.fxempire.com/news/article/belarus-inflation-falls-after-lukashenko-bans-price-rises-1194424,https://bit.ly/3TnCbAU
FXEmpire,COP27-US targets methane in ‘relentless’ emissions focus,https://www.fxempire.com/news/article/cop27-us-targets-methane-in-relentless-emissions-focus-1194426,https://bit.ly/3TJ06uZ
FXEmpire,"JPMorgan to expand in Greece with new office, payments team",https://www.fxempire.com/news/article/jpmorgan-to-expand-in-greece-with-new-office-payments-team-1194428,https://bit.ly/3UIG1FG
