feed,title,long_url,short_url
SeekingAlpha,"Presidio Property Trust GAAP EPS of -$0.11, revenue of $4.39M",https://seekingalpha.com/news/3906482,
SeekingAlpha,"Hyperfine stock rises as Q3 device revenue surges, maintains FY22 outlook",https://seekingalpha.com/news/3906478,
SeekingAlpha,Brilliant Earth plunges 60% after slash in full-year outlook,https://seekingalpha.com/news/3906481,
SeekingAlpha,Amfil Technologies Inc. reports Q1 results,https://seekingalpha.com/news/3906480,
SeekingAlpha,Elanco Animal Health gains on speculation of potential activist,https://seekingalpha.com/news/3906479,
SeekingAlpha,Jounce downgraded to outperform at Raymond James on timing for data on immunotherapy,https://seekingalpha.com/news/3906476,
