feed,title,long_url,short_url
Nasdaq,"How the Power of Data Will Advance Diversity, Equity and Inclusion",https://www.nasdaq.com/articles/how-the-power-of-data-will-advance-diversity-equity-and-inclusion-2021-07-20,https://j.mp/3zjwVoc
Nasdaq,These 2 Under-the-Radar Stocks Are Big Winners in Tuesday's Stock Market Rally,https://www.nasdaq.com/articles/these-2-under-the-radar-stocks-are-big-winners-in-tuesdays-stock-market-rally-2021-07-20,https://j.mp/3kH0sUO
Nasdaq,Apple to delay office returns to October - Bloomberg News,https://www.nasdaq.com/articles/apple-to-delay-office-returns-to-october-bloomberg-news-2021-07-20,https://j.mp/3itb1Ij
Nasdaq,"Ferragamo's sales jump in Q2, lag pre-COVID levels",https://www.nasdaq.com/articles/ferragamos-sales-jump-in-q2-lag-pre-covid-levels-2021-07-20,https://j.mp/3eDfTcM
Nasdaq,Buyers circle Seadrill as it plots exit from bankruptcy -sources,https://www.nasdaq.com/articles/buyers-circle-seadrill-as-it-plots-exit-from-bankruptcy-sources-2021-07-20,https://j.mp/3itEodN
Nasdaq,GRAINS-Wheat at two-month peak on U.S. weather worries,https://www.nasdaq.com/articles/grains-wheat-at-two-month-peak-on-u.s.-weather-worries-2021-07-20,https://j.mp/2UmYi27
