feed,title,long_url,short_url
ETFTrends:DailyRecap,Diversifying Exposure to the Nasdaq With Options-Based ETF Strategies,https://www.etftrends.com/thematic-investing-channel/diversifying-exposure-to-the-nasdaq-with-options-based-etf-strategies/,https://j.mp/308WBIs
ETFTrends:DailyRecap,"Advocate Capital: For Rising Rates, Advisors Need To Consider A Multi-Asset Hedge",https://www.etftrends.com/advocate-capital-q-a/,https://j.mp/31tv6tP
ETFTrends:DailyRecap,Potential Evergrande Default Won’t Diminish ADIV,https://www.etftrends.com/dividend-channel/potential-evergrande-default-wont-diminish-adiv/,https://j.mp/3y1w38x
ETFTrends:DailyRecap,How to Maximize Returns With Tax-Loss Harvesting,https://www.etftrends.com/core-strategies-channel/how-to-maximize-returns-with-tax-loss-harvesting/,https://j.mp/3GoaGRD
ETFTrends:DailyRecap,Where Inflation Goes To Hide,https://www.etftrends.com/etf-strategist-channel/where-inflation-goes-to-hide/,https://j.mp/3lLo7mV
ETFTrends:DailyRecap,Fear Shifts Investor Sentiment Bearish as Volatility Continues,https://www.etftrends.com/retirement-income-channel/fear-shifts-investor-sentiment-bearish-as-volatility-continues/,https://j.mp/3IDGiEW
ETFTrends:DailyRecap,Disheveled… Again,https://www.etftrends.com/etf-strategist-channel/disheveled-again/,https://j.mp/3pxrv5L
ETFTrends:DailyRecap,China’s Central Bank Could Catapult Copper ETF Higher,https://www.etftrends.com/thematic-investing-channel/chinas-central-bank-could-catapult-copper-etf-higher/,https://j.mp/3EA4tSf
ETFTrends:DailyRecap,"Avoid Passive Investing, Says Peter Lynch",https://www.etftrends.com/active-etf-channel/avoid-passive-investing-says-peter-lynch/,https://j.mp/3DvqBM7
ETFTrends:DailyRecap,Real Estate Looking Sturdy at Right Time,https://www.etftrends.com/future-etfs-channel/real-estate-looking-sturdy-at-right-time/,https://j.mp/3owZw6V
ETFTrends:DailyRecap,"Bond Bites – No, 60/40 Is Not Dead",https://www.etftrends.com/etf-strategist-channel/bond-bites-no-6040-is-not-dead/,https://j.mp/3y6JUdx
ETFTrends:DailyRecap,Emerging Markets Dividends Growth a Plus for This ETF,https://www.etftrends.com/dividend-channel/emerging-markets-dividends-growth-a-plus-for-this-etf/,https://j.mp/3y19osK
ETFTrends:DailyRecap,Buying Opportunity Emerges With Small-Cap Growth ETFs,https://www.etftrends.com/etf-education-channel/buying-opportunity-emerges-with-small-cap-growth-etfs/,https://j.mp/3ExaGy8
ETFTrends:DailyRecap,"If 2022 Is Tricky, Equal Weight Could Be Way to Go",https://www.etftrends.com/portfolio-strategies-channel/if-2022-is-tricky-equal-weight-could-be-way-to-go/,https://j.mp/3IqbsiX
ETFTrends:DailyRecap,El Salvador Undeterred by Drop in Bitcoin,https://www.etftrends.com/crypto-channel/el-salvador-undeterred-by-drop-in-bitcoin/,https://j.mp/3y0c3mF
ETFTrends:DailyRecap,Don’t Miss This Leveraged Nasdaq ETF’s Record Run,https://www.etftrends.com/nasdaq-portfolio-solutions-channel/dont-miss-this-leveraged-nasdaq-etfs-record-run/,https://j.mp/3pDoocH
ETFTrends:DailyRecap,"Municipal Bonds Are Going Green, and Investors Can Benefit",https://www.etftrends.com/tactical-allocation-channel/municipal-bonds-are-going-green-and-investors-can-benefit/,https://j.mp/3y0FCV4
ETFTrends:DailyRecap,Smaller Biotech Stocks Ready to Perk Up,https://www.etftrends.com/etf-building-blocks-channel/smaller-biotech-stocks-ready-to-perk-up/,https://j.mp/300WKNQ
ETFTrends:DailyRecap,"Quality Always Matters, and It’s Accessible With This ETF",https://www.etftrends.com/model-portfolio-channel/quality-always-matters-and-its-accessible-with-this-etf/,https://j.mp/3rJqeLy
ETFTrends:DailyRecap,Equal-Weight Strategy ETF Outpaces S&P 500 Health Care Index,https://www.etftrends.com/innovative-etfs-channel/invesco-equal-weight-healthcare-etf-outperforms-index/,https://j.mp/31xXyu5
ETFTrends:DailyRecap,Introducing The ETFinTwit 50: Part 2,https://www.etftrends.com/exchange-an-etf-experience/introducing-the-etfintwit-50-part-2/,https://j.mp/3y1fOrX
ETFTrends:DailyRecap,Ethereum Mining Revenue Outpaced Bitcoin Mining Revenue in November,https://www.etftrends.com/crypto-channel/ethereum-mining-revenue-outpaced-bitcoin-mining-revenue-in-november/,https://j.mp/3pyAbJ5
ETFTrends:DailyRecap,Majority of Bitcoin Investors Are First-Timers in 2021,https://www.etftrends.com/crypto-channel/majority-of-bitcoin-investors-are-first-timers-in-2021/,https://j.mp/3rNyD0C
ETFTrends:DailyRecap,Tilt Your Bond Exposure to the Short Side With Inflation Protection,https://www.etftrends.com/multi-asset-channel/tilt-your-bond-exposure-to-the-short-side-with-inflation-protection/,https://j.mp/3oxk3IC
ETFTrends:DailyRecap,"Whether Through Fission or Fusion, Nuclear Power is the Future",https://www.etftrends.com/gold-silver-investing-channel/whether-through-fission-or-fusion-nuclear-power-is-the-future/,https://j.mp/3ExVNvp
ETFTrends:DailyRecap,Numbers Don’t Lie: The Continued Case for Active ETFs,https://www.etftrends.com/active-etf-channel/numbers-dont-lie-the-continued-case-for-active-etfs/,https://j.mp/3ouCKMZ
ETFTrends:DailyRecap,How to Find Optimal Liquidity in ESG Funds,https://www.etftrends.com/esg-channel/how-to-find-optimal-liquidity-in-esg-funds/,https://j.mp/3lIOU35
ETFTrends:DailyRecap,Travel ETFs Jump as Traders Look Past Omicron,https://www.etftrends.com/travel-etfs-jump-as-traders-look-past-omicron/,https://j.mp/3GgZZ3e
ETFTrends:DailyRecap,How Options-Based Strategies May Provide Protection,https://www.etftrends.com/thematic-investing-channel/how-options-based-strategies-may-provide-protection/,https://j.mp/31vSWoh
ETFTrends:DailyRecap,U.S. Stock ETFs Strengthen as Fears Over Omicron Ease,https://www.etftrends.com/portfolio-strategies-channel/u-s-stock-etfs-strengthen-as-fears-over-omicron-ease/,https://j.mp/3pApR3i
ETFTrends:DailyRecap,Why Income Investors Should Look at a Short-Term REITs ETF,https://www.etftrends.com/why-income-investors-should-look-at-a-short-term-reits-etf/,https://j.mp/3DsUigY
ETFTrends:DailyRecap,Better Than TIPS? SDOG Offers Inflation Protection,https://www.etftrends.com/etf-building-blocks-channel/better-than-tips-sdog-offers-inflation-protection/,https://j.mp/3oseLhs
ETFTrends:DailyRecap,Expect Midstream Industry to Continue Growth in 2022,https://www.etftrends.com/energy-infrastructure-channel/expect-midstream-industry-to-continue-growth-in-2022/,https://j.mp/3lAmPuT
ETFTrends:DailyRecap,Japan’s Catch-Up Story Is a 2022 Theme to Monitor,https://www.etftrends.com/model-portfolio-channel/japans-catch-up-story-is-a-2022-theme-to-monitor/,https://j.mp/3EH9CaU
