feed,title,long_url,short_url
SeekingAlpha,TSMC reportedly mulling first chip fab in Japan,https://seekingalpha.com/news/3704968,
SeekingAlpha,Harmony Bio reports clinical impact of Wakix in excessive daytime sleepiness at SLEEP 2021,https://seekingalpha.com/news/3704967,
SeekingAlpha,Digihost inks strategic collaboration with Bit Digital for increasing combined hashrates by 400 PH,https://seekingalpha.com/news/3704966,
SeekingAlpha,"GameStop, Celsius Holdings, FuelCell Energy among premarket losers' pack",https://seekingalpha.com/news/3704965,
SeekingAlpha,Data suggests higher dose of Biogen Spinraza may better improve motor function,https://seekingalpha.com/news/3704962,
