feed,title,long_url,short_url
ETFdb:DailyRecap,Fast Money: Tom Lydon Talks Single-Stock ETFs,https://etfdb.com/news/2022/08/18/fast-money-tom-lydon-talks-single-stock-etfs/,https://bit.ly/3QVuDEQ
ETFdb:DailyRecap,Meb Faber and Jim Bianco Talk Markets and the Economy,https://etfdb.com/model-portfolio-channel/meb-faber-and-jim-bianco-talk-markets-and-the-economy/,https://bit.ly/3QSH7gq
ETFdb:DailyRecap,"Dave Nadig Talks Clean Energy, Memes on Yahoo Finance",https://etfdb.com/dual-impact-channel/dave-nadig-talks-clean-energy-memes-on-yahoo-finance/,https://bit.ly/3QSOTGV
ETFdb:DailyRecap,SESG Offers Transparency and Sustainability to Gold,https://etfdb.com/gold-silver-investing-channel/sesg-offers-transparency-and-sustainability-to-gold/,https://bit.ly/3wfwTP5
ETFdb:DailyRecap,AZTLAN Seeks Stocks in Global Developed Markets,https://etfdb.com/news/2022/08/18/aztlan-seeks-stocks-in-global-developed-markets/,https://bit.ly/3QUWS6i
ETFdb:DailyRecap,Inflation Reduction Act Is Great for Clean Energy ETFs,https://etfdb.com/innovative-etfs-channel/inflation-reduction-act-is-great-for-clean-energy-etfs/,https://bit.ly/3PDOveq
ETFdb:DailyRecap,Investing in ESG With This Free Cash Flow ETF,https://etfdb.com/free-cash-flow-channel/investing-in-esg-with-this-free-cash-flow-etf/,https://bit.ly/3PAII9B
ETFdb:DailyRecap,Shorten Duration While the Fed Extends Rate Hikes,https://etfdb.com/core-strategies-channel/shorten-duration-while-the-fed-extends-rate-hikes/,https://bit.ly/3pA43Fj
ETFdb:DailyRecap,The RGGI Carbon Market Performs Despite Uncertainty,https://etfdb.com/climate-insights-channel/the-rggi-carbon-market-performs-despit-uncertainty/,https://bit.ly/3AGgQwF
ETFdb:DailyRecap,Check Out RYH for Defensive Healthcare Stocks,https://etfdb.com/portfolio-strategies-channel/check-out-ryh-for-defensive-healthcare-stocks/,https://bit.ly/3bZCmmw
ETFdb:DailyRecap,Innovator Launched Uncapped Accelerated U.S. Equity ETF,https://etfdb.com/news/2022/08/18/innovator-launched-uncapped-accelerated-u-s-equity-etf/,https://bit.ly/3CgldiV
ETFdb:DailyRecap,VettaFi’s Todd Rosenbluth on The Sherman Show,https://etfdb.com/news/2022/08/18/vettafi-s-todd-rosenbluth-on-the-sherman-show/,https://bit.ly/3QxFll9
ETFdb:DailyRecap,BlackRock Adds to Megatrends Platform With BPAY,https://etfdb.com/news/2022/08/18/blackrock-adds-to-megatrends-platform-with-bpay/,https://bit.ly/3SXqfa7
ETFdb:DailyRecap,The Future Economy Driving Infrastructure Needs,https://etfdb.com/thematic-investing-channel/the-future-economy-driving-infrastructure-needs/,https://bit.ly/3K562ef
ETFdb:DailyRecap,3 Steps To Developing an Effective Estate Plan,https://etfdb.com/retirement-income-channel/3-steps-to-developing-an-effective-estate-plan/,https://bit.ly/3we0BnC
ETFdb:DailyRecap,Healthcare Costs Make This Leveraged ETF a Prospect,https://etfdb.com/leveraged-inverse-channel/healthcare-costs-make-this-leveraged-etf-a-prospect/,https://bit.ly/3puESEa
ETFdb:DailyRecap,Spike in Bitcoin Buyers Could Signal Accumulation Phase,https://etfdb.com/crypto-channel/spike-in-bitcoin-buyers-could-signal-accumulation-phase/,https://bit.ly/3CanXhU
ETFdb:DailyRecap,Merger Fund: Unique Opportunity for Reducing Volatility,https://etfdb.com/alternatives-channel/merger-fund-unique-opportunity-for-reducing-volatility/,https://bit.ly/3wBfLnp
ETFdb:DailyRecap,Fantastic Women-Led Companies Found in This ETF,https://etfdb.com/esg-channel/fantastic-women-led-companies-found-in-this-etf/,https://bit.ly/3SZP9pG
ETFdb:DailyRecap,Nibble at Rebounding Cloud Stocks With This Tech ETF,https://etfdb.com/future-etfs-channel/nibble-at-rebounding-cloud-stocks-with-this-tech-etf/,https://bit.ly/3SWUqy5
ETFdb:DailyRecap,Dividend Forecasts Bode Well for DIVS,https://etfdb.com/dividend-channel/dividend-forecasts-bode-well-for-divs/,https://bit.ly/3dFxD9Z
ETFdb:DailyRecap,Chart of the Week: What Factors Matter Most,https://etfdb.com/news/2022/08/18/chart-of-the-week-what-factors-matter-most/,https://bit.ly/3QCqKoy
