feed,title,long_url,short_url
InvestorPlace,Investors Must Ask a Key Question Before Buying Naked Brand,https://investorplace.com/2021/10/nakd-stock-investors-must-ask-key-question/,https://j.mp/2Yb0XgK
InvestorPlace,3 Reasons to Buy the Dips in Nvidia Stock,https://investorplace.com/2021/10/3-reasons-to-buy-the-dips-in-nvidia-nvda-stock/,https://j.mp/3ovKPld
InvestorPlace,What to Make of Cassava Sciences’ Late September Rally,https://investorplace.com/2021/10/what-to-make-of-late-september-rally-sava-stock/,https://j.mp/2WJ8lQc
InvestorPlace,"Algorand Is Still at the Ground Floor, But Tread Carefully",https://investorplace.com/2021/10/algorand-still-at-ground-floor-but-tread-carefully/,https://j.mp/3uHp171
InvestorPlace,"Avoid Zoom as It Grapples With Reopening, Tough Competitors",https://investorplace.com/2021/10/avoid-zm-stock-as-it-grapples-with-reopening-tough-competitors/,https://j.mp/3uKGhbB
InvestorPlace,Ford Stock: The Electric Boom Could Easily Go Bust,https://investorplace.com/2021/10/f-stock-the-electric-boom-easily-go-bust-ford/,https://j.mp/3mhjLmS
InvestorPlace,Buy NIO Stock Dips as New Market Openings Should Give Shares a Boost,https://investorplace.com/2021/10/nio-stock-will-rebound-soon-buy-the-dip/,https://j.mp/3a4YZkE
