feed,title,long_url,short_url
Investing,Oil prices rebound from 1-mth low as rate hike doubts dent dollar,https://www.investing.com/news/commodities-news/oil-prices-rebound-from-1mth-low-as-rate-hike-doubts-dent-dollar-3218068,https://da.gd/Z37PgV
Investing,BlackRock ventures into burgeoning private credit market,https://www.investing.com/news/stock-market-news/blackrock-ventures-into-burgeoning-private-credit-market-93CH-3218067,https://da.gd/PNANP
Investing,Asiana Airlines board meets again to decide on sale of cargo unit,https://www.investing.com/news/stock-market-news/asiana-airlines-board-meets-again-to-decide-on-sale-of-cargo-unit-3218065,https://da.gd/qTk1
Investing,"US Justice department probes Live Nation's agreements with venues, artists -WSJ",https://www.investing.com/news/stock-market-news/us-justice-department-probes-live-nations-agreements-with-venues-artists-wsj-3218063,https://da.gd/7wZ8s
Investing,Australia’s trade surplus slumps to 2-½ year low in Sept,https://www.investing.com/news/economic-indicators/australias-trade-surplus-slumps-to-2-year-low-in-sept-3218061,https://da.gd/qH9Mv
Investing,Dollar tracks Treasury yields lower as Fed stays on hold,https://www.investing.com/news/economy/dollar-tracks-treasury-yields-lower-as-fed-stays-on-hold-3218064,https://da.gd/JCwoyK
Investing,Job market resilience continues despite Federal Reserve's inflation measures,https://www.investing.com/news/economy/job-market-resilience-continues-despite-federal-reserves-inflation-measures-93CH-3218062,https://da.gd/KHiR1y
