feed,title,long_url,short_url
SeekingAlpha,8x8 surges 30% after Craig-Hallum upgrades following Q2 beat,https://seekingalpha.com/news/4029206,
SeekingAlpha,I-Mab gains FDA breakthrough tag for kidney disease therapy,https://seekingalpha.com/news/4029210,
SeekingAlpha,SGL Carbon reports 9M results,https://seekingalpha.com/news/4029209,
SeekingAlpha,Generac upgraded to Buy at Stifel on earnings outlook,https://seekingalpha.com/news/4029208,
SeekingAlpha,"CyberArk climbs as earnings, guidance beat estimates",https://seekingalpha.com/news/4029184,
