feed,title,long_url,short_url
Motley,BigBear.ai Share Prices Surge. Is It Too Late to Buy the Stock?,https://www.fool.com/investing/2025/11/17/bigbear-ai-share-surge-too-late-buy-stock/?source=iedfolrf0000001,
Motley,"The Best Warren Buffett Stocks to Buy With $1,000 Right Now",https://www.fool.com/investing/2025/11/17/the-best-warren-buffett-stocks-to-buy-with-1000-ri/?source=iedfolrf0000001,
Motley,"Pullbacks for Quantum Computing Stocks IonQ, Rigetti Computing, and D-Wave Quantum Appear Set to Accelerate",https://www.fool.com/investing/2025/11/17/pullbacks-quantum-computing-stocks-ionq-rgti-qbts/?source=iedfolrf0000001,
Motley,Is United Parcel Service Stock a Buy Now?,https://www.fool.com/investing/2025/11/17/is-united-parcel-service-stock-a-buy-now/?source=iedfolrf0000001,
Motley,"History Says the Nasdaq Will Soar: 2 Brilliant IPO Stocks to Buy Before 2026, According to Wall Street",https://www.fool.com/investing/2025/11/17/nasdaq-will-soar-2-ipo-stocks-buy-2026-wall-street/?source=iedfolrf0000001,
