feed,title,long_url,short_url
InsiderMonkey,"Via Transportation, Inc. (NYSE:VIA) Q3 2025 Earnings Call Transcript",https://insidermonkey.com/blog/--1646725,
InsiderMonkey,Innoviz Technologies Ltd. (NASDAQ:INVZW) Q3 2025 Earnings Call Transcript,https://insidermonkey.com/blog/--1646724,
InsiderMonkey,Gogoro Inc. (NASDAQ:GGROW) Q3 2025 Earnings Call Transcript,https://insidermonkey.com/blog/--1646723,
InsiderMonkey,"“It’s Been a Bust,” Says Jim Cramer About StubHub (STUB)",https://insidermonkey.com/blog/--1646681,
InsiderMonkey,"Applied Materials (AMAT) Was Disappointing, Says Jim Cramer",https://insidermonkey.com/blog/--1646683,
InsiderMonkey,“What is This Company?” Wonders Jim Cramer About Bitdeer (BTDR),https://insidermonkey.com/blog/--1646361,
InsiderMonkey,Jim Cramer’s Must Read Comments About Oracle (ORCL) & OpenAI,https://insidermonkey.com/blog/--1646679,
InsiderMonkey,Jim Cramer Discusses NVIDIA (NVDA) Ahead Of Earnings,https://insidermonkey.com/blog/--1646682,
InsiderMonkey,"CoreWeave (CRWV) CEO’s Comments Were “Jarring,” Says Jim Cramer",https://insidermonkey.com/blog/--1646684,
InsiderMonkey,"Alphabet (GOOGL)’s a Serious Company “That You Want to Buy,” Says Jim Cramer",https://insidermonkey.com/blog/--1646685,
InsiderMonkey,"I’ll Feel Great About Walmart (WMT)’s New CEO When I Meet Him, Says Jim Cramer",https://insidermonkey.com/blog/--1646686,
InsiderMonkey,"Costco (COST)’s A Big Position in My Trust, Says Jim Cramer",https://insidermonkey.com/blog/--1646687,
InsiderMonkey,Jim Cramer Comments On Tesla (TSLA)’s Share Price Drop,https://insidermonkey.com/blog/--1646680,
