feed,title,long_url,short_url
Yahoo,Daily – Vickers Top Insider Picks for 06/26/2023,https://finance.yahoo.com/research/reports/ARGUS_36865_InsiderActivity_1687776068000?yptr=yahoo&ncid=yahooproperties_plusresear_nm5q6ze1cei,https://da.gd/norc
Yahoo,Analysts Are Almost 100% Certain You Should Buy These 10 Stocks,https://www.investors.com/etfs-and-funds/sectors/sp500-analysts-are-almost-100-certain-you-should-buy-these-10-stocks/?src=A00220&yptr=yahoo,https://da.gd/Drue
Yahoo,Dow Jones Futures Dip After Last Week's Losses; Tesla Stock Slides On Another Downgrade,https://www.investors.com/market-trend/stock-market-today/dow-jones-futures-stock-market-losses-tesla-stock-slides-on-downgrade/?src=A00220&yptr=yahoo,https://da.gd/48ffao
Yahoo,Dow Jones Futures Dip After Last Week's Losses; Tesla Stock Slides On Another Downgrade,https://finance.yahoo.com/m/98ffd75b-4d44-3c74-9c68-ead5f10f0871/dow-jones-futures-dip-after.html?.tsrc=rss,https://da.gd/D12haj
Yahoo,Does This Move by Rivian Spell Desperation?,https://finance.yahoo.com/m/cf914f74-b8be-3fac-95ef-09dd8aa6431d/does-this-move-by-rivian.html?.tsrc=rss,https://da.gd/WZuP
Yahoo,This Big Cathie Wood Stock Is Outperforming Even Tesla,https://finance.yahoo.com/m/10f70888-b3e3-3d62-8777-3a2b48148ab7/this-big-cathie-wood-stock-is.html?.tsrc=rss,https://da.gd/vPyx
Yahoo,5 Things to Know Before Markets Open,https://finance.yahoo.com/m/dd43a526-c8cd-3b8f-b597-754e8544422a/5-things-to-know-before.html?.tsrc=rss,https://da.gd/MZ633s
Yahoo,"Russian turmoil, Tesla, German Ifo - what's moving markets",https://finance.yahoo.com/news/russian-turmoil-tesla-german-ifo-052653769.html?.tsrc=rss,https://da.gd/Z1Km
