feed,title,long_url,short_url
InvestorPlace,Is the Stock Market Closed on the Fourth of July 2023?,https://investorplace.com/2023/06/is-the-stock-market-closed-on-the-fourth-of-july-2023/,https://da.gd/Kk1dAs
InvestorPlace,Tencent Cut Its Stake in Nio (NIO) Stock by 25%,https://investorplace.com/2023/06/tencent-cut-its-stake-in-nio-nio-stock-by-25/,https://da.gd/KWej
InvestorPlace,"Is the Stock Market Closed on July 3, 2023?",https://investorplace.com/2023/06/is-the-stock-market-closed-on-july-3-2023/,https://da.gd/2KVfo
InvestorPlace,Why Is PacWest (PACW) Stock Up Today?,https://investorplace.com/2023/06/why-is-pacwest-pacw-stock-up-today/,https://da.gd/GDH2P
InvestorPlace,AI Stock Spotlight: Is Palantir’s Recent Drop a Warning or an Opportunity?,https://investorplace.com/2023/06/all-the-ai-excitement-priced-into-pltr-stock-already/,https://da.gd/eQ2f6
InvestorPlace,Insiders Promise Not to Sell AMTD Digital (HKD) Stock Until 2025,https://investorplace.com/2023/06/insiders-promise-not-to-sell-amtd-digital-hkd-stock-until-2025/,https://da.gd/MGlXQb
InvestorPlace,Why Is Aston Martin (ARGGY) Stock Up Today?,https://investorplace.com/2023/06/why-is-aston-martin-arggy-stock-up-today/,https://da.gd/Yv8snn
InvestorPlace,Why Is FibroGen (FGEN) Stock Down 81% Today?,https://investorplace.com/2023/06/why-is-fibrogen-fgen-stock-down-81-today/,https://da.gd/b1zqM
InvestorPlace,Why Is MoonLake Immunotherapeutics (MLTX) Stock Up 93% Today?,https://investorplace.com/2023/06/why-is-moonlake-immunotherapeutics-mltx-stock-up-93-today/,https://da.gd/nbNGqd
