feed,title,long_url,short_url
Benzinga,Analyzing Bed Bath & Beyond's Unusual Options Activity,https://benzinga.com/markets/options/21/06/21746942/analyzing-bed-bath-beyonds-unusual-options-activity,https://j.mp/3dprA6e
Benzinga,Unusual Options Activity Insight: BlackBerry,https://benzinga.com/markets/options/21/06/21746940/unusual-options-activity-insight-blackberry,https://j.mp/2ThcLvR
Benzinga,Unusual Options Activity Insight: Bank of America,https://benzinga.com/markets/options/21/06/21746936/unusual-options-activity-insight-bank-of-america,https://j.mp/3dFzrNt
Benzinga,Logistics Decision-Making Backed by Data Science: 4 Keys to Success,https://benzinga.com/markets/commodities/21/06/21744007/logistics-decision-making-backed-by-data-science-4-keys-to-success,https://j.mp/3w3Akpl
Benzinga,Understanding Alibaba Group Holding's Unusual Options Activity,https://benzinga.com/markets/options/21/06/21746933/understanding-alibaba-group-holdings-unusual-options-activity,https://j.mp/3y2GVBS
Benzinga,Unusual Options Activity Insight: Boeing,https://benzinga.com/markets/options/21/06/21746932/unusual-options-activity-insight-boeing,https://j.mp/35V5UuI
Benzinga,Unusual Options Activity Insight: Atossa Therapeutics,https://benzinga.com/markets/options/21/06/21746923/unusual-options-activity-insight-atossa-therapeutics,https://j.mp/3jlG3E5
Benzinga,Unusual Options Activity Insight: ARK Innovation ETF,https://benzinga.com/markets/options/21/06/21746912/unusual-options-activity-insight-ark-innovation-etf,https://j.mp/3jpZjjQ
Benzinga,Understanding Advanced Micro Devices's Unusual Options Activity,https://benzinga.com/markets/options/21/06/21746908/understanding-advanced-micro-devicess-unusual-options-activity,https://j.mp/3gXlrR4
Benzinga,Analyzing AMC Entertainment's Unusual Options Activity,https://benzinga.com/markets/options/21/06/21746905/analyzing-amc-entertainments-unusual-options-activity,https://j.mp/3qvdllP
Benzinga,US Class I Rail Headcount Sees Modest Gains In May,https://benzinga.com/markets/commodities/21/06/21745402/us-class-i-rail-headcount-sees-modest-gains-in-may,https://j.mp/3hb0XmU
Benzinga,Understanding Adobe's Unusual Options Activity,https://benzinga.com/markets/options/21/06/21746898/understanding-adobes-unusual-options-activity,https://j.mp/3dFzsRx
