feed,title,long_url,short_url
Investing,"Russia says analysing Western sanctions, will act in its interests",https://www.investing.com/news/commodities-news/russia-says-analysing-western-sanctions-will-act-in-its-interests-93CH-4307017,
Investing,Oreo-maker Mondelez to use new generative AI tool to slash marketing costs,https://www.investing.com/news/stock-market-news/oreomaker-mondelez-to-use-new-generative-ai-tool-to-slash-marketing-costs-4307008,
Investing,"Lufthansa pilot pension talks stall, union to consider next steps",https://www.investing.com/news/stock-market-news/lufthansa-pilot-pension-talks-stall-union-to-consider-next-steps-93CH-4307034,
Investing,Wendel enters exclusive talks to acquire 56% stake in Committed Advisors,https://www.investing.com/news/stock-market-news/wendel-enters-exclusive-talks-to-acquire-56-stake-in-committed-advisors-93CH-4307019,
Investing,Tinder owner Match says Apple fee will stifle growth in India,https://www.investing.com/news/stock-market-news/tinder-owner-match-says-apple-fee-will-stifle-growth-in-india-4307016,
Investing,BofA’s Hartnett says stay long gold as hedge against U.S. boom and dollar risk,https://www.investing.com/news/stock-market-news/bofas-hartnett-says-stay-long-gold-as-hedge-against-us-boom-and-dollar-risk-4307013,
Investing,Blackstone among firms eyeing UnitedHealth’s Optum UK unit - report,https://www.investing.com/news/stock-market-news/blackstone-among-firms-eyeing-unitedhealths-optum-uk-unit--report-93CH-4307007,
Investing,IBM runs quantum computing algorithm on standard AMD chips,https://www.investing.com/news/stock-market-news/ibm-runs-quantum-computing-algorithm-on-standard-amd-chips-93CH-4307005,
Investing,Tourists gawk and recoil at Trump’s destruction of the White House East Wing,https://www.investing.com/news/stock-market-news/tourists-gawk-and-recoil-at-trumps-destruction-of-the-white-house-east-wing-4306998,
Investing,US government shutdown will inflict temporary pain to economy,https://www.investing.com/news/economic-indicators/us-government-shutdown-will-inflict-temporary-pain-to-economy-4307004,
Investing,"US blocks WTO proposal to fill Appellate Body vacancies for 91st time, says trade official",https://www.investing.com/news/economy-news/us-blocks-wto-proposal-to-fill-appellate-body-vacancies-for-91st-time-says-trade-official-4307040,
Investing,Retirees on the edge: Argentina’s protesting pensioners,https://www.investing.com/news/economy-news/retirees-on-the-edge-argentinas-protesting-pensioners-4307035,
