feed,title,long_url,short_url
SeekingAlpha,"Tivic Health Systems GAAP EPS of -$0.23, revenue of $0.43M",https://seekingalpha.com/news/3839246,
SeekingAlpha,Taiga Motors reports Q1 results,https://seekingalpha.com/news/3839245,
SeekingAlpha,Blue Star Foods reports Q1 results,https://seekingalpha.com/news/3839244,
SeekingAlpha,Weatherford International CFO Keith Jennings to resign,https://seekingalpha.com/news/3839243,
SeekingAlpha,Mill City Ventures III reports Q1 results,https://seekingalpha.com/news/3839242,
