feed,title,long_url,short_url
SeekingAlpha,"Gain Therapeutics GAAP EPS of -$0.28 beats by $0.09, revenue of $0.05M beats by $0.01M",https://seekingalpha.com/news/3839546,
SeekingAlpha,"AST SpaceMobile GAAP EPS of -$0.21, revenue of $2.39M",https://seekingalpha.com/news/3839544,
SeekingAlpha,"Angion Biomedica GAAP EPS of -$0.48 misses by $0.05, revenue of $1.65M beats by $0.73M",https://seekingalpha.com/news/3839543,
SeekingAlpha,UGI Corp. commits to $70M funding for South Dakota renewable nat gas project,https://seekingalpha.com/news/3839547,
SeekingAlpha,Ampio Pharmaceuticals GAAP EPS of -$0.03 misses by $0.01,https://seekingalpha.com/news/3839542,
SeekingAlpha,"Unrivaled Brands GAAP EPS of -$0.02, revenue of $20.73M",https://seekingalpha.com/news/3839541,
