feed,title,long_url,short_url
Benzinga,What Are Whales Doing With Plug Power,https://benzinga.com/markets/options/22/05/27236130/what-are-whales-doing-with-plug-power,https://bit.ly/38qnFak
Benzinga,Salesforce Whale Trades Spotted,https://benzinga.com/markets/options/22/05/27234636/salesforce-whale-trades-spotted,https://bit.ly/3wyIwjs
Benzinga,Check Out What Whales Are Doing With ADBE,https://benzinga.com/markets/options/22/05/27234619/check-out-what-whales-are-doing-with-adbe,https://bit.ly/3LhXHmz
Benzinga,Affirm Holdings Whale Trades Spotted,https://benzinga.com/markets/options/22/05/27234578/affirm-holdings-whale-trades-spotted,https://bit.ly/3LlqYNk
Benzinga,Want To Buy Crypto? Check Out The Top Movers For Today,https://benzinga.com/markets/cryptocurrency/22/05/27234513/want-to-buy-crypto-check-out-the-top-movers-for-today,https://bit.ly/3yNUacW
Benzinga,What Are Whales Doing With Palantir Technologies,https://benzinga.com/markets/options/22/05/27233658/what-are-whales-doing-with-palantir-technologies,https://bit.ly/3wi7www
Benzinga,This Is What Whales Are Betting On Ford Motor,https://benzinga.com/markets/options/22/05/27233651/this-is-what-whales-are-betting-on-ford-motor,https://bit.ly/3yGw1oD
Benzinga,Check Out What Whales Are Doing With AMAT,https://benzinga.com/markets/options/22/05/27233648/check-out-what-whales-are-doing-with-amat,https://bit.ly/3Ppy9as
