feed,title,long_url,short_url
SeekingAlpha,"Dawson Geophysical GAAP EPS of -$0.10, revenue of $18.36M",https://seekingalpha.com/news/3839616,
SeekingAlpha,Firsthand Technology Value Fund reports Q1 results,https://seekingalpha.com/news/3839615,
SeekingAlpha,"Nu Holdings Adj. net income of $10.1M, revenue of $877.2M beats by $223.76M",https://seekingalpha.com/news/3839614,
SeekingAlpha,"Land & Buildings takes new stakes in Alexandria Real Estate, WeWork",https://seekingalpha.com/news/3839613,
SeekingAlpha,"Autoscope Technologies GAAP EPS of $0.00, revenue of $2.75M",https://seekingalpha.com/news/3839612,
