feed,title,long_url,short_url
SeekingAlpha,"Builder sentiment dips in September, trailing consensus",https://seekingalpha.com/news/4012692,
SeekingAlpha,Simply Good Foods rallies after Morgan Stanley calls out upside,https://seekingalpha.com/news/4012691,
SeekingAlpha,"CARA, AVGR and KA among healthcare movers",https://seekingalpha.com/news/4012690,
SeekingAlpha,"Nexstar Media reaches new distribution agreement with DirecTV, ending months-long battle",https://seekingalpha.com/news/4012689,
SeekingAlpha,Invesco BulletShares 2023 Corporate Bond ETF declares monthly distribution of $0.0772,https://seekingalpha.com/news/4012687,
SeekingAlpha,What Is A Golden Cross?,https://seekingalpha.com/article/4635467,
SeekingAlpha,SolarEdge Technologies: An Even Better Entry Point,https://seekingalpha.com/article/4635761,
