feed,title,long_url,short_url
Yahoo,Tim Cook says Apple is building AI into ‘every product’ amid questions over its plans,https://www.independent.co.uk/tech/apple-ai-artificial-intelligence-tim-cook-iphone-b2387879.html?.tsrc=rss,https://da.gd/eAVjf7
Yahoo,Amazon’s Big Quarter Drives Gains in Snowflake and Other Cloud Software Stocks,https://finance.yahoo.com/m/92bc93ea-16fe-3e21-984a-6980d454717b/amazon%E2%80%99s-big-quarter-drives.html?.tsrc=rss,https://da.gd/dipjS
Yahoo,4 Signs You're Throwing Money Away on Walmart+,https://finance.yahoo.com/m/192efcb9-10c6-3f56-a256-053e2bd673a4/4-signs-you%27re-throwing-money.html?.tsrc=rss,https://da.gd/bsDnqD
Yahoo,"Apple Stock Lacks Catalysts, Says Analyst. U.S. Slowdown ‘Likely to Last.’",https://finance.yahoo.com/m/a3cb45af-f9a3-3cc7-852a-f8063bc604df/apple-stock-lacks-catalysts%2C.html?.tsrc=rss,https://da.gd/120ez9
Yahoo,"Markets Higher Midday After Upbeat Earnings, July Jobs Report",https://finance.yahoo.com/m/fc8ba2a2-9166-371d-abba-6ee850cfcecf/markets-higher-midday-after.html?.tsrc=rss,https://da.gd/qT9xk
Yahoo,Is Amazon.com Inc (AMZN) a Modestly Undervalued Gem?,https://finance.yahoo.com/news/amazon-com-inc-amzn-modestly-163346896.html?.tsrc=rss,https://da.gd/RO2LkH
Yahoo,ETFs in Focus Post Apple's Q3 Earnings and Revenue Beat,https://finance.yahoo.com/news/etfs-focus-post-apples-q3-150000425.html?.tsrc=rss,https://da.gd/HgMQH
