feed,title,long_url,short_url
SeekingAlpha,"Janus International Non-GAAP EPS of $0.22 in-line, revenue of $279.7M beats by $18.91M",https://seekingalpha.com/news/3948075,
SeekingAlpha,First Republic Bank plunges amid report it's evaluating possible sale,https://seekingalpha.com/news/3948074,
SeekingAlpha,Evelo Biosciences GAAP EPS of -$0.21 beats by $0.07,https://seekingalpha.com/news/3948073,
SeekingAlpha,"Apyx Medical GAAP EPS of -$0.17 misses by $0.03, revenue of $12.61M misses by $0.43M",https://seekingalpha.com/news/3948072,
SeekingAlpha,Iterum Therapeutics Non-GAAP EPS of -$0.52 beats by $0.63,https://seekingalpha.com/news/3948071,
SeekingAlpha,"Children's Place Retail Stores Non-GAAP EPS of -$3.87 beats by $0.22, revenue of $456.1M beats by $0.76M",https://seekingalpha.com/news/3948070,
SeekingAlpha,"Honest Company GAAP EPS of -$0.14 misses by $0.10, revenue of $81.86M beats by $1M",https://seekingalpha.com/news/3948069,
