feed,title,long_url,short_url
Benzinga,Elon Musk Building Texas 'Utopia' for SpaceX and Boring Company Employees,https://benzinga.com/news/23/03/31383759/elon-musk-building-texas-utopia-for-spacex-and-boring-company-employees,https://da.gd/34e64l
Benzinga,Alzheimer's Association Launches Grassroots Level Lobbying For Medicare Coverage Of Alzheimer's Treatments,https://benzinga.com/general/biotech/23/03/31380813/alzheimers-association-launches-grassroots-level-lobbying-for-medicare-coverage-of-alzheimers-tre,https://da.gd/PCafXU
Benzinga,"$1000 Invested In This Stock 5 Years Ago Would Be Worth $3,700 Today",https://benzinga.com/news/earnings/23/03/31383721/1000-invested-in-this-stock-5-years-ago-would-be-worth-3-700-today,https://da.gd/ib8HA3
Benzinga,"$1000 Invested In This Stock 5 Years Ago Would Be Worth $2,200 Today",https://benzinga.com/news/earnings/23/03/31383718/1000-invested-in-this-stock-5-years-ago-would-be-worth-2-200-today,https://da.gd/e619R
Benzinga,P/E Ratio Insights for Baidu,https://benzinga.com/news/23/03/31383715/pe-ratio-insights-for-baidu,https://da.gd/P1FzX
