feed,title,long_url,short_url
FXEmpire,Austrian central bank sees growing risks from mortgages amid property boom,https://www.fxempire.com/news/article/austrian-central-bank-sees-growing-risks-from-mortgages-amid-property-boom-819153,https://j.mp/3cZmayx
FXEmpire,"German business morale darkens on supply bottlenecks, COVID",https://www.fxempire.com/news/article/german-business-morale-darkens-on-supply-bottlenecks-covid-819159,https://j.mp/3CR1seq
FXEmpire,Swedish parliament confirms Social Democrat leader Andersson as new PM,https://www.fxempire.com/news/article/swedish-parliament-confirms-social-democrat-leader-andersson-as-new-pm-819152,https://j.mp/2ZgKOHo
FXEmpire,"Bahrain’s $30 billion strategic projects plan includes offshore cities, metro",https://www.fxempire.com/news/article/bahrains-30-billion-strategic-projects-plan-includes-offshore-cities-metro-819150,https://j.mp/3DN8dze
FXEmpire,ByteDance plans to spin off real estate listing business,https://www.fxempire.com/news/article/bytedance-plans-to-spin-off-real-estate-listing-business-819151,https://j.mp/3xjdj3J
FXEmpire,"Singapore, Malaysia to open land border for vaccinated travelers",https://www.fxempire.com/news/article/singapore-malaysia-to-open-land-border-for-vaccinated-travelers-819157,https://j.mp/3FK6QSE
FXEmpire,Oil stocks help European shares rebound from four-day losing streak,https://www.fxempire.com/news/article/oil-stocks-help-european-shares-rebound-from-four-day-losing-streak-819160,https://j.mp/30X1aW3
