feed,title,long_url,short_url
SeekingAlpha,Midwest Energy Emissions reports Q3 results,https://seekingalpha.com/news/4039103,
SeekingAlpha,Esports Entertainment Group reports Q1 results,https://seekingalpha.com/news/4039102,
SeekingAlpha,Clearmind Medicine announces 1-for-30 reverse share split,https://seekingalpha.com/news/4039101,
SeekingAlpha,Accel Entertainment director cuts indirect holding to 0,https://seekingalpha.com/news/4039100,
SeekingAlpha,"Gamer Pakistan up 19%, approves $1M buyback",https://seekingalpha.com/news/4039099,
