feed,title,long_url,short_url
Investing,"CryptoAutos Acquires $20M Rental Fleet in Dubai, Advancing Real-World Asset (RWA) Adoption",https://www.investing.com/news/cryptocurrency-news/cryptoautos-acquires-20m-rental-fleet-in-dubai-advancing-realworld-asset-rwa-adoption-3875188,https://da.gd/nTWe
Investing,Singularity Finance CEO Joins US Senate Roundtable to Discuss Crypto Legitimisation and AI Innovation,https://www.investing.com/news/cryptocurrency-news/singularity-finance-ceo-joins-us-senate-roundtable-to-discuss-crypto-legitimisation-and-ai-innovation-3875187,https://da.gd/FQgsZ
Investing,Denmark stocks higher at close of trade; OMX Copenhagen 20 up 2.24%,https://www.investing.com/news/stock-market-news/denmark-stocks-higher-at-close-of-trade-omx-copenhagen-20-up-224-3875196,https://da.gd/We6ax8
Investing,Johnson & Johnson restarts limited U.S. release of VARIPULSE™,https://www.investing.com/news/stock-market-news/johnson--johnson-restarts-limited-us-release-of-varipulse-93CH-3875185,https://da.gd/DmrPK2
Investing,BofA double downgrades Leslie’s on weak free cash flow,https://www.investing.com/news/stock-market-news/bofa-downgrades-leslies-on-weak-free-cash-flow-3875184,https://da.gd/PbpVC4
Investing,Ukraine's bonds face largest daily loss in months as ceasefire optimism fades,https://www.investing.com/news/stock-market-news/ukraines-bonds-face-largest-daily-loss-in-months-as-ceasefire-optimism-fades-3875183,https://da.gd/NBbW
Investing,"JELD-WEN stock tumbles on weak results, outlook",https://www.investing.com/news/stock-market-news/jeldwen-stock-tumbles-on-weak-results-outlook-93CH-3875179,https://da.gd/zFZRlx
Investing,ECB extends work from home policy even as others reverse course,https://www.investing.com/news/economy-news/ecb-extends-work-from-home-policy-even-as-others-reverse-course-3875189,https://da.gd/ZxNmY8
