feed,title,long_url,short_url
SeekingAlpha,Sabina Gold & Silver reports Q1 results,https://seekingalpha.com/news/3697063,
SeekingAlpha,Zions Bancorporation cut to Underperform at Baird on weak setup for valuations,https://seekingalpha.com/news/3697062,
SeekingAlpha,Battalion Oil reports Q1 results,https://seekingalpha.com/news/3697061,
SeekingAlpha,TC Energy CFO Marchand set to retire; Hunter to assume role,https://seekingalpha.com/news/3697060,
SeekingAlpha,Gracell Biotechnologies EPS beats by $0.16,https://seekingalpha.com/news/3697059,
