feed,title,long_url,short_url
Investing,"Brad Garlinghouse Reveals What's Happening to $125 Million SEC Fine, XRP Bulls Got Confirmation They've Been Waiting For, $578,646,289 Bitcoin Withdrawal Stuns Kraken: Crypto News Digest by U.Today",https://www.investing.com/news/cryptocurrency-news/brad-garlinghouse-reveals-whats-happening-to-125-million-sec-fine-xrp-bulls-got-confirmation-theyve-been-waiting-for-578646289-bitcoin-withdrawal-stuns-kraken-crypto-news-digest-by-utoday-3984336,https://da.gd/UVw9UI
Investing,Webull stock soars on SPAC merger completion,https://www.investing.com/news/stock-market-news/webull-stock-soars-on-spac-merger-completion-93CH-3984335,https://da.gd/4Ywond
Investing,US State Dept approves potential sale of Eitan PowerPack engines to Israel,https://www.investing.com/news/stock-market-news/us-state-dept-approves-potential-sale-of-eitan-powerpack-engines-to-israel-3984328,https://da.gd/Qphrz
Investing,"Trump administration wants to halve State Dept budget, slash foreign aid 75%",https://www.investing.com/news/economy-news/trump-administration-wants-to-halve-state-dept-budget-slash-foreign-aid-75-3984333,https://da.gd/zaGsT
Investing,Trump administration eyes major State Department budget cuts in fiscal 2026 - Reuters,https://www.investing.com/news/economy-news/trump-administration-eyes-major-state-department-budget-cuts-in-fiscal-2026--reuters-93CH-3984330,https://da.gd/CXKiq
Investing,Manitoba to redirect hydro exports from U.S. for local projects - CBC,https://www.investing.com/news/economy-news/manitoba-to-redirect-hydro-exports-from-us-for-local-projects--cbc-93CH-3984325,https://da.gd/upcmCZ
