feed,title,long_url,short_url
Investing,GM's second-quarter US auto sales rise 7%,https://www.investing.com/news/stock-market-news/gms-secondquarter-us-auto-sales-rise-7-4119736,
Investing,Turkey stocks higher at close of trade; BIST 100 up 1.33%,https://www.investing.com/news/stock-market-news/turkey-stocks-higher-at-close-of-trade-bist-100-up-133-4119734,
Investing,Packaging Corp of America stock surges after $1.8 billion Greif deal,https://www.investing.com/news/stock-market-news/packaging-corp-of-america-stock-surges-after-18-billion-greif-deal-93CH-4119733,
Investing,Denmark stocks lower at close of trade; OMX Copenhagen 20 down 0.19%,https://www.investing.com/news/stock-market-news/denmark-stocks-lower-at-close-of-trade-omx-copenhagen-20-down-019-4119730,
Investing,"Surge AI seeks $1 billion in funding, targets $15 billion valuation - Reuters",https://www.investing.com/news/stock-market-news/surge-ai-seeks-1-billion-in-funding-targets-15-billion-valuation--reuters-93CH-4119726,
Investing,"Exclusive-Scale AI's bigger rival Surge AI seeks up to $1 billion capital raise, sources say",https://www.investing.com/news/stock-market-news/exclusivescale-ais-bigger-rival-surge-ai-seeks-up-to-1-billion-capital-raise-sources-say-4119718,
Investing,Mexico remittances dip 5% in May as US mulls tax,https://www.investing.com/news/economic-indicators/mexico-remittances-dip-5-in-may-as-us-mulls-tax-4119719,
Investing,Bessent says US trade deal with India is very close,https://www.investing.com/news/economic-indicators/bessent-says-us-trade-deal-with-india-is-very-close-4119717,
