feed,title,long_url,short_url
Investing,Wood Mackenzie sees challenges meeting gas power demand over next 15 years,https://www.investing.com/news/commodities-news/wood-mackenzie-sees-challenges-meeting-gas-power-demand-over-next-15-years-4045927,https://da.gd/074tp
Investing,"Aeva sells 6% stake and inks manufacturing deal, shares rise",https://www.investing.com/news/stock-market-news/aeva-sells-6-stake-and-inks-manufacturing-deal-shares-rise-4045944,https://da.gd/aA6KR0
Investing,Altria Group's rating gets a boost from S&P Global Ratings,https://www.investing.com/news/stock-market-news/altria-groups-rating-gets-a-boost-from-sp-global-ratings-93CH-4045942,https://da.gd/5Czlt
Investing,Townsquare Media's outlook revised to negative by S&P Global Ratings,https://www.investing.com/news/stock-market-news/townsquare-medias-outlook-revised-to-negative-by-sp-global-ratings-93CH-4045941,https://da.gd/4aXhh
Investing,"Allspring outlook revised to stable, leverage lowered to 4.4x: S&P Global Ratings",https://www.investing.com/news/stock-market-news/allspring-outlook-revised-to-stable-leverage-lowered-to-44x-sp-global-ratings-93CH-4045940,https://da.gd/b2TIo1
Investing,Matthews International rating downgraded to 'B+' by S&P Global Ratings,https://www.investing.com/news/stock-market-news/matthews-international-rating-downgraded-to-b-by-sp-global-ratings-93CH-4045939,https://da.gd/IRzDEj
Investing,Murphy Oil outlook downgraded to negative by S&P Global Ratings,https://www.investing.com/news/stock-market-news/murphy-oil-outlook-downgraded-to-negative-by-sp-global-ratings-93CH-4045938,https://da.gd/DTPYOB
Investing,Leslie's Poolmart Inc. credit rating downgraded at S&P amid weaker business prospects,https://www.investing.com/news/stock-market-news/leslies-poolmart-inc-credit-rating-downgraded-at-sp-amid-weaker-business-prospects-93CH-4045937,https://da.gd/9PzXFF
Investing,Netflix says ad-supported service has 94 million subscribers,https://www.investing.com/news/stock-market-news/netflix-says-adsupported-service-has-94-million-subscribers-4045933,https://da.gd/f6vYxY
