feed,title,long_url,short_url
TheStreet,Here's How Much Elizabeth Holmes Is Spending Before Jail,https://www.thestreet.com/biotech/heres-how-much-elizabeth-holmes-is-spending-before-jail,https://da.gd/JDbAkU
TheStreet,"TV, Music Star Opening Major Las Vegas Strip Venue",https://www.thestreet.com/travel/blake-shelton-opening-major-las-vegas-strip-venue-ole-red,https://da.gd/wKip
TheStreet,Kellogg Makes Morningstar List of Undervalued Dividend Stocks,https://www.thestreet.com/investing/stocks/kellogg-morningstar-undervalued-dividend-stocks,https://da.gd/UfhueP
TheStreet,Disney World Has a Surprising Offer for 'Star Wars' Fans,https://www.thestreet.com/travel/disney-world-has-a-generous-offer-for-star-wars-fans,https://da.gd/w7Pr
TheStreet,Here's Why the President of Peet's Coffee Is Betting on Cold Drinks,https://www.thestreet.com/restaurants/peets-coffee-president-cold-drinks,https://da.gd/VJpX4a
TheStreet,Delta Airlines Brings Back a Fancy Flight Perk You Probably Don't Know Exists,https://www.thestreet.com/travel/delta-airlines-brings-back-fancy-flight-perk-you-probably-dont-know-exists,https://da.gd/eBxdY
