feed,title,long_url,short_url
Investing,"Meta scraps NFTs on Instagram and Facebook: Nifty Newsletter, March 8–14",https://www.investing.com/news/cryptocurrency-news/meta-scraps-nfts-on-instagram-and-facebook-nifty-newsletter-march-814-3031671,https://da.gd/XLCEE
Investing,LGBTQ advocacy group Human Rights Campaign settles racism lawsuit with ex-leader,https://www.investing.com/news/stock-market-news/lgbtq-advocacy-group-human-rights-campaign-settles-racism-lawsuit-with-exleader-3031672,https://da.gd/5Dfb9
Investing,"After-hours movers: Esperion sinks on Daiichi Sankyo dispute, Adobe gains on EPS",https://www.investing.com/news/stock-market-news/afterhours-movers-esperion-sinks-on-daiichi-sankyo-dispute-adobe-gains-on-eps-432SI-3031668,https://da.gd/0lPRY
Investing,"Five Below reports Q4 beat, shares drop 4% on dull outlook",https://www.investing.com/news/stock-market-news/five-below-reports-q4-beat-shares-drop-4-on-dull-outlook-432SI-3031662,https://da.gd/E1CLn
Investing,Americans are wary of bailouts as banking concerns mount -Reuters/Ipsos Poll,https://www.investing.com/news/stock-market-news/americans-are-wary-of-bailouts-as-banking-concerns-mount-reutersipsos-poll,https://da.gd/3Mzu3
