feed,title,long_url,short_url
SeekingAlpha,"Enterprise Financial Services EPS misses by $0.05, beats on revenue",https://seekingalpha.com/news/3719274,
SeekingAlpha,"Agile Therapeutics EPS beats by $0.01, misses on revenue",https://seekingalpha.com/news/3719273,
SeekingAlpha,"QCR Holdings EPS beats by $0.08, misses on revenue",https://seekingalpha.com/news/3719271,
SeekingAlpha,"F5 Networks EPS beats by $0.30, beats on revenue",https://seekingalpha.com/news/3719270,
SeekingAlpha,"HomeStreet EPS beats by $0.21, misses on revenue",https://seekingalpha.com/news/3719269,
SeekingAlpha,Cerecor shares surge 23% on initial results from early-stage CERC-002 Crohn's disease trial,https://seekingalpha.com/news/3719268,
SeekingAlpha,"Cadence Design Systems EPS beats by $0.10, beats on revenue, guides Q3 above estimates",https://seekingalpha.com/news/3719267,
