feed,title,long_url,short_url
SeekingAlpha,"Ceragon Networks Non-GAAP EPS of $0.04 beats by $0.02, revenue of $83.4M beats by $4.99M",https://seekingalpha.com/news/3962518,
SeekingAlpha,ArcBest stock skids after Bank of America downgrade,https://seekingalpha.com/news/3962517,
SeekingAlpha,"Norwegian Cruise Line Holdings Non-GAAP EPS of -$0.30 beats by $0.13, revenue of $1.82B beats by $80M",https://seekingalpha.com/news/3962516,
SeekingAlpha,"TG Therapeutics GAAP EPS of -$0.28 beats by $0.07, revenue of $7.8M beats by $4.42M",https://seekingalpha.com/news/3962515,
SeekingAlpha,"SJW GAAP EPS of $0.37 beats by $0.15, revenue of $137.3M beats by $5.3M",https://seekingalpha.com/news/3962513,
SeekingAlpha,JPMorgan Chase pays $10.6B to FDIC for First Republic Bank acquisition,https://seekingalpha.com/news/3962512,
