feed,title,long_url,short_url
SeekingAlpha,3D Systems boosts SLS offering with Wematter purchase in Sweden,https://seekingalpha.com/news/3962988,
SeekingAlpha,"Surgery Partners Non-GAAP EPS of $0.08, revenue of $666.2M beats by $9.06M",https://seekingalpha.com/news/3962987,
SeekingAlpha,"Woodward FQ2 results beat estimates, co raises FY 2023 guidance",https://seekingalpha.com/news/3962986,
SeekingAlpha,"Symbotic GAAP EPS of -$0.10 beats by $0.03, revenue of $266.8M beats by $41.98M",https://seekingalpha.com/news/3962985,
SeekingAlpha,"Orient Overseas Limited: Record Profits, But Faces An Uncertain Future",https://seekingalpha.com/article/4598608,
SeekingAlpha,ON Semiconductor: Next Leg Up,https://seekingalpha.com/article/4598607,
