feed,title,long_url,short_url
SeekingAlpha,Commercial Metals Company buys a geogrid manufacturing plant in Oklahoma,https://seekingalpha.com/news/3962995,
SeekingAlpha,"CNO Financial GAAP EPS of -$0.01 misses by $0.62, revenue of $1B beats by $74M",https://seekingalpha.com/news/3962994,
SeekingAlpha,"Kennametal Non-GAAP EPS of $0.47 beats by $0.13, revenue of $536M beats by $5.6M",https://seekingalpha.com/news/3962993,
SeekingAlpha,SPAC Project Energy Reimagined signs merger LOI with unnamed target,https://seekingalpha.com/news/3962992,
SeekingAlpha,"FMC Non-GAAP EPS of $1.77 beats by $0.03, revenue of $1.34B misses by $90M",https://seekingalpha.com/news/3962990,
SeekingAlpha,"Addus HomeCare Non-GAAP EPS of $0.97 beats by $0.06, revenue of $251.6M beats by $0.68M",https://seekingalpha.com/news/3962989,
