feed,title,long_url,short_url
SeekingAlpha,IoT device maker EnOcean terminates merger with SPAC Parabellum,https://seekingalpha.com/news/3963035,
SeekingAlpha,"Instructure GAAP EPS of -$0.08 misses by $0.01, revenue of $128.8M beats by $1.75M",https://seekingalpha.com/news/3963033,
SeekingAlpha,"U.S. government could run out of money, measures by June 1, Yellen tells McCarthy",https://seekingalpha.com/news/3963031,
SeekingAlpha,"Tetra Technologies Q1 results miss estimates, co gives Q2 revenue guidance in-line",https://seekingalpha.com/news/3963029,
SeekingAlpha,SBA Communications raises year outlook after solid quarterly earnings,https://seekingalpha.com/news/3963028,
