feed,title,long_url,short_url
SeekingAlpha,"Exodus Movement, Inc. reports Q4 results",https://seekingalpha.com/news/3963077,
SeekingAlpha,"Integrated Financial Holdings GAAP EPS of $1.04, revenue of $12.25M",https://seekingalpha.com/news/3963076,
SeekingAlpha,Pluribus Technologies reports Q4 results,https://seekingalpha.com/news/3963074,
SeekingAlpha,Pluribus Technologies reports Q4 results,https://seekingalpha.com/news/3963073,
SeekingAlpha,"ScreenPro Security GAAP EPS of -$0.06, revenue of $14M",https://seekingalpha.com/news/3963072,
SeekingAlpha,"Arrow Exploration GAAP EPS of $0.01, revenue of $8.93M",https://seekingalpha.com/news/3963071,
SeekingAlpha,DocuSign: Risk Reward Remains Skewed To The Downside,https://seekingalpha.com/article/4598631,
