feed,title,long_url,short_url
Yahoo,Will Tesla Buyers Pay More for New Technology? One Analyst Isn’t So Sure,https://finance.yahoo.com/m/ce3f1956-71eb-3ce2-a6c6-044c072ede59/will-tesla-buyers-pay-more.html?.tsrc=rss,https://yhoo.it/3qKax5t
Yahoo,This #1 (Strong Buy) Computer and Technology Stock is a Smart Buy Right Now,https://finance.yahoo.com/news/1-strong-buy-computer-technology-134001940.html?.tsrc=rss,https://yhoo.it/3NAHL0W
Yahoo,"This Top Auto, Tires and Trucks Stock is a #1 (Strong Buy): Why It Should Be on Your Radar",https://finance.yahoo.com/news/top-auto-tires-trucks-stock-134001735.html?.tsrc=rss,https://yhoo.it/3ITg6Fh
Yahoo,Is Honda Motor (HMC) Outperforming Other Auto-Tires-Trucks Stocks This Year?,https://finance.yahoo.com/news/honda-motor-hmc-outperforming-other-134001538.html?.tsrc=rss,https://yhoo.it/3IZsPq0
Yahoo,Has Canon (CAJ) Outpaced Other Computer and Technology Stocks This Year?,https://finance.yahoo.com/news/canon-caj-outpaced-other-computer-134001785.html?.tsrc=rss,https://yhoo.it/3tPTe4X
