feed,title,long_url,short_url
SeekingAlpha,Crinetics shows dose-dependent effect of hyperinsulinism candidate in early trial,https://seekingalpha.com/news/3819053,
SeekingAlpha,"Phreesia GAAP EPS of -$0.90 beats by $0.13, revenue of $58.02M beats by $1.68M",https://seekingalpha.com/news/3819052,
SeekingAlpha,Sanara MedTech reports FY results,https://seekingalpha.com/news/3819051,
SeekingAlpha,Visa launches NFT program to let entrepreneurs embrace creator economy: Blockworks,https://seekingalpha.com/news/3819050,
SeekingAlpha,reports Q4 results,https://seekingalpha.com/news/3819049,
SeekingAlpha,Biden tells lawmakers to authorize billions in COVID spending,https://seekingalpha.com/news/3819043,
