feed,title,long_url,short_url
ETFTrends,Rumors of U.S. and China Audit Deal Send Tech Stocks Skyward,https://www.etftrends.com/china-insights-channel/rumors-of-u-s-and-china-audit-deal-send-tech-stocks-skyward/,https://bit.ly/3dQYzU9
ETFTrends,"As Emerging Markets Volatility Dissipates, Reconsider Their Bonds",https://www.etftrends.com/fixed-income-channel/as-emerging-markets-volatility-dissipates-reconsider-their-bonds/,https://bit.ly/3CxYeQO
ETFTrends,RiverFront Investment Group Strategic View 8.23.2022,https://www.etftrends.com/etf-strategist-channel/riverfront-investment-group-strategic-view-8-23-2022/,https://bit.ly/3QPjOob
ETFTrends,These 3 Clean Energy ETFs Are Leading in 4-Week Returns,https://www.etftrends.com/etf-building-blocks-channel/these-3-clean-energy-etfs-are-leading-in-4-week-returns/,https://bit.ly/3QXRUXa
ETFTrends,"Supply Concerns, Demand Uncertainty Could Push This Metals/Mining ETF Higher",https://www.etftrends.com/leveraged-inverse-channel/supply-concerns-demand-uncertainty-could-push-this-metals-mining-etf-higher/,https://bit.ly/3q46bpr
ETFTrends,What’s Past Is Prologue,https://www.etftrends.com/etf-strategist-channel/whats-past-is-prologue/,https://bit.ly/3Cs0k4y
ETFTrends,Tesla Stock Has Split; Get Exposure With These 2 ARK ETFs,https://www.etftrends.com/disruptive-technology-channel/tesla-stock-has-split-get-exposure-with-these-2-ark-etfs/,https://bit.ly/3RsKc7h
ETFTrends,Free Cash Flow Is a Durable Idea,https://www.etftrends.com/free-cash-flow-channel/free-cash-flow-is-a-durable-idea/,https://bit.ly/3CwV3bT
ETFTrends,Pairing ESG With Attractive Market Opportunities,https://www.etftrends.com/esg-channel/pairing-esg-with-attractive-market-opportunities/,https://bit.ly/3pQlv8E
ETFTrends,Depend on DIVS for Inflation-Fighting Potency,https://www.etftrends.com/dividend-channel/depend-on-divs-for-inflation-fighting-potency/,https://bit.ly/3QUJako
ETFTrends,Some QQQ Holdings Are Cheap and Offering Earnings Growth,https://www.etftrends.com/etf-education-channel/some-qqq-holdings-are-cheap-and-offering-earnings-growth/,https://bit.ly/3R9S5hx
ETFTrends,The Inflation Reduction Act Moves the Needle on Green Hydrogen,https://www.etftrends.com/climate-insights-channel/the-inflation-reduction-act-moves-the-needle-on-green-hydrogen/,https://bit.ly/3QXRVuc
