feed,title,long_url,short_url
Yahoo,Brazil reaches deals with airlines to settle tax obligations,https://finance.yahoo.com/news/brazil-reaches-deals-airlines-settle-161831775.html,https://da.gd/Ji8flG
Yahoo,EV Sales Surge 38% For Ford With GM On Deck After Tesla's Stumble,https://www.investors.com/news/ev-sales-q4-2024-auto-sales-gm-ford-tesla-toyota-honda-stellantis/?src=A00220&yptr=yahoo,https://da.gd/rfLOm
Yahoo,U.S. Natural Gas Extends Losses on Below-Estimate Storage Draw,https://www.wsj.com/finance/commodities-futures/european-natural-gas-prices-slip-but-stay-elevated-due-to-cold-weather-forecasts-18a9be13?siteid=yhoof2&yptr=yahoo,https://da.gd/sX87E
Yahoo,Holiday Cattle Trade Pays Off For the 20th Year Running,https://www.wsj.com/livecoverage/stock-market-today-dow-sp500-nasdaq-live-01-03-2025/card/holiday-cattle-trade-pays-off-for-the-20th-year-running-5Gmb1B8tI7Qz9koyoHif?siteid=yhoof2&yptr=yahoo,https://da.gd/uY8AA
Yahoo,U.S. Factory Activity Contracts at Slower Rate Amid Uptick in Demand,https://www.wsj.com/economy/u-s-factory-activity-contracts-at-slower-rate-amid-uptick-in-demand-5fba3e9b?siteid=yhoof2&yptr=yahoo,https://da.gd/Qu4l
Yahoo,"Jobs Report, Fed Minutes, Delta Earnings: What to Watch Next Week",https://www.wsj.com/livecoverage/stock-market-today-dow-sp500-nasdaq-live-01-03-2025/card/jobs-report-fed-minutes-delta-earnings-what-to-watch-next-week-z3MqwvIn3p7T1BJt3Il7?siteid=yhoof2&yptr=yahoo,https://da.gd/8EBcOP
Yahoo,How to Navigate the Stock and Bond Markets in 2025,https://finance.yahoo.com/m/575f39c5-10d1-3e72-9ea6-20dfd26ba435/how-to-navigate-the-stock-and.html?.tsrc=rss,https://da.gd/C5jZGt
