feed,title,long_url,short_url
Investing,Morning Bid: US PCE eyed as China rebound accelerates,https://www.investing.com/news/commodities-news/morning-bid-us-pce-eyed-as-china-rebound-accelerates-3635621,https://da.gd/mfYkd
Investing,US farmers call for vaccine option to fight bird flu as wildfowl migration begins,https://www.investing.com/news/stock-market-news/us-farmers-call-for-vaccine-option-to-fight-bird-flu-as-wildfowl-migration-begins-3635617,https://da.gd/nQvv3
Investing,Europe’s Banks are launching new product to break the Visa/Mastercard dominance,https://www.investing.com/news/stock-market-news/europes-banks-are-launching-new-product-to-break-the-visamastercard-dominance-3635581,https://da.gd/51DrK
Investing,"UK retail sales grow at fastest pace since May, CBI says",https://www.investing.com/news/economic-indicators/uk-retail-sales-grow-at-fastest-pace-since-may-cbi-says-3635645,https://da.gd/9JIp
Investing,Futures slip as investors await key inflation report,https://www.investing.com/news/economy-news/futures-slip-as-investors-await-key-inflation-report-3635623,https://da.gd/eNYss
Investing,"Fed is aligned on rate cuts, but upcoming data will shape the pace",https://www.investing.com/news/economy-news/fed-is-aligned-on-rate-cuts-but-upcoming-data-will-shape-the-pace-3635620,https://da.gd/GNkZR
