feed,title,long_url,short_url
Yahoo,Heard on the Street Thursday Recap: Microsoft in the Clouds,https://www.wsj.com/livecoverage/april-jobs-report-stock-market-trump-tariffs-05-02-2025/card/wsj-heard-on-the-street-thursday-recap-microsoft-in-the-clouds-PEuBWKCoq3Wf5tYY4AcA?siteid=yhoof2&yptr=yahoo,https://da.gd/VRmA0
Yahoo,"Shell profit beats expectations, buybacks kept steady",https://finance.yahoo.com/news/shell-reports-q1-profit-5-060853009.html,https://da.gd/TAr0D
Yahoo,BASF Confirms Outlook But Warns of Tariff Uncertainty,https://www.wsj.com/business/earnings/basf-confirms-outlook-after-sales-miss-profit-beat-16193746?siteid=yhoof2&yptr=yahoo,https://da.gd/ox002
Yahoo,Danske Bank posts profit beat and expects moderate tariff impact in Nordic market,https://finance.yahoo.com/news/danske-banks-q1-net-profit-053628248.html,https://da.gd/SJnZQ
Yahoo,Analysis-BOJ sees window for rate hikes narrowing but not closed yet,https://finance.yahoo.com/news/analysis-boj-sees-window-rate-053212196.html,https://da.gd/1IwX1h
Yahoo,"Wall Street extends its gains to a 9th straight day, reclaiming losses since tariff escalation",https://finance.yahoo.com/news/asian-shares-rise-china-says-044802408.html,https://da.gd/Qdi4j
Yahoo,"Parker-Hannifin Trims Outlook, But CEO Says Firm Ready To Handle Tariff Uncertainty",https://finance.yahoo.com/news/parker-hannifin-trims-outlook-ceo-042855395.html,https://da.gd/m1Cq
Yahoo,"Standard Chartered Posts Profit Growth, Maintains Guidance",https://www.wsj.com/finance/banking/standard-chartereds-quarterly-profit-rises-maintains-guidance-c9a5e086?siteid=yhoof2&yptr=yahoo,https://da.gd/Qne8
Yahoo,NatWest Narrows Guidance After Profit Beat,https://www.wsj.com/business/earnings/natwest-narrows-guidance-after-profit-beat-4a335413?siteid=yhoof2&yptr=yahoo,https://da.gd/LDAhq
Yahoo,"Investors sell U.S. shares in past week flock to Japan, Europe, BofA note shows",https://finance.yahoo.com/news/investors-sell-u-shares-past-081421378.html,https://da.gd/DcuT2m
Yahoo,"Analysis-Amazon sellers are stocking up in the face of tariffs, but it's a short-term fix",https://finance.yahoo.com/news/analysis-amazon-sellers-stocking-face-060305408.html,https://da.gd/P8QxW3
Yahoo,Shell Launches $3.5 Billion Share Buyback After Earnings Beat Expectations,https://www.wsj.com/business/retail/shell-launches-3-5-billion-share-buyback-after-earnings-beat-expectations-98d0df8f?siteid=yhoof2&yptr=yahoo,https://da.gd/SdkXe
