feed,title,long_url,short_url
Motley,IBM Plans to Invest $150 Billion. Time to Buy the Stock?,https://www.fool.com/investing/2025/05/03/ibm-plans-to-invest-150-billion-in-capex-time-to-b/?source=iedfolrf0000001,https://da.gd/Wi9bp
Motley,"The 3 Best Warren Buffett Stocks to Buy With $3,000 Right Now",https://www.fool.com/investing/2025/05/03/the-3-best-warren-buffett-stocks-to-buy-with-3000/?source=iedfolrf0000001,https://da.gd/cdImtK
Motley,Does Seaport Research Know Something the Rest of Wall Street Doesn't? Analysts There Just Gave Nvidia a Sell Rating,https://www.fool.com/investing/2025/05/03/seaport-research-rates-nvidia-sell/?source=iedfolrf0000001,https://da.gd/azeik1
Motley,Should You Buy AGNC Investment While It's Below $10?,https://www.fool.com/investing/2025/05/03/should-you-buy-agnc-investment-while-its-below-10/?source=iedfolrf0000001,https://da.gd/r3zRge
Motley,Prediction: 2 Stocks Will Be Worth More Than Palantir Technologies in 2026,https://www.fool.com/investing/2025/05/03/2-stock-worth-more-than-palantir-stock-by-2026/?source=iedfolrf0000001,https://da.gd/6YbTQ
