feed,title,long_url,short_url
FXEmpire,Moldova pays Gazprom to avert gas cut-off -CEO,https://www.fxempire.com/news/article/moldova-pays-gazprom-to-avert-gas-cut-off-ceo-1145747,https://bit.ly/3fkk947
FXEmpire,China’s Geely takes 7.6% stake in Aston Martin,https://www.fxempire.com/news/article/chinas-geely-takes-7-6-stake-in-aston-martin-1145751,https://bit.ly/3CmFyTy
FXEmpire,Japan’s junior coalition signals tax hike to fund defence spending,https://www.fxempire.com/news/article/japans-junior-coalition-signals-tax-hike-to-fund-defence-spending-1145743,https://bit.ly/3ClRlkK
FXEmpire,Analysis-Eisai’s trial success raises hope for Alzheimer’s prevention,https://www.fxempire.com/news/article/analysis-eisais-trial-success-raises-hope-for-alzheimers-prevention-1145748,https://bit.ly/3fkkbcf
FXEmpire,Liberal Justice Jackson joins a rightward-moving U.S. Supreme Court,https://www.fxempire.com/news/article/liberal-justice-jackson-joins-a-rightward-moving-u-s-supreme-court-1145744,https://bit.ly/3fkk9RF
FXEmpire,Analysis-Turnout key for Lula to clinch Brazil election in first round,https://www.fxempire.com/news/article/analysis-turnout-key-for-lula-to-clinch-brazil-election-in-first-round-1145749,https://bit.ly/3fkkaFd
FXEmpire,Lula vows ‘peace and love’ for polarized Brazil in comeback attempt,https://www.fxempire.com/news/article/lula-vows-peace-and-love-for-polarized-brazil-in-comeback-attempt-1145750,https://bit.ly/3EdSVXc
FXEmpire,Factbox-U.S. Supreme Court to tackle a raft of new cases,https://www.fxempire.com/news/article/factbox-u-s-supreme-court-to-tackle-a-raft-of-new-cases-1145745,https://bit.ly/3rhVT5k
