feed,title,long_url,short_url
Investing,Terra Rebels Release Official Terra Classic (LUNC) Revival Roadmap,https://investing.com/news/-2903023,
Investing,"Indian Enforcement Clamps Down On 8 Chinese Firms, Freezes $6.9M",https://investing.com/news/-2903022,
Investing,Ethereum With Proof-Of-Stake Is a Commodity: CFTC Commissioner,https://investing.com/news/-2903021,
Investing,Bank of America Doesn't Believe Cryptocurrencies and Risk Assets Could Rally Soon,https://investing.com/news/-2903013,
Investing,BlackRock says reducing leverage in LDI funds,https://investing.com/news/-2903030,
Investing,Carnival Corp misses revenue estimates as inflation dampens travel plans,https://investing.com/news/-2903026,
