feed,title,long_url,short_url
InvestorPlace,BTM Stock Earnings: Bitcoin Depot Beats Revenue for Q2 2024,https://investorplace.com/earning-results/2024/08/btm-stock-earnings-bitcoin-depot-for-q2-of-2024/,https://da.gd/pOyVo
InvestorPlace,TTNP Stock Earnings: Titan Pharmaceuticals Reported Results for Q2 2024,https://investorplace.com/earning-results/2024/08/ttnp-stock-earnings-titan-pharmaceuticals-for-q2-of-2024/,https://da.gd/32DGRu
InvestorPlace,KAYS Stock Earnings: Kaya Holdings Reported Results for Q2 2024,https://investorplace.com/earning-results/2024/08/kays-stock-earnings-kaya-holdings-for-q2-of-2024/,https://da.gd/zrPqS
InvestorPlace,AYRO Stock Earnings: AYRO Reported Results for Q2 2024,https://investorplace.com/earning-results/2024/08/ayro-stock-earnings-ayro-for-q2-of-2024/,https://da.gd/2E5Ht
InvestorPlace,LRHC Stock Earnings: La Rosa Holdings Reported Results for Q2 2024,https://investorplace.com/earning-results/2024/08/lrhc-stock-earnings-la-rosa-holdings-for-q2-of-2024/,https://da.gd/yGxwK
InvestorPlace,BLBX Stock Earnings: Blackboxstocks Misses Revenue for Q2 2024,https://investorplace.com/earning-results/2024/08/blbx-stock-earnings-blackboxstocks-for-q2-of-2024/,https://da.gd/tIBXS
InvestorPlace,ALMS Stock Earnings: Alumis Reported Results for Q2 2024,https://investorplace.com/earning-results/2024/08/alms-stock-earnings-alumis-for-q2-of-2024/,https://da.gd/Zq5r2Q
InvestorPlace,NCNA Stock Earnings: NuCana Beats EPS for Q2 2024,https://investorplace.com/earning-results/2024/08/ncna-stock-earnings-nucana-for-q2-of-2024/,https://da.gd/OHAu
InvestorPlace,CLOE Stock Earnings: Clover Leaf Capital Reported Results for Q2 2024,https://investorplace.com/earning-results/2024/08/cloe-stock-earnings-clover-leaf-capital-for-q2-of-2024/,https://da.gd/w0trjx
InvestorPlace,XELA Stock Earnings: Exela Technologies Reported Results for Q2 2024,https://investorplace.com/earning-results/2024/08/xela-stock-earnings-exela-technologies-for-q2-of-2024/,https://da.gd/Vtfv6T
InvestorPlace,CLRO Stock Earnings: ClearOne Reported Results for Q2 2024,https://investorplace.com/earning-results/2024/08/clro-stock-earnings-clearone-for-q2-of-2024/,https://da.gd/Gjz0
InvestorPlace,"USAS Stock Earnings: Americas Gold And Silver Misses EPS, Beats Revenue for Q2 2024",https://investorplace.com/earning-results/2024/08/usas-stock-earnings-americas-gold-and-silver-for-q2-of-2024/,https://da.gd/6KWxFR
InvestorPlace,"ICG Stock Earnings: Intchains Gr Beats EPS, Beats Revenue for Q2 2024",https://investorplace.com/earning-results/2024/08/icg-stock-earnings-intchains-gr-for-q2-of-2024/,https://da.gd/Brsfn
InvestorPlace,"AMAT Stock Earnings: Applied Mat Beats EPS, Beats Revenue for Q3 2024",https://investorplace.com/earning-results/2024/08/amat-stock-earnings-applied-mat-for-q3-of-2024/,https://da.gd/gYJ9r
InvestorPlace,"SHIM Stock Earnings: Shimmick Misses EPS, Misses Revenue for Q2 2024",https://investorplace.com/earning-results/2024/08/shim-stock-earnings-shimmick-for-q2-of-2024/,https://da.gd/XWEe7b
InvestorPlace,"DESP Stock Earnings: Despegar.com Beats EPS, Beats Revenue for Q2 2024",https://investorplace.com/earning-results/2024/08/desp-stock-earnings-despegar-com-for-q2-of-2024/,https://da.gd/SxsX82
InvestorPlace,"HRB Stock Earnings: H&R Block Beats EPS, Beats Revenue for Q4 2024",https://investorplace.com/earning-results/2024/08/hrb-stock-earnings-hr-block-for-q4-of-2024/,https://da.gd/osnRe
InvestorPlace,"COHR Stock Earnings: Coherent Beats EPS, Beats Revenue for Q4 2024",https://investorplace.com/earning-results/2024/08/cohr-stock-earnings-coherent-for-q4-of-2024/,https://da.gd/43kC
InvestorPlace,"AMCR Stock Earnings: Amcor Beats EPS, Misses Revenue for Q4 2024",https://investorplace.com/earning-results/2024/08/amcr-stock-earnings-amcor-for-q4-of-2024/,https://da.gd/qnahD
InvestorPlace,ALVO Stock Earnings: Alvotech Misses Revenue for Q2 2024,https://investorplace.com/earning-results/2024/08/alvo-stock-earnings-alvotech-for-q2-of-2024/,https://da.gd/BFLwQr
InvestorPlace,"GLOB Stock Earnings: Globant Beats EPS, Beats Revenue for Q2 2024",https://investorplace.com/earning-results/2024/08/glob-stock-earnings-globant-for-q2-of-2024/,https://da.gd/uIHRm
InvestorPlace,RNW Stock Earnings: ReNew Energy Glb Misses Revenue for Q1 2025,https://investorplace.com/earning-results/2024/08/rnw-stock-earnings-renew-energy-glb-for-q1-of-2025/,https://da.gd/Bmyy
