feed,title,long_url,short_url
SeekingAlpha,fuboTV acquires exclusive Serie A and Coppa Italia rights for Canada,https://seekingalpha.com/news/3732291,
SeekingAlpha,Comtech Telecom nabs 5G contract with Canadian wireless network operator,https://seekingalpha.com/news/3732290,
SeekingAlpha,180 Life Sciences plummets on $15M private placement,https://seekingalpha.com/news/3732289,
SeekingAlpha,Lantern Pharma shares fall 10% after LP-184 glioblastoma preclinical data,https://seekingalpha.com/news/3732275,
SeekingAlpha,Alset EHome International reports 1H results,https://seekingalpha.com/news/3732288,
SeekingAlpha,Allied signs CBD supply contracts to Australia,https://seekingalpha.com/news/3732287,
SeekingAlpha,Surgalign issued U.S. patent covering use of AI in medical image segmentation,https://seekingalpha.com/news/3732285,
