feed,title,long_url,short_url
Cointelegraph,"Bitcoin miners steamrolled after electricity thefts, exchange ‘closure’ scam: Asia Express",https://cointelegraph.com/magazine/bitcoin-mining-crackdown-epicenters-nft-phishing-scam-asia-express/?utm_source=rss_feed&utm_medium=rss%3F1724374474945&utm_campaign=rss_partner_inbound,https://da.gd/mFHW2y
Cointelegraph,Is it time for Avalanche (AVAX) price to turn bullish?,https://cointelegraph.com/news/is-it-time-for-avalanche-avax-price-to-turn-bullish?utm_source=rss_feed&utm_medium=rss%3F1724374474945&utm_campaign=rss_partner_inbound,https://da.gd/Adebn
Cointelegraph,Kamala Harris campaign may focus on highlighting innovation over crypto,https://cointelegraph.com/news/kamala-harris-campaign-innovation-crypto?utm_source=rss_feed&utm_medium=rss%3F1724374474945&utm_campaign=rss_partner_inbound,https://da.gd/yzFd4g
Cointelegraph,Bitcoin is holding $60K — Here’s why it’s important,https://cointelegraph.com/news/bitcoin-is-holding-60k-here-s-why-its-important?utm_source=rss_feed&utm_medium=rss%3F1724374474945&utm_campaign=rss_partner_inbound,https://da.gd/BPO1w
Cointelegraph,Elon Musk’s Twitter buyout is going so poorly that banks had to issue pay cuts,https://cointelegraph.com/news/elon-musk-twitter-buyout-going-poorly-banks-issue-pay-cuts?utm_source=rss_feed&utm_medium=rss%3F1724374474945&utm_campaign=rss_partner_inbound,https://da.gd/jcRm
Cointelegraph,California DMV putting vehicle titles on a subnet is innovation theater,https://cointelegraph.com/news/california-dmv-vehicle-titles-subnet-innovation-theater?utm_source=rss_feed&utm_medium=rss%3F1724374474945&utm_campaign=rss_partner_inbound,https://da.gd/w7Cw
Cointelegraph,Here’s what happened in crypto today,https://cointelegraph.com/news/what-happened-in-crypto-today?utm_source=rss_feed&utm_medium=rss%3F1724374474945&utm_campaign=rss_partner_inbound,https://da.gd/eddZj
Cointelegraph,Why is the crypto market up today?,https://cointelegraph.com/news/why-is-the-crypto-market-up-today?utm_source=rss_feed&utm_medium=rss%3F1724374474945&utm_campaign=rss_partner_inbound,https://da.gd/MZ8OF
Cointelegraph,Bitcoin exchange inflow has fallen sharply in August — CryptoQuant,https://cointelegraph.com/news/bitcoin-exchange-inflows-drop-significantly-august?utm_source=rss_feed&utm_medium=rss%3F1724374474945&utm_campaign=rss_partner_inbound,https://da.gd/k6fJx
Cointelegraph,Changpeng Zhao moved to custody of field office ahead of Sept release,https://cointelegraph.com/news/changpeng-zhao-moved-prison-facility-september-release?utm_source=rss_feed&utm_medium=rss%3F1724374474945&utm_campaign=rss_partner_inbound,https://da.gd/BXCvXV
Cointelegraph,Mercado Libre launches USD-pegged Meli Dollar stablecoin in Brazil,https://cointelegraph.com/news/mercado-libre-launches-meli-dollar-stablecoin-brazil?utm_source=rss_feed&utm_medium=rss%3F1724374474945&utm_campaign=rss_partner_inbound,https://da.gd/sJCyD
Cointelegraph,HTC launches no-code game creator for ‘Viverse’ metaverse,https://cointelegraph.com/news/htc-launches-no-code-game-creator-viverse-metaverse?utm_source=rss_feed&utm_medium=rss%3F1724374474945&utm_campaign=rss_partner_inbound,https://da.gd/KdJNY
Cointelegraph,Anchorage Digital adds PayPal stablecoin yield to custody platform,https://cointelegraph.com/news/anchorage-adds-paypal-stablecoin-yield-custody-platform?utm_source=rss_feed&utm_medium=rss%3F1724374474945&utm_campaign=rss_partner_inbound,https://da.gd/AJUZP
Cointelegraph,3 reasons why Bitcoin price could hit $68K in September,https://cointelegraph.com/news/3-reasons-why-bitcoin-price-could-hit-68-k-in-september?utm_source=rss_feed&utm_medium=rss%3F1724374474945&utm_campaign=rss_partner_inbound,https://da.gd/2cYjlF
Cointelegraph,Partner of ex-FTX exec hit with campaign finance charges,https://cointelegraph.com/news/ftx-partner-michelle-bond-campaign-finance-charges?utm_source=rss_feed&utm_medium=rss%3F1724374474945&utm_campaign=rss_partner_inbound,https://da.gd/nRh7Zn
Cointelegraph,UK risks quantum startup exodus after Labour slashes incentives,https://cointelegraph.com/news/uk-risks-quantum-computing-startup-exodus-labour-slashes-incentives?utm_source=rss_feed&utm_medium=rss%3F1724374474945&utm_campaign=rss_partner_inbound,https://da.gd/qeKmv6
Cointelegraph,Metaverse pioneer and movie VFX team unite for blockchain project,https://cointelegraph.com/news/lamina1-weta-workshop-metaverse-artefact?utm_source=rss_feed&utm_medium=rss%3F1724374474945&utm_campaign=rss_partner_inbound,https://da.gd/Je2lnT
Cointelegraph,"AI drone ‘hellscape’ plan for Taiwan, LLMs too dumb to destroy humanity: AI Eye",https://cointelegraph.com/magazine/ai-drone-hellscape-plan-for-taiwan-llms-too-dumb-to-destroy-humanity-ai-eye/?utm_source=rss_feed&utm_medium=rss%3F1724374474945&utm_campaign=rss_partner_inbound,https://da.gd/N5Ig
Cointelegraph,Grayscale launches investment fund for AVAX token,https://cointelegraph.com/news/grayscale-launches-investment-fund-avax-token?utm_source=rss_feed&utm_medium=rss%3F1724374474945&utm_campaign=rss_partner_inbound,https://da.gd/DamER
Cointelegraph,Why is the BNB price up today?,https://cointelegraph.com/news/why-is-bnb-price-up-today?utm_source=rss_feed&utm_medium=rss%3F1724374474945&utm_campaign=rss_partner_inbound,https://da.gd/GXlX8x
Cointelegraph,Magic Eden Foundation launches ME token for cross-chain trading,https://cointelegraph.com/news/magic-eden-foundation-launches-me-token-cross-chain-trading?utm_source=rss_feed&utm_medium=rss%3F1724374474945&utm_campaign=rss_partner_inbound,https://da.gd/MMMKWE
Cointelegraph,Compliance experts should help regulate crypto — Silk Road 2.0 founder,https://cointelegraph.com/news/compliance-regulate-crypto-silk-road?utm_source=rss_feed&utm_medium=rss%3F1724374474945&utm_campaign=rss_partner_inbound,https://da.gd/mT4vQ
Cointelegraph,Ocean Nodes Incentive Program delayed for back-end improvements,https://cointelegraph.com/news/ocean-protocol-delays-node-incentive-program?utm_source=rss_feed&utm_medium=rss%3F1724374474945&utm_campaign=rss_partner_inbound,https://da.gd/rgfW
Cointelegraph,Franklin Templeton expands blockchain fund to Avalanche network,https://cointelegraph.com/news/franklin-templeton-onchain-us-money-fund-avalanche-expansion?utm_source=rss_feed&utm_medium=rss%3F1724374474945&utm_campaign=rss_partner_inbound,https://da.gd/okqycY
Cointelegraph,Nearly 80% of hacked cryptocurrencies never recover in price — Immunefi,https://cointelegraph.com/news/crypto-hacks-price-declines-report-2024?utm_source=rss_feed&utm_medium=rss%3F1724374474945&utm_campaign=rss_partner_inbound,https://da.gd/yj7r75
Cointelegraph,India’s crypto future hinges on gov’t consultation paper,https://cointelegraph.com/news/india-crypto-regulation-dea-paper-september?utm_source=rss_feed&utm_medium=rss%3F1724374474945&utm_campaign=rss_partner_inbound,https://da.gd/MvRu6T
Cointelegraph,Hong Kong targets noncompliant crypto exchanges in licensing push,https://cointelegraph.com/news/hong-kong-crypto-exchanges-license-scrutiny?utm_source=rss_feed&utm_medium=rss%3F1724374474945&utm_campaign=rss_partner_inbound,https://da.gd/fxsgS
Cointelegraph,FTX says creditors supported reorganization plan with 95% vote,https://cointelegraph.com/news/ftx-reorganization-plan-gains-creditor-support?utm_source=rss_feed&utm_medium=rss%3F1724374474945&utm_campaign=rss_partner_inbound,https://da.gd/JEuzX
Cointelegraph,Former TON Foundation execs establish new community initiative,https://cointelegraph.com/news/former-ton-execs-establish-community-initiative?utm_source=rss_feed&utm_medium=rss%3F1724374474945&utm_campaign=rss_partner_inbound,https://da.gd/mPADj8
Cointelegraph,Why is Bitcoin price stuck?,https://cointelegraph.com/news/why-is-bitcoin-price-stuck?utm_source=rss_feed&utm_medium=rss%3F1724374474945&utm_campaign=rss_partner_inbound,https://da.gd/iGbvu
