feed,title,long_url,short_url
Nasdaq,US STOCKS-S&P 500 flat after Fed holds steady on rates,https://www.nasdaq.com/articles/us-stocks-sp-500-flat-after-fed-holds-steady-on-rates-2021-04-28,https://j.mp/2SawVqu
Nasdaq,Beyond Meat Likely Plans Summer Plant-Based Chicken Launch,https://www.nasdaq.com/articles/beyond-meat-likely-plans-summer-plant-based-chicken-launch-2021-04-28,https://j.mp/32UZlGS
Nasdaq,Investors Shrug Off General Dynamics' Earnings Beat,https://www.nasdaq.com/articles/investors-shrug-off-general-dynamics-earnings-beat-2021-04-28,https://j.mp/2Pv9Qh8
Nasdaq,Italy's Brembo to buy Spanish motorcycle brake maker for 70 mln euros,https://www.nasdaq.com/articles/italys-brembo-to-buy-spanish-motorcycle-brake-maker-for-70-mln-euros-2021-04-28,https://j.mp/3u6khqw
Nasdaq,Major European Markets Close Slightly Higher,https://www.nasdaq.com/articles/major-european-markets-close-slightly-higher-2021-04-28,https://j.mp/2S2YeCU
