feed,title,long_url,short_url
Nasdaq,NZ's Infratil to buy majority stake in radiology firm for $254 mln,https://www.nasdaq.com/articles/nzs-infratil-to-buy-majority-stake-in-radiology-firm-for-%24254-mln-2021-04-28,https://j.mp/2QEfAFY
Nasdaq,"FOREX-Dollar weakens after Fed dampens taper hopes, cautious U.S. outlook",https://www.nasdaq.com/articles/forex-dollar-weakens-after-fed-dampens-taper-hopes-cautious-u.s.-outlook-2021-04-28-0,https://j.mp/3u32Y9U
Nasdaq,Ford says chip shortage to slash Q2 vehicle production in half,https://www.nasdaq.com/articles/ford-says-chip-shortage-to-slash-q2-vehicle-production-in-half-2021-04-28,https://j.mp/2PuJFHk
Nasdaq,"CANADA STOCKS - TSX rises 0.95% to 19,356.95",https://www.nasdaq.com/articles/canada-stocks-tsx-rises-0.95-to-19356.95-2021-04-28,https://j.mp/3xFOQWr
Nasdaq,Soccer-Man City fight back to beat 10-man PSG in first leg,https://www.nasdaq.com/articles/soccer-man-city-fight-back-to-beat-10-man-psg-in-first-leg-2021-04-28,https://j.mp/32ZJ8QO
Nasdaq,"Verizon explores sale of media assets, including Yahoo and AOL - WSJ",https://www.nasdaq.com/articles/verizon-explores-sale-of-media-assets-including-yahoo-and-aol-wsj-2021-04-28,https://j.mp/3dZM7PC
