feed,title,long_url,short_url
SeekingAlpha,Euro Area inflation drops to 4.3% in September,https://seekingalpha.com/news/4016611,
SeekingAlpha,SWK Holdings prices $29M offering,https://seekingalpha.com/news/4016610,
SeekingAlpha,Warning: CLMEF is at high risk of performing badly,https://seekingalpha.com/warnings/4016606,
SeekingAlpha,Warning: XPON is at high risk of performing badly,https://seekingalpha.com/warnings/4016605,
SeekingAlpha,Warning: WDH is at high risk of performing badly,https://seekingalpha.com/warnings/4016603,
