feed,title,long_url,short_url
Benzinga,Phoenix Motor 10% Owner Trades $12.24M In Company Stock,https://benzinga.com/news/23/09/35004883/phoenix-motor-10-owner-trades-12-24m-in-company-stock,https://da.gd/p9wdY
Benzinga,Enliven Therapeutics Insider Trades Send a Signal,https://benzinga.com/news/23/09/35004878/enliven-therapeutics-insider-trades-send-a-signal,https://da.gd/35yP
Benzinga,189K Reasons To Be Bullish On RF Industries Stock,https://benzinga.com/news/23/09/35004876/189k-reasons-to-be-bullish-on-rf-industries-stock,https://da.gd/Yh9BQ
Benzinga,394K Reasons To Be Bullish On Dianthus Therapeutics Stock,https://benzinga.com/news/23/09/35004874/394k-reasons-to-be-bullish-on-dianthus-therapeutics-stock,https://da.gd/u3mh
Benzinga,10% Owner At This Utilities Company Buys $367K of Stock,https://benzinga.com/news/23/09/35004873/10-owner-at-this-utilities-company-buys-367k-of-stock,https://da.gd/uoqQ6
Benzinga,Sangamo Therapeutics 10% Owner Sold $3.00M In Company Stock,https://benzinga.com/news/23/09/35004871/sangamo-therapeutics-10-owner-sold-3-00m-in-company-stock,https://da.gd/3uvyza
Benzinga,Chief Development Officer of TMC Metals Sold $142K In Stock,https://benzinga.com/news/23/09/35004864/chief-development-officer-of-tmc-metals-sold-142k-in-stock,https://da.gd/jF7bb
Benzinga,Xerox Holdings Insider Trades Send a Signal,https://benzinga.com/news/23/09/35004860/xerox-holdings-insider-trades-send-a-signal,https://da.gd/SIrvw
Benzinga,Abeona Therapeutics Insider Trades Send a Signal,https://benzinga.com/news/23/09/35004858/abeona-therapeutics-insider-trades-send-a-signal,https://da.gd/hzFJ9
Benzinga,American Software CFO Awarded $1.72M Worth of Stock Options,https://benzinga.com/news/23/09/35004856/american-software-cfo-awarded-1-72m-worth-of-stock-options,https://da.gd/tHL7
Benzinga,"President at American Software Acquires Company Stock Options Worth 300,000 Shares",https://benzinga.com/news/23/09/35004853/president-at-american-software-acquires-company-stock-options-worth-300-000-shares,https://da.gd/ErbAH
Benzinga,Senior Vice President at ConocoPhillips Exercises Options Worth $3.72M,https://benzinga.com/news/23/09/35004850/senior-vice-president-at-conocophillips-exercises-options-worth-3-72m,https://da.gd/cmwGN
Benzinga,"FactSet Research Systems EVP Acquires 3,000 Shares After Exercising Company Stock Options",https://benzinga.com/news/23/09/35004849/factset-research-systems-evp-acquires-3-000-shares-after-exercising-company-stock-options,https://da.gd/d72yKB
Benzinga,"Chief Scientific Officer at Comera Life Sciences Acquires Company Stock Options Worth 300,000 Shares",https://benzinga.com/news/23/09/35004847/chief-scientific-officer-at-comera-life-sciences-acquires-company-stock-options-worth-300-000-shares,https://da.gd/wvQS
Benzinga,"EVP & CFO at Comera Life Sciences Acquires Company Stock Options Worth 350,000 Shares",https://benzinga.com/news/23/09/35004845/evp-cfo-at-comera-life-sciences-acquires-company-stock-options-worth-350-000-shares,https://da.gd/2TuA
Benzinga,Cryptocurrency Lido DAO Rises More Than 4% In 24 hours,https://benzinga.com/markets/cryptocurrency/23/09/35004833/cryptocurrency-lido-dao-rises-more-than-4-in-24-hours,https://da.gd/8ZBh0
Benzinga,TRON Rises More Than 3% In 24 hours,https://benzinga.com/markets/cryptocurrency/23/09/35004824/tron-rises-more-than-3-in-24-hours,https://da.gd/lphsh
Benzinga,XRP Rises More Than 4% In 24 hours,https://benzinga.com/markets/cryptocurrency/23/09/35004815/xrp-rises-more-than-4-in-24-hours,https://da.gd/zMaS
