feed,title,long_url,short_url
ETFTrends,What Makes That Ticker Tick: Zeno Mercer and ROBO,https://www.etftrends.com/disruptive-technology-channel/what-makes-that-ticker-tick-zeno-mercer-robo/,https://da.gd/tApH5
ETFTrends,"Another Reason Active, ESG Combination Matters",https://www.etftrends.com/esg-channel/another-reason-active-esg-combination-matters/,https://da.gd/s8gxa4
ETFTrends,Dunwoody on Canada’s Seller Marketplace and ETF Industry,https://www.etftrends.com/etfs-in-canada-channel/pat-dunwoody-canadas-etf-industry/,https://da.gd/UfL39J
ETFTrends,"Appetite for Climate, ESG Investing Rebounding",https://www.etftrends.com/etf-education-channel/appetite-climate-esg-investing-rebounding/,https://da.gd/5Ag1ka
ETFTrends,Particle Accelerators Could Make China Semiconductors Leader,https://www.etftrends.com/china-insights-channel/particle-accelerators-could-make-china-semiconductor-leader/,https://da.gd/0tAdk0
ETFTrends,"Nvidia Mania: Is the AI Bump Over, or Is the Best Yet to Come?",https://www.etftrends.com/leveraged-inverse-channel/nvidia-mania-ai-bump-over-or-best-yet-to-come/,https://da.gd/lhcYa
ETFTrends,Higher for How Much Longer?,https://www.etftrends.com/etf-strategist-channel/higher-how-much-longer/,https://da.gd/hB2ph
ETFTrends,A Fixed Income Primer for Portfolio Construction,https://www.etftrends.com/etf-strategist-channel/fixed-income-primer-portfolio-construction/,https://da.gd/8giOO
ETFTrends,Millennial Investors Like Gold,https://www.etftrends.com/tactical-allocation-channel/millennial-investors-like-gold/,https://da.gd/ifg7Eh
ETFTrends,ROAM Outperforms Key Cap-Weighted Emerging Markets ETF,https://www.etftrends.com/multi-factor-channel/roam-outperforms-key-cap-weighted-emerging-markets-etf/,https://da.gd/t9fekM
ETFTrends,"Depend on DGRW for Dividends, Outperformance Potential",https://www.etftrends.com/model-portfolio-channel/depend-on-dgrw-dividends-outperformance-potential/,https://da.gd/pUaOxr
ETFTrends,Harness Full Portfolio Control Using Direct Indexing,https://www.etftrends.com/direct-indexing-channel/harness-full-portfolio-control-using-direct-indexing/,https://da.gd/w9CM
ETFTrends,Capture the Super-Cycle of AI Through IGPT,https://www.etftrends.com/innovative-etfs-channel/capture-super-cycle-ai-through-igpt/,https://da.gd/GAt32
