feed,title,long_url,short_url
Investing,"Compass Point downgrades Coinbase on valuation, weak earnings outlook",https://www.investing.com/news/stock-market-news/compass-point-downgrades-coinbase-on-valuation-weak-earnings-outlook-4167890,
Investing,Swiss government seeks better trade terms with US after 39% tariff shock,https://www.investing.com/news/stock-market-news/swiss-government-seeks-better-trade-terms-with-us-after-39-tariff-shock-93CH-4167886,
Investing,Hillevax stock rises after XOMA Royalty announces acquisition,https://www.investing.com/news/stock-market-news/hillevax-stock-rises-after-xoma-royalty-announces-acquisition-93CH-4167885,
Investing,LAVA Therapeutics stock rises on acquisition deal with XOMA Royalty,https://www.investing.com/news/stock-market-news/lava-therapeutics-stock-rises-on-acquisition-deal-with-xoma-royalty-93CH-4167884,
Investing,Saudi Arabia stocks higher at close of trade; Tadawul All Share up 0.06%,https://www.investing.com/news/stock-market-news/saudi-arabia-stocks-higher-at-close-of-trade-tadawul-all-share-up-006-4167880,
Investing,Piper plays down significance of Tesla Autopilot case in Florida,https://www.investing.com/news/stock-market-news/piper-plays-down-significance-of-tesla-autopilot-case-in-florida-4167879,
Investing,Replimune stock plunges after FDA cancer drug rejection details emerge,https://www.investing.com/news/stock-market-news/replimune-stock-plunges-after-fda-cancer-drug-rejection-details-emerge-93CH-4167877,
