feed,title,long_url,short_url
Investing,Why Teradyne's 19% Rally Is Just Getting Started,https://www.investing.com/analysis/why-teradynes-19-rally-is-just-getting-started-200664811,
Investing,"Coterra Energy beats second-quarter profit estimates on higher gas prices, strong output",https://www.investing.com/news/stock-market-news/coterra-energy-beats-second-quarter-profit-estimates-4168756,
Investing,Fed's Daly signals readiness for rate cuts as job market softens,https://www.investing.com/news/stock-market-news/feds-daly-signals-readiness-for-rate-cuts-as-job-market-softens-93CH-4168769,
Investing,MercadoLibre misses profit estimates as Brazil free-shipping boost hurts margins,https://www.investing.com/news/stock-market-news/mercadolibre-misses-profit-estimates-as-brazil-freeshipping-boost-hurts-margins-4168753,
Investing,Palantir raises annual revenue forecast again on surging AI demand,https://www.investing.com/news/stock-market-news/palantir-raises-annual-revenue-forecast-again-on-surging-ai-demand-4168723,
Investing,Vertex Pharmaceuticals stock falls after pain drug fails in Phase 2 study,https://www.investing.com/news/stock-market-news/vertex-pharmaceuticals-stock-falls-after-pain-drug-fails-in-phase-2-study-93CH-4168706,
