feed,title,long_url,short_url
Investing,Stock Market Today: Dow closes higher as dovish Fed speak dents Treasury yields,https://www.investing.com/news/stock-market-news/stock-market-today-dow-closes-higher-as-dovish-fed-speak-dents-treasury-yields-3244269,https://da.gd/EUCS2
Investing,"Intuit earnings beat by $0.49, revenue topped estimates",https://www.investing.com/news/stock-market-news/intuit-earnings-beat-by-049-revenue-topped-estimates-3245110,https://da.gd/zAZL
Investing,"Workday earnings beat by $0.12, revenue topped estimates",https://www.investing.com/news/stock-market-news/workday-earnings-beat-by-012-revenue-topped-estimates-3245108,https://da.gd/jEkGWO
Investing,Government Increases Mortgage Limits in Luxury Markets Amid Rising Home Prices,https://www.investing.com/news/stock-market-news/government-increases-mortgage-limits-in-luxury-markets-amid-rising-home-prices-3245105,https://da.gd/Pujhng
Investing,Fed's Unified Stance: Discount Rate Held Constant Unanimously Amid Inflation Focus,https://www.investing.com/news/stock-market-news/feds-unified-stance-discount-rate-held-constant-unanimously-amid-inflation-focus-3245104,https://da.gd/MDsErJ
Investing,GameStop's Options Surge Signals 50% Rally Bet by Traders,https://www.investing.com/news/stock-market-news/gamestops-options-surge-signals-50-rally-bet-by-traders-3245103,https://da.gd/xuY93A
Investing,Disney's Revival: Bob Iger Leads Transition from Restructuring to Building,https://www.investing.com/news/stock-market-news/disneys-revival-bob-iger-leads-transition-from-restructuring-to-building-3245102,https://da.gd/ho1fnQ
