feed,title,long_url,short_url
SeekingAlpha,CI Financial reports total assets of C$420.7B for October,https://seekingalpha.com/news/4040955,
SeekingAlpha,AppLovin says CMO Jansen sells 52.2K shares in co,https://seekingalpha.com/news/4040954,
SeekingAlpha,Activist Elliott asks to inspect Crown Castle's books and records,https://seekingalpha.com/news/4040952,
SeekingAlpha,ElectraMeccanica and Tevva Motors resolve merger litigation,https://seekingalpha.com/news/4040951,
SeekingAlpha,Netflix: 4 Reasons Why I Am Cautious,https://seekingalpha.com/article/4654695,
SeekingAlpha,"STAG Industrial: Solid Outperformance, Perhaps Too Much",https://seekingalpha.com/article/4654694,
