feed,title,long_url,short_url
ZeroHedgeRU,"Initial Jobless Claims Unexpectedly Tumbled Last Week, Led By TX & CA",https://www.zerohedge.com/personal-finance/initial-jobless-claims-unexpectedly-tumbled-last-week-led-tx-ca,https://da.gd/uViIjg
ZeroHedgeRU,Credit Spreads And Real Economy Are Increasingly At Odds,https://www.zerohedge.com/markets/credit-spreads-and-real-economy-are-increasingly-odds,https://da.gd/Gl6WfM
ZeroHedgeRU,Futures Rise As Fed Stress Test Reassures Banks Are Fine,https://www.zerohedge.com/markets/futures-rise-fed-stress-test-reassures-banks-are-fine,https://da.gd/SC30E
ZeroHedgeRU,"Titan Sub Wreckage With ""Presumed Human Remains"" Offloaded At Canadian Port",https://www.zerohedge.com/markets/titan-sub-wreckage-presumed-human-remains-offloaded-canadian-port,https://da.gd/Go2J
ZeroHedgeRU,Money Trends In Europe Leave ECB's Renewed Hawkishness In Doubt,https://www.zerohedge.com/markets/money-trends-europe-leave-ecbs-renewed-hawkishness-doubt,https://da.gd/UuSod9
