feed,title,long_url,short_url
ETFTrends,Alternatives Could See Big Inflows,https://www.etftrends.com/alternatives-channel/alternatives-could-see-big-inflows/,https://da.gd/mKCg9
ETFTrends,Agricultural Commodities Could Face a Volatile Summer,https://www.etftrends.com/commodities-channel/agricultural-commodities-could-face-volatile-summer/,https://da.gd/Orwj
ETFTrends,Fixed Income ETFs Have Many Uses,https://www.etftrends.com/financial-literacy-channel/fixed-income-etfs-have-many-uses/,https://da.gd/q2n1l7
ETFTrends,Crypto ETFs Back in the Spotlight,https://www.etftrends.com/crypto-channel/crypto-etfs-back-spotlight/,https://da.gd/Dnsw
ETFTrends,Familiar Catalyst Could Lift Stocks in Second Half,https://www.etftrends.com/etf-education-channel/familiar-catalyst-could-lift-stocks-second-half/,https://da.gd/MnhKWu
ETFTrends,Is Now the Time to Consider Long-Term Bond ETFs?,https://www.etftrends.com/fixed-income-channel/is-now-the-time-to-consider-long-term-bond-etfs/,https://da.gd/rvO1E
