feed,title,long_url,short_url
SeekingAlpha,"Franklin Electric GAAP EPS of $1.26 beats by $0.24, revenue of $551.1M beats by $22.43M",https://seekingalpha.com/news/3860442,
SeekingAlpha,"Zendesk unlikely to see competing bid analysts say, as downgrades come in",https://seekingalpha.com/news/3860428,
SeekingAlpha,"Oxford Square Capital GAAP EPS of $0.09, Total Investment Income of $9.94M misses by $0.06M",https://seekingalpha.com/news/3860441,
SeekingAlpha,Archer-Daniels-Midland stock accelerates on big earnings beat,https://seekingalpha.com/news/3860440,
SeekingAlpha,General Motors and Livent sign long-term Lithium Hydroxide supply agreement,https://seekingalpha.com/news/3860439,
