feed,title,long_url,short_url
SeekingAlpha,"F5 pops even as BofA points out decelerating software growth amid Q3 beat, strong outlook",https://seekingalpha.com/news/3860469,
SeekingAlpha,Kimberly-Clark stock slides as cost concerns overshadow strong sales,https://seekingalpha.com/news/3860473,
SeekingAlpha,"Equifax to acquire Midigator, post-transaction fraud mitigation solutions provider",https://seekingalpha.com/news/3860472,
SeekingAlpha,Modular Medical appoints Kevin Schmid as COO,https://seekingalpha.com/news/3860471,
SeekingAlpha,Virax Biolabs soars 37% on launch of real-time PCR test for monkeypox in Europe,https://seekingalpha.com/news/3860466,
SeekingAlpha,"Auburn National GAAP EPS of $0.51, revenue of $7.22M",https://seekingalpha.com/news/3860468,
