feed,title,long_url,short_url
SeekingAlpha,"Equity Residential lifts year guidance after strong Q2 earnings, rising rental income",https://seekingalpha.com/news/3861006,
SeekingAlpha,"Morguard North American Residential REIT FFO of C$0.34, Revenue from real estate properties of C$67.39M",https://seekingalpha.com/news/3861005,
SeekingAlpha,"First Interstate Banc GAAP EPS of $0.59 beats by $0.07, revenue of $288.9M beats by $15.56M",https://seekingalpha.com/news/3861003,
SeekingAlpha,"First Community Bancshares Non-GAAP EPS of $0.67, revenue of $36.4M",https://seekingalpha.com/news/3861002,
SeekingAlpha,"Ashland Non-GAAP EPS of $1.89 beats by $0.22, revenue of $644M beats by $21.21M",https://seekingalpha.com/news/3861001,
