feed,title,long_url,short_url
SeekingAlpha,Vanguard Emerging Markets Government Bond ETF declares monthly distribution of $0.2691,https://seekingalpha.com/news/3879031,
SeekingAlpha,Vanguard Total International Bond ETF declares monthly distribution of $0.0484,https://seekingalpha.com/news/3879030,
SeekingAlpha,Vanguard Mortgage-Backed Securities ETF declares monthly distribution of $0.0984,https://seekingalpha.com/news/3879029,
SeekingAlpha,Vanguard Long-Term Corporate Bond ETF declares monthly distribution of $0.2849,https://seekingalpha.com/news/3879028,
SeekingAlpha,Vanguard Intermediate-Term Corporate Bond ETF declares monthly distribution of $0.2067,https://seekingalpha.com/news/3879027,
SeekingAlpha,Vanguard Short-Term Corporate Bond ETF declares monthly distribution of $0.1362,https://seekingalpha.com/news/3879026,
SeekingAlpha,Vanguard Long-Term Treasury ETF declares monthly distribution of $0.1524,https://seekingalpha.com/news/3879025,
SeekingAlpha,HUYA: A Deeply Discounted Turnaround Play,https://seekingalpha.com/article/4538208,
