feed,title,long_url,short_url
SeekingAlpha,"U.S., G7 allies set to outline plan to cap price of Russian oil - WSJ",https://seekingalpha.com/news/3879140,
SeekingAlpha,Is there a trend starting where stock bear markets beat bond markets?,https://seekingalpha.com/news/3879091,
SeekingAlpha,Washington Federal promotes chief risk officer to CFO,https://seekingalpha.com/news/3879139,
SeekingAlpha,Innovative Industrial Properties: High-Growth Cannabis REIT With 7.6% Yield,https://seekingalpha.com/article/4538252,
SeekingAlpha,DocGo: 'Last Mile' Care More Palatable To The Public Than Telemedicine,https://seekingalpha.com/article/4538251,
