feed,title,long_url,short_url
Benzinga,OraSure Technologies to Present at the Raymond James 42nd Annual Institutional Investors Conference,https://benzinga.com/pressreleases/21/02/g19838095/orasure-technologies-to-present-at-the-raymond-james-42nd-annual-institutional-investors-conferenc,
Benzinga,G1 Therapeutics Provides Fourth Quarter and Full Year 2020 Financial Results and Operational Highlights,https://benzinga.com/pressreleases/21/02/g19838089/g1-therapeutics-provides-fourth-quarter-and-full-year-2020-financial-results-and-operational-highl,
Benzinga,"Vaxart to Provide 2021 Business Outlook on Tuesday, March 2, 2021",https://benzinga.com/pressreleases/21/02/g19838087/vaxart-to-provide-2021-business-outlook-on-tuesday-march-2-2021,
Benzinga,BridgeBio Pharma To Announce Proof-Of-Concept Data from ADH1 at the Endocrine Society's 2021 Annual Meeting,https://benzinga.com/pressreleases/21/02/g19838085/bridgebio-pharma-to-announce-proof-of-concept-data-from-adh1-at-the-endocrine-societys-2021-annual,
Benzinga,"Priority Income Fund Announces 10.35% Annualized Cash Distribution Rate (on Class R Offering Price) Through Board Declarations of Increased Quarterly Cash ""Bonus"" Common Shareholder Distribution in Addition to Steady Monthly Cash ""Base"" Common Shareholder Distributions for March 2021 through May 2021",https://benzinga.com/pressreleases/21/02/g19838083/priority-income-fund-announces-10-35-annualized-cash-distribution-rate-on-class-r-offering-price-t,
Benzinga,InflaRx Announces Proposed Offering of Common Shares and One-Year Warrants,https://benzinga.com/pressreleases/21/02/g19838082/inflarx-announces-proposed-offering-of-common-shares-and-one-year-warrants,
