feed,title,long_url,short_url
Benzinga,University of Phoenix and Maricopa County Community College District announce 3+1 transfer program agreement,https://www.benzinga.com/pressreleases/20/09/n17581415/university-of-phoenix-and-maricopa-county-community-college-district-announce-3-1-transfer-program,https://j.mp/32TQI0p
Benzinga,How Does Northern Oil and Gas's Debt Look?,https://www.benzinga.com/news/20/09/17581413/how-does-northern-oil-and-gass-debt-look,https://j.mp/3cmAK1F
Benzinga,"ADT Invests in Percepta Labs, ""Ethical AI"" Security Technology Startup",https://www.benzinga.com/pressreleases/20/09/g17581278/adt-invests-in-percepta-labs-ethical-ai-security-technology-startup,https://j.mp/2FNmYcD
Benzinga,"Dr. Joseph Kaplun, Seasoned Technology Leader to Become Nano Dimension's CTO-Materials and VP of R&D and Product Development",https://www.benzinga.com/pressreleases/20/09/g17581273/dr-joseph-kaplun-seasoned-technology-leader-to-become-nano-dimensions-cto-materials-and-vp-of-r-d-,https://j.mp/3hT0Vy6
Benzinga,"Schultze Special Purpose Acquisition Corp. and Clever Leaves International Inc., a Large-Scale Pharmaceutical-Grade Multi-National Cannabis Operator, to Participate in SPACInsider Webinar on September 22 at 2 p.m. ET",https://www.benzinga.com/pressreleases/20/09/g17581247/schultze-special-purpose-acquisition-corp-and-clever-leaves-international-inc-a-large-scale-pharma,https://j.mp/2ZVwbpY
Benzinga,Zogenix Appoints Three Industry Leaders to Its Board of Directors,https://www.benzinga.com/pressreleases/20/09/g17581241/zogenix-appoints-three-industry-leaders-to-its-board-of-directors,https://j.mp/2FYSzYp
Benzinga,"Whole Earth Brands, Inc. Chief Executive Officer Albert Manzone Appointed to its Board of Directors",https://www.benzinga.com/pressreleases/20/09/g17581238/whole-earth-brands-inc-chief-executive-officer-albert-manzone-appointed-to-its-board-of-directors,https://j.mp/32PEWnr
Benzinga,"Forum Merger II Corporation Reminds Shareholders to Vote in Favor of Extension to October 30, 2020",https://www.benzinga.com/pressreleases/20/09/g17581230/forum-merger-ii-corporation-reminds-shareholders-to-vote-in-favor-of-extension-to-october-30-2020,https://j.mp/3kFjK9J
Benzinga,RETRANSMISSION - MEDIA AVAILABILITY: CN Police officers available for media interviews during Rail Safety Week,https://www.benzinga.com/pressreleases/20/09/g17581227/retransmission-media-availability-cn-police-officers-available-for-media-interviews-during-rail-sa,https://j.mp/2RN9H69
Benzinga,Protech Home Medical Secures US$20 Million Senior Credit Facility With CIT Group's Healthcare Finance Business,https://www.benzinga.com/pressreleases/20/09/g17581223/protech-home-medical-secures-us-20-million-senior-credit-facility-with-cit-groups-healthcare-finan,https://j.mp/3kBha4S
Benzinga,"Kleo Pharmaceuticals to Present at ""Bioscience Pipeline & Innovation in Connecticut in the Age of COVID"" Conference",https://www.benzinga.com/pressreleases/20/09/g17581221/kleo-pharmaceuticals-to-present-at-bioscience-pipeline-innovation-in-connecticut-in-the-age-of-cov,https://j.mp/32OA3uY
Benzinga,The Apache® Software Foundation Welcomes its Global Community Online at ApacheCon@Home,https://www.benzinga.com/pressreleases/20/09/g17581219/the-apache-software-foundation-welcomes-its-global-community-online-at-apachecon-home,https://j.mp/2ZViyY8
Benzinga,TrueCommerce Netalogue wins two UK eCommerce Awards for its work with Matthew Clark,https://www.benzinga.com/pressreleases/20/09/g17581214/truecommerce-netalogue-wins-two-uk-ecommerce-awards-for-its-work-with-matthew-clark,https://j.mp/3j3mAW1
