feed,title,long_url,short_url
SeekingAlpha,Northway Financial reports Q4 results,https://seekingalpha.com/news/3656142,
SeekingAlpha,Woodlands Financial Services extends stock repurchase program,https://seekingalpha.com/news/3656141,
SeekingAlpha,"OTLK, GBR among premarket losers",https://seekingalpha.com/news/3656140,
SeekingAlpha,Rupert Resources reports Q3 results,https://seekingalpha.com/news/3656139,
SeekingAlpha,BiondVax Pharmaceuticals under pressure on pricing $12.1M ADSs follow-on offering,https://seekingalpha.com/news/3656138,
SeekingAlpha,Consumer Defensive: Get The Best Of These Constant Cash Flows,https://seekingalpha.com/article/4401940,
