feed,title,long_url,short_url
SeekingAlpha,"Office Depot EPS beats by $0.49, misses on revenue",https://seekingalpha.com/news/3690886,
SeekingAlpha,Brookfield Business Partners L.P. reports Q1 results,https://seekingalpha.com/news/3690885,
SeekingAlpha,"Novo Nordisk EPS beats by $4.62, beats on revenue",https://seekingalpha.com/news/3690883,
SeekingAlpha,World’s most vaccinated nation reintroduces curbs to counter surge in COVID-19 cases,https://seekingalpha.com/news/3690884,
SeekingAlpha,Parsons bags $618M cyber & intelligence task order,https://seekingalpha.com/news/3690882,
