feed,title,long_url,short_url
SeekingAlpha,"FMC EPS beats by $0.02, beats on revenue; updates outlook",https://seekingalpha.com/news/3691610,
SeekingAlpha,"Clearwater Paper EPS misses by $0.18, misses on revenue",https://seekingalpha.com/news/3691609,
SeekingAlpha,"Arlo Technologies EPS beats by $0.19, beats on revenue",https://seekingalpha.com/news/3691608,
SeekingAlpha,"Kimball Electronics EPS misses by $0.04, misses on revenue",https://seekingalpha.com/news/3691607,
SeekingAlpha,"Lincoln National EPS beats by $0.35, misses on revenue",https://seekingalpha.com/news/3691606,
SeekingAlpha,"FICO EPS beats by $0.47, beats on revenue",https://seekingalpha.com/news/3691605,
SeekingAlpha,"Saratoga Investment NII beats by $0.02, beats on total investment income",https://seekingalpha.com/news/3691604,
