feed,title,long_url,short_url
InsiderMonkey,MarketAxess Holdings (MKTX) Remains Attractive Despite Competition and Margin Concerns,https://insidermonkey.com/blog/--1803526,
InsiderMonkey,IREN Limited (IREN) Lands $2.8 Billion in AI Contracts. Is This the Catalyst Its Stock Needed?,https://insidermonkey.com/blog/--1803350,
InsiderMonkey,What Makes KLA Corporation (KLAC) an Attractive Bet?,https://insidermonkey.com/blog/--1803631,
InsiderMonkey,Bristol Gate US Equity Strategy’s Q2 2026 Investor Letter,https://insidermonkey.com/blog/--1803629,
InsiderMonkey,Jim Cramer Defends His Dell Stance as Investors Complain About Missing Out,https://insidermonkey.com/blog/--1803638,
InsiderMonkey,Investor’s Skepticism Weighed on MercadoLibre (MELI),https://insidermonkey.com/blog/--1803624,
InsiderMonkey,Tidewater (TDW) Slid Following the U.S.–Iran Ceasefire in June,https://insidermonkey.com/blog/--1803619,
InsiderMonkey,Talen Energy (TLN) Gains from Current Electrification Trends,https://insidermonkey.com/blog/--1803615,
InsiderMonkey,ICON Plc (ICLR) is Strengthening After Challenges,https://insidermonkey.com/blog/--1803626,
InsiderMonkey,City Different Global Equity Strategies’ Q2 2026 Investor Letter,https://insidermonkey.com/blog/--1803612,
InsiderMonkey,What Makes Thermo Fisher Scientific (TMO) an Attractive Long-Term Bet?,https://insidermonkey.com/blog/--1803589,
InsiderMonkey,Here are the Compelling Reasons to Own Visa (V),https://insidermonkey.com/blog/--1803586,
InsiderMonkey,Dodge & COX Stock Fund’s Q2 2026 Investor Letter,https://insidermonkey.com/blog/--1803582,
InsiderMonkey,Why Supermicro Stock Is Surging Even as Revenue Falls Short,https://insidermonkey.com/blog/--1803645,
InsiderMonkey,Here’s What Propelled AmpliTech Group (AMPG) Higher,https://insidermonkey.com/blog/--1803610,
InsiderMonkey,What Fuels Credo Technology Group Holding Ltd’s (CRDO) Exceptional Return in Q2?,https://insidermonkey.com/blog/--1803607,
InsiderMonkey,Deep Sail Capital Partners’ Q2 2026 Investor Letter,https://insidermonkey.com/blog/--1803604,
InsiderMonkey,Multiple Catalysts Spur Upslope Capital Management’s Latest Buy: Magnum Ice Cream (MICC),https://insidermonkey.com/blog/--1803571,
InsiderMonkey,AI Worries Weighed on Jack Henry (JKHY) in Q2,https://insidermonkey.com/blog/--1803568,
