feed,title,long_url,short_url
Benzinga,Understanding Churchill Cap Corp's Unusual Options Activity,https://benzinga.com/markets/options/21/06/21413057/understanding-churchill-cap-corps-unusual-options-activity,https://j.mp/2S67Qxb
Benzinga,Unusual Options Activity Insight: Aurinia Pharmaceuticals,https://benzinga.com/markets/options/21/06/21413048/unusual-options-activity-insight-aurinia-pharmaceuticals,https://j.mp/2SO7XNT
Benzinga,Analyzing iShares PHLX SOX Semiconductor Sector Index Fund's Unusual Options Activity,https://benzinga.com/markets/options/21/06/21413040/analyzing-ishares-phlx-sox-semiconductor-sector-index-funds-unusual-options-activity,https://j.mp/3uLxPr6
Benzinga,Analyzing Netflix's Unusual Options Activity,https://benzinga.com/markets/options/21/06/21413035/analyzing-netflixs-unusual-options-activity,https://j.mp/34KzSks
Benzinga,Analyzing GameStop's Unusual Options Activity,https://benzinga.com/markets/options/21/06/21413028/analyzing-gamestops-unusual-options-activity,https://j.mp/3vNvwVP
Benzinga,Understanding Tesla's Unusual Options Activity,https://benzinga.com/markets/options/21/06/21413024/understanding-teslas-unusual-options-activity,https://j.mp/3wQoWxR
