feed,title,long_url,short_url
SeekingAlpha,BrainStorm shares surge 20% on positive NurOwn data in multiple sclerosis,https://seekingalpha.com/news/3675624,
SeekingAlpha,Fanatics doubles in value in seven months,https://seekingalpha.com/news/3675623,
SeekingAlpha,"RIOT, SRNE, GNUS and IPHI among premarket gainers",https://seekingalpha.com/news/3675621,
SeekingAlpha,Navios Maritime Containers receives unit holders approval for Navios Partners merger,https://seekingalpha.com/news/3675620,
SeekingAlpha,Northrop partners with Raytheon on next generation interceptor program,https://seekingalpha.com/news/3675619,
