feed,title,long_url,short_url
Yahoo,"Stock market today: Dow, S&P 500, Nasdaq seesaw after jobs report, with Powell on deck",https://finance.yahoo.com/news/live/stock-market-today-dow-sp-500-nasdaq-seesaw-after-jobs-report-with-powell-on-deck-143040688.html,https://da.gd/u5pS3
Yahoo,"This Stock With Massive Earnings Growth Crushes S&P 500, Hangs Tough Near Entry",https://www.investors.com/stock-lists/stock-spotlight/insurance-stock-massive-earnings-growth-crushes-sp500-axis-capital-axs/?src=A00220&yptr=yahoo,https://da.gd/WSaix
Yahoo,"Canada’s Big-Tobacco Settlement Finalized, Ending Decadeslong Litigation",https://www.wsj.com/business/british-american-tobaccos-canadian-litigation-plan-gets-court-approval-e89e3a72?siteid=yhoof2&yptr=yahoo,https://da.gd/B3dVd
Yahoo,"MDA Space Profit Rises, Sets 2025 Growth Targets",https://www.wsj.com/business/earnings/mda-space-profit-rises-sets-2025-growth-targets-1fc0677d?siteid=yhoof2&yptr=yahoo,https://da.gd/sf7Qnj
Yahoo,Walgreens Goes From $100 Billion Health Giant to Private-Equity Salvage Project,https://www.wsj.com/business/retail/walgreens-private-equity-sale-rise-fall-42ac5db6?siteid=yhoof2&yptr=yahoo,https://da.gd/h1Qp8
Yahoo,"The Dollar's Very Bad Week, in Numbers",https://www.wsj.com/livecoverage/jobs-report-stock-market-today-dow-nasdaq-sp500-03-07-2025/card/the-dollar-s-very-bad-week-in-numbers-7AVpNHuJkki2jSAFrkW5?siteid=yhoof2&yptr=yahoo,https://da.gd/KtQAK0
Yahoo,French Former Spy Chief Known as ‘The Shark’ Convicted Over LVMH Dealings,https://www.wsj.com/world/europe/french-former-spy-chief-known-as-the-shark-convicted-over-lvmh-dealings-6c82f2d3?siteid=yhoof2&yptr=yahoo,https://da.gd/DFcXA
Yahoo,Lending platform Funding Circle swings to profit in 2024,https://finance.yahoo.com/news/lending-platform-funding-circle-swings-155307326.html,https://da.gd/Nyai
