feed,title,long_url,short_url
Investing,Retail trading frenzy drives NASDAQ to move to 24-hour trading,https://www.investing.com/news/stock-market-news/retail-trading-frenzy-drives-nasdaq-to-move-to-24hour-trading-3915649,https://da.gd/qSYZbq
Investing,Poland stocks higher at close of trade; WIG30 up 0.12%,https://www.investing.com/news/stock-market-news/poland-stocks-higher-at-close-of-trade-wig30-up-012-3915646,https://da.gd/ivPJL
Investing,Denmark stocks lower at close of trade; OMX Copenhagen 20 down 1.56%,https://www.investing.com/news/stock-market-news/denmark-stocks-lower-at-close-of-trade-omx-copenhagen-20-down-156-3915643,https://da.gd/a3vx7k
Investing,Canada suspends imports from biggest US pork processing plant,https://www.investing.com/news/stock-market-news/canada-suspends-imports-from-biggest-us-pork-processing-plant-3915641,https://da.gd/HEn2
Investing,Micropolis Holdings starts trading at $3.90 after $4.00 IPO pricing,https://www.investing.com/news/stock-market-news/micropolis-holdings-starts-trading-at-390-after-400-ipo-pricing-93CH-3915633,https://da.gd/orGnX0
