feed,title,long_url,short_url
InsiderMonkey,10 High-Flying AI Stocks to Watch Today,https://insidermonkey.com/blog/--1486302,
InsiderMonkey,ICON Public Limited Company (ICLR) Slid on Disappointing Earnings,https://insidermonkey.com/blog/--1486534,
InsiderMonkey,Polen Global Growth Strategy Trimmed Alphabet (GOOG) Amid Price Appreciation,https://insidermonkey.com/blog/--1486525,
InsiderMonkey,The Confident Retirement: Balancing Dental Aesthetics with Financial Well-being,https://insidermonkey.com/blog/--1486704,
InsiderMonkey,Here’s What Lifted Paycom Software (PAYC) Stock up More Than 20%,https://insidermonkey.com/blog/--1486502,
InsiderMonkey,Polen Capital Global Growth Strategy’s Q4 2024 Investor Letter,https://insidermonkey.com/blog/--1486495,
InsiderMonkey,Floor & Decor Holdings (FND) Slid on Concerns Related to Tariff Increase,https://insidermonkey.com/blog/--1486493,
InsiderMonkey,Here’s How Wasatch Long/Short Alpha Fund Benefitted from its Short Position Acadia Healthcare Company (ACHC),https://insidermonkey.com/blog/--1486479,
InsiderMonkey,Here’s How IonQ (IONQ) Impacted Wasatch Long/Short Alpha Fund’s Performance,https://insidermonkey.com/blog/--1486476,
InsiderMonkey,HealthEquity (HQY) Surged as Interest Rates Rose,https://insidermonkey.com/blog/--1486469,
InsiderMonkey,ICF International (ICFI) Slid on Trump’s Plans To Cut Government Spending,https://insidermonkey.com/blog/--1486474,
InsiderMonkey,Wasatch Global Investors Long/Short Alpha Fund’s Q4 2024 Investor Letter,https://insidermonkey.com/blog/--1486463,
InsiderMonkey,Lithium Argentina AG (NYSE:LAR) Q4 2024 Earnings Call Transcript,https://insidermonkey.com/blog/--1486676,
InsiderMonkey,UP Fintech Holding Limited (NASDAQ:TIGR) Q4 2024 Earnings Call Transcript,https://insidermonkey.com/blog/--1486675,
InsiderMonkey,XPeng Inc. (NYSE:XPEV) Q4 2024 Earnings Call Transcript,https://insidermonkey.com/blog/--1486674,
InsiderMonkey,"Citi Trends, Inc. (NASDAQ:CTRN) Q4 2024 Earnings Call Transcript",https://insidermonkey.com/blog/--1486673,
InsiderMonkey,IHS Holding Limited (NYSE:IHS) Q4 2024 Earnings Call Transcript,https://insidermonkey.com/blog/--1486672,
InsiderMonkey,Tencent Music Entertainment Group (NYSE:TME) Q4 2024 Earnings Call Transcript,https://insidermonkey.com/blog/--1486671,
InsiderMonkey,Bitcoin Depot Inc. (NASDAQ:BTM) Q4 2024 Earnings Call Transcript,https://insidermonkey.com/blog/--1486670,
InsiderMonkey,"Eton Pharmaceuticals, Inc. (NASDAQ:ETON) Q4 2024 Earnings Call Transcript",https://insidermonkey.com/blog/--1486669,
