feed,title,long_url,short_url
SeekingAlpha,Global Diversified Marketing Group reports FY results,https://seekingalpha.com/news/3813109,
SeekingAlpha,"Alibaba, Baidu lead Chinese tech stocks south as downgrades say it's time to sell",https://seekingalpha.com/news/3813106,
SeekingAlpha,GlucoTrack announces corporate name and ticker symbol change,https://seekingalpha.com/news/3813108,
SeekingAlpha,"Arcimoto, Scoot Scoot Rentals commence FUV rentals in St. Petersburg, Florida",https://seekingalpha.com/news/3813107,
SeekingAlpha,Nektar slips after setback for lead asset bringing similar drugs into focus,https://seekingalpha.com/news/3813105,
SeekingAlpha,"RDE GAAP EPS of -$0.41, revenue of $3.3M",https://seekingalpha.com/news/3813104,
