feed,title,long_url,short_url
FXEmpire,London Metal Exchange suspends nickel trading until March 11,https://www.fxempire.com/news/article/london-metal-exchange-suspends-nickel-trading-until-march-11-927994,https://bit.ly/360EerA
FXEmpire,"Italy to give new electric car buyers subsidy of up to 6,000 euros",https://www.fxempire.com/news/article/italy-to-give-new-electric-car-buyers-subsidy-of-up-to-6000-euros-927991,https://bit.ly/3sTfDy1
FXEmpire,"ARK’S Wood sees Europe in recession, high oil prices to drive EV sales",https://www.fxempire.com/news/article/arks-wood-sees-europe-in-recession-high-oil-prices-to-drive-ev-sales-927993,https://bit.ly/3KrDRFA
FXEmpire,"Norway-Poland gas pipeline to be ready in Oct-Nov, Polish PM says",https://www.fxempire.com/news/article/norway-poland-gas-pipeline-to-be-ready-in-oct-nov-polish-pm-says-927995,https://bit.ly/3CnIaie
FXEmpire,Russia ready to open human corridors from five Ukrainian cities -Tass cites senior official,https://www.fxempire.com/news/article/russia-ready-to-open-human-corridors-from-five-ukrainian-cities-tass-cites-senior-official-927992,https://bit.ly/3sSVRmb
FXEmpire,Starbucks suspending all business activity in Russia,https://www.fxempire.com/news/article/starbucks-suspending-all-business-activity-in-russia-927990,https://bit.ly/3KwWI21
