feed,title,long_url,short_url
SeekingAlpha,Coca-Cola Consolidated: A Better Investment Down 10%,https://seekingalpha.com/article/4532919,
SeekingAlpha,U.S. Dollar Soft While Consolidating Yesterday's Drop,https://seekingalpha.com/article/4532918,
SeekingAlpha,Novavax Q2: Time To Turn Bullish After The Massive Collapse,https://seekingalpha.com/article/4532863,
SeekingAlpha,Intelligent Living Application Stock: What To Know About This New IPO,https://seekingalpha.com/article/4532658,
SeekingAlpha,VICI Properties: What To Do Following This Bull Run,https://seekingalpha.com/article/4532478,
