feed,title,long_url,short_url
Investing,3 Dividend Stocks That Could Provide Solid Income For The Rest Of Your Life,https://investing.com/analysis/-200628400,
Investing,"Manulife agent numbers in China, Vietnam slide on pandemic challenges, regulation",https://investing.com/news/-2870580,
Investing,"Senate Finance Committee looks at Amgen taxes, widening drugmaker probe",https://investing.com/news/-2870579,
Investing,The New York Times Shares Jump After ValueAct Reveals 7% Stake,https://investing.com/news/-2870576,
Investing,Germany stocks mixed at close of trade; DAX down 0.05%,https://i-invdn-com.investing.com/news/LYNXMPEB4O088_M.jpg,
