feed,title,long_url,short_url
ETFdb:DailyRecap,A Look at the Electric Vehicle Transformation in China,https://etfdb.com/climate-insights-channel/a-look-at-the-electric-vehicle-transformation-in-china/,https://bit.ly/3bN6bGK
ETFdb:DailyRecap,How to Save for Retirement in a Bear Market,https://etfdb.com/retirement-income-channel/how-to-save-for-retirement-in-a-bear-market/,https://bit.ly/3bNwzjK
ETFdb:DailyRecap,Threat of Stagflation Persists,https://etfdb.com/etf-strategist-channel/threat-of-stagflation-persists/,https://bit.ly/3vUgC1U
ETFdb:DailyRecap,"July Provides a Much-Needed Reprieve for Stocks, Bonds",https://etfdb.com/etf-strategist-channel/july-provides-a-much-needed-reprieve-for-stocks-bonds/,https://bit.ly/3vVmloe
ETFdb:DailyRecap,Sell on the Pop Prospects: August 10 Edition,https://etfdb.com/news/2022/08/10/sell-on-pop-prospects-aug-10-edition/,https://bit.ly/3BTCpL2
ETFdb:DailyRecap,Seek PFM for Generous Dividends,https://etfdb.com/innovative-etfs-channel/seek-pfm-for-generous-dividends/,https://bit.ly/3AaIscU
ETFdb:DailyRecap,Economic and Market Signals to Watch: Part 2,https://etfdb.com/model-portfolio-channel/economic-and-market-signals-to-watch-part-2/,https://bit.ly/3PeKAVa
ETFdb:DailyRecap,Why Investors Look to RSP for a Core Holding,https://etfdb.com/portfolio-strategies-channel/why-investors-look-to-rsp-for-a-core-holding/,https://bit.ly/3AcFwwj
ETFdb:DailyRecap,SBIO Surges on M&A Announcements,https://etfdb.com/etf-building-blocks-channel/sbio-surges-on-m-a-announcements/,https://bit.ly/3A9GoBV
ETFdb:DailyRecap,GraniteShares Launches 4 Leveraged Single-Stock ETFS,https://etfdb.com/news/2022/08/10/graniteshares-launches-4-leveraged-single-stock-etfs/,https://bit.ly/3Pet6Iw
ETFdb:DailyRecap,TILL Breaks Out With $65 million in Creates,https://etfdb.com/commodities-channel/till-breaks-out-with-65-million-in-creates/,https://bit.ly/3vY2AfJ
ETFdb:DailyRecap,CLNR Could Be Charged by Climate Change Bill,https://etfdb.com/dual-impact-channel/clnr-could-be-charged-by-climate-change-bill/,https://bit.ly/3BRKos1
ETFdb:DailyRecap,"If Recession Hits, Depend on DURA",https://etfdb.com/tactical-allocation-channel/if-recession-hits-depend-on-dura/,https://bit.ly/3BTtold
ETFdb:DailyRecap,Big Names Fuel Crypto Rebound,https://etfdb.com/crypto-channel/big-names-fuel-crypto-rebound/,https://bit.ly/3vV4NIL
