feed,title,long_url,short_url
Investing,"Heilpern loves Bitcoin, hates bullshit… was a China state media journo: Hall of Flame",https://www.investing.com/news/cryptocurrency-news/heilpern-loves-bitcoin-hates-bullshit-was-a-china-state-media-journo-hall-of-flame-3100164,https://da.gd/wjw3
Investing,Bain Capital values Chindata at nearly $3 billion in take-private offer,https://www.investing.com/news/economy/bain-capital-values-chindata-at-nearly-3-billion-in-takeprivate-offer-3100162,https://da.gd/EyvOA
Investing,Netflix adds 3% as Wells Fargo sets a Street-high target with 25% upside,https://www.investing.com/news/stock-market-news/netflix-adds-3-as-wells-fargo-sets-a-streethigh-target-with-25-upside-432SI-3100160,https://da.gd/TfeVl
Investing,"Canaccord Genuity starts Mobileye at Buy, sees long-term potential",https://www.investing.com/news/stock-market-news/canaccord-genuity-starts-mobileye-at-buy-sees-longterm-potential-432SI-3100149,https://da.gd/w4sUd
Investing,American Lithium to Spin Out Macusani Uranium Deposit into an Independent Public Company,https://www.investing.com/news/stock-market-news/american-lithium-to-spin-out-macusani-uranium-deposit-into-an-independent-public-company-432SI-3100146,https://da.gd/394u
Investing,Brazil inflation at lowest in more than two years amid calls for rate cuts,https://www.investing.com/news/economy/brazil-inflation-at-lowest-in-more-than-two-years-amid-calls-for-rate-cuts-3100163,https://da.gd/XZs2OL
