feed,title,long_url,short_url
TheStreet,Honda Takes on Tesla in Exciting New Driver Feature for These People,https://www.thestreet.com/automotive/honda-takes-on-tesla-in-exciting-new-driver-feature-for-these-people,https://da.gd/rA15ev
TheStreet,Elon Musk Sends Dire Warning to Home Buyers And Homeowners Worldwide,https://www.thestreet.com/technology/elon-musk-sends-dire-warning-to-home-buyers-and-homeowners-worldwide,https://da.gd/kC1T
TheStreet,New Stats Show These 15 Cities Could Be in for a Rocky Road Ahead,https://www.thestreet.com/real-estate/which-cities-have-the-most-empty-offices,https://da.gd/ur63H1
TheStreet,Resort Casino Has Answer for Frustrated Las Vegas Strip Visitors,https://www.thestreet.com/travel/resort-casino-has-answer-for-frustrated-las-vegas-strip-visitors,https://da.gd/wkQEw
TheStreet,"UnitedHealth Boosts Dividend By 14% Following Record Q1 Revenues, Solid Earnings",https://www.thestreet.com/investing/stocks/unitedhealth-boosts-dividend-by-14-following-record-q1-revenues,https://da.gd/IiSMR8
TheStreet,Spirit Airlines Isn't the Most Hated Company in America,https://www.thestreet.com/personal-finance/spirit-airlines-isnt-the-most-hated-company-in-america,https://da.gd/zCMazv
TheStreet,"Stocks Slip Lower, Bank of Canada On Deck, Boeing Slides, Binance Freeze, Campbell Soup Earnings - 5 Things To Know",https://www.thestreet.com/investing/stocks/stocks-lower-bank-of-canada-boeing-binance-campbell-soup,https://da.gd/5tzuBA
