feed,title,long_url,short_url
SeekingAlpha,IBM expands watsonx portfolio to scale AI on Amazon Web Services,https://seekingalpha.com/news/4108763,
SeekingAlpha,Community Health Systems announces $1.1B tack-on note offering,https://seekingalpha.com/news/4108762,
SeekingAlpha,Atlas Engineered Products advances robotic automation and expansion with strategic land acquisition,https://seekingalpha.com/news/4108761,
SeekingAlpha,"Massimo Group expands manufacturing facility in Garland, Texas",https://seekingalpha.com/news/4108760,
SeekingAlpha,CI Financial to offer senior unsecured U.S.-dollar-denominated notes in private placement,https://seekingalpha.com/news/4108759,
SeekingAlpha,Reborn Coffee signs LOI to acquire 55% stake in Derin Lezzetler,https://seekingalpha.com/news/4108756,
SeekingAlpha,Consol Energy resumes coal shipments from its Baltimore marine terminal,https://seekingalpha.com/news/4108754,
