feed,title,long_url,short_url
Yahoo,Big Banks Show Consumers Remained Resilient Heading Into Tariff Turmoil,https://finance.yahoo.com/news/bank-america-profit-climbs-consumer-112400652.html,https://da.gd/rMutlw
Yahoo,Top ETF analyst sends hard-nosed response to MicroStrategy stock surge,https://finance.yahoo.com/news/top-etf-analyst-sends-hard-173632194.html,https://da.gd/W1Xa
Yahoo,"FedEx, UPS Bring Back Fees for Chinese Imports",https://finance.yahoo.com/news/fedex-ups-bring-back-fees-174157497.html,https://da.gd/X6byU
Yahoo,Analysis-Brazil auto market offers warning for US tariff policy,https://finance.yahoo.com/news/analysis-brazil-auto-market-offers-175421311.html,https://da.gd/AMTp
Yahoo,Sprouts Farmers Market's Profits Keep Growing As This Gold Stock Shines,https://www.investors.com/research/sprouts-farmers-market-stock-sfm-gold-newmont-nem-fico/?src=A00220&yptr=yahoo,https://da.gd/GjdYe
Yahoo,KKR acquires German IT firm Datagroup for around $500 million,https://finance.yahoo.com/news/kkr-nears-acquisition-german-services-181931819.html,https://da.gd/jNl5J
Yahoo,Analysts Stay Bullish on Netflix Stock Ahead of Earnings,https://finance.yahoo.com/news/analysts-stay-bullish-netflix-stock-174436478.html,https://da.gd/n7Wf5
