feed,title,long_url,short_url
SeekingAlpha,"Wave Life Sciences GAAP EPS of -$0.27 misses by $0.23, revenue of $12.93M misses by $25.67M",https://seekingalpha.com/news/3964380,
SeekingAlpha,Molson Coors shakes off prior bear call at JPMorgan but limited upside seen,https://seekingalpha.com/news/3964379,
SeekingAlpha,"SunPower Non-GAAP EPS of -$0.07 misses by $0.07, revenue of $442.5M beats by $22.8M",https://seekingalpha.com/news/3964378,
SeekingAlpha,"Clean Harbors GAAP EPS of $1.33, revenue of $1.31B",https://seekingalpha.com/news/3964377,
SeekingAlpha,Barclays favors cyclicals amid U.S. debt ceiling debate,https://seekingalpha.com/news/3964357,
