feed,title,long_url,short_url
Investing,Securities token platform launches MPC wallet for institutions,https://www.investing.com/news/cryptocurrency-news/securities-token-platform-launches-mpc-wallet-for-institutions-3071794,https://da.gd/bXPx
Investing,Polygon and Others Respond to UK HM Treasury’s Crypto Regulations Consultation,https://www.investing.com/news/cryptocurrency-news/po,https://da.gd/EF4yQ
Investing,Qualcomm sees dull third quarter on weak chip demand for smartphones,https://www.investing.com/news/stock-market-news/qualcomm-sees-dull-third-quarter-on-weak-chip-demand-for-smartphones-3071837,https://da.gd/AQHZYC
Investing,Google wins US patent trial over data-retrieval technology,https://www.investing.com/news/stock-market-news/google-wins-us-patent-trial-over-dataretrieval-technology-3071863,https://da.gd/TX0DN
Investing,"Jobless claims, Apple earnings, Shell earnings: 3 things to watch",https://www.investing.com/news/stock-market-news/jobless-claims-apple-earnings-shell-earnings-3-things-to-watch-3071836,https://da.gd/27Foi
Investing,"Cognizant A earnings beat by $0.07, revenue topped estimates",https://www.investing.com/news/stock-market-news/cognizant-a-earnings-beat-by-007-revenue-topped-estimates-3071830,https://da.gd/O95w
Investing,"Qualcomm earnings matched, revenue topped estimates",https://www.investing.com/news/stock-market-news/qualcomm-earnings-matched-revenue-topped-estimates-3071828,https://da.gd/4d9vDM
Investing,"MercadoLibre earnings beat by $1.16, revenue topped estimates",https://www.investing.com/news/stock-market-news/mercadolibre-earnings-beat-by-116-revenue-topped-estimates-3071822,https://da.gd/XO8YyC
Investing,"Exxon, Guyana's environmental agency in breach of oil-spill insurance -court",https://www.investing.com/news/stock-market-news/exxon-guyanas-environmental-agency-in-breach-of-oilspill-insurance-court-3071815,https://da.gd/qKrgp
Investing,"US rate futures price in Fed pause in June, July; see September cut",https://www.investing.com/news/economy/us-rate-futures-price-in-fed-pause-in-june-july-see-september-cut-3071800,https://da.gd/wCsCot
