feed,title,long_url,short_url
SeekingAlpha,"Gladstone Commercial FFO of $0.37 in-line, revenue of $36.55M misses by $0.96M",https://seekingalpha.com/news/3964992,
SeekingAlpha,Why did Adobe stock slip today? UK regulator probes Figma deal,https://seekingalpha.com/news/3964988,
SeekingAlpha,"Brightcove Non-GAAP EPS of -$0.15 misses by $0.09, revenue of $49.1M misses by $0.21M",https://seekingalpha.com/news/3964991,
SeekingAlpha,Etsy rallies after positive buyer trends leads to earnings topper,https://seekingalpha.com/news/3964990,
SeekingAlpha,"Upwork Non-GAAP EPS of -$0.01 beats by $0.06, revenue of $160.8M beats by $1.8M",https://seekingalpha.com/news/3964989,
SeekingAlpha,"Rayonier GAAP EPS of $0.01 misses by $0.08, revenue of $179.1M misses by $31.03M",https://seekingalpha.com/news/3964987,
SeekingAlpha,"Civitas Resources GAAP EPS of $2.46 beats by $0.54, revenue of $656.02M beats by $28.17M",https://seekingalpha.com/news/3964985,
