feed,title,long_url,short_url
Investing,"Measles cases rise to 159 in Texas, state health department says",https://www.investing.com/news/stock-market-news/measles-cases-rise-to-159-in-texas-state-health-department-says-3906938,https://da.gd/hFsSK9
Investing,ADNOC and OMV to merge petrochemical firms to create $60 billion giant,https://www.investing.com/news/stock-market-news/adnoc-and-omv-to-merge-petrochemical-firms-to-create-60-billion-giant-3906948,https://da.gd/TIz12b
Investing,Goldman Sachs aims for 3% to 5% staff reduction in spring review - Reuters,https://www.investing.com/news/stock-market-news/goldman-sachs-aims-for-3-to-5-staff-reduction-in-spring-review--reuters-93CH-3906935,https://da.gd/NzvkB3
Investing,Storm clouds gather over US economy as Trump kicks off trade war,https://www.investing.com/news/economy-news/storm-clouds-gather-over-us-economy-as-trump-kicks-off-trade-war-3906941,https://da.gd/uLOz61
Investing,US House speaker urges lawmakers to avoid town hall meetings,https://www.investing.com/news/economy-news/us-house-speaker-urges-lawmakers-to-avoid-town-hall-meetings-3906939,https://da.gd/v34qh9
Investing,"Instant View: German parties agree debt brake reform, 500 billion-euro infrastructure fund",https://www.investing.com/news/economy-news/instant-view-german-parties-agree-debt-brake-reform-500-billioneuro-infrastructure-fund-3906940,https://da.gd/SfQn0
