feed,title,long_url,short_url
Investing,Axalta stock rises as company unveils innovative EV battery coatings,https://www.investing.com/news/stock-market-news/axalta-stock-rises-as-company-unveils-innovative-ev-battery-coatings-93CH-4272778,
Investing,Saudi Arabia stocks higher at close of trade; Tadawul All Share up 0.66%,https://www.investing.com/news/stock-market-news/saudi-arabia-stocks-higher-at-close-of-trade-tadawul-all-share-up-066-4272777,
Investing,Free Press founder Bari Weiss named editor of CBS News after deal with Paramount,https://www.investing.com/news/stock-market-news/free-press-founder-bari-weiss-named-editor-of-cbs-news-after-deal-with-paramount-4272774,
Investing,Verizon names former PayPal boss Dan Schulman as CEO,https://www.investing.com/news/stock-market-news/verizon-names-former-paypal-ceo-dan-schulman-as-ceo-4272721,
Investing,"Micron looks at multiple strong earning quarters, Morgan Stanley",https://www.investing.com/news/stock-market-news/micron-looks-at-multiple-strong-earning-quarters-morgan-stanley-4272759,
Investing,Churchill Capital Corp X stock surges after Citron Research mention,https://www.investing.com/news/stock-market-news/churchill-capital-corp-x-stock-surges-after-citron-research-mention-93CH-4272722,
Investing,Galaxy Digital stock soars after launching GalaxyOne platform,https://www.investing.com/news/stock-market-news/galaxy-digital-stock-soars-after-launching-galaxyone-platform-93CH-4272704,
Investing,"US Treasury’s Bessent to remain as IRS commissioner, CNBC reports",https://www.investing.com/news/economy-news/us-treasurys-bessent-to-remain-as-irs-commissioner-cnbc-reports-4272772,
