feed,title,long_url,short_url
Investing,Figure Technology: Analysts bullish on tokenization ‘market leader‘,https://www.investing.com/news/stock-market-news/figure-technology-analysts-bullish-on-tokenization-market-leader-4273222,
Investing,Union urges air traffic controllers to remain on job despite shutdown,https://www.investing.com/news/stock-market-news/union-urges-air-traffic-controllers-to-remain-on-job-despite-shutdown-4273209,
Investing,Norway stocks higher at close of trade; Oslo OBX up 0.60%,https://www.investing.com/news/stock-market-news/norway-stocks-higher-at-close-of-trade-oslo-obx-up-060-4273215,
Investing,BofA downgrades Shake Shack as softening labor market weighs on traffic,https://www.investing.com/news/stock-market-news/bofa-downgrades-shake-shack-as-softening-labor-market-weighs-on-traffic-4273211,
Investing,Greece stocks lower at close of trade; Athens General Composite down 1.14%,https://www.investing.com/news/stock-market-news/greece-stocks-lower-at-close-of-trade-athens-general-composite-down-114-4273210,
Investing,JPMorgan names Hillery and Wiltz as co-CEOs for EMEA region,https://www.investing.com/news/stock-market-news/jpmorgan-names-hillery-and-wiltz-as-coceos-for-emea-region-93CH-4273200,
Investing,Brazil’s central bank chief points to clear signs economy remains heated,https://www.investing.com/news/economy-news/brazils-central-bank-chief-points-to-clear-signs-economy-remains-heated-4273214,
