feed,title,long_url,short_url
SeekingAlpha,THC BioMed reports Q4 results,https://seekingalpha.com/news/3636106,
SeekingAlpha,"Village Farms +6% on solid Q3 results, top-line up 12%",https://seekingalpha.com/news/3636102,
SeekingAlpha,Surface Oncology's lead cancer programs to advance to combination and expansion stages of early-stage studies,https://seekingalpha.com/news/3636099,
SeekingAlpha,"CSCO, NIO, DKNG and VIPS among premarket gainers",https://seekingalpha.com/news/3636098,
SeekingAlpha,"BigCommerce gains bear at Citi on valuation, competition concerns",https://seekingalpha.com/news/3636097,
