feed,title,long_url,short_url
Benzinga,"Wireless Temperature Sensor Market to Reach $3,129.8 Million by 2027; Increasing Demand during the Covid-19 Pandemic will Provide Impetus to Market Growth, says Fortune Business Insights™",https://www.benzinga.com/pressreleases/20/09/g17332395/wireless-temperature-sensor-market-to-reach-3-129-8-million-by-2027-increasing-demand-during-the-c,https://j.mp/2EP86Ka
Benzinga,"Cosmetic Dentistry Market to Exhibit a Decent CAGR of 8.0% to Reach USD 43.06 Billion by 2026; Rising Inclination Towards Dental Aesthetics to Spur Demand, states Fortune Business Insights™",https://www.benzinga.com/pressreleases/20/09/g17332391/cosmetic-dentistry-market-to-exhibit-a-decent-cagr-of-8-0-to-reach-usd-43-06-billion-by-2026-risin,https://j.mp/34XitGz
Benzinga,Insider Buys Camping World's Shares,https://www.benzinga.com/news/20/09/17331453/insider-buys-camping-worlds-shares,https://j.mp/3hRLAyA
Benzinga,Tesla Model Y Prototype Spotted In China,https://www.benzinga.com/news/20/09/17327330/tesla-model-y-prototype-spotted-in-china,https://j.mp/2EP0tn3
Benzinga,Insider Buys Odonate Therapeutics's Stock,https://www.benzinga.com/news/20/09/17331456/insider-buys-odonate-therapeuticss-stock,https://j.mp/3gSjrWW
Benzinga,Stocks That Hit 52-Week Highs On Tuesday,https://www.benzinga.com/news/20/09/17332331/stocks-that-hit-52-week-highs-on-tuesday,https://j.mp/31NvyjZ
