feed,title,long_url,short_url
SeekingAlpha,"History says Apple, Tesla momentum can become even more extraordinary",https://seekingalpha.com/news/3610544,
SeekingAlpha,SPDR Portfolio Intermediate Term Corporate Bond ETF declares monthly distribution of $0.0629,https://seekingalpha.com/news/3610603,
SeekingAlpha,SPDR Portfolio Aggregate Bond ETF declares monthly distribution of $0.0618,https://seekingalpha.com/news/3610602,
SeekingAlpha,SPDR Barclays Short Term High Yield Bond ETF declares monthly distribution of $0.1016,https://seekingalpha.com/news/3610601,
SeekingAlpha,SPDR Nuveen Barclays Short Term Municipal Bond ETF declares monthly distribution of $0.0459,https://seekingalpha.com/news/3610600,
SeekingAlpha,SPDR Wells Fargo Preferred Stock ETF declares monthly distribution of $0.1800,https://seekingalpha.com/news/3610598,
