feed,title,long_url,short_url
InsiderMonkey,Bitfarms (BITF) Jumps 12% as Market Sentiment Turns Upbeat,https://insidermonkey.com/blog/--1653396,
InsiderMonkey,Credo (CRDO) Surges 8.3% Ahead of Earnings,https://insidermonkey.com/blog/--1653399,
InsiderMonkey,Applied Digital (APLD) Pops 8.7% as Market Mood Brightens,https://insidermonkey.com/blog/--1653404,
InsiderMonkey,Circle Internet (CRCL) Soars 10% on Bargain-Hunting After Hitting Low,https://insidermonkey.com/blog/--1653406,
InsiderMonkey,Intel Corp. (INTC) Climbs 10.3% on Apple Deal Hype,https://insidermonkey.com/blog/--1653397,
InsiderMonkey,ImmunityBio (IBRX) Soars 10.8% Ahead of Health Conferences,https://insidermonkey.com/blog/--1653401,
InsiderMonkey,CleanSpark (CLSK) Surges 12% on Broader Market Strength,https://insidermonkey.com/blog/--1653393,
InsiderMonkey,First Majestic (AG) Climbs 12.7% on Silver Rush,https://insidermonkey.com/blog/--1653394,
InsiderMonkey,Endeavour (EXK) Soars 15% on Silver Boost,https://insidermonkey.com/blog/--1653390,
InsiderMonkey,TMC the metals company (TMC) Rockets 19% Higher as Copper Hits Record High,https://insidermonkey.com/blog/--1653391,
InsiderMonkey,Varied Growth Drivers Lifted nLIGHT (LASR) in Q3,https://insidermonkey.com/blog/--1653299,
InsiderMonkey,"Favorable Market Outlook Lifted Planet Labs, PBC (PL) in Q3",https://insidermonkey.com/blog/--1653295,
InsiderMonkey,The Honest Company (HNST) Fell Due to Cautious Guidance,https://insidermonkey.com/blog/--1653286,
InsiderMonkey,"Kornit Digital, Ltd. (KRNT) Rose in Q3 on Stabilized Demand",https://insidermonkey.com/blog/--1653324,
InsiderMonkey,Meridian Contrarian Fund’s Q3 2025 Investor Letter,https://insidermonkey.com/blog/--1653279,
InsiderMonkey,Sands Capital Technology Innovators Fund Exited Its Position in Okta (OKTA) in Q3,https://insidermonkey.com/blog/--1653155,
InsiderMonkey,Here’s Why Sands Capital Technology Innovators Fund Sold CrowdStrike Holdings (CRWD),https://insidermonkey.com/blog/--1653119,
InsiderMonkey,What Makes Figma (FIG) an Investment Choice?,https://insidermonkey.com/blog/--1653112,
