feed,title,long_url,short_url
Yahoo,"Warner Bros. Discovery slashes more staff, cuts departments",https://finance.yahoo.com/news/warner-bros-discovery-slashes-more-staff-095425664.html,https://yhoo.it/3RXafDf
Yahoo,"Stock market news live updates: Stock futures edge higher ahead of inflation report, Fed minutes",https://finance.yahoo.com/news/stock-market-news-live-updates-october-12-2022-121220378.html,https://yhoo.it/3TaBT0u
Yahoo,Dow Jones Futures Slash Gains On Hot Inflation Data; Fed Minutes Up Next; PepsiCo Jumps On Earnings,https://finance.yahoo.com/m/4d2b0a8f-89d1-32d8-8c85-08db4f0d551b/dow-jones-futures-slash-gains.html?.tsrc=rss,https://yhoo.it/3TiqknV
Yahoo,"Dow Jones Futures Rise, Bond Yields In Flux With Inflation Reports Due",https://finance.yahoo.com/m/46cca5c3-3efe-3379-b142-d3ba2925761b/dow-jones-futures-rise%2C-bond.html?.tsrc=rss,https://yhoo.it/3RYuNv0
Yahoo,MarketWatch Moments: How the new tools of monetary policy and the rise of China changed markets,https://finance.yahoo.com/m/f3b84620-4ef6-3649-ab40-08ed6bc45fb2/marketwatch-moments%3A-how-the.html?.tsrc=rss,https://yhoo.it/3Tik143
