feed,title,long_url,short_url
ETFTrends:DailyRecap,Global Corporate Bond ETFs Are Taking a Beating,https://www.etftrends.com/global-corporate-bond-etfs-are-taking-a-beating/,https://bit.ly/35tmwgD
ETFTrends:DailyRecap,ETFs to Stay in the Markets and Manage Potential Bumps Ahead,https://www.etftrends.com/etfs-to-stay-in-the-markets-and-manage-potential-bumps-ahead/,https://bit.ly/3qSGDfA
ETFTrends:DailyRecap,Commodities Set for Best Quarter Since 1990,https://www.etftrends.com/innovative-etfs-channel/commodities-set-for-best-quarter-since-1990/,https://bit.ly/3wYnr3R
ETFTrends:DailyRecap,We Remain ETN Skeptics,https://www.etftrends.com/etf-strategist-channel/we-remain-etn-skeptics/,https://bit.ly/3iTQIEI
ETFTrends:DailyRecap,ETF of the Week: Emerging Markets Internet & Ecommerce ETF (EMQQ),https://www.etftrends.com/etf-of-the-week/etf-of-the-week-emerging-markets-internet-ecommerce-etf-emqq/,https://bit.ly/3qTYgvE
ETFTrends:DailyRecap,Shopify Provides Funding to 9 Carbon Removal Projects,https://www.etftrends.com/esg-channel/shopify-provides-funding-to-9-carbon-removal-projects/,https://bit.ly/3NBy56w
ETFTrends:DailyRecap,"What Factor-Based, Active Investing Can Offer Your Clients",https://www.etftrends.com/what-factor-based-active-investing-can-offer-your-clients/,https://bit.ly/3qQUwek
ETFTrends:DailyRecap,Morningstar Forecasts a Good Year for High-Yield Bonds,https://www.etftrends.com/institutional-income-strategies-channel/morningstar-forecasts-a-good-year-for-high-yield-fixed-income/,https://bit.ly/3IWdDd7
ETFTrends:DailyRecap,Managed Futures Shine During Macro Volatility,https://www.etftrends.com/china-insights-channel/managed-futures-shine-during-macro-volatility/,https://bit.ly/3iU5dYZ
ETFTrends:DailyRecap,"GDVD Just Launched, Offering Investors Income Through Dividends",https://www.etftrends.com/gdvd-just-launched-offering-investors-income-through-dividends/,https://bit.ly/3DwkCIv
ETFTrends:DailyRecap,"Refinancing Rate Falls, Opening up an Opportunity for This ETF",https://www.etftrends.com/fixed-income-channel/refinancing-rate-falls-opening-up-an-opportunity-for-this-etf/,https://bit.ly/3wPc6mJ
ETFTrends:DailyRecap,Financial Advisors Still Walking on Eggshells With Cryptocurrencies,https://www.etftrends.com/crypto-channel/financial-advisors-still-walking-on-eggshells-with-cryptocurrencies/,https://bit.ly/3uGeLfW
ETFTrends:DailyRecap,Rising Rates Could Be Friendly to Value ETFs,https://www.etftrends.com/etf-education-channel/rising-rates-could-be-friendly-to-value-etfs/,https://bit.ly/3LtVq8u
ETFTrends:DailyRecap,A Lot To Unpack,https://www.etftrends.com/etf-strategist-channel/a-lot-to-unpack/,https://bit.ly/3JYKv6m
ETFTrends:DailyRecap,This Could Be Pivotal to Fortunes of Emerging Markets Stocks,https://www.etftrends.com/emerging-markets-channel/this-could-be-pivotal-to-fortunes-of-emerging-markets-stocks/,https://bit.ly/35qryu7
ETFTrends:DailyRecap,Sector Clues Could Signal Equal-Weight Outperformance,https://www.etftrends.com/portfolio-strategies-channel/sector-clues-could-signal-equal-weight-outperformance/,https://bit.ly/3JYKyPA
ETFTrends:DailyRecap,Retail Investors Could Push Bitcoin Higher,https://www.etftrends.com/crypto-channel/retail-investors-could-push-bitcoin-higher/,https://bit.ly/36KmuBx
ETFTrends:DailyRecap,Time Could Be Right for This Equal-Weight ETF,https://www.etftrends.com/nasdaq-portfolio-solutions-channel/time-could-be-right-for-this-equal-weight-etf/,https://bit.ly/3DrEHQ9
ETFTrends:DailyRecap,Stepping Into the Metaverse With Matthew Ball,https://www.etftrends.com/stepping-into-the-metaverse-with-matthew-ball/,https://bit.ly/35pZffk
ETFTrends:DailyRecap,BIZD: Where the Big Yields Are,https://www.etftrends.com/tactical-allocation-channel/bizd-where-the-big-yields-are/,https://bit.ly/3uL7N9c
ETFTrends:DailyRecap,Don’t Give Up on High-Yield ETFs,https://www.etftrends.com/dont-give-up-on-high-yield-etfs/,https://bit.ly/3tSuIjR
ETFTrends:DailyRecap,"Amid Rising Rates, Yields Are Flashing a Recession Sign",https://www.etftrends.com/fixed-income-channel/amid-rising-rates-yields-are-flashing-a-recession-sign/,https://bit.ly/35pZebg
