feed,title,long_url,short_url
SeekingAlpha,Gabriella's Kitchen reports FY results,https://seekingalpha.com/news/3829854,
SeekingAlpha,"SunCoke Energy GAAP EPS of $0.35 beats by $0.18, revenue of $439.8M beats by $67.8M",https://seekingalpha.com/news/3829853,
SeekingAlpha,Brown & Brown to acquire Patrick Quinlan Insurance,https://seekingalpha.com/news/3829852,
SeekingAlpha,"New Gold Non-GAAP EPS of $0.02, revenue of $174.7M",https://seekingalpha.com/news/3829851,
SeekingAlpha,Supernus rises on FDA label expansion of ADHD therapy,https://seekingalpha.com/news/3829850,
