feed,title,long_url,short_url
InvestorPlace,3 Killer Cryptos to Buy in May 2022,https://investorplace.com/2022/05/3-killer-cryptos-to-buy-in-may-2022/,https://bit.ly/3s5iSSi
InvestorPlace,Pinterest Faces Tough Times Ahead Despite What the Company Says,https://investorplace.com/2022/05/pins-stock-faces-a-tough-time-ahead-if-the-economy-keeps-falling/,https://bit.ly/3kyd3IQ
InvestorPlace,2 Key Reasons Aterian Stock Q1 Earnings Could Be a Miss,https://investorplace.com/2022/05/2-key-reasons-aterian-stock-q1-earnings-could-be-a-miss/,https://bit.ly/3s6Ht9c
InvestorPlace,Why Is the Cronos (CRO) Crypto Plunging Today?,https://investorplace.com/2022/05/why-is-the-cronos-cro-crypto-plunging-today/,https://bit.ly/3F5klNE
InvestorPlace,The Future of Dogecoin Looks Brighter With Elon Musk’s Twitter Takeover,https://investorplace.com/2022/05/the-future-of-dogecoin-looks-brighter-with-elon-musks-twitter-takeover/,https://bit.ly/3vBJ8Wc
