feed,title,long_url,short_url
SeekingAlpha,"ReWalK EPS misses by $0.01, beats on revenue",https://seekingalpha.com/news/3727346,
SeekingAlpha,Energizer tops estimates after volume and pricing head higher,https://seekingalpha.com/news/3727345,
SeekingAlpha,"Scientific Games EPS beats by $1.07, beats on revenue",https://seekingalpha.com/news/3727344,
SeekingAlpha,Axsome Therapeutics EPS beats by $0.07,https://seekingalpha.com/news/3727343,
SeekingAlpha,"TEGNA EPS in-line, beats on revenue",https://seekingalpha.com/news/3727342,
SeekingAlpha,"Dicerna Pharmaceuticals EPS misses by $0.81, misses on revenue",https://seekingalpha.com/news/3727341,
SeekingAlpha,"Village Farms EPS misses by $0.03, beats on revenue",https://seekingalpha.com/news/3727340,
