feed,title,long_url,short_url
InsiderMonkey,Strong Results and Improved Investor Sentiment Around AI Lifted Alphabet (GOOG) in Q4,https://insidermonkey.com/blog/--1724192,
InsiderMonkey,CoreWeave (CRWV) Fell Despite More Than 40% Revenue Growth,https://insidermonkey.com/blog/--1724196,
InsiderMonkey,Microsoft (MSFT) Declines Amid Investor Concerns Over Guidance and Capital Expenditure Intensity,https://insidermonkey.com/blog/--1724251,
InsiderMonkey,BTG Pactual Initiates Coverage of Pilgrim’s Pride Corporation (PPC) With a Neutral Rating – Here’s Why,https://insidermonkey.com/blog/--1724010,
InsiderMonkey,Ingredion Incorporated (INGR) Gets Initiated With a Buy Rating by Benchmark,https://insidermonkey.com/blog/--1724011,
InsiderMonkey,Why is Archer-Daniels-Midland Company (ADM) One of the Best Undervalued Defensive Stocks for 2026?,https://insidermonkey.com/blog/--1724012,
InsiderMonkey,UBS Cuts PT on The Campbell’s Company (CPB) to $20 From $24 – Here’s Why,https://insidermonkey.com/blog/--1724013,
InsiderMonkey,JPMorgan Cuts PT on Conagra Brands (CAG) to $17 From $19 – Here’s Why,https://insidermonkey.com/blog/--1724014,
InsiderMonkey,BofA Lifts PT on Bunge Global SA (BG) to $130 From $125 – Here’s Why,https://insidermonkey.com/blog/--1724015,
InsiderMonkey,RBC Capital Cuts PT on General Mills (GIS) to $55 From $60 – Here’s Why,https://insidermonkey.com/blog/--1724016,
InsiderMonkey,Truist Cuts PT on Dollar Tree (DLTR) to $142 From $156 – Here’s Why,https://insidermonkey.com/blog/--1724017,
InsiderMonkey,BofA Cuts PT on Lamb Weston Holdings (LW) to $49 From $53 – Here’s Why,https://insidermonkey.com/blog/--1724018,
InsiderMonkey,Citi Updates Constellation Brands (STZ) to Buy From Neutral – Here’s Why,https://insidermonkey.com/blog/--1724019,
InsiderMonkey,"ImmunityBio Inc. (IBRX) Announces Approval for ANKTIVA® in Macau SAR, China",https://insidermonkey.com/blog/--1724077,
InsiderMonkey,"Scotiabank Cuts PT on SailPoint, Inc. (SAIL) to $16 From $24 – Here’s Why",https://insidermonkey.com/blog/--1724078,
InsiderMonkey,Barclays Cuts PT on Kanzhun Limited (BZ) to $19 From $28 – Here’s Why,https://insidermonkey.com/blog/--1724079,
InsiderMonkey,"Ondas Inc. (ONDS) to Acquire World View Enterprises, Inc.",https://insidermonkey.com/blog/--1724080,
InsiderMonkey,Uranium Energy Corp. (UEC) Attains Approval for Expanded Production at Christensen Ranch,https://insidermonkey.com/blog/--1724081,
InsiderMonkey,Wells Fargo Adds Levi Strauss & Co. (LEVI) to its Top Picks List – Here’s Why,https://insidermonkey.com/blog/--1724082,
InsiderMonkey,Mizuho Lifts PT on Permian Resources Corporation (PR) to $25 From $23 – Here’s Why,https://insidermonkey.com/blog/--1724083,
