feed,title,long_url,short_url
Benzinga,Premia Partners Launches New Report on Asia Innovative Technology,https://www.benzinga.com/pressreleases/21/01/n19135877/premia-partners-launches-new-report-on-asia-innovative-technology,https://j.mp/3nEVHJo
Benzinga,Premia Partners Launches New Report on Asia Innovative Technology,https://www.benzinga.com/pressreleases/21/01/n19135876/premia-partners-launches-new-report-on-asia-innovative-technology,https://j.mp/39v23Wu
Benzinga,Highland Global Allocation Fund Declares Monthly Distributions of $0.071 Per Share,https://www.benzinga.com/pressreleases/21/01/n19135875/highland-global-allocation-fund-declares-monthly-distributions-of-0-071-per-share,https://j.mp/3bzTwEj
Benzinga,TIGA Research Shows UK Video Games Industry on Course for Growth In 2021,https://www.benzinga.com/pressreleases/21/01/n19135853/tiga-research-shows-uk-video-games-industry-on-course-for-growth-in-2021,https://j.mp/2LsQoiX
Benzinga,National PTA to Provide $120K in Grants to PTAs Across the Country to Continue COVID-19 Relief Efforts,https://www.benzinga.com/pressreleases/21/01/n19135842/national-pta-to-provide-120k-in-grants-to-ptas-across-the-country-to-continue-covid-19-relief-effo,https://j.mp/3qeiAVB
Benzinga,"""GEODIS City Delivery"" for even faster urban deliveries",https://www.benzinga.com/pressreleases/21/01/n19135841/geodis-city-delivery-for-even-faster-urban-deliveries,https://j.mp/2XCefiW
Benzinga,Innovent Announces NMPA Acceptance of a Supplemental New Drug Application for TYVYT® (sintilimab injection) in Combination with BYVASDA® (bevacizumab injection) as First-Line Therapy in Hepatocellular Carcinoma (HCC),https://www.benzinga.com/pressreleases/21/01/n19135840/innovent-announces-nmpa-acceptance-of-a-supplemental-new-drug-application-for-tyvyt-sintilimab-inj,https://j.mp/3nBSI4b
Benzinga,"Madison Pacific Properties Inc. announces the results for the three months ended November 30, 2020",https://www.benzinga.com/pressreleases/21/01/g19135839/madison-pacific-properties-inc-announces-the-results-for-the-three-months-ended-november-30-2020,https://j.mp/2LvkaDL
Benzinga,Covid-19 Passport from iProov and Mvine Moves Into Trial Phase,https://www.benzinga.com/pressreleases/21/01/b19135843/covid-19-passport-from-iproov-and-mvine-moves-into-trial-phase,https://j.mp/35A7aDO
