feed,title,long_url,short_url
SeekingAlpha,Rocket Lab USA could take off with catalysts ahead - Morgan Stanley,https://seekingalpha.com/news/3799158,
SeekingAlpha,"Gilead's remdesivir effective against multiple COVID variants, including Omicron",https://seekingalpha.com/news/3799155,
SeekingAlpha,Sanjay Singh names new Chairman and CEO at Mace Security International,https://seekingalpha.com/news/3799157,
SeekingAlpha,Grupo Aeromexico's traffic grew 39% Y/Y in Jan. 2022,https://seekingalpha.com/news/3799156,
SeekingAlpha,3 Things I Think I Think - All About Inflation,https://seekingalpha.com/article/4486288,
SeekingAlpha,5 Reasons Why Meta Platforms Is A Value Trap,https://seekingalpha.com/article/4486287,
SeekingAlpha,AbCellera Biologics: Bebtelovimab Supply Deal Provides A Much Needed Shot In The Arm,https://seekingalpha.com/article/4486286,
