feed,title,long_url,short_url
SeekingAlpha,Is Visa Stock A Buy Or Sell After Recent Earnings?,https://seekingalpha.com/article/4486242,
SeekingAlpha,Algoma Steel: Exceptional Steel Market Results In Record Performance,https://seekingalpha.com/article/4486263,
SeekingAlpha,Prairie Sky Royalty: The Easy Money Side Of The Oil Patch,https://seekingalpha.com/article/4486046,
SeekingAlpha,The Crypto Rally: Marathon Digital Is The Best Bitcoin Mining Stock To Buy,https://seekingalpha.com/article/4486096,
SeekingAlpha,Ball Corporation: A Great Company At A Fair Price,https://seekingalpha.com/article/4486306,
