feed,title,long_url,short_url
SeekingAlpha,WisdomTree U.S. Multifactor Fund declares quarterly distribution of $0.1955,https://seekingalpha.com/news/3920406,
SeekingAlpha,First Trust Large Cap Value AlphaDEX Fund declares quarterly distribution of $0.5323,https://seekingalpha.com/news/3920405,
SeekingAlpha,WisdomTree U.S. MidCap Fund declares quarterly distribution of $0.2364,https://seekingalpha.com/news/3920404,
SeekingAlpha,WisdomTree U.S. LargeCap Fund declares quarterly distribution of $0.2228,https://seekingalpha.com/news/3920403,
SeekingAlpha,First Trust Mid Cap Core AlphaDEX Fund declares quarterly distribution of $0.3782,https://seekingalpha.com/news/3920402,
SeekingAlpha,WisdomTree U.S. ESG Fund declares quarterly distribution of $0.1826,https://seekingalpha.com/news/3920401,
