feed,title,long_url,short_url
Investing,US Bond Selloff Continues Amid Hawkish Fed Comments,https://www.investing.com/analysis/us-bond-selloff-continues-amid-hawkish-fed-comments-200645808,https://da.gd/wCEQwO
Investing,A Bank Crisis Is Percolating,https://www.investing.com/analysis/a-bank-crisis-is-percolating-200645807,https://da.gd/ulO0T
Investing,S&P 500 Equal Weight Double Tops as Main Indexes Hold Breakout: Divergence Ahead?,https://www.investing.com/analysis/sp-500-equal-weight-double-tops-as-main-indexes-hold-breakout-divergence-ahead-200645801,https://da.gd/hWog3T
Investing,McDonald’s Stock Serves Up a Buy-The-Dip Opportunity,https://www.investing.com/analysis/mcdonalds-stock-serves-up-a-buythedip-opportunity-200645810,https://da.gd/uG4R
Investing,"S&P 500 E-Mini Futures Shoot Higher, Eye 4985 Next: How to Plan Your Trade",https://www.investing.com/analysis/sp-500-emini-futures-shoot-higher-eye-4985-next-how-to-plan-your-trade-200645809,https://da.gd/zdYUe
Investing,Nikkei 225: Yet Another Big Move Remains in the Offing,https://www.investing.com/analysis/nikkei-225-yet-another-big-move-remains-in-the-offing-200645806,https://da.gd/6yCnF
Investing,"Transportation Sector Indicates Demand Remains Solid, Defying Recession Calls",https://www.investing.com/analysis/transportation-sector-indicates-demand-remains-solid-defying-recession-calls-200645805,https://da.gd/NUJAi
Investing,"Ethereum (ETH) In Dangerous Position, Bitcoin (BTC) About to Lose $40,000, Shiba Inu (SHIB) At Local Support",https://www.investing.com/news/cryptocurrency-news/ethereum-eth-in-dangerous-position-bitcoin-btc-about-to-lose-40000-shiba-inu-shib-at-local-support-3293453,https://da.gd/aTgqBU
Investing,"Ethereum (ETH) Loses All of Its Gains, Bitcoin (BTC) Not Ready to Give up $40,000, Solana (SOL) Comeback Starts",https://www.investing.com/news/cryptocurrency-news/ethereum-eth-loses-all-of-its-gains-bitcoin-btc-not-ready-to-give-up-40000-solana-sol-comeback-starts-3293452,https://da.gd/dxdFFU
Investing,"XRP Starts Moving Earlier, Solana (SOL) Already Stronger Than Everyone Else; Does Ethereum (ETH) Need More Fuel?",https://www.investing.com/news/cryptocurrency-news/xrp-starts-moving-earlier-solana-sol-already-stronger-than-everyone-else-does-ethereum-eth-need-more-fuel-3293451,https://da.gd/WN3o
Investing,"Dogecoin (DOGE) Breakout Occurs, What's Next? Solana (SOL) Stays Dominant, Will Ethereum (ETH) Survive Unseen Stalemate?",https://www.investing.com/news/cryptocurrency-news/dogecoin-doge-breakout-occurs-whats-next-solana-sol-stays-dominant-will-ethereum-eth-survive-unseen-stalemate-3293449,https://da.gd/109ZV
Investing,Novo Nordisk to begin 2024 share buybacks,https://www.investing.com/news/stock-market-news/novo-nordisk-to-begin-2024-share-buybacks-3293447,https://da.gd/3QY2KV
