feed,title,long_url,short_url
SeekingAlpha,Vanguard Small-Cap ETF declares quarterly distribution of $0.7461,https://seekingalpha.com/news/3950124,
SeekingAlpha,"Aziyo Biologics GAAP EPS of -$0.38 beats by $0.34, revenue of $12.67M beats by $0.12M",https://seekingalpha.com/news/3950123,
SeekingAlpha,Vanguard Total Stock Market ETF declares quarterly distribution of $0.7862,https://seekingalpha.com/news/3950119,
SeekingAlpha,"NextNav GAAP EPS of -$0.40 beats by $0.03, revenue of $3.93M misses by $1.22M",https://seekingalpha.com/news/3950118,
SeekingAlpha,SPAC Maxpro shareholders approve merger with biotech firm Apollomics,https://seekingalpha.com/news/3950117,
SeekingAlpha,Bank of America to redeem C$1B of fixed/floating rate senior notes,https://seekingalpha.com/news/3950116,
SeekingAlpha,"Aspira Women’s Health GAAP EPS of -$0.04 beats by $0.03, revenue of $2.15M misses by $0.1M",https://seekingalpha.com/news/3950115,
