feed,title,long_url,short_url
TheStreet,Mark Zuckerberg Is Getting Sued for a Very Disturbing Reason,https://www.thestreet.com/social-media/mark-zuckerberg-is-getting-sued-for-a-very-disturbing-reason,https://da.gd/ClRV
TheStreet,Memestock Traders React to GameStop's Unexpected Comeback,https://www.thestreet.com/investing/stocks/memestock-traders-react-to-gamestops-unexpected-comeback,https://da.gd/mYyU
TheStreet,SVB Collapse: FDIC Removed $2 Billion Cash From Parent Company,https://www.thestreet.com/banking/svb-collapse-fdic-removed-2-billion-cash-from-parent-company,https://da.gd/xSx7
TheStreet,Billionaire Richard Branson's Space Business Just Found a Game-Changer,https://www.thestreet.com/stocks/billionaire-richard-bransons-space-business-just-found-a-game-changer,https://da.gd/nH4wc
TheStreet,Cathie Wood Watch: Ark Gets Back into Intuit,https://www.thestreet.com/stocks/cathie-wood-ark-intuit-coinbase,https://da.gd/X0GU0e
TheStreet,U.S. Bancorp Dispels Doom Scenarios,https://www.thestreet.com/banking/u-s-bancorp-dispels-doom-scenarios,https://da.gd/iK4Xp
TheStreet,Amazon Stock Is Teetering on a Breakout. Here's the Setup.,https://www.thestreet.com/investing/stocks/amazon-amzn-stock-is-teetering-on-a-breakout-heres-the-setup-now,https://da.gd/wFqI
TheStreet,"Fed Hikes Rates Despite Ongoing Banking Crisis, Cites High Inflation Risk",https://www.thestreet.com/investing/stocks/fed-hike-rates-despite-banking-crisis-cites-high-inflation-risk,https://da.gd/fkuea
TheStreet,Elon Musk Is Very Worried About Italy,https://www.thestreet.com/technology/elon-musk-is-very-worried-about-italy,https://da.gd/IDCo
