feed,title,long_url,short_url
FXEmpire,"Credit Suisse names Koerner as CEO, sets strategic review",https://www.fxempire.com/news/article/credit-suisse-names-koerner-as-ceo-sets-strategic-review-1076752,https://bit.ly/3b7Rj5r
FXEmpire,Fed to unveil another big rate hike as signs of economic slowdown grow,https://www.fxempire.com/news/article/fed-to-unveil-another-big-rate-hike-as-signs-of-economic-slowdown-grow-1076753,https://bit.ly/3vjE7RF
FXEmpire,"Credit Suisse swaps out CEO, launches strategy review amid big Q2 loss",https://www.fxempire.com/news/article/credit-suisse-swaps-out-ceo-launches-strategy-review-amid-big-q2-loss-1076757,https://bit.ly/3vGxedF
FXEmpire,LG Display swings to a loss as inflation puts brakes on pandemic-led demand,https://www.fxempire.com/news/article/lg-display-swings-to-a-loss-as-inflation-puts-brakes-on-pandemic-led-demand-1076756,https://bit.ly/3OARt2H
FXEmpire,Singapore extends stay of Sri Lanka’s Rajapaksa,https://www.fxempire.com/news/article/singapore-extends-stay-of-sri-lankas-rajapaksa-1076755,https://bit.ly/3OCO8jT
FXEmpire,Analysis-Investors gauge U.S. stocks rebound: ‘suckers’ rally’ or market bottom?,https://www.fxempire.com/news/article/analysis-investors-gauge-u-s-stocks-rebound-suckers-rally-or-market-bottom-1076751,https://bit.ly/3zAUwDV
