feed,title,long_url,short_url
SeekingAlpha,Automatic Data Processing beats top an bottom line; provides fiscal 2023 outlook,https://seekingalpha.com/news/3861193,
SeekingAlpha,"Alkermes Non-GAAP EPS of $0.06 beats by $0.05, revenue of $276.2M beats by $7.19M",https://seekingalpha.com/news/3861192,
SeekingAlpha,"General Dynamics GAAP EPS of $2.75 beats by $0.03, revenue of $9.19B misses by $230M",https://seekingalpha.com/news/3861189,
SeekingAlpha,"Stepan Non-GAAP EPS of $2.30 beats by $0.40, revenue of $751.63M beats by $59.23M",https://seekingalpha.com/news/3861190,
SeekingAlpha,WestRock to acquire remaining 67.7% interest in Grupo Gondi in an immediately accretive transaction,https://seekingalpha.com/news/3861188,
SeekingAlpha,"Rockwell Automation Non-GAAP EPS of $2.66 beats by $0.32, revenue of $1.97B misses by $10M",https://seekingalpha.com/news/3861187,
