feed,title,long_url,short_url
SeekingAlpha,"Meritage Homes GAAP EPS of $6.77 beats by $0.90, revenue of $1.41B beats by $30M",https://seekingalpha.com/news/3861792,
SeekingAlpha,"Arch Capital GAAP EPS of $1.04 misses by $0.08, revenue of $2.33B misses by $180M",https://seekingalpha.com/news/3861791,
SeekingAlpha,Viking Therapeutics GAAP EPS of -$0.23 misses by $0.02,https://seekingalpha.com/news/3861790,
SeekingAlpha,"CONMED Non-GAAP EPS of $0.76 beats by $0.01, revenue of $277.19M beats by $2.97M",https://seekingalpha.com/news/3861789,
SeekingAlpha,"Best Buy stock falls postmarket on disappointing outlook amid high inflation, weak demand",https://seekingalpha.com/news/3861787,
