feed,title,long_url,short_url
SeekingAlpha,"ChoiceOne Financial Services GAAP EPS of $0.75, revenue of $19.72M",https://seekingalpha.com/news/3861957,
SeekingAlpha,Companhia Brasileira de Distribuio reports Q2 results,https://seekingalpha.com/news/3861956,
SeekingAlpha,Raymond James fiscal Q3 earnings miss reflects slump in Capital Markets unit,https://seekingalpha.com/news/3861955,
SeekingAlpha,"Taro Pharmaceutical Non-GAAP EPS of $1.09 beats by $0.24, revenue of $156.7M beats by $6.8M",https://seekingalpha.com/news/3861953,
SeekingAlpha,"Netgear stock rises postmarket as revenue guidance, results top estimates",https://seekingalpha.com/news/3861952,
SeekingAlpha,Equinor: Returning Even More Money To Shareholders,https://seekingalpha.com/article/4526559,
