feed,title,long_url,short_url
Benzinga,What Are Whales Doing With Enphase Energy,https://benzinga.com/markets/options/22/09/29031775/what-are-whales-doing-with-enphase-energy,https://bit.ly/3rdWVQ6
Benzinga,What Are Whales Doing With Amazon.com,https://benzinga.com/markets/options/22/09/29031748/what-are-whales-doing-with-amazon-com,https://bit.ly/3xVTaCu
Benzinga,Cryptocurrency Chainlink's Price Increased More Than 7% Within 24 hours,https://benzinga.com/markets/cryptocurrency/22/09/29031706/cryptocurrency-chainlinks-price-increased-more-than-7-within-24-hours,https://bit.ly/3UH8dto
Benzinga,BNB Rises More Than 3% In 24 hours,https://benzinga.com/markets/cryptocurrency/22/09/29031702/cryptocurrency-bnb-rises-more-than-3-in-24-hours,https://bit.ly/3xVTh0S
Benzinga,Cryptocurrency Solana's Price Increased More Than 5% Within 24 hours,https://benzinga.com/markets/cryptocurrency/22/09/29031691/cryptocurrency-solanas-price-increased-more-than-5-within-24-hours,https://bit.ly/3SAQAJZ
