feed,title,long_url,short_url
Investing,"Imge su Cetin, CEO of Defy Trends: On Big Data, Crypto Volatility, and Data Analytics",https://investing.com/news/-2742113,
Investing,"Metafluence: The First Influencer Platform Connecting Influencers, Brands and Audiences in The Metaverse",https://investing.com/news/-2742112,
Investing,KPMG fined $5.8 million over Conviviality audit in Britain,https://investing.com/news/-2742120,
Investing,Net profits of China's centrally owned state firms up 29.8% y/y in 2021,https://investing.com/news/-2742110,
Investing,Australia stocks lower at close of trade; S&P/ASX 200 down 1.03%,https://investing.com/news/-2742102,
