feed,title,long_url,short_url
SeekingAlpha,"Cleartronic GAAP EPS of $0.00, revenue of $0.54M",https://seekingalpha.com/news/3873667,
SeekingAlpha,Propanc to get EU patent for proenzyme compositions to treat cancer,https://seekingalpha.com/news/3873666,
SeekingAlpha,"BT Brands GAAP EPS of -$0.01, revenue of $3.5M",https://seekingalpha.com/news/3873665,
SeekingAlpha,"Pandora A/S GAAP EPS of DKK9.80, revenue of DKK5.65B beats by DKK4.86B",https://seekingalpha.com/news/3873664,
SeekingAlpha,"Polished.com slides after Q2 prelim sales miss, guidance cut on supply concerns",https://seekingalpha.com/news/3873663,
