feed,title,long_url,short_url
FXEmpire,Carnival Cruise bookings soar after it eases COVID testing requirements,https://www.fxempire.com/news/article/carnival-cruise-bookings-soar-after-it-eases-covid-testing-requirements-1098163,https://bit.ly/3zYZPvN
FXEmpire,Estonian visa cancellation has ordinary Russians worried,https://www.fxempire.com/news/article/estonian-visa-cancellation-has-ordinary-russians-worried-1098158,https://bit.ly/3CatG7t
FXEmpire,"Brazil 2022 trade surplus outlook dims, but record still in reach",https://www.fxempire.com/news/article/brazil-2022-trade-surplus-outlook-dims-but-record-still-in-reach-1098161,https://bit.ly/3A2x0if
FXEmpire,Cuba cracks open door to foreign investment in domestic trade,https://www.fxempire.com/news/article/cuba-cracks-open-door-to-foreign-investment-in-domestic-trade-1098157,https://bit.ly/3dA7p8x
FXEmpire,Germany says undecided on nuclear plants extension,https://www.fxempire.com/news/article/germany-says-undecided-on-nuclear-plants-extension-1098160,https://bit.ly/3QvCNnl
FXEmpire,Zimbabwe measles outbreak blamed on sect gatherings kills 157 children,https://www.fxempire.com/news/article/zimbabwe-measles-outbreak-blamed-on-sect-gatherings-kills-157-children-1098159,https://bit.ly/3dD9n8x
