feed,title,long_url,short_url
SeekingAlpha,Optex Systems bags $3.8M laser protected periscopes order,https://seekingalpha.com/news/4100183,
SeekingAlpha,Ensign Energy Services reports Q1 results,https://seekingalpha.com/news/4100182,
SeekingAlpha,Virgin Galactic begins ground testing of Delta spaceship subsystems,https://seekingalpha.com/news/4100181,
SeekingAlpha,"Bitcoin miner Hut 8 says Salt Creek site fully energized, shares up",https://seekingalpha.com/news/4100180,
SeekingAlpha,"Federal Agricultural Mortgage Non-GAAP EPS of $3.96 misses by $0.10, revenue of $89.1M misses by $3.17M",https://seekingalpha.com/news/4100179,
SeekingAlpha,Bowlero reports Q3 results; updates FY24 outlook,https://seekingalpha.com/news/4100178,
SeekingAlpha,"Sunstone Hotel FFO of $0.18 beats by $0.02, revenue of $217.16M beats by $2.57M",https://seekingalpha.com/news/4100177,
