feed,title,long_url,short_url
InsiderMonkey,Brown & Brown (BRO) Fell as Management Suggested Continued Decline in Organic Growth,https://insidermonkey.com/blog/--1713551,
InsiderMonkey,Does ServiceTitan (TTAN) Have a Long Runway for Growth?,https://insidermonkey.com/blog/--1713591,
InsiderMonkey,A.O. Smith (AOS) is Poised to Benefit from Upcoming Energy Regulations,https://insidermonkey.com/blog/--1713607,
InsiderMonkey,MSA Safety (MSA) Derives Value from Leading Market Positions and Strong Brand Recognition,https://insidermonkey.com/blog/--1713615,
InsiderMonkey,Madison Mid Cap Fund Exited Microchip Technology Incorporated (MCHP) Following Valuation Recovery,https://insidermonkey.com/blog/--1713621,
InsiderMonkey,Madison Mid Cap Fund’s Q4 2025 Investor Letter,https://insidermonkey.com/blog/--1713496,
InsiderMonkey,Here’s Third Avenue Small-Cap Value Fund’s Updates on Cintas Corporation’s (CTAS) Unifirst Takeover Offer,https://insidermonkey.com/blog/--1713448,
