feed,title,long_url,short_url
Benzinga,"Chief Diversity Officers Take On New Visibility, Challenges",https://www.benzinga.com/news/21/01/19352180/chief-diversity-officers-take-on-new-visibility-challenges,https://j.mp/36iTzRI
Benzinga,Burloak Technologies Becomes First Additive Manufacturer Approved to Supply Boeing,https://www.benzinga.com/pressreleases/21/01/n19353360/burloak-technologies-becomes-first-additive-manufacturer-approved-to-supply-boeing,https://j.mp/3t4RsKO
Benzinga,Burloak Technologies Becomes First Additive Manufacturer Approved to Supply Boeing,https://www.benzinga.com/pressreleases/21/01/n19353357/burloak-technologies-becomes-first-additive-manufacturer-approved-to-supply-boeing,https://j.mp/3okdp53
Benzinga,Cotton Ginning Machines Market 2021-2025 | Increasing Consumption of Cotton and Related Products to Emerge as Key Driver | Technavio,https://www.benzinga.com/pressreleases/21/01/b19353426/cotton-ginning-machines-market-2021-2025-increasing-consumption-of-cotton-and-related-products-to-,https://j.mp/39nwGyo
Benzinga,Webster Bank General Counsel Harriet Wolfe Named Best In-House Mentor by 2020 American Lawyer Industry Awards,https://www.benzinga.com/pressreleases/21/01/n19353397/webster-bank-general-counsel-harriet-wolfe-named-best-in-house-mentor-by-2020-american-lawyer-indu,https://j.mp/2NyN9Hu
Benzinga,Kruger Products' Memphis site announces new facial tissue line,https://www.benzinga.com/pressreleases/21/01/n19353348/kruger-products-memphis-site-announces-new-facial-tissue-line,https://j.mp/2KZF0Lu
