feed,title,long_url,short_url
Motley,1 No-Brainer Artificial Intelligence (AI) Stock to Buy for Under $200 in August,https://www.fool.com/investing/2025/08/23/1-no-brainer-ai-stock-to-buy-with-under-200-august/?source=iedfolrf0000001,
Motley,Could This Dividend King Double Your Money in 5 Years?,https://www.fool.com/investing/2025/08/23/could-this-dividend-king-double-your-money-in-x-ye/?source=iedfolrf0000001,
Motley,Is XRP a Millionaire Maker?,https://www.fool.com/investing/2025/08/23/is-xrp-a-millionaire-maker/?source=iedfolrf0000001,
Motley,The AI Chip War: A Look at the Unexpected Winners of the Next 5 Years,https://www.fool.com/investing/2025/08/23/ai-chip-war-unexpected-winners-next-5-years/?source=iedfolrf0000001,
Motley,"Billionaires Warren Buffett and David Tepper and ""Big Short"" Investor Michael Burry Just Bought UnitedHealth Group Stock. Should You?",https://www.fool.com/investing/2025/08/23/buffett-burry-tepper-unitedhealth-group-stock/?source=iedfolrf0000001,
