feed,title,long_url,short_url
Benzinga,"Wilshire Law Firm Promotes Jon C. Teller, Esq. to Partner",https://www.benzinga.com/pressreleases/21/01/n19327611/wilshire-law-firm-promotes-jon-c-teller-esq-to-partner,https://j.mp/2NEus5m
Benzinga,InventHelp Inventor Presents a Tool For Tile Installation (CKL-1415),https://www.benzinga.com/pressreleases/21/01/n19327610/inventhelp-inventor-presents-a-tool-for-tile-installation-ckl-1415,https://j.mp/2NDLW1L
Benzinga,The Worldwide Automotive Conformal Coatings Industry is Projected to Reach $2.7 Billion by 2025,https://www.benzinga.com/pressreleases/21/01/n19327609/the-worldwide-automotive-conformal-coatings-industry-is-projected-to-reach-2-7-billion-by-2025,https://j.mp/36ewZcJ
Benzinga,"NES Financial | JTC to Administer Private Equity Fund for Participant Capital Legacy Fund, LP",https://www.benzinga.com/pressreleases/21/01/n19327608/nes-financial-jtc-to-administer-private-equity-fund-for-participant-capital-legacy-fund-lp,https://j.mp/3iSCQcT
Benzinga,"Steven Le, DDS, Appointed Pediatric Director at Western Dental",https://www.benzinga.com/pressreleases/21/01/b19327607/steven-le-dds-appointed-pediatric-director-at-western-dental,https://j.mp/3ojKY7v
Benzinga,"BG Staffing, Inc. Announces Corporate Name Change to BGSF, Inc. to Reflect Broader Workforce Solutions Strategy",https://www.benzinga.com/pressreleases/21/01/b19327606/bg-staffing-inc-announces-corporate-name-change-to-bgsf-inc-to-reflect-broader-workforce-solutions,https://j.mp/3cazHny
Benzinga,United States Ankylosing Spondylitis Market and Competitive Landscape Report 2021 - ResearchAndMarkets.com,https://www.benzinga.com/pressreleases/21/01/b19327605/united-states-ankylosing-spondylitis-market-and-competitive-landscape-report-2021-researchandmarke,https://j.mp/3iSCQtp
Benzinga,Holly Sonders and Cordia Developing Virtual Restaurants,https://www.benzinga.com/pressreleases/21/01/g19327603/holly-sonders-and-cordia-developing-virtual-restaurants,https://j.mp/2Ydu1RA
Benzinga,Louis Cooke Is On a Mission To help 50 People Quit Their Job In 2021,https://www.benzinga.com/pressreleases/21/01/g19327587/louis-cooke-is-on-a-mission-to-help-50-people-quit-their-job-in-2021,https://j.mp/2NDLQXX
Benzinga,"ONGOING INVESTIGATION ALERT: The Schall Law Firm Announces it is Investigating Claims Against Eos Energy Enterprises, Inc. and Encourages Investors with Losses of $100,000 to Contact the Firm",https://www.benzinga.com/pressreleases/21/01/n19327579/ongoing-investigation-alert-the-schall-law-firm-announces-it-is-investigating-claims-against-eos-e,https://j.mp/2YjuuBL
Benzinga,"Oxygen-Free Copper Market by Grade, Product Form, End-use Industry & Region - Global Forecast to 2025 - ResearchAndMarkets.com",https://www.benzinga.com/pressreleases/21/01/b19327568/oxygen-free-copper-market-by-grade-product-form-end-use-industry-region-global-forecast-to-2025-re,https://j.mp/36cBBQA
Benzinga,NASA's OSIRIS-REx Mission Plans for May Asteroid Departure,https://www.benzinga.com/pressreleases/21/01/n19327566/nasas-osiris-rex-mission-plans-for-may-asteroid-departure,https://j.mp/3sWYDF5
