feed,title,long_url,short_url
SeekingAlpha,Brookfield Asset Management Q1 earnings beat; raises $19B of funds in quarter,https://seekingalpha.com/news/3968984,
SeekingAlpha,"Syros Pharmaceuticals GAAP EPS of -$0.85 beats by $0.20, revenue of $3M misses by $0.3M",https://seekingalpha.com/news/3968983,
SeekingAlpha,Vertex reports Q1 earningst; initiates Q2 and updates FY23 outlook,https://seekingalpha.com/news/3968982,
SeekingAlpha,IGT drives lottery innovation in Malta via long-term contracts,https://seekingalpha.com/news/3968981,
SeekingAlpha,IGT drives lottery innovation for National Lottery in Malta via long-term contracts,https://seekingalpha.com/news/3968979,
SeekingAlpha,IGT drives lottery innovation in Malta via long-term contracts,https://seekingalpha.com/news/3968980,
SeekingAlpha,Syneos stock rises as PE consortium to acquire in ~$7.1B deal,https://seekingalpha.com/news/3968974,
