feed,title,long_url,short_url
SeekingAlpha,"Avinger GAAP EPS of -$0.71 misses by $0.22, revenue of $1.89M misses by $0.11M",https://seekingalpha.com/news/3969512,
SeekingAlpha,"a.k.a. Brands GAAP EPS of -$0.07 misses by $0.02, revenue of $120.5M beats by $0.4M",https://seekingalpha.com/news/3969511,
SeekingAlpha,"Origin Materials GAAP EPS of $0.07 beats by $0.18, revenue of $1.7M beats by $0.4M",https://seekingalpha.com/news/3969510,
SeekingAlpha,"PennantPark Investment NII of $0.21 beats by $0.01, Total investment income of $36.35M beats by $4.45M",https://seekingalpha.com/news/3969509,
SeekingAlpha,"urban-gro GAAP EPS of -$0.48 misses by $0.15, revenue of $16.8M beats by $1.11M",https://seekingalpha.com/news/3969508,
SeekingAlpha,Semler Scientific reports Q1 results,https://seekingalpha.com/news/3969507,
SeekingAlpha,"Gladstone Investment NII of $0.26 misses by $0.01, Total investment income of $19.86M misses by $0.55M",https://seekingalpha.com/news/3969506,
