feed,title,long_url,short_url
SeekingAlpha,"Profound Medical GAAP EPS of $0.32 beats by $0.67, revenue of $1.86M misses by $0.21M",https://seekingalpha.com/news/3969562,
SeekingAlpha,"Paycor HCM GAAP EPS of -$0.04 misses by $0.01, revenue of $161.5M beats by $5.41M",https://seekingalpha.com/news/3969561,
SeekingAlpha,Boxlight beats Q1 top and bottom line estimates; initiates Q2 outlook,https://seekingalpha.com/news/3969560,
SeekingAlpha,Fossil slides after posting a wider Q1 loss than a year ago,https://seekingalpha.com/news/3969559,
SeekingAlpha,ACI Worldwide potential buyer still working on takeover - report,https://seekingalpha.com/news/3969558,
SeekingAlpha,"Crescent Energy Company GAAP EPS of $1.24 beats by $0.78, revenue of $590.14M beats by $98.5M",https://seekingalpha.com/news/3969557,
SeekingAlpha,"Nephros GAAP EPS of -$0.03 misses by $0.01, revenue of $3.7M beats by $0.02M",https://seekingalpha.com/news/3969556,
