feed,title,long_url,short_url
Investing,Gold Miners Sink Following Soft CPI Data: What Comes Next?,https://www.investing.com/analysis/gold-miners-sink-following-soft-cpi-data-what-comes-next-200643609,https://da.gd/adnBzw
Investing,Citigroup is Developing Blockchain FX Solution under the Monetary Authority of Singapore’s Project Guardian,https://www.investing.com/news/cryptocurrency-news/citigroup-is-developing-blockchain-fx-solution-under-the-monetary-authority-of-singapores-project-guardian-432SI-3234627,https://da.gd/6ayjPb
Investing,Lido DAO token surges 51% amid whale activity and reduced exchange supply,https://www.investing.com/news/cryptocurrency-news/lido-dao-token-surges-51-amid-whale-activity-and-reduced-exchange-supply-93CH-3234606,https://da.gd/pzqw
Investing,"XRP falls 6.13% amid SEC lawsuit uncertainty, potential penalties loom",https://www.investing.com/news/cryptocurrency-news/xrp-falls-613-amid-sec-lawsuit-uncertainty-potential-penalties-loom-93CH-3234597,https://da.gd/bEzo6T
Investing,Greece's National Bank attracts strong demand in 20% stake sale - source,https://www.investing.com/news/stock-market-news/greeces-national-bank-attracts-strong-demand-in-20-stake-sale--source-3234626,https://da.gd/EMcPDY
Investing,Citigroup's restructuring under CEO Jane Fraser faces scrutiny,https://www.investing.com/news/stock-market-news/citigroups-restructuring-under-ceo-jane-fraser-faces-scrutiny-93CH-3234603,https://da.gd/8iEQb5
Investing,"SBI maintains MCLR rates, supports stable EMI for borrowers",https://www.investing.com/news/stock-market-news/sbi-maintains-mclr-rates-supports-stable-emi-for-borrowers-93CH-3234602,https://da.gd/ShXfq
Investing,"JD.com Inc Adr earnings beat by ¥0.80, revenue topped estimates",https://www.investing.com/news/stock-market-news/jdcom-inc-adr-earnings-beat-by-080-revenue-topped-estimates-3234600,https://da.gd/kNiaj
Investing,Asian stocks rally on US inflation slowdown and robust China data,https://www.investing.com/news/stock-market-news/asian-stocks-rally-on-us-inflation-slowdown-and-robust-china-data-93CH-3234598,https://da.gd/B3k2T
