feed,title,long_url,short_url
gNews,Stock Market Faces Another Oil Spill as Energy Sector Falls - The Wall Street Journal,https://www.wsj.com/livecoverage/stock-market-news-today-11-21-2022/card/stock-market-faces-another-oil-spill-as-energy-sector-falls-whYWcIOv2WHonjH7iJEG,https://on.wsj.com/3EneO57
gNews,Petroreconcavo S.A.'s (BVMF:RECV3) Stock's On An Uptrend: Are Strong Financials Guiding The Market? - Simply Wall St,https://simplywall.st/stocks/br/energy/bovespa-recv3/petroreconcavo-shares/news/petroreconcavo-sas-bvmfrecv3-stocks-on-an-uptrend-are-strong,https://bit.ly/3gvb7Ce
gNews,Buffett's Berkshire lifts Japan bets to $11 billion amid buying spree - Markets Insider,https://markets.businessinsider.com/news/stocks/warren-buffett-berkshire-hathaway-buys-japan-stocks-portfolio-spending-spree-2022-11,https://bit.ly/3XeGeTn
gNews,Global stocks down after Wall St weekly loss on rate fears - News10NBC,https://www.whec.com/national-world/global-stocks-down-after-wall-st-weekly-loss-on-rate-fears/,https://bit.ly/3gpCZrq
gNews,South Korea Financial Markets | Nation & World | djournal.com - Northeast Mississippi Daily Journal,https://www.djournal.com/news/nation-world/south-korea-financial-markets/image_a24eb875-2df3-5ef7-bd44-6c4272be4f35.html,https://bit.ly/3TTKS6c
