feed,title,long_url,short_url
SeekingAlpha,Amazon considered saving Argo AI self-driving startup - Bloomberg,https://seekingalpha.com/news/3910237,
SeekingAlpha,"Universal Security Instruments GAAP EPS of $0.09, revenue of $5.86M",https://seekingalpha.com/news/3910236,
SeekingAlpha,FTI Consulting upsizes senior revolving credit facility to $900M,https://seekingalpha.com/news/3910235,
SeekingAlpha,Dell shares surge as results top Wall Street's expectations,https://seekingalpha.com/news/3910234,
SeekingAlpha,"GreenBox POS GAAP EPS of -$0.32 misses by $0.05, revenue of $10.63M beats by $0.63M",https://seekingalpha.com/news/3910233,
SeekingAlpha,Why did Disney stock surge today? Return of the CEO,https://seekingalpha.com/news/3910232,
SeekingAlpha,"GDS Holdings GAAP EPS of -$0.03 beats by $0.17, revenue of $332.8M beats by $7.47M",https://seekingalpha.com/news/3910231,
SeekingAlpha,Why The Smart Money Is Buying Otter Tail Stock,https://seekingalpha.com/article/4559633,
