feed,title,long_url,short_url
InsiderMonkey,7 Best Robotic Surgery Stocks to Buy,https://insidermonkey.com/blog/--1766628,
InsiderMonkey,5 Best Robotic Surgery Stocks to Buy,https://insidermonkey.com/blog/--1766895,
InsiderMonkey,12 Best Medical Stocks to Invest In According to Billionaires,https://insidermonkey.com/blog/--1766760,
InsiderMonkey,5 Best Medical Stocks to Invest In According to Billionaires,https://insidermonkey.com/blog/--1766899,
InsiderMonkey,Here is why Canadian Natural Resources Limited (CNQ) is among the Best Natural Gas Stocks to Buy for Transitional Power,https://insidermonkey.com/blog/--1768159,
InsiderMonkey,Ecopetrol S.A. (EC): 9 Best Natural Gas Stocks to Buy for Transitional Power,https://insidermonkey.com/blog/--1768161,
InsiderMonkey,Enterprise Products Partners (EPD) Gets A Higher Target But Analysts Stay Cautious,https://insidermonkey.com/blog/--1768163,
InsiderMonkey,Why Shell’s (SHEL) Capital Return Strategy Is Back In Focus,https://insidermonkey.com/blog/--1768165,
InsiderMonkey,Equinor (EQNR) Lands An Upgrade As Europe’s Gas Market Tightens,https://insidermonkey.com/blog/--1768169,
InsiderMonkey,Why Exxon Mobil’s (XOM) Board Proposals Are Drawing Investor Attention,https://insidermonkey.com/blog/--1768171,
InsiderMonkey,Enbridge (ENB) Gets A Higher Target As Its Cash Flow Story Remains Intact,https://insidermonkey.com/blog/--1768173,
InsiderMonkey,Energy Transfer (ET) Gets A Higher Target As EBITDA Outlook Improves,https://insidermonkey.com/blog/--1768167,
InsiderMonkey,"Here is why NRx Pharmaceuticals, Inc. (NRXP) is among the Best Rated Penny Stocks to Buy According to Wall Street Analysts",https://insidermonkey.com/blog/--1768178,
InsiderMonkey,VolitionRx Limited (VNRX): 7 Best Rated Penny Stocks to Buy According to Wall Street Analysts,https://insidermonkey.com/blog/--1768180,
InsiderMonkey,eHealth (EHTH) Gets A Higher Target As Operational Momentum Improves,https://insidermonkey.com/blog/--1768182,
InsiderMonkey,Embecta (EMBC) Hit With A Sharp Target Cut As Medtech Sentiment Weakens,https://insidermonkey.com/blog/--1768184,
InsiderMonkey,Why Prairie Operating’s (PROP) Near-Term Pressure Hasn’t Broken The Bull Case,https://insidermonkey.com/blog/--1768186,
InsiderMonkey,Alight (ALIT) Expands Its Health Solutions Network With New Strategic Partners,https://insidermonkey.com/blog/--1768188,
