feed,title,long_url,short_url
SeekingAlpha,9 meters launches Phase 2 VIBRANT study of vurolenatide for short bowel syndrome,https://seekingalpha.com/news/3705942,
SeekingAlpha,Tesla price target cut at Canaccord with new battery cell breakthrough still a wildcard,https://seekingalpha.com/news/3705941,
SeekingAlpha,Meten Edtechx to use non-fungible token for digital copyright in online education,https://seekingalpha.com/news/3705940,
SeekingAlpha,Happiness Biotech trades high on agreement to distribute Volkswagen EVs,https://seekingalpha.com/news/3705938,
SeekingAlpha,C4 Therapeutics gets dosing underway in early-stage CFT7455 lymphoma trial,https://seekingalpha.com/news/3705937,
SeekingAlpha,Paysafe: Low Revenue Growth,https://seekingalpha.com/article/4434684,
