feed,title,long_url,short_url
Investing,JD.com stock jumps on strong fourth-quarter profit and revenue beat,https://www.investing.com/news/stock-market-news/jdcom-stock-jumps-on-strong-fourthquarter-profit-and-revenue-beat-3911257,https://da.gd/vCWYJ
Investing,Robert Walters sees decline in pretax profit and revenue for 2024,https://www.investing.com/news/stock-market-news/robert-walters-sees-decline-in-pretax-profit-and-revenue-for-2024-93CH-3911253,https://da.gd/3h9l8d
Investing,Admiral shares jump 6% as profits and dividend jump past expectations,https://www.investing.com/news/stock-market-news/admiral-shares-jump-6-as-profits-and-dividend-jump-past-expectations-3911242,https://da.gd/UWha
Investing,"Hunting reports rise in annual profit, backed by international markets",https://www.investing.com/news/stock-market-news/hunting-reports-rise-in-annual-profit-backed-by-international-markets-93CH-3911240,https://da.gd/N8XgAX
Investing,"JD.com Inc Adr earnings beat by ¥1.98, revenue topped estimates",https://www.investing.com/news/stock-market-news/jdcom-inc-adr-earnings-beat-by-198-revenue-topped-estimates-3911239,https://da.gd/wtwobD
Investing,Havas plans 10% capital buyback and reverse share split after Vivendi spinoff; shares soar,https://www.investing.com/news/stock-market-news/havas-plans-10-capital-buyback-and-reverse-share-split-after-vivendi-spinoff-shares-soar-93CH-3911236,https://da.gd/LG6Ri
Investing,Migros stock drops on soft underlying EBIT margins,https://www.investing.com/news/stock-market-news/migros-stock-drops-on-soft-underlying-ebit-margins-93CH-3911229,https://da.gd/npQmX
Investing,China's JD.com beats quarterly revenue estimate on robust demand,https://www.investing.com/news/economy-news/chinas-jdcom-beats-quarterly-revenue-estimate-on-robust-demand-3911248,https://da.gd/sBkLu
