feed,title,long_url,short_url
Yahoo,"Taiwan’s President, TSMC CEO Plan to Hold Briefing",https://finance.yahoo.com/news/taiwan-president-tsmc-ceo-plan-084232998.html,https://da.gd/lJR1F
Yahoo,Onsemi Discloses Allegro Takeover Bid at $6.9 Billion Value,https://finance.yahoo.com/news/onsemi-discloses-allegro-takeover-bid-035506435.html,https://da.gd/sPldnj
Yahoo,"Global rubber shortfall looms in 2025 on stagnant output, association says",https://finance.yahoo.com/news/global-rubber-shortfall-looms-2025-052410800.html,https://da.gd/FgRpgO
Yahoo,1 Mind-Boggling Number From Nvidia's Q4 Earnings That May Have You Thinking Twice About Whether the Stock Peaked,https://www.fool.com/investing/2025/03/06/1-mind-boggling-number-from-nvidias-q4-earnings-th/?source=eptyholnk0000202&utm_source=yahoo-host-full&utm_medium=feed&utm_campaign=article&referring_guid=fa37d27e-6660-4cb2-9471-b2540865e28d&.tsrc=rss,https://da.gd/sIHoa
Yahoo,CRA hits taxpayer with hefty 'foreign property' penalty over Swiss bank account,https://ca.finance.yahoo.com/news/cra-hits-taxpayer-hefty-foreign-110041794.html?.tsrc=rss,https://da.gd/OTQsU
