feed,title,long_url,short_url
Yahoo,Q4 2024 Rigetti Computing Inc Earnings Call,https://finance.yahoo.com/news/q4-2024-rigetti-computing-inc-150824572.html?.tsrc=rss,https://da.gd/ZGC6UB
Yahoo,Nvidia Shares Fall as Marvell earnings trigger AI investment fears,https://finance.yahoo.com/news/nvidia-shares-fall-marvell-earnings-150653069.html?.tsrc=rss,https://da.gd/SRtEz
Yahoo,"Nvidia Falls On AI Chip Rival's Report, Another Looms; Is Nvidia A Buy Or Sell Now?",https://finance.yahoo.com/m/dc591aa5-8656-399f-a2b0-90fb4c8c329e/nvidia-falls-on-ai-chip.html?.tsrc=rss,https://da.gd/z0RkZx
Yahoo,Tesla Stock Drops. Why This Analyst Just Issued a Warning.,https://finance.yahoo.com/m/c71b1767-0c65-38eb-b633-bf322b844d6e/tesla-stock-drops.-why-this.html?.tsrc=rss,https://da.gd/ODhoA
Yahoo,3 Drone Technology Stocks to Boost Portfolio Returns,https://finance.yahoo.com/news/3-drone-technology-stocks-boost-132900941.html?.tsrc=rss,https://da.gd/Q6uKLP
