feed,title,long_url,short_url
Investing,Finland stocks higher at close of trade; OMX Helsinki 25 up 1.40%,https://www.investing.com/news/stock-market-news/finland-stocks-higher-at-close-of-trade-omx-helsinki-25-up-140-3912905,https://da.gd/mI0COX
Investing,US corporate bond investors cautiously navigate trade war uncertainty,https://www.investing.com/news/stock-market-news/us-corporate-bond-investors-cautiously-navigate-trade-war-uncertainty-3912899,https://da.gd/h69C2
Investing,"Moody's upgrades Rolls-Royce rating, maintains positive outlook",https://www.investing.com/news/stock-market-news/moodys-upgrades-rollsroyce-rating-maintains-positive-outlook-93CH-3912877,https://da.gd/oehlH7
Investing,"Mexico won't have to pay tariffs on USMCA goods until April 2, Trump says",https://www.investing.com/news/economy-news/mexico-wont-have-to-pay-tariffs-on-usmca-goods-until-april-2-trump-says-3912884,https://da.gd/4LGuK
Investing,"ECB governors see growing chance of April pause before cutting resumes, sources say",https://www.investing.com/news/economy-news/ecb-governors-see-growing-chance-of-april-pause-before-cutting-resumes-sources-say-3912878,https://da.gd/cW60Ih
Investing,"Magnitude 6.3 earthquake strikes Antofagasta, Chile, EMSC says",https://www.investing.com/news/economy-news/magnitude-63-earthquake-strikes-antofagasta-chile-emsc-says-3912869,https://da.gd/SBNb9O
