feed,title,long_url,short_url
Benzinga,Cryptocurrency Solana's Price Increased More Than 6% Within 24 hours,https://benzinga.com/markets/cryptocurrency/21/09/23114266/cryptocurrency-solanas-price-increased-more-than-6-within-24-hours,https://j.mp/3iaQVn8
Benzinga,Monday's Morning Update On Crypto Gainers and Losers,https://benzinga.com/markets/cryptocurrency/21/09/23114257/mondays-morning-update-on-crypto-gainers-and-losers,https://j.mp/39DDqrn
Benzinga,Death Cross Looms Over Roku Investors,https://benzinga.com/markets/21/09/23113975/death-cross-looms-over-roku-investors,https://j.mp/3ALdF45
Benzinga,Death Cross Looms Over Electronic Arts Investors,https://benzinga.com/markets/21/09/23113974/death-cross-looms-over-electronic-arts-investors,https://j.mp/3ic2V7z
Benzinga,Legion Network Announces A New Super Blockchain Ecosystem,https://benzinga.com/markets/cryptocurrency/21/09/23114937/legion-network-announces-a-new-super-blockchain-ecosystem,https://j.mp/3lXqLoO
Benzinga,Death Cross Looms Over Stanley Black & Decker Investors,https://benzinga.com/markets/21/09/23113972/death-cross-looms-over-stanley-black-decker-investors,https://j.mp/3m4JZsx
Benzinga,Will Chart Analysts Notice Bad Omen on Hewlett Packard's Chart,https://benzinga.com/markets/21/09/23113971/will-chart-analysts-notice-bad-omen-on-hewlett-packards-chart,https://j.mp/3o9gzfx
