feed,title,long_url,short_url
Benzinga,Nikola Enters Second $300M Equity Purchase Agreement With Tumim,https://benzinga.com/news/21/09/23113964/nikola-enters-second-300m-equity-purchase-agreement-with-tumim,https://j.mp/3m7cSEH
Benzinga,Bristol Myers' Two Opdivo Based Regimes Under FDA Review For Esophageal Cancer,https://benzinga.com/general/biotech/21/09/23114036/bristol-myers-two-opdivo-based-regimes-under-fda-review-for-esophageal-cancer,https://j.mp/3EW9zsw
Benzinga,Overview Of Value Stocks In The Communication Services Sector,https://benzinga.com/news/21/09/23113817/overview-of-value-stocks-in-the-communication-services-sector,https://j.mp/3kR5yxH
Benzinga,5 Value Stocks To Watch In The Healthcare Sector,https://benzinga.com/news/21/09/23113804/5-value-stocks-to-watch-in-the-healthcare-sector,https://j.mp/3ivlCUf
Benzinga,Overview Of Value Stocks In The Real Estate Sector,https://benzinga.com/news/21/09/23113727/overview-of-value-stocks-in-the-real-estate-sector,https://j.mp/3ujOx2e
Benzinga,"Leading And Lagging Sectors For September 27, 2021",https://benzinga.com/etfs/sector-etfs/21/09/23113055/leading-and-lagging-sectors-for-september-27-2021,https://j.mp/3ASxtms
