feed,title,long_url,short_url
Investing,Ault Alliance Exploring Distribute Special Dividend Payable in Bitcoin,https://www.investing.com/news/cryptocurrency-news/ault-alliance-exploring-distribute-special-dividend-payable-in-bitcoin-432SI-3123154,https://da.gd/W6F8xs
Investing,"Bitcoin sees 3-month high in new addresses following spike to $31,000",https://www.investing.com/news/cryptocurrency-news/bitcoin-sees-3month-high-in-new-addresses-following-spike-to-31000-3123151,https://da.gd/nAU6
Investing,"Bitcoin's (BTC) Run to $30,000 Is Not What You Think at All",https://www.investing.com/news/cryptocurrency-news/bitcoins-btc-run-to-30000-is-not-what-you-think-at-all-3123146,https://da.gd/OnK4Fo
Investing,Crypto custody market reached $448 billion in 2022: Report,https://www.investing.com/news/cryptocurrency-news/crypto-custody-market-reached-448-billion-in-2022-report-3123135,https://da.gd/V3AF
Investing,'Rich Dad' Author Gives Bitcoin (BTC) New Mega Predictio,https://i-invdn-com.investing.com/news/LYNXMPEDAR0WY-ORUBS_M.jpg,https://da.gd/ynCp
Investing,Volkswagen faces fresh investor doubts on independence of planned Xinjiang audit,https://www.investing.com/news/stock-market-news/volkswagen-faces-fresh-investor-doubts-on-independence-of-planned-xinjiang-audit-3123138,https://da.gd/5MTLS4
