feed,title,long_url,short_url
SeekingAlpha,Taysha falls after data for Rett syndrome candidate,https://seekingalpha.com/news/4116967,
SeekingAlpha,KKR-SingTel consortium to invest $1.3B in ST Telemedia Global Data Centres,https://seekingalpha.com/news/4116966,
SeekingAlpha,O-I Glass parks $65M in electrification and decarbonization in France,https://seekingalpha.com/news/4116965,
SeekingAlpha,Apple's price target raised at J.P. Morgan on AI boost to iPhones,https://seekingalpha.com/news/4116961,
SeekingAlpha,Ameren Illinois announces pricing of first mortgage bonds due 2054,https://seekingalpha.com/news/4116964,
SeekingAlpha,"CHY: Solid Income, Good Long-Term Record, But Not A Buy",https://seekingalpha.com/article/4699589,
SeekingAlpha,Knowles: Stable Results,https://seekingalpha.com/article/4699816,
