feed,title,long_url,short_url
ETFdb:DailyRecap,Exchange Reflections With Sovaida Noronha,https://etfdb.com/news/2022/06/22/exchange-reflections-with-sovaida-noronha/,https://bit.ly/3bekSBP
ETFdb:DailyRecap,LGBTQIA+ Clients Face Unique Financial Challenges,https://etfdb.com/retirement-income-channel/lgbtqia-clients-face-unique-financial-challenges/,https://bit.ly/3HZI57r
ETFdb:DailyRecap,Insurance Companies Allotting More to Fixed Income ETFs,https://etfdb.com/institutional-income-strategies-channel/insurance-companies-allotting-more-to-fixed-income-etfs/,https://bit.ly/3xK85Pb
ETFdb:DailyRecap,This Fund Benefits From U.S. Dollar Strength,https://etfdb.com/model-portfolio-channel/this-fund-benefits-from-us-dollar-strength/,https://bit.ly/3xN0qzF
ETFdb:DailyRecap,Flows Into Managed Futures Funds Have Doubled in 2022,https://etfdb.com/managed-futures-channel/flows-into-managed-futures-funds-have-doubled-in-2022/,https://bit.ly/3OyFfrX
ETFdb:DailyRecap,TD Ameritrade: Rosenbluth on Fixed Income Resurgence,https://etfdb.com/news/2022/06/22/td-ameritrade-rosenbluth-on-fixed-income-resurgence/,https://bit.ly/3Ok3XMX
ETFdb:DailyRecap,This Week's Top Performing ETFs: 06/19/2022,https://etfdb.com/news/2022/06/22/top-performing-etfs-2022-06-19/,https://bit.ly/3NfcfnQ
ETFdb:DailyRecap,US LNG Projects Goes Ahead as Long-term Buyers Line Up,https://etfdb.com/energy-infrastructure-channel/us-lng-projects-goes-ahead-as-long-term-buyers-line-up/,https://bit.ly/3zVh4Ql
ETFdb:DailyRecap,Best & Worst Monthly Performers: June 22 Edition,https://etfdb.com/news/2022/06/22/best-worst-monthly-performers-june-22-edition/,https://bit.ly/3HYVTz3
ETFdb:DailyRecap,ETF Leaders Powered by the NYSE: Discipline Funds,https://etfdb.com/news/2022/06/22/etf-leaders-powered-by-the-nyse-discipline-funds/,https://bit.ly/3bmfr3Z
ETFdb:DailyRecap,MicroSectors Introduces U.S. Travel Long and Short ETNs,https://etfdb.com/news/2022/06/22/microsectors-introduces-us-travel-long-and-short-etns/,https://bit.ly/3na18lI
ETFdb:DailyRecap,EV Sales Data Interesting for CLNR,https://etfdb.com/dual-impact-channel/ev-sales-data-interesting-for-clnr/,https://bit.ly/3ycwtKR
ETFdb:DailyRecap,Secular Winners Located in These ETFs,https://etfdb.com/etf-education-channel/secular-winners-located-in-these-etfs/,https://bit.ly/3ybID6N
ETFdb:DailyRecap,Dividend Durability on Display,https://etfdb.com/dividend-channel/dividend-durability-on-display/,https://bit.ly/3ybIxMt
ETFdb:DailyRecap,"An ETF With Strong Balance Sheet Stocks, Opportunities",https://etfdb.com/future-etfs-channel/an-etf-with-strong-balance-sheet-stocks-opportunities/,https://bit.ly/3yc75oE
ETFdb:DailyRecap,How the Energy Transition Looks: Fortescue Metals Group,https://etfdb.com/climate-insights-channel/how-the-energy-transition-looks-fortescue-metals-group/,https://bit.ly/39Qf5C9
ETFdb:DailyRecap,Alerian MLP Infrastructure Index Gets an Update,https://etfdb.com/energy-infrastructure-channel/alerian-mlp-infrastructure-index-gets-an-update/,https://bit.ly/3OcPHpp
ETFdb:DailyRecap,Answering 5 Questions Investors Have About The Market,https://etfdb.com/etf-strategist-channel/answering-5-questions-investors-have-about-the-market/,https://bit.ly/3NcIe8m
ETFdb:DailyRecap,Rate Hikes Can't Come Soon Enough for Bond Investors,https://etfdb.com/fixed-income-channel/rate-hikes-can-t-come-soon-enough-for-bond-investors/,https://bit.ly/3NeP2Cv
ETFdb:DailyRecap,Report Says Smart Buildings Market Could Prosper,https://etfdb.com/thematic-investing-channel/report-says-smart-buildings-market-could-prosper/,https://bit.ly/3b8rvWk
ETFdb:DailyRecap,Record Money Traded in Bond ETFs as Fed Sought Hike,https://etfdb.com/news/2022/06/22/record-money-traded-in-bond-etfs-as-fed-sought-hike/,https://bit.ly/3y7vz29
