feed,title,long_url,short_url
SeekingAlpha,"Qiagen Non-GAAP EPS of $0.50 beats by $0.02, revenue of $470M misses by $0.85M",https://seekingalpha.com/news/4026540,
SeekingAlpha,"Comstock Resources Non-GAAP EPS of $0.04 misses by $0.01, revenue of $376.74M beats by $44.46M",https://seekingalpha.com/news/4026539,
SeekingAlpha,"Independence Realty Trust FFO of $0.30 beats by $0.01, revenue of $168.38M beats by $1.48M",https://seekingalpha.com/news/4026538,
SeekingAlpha,"ZoomInfo Non-GAAP EPS of $0.26 beats by $0.01, revenue of $313.8M beats by $3.3M",https://seekingalpha.com/news/4026537,
SeekingAlpha,"Addus HomeCare Non-GAAP EPS of $1.15 beats by $0.07, revenue of $270.7M beats by $3.55M",https://seekingalpha.com/news/4026536,
SeekingAlpha,Apollo Commercial Real Estate Finance Non-GAAP EPS of $0.37 beats by $0.02,https://seekingalpha.com/news/4026535,
SeekingAlpha,Simon Property Group - a surprising 'buy' stock,https://seekingalpha.com/news/4026534,
SeekingAlpha,SoFi Stock Pops Then Drops As Investors Digest Q3 Earnings Report,https://seekingalpha.com/article/4645130,
