feed,title,long_url,short_url
SeekingAlpha,Humana beats top-line and bottom-line estimates; updates FY24 outlook,https://seekingalpha.com/news/4092985,
SeekingAlpha,"Boston Scientific Non-GAAP EPS of $0.56 beats by $0.05, revenue of $3.86B beats by $180M",https://seekingalpha.com/news/4092984,
SeekingAlpha,"Hasbro Non-GAAP EPS of $0.61, revenue of $757.3M",https://seekingalpha.com/news/4092983,
SeekingAlpha,Zuora enters into partnership with Ubisoft,https://seekingalpha.com/news/4092982,
SeekingAlpha,"China's SenseTime surges on unveiling new AI model, rival to GPT-4 Turbo",https://seekingalpha.com/news/4092979,
SeekingAlpha,"AT&T GAAP EPS of $0.47 misses by $0.02, revenue of $30.02B misses by $510M",https://seekingalpha.com/news/4092981,
