feed,title,long_url,short_url
CryptoNewsFlash,Bullish news: Bitcoin to become legal tender to drive BTC adoption for 211M people worldwide,https://crypto-news-flash.com/bullish-news-bitcoin-to-become-legal-tender-to-drive-btc-adoption-for-211m-people-worldwide/,https://da.gd/GrBvb
CryptoNewsFlash,Massive Ethereum wallets move ETH to exchanges – Will a sell off drive ETH price to $850?,https://crypto-news-flash.com/massive-ethereum-wallets-move-eth-to-exchanges-will-a-sell-off-drive-eth-price-to-850/,https://da.gd/eNvt
CryptoNewsFlash,"Cardano leading the race before Polkadot, Cosmos and Ethereum – Will it drive ADA to $5?",https://crypto-news-flash.com/cardano-leading-the-race-before-polkadot-cosmos-and-ethereum-will-it-drive-ada-to-5/,https://da.gd/1bjL1W
CryptoNewsFlash,Understanding the Impact of Cryptocurrency Education on Online Gaming Platforms,https://crypto-news-flash.com/understanding-the-impact-of-cryptocurrency-education-on-online-gaming-platforms/,https://da.gd/2Jo7G
CryptoNewsFlash,BREAKING: Elon Musk to be replaced by Edward Snowden as Twitter CEO with a salary in Bitcoin – Will Dogecoin fall?,https://crypto-news-flash.com/breaking-elon-musk-to-be-replaced-by-edward-snowden-as-twitter-ceo-with-a-salary-in-bitcoin-will-dogecoin-fall/,https://da.gd/lYEX
CryptoNewsFlash,Shiba Inu Racing NFT launch to conquer billion-$-market – Will it drive SHIB price to $1?,https://crypto-news-flash.com/shiba-inu-racing-nft-launch-to-conquer-billion-market-will-it-drive-shib-price-to-1/,https://da.gd/Bpuw
