feed,title,long_url,short_url
Benzinga,Ethereum Edges Higher But Remains Below This Key Level; XDC Network Becomes Top Gainer,https://benzinga.com/markets/cryptocurrency/22/12/30129017/ethereum-edges-higher-but-remains-below-this-key-level-xdc-network-becomes-top-gainer,https://da.gd/MCsq
Benzinga,This Favorable Sign Appears On Stellantis's Chart,https://benzinga.com/markets/22/12/30128924/this-favorable-sign-appears-on-stellantiss-chart,https://da.gd/xlEqeG
Benzinga,Will Investors Notice Exciting Sign On Raytheon Technologies's Chart?,https://benzinga.com/markets/22/12/30128917/will-investors-notice-exciting-sign-on-raytheon-technologiess-chart,https://da.gd/Wei4
Benzinga,A Bullish Sign Appears On Royal Caribbean Gr's Chart,https://benzinga.com/markets/22/12/30128915/a-bullish-sign-appears-on-royal-caribbean-grs-chart,https://da.gd/jCVti2
Benzinga,Hopeful Golden Cross Forms On Otis Worldwide's Chart,https://benzinga.com/markets/22/12/30128904/hopeful-golden-cross-forms-on-otis-worldwides-chart,https://da.gd/eKko
Benzinga,This Foreboding Sign Looms Over EQT's Chart,https://benzinga.com/markets/22/12/30128902/this-foreboding-sign-looms-over-eqts-chart,https://da.gd/HLmHxM
