feed,title,long_url,short_url
SeekingAlpha,RF Industries has a new COO,https://seekingalpha.com/news/3838507,
SeekingAlpha,"Volta Inc. GAAP EPS of -$0.28 beats by $0.02, revenue of $8.4M beats by $0.12M",https://seekingalpha.com/news/3838506,
SeekingAlpha,"GCM Mining Non-GAAP EPS of $0.15, revenue of $101.3M misses by $1.7M",https://seekingalpha.com/news/3838505,
SeekingAlpha,"Nasdaq, S&P, Dow futures climb, yields arrest slide and gain",https://seekingalpha.com/news/3838502,
SeekingAlpha,"Cineplex GAAP EPS of -$0.67, revenue of $228.7M beats by $70.46M",https://seekingalpha.com/news/3838504,
SeekingAlpha,Fortescue weighs shuttered U.S. coal mine site for green hydrogen plant,https://seekingalpha.com/news/3838503,
