feed,title,long_url,short_url
SeekingAlpha,Abeona Therapeutics files for offering of 15.2M shares by sellers,https://seekingalpha.com/news/3912926,
SeekingAlpha,"Babcock & Wilcox, Chart Industries to integrate on deployment of B&W’s BrightLoopTM Technology",https://seekingalpha.com/news/3912925,
SeekingAlpha,"Patterson Non-GAAP EPS of $0.63 beats by $0.06, revenue of $1.63B misses by $50M, reaffirms FY outlook",https://seekingalpha.com/news/3912924,
SeekingAlpha,Duluth Holdings sees margins squeezed with promotions elevated,https://seekingalpha.com/news/3912923,
SeekingAlpha,Big Lots stock slumps as inventory clearing efforts squeeze margins,https://seekingalpha.com/news/3912922,
SeekingAlpha,"Jolly Old Jerome's market gift comes early, but Fed could still bring a lump of coal",https://seekingalpha.com/news/3912902,
