feed,title,long_url,short_url
Investing,Fed’s Changing Its Tune,https://www.investing.com/analysis/feds-changing-its-tune-200644449,https://da.gd/oXw91
Investing,Mixed Fortunes for U.S. Manufacturing: November 2023 Output Analysis,https://www.investing.com/news/stock-market-news/mixed-fortunes-for-us-manufacturing-november-2023-output-analysis-3258023,https://da.gd/8Bftjb
Investing,U.S. Safety Regulator Probes Nissan Over Engine Failure Reports,https://www.investing.com/news/stock-market-news/us-safety-regulator-probes-nissan-over-engine-failure-reports-3258022,https://da.gd/pQbJ
Investing,Nikola names Jonathan Pertchik to Board of Directors,https://www.investing.com/news/stock-market-news/nikola-names-jonathan-pertchik-to-board-of-directors-432SI-3258021,https://da.gd/doAbc
Investing,Power blip across New York City followed equipment failure - Con Edison,https://www.investing.com/news/stock-market-news/power-blip-across-new-york-city-followed-equipment-failure--con-edison-3258018,https://da.gd/gIdQzn
