feed,title,long_url,short_url
Investing,"Super Micro Computer shares fall, but analysts expect the AI momentum to continue",https://www.investing.com/news/stock-market-news/super-micro-computer-shares-fall-but-analysts-expect-the-ai-momentum-to-continue-432SI-3306602,https://da.gd/PywpR
Investing,Germany stocks higher at close of trade; DAX up 0.42%,https://www.investing.com/news/stock-market-news/germany-stocks-higher-at-close-of-trade-dax-up-042-3306600,https://da.gd/BAHxKP
Investing,France stocks higher at close of trade; CAC 40 up 0.32%,https://www.investing.com/news/stock-market-news/france-stocks-higher-at-close-of-trade-cac-40-up-032-3306599,https://da.gd/KnZqpi
Investing,Apple Set to Revolutionize App Development with New AI Tools,https://www.investing.com/news/stock-market-news/apple-set-to-revolutionize-app-development-with-new-ai-tools-3306598,https://da.gd/f3bh
Investing,Why Toast (TOST) Stock Is Trading Up Today,https://www.investing.com/news/stock-market-news/why-toast-tost-stock-is-trading-up-today-3306597,https://da.gd/80EHw2
Investing,Why Dropbox (DBX) Stock Is Down Today,https://www.investing.com/news/stock-market-news/why-dropbox-dbx-stock-is-down-today-3306596,https://da.gd/kOSpVE
Investing,Why Are The Trade Desk (TTD) Shares Soaring Today,https://www.investing.com/news/stock-market-news/why-are-the-trade-desk-ttd-shares-soaring-today-3306595,https://da.gd/1IYEd
Investing,"Roku (ROKU) Stock Trades Down, Here Is Why",https://www.investing.com/news/stock-market-news/roku-roku-stock-trades-down-here-is-why-3306594,https://da.gd/Wxscd
Investing,"Applied Materials (AMAT) Shares Skyrocket, What You Need To Know",https://www.investing.com/news/stock-market-news/applied-materials-amat-shares-skyrocket-what-you-need-to-know-3306593,https://da.gd/qsIEr
Investing,Why TreeHouse Foods (THS) Shares Are Getting Obliterated Today,https://www.investing.com/news/stock-market-news/why-treehouse-foods-ths-shares-are-getting-obliterated-today-3306592,https://da.gd/ILjAL
