feed,title,long_url,short_url
InsiderMonkey,J.P. Morgan Maintains a Buy on Mizuho Financial Group (MFG),https://insidermonkey.com/blog/--1596424,
InsiderMonkey,Bank of America Securities Maintains a Sell Rating on Ecopetrol S.A. (EC) With a $7 PT,https://insidermonkey.com/blog/--1596425,
InsiderMonkey,What Does Wall Street Think About Banco Santander S.A. (SAN)?,https://insidermonkey.com/blog/--1596426,
InsiderMonkey,"Citi Reiterates a Sell Rating on Wipro Limited (WIT), Sets a PT of INR225",https://insidermonkey.com/blog/--1596427,
InsiderMonkey,"UBS Lowers PT on Ambev S.A. (ABEV) to $2.20 from $2.50, Keeps a Neutral Rating",https://insidermonkey.com/blog/--1596428,
InsiderMonkey,"Berenberg Slashes PT on Haleon plc (HLN) to 500 GBp from 503 GBp, Keeps a Buy Rating",https://insidermonkey.com/blog/--1596429,
InsiderMonkey,Bernstein Maintains a Hold on Stellantis N.V. (STLA),https://insidermonkey.com/blog/--1596430,
InsiderMonkey,Bernstein Maintains a Hold on Vale S.A. (VALE) With a PT of $11.50,https://insidermonkey.com/blog/--1596432,
InsiderMonkey,Citi Remains Bullish on Amcor plc (AMCR),https://insidermonkey.com/blog/--1596433,
InsiderMonkey,Grab Holdings (GRAB) Announces a Strategic Equity Investment in WeRide,https://insidermonkey.com/blog/--1596436,
InsiderMonkey,Oppenheimer Reiterates a Buy Rating on Freshworks Inc. (FRSH) With a $19 PT,https://insidermonkey.com/blog/--1596497,
InsiderMonkey,"Bernstein Maintains a Hold on Snap Inc. (SNAP), Sets a $9 PT",https://insidermonkey.com/blog/--1596498,
InsiderMonkey,Craig-Hallum Reiterates a Buy Rating on Cellebrite DI Ltd. (CLBT),https://insidermonkey.com/blog/--1596499,
InsiderMonkey,"J.P. Morgan Reiterates a Buy Rating on Remitly Global (RELY), Sets a $25 PT",https://insidermonkey.com/blog/--1596500,
InsiderMonkey,What Does Wall Street Think About Riot Platforms (RIOT)?,https://insidermonkey.com/blog/--1596503,
InsiderMonkey,RBC Capital Maintains a Hold on UiPath Inc. (PATH),https://insidermonkey.com/blog/--1596501,
InsiderMonkey,Barclays Maintains a Hold Rating on SentinelOne (S) With a $19 PT,https://insidermonkey.com/blog/--1596502,
InsiderMonkey,UBS Lifts PT on Permian Resources Corporation (PR) to $17 From $16,https://insidermonkey.com/blog/--1596504,
