feed,title,long_url,short_url
Investing,Nvidia Earnings in Focus as Call Options Could Limit Stock Rally,https://www.investing.com/analysis/nvidia-earnings-in-focus-as-call-options-could-limit-stock-rally-200665857,
Investing,Litecoin Falls 10% In Bearish Trade,https://www.investing.com/news/cryptocurrency-news/litecoin-falls-10-in-bearish-trade-4209506,
Investing,"US halt of wind project hurts New England grid reliability and jobs, officials say",https://www.investing.com/news/commodities-news/us-halt-of-wind-project-hurts-new-england-grid-reliability-and-jobs-officials-say-4209513,
Investing,"Kraft, other companies beat test lawsuit over ultra processed foods",https://www.investing.com/news/stock-market-news/kraft-other-companies-beat-test-lawsuit-over-ultra-processed-foods-4209533,
Investing,Iris Energy stock rises after doubling GPU fleet with NVIDIA Blackwell purchase,https://www.investing.com/news/stock-market-news/iris-energy-stock-rises-after-doubling-gpu-fleet-with-nvidia-blackwell-purchase-93CH-4209528,
Investing,Dyne Therapeutics stock rises after Raymond James upgrade to Strong Buy,https://www.investing.com/news/stock-market-news/dyne-therapeutics-stock-rises-after-raymond-james-upgrade-to-strong-buy-93CH-4209525,
Investing,Atai Life Sciences stock surges on AbbVie’s psychedelic drug acquisition,https://www.investing.com/news/stock-market-news/atai-life-sciences-stock-surges-on-abbvies-psychedelic-drug-acquisition-93CH-4209522,
Investing,Eversource Energy stock falls after Trump administration halts Orsted’s wind farm,https://www.investing.com/news/stock-market-news/eversource-energy-stock-falls-after-trump-administration-halts-orsteds-wind-farm-93CH-4209514,
