feed,title,long_url,short_url
SeekingAlpha,TreeHouse Foods reports mixed Q3 earnings; updates FY23 outlook,https://seekingalpha.com/news/4030811,
SeekingAlpha,"Affiliated Managers Non-GAAP EPS of $4.08 beats by $0.34, revenue of $525.2M beats by $15.76M",https://seekingalpha.com/news/4030810,
SeekingAlpha,Trimble and Ferguson collaborate to streamline supply chain workflows,https://seekingalpha.com/news/4030809,
SeekingAlpha,Celldex jumps premarket on positive topline results from urticaria drug study,https://seekingalpha.com/news/4030808,
SeekingAlpha,"Axsome Therapeutics GAAP EPS of -$1.32 misses by $0.09, revenue of $57.79M beats by $2.93M",https://seekingalpha.com/news/4030807,
