feed,title,long_url,short_url
Investing,"Ethereum (ETH) Fees Surge by 30%, Is Network Coming Back?",https://www.investing.com/news/cryptocurrency-news/ethereum-eth-fees-surge-by-30-is-network-coming-back-3223499,https://da.gd/uQ9L4R
Investing,NFT sales volume jumps to $129M in November — Nansen data,https://www.investing.com/news/cryptocurrency-news/nft-sales-volume-jumps-to-129m-in-november--nansen-data-3223495,https://da.gd/HSRUdT
Investing,Ripple (XRP) surges 10% to lead cryptocurrency market,https://www.investing.com/news/cryptocurrency-news/ripple-xrp-surges-10-to-lead-cryptocurrency-market-93CH-3223478,https://da.gd/mCv3lb
Investing,Clorox FY24 guidance incorporates 'appropriate degree of conservatism' - UBS,https://www.investing.com/news/stock-market-news/clorox-fy24-guidance-incorporates-appropriate-degree-of-conservatism--ubs-432SI-3223492,https://da.gd/lTr6k
Investing,"TreeHouse Foods rebounds with profitable Q3, outperforms wider retail market",https://www.investing.com/news/stock-market-news/treehouse-foods-rebounds-with-profitable-q3-outperforms-wider-retail-market-93CH-3223491,https://da.gd/BwExj
Investing,"Genie Energy posts record Q3 revenue, revises EBITDA forecast upward",https://www.investing.com/news/stock-market-news/genie-energy-posts-record-q3-revenue-revises-ebitda-forecast-upward-93CH-3223490,https://da.gd/DthPA
Investing,"Emerald Holding reports Q3 revenue growth, despite net income drop",https://www.investing.com/news/stock-market-news/emerald-holding-reports-q3-revenue-growth-despite-net-income-drop-93CH-3223489,https://da.gd/1CoQIW
Investing,Kosmos Energy reports Q3 results with $85m net income,https://www.investing.com/news/stock-market-news/kosmos-energy-reports-q3-results-with-85m-net-income-93CH-3223486,https://da.gd/az2oeX
Investing,Citigroup restructuring plan aims for 10% staff reduction,https://www.investing.com/news/stock-market-news/citigroup-restructuring-plan-aims-for-10-staff-reduction-93CH-3223485,https://da.gd/lZXn4
Investing,Graham Corp reports robust Q2 fiscal 2024 performance,https://www.investing.com/news/stock-market-news/graham-corp-reports-robust-q2-fiscal-2024-performance-93CH-3223484,https://da.gd/YDXhz
Investing,Bernstein upgrades BMW to Outperform as automaker is determined to sell EVs in China,https://www.investing.com/news/stock-market-news/bernstein-upgrades-bmw-to-outperform-as-automaker-is-determined-to-sell-evs-in-china-432SI-3223479,https://da.gd/cBnThP
Investing,Hedge funds accelerate U.S. stocks purchase amid rate pause expectations,https://www.investing.com/news/stock-market-news/hedge-funds-accelerate-us-stocks-purchase-amid-rate-pause-expectations-93CH-3223482,https://da.gd/7Y0DHv
Investing,Federal Reserve Bank of Atlanta leans towards cautious approach on interest-rate changes,https://www.investing.com/news/economy/federal-reserve-bank-of-atlanta-leans-towards-cautious-approach-on-interestrate-changes-93CH-3223493,https://da.gd/2lwn3S
Investing,Kenya's central bank warns of rising illegal fund transfers,https://www.investing.com/news/economy/kenyas-central-bank-warns-of-rising-illegal-fund-transfers-93CH-3223487,https://da.gd/gtG9Ht
