feed,title,long_url,short_url
FXEmpire,Rheinmetall to send tanks to Czechs from December under Ukraine swap scheme,https://www.fxempire.com/news/article/rheinmetall-to-send-tanks-to-czechs-from-december-under-ukraine-swap-scheme-1157534,https://bit.ly/3fTYOim
FXEmpire,EnBW to further rise retail gas prices as procurement costs spiral,https://www.fxempire.com/news/article/enbw-to-further-rise-retail-gas-prices-as-procurement-costs-spiral-1157537,https://bit.ly/3etAlQq
FXEmpire,Shares in Leonteq hammered after FT report on unusual trading activity,https://www.fxempire.com/news/article/shares-in-leonteq-hammered-after-ft-report-on-unusual-trading-activity-1157535,https://bit.ly/3CIFnB1
FXEmpire,Ukraine grain backlog prompts U.N. call for faster ship checks,https://www.fxempire.com/news/article/ukraine-grain-backlog-prompts-u-n-call-for-faster-ship-checks-1157530,https://bit.ly/3ywkJCx
FXEmpire,Spain’s Ferrovial sells UK services business Amey,https://www.fxempire.com/news/article/spains-ferrovial-sells-uk-services-business-amey-1157538,https://bit.ly/3S6SfXj
