feed,title,long_url,short_url
Nasdaq,Oil on Pace for Second Consecutive Week of Decline on Growing Delta Variant Concerns,https://www.nasdaq.com/articles/oil-on-pace-for-second-consecutive-week-of-decline-on-growing-delta-variant-concerns-2021,https://j.mp/36FSZNz
Nasdaq,Better Buy: FuelCell Energy vs. Bloom Energy,https://www.nasdaq.com/articles/better-buy%3A-fuelcell-energy-vs.-bloom-energy-2021-07-16,https://j.mp/3epTdgc
Nasdaq,5 Costs That Could Wreck Your Travel Budget,https://www.nasdaq.com/articles/5-costs-that-could-wreck-your-travel-budget-2021-07-16,https://j.mp/3hIwBti
Nasdaq,China's Ganfeng to offer to buy Millennial Lithium for up to $280 mln,https://www.nasdaq.com/articles/chinas-ganfeng-to-offer-to-buy-millennial-lithium-for-up-to-%24280-mln-2021-07-16-0,https://j.mp/3xNe0BM
Nasdaq,"Current Mortgage Rates -- July 16, 2021: Rates Up for Most Loans",https://www.nasdaq.com/articles/current-mortgage-rates-july-16-2021%3A-rates-up-for-most-loans-2021-07-16,https://j.mp/3Bev8mq
Nasdaq,EXCLUSIVE-Louis Vuitton-backed L Catterton explores public listing -sources,https://www.nasdaq.com/articles/exclusive-louis-vuitton-backed-l-catterton-explores-public-listing-sources-2021-07-16,https://j.mp/3z65yy4
