feed,title,long_url,short_url
Benzinga,$100 Invested In Elevance Health 5 Years Ago Would Be Worth This Much Today,https://benzinga.com/news/earnings/22/07/28270865/100-invested-in-elevance-health-5-years-ago-would-be-worth-this-much-today,https://bit.ly/3oCTGQM
Benzinga,Here's How Much You Would Have Made Owning Estee Lauder Cos Stock In The Last 20 Years,https://benzinga.com/news/earnings/22/07/28270858/heres-how-much-you-would-have-made-owning-estee-lauder-cos-stock-in-the-last-20-years,https://bit.ly/3Jf41f4
Benzinga,Looking At Zoom Video Comms's Recent Whale Trades,https://benzinga.com/markets/options/22/07/28270885/looking-at-zoom-video-commss-recent-whale-trades,https://bit.ly/3Q9jBeJ
Benzinga,Looking At Target's Recent Whale Trades,https://benzinga.com/markets/options/22/07/28270879/looking-at-targets-recent-whale-trades,https://bit.ly/3bdKeAe
Benzinga,Alcoa Whale Trades Spotted,https://benzinga.com/markets/options/22/07/28270871/alcoa-whale-trades-spotted,https://bit.ly/3cTt9MA
Benzinga,"2,023 ETH Worth $3M Was Just Burned",https://benzinga.com/markets/cryptocurrency/22/07/28270847/2-023-eth-worth-3m-was-just-burned,https://bit.ly/3JfRUhW
