feed,title,long_url,short_url
ETFTrends:DailyRecap,An Advisor’s Roadmap to Risk in 2022,https://www.etftrends.com/an-advisors-roadmap-to-risk-in-2022/,https://j.mp/3zZYGUr
ETFTrends:DailyRecap,An ETF to Capture Promising Biotech Innovators,https://www.etftrends.com/innovative-etfs-channel/an-etf-to-capture-promising-biotech-innovators/,https://j.mp/3qmhREF
ETFTrends:DailyRecap,China ETFs Rebound as Lack of Regulatory Scrutiny Emboldens Investors,https://www.etftrends.com/china-insights-channel/china-etfs-rebound-as-lack-of-regulatory-scrutiny-emboldens-investors/,https://j.mp/33iIMZg
ETFTrends:DailyRecap,Bitcoin Came Into Its Own in 2021,https://www.etftrends.com/crypto-channel/bitcoin-came-into-its-own-in-2021/,https://j.mp/3HY5zs1
ETFTrends:DailyRecap,A Case for Crypto and Web3 Regulation,https://www.etftrends.com/crypto-channel/a-case-for-crypto-and-web3-regulation/,https://j.mp/3nl5uqw
ETFTrends:DailyRecap,Natural Gas ETFs Surge on a Wintry Blast,https://www.etftrends.com/natural-gas-etfs-surge-on-a-wintry-blast/,https://j.mp/33twJIk
ETFTrends:DailyRecap,U.S. Stock ETFs Push Higher on Hopes That Inflation Is Peaking,https://www.etftrends.com/portfolio-strategies-channel/u-s-stock-etfs-push-higher-on-hopes-that-inflation-is-peaking/,https://j.mp/3ranWU8
ETFTrends:DailyRecap,Planned Fed Interest Rate Hikes Set to Release $1 Trillion in Additional Stimulus,https://www.etftrends.com/etf-strategist-channel/planned-fed-interest-rate-hikes-set-to-release-1-trillion-in-additional-stimulus/,https://j.mp/3FtAbjO
ETFTrends:DailyRecap,Top Performing Leveraged/Inverse ETFs: 01/09/2022,https://www.etftrends.com/leverage-inverse-channel/top-performing-leveragedinverse-etfs-01092022/,https://j.mp/3zSDBLE
ETFTrends:DailyRecap,Leveraged Fund Rakes in Record Capital During Market Dip,https://www.etftrends.com/nasdaq-portfolio-solutions-channel/leveraged-fund-rakes-in-record-capital-during-market-dip/,https://j.mp/34PQiLX
ETFTrends:DailyRecap,5 Predictions for the Chinese Internet Sector in 2022,https://www.etftrends.com/china-insights-channel/5-predictions-for-the-chinese-internet-sector-in-2022/,https://j.mp/3tmLK9K
ETFTrends:DailyRecap,Market Expert Sees Higher Real Estate Prices and Rates in 2022,https://www.etftrends.com/multi-asset-channel/market-expert-sees-higher-real-estate-prices-and-rates-in-2022/,https://j.mp/3nkhdFX
ETFTrends:DailyRecap,Newfound and Simplify Partner for Structured Alpha ETF Model Portfolios,https://www.etftrends.com/newfound-and-simplify-partner-for-structured-alpha-etf-model-portfolios/,https://j.mp/3fnvX2c
ETFTrends:DailyRecap,Innovative Ocean Battery Could Be Pivotal for Wind Energy ETF,https://www.etftrends.com/thematic-investing-channel/innovative-ocean-battery-could-be-pivotal-for-wind-energy-etf/,https://j.mp/3Gn8rOZ
ETFTrends:DailyRecap,GINN Has Goods for More Big Tech Upside,https://www.etftrends.com/future-etfs-channel/ginn-has-goods-for-more-big-tech-upside/,https://j.mp/3GrkVoI
ETFTrends:DailyRecap,Gene Editing Stocks Might Be Building Some Momentum,https://www.etftrends.com/disruptive-technology-channel/gene-editing-stocks-might-be-building-some-momentum/,https://j.mp/3feMTIq
ETFTrends:DailyRecap,Interesting China Stock Trend Could Bode Well for Emerging Markets ETF,https://www.etftrends.com/emerging-markets-channel/interesting-china-stock-trend-could-bode-well-for-emerging-markets-etf/,https://j.mp/335KRIh
ETFTrends:DailyRecap,Bank Earnings Season Puts Equal-Weight ETF in Spotlight,https://www.etftrends.com/portfolio-strategies-channel/bank-earnings-season-puts-equal-weight-etf-in-spotlight/,https://j.mp/3r6Ubn0
ETFTrends:DailyRecap,Less Hawkish Fed Could Push Gold Prices Higher,https://www.etftrends.com/gold-silver-investing-channel/less-hawkish-fed-could-push-gold-prices-higher/,https://j.mp/3GqpWha
ETFTrends:DailyRecap,Expect the Global Supply Chain and Inflation to Get Worse,https://www.etftrends.com/active-etf-channel/expect-the-global-supply-chain-and-inflation-to-get-worse/,https://j.mp/3K31QeF
ETFTrends:DailyRecap,PKW Pertinent as Buybacks Projected to Soar,https://www.etftrends.com/nasdaq-portfolio-solutions-channel/pkw-pertinent-as-buybacks-projected-to-soar/,https://j.mp/3rcJEXt
ETFTrends:DailyRecap,Some Crypto Stocks Are Looking Interesting,https://www.etftrends.com/crypto-channel/some-crypto-stocks-are-looking-interesting/,https://j.mp/3r5Z13K
ETFTrends:DailyRecap,Dividends Are Going to Be Big Deals This Year,https://www.etftrends.com/etf-building-blocks-channel/dividends-are-going-to-be-big-deals-this-year/,https://j.mp/31UAiqM
ETFTrends:DailyRecap,UFO Travels Through Increasingly Crowded Space,https://www.etftrends.com/ufo-travels-through-increasingly-crowded-space/,https://j.mp/3rb5s5U
ETFTrends:DailyRecap,"As Fed Policy Influences Bonds, Get Dynamic Exposure With This ETF",https://www.etftrends.com/multi-asset-channel/as-fed-policy-influences-bonds-get-dynamic-exposure-with-this-etf/,https://j.mp/3rdMQ5e
ETFTrends:DailyRecap,Artificial Intelligence Trade Could Roar Back in 2022,https://www.etftrends.com/model-portfolio-channel/artificial-intelligence-trade-could-roar-back-in-2022/,https://j.mp/3rciZdl
ETFTrends:DailyRecap,Get Exposure to KBWY After REITs Have Banner Year,https://www.etftrends.com/innovative-etfs-channel/get-exposure-to-kbwy-after-reits-have-banner-year/,https://j.mp/3zOpTcJ
ETFTrends:DailyRecap,Day Hagan Tech Talk: Questions Answered,https://www.etftrends.com/etf-strategist-channel/day-hagan-tech-talk-questions-answered/,https://j.mp/3tluqlz
ETFTrends:DailyRecap,An Income ETF Strategy to Help Retirees Manage Portfolio Risk,https://www.etftrends.com/retirement-income-channel/an-income-etf-strategy-to-help-retirees-manage-portfolio-risk/,https://j.mp/31RvCSz
ETFTrends:DailyRecap,ETF Prime: A Debate on 2022 ETF Predictions,https://www.etftrends.com/etf-prime/etf-prime-a-debate-on-2022-etf-predictions/,https://j.mp/3FrVGl2
ETFTrends:DailyRecap,3 Bond ETFs to Consider for the Current Market,https://www.etftrends.com/fixed-income-channel/3-bond-etfs-to-consider-for-the-current-market/,https://j.mp/33mzMlH
