feed,title,long_url,short_url
SeekingAlpha,Vicinity Motor signs multi-year supply deal with Proterra,https://seekingalpha.com/news/3787860,
SeekingAlpha,Mimecast gains on report of getting offer from rival Proofpoint above Permira deal,https://seekingalpha.com/news/3787859,
SeekingAlpha,Biomerica reports FQ2 results,https://seekingalpha.com/news/3787858,
SeekingAlpha,"Snap sinks on Cowen downgrade, price target cut over worries from iOS changes",https://seekingalpha.com/news/3787851,
SeekingAlpha,American Green's new cannabis facility to generate additional annual revenue,https://seekingalpha.com/news/3787854,
SeekingAlpha,Saputo (SAPIF) announces change in its senior management structure,https://seekingalpha.com/news/3787856,
SeekingAlpha,"Is Taiwan Semiconductor Stock A Buy, Sell, Or Hold Heading Into 2022?",https://seekingalpha.com/article/4479390,
