feed,title,long_url,short_url
FXEmpire,"U.S. Senator Sinema defends filibuster, despite Biden’s plea to reform it",https://www.fxempire.com/news/article/u-s-senator-sinema-defends-filibuster-despite-bidens-plea-to-reform-it-865394,https://j.mp/31VLqUl
FXEmpire,Canada’s shift to net-zero emissions likely to drive higher inflation,https://www.fxempire.com/news/article/canadas-shift-to-net-zero-emissions-likely-to-drive-higher-inflation-865397,https://j.mp/3zSDuQg
FXEmpire,Last year was the world’s sixth-warmest on record – U.S. scientists,https://www.fxempire.com/news/article/last-year-was-the-worlds-sixth-warmest-on-record-u-s-scientists-865395,https://j.mp/3qpW0MT
FXEmpire,"UK’s Prince Andrew renounces royal patronages, military affiliations",https://www.fxempire.com/news/article/uks-prince-andrew-renounces-royal-patronages-military-affiliations-865399,https://j.mp/3np6sCe
FXEmpire,Private equity firm TPG valued at over $10 billion in strong market debut,https://www.fxempire.com/news/article/private-equity-firm-tpg-valued-at-over-10-billion-in-strong-market-debut-865401,https://j.mp/33yHJnL
FXEmpire,"Frustrated Europeans say we’re not absent from Russia, U.S. talks",https://www.fxempire.com/news/article/frustrated-europeans-say-were-not-absent-from-russia-u-s-talks-865402,https://j.mp/3fjIHHh
FXEmpire,The First Ever NFT Dining Club Is Coming to New York,https://www.fxempire.com/news/article/the-first-ever-nft-dining-club-is-coming-to-new-york-865365,https://j.mp/3fjx6rV
