feed,title,long_url,short_url
SeekingAlpha,Kuehne + Nagel: Valuation And Near-Term Uncertainties Are Concerns To Be Aware Of,https://seekingalpha.com/article/4597167,
SeekingAlpha,Boeing: Testing Times Ahead,https://seekingalpha.com/article/4597137,
SeekingAlpha,PepsiCo Looks Overvalued Compared To Coca-Cola,https://seekingalpha.com/article/4597063,
SeekingAlpha,Flat Broke - Or How To Find Value In The U.K. Gilt Curve?,https://seekingalpha.com/article/4597169,
SeekingAlpha,"How Investors Should Think About AI, Micron, Tesla And The Fed With Chaim Siegel",https://seekingalpha.com/article/4597174,
