feed,title,long_url,short_url
Investing,Samson Mow Says Bitcoin Fixes Problem of the Unbanked,https://www.investing.com/news/cryptocurrency-news/samson-mow-says-bitcoin-fixes-problem-of-the-unbanked-3066725,https://da.gd/83MlGm
Investing,Flooding on Upper Mississippi River to halt barge traffic for weeks -USDA,https://www.investing.com/news/commodities-news/flooding-on-upper-mississippi-river-to-halt-barge-traffic-for-weeks-usda-3066731,https://da.gd/7TOuud
Investing,Crude rises first time in 3 days; OPEC in war of words with IEA,https://www.investing.com/news/commodities-news/crude-rises-first-time-in-3-days-opec-in-war-of-words-with-iea-3066721,https://da.gd/JriB4
Investing,Glass Lewis recommends Tesla investor vote against board nominee JB Straubel,https://www.investing.com/news/stock-market-news/glass-lewis-recommends-tesla-investor-vote-against-board-nominee-jb-straubel-3066736,https://da.gd/5jGXOo
Investing,Tesla pulls Models S and X orders from Australian website,https://www.investing.com/news/stock-market-news/tesla-pulls-models-s-and-x-orders-from-australian-website-432SI-3066722,https://da.gd/hwl3R
Investing,LVMH zeros in on China for global Tiffany & Co overhaul,https://www.investing.com/news/stock-market-news/lvmh-zeros-in-on-china-for-global-tiffany--co-overhaul-3066728,https://da.gd/Zk0SD
Investing,S&P 500 in rally mode as Meta shines on earnings stage,https://www.investing.com/news/stock-market-news/sp-500-in-rally-mode-as-meta-shines-on-earnings-stage-3066715,https://da.gd/dz7DM
