feed,title,long_url,short_url
SeekingAlpha,Greenidge Generation names new finance chief,https://seekingalpha.com/news/3770545,
SeekingAlpha,Centessa Pharmaceuticals reports Q3 results,https://seekingalpha.com/news/3770544,
SeekingAlpha,"Tyson Foods gains after posting strong guidance, unveiling new productivity plan",https://seekingalpha.com/news/3770543,
SeekingAlpha,"Butterfly Network EPS beats by $0.18, misses on revenue",https://seekingalpha.com/news/3770542,
SeekingAlpha,"Orbital Energy EPS misses by $0.06, misses on revenue",https://seekingalpha.com/news/3770541,
SeekingAlpha,"Greenidge Generation Holdings EPS beats by $0.18, misses on revenue",https://seekingalpha.com/news/3770540,
SeekingAlpha,Lithium Americas EPS misses by $0.06,https://seekingalpha.com/news/3770539,
