feed,title,long_url,short_url
FXEmpire,Locals helping migrants on Poland-Belarus border fear backlash,https://www.fxempire.com/news/article/locals-helping-migrants-on-poland-belarus-border-fear-backlash-808957,https://j.mp/3HzSSVh
FXEmpire,Airbus wins Air Lease launch order for A350 freighters,https://www.fxempire.com/news/article/airbus-wins-air-lease-launch-order-for-a350-freighters-808958,https://j.mp/3nf4Awf
FXEmpire,"Risks for German finance revolve around rates, BaFin president says",https://www.fxempire.com/news/article/risks-for-german-finance-revolve-around-rates-bafin-president-says-808961,https://j.mp/3qEeWrr
FXEmpire,Former presidential candidate Beto O’Rourke announces run for Texas governor,https://www.fxempire.com/news/article/former-presidential-candidate-beto-orourke-announces-run-for-texas-governor-808952,https://j.mp/3kG3vvH
FXEmpire,Goldman Sachs sees U.S. core PCE halving by end of 2022,https://www.fxempire.com/news/article/goldman-sachs-sees-u-s-core-pce-halving-by-end-of-2022-808953,https://j.mp/3cfF0Ry
