feed,title,long_url,short_url
Benzinga,Cryptocurrency Crypto.com Coin's Price Increased More Than 9% Within 24 hours,https://benzinga.com/markets/cryptocurrency/21/11/24095802/cryptocurrency-crypto-com-coins-price-increased-more-than-9-within-24-hours,https://j.mp/3kEBVyN
Benzinga,"Dogecoin, Polygon, Bitcoin Cash Amongst Top Crypto Movers",https://benzinga.com/markets/cryptocurrency/21/11/24095800/dogecoin-polygon-bitcoin-cash-amongst-top-crypto-movers,https://j.mp/3HiuLdv
Benzinga,Cryptocurrency Litecoin's Price Increased More Than 4% Within 24 hours,https://benzinga.com/markets/cryptocurrency/21/11/24095799/cryptocurrency-litecoins-price-increased-more-than-4-within-24-hours,https://j.mp/3Hnli4C
Benzinga,Will Chart Analysts Notice Bad Omen on CMS Energy's Chart,https://benzinga.com/markets/21/11/24095327/will-chart-analysts-notice-bad-omen-on-cms-energys-chart,https://j.mp/3HkCbwV
Benzinga,A Bearish Sign Appears On Franco-Nevada's Chart,https://benzinga.com/markets/21/11/24095320/a-bearish-sign-appears-on-franco-nevadas-chart,https://j.mp/3CiinXb
