feed,title,long_url,short_url
SeekingAlpha,GSE Systems reports Q3 results,https://seekingalpha.com/news/3770930,
SeekingAlpha,"Aytu BioScience EPS misses by $0.60, misses on revenue",https://seekingalpha.com/news/3770929,
SeekingAlpha,"Why did Marathon Digital fall today? Debt offering, subpoena",https://seekingalpha.com/news/3770925,
SeekingAlpha,Ra Medical Systems EPS misses by $0.36,https://seekingalpha.com/news/3770928,
SeekingAlpha,"Eton Pharmaceuticals EPS misses by $0.10, misses on revenue",https://seekingalpha.com/news/3770927,
SeekingAlpha,"Traeger EPS misses by $0.27, beats on revenue",https://seekingalpha.com/news/3770926,
SeekingAlpha,iBio misses on revenue,https://seekingalpha.com/news/3770924,
