feed,title,long_url,short_url
ETF:DailyRecap,JPMorgan Debuts 2 New Active ETFs,http://www.etf.com/sections/daily-etf-watch/jpmorgan-debuts-2-new-active-etfs,https://da.gd/OZCEGF
ETF:DailyRecap,Here’s Why Grayscale’s Trust Discount Isn't Lower,http://www.etf.com/sections/news/heres-why-grayscales-trust-discount-isnt-lower,https://da.gd/WM0yw
ETF:DailyRecap,What Is a Genomics ETF? A Complete Guide to the Breakthrough Biotech,http://www.etf.com/sections/etf-basics/what-genomics-etf,https://da.gd/rN3iOt
ETF:DailyRecap,Ric Edelman: Have You Fallen for These Crypto Myths?,http://www.etf.com/sections/podcasts/ric-edelman-have-you-fallen-these-crypto-myths,https://da.gd/s83ISy
ETF:DailyRecap,Investors Drive Up Natural Gas as Oil Slumps,http://www.etf.com/sections/features/investors-drive-natural-gas-oil-slumps,https://da.gd/o0iez
