feed,title,long_url,short_url
SeekingAlpha,Moderna to end mRNA COVID shot production at Lonza plant,https://seekingalpha.com/news/4013212,
SeekingAlpha,Cannabis short selling goes unabated despite September rally,https://seekingalpha.com/news/4013214,
SeekingAlpha,GSK subsidiary ViiV gets EU okay for HIV prevention drug,https://seekingalpha.com/news/4013213,
SeekingAlpha,"Cavco Industries: High Quality Company, Stock Not As Cheap At It Seems",https://seekingalpha.com/article/4636028,
SeekingAlpha,Cutera: Consider Both Financial Outlook And New CEO Appointment (Rating Upgrade),https://seekingalpha.com/article/4636027,
SeekingAlpha,Tapestry: Anything But A Luxury To Investors,https://seekingalpha.com/article/4636026,
