feed,title,long_url,short_url
Cointelegraph,Kaito AI and founder Yu Hu's X social media accounts hacked,https://cointelegraph.com/news/kaito-ai-yu-hu-x-social-media-hacked?utm_source=rss_feed&utm_medium=rss%3Ft%3D1742092372980&utm_campaign=rss_partner_inbound,https://da.gd/cPmBV
Cointelegraph,TON Society celebrates Pavel Durov leaving France as free speech win,https://cointelegraph.com/news/ton-society-durov-leaving-france-free-speech-win?utm_source=rss_feed&utm_medium=rss%3Ft%3D1742092372980&utm_campaign=rss_partner_inbound,https://da.gd/F2B8hB
Cointelegraph,Toncoin surges as Pavel Durov leaves France after months,https://cointelegraph.com/news/toncoin-surges-durov-leaves-france?utm_source=rss_feed&utm_medium=rss%3Ft%3D1742092372980&utm_campaign=rss_partner_inbound,https://da.gd/GghUMv
Cointelegraph,Bitcoin’s role as an inflation hedge depends on where one lives — Analyst,https://cointelegraph.com/news/bitcoin-s-role-as-inflation-hedge-depends-on-where-one-lives-analyst?utm_source=rss_feed&utm_medium=rss%3Ft%3D1742092372980&utm_campaign=rss_partner_inbound,https://da.gd/WYxT0I
Cointelegraph,Decentralized science meets AI — legacy institutions aren’t ready,https://cointelegraph.com/news/decentralized-science-meets-ai?utm_source=rss_feed&utm_medium=rss%3Ft%3D1742092372980&utm_campaign=rss_partner_inbound,https://da.gd/Sdv2W
Cointelegraph,"Bitcoin poised to reclaim $90,000, according to derivatives metrics",https://cointelegraph.com/news/bitcoin-poised-reclaim-90000-according-derivatives-metrics?utm_source=rss_feed&utm_medium=rss%3Ft%3D1742092372980&utm_campaign=rss_partner_inbound,https://da.gd/gBC76
Cointelegraph,Here’s what happened in crypto today,https://cointelegraph.com/news/what-happened-in-crypto-today?utm_source=rss_feed&utm_medium=rss%3Ft%3D1742092372980&utm_campaign=rss_partner_inbound,https://da.gd/uUhI
Cointelegraph,Telegram founder Pavel Durov given permission to leave France,https://cointelegraph.com/news/telegram-founder-pavel-durov-leaves-france?utm_source=rss_feed&utm_medium=rss%3Ft%3D1742092372980&utm_campaign=rss_partner_inbound,https://da.gd/hQYSf
Cointelegraph,"Rising $219B stablecoin supply signals mid-bull cycle, not market top",https://cointelegraph.com/news/rising-219-b-stablecoin-supply-mid-bull-cycle-not-top?utm_source=rss_feed&utm_medium=rss%3Ft%3D1742092372980&utm_campaign=rss_partner_inbound,https://da.gd/dnvP5n
Cointelegraph,"Ether may fall below $1.9K ‘robust’ demand zone, analysts eye capitulation",https://cointelegraph.com/news/ether-fall-below-1-9k-robust-demand-zone-analysts-capitulation?utm_source=rss_feed&utm_medium=rss%3Ft%3D1742092372980&utm_campaign=rss_partner_inbound,https://da.gd/oJy09
Cointelegraph,Trade war puts Bitcoin’s status as safe-haven asset in doubt,https://cointelegraph.com/news/bitcoin-trade-tariff-safe-haven?utm_source=rss_feed&utm_medium=rss%3Ft%3D1742092372980&utm_campaign=rss_partner_inbound,https://da.gd/NoseGR
Cointelegraph,"Bitcoin’s megaphone pattern, explained: How to trade it",https://cointelegraph.com/news/bitcoin-s-megaphone-pattern-explained-how-to-trade-it?utm_source=rss_feed&utm_medium=rss%3Ft%3D1742092372980&utm_campaign=rss_partner_inbound,https://da.gd/bJuNK
Cointelegraph,Bitcoin needs weekly close above $81K to avoid downside ahead of FOMC,https://cointelegraph.com/news/bitcoin-weekly-close-81-k-avoid-downside-ahead-of-fomc?utm_source=rss_feed&utm_medium=rss%3Ft%3D1742092372980&utm_campaign=rss_partner_inbound,https://da.gd/vUNv1t
Cointelegraph,‘Very possible’ Bitcoin consolidates for 8 months again: 10x Research,https://cointelegraph.com/news/bitcoin-consolidation-phase-repeat-2024-price-action-possible-crypto-analyst?utm_source=rss_feed&utm_medium=rss%3Ft%3D1742092372980&utm_campaign=rss_partner_inbound,https://da.gd/Ql0N1
Cointelegraph,Crypto faces ‘starkest' gap between sentiment and fundamentals: BlockTower,https://cointelegraph.com/news/crypto-market-divergence-sentiment-fundamentals-blocktower-founder?utm_source=rss_feed&utm_medium=rss%3Ft%3D1742092372980&utm_campaign=rss_partner_inbound,https://da.gd/KHkWq0
Cointelegraph,"Sacks’ VC firm sold $200M+ in crypto, stocks before White House role",https://cointelegraph.com/news/david-sacks-sold-off-crypto-related-assets-prior-crypto-czar-white-house?utm_source=rss_feed&utm_medium=rss%3Ft%3D1742092372980&utm_campaign=rss_partner_inbound,https://da.gd/rghX
Cointelegraph,Hyperliquid’s mystery 50x ETH whale is now betting on LINK,https://cointelegraph.com/news/hyperliquid-mystery-50x-eth-whale-bet-link?utm_source=rss_feed&utm_medium=rss%3Ft%3D1742092372980&utm_campaign=rss_partner_inbound,https://da.gd/veclBT
Cointelegraph,VanEck files for AVAX ETF,https://cointelegraph.com/news/vaneck-files-avalanche-etf?utm_source=rss_feed&utm_medium=rss%3Ft%3D1742092372980&utm_campaign=rss_partner_inbound,https://da.gd/fPgD6l
Cointelegraph,"New MassJacker malware targets piracy users, steals crypto",https://cointelegraph.com/news/new-massjacker-malware-targets-piracy-users-steals-crypto?utm_source=rss_feed&utm_medium=rss%3Ft%3D1742092372980&utm_campaign=rss_partner_inbound,https://da.gd/DUPNL
Cointelegraph,Bitcoin apparent demand reaches lowest point in 2025 — CryptoQuant,https://cointelegraph.com/news/bitcoin-demand-lowest-point-2025?utm_source=rss_feed&utm_medium=rss%3Ft%3D1742092372980&utm_campaign=rss_partner_inbound,https://da.gd/PdK6z
Cointelegraph,UK authorizes charges against NCA officer for alleged Bitcoin theft,https://cointelegraph.com/news/uk-charges-officer-bitcoin-theft?utm_source=rss_feed&utm_medium=rss%3Ft%3D1742092372980&utm_campaign=rss_partner_inbound,https://da.gd/5j0kr5
Cointelegraph,Crypto Biz: Is Trump intentionally crashing the market?,https://cointelegraph.com/news/crypto-biz-trump-intentionally-crashing-market?utm_source=rss_feed&utm_medium=rss%3Ft%3D1742092372980&utm_campaign=rss_partner_inbound,https://da.gd/UfmYd
Cointelegraph,XRP flips Ether’s FDV amid change in market dynamics,https://cointelegraph.com/news/xrp-flips-ether-fdv-change-market-dynamics?utm_source=rss_feed&utm_medium=rss%3Ft%3D1742092372980&utm_campaign=rss_partner_inbound,https://da.gd/PZnbEv
Cointelegraph,‘Scale or fail’: RLNC technology can boost Web3 adoption — MIT Professor,https://cointelegraph.com/news/scale-fail-rlnc-technology-web3-adoption-mit-professor?utm_source=rss_feed&utm_medium=rss%3Ft%3D1742092372980&utm_campaign=rss_partner_inbound,https://da.gd/x8sZu
Cointelegraph,"US House kills IRS DeFi broker rule, Solana won’t cut 80% inflation rate: Finance Redefined",https://cointelegraph.com/news/us-house-kills-irs-de-fi-broker-rule-solana-won-t-cut-80-inflation-rate?utm_source=rss_feed&utm_medium=rss%3Ft%3D1742092372980&utm_campaign=rss_partner_inbound,https://da.gd/rAc6O
Cointelegraph,"BlackRock now holds over 567,000 BTC, valued at over $47 billion",https://cointelegraph.com/news/blackrock-holds-47-billion-bitcoin?utm_source=rss_feed&utm_medium=rss%3Ft%3D1742092372980&utm_campaign=rss_partner_inbound,https://da.gd/oFHxu
Cointelegraph,Growth in Bitcoin and stablecoin adoption could accelerate dedollarization,https://cointelegraph.com/news/growth-in-bitcoin-and-stablecoin-adoption-could-accelerate-dedollarization?utm_source=rss_feed&utm_medium=rss%3Ft%3D1742092372980&utm_campaign=rss_partner_inbound,https://da.gd/OD80
Cointelegraph,Crypto influencer sentenced to 45 months in prison for wire fraud,https://cointelegraph.com/news/crypto-influencer-prison-wire-fraud?utm_source=rss_feed&utm_medium=rss%3Ft%3D1742092372980&utm_campaign=rss_partner_inbound,https://da.gd/tky62
Cointelegraph,Bitcoin bull market in peril as US recession and tariff worries loom,https://cointelegraph.com/news/bitcoin-bull-market-in-peril-as-us-recession-and-tariff-worries-loom?utm_source=rss_feed&utm_medium=rss%3Ft%3D1742092372980&utm_campaign=rss_partner_inbound,https://da.gd/xX8nVs
Cointelegraph,Argentina finalizes rules for virtual asset providers,https://cointelegraph.com/news/argentina-finalizes-rules-virtual-asset-providers?utm_source=rss_feed&utm_medium=rss%3Ft%3D1742092372980&utm_campaign=rss_partner_inbound,https://da.gd/wucLNX
Cointelegraph,Twitter User Claims TradingView Has Ignored a Fibonacci Retracement Bug for 5 Years,https://cointelegraph.com/news/twitter-user-claims-tradingview-has-ignored-a-fibonacci-retracement-bug-for-5-years?utm_source=rss_feed&utm_medium=rss%3Ft%3D1742092372980&utm_campaign=rss_partner_inbound,https://da.gd/hNkhe
