feed,title,long_url,short_url
Investing,Trump’s CFTC pick says entrepreneur Winklevoss lobbied president to delay nomination,https://www.investing.com/news/stock-market-news/trumps-cftc-pick-says-entrepreneur-winklevoss-lobbied-president-to-delay-nomination-4234516,
Investing,"Hawaiian Airlines CEO Joe Sprague to retire, Diana Birkett Rakow to step in",https://www.investing.com/news/stock-market-news/hawaiian-airlines-ceo-joe-sprague-to-retire-diana-birkett-rakow-to-step-in-4234514,
Investing,Mexico stocks lower at close of trade; S&P/BMV IPC down 0.31%,https://www.investing.com/news/stock-market-news/mexico-stocks-lower-at-close-of-trade-spbmv-ipc-down-031-4234503,
Investing,Colombia stocks higher at close of trade; COLCAP up 0.28%,https://www.investing.com/news/stock-market-news/colombia-stocks-higher-at-close-of-trade-colcap-up-028-4234487,
Investing,Lawyer says many immigrants detained at Hyundai US facility appeared be to working legally,https://www.investing.com/news/stock-market-news/lawyer-says-many-immigrants-detained-at-hyundai-us-facility-appeared-be-to-working-legally-4234486,
Investing,Russia stocks lower at close of trade; MOEX Russia Index down 0.80%,https://www.investing.com/news/stock-market-news/russia-stocks-lower-at-close-of-trade-moex-russia-index-down-080-4234480,
Investing,Merrill creates new division to increase credit offerings to the wealthy,https://www.investing.com/news/stock-market-news/merrill-creates-new-division-to-increase-credit-offerings-to-the-wealthy-4234370,
