feed,title,long_url,short_url
Investing,Tesla: Is a Bearish Reversal Ahead?,https://www.investing.com/analysis/tesla-is-a-bearish-reversal-ahead-200667926,
Investing,Tesla begins selling Cybertruck in Qatar,https://www.investing.com/news/stock-market-news/tesla-begins-selling-cybertruck-in-qatar-93CH-4269980,
Investing,"Tesla begins selling Cybertrucks in Qatar, company says",https://www.investing.com/news/stock-market-news/tesla-begins-selling-cybertrucks-in-qatar-company-says-4269973,
Investing,Legrand hits record high after agreeing $1.1bn deal to acquire Avtron Power,https://www.investing.com/news/stock-market-news/legrand-hits-record-high-after-agreeing-11bn-deal-to-acquire-avtron-power-4269949,
Investing,TBO Tek shares jump after unit acquires Classic Vacations for $125 million,https://www.investing.com/news/stock-market-news/tbo-tek-shares-jump-after-unit-acquires-classic-vacations-for-125-million-93CH-4269948,
Investing,"Indian ministers push domestic alternatives to Google, Microsoft apps amid strained US ties",https://www.investing.com/news/stock-market-news/indian-ministers-push-domestic-alternatives-to-google-microsoft-apps-amid-strainedusties-4269939,
Investing,"UK business activity grows at slowest pace in 5 months, PMI shows",https://www.investing.com/news/economic-indicators/uk-business-activity-grows-at-slowest-pace-in-5-months-pmi-shows-4269934,
