feed,title,long_url,short_url
Investing,CCH Holdings shares open above IPO price in Nasdaq debut,https://www.investing.com/news/stock-market-news/cch-holdings-shares-open-above-ipo-price-in-nasdaq-debut-93CH-4270948,
Investing,BlackRock’s infrastructure play gets a boost as Minnesota approves buyout,https://www.investing.com/news/stock-market-news/blackrocks-infrastructure-play-gets-a-boost-as-minnesota-approves-buyout-4270947,
Investing,"Biden ban on offshore drilling in vast areas was illegal, court rules",https://www.investing.com/news/stock-market-news/biden-ban-on-offshore-drilling-in-vast-areas-was-illegal-court-rules-4270942,
Investing,KnightSwift and Schneider to benefit on trucking supply crunch despite weak demand,https://www.investing.com/news/stock-market-news/knightswift-and-schneider-to-benefit-on-trucking-supply-crunch-despite-weak-demand-4270941,
Investing,Netflix stock defended at Oppenheimer amid recent underperformance,https://www.investing.com/news/stock-market-news/netflix-stock-defended-at-oppenheimer-amid-recent-underperformance-4270936,
Investing,Fed’s Miran wants aggressive rate cuts but downplays differences with other officials,https://www.investing.com/news/economy-news/feds-miran-wants-aggressive-rate-cuts-but-downplays-differences-with-other-officials-4270930,
