feed,title,long_url,short_url
SeekingAlpha,"TAL Education Non-GAAP EPADS of $0.05, revenue of $414.2M",https://seekingalpha.com/news/4131903,
SeekingAlpha,Euro Area unemployment rate rises to 6.5% in June,https://seekingalpha.com/news/4131899,
SeekingAlpha,"Biggest stock movers today: META, TDOC, and more",https://seekingalpha.com/news/4131900,
SeekingAlpha,The Rise Of Asia's Data Centers,https://seekingalpha.com/article/4708964,
SeekingAlpha,Top 5 Stocks If Kamala Wins The Election: Harris Vs. Trump Trade (SA Quant),https://seekingalpha.com/article/4708710,
SeekingAlpha,Fed Sets Stage For Rate Cuts Amid Growing Confidence On Inflation,https://seekingalpha.com/article/4708966,
