feed,title,long_url,short_url
SeekingAlpha,Roblox reports Q2 results,https://seekingalpha.com/news/4132191,
SeekingAlpha,"Enviri Corp Non-GAAP EPS of $0.02 beats by $0.03, revenue of $610M misses by $6.85M",https://seekingalpha.com/news/4132190,
SeekingAlpha,EVgo rallies after charging network surges in Q2,https://seekingalpha.com/news/4132189,
SeekingAlpha,"Curis GAAP EPS of -$2.03 misses by $0.35, revenue of $2.5M beats by $0.44M",https://seekingalpha.com/news/4132188,
SeekingAlpha,2 High Conviction Buys Yielding 5-8%,https://seekingalpha.com/article/4708632,
