feed,title,long_url,short_url
SeekingAlpha,Real Matters reports Q3 results,https://seekingalpha.com/news/4132201,
SeekingAlpha,"W.W. Grainger Non-GAAP EPS of $9.76 beats by $0.17, revenue of $4.3B misses by $50M",https://seekingalpha.com/news/4132200,
SeekingAlpha,"Insight Enterprises Non-GAAP EPS of $2.46 misses by $0.36, revenue of $2.2B misses by $270M",https://seekingalpha.com/news/4132199,
SeekingAlpha,"GigaMedia GAAP EPS of -$0.06, revenue of $0.72M",https://seekingalpha.com/news/4132198,
SeekingAlpha,Wayfair shares pressured as Q2 shows macro headwinds weigh on repeat customers,https://seekingalpha.com/news/4132197,
