feed,title,long_url,short_url
SeekingAlpha,"TOMI Environmental Solutions GAAP EPS of $0.00, revenue of $3.01M beats by $0.21M",https://seekingalpha.com/news/4132589,
SeekingAlpha,"Warner Music Group streamlines ops structure, Recorded Music CEO Lousada steps down",https://seekingalpha.com/news/4132586,
SeekingAlpha,Prudential Financial Non-GAAP EPS of $3.39 misses by $0.06,https://seekingalpha.com/news/4132585,
SeekingAlpha,"Sight Sciences GAAP EPS of -$0.25 beats by $0.04, revenue of $21.4M beats by $0.05M",https://seekingalpha.com/news/4132584,
SeekingAlpha,Lulus reports preliminary second quarter results,https://seekingalpha.com/news/4132583,
SeekingAlpha,"Universal Display GAAP EPS of $1.10 misses by $0.05, revenue of $158.5M misses by $1.44M",https://seekingalpha.com/news/4132582,
SeekingAlpha,"Arteries IP Non-GAAP EPS of -$0.11 beats by $0.03, revenue of $14.6M beats by $0.91M",https://seekingalpha.com/news/4132581,
