feed,title,long_url,short_url
InvestorPlace,3 Defensive Stocks Offering Stability and Steady Returns,https://investorplace.com/2024/07/3-defensive-stocks-offering-stability-and-steady-returns/,https://da.gd/F9ovi
InvestorPlace,PCYO Stock Earnings: Pure Cycle Reported Results for Q3 2024,https://investorplace.com/earning-results/2024/07/pcyo-stock-earnings-pure-cycle-for-q3-of-2024/,https://da.gd/qL0Wf
InvestorPlace,"PSMT Stock Earnings: Pricesmart Beats EPS, Beats Revenue for Q3 2024",https://investorplace.com/earning-results/2024/07/psmt-stock-earnings-pricesmart-for-q3-of-2024/,https://da.gd/M0t4
InvestorPlace,"BSET Stock Earnings: Bassett Furniture Indus Misses EPS, Misses Revenue for Q2 2024",https://investorplace.com/earning-results/2024/07/bset-stock-earnings-bassett-furniture-indus-for-q2-of-2024/,https://da.gd/PKyZ
InvestorPlace,VOXX Stock Earnings: VOXX International Misses Revenue for Q1 2025,https://investorplace.com/earning-results/2024/07/voxx-stock-earnings-voxx-international-for-q1-of-2025/,https://da.gd/29xVR3
InvestorPlace,"WDFC Stock Earnings: WD-40 Beats EPS, Beats Revenue for Q3 2024",https://investorplace.com/earning-results/2024/07/wdfc-stock-earnings-wd-40-for-q3-of-2024/,https://da.gd/OGF7e
InvestorPlace,"ETWO Stock Earnings: E2open Parent Holdings Meets EPS, Misses Revenue for Q1 2025",https://investorplace.com/earning-results/2024/07/etwo-stock-earnings-e2open-parent-holdings-for-q1-of-2025/,https://da.gd/rP0W97
InvestorPlace,"AZZ Stock Earnings: AZZ Beats EPS, Beats Revenue for Q1 2025",https://investorplace.com/earning-results/2024/07/azz-stock-earnings-azz-for-q1-of-2025/,https://da.gd/tZcBC
